{
  "title": "2200620_한국수출입은행법_일부개정법률안",
  "bill_number": "620",
  "proposal_date": "2024. 6. 19.",
  "submission_date": "",
  "is_alternative": false,
  "alternative_bill_numbers": [],
  "has_comparison_table": false,
  "comparison_table": "신·구조문대비표\n현 행 개 정 안\n제3조(본점·지점·출장소·대리점) 제3조(본점·지점·출장소·대리점)\n① 수출입은행은 본점을 서울 ① ------------------부산\n특별시에 둔다. 광역시------.\n② (생 략) ② (현행과 같음)",
  "full_text": "한국수출입은행법 일부개정법률안\n(이성권의원 대표발의)\n발의연월일 : 2024. 6. 19.\n의 안\n620\n번 호 발 의 자 : 이성권ㆍ백종헌ㆍ곽규택\n주진우ㆍ이헌승ㆍ김미애\n정연욱ㆍ조승환ㆍ김도읍\n박성훈ㆍ김희정ㆍ김대식\n서지영ㆍ조경태ㆍ정동만\n구자근ㆍ정성국 의원\n(17인)\n제안이유 및 주요내용\n지역 간 불균형 해소 특히 수도권과 지방 간 격차 해소 목적으로 2\n004년 「국가균형발전 특별법」과 2007년 「혁신도시 조성 및 발전에\n관한 특별법」이 마련되었음. 이를 바탕으로 1차 공공기관 이전이 이\n뤄졌음. 1차 공공기관 이전은 지역별 특화 산업 육성이라는 취지로 진\n행됐음.\n부산은 2009년에 금융중심지로 지정됐던 만큼 한국주택금융공사, 한\n국예탁결제원, 한국자산관리공사 등의 금융기관이 해양 분야 공공기관\n과 함께 부산으로 이전하였음. 이에 금융중심지로서 부산의 위상을 보\n다 확고히 하기 위해 국내의 굵직한 금융기관들이 선제적으로 부산으\n로 이전하여 안정적인 금융생태계를 조성할 필요성이 제기되고 있음.\n\n\n\nKDB산업은행, IBK중소기업은행, 예금보험공사와 함께 수출입 지\n원 목적의 국책은행인 한국수출입은행이 부산으로 이전하여 부산의\n금융생태계 조성의 견인차가 되도록 하고, 금융중심지로서 국제적 위\n상을 높일 수 있어야 한다는 의견이 제시되고 있음.\n한국수출입은행은 부산의 수출입 기업 지원을 비롯해 부산의 기존\n해양플랜트, 자동차 부품 등의 연관산업 활성화에 기여하고, 지역별\n특화를 고려한 공공기관의 고른 지역별 분배와 지역 간 격차 해소를\n통해 달성하려는 국가균형발전의 취지에도 부합할 것임.\n이에 한국수출입은행의 본점을 부산광역시에 두도록 법률을 개정함\n으로써 부산광역시가 금융중심지로서 위상을 확고히 하고, 궁극적으로\n는 국가균형발전이라는 목표에 부합하고자 하려는 것임(안 제3조제1\n항).\n\n법률 제 호\n한국수출입은행법 일부개정법률안\n한국수출입은행법 일부를 다음과 같이 개정한다.\n제3조제1항 중 “서울특별시”를 “부산광역시”로 한다.\n부 칙\n제1조(시행일) 이 법은 공포 후 6개월이 경과한 날부터 시행한다. 다\n만, 부칙 제2조는 공포한 날부터 시행한다.\n제2조(본점 이전에 관한 준비행위 등) 한국수출입은행은 이 법 공포일\n부터 2개월 이내에 본점 이전에 관한 계획을 수립하여야 한다.\n\n\n\n\n신·구조문대비표\n현 행 개 정 안\n제3조(본점·지점·출장소·대리점) 제3조(본점·지점·출장소·대리점)\n① 수출입은행은 본점을 서울 ① ------------------부산\n특별시에 둔다. 광역시------.\n② (생 략) ② (현행과 같음)\n",
  "sections": {
    "제안이유": "및",
    "주요내용": "지역 간 불균형 해소 특히 수도권과 지방 간 격차 해소 목적으로 2\n004년 「국가균형발전 특별법」과 2007년 「혁신도시 조성 및 발전에\n관한 특별법」이 마련되었음. 이를 바탕으로 1차 공공기관 이전이 이\n뤄졌음. 1차 공공기관 이전은 지역별 특화 산업 육성이라는 취지로 진\n행됐음.\n부산은 2009년에 금융중심지로 지정됐던 만큼 한국주택금융공사, 한\n국예탁결제원, 한국자산관리공사 등의 금융기관이 해양 분야 공공기관\n과 함께 부산으로 이전하였음. 이에 금융중심지로서 부산의 위상을 보\n다 확고히 하기 위해 국내의 굵직한 금융기관들이 선제적으로 부산으\n로 이전하여 안정적인 금융생태계를 조성할 필요성이 제기되고 있음.\n\n\n\nKDB산업은행, IBK중소기업은행, 예금보험공사와 함께 수출입 지\n원 목적의 국책은행인 한국수출입은행이 부산으로 이전하여 부산의\n금융생태계 조성의 견인차가 되도록 하고, 금융중심지로서 국제적 위\n상을 높일 수 있어야 한다는 의견이 제시되고 있음.\n한국수출입은행은 부산의 수출입 기업 지원을 비롯해 부산의 기존\n해양플랜트, 자동차 부품 등의 연관산업 활성화에 기여하고, 지역별\n특화를 고려한 공공기관의 고른 지역별 분배와 지역 간 격차 해소를\n통해 달성하려는 국가균형발전의 취지에도 부합할 것임.\n이에 한국수출입은행의 본점을 부산광역시에 두도록 법률을 개정함\n으로써 부산광역시가 금융중심지로서 위상을 확고히 하고, 궁극적으로\n는 국가균형발전이라는 목표에 부합하고자 하려는 것임(안 제3조제1\n항).",
    "제안이유_및_주요내용": "지역 간 불균형 해소 특히 수도권과 지방 간 격차 해소 목적으로 2\n004년 「국가균형발전 특별법」과 2007년 「혁신도시 조성 및 발전에\n관한 특별법」이 마련되었음. 이를 바탕으로 1차 공공기관 이전이 이\n뤄졌음. 1차 공공기관 이전은 지역별 특화 산업 육성이라는 취지로 진\n행됐음.\n부산은 2009년에 금융중심지로 지정됐던 만큼 한국주택금융공사, 한\n국예탁결제원, 한국자산관리공사 등의 금융기관이 해양 분야 공공기관\n과 함께 부산으로 이전하였음. 이에 금융중심지로서 부산의 위상을 보\n다 확고히 하기 위해 국내의 굵직한 금융기관들이 선제적으로 부산으\n로 이전하여 안정적인 금융생태계를 조성할 필요성이 제기되고 있음.\n\n\n\nKDB산업은행, IBK중소기업은행, 예금보험공사와 함께 수출입 지\n원 목적의 국책은행인 한국수출입은행이 부산으로 이전하여 부산의\n금융생태계 조성의 견인차가 되도록 하고, 금융중심지로서 국제적 위\n상을 높일 수 있어야 한다는 의견이 제시되고 있음.\n한국수출입은행은 부산의 수출입 기업 지원을 비롯해 부산의 기존\n해양플랜트, 자동차 부품 등의 연관산업 활성화에 기여하고, 지역별\n특화를 고려한 공공기관의 고른 지역별 분배와 지역 간 격차 해소를\n통해 달성하려는 국가균형발전의 취지에도 부합할 것임.\n이에 한국수출입은행의 본점을 부산광역시에 두도록 법률을 개정함\n으로써 부산광역시가 금융중심지로서 위상을 확고히 하고, 궁극적으로\n는 국가균형발전이라는 목표에 부합하고자 하려는 것임(안 제3조제1\n항).",
    "법률_제_호": "한국수출입은행법 일부개정법률안\n한국수출입은행법 일부를 다음과 같이 개정한다.\n제3조제1항 중 “서울특별시”를 “부산광역시”로 한다.",
    "신구조문대비표": "현 행 개 정 안\n제3조(본점·지점·출장소·대리점) 제3조(본점·지점·출장소·대리점)\n① 수출입은행은 본점을 서울 ① ------------------부산\n특별시에 둔다. 광역시------.\n② (생 략) ② (현행과 같음)"
  }
}