{
  "title": "2200748_노인복지법_일부개정법률안",
  "bill_number": "748",
  "proposal_date": "2024. 6. 20.",
  "submission_date": "",
  "is_alternative": false,
  "alternative_bill_numbers": [],
  "has_comparison_table": false,
  "comparison_table": "신ㆍ구조문대비표\n현 행 개 정 안\n<신 설> 제35조의2(공공주택에 설치된 양\n로시설 등의 운영) 국가나 지\n방자치단체는 「공공주택 특별\n법」 제37조의2에 따라 설치되\n어야 하는 양로시설이나 노인\n요양시설을 운영하여야 한다.",
  "full_text": "노인복지법 일부개정법률안\n(민홍철의원 대표발의)\n발의연월일 : 2024. 6. 20.\n의 안\n748\n번 호 발 의 자 : 민홍철ㆍ문대림ㆍ박용갑\n백혜련ㆍ이건태ㆍ이연희\n이재강ㆍ조 국ㆍ한정애\n한준호 의원(10인)\n제안이유 및 주요내용\n현행법은 노인의 주거 및 의료 복지를 위하여 노인을 입소시켜 급\n식과 그 밖에 일상생활에 필요한 편의를 제공하는 ‘양로시설’과 치매·\n중풍 등 노인성질환 등으로 심신에 상당한 장애가 발생하여 도움을\n필요로 하는 노인을 입소시켜 급식·요양과 그 밖에 일상생활에 필요한\n편의를 제공하는 ‘노인요양시설’에 관한 설치 근거 규정을 두고 있음.\n그런데 최근 고령화 현상이 심화됨에 따라 주거지 내에서 노인의\n사회적 돌봄체계 구축의 필요성이 높아지고 있음에도 불구하고 주거\n지 내의 양로시설이나 노인요양시설의 설치·운영에 관한 규정이 미비\n하여 주거지 내 노인에 대한 보호체계가 취약하다는 지적이 제기되고\n있음.\n이에 「공공주택 특별법」에서 공공주택사업자가 500세대 이상의\n공공주택단지를 건설할 경우에는 그 단지에 양로시설 또는 노인요양\n\n\n\n시설을 설치하도록 의무화하는 개정 내용과 연계하여, 공공주택사업자\n가 설치한 양로시설 또는 노인요양시설의 운영 의무를 국가나 지방자\n치단체에 부여하려는 것임(안 제35조의2 신설).\n참고사항\n이 법률안은 민홍철의원이 대표발의한 「공공주택 특별법 일부개정\n법률안」(의안번호 제745호)의 의결을 전제로 하는 것이므로 같은 법\n률안이 의결되지 아니하거나 수정의결되는 경우에는 이에 맞추어 조\n정하여야 할 것임.\n\n법률 제 호\n노인복지법 일부개정법률안\n노인복지법 일부를 다음과 같이 개정한다.\n제35조의2를 다음과 같이 신설한다.\n제35조의2(공공주택에 설치된 양로시설 등의 운영) 국가나 지방자치단\n체는 「공공주택 특별법」 제37조의2에 따라 설치되어야 하는 양로\n시설이나 노인요양시설을 운영하여야 한다.\n부 칙\n이 법은 공포 후 6개월이 경과한 날부터 시행한다.\n\n\n\n\n신ㆍ구조문대비표\n현 행 개 정 안\n<신 설> 제35조의2(공공주택에 설치된 양\n로시설 등의 운영) 국가나 지\n방자치단체는 「공공주택 특별\n법」 제37조의2에 따라 설치되\n어야 하는 양로시설이나 노인\n요양시설을 운영하여야 한다.\n",
  "sections": {
    "제안이유": "및",
    "주요내용": "현행법은 노인의 주거 및 의료 복지를 위하여 노인을 입소시켜 급\n식과 그 밖에 일상생활에 필요한 편의를 제공하는 ‘양로시설’과 치매·\n중풍 등 노인성질환 등으로 심신에 상당한 장애가 발생하여 도움을\n필요로 하는 노인을 입소시켜 급식·요양과 그 밖에 일상생활에 필요한\n편의를 제공하는 ‘노인요양시설’에 관한 설치 근거 규정을 두고 있음.\n그런데 최근 고령화 현상이 심화됨에 따라 주거지 내에서 노인의\n사회적 돌봄체계 구축의 필요성이 높아지고 있음에도 불구하고 주거\n지 내의 양로시설이나 노인요양시설의 설치·운영에 관한 규정이 미비\n하여 주거지 내 노인에 대한 보호체계가 취약하다는 지적이 제기되고\n있음.\n이에 「공공주택 특별법」에서 공공주택사업자가 500세대 이상의\n공공주택단지를 건설할 경우에는 그 단지에 양로시설 또는 노인요양\n\n\n\n시설을 설치하도록 의무화하는 개정 내용과 연계하여, 공공주택사업자\n가 설치한 양로시설 또는 노인요양시설의 운영 의무를 국가나 지방자\n치단체에 부여하려는 것임(안 제35조의2 신설).",
    "제안이유_및_주요내용": "현행법은 노인의 주거 및 의료 복지를 위하여 노인을 입소시켜 급\n식과 그 밖에 일상생활에 필요한 편의를 제공하는 ‘양로시설’과 치매·\n중풍 등 노인성질환 등으로 심신에 상당한 장애가 발생하여 도움을\n필요로 하는 노인을 입소시켜 급식·요양과 그 밖에 일상생활에 필요한\n편의를 제공하는 ‘노인요양시설’에 관한 설치 근거 규정을 두고 있음.\n그런데 최근 고령화 현상이 심화됨에 따라 주거지 내에서 노인의\n사회적 돌봄체계 구축의 필요성이 높아지고 있음에도 불구하고 주거\n지 내의 양로시설이나 노인요양시설의 설치·운영에 관한 규정이 미비\n하여 주거지 내 노인에 대한 보호체계가 취약하다는 지적이 제기되고\n있음.\n이에 「공공주택 특별법」에서 공공주택사업자가 500세대 이상의\n공공주택단지를 건설할 경우에는 그 단지에 양로시설 또는 노인요양\n\n\n\n시설을 설치하도록 의무화하는 개정 내용과 연계하여, 공공주택사업자\n가 설치한 양로시설 또는 노인요양시설의 운영 의무를 국가나 지방자\n치단체에 부여하려는 것임(안 제35조의2 신설).",
    "법률_제_호": "노인복지법 일부개정법률안\n노인복지법 일부를 다음과 같이 개정한다.\n제35조의2를 다음과 같이 신설한다.\n제35조의2(공공주택에 설치된 양로시설 등의 운영) 국가나 지방자치단\n체는 「공공주택 특별법」 제37조의2에 따라 설치되어야 하는 양로\n시설이나 노인요양시설을 운영하여야 한다.",
    "신구조문대비표": "현 행 개 정 안\n<신 설> 제35조의2(공공주택에 설치된 양\n로시설 등의 운영) 국가나 지\n방자치단체는 「공공주택 특별\n법」 제37조의2에 따라 설치되\n어야 하는 양로시설이나 노인\n요양시설을 운영하여야 한다."
  }
}