{
  "title": "2200259_남녀고용평등과_일·가정_양립_지원에_관한_법률_일부개정법률안",
  "bill_number": "259",
  "proposal_date": "2024. 6. 10.",
  "submission_date": "",
  "is_alternative": false,
  "alternative_bill_numbers": [],
  "has_comparison_table": false,
  "comparison_table": "신ㆍ구조문대비표\n현 행 개 정 안\n제18조의2(배우자 출산휴가) ① 제18조의2(배우자 출산휴가) ①\n∼ ③ (생 략) ∼ ③ (현행과 같음)\n④ 배우자 출산휴가는 1회에 ④ ------------------3회----\n한정하여 나누어 사용할 수 있 ----------------------------\n다. -.\n⑤ (생 략) ⑤ (현행과 같음)",
  "full_text": "남녀고용평등과 일ㆍ가정 양립 지원에 관한 법률\n일부개정법률안\n(진성준의원 대표발의)\n발의연월일 : 2024. 6. 10.\n의 안\n259\n번 호 발 의 자 : 진성준ㆍ이재관ㆍ허 영\n민병덕ㆍ이연희ㆍ박상혁\n김윤덕ㆍ위성곤ㆍ황정아\n조 국ㆍ김주영ㆍ김 윤\n의원(12인)\n제안이유 및 주요내용\n현행법에 따르면, 사업주는 근로자가 배우자 출산휴가를 청구하는\n경우에 10일의 유급휴가를 주도록 하고, 이를 1회에 한정하여 나누어\n사용할 수 있도록 하고 있음.\n그런데 이탈리아에서는 10일의 배우자 출산휴가를 하루 단위로 나\n누어 사용할 수 있고, 벨기에는 15일 전일제나 30일 반일제 중 선택하\n여 배우자 출산휴가를 사용할 수 있도록 하고 있다는 점을 고려하면,\n우리나라의 배우자 출산휴가는 사용의 유연성이 많이 떨어진다는 지\n적이 있음.\n이에 배우자 출산휴가의 분할 사용 가능 횟수를 현행 1회에서 3회\n로 확대함으로써 배우자 출산휴가 사용이 보다 확대되도록 하려는 것\n임(안 제18조의2제4항).\n\n\n\n\n법률 제 호\n남녀고용평등과 일ㆍ가정 양립 지원에 관한 법률\n일부개정법률안\n남녀고용평등과 일ㆍ가정 양립 지원에 관한 법률 일부를 다음과 같이\n개정한다.\n제18조의2제4항 중 “1회”를 “3회”로 한다.\n부 칙\n제1조(시행일) 이 법은 공포 후 6개월이 경과한 날부터 시행한다.\n제2조(배우자 출산휴가 분할사용에 관한 적용례) 제18조의2제4항의 개\n정규정은 이 법 시행 후 배우자 출산휴가 기간의 첫째 날을 사용하\n는 근로자부터 적용한다.\n\n\n\n\n신ㆍ구조문대비표\n현 행 개 정 안\n제18조의2(배우자 출산휴가) ① 제18조의2(배우자 출산휴가) ①\n∼ ③ (생 략) ∼ ③ (현행과 같음)\n④ 배우자 출산휴가는 1회에 ④ ------------------3회----\n한정하여 나누어 사용할 수 있 ----------------------------\n다. -.\n⑤ (생 략) ⑤ (현행과 같음)\n",
  "sections": {
    "제안이유": "및",
    "주요내용": "현행법에 따르면, 사업주는 근로자가 배우자 출산휴가를 청구하는\n경우에 10일의 유급휴가를 주도록 하고, 이를 1회에 한정하여 나누어\n사용할 수 있도록 하고 있음.\n그런데 이탈리아에서는 10일의 배우자 출산휴가를 하루 단위로 나\n누어 사용할 수 있고, 벨기에는 15일 전일제나 30일 반일제 중 선택하\n여 배우자 출산휴가를 사용할 수 있도록 하고 있다는 점을 고려하면,\n우리나라의 배우자 출산휴가는 사용의 유연성이 많이 떨어진다는 지\n적이 있음.\n이에 배우자 출산휴가의 분할 사용 가능 횟수를 현행 1회에서 3회\n로 확대함으로써 배우자 출산휴가 사용이 보다 확대되도록 하려는 것\n임(안 제18조의2제4항).",
    "제안이유_및_주요내용": "현행법에 따르면, 사업주는 근로자가 배우자 출산휴가를 청구하는\n경우에 10일의 유급휴가를 주도록 하고, 이를 1회에 한정하여 나누어\n사용할 수 있도록 하고 있음.\n그런데 이탈리아에서는 10일의 배우자 출산휴가를 하루 단위로 나\n누어 사용할 수 있고, 벨기에는 15일 전일제나 30일 반일제 중 선택하\n여 배우자 출산휴가를 사용할 수 있도록 하고 있다는 점을 고려하면,\n우리나라의 배우자 출산휴가는 사용의 유연성이 많이 떨어진다는 지\n적이 있음.\n이에 배우자 출산휴가의 분할 사용 가능 횟수를 현행 1회에서 3회\n로 확대함으로써 배우자 출산휴가 사용이 보다 확대되도록 하려는 것\n임(안 제18조의2제4항).",
    "법률_제_호": "남녀고용평등과 일ㆍ가정 양립 지원에 관한 법률\n일부개정법률안\n남녀고용평등과 일ㆍ가정 양립 지원에 관한 법률 일부를 다음과 같이\n개정한다.\n제18조의2제4항 중 “1회”를 “3회”로 한다.",
    "신구조문대비표": "현 행 개 정 안\n제18조의2(배우자 출산휴가) ① 제18조의2(배우자 출산휴가) ①\n∼ ③ (생 략) ∼ ③ (현행과 같음)\n④ 배우자 출산휴가는 1회에 ④ ------------------3회----\n한정하여 나누어 사용할 수 있 ----------------------------\n다. -.\n⑤ (생 략) ⑤ (현행과 같음)"
  }
}