{
  "title": "2200340_주택도시기금법_일부개정법률안",
  "bill_number": "340",
  "proposal_date": "2024. 6. 11.",
  "submission_date": "",
  "is_alternative": false,
  "alternative_bill_numbers": [],
  "has_comparison_table": false,
  "comparison_table": "신·구조문대비표\n현 행 개 정 안\n<신 설> 제27조의2(중도상환수수료의 특\n례) 공사는 「금융소비자 보호\n에 관한 법률」 제20조제1항에\n도 불구하고 중도상환수수료를\n부과할 수 없다.",
  "full_text": "주택도시기금법 일부개정법률안\n(민병덕의원 대표발의)\n발의연월일 : 2024. 6. 11.\n의 안\n340\n번 호 발 의 자 : 민병덕ㆍ김현정ㆍ김남근\n정준호ㆍ이정문ㆍ김 윤\n이수진ㆍ이강일ㆍ강준현\n염태영ㆍ천준호ㆍ서영석\n이용우 의원(13인)\n제안이유 및 주요내용\n최근 고금리 상황이 지속됨에 따라 가계를 비롯한 금융소비자의 부\n담이 커지고 있는 반면 은행권은 이자수익이 크게 증가하였음.\n은행권은 이자수익 외에도 중도상환수수료를 연간 약 3천억원 부과\n하고 있고, 금융위원회는 2024년 3월 ‘은행별로 해당 수수료 부과 기\n준이 다르거나, 불합리한 기준을 적용하고 있다’고 밝혔음.\n한편, 주택도시보증공사의 디딤돌 대출 역시 중도상환수수료를 부과\n하고 있음.\n이에 정책모기지의 중도상환수수료를 선제적 폐지하여, 시중은행의\n동참을 유도하고, 궁극적으로 시중은행의 비합리적 중도상환수수료 문\n제를 해결하고자 함.\n가계대출의 많은 비중을 차지하는 주택담보대출 및 전세자금대출\n등은 대부분 정책금융의 지원이나 보증을 받는 구조로 설계되어 있는\n\n\n\n만큼 가계 대출 부담 완화에 기여할 것으로 기대함(안 제27조의2 신\n설).\n\n법률 제 호\n주택도시기금법 일부개정법률안\n주택도시기금법 일부를 다음과 같이 개정한다.\n제27조의2를 다음과 같이 신설한다.\n제27조의2(중도상환수수료의 특례) 공사는 「금융소비자 보호에 관한\n법률」 제20조제1항에도 불구하고 중도상환수수료를 부과할 수 없\n다.\n부 칙\n이 법은 공포 후 6개월이 경과한 날부터 시행한다.\n\n\n\n\n신·구조문대비표\n현 행 개 정 안\n<신 설> 제27조의2(중도상환수수료의 특\n례) 공사는 「금융소비자 보호\n에 관한 법률」 제20조제1항에\n도 불구하고 중도상환수수료를\n부과할 수 없다.\n",
  "sections": {
    "제안이유": "및",
    "주요내용": "최근 고금리 상황이 지속됨에 따라 가계를 비롯한 금융소비자의 부\n담이 커지고 있는 반면 은행권은 이자수익이 크게 증가하였음.\n은행권은 이자수익 외에도 중도상환수수료를 연간 약 3천억원 부과\n하고 있고, 금융위원회는 2024년 3월 ‘은행별로 해당 수수료 부과 기\n준이 다르거나, 불합리한 기준을 적용하고 있다’고 밝혔음.\n한편, 주택도시보증공사의 디딤돌 대출 역시 중도상환수수료를 부과\n하고 있음.\n이에 정책모기지의 중도상환수수료를 선제적 폐지하여, 시중은행의\n동참을 유도하고, 궁극적으로 시중은행의 비합리적 중도상환수수료 문\n제를 해결하고자 함.\n가계대출의 많은 비중을 차지하는 주택담보대출 및 전세자금대출\n등은 대부분 정책금융의 지원이나 보증을 받는 구조로 설계되어 있는\n\n\n\n만큼 가계 대출 부담 완화에 기여할 것으로 기대함(안 제27조의2 신\n설).",
    "제안이유_및_주요내용": "최근 고금리 상황이 지속됨에 따라 가계를 비롯한 금융소비자의 부\n담이 커지고 있는 반면 은행권은 이자수익이 크게 증가하였음.\n은행권은 이자수익 외에도 중도상환수수료를 연간 약 3천억원 부과\n하고 있고, 금융위원회는 2024년 3월 ‘은행별로 해당 수수료 부과 기\n준이 다르거나, 불합리한 기준을 적용하고 있다’고 밝혔음.\n한편, 주택도시보증공사의 디딤돌 대출 역시 중도상환수수료를 부과\n하고 있음.\n이에 정책모기지의 중도상환수수료를 선제적 폐지하여, 시중은행의\n동참을 유도하고, 궁극적으로 시중은행의 비합리적 중도상환수수료 문\n제를 해결하고자 함.\n가계대출의 많은 비중을 차지하는 주택담보대출 및 전세자금대출\n등은 대부분 정책금융의 지원이나 보증을 받는 구조로 설계되어 있는\n\n\n\n만큼 가계 대출 부담 완화에 기여할 것으로 기대함(안 제27조의2 신\n설).",
    "법률_제_호": "주택도시기금법 일부개정법률안\n주택도시기금법 일부를 다음과 같이 개정한다.\n제27조의2를 다음과 같이 신설한다.\n제27조의2(중도상환수수료의 특례) 공사는 「금융소비자 보호에 관한\n법률」 제20조제1항에도 불구하고 중도상환수수료를 부과할 수 없\n다.",
    "신구조문대비표": "현 행 개 정 안\n<신 설> 제27조의2(중도상환수수료의 특\n례) 공사는 「금융소비자 보호\n에 관한 법률」 제20조제1항에\n도 불구하고 중도상환수수료를\n부과할 수 없다."
  }
}