{
  "title": "2200589_방송통신발전_기본법_일부개정법률안",
  "bill_number": "589",
  "proposal_date": "2024. 6. 18.",
  "submission_date": "",
  "is_alternative": false,
  "alternative_bill_numbers": [],
  "has_comparison_table": false,
  "comparison_table": "신ㆍ구조문대비표\n현 행 개 정 안\n제40조의3(재난방송등 수신시설 제40조의3(재난방송등 수신시설\n의 설치) ①ㆍ② (생 략) 의 설치) ①ㆍ② (현행과 같음)\n<신 설> ③ 제1항에 따른 방송통신설비\n설치대상의 범위ㆍ설치기준 및\n제2항에 따른 조사의 방법ㆍ절\n차 등에 필요한 사항은 대통령\n령으로 정한다.",
  "full_text": "방송통신발전 기본법 일부개정법률안\n(권영세의원 대표발의)\n발의연월일 : 2024. 6. 18.\n의 안\n589\n번 호 발 의 자 : 권영세ㆍ임이자ㆍ구자근\n강대식ㆍ안철수ㆍ박대출\n이인선ㆍ조경태ㆍ서일준\n김소희 의원(10인)\n제안이유 및 주요내용\n현행법은 도로, 도시철도시설, 철도시설의 소유자 등에게 재난방송\n및 민방위 경보의 원활한 수신을 위하여 방송수신 장애지역에 라디오\n방송 및 이동식멀티미디어방송의 수신에 필요한 방송통신설비를 설치\n하도록 하고, 방송통신위원회가 해당 설비의 설치 여부 및 수신 상태\n에 대한 조사를 실시ㆍ공표하도록 규정함.\n그런데 방송통신설비의 설치 대상, 기준 및 방송통신위원회의 조사\n방법 등에 관하여 법령에서 명확하게 규정하고 있지 아니하여 해당\n사업의 집행에 혼선이 발생하고 있다는 지적이 제기됨.\n이에 재난방송 등을 수신하기 위한 방송통신설비의 설치대상 범위,\n설치의 기준 및 조사의 방법ㆍ절차 등 제도 운용기준에 관한 구체적\n인 사항을 대통령령으로 정할 수 있도록 위임의 근거를 마련함으로써\n재난방송 등의 수신시설 설치 사업이 원활하게 수행되도록 하려는 것\n\n\n\n임(안 제40조의3).\n\n법률 제 호\n방송통신발전 기본법 일부개정법률안\n방송통신발전 기본법 일부를 다음과 같이 개정한다.\n제40조의3에 제3항을 다음과 같이 신설한다.\n③ 제1항에 따른 방송통신설비 설치대상의 범위ㆍ설치기준 및 제2\n항에 따른 조사의 방법ㆍ절차 등에 필요한 사항은 대통령령으로 정\n한다.\n부 칙\n이 법은 공포 후 6개월이 경과한 날부터 시행한다.\n\n\n\n\n신ㆍ구조문대비표\n현 행 개 정 안\n제40조의3(재난방송등 수신시설 제40조의3(재난방송등 수신시설\n의 설치) ①ㆍ② (생 략) 의 설치) ①ㆍ② (현행과 같음)\n<신 설> ③ 제1항에 따른 방송통신설비\n설치대상의 범위ㆍ설치기준 및\n제2항에 따른 조사의 방법ㆍ절\n차 등에 필요한 사항은 대통령\n령으로 정한다.\n",
  "sections": {
    "제안이유": "및",
    "주요내용": "현행법은 도로, 도시철도시설, 철도시설의 소유자 등에게 재난방송\n및 민방위 경보의 원활한 수신을 위하여 방송수신 장애지역에 라디오\n방송 및 이동식멀티미디어방송의 수신에 필요한 방송통신설비를 설치\n하도록 하고, 방송통신위원회가 해당 설비의 설치 여부 및 수신 상태\n에 대한 조사를 실시ㆍ공표하도록 규정함.\n그런데 방송통신설비의 설치 대상, 기준 및 방송통신위원회의 조사\n방법 등에 관하여 법령에서 명확하게 규정하고 있지 아니하여 해당\n사업의 집행에 혼선이 발생하고 있다는 지적이 제기됨.\n이에 재난방송 등을 수신하기 위한 방송통신설비의 설치대상 범위,\n설치의 기준 및 조사의 방법ㆍ절차 등 제도 운용기준에 관한 구체적\n인 사항을 대통령령으로 정할 수 있도록 위임의 근거를 마련함으로써\n재난방송 등의 수신시설 설치 사업이 원활하게 수행되도록 하려는 것\n\n\n\n임(안 제40조의3).",
    "제안이유_및_주요내용": "현행법은 도로, 도시철도시설, 철도시설의 소유자 등에게 재난방송\n및 민방위 경보의 원활한 수신을 위하여 방송수신 장애지역에 라디오\n방송 및 이동식멀티미디어방송의 수신에 필요한 방송통신설비를 설치\n하도록 하고, 방송통신위원회가 해당 설비의 설치 여부 및 수신 상태\n에 대한 조사를 실시ㆍ공표하도록 규정함.\n그런데 방송통신설비의 설치 대상, 기준 및 방송통신위원회의 조사\n방법 등에 관하여 법령에서 명확하게 규정하고 있지 아니하여 해당\n사업의 집행에 혼선이 발생하고 있다는 지적이 제기됨.\n이에 재난방송 등을 수신하기 위한 방송통신설비의 설치대상 범위,\n설치의 기준 및 조사의 방법ㆍ절차 등 제도 운용기준에 관한 구체적\n인 사항을 대통령령으로 정할 수 있도록 위임의 근거를 마련함으로써\n재난방송 등의 수신시설 설치 사업이 원활하게 수행되도록 하려는 것\n\n\n\n임(안 제40조의3).",
    "법률_제_호": "방송통신발전 기본법 일부개정법률안\n방송통신발전 기본법 일부를 다음과 같이 개정한다.\n제40조의3에 제3항을 다음과 같이 신설한다.\n③ 제1항에 따른 방송통신설비 설치대상의 범위ㆍ설치기준 및 제2\n항에 따른 조사의 방법ㆍ절차 등에 필요한 사항은 대통령령으로 정\n한다.",
    "신구조문대비표": "현 행 개 정 안\n제40조의3(재난방송등 수신시설 제40조의3(재난방송등 수신시설\n의 설치) ①ㆍ② (생 략) 의 설치) ①ㆍ② (현행과 같음)\n<신 설> ③ 제1항에 따른 방송통신설비\n설치대상의 범위ㆍ설치기준 및\n제2항에 따른 조사의 방법ㆍ절\n차 등에 필요한 사항은 대통령\n령으로 정한다."
  }
}