{
  "title": "2200304_국민연금법_일부개정법률안",
  "bill_number": "304",
  "proposal_date": "2024. 6. 11.",
  "submission_date": "",
  "is_alternative": false,
  "alternative_bill_numbers": [],
  "has_comparison_table": false,
  "comparison_table": "신·구조문대비표\n현 행 개 정 안\n법률 제8541호 국민연금법 전부 법률 제8541호 국민연금법 전부\n개정법률 ",
  "full_text": "국민연금법 일부개정법률안\n(박희승의원 대표발의)\n발의연월일 : 2024. 6. 11.\n의 안\n304\n번 호 발 의 자 : 박희승ㆍ김한규ㆍ윤준병\n이성윤ㆍ김영진ㆍ정성호\n홍기원ㆍ박민규ㆍ정진욱\n안호영ㆍ박상혁ㆍ임미애\n이원택ㆍ안태준 의원\n(14인)\n제안이유 및 주요내용\n1995년 농산물 수입개방 확대에 따른 농어민의 경제적 부담을 덜어\n주고 안정적인 노후생활을 지원하기 위하여 국민연금 당연적용대상을\n농어촌지역 거주자 및 도시지역 거주농어민으로 확대하면서, 농어민의\n연금보험료 납부에 대한 부담을 완화하기 위해 농어업인이 부담할 연\n금보험료의 일부를 지원하는 제도를 도입하였음. 2022년말 기준 지원\n대상자는 38만 4,484명이며, 지원사업 예산은 2023년 1,766억원 수준으\n로 농어촌구조개선특별회계에서 지원하고 있음.\n1995년 농어민의 연금보험료 국고 지원 제도 도입 이후 수차례에\n걸쳐 지원 기한을 연장해 2024년까지 지원하도록 하고 있으나, 올해\n이후 농어업인에 대한 연금보험료 지원이 종결하게 됨.\n그런데 농협경제연구소 자료에 따르면, 농업경영주의 63%가 65세를\n\n\n\n넘은 고령농이며, 고령농의 75%는 경지면적이 1ha 미만이며, 67%는\n농축산물 판매금액이 1천만 원 미만으로 대부분 영세·소농임. 특히 70\n대 이상 고령농의 연간 평균 농업소득은 634만 원이고 고령농의 40%\n가 중위소득 절반 이하의 소득 수준으로 공공부조나 공적연금 지원\n없이 노후생활을 안정적으로 유지하기 어려운 상황임.\n이에 농어업인에 대한 연금보험료 지원기한을 현행 2024년 12월 31\n일에서 2029년 12월 31일까지 5년간 연장함으로써 농어업인의 안정적\n노후생활을 보장하려는 것임(안 법률 제8541호 국민연금법 전부개정법\n률 부칙 제7조 및 법률 제11143호 국민연금법 일부개정법률 부칙 제7\n조).\n\n법률 제 호\n국민연금법 일부개정법률안\n국민연금법 일부를 다음과 같이 개정한다.\n법률 제8541호 국민연금법 전부개정법률 부칙(법률 제11143호 국민연\n금법 일부개정법률, 법률 제12242호 국민연금법 일부개정법률 및 법률\n제16867호 국민연금법 일부개정법률에 따라 각각 개정된 내용을 포함\n한다) 제7조 중 “제88조제3항”을 “제88조제4항”으로 하고, “2024년”을\n“2029년”으로 한다.\n법률 제11143호 국민연금법 일부개정법률 부칙(법률 제12242호 국민연\n금법 일부개정법률 및 제16867호 국민연금법 일부개정법률에 따라 각\n각 개정된 내용을 포함한다) 제7조 중 “제88조제3항”을 “제88조제4항”\n으로 하고, “2024년”을 “2029년”으로 한다.\n부 칙\n이 법은 공포한 날부터 시행한다.\n\n\n\n\n신·구조문대비표\n현 행 개 정 안\n법률 제8541호 국민연금법 전부 법률 제8541호 국민연금법 전부\n개정법률 부칙 개정법률 부칙\n제7조(농어업인에 대한 연금보험 제7조(농어업인에 대한 연금보험\n료 보조) 지역가입자인 농어업 료 보조) -------------------\n인과 지역가입자에서 임의계속 ----------------------------\n가입자로 된 농어업인에게는 ----------------------------\n제88조제3항의 개정규정에도 제88조제4항-----------------\n불구하고 2024년 12월 31일까 ------2029년----------------\n지 본인이 부담할 연금보험료 ----------------------------\n중 100분의 50의 범위 내에서 ----------------------------\n대통령령으로 정하는 바에 따 ----------------------------\n라 농어촌구조개선특별회계에 ----------------------------\n서 지원한다. ------.\n법률 제11143호 국민연금법 일부 법률 제11143호 국민연금법 일부\n개정법률 부칙 개정법률 부칙\n제7조(농어업인에 대한 연금보험 제7조(농어업인에 대한 연금보험\n료 보조 특례) 사업장가입자 료 보조 특례) --------------\n또는 임의가입자에서 임의계속 ----------------------------\n가입자로 된 농어업인(당연적 ----------------------------\n용사업장의 근로자 또는 사용 ----------------------------\n자이거나 제9조 각 호의 어느 ----------------------------\n하나에 해당하는 사람은 제외 ----------------------------\n한다)에게는 제88조제3항에도 --------------제88조제4항---\n\n\n\n불구하고 2024년 12월 31일까 ------2029년----------------\n지 본인이 부담할 연금보험료 ----------------------------\n중 100분의 50의 범위에서 대 ----------------------------\n통령령으로 정하는 바에 따라 ----------------------------\n농어촌구조개선특별회계에서 ----------------------------\n지원한다. -------.",
  "sections": {
    "제안이유": "및",
    "주요내용": "1995년 농산물 수입개방 확대에 따른 농어민의 경제적 부담을 덜어\n주고 안정적인 노후생활을 지원하기 위하여 국민연금 당연적용대상을\n농어촌지역 거주자 및 도시지역 거주농어민으로 확대하면서, 농어민의\n연금보험료 납부에 대한 부담을 완화하기 위해 농어업인이 부담할 연\n금보험료의 일부를 지원하는 제도를 도입하였음. 2022년말 기준 지원\n대상자는 38만 4,484명이며, 지원사업 예산은 2023년 1,766억원 수준으\n로 농어촌구조개선특별회계에서 지원하고 있음.\n1995년 농어민의 연금보험료 국고 지원 제도 도입 이후 수차례에\n걸쳐 지원 기한을 연장해 2024년까지 지원하도록 하고 있으나, 올해\n이후 농어업인에 대한 연금보험료 지원이 종결하게 됨.\n그런데 농협경제연구소 자료에 따르면, 농업경영주의 63%가 65세를\n\n\n\n넘은 고령농이며, 고령농의 75%는 경지면적이 1ha 미만이며, 67%는\n농축산물 판매금액이 1천만 원 미만으로 대부분 영세·소농임. 특히 70\n대 이상 고령농의 연간 평균 농업소득은 634만 원이고 고령농의 40%\n가 중위소득 절반 이하의 소득 수준으로 공공부조나 공적연금 지원\n없이 노후생활을 안정적으로 유지하기 어려운 상황임.\n이에 농어업인에 대한 연금보험료 지원기한을 현행 2024년 12월 31\n일에서 2029년 12월 31일까지 5년간 연장함으로써 농어업인의 안정적\n노후생활을 보장하려는 것임(안",
    "제안이유_및_주요내용": "1995년 농산물 수입개방 확대에 따른 농어민의 경제적 부담을 덜어\n주고 안정적인 노후생활을 지원하기 위하여 국민연금 당연적용대상을\n농어촌지역 거주자 및 도시지역 거주농어민으로 확대하면서, 농어민의\n연금보험료 납부에 대한 부담을 완화하기 위해 농어업인이 부담할 연\n금보험료의 일부를 지원하는 제도를 도입하였음. 2022년말 기준 지원\n대상자는 38만 4,484명이며, 지원사업 예산은 2023년 1,766억원 수준으\n로 농어촌구조개선특별회계에서 지원하고 있음.\n1995년 농어민의 연금보험료 국고 지원 제도 도입 이후 수차례에\n걸쳐 지원 기한을 연장해 2024년까지 지원하도록 하고 있으나, 올해\n이후 농어업인에 대한 연금보험료 지원이 종결하게 됨.\n그런데 농협경제연구소 자료에 따르면, 농업경영주의 63%가 65세를\n\n\n\n넘은 고령농이며, 고령농의 75%는 경지면적이 1ha 미만이며, 67%는\n농축산물 판매금액이 1천만 원 미만으로 대부분 영세·소농임. 특히 70\n대 이상 고령농의 연간 평균 농업소득은 634만 원이고 고령농의 40%\n가 중위소득 절반 이하의 소득 수준으로 공공부조나 공적연금 지원\n없이 노후생활을 안정적으로 유지하기 어려운 상황임.\n이에 농어업인에 대한 연금보험료 지원기한을 현행 2024년 12월 31\n일에서 2029년 12월 31일까지 5년간 연장함으로써 농어업인의 안정적\n노후생활을 보장하려는 것임(안",
    "법률_제_호": "국민연금법 전부개정법\n률",
    "신구조문대비표": "현 행 개 정 안\n법률 제8541호 국민연금법 전부 법률 제8541호 국민연금법 전부\n개정법률"
  }
}