{
  "title": "2200594_군인보수법_일부개정법률안",
  "bill_number": "594",
  "proposal_date": "2024. 6. 18.",
  "submission_date": "",
  "is_alternative": false,
  "alternative_bill_numbers": [],
  "has_comparison_table": false,
  "comparison_table": "신ㆍ구조문대비표\n현 행 개 정 안\n제14조(주택수당) 부대 밖에 거주 제14조(주택수당) ------------\n하는 자에게는 대통령령으로 ---------------부대 소재지\n정하는 바에 따라 주택수당을 의 주택 임차료 시세를 고려하\n지급할 수 있다. 여 예산의 범위에서 대통령령\n으로 정하는 바에 따라 주택수\n당을 지급한다.",
  "full_text": "군인보수법 일부개정법률안\n(유용원의원 대표발의)\n발의연월일 : 2024. 6. 18.\n의 안\n594\n번 호 발 의 자 : 유용원ㆍ임종득ㆍ김성원\n백종헌ㆍ임이자ㆍ주진우\n배준영ㆍ김용태ㆍ이종배\n김도읍ㆍ김형동ㆍ신동욱\n의원(12인)\n제안이유 및 주요내용\n현행법은 군인이 안정된 주거생활을 함으로써 복무에 전념할 수 있\n도록 하기 위하여 부대 밖에 거주하는 군인에게 대통령령으로 정하는\n바에 따라 주택수당을 지급하도록 하고 있음.\n그런데 「공무원수당 등에 관한 규정」은 군인에게 일률적으로 월\n16만원의 주택수당을 지급하도록 하고 있어 주택수당이 군인의 실질\n적인 주거안정을 지원하기에는 부족한 수준이며, 낮은 주택수당으로\n인하여 군인 주거지원 정책이 관사 및 간부숙소 건립 위주로 이뤄짐\n에 따라 국가의 재정부담이 심화되고 군인의 주거 질이 저하되고 있\n다는 지적이 있음.\n이에 군인에 대하여 부대 소재지의 주택 임차료 시세를 고려하여\n대통령령으로 정하는 바에 따라 주택수당으로 지급하도록 하여 군인\n의 실질적인 주거안정을 도모하려는 것임(안 제14조).\n\n\n법률 제 호\n군인보수법 일부개정법률안\n군인보수법 일부를 다음과 같이 개정한다.\n제14조 중 “대통령령으로 정하는 바에 따라 주택수당을 지급할 수 있\n다”를 “부대 소재지의 주택 임차료 시세를 고려하여 예산의 범위에서\n대통령령으로 정하는 바에 따라 주택수당을 지급한다”로 한다.\n부 칙\n이 법은 2025년 1월 1일부터 시행한다.\n\n\n신ㆍ구조문대비표\n현 행 개 정 안\n제14조(주택수당) 부대 밖에 거주 제14조(주택수당) ------------\n하는 자에게는 대통령령으로 ---------------부대 소재지\n정하는 바에 따라 주택수당을 의 주택 임차료 시세를 고려하\n지급할 수 있다. 여 예산의 범위에서 대통령령\n으로 정하는 바에 따라 주택수\n당을 지급한다.\n",
  "sections": {
    "제안이유": "및",
    "주요내용": "현행법은 군인이 안정된 주거생활을 함으로써 복무에 전념할 수 있\n도록 하기 위하여 부대 밖에 거주하는 군인에게 대통령령으로 정하는\n바에 따라 주택수당을 지급하도록 하고 있음.\n그런데 「공무원수당 등에 관한 규정」은 군인에게 일률적으로 월\n16만원의 주택수당을 지급하도록 하고 있어 주택수당이 군인의 실질\n적인 주거안정을 지원하기에는 부족한 수준이며, 낮은 주택수당으로\n인하여 군인 주거지원 정책이 관사 및 간부숙소 건립 위주로 이뤄짐\n에 따라 국가의 재정부담이 심화되고 군인의 주거 질이 저하되고 있\n다는 지적이 있음.\n이에 군인에 대하여 부대 소재지의 주택 임차료 시세를 고려하여\n대통령령으로 정하는 바에 따라 주택수당으로 지급하도록 하여 군인\n의 실질적인 주거안정을 도모하려는 것임(안 제14조).",
    "제안이유_및_주요내용": "현행법은 군인이 안정된 주거생활을 함으로써 복무에 전념할 수 있\n도록 하기 위하여 부대 밖에 거주하는 군인에게 대통령령으로 정하는\n바에 따라 주택수당을 지급하도록 하고 있음.\n그런데 「공무원수당 등에 관한 규정」은 군인에게 일률적으로 월\n16만원의 주택수당을 지급하도록 하고 있어 주택수당이 군인의 실질\n적인 주거안정을 지원하기에는 부족한 수준이며, 낮은 주택수당으로\n인하여 군인 주거지원 정책이 관사 및 간부숙소 건립 위주로 이뤄짐\n에 따라 국가의 재정부담이 심화되고 군인의 주거 질이 저하되고 있\n다는 지적이 있음.\n이에 군인에 대하여 부대 소재지의 주택 임차료 시세를 고려하여\n대통령령으로 정하는 바에 따라 주택수당으로 지급하도록 하여 군인\n의 실질적인 주거안정을 도모하려는 것임(안 제14조).",
    "법률_제_호": "군인보수법 일부개정법률안\n군인보수법 일부를 다음과 같이 개정한다.\n제14조 중 “대통령령으로 정하는 바에 따라 주택수당을 지급할 수 있\n다”를 “부대 소재지의 주택 임차료 시세를 고려하여 예산의 범위에서\n대통령령으로 정하는 바에 따라 주택수당을 지급한다”로 한다.",
    "신구조문대비표": "현 행 개 정 안\n제14조(주택수당) 부대 밖에 거주 제14조(주택수당) ------------\n하는 자에게는 대통령령으로 ---------------부대 소재지\n정하는 바에 따라 주택수당을 의 주택 임차료 시세를 고려하\n지급할 수 있다. 여 예산의 범위에서 대통령령\n으로 정하는 바에 따라 주택수\n당을 지급한다."
  }
}