{
  "title": "2200739_농어촌_등_보건의료를_위한_특별조치법_일부개정법률안",
  "bill_number": "739",
  "proposal_date": "2024. 6. 20.",
  "submission_date": "",
  "is_alternative": false,
  "alternative_bill_numbers": [],
  "has_comparison_table": false,
  "comparison_table": "신ㆍ구조문대비표\n현 행 개 정 안\n제25조(진료비) 보건진료소의 진 제25조(진료비) 보건진료소의 진\n료수가기준(診療酬價基準)은 보 료비는 보건복지부령으로 정하\n건복지부장관이 정하는 바에 는 기준에 따라 해당 지방자치\n따른다. 단체의 조례로 정한다.",
  "full_text": "농어촌 등 보건의료를 위한 특별조치법 일부개정법률안\n(송옥주의원 대표발의)\n발의연월일 : 2024. 6. 20.\n의 안\n739\n번 호 발 의 자 : 송옥주ㆍ홍기원ㆍ백승아\n윤준병ㆍ이재관ㆍ문진석\n민병덕ㆍ이원택ㆍ박지원\n정준호ㆍ한정애ㆍ박 정\n이수진ㆍ한민수ㆍ이병진\n염태영 의원(16인)\n제안이유 및 주요내용\n보건소는 「지역보건법」에 따라 지역주민의 건강을 증진하고 질병\n을 예방ㆍ관리하기 위하여 시ㆍ군ㆍ구에 설치하는 지역보건의료기관\n이고, 보건진료소는 현행법에 따라 의사가 배치되어 있지 아니하고 계\n속하여 의사를 배치하기 어려울 것으로 예상되는 의료 취약지역에서\n보건진료 전담공무원으로 하여금 경미한 의료행위를 하게 하기 위하\n여 시장ㆍ군수가 설치하는 보건의료시설임.\n그런데 보건소의 진료비는 보건복지부령으로 정하는 기준에 따라\n지방자치단체의 조례로 정하도록 하고 있어, 지방자치단체가 조례로\n진료비 감면에 관하여 규정하고 있는 반면, 보건진료소의 진료비에 관\n하여는 조례로 정하도록 한 규정이 없고, 이에 따라 진료비를 감면할\n수 있는 근거 또한 없으므로 보건진료소의 경우에도 보건소와 마찬가\n\n\n\n지로 진료비를 조례로 정하도록 하고, 지방자치단체가 조례로 감면 근\n거를 마련할 수 있도록 할 필요가 있다는 지적이 있음.\n이에 보건진료소의 진료비를 보건복지부령으로 정하는 기준에 따라\n해당 지방자치단체의 조례로 정하도록 함으로써 진료비 감면에 관하\n여 조례로 정할 수 있도록 하려는 것임(안 제25조).\n\n법률 제 호\n농어촌 등 보건의료를 위한 특별조치법 일부개정법률안\n농어촌 등 보건의료를 위한 특별조치법 일부를 다음과 같이 개정한다.\n제25조를 다음과 같이 한다.\n제25조(진료비) 보건진료소의 진료비는 보건복지부령으로 정하는 기준\n에 따라 해당 지방자치단체의 조례로 정한다.\n부 칙\n이 법은 공포 후 6개월이 경과한 날부터 시행한다.\n\n\n\n\n신ㆍ구조문대비표\n현 행 개 정 안\n제25조(진료비) 보건진료소의 진 제25조(진료비) 보건진료소의 진\n료수가기준(診療酬價基準)은 보 료비는 보건복지부령으로 정하\n건복지부장관이 정하는 바에 는 기준에 따라 해당 지방자치\n따른다. 단체의 조례로 정한다.\n",
  "sections": {
    "제안이유": "및",
    "주요내용": "보건소는 「지역보건법」에 따라 지역주민의 건강을 증진하고 질병\n을 예방ㆍ관리하기 위하여 시ㆍ군ㆍ구에 설치하는 지역보건의료기관\n이고, 보건진료소는 현행법에 따라 의사가 배치되어 있지 아니하고 계\n속하여 의사를 배치하기 어려울 것으로 예상되는 의료 취약지역에서\n보건진료 전담공무원으로 하여금 경미한 의료행위를 하게 하기 위하\n여 시장ㆍ군수가 설치하는 보건의료시설임.\n그런데 보건소의 진료비는 보건복지부령으로 정하는 기준에 따라\n지방자치단체의 조례로 정하도록 하고 있어, 지방자치단체가 조례로\n진료비 감면에 관하여 규정하고 있는 반면, 보건진료소의 진료비에 관\n하여는 조례로 정하도록 한 규정이 없고, 이에 따라 진료비를 감면할\n수 있는 근거 또한 없으므로 보건진료소의 경우에도 보건소와 마찬가\n\n\n\n지로 진료비를 조례로 정하도록 하고, 지방자치단체가 조례로 감면 근\n거를 마련할 수 있도록 할 필요가 있다는 지적이 있음.\n이에 보건진료소의 진료비를 보건복지부령으로 정하는 기준에 따라\n해당 지방자치단체의 조례로 정하도록 함으로써 진료비 감면에 관하\n여 조례로 정할 수 있도록 하려는 것임(안 제25조).",
    "제안이유_및_주요내용": "보건소는 「지역보건법」에 따라 지역주민의 건강을 증진하고 질병\n을 예방ㆍ관리하기 위하여 시ㆍ군ㆍ구에 설치하는 지역보건의료기관\n이고, 보건진료소는 현행법에 따라 의사가 배치되어 있지 아니하고 계\n속하여 의사를 배치하기 어려울 것으로 예상되는 의료 취약지역에서\n보건진료 전담공무원으로 하여금 경미한 의료행위를 하게 하기 위하\n여 시장ㆍ군수가 설치하는 보건의료시설임.\n그런데 보건소의 진료비는 보건복지부령으로 정하는 기준에 따라\n지방자치단체의 조례로 정하도록 하고 있어, 지방자치단체가 조례로\n진료비 감면에 관하여 규정하고 있는 반면, 보건진료소의 진료비에 관\n하여는 조례로 정하도록 한 규정이 없고, 이에 따라 진료비를 감면할\n수 있는 근거 또한 없으므로 보건진료소의 경우에도 보건소와 마찬가\n\n\n\n지로 진료비를 조례로 정하도록 하고, 지방자치단체가 조례로 감면 근\n거를 마련할 수 있도록 할 필요가 있다는 지적이 있음.\n이에 보건진료소의 진료비를 보건복지부령으로 정하는 기준에 따라\n해당 지방자치단체의 조례로 정하도록 함으로써 진료비 감면에 관하\n여 조례로 정할 수 있도록 하려는 것임(안 제25조).",
    "법률_제_호": "농어촌 등 보건의료를 위한 특별조치법 일부개정법률안\n농어촌 등 보건의료를 위한 특별조치법 일부를 다음과 같이 개정한다.\n제25조를 다음과 같이 한다.\n제25조(진료비) 보건진료소의 진료비는 보건복지부령으로 정하는 기준\n에 따라 해당 지방자치단체의 조례로 정한다.",
    "신구조문대비표": "현 행 개 정 안\n제25조(진료비) 보건진료소의 진 제25조(진료비) 보건진료소의 진\n료수가기준(診療酬價基準)은 보 료비는 보건복지부령으로 정하\n건복지부장관이 정하는 바에 는 기준에 따라 해당 지방자치\n따른다. 단체의 조례로 정한다."
  }
}