{
  "title": "2200989_법원조직법_일부개정법률안",
  "bill_number": "989",
  "proposal_date": "2024. 6. 26.",
  "submission_date": "",
  "is_alternative": false,
  "alternative_bill_numbers": [],
  "has_comparison_table": false,
  "comparison_table": "신ㆍ구조문대비표\n현 행 개 정 안\n제12조(소재지) 대법원은 서울특 제12조(소재지) -------대구광\n별시에 둔다. 역시에-----.",
  "full_text": "법원조직법 일부개정법률안\n(김용민의원 대표발의)\n발의연월일 : 2024. 6. 26.\n의 안\n989\n번 호 발 의 자 : 김용민ㆍ민형배ㆍ박균택\n주철현ㆍ정진욱ㆍ양부남\n임미애ㆍ한준호ㆍ문정복\n김용만ㆍ전진숙ㆍ조인철\n모경종 의원(13인)\n제안이유 및 주요내용\n대법원, 대검찰청을 비롯해 법원이나 검찰의 주요 사법기관은 현재\n서울시에 집중되어있음. 서울의 과밀화 해소하고, 국토 균형발전을 도\n모하고자 많은 공공기관이 지방으로 이전하고 있는바, 이에 발맞춰 사\n법기관도 지방으로 분산이전하는 것이 타당함.\n헌법상 중립을 지키는 것이 강하게 필요한 주요 국가기관의 경우\n정치권력의 중심으로부터 물리적ㆍ심리적 거리를 두어야하며, 사법 선\n진국인 독일을 비롯한 여러 국가의 경우 이미 대법원과 헌법재판소가\n전국에 분산되어 사법 권력과 정치 권력의 거리를 분리함으로서 실질\n적 권력분립을 이루고자 하고 있음.\n또한 대구의 경우 가장 많은 독립운동가를 배출했고, 4ㆍ19혁명을\n시작했던 역사적 의의가 깊은 도시이므로 그 역사성을 보존하고 대법\n원이 소재하기에 충분한 의의를 지닌 지역인바, 대법원이 소재하기에\n\n\n\n적절한 도시임. 이에 대법원의 소재지를 대구광역시로 하도록 함(안\n제12조).\n\n법률 제 호\n법원조직법 일부개정법률안\n법원조직법 일부를 다음과 같이 개정한다.\n제12조 중 “서울특별시에”를 “대구광역시에”로 한다.\n부 칙\n이 법은 공포 후 1년이 경과한 날부터 시행한다.\n\n\n\n\n신ㆍ구조문대비표\n현 행 개 정 안\n제12조(소재지) 대법원은 서울특 제12조(소재지) -------대구광\n별시에 둔다. 역시에-----.\n",
  "sections": {
    "제안이유": "및",
    "주요내용": "대법원, 대검찰청을 비롯해 법원이나 검찰의 주요 사법기관은 현재\n서울시에 집중되어있음. 서울의 과밀화 해소하고, 국토 균형발전을 도\n모하고자 많은 공공기관이 지방으로 이전하고 있는바, 이에 발맞춰 사\n법기관도 지방으로 분산이전하는 것이 타당함.\n헌법상 중립을 지키는 것이 강하게 필요한 주요 국가기관의 경우\n정치권력의 중심으로부터 물리적ㆍ심리적 거리를 두어야하며, 사법 선\n진국인 독일을 비롯한 여러 국가의 경우 이미 대법원과 헌법재판소가\n전국에 분산되어 사법 권력과 정치 권력의 거리를 분리함으로서 실질\n적 권력분립을 이루고자 하고 있음.\n또한 대구의 경우 가장 많은 독립운동가를 배출했고, 4ㆍ19혁명을\n시작했던 역사적 의의가 깊은 도시이므로 그 역사성을 보존하고 대법\n원이 소재하기에 충분한 의의를 지닌 지역인바, 대법원이 소재하기에\n\n\n\n적절한 도시임. 이에 대법원의 소재지를 대구광역시로 하도록 함(안\n제12조).",
    "제안이유_및_주요내용": "대법원, 대검찰청을 비롯해 법원이나 검찰의 주요 사법기관은 현재\n서울시에 집중되어있음. 서울의 과밀화 해소하고, 국토 균형발전을 도\n모하고자 많은 공공기관이 지방으로 이전하고 있는바, 이에 발맞춰 사\n법기관도 지방으로 분산이전하는 것이 타당함.\n헌법상 중립을 지키는 것이 강하게 필요한 주요 국가기관의 경우\n정치권력의 중심으로부터 물리적ㆍ심리적 거리를 두어야하며, 사법 선\n진국인 독일을 비롯한 여러 국가의 경우 이미 대법원과 헌법재판소가\n전국에 분산되어 사법 권력과 정치 권력의 거리를 분리함으로서 실질\n적 권력분립을 이루고자 하고 있음.\n또한 대구의 경우 가장 많은 독립운동가를 배출했고, 4ㆍ19혁명을\n시작했던 역사적 의의가 깊은 도시이므로 그 역사성을 보존하고 대법\n원이 소재하기에 충분한 의의를 지닌 지역인바, 대법원이 소재하기에\n\n\n\n적절한 도시임. 이에 대법원의 소재지를 대구광역시로 하도록 함(안\n제12조).",
    "법률_제_호": "법원조직법 일부개정법률안\n법원조직법 일부를 다음과 같이 개정한다.\n제12조 중 “서울특별시에”를 “대구광역시에”로 한다.",
    "신구조문대비표": "현 행 개 정 안\n제12조(소재지) 대법원은 서울특 제12조(소재지) -------대구광\n별시에 둔다. 역시에-----."
  }
}