{
  "title": "2200586_콘텐츠산업_진흥법_일부개정법률안",
  "bill_number": "586",
  "proposal_date": "2024. 6. 18.",
  "submission_date": "",
  "is_alternative": false,
  "alternative_bill_numbers": [],
  "has_comparison_table": false,
  "comparison_table": "신ㆍ구조문대비표\n현 행 개 정 안\n<신 설> 제15조의2(신기술 활용 콘텐츠의\n활성화) ① 정부는 신기술을\n기반으로 한 콘텐츠의 연구와\n개발을 촉진하기 위하여 필요\n한 시책을 수립ㆍ시행하여야\n한다.\n② 제1항에 따른 신기술의 목\n록 등 세부사항은 대통령령으\n로 정한다.",
  "full_text": "콘텐츠산업 진흥법 일부개정법률안\n(서지영의원 대표발의)\n발의연월일 : 2024. 6. 18.\n의 안\n586\n번 호 발 의 자 : 서지영ㆍ곽규택ㆍ성일종\n이헌승ㆍ김승수ㆍ이종배\n정성국ㆍ박성민ㆍ정연욱\n박충권ㆍ박성훈ㆍ인요한\n김도읍 의원(13명)\n제안이유 및 주요내용\n현행법은 콘텐츠산업의 기반을 조성하고 그 경쟁력을 강화하기 위\n해 콘텐츠산업의 진흥에 필요한 사항을 규정하고 있으며 콘텐츠제작\n의 활성화 및 융합콘텐츠의 활성화를 위해 정부가 필요한 시책을 마\n련하도록 하고 있음.\n최근 4차 산업혁명과 함께 새로운 기술을 기반으로 메타버스 산업\n등이 급속하게 성장하고 있으며, 이를 활용한 창의적인 콘텐츠 개발,\n발굴 및 제작 등과 관련한 정부의 체계적ㆍ선도적인 지원의 필요성이\n제기되고 있음.\n이에 정부가 메타버스, AI, VR 등 신기술을 활용한 콘텐츠산업 활\n성화와 관련한 시책을 마련하도록 하여 급변하는 시장 환경에 대응해\n신기술을 활용한 콘텐츠 제작 역량을 키우려는 것임(안 제15조의2 신\n설).\n\n\n\n\n법률 제 호\n콘텐츠산업 진흥법 일부개정법률안\n콘텐츠산업 진흥법 일부를 다음과 같이 개정한다.\n제3장에 제15조의2를 다음과 같이 신설한다.\n제15조의2(신기술 활용 콘텐츠의 활성화) ① 정부는 신기술을 기반으\n로 한 콘텐츠의 연구와 개발을 촉진하기 위하여 필요한 시책을 수\n립ㆍ시행하여야 한다.\n② 제1항에 따른 신기술의 목록 등 세부사항은 대통령령으로 정한\n다.\n부 칙\n이 법은 공포 후 6개월이 경과한 날부터 시행한다.\n\n\n\n\n신ㆍ구조문대비표\n현 행 개 정 안\n<신 설> 제15조의2(신기술 활용 콘텐츠의\n활성화) ① 정부는 신기술을\n기반으로 한 콘텐츠의 연구와\n개발을 촉진하기 위하여 필요\n한 시책을 수립ㆍ시행하여야\n한다.\n② 제1항에 따른 신기술의 목\n록 등 세부사항은 대통령령으\n로 정한다.\n",
  "sections": {
    "제안이유": "및",
    "주요내용": "현행법은 콘텐츠산업의 기반을 조성하고 그 경쟁력을 강화하기 위\n해 콘텐츠산업의 진흥에 필요한 사항을 규정하고 있으며 콘텐츠제작\n의 활성화 및 융합콘텐츠의 활성화를 위해 정부가 필요한 시책을 마\n련하도록 하고 있음.\n최근 4차 산업혁명과 함께 새로운 기술을 기반으로 메타버스 산업\n등이 급속하게 성장하고 있으며, 이를 활용한 창의적인 콘텐츠 개발,\n발굴 및 제작 등과 관련한 정부의 체계적ㆍ선도적인 지원의 필요성이\n제기되고 있음.\n이에 정부가 메타버스, AI, VR 등 신기술을 활용한 콘텐츠산업 활\n성화와 관련한 시책을 마련하도록 하여 급변하는 시장 환경에 대응해\n신기술을 활용한 콘텐츠 제작 역량을 키우려는 것임(안 제15조의2 신\n설).",
    "제안이유_및_주요내용": "현행법은 콘텐츠산업의 기반을 조성하고 그 경쟁력을 강화하기 위\n해 콘텐츠산업의 진흥에 필요한 사항을 규정하고 있으며 콘텐츠제작\n의 활성화 및 융합콘텐츠의 활성화를 위해 정부가 필요한 시책을 마\n련하도록 하고 있음.\n최근 4차 산업혁명과 함께 새로운 기술을 기반으로 메타버스 산업\n등이 급속하게 성장하고 있으며, 이를 활용한 창의적인 콘텐츠 개발,\n발굴 및 제작 등과 관련한 정부의 체계적ㆍ선도적인 지원의 필요성이\n제기되고 있음.\n이에 정부가 메타버스, AI, VR 등 신기술을 활용한 콘텐츠산업 활\n성화와 관련한 시책을 마련하도록 하여 급변하는 시장 환경에 대응해\n신기술을 활용한 콘텐츠 제작 역량을 키우려는 것임(안 제15조의2 신\n설).",
    "법률_제_호": "콘텐츠산업 진흥법 일부개정법률안\n콘텐츠산업 진흥법 일부를 다음과 같이 개정한다.\n제3장에 제15조의2를 다음과 같이 신설한다.\n제15조의2(신기술 활용 콘텐츠의 활성화) ① 정부는 신기술을 기반으\n로 한 콘텐츠의 연구와 개발을 촉진하기 위하여 필요한 시책을 수\n립ㆍ시행하여야 한다.\n② 제1항에 따른 신기술의 목록 등 세부사항은 대통령령으로 정한\n다.",
    "신구조문대비표": "현 행 개 정 안\n<신 설> 제15조의2(신기술 활용 콘텐츠의\n활성화) ① 정부는 신기술을\n기반으로 한 콘텐츠의 연구와\n개발을 촉진하기 위하여 필요\n한 시책을 수립ㆍ시행하여야\n한다.\n② 제1항에 따른 신기술의 목\n록 등 세부사항은 대통령령으\n로 정한다."
  }
}