{
  "title": "2200774_형법_일부개정법률안",
  "bill_number": "774",
  "proposal_date": "2024. 6. 21.",
  "submission_date": "",
  "is_alternative": false,
  "alternative_bill_numbers": [],
  "has_comparison_table": false,
  "comparison_table": "신·구조문대비표\n현 행 개 정 안\n第98條(間諜) ①⋅② (생 략) 第98條(間諜) ①⋅② (현행과 같\n음)\n<신 설> ③ 외국, 외국인, 외국인 단체\n를 위하여 간첩한 자는 5년 이\n상의 징역에 처한다.",
  "full_text": "형법 일부개정법률안\n(주호영의원 대표발의)\n발의연월일 : 2024. 6. 21.\n의 안\n774\n번 호 발 의 자 : 주호영ㆍ권영세ㆍ곽규택\n김승수ㆍ김도읍ㆍ장동혁\n이헌승ㆍ구자근ㆍ이인선\n정희용 의원(10인)\n제안이유 및 주요내용\n현행법은 간첩행위를 ‘적국’을 위하여 간첩하거나 ‘적국’의 간첩을\n방조한자로, 범위는 ‘군사상의 기밀’로 한하고 있음.\n그러나 냉전체제의 종식과 포괄적 안보 개념이 대두되면서 과거와\n달리 적국 개념이 모호해지고 있으며 간첩행위 역시 국가기밀에 국한\n되지 않고 갈수록 광범위해지는 양상임.\n간첩의 양상이 변모함에 따라 국익 손실을 미연에 방지하기 위해\n간첩죄의 적용범위를 시대 상황에 맞게 변화시킬 필요가 있다는 의견\n이 제기됨.\n이에 외국, 외국인, 외국인단체를 위하여 간첩한 자를 5년 이상의\n징역에 처해 국가의 외적 안전을 지키려는 것임(안 제98조제3항 신\n설).\n\n\n\n\n법률 제 호\n형법 일부개정법률안\n형법 일부를 다음과 같이 개정한다.\n제98조에 제3항을 다음과 같이 신설한다.\n③ 외국, 외국인, 외국인 단체를 위하여 간첩한 자는 5년 이상의 징\n역에 처한다.\n부 칙\n이 법은 공포 후 3개월이 경과한 날부터 시행한다.\n\n\n\n\n신·구조문대비표\n현 행 개 정 안\n第98條(間諜) ①⋅② (생 략) 第98條(間諜) ①⋅② (현행과 같\n음)\n<신 설> ③ 외국, 외국인, 외국인 단체\n를 위하여 간첩한 자는 5년 이\n상의 징역에 처한다.\n",
  "sections": {
    "제안이유": "및",
    "주요내용": "현행법은 간첩행위를 ‘적국’을 위하여 간첩하거나 ‘적국’의 간첩을\n방조한자로, 범위는 ‘군사상의 기밀’로 한하고 있음.\n그러나 냉전체제의 종식과 포괄적 안보 개념이 대두되면서 과거와\n달리 적국 개념이 모호해지고 있으며 간첩행위 역시 국가기밀에 국한\n되지 않고 갈수록 광범위해지는 양상임.\n간첩의 양상이 변모함에 따라 국익 손실을 미연에 방지하기 위해\n간첩죄의 적용범위를 시대 상황에 맞게 변화시킬 필요가 있다는 의견\n이 제기됨.\n이에 외국, 외국인, 외국인단체를 위하여 간첩한 자를 5년 이상의\n징역에 처해 국가의 외적 안전을 지키려는 것임(안 제98조제3항 신\n설).",
    "제안이유_및_주요내용": "현행법은 간첩행위를 ‘적국’을 위하여 간첩하거나 ‘적국’의 간첩을\n방조한자로, 범위는 ‘군사상의 기밀’로 한하고 있음.\n그러나 냉전체제의 종식과 포괄적 안보 개념이 대두되면서 과거와\n달리 적국 개념이 모호해지고 있으며 간첩행위 역시 국가기밀에 국한\n되지 않고 갈수록 광범위해지는 양상임.\n간첩의 양상이 변모함에 따라 국익 손실을 미연에 방지하기 위해\n간첩죄의 적용범위를 시대 상황에 맞게 변화시킬 필요가 있다는 의견\n이 제기됨.\n이에 외국, 외국인, 외국인단체를 위하여 간첩한 자를 5년 이상의\n징역에 처해 국가의 외적 안전을 지키려는 것임(안 제98조제3항 신\n설).",
    "법률_제_호": "형법 일부개정법률안\n형법 일부를 다음과 같이 개정한다.\n제98조에 제3항을 다음과 같이 신설한다.\n③ 외국, 외국인, 외국인 단체를 위하여 간첩한 자는 5년 이상의 징\n역에 처한다.",
    "신구조문대비표": "현 행 개 정 안\n第98條(間諜) ①⋅② (생 략) 第98條(間諜) ①⋅② (현행과 같\n음)\n<신 설> ③ 외국, 외국인, 외국인 단체\n를 위하여 간첩한 자는 5년 이\n상의 징역에 처한다."
  }
}