{
  "title": "2200203_소재ㆍ부품ㆍ장비산업_경쟁력_강화_및_공급망_안정화를_위한_특별조치법_일부개정법률안",
  "bill_number": "203",
  "proposal_date": "2024. 6. 7.",
  "submission_date": "",
  "is_alternative": false,
  "alternative_bill_numbers": [],
  "has_comparison_table": false,
  "comparison_table": "신ㆍ구조문대비표\n현 행 개 정 안\n법률 제16859호 법률 제16859호\n소재ㆍ부품전문기업 등의 육성에 소재ㆍ부품전문기업 등의 육성에\n관한 특별조치법 전부개정법률 관한 특별조치법 전부개정법률\n",
  "full_text": "소재ㆍ부품ㆍ장비산업 경쟁력 강화 및 공급망 안정화를\n위한 특별조치법 일부개정법률안\n(조지연의원 대표발의)\n발의연월일 : 2024. 6. 7.\n의 안\n203\n번 호 발 의 자 : 조지연ㆍ박충권ㆍ박준태\n김은혜ㆍ박덕흠ㆍ엄태영\n백종헌ㆍ김석기ㆍ고동진\n박성민ㆍ조승환 의원\n(11인)\n제안이유 및 주요내용\n현행법은 소재ㆍ부품ㆍ장비산업(이하 “소부장산업”이라 함)의 발전\n기반을 조성하고, 소부장 기업 육성과 기술역량의 축적 등 소부장산업\n의 활성화 및 경쟁력 강화를 위해 제정되었음. 또한 소부장산업의 안\n정적 발전을 위한 재정확보와 관련 사업의 효율적 시행을 위하여\n2024년 12월 31일까지 효력이 있는 소재ㆍ부품ㆍ장비경쟁력강화특별\n회계를 설치하였음.\n그런데 소부장산업은 타(他) 국가의 수출품목 제한 사태와 코로나19\n팬데믹 등을 거치며 그 중요성이 지속적으로 커지고 있을 뿐만 아니\n라, 소부장 국산화와 안정적인 공급망 구축을 위해 장기적으로 양성ㆍ\n발전시켜나가야 하는 국가적 과제를 안고 있음. 또한 소부장산업 관련\n기업과 그 지원시설 등이 집단적으로 입주하는 특화단지의 추가 지정\n\n\n\n이 예정되어 있는 상황에서 국가의 재정지원은 계속될 필요가 있음.\n이에 현행법의 소재ㆍ부품ㆍ장비경쟁력강화특별회계 유효기간을 5\n년 더 연장하여 소부장산업 기술 자립과 소부장산업 발전이 국민경제\n의 발전에 지속적으로 기여하도록 하려는 것임(안 법률 제16859호 소\n재ㆍ부품전문기업 등의 육성에 관한 특별조치법 전부개정법률 부칙\n제2조).\n\n법률 제 호\n소재ㆍ부품ㆍ장비산업 경쟁력 강화 및 공급망 안정화를\n위한 특별조치법 일부개정법률안\n소재ㆍ부품ㆍ장비산업 경쟁력 강화 및 공급망 안정화를 위한 특별조\n치법 일부를 다음과 같이 개정한다.\n법률 제16859호 소재ㆍ부품전문기업 등의 육성에 관한 특별조치법 전\n부개정법률 부칙 제2조 중 “2024년”을 “2029년”으로 한다.\n부 칙\n이 법은 공포한 날부터 시행한다.\n\n\n\n\n신ㆍ구조문대비표\n현 행 개 정 안\n법률 제16859호 법률 제16859호\n소재ㆍ부품전문기업 등의 육성에 소재ㆍ부품전문기업 등의 육성에\n관한 특별조치법 전부개정법률 관한 특별조치법 전부개정법률\n부칙 부칙\n제2조(특별회계의 유효기간) 제68 제2조(특별회계의 유효기간) ----\n조부터 제73조까지의 개정규정 ----------------------------\n은 2024년 12월 31일까지 효력 ---2029년-------------------\n을 가진다. ---------.\n",
  "sections": {
    "제안이유": "및",
    "주요내용": "현행법은 소재ㆍ부품ㆍ장비산업(이하 “소부장산업”이라 함)의 발전\n기반을 조성하고, 소부장 기업 육성과 기술역량의 축적 등 소부장산업\n의 활성화 및 경쟁력 강화를 위해 제정되었음. 또한 소부장산업의 안\n정적 발전을 위한 재정확보와 관련 사업의 효율적 시행을 위하여\n2024년 12월 31일까지 효력이 있는 소재ㆍ부품ㆍ장비경쟁력강화특별\n회계를 설치하였음.\n그런데 소부장산업은 타(他) 국가의 수출품목 제한 사태와 코로나19\n팬데믹 등을 거치며 그 중요성이 지속적으로 커지고 있을 뿐만 아니\n라, 소부장 국산화와 안정적인 공급망 구축을 위해 장기적으로 양성ㆍ\n발전시켜나가야 하는 국가적 과제를 안고 있음. 또한 소부장산업 관련\n기업과 그 지원시설 등이 집단적으로 입주하는 특화단지의 추가 지정\n\n\n\n이 예정되어 있는 상황에서 국가의 재정지원은 계속될 필요가 있음.\n이에 현행법의 소재ㆍ부품ㆍ장비경쟁력강화특별회계 유효기간을 5\n년 더 연장하여 소부장산업 기술 자립과 소부장산업 발전이 국민경제\n의 발전에 지속적으로 기여하도록 하려는 것임(안",
    "제안이유_및_주요내용": "현행법은 소재ㆍ부품ㆍ장비산업(이하 “소부장산업”이라 함)의 발전\n기반을 조성하고, 소부장 기업 육성과 기술역량의 축적 등 소부장산업\n의 활성화 및 경쟁력 강화를 위해 제정되었음. 또한 소부장산업의 안\n정적 발전을 위한 재정확보와 관련 사업의 효율적 시행을 위하여\n2024년 12월 31일까지 효력이 있는 소재ㆍ부품ㆍ장비경쟁력강화특별\n회계를 설치하였음.\n그런데 소부장산업은 타(他) 국가의 수출품목 제한 사태와 코로나19\n팬데믹 등을 거치며 그 중요성이 지속적으로 커지고 있을 뿐만 아니\n라, 소부장 국산화와 안정적인 공급망 구축을 위해 장기적으로 양성ㆍ\n발전시켜나가야 하는 국가적 과제를 안고 있음. 또한 소부장산업 관련\n기업과 그 지원시설 등이 집단적으로 입주하는 특화단지의 추가 지정\n\n\n\n이 예정되어 있는 상황에서 국가의 재정지원은 계속될 필요가 있음.\n이에 현행법의 소재ㆍ부품ㆍ장비경쟁력강화특별회계 유효기간을 5\n년 더 연장하여 소부장산업 기술 자립과 소부장산업 발전이 국민경제\n의 발전에 지속적으로 기여하도록 하려는 것임(안",
    "법률_제_호": "소\n재ㆍ부품전문기업 등의 육성에 관한 특별조치법 전부개정법률",
    "신구조문대비표": "현 행 개 정 안\n법률 제16859호 법률 제16859호\n소재ㆍ부품전문기업 등의 육성에 소재ㆍ부품전문기업 등의 육성에\n관한 특별조치법 전부개정법률 관한 특별조치법 전부개정법률"
  }
}