{
  "title": "2200812_수상레저안전법_일부개정법률안",
  "bill_number": "812",
  "proposal_date": "2024. 6. 21.",
  "submission_date": "",
  "is_alternative": false,
  "alternative_bill_numbers": [],
  "has_comparison_table": false,
  "comparison_table": "신ㆍ구조문대비표\n현 행 개 정 안\n제61조(벌칙) <신 설> 제61조(벌칙) ① 제25조 각 호 외\n의 부분 본문을 2회 이상 위반\n하여 조종면허를 받지 아니하고\n동력수상레저기구를 조종한 자\n는 1년 이상 2년 이하의 징역\n또는 1천만원 이상 2천만원 이\n하의 벌금에 처한다.\n(생 략) ② (현행 제목 외의 부분과 같\n음)",
  "full_text": "수상레저안전법 일부개정법률안\n(김선교의원 대표발의)\n발의연월일 : 2024. 6. 21.\n의 안\n812\n번 호 발 의 자 : 김선교ㆍ서천호ㆍ김성원\n구자근ㆍ김예지ㆍ우재준\n김위상ㆍ윤한홍ㆍ김상훈\n송석준ㆍ서지영ㆍ최수진\n의원(12인)\n제안이유 및 주요내용\n현행법은 조종면허를 받지 아니하고 동력수상레저기구를 조종한 사\n람에게는 1년 이하의 징역 또는 1천만원 이하의 벌금을 부과하고 있\n음.\n그러나 수상레저활동에 참여하는 국민은 매년 증가하고 있으나 최\n근 5년 간 현행법을 위반하여 무면허조종으로 적발된 건수가 2019년\n68건, 2020년 95건, 2021년 95건, 2022년 80건, 2023년 103건으로 증가\n하는 추세에 있으며, 무면허조종으로 2회 이상 적발되는 사례도 발생\n하고 있어 수상레저활동을 하는 국민의 안전이 위협받고 있다는 지적\n이 제기되고 있음.\n이에 조종면허를 받지 아니하고 동력수상레저기구를 조종하여 2회\n이상 적발된 자에게 1년 이상 2년 이하의 징역 또는 1천만원 이상 2\n\n\n\n천만원 이하의 벌금을 부과토록 하여 무면허조종으로 인한 인적ㆍ물\n적 피해를 사전에 예방하고, 무면허조종의 위험성에 대한 경각심을 제\n고하려는 것임(안 제61조제1항 신설).\n\n법률 제 호\n수상레저안전법 일부개정법률안\n수상레저안전법 일부를 다음과 같이 개정한다.\n제61조 제목 외의 부분을 제2항으로 하고, 같은 조에 제1항을 다음과\n같이 신설한다.\n① 제25조 각 호 외의 부분 본문을 2회 이상 위반하여 조종면허를\n받지 아니하고 동력수상레저기구를 조종한 자는 1년 이상 2년 이하\n의 징역 또는 1천만원 이상 2천만원 이하의 벌금에 처한다.\n부 칙\n이 법은 공포한 날부터 시행한다.\n\n\n\n\n신ㆍ구조문대비표\n현 행 개 정 안\n제61조(벌칙) <신 설> 제61조(벌칙) ① 제25조 각 호 외\n의 부분 본문을 2회 이상 위반\n하여 조종면허를 받지 아니하고\n동력수상레저기구를 조종한 자\n는 1년 이상 2년 이하의 징역\n또는 1천만원 이상 2천만원 이\n하의 벌금에 처한다.\n(생 략) ② (현행 제목 외의 부분과 같\n음)\n",
  "sections": {
    "제안이유": "및",
    "주요내용": "현행법은 조종면허를 받지 아니하고 동력수상레저기구를 조종한 사\n람에게는 1년 이하의 징역 또는 1천만원 이하의 벌금을 부과하고 있\n음.\n그러나 수상레저활동에 참여하는 국민은 매년 증가하고 있으나 최\n근 5년 간 현행법을 위반하여 무면허조종으로 적발된 건수가 2019년\n68건, 2020년 95건, 2021년 95건, 2022년 80건, 2023년 103건으로 증가\n하는 추세에 있으며, 무면허조종으로 2회 이상 적발되는 사례도 발생\n하고 있어 수상레저활동을 하는 국민의 안전이 위협받고 있다는 지적\n이 제기되고 있음.\n이에 조종면허를 받지 아니하고 동력수상레저기구를 조종하여 2회\n이상 적발된 자에게 1년 이상 2년 이하의 징역 또는 1천만원 이상 2\n\n\n\n천만원 이하의 벌금을 부과토록 하여 무면허조종으로 인한 인적ㆍ물\n적 피해를 사전에 예방하고, 무면허조종의 위험성에 대한 경각심을 제\n고하려는 것임(안 제61조제1항 신설).",
    "제안이유_및_주요내용": "현행법은 조종면허를 받지 아니하고 동력수상레저기구를 조종한 사\n람에게는 1년 이하의 징역 또는 1천만원 이하의 벌금을 부과하고 있\n음.\n그러나 수상레저활동에 참여하는 국민은 매년 증가하고 있으나 최\n근 5년 간 현행법을 위반하여 무면허조종으로 적발된 건수가 2019년\n68건, 2020년 95건, 2021년 95건, 2022년 80건, 2023년 103건으로 증가\n하는 추세에 있으며, 무면허조종으로 2회 이상 적발되는 사례도 발생\n하고 있어 수상레저활동을 하는 국민의 안전이 위협받고 있다는 지적\n이 제기되고 있음.\n이에 조종면허를 받지 아니하고 동력수상레저기구를 조종하여 2회\n이상 적발된 자에게 1년 이상 2년 이하의 징역 또는 1천만원 이상 2\n\n\n\n천만원 이하의 벌금을 부과토록 하여 무면허조종으로 인한 인적ㆍ물\n적 피해를 사전에 예방하고, 무면허조종의 위험성에 대한 경각심을 제\n고하려는 것임(안 제61조제1항 신설).",
    "법률_제_호": "수상레저안전법 일부개정법률안\n수상레저안전법 일부를 다음과 같이 개정한다.\n제61조 제목 외의 부분을 제2항으로 하고, 같은 조에 제1항을 다음과\n같이 신설한다.\n① 제25조 각 호 외의 부분 본문을 2회 이상 위반하여 조종면허를\n받지 아니하고 동력수상레저기구를 조종한 자는 1년 이상 2년 이하\n의 징역 또는 1천만원 이상 2천만원 이하의 벌금에 처한다.",
    "신구조문대비표": "현 행 개 정 안\n제61조(벌칙) <신 설> 제61조(벌칙) ① 제25조 각 호 외\n의 부분 본문을 2회 이상 위반\n하여 조종면허를 받지 아니하고\n동력수상레저기구를 조종한 자\n는 1년 이상 2년 이하의 징역\n또는 1천만원 이상 2천만원 이\n하의 벌금에 처한다.\n(생 략) ② (현행 제목 외의 부분과 같\n음)"
  }
}