{
  "title": "2200208_전기사업법_일부개정법률안",
  "bill_number": "208",
  "proposal_date": "2024. 6. 7.",
  "submission_date": "",
  "is_alternative": false,
  "alternative_bill_numbers": [],
  "has_comparison_table": false,
  "comparison_table": "신ㆍ구조문대비표\n현 행 개 정 안\n법률 제18280호 전기사업법 일 법률 제18280호 전기사업법 일\n부개정법률 ",
  "full_text": "전기사업법 일부개정법률안\n(박정의원 대표발의)\n발의연월일 : 2024. 6. 7.\n의 안\n208\n번 호 발 의 자 : 박 정ㆍ문금주ㆍ유동수\n김현정ㆍ안규백ㆍ강유정\n어기구ㆍ송옥주ㆍ민병덕\n김병기ㆍ김영환ㆍ소병훈\n김남근ㆍ염태영 의원\n(14인)\n제안이유 및 주요내용\n현행법은 가공전선로의 지중이설 사업에 대해 지중이설을 요청한\n자가 비용을 부담하는 것을 원칙으로 하고 있으나, 시장ㆍ군수ㆍ구청\n장이 공익적 목적을 위하여 요청하는 경우에는 예외적으로 가공전선\n로 설치사업자가 그 비용의 일부를 부담할 수 있도록 규정하고 있음.\n한편, 2021년 6월 법 개정으로 국민안전과 관련하여 필요한 경우에\n는 지방자치단체가 부담하는 지중이설 비용의 일부를 국가가 부담할\n수 있도록 신설하되, 부칙에서 유효기간을 2025년 12월 31일까지로 하\n였음.\n그런데 지중이설 사업이 국민안전과 직결되고 있다는 점을 감안할\n때, 동 사업에 대한 국가의 재정지원을 한시적이 아니라 지속적으로\n추진할 필요가 있다는 의견이 제시됨.\n\n\n\n이에 가공전선로 지중이설 관련 지방자치단체에 대한 국가의 비용\n지원 유효기간을 정한 부칙의 규정을 삭제함으로써, 국민 안전을 위한\n가공전선로 지중이설 사업이 지속적으로 추진되어 국가의 국민안전\n보장 책무를 보다 강화하려는 것임(법률 제18280호 전기사업법 일부개\n정법률 부칙 제2조 삭제).\n\n법률 제 호\n전기사업법 일부개정법률안\n전기사업법 일부를 다음과 같이 개정한다.\n법률 제18280호 전기사업법 일부개정법률 부칙 제2조를 삭제한다.\n부 칙\n이 법은 공포한 날부터 시행한다.\n\n\n\n\n신ㆍ구조문대비표\n현 행 개 정 안\n법률 제18280호 전기사업법 일 법률 제18280호 전기사업법 일\n부개정법률 부칙 부개정법률 부칙\n제2조(유효기간) 제49조제11호 및 <삭 제>\n제72조의2제3항의 개정규정은\n2025년 12월 31일까지 효력을\n가진다.\n",
  "sections": {
    "제안이유": "및",
    "주요내용": "현행법은 가공전선로의 지중이설 사업에 대해 지중이설을 요청한\n자가 비용을 부담하는 것을 원칙으로 하고 있으나, 시장ㆍ군수ㆍ구청\n장이 공익적 목적을 위하여 요청하는 경우에는 예외적으로 가공전선\n로 설치사업자가 그 비용의 일부를 부담할 수 있도록 규정하고 있음.\n한편, 2021년 6월 법 개정으로 국민안전과 관련하여 필요한 경우에\n는 지방자치단체가 부담하는 지중이설 비용의 일부를 국가가 부담할\n수 있도록 신설하되, 부칙에서 유효기간을 2025년 12월 31일까지로 하\n였음.\n그런데 지중이설 사업이 국민안전과 직결되고 있다는 점을 감안할\n때, 동 사업에 대한 국가의 재정지원을 한시적이 아니라 지속적으로\n추진할 필요가 있다는 의견이 제시됨.\n\n\n\n이에 가공전선로 지중이설 관련 지방자치단체에 대한 국가의 비용\n지원 유효기간을 정한 부칙의 규정을 삭제함으로써, 국민 안전을 위한\n가공전선로 지중이설 사업이 지속적으로 추진되어 국가의 국민안전\n보장 책무를 보다 강화하려는 것임(",
    "제안이유_및_주요내용": "현행법은 가공전선로의 지중이설 사업에 대해 지중이설을 요청한\n자가 비용을 부담하는 것을 원칙으로 하고 있으나, 시장ㆍ군수ㆍ구청\n장이 공익적 목적을 위하여 요청하는 경우에는 예외적으로 가공전선\n로 설치사업자가 그 비용의 일부를 부담할 수 있도록 규정하고 있음.\n한편, 2021년 6월 법 개정으로 국민안전과 관련하여 필요한 경우에\n는 지방자치단체가 부담하는 지중이설 비용의 일부를 국가가 부담할\n수 있도록 신설하되, 부칙에서 유효기간을 2025년 12월 31일까지로 하\n였음.\n그런데 지중이설 사업이 국민안전과 직결되고 있다는 점을 감안할\n때, 동 사업에 대한 국가의 재정지원을 한시적이 아니라 지속적으로\n추진할 필요가 있다는 의견이 제시됨.\n\n\n\n이에 가공전선로 지중이설 관련 지방자치단체에 대한 국가의 비용\n지원 유효기간을 정한 부칙의 규정을 삭제함으로써, 국민 안전을 위한\n가공전선로 지중이설 사업이 지속적으로 추진되어 국가의 국민안전\n보장 책무를 보다 강화하려는 것임(",
    "법률_제_호": "전기사업법 일부개\n정법률",
    "신구조문대비표": "현 행 개 정 안\n법률 제18280호 전기사업법 일 법률 제18280호 전기사업법 일\n부개정법률"
  }
}