{
  "title": "2200406_전자장치_부착_등에_관한_법률_일부개정법률안",
  "bill_number": "406",
  "proposal_date": "2024. 6. 12.",
  "submission_date": "",
  "is_alternative": false,
  "alternative_bill_numbers": [],
  "has_comparison_table": false,
  "comparison_table": "신ㆍ구조문대비표\n현 행 개 정 안\n제22조(가석방과 전자장치 부착) 제22조(가석방과 전자장치 부착)\n①ㆍ② (생 략) ①ㆍ② (현행과 같음)\n<신 설> ③ 전자장치 부착명령을 받지\n않은 무기형 수형자로서 형의\n집행 중 가석방되는 경우 가석\n방기간 동안 전자장치를 부착하\n여야 한다\n③ ∼ ⑤ (생 략) ④ ∼ ⑥ (현행 제3항부터 제5\n항까지와 같음)",
  "full_text": "전자장치 부착 등에 관한 법률 일부개정법률안\n(권칠승의원 대표발의)\n발의연월일 : 2024. 6. 12.\n의 안\n406\n번 호 발 의 자 : 권칠승ㆍ송옥주ㆍ민병덕\n서영교ㆍ김종민ㆍ홍기원\n문금주ㆍ임호선ㆍ이병진\n김용만 의원(10인)\n제안이유 및 주요내용\n현행법은 징역ㆍ금고의 기간에 있어서 무기(無期)를 규정하고 있으\n나, 무기징역 또는 무기금고의 경우에도 행상(行狀)이 양호하여 뉘우\n침이 뚜렷한 때에는 20년이 경과한 후 행정처분으로 가석방을 할 수\n있다고 규정하고 있어 무기형을 선고받은 범죄자의 사회복귀 가능성\n이 열려 있음.\n그러나 잔혹한 범죄를 저지르는 등 그 죄질이 흉악하고 준법의식과\n공동체 구성원에 대한 존중이 현저히 결여되어 있었던 범죄자의 경우\n에는 가석방 후에도 중대한 피해를 끼치는 것을 방지하기 위한 제도\n적 장치를 강화할 필요가 있음.\n이에 무기징역 또는 무기금고의 집행 중에 있는 사람의 가석방과\n관련하여서 가석방기간 동안 전자장치를 부착하려는 것임(안 제22조).\n\n\n\n\n법률 제 호\n전자장치 부착 등에 관한 법률 일부개정법률안\n전자장치 부착 등에 관한 법률 일부를 다음과 같이 개정한다.\n제22조제3항부터 제5항까지를 각각 제4항부터 제6항까지로 하고, 같은\n조에 제3항을 다음과 같이 신설한다.\n③ 전자장치 부착명령을 받지 않은 무기형 수형자로서 형의 집행\n중 가석방되는 경우 가석방기간 동안 전자장치를 부착하여야 한다\n부 칙\n이 법은 공포 후 6개월이 경과한 날부터 시행한다.\n\n\n\n\n신ㆍ구조문대비표\n현 행 개 정 안\n제22조(가석방과 전자장치 부착) 제22조(가석방과 전자장치 부착)\n①ㆍ② (생 략) ①ㆍ② (현행과 같음)\n<신 설> ③ 전자장치 부착명령을 받지\n않은 무기형 수형자로서 형의\n집행 중 가석방되는 경우 가석\n방기간 동안 전자장치를 부착하\n여야 한다\n③ ∼ ⑤ (생 략) ④ ∼ ⑥ (현행 제3항부터 제5\n항까지와 같음)\n",
  "sections": {
    "제안이유": "및",
    "주요내용": "현행법은 징역ㆍ금고의 기간에 있어서 무기(無期)를 규정하고 있으\n나, 무기징역 또는 무기금고의 경우에도 행상(行狀)이 양호하여 뉘우\n침이 뚜렷한 때에는 20년이 경과한 후 행정처분으로 가석방을 할 수\n있다고 규정하고 있어 무기형을 선고받은 범죄자의 사회복귀 가능성\n이 열려 있음.\n그러나 잔혹한 범죄를 저지르는 등 그 죄질이 흉악하고 준법의식과\n공동체 구성원에 대한 존중이 현저히 결여되어 있었던 범죄자의 경우\n에는 가석방 후에도 중대한 피해를 끼치는 것을 방지하기 위한 제도\n적 장치를 강화할 필요가 있음.\n이에 무기징역 또는 무기금고의 집행 중에 있는 사람의 가석방과\n관련하여서 가석방기간 동안 전자장치를 부착하려는 것임(안 제22조).",
    "제안이유_및_주요내용": "현행법은 징역ㆍ금고의 기간에 있어서 무기(無期)를 규정하고 있으\n나, 무기징역 또는 무기금고의 경우에도 행상(行狀)이 양호하여 뉘우\n침이 뚜렷한 때에는 20년이 경과한 후 행정처분으로 가석방을 할 수\n있다고 규정하고 있어 무기형을 선고받은 범죄자의 사회복귀 가능성\n이 열려 있음.\n그러나 잔혹한 범죄를 저지르는 등 그 죄질이 흉악하고 준법의식과\n공동체 구성원에 대한 존중이 현저히 결여되어 있었던 범죄자의 경우\n에는 가석방 후에도 중대한 피해를 끼치는 것을 방지하기 위한 제도\n적 장치를 강화할 필요가 있음.\n이에 무기징역 또는 무기금고의 집행 중에 있는 사람의 가석방과\n관련하여서 가석방기간 동안 전자장치를 부착하려는 것임(안 제22조).",
    "법률_제_호": "전자장치 부착 등에 관한 법률 일부개정법률안\n전자장치 부착 등에 관한 법률 일부를 다음과 같이 개정한다.\n제22조제3항부터 제5항까지를 각각 제4항부터 제6항까지로 하고, 같은\n조에 제3항을 다음과 같이 신설한다.\n③ 전자장치 부착명령을 받지 않은 무기형 수형자로서 형의 집행\n중 가석방되는 경우 가석방기간 동안 전자장치를 부착하여야 한다",
    "신구조문대비표": "현 행 개 정 안\n제22조(가석방과 전자장치 부착) 제22조(가석방과 전자장치 부착)\n①ㆍ② (생 략) ①ㆍ② (현행과 같음)\n<신 설> ③ 전자장치 부착명령을 받지\n않은 무기형 수형자로서 형의\n집행 중 가석방되는 경우 가석\n방기간 동안 전자장치를 부착하\n여야 한다\n③ ∼ ⑤ (생 략) ④ ∼ ⑥ (현행 제3항부터 제5\n항까지와 같음)"
  }
}