{
  "title": "2200743_군인사법_일부개정법률안",
  "bill_number": "743",
  "proposal_date": "2024. 6. 20.",
  "submission_date": "",
  "is_alternative": false,
  "alternative_bill_numbers": [],
  "has_comparison_table": false,
  "comparison_table": "신ㆍ구조문대비표\n현 행 개 정 안\n제30조(전사자ㆍ순직자 및 전투 제30조(전사자ㆍ순직자 및 전투\n유공자의 진급) ① ∼ ③ (생 유공자의 진급) ① ∼ ③ (현행\n략) 과 같음)\n<신 설> ④ 제1항에 따라 진급된 사람\n의 연금 등 각종 급여와 그 밖\n에 예우는 진급된 계급에 따라\n서 한다.",
  "full_text": "군인사법 일부개정법률안\n(한기호의원 대표발의)\n발의연월일 : 2024. 6. 20.\n의 안\n743\n번 호 발 의 자 : 한기호ㆍ김은혜ㆍ구자근\n김종양ㆍ백종헌ㆍ임종득\n정희용ㆍ신성범ㆍ주진우\n강선영 의원(10인)\n제안이유 및 주요내용\n현행법은 전사자와 순직자와 전투, 전시ㆍ사변 등 국가비상사태에서\n국가에 뚜렷한 공적이 있는 사람에 대하여는 진급 최저복무기간 규정에도\n불구하고 1계급 진급시킬 수 있다고 규정하고 있음.\n전사자 및 순직자 등의 예우를 위해 추서 진급을 시킴에도 불구하고,\n유족 연금, 수당 등 각종 급여는 진급 전 계급에 따라 지급되고 있어\n국가를 위한 희생에 상응한 적절한 예우와 이에 상응하는 보상이 이\n뤄지지 않고 있다는 지적이 있음.\n이에 전사자와 순직자 등 추서 진급된 사람의 연금 등 각종 급여와\n그 밖에 예우는 진급된 계급에 따라서 하도록 명시하려는 것임(안 제3\n0조제4항 신설).\n\n\n\n\n법률 제 호\n군인사법 일부개정법률안\n군인사법 일부를 다음과 같이 개정한다.\n제30조에 제4항을 다음과 같이 신설한다.\n④ 제1항에 따라 진급된 사람의 연금 등 각종 급여와 그 밖에 예우\n는 진급된 계급에 따라서 한다.\n부 칙\n이 법은 공포한 날부터 시행한다.\n\n\n\n\n신ㆍ구조문대비표\n현 행 개 정 안\n제30조(전사자ㆍ순직자 및 전투 제30조(전사자ㆍ순직자 및 전투\n유공자의 진급) ① ∼ ③ (생 유공자의 진급) ① ∼ ③ (현행\n략) 과 같음)\n<신 설> ④ 제1항에 따라 진급된 사람\n의 연금 등 각종 급여와 그 밖\n에 예우는 진급된 계급에 따라\n서 한다.\n",
  "sections": {
    "제안이유": "및",
    "주요내용": "현행법은 전사자와 순직자와 전투, 전시ㆍ사변 등 국가비상사태에서\n국가에 뚜렷한 공적이 있는 사람에 대하여는 진급 최저복무기간 규정에도\n불구하고 1계급 진급시킬 수 있다고 규정하고 있음.\n전사자 및 순직자 등의 예우를 위해 추서 진급을 시킴에도 불구하고,\n유족 연금, 수당 등 각종 급여는 진급 전 계급에 따라 지급되고 있어\n국가를 위한 희생에 상응한 적절한 예우와 이에 상응하는 보상이 이\n뤄지지 않고 있다는 지적이 있음.\n이에 전사자와 순직자 등 추서 진급된 사람의 연금 등 각종 급여와\n그 밖에 예우는 진급된 계급에 따라서 하도록 명시하려는 것임(안 제3\n0조제4항 신설).",
    "제안이유_및_주요내용": "현행법은 전사자와 순직자와 전투, 전시ㆍ사변 등 국가비상사태에서\n국가에 뚜렷한 공적이 있는 사람에 대하여는 진급 최저복무기간 규정에도\n불구하고 1계급 진급시킬 수 있다고 규정하고 있음.\n전사자 및 순직자 등의 예우를 위해 추서 진급을 시킴에도 불구하고,\n유족 연금, 수당 등 각종 급여는 진급 전 계급에 따라 지급되고 있어\n국가를 위한 희생에 상응한 적절한 예우와 이에 상응하는 보상이 이\n뤄지지 않고 있다는 지적이 있음.\n이에 전사자와 순직자 등 추서 진급된 사람의 연금 등 각종 급여와\n그 밖에 예우는 진급된 계급에 따라서 하도록 명시하려는 것임(안 제3\n0조제4항 신설).",
    "법률_제_호": "군인사법 일부개정법률안\n군인사법 일부를 다음과 같이 개정한다.\n제30조에 제4항을 다음과 같이 신설한다.\n④ 제1항에 따라 진급된 사람의 연금 등 각종 급여와 그 밖에 예우\n는 진급된 계급에 따라서 한다.",
    "신구조문대비표": "현 행 개 정 안\n제30조(전사자ㆍ순직자 및 전투 제30조(전사자ㆍ순직자 및 전투\n유공자의 진급) ① ∼ ③ (생 유공자의 진급) ① ∼ ③ (현행\n략) 과 같음)\n<신 설> ④ 제1항에 따라 진급된 사람\n의 연금 등 각종 급여와 그 밖\n에 예우는 진급된 계급에 따라\n서 한다."
  }
}