{
  "title": "2200447_문화기본법_일부개정법률안",
  "bill_number": "447",
  "proposal_date": "2024. 6. 13.",
  "submission_date": "",
  "is_alternative": false,
  "alternative_bill_numbers": [],
  "has_comparison_table": false,
  "comparison_table": "신ㆍ구조문대비표\n현 행 개 정 안\n제5조(국가와 지방자치단체의 책 제5조(국가와 지방자치단체의 책\n무) <신 설> 무) ① 국가와 지방자치단체는\n문화의 진흥을 위하여 지원하\n되 그 내용에 대하여 간섭하지\n아니하도록 하여야 한다.\n① ∼ ⑤ (생 략) ② ∼ ⑥ (현행 제1항부터 제5\n항까지와 같음)",
  "full_text": "문화기본법 일부개정법률안\n(조계원의원 대표발의)\n발의연월일 : 2024. 6. 13.\n의 안\n447\n번 호 발 의 자 : 조계원ㆍ윤종군ㆍ주철현\n민형배ㆍ김문수ㆍ민병덕\n윤준병ㆍ소병훈ㆍ이개호\n박수현ㆍ문금주ㆍ김기표\n서미화ㆍ박희승ㆍ송재봉\n김성환ㆍ백승아 의원\n(17인)\n제안이유 및 주요내용\n김대중 제15대 대통령은 문화예술에 대해 ‘지원은 하되, 간섭은 하\n지 않는다’라고 밝혔고, 이 정치철학은 김대중 정부 이후 대부분 정권\n에서도 정부의 행정력이 문화예술 분야에 간섭을 자제해왔음.\n그러나 지난 박근혜 정부 당시 문화예술계의 문화예술인에 대해 정\n부의 지원을 끊거나 검열 및 불이익을 줄 목적으로 비밀리에 작성한\n‘블랙리스트’ 사건으로 2017년 7월 문체부와 문화예술계는 ‘문화예술계\n블랙리스트 진상조사 및 제도개선위원회’를 설치하였고, 2018년 6월\n책임 규명 권고안을 심의ㆍ의결하여 문체부는 수사 의뢰와 징계절차\n에 착수해 총 85개의 과제를 제시하면서, 문화행정의 개선을 위해서\n“참여와 협치의 원칙”과 “정보공개의 책임”을 「문화기본법」에 명시\n\n\n\n하도록 권고한 바 있음.\n윤석열 제20대 대통령도 영화배우를 비롯한 예술인과의 만남에서\n‘지원은 하되, 간섭은 하지 않는다’라고 문화예술분야에 대한 국정철학\n을 밝혔음.\n그러나 지난 2023년 부천에서 열린 학생만화 공모전에서 금상을 수\n상한 고등학생의 작품에 대해 문화체육관광부는 해당 작품 선정을 두\n고 관련 기관에 엄중 경고와 후원명칭 사용 금지에 대한 사건이 발생\n함. 이뿐만이 아니라 윤석열 정부 출범 이후 지방자치단체에서도 문화\n예술 검열 논란이 끊이질 않고 있어 문화예술계에서는 ‘블랙리스트’의\n악몽이 재현되는 것이 아닌지 걱정하고 있음.\n이에 문화행정에 협치 기반을 조성하고 정책과정의 투명성ㆍ신뢰성\nㆍ객관성을 제고와 「예술인의 지위와 권리의 보장에 관한 법률」 제\n2장 예술표현의 자유 보장 규정에 따라 문화예술인의 자유를 보장할\n필요가 있음.\n이에 국가와 지방자치단체의 책무에 지원은 하되, 간섭하지 않도록\n명시하여 문화예술의 표현의 자유를 침해하지 않도록 하고자 함(안 제\n5조제1항 신설).\n\n법률 제 호\n문화기본법 일부개정법률안\n문화기본법 일부를 다음과 같이 개정한다.\n제5조제1항부터 제5항까지를 각각 제2항부터 제6항까지로 하고, 같은\n조에 제1항을 다음과 같이 신설한다.\n① 국가와 지방자치단체는 문화의 진흥을 위하여 지원하되 그 내용\n에 대하여 간섭하지 아니하도록 하여야 한다.\n부 칙\n이 법은 공포한 날부터 시행한다.\n\n\n\n\n신ㆍ구조문대비표\n현 행 개 정 안\n제5조(국가와 지방자치단체의 책 제5조(국가와 지방자치단체의 책\n무) <신 설> 무) ① 국가와 지방자치단체는\n문화의 진흥을 위하여 지원하\n되 그 내용에 대하여 간섭하지\n아니하도록 하여야 한다.\n① ∼ ⑤ (생 략) ② ∼ ⑥ (현행 제1항부터 제5\n항까지와 같음)\n",
  "sections": {
    "제안이유": "및",
    "주요내용": "김대중 제15대 대통령은 문화예술에 대해 ‘지원은 하되, 간섭은 하\n지 않는다’라고 밝혔고, 이 정치철학은 김대중 정부 이후 대부분 정권\n에서도 정부의 행정력이 문화예술 분야에 간섭을 자제해왔음.\n그러나 지난 박근혜 정부 당시 문화예술계의 문화예술인에 대해 정\n부의 지원을 끊거나 검열 및 불이익을 줄 목적으로 비밀리에 작성한\n‘블랙리스트’ 사건으로 2017년 7월 문체부와 문화예술계는 ‘문화예술계\n블랙리스트 진상조사 및 제도개선위원회’를 설치하였고, 2018년 6월\n책임 규명 권고안을 심의ㆍ의결하여 문체부는 수사 의뢰와 징계절차\n에 착수해 총 85개의 과제를 제시하면서, 문화행정의 개선을 위해서\n“참여와 협치의 원칙”과 “정보공개의 책임”을 「문화기본법」에 명시\n\n\n\n하도록 권고한 바 있음.\n윤석열 제20대 대통령도 영화배우를 비롯한 예술인과의 만남에서\n‘지원은 하되, 간섭은 하지 않는다’라고 문화예술분야에 대한 국정철학\n을 밝혔음.\n그러나 지난 2023년 부천에서 열린 학생만화 공모전에서 금상을 수\n상한 고등학생의 작품에 대해 문화체육관광부는 해당 작품 선정을 두\n고 관련 기관에 엄중 경고와 후원명칭 사용 금지에 대한 사건이 발생\n함. 이뿐만이 아니라 윤석열 정부 출범 이후 지방자치단체에서도 문화\n예술 검열 논란이 끊이질 않고 있어 문화예술계에서는 ‘블랙리스트’의\n악몽이 재현되는 것이 아닌지 걱정하고 있음.\n이에 문화행정에 협치 기반을 조성하고 정책과정의 투명성ㆍ신뢰성\nㆍ객관성을 제고와 「예술인의 지위와 권리의 보장에 관한 법률」 제\n2장 예술표현의 자유 보장 규정에 따라 문화예술인의 자유를 보장할\n필요가 있음.\n이에 국가와 지방자치단체의 책무에 지원은 하되, 간섭하지 않도록\n명시하여 문화예술의 표현의 자유를 침해하지 않도록 하고자 함(안 제\n5조제1항 신설).",
    "제안이유_및_주요내용": "김대중 제15대 대통령은 문화예술에 대해 ‘지원은 하되, 간섭은 하\n지 않는다’라고 밝혔고, 이 정치철학은 김대중 정부 이후 대부분 정권\n에서도 정부의 행정력이 문화예술 분야에 간섭을 자제해왔음.\n그러나 지난 박근혜 정부 당시 문화예술계의 문화예술인에 대해 정\n부의 지원을 끊거나 검열 및 불이익을 줄 목적으로 비밀리에 작성한\n‘블랙리스트’ 사건으로 2017년 7월 문체부와 문화예술계는 ‘문화예술계\n블랙리스트 진상조사 및 제도개선위원회’를 설치하였고, 2018년 6월\n책임 규명 권고안을 심의ㆍ의결하여 문체부는 수사 의뢰와 징계절차\n에 착수해 총 85개의 과제를 제시하면서, 문화행정의 개선을 위해서\n“참여와 협치의 원칙”과 “정보공개의 책임”을 「문화기본법」에 명시\n\n\n\n하도록 권고한 바 있음.\n윤석열 제20대 대통령도 영화배우를 비롯한 예술인과의 만남에서\n‘지원은 하되, 간섭은 하지 않는다’라고 문화예술분야에 대한 국정철학\n을 밝혔음.\n그러나 지난 2023년 부천에서 열린 학생만화 공모전에서 금상을 수\n상한 고등학생의 작품에 대해 문화체육관광부는 해당 작품 선정을 두\n고 관련 기관에 엄중 경고와 후원명칭 사용 금지에 대한 사건이 발생\n함. 이뿐만이 아니라 윤석열 정부 출범 이후 지방자치단체에서도 문화\n예술 검열 논란이 끊이질 않고 있어 문화예술계에서는 ‘블랙리스트’의\n악몽이 재현되는 것이 아닌지 걱정하고 있음.\n이에 문화행정에 협치 기반을 조성하고 정책과정의 투명성ㆍ신뢰성\nㆍ객관성을 제고와 「예술인의 지위와 권리의 보장에 관한 법률」 제\n2장 예술표현의 자유 보장 규정에 따라 문화예술인의 자유를 보장할\n필요가 있음.\n이에 국가와 지방자치단체의 책무에 지원은 하되, 간섭하지 않도록\n명시하여 문화예술의 표현의 자유를 침해하지 않도록 하고자 함(안 제\n5조제1항 신설).",
    "법률_제_호": "문화기본법 일부개정법률안\n문화기본법 일부를 다음과 같이 개정한다.\n제5조제1항부터 제5항까지를 각각 제2항부터 제6항까지로 하고, 같은\n조에 제1항을 다음과 같이 신설한다.\n① 국가와 지방자치단체는 문화의 진흥을 위하여 지원하되 그 내용\n에 대하여 간섭하지 아니하도록 하여야 한다.",
    "신구조문대비표": "현 행 개 정 안\n제5조(국가와 지방자치단체의 책 제5조(국가와 지방자치단체의 책\n무) <신 설> 무) ① 국가와 지방자치단체는\n문화의 진흥을 위하여 지원하\n되 그 내용에 대하여 간섭하지\n아니하도록 하여야 한다.\n① ∼ ⑤ (생 략) ② ∼ ⑥ (현행 제1항부터 제5\n항까지와 같음)"
  }
}