{
  "title": "2200621_예금자보호법_일부개정법률안",
  "bill_number": "621",
  "proposal_date": "2024. 6. 19.",
  "submission_date": "",
  "is_alternative": false,
  "alternative_bill_numbers": [],
  "has_comparison_table": false,
  "comparison_table": "신·구조문대비표\n현 행 개 정 안\n제5조의2(사무소) ① 공사는 주된 제5조의2(사무소) ① --------\n사무소를 서울특별시에 둔다. --------부산광역시------.\n② (생 략) ② (현행과 같음)",
  "full_text": "예금자보호법 일부개정법률안\n(이성권의원 대표발의)\n발의연월일 : 2024. 6. 19.\n의 안\n621\n번 호 발 의 자 : 이성권ㆍ백종헌ㆍ곽규택\n주진우ㆍ이헌승ㆍ김미애\n정연욱ㆍ조승환ㆍ김도읍\n박성훈ㆍ김희정ㆍ김대식\n서지영ㆍ조경태ㆍ정동만\n구자근ㆍ정성국 의원\n(17인)\n제안이유 및 주요내용\n지역 간 불균형 해소 특히 수도권과 지방 간 격차 해소 목적으로 2\n004년 「국가균형발전 특별법」과 2007년 「혁신도시 조성 및 발전에\n관한 특별법」이 마련되었음. 이를 바탕으로 1차 공공기관 이전이 이\n뤄졌음. 1차 공공기관 이전은 지역별 특화 산업 육성이라는 취지로 진\n행됐음.\n부산은 2009년에 금융중심지로 지정됐던 만큼 한국주택금융공사, 한\n국예탁결제원, 한국자산관리공사 등의 금융기관이 해양 분야 공공기관\n과 함께 부산으로 이전하였음. 부산은 2009년에 금융중심지로 지정됐\n던 만큼 한국주택금융공사, 한국예탁결제원, 한국자산관리공사 등의\n금융기관이 해양 분야 공공기관과 함께 부산으로 이전하였음. 이에 금\n\n\n\n융중심지로서 부산의 위상을 보다 확고히 하기 위해 국내의 굵직한\n금융기관들이 선제적으로 부산으로 이전하여 안정적인 금융생태계를\n조성할 필요성이 제기되고 있음.\nKDB산업은행, IBK중소기업은행, 한국수출입은행과 함께 예금자\n보호 및 금융제도 안정을 목적으로 하는 국책기관인 예금보험공사를\n부산으로 이전하여 부산의 금융생태계 조성의 견인차가 되도록 하고,\n금융중심지로서 국제적 위상을 높일 수 있어야 한다는 의견이 제시되\n고 있음.\n국가균형발전은 중차대한 국가적 과제가 되었음. 예금보험공사의 부\n산 이전은 지역별 특화를 고려한 공공기관의 고른 지역별 분배와 지\n역 간 격차 해소를 통해 달성하려는 국가균형발전의 취지에도 부합할\n것임.\n이에 예금보험공사의 주된 사무소를 부산광역시에 두도록 법률을\n개정함으로써 부산광역시가 금융중심지로서 위상을 확고히 하고, 궁극\n적으로는 국가균형발전이라는 목표에 부합하고자 하려는 것임(안 제5\n조의2제1항).\n\n법률 제 호\n예금자보호법 일부개정법률안\n예금자보호법 일부를 다음과 같이 개정한다.\n제5조의2제1항 중 “서울특별시”를 “부산광역시”로 한다.\n부 칙\n제1조(시행일) 이 법은 공포 후 6개월이 경과한 날부터 시행한다. 다\n만, 부칙 제2조는 공포한 날부터 시행한다.\n제2조(본점 이전에 관한 준비행위 등) 예금보험공사는 이 법 공포일부\n터 2개월 이내에 본점 이전에 관한 계획을 수립하여야 한다.\n\n\n\n\n신·구조문대비표\n현 행 개 정 안\n제5조의2(사무소) ① 공사는 주된 제5조의2(사무소) ① --------\n사무소를 서울특별시에 둔다. --------부산광역시------.\n② (생 략) ② (현행과 같음)\n",
  "sections": {
    "제안이유": "및",
    "주요내용": "지역 간 불균형 해소 특히 수도권과 지방 간 격차 해소 목적으로 2\n004년 「국가균형발전 특별법」과 2007년 「혁신도시 조성 및 발전에\n관한 특별법」이 마련되었음. 이를 바탕으로 1차 공공기관 이전이 이\n뤄졌음. 1차 공공기관 이전은 지역별 특화 산업 육성이라는 취지로 진\n행됐음.\n부산은 2009년에 금융중심지로 지정됐던 만큼 한국주택금융공사, 한\n국예탁결제원, 한국자산관리공사 등의 금융기관이 해양 분야 공공기관\n과 함께 부산으로 이전하였음. 부산은 2009년에 금융중심지로 지정됐\n던 만큼 한국주택금융공사, 한국예탁결제원, 한국자산관리공사 등의\n금융기관이 해양 분야 공공기관과 함께 부산으로 이전하였음. 이에 금\n\n\n\n융중심지로서 부산의 위상을 보다 확고히 하기 위해 국내의 굵직한\n금융기관들이 선제적으로 부산으로 이전하여 안정적인 금융생태계를\n조성할 필요성이 제기되고 있음.\nKDB산업은행, IBK중소기업은행, 한국수출입은행과 함께 예금자\n보호 및 금융제도 안정을 목적으로 하는 국책기관인 예금보험공사를\n부산으로 이전하여 부산의 금융생태계 조성의 견인차가 되도록 하고,\n금융중심지로서 국제적 위상을 높일 수 있어야 한다는 의견이 제시되\n고 있음.\n국가균형발전은 중차대한 국가적 과제가 되었음. 예금보험공사의 부\n산 이전은 지역별 특화를 고려한 공공기관의 고른 지역별 분배와 지\n역 간 격차 해소를 통해 달성하려는 국가균형발전의 취지에도 부합할\n것임.\n이에 예금보험공사의 주된 사무소를 부산광역시에 두도록 법률을\n개정함으로써 부산광역시가 금융중심지로서 위상을 확고히 하고, 궁극\n적으로는 국가균형발전이라는 목표에 부합하고자 하려는 것임(안 제5\n조의2제1항).",
    "제안이유_및_주요내용": "지역 간 불균형 해소 특히 수도권과 지방 간 격차 해소 목적으로 2\n004년 「국가균형발전 특별법」과 2007년 「혁신도시 조성 및 발전에\n관한 특별법」이 마련되었음. 이를 바탕으로 1차 공공기관 이전이 이\n뤄졌음. 1차 공공기관 이전은 지역별 특화 산업 육성이라는 취지로 진\n행됐음.\n부산은 2009년에 금융중심지로 지정됐던 만큼 한국주택금융공사, 한\n국예탁결제원, 한국자산관리공사 등의 금융기관이 해양 분야 공공기관\n과 함께 부산으로 이전하였음. 부산은 2009년에 금융중심지로 지정됐\n던 만큼 한국주택금융공사, 한국예탁결제원, 한국자산관리공사 등의\n금융기관이 해양 분야 공공기관과 함께 부산으로 이전하였음. 이에 금\n\n\n\n융중심지로서 부산의 위상을 보다 확고히 하기 위해 국내의 굵직한\n금융기관들이 선제적으로 부산으로 이전하여 안정적인 금융생태계를\n조성할 필요성이 제기되고 있음.\nKDB산업은행, IBK중소기업은행, 한국수출입은행과 함께 예금자\n보호 및 금융제도 안정을 목적으로 하는 국책기관인 예금보험공사를\n부산으로 이전하여 부산의 금융생태계 조성의 견인차가 되도록 하고,\n금융중심지로서 국제적 위상을 높일 수 있어야 한다는 의견이 제시되\n고 있음.\n국가균형발전은 중차대한 국가적 과제가 되었음. 예금보험공사의 부\n산 이전은 지역별 특화를 고려한 공공기관의 고른 지역별 분배와 지\n역 간 격차 해소를 통해 달성하려는 국가균형발전의 취지에도 부합할\n것임.\n이에 예금보험공사의 주된 사무소를 부산광역시에 두도록 법률을\n개정함으로써 부산광역시가 금융중심지로서 위상을 확고히 하고, 궁극\n적으로는 국가균형발전이라는 목표에 부합하고자 하려는 것임(안 제5\n조의2제1항).",
    "법률_제_호": "예금자보호법 일부개정법률안\n예금자보호법 일부를 다음과 같이 개정한다.\n제5조의2제1항 중 “서울특별시”를 “부산광역시”로 한다.",
    "신구조문대비표": "현 행 개 정 안\n제5조의2(사무소) ① 공사는 주된 제5조의2(사무소) ① --------\n사무소를 서울특별시에 둔다. --------부산광역시------.\n② (생 략) ② (현행과 같음)"
  }
}