{
  "title": "2200266_지방자치단체_기금관리기본법_일부개정법률안",
  "bill_number": "266",
  "proposal_date": "2024. 6. 10.",
  "submission_date": "",
  "is_alternative": false,
  "alternative_bill_numbers": [],
  "has_comparison_table": false,
  "comparison_table": "신ㆍ구조문대비표\n현 행 개 정 안\n제23조(지방소멸대응기금의 재 제23조(지방소멸대응기금의 재\n원) (생 략) 원) (현행과 같음)\n1. 정부출연금 1조원 1. 정부출연금 2조원\n2. (생 략) 2. (현행과 같음)",
  "full_text": "지방자치단체 기금관리기본법 일부개정법률안\n(이개호의원 대표발의)\n발의연월일 : 2024. 6. 10.\n의 안\n266\n번 호 발 의 자 : 이개호ㆍ이정문ㆍ위성곤\n어기구ㆍ임호선ㆍ조인철\n문금주ㆍ김병기ㆍ박지혜\n김영호 의원(10인)\n제안이유 및 주요내용\n우리나라 합계출산율은 0.7명으로 유례없는 출산율 감소로 2021년을\n기준으로 72년만에 절대 인구가 줄기 시작하면서 이로인한 농어촌지\n역과 지방이 소멸에 직면하고 있음. 그동안 정부는 지방소멸 위기극복\n을 위한 다양한 정책(청년지원, 귀농귀촌, 출산지원)을 추진해 왔지만\n인구감소 및 수도권 집중을 막지 못한 것이 현실임.\n이제는 출산율 제고, 인구유출방지라는 단순한 접근보다는 그동안\n중앙정부에서 획일적으로 추진해온 지방인구감소 방지정책에서 벗어\n나 위기의 당사자인 지방이 주도하면서 일시적 처방이 아닌 장기적\n호흡으로 문제를 풀어나갈 수 있도록 중앙정부 차원에서 지속적인 지\n원과 보장이 이루어져야 함.\n정부는 「인구감소지역 지원 특별법」 시행에 따라 「지방자치단체\n기금관리기본법」에서 지방소멸대응기금을 조성하여 운용해 오고 있\n음. 그러나 현행 「지방자치단체 기금관리기본법」은 2031년까지 한시\n\n\n\n적으로 운영되도록 규정하고 있고 그 재원도 매년 1조원 수준에 그치\n고 있음.\n이로인해 사업의 주체인 지자체에서 장기적이고 안정적인 사업을\n발굴하고 추진할 수 없어 연례적으로 소규모 사업만 반복하고 있는\n실정임.\n또한 재원의 규모도 전국 지자체에 1조원 수준의 예산만 지원하고\n있어 인구감소 현상이 심각한 지자체들이 충분한 대책을 수립하기에\n는 역부족인 현실임.\n이에 기금의 재원 규모를 2배로 확대하고 2031년까지 되어 있는 한\n시성을 폐지하여 농어촌지역과 지방의 인구소멸 방지 대책을 효과적\n으로 추진하기 위한 근거를 마련하려는 것임(안 제23조제1호 등).\n\n법률 제 호\n지방자치단체 기금관리기본법 일부개정법률안\n지방자치단체 기금관리기본법 일부를 다음과 같이 개정한다.\n제23조제1호를 다음과 같이 한다.\n1. 정부출연금 2조원\n법률 제18545호 지방자치단체 기금관리기본법 부칙 제2조제2항을 삭\n제한다.\n부 칙\n제1조(시행일) 이 법은 공포한 날부터 시행한다.\n제2조(지방소멸대응기금의 재원에 관한 특례) 제23조제1호의 개정규정\n에도 불구하고 2025회계 연도의 정부출연금은 1조원으로 한다.\n\n\n\n\n신ㆍ구조문대비표\n현 행 개 정 안\n제23조(지방소멸대응기금의 재 제23조(지방소멸대응기금의 재\n원) (생 략) 원) (현행과 같음)\n1. 정부출연금 1조원 1. 정부출연금 2조원\n2. (생 략) 2. (현행과 같음)\n",
  "sections": {
    "제안이유": "및",
    "주요내용": "우리나라 합계출산율은 0.7명으로 유례없는 출산율 감소로 2021년을\n기준으로 72년만에 절대 인구가 줄기 시작하면서 이로인한 농어촌지\n역과 지방이 소멸에 직면하고 있음. 그동안 정부는 지방소멸 위기극복\n을 위한 다양한 정책(청년지원, 귀농귀촌, 출산지원)을 추진해 왔지만\n인구감소 및 수도권 집중을 막지 못한 것이 현실임.\n이제는 출산율 제고, 인구유출방지라는 단순한 접근보다는 그동안\n중앙정부에서 획일적으로 추진해온 지방인구감소 방지정책에서 벗어\n나 위기의 당사자인 지방이 주도하면서 일시적 처방이 아닌 장기적\n호흡으로 문제를 풀어나갈 수 있도록 중앙정부 차원에서 지속적인 지\n원과 보장이 이루어져야 함.\n정부는 「인구감소지역 지원 특별법」 시행에 따라 「지방자치단체\n기금관리기본법」에서 지방소멸대응기금을 조성하여 운용해 오고 있\n음. 그러나 현행 「지방자치단체 기금관리기본법」은 2031년까지 한시\n\n\n\n적으로 운영되도록 규정하고 있고 그 재원도 매년 1조원 수준에 그치\n고 있음.\n이로인해 사업의 주체인 지자체에서 장기적이고 안정적인 사업을\n발굴하고 추진할 수 없어 연례적으로 소규모 사업만 반복하고 있는\n실정임.\n또한 재원의 규모도 전국 지자체에 1조원 수준의 예산만 지원하고\n있어 인구감소 현상이 심각한 지자체들이 충분한 대책을 수립하기에\n는 역부족인 현실임.\n이에 기금의 재원 규모를 2배로 확대하고 2031년까지 되어 있는 한\n시성을 폐지하여 농어촌지역과 지방의 인구소멸 방지 대책을 효과적\n으로 추진하기 위한 근거를 마련하려는 것임(안 제23조제1호 등).",
    "제안이유_및_주요내용": "우리나라 합계출산율은 0.7명으로 유례없는 출산율 감소로 2021년을\n기준으로 72년만에 절대 인구가 줄기 시작하면서 이로인한 농어촌지\n역과 지방이 소멸에 직면하고 있음. 그동안 정부는 지방소멸 위기극복\n을 위한 다양한 정책(청년지원, 귀농귀촌, 출산지원)을 추진해 왔지만\n인구감소 및 수도권 집중을 막지 못한 것이 현실임.\n이제는 출산율 제고, 인구유출방지라는 단순한 접근보다는 그동안\n중앙정부에서 획일적으로 추진해온 지방인구감소 방지정책에서 벗어\n나 위기의 당사자인 지방이 주도하면서 일시적 처방이 아닌 장기적\n호흡으로 문제를 풀어나갈 수 있도록 중앙정부 차원에서 지속적인 지\n원과 보장이 이루어져야 함.\n정부는 「인구감소지역 지원 특별법」 시행에 따라 「지방자치단체\n기금관리기본법」에서 지방소멸대응기금을 조성하여 운용해 오고 있\n음. 그러나 현행 「지방자치단체 기금관리기본법」은 2031년까지 한시\n\n\n\n적으로 운영되도록 규정하고 있고 그 재원도 매년 1조원 수준에 그치\n고 있음.\n이로인해 사업의 주체인 지자체에서 장기적이고 안정적인 사업을\n발굴하고 추진할 수 없어 연례적으로 소규모 사업만 반복하고 있는\n실정임.\n또한 재원의 규모도 전국 지자체에 1조원 수준의 예산만 지원하고\n있어 인구감소 현상이 심각한 지자체들이 충분한 대책을 수립하기에\n는 역부족인 현실임.\n이에 기금의 재원 규모를 2배로 확대하고 2031년까지 되어 있는 한\n시성을 폐지하여 농어촌지역과 지방의 인구소멸 방지 대책을 효과적\n으로 추진하기 위한 근거를 마련하려는 것임(안 제23조제1호 등).",
    "법률_제_호": "지방자치단체 기금관리기본법 일부개정법률안\n지방자치단체 기금관리기본법 일부를 다음과 같이 개정한다.\n제23조제1호를 다음과 같이 한다.\n1. 정부출연금 2조원\n법률 제18545호 지방자치단체 기금관리기본법",
    "신구조문대비표": "현 행 개 정 안\n제23조(지방소멸대응기금의 재 제23조(지방소멸대응기금의 재\n원) (생 략) 원) (현행과 같음)\n1. 정부출연금 1조원 1. 정부출연금 2조원\n2. (생 략) 2. (현행과 같음)"
  }
}