{
  "title": "2200609_국민연금법_일부개정법률안",
  "bill_number": "609",
  "proposal_date": "2024. 6. 18.",
  "submission_date": "",
  "is_alternative": false,
  "alternative_bill_numbers": [],
  "has_comparison_table": false,
  "comparison_table": "신ㆍ구조문대비표\n현 행 개 정 안\n제3조의2(국가의 책무) 국가는 이 제3조의2(국가의 책무) ---------\n법에 따른 연금급여가 안정적 -----------연금급여가 안정적\nㆍ지속적으로 지급되도록 필요 ㆍ지속적으로 지급되도록 보장\n한 시책을 수립ㆍ시행하여야 하여야 한다.\n한다.",
  "full_text": "국민연금법 일부개정법률안\n(소병훈의원 대표발의)\n발의연월일 : 2024. 6. 18.\n의 안\n609\n번 호 발 의 자 : 소병훈ㆍ허 영ㆍ정성호\n김영진ㆍ김교흥ㆍ이원택\n박 정ㆍ이수진ㆍ서영석\n서삼석 의원(10인)\n제안이유 및 주요내용\n현행법에서는 국가의 책무로서 “연금급여가 안정적ㆍ지속적으로 지\n급되도록 필요한 시책을 수립ㆍ시행”할 것을 규정할 뿐, 다른 직역연\n금의 예와 같이 급여 비용 충당이 어려운 경우 국가가 지급을 의무적\n으로 보장하는 명시적 형태의 규정은 두지 아니하고 있음.\n국민연금의 적립금 감소 및 고갈이 전망되어 재정의 지속가능성에\n대한 문제 제기가 이루어지고 있는 상황에서, 국민연금급여의 안정적\n이고 지속적인 지급을 국가가 보장한다는 점을 명확하게 법률에 규정\n할 필요가 있다는 의견이 제기됨.\n이에 국가의 지급보장을 명문화하려는 것임(안 제3조의2).\n\n\n\n\n법률 제 호\n국민연금법 일부개정법률안\n국민연금법 일부를 다음과 같이 개정한다.\n제3조의2 중 “연금급여가 안정적ㆍ지속적으로 지급되도록 필요한 시\n책을 수립ㆍ시행하여야 한다”를 “연금급여가 안정적ㆍ지속적으로 지급\n되도록 보장하여야 한다”로 한다.\n부 칙\n이 법은 공포한 날부터 시행한다.\n\n\n\n\n신ㆍ구조문대비표\n현 행 개 정 안\n제3조의2(국가의 책무) 국가는 이 제3조의2(국가의 책무) ---------\n법에 따른 연금급여가 안정적 -----------연금급여가 안정적\nㆍ지속적으로 지급되도록 필요 ㆍ지속적으로 지급되도록 보장\n한 시책을 수립ㆍ시행하여야 하여야 한다.\n한다.\n",
  "sections": {
    "제안이유": "및",
    "주요내용": "현행법에서는 국가의 책무로서 “연금급여가 안정적ㆍ지속적으로 지\n급되도록 필요한 시책을 수립ㆍ시행”할 것을 규정할 뿐, 다른 직역연\n금의 예와 같이 급여 비용 충당이 어려운 경우 국가가 지급을 의무적\n으로 보장하는 명시적 형태의 규정은 두지 아니하고 있음.\n국민연금의 적립금 감소 및 고갈이 전망되어 재정의 지속가능성에\n대한 문제 제기가 이루어지고 있는 상황에서, 국민연금급여의 안정적\n이고 지속적인 지급을 국가가 보장한다는 점을 명확하게 법률에 규정\n할 필요가 있다는 의견이 제기됨.\n이에 국가의 지급보장을 명문화하려는 것임(안 제3조의2).",
    "제안이유_및_주요내용": "현행법에서는 국가의 책무로서 “연금급여가 안정적ㆍ지속적으로 지\n급되도록 필요한 시책을 수립ㆍ시행”할 것을 규정할 뿐, 다른 직역연\n금의 예와 같이 급여 비용 충당이 어려운 경우 국가가 지급을 의무적\n으로 보장하는 명시적 형태의 규정은 두지 아니하고 있음.\n국민연금의 적립금 감소 및 고갈이 전망되어 재정의 지속가능성에\n대한 문제 제기가 이루어지고 있는 상황에서, 국민연금급여의 안정적\n이고 지속적인 지급을 국가가 보장한다는 점을 명확하게 법률에 규정\n할 필요가 있다는 의견이 제기됨.\n이에 국가의 지급보장을 명문화하려는 것임(안 제3조의2).",
    "법률_제_호": "국민연금법 일부개정법률안\n국민연금법 일부를 다음과 같이 개정한다.\n제3조의2 중 “연금급여가 안정적ㆍ지속적으로 지급되도록 필요한 시\n책을 수립ㆍ시행하여야 한다”를 “연금급여가 안정적ㆍ지속적으로 지급\n되도록 보장하여야 한다”로 한다.",
    "신구조문대비표": "현 행 개 정 안\n제3조의2(국가의 책무) 국가는 이 제3조의2(국가의 책무) ---------\n법에 따른 연금급여가 안정적 -----------연금급여가 안정적\nㆍ지속적으로 지급되도록 필요 ㆍ지속적으로 지급되도록 보장\n한 시책을 수립ㆍ시행하여야 하여야 한다.\n한다."
  }
}