{
  "title": "2200461_방송통신위원회의_설치_및_운영에_관한_법률_일부개정법률안",
  "bill_number": "461",
  "proposal_date": "2024. 6. 13.",
  "submission_date": "",
  "is_alternative": false,
  "alternative_bill_numbers": [],
  "has_comparison_table": false,
  "comparison_table": "신·구조문대비표\n현 행 개 정 안\n제13조(회의) ① (생 략) 제13조(회의) ① (현행과 같음)\n② 위원회의 회의는 재적위원 ② ----------------4인 이상\n과반수의 찬성으로 의결한다. 의 위원의 출석으로 개의하고,\n출석위원--------------------\n------.\n③ ∼ ⑦ (생 략) ③ ∼ ⑦ (현행과 같음)",
  "full_text": "방송통신위원회의 설치 및 운영에 관한 법률\n일부개정법률안\n(한준호의원 발의)\n발의연월일 : 2024. 6. 13.\n의 안\n461\n번 호\n발 의 자 : 한준호 의원\n찬 성 자 : 169인\n제안이유 및 주요내용\n현행법에 따르면 방송통신위원회 위원(이하 “위원”이라 함)은 방송\nㆍ정보통신 분야의 전문성 등을 고려하여 대통령이 임명하되, 위원 5\n인 중 위원장을 포함한 2인은 대통령이 지명하고, 위원 3인은 국회에\n서 추천함. 또한, 방송통신위원회의 회의는 2인 이상의 위원의 요구가\n있는 때에 소집되어 재적위원 과반수의 찬성으로 의결함.\n그런데 방송통신위원회 회의의 경우 개의에 필요한 최소한의 출석\n인원 수를 정하고 있지 아니하여 대통령이 지명한 2인의 출석만으로\n도 의결이 가능하다는 점에서 의결을 위한 의사정족수 도입이 필요하\n다는 지적이 제기됨.\n이에 방송통신위원회의 회의는 4인 이상의 위원의 출석으로 개의하\n고, 출석위원 과반수의 찬성으로 의결하도록 회의운영과 관련된 규정\n을 정비하려는 것임(안 제13조제2항).\n\n\n\n\n법률 제 호\n방송통신위원회의 설치 및 운영에 관한 법률\n일부개정법률안\n방송통신위원회의 설치 및 운영에 관한 법률 일부를 다음과 같이 개\n정한다.\n제13조제2항 중 “재적위원”을 “4인 이상의 위원의 출석으로 개의하고,\n출석위원”으로 한다.\n부 칙\n이 법은 공포한 날부터 시행한다.\n\n\n\n\n신·구조문대비표\n현 행 개 정 안\n제13조(회의) ① (생 략) 제13조(회의) ① (현행과 같음)\n② 위원회의 회의는 재적위원 ② ----------------4인 이상\n과반수의 찬성으로 의결한다. 의 위원의 출석으로 개의하고,\n출석위원--------------------\n------.\n③ ∼ ⑦ (생 략) ③ ∼ ⑦ (현행과 같음)\n",
  "sections": {
    "제안이유": "및",
    "주요내용": "현행법에 따르면 방송통신위원회 위원(이하 “위원”이라 함)은 방송\nㆍ정보통신 분야의 전문성 등을 고려하여 대통령이 임명하되, 위원 5\n인 중 위원장을 포함한 2인은 대통령이 지명하고, 위원 3인은 국회에\n서 추천함. 또한, 방송통신위원회의 회의는 2인 이상의 위원의 요구가\n있는 때에 소집되어 재적위원 과반수의 찬성으로 의결함.\n그런데 방송통신위원회 회의의 경우 개의에 필요한 최소한의 출석\n인원 수를 정하고 있지 아니하여 대통령이 지명한 2인의 출석만으로\n도 의결이 가능하다는 점에서 의결을 위한 의사정족수 도입이 필요하\n다는 지적이 제기됨.\n이에 방송통신위원회의 회의는 4인 이상의 위원의 출석으로 개의하\n고, 출석위원 과반수의 찬성으로 의결하도록 회의운영과 관련된 규정\n을 정비하려는 것임(안 제13조제2항).",
    "제안이유_및_주요내용": "현행법에 따르면 방송통신위원회 위원(이하 “위원”이라 함)은 방송\nㆍ정보통신 분야의 전문성 등을 고려하여 대통령이 임명하되, 위원 5\n인 중 위원장을 포함한 2인은 대통령이 지명하고, 위원 3인은 국회에\n서 추천함. 또한, 방송통신위원회의 회의는 2인 이상의 위원의 요구가\n있는 때에 소집되어 재적위원 과반수의 찬성으로 의결함.\n그런데 방송통신위원회 회의의 경우 개의에 필요한 최소한의 출석\n인원 수를 정하고 있지 아니하여 대통령이 지명한 2인의 출석만으로\n도 의결이 가능하다는 점에서 의결을 위한 의사정족수 도입이 필요하\n다는 지적이 제기됨.\n이에 방송통신위원회의 회의는 4인 이상의 위원의 출석으로 개의하\n고, 출석위원 과반수의 찬성으로 의결하도록 회의운영과 관련된 규정\n을 정비하려는 것임(안 제13조제2항).",
    "법률_제_호": "방송통신위원회의 설치 및 운영에 관한 법률\n일부개정법률안\n방송통신위원회의 설치 및 운영에 관한 법률 일부를 다음과 같이 개\n정한다.\n제13조제2항 중 “재적위원”을 “4인 이상의 위원의 출석으로 개의하고,\n출석위원”으로 한다.",
    "신구조문대비표": "현 행 개 정 안\n제13조(회의) ① (생 략) 제13조(회의) ① (현행과 같음)\n② 위원회의 회의는 재적위원 ② ----------------4인 이상\n과반수의 찬성으로 의결한다. 의 위원의 출석으로 개의하고,\n출석위원--------------------\n------.\n③ ∼ ⑦ (생 략) ③ ∼ ⑦ (현행과 같음)"
  }
}