{
  "title": "2200627_국가배상법_일부개정법률안",
  "bill_number": "627",
  "proposal_date": "2024. 6. 19.",
  "submission_date": "",
  "is_alternative": false,
  "alternative_bill_numbers": [],
  "has_comparison_table": false,
  "comparison_table": "신·구조문대비표\n현 행 개 정 안\n제2조(배상책임) ①ㆍ② (생 략) 제2조(배상책임) ①ㆍ② (현행과\n같음)\n<신 설> ③ 제1항 단서에도 불구하고\n전사하거나 순직한 군인ㆍ군무\n원ㆍ경찰공무원 또는 예비군대\n원의 유족은 자신의 정신적 고\n통에 대한 위자료를 청구할 수\n있다.",
  "full_text": "국가배상법 일부개정법률안\n(신장식의원 대표발의)\n발의연월일 : 2024. 6. 19.\n의 안\n627\n번 호 발 의 자 : 신장식ㆍ정춘생ㆍ조 국\n김준형ㆍ이해민ㆍ차규근\n박은정ㆍ김재원ㆍ김선민\n강경숙ㆍ서왕진ㆍ황운하\n의원(12인)\n제안이유 및 주요내용\n현행법에 따를 때, 일반적으로 공무원 등의 불법행위로 인해 발생한\n사망사건의 경우에는 사망으로 인해 경제적 손해에 따른 배상 뿐 아\n니라 사망한 피해자의 유족이 입은 정신적 고통에 대한 위자료에 대\n해서도 국가에 대한 배상청구가 가능함\n하지만 사망자가 군인 등인 경우 다른 법령에 따라 보상을 받는 경\n우, 그 유족은 「민법」 및 「국가배상법」에 따른 손해배상을 청구할\n수 없게 되는데, 그에 따라 군인 등의 유족이 정신적 고통에 대한 위\n자료를 청구하는 것도 제한되고 있음. 또한, 다른 법령에 따른 보상을\n받을 수 있을 때에는 실제 수령 여부와 무관하게 「국가배상법」에\n따른 배상을 받을 수 없도록 하고 있으므로, 다른 법령에 따른 보상을\n거부하고 정신적 고통에 대한 위자료를 포함한 국가배상을 청구하는\n것은 자체가 불가능한 상황임.\n\n\n\n이에 전사하거나 순직한 군인 등의 유족이 가지는 고유의 위자료\n청구권은 군인 등 본인의 청구권과는 별개의 독립적인 청구권이므로\n앞으로는 전사하거나 순직한 군인 등의 유족은 자신의 정신적 고통에\n대한 위자료 청구권을 행사할 수 있도록 하려는 것임(안 제2조).\n\n법률 제 호\n국가배상법 일부개정법률안\n국가배상법 일부를 다음과 같이 개정한다.\n제2조에 제3항을 다음과 같이 신설한다.\n③ 제1항 단서에도 불구하고 전사하거나 순직한 군인ㆍ군무원ㆍ경\n찰공무원 또는 예비군대원의 유족은 자신의 정신적 고통에 대한 위\n자료를 청구할 수 있다.\n부 칙\n제1조(시행일) 이 법은 공포한 날부터 시행한다.\n제2조(유족의 위자료에 관한 적용례) ① 제2조제3항의 개정규정은 이\n법 시행 이후 군인ㆍ군무원ㆍ경찰공무원 또는 예비군대원이 전투ㆍ\n훈련 등 직무 집행과 관련하여 전사하거나 순직한 경우부터 적용한\n다.\n② 제1항에도 불구하고 이 법 시행 당시 본부심의회, 특별심의회 또\n는 지구심의회에 계속 중인 사건과 법원에 계속 중인 소송사건에\n대해서는 제2조제3항의 개정규정을 적용한다.\n\n\n신·구조문대비표\n현 행 개 정 안\n제2조(배상책임) ①ㆍ② (생 략) 제2조(배상책임) ①ㆍ② (현행과\n같음)\n<신 설> ③ 제1항 단서에도 불구하고\n전사하거나 순직한 군인ㆍ군무\n원ㆍ경찰공무원 또는 예비군대\n원의 유족은 자신의 정신적 고\n통에 대한 위자료를 청구할 수\n있다.\n",
  "sections": {
    "제안이유": "및",
    "주요내용": "현행법에 따를 때, 일반적으로 공무원 등의 불법행위로 인해 발생한\n사망사건의 경우에는 사망으로 인해 경제적 손해에 따른 배상 뿐 아\n니라 사망한 피해자의 유족이 입은 정신적 고통에 대한 위자료에 대\n해서도 국가에 대한 배상청구가 가능함\n하지만 사망자가 군인 등인 경우 다른 법령에 따라 보상을 받는 경\n우, 그 유족은 「민법」 및 「국가배상법」에 따른 손해배상을 청구할\n수 없게 되는데, 그에 따라 군인 등의 유족이 정신적 고통에 대한 위\n자료를 청구하는 것도 제한되고 있음. 또한, 다른 법령에 따른 보상을\n받을 수 있을 때에는 실제 수령 여부와 무관하게 「국가배상법」에\n따른 배상을 받을 수 없도록 하고 있으므로, 다른 법령에 따른 보상을\n거부하고 정신적 고통에 대한 위자료를 포함한 국가배상을 청구하는\n것은 자체가 불가능한 상황임.\n\n\n\n이에 전사하거나 순직한 군인 등의 유족이 가지는 고유의 위자료\n청구권은 군인 등 본인의 청구권과는 별개의 독립적인 청구권이므로\n앞으로는 전사하거나 순직한 군인 등의 유족은 자신의 정신적 고통에\n대한 위자료 청구권을 행사할 수 있도록 하려는 것임(안 제2조).",
    "제안이유_및_주요내용": "현행법에 따를 때, 일반적으로 공무원 등의 불법행위로 인해 발생한\n사망사건의 경우에는 사망으로 인해 경제적 손해에 따른 배상 뿐 아\n니라 사망한 피해자의 유족이 입은 정신적 고통에 대한 위자료에 대\n해서도 국가에 대한 배상청구가 가능함\n하지만 사망자가 군인 등인 경우 다른 법령에 따라 보상을 받는 경\n우, 그 유족은 「민법」 및 「국가배상법」에 따른 손해배상을 청구할\n수 없게 되는데, 그에 따라 군인 등의 유족이 정신적 고통에 대한 위\n자료를 청구하는 것도 제한되고 있음. 또한, 다른 법령에 따른 보상을\n받을 수 있을 때에는 실제 수령 여부와 무관하게 「국가배상법」에\n따른 배상을 받을 수 없도록 하고 있으므로, 다른 법령에 따른 보상을\n거부하고 정신적 고통에 대한 위자료를 포함한 국가배상을 청구하는\n것은 자체가 불가능한 상황임.\n\n\n\n이에 전사하거나 순직한 군인 등의 유족이 가지는 고유의 위자료\n청구권은 군인 등 본인의 청구권과는 별개의 독립적인 청구권이므로\n앞으로는 전사하거나 순직한 군인 등의 유족은 자신의 정신적 고통에\n대한 위자료 청구권을 행사할 수 있도록 하려는 것임(안 제2조).",
    "법률_제_호": "국가배상법 일부개정법률안\n국가배상법 일부를 다음과 같이 개정한다.\n제2조에 제3항을 다음과 같이 신설한다.\n③ 제1항 단서에도 불구하고 전사하거나 순직한 군인ㆍ군무원ㆍ경\n찰공무원 또는 예비군대원의 유족은 자신의 정신적 고통에 대한 위\n자료를 청구할 수 있다.",
    "신구조문대비표": "현 행 개 정 안\n제2조(배상책임) ①ㆍ② (생 략) 제2조(배상책임) ①ㆍ② (현행과\n같음)\n<신 설> ③ 제1항 단서에도 불구하고\n전사하거나 순직한 군인ㆍ군무\n원ㆍ경찰공무원 또는 예비군대\n원의 유족은 자신의 정신적 고\n통에 대한 위자료를 청구할 수\n있다."
  }
}