{
  "title": "2200986_공휴일에_관한_법률_일부개정법률안",
  "bill_number": "986",
  "proposal_date": "2024. 6. 26",
  "submission_date": "",
  "is_alternative": false,
  "alternative_bill_numbers": [],
  "has_comparison_table": false,
  "comparison_table": "신ㆍ구조문대비표\n현 행 개 정 안\n제2조(공휴일) 공휴일은 다음 각 제2조(공휴일) --------------\n호와 같다. -------.\n1. 「국경일에 관한 법률」에 1. ----------------------\n따른 국경일 중 3ㆍ1절, 광복 ---국경일\n절, 개천절 및 한글날\n2. ∼ 10. (생 략) 2. ∼ 10. (현행과 같음)",
  "full_text": "공휴일에 관한 법률 일부개정법률안\n(임오경의원 대표발의)\n발의연월일 : 2024. 6. 26 .\n의 안\n986\n번 호 발 의 자 : 임오경ㆍ민병덕ㆍ한정애\n한민수ㆍ박 정ㆍ김현정\n서영교ㆍ이연희ㆍ임미애\n강유정 의원(10인)\n제안이유 및 주요내용\n제헌절은 기업의 생산성 저하 등의 이유로 2008년부터 공휴일에서\n제외되어 우리나라 5대 국경일 중 유일하게 공휴일에서 제외되어 있\n음.\n그러나 우리나라의 근간인 헌법을 공포한 날이라는 제헌절의 의미\n를 되새기고 국민의 휴식권을 보장하기 위하여 제헌절을 공휴일로 재\n지정하여야 한다는 의견이 꾸준히 제기되어 왔음.\n이에 제헌절을 공휴일로 지정하여 헌법정신에 대한 국민의식을 제\n고하고 휴식권 보장을 통한 삶의 질 개선을 도모하려는 것임(안 제2조\n제1호).\n\n\n\n\n법률 제 호\n공휴일에 관한 법률 일부개정법률안\n공휴일에 관한 법률 일부를 다음과 같이 개정한다.\n제2조제1호 중 “국경일 중 3ㆍ1절, 광복절, 개천절 및 한글날”을 “국경\n일”로 한다.\n부 칙\n이 법은 2025년 1월 1일부터 시행한다.\n\n\n\n\n신ㆍ구조문대비표\n현 행 개 정 안\n제2조(공휴일) 공휴일은 다음 각 제2조(공휴일) --------------\n호와 같다. -------.\n1. 「국경일에 관한 법률」에 1. ----------------------\n따른 국경일 중 3ㆍ1절, 광복 ---국경일\n절, 개천절 및 한글날\n2. ∼ 10. (생 략) 2. ∼ 10. (현행과 같음)\n",
  "sections": {
    "제안이유": "및",
    "주요내용": "제헌절은 기업의 생산성 저하 등의 이유로 2008년부터 공휴일에서\n제외되어 우리나라 5대 국경일 중 유일하게 공휴일에서 제외되어 있\n음.\n그러나 우리나라의 근간인 헌법을 공포한 날이라는 제헌절의 의미\n를 되새기고 국민의 휴식권을 보장하기 위하여 제헌절을 공휴일로 재\n지정하여야 한다는 의견이 꾸준히 제기되어 왔음.\n이에 제헌절을 공휴일로 지정하여 헌법정신에 대한 국민의식을 제\n고하고 휴식권 보장을 통한 삶의 질 개선을 도모하려는 것임(안 제2조\n제1호).",
    "제안이유_및_주요내용": "제헌절은 기업의 생산성 저하 등의 이유로 2008년부터 공휴일에서\n제외되어 우리나라 5대 국경일 중 유일하게 공휴일에서 제외되어 있\n음.\n그러나 우리나라의 근간인 헌법을 공포한 날이라는 제헌절의 의미\n를 되새기고 국민의 휴식권을 보장하기 위하여 제헌절을 공휴일로 재\n지정하여야 한다는 의견이 꾸준히 제기되어 왔음.\n이에 제헌절을 공휴일로 지정하여 헌법정신에 대한 국민의식을 제\n고하고 휴식권 보장을 통한 삶의 질 개선을 도모하려는 것임(안 제2조\n제1호).",
    "법률_제_호": "공휴일에 관한 법률 일부개정법률안\n공휴일에 관한 법률 일부를 다음과 같이 개정한다.\n제2조제1호 중 “국경일 중 3ㆍ1절, 광복절, 개천절 및 한글날”을 “국경\n일”로 한다.",
    "신구조문대비표": "현 행 개 정 안\n제2조(공휴일) 공휴일은 다음 각 제2조(공휴일) --------------\n호와 같다. -------.\n1. 「국경일에 관한 법률」에 1. ----------------------\n따른 국경일 중 3ㆍ1절, 광복 ---국경일\n절, 개천절 및 한글날\n2. ∼ 10. (생 략) 2. ∼ 10. (현행과 같음)"
  }
}