{
  "title": "2200983_헌법재판소법_일부개정법률안",
  "bill_number": "983",
  "proposal_date": "2024. 6. 26.",
  "submission_date": "",
  "is_alternative": false,
  "alternative_bill_numbers": [],
  "has_comparison_table": false,
  "comparison_table": "신ㆍ구조문대비표\n현 행 개 정 안\n<신 설> 제11조의2(소재지) ① 헌법재판\n소는 광주광역시에 둔다.",
  "full_text": "헌법재판소법 일부개정법률안\n(민형배의원 대표발의)\n발의연월일 : 2024. 6. 26.\n의 안\n983\n번 호 발 의 자 : 민형배ㆍ정준호ㆍ김용민\n박균택ㆍ주철현ㆍ정진욱\n양부남ㆍ임미애ㆍ한준호\n문정복ㆍ김용만ㆍ전진숙\n안도걸ㆍ조인철 의원\n(14인)\n제안이유 및 주요내용\n헌법재판소를 광주로 이전하고자 합니다.\n광주는 일제강점기 광주학생항일운동이 일어난 곳입니다. 1980년 5‧\n18 민주화운동은 1987년 헌법 체제를 탄생케한 밑거름입니다. 헌정질\n서를 수호하는 국가기관인 헌법재판소가 소재하기에 적절합니다. 5·1\n8 광주 정신 계승에도 부합하는 일입니다.\n서울 등 수도권 과밀화 해소와 국가 균형 발전 차원에서 많은 공공\n기관이 지역으로 이전했습니다. 현재 21개 중앙행정기관 부처가 세종\n특별자치시에 위치합니다. 헌법재판소는 헌법상 정치적 중립이 강하게\n요청되는 국가기관입니다. 행정 권력의 중심에서 물리적 거리를 두는\n것이 더 바람직합니다.\n헌법재판소 지역 이전은 위헌 논란도 없습니다. 2004년 10월, 사법\n\n\n\n권 행사 장소는 수도 결정의 필수적 요소가 아니라는 헌재 판결이 나\n왔습니다. 독일 연방헌법재판소도 수도 베를린이 아닌 칼스루에(Karls\nruhe)에 소재합니다.\n이에 헌법재판소의 소재지를 광주광역시에 두고자 합니다. 독립성을\n강화하고 지역균형발전을 도모하기 위한 것입니다(안 제11조의2 신\n설).\n\n법률 제 호\n헌법재판소법 일부개정법률안\n헌법재판소법 일부를 다음과 같이 개정한다.\n제2장에 제11조의2를 다음과 같이 신설한다.\n제11조의2(소재지) 헌법재판소는 광주광역시에 둔다.\n부 칙\n이 법은 공포 후 1년이 경과한 날부터 시행한다.\n\n\n\n\n신ㆍ구조문대비표\n현 행 개 정 안\n<신 설> 제11조의2(소재지) ① 헌법재판\n소는 광주광역시에 둔다.\n",
  "sections": {
    "제안이유": "및",
    "주요내용": "헌법재판소를 광주로 이전하고자 합니다.\n광주는 일제강점기 광주학생항일운동이 일어난 곳입니다. 1980년 5‧\n18 민주화운동은 1987년 헌법 체제를 탄생케한 밑거름입니다. 헌정질\n서를 수호하는 국가기관인 헌법재판소가 소재하기에 적절합니다. 5·1\n8 광주 정신 계승에도 부합하는 일입니다.\n서울 등 수도권 과밀화 해소와 국가 균형 발전 차원에서 많은 공공\n기관이 지역으로 이전했습니다. 현재 21개 중앙행정기관 부처가 세종\n특별자치시에 위치합니다. 헌법재판소는 헌법상 정치적 중립이 강하게\n요청되는 국가기관입니다. 행정 권력의 중심에서 물리적 거리를 두는\n것이 더 바람직합니다.\n헌법재판소 지역 이전은 위헌 논란도 없습니다. 2004년 10월, 사법\n\n\n\n권 행사 장소는 수도 결정의 필수적 요소가 아니라는 헌재 판결이 나\n왔습니다. 독일 연방헌법재판소도 수도 베를린이 아닌 칼스루에(Karls\nruhe)에 소재합니다.\n이에 헌법재판소의 소재지를 광주광역시에 두고자 합니다. 독립성을\n강화하고 지역균형발전을 도모하기 위한 것입니다(안 제11조의2 신\n설).",
    "제안이유_및_주요내용": "헌법재판소를 광주로 이전하고자 합니다.\n광주는 일제강점기 광주학생항일운동이 일어난 곳입니다. 1980년 5‧\n18 민주화운동은 1987년 헌법 체제를 탄생케한 밑거름입니다. 헌정질\n서를 수호하는 국가기관인 헌법재판소가 소재하기에 적절합니다. 5·1\n8 광주 정신 계승에도 부합하는 일입니다.\n서울 등 수도권 과밀화 해소와 국가 균형 발전 차원에서 많은 공공\n기관이 지역으로 이전했습니다. 현재 21개 중앙행정기관 부처가 세종\n특별자치시에 위치합니다. 헌법재판소는 헌법상 정치적 중립이 강하게\n요청되는 국가기관입니다. 행정 권력의 중심에서 물리적 거리를 두는\n것이 더 바람직합니다.\n헌법재판소 지역 이전은 위헌 논란도 없습니다. 2004년 10월, 사법\n\n\n\n권 행사 장소는 수도 결정의 필수적 요소가 아니라는 헌재 판결이 나\n왔습니다. 독일 연방헌법재판소도 수도 베를린이 아닌 칼스루에(Karls\nruhe)에 소재합니다.\n이에 헌법재판소의 소재지를 광주광역시에 두고자 합니다. 독립성을\n강화하고 지역균형발전을 도모하기 위한 것입니다(안 제11조의2 신\n설).",
    "법률_제_호": "헌법재판소법 일부개정법률안\n헌법재판소법 일부를 다음과 같이 개정한다.\n제2장에 제11조의2를 다음과 같이 신설한다.\n제11조의2(소재지) 헌법재판소는 광주광역시에 둔다.",
    "신구조문대비표": "현 행 개 정 안\n<신 설> 제11조의2(소재지) ① 헌법재판\n소는 광주광역시에 둔다."
  }
}