{
  "title": "2200903_초·중등교육법_일부개정법률안",
  "bill_number": "903",
  "proposal_date": "2024. 6. 25.",
  "submission_date": "",
  "is_alternative": false,
  "alternative_bill_numbers": [],
  "has_comparison_table": false,
  "comparison_table": "신ㆍ구조문대비표\n현 행 개 정 안\n제20조의2(학교의 장 및 교원의 제20조의2(학교의 장 및 교원의\n학생생활지도) ①ㆍ② (생 략) 학생생활지도) ①ㆍ② (현행과\n같음)\n<신 설> ③ 교육부장관과 교육감은 제1\n항에 따른 학생생활지도에 필\n요한 인력 및 시설 등에 소요\n되는 경비를 예산의 범위에서\n지원할 수 있다.",
  "full_text": "초ㆍ중등교육법 일부개정법률안\n(임오경의원 대표발의)\n발의연월일 : 2024. 6. 25.\n의 안\n903\n번 호 발 의 자 : 임오경ㆍ한정애ㆍ한민수\n박 정ㆍ한병도ㆍ김현정\n서영교ㆍ이연희ㆍ임미애\n강유정 의원(10인)\n제안이유 및 주요내용\n최근 3년간 교사의 교육활동 침해에 대응하기 위한 교권보호위원회\n심의 건수는 2021년 2,269건에서 2022년 3,035건, 서이초 사건이 있었\n던 2023년에는 5,050건으로 급증하였음.\n특히 2023년 7월에 발생한 서이초 사건은 ‘교권 추락으로 인한 공교\n육의 절대적인 위기 상황’에 대한 사회적 공감대를 형성하는 계기가\n되었음.\n이후 교육부는 악성 민원ㆍ아동학대 신고 등 교권 침해 상황으로부\n터 교원 보호를 위한 학교ㆍ교육청 지원을 강화할 계획을 밝혔으나\n이에 필요한 예산, 인력, 시설 등의 지원은 아직 부족한 상황임.\n이에 교육부장관 및 교육감이 학생생활지도에 필요한 경비를 지원\n할 수 있도록 규정함으로써 교육활동 및 교권 보호 강화제도의 실효\n성을 제고하고 교육현장에서 학생생활지도가 원활하게 이루어질 수\n\n\n\n있도록 하려는 것임(안 제20조의2제3항 신설).\n\n법률 제 호\n초ㆍ중등교육법 일부개정법률안\n초ㆍ중등교육법 일부를 다음과 같이 개정한다.\n제20조의2에 제3항을 다음과 같이 신설한다.\n③ 교육부장관과 교육감은 제1항에 따른 학생생활지도에 필요한 인\n력 및 시설 등에 소요되는 경비를 예산의 범위에서 지원할 수 있다.\n부 칙\n이 법은 공포 후 6개월이 경과한 날부터 시행한다.\n\n\n\n\n신ㆍ구조문대비표\n현 행 개 정 안\n제20조의2(학교의 장 및 교원의 제20조의2(학교의 장 및 교원의\n학생생활지도) ①ㆍ② (생 략) 학생생활지도) ①ㆍ② (현행과\n같음)\n<신 설> ③ 교육부장관과 교육감은 제1\n항에 따른 학생생활지도에 필\n요한 인력 및 시설 등에 소요\n되는 경비를 예산의 범위에서\n지원할 수 있다.\n",
  "sections": {
    "제안이유": "및",
    "주요내용": "최근 3년간 교사의 교육활동 침해에 대응하기 위한 교권보호위원회\n심의 건수는 2021년 2,269건에서 2022년 3,035건, 서이초 사건이 있었\n던 2023년에는 5,050건으로 급증하였음.\n특히 2023년 7월에 발생한 서이초 사건은 ‘교권 추락으로 인한 공교\n육의 절대적인 위기 상황’에 대한 사회적 공감대를 형성하는 계기가\n되었음.\n이후 교육부는 악성 민원ㆍ아동학대 신고 등 교권 침해 상황으로부\n터 교원 보호를 위한 학교ㆍ교육청 지원을 강화할 계획을 밝혔으나\n이에 필요한 예산, 인력, 시설 등의 지원은 아직 부족한 상황임.\n이에 교육부장관 및 교육감이 학생생활지도에 필요한 경비를 지원\n할 수 있도록 규정함으로써 교육활동 및 교권 보호 강화제도의 실효\n성을 제고하고 교육현장에서 학생생활지도가 원활하게 이루어질 수\n\n\n\n있도록 하려는 것임(안 제20조의2제3항 신설).",
    "제안이유_및_주요내용": "최근 3년간 교사의 교육활동 침해에 대응하기 위한 교권보호위원회\n심의 건수는 2021년 2,269건에서 2022년 3,035건, 서이초 사건이 있었\n던 2023년에는 5,050건으로 급증하였음.\n특히 2023년 7월에 발생한 서이초 사건은 ‘교권 추락으로 인한 공교\n육의 절대적인 위기 상황’에 대한 사회적 공감대를 형성하는 계기가\n되었음.\n이후 교육부는 악성 민원ㆍ아동학대 신고 등 교권 침해 상황으로부\n터 교원 보호를 위한 학교ㆍ교육청 지원을 강화할 계획을 밝혔으나\n이에 필요한 예산, 인력, 시설 등의 지원은 아직 부족한 상황임.\n이에 교육부장관 및 교육감이 학생생활지도에 필요한 경비를 지원\n할 수 있도록 규정함으로써 교육활동 및 교권 보호 강화제도의 실효\n성을 제고하고 교육현장에서 학생생활지도가 원활하게 이루어질 수\n\n\n\n있도록 하려는 것임(안 제20조의2제3항 신설).",
    "법률_제_호": "초ㆍ중등교육법 일부개정법률안\n초ㆍ중등교육법 일부를 다음과 같이 개정한다.\n제20조의2에 제3항을 다음과 같이 신설한다.\n③ 교육부장관과 교육감은 제1항에 따른 학생생활지도에 필요한 인\n력 및 시설 등에 소요되는 경비를 예산의 범위에서 지원할 수 있다.",
    "신구조문대비표": "현 행 개 정 안\n제20조의2(학교의 장 및 교원의 제20조의2(학교의 장 및 교원의\n학생생활지도) ①ㆍ② (생 략) 학생생활지도) ①ㆍ② (현행과\n같음)\n<신 설> ③ 교육부장관과 교육감은 제1\n항에 따른 학생생활지도에 필\n요한 인력 및 시설 등에 소요\n되는 경비를 예산의 범위에서\n지원할 수 있다."
  }
}