{
  "title": "2200831_형법_일부개정법률안",
  "bill_number": "831",
  "proposal_date": "2024. 6. 24.",
  "submission_date": "",
  "is_alternative": false,
  "alternative_bill_numbers": [],
  "has_comparison_table": false,
  "comparison_table": "신·구조문대비표\n현 행 개 정 안\n제10조(심신장애인) ① ∼ ③ (생 제10조(심신장애인) ① ∼ ③ (현\n략) 행과 같음)\n<신 설> ④ 음주나 마약류(「마약류관\n리에 관한 법률」 제2조에 따\n른 마약류를 말한다)로 인하여\n자의로 심신장애를 야기한 자\n의 행위는 제2항을 적용하지\n아니할 수 있다.",
  "full_text": "형법 일부개정법률안\n(주호영의원 대표발의)\n발의연월일 : 2024. 6. 24.\n의 안\n831\n번 호 발 의 자 : 주호영ㆍ권영세ㆍ김승수\n장동혁ㆍ이헌승ㆍ구자근\n신동욱ㆍ이인선ㆍ정희용\n김위상 의원(10인)\n제안이유 및 주요내용\n현행법은 심신장애로 사물 변별 능력이 없거나 의사 결정 능력이\n없는 자의 행위는 벌하지 않고 이러한 능력이 미약한 자의 행위는 형\n을 감경할 수 있다고 규정하고 있음.\n이로 인해 범죄자들이 형 감경을 목적으로 심신미약상태에서 이루\n어진 범죄를 주장하는 사례가 빈발하고 재판부 판단에 따라 범죄의\n형을 감경해주고 있음.\n그러나 음주나 마약류로 인한 범죄는 자의로 사전에 제어가 가능하\n다는 점과 흉악범죄를 저지르고도 심신미약을 이유로 감형하는 것은\n국민정서에 부합하지 않는 측면을 고려할 필요가 있음.\n이에 음주나 마약으로 인하여 자의로 심신장애를 야기한 자의 행위\n에 대해서 형을 면제하거나 감경하지 아니할 수 있도록 하려는 것임\n(안 제10조제4항 신설).\n\n\n\n\n법률 제 호\n형법 일부개정법률안\n형법 일부를 다음과 같이 개정한다.\n제10조에 제4항을 다음과 같이 신설한다.\n④ 음주나 마약류(「마약류관리에 관한 법률」 제2조에 따른 마약류\n를 말한다)로 인하여 자의로 심신장애를 야기한 자의 행위는 제2항\n을 적용하지 아니할 수 있다.\n부 칙\n이 법은 공포 후 3개월이 경과한 날부터 시행한다.\n\n\n\n\n신·구조문대비표\n현 행 개 정 안\n제10조(심신장애인) ① ∼ ③ (생 제10조(심신장애인) ① ∼ ③ (현\n략) 행과 같음)\n<신 설> ④ 음주나 마약류(「마약류관\n리에 관한 법률」 제2조에 따\n른 마약류를 말한다)로 인하여\n자의로 심신장애를 야기한 자\n의 행위는 제2항을 적용하지\n아니할 수 있다.\n",
  "sections": {
    "제안이유": "및",
    "주요내용": "현행법은 심신장애로 사물 변별 능력이 없거나 의사 결정 능력이\n없는 자의 행위는 벌하지 않고 이러한 능력이 미약한 자의 행위는 형\n을 감경할 수 있다고 규정하고 있음.\n이로 인해 범죄자들이 형 감경을 목적으로 심신미약상태에서 이루\n어진 범죄를 주장하는 사례가 빈발하고 재판부 판단에 따라 범죄의\n형을 감경해주고 있음.\n그러나 음주나 마약류로 인한 범죄는 자의로 사전에 제어가 가능하\n다는 점과 흉악범죄를 저지르고도 심신미약을 이유로 감형하는 것은\n국민정서에 부합하지 않는 측면을 고려할 필요가 있음.\n이에 음주나 마약으로 인하여 자의로 심신장애를 야기한 자의 행위\n에 대해서 형을 면제하거나 감경하지 아니할 수 있도록 하려는 것임\n(안 제10조제4항 신설).",
    "제안이유_및_주요내용": "현행법은 심신장애로 사물 변별 능력이 없거나 의사 결정 능력이\n없는 자의 행위는 벌하지 않고 이러한 능력이 미약한 자의 행위는 형\n을 감경할 수 있다고 규정하고 있음.\n이로 인해 범죄자들이 형 감경을 목적으로 심신미약상태에서 이루\n어진 범죄를 주장하는 사례가 빈발하고 재판부 판단에 따라 범죄의\n형을 감경해주고 있음.\n그러나 음주나 마약류로 인한 범죄는 자의로 사전에 제어가 가능하\n다는 점과 흉악범죄를 저지르고도 심신미약을 이유로 감형하는 것은\n국민정서에 부합하지 않는 측면을 고려할 필요가 있음.\n이에 음주나 마약으로 인하여 자의로 심신장애를 야기한 자의 행위\n에 대해서 형을 면제하거나 감경하지 아니할 수 있도록 하려는 것임\n(안 제10조제4항 신설).",
    "법률_제_호": "형법 일부개정법률안\n형법 일부를 다음과 같이 개정한다.\n제10조에 제4항을 다음과 같이 신설한다.\n④ 음주나 마약류(「마약류관리에 관한 법률」 제2조에 따른 마약류\n를 말한다)로 인하여 자의로 심신장애를 야기한 자의 행위는 제2항\n을 적용하지 아니할 수 있다.",
    "신구조문대비표": "현 행 개 정 안\n제10조(심신장애인) ① ∼ ③ (생 제10조(심신장애인) ① ∼ ③ (현\n략) 행과 같음)\n<신 설> ④ 음주나 마약류(「마약류관\n리에 관한 법률」 제2조에 따\n른 마약류를 말한다)로 인하여\n자의로 심신장애를 야기한 자\n의 행위는 제2항을 적용하지\n아니할 수 있다."
  }
}