{
  "title": "2200419_하도급거래_공정화에_관한_법률_일부개정법률안",
  "bill_number": "419",
  "proposal_date": "2024. 6. 13.",
  "submission_date": "",
  "is_alternative": false,
  "alternative_bill_numbers": [],
  "has_comparison_table": false,
  "comparison_table": "신ㆍ구조문대비표\n현 행 개 정 안\n<신 설> 제2조의2(국외 행위에 대한 적용)\n국외에서 이루어진 행위라도\n국내 시장에 영향을 미치는 경\n우에는 이 법을 적용한다.",
  "full_text": "하도급거래 공정화에 관한 법률 일부개정법률안\n(김정호의원 대표발의)\n발의연월일 : 2024. 6. 13.\n의 안\n419\n번 호 발 의 자 : 김정호ㆍ김성환ㆍ박희승\n김남희ㆍ신영대ㆍ허종식\n정성호ㆍ정진욱ㆍ박해철\n어기구ㆍ강유정ㆍ이연희\n박 정 의원(13인)\n제안이유 및 주요내용\n「독점규제 및 공정거래에 관한 법률」에 따르면 국외에서 이루어\n진 행위라도 국내 시장에 영향을 미치는 경우에는 해당 법이 적용되\n도록 명시적인 규정을 두고 있음. 반면, 현행법은 유사한 규정 또는\n준용 규정을 두고 있지 아니함.\n그런데, 초국적기업 혹은 외국기업이 국내기업을 수급사업자로 하여\n하도급거래를 하고, 거래대행사를 통하여 직접 도급 관련 지시를 하는\n사례가 나타나고 있음. 이와 관련하여 공정거래위원회는 현행법에 근\n거 규정이 없으므로, 초국적기업 또는 외국기업에 대하여 현행법을 적\n용할 수 없다는 견해를 밝힌 바 있음.\n이에 국외에서 이루어진 행위라도 국내 시장에 영향을 미치는 경우\n에는 이 법을 적용하도록 규정을 신설하여 초국적기업 또는 외국기업\n에 대하여 현행법을 적용함으로써, 국민경제의 건전한 발전에 이바지\n\n\n\n하고자 함(안 제2조의2 신설).\n\n법률 제 호\n하도급거래 공정화에 관한 법률 일부개정법률안\n하도급거래 공정화에 관한 법률 일부를 다음과 같이 개정한다.\n제2조의2를 다음과 같이 신설한다.\n제2조의2(국외 행위에 대한 적용) 국외에서 이루어진 행위라도 국내\n시장에 영향을 미치는 경우에는 이 법을 적용한다.\n부 칙\n제1조(시행일) 이 법은 공포한 날부터 시행한다.\n제2조(국외 행위에 관한 적용례) 제2조의2의 개정규정은 이 법 시행\n이후 국외에서 이루어진 행위부터 적용한다.\n\n\n\n\n신ㆍ구조문대비표\n현 행 개 정 안\n<신 설> 제2조의2(국외 행위에 대한 적용)\n국외에서 이루어진 행위라도\n국내 시장에 영향을 미치는 경\n우에는 이 법을 적용한다.\n",
  "sections": {
    "제안이유": "및",
    "주요내용": "「독점규제 및 공정거래에 관한 법률」에 따르면 국외에서 이루어\n진 행위라도 국내 시장에 영향을 미치는 경우에는 해당 법이 적용되\n도록 명시적인 규정을 두고 있음. 반면, 현행법은 유사한 규정 또는\n준용 규정을 두고 있지 아니함.\n그런데, 초국적기업 혹은 외국기업이 국내기업을 수급사업자로 하여\n하도급거래를 하고, 거래대행사를 통하여 직접 도급 관련 지시를 하는\n사례가 나타나고 있음. 이와 관련하여 공정거래위원회는 현행법에 근\n거 규정이 없으므로, 초국적기업 또는 외국기업에 대하여 현행법을 적\n용할 수 없다는 견해를 밝힌 바 있음.\n이에 국외에서 이루어진 행위라도 국내 시장에 영향을 미치는 경우\n에는 이 법을 적용하도록 규정을 신설하여 초국적기업 또는 외국기업\n에 대하여 현행법을 적용함으로써, 국민경제의 건전한 발전에 이바지\n\n\n\n하고자 함(안 제2조의2 신설).",
    "제안이유_및_주요내용": "「독점규제 및 공정거래에 관한 법률」에 따르면 국외에서 이루어\n진 행위라도 국내 시장에 영향을 미치는 경우에는 해당 법이 적용되\n도록 명시적인 규정을 두고 있음. 반면, 현행법은 유사한 규정 또는\n준용 규정을 두고 있지 아니함.\n그런데, 초국적기업 혹은 외국기업이 국내기업을 수급사업자로 하여\n하도급거래를 하고, 거래대행사를 통하여 직접 도급 관련 지시를 하는\n사례가 나타나고 있음. 이와 관련하여 공정거래위원회는 현행법에 근\n거 규정이 없으므로, 초국적기업 또는 외국기업에 대하여 현행법을 적\n용할 수 없다는 견해를 밝힌 바 있음.\n이에 국외에서 이루어진 행위라도 국내 시장에 영향을 미치는 경우\n에는 이 법을 적용하도록 규정을 신설하여 초국적기업 또는 외국기업\n에 대하여 현행법을 적용함으로써, 국민경제의 건전한 발전에 이바지\n\n\n\n하고자 함(안 제2조의2 신설).",
    "법률_제_호": "하도급거래 공정화에 관한 법률 일부개정법률안\n하도급거래 공정화에 관한 법률 일부를 다음과 같이 개정한다.\n제2조의2를 다음과 같이 신설한다.\n제2조의2(국외 행위에 대한 적용) 국외에서 이루어진 행위라도 국내\n시장에 영향을 미치는 경우에는 이 법을 적용한다.",
    "신구조문대비표": "현 행 개 정 안\n<신 설> 제2조의2(국외 행위에 대한 적용)\n국외에서 이루어진 행위라도\n국내 시장에 영향을 미치는 경\n우에는 이 법을 적용한다."
  }
}