{
  "title": "2200905_예금자보호법_일부개정법률안",
  "bill_number": "905",
  "proposal_date": "2024. 6. 25.",
  "submission_date": "",
  "is_alternative": false,
  "alternative_bill_numbers": [],
  "has_comparison_table": false,
  "comparison_table": "신ㆍ구조문대비표\n현 행 개 정 안\n법률 제9134호 예금자보호법 법률 제9134호 예금자보호법\n일부개정법률 ",
  "full_text": "예금자보호법 일부개정법률안\n(강민국의원 대표발의)\n발의연월일 : 2024. 6. 25.\n의 안\n905\n번 호 발 의 자 : 강민국ㆍ서천호ㆍ박성민\n김소희ㆍ신동욱ㆍ주호영\n이헌승ㆍ윤한홍ㆍ이종욱\n이상휘ㆍ조승환ㆍ박덕흠\n의원(12인)\n제안이유 및 주요내용\n현재 예금자보호법은 금융부실 발생에 대비하여 예금보험기금을 적\n립하기 위한 보험료율 한도를 모든 금융업권에 0.5%이내로 규정하고\n있으며, 대통령령에서 각 업권별로 구체적인 보험료율을 정하도록 하\n고 있음.\n또한, 「예금자보호법」 부칙은 보험료율 한도에 관한 적용기한을\n2024년 8월 31일까지로 하고 있으며, 이를 기한 내 다시 정하지 아니\n한 경우 1998년도 「예금자보호법」에서 정한 업권별 보험료율 한도\n규정을 적용하도록 하고 있음.\n이에 따라 동 부칙에서 규정한 보험료율 한도에 대한 적용기한이\n연장되지 않을 경우, 현행보다 낮은 보험료율 한도 규정이 적용됨에\n따라, 보험료율 한도가 현행 보험료율보다 낮은 은행, 투자매매업자ㆍ\n\n\n\n투자중개업자, 상호저축은행으로부터의 보험료 수입이 연간 약 8천억\n원 감소할 것으로 예상됨.\n이로 인해 과거 저축은행 구조조정 비용 부담을 위해 운영 중인 특\n별계정의 잔여 부채 상환에 차질을 초래할 수 있고, 구조조정 비용 상\n환으로 인해 현재 예금보험기금 적립이 충분하지 못한 상황에서 예금\n보험기금의 건전성을 훼손할 우려도 있음.\n따라서 보험료 수입 감소를 방지하고 예금보험기금의 안정성을 확\n보하기 위해 외환위기 및 저축은행 부실 등 과거 구조조정 비용 상환\n이 완료되는 2027년 12월 31일까지 현행 보험료율 한도의 적용기한을\n연장하고자 함(안 법률 제9134호 예금자보호법 일부개정법률 부칙 제2\n항). 또한, 개정규정을 개정 법률 시행일이 속하는 사업연도에 대한 보\n험료분부터 적용하는 적용례를 부칙에 신설함(안 부칙 제2조).\n\n법률 제 호\n예금자보호법 일부개정법률안\n예금자보호법 일부를 다음과 같이 개정한다.\n법률 제9134호 예금자보호법 일부개정법률 부칙 제2항(법률 제10691호\n예금자보호법 일부개정법률, 법률 제14128호 예금자보호법 일부개정법\n률 및 법률 제18436호 예금자보호법 일부개정법률에 따라 개정된 내\n용을 포함한다) 중 “2024년 8월”을 “2027년 12월”으로 한다.\n부 칙\n제1조(시행일) 이 법은 공포한 날부터 시행한다.\n제2조(보험료에 관한 적용례) 법률 제9134호 예금자보호법 일부개정법\n률 부칙 제2항의 개정규정은 이 법 시행일이 속하는 사업연도(다만,\n은행의 경우에는 시행일이 속하는 분기를 말한다)에 대한 보험료분\n부터 적용한다.\n\n\n\n\n신ㆍ구조문대비표\n현 행 개 정 안\n법률 제9134호 예금자보호법 법률 제9134호 예금자보호법\n일부개정법률 부칙 일부개정법률 부칙\n① (생 략) ① (현행과 같음)\n②(보험료율 한도에 관한 적용 ②(보험료율 한도에 관한 적용\n례) 제30조제1항의 개정규정에 례) ---------------------\n관하여 2024년 8월 31일까지 -------2027년 12월--------\n각 부보금융기관이 매년 보험 ------------------------\n료로 납부하여야 하는 금액의 ------------------------\n예금등의 잔액에 대한 비율의 ------------------------\n한도를 다시 정하지 아니하는 ------------------------\n경우에는 법률 제5492호 예금 ------------------------\n자보호법중개정법률 제30조제1 ------------------------\n항제1호부터 제6호까지의 규정 ------------------------\n을 적용한다. -------------.\n",
  "sections": {
    "제안이유": "및",
    "주요내용": "현재 예금자보호법은 금융부실 발생에 대비하여 예금보험기금을 적\n립하기 위한 보험료율 한도를 모든 금융업권에 0.5%이내로 규정하고\n있으며, 대통령령에서 각 업권별로 구체적인 보험료율을 정하도록 하\n고 있음.\n또한, 「예금자보호법」 부칙은 보험료율 한도에 관한 적용기한을\n2024년 8월 31일까지로 하고 있으며, 이를 기한 내 다시 정하지 아니\n한 경우 1998년도 「예금자보호법」에서 정한 업권별 보험료율 한도\n규정을 적용하도록 하고 있음.\n이에 따라 동 부칙에서 규정한 보험료율 한도에 대한 적용기한이\n연장되지 않을 경우, 현행보다 낮은 보험료율 한도 규정이 적용됨에\n따라, 보험료율 한도가 현행 보험료율보다 낮은 은행, 투자매매업자ㆍ\n\n\n\n투자중개업자, 상호저축은행으로부터의 보험료 수입이 연간 약 8천억\n원 감소할 것으로 예상됨.\n이로 인해 과거 저축은행 구조조정 비용 부담을 위해 운영 중인 특\n별계정의 잔여 부채 상환에 차질을 초래할 수 있고, 구조조정 비용 상\n환으로 인해 현재 예금보험기금 적립이 충분하지 못한 상황에서 예금\n보험기금의 건전성을 훼손할 우려도 있음.\n따라서 보험료 수입 감소를 방지하고 예금보험기금의 안정성을 확\n보하기 위해 외환위기 및 저축은행 부실 등 과거 구조조정 비용 상환\n이 완료되는 2027년 12월 31일까지 현행 보험료율 한도의 적용기한을\n연장하고자 함(안",
    "제안이유_및_주요내용": "현재 예금자보호법은 금융부실 발생에 대비하여 예금보험기금을 적\n립하기 위한 보험료율 한도를 모든 금융업권에 0.5%이내로 규정하고\n있으며, 대통령령에서 각 업권별로 구체적인 보험료율을 정하도록 하\n고 있음.\n또한, 「예금자보호법」 부칙은 보험료율 한도에 관한 적용기한을\n2024년 8월 31일까지로 하고 있으며, 이를 기한 내 다시 정하지 아니\n한 경우 1998년도 「예금자보호법」에서 정한 업권별 보험료율 한도\n규정을 적용하도록 하고 있음.\n이에 따라 동 부칙에서 규정한 보험료율 한도에 대한 적용기한이\n연장되지 않을 경우, 현행보다 낮은 보험료율 한도 규정이 적용됨에\n따라, 보험료율 한도가 현행 보험료율보다 낮은 은행, 투자매매업자ㆍ\n\n\n\n투자중개업자, 상호저축은행으로부터의 보험료 수입이 연간 약 8천억\n원 감소할 것으로 예상됨.\n이로 인해 과거 저축은행 구조조정 비용 부담을 위해 운영 중인 특\n별계정의 잔여 부채 상환에 차질을 초래할 수 있고, 구조조정 비용 상\n환으로 인해 현재 예금보험기금 적립이 충분하지 못한 상황에서 예금\n보험기금의 건전성을 훼손할 우려도 있음.\n따라서 보험료 수입 감소를 방지하고 예금보험기금의 안정성을 확\n보하기 위해 외환위기 및 저축은행 부실 등 과거 구조조정 비용 상환\n이 완료되는 2027년 12월 31일까지 현행 보험료율 한도의 적용기한을\n연장하고자 함(안",
    "법률_제_호": "예금자보호법 일부개정법률",
    "신구조문대비표": "현 행 개 정 안\n법률 제9134호 예금자보호법 법률 제9134호 예금자보호법\n일부개정법률"
  }
}