{
  "title": "2200934_국가배상법_일부개정법률안",
  "bill_number": "934",
  "proposal_date": "2024. 6. 25.",
  "submission_date": "",
  "is_alternative": false,
  "alternative_bill_numbers": [],
  "has_comparison_table": false,
  "comparison_table": "신ㆍ구조문대비표\n현 행 개 정 안\n제2조(배상책임) ① ㆍ ② (생 제2조(배상책임) ① ㆍ ② (현행\n략) 과 같음)\n<신 설> ③ 제1항 단서에도 불구하고\n전사ㆍ순직하거나 공상을 입은\n군인ㆍ군무원ㆍ경찰공무원 또\n는 예비군대원의 유족 또는 가\n족은 자신의 정신적 고통에 대\n한 위자료를 청구할 수 있다.",
  "full_text": "국가배상법 일부개정법률안\n(엄태영의원 대표발의)\n발의연월일 : 2024. 6. 25.\n의 안\n934\n번 호 발 의 자 : 엄태영ㆍ신성범ㆍ서천호\n이종배ㆍ주진우ㆍ김상훈\n조경태ㆍ권성동ㆍ임종득\n박덕흠 의원(10인)\n제안이유 및 주요내용\n국가를 위해 헌신하다가 희생 되신 분들과 유족들은 최우선적으로\n보호받고 지원받아야 할 대상일 뿐만 아니라, 사회적 참사에 대해 특\n별법에 따라 국가적 차원의 보상 규정을 정하고 있는 것과의 형평성\n차원에서도 유가족에 대한 추가적인 지원책을 마련하는 것이 필요함.\n그런데 현행법에 따르면 군인 등이 직무 집행 중 전사 혹은 순직하\n거나 공상을 입은 경우, 본인이나 그 유족이 다른 법령에 따라 재해보\n상금 등의 보상을 지급받을 수 있는 경우에는 이 법 또는 민법에 따\n른 손해배상이 허용되지 아니함. 즉 공상을 입은 군인 등의 가족은\n‘본인이나 유족’에 해당하지 아니하므로 공상에 따른 가족으로서의 위\n자료 청구가 가능함에 비해, 전사, 순직한 군인 등의 유가족은 위자료\n청구를 할 수 없어 공평하지 못하다는 비판이 제기됨.\n이에 헌법이 법률에 위임한 범위에서 국가를 위해 희생한 군인 등\n\n\n\n의 유가족이 국가 등에 위자료를 청구할 수 있고, 아울러 공상을 입은\n군인 등의 가족 등에 대해서도 위자료를 청구할 수 있는 명확한 근거\n를 마련하려는 취지임(안 제2조제3항 신설).\n\n법률 제 호\n국가배상법 일부개정법률안\n국가배상법 일부를 다음과 같이 개정한다.\n제2조에 제3항을 다음과 같이 신설한다.\n③ 제1항 단서에도 불구하고 전사ㆍ순직하거나 공상을 입은 군인ㆍ\n군무원ㆍ경찰공무원 또는 예비군대원의 유족 또는 가족은 자신의\n정신적 고통에 대한 위자료를 청구할 수 있다.\n부 칙\n제1조(시행일) 이 법은 공포한 날부터 시행한다.\n제2조(유족 또는 가족의 위자료에 관한 적용례) ① 제2조제3항의 개정\n규정은 이 법 시행 이후 군인ㆍ군무원ㆍ경찰공무원 또는 예비군대\n원이 전투ㆍ훈련 등 직무 집행과 관련하여 전사ㆍ순직하거나 「국\n가유공자 등 예우 및 지원에 관한 법률」에 따라 상이등급 판정을\n받은 경우부터 적용한다.\n② 제1항에도 불구하고 이 법 시행 당시 본부심의회, 특별심의회 또\n는 지구심의회에 계속 중인 사건과 법원에 계속 중인 사건에 대해\n서는 제2조제3항의 개정규정을 적용한다.\n\n\n\n\n신ㆍ구조문대비표\n현 행 개 정 안\n제2조(배상책임) ① ㆍ ② (생 제2조(배상책임) ① ㆍ ② (현행\n략) 과 같음)\n<신 설> ③ 제1항 단서에도 불구하고\n전사ㆍ순직하거나 공상을 입은\n군인ㆍ군무원ㆍ경찰공무원 또\n는 예비군대원의 유족 또는 가\n족은 자신의 정신적 고통에 대\n한 위자료를 청구할 수 있다.\n",
  "sections": {
    "제안이유": "및",
    "주요내용": "국가를 위해 헌신하다가 희생 되신 분들과 유족들은 최우선적으로\n보호받고 지원받아야 할 대상일 뿐만 아니라, 사회적 참사에 대해 특\n별법에 따라 국가적 차원의 보상 규정을 정하고 있는 것과의 형평성\n차원에서도 유가족에 대한 추가적인 지원책을 마련하는 것이 필요함.\n그런데 현행법에 따르면 군인 등이 직무 집행 중 전사 혹은 순직하\n거나 공상을 입은 경우, 본인이나 그 유족이 다른 법령에 따라 재해보\n상금 등의 보상을 지급받을 수 있는 경우에는 이 법 또는 민법에 따\n른 손해배상이 허용되지 아니함. 즉 공상을 입은 군인 등의 가족은\n‘본인이나 유족’에 해당하지 아니하므로 공상에 따른 가족으로서의 위\n자료 청구가 가능함에 비해, 전사, 순직한 군인 등의 유가족은 위자료\n청구를 할 수 없어 공평하지 못하다는 비판이 제기됨.\n이에 헌법이 법률에 위임한 범위에서 국가를 위해 희생한 군인 등\n\n\n\n의 유가족이 국가 등에 위자료를 청구할 수 있고, 아울러 공상을 입은\n군인 등의 가족 등에 대해서도 위자료를 청구할 수 있는 명확한 근거\n를 마련하려는 취지임(안 제2조제3항 신설).",
    "제안이유_및_주요내용": "국가를 위해 헌신하다가 희생 되신 분들과 유족들은 최우선적으로\n보호받고 지원받아야 할 대상일 뿐만 아니라, 사회적 참사에 대해 특\n별법에 따라 국가적 차원의 보상 규정을 정하고 있는 것과의 형평성\n차원에서도 유가족에 대한 추가적인 지원책을 마련하는 것이 필요함.\n그런데 현행법에 따르면 군인 등이 직무 집행 중 전사 혹은 순직하\n거나 공상을 입은 경우, 본인이나 그 유족이 다른 법령에 따라 재해보\n상금 등의 보상을 지급받을 수 있는 경우에는 이 법 또는 민법에 따\n른 손해배상이 허용되지 아니함. 즉 공상을 입은 군인 등의 가족은\n‘본인이나 유족’에 해당하지 아니하므로 공상에 따른 가족으로서의 위\n자료 청구가 가능함에 비해, 전사, 순직한 군인 등의 유가족은 위자료\n청구를 할 수 없어 공평하지 못하다는 비판이 제기됨.\n이에 헌법이 법률에 위임한 범위에서 국가를 위해 희생한 군인 등\n\n\n\n의 유가족이 국가 등에 위자료를 청구할 수 있고, 아울러 공상을 입은\n군인 등의 가족 등에 대해서도 위자료를 청구할 수 있는 명확한 근거\n를 마련하려는 취지임(안 제2조제3항 신설).",
    "법률_제_호": "국가배상법 일부개정법률안\n국가배상법 일부를 다음과 같이 개정한다.\n제2조에 제3항을 다음과 같이 신설한다.\n③ 제1항 단서에도 불구하고 전사ㆍ순직하거나 공상을 입은 군인ㆍ\n군무원ㆍ경찰공무원 또는 예비군대원의 유족 또는 가족은 자신의\n정신적 고통에 대한 위자료를 청구할 수 있다.",
    "신구조문대비표": "현 행 개 정 안\n제2조(배상책임) ① ㆍ ② (생 제2조(배상책임) ① ㆍ ② (현행\n략) 과 같음)\n<신 설> ③ 제1항 단서에도 불구하고\n전사ㆍ순직하거나 공상을 입은\n군인ㆍ군무원ㆍ경찰공무원 또\n는 예비군대원의 유족 또는 가\n족은 자신의 정신적 고통에 대\n한 위자료를 청구할 수 있다."
  }
}