{
  "title": "2201219_군형법_일부개정법률안",
  "bill_number": "1219",
  "proposal_date": "2024. 7. 1.",
  "submission_date": "",
  "is_alternative": false,
  "alternative_bill_numbers": [],
  "has_comparison_table": false,
  "comparison_table": "신·구조문대비표\n현 행 개 정 안\n제62조(가혹행위) ① ∼ ② (생 제62조(가혹행위) ① ∼ ② (현행\n략) 과 같음)\n<신 설> ③ 제1항 또는 제2항의 죄를\n범하여 사람을 중상해에 이르\n게 한 때에는 3년 이상의 징역\n에 처한다. 사망에 이르게 한\n때에는 5년 이상의 징역에 처\n한다.",
  "full_text": "군형법 일부개정법률안\n(신동욱의원 대표발의)\n발의연월일 : 2024. 7. 1.\n의 안\n1219\n번 호 발 의 자 : 신동욱ㆍ유용원ㆍ김승수\n박정하ㆍ강대식ㆍ박준태\n권성동ㆍ김은혜ㆍ이달희\n서지영ㆍ김예지ㆍ서천호\n김상훈 의원(13인)\n제안이유 및 주요내용\n현행법은 일반 가혹행위에 대한 규정만 존재할 뿐, 가혹행위로 인하\n여 중상해 또는 사망에 이르게 한 경우에 대한 규정은 마련되어 있지\n않음.\n이로 인해 가혹행위로 인한 사망 사건이 발생할 경우, 이를 업무상\n과실치사 등의 형법상의 죄명으로 다루어야 하는 한계가 존재함.\n이에 가혹행위로 인해 중상해 또는 사망에 이르게 한 경우를 신설\n하고, 이를 가중처벌하도록 함으로써 군 내 가혹행위에 대한 경각심을\n제고하고 피해자의 권익을 보다 두텁게 보호하고자 하는 것임(안 제62\n조제3항신설).\n\n\n\n\n법률 제 호\n군형법 일부개정법률안\n군형법 일부를 다음과 같이 개정한다.\n제62조에 제3항을 다음과 같이 신설한다.\n③ 제1항 또는 제2항의 죄를 범하여 사람을 중상해에 이르게 한 때\n에는 3년 이상의 징역에 처한다. 사망에 이르게 한 때에는 5년 이상\n의 징역에 처한다.\n부 칙\n이 법은 공포 후 6개월이 경과한 날부터 시행한다.\n\n\n\n\n신·구조문대비표\n현 행 개 정 안\n제62조(가혹행위) ① ∼ ② (생 제62조(가혹행위) ① ∼ ② (현행\n략) 과 같음)\n<신 설> ③ 제1항 또는 제2항의 죄를\n범하여 사람을 중상해에 이르\n게 한 때에는 3년 이상의 징역\n에 처한다. 사망에 이르게 한\n때에는 5년 이상의 징역에 처\n한다.\n",
  "sections": {
    "제안이유": "및",
    "주요내용": "현행법은 일반 가혹행위에 대한 규정만 존재할 뿐, 가혹행위로 인하\n여 중상해 또는 사망에 이르게 한 경우에 대한 규정은 마련되어 있지\n않음.\n이로 인해 가혹행위로 인한 사망 사건이 발생할 경우, 이를 업무상\n과실치사 등의 형법상의 죄명으로 다루어야 하는 한계가 존재함.\n이에 가혹행위로 인해 중상해 또는 사망에 이르게 한 경우를 신설\n하고, 이를 가중처벌하도록 함으로써 군 내 가혹행위에 대한 경각심을\n제고하고 피해자의 권익을 보다 두텁게 보호하고자 하는 것임(안 제62\n조제3항신설).",
    "제안이유_및_주요내용": "현행법은 일반 가혹행위에 대한 규정만 존재할 뿐, 가혹행위로 인하\n여 중상해 또는 사망에 이르게 한 경우에 대한 규정은 마련되어 있지\n않음.\n이로 인해 가혹행위로 인한 사망 사건이 발생할 경우, 이를 업무상\n과실치사 등의 형법상의 죄명으로 다루어야 하는 한계가 존재함.\n이에 가혹행위로 인해 중상해 또는 사망에 이르게 한 경우를 신설\n하고, 이를 가중처벌하도록 함으로써 군 내 가혹행위에 대한 경각심을\n제고하고 피해자의 권익을 보다 두텁게 보호하고자 하는 것임(안 제62\n조제3항신설).",
    "법률_제_호": "군형법 일부개정법률안\n군형법 일부를 다음과 같이 개정한다.\n제62조에 제3항을 다음과 같이 신설한다.\n③ 제1항 또는 제2항의 죄를 범하여 사람을 중상해에 이르게 한 때\n에는 3년 이상의 징역에 처한다. 사망에 이르게 한 때에는 5년 이상\n의 징역에 처한다.",
    "신구조문대비표": "현 행 개 정 안\n제62조(가혹행위) ① ∼ ② (생 제62조(가혹행위) ① ∼ ② (현행\n략) 과 같음)\n<신 설> ③ 제1항 또는 제2항의 죄를\n범하여 사람을 중상해에 이르\n게 한 때에는 3년 이상의 징역\n에 처한다. 사망에 이르게 한\n때에는 5년 이상의 징역에 처\n한다."
  }
}