{
  "title": "2201876_해운법_일부개정법률안",
  "bill_number": "1876",
  "proposal_date": "2024. 7. 17.",
  "submission_date": "",
  "is_alternative": false,
  "alternative_bill_numbers": [],
  "has_comparison_table": false,
  "comparison_table": "신ㆍ구조문대비표\n현 행 개 정 안\n제15조의2(선박건조의 지원) ① 제15조의2(선박건조의 지원) ①\n(생 략) (현행과 같음)\n<신 설> ② 국가는 도서주민의 이동권\n을 보장하기 위하여 지방자치\n단체가 선박을 건조하여 운항\n하는 경우 대통령령으로 정하\n는 바에 따라 선박의 건조에\n필요한 비용을 지원할 수 있다.\n② (생 략) ③ (현행 제2항과 같음)",
  "full_text": "해운법 일부개정법률안\n(서삼석의원 대표발의)\n발의연월일 : 2024. 7. 17.\n의 안\n1876\n번 호 발 의 자 : 서삼석ㆍ문대림ㆍ임호선\n이병진ㆍ박희승ㆍ복기왕\n정준호ㆍ정을호ㆍ이개호\n김원이ㆍ윤준병ㆍ문금주\n의원(12인)\n제안이유 및 주요내용\n현행법은 섬 주민의 해양교통수단을 확보하기 위하여 해양수산부장\n관으로 하여금 항로 운영의 수익성이 낮아 국가가 운항에 따른 결손\n금액을 보조하는 항로(이하 “보조항로”라 함)를 지정하고 여객운송사\n업자 중에서 보조항로를 운항할 사업자를 선정할 수 있도록 하고 있\n으며, 보조항로를 운항하는 사업자의 선박에 대하여는 그 선박건조에\n소요되는 비용을 지원할 수 있도록 규정하고 있음.\n그런데 현행법에 따른 선박건조 비용의 지원대상은 보조항로를 운\n항하는 민간 여객운송사업자의 선박만 해당하고, 섬 주민의 이동권 보\n장을 위하여 지방자치단체가 자체적으로 보조항로가 지정되지 아니한\n곳에 대하여 선박을 운항하는 경우 해당 선박은 선박건조 비용의 지\n원대상에서 제외됨으로써 재정여건이 열악한 지방자치단체 주민의 교\n통불편이 가중되고 있다는 지적이 있음.\n\n\n\n이에 선박건조 비용의 지원 대상에 지방자치단체가 선박을 건조하\n여 운항하는 경우를 추가함으로써, 섬 주민의 이동권 보장을 통하여\n해상교통 복지의 증진에 기여하려는 것임(안 제15조의2제2항 신설).\n\n법률 제 호\n해운법 일부개정법률안\n해운법 일부를 다음과 같이 개정한다.\n제15조의2제2항을 제3항으로 하고, 같은 조에 제2항을 다음과 같이 신\n설한다.\n② 국가는 도서주민의 이동권을 보장하기 위하여 지방자치단체가\n선박을 건조하여 운항하는 경우 대통령령으로 정하는 바에 따라 선\n박의 건조에 필요한 비용을 지원할 수 있다.\n부 칙\n이 법은 공포 후 6개월이 경과한 날부터 시행한다.\n\n\n\n\n신ㆍ구조문대비표\n현 행 개 정 안\n제15조의2(선박건조의 지원) ① 제15조의2(선박건조의 지원) ①\n(생 략) (현행과 같음)\n<신 설> ② 국가는 도서주민의 이동권\n을 보장하기 위하여 지방자치\n단체가 선박을 건조하여 운항\n하는 경우 대통령령으로 정하\n는 바에 따라 선박의 건조에\n필요한 비용을 지원할 수 있다.\n② (생 략) ③ (현행 제2항과 같음)\n",
  "sections": {
    "제안이유": "및",
    "주요내용": "현행법은 섬 주민의 해양교통수단을 확보하기 위하여 해양수산부장\n관으로 하여금 항로 운영의 수익성이 낮아 국가가 운항에 따른 결손\n금액을 보조하는 항로(이하 “보조항로”라 함)를 지정하고 여객운송사\n업자 중에서 보조항로를 운항할 사업자를 선정할 수 있도록 하고 있\n으며, 보조항로를 운항하는 사업자의 선박에 대하여는 그 선박건조에\n소요되는 비용을 지원할 수 있도록 규정하고 있음.\n그런데 현행법에 따른 선박건조 비용의 지원대상은 보조항로를 운\n항하는 민간 여객운송사업자의 선박만 해당하고, 섬 주민의 이동권 보\n장을 위하여 지방자치단체가 자체적으로 보조항로가 지정되지 아니한\n곳에 대하여 선박을 운항하는 경우 해당 선박은 선박건조 비용의 지\n원대상에서 제외됨으로써 재정여건이 열악한 지방자치단체 주민의 교\n통불편이 가중되고 있다는 지적이 있음.\n\n\n\n이에 선박건조 비용의 지원 대상에 지방자치단체가 선박을 건조하\n여 운항하는 경우를 추가함으로써, 섬 주민의 이동권 보장을 통하여\n해상교통 복지의 증진에 기여하려는 것임(안 제15조의2제2항 신설).",
    "제안이유_및_주요내용": "현행법은 섬 주민의 해양교통수단을 확보하기 위하여 해양수산부장\n관으로 하여금 항로 운영의 수익성이 낮아 국가가 운항에 따른 결손\n금액을 보조하는 항로(이하 “보조항로”라 함)를 지정하고 여객운송사\n업자 중에서 보조항로를 운항할 사업자를 선정할 수 있도록 하고 있\n으며, 보조항로를 운항하는 사업자의 선박에 대하여는 그 선박건조에\n소요되는 비용을 지원할 수 있도록 규정하고 있음.\n그런데 현행법에 따른 선박건조 비용의 지원대상은 보조항로를 운\n항하는 민간 여객운송사업자의 선박만 해당하고, 섬 주민의 이동권 보\n장을 위하여 지방자치단체가 자체적으로 보조항로가 지정되지 아니한\n곳에 대하여 선박을 운항하는 경우 해당 선박은 선박건조 비용의 지\n원대상에서 제외됨으로써 재정여건이 열악한 지방자치단체 주민의 교\n통불편이 가중되고 있다는 지적이 있음.\n\n\n\n이에 선박건조 비용의 지원 대상에 지방자치단체가 선박을 건조하\n여 운항하는 경우를 추가함으로써, 섬 주민의 이동권 보장을 통하여\n해상교통 복지의 증진에 기여하려는 것임(안 제15조의2제2항 신설).",
    "법률_제_호": "해운법 일부개정법률안\n해운법 일부를 다음과 같이 개정한다.\n제15조의2제2항을 제3항으로 하고, 같은 조에 제2항을 다음과 같이 신\n설한다.\n② 국가는 도서주민의 이동권을 보장하기 위하여 지방자치단체가\n선박을 건조하여 운항하는 경우 대통령령으로 정하는 바에 따라 선\n박의 건조에 필요한 비용을 지원할 수 있다.",
    "신구조문대비표": "현 행 개 정 안\n제15조의2(선박건조의 지원) ① 제15조의2(선박건조의 지원) ①\n(생 략) (현행과 같음)\n<신 설> ② 국가는 도서주민의 이동권\n을 보장하기 위하여 지방자치\n단체가 선박을 건조하여 운항\n하는 경우 대통령령으로 정하\n는 바에 따라 선박의 건조에\n필요한 비용을 지원할 수 있다.\n② (생 략) ③ (현행 제2항과 같음)"
  }
}