{
  "title": "2201598_섬_발전_촉진법_일부개정법률안",
  "bill_number": "1598",
  "proposal_date": "2024. 7. 10.",
  "submission_date": "",
  "is_alternative": false,
  "alternative_bill_numbers": [],
  "has_comparison_table": false,
  "comparison_table": "신ㆍ구조문대비표\n현 행 개 정 안\n제13조의3(교통편의 증진 지원) 제13조의3(교통편의 증진 지원)\n① ㆍ ② (생 략) ① ㆍ ② (현행과 같음)\n<신 설> ③ 국가는 제1항에 따라 이용\n되는 선박에 대하여 대통령령\n으로 정하는 바에 따라 그 구\n입ㆍ건조ㆍ수리 등에 소요되는\n비용의 전부 또는 일부를 지원\n할 수 있다.",
  "full_text": "섬 발전 촉진법 일부개정법률안\n(서삼석의원 대표발의)\n발의연월일 : 2024. 7. 10.\n의 안\n1598\n번 호 발 의 자 : 서삼석ㆍ문대림ㆍ임호선\n이병진ㆍ박희승ㆍ복기왕\n정준호ㆍ정을호ㆍ이개호\n윤준병ㆍ문금주 의원\n(11인)\n제안이유 및 주요내용\n현행법은 섬지역 주민의 소득 증대와 복지 향상을 위하여 개발이\n필요하다고 인정되는 섬을 개발대상섬(이하 “지정섬”이라 한다)으로\n지정하도록 하고, 여객선이 운항하지 않는 지정섬의 경우 주민의 교통\n편의를 위하여 지방자치단체의 공무용 선박을 이용하여 사람을 운송\n할 수 있도록 하고 있음.\n그러나 일부 지방자치단체의 경우 어려운 재정 여건으로 인해 공무\n용 선박을 도입하지 못하고 있거나, 이용 중인 선박의 내용연수가 경\n과 또는 임박했음에도 이를 교체하지 못하고 있어 주민의 교통편의와\n안전이 보장되지 않고 있는 실정임.\n이에 주민의 교통편의를 위하여 운행하는 공무용 선박의 경우 그\n건조ㆍ구입ㆍ수리 등에 소요되는 비용의 전부 또는 일부를 국가가 지\n원할 수 있도록 하려는 것임(안 제13조의3제3항).\n\n\n\n\n법률 제 호\n섬 발전 촉진법 일부개정법률안\n섬 발전 촉진법 일부를 다음과 같이 개정한다.\n제13조의3에 제3항을 다음과 같이 신설한다.\n③ 국가는 제1항에 따라 이용되는 선박에 대하여 대통령령으로 정\n하는 바에 따라 그 구입ㆍ건조ㆍ수리 등에 소요되는 비용의 전부\n또는 일부를 지원할 수 있다.\n부 칙\n이 법은 공포 후 6개월이 경과한 날부터 시행한다.\n\n\n\n\n신ㆍ구조문대비표\n현 행 개 정 안\n제13조의3(교통편의 증진 지원) 제13조의3(교통편의 증진 지원)\n① ㆍ ② (생 략) ① ㆍ ② (현행과 같음)\n<신 설> ③ 국가는 제1항에 따라 이용\n되는 선박에 대하여 대통령령\n으로 정하는 바에 따라 그 구\n입ㆍ건조ㆍ수리 등에 소요되는\n비용의 전부 또는 일부를 지원\n할 수 있다.\n",
  "sections": {
    "제안이유": "및",
    "주요내용": "현행법은 섬지역 주민의 소득 증대와 복지 향상을 위하여 개발이\n필요하다고 인정되는 섬을 개발대상섬(이하 “지정섬”이라 한다)으로\n지정하도록 하고, 여객선이 운항하지 않는 지정섬의 경우 주민의 교통\n편의를 위하여 지방자치단체의 공무용 선박을 이용하여 사람을 운송\n할 수 있도록 하고 있음.\n그러나 일부 지방자치단체의 경우 어려운 재정 여건으로 인해 공무\n용 선박을 도입하지 못하고 있거나, 이용 중인 선박의 내용연수가 경\n과 또는 임박했음에도 이를 교체하지 못하고 있어 주민의 교통편의와\n안전이 보장되지 않고 있는 실정임.\n이에 주민의 교통편의를 위하여 운행하는 공무용 선박의 경우 그\n건조ㆍ구입ㆍ수리 등에 소요되는 비용의 전부 또는 일부를 국가가 지\n원할 수 있도록 하려는 것임(안 제13조의3제3항).",
    "제안이유_및_주요내용": "현행법은 섬지역 주민의 소득 증대와 복지 향상을 위하여 개발이\n필요하다고 인정되는 섬을 개발대상섬(이하 “지정섬”이라 한다)으로\n지정하도록 하고, 여객선이 운항하지 않는 지정섬의 경우 주민의 교통\n편의를 위하여 지방자치단체의 공무용 선박을 이용하여 사람을 운송\n할 수 있도록 하고 있음.\n그러나 일부 지방자치단체의 경우 어려운 재정 여건으로 인해 공무\n용 선박을 도입하지 못하고 있거나, 이용 중인 선박의 내용연수가 경\n과 또는 임박했음에도 이를 교체하지 못하고 있어 주민의 교통편의와\n안전이 보장되지 않고 있는 실정임.\n이에 주민의 교통편의를 위하여 운행하는 공무용 선박의 경우 그\n건조ㆍ구입ㆍ수리 등에 소요되는 비용의 전부 또는 일부를 국가가 지\n원할 수 있도록 하려는 것임(안 제13조의3제3항).",
    "법률_제_호": "섬 발전 촉진법 일부개정법률안\n섬 발전 촉진법 일부를 다음과 같이 개정한다.\n제13조의3에 제3항을 다음과 같이 신설한다.\n③ 국가는 제1항에 따라 이용되는 선박에 대하여 대통령령으로 정\n하는 바에 따라 그 구입ㆍ건조ㆍ수리 등에 소요되는 비용의 전부\n또는 일부를 지원할 수 있다.",
    "신구조문대비표": "현 행 개 정 안\n제13조의3(교통편의 증진 지원) 제13조의3(교통편의 증진 지원)\n① ㆍ ② (생 략) ① ㆍ ② (현행과 같음)\n<신 설> ③ 국가는 제1항에 따라 이용\n되는 선박에 대하여 대통령령\n으로 정하는 바에 따라 그 구\n입ㆍ건조ㆍ수리 등에 소요되는\n비용의 전부 또는 일부를 지원\n할 수 있다."
  }
}