{
  "title": "2201007_건강가정기본법_일부개정법률안",
  "bill_number": "1007",
  "proposal_date": "2024. 6. 27.",
  "submission_date": "",
  "is_alternative": false,
  "alternative_bill_numbers": [],
  "has_comparison_table": false,
  "comparison_table": "신ㆍ구조문대비표\n현 행 개 정 안\n<신 설> 제8조의2(혼인예식 장소의 제공)\n국가기관의 장, 지방자치단체의\n장, 공공기관ㆍ단체 및 국ㆍ공\n립 대학 등의 장은 업무수행에\n지장이 없는 범위에서 강당, 회\n의실, 그 밖의 시설을 혼인예식\n의 장소로 적극 개방하여야 한\n다.",
  "full_text": "건강가정기본법 일부개정법률안\n(이수진의원 대표발의)\n발의연월일 : 2024. 6. 27.\n의 안\n1007\n번 호 발 의 자 : 이수진ㆍ정진욱ㆍ장철민\n추미애ㆍ박홍배ㆍ신장식\n정준호ㆍ박홍근ㆍ김현정\n한정애ㆍ이건태 의원\n(11인)\n제안이유\n「건전가정의례의 정착 및 지원에 관한 법률」은 국가 및 지방자치\n단체의 건전한 가정의례의 정착 및 지원에 관한 책임을 강화하고, 민\n간단체 등의 건전한 가정의례활동에 대한 지원 등을 통하여 허례허식\n을 없애고 건전한 사회기풍을 진작하기 위하여 1999년에 제정되었음.\n주요 내용으로 가정의례에 관한 시책의 수립ㆍ시행, 건전가정의례 준\n칙 제정, 민간단체 보조금 지원, 공공기관의 혼인예식 장소 적극개방,\n명예가정의례지도원을 규정하고 있음.\n그러나 개인생활에 대한 국가의 과도한 규제라는 지적이 있으며, 이\n법을 근거로 유지하고 있는 ‘건전가정의례준칙’은 구시대적이고 가부\n장적인 내용을 많이 담고 있으며, 이 법에 따른 행정행위가 거의 없어\n법률의 실효성이 크지 아니하므로 이를 폐지하려는 것임.\n다만 위 준칙의 폐지에 따라 공공장소를 혼인예식 장소로 제공하는\n\n\n\n조항이 사라지므로, 이 조항을 「건강가정기본법」에 이관하고자 하는\n것임.\n주요내용\n공공장소를 혼인예식 장소로 제공하는 조항을 「건강가정기본법」\n에 신설함(안 제8조의2 신설).\n참고사항\n이 법률안은 이수진의원이 대표발의한 「건전가정의례의 정착 및\n지원에 관한 법률 폐지법률안」(의안번호 제1006호)의 의결을 전제로\n하는 것이므로 같은 법률안이 의결되지 아니하거나 수정의결되는 경\n우에는 이에 맞추어 조정하여야 할 것임.\n\n법률 제 호\n건강가정기본법 일부개정법률안\n건강가정기본법 일부를 다음과 같이 개정한다.\n제8조의2를 다음과 같이 신설한다.\n제8조의2(혼인예식 장소의 제공) 국가기관의 장, 지방자치단체의 장,\n공공기관ㆍ단체 및 국ㆍ공립 대학 등의 장은 업무수행에 지장이 없\n는 범위에서 강당, 회의실, 그 밖의 시설을 혼인예식의 장소로 적극\n개방하여야 한다.\n부 칙\n이 법은 공포한 날부터 시행한다.\n\n\n\n\n신ㆍ구조문대비표\n현 행 개 정 안\n<신 설> 제8조의2(혼인예식 장소의 제공)\n국가기관의 장, 지방자치단체의\n장, 공공기관ㆍ단체 및 국ㆍ공\n립 대학 등의 장은 업무수행에\n지장이 없는 범위에서 강당, 회\n의실, 그 밖의 시설을 혼인예식\n의 장소로 적극 개방하여야 한\n다.\n",
  "sections": {
    "제안이유": "「건전가정의례의 정착 및 지원에 관한 법률」은 국가 및 지방자치\n단체의 건전한 가정의례의 정착 및 지원에 관한 책임을 강화하고, 민\n간단체 등의 건전한 가정의례활동에 대한 지원 등을 통하여 허례허식\n을 없애고 건전한 사회기풍을 진작하기 위하여 1999년에 제정되었음.\n주요 내용으로 가정의례에 관한 시책의 수립ㆍ시행, 건전가정의례 준\n칙 제정, 민간단체 보조금 지원, 공공기관의 혼인예식 장소 적극개방,\n명예가정의례지도원을 규정하고 있음.\n그러나 개인생활에 대한 국가의 과도한 규제라는 지적이 있으며, 이\n법을 근거로 유지하고 있는 ‘건전가정의례준칙’은 구시대적이고 가부\n장적인 내용을 많이 담고 있으며, 이 법에 따른 행정행위가 거의 없어\n법률의 실효성이 크지 아니하므로 이를 폐지하려는 것임.\n다만 위 준칙의 폐지에 따라 공공장소를 혼인예식 장소로 제공하는\n\n\n\n조항이 사라지므로, 이 조항을 「건강가정기본법」에 이관하고자 하는\n것임.",
    "주요내용": "공공장소를 혼인예식 장소로 제공하는 조항을 「건강가정기본법」\n에 신설함(안 제8조의2 신설).",
    "법률_제_호": "건강가정기본법 일부개정법률안\n건강가정기본법 일부를 다음과 같이 개정한다.\n제8조의2를 다음과 같이 신설한다.\n제8조의2(혼인예식 장소의 제공) 국가기관의 장, 지방자치단체의 장,\n공공기관ㆍ단체 및 국ㆍ공립 대학 등의 장은 업무수행에 지장이 없\n는 범위에서 강당, 회의실, 그 밖의 시설을 혼인예식의 장소로 적극\n개방하여야 한다.",
    "신구조문대비표": "현 행 개 정 안\n<신 설> 제8조의2(혼인예식 장소의 제공)\n국가기관의 장, 지방자치단체의\n장, 공공기관ㆍ단체 및 국ㆍ공\n립 대학 등의 장은 업무수행에\n지장이 없는 범위에서 강당, 회\n의실, 그 밖의 시설을 혼인예식\n의 장소로 적극 개방하여야 한\n다."
  }
}