{
  "title": "2201510_의료급여법_일부개정법률안",
  "bill_number": "1510",
  "proposal_date": "2024. 7. 9.",
  "submission_date": "",
  "is_alternative": false,
  "alternative_bill_numbers": [],
  "has_comparison_table": false,
  "comparison_table": "신·구조문대비표\n현 행 개 정 안\n<신 설> 제7조의2(의료급여에 관한 특례)\n수급권자 중 70세 이상인 사람\n에게는 입원기간 중 간병에 대\n하여 의료급여를 할 수 있다.\n이 경우 간병에 대한 의료급여\n의 범위ㆍ방법ㆍ절차, 그 밖에\n필요한 사항은 보건복지부령으\n로 정한다.",
  "full_text": "의료급여법 일부개정법률안\n(박지혜의원 대표발의)\n발의연월일 : 2024. 7. 9.\n의 안\n1510\n번 호 발 의 자 : 박지혜ㆍ위성곤ㆍ이개호\n조인철ㆍ강준현ㆍ정일영\n정진욱ㆍ오세희ㆍ박수현\n허 영ㆍ김용만ㆍ이재관\n이용우ㆍ문대림ㆍ황명선\n이재강ㆍ이광희ㆍ박선원\n박희승 의원(19인)\n제안이유 및 주요내용\n인구 고령화로 인해 의료기관 입원환자 중 노인환자 비율도 지속적\n으로 증가하고 있으며, 고령환자 특성상 입원이 장기화됨에 따라 간병\n수요 또한 급증하고 있음.\n그런데 월평균 370만원에 달하는 막대한 사적 간병비용, 간병인 구\n인난 등으로 인해 간병이 필요한 저소득층 환자의 경제적 부담과 환\n자 가족의 돌봄 부담이 심각한 사회적 문제가 되고 있음.\n이에 의료급여 수급권자 중 70세 이상인 사람에 대하여 간병급여를\n실시할 수 있도록 규정하여 저소득층 노인의 간병비 부담 완화 및\n사회복지 증진에 기여하고자 하는 것임(안 제7조의2 신설).\n\n\n\n\n법률 제 호\n의료급여법 일부개정법률안\n의료급여법 일부를 다음과 같이 개정한다.\n제7조의2를 다음과 같이 신설한다.\n제7조의2(의료급여에 관한 특례) 수급권자 중 70세 이상인 사람에게는\n입원기간 중 간병에 대하여 의료급여를 할 수 있다. 이 경우 간병에\n대한 의료급여의 범위ㆍ방법ㆍ절차, 그 밖에 필요한 사항은 보건복\n지부령으로 정한다.\n부 칙\n이 법은 공포 후 1년이 경과한 날부터 시행한다.\n\n\n\n\n신·구조문대비표\n현 행 개 정 안\n<신 설> 제7조의2(의료급여에 관한 특례)\n수급권자 중 70세 이상인 사람\n에게는 입원기간 중 간병에 대\n하여 의료급여를 할 수 있다.\n이 경우 간병에 대한 의료급여\n의 범위ㆍ방법ㆍ절차, 그 밖에\n필요한 사항은 보건복지부령으\n로 정한다.\n",
  "sections": {
    "제안이유": "및",
    "주요내용": "인구 고령화로 인해 의료기관 입원환자 중 노인환자 비율도 지속적\n으로 증가하고 있으며, 고령환자 특성상 입원이 장기화됨에 따라 간병\n수요 또한 급증하고 있음.\n그런데 월평균 370만원에 달하는 막대한 사적 간병비용, 간병인 구\n인난 등으로 인해 간병이 필요한 저소득층 환자의 경제적 부담과 환\n자 가족의 돌봄 부담이 심각한 사회적 문제가 되고 있음.\n이에 의료급여 수급권자 중 70세 이상인 사람에 대하여 간병급여를\n실시할 수 있도록 규정하여 저소득층 노인의 간병비 부담 완화 및\n사회복지 증진에 기여하고자 하는 것임(안 제7조의2 신설).",
    "제안이유_및_주요내용": "인구 고령화로 인해 의료기관 입원환자 중 노인환자 비율도 지속적\n으로 증가하고 있으며, 고령환자 특성상 입원이 장기화됨에 따라 간병\n수요 또한 급증하고 있음.\n그런데 월평균 370만원에 달하는 막대한 사적 간병비용, 간병인 구\n인난 등으로 인해 간병이 필요한 저소득층 환자의 경제적 부담과 환\n자 가족의 돌봄 부담이 심각한 사회적 문제가 되고 있음.\n이에 의료급여 수급권자 중 70세 이상인 사람에 대하여 간병급여를\n실시할 수 있도록 규정하여 저소득층 노인의 간병비 부담 완화 및\n사회복지 증진에 기여하고자 하는 것임(안 제7조의2 신설).",
    "법률_제_호": "의료급여법 일부개정법률안\n의료급여법 일부를 다음과 같이 개정한다.\n제7조의2를 다음과 같이 신설한다.\n제7조의2(의료급여에 관한 특례) 수급권자 중 70세 이상인 사람에게는\n입원기간 중 간병에 대하여 의료급여를 할 수 있다. 이 경우 간병에\n대한 의료급여의 범위ㆍ방법ㆍ절차, 그 밖에 필요한 사항은 보건복\n지부령으로 정한다.",
    "신구조문대비표": "현 행 개 정 안\n<신 설> 제7조의2(의료급여에 관한 특례)\n수급권자 중 70세 이상인 사람\n에게는 입원기간 중 간병에 대\n하여 의료급여를 할 수 있다.\n이 경우 간병에 대한 의료급여\n의 범위ㆍ방법ㆍ절차, 그 밖에\n필요한 사항은 보건복지부령으\n로 정한다."
  }
}