{
  "title": "2201908_국민연금법_일부개정법률안",
  "bill_number": "1908",
  "proposal_date": "2024. 7. 18.",
  "submission_date": "",
  "is_alternative": false,
  "alternative_bill_numbers": [],
  "has_comparison_table": false,
  "comparison_table": "신ㆍ구조문대비표\n현 행 개 정 안\n법률 제8541호 국민연금법 전부 법률 제8541호 국민연금법 전부\n개정법률 ",
  "full_text": "국민연금법 일부개정법률안\n(신성범의원 대표발의)\n발의연월일 : 2024. 7. 18.\n의 안\n1908\n번 호 발 의 자 : 신성범ㆍ강선영ㆍ박정하\n이상휘ㆍ김종양ㆍ김위상\n구자근ㆍ정희용ㆍ박충권\n조은희ㆍ권영진 의원\n(11인)\n제안이유 및 주요내용\n1994년 우루과이라운드 타결로 농어업 시장을 개방하면서 소득이\n감소할 수 있는 농어업인의 연금보험료 납부 부담 완화를 위해 농어\n업인 연금보험료 지원 제도를 도입하였음.\n그런데 동 제도는 2024년 기한이 종료될 예정으로, 다수의 농어업인\n이 여전히 생활의 어려움을 호소하고 있는 상황에서 제도의 기한을\n연장할 필요가 있다는 의견이 있음.\n특히 농어촌 지역의 소득 양극화 현상이 도시 지역에 비하여 심화\n되고 있다는 최근의 연구 결과들을 고려할 때, 저소득층 농어업인에\n대한 사회안전망을 강화할 필요가 있음.\n이에 2024년 12월 31일까지로 되어 있는 농어업인 연금보험료 지원\n제도의 종료 기간을 2031년 12월 31일까지로 7년 연장하려는 것임(안\n법률 제8541호 국민연금법 전부개정법률 부칙 제7조 및 법률 제11143\n\n\n\n호 국민연금법 일부개정법률 부칙 제7조).\n\n법률 제 호\n국민연금법 일부개정법률안\n국민연금법 일부를 다음과 같이 개정한다.\n법률 제8541호 국민연금법 전부개정법률 부칙(법률 제11143호 국민연\n금법 일부개정법률, 법률 제12242호 국민연금법 일부개정법률 및 법률\n제16867호 국민연금법 일부개정법률에 따라 각각 개정된 내용을 포함\n한다) 제7조 중 “제88조제3항”을 “제88조제4항”으로, “2024년”을 “2031\n년”으로 한다.\n법률 제11143호 국민연금법 일부개정법률 부칙(법률 제12242호 국민연\n금법 일부개정법률 및 제16867호 국민연금법 일부개정법률에 따라 각\n각 개정된 내용을 포함한다) 제7조 중 “제88조제3항”을 “제88조제4항”\n으로, “2024년”을 “2031년”으로 한다.\n부 칙\n제1조(시행일) 이 법은 공포한 날부터 시행한다.\n제2조(농어업인에 대한 연금보험료 보조에 관한 적용례) 법률 제8541\n호 국민연금법 전부개정법률 부칙 제7조 및 법률 제11143호 국민연\n금법 일부개정법률 부칙 제7조의 개정규정은 공포한 날이 속한 달\n\n\n\n의 보험료분부터 적용한다.\n\n신ㆍ구조문대비표\n현 행 개 정 안\n법률 제8541호 국민연금법 전부 법률 제8541호 국민연금법 전부\n개정법률 부칙 개정법률 부칙\n제7조(농어업인에 대한 연금보험 제7조(농어업인에 대한 연금보험\n료 보조) 지역가입자인 농어업 료 보조) -------------------\n인과 지역가입자에서 임의계속 ----------------------------\n가입자로 된 농어업인에게는 ----------------------------\n제88조제3항의 개정규정에도 제88조제4항-----------------\n불구하고 2024년 12월 31일까 --------2031년--------------\n지 본인이 부담할 연금보험료 ----------------------------\n중 100분의 50의 범위 내에서 ----------------------------\n대통령령으로 정하는 바에 따 ----------------------------\n라 농어촌구조개선특별회계에 ----------------------------\n서 지원한다. --------.\n법률 제11143호 국민연금법 일부 법률 제11143호 국민연금법 일부\n개정법률 부칙 개정법률 부칙\n제7조(농어업인에 대한 연금보험 제7조(농어업인에 대한 연금보험\n료 보조 특례) 사업장가입자 료 보조 특례) --------------\n또는 임의가입자에서 임의계속 ----------------------------\n가입자로 된 농어업인(당연적 ----------------------------\n용사업장의 근로자 또는 사용 ----------------------------\n자이거나 제9조 각 호의 어느 ----------------------------\n하나에 해당하는 사람은 제외 ----------------------------\n한다)에게는 제88조제3항에도 ---------------제88조제4항--\n\n\n\n불구하고 2024년 12월 31일까 ------2031년----------------\n지 본인이 부담할 연금보험료 ----------------------------\n중 100분의 50의 범위에서 대 ----------------------------\n통령령으로 정하는 바에 따라 ----------------------------\n농어촌구조개선특별회계에서 ----------------------------\n지원한다. -------.",
  "sections": {
    "제안이유": "및",
    "주요내용": "1994년 우루과이라운드 타결로 농어업 시장을 개방하면서 소득이\n감소할 수 있는 농어업인의 연금보험료 납부 부담 완화를 위해 농어\n업인 연금보험료 지원 제도를 도입하였음.\n그런데 동 제도는 2024년 기한이 종료될 예정으로, 다수의 농어업인\n이 여전히 생활의 어려움을 호소하고 있는 상황에서 제도의 기한을\n연장할 필요가 있다는 의견이 있음.\n특히 농어촌 지역의 소득 양극화 현상이 도시 지역에 비하여 심화\n되고 있다는 최근의 연구 결과들을 고려할 때, 저소득층 농어업인에\n대한 사회안전망을 강화할 필요가 있음.\n이에 2024년 12월 31일까지로 되어 있는 농어업인 연금보험료 지원\n제도의 종료 기간을 2031년 12월 31일까지로 7년 연장하려는 것임(안",
    "제안이유_및_주요내용": "1994년 우루과이라운드 타결로 농어업 시장을 개방하면서 소득이\n감소할 수 있는 농어업인의 연금보험료 납부 부담 완화를 위해 농어\n업인 연금보험료 지원 제도를 도입하였음.\n그런데 동 제도는 2024년 기한이 종료될 예정으로, 다수의 농어업인\n이 여전히 생활의 어려움을 호소하고 있는 상황에서 제도의 기한을\n연장할 필요가 있다는 의견이 있음.\n특히 농어촌 지역의 소득 양극화 현상이 도시 지역에 비하여 심화\n되고 있다는 최근의 연구 결과들을 고려할 때, 저소득층 농어업인에\n대한 사회안전망을 강화할 필요가 있음.\n이에 2024년 12월 31일까지로 되어 있는 농어업인 연금보험료 지원\n제도의 종료 기간을 2031년 12월 31일까지로 7년 연장하려는 것임(안",
    "법률_제_호": "국민연금법 전부개정법률",
    "신구조문대비표": "현 행 개 정 안\n법률 제8541호 국민연금법 전부 법률 제8541호 국민연금법 전부\n개정법률"
  }
}