{
  "title": "2201611_공직선거법_일부개정법률안",
  "bill_number": "1611",
  "proposal_date": "2024. 7. 11.",
  "submission_date": "",
  "is_alternative": false,
  "alternative_bill_numbers": [],
  "has_comparison_table": false,
  "comparison_table": "신·구조문대비표\n현 행 개 정 안\n제21조(국회의 의원정수) ① 국회 제21조(국회의 의원정수) ① ---\n의 의원정수는 지역구국회의원 ------------지역구국회의원\n254명과 비례대표국회의원 46 과 비례대표국회의원을 합하여\n명을 합하여 300명으로 한다. 270명 --------.\n② (생 략) ② (현행과 같음)",
  "full_text": "공직선거법 일부개정법률안\n(김기현의원 대표발의)\n발의연월일 : 2024. 7. 11.\n의 안\n1611\n번 호 발 의 자 : 김기현ㆍ박충권ㆍ김소희\n김석기ㆍ유상범ㆍ김 건\n박준태ㆍ김상훈ㆍ구자근\n김선교ㆍ김형동ㆍ최은석\n윤영석ㆍ서천호ㆍ박정하\n최수진ㆍ엄태영ㆍ백종헌\n임종득ㆍ권영진ㆍ최형두\n한기호ㆍ박성민ㆍ김상욱\n서범수 의원(25인)\n제안이유 및 주요내용\n제헌국회에서 200명으로 시작한 국회의원 정수는 차츰 늘어나기 시\n작하여 제13대국회에서 299명까지 늘어났다가 정치개혁 차원에서 제\n16대국회에서 273명으로 감축된 바 있음.\n이후 제17대국회에서는 다시 299명으로 늘어났고, 제19대국회부터는\n세종특별자치시 설치를 이유로 300명까지 늘어나 현재에 이르고 있음.\n그러나, 국회의원 정수 300명의 적정성에 대하여 국민의 부정적인\n여론이 높은 상황이며, 비례대표국회의원과 지역구국회의원 간의 전문\n성에서 차별화가 점차 없어지는 등 의원 정수 개선에 대한 필요성도\n지속적으로 제기되고 있음.\n\n\n\n이에 이러한 국민적 요구를 반영하여 국회의원 정수를 현행보다\n10% 감축한 270명으로 함으로써 정치에 대한 국민의 신뢰를 다시금\n도모하려는 것임(안 제21조제1항).\n\n법률 제 호\n공직선거법 일부개정법률안\n공직선거법 일부를 다음과 같이 개정한다.\n제21조제1항 중 “지역구국회의원 254명과 비례대표국회의원 46명을\n합하여 300명”을 “지역구국회의원과 비례대표국회의원을 합하여 270\n명”으로 한다.\n부 칙\n제1조(시행일) 이 법은 공포한 날부터 시행한다.\n\n\n\n\n신·구조문대비표\n현 행 개 정 안\n제21조(국회의 의원정수) ① 국회 제21조(국회의 의원정수) ① ---\n의 의원정수는 지역구국회의원 ------------지역구국회의원\n254명과 비례대표국회의원 46 과 비례대표국회의원을 합하여\n명을 합하여 300명으로 한다. 270명 --------.\n② (생 략) ② (현행과 같음)\n",
  "sections": {
    "제안이유": "및",
    "주요내용": "제헌국회에서 200명으로 시작한 국회의원 정수는 차츰 늘어나기 시\n작하여 제13대국회에서 299명까지 늘어났다가 정치개혁 차원에서 제\n16대국회에서 273명으로 감축된 바 있음.\n이후 제17대국회에서는 다시 299명으로 늘어났고, 제19대국회부터는\n세종특별자치시 설치를 이유로 300명까지 늘어나 현재에 이르고 있음.\n그러나, 국회의원 정수 300명의 적정성에 대하여 국민의 부정적인\n여론이 높은 상황이며, 비례대표국회의원과 지역구국회의원 간의 전문\n성에서 차별화가 점차 없어지는 등 의원 정수 개선에 대한 필요성도\n지속적으로 제기되고 있음.\n\n\n\n이에 이러한 국민적 요구를 반영하여 국회의원 정수를 현행보다\n10% 감축한 270명으로 함으로써 정치에 대한 국민의 신뢰를 다시금\n도모하려는 것임(안 제21조제1항).",
    "제안이유_및_주요내용": "제헌국회에서 200명으로 시작한 국회의원 정수는 차츰 늘어나기 시\n작하여 제13대국회에서 299명까지 늘어났다가 정치개혁 차원에서 제\n16대국회에서 273명으로 감축된 바 있음.\n이후 제17대국회에서는 다시 299명으로 늘어났고, 제19대국회부터는\n세종특별자치시 설치를 이유로 300명까지 늘어나 현재에 이르고 있음.\n그러나, 국회의원 정수 300명의 적정성에 대하여 국민의 부정적인\n여론이 높은 상황이며, 비례대표국회의원과 지역구국회의원 간의 전문\n성에서 차별화가 점차 없어지는 등 의원 정수 개선에 대한 필요성도\n지속적으로 제기되고 있음.\n\n\n\n이에 이러한 국민적 요구를 반영하여 국회의원 정수를 현행보다\n10% 감축한 270명으로 함으로써 정치에 대한 국민의 신뢰를 다시금\n도모하려는 것임(안 제21조제1항).",
    "법률_제_호": "공직선거법 일부개정법률안\n공직선거법 일부를 다음과 같이 개정한다.\n제21조제1항 중 “지역구국회의원 254명과 비례대표국회의원 46명을\n합하여 300명”을 “지역구국회의원과 비례대표국회의원을 합하여 270\n명”으로 한다.",
    "신구조문대비표": "현 행 개 정 안\n제21조(국회의 의원정수) ① 국회 제21조(국회의 의원정수) ① ---\n의 의원정수는 지역구국회의원 ------------지역구국회의원\n254명과 비례대표국회의원 46 과 비례대표국회의원을 합하여\n명을 합하여 300명으로 한다. 270명 --------.\n② (생 략) ② (현행과 같음)"
  }
}