{
  "title": "2201482_가축분뇨의_관리_및_이용에_관한_법률_일부개정법률안",
  "bill_number": "1482",
  "proposal_date": "2024. 7. 8.",
  "submission_date": "",
  "is_alternative": false,
  "alternative_bill_numbers": [],
  "has_comparison_table": false,
  "comparison_table": "신ㆍ구조문대비표\n현 행 개 정 안\n제42조(국고보조) ①ㆍ② (생 제42조(국고보조) ①ㆍ② (현행과\n략) 같음)\n<신 설> ③ 국가는 대통령령으로 정하\n는 축산농가 등에 대하여 예산\n의 범위에서 악취저감시설 설\n치ㆍ가동에 필요한 비용의 전\n부 또는 일부를 보조할 수 있\n다.",
  "full_text": "가축분뇨의 관리 및 이용에 관한 법률 일부개정법률안\n(송기헌의원 대표발의)\n발의연월일 : 2024. 7. 8.\n의 안\n1482\n번 호 발 의 자 : 송기헌ㆍ문대림ㆍ박균택\n박정하ㆍ백승아ㆍ윤건영\n윤준병ㆍ정성호ㆍ정준호\n정춘생 의원(10인)\n제안이유 및 주요내용\n가축분뇨와 축산 악취로 인해 지역 주민 민원이 급증함에 따라 현\n행법은 일정 규모 이상의 배출시설을 설치하려고 하거나 설치ㆍ운영\n중인 자로 하여금 대통령령으로 정하는 바에 따라 가축분뇨처리 및\n악취저감에 관한 사항을 포함한 배출시설의 설치계획을 갖추어 시장\nㆍ군수ㆍ구청장의 허가를 받도록 함.\n그러나 영세한 축산농가 및 축산업자들은 경제적 사정으로 인해 악\n취 저감을 위한 노력 및 개선대책 마련에 소극적인 실정임.\n이에 가축분뇨 배출시설의 악취저감시설 설치를 촉진하기 위하여\n국가가 예산의 범위에서 악취저감시설의 설치와 가동에 필요한 비용\n의 전부 또는 일부를 보조할 수 있도록 함으로써 악취 문제 해결을\n도모하고 국민의 쾌적한 주거 환경을 개선하고자 함(안 제42조제3항\n신설).\n\n\n\n\n법률 제 호\n가축분뇨의 관리 및 이용에 관한 법률 일부개정법률안\n가축분뇨의 관리 및 이용에 관한 법률 일부를 다음과 같이 개정한다.\n제42조에 제3항을 다음과 같이 신설한다.\n③ 국가는 대통령령으로 정하는 축산농가 등에 대하여 예산의 범위\n에서 악취저감시설 설치ㆍ가동에 필요한 비용의 전부 또는 일부를\n보조할 수 있다.\n부 칙\n이 법은 공포한 날부터 시행한다.\n\n\n\n\n신ㆍ구조문대비표\n현 행 개 정 안\n제42조(국고보조) ①ㆍ② (생 제42조(국고보조) ①ㆍ② (현행과\n략) 같음)\n<신 설> ③ 국가는 대통령령으로 정하\n는 축산농가 등에 대하여 예산\n의 범위에서 악취저감시설 설\n치ㆍ가동에 필요한 비용의 전\n부 또는 일부를 보조할 수 있\n다.\n",
  "sections": {
    "제안이유": "및",
    "주요내용": "가축분뇨와 축산 악취로 인해 지역 주민 민원이 급증함에 따라 현\n행법은 일정 규모 이상의 배출시설을 설치하려고 하거나 설치ㆍ운영\n중인 자로 하여금 대통령령으로 정하는 바에 따라 가축분뇨처리 및\n악취저감에 관한 사항을 포함한 배출시설의 설치계획을 갖추어 시장\nㆍ군수ㆍ구청장의 허가를 받도록 함.\n그러나 영세한 축산농가 및 축산업자들은 경제적 사정으로 인해 악\n취 저감을 위한 노력 및 개선대책 마련에 소극적인 실정임.\n이에 가축분뇨 배출시설의 악취저감시설 설치를 촉진하기 위하여\n국가가 예산의 범위에서 악취저감시설의 설치와 가동에 필요한 비용\n의 전부 또는 일부를 보조할 수 있도록 함으로써 악취 문제 해결을\n도모하고 국민의 쾌적한 주거 환경을 개선하고자 함(안 제42조제3항\n신설).",
    "제안이유_및_주요내용": "가축분뇨와 축산 악취로 인해 지역 주민 민원이 급증함에 따라 현\n행법은 일정 규모 이상의 배출시설을 설치하려고 하거나 설치ㆍ운영\n중인 자로 하여금 대통령령으로 정하는 바에 따라 가축분뇨처리 및\n악취저감에 관한 사항을 포함한 배출시설의 설치계획을 갖추어 시장\nㆍ군수ㆍ구청장의 허가를 받도록 함.\n그러나 영세한 축산농가 및 축산업자들은 경제적 사정으로 인해 악\n취 저감을 위한 노력 및 개선대책 마련에 소극적인 실정임.\n이에 가축분뇨 배출시설의 악취저감시설 설치를 촉진하기 위하여\n국가가 예산의 범위에서 악취저감시설의 설치와 가동에 필요한 비용\n의 전부 또는 일부를 보조할 수 있도록 함으로써 악취 문제 해결을\n도모하고 국민의 쾌적한 주거 환경을 개선하고자 함(안 제42조제3항\n신설).",
    "법률_제_호": "가축분뇨의 관리 및 이용에 관한 법률 일부개정법률안\n가축분뇨의 관리 및 이용에 관한 법률 일부를 다음과 같이 개정한다.\n제42조에 제3항을 다음과 같이 신설한다.\n③ 국가는 대통령령으로 정하는 축산농가 등에 대하여 예산의 범위\n에서 악취저감시설 설치ㆍ가동에 필요한 비용의 전부 또는 일부를\n보조할 수 있다.",
    "신구조문대비표": "현 행 개 정 안\n제42조(국고보조) ①ㆍ② (생 제42조(국고보조) ①ㆍ② (현행과\n략) 같음)\n<신 설> ③ 국가는 대통령령으로 정하\n는 축산농가 등에 대하여 예산\n의 범위에서 악취저감시설 설\n치ㆍ가동에 필요한 비용의 전\n부 또는 일부를 보조할 수 있\n다."
  }
}