{
  "title": "2201897_자본시장과_금융투자업에_관한_법률_일부개정법률안",
  "bill_number": "1897",
  "proposal_date": "2024. 7. 18.",
  "submission_date": "",
  "is_alternative": false,
  "alternative_bill_numbers": [],
  "has_comparison_table": false,
  "comparison_table": "신·구조문대비표\n현 행 개 정 안\n제443조(벌칙) ①ㆍ② (생 략) 제443조(벌칙) ①ㆍ② (현행과 같\n음)\n<신 설> ③ 제1항제10호의 위반행위로\n얻은 이익 또는 회피한 손실액\n이 5억원 이상인 경우에는 제1\n항의 벌금을 2배까지 가중한다.\n③ (생 략) ④ (현행 제3항과 같음)",
  "full_text": "자본시장과 금융투자업에 관한 법률 일부개정법률안\n(권성동의원 대표발의)\n발의연월일 : 2024. 7. 18.\n의 안\n1897\n번 호 발 의 자 : 권성동ㆍ서천호ㆍ백종헌\n우재준ㆍ윤한홍ㆍ정성국\n김예지ㆍ임종득ㆍ강선영\n김대식ㆍ박상웅ㆍ곽규택\n의원(12인)\n제안이유 및 주요내용\n현행법은 불법 공매도의 경우 1년 이상의 유기징역 또는 그 위반행\n위로 얻은 이익 또는 회피한 손실액의 3배 이상 5배 이하에 상당하는\n벌금을 규정하고 있으나 불법 공매도로 인한 시장 왜곡 및 투자자 피\n해 사례가 빈번히 발생하고 있음.\n불법 공매도는 주가를 인위적으로 낮추거나 조작하는 행위로 시장\n의 공정성을 심각하게 훼손하고, 주식시장의 신뢰성을 떨어뜨리며, 주\n식시장의 가격 체계를 왜곡하는 행위로 자본시장의 안정성을 위협한\n다는 측면에서 모든 투자자들에게 공정한 거래 환경을 제공하고, 주식\n시장의 건강한 발전을 도모하기 위해 불법 공매도를 예방하고 억제할\n수 있도록 처벌을 강화할 필요성이 제기됨.\n이에 불법 공매도로 얻은 이익 또는 회피한 손실액이 5억원 이상인\n경우에는 벌금을 2배까지 가중하여 부과할 수 있도록 하여 불법 공매\n\n\n\n도 근절과 함께 그로 인한 피해를 예방하고, 자본시장의 공정성 및 투\n명성을 높여 모든 투자자의 신뢰를 높이고 주식시장의 건전한 발전을\n도모하려는 것임(안 제443조제3항 신설).\n\n법률 제 호\n자본시장과 금융투자업에 관한 법률 일부개정법률안\n자본시장과 금융투자업에 관한 법률 일부를 다음과 같이 개정한다.\n제443조제3항을 제4항으로 하고, 같은 조에 제3항을 다음과 같이 신설\n한다.\n③ 제1항제10호의 위반행위로 얻은 이익 또는 회피한 손실액이 5억\n원 이상인 경우에는 제1항의 벌금을 2배까지 가중한다.\n부 칙\n이 법은 공포 후 6개월이 경과한 날부터 시행한다.\n\n\n\n\n신·구조문대비표\n현 행 개 정 안\n제443조(벌칙) ①ㆍ② (생 략) 제443조(벌칙) ①ㆍ② (현행과 같\n음)\n<신 설> ③ 제1항제10호의 위반행위로\n얻은 이익 또는 회피한 손실액\n이 5억원 이상인 경우에는 제1\n항의 벌금을 2배까지 가중한다.\n③ (생 략) ④ (현행 제3항과 같음)\n",
  "sections": {
    "제안이유": "및",
    "주요내용": "현행법은 불법 공매도의 경우 1년 이상의 유기징역 또는 그 위반행\n위로 얻은 이익 또는 회피한 손실액의 3배 이상 5배 이하에 상당하는\n벌금을 규정하고 있으나 불법 공매도로 인한 시장 왜곡 및 투자자 피\n해 사례가 빈번히 발생하고 있음.\n불법 공매도는 주가를 인위적으로 낮추거나 조작하는 행위로 시장\n의 공정성을 심각하게 훼손하고, 주식시장의 신뢰성을 떨어뜨리며, 주\n식시장의 가격 체계를 왜곡하는 행위로 자본시장의 안정성을 위협한\n다는 측면에서 모든 투자자들에게 공정한 거래 환경을 제공하고, 주식\n시장의 건강한 발전을 도모하기 위해 불법 공매도를 예방하고 억제할\n수 있도록 처벌을 강화할 필요성이 제기됨.\n이에 불법 공매도로 얻은 이익 또는 회피한 손실액이 5억원 이상인\n경우에는 벌금을 2배까지 가중하여 부과할 수 있도록 하여 불법 공매\n\n\n\n도 근절과 함께 그로 인한 피해를 예방하고, 자본시장의 공정성 및 투\n명성을 높여 모든 투자자의 신뢰를 높이고 주식시장의 건전한 발전을\n도모하려는 것임(안 제443조제3항 신설).",
    "제안이유_및_주요내용": "현행법은 불법 공매도의 경우 1년 이상의 유기징역 또는 그 위반행\n위로 얻은 이익 또는 회피한 손실액의 3배 이상 5배 이하에 상당하는\n벌금을 규정하고 있으나 불법 공매도로 인한 시장 왜곡 및 투자자 피\n해 사례가 빈번히 발생하고 있음.\n불법 공매도는 주가를 인위적으로 낮추거나 조작하는 행위로 시장\n의 공정성을 심각하게 훼손하고, 주식시장의 신뢰성을 떨어뜨리며, 주\n식시장의 가격 체계를 왜곡하는 행위로 자본시장의 안정성을 위협한\n다는 측면에서 모든 투자자들에게 공정한 거래 환경을 제공하고, 주식\n시장의 건강한 발전을 도모하기 위해 불법 공매도를 예방하고 억제할\n수 있도록 처벌을 강화할 필요성이 제기됨.\n이에 불법 공매도로 얻은 이익 또는 회피한 손실액이 5억원 이상인\n경우에는 벌금을 2배까지 가중하여 부과할 수 있도록 하여 불법 공매\n\n\n\n도 근절과 함께 그로 인한 피해를 예방하고, 자본시장의 공정성 및 투\n명성을 높여 모든 투자자의 신뢰를 높이고 주식시장의 건전한 발전을\n도모하려는 것임(안 제443조제3항 신설).",
    "법률_제_호": "자본시장과 금융투자업에 관한 법률 일부개정법률안\n자본시장과 금융투자업에 관한 법률 일부를 다음과 같이 개정한다.\n제443조제3항을 제4항으로 하고, 같은 조에 제3항을 다음과 같이 신설\n한다.\n③ 제1항제10호의 위반행위로 얻은 이익 또는 회피한 손실액이 5억\n원 이상인 경우에는 제1항의 벌금을 2배까지 가중한다.",
    "신구조문대비표": "현 행 개 정 안\n제443조(벌칙) ①ㆍ② (생 략) 제443조(벌칙) ①ㆍ② (현행과 같\n음)\n<신 설> ③ 제1항제10호의 위반행위로\n얻은 이익 또는 회피한 손실액\n이 5억원 이상인 경우에는 제1\n항의 벌금을 2배까지 가중한다.\n③ (생 략) ④ (현행 제3항과 같음)"
  }
}