{
  "title": "2201140_소재ㆍ부품ㆍ장비산업_경쟁력_강화_및_공급망_안정화를_위한_특별조치법_일부개정법률안",
  "bill_number": "1140",
  "proposal_date": "2024. 6. 28.",
  "submission_date": "",
  "is_alternative": false,
  "alternative_bill_numbers": [],
  "has_comparison_table": false,
  "comparison_table": "신ㆍ구조문대비표\n현 행 개 정 안\n법률 제16859호 법률 제16859호\n소재ㆍ부품전문기업 등의 육성에 소재ㆍ부품전문기업 등의 육성에\n관한 특별조치법 전부개정법률 관한 특별조치법 전부개정법률\n",
  "full_text": "소재ㆍ부품ㆍ장비산업 경쟁력 강화 및 공급망 안정화를\n위한 특별조치법 일부개정법률안\n(이재관의원 대표발의)\n발의연월일 : 2024. 6. 28.\n의 안\n1140\n번 호 발 의 자 : 이재관ㆍ김남근ㆍ김승수\n복기왕ㆍ박지원ㆍ송재봉\n문금주ㆍ이광희ㆍ문진석\n이정문ㆍ황정아ㆍ부승찬\n황명선ㆍ이상식ㆍ정준호\n오세희ㆍ김용만ㆍ인요한\n강준현ㆍ윤종군ㆍ박희승\n의원(21인)\n제안이유 및 주요내용\n현행법에 따른 소재ㆍ부품ㆍ장비경쟁력강화특별회계는 소재ㆍ부품\nㆍ장비산업(이하 “소부장산업”이라 함) 경쟁력강화 기본계획의 안정적\n추진을 위한 재원확보와 관련 사업의 효율적 시행을 위하여 설치된\n특별회계로, 2019년에 5년 한시 회계로 설치되어 2024년 12월 31일까\n지 유효한 상황임.\n그런데 코로나19 팬데믹 이후 글로벌 공급망 교란이 지속되고 있고\n미국, 중국 등 주요국의 패권경쟁이 심화됨에 따라 우리나라도 소부장\n산업의 육성ㆍ보호와 안정적인 공급망 확보를 위한 종합적 대책 마련\n\n\n\n이 요구되고 있음. 특히, 지난 4월 정부가 소부장산업 기술 자립화와\n공급망 내재화를 위해 추가로 지정된 특화단지 5곳에 5년간 5천억원\n을 투자하겠다고 밝혔으며, 이를 시행하려면 정부의 지속적인 재정지\n원이 필요하므로 소재ㆍ부품ㆍ장비경쟁력강화특별회계의 일몰기한 폐\n지가 필요함.\n이에 소재ㆍ부품ㆍ장비경쟁력강화특별회계의 일몰기한을 폐지함으\n로써 소부장산업의 전략기술 육성과 관련 사업의 안정적인 추진을 도\n모하여 공급망 확보와 국민경제의 지속적인 발전에 이바지하려는 것\n임(안 법률 제16859호 소재ㆍ부품전문기업 등의 육성에 관한 특별조치\n법 전부개정법률 부칙 제2조 삭제).\n\n법률 제 호\n소재ㆍ부품ㆍ장비산업 경쟁력 강화 및 공급망 안정화를\n위한 특별조치법 일부개정법률안\n소재ㆍ부품ㆍ장비산업 경쟁력 강화 및 공급망 안정화를 위한 특별조\n치법 일부를 다음과 같이 개정한다.\n법률 제16859호 소재ㆍ부품전문기업 등의 육성에 관한 특별조치법 전\n부개정법률 부칙 제2조를 삭제한다.\n부 칙\n이 법은 공포한 날부터 시행한다.\n\n\n\n\n신ㆍ구조문대비표\n현 행 개 정 안\n법률 제16859호 법률 제16859호\n소재ㆍ부품전문기업 등의 육성에 소재ㆍ부품전문기업 등의 육성에\n관한 특별조치법 전부개정법률 관한 특별조치법 전부개정법률\n부칙 부칙\n제2조(특별회계의 유효기간) 제68 <삭 제>\n조부터 제73조까지의 개정규정\n은 2024년 12월 31일까지 효력\n을 가진다.\n",
  "sections": {
    "제안이유": "및",
    "주요내용": "현행법에 따른 소재ㆍ부품ㆍ장비경쟁력강화특별회계는 소재ㆍ부품\nㆍ장비산업(이하 “소부장산업”이라 함) 경쟁력강화 기본계획의 안정적\n추진을 위한 재원확보와 관련 사업의 효율적 시행을 위하여 설치된\n특별회계로, 2019년에 5년 한시 회계로 설치되어 2024년 12월 31일까\n지 유효한 상황임.\n그런데 코로나19 팬데믹 이후 글로벌 공급망 교란이 지속되고 있고\n미국, 중국 등 주요국의 패권경쟁이 심화됨에 따라 우리나라도 소부장\n산업의 육성ㆍ보호와 안정적인 공급망 확보를 위한 종합적 대책 마련\n\n\n\n이 요구되고 있음. 특히, 지난 4월 정부가 소부장산업 기술 자립화와\n공급망 내재화를 위해 추가로 지정된 특화단지 5곳에 5년간 5천억원\n을 투자하겠다고 밝혔으며, 이를 시행하려면 정부의 지속적인 재정지\n원이 필요하므로 소재ㆍ부품ㆍ장비경쟁력강화특별회계의 일몰기한 폐\n지가 필요함.\n이에 소재ㆍ부품ㆍ장비경쟁력강화특별회계의 일몰기한을 폐지함으\n로써 소부장산업의 전략기술 육성과 관련 사업의 안정적인 추진을 도\n모하여 공급망 확보와 국민경제의 지속적인 발전에 이바지하려는 것\n임(안",
    "제안이유_및_주요내용": "현행법에 따른 소재ㆍ부품ㆍ장비경쟁력강화특별회계는 소재ㆍ부품\nㆍ장비산업(이하 “소부장산업”이라 함) 경쟁력강화 기본계획의 안정적\n추진을 위한 재원확보와 관련 사업의 효율적 시행을 위하여 설치된\n특별회계로, 2019년에 5년 한시 회계로 설치되어 2024년 12월 31일까\n지 유효한 상황임.\n그런데 코로나19 팬데믹 이후 글로벌 공급망 교란이 지속되고 있고\n미국, 중국 등 주요국의 패권경쟁이 심화됨에 따라 우리나라도 소부장\n산업의 육성ㆍ보호와 안정적인 공급망 확보를 위한 종합적 대책 마련\n\n\n\n이 요구되고 있음. 특히, 지난 4월 정부가 소부장산업 기술 자립화와\n공급망 내재화를 위해 추가로 지정된 특화단지 5곳에 5년간 5천억원\n을 투자하겠다고 밝혔으며, 이를 시행하려면 정부의 지속적인 재정지\n원이 필요하므로 소재ㆍ부품ㆍ장비경쟁력강화특별회계의 일몰기한 폐\n지가 필요함.\n이에 소재ㆍ부품ㆍ장비경쟁력강화특별회계의 일몰기한을 폐지함으\n로써 소부장산업의 전략기술 육성과 관련 사업의 안정적인 추진을 도\n모하여 공급망 확보와 국민경제의 지속적인 발전에 이바지하려는 것\n임(안",
    "법률_제_호": "소재ㆍ부품전문기업 등의 육성에 관한 특별조치\n법 전부개정법률",
    "신구조문대비표": "현 행 개 정 안\n법률 제16859호 법률 제16859호\n소재ㆍ부품전문기업 등의 육성에 소재ㆍ부품전문기업 등의 육성에\n관한 특별조치법 전부개정법률 관한 특별조치법 전부개정법률"
  }
}