{
  "title": "2201056_국민연금법_일부개정법률안",
  "bill_number": "1056",
  "proposal_date": "2024. 6. 27.",
  "submission_date": "",
  "is_alternative": false,
  "alternative_bill_numbers": [],
  "has_comparison_table": false,
  "comparison_table": "신ㆍ구조문대비표\n현 행 개 정 안\n제3조의2(국가의 책무) 국가는 이 제3조의2(국가의 책무) ---------\n법에 따른 연금급여가 안정적 -----------연금급여의 안정적\nㆍ지속적으로 지급되도록 필요 이고 지속적인 지급을 보장하\n한 시책을 수립ㆍ시행하여야 여야 하며, 이에--------------\n한다. ---------------------.",
  "full_text": "국민연금법 일부개정법률안\n(한정애의원 대표발의)\n발의연월일 : 2024. 6. 27.\n의 안\n1056\n번 호 발 의 자 : 한정애ㆍ박홍배ㆍ송옥주\n김주영ㆍ정성호ㆍ강훈식\n부승찬ㆍ장철민ㆍ서영교\n김민석ㆍ박홍근ㆍ이병진\n이수진 의원(13인)\n제안이유 및 주요내용\n국민연금 재정계산을 통한 기금 소진 예상 시점이 2055년으로 10년\n앞으로 다가옴에 따라 연기금이 고갈되면 급여를 받을 수 없을 것이\n라는 우려가 심화되고 있으며, 연금 고갈 문제가 세대간 갈등으로 번\n지는 등 국민연금 제도에 대한 불신이 증폭되고 있음.\n이에 국민연금도 공무원연금ㆍ군인연금ㆍ사립학교교원연금 등 직역\n연금처럼 국가의 지급 보장을 명문화하여 국민연금에 대한 국민 신뢰\n를 높이고자 함(안 제3조의2).\n\n\n\n\n법률 제 호\n국민연금법 일부개정법률안\n국민연금법 일부를 다음과 같이 개정한다.\n제3조의2 중 “연금급여가 안정적ㆍ지속적으로 지급되도록”을 “연금급\n여의 안정적이고 지속적인 지급을 보장하여야 하며, 이에”로 한다.\n부 칙\n이 법은 공포한 날부터 시행한다.\n\n\n\n\n신ㆍ구조문대비표\n현 행 개 정 안\n제3조의2(국가의 책무) 국가는 이 제3조의2(국가의 책무) ---------\n법에 따른 연금급여가 안정적 -----------연금급여의 안정적\nㆍ지속적으로 지급되도록 필요 이고 지속적인 지급을 보장하\n한 시책을 수립ㆍ시행하여야 여야 하며, 이에--------------\n한다. ---------------------.\n",
  "sections": {
    "제안이유": "및",
    "주요내용": "국민연금 재정계산을 통한 기금 소진 예상 시점이 2055년으로 10년\n앞으로 다가옴에 따라 연기금이 고갈되면 급여를 받을 수 없을 것이\n라는 우려가 심화되고 있으며, 연금 고갈 문제가 세대간 갈등으로 번\n지는 등 국민연금 제도에 대한 불신이 증폭되고 있음.\n이에 국민연금도 공무원연금ㆍ군인연금ㆍ사립학교교원연금 등 직역\n연금처럼 국가의 지급 보장을 명문화하여 국민연금에 대한 국민 신뢰\n를 높이고자 함(안 제3조의2).",
    "제안이유_및_주요내용": "국민연금 재정계산을 통한 기금 소진 예상 시점이 2055년으로 10년\n앞으로 다가옴에 따라 연기금이 고갈되면 급여를 받을 수 없을 것이\n라는 우려가 심화되고 있으며, 연금 고갈 문제가 세대간 갈등으로 번\n지는 등 국민연금 제도에 대한 불신이 증폭되고 있음.\n이에 국민연금도 공무원연금ㆍ군인연금ㆍ사립학교교원연금 등 직역\n연금처럼 국가의 지급 보장을 명문화하여 국민연금에 대한 국민 신뢰\n를 높이고자 함(안 제3조의2).",
    "법률_제_호": "국민연금법 일부개정법률안\n국민연금법 일부를 다음과 같이 개정한다.\n제3조의2 중 “연금급여가 안정적ㆍ지속적으로 지급되도록”을 “연금급\n여의 안정적이고 지속적인 지급을 보장하여야 하며, 이에”로 한다.",
    "신구조문대비표": "현 행 개 정 안\n제3조의2(국가의 책무) 국가는 이 제3조의2(국가의 책무) ---------\n법에 따른 연금급여가 안정적 -----------연금급여의 안정적\nㆍ지속적으로 지급되도록 필요 이고 지속적인 지급을 보장하\n한 시책을 수립ㆍ시행하여야 여야 하며, 이에--------------\n한다. ---------------------."
  }
}