{
  "title": "2201767_공공주택_특별법_일부개정법률안",
  "bill_number": "1767",
  "proposal_date": "2024. 7. 15.",
  "submission_date": "",
  "is_alternative": false,
  "alternative_bill_numbers": [],
  "has_comparison_table": false,
  "comparison_table": "신ㆍ구조문대비표\n현 행 개 정 안\n법률 제18311호 공공주택 특별법 법률 제18311호 공공주택 특별법\n일부개정법률 ",
  "full_text": "공공주택 특별법 일부개정법률안\n(김남근의원 대표발의)\n발의연월일 : 2024. 7. 15.\n의 안\n1767\n번 호 발 의 자 : 김남근ㆍ남인순ㆍ김동아\n박홍근ㆍ채현일ㆍ민병덕\n김우영ㆍ황정아ㆍ이용선\n조 국ㆍ이해식ㆍ박지원\n김민석ㆍ오기형ㆍ고민정\n복기왕ㆍ염태영ㆍ김영배\n정준호ㆍ진성준ㆍ서영석\n장경태ㆍ서왕진ㆍ박주민\n박민규 의원(25인)\n제안이유 및 주요내용\n도심 공공주택 복합사업은 기존 민간사업으로는 개발이 어려워 저\n이용ㆍ노후화되고 있는 지역을 공공이 지구지정을 통해 부지를 확보\n하여 공공주도로 사업을 추진하는 대신, 개발절차 간소화, 용적률 등\n도시ㆍ건축 규제 완화 등 혜택을 제공해 양질의 주택 공급과 도시기\n능 재구조화를 신속하게 추진하기 위한 사업임.\n하지만 윤석열 정부와 오세훈 시장은 도심공공주택복합사업을 전 정\n부의 사업으로 치부하고 민간 주도의 주택공급을 주장하며 사실상 사\n업을 방치하고 있음.\n게다가 민간재개발 사업은 오세훈 서울시장이 2017년 이후 부동산\n\n\n\n가격 상승 분위기에서 규제완화를 통해 조합원의 부담을 낮추고 신속\n하게 추진한다는 공약으로 큰 지지를 모았음에도 2022년 이후 부동산\n가격 하락으로 고가 분양을 통한 사업수익 확보가 어려워지고 러시아\n-우크라이나 전쟁 이후 원자재비 상승으로 공사비가 인상되었으며 방\n만한 PF금융 운영으로 인한 건설사의 재정능력이 위기에 처하게 됨에\n따라 약속과 달리 조합원의 분담금 부담이 치솟게 되어 개발사업에\n회의적이거나 관망하는 조합원의 등장으로 지역 공동체의 갈등을 유\n발하고 있는 상황임.\n이런 상황을 타개하기 위해서 LH, SH 등 공공사업자 중심으로 공\n공재개발, 도심공공주택복합개발 등의 사업으로 마중물을 내 주어야\n하나 정작 공공개발사업을 주도해야 할 일부 공공사업자의 경우 정권\n의 눈치를 보며 사업 지연을 하거나 제 역할을 벗어난 개발사업을 벌\n이는 등 본연의 모습을 잃어가고 있음.\n더군다나 「공공주택 특별법」의 도심공공주택 복합 사업 유효기간\n이 2024년 9월 20일로 만료됨에 따라 대부분의 지구가 도심 공공주택\n복합사업 후보지에서 해제될 우려가 있고 개정안의 발의시점인 현재\n까지 40개 지구 중에서 지구지정은 단 9개에 불과하여 3년의 기간으\n로는 안정적인 사업추진이 어렵다고 판단되는 바, 2024년 9월 20일까\n지인 「공공주택 특별법」 제40조의7 등의 유효기간을 2029년 9월 20\n일로 5년 더 연장함으로써 안정적인 공공개발 사업 유효기간을 확보\n하여 전체적으로 지체된 부동산 개발 상황에 활로를 제시하고자 함(안\n\n부칙 제4조 등).\n\n\n\n\n법률 제 호\n공공주택 특별법 일부개정법률안\n공공주택 특별법 일부를 다음과 같이 개정한다.\n법률 제18311호 공공주택 특별법 일부개정법률 부칙 제2조 중 “3년간”\n을 “8년간”으로 한다.\n법률 제19763호 공공주택 특별법 일부개정법률 부칙 제4조 중 “2024\n년”을 “2029년”으로 한다.\n부 칙\n이 법은 공포한 날부터 시행한다.\n\n\n\n\n신ㆍ구조문대비표\n현 행 개 정 안\n법률 제18311호 공공주택 특별법 법률 제18311호 공공주택 특별법\n일부개정법률 부칙 일부개정법률 부칙\n제2조(도심 공공주택 복합사업에 제2조(도심 공공주택 복합사업에\n관한 규정의 유효기간) 제2조 관한 규정의 유효기간) ------\n제2호의2, 같은 조 제3호마목, ----------------------------\n제4조제1항제6호, 제33조, 제34 ----------------------------\n조제1항, 제5장의3(제40조의7부 ----------------------------\n터 제40조의13까지) 및 제57조 ----------------------------\n의3제2호의 개정규정은 이 법 ----------------------------\n시행일부터 3년간 효력을 가진 -------------8년간----------\n다. ----.\n법률 제19763호 공공주택 특별법 법률 제19763호 공공주택 특별법\n일부개정법률 부칙 일부개정법률 부칙\n제4조(도심 공공주택 복합사업 제4조(도심 공공주택 복합사업\n유효기간) 제40조의8 및 제40 유효기간) ------------------\n조의10부터 제40조의17까지의 ----------------------------\n개정규정은 2024년 9월 20일 ----------2029년------------\n까지 효력을 가진다. ---------------.\n",
  "sections": {
    "제안이유": "및",
    "주요내용": "도심 공공주택 복합사업은 기존 민간사업으로는 개발이 어려워 저\n이용ㆍ노후화되고 있는 지역을 공공이 지구지정을 통해 부지를 확보\n하여 공공주도로 사업을 추진하는 대신, 개발절차 간소화, 용적률 등\n도시ㆍ건축 규제 완화 등 혜택을 제공해 양질의 주택 공급과 도시기\n능 재구조화를 신속하게 추진하기 위한 사업임.\n하지만 윤석열 정부와 오세훈 시장은 도심공공주택복합사업을 전 정\n부의 사업으로 치부하고 민간 주도의 주택공급을 주장하며 사실상 사\n업을 방치하고 있음.\n게다가 민간재개발 사업은 오세훈 서울시장이 2017년 이후 부동산\n\n\n\n가격 상승 분위기에서 규제완화를 통해 조합원의 부담을 낮추고 신속\n하게 추진한다는 공약으로 큰 지지를 모았음에도 2022년 이후 부동산\n가격 하락으로 고가 분양을 통한 사업수익 확보가 어려워지고 러시아\n-우크라이나 전쟁 이후 원자재비 상승으로 공사비가 인상되었으며 방\n만한 PF금융 운영으로 인한 건설사의 재정능력이 위기에 처하게 됨에\n따라 약속과 달리 조합원의 분담금 부담이 치솟게 되어 개발사업에\n회의적이거나 관망하는 조합원의 등장으로 지역 공동체의 갈등을 유\n발하고 있는 상황임.\n이런 상황을 타개하기 위해서 LH, SH 등 공공사업자 중심으로 공\n공재개발, 도심공공주택복합개발 등의 사업으로 마중물을 내 주어야\n하나 정작 공공개발사업을 주도해야 할 일부 공공사업자의 경우 정권\n의 눈치를 보며 사업 지연을 하거나 제 역할을 벗어난 개발사업을 벌\n이는 등 본연의 모습을 잃어가고 있음.\n더군다나 「공공주택 특별법」의 도심공공주택 복합 사업 유효기간\n이 2024년 9월 20일로 만료됨에 따라 대부분의 지구가 도심 공공주택\n복합사업 후보지에서 해제될 우려가 있고 개정안의 발의시점인 현재\n까지 40개 지구 중에서 지구지정은 단 9개에 불과하여 3년의 기간으\n로는 안정적인 사업추진이 어렵다고 판단되는 바, 2024년 9월 20일까\n지인 「공공주택 특별법」 제40조의7 등의 유효기간을 2029년 9월 20\n일로 5년 더 연장함으로써 안정적인 공공개발 사업 유효기간을 확보\n하여 전체적으로 지체된 부동산 개발 상황에 활로를 제시하고자 함(안\n\n부칙 제4조 등).",
    "제안이유_및_주요내용": "도심 공공주택 복합사업은 기존 민간사업으로는 개발이 어려워 저\n이용ㆍ노후화되고 있는 지역을 공공이 지구지정을 통해 부지를 확보\n하여 공공주도로 사업을 추진하는 대신, 개발절차 간소화, 용적률 등\n도시ㆍ건축 규제 완화 등 혜택을 제공해 양질의 주택 공급과 도시기\n능 재구조화를 신속하게 추진하기 위한 사업임.\n하지만 윤석열 정부와 오세훈 시장은 도심공공주택복합사업을 전 정\n부의 사업으로 치부하고 민간 주도의 주택공급을 주장하며 사실상 사\n업을 방치하고 있음.\n게다가 민간재개발 사업은 오세훈 서울시장이 2017년 이후 부동산\n\n\n\n가격 상승 분위기에서 규제완화를 통해 조합원의 부담을 낮추고 신속\n하게 추진한다는 공약으로 큰 지지를 모았음에도 2022년 이후 부동산\n가격 하락으로 고가 분양을 통한 사업수익 확보가 어려워지고 러시아\n-우크라이나 전쟁 이후 원자재비 상승으로 공사비가 인상되었으며 방\n만한 PF금융 운영으로 인한 건설사의 재정능력이 위기에 처하게 됨에\n따라 약속과 달리 조합원의 분담금 부담이 치솟게 되어 개발사업에\n회의적이거나 관망하는 조합원의 등장으로 지역 공동체의 갈등을 유\n발하고 있는 상황임.\n이런 상황을 타개하기 위해서 LH, SH 등 공공사업자 중심으로 공\n공재개발, 도심공공주택복합개발 등의 사업으로 마중물을 내 주어야\n하나 정작 공공개발사업을 주도해야 할 일부 공공사업자의 경우 정권\n의 눈치를 보며 사업 지연을 하거나 제 역할을 벗어난 개발사업을 벌\n이는 등 본연의 모습을 잃어가고 있음.\n더군다나 「공공주택 특별법」의 도심공공주택 복합 사업 유효기간\n이 2024년 9월 20일로 만료됨에 따라 대부분의 지구가 도심 공공주택\n복합사업 후보지에서 해제될 우려가 있고 개정안의 발의시점인 현재\n까지 40개 지구 중에서 지구지정은 단 9개에 불과하여 3년의 기간으\n로는 안정적인 사업추진이 어렵다고 판단되는 바, 2024년 9월 20일까\n지인 「공공주택 특별법」 제40조의7 등의 유효기간을 2029년 9월 20\n일로 5년 더 연장함으로써 안정적인 공공개발 사업 유효기간을 확보\n하여 전체적으로 지체된 부동산 개발 상황에 활로를 제시하고자 함(안\n\n부칙 제4조 등).",
    "법률_제_호": "공공주택 특별법 일부개정법률안\n공공주택 특별법 일부를 다음과 같이 개정한다.\n법률 제18311호 공공주택 특별법 일부개정법률",
    "신구조문대비표": "현 행 개 정 안\n법률 제18311호 공공주택 특별법 법률 제18311호 공공주택 특별법\n일부개정법률"
  }
}