{
  "title": "2201812_지방교육재정교부금법_일부개정법률안",
  "bill_number": "1812",
  "proposal_date": "2024. 7. 16.",
  "submission_date": "",
  "is_alternative": false,
  "alternative_bill_numbers": [],
  "has_comparison_table": false,
  "comparison_table": "신ㆍ구조문대비표\n현 행 개 정 안\n법률 제16673호 지방교육재정교 법률 제16673호 지방교육재정교\n부금법 일부개정법률 ",
  "full_text": "지방교육재정교부금법 일부개정법률안\n(문정복의원 대표발의)\n발의연월일 : 2024. 7. 16.\n의 안\n1812\n번 호 발 의 자 : 문정복ㆍ민병덕ㆍ부승찬\n최기상ㆍ박상혁ㆍ김준혁\n백승아ㆍ이언주ㆍ문금주\n김영호ㆍ송재봉ㆍ윤준병\n의원(12인)\n제안이유 및 주요내용\n현행법에서는 국가는 고등학교 등의 무상교육에 필요한 비용 중\n1,000분의 475에 해당하는 금액을 교부금 외에 따로 증액교부하도록\n하고 있으나, 2024년 12월 31일을 기한으로 일몰이 예정되어 있음.\n그런데 고물가와 경기침체가 지속되는 상황에서 국가의 경비 지원\n이 중단될 경우 각 지역의 교육재정 운영에 어려움이 가중될 우려가\n있으므로 해당 특례의 적용기한을 연장할 필요가 있다는 의견이 제기\n되고 있음.\n이에 고등학교 등의 무상교육 경비 부담에 관한 특례의 적용기한을\n2027년까지 3년 연장하여 고등학교 등의 무상교육이 안정적으로 운영\n되도록 하려는 것임(안 법률 제16673호 지방교육재정교부금법 일부개\n정법률 부칙 제2조).\n\n\n\n\n법률 제 호\n지방교육재정교부금법 일부개정법률안\n지방교육재정교부금법 일부를 다음과 같이 개정한다.\n법률 제16673호 지방교육재정교부금법 일부개정법률 부칙 제2조 중\n“2024년”을 “2027년”으로 한다.\n부 칙\n이 법은 공포한 날부터 시행한다.\n\n\n\n\n신ㆍ구조문대비표\n현 행 개 정 안\n법률 제16673호 지방교육재정교 법률 제16673호 지방교육재정교\n부금법 일부개정법률 부칙 부금법 일부개정법률 부칙\n제2조(유효기간) 제14조의 개정규 제2조(유효기간) ---------------\n정은 2020년 1월 1일부터 2024 ------------------------2027\n년 12월 31일까지 효력을 가진 년--------------------------\n다. --.\n",
  "sections": {
    "제안이유": "및",
    "주요내용": "현행법에서는 국가는 고등학교 등의 무상교육에 필요한 비용 중\n1,000분의 475에 해당하는 금액을 교부금 외에 따로 증액교부하도록\n하고 있으나, 2024년 12월 31일을 기한으로 일몰이 예정되어 있음.\n그런데 고물가와 경기침체가 지속되는 상황에서 국가의 경비 지원\n이 중단될 경우 각 지역의 교육재정 운영에 어려움이 가중될 우려가\n있으므로 해당 특례의 적용기한을 연장할 필요가 있다는 의견이 제기\n되고 있음.\n이에 고등학교 등의 무상교육 경비 부담에 관한 특례의 적용기한을\n2027년까지 3년 연장하여 고등학교 등의 무상교육이 안정적으로 운영\n되도록 하려는 것임(안",
    "제안이유_및_주요내용": "현행법에서는 국가는 고등학교 등의 무상교육에 필요한 비용 중\n1,000분의 475에 해당하는 금액을 교부금 외에 따로 증액교부하도록\n하고 있으나, 2024년 12월 31일을 기한으로 일몰이 예정되어 있음.\n그런데 고물가와 경기침체가 지속되는 상황에서 국가의 경비 지원\n이 중단될 경우 각 지역의 교육재정 운영에 어려움이 가중될 우려가\n있으므로 해당 특례의 적용기한을 연장할 필요가 있다는 의견이 제기\n되고 있음.\n이에 고등학교 등의 무상교육 경비 부담에 관한 특례의 적용기한을\n2027년까지 3년 연장하여 고등학교 등의 무상교육이 안정적으로 운영\n되도록 하려는 것임(안",
    "법률_제_호": "지방교육재정교부금법 일부개\n정법률",
    "신구조문대비표": "현 행 개 정 안\n법률 제16673호 지방교육재정교 법률 제16673호 지방교육재정교\n부금법 일부개정법률"
  }
}