{
  "title": "2201033_형법_일부개정법률안",
  "bill_number": "1033",
  "proposal_date": "2024. 6. 27.",
  "submission_date": "",
  "is_alternative": false,
  "alternative_bill_numbers": [],
  "has_comparison_table": false,
  "comparison_table": "신ㆍ구조문대비표\n현 행 개 정 안\n<신 설> 제118조의2(친일반민족행위 정당\n화 금지) 「일제강점하 반민족\n행위 진상규명에 관한 특별\n법」에 따른 친일반민족행위를\n정당화하는 내용을 선전ㆍ선동\n하는 자는 3년 이하의 징역 또\n는 3천만원 이하의 벌금에 처\n한다.",
  "full_text": "형법 일부개정법률안\n(김용만의원 대표발의)\n발의연월일 : 2024. 6. 27.\n의 안\n1033\n번 호 발 의 자 : 김용만ㆍ김용민ㆍ박상혁\n강훈식ㆍ이수진ㆍ임미애\n임오경ㆍ민병덕ㆍ이인영\n조승래ㆍ민형배 의원\n(11인)\n제안이유 및 주요내용\n일본 군국주의 상징물인 욱일기가 현충일에 부산에 한 아파트에서\n게첩되고, 일본군 위안부 피해자 문제해결을 위한 정기 수요집회 현장\n에서 일부 단체가 욱일기를 앞세워 위안부 피해자들을 모욕하는 행위\n가 발생하고 있음. 그럼에도 현행법상 이에 대한 처벌규정이 없어 욱\n일기 사용 등 헌법질서를 파괴하는 친일반민족행위가 계속되고 있는\n실정임.\n한편, 역사의 진실과 민족의 정통성을 확인하기 위한 목적으로 일제\n강점하 반민족행위 진상규명에 관한 특별법을 2003년 여야합의로 통\n과시킨 바 있고, 이 법에 따르면 친일반민족행위를 정의하고 있음.\n이에 일제강점하 친일반민족행위 진상규명에 관한 특별법 상 친일\n반민족행위를 정당화하는 행위를 금지하여 이를 위반하는 경우 3년\n이하의 징역 또는 3천만원 이하의 벌금에 처하려는 것임(안 제118조의\n\n\n\n2 신설).\n\n법률 제 호\n형법 일부개정법률안\n형법 일부를 다음과 같이 개정한다.\n제2편제5장에 제118조의2를 다음과 같이 신설한다.\n제118조의2(친일반민족행위 정당화 금지) 「일제강점하 반민족행위 진\n상규명에 관한 특별법」에 따른 친일반민족행위를 정당화하는 내용\n을 선전ㆍ선동하는 자는 3년 이하의 징역 또는 3천만원 이하의 벌\n금에 처한다.\n부 칙\n이 법은 공포 후 3개월이 경과한 날부터 시행한다.\n\n\n\n\n신ㆍ구조문대비표\n현 행 개 정 안\n<신 설> 제118조의2(친일반민족행위 정당\n화 금지) 「일제강점하 반민족\n행위 진상규명에 관한 특별\n법」에 따른 친일반민족행위를\n정당화하는 내용을 선전ㆍ선동\n하는 자는 3년 이하의 징역 또\n는 3천만원 이하의 벌금에 처\n한다.\n",
  "sections": {
    "제안이유": "및",
    "주요내용": "일본 군국주의 상징물인 욱일기가 현충일에 부산에 한 아파트에서\n게첩되고, 일본군 위안부 피해자 문제해결을 위한 정기 수요집회 현장\n에서 일부 단체가 욱일기를 앞세워 위안부 피해자들을 모욕하는 행위\n가 발생하고 있음. 그럼에도 현행법상 이에 대한 처벌규정이 없어 욱\n일기 사용 등 헌법질서를 파괴하는 친일반민족행위가 계속되고 있는\n실정임.\n한편, 역사의 진실과 민족의 정통성을 확인하기 위한 목적으로 일제\n강점하 반민족행위 진상규명에 관한 특별법을 2003년 여야합의로 통\n과시킨 바 있고, 이 법에 따르면 친일반민족행위를 정의하고 있음.\n이에 일제강점하 친일반민족행위 진상규명에 관한 특별법 상 친일\n반민족행위를 정당화하는 행위를 금지하여 이를 위반하는 경우 3년\n이하의 징역 또는 3천만원 이하의 벌금에 처하려는 것임(안 제118조의\n\n\n\n2 신설).",
    "제안이유_및_주요내용": "일본 군국주의 상징물인 욱일기가 현충일에 부산에 한 아파트에서\n게첩되고, 일본군 위안부 피해자 문제해결을 위한 정기 수요집회 현장\n에서 일부 단체가 욱일기를 앞세워 위안부 피해자들을 모욕하는 행위\n가 발생하고 있음. 그럼에도 현행법상 이에 대한 처벌규정이 없어 욱\n일기 사용 등 헌법질서를 파괴하는 친일반민족행위가 계속되고 있는\n실정임.\n한편, 역사의 진실과 민족의 정통성을 확인하기 위한 목적으로 일제\n강점하 반민족행위 진상규명에 관한 특별법을 2003년 여야합의로 통\n과시킨 바 있고, 이 법에 따르면 친일반민족행위를 정의하고 있음.\n이에 일제강점하 친일반민족행위 진상규명에 관한 특별법 상 친일\n반민족행위를 정당화하는 행위를 금지하여 이를 위반하는 경우 3년\n이하의 징역 또는 3천만원 이하의 벌금에 처하려는 것임(안 제118조의\n\n\n\n2 신설).",
    "법률_제_호": "형법 일부개정법률안\n형법 일부를 다음과 같이 개정한다.\n제2편제5장에 제118조의2를 다음과 같이 신설한다.\n제118조의2(친일반민족행위 정당화 금지) 「일제강점하 반민족행위 진\n상규명에 관한 특별법」에 따른 친일반민족행위를 정당화하는 내용\n을 선전ㆍ선동하는 자는 3년 이하의 징역 또는 3천만원 이하의 벌\n금에 처한다.",
    "신구조문대비표": "현 행 개 정 안\n<신 설> 제118조의2(친일반민족행위 정당\n화 금지) 「일제강점하 반민족\n행위 진상규명에 관한 특별\n법」에 따른 친일반민족행위를\n정당화하는 내용을 선전ㆍ선동\n하는 자는 3년 이하의 징역 또\n는 3천만원 이하의 벌금에 처\n한다."
  }
}