{
  "title": "2201819_의료법_일부개정법률안",
  "bill_number": "1819",
  "proposal_date": "2024. 7. 17.",
  "submission_date": "",
  "is_alternative": false,
  "alternative_bill_numbers": [],
  "has_comparison_table": false,
  "comparison_table": "신ㆍ구조문대비표\n현 행 개 정 안\n제20조(태아 성 감별 행위 등 금 제20조(태아 성 감별 행위 등 금\n지) ① (생 략) 지) ① (현행과 같음)\n② 의료인은 임신 32주 이전에 <삭 제>\n태아나 임부를 진찰하거나 검\n사하면서 알게 된 태아의 성\n(性)을 임부, 임부의 가족, 그\n밖의 다른 사람이 알게 하여서\n는 아니 된다.",
  "full_text": "의료법 일부개정법률안\n(박희승의원 대표발의)\n발의연월일 : 2024. 7. 17.\n의 안\n1819\n번 호 발 의 자 : 박희승ㆍ박상혁ㆍ한민수\n정성호ㆍ김정호ㆍ윤준병\n최기상ㆍ강유정ㆍ조 국\n김영진 의원(10인)\n제안이유 및 주요내용\n현행법은 의료인이 임신 32주 이전에 태아나 임부를 진찰하거나 검\n사하면서 알게 된 태아의 성(性)을 임부, 임부의 가족, 그 밖의 다른\n사람에 알리는 것을 금지하고, 이를 위반한 의료인에 대해 1년의 범위\n에서 면허자격 정지와 2년 이하의 징역이나 2천만 원 이하의 벌금에\n처하도록 하고 있음.\n이와 관련하여 헌법재판소에서는 태아의 성별 고지를 제한하는 것\n은 태아의 생명 보호라는 입법목적을 달성하기 위한 수단으로 적합하\n지 않고, 부모가 태아의 성별 정보에 대한 접근을 방해받지 않을 권리\n를 필요 이상으로 제약하여 침해의 최소성에 반하여 헌법에 위반된다\n고 하여 위헌 판결을 내린 바 있음([2022헌마356, 2023헌마189, 1305\n(병합) 결정]).\n과거 우리 사회에서 존재하던 남아선호사상에 따라 태아의 성을 선\n\n\n\n별하여 출산하는 경향이 발생하였고, 그 결과 남녀 간의 성비에 심한\n불균형이 초래되어 1987년 의료법에서 의료인에게 태아의 성별고지\n행위를 금지하는 규정을 도입하였으나, 그 사이 국민의 가치관과 의식\n의 변화로 남아선호사상은 확연히 쇠퇴하고 있고, 성비불균형은 해결\n되어 출생성비는 출산 순위와 관계없이 모두 자연성비에 도달하였으\n므로, 성별을 이유로 한 낙태는 더 이상 사회적으로 문제되지 않은 상\n황에서 부모가 태아의 성별 정보에 대한 접근을 방해받지 않을 권리\n를 침해하고 있음.\n이에 의료인의 태아 성별 고지를 제한하고 있는 해당 부분을 삭제\n함으로써 위헌성을 해소하고 부모의 태아의 성별 정보에 대한 접근권\n을 보장하려는 것임(안 제20조제2항 삭제).\n\n법률 제 호\n의료법 일부개정법률안\n의료법 일부를 다음과 같이 개정한다.\n제20조제2항을 삭제한다.\n부 칙\n이 법은 공포한 날부터 시행한다.\n\n\n\n\n신ㆍ구조문대비표\n현 행 개 정 안\n제20조(태아 성 감별 행위 등 금 제20조(태아 성 감별 행위 등 금\n지) ① (생 략) 지) ① (현행과 같음)\n② 의료인은 임신 32주 이전에 <삭 제>\n태아나 임부를 진찰하거나 검\n사하면서 알게 된 태아의 성\n(性)을 임부, 임부의 가족, 그\n밖의 다른 사람이 알게 하여서\n는 아니 된다.\n",
  "sections": {
    "제안이유": "및",
    "주요내용": "현행법은 의료인이 임신 32주 이전에 태아나 임부를 진찰하거나 검\n사하면서 알게 된 태아의 성(性)을 임부, 임부의 가족, 그 밖의 다른\n사람에 알리는 것을 금지하고, 이를 위반한 의료인에 대해 1년의 범위\n에서 면허자격 정지와 2년 이하의 징역이나 2천만 원 이하의 벌금에\n처하도록 하고 있음.\n이와 관련하여 헌법재판소에서는 태아의 성별 고지를 제한하는 것\n은 태아의 생명 보호라는 입법목적을 달성하기 위한 수단으로 적합하\n지 않고, 부모가 태아의 성별 정보에 대한 접근을 방해받지 않을 권리\n를 필요 이상으로 제약하여 침해의 최소성에 반하여 헌법에 위반된다\n고 하여 위헌 판결을 내린 바 있음([2022헌마356, 2023헌마189, 1305\n(병합) 결정]).\n과거 우리 사회에서 존재하던 남아선호사상에 따라 태아의 성을 선\n\n\n\n별하여 출산하는 경향이 발생하였고, 그 결과 남녀 간의 성비에 심한\n불균형이 초래되어 1987년 의료법에서 의료인에게 태아의 성별고지\n행위를 금지하는 규정을 도입하였으나, 그 사이 국민의 가치관과 의식\n의 변화로 남아선호사상은 확연히 쇠퇴하고 있고, 성비불균형은 해결\n되어 출생성비는 출산 순위와 관계없이 모두 자연성비에 도달하였으\n므로, 성별을 이유로 한 낙태는 더 이상 사회적으로 문제되지 않은 상\n황에서 부모가 태아의 성별 정보에 대한 접근을 방해받지 않을 권리\n를 침해하고 있음.\n이에 의료인의 태아 성별 고지를 제한하고 있는 해당 부분을 삭제\n함으로써 위헌성을 해소하고 부모의 태아의 성별 정보에 대한 접근권\n을 보장하려는 것임(안 제20조제2항 삭제).",
    "제안이유_및_주요내용": "현행법은 의료인이 임신 32주 이전에 태아나 임부를 진찰하거나 검\n사하면서 알게 된 태아의 성(性)을 임부, 임부의 가족, 그 밖의 다른\n사람에 알리는 것을 금지하고, 이를 위반한 의료인에 대해 1년의 범위\n에서 면허자격 정지와 2년 이하의 징역이나 2천만 원 이하의 벌금에\n처하도록 하고 있음.\n이와 관련하여 헌법재판소에서는 태아의 성별 고지를 제한하는 것\n은 태아의 생명 보호라는 입법목적을 달성하기 위한 수단으로 적합하\n지 않고, 부모가 태아의 성별 정보에 대한 접근을 방해받지 않을 권리\n를 필요 이상으로 제약하여 침해의 최소성에 반하여 헌법에 위반된다\n고 하여 위헌 판결을 내린 바 있음([2022헌마356, 2023헌마189, 1305\n(병합) 결정]).\n과거 우리 사회에서 존재하던 남아선호사상에 따라 태아의 성을 선\n\n\n\n별하여 출산하는 경향이 발생하였고, 그 결과 남녀 간의 성비에 심한\n불균형이 초래되어 1987년 의료법에서 의료인에게 태아의 성별고지\n행위를 금지하는 규정을 도입하였으나, 그 사이 국민의 가치관과 의식\n의 변화로 남아선호사상은 확연히 쇠퇴하고 있고, 성비불균형은 해결\n되어 출생성비는 출산 순위와 관계없이 모두 자연성비에 도달하였으\n므로, 성별을 이유로 한 낙태는 더 이상 사회적으로 문제되지 않은 상\n황에서 부모가 태아의 성별 정보에 대한 접근을 방해받지 않을 권리\n를 침해하고 있음.\n이에 의료인의 태아 성별 고지를 제한하고 있는 해당 부분을 삭제\n함으로써 위헌성을 해소하고 부모의 태아의 성별 정보에 대한 접근권\n을 보장하려는 것임(안 제20조제2항 삭제).",
    "법률_제_호": "의료법 일부개정법률안\n의료법 일부를 다음과 같이 개정한다.\n제20조제2항을 삭제한다.",
    "신구조문대비표": "현 행 개 정 안\n제20조(태아 성 감별 행위 등 금 제20조(태아 성 감별 행위 등 금\n지) ① (생 략) 지) ① (현행과 같음)\n② 의료인은 임신 32주 이전에 <삭 제>\n태아나 임부를 진찰하거나 검\n사하면서 알게 된 태아의 성\n(性)을 임부, 임부의 가족, 그\n밖의 다른 사람이 알게 하여서\n는 아니 된다."
  }
}