{
  "title": "2201287_성폭력범죄의_처벌_등에_관한_특례법_일부개정법률안",
  "bill_number": "1287",
  "proposal_date": "2024. 7. 2.",
  "submission_date": "",
  "is_alternative": false,
  "alternative_bill_numbers": [],
  "has_comparison_table": false,
  "comparison_table": "신·구조문대비표\n현 행 개 정 안\n제21조(공소시효에 관한 특례) ① 제21조(공소시효에 관한 특례) ①\n∼ ④ (생 략) ∼ ④ (현행과 같음)\n<신 설> ⑤ 가해자와 피해자가 친족관\n계일 때에는 공소시효가 10년\n연장된다.",
  "full_text": "성폭력범죄의 처벌 등에 관한 특례법 일부개정법률안\n(이종배의원 대표발의)\n발의연월일 : 2024. 7. 2.\n의 안\n1287\n번 호 발 의 자 : 이종배ㆍ김상훈ㆍ강대식\n조승환ㆍ최은석ㆍ엄태영\n성일종ㆍ김성원ㆍ이종욱\n송석준 의원(10인)\n제안이유 및 주요내용\n현행법상 성범죄의 공소시효는 특례의 적용을 받아 13세 미만 미성\n년자와 장애인같이 신고 여부에 대한 판단능력이 결여되거나 부족한\n경우 공소시효를 연장하거나 배제하고 있음.\n그러나 친족관계에 의한 성범죄의 공소시효는 피해자가 성인일 경\n우 신고가 어려운 친족관계라는 특성에도 불구하고 특례의 적용을 받\n지 못하고 있어 제도의 보완이 필요함.\n이에 친족관계에 의한 성범죄의 경우 성폭력범죄의 공소시효를 10\n년 연장되게 함으로써 친족관계에 의한 성폭력의 피해자의 인권을 보\n호하고 사법적 정의를 구현하고자 함(안 제21조제5항 신설).\n\n\n\n\n법률 제 호\n성폭력범죄의 처벌 등에 관한 특례법 일부개정법률안\n성폭력범죄의 처벌 등에 관한 특례법 일부를 다음과 같이 개정한다.\n제21조에 제5항을 다음과 같이 신설한다.\n⑤ 가해자와 피해자가 친족관계일 때에는 공소시효가 10년 연장된\n다.\n부 칙\n제1조(시행일) 이 법은 공포한 날부터 시행한다.\n제2조(적용례) 제21조제5항의 개정규정은 이 법 시행 전에 행하여진\n성폭력범죄로 아직 공소시효가 완성되지 아니한 것에 대하여도 적\n용한다.\n\n\n\n\n신·구조문대비표\n현 행 개 정 안\n제21조(공소시효에 관한 특례) ① 제21조(공소시효에 관한 특례) ①\n∼ ④ (생 략) ∼ ④ (현행과 같음)\n<신 설> ⑤ 가해자와 피해자가 친족관\n계일 때에는 공소시효가 10년\n연장된다.\n",
  "sections": {
    "제안이유": "및",
    "주요내용": "현행법상 성범죄의 공소시효는 특례의 적용을 받아 13세 미만 미성\n년자와 장애인같이 신고 여부에 대한 판단능력이 결여되거나 부족한\n경우 공소시효를 연장하거나 배제하고 있음.\n그러나 친족관계에 의한 성범죄의 공소시효는 피해자가 성인일 경\n우 신고가 어려운 친족관계라는 특성에도 불구하고 특례의 적용을 받\n지 못하고 있어 제도의 보완이 필요함.\n이에 친족관계에 의한 성범죄의 경우 성폭력범죄의 공소시효를 10\n년 연장되게 함으로써 친족관계에 의한 성폭력의 피해자의 인권을 보\n호하고 사법적 정의를 구현하고자 함(안 제21조제5항 신설).",
    "제안이유_및_주요내용": "현행법상 성범죄의 공소시효는 특례의 적용을 받아 13세 미만 미성\n년자와 장애인같이 신고 여부에 대한 판단능력이 결여되거나 부족한\n경우 공소시효를 연장하거나 배제하고 있음.\n그러나 친족관계에 의한 성범죄의 공소시효는 피해자가 성인일 경\n우 신고가 어려운 친족관계라는 특성에도 불구하고 특례의 적용을 받\n지 못하고 있어 제도의 보완이 필요함.\n이에 친족관계에 의한 성범죄의 경우 성폭력범죄의 공소시효를 10\n년 연장되게 함으로써 친족관계에 의한 성폭력의 피해자의 인권을 보\n호하고 사법적 정의를 구현하고자 함(안 제21조제5항 신설).",
    "법률_제_호": "성폭력범죄의 처벌 등에 관한 특례법 일부개정법률안\n성폭력범죄의 처벌 등에 관한 특례법 일부를 다음과 같이 개정한다.\n제21조에 제5항을 다음과 같이 신설한다.\n⑤ 가해자와 피해자가 친족관계일 때에는 공소시효가 10년 연장된\n다.",
    "신구조문대비표": "현 행 개 정 안\n제21조(공소시효에 관한 특례) ① 제21조(공소시효에 관한 특례) ①\n∼ ④ (생 략) ∼ ④ (현행과 같음)\n<신 설> ⑤ 가해자와 피해자가 친족관\n계일 때에는 공소시효가 10년\n연장된다."
  }
}