{
  "title": "2201103_공공주택_특별법_일부개정법률안",
  "bill_number": "1103",
  "proposal_date": "2024. 6. 28.",
  "submission_date": "",
  "is_alternative": false,
  "alternative_bill_numbers": [],
  "has_comparison_table": false,
  "comparison_table": "신ㆍ구조문대비표\n현 행 개 정 안\n법률 제18311호 공공주택 특별 법률 제18311호 공공주택 특별\n법 일부개정법률 ",
  "full_text": "공공주택 특별법 일부개정법률안\n(강선우의원 대표발의)\n발의연월일 : 2024. 6. 28.\n의 안\n1103\n번 호 발 의 자 : 강선우ㆍ송옥주ㆍ문진석\n이원택ㆍ염태영ㆍ한정애\n전현희ㆍ문대림ㆍ서영석\n김민석 의원(10인)\n제안이유 및 주요내용\n도심 공공주택 복합사업은 기존 민간사업으로는 개발이 어려워 저\n이용ㆍ노후화되고 있는 지역을 공공이 지구지정을 통해 부지를 확보\n하여 공공주도로 사업을 추진하는 대신, 개발절차 간소화, 용적률 등\n도시ㆍ건축 규제 완화 등 혜택을 제공해 양질의 주택 공급과 도시기\n능 재구조화를 신속하게 추진하기 위한 사업임.\n도심 공공주택 복합사업이 도입된 이후, 현재까지 전국에 총 9만 1,\n000가구를 공급할 수 있는 57개 후보지가 선정되었고, 이 가운데 총 1\n만 8,000가구 규모의 13개 지구가 본지구로 선정되었으며, 이 중 3,079\n가구를 공급할 수 있는 4개 지구가 본지구 지정 2년 만에 사업계획\n승인이 완료되어 시공사 선정작업에 돌입하는 등 다른 민간 사업에\n비해 사업이 매우 빠른 속도로 진행되고 있음.\n그러나 도심 공공주택 복합사업은 역세권 등 주택 수요가 많은 도\n\n\n\n심지역에 주택을 신속하게 공급할 수 있다는 장점에도 불구하고, 2024\n년 9월 20일까지 한시적으로 도입되어 곧 일몰이 도래하게 되며, 일몰\n이 도래할 경우, 아직 예정지구 지정을 받지 못한 지구는 도심 공공주\n택 복합사업 후보지에서 해제되어 큰 혼란이 발생할 우려가 있음.\n전문가들은 도심 공공주택 복합사업이 안정적으로 추진될 수 있도\n록 하기 위해서는 현행법을 개정해 도심 공공주택 복합사업의 유효기\n간을 3년 더 연장해야 한다고 주장하고 있음.\n이에 도심 공공주택 복합사업의 유효기간을 2027년 9월 20일까지로\n3년 더 연장하려는 것임(안 부칙 제4조).\n\n법률 제 호\n공공주택 특별법 일부개정법률안\n공공주택 특별법 일부를 다음과 같이 개정한다.\n법률 제18311호 공공주택 특별법 일부개정법률 부칙 제2조 중 “3년간”\n을 “6년간”으로 한다.\n법률 제19763호 공공주택 특별법 일부개정법률 부칙 제2조 중 “2024\n년”을 “2027년”으로 한다.\n같은 부칙 제4조 중 “2024년”을 “2027년”으로 한다.\n부 칙\n이 법은 공포한 날부터 시행한다.\n\n\n\n\n신ㆍ구조문대비표\n현 행 개 정 안\n법률 제18311호 공공주택 특별 법률 제18311호 공공주택 특별\n법 일부개정법률 부칙 법 일부개정법률 부칙\n제2조(도심 공공주택 복합사업에 제2조(도심 공공주택 복합사업에\n관한 규정의 유효기간) 제2조 관한 규정의 유효기간) ------\n제2호의2, 같은 조 제3호마목, ----------------------------\n제4조제1항제6호, 제33조, 제34 ----------------------------\n조제1항, 제5장의3(제40조의7부 ----------------------------\n터 제40조의13까지) 및 제57조 ----------------------------\n의3제2호의 개정규정은 이 법 ----------------------------\n시행일부터 3년간 효력을 가진 -------------6년간----------\n다. ----.\n법률 제19763호 공공주택 특별 법률 제19763호 공공주택 특별\n법 일부개정법률 부칙 법 일부개정법률 부칙\n제2조(현물보상 유효기간) 제27조 제2조(현물보상 유효기간) ------\n의4의 개정규정은 2024년 9월 -----------------2027년-----\n20일까지 효력을 가진다. ----------------------.\n제4조(도심 공공주택 복합사업 제4조(도심 공공주택 복합사업\n유효기간) 제40조의8 및 제40 유효기간) ------------------\n조의10부터 제40조의17까지의 ----------------------------\n개정규정은 2024년 9월 20일까 ----------2027년------------\n지 효력을 가진다. ---------------.\n",
  "sections": {
    "제안이유": "및",
    "주요내용": "도심 공공주택 복합사업은 기존 민간사업으로는 개발이 어려워 저\n이용ㆍ노후화되고 있는 지역을 공공이 지구지정을 통해 부지를 확보\n하여 공공주도로 사업을 추진하는 대신, 개발절차 간소화, 용적률 등\n도시ㆍ건축 규제 완화 등 혜택을 제공해 양질의 주택 공급과 도시기\n능 재구조화를 신속하게 추진하기 위한 사업임.\n도심 공공주택 복합사업이 도입된 이후, 현재까지 전국에 총 9만 1,\n000가구를 공급할 수 있는 57개 후보지가 선정되었고, 이 가운데 총 1\n만 8,000가구 규모의 13개 지구가 본지구로 선정되었으며, 이 중 3,079\n가구를 공급할 수 있는 4개 지구가 본지구 지정 2년 만에 사업계획\n승인이 완료되어 시공사 선정작업에 돌입하는 등 다른 민간 사업에\n비해 사업이 매우 빠른 속도로 진행되고 있음.\n그러나 도심 공공주택 복합사업은 역세권 등 주택 수요가 많은 도\n\n\n\n심지역에 주택을 신속하게 공급할 수 있다는 장점에도 불구하고, 2024\n년 9월 20일까지 한시적으로 도입되어 곧 일몰이 도래하게 되며, 일몰\n이 도래할 경우, 아직 예정지구 지정을 받지 못한 지구는 도심 공공주\n택 복합사업 후보지에서 해제되어 큰 혼란이 발생할 우려가 있음.\n전문가들은 도심 공공주택 복합사업이 안정적으로 추진될 수 있도\n록 하기 위해서는 현행법을 개정해 도심 공공주택 복합사업의 유효기\n간을 3년 더 연장해야 한다고 주장하고 있음.\n이에 도심 공공주택 복합사업의 유효기간을 2027년 9월 20일까지로\n3년 더 연장하려는 것임(안 부칙 제4조).",
    "제안이유_및_주요내용": "도심 공공주택 복합사업은 기존 민간사업으로는 개발이 어려워 저\n이용ㆍ노후화되고 있는 지역을 공공이 지구지정을 통해 부지를 확보\n하여 공공주도로 사업을 추진하는 대신, 개발절차 간소화, 용적률 등\n도시ㆍ건축 규제 완화 등 혜택을 제공해 양질의 주택 공급과 도시기\n능 재구조화를 신속하게 추진하기 위한 사업임.\n도심 공공주택 복합사업이 도입된 이후, 현재까지 전국에 총 9만 1,\n000가구를 공급할 수 있는 57개 후보지가 선정되었고, 이 가운데 총 1\n만 8,000가구 규모의 13개 지구가 본지구로 선정되었으며, 이 중 3,079\n가구를 공급할 수 있는 4개 지구가 본지구 지정 2년 만에 사업계획\n승인이 완료되어 시공사 선정작업에 돌입하는 등 다른 민간 사업에\n비해 사업이 매우 빠른 속도로 진행되고 있음.\n그러나 도심 공공주택 복합사업은 역세권 등 주택 수요가 많은 도\n\n\n\n심지역에 주택을 신속하게 공급할 수 있다는 장점에도 불구하고, 2024\n년 9월 20일까지 한시적으로 도입되어 곧 일몰이 도래하게 되며, 일몰\n이 도래할 경우, 아직 예정지구 지정을 받지 못한 지구는 도심 공공주\n택 복합사업 후보지에서 해제되어 큰 혼란이 발생할 우려가 있음.\n전문가들은 도심 공공주택 복합사업이 안정적으로 추진될 수 있도\n록 하기 위해서는 현행법을 개정해 도심 공공주택 복합사업의 유효기\n간을 3년 더 연장해야 한다고 주장하고 있음.\n이에 도심 공공주택 복합사업의 유효기간을 2027년 9월 20일까지로\n3년 더 연장하려는 것임(안 부칙 제4조).",
    "법률_제_호": "공공주택 특별법 일부개정법률안\n공공주택 특별법 일부를 다음과 같이 개정한다.\n법률 제18311호 공공주택 특별법 일부개정법률",
    "신구조문대비표": "현 행 개 정 안\n법률 제18311호 공공주택 특별 법률 제18311호 공공주택 특별\n법 일부개정법률"
  }
}