{
  "title": "2201025_군형법_일부개정법률안",
  "bill_number": "1025",
  "proposal_date": "2024. 6. 27.",
  "submission_date": "",
  "is_alternative": false,
  "alternative_bill_numbers": [],
  "has_comparison_table": false,
  "comparison_table": "신·구조문대비표\n현 행 개 정 안\n<신 설> 제92조의9(상관이 범한 성범죄에\n대한 형의 가중) 상관이 지위\n를 이용하여 제92조, 제92조의2\n부터 제92조의8까지의 죄를 범\n한 경우에는 그 죄에 정한 형\n의 2분의 1까지 가중할 수 있\n다.",
  "full_text": "군형법 일부개정법률안\n(윤후덕의원 대표발의)\n발의연월일 : 2024. 6. 27.\n의 안\n1025\n번 호 발 의 자 : 윤후덕ㆍ김정호ㆍ정준호\n박희승ㆍ이훈기ㆍ이연희\n정성호ㆍ이학영ㆍ김영배\n박 정ㆍ이병진 의원\n(11인)\n제안이유 및 주요내용\n상관의 성추행과 은폐 시도 등으로 인하여 여군 중사가 자살한 사\n건 이후 군대 내에서 발생하는 성범죄를 근절해야 한다는 목소리가\n높아지고 있지만, 상관의 우월적 지위를 이용한 성범죄는 지속적으로\n발생하고 있음.\n이는 폐쇄적이고 엄격한 상명하복 체계가 유지되는 군 조직의 특수\n성에 비추어 진급이나 장기복무심사 등 군복무 지속 여부를 결정하는\n데 큰 영향력을 행사하는 상관이 성범죄의 가해자가 될 경우 피해자\n는 사실상 제대로 저항은 물론 신고도 하지 못하기 때문임.\n이에 상관이 명령복종관계에 있는 직속 부하에 대해 강간죄 등 성\n폭력범죄를 범한 경우에는 죄질에 따라 그 죄에 정한 형의 2분의 1까\n지 가중할 수 있도록 하여 군대 내에서의 상관에 의한 성폭력을 근절\n하려는 것임(안 제92조의9 신설).\n\n\n\n\n법률 제 호\n군형법 일부개정법률안\n군형법 일부를 다음과 같이 개정한다.\n제2편제15장에 제92조의9를 다음과 같이 신설한다.\n제92조의9(상관이 범한 성범죄에 대한 형의 가중) 상관이 지위를 이용\n하여 제92조, 제92조의2부터 제92조의8까지의 죄를 범한 경우에는\n그 죄에 정한 형의 2분의 1까지 가중할 수 있다.\n부 칙\n이 법은 공포 후 6개월이 경과한 날부터 시행한다.\n\n\n\n\n신·구조문대비표\n현 행 개 정 안\n<신 설> 제92조의9(상관이 범한 성범죄에\n대한 형의 가중) 상관이 지위\n를 이용하여 제92조, 제92조의2\n부터 제92조의8까지의 죄를 범\n한 경우에는 그 죄에 정한 형\n의 2분의 1까지 가중할 수 있\n다.\n",
  "sections": {
    "제안이유": "및",
    "주요내용": "상관의 성추행과 은폐 시도 등으로 인하여 여군 중사가 자살한 사\n건 이후 군대 내에서 발생하는 성범죄를 근절해야 한다는 목소리가\n높아지고 있지만, 상관의 우월적 지위를 이용한 성범죄는 지속적으로\n발생하고 있음.\n이는 폐쇄적이고 엄격한 상명하복 체계가 유지되는 군 조직의 특수\n성에 비추어 진급이나 장기복무심사 등 군복무 지속 여부를 결정하는\n데 큰 영향력을 행사하는 상관이 성범죄의 가해자가 될 경우 피해자\n는 사실상 제대로 저항은 물론 신고도 하지 못하기 때문임.\n이에 상관이 명령복종관계에 있는 직속 부하에 대해 강간죄 등 성\n폭력범죄를 범한 경우에는 죄질에 따라 그 죄에 정한 형의 2분의 1까\n지 가중할 수 있도록 하여 군대 내에서의 상관에 의한 성폭력을 근절\n하려는 것임(안 제92조의9 신설).",
    "제안이유_및_주요내용": "상관의 성추행과 은폐 시도 등으로 인하여 여군 중사가 자살한 사\n건 이후 군대 내에서 발생하는 성범죄를 근절해야 한다는 목소리가\n높아지고 있지만, 상관의 우월적 지위를 이용한 성범죄는 지속적으로\n발생하고 있음.\n이는 폐쇄적이고 엄격한 상명하복 체계가 유지되는 군 조직의 특수\n성에 비추어 진급이나 장기복무심사 등 군복무 지속 여부를 결정하는\n데 큰 영향력을 행사하는 상관이 성범죄의 가해자가 될 경우 피해자\n는 사실상 제대로 저항은 물론 신고도 하지 못하기 때문임.\n이에 상관이 명령복종관계에 있는 직속 부하에 대해 강간죄 등 성\n폭력범죄를 범한 경우에는 죄질에 따라 그 죄에 정한 형의 2분의 1까\n지 가중할 수 있도록 하여 군대 내에서의 상관에 의한 성폭력을 근절\n하려는 것임(안 제92조의9 신설).",
    "법률_제_호": "군형법 일부개정법률안\n군형법 일부를 다음과 같이 개정한다.\n제2편제15장에 제92조의9를 다음과 같이 신설한다.\n제92조의9(상관이 범한 성범죄에 대한 형의 가중) 상관이 지위를 이용\n하여 제92조, 제92조의2부터 제92조의8까지의 죄를 범한 경우에는\n그 죄에 정한 형의 2분의 1까지 가중할 수 있다.",
    "신구조문대비표": "현 행 개 정 안\n<신 설> 제92조의9(상관이 범한 성범죄에\n대한 형의 가중) 상관이 지위\n를 이용하여 제92조, 제92조의2\n부터 제92조의8까지의 죄를 범\n한 경우에는 그 죄에 정한 형\n의 2분의 1까지 가중할 수 있\n다."
  }
}