{
  "title": "2201004_예금자보호법_일부개정법률안",
  "bill_number": "1004",
  "proposal_date": "2024. 6. 26.",
  "submission_date": "",
  "is_alternative": false,
  "alternative_bill_numbers": [],
  "has_comparison_table": false,
  "comparison_table": "신ㆍ구조문대비표\n현 행 개 정 안\n법률 제9134호 예금자보호법 법률 제9134호 예금자보호법\n일부개정법률 ",
  "full_text": "예금자보호법 일부개정법률안\n(김용만의원 대표발의)\n발의연월일 : 2024. 6. 26.\n의 안\n1004\n번 호 발 의 자 : 김용만ㆍ김용민ㆍ박상혁\n김남희ㆍ강훈식ㆍ강유정\n임미애ㆍ임오경ㆍ이인영\n민병덕ㆍ조승래ㆍ민형배\n의원(12인)\n제안이유 및 주요내용\n예금보험제도는 1997년 외환위기, 2011년 저축은행 부실사태 등 금\n융시장의 위기 때마다 예금자 보호의 최후 보루로서 중요한 역할을\n수행해 왔으며, 최근 미국의 실리콘밸리은행 파산, 스위스의 크레디트\n스위스 합병 등 금융회사의 부실 발생으로 그 중요성이 더욱 부각되\n고 있음.\n현재 금융부실 발생에 대비해 예금보험기금을 적립하기 위한 보험\n료율은 현행법에서 한도를 금융업권 공통 0.5% 이내로 규정하고 있으\n며, 대통령령에서 각 업권별로 구체적인 보험료율을 정하도록 위임하\n고 있음.\n또한, 「예금자보호법」 부칙은 보험료율 한도에 관한 적용기한을\n2024년 8월 31일까지로 하고 있으며, 이를 기한 내 다시 정하지 아니\n한 경우 1998년도 「예금자보호법」에서 정한 업권별 보험료율 한도\n\n\n\n규정을 적용하도록 하고 있음.\n이에 따라 동 「예금자보호법」 부칙 규정의 기한이 연장되지 않을\n경우 현행보다 낮은 보험료율로 환원되어 예금보험기금의 안정성이\n떨어질 우려가 있음. 이는 과거 구조조정 비용 상환으로 인해 현재 예\n금보험기금 적립이 충분하지 못한 상황에서 연간 7천억원 수준의 보\n험료 수입이 감소하고, 저축은행 구조조정 비용 부담을 위해 운영 중\n인 특별계정의 잔여 부채 상환도 곤란해지는 문제가 있음.\n따라서 보험료 수입 감소를 막고 예금보험기금의 안정성을 확보하\n기 위해 2027년 8월 31일까지 현행 보험료율 한도의 적용기한을 연장\n하고자 함(안 법률 제9134호 예금자보호법 일부개정법률 부칙 제2항).\n\n법률 제 호\n예금자보호법 일부개정법률안\n예금자보호법 일부를 다음과 같이 개정한다.\n법률 제9134호 예금자보호법 일부개정법률 부칙 제2항(법률 제10691호\n예금자보호법 일부개정법률, 법률 제14128호 예금자보호법 일부개정법\n률 및 법률 제18436호 예금자보호법 일부개정법률에 따라 개정된 내\n용을 포함한다) 중 “2024년”을 “2027년”으로 한다.\n부 칙\n이 법은 공포한 날부터 시행한다.\n\n\n\n\n신ㆍ구조문대비표\n현 행 개 정 안\n법률 제9134호 예금자보호법 법률 제9134호 예금자보호법\n일부개정법률 부칙 일부개정법률 부칙\n① (생 략) ① (현행과 같음)\n②(보험료율 한도에 관한 적용 ②(보험료율 한도에 관한 적용\n례) 제30조제1항의 개정규정에 례) ---------------------\n관하여 2024년 8월 31일까지 -------2027년------------\n각 부보금융기관이 매년 보험 ------------------------\n료로 납부하여야 하는 금액의 ------------------------\n예금등의 잔액에 대한 비율의 ------------------------\n한도를 다시 정하지 아니하는 ------------------------\n경우에는 법률 제5492호 예금 ------------------------\n자보호법중개정법률 제30조제1 ------------------------\n항제1호부터 제6호까지의 규정 ------------------------\n을 적용한다. ---------.\n",
  "sections": {
    "제안이유": "및",
    "주요내용": "예금보험제도는 1997년 외환위기, 2011년 저축은행 부실사태 등 금\n융시장의 위기 때마다 예금자 보호의 최후 보루로서 중요한 역할을\n수행해 왔으며, 최근 미국의 실리콘밸리은행 파산, 스위스의 크레디트\n스위스 합병 등 금융회사의 부실 발생으로 그 중요성이 더욱 부각되\n고 있음.\n현재 금융부실 발생에 대비해 예금보험기금을 적립하기 위한 보험\n료율은 현행법에서 한도를 금융업권 공통 0.5% 이내로 규정하고 있으\n며, 대통령령에서 각 업권별로 구체적인 보험료율을 정하도록 위임하\n고 있음.\n또한, 「예금자보호법」 부칙은 보험료율 한도에 관한 적용기한을\n2024년 8월 31일까지로 하고 있으며, 이를 기한 내 다시 정하지 아니\n한 경우 1998년도 「예금자보호법」에서 정한 업권별 보험료율 한도\n\n\n\n규정을 적용하도록 하고 있음.\n이에 따라 동 「예금자보호법」 부칙 규정의 기한이 연장되지 않을\n경우 현행보다 낮은 보험료율로 환원되어 예금보험기금의 안정성이\n떨어질 우려가 있음. 이는 과거 구조조정 비용 상환으로 인해 현재 예\n금보험기금 적립이 충분하지 못한 상황에서 연간 7천억원 수준의 보\n험료 수입이 감소하고, 저축은행 구조조정 비용 부담을 위해 운영 중\n인 특별계정의 잔여 부채 상환도 곤란해지는 문제가 있음.\n따라서 보험료 수입 감소를 막고 예금보험기금의 안정성을 확보하\n기 위해 2027년 8월 31일까지 현행 보험료율 한도의 적용기한을 연장\n하고자 함(안",
    "제안이유_및_주요내용": "예금보험제도는 1997년 외환위기, 2011년 저축은행 부실사태 등 금\n융시장의 위기 때마다 예금자 보호의 최후 보루로서 중요한 역할을\n수행해 왔으며, 최근 미국의 실리콘밸리은행 파산, 스위스의 크레디트\n스위스 합병 등 금융회사의 부실 발생으로 그 중요성이 더욱 부각되\n고 있음.\n현재 금융부실 발생에 대비해 예금보험기금을 적립하기 위한 보험\n료율은 현행법에서 한도를 금융업권 공통 0.5% 이내로 규정하고 있으\n며, 대통령령에서 각 업권별로 구체적인 보험료율을 정하도록 위임하\n고 있음.\n또한, 「예금자보호법」 부칙은 보험료율 한도에 관한 적용기한을\n2024년 8월 31일까지로 하고 있으며, 이를 기한 내 다시 정하지 아니\n한 경우 1998년도 「예금자보호법」에서 정한 업권별 보험료율 한도\n\n\n\n규정을 적용하도록 하고 있음.\n이에 따라 동 「예금자보호법」 부칙 규정의 기한이 연장되지 않을\n경우 현행보다 낮은 보험료율로 환원되어 예금보험기금의 안정성이\n떨어질 우려가 있음. 이는 과거 구조조정 비용 상환으로 인해 현재 예\n금보험기금 적립이 충분하지 못한 상황에서 연간 7천억원 수준의 보\n험료 수입이 감소하고, 저축은행 구조조정 비용 부담을 위해 운영 중\n인 특별계정의 잔여 부채 상환도 곤란해지는 문제가 있음.\n따라서 보험료 수입 감소를 막고 예금보험기금의 안정성을 확보하\n기 위해 2027년 8월 31일까지 현행 보험료율 한도의 적용기한을 연장\n하고자 함(안",
    "법률_제_호": "예금자보호법 일부개정법률",
    "신구조문대비표": "현 행 개 정 안\n법률 제9134호 예금자보호법 법률 제9134호 예금자보호법\n일부개정법률"
  }
}