{
  "title": "2201817_국민연금법_일부개정법률안",
  "bill_number": "1817",
  "proposal_date": "2024. 7. 17.",
  "submission_date": "",
  "is_alternative": false,
  "alternative_bill_numbers": [],
  "has_comparison_table": false,
  "comparison_table": "신ㆍ구조문대비표\n현 행 개 정 안\n법률 제15267호 국민연금법 일부 법률 제15267호 국민연금법 일부\n개정법률 ",
  "full_text": "국민연금법 일부개정법률안\n(박희승의원 대표발의)\n발의연월일 : 2024. 7. 17.\n의 안\n1817\n번 호 발 의 자 : 박희승ㆍ박상혁ㆍ한민수\n정성호ㆍ김정호ㆍ윤준병\n서영교ㆍ최기상ㆍ강유정\n조 국ㆍ김영진 의원\n(11인)\n제안이유 및 주요내용\n헌법재판소는 2016. 12. 29. ‘2015헌바82’ 결정에서 별거나 가출 등으\n로 실질적인 혼인관계가 존재하지 아니하여 연금 형성에 기여가 없는\n이혼배우자에 대해서까지 법률혼 기간을 기준으로 분할연금 수급권을\n인정하는 구 국민연금법 제64조 제1항(이하 ‘구법조항’)에 대하여 헌법\n불합치 결정을 하였음.\n이후 국회는 2017. 12. 19. 법률 제15267호로 국민연금법 제64조 제1\n항과 제4항을 개정하였고(제64조 제1항을 이하 ‘신법조항’), 개정 국민\n연금법은 공포 후 6개월이 경과한 날(2018. 6. 20.)부터 시행하되(부칙\n제1조), 제64조 제1항 및 제4항의 개정규정은 법 시행 후 최초로 분할\n연금 지급 사유가 발생한 경우부터 적용하는 것으로 규정하였음(부칙\n제2조).\n이와 관련하여 헌법재판소는 종전 헌법불합치결정 이후 신법 조항\n\n\n\n시행 전에 분할연금 지급 사유가 발생한 자에 대하여, 실질적인 혼인\n관계가 해소되어 분할연금의 기초가 되는 노령연금 수급권 형성에 아\n무런 기여가 없었던 배우자에게 일률적으로 분할연금이 지급되지 않\n도록 규정한 신법 조항을 적용하지 않은 것이 평등원칙에 위반된다고\n하여 헌법불합치 결정을 내린 바 있음(2019헌가29 결정).\n이에 종전 헌법불합치결정일부터 신법 조항 시행 전날까지 분할연\n금 지급사유가 발생하였고 연금액 변경처분 등이 확정되지 않은 사람\n들에 대하여 적어도 이 결정일 현재 아직 이행기가 도래하지 아니한\n분할연금 수급권에 대해서는 신법 조항의 적용범위에 포함하도록 함\n으로써 위헌성을 해소하려는 것임(안 법률 제15267호 국민연금법 일부\n개정법률 부칙 제2조).\n\n법률 제 호\n국민연금법 일부개정법률안\n국민연금법 일부를 다음과 같이 개정한다.\n법률 제15267호 국민연금법 일부개정법률 부칙 제2조 중 “이 법 시행\n후”를 “종전 헌법불합치결정일 이후”로 한다.\n부 칙\n이 법은 공포한 날부터 시행한다.\n\n\n\n\n신ㆍ구조문대비표\n현 행 개 정 안\n법률 제15267호 국민연금법 일부 법률 제15267호 국민연금법 일부\n개정법률 부칙 개정법률 부칙\n제2조(분할연금 수급권자 등에 제2조(분할연금 수급권자 등에\n관한 적용례) 제64조제1항 및 관한 적용례) ---------------\n제4항의 개정규정은 이 법 시 -------------------종전 헌법\n행 후 최초로 분할연금 지급 불합치결정일 이후-----------\n사유가 발생한 경우부터 적용 ----------------------------\n한다. --------------.\n",
  "sections": {
    "제안이유": "및",
    "주요내용": "헌법재판소는 2016. 12. 29. ‘2015헌바82’ 결정에서 별거나 가출 등으\n로 실질적인 혼인관계가 존재하지 아니하여 연금 형성에 기여가 없는\n이혼배우자에 대해서까지 법률혼 기간을 기준으로 분할연금 수급권을\n인정하는 구 국민연금법 제64조 제1항(이하 ‘구법조항’)에 대하여 헌법\n불합치 결정을 하였음.\n이후 국회는 2017. 12. 19.",
    "제안이유_및_주요내용": "헌법재판소는 2016. 12. 29. ‘2015헌바82’ 결정에서 별거나 가출 등으\n로 실질적인 혼인관계가 존재하지 아니하여 연금 형성에 기여가 없는\n이혼배우자에 대해서까지 법률혼 기간을 기준으로 분할연금 수급권을\n인정하는 구 국민연금법 제64조 제1항(이하 ‘구법조항’)에 대하여 헌법\n불합치 결정을 하였음.\n이후 국회는 2017. 12. 19.",
    "법률_제_호": "로 국민연금법 제64조 제1\n항과 제4항을 개정하였고(제64조 제1항을 이하 ‘신법조항’), 개정 국민\n연금법은 공포 후 6개월이 경과한 날(2018. 6. 20.)부터 시행하되(",
    "신구조문대비표": "현 행 개 정 안\n법률 제15267호 국민연금법 일부 법률 제15267호 국민연금법 일부\n개정법률"
  }
}