{
  "title": "2201894_형사소송법_일부개정법률안",
  "bill_number": "1894",
  "proposal_date": "2024. 7. 17.",
  "submission_date": "",
  "is_alternative": false,
  "alternative_bill_numbers": [],
  "has_comparison_table": false,
  "comparison_table": "신ㆍ구조문대비표\n현 행 개 정 안\n第230條(告訴期間) ① (생 략) 第230條(告訴期間) ① (현행과 같\n음)\n<신 설> ② 형법 제328조제2항의 경우의\n고소는 피해자가 동일한 사실관\n계에 대하여 민사소송을 제기한\n날로부터 전항의 기간이 진행된\n다.",
  "full_text": "형사소송법 일부개정법률안\n(권칠승의원 대표발의)\n발의연월일 : 2024. 7. 17.\n의 안\n1894\n번 호 발 의 자 : 권칠승ㆍ민병덕ㆍ이병진\n김준형ㆍ임호선ㆍ김남근\n송옥주ㆍ강유정ㆍ문금주\n임미애 의원(10인)\n제안이유 및 주요내용\n현행 「형법」은 직계혈족, 배우자, 동거친족, 동거가족 또는 그 배\n우자 이외의 친족간에 권리행사방해죄를 범한 때에는 고소가 있어야\n공소를 제기할 수 있도록 하고 있음.\n그런데, 현행 「형사소송법」은 친고죄에 대하여 범인을 알게 된 날\n로부터 6월을 경과하면 고소하지 못하도록 규정되어 있어 피해자가\n친족간의 원만한 합의를 위해서 노력하다가 6월의 기간이 도과하여\n고소 자체를 할 수 없는 경우가 발생함.\n이에 친족간에 권리행사방해죄를 범한 때에는 민사소송을 제기한\n날로부터 고소기간이 진행되도록 하여 친족간의 원만한 합의기간을\n보장하면서도 범죄피해로부터 국민이 효과적으로 보호되도록 하려는\n것임(안 제230조제2항 신설).\n\n\n\n\n법률 제 호\n형사소송법 일부개정법률안\n형사소송법 일부를 다음과 같이 개정한다.\n제230조에 제2항을 다음과 같이 신설한다.\n② 형법 제328조제2항의 경우의 고소는 피해자가 동일한 사실관계\n에 대하여 민사소송을 제기한 날로부터 전항의 기간이 진행된다.\n부 칙\n이 법은 공포 후 6개월이 경과한 날부터 시행한다.\n\n\n\n\n신ㆍ구조문대비표\n현 행 개 정 안\n第230條(告訴期間) ① (생 략) 第230條(告訴期間) ① (현행과 같\n음)\n<신 설> ② 형법 제328조제2항의 경우의\n고소는 피해자가 동일한 사실관\n계에 대하여 민사소송을 제기한\n날로부터 전항의 기간이 진행된\n다.\n",
  "sections": {
    "제안이유": "및",
    "주요내용": "현행 「형법」은 직계혈족, 배우자, 동거친족, 동거가족 또는 그 배\n우자 이외의 친족간에 권리행사방해죄를 범한 때에는 고소가 있어야\n공소를 제기할 수 있도록 하고 있음.\n그런데, 현행 「형사소송법」은 친고죄에 대하여 범인을 알게 된 날\n로부터 6월을 경과하면 고소하지 못하도록 규정되어 있어 피해자가\n친족간의 원만한 합의를 위해서 노력하다가 6월의 기간이 도과하여\n고소 자체를 할 수 없는 경우가 발생함.\n이에 친족간에 권리행사방해죄를 범한 때에는 민사소송을 제기한\n날로부터 고소기간이 진행되도록 하여 친족간의 원만한 합의기간을\n보장하면서도 범죄피해로부터 국민이 효과적으로 보호되도록 하려는\n것임(안 제230조제2항 신설).",
    "제안이유_및_주요내용": "현행 「형법」은 직계혈족, 배우자, 동거친족, 동거가족 또는 그 배\n우자 이외의 친족간에 권리행사방해죄를 범한 때에는 고소가 있어야\n공소를 제기할 수 있도록 하고 있음.\n그런데, 현행 「형사소송법」은 친고죄에 대하여 범인을 알게 된 날\n로부터 6월을 경과하면 고소하지 못하도록 규정되어 있어 피해자가\n친족간의 원만한 합의를 위해서 노력하다가 6월의 기간이 도과하여\n고소 자체를 할 수 없는 경우가 발생함.\n이에 친족간에 권리행사방해죄를 범한 때에는 민사소송을 제기한\n날로부터 고소기간이 진행되도록 하여 친족간의 원만한 합의기간을\n보장하면서도 범죄피해로부터 국민이 효과적으로 보호되도록 하려는\n것임(안 제230조제2항 신설).",
    "법률_제_호": "형사소송법 일부개정법률안\n형사소송법 일부를 다음과 같이 개정한다.\n제230조에 제2항을 다음과 같이 신설한다.\n② 형법 제328조제2항의 경우의 고소는 피해자가 동일한 사실관계\n에 대하여 민사소송을 제기한 날로부터 전항의 기간이 진행된다.",
    "신구조문대비표": "현 행 개 정 안\n第230條(告訴期間) ① (생 략) 第230條(告訴期間) ① (현행과 같\n음)\n<신 설> ② 형법 제328조제2항의 경우의\n고소는 피해자가 동일한 사실관\n계에 대하여 민사소송을 제기한\n날로부터 전항의 기간이 진행된\n다."
  }
}