{
  "title": "2201087_국회법_일부개정법률안",
  "bill_number": "1087",
  "proposal_date": "2024. 6. 28.",
  "submission_date": "",
  "is_alternative": false,
  "alternative_bill_numbers": [],
  "has_comparison_table": false,
  "comparison_table": "신ㆍ구조문대비표\n현 행 개 정 안\n<신 설> 제129조의2(업무보고의 요구) ①\n위원회는 그 의결로 국무위원,\n정부위원 및 행정기관의 장 등\n의 출석 및 업무보고를 요구할\n수 있다.\n② 제1항의 출석 및 업무보고\n에 관하여는 제121조제2항부터\n제4항까지를 준용한다.",
  "full_text": "국회법 일부개정법률안\n(모경종의원 대표발의)\n발의연월일 : 2024. 6. 28.\n의 안\n1087\n번 호 발 의 자 : 모경종ㆍ정진욱ㆍ복기왕\n김준혁ㆍ이훈기ㆍ강준현\n김승원ㆍ박지원ㆍ백승아\n김 윤ㆍ박해철ㆍ윤건영\n이준석ㆍ박정현ㆍ김원이\n김용민ㆍ정청래ㆍ오세희\n의원(18인)\n제안이유 및 주요내용\n국회에 대한 정부 부처의 업무보고는 국회법 제121조(국무위원 등의\n출석 요구), 제129조(증인ㆍ감정인 또는 참고인의 출석 요구)를 참고해\n관행적으로 이루어지고 있음.\n각 상임위원회에 대한 정부 부처의 업무보고는 원활한 의정활동을\n위해 필수적이나, 명확한 근거 규정 없이 이루어지고 있는 실정임.\n이에 위원회는 정부 부처에 업무보고를 요구할 수 있고 업무보고를\n요구 받은 정부 부처는 출석하여 업무보고를 하도록 해 정부 부처의\n업무보고에 대한 근거 규정을 명확히 하고자 함(안 제129조의2 신설).\n\n\n\n\n법률 제 호\n국회법 일부개정법률안\n국회법 일부를 다음과 같이 개정한다.\n제10장에 제129조의2를 다음과 같이 신설한다.\n제129조의2(업무보고의 요구) ① 위원회는 그 의결로 국무위원, 정부\n위원 및 행정기관의 장 등의 출석 및 업무보고를 요구할 수 있다.\n② 제1항의 출석 및 업무보고에 관하여는 제121조제2항부터 제4항\n까지를 준용한다.\n부 칙\n이 법은 공포한 날부터 시행한다.\n\n\n\n\n신ㆍ구조문대비표\n현 행 개 정 안\n<신 설> 제129조의2(업무보고의 요구) ①\n위원회는 그 의결로 국무위원,\n정부위원 및 행정기관의 장 등\n의 출석 및 업무보고를 요구할\n수 있다.\n② 제1항의 출석 및 업무보고\n에 관하여는 제121조제2항부터\n제4항까지를 준용한다.\n",
  "sections": {
    "제안이유": "및",
    "주요내용": "국회에 대한 정부 부처의 업무보고는 국회법 제121조(국무위원 등의\n출석 요구), 제129조(증인ㆍ감정인 또는 참고인의 출석 요구)를 참고해\n관행적으로 이루어지고 있음.\n각 상임위원회에 대한 정부 부처의 업무보고는 원활한 의정활동을\n위해 필수적이나, 명확한 근거 규정 없이 이루어지고 있는 실정임.\n이에 위원회는 정부 부처에 업무보고를 요구할 수 있고 업무보고를\n요구 받은 정부 부처는 출석하여 업무보고를 하도록 해 정부 부처의\n업무보고에 대한 근거 규정을 명확히 하고자 함(안 제129조의2 신설).",
    "제안이유_및_주요내용": "국회에 대한 정부 부처의 업무보고는 국회법 제121조(국무위원 등의\n출석 요구), 제129조(증인ㆍ감정인 또는 참고인의 출석 요구)를 참고해\n관행적으로 이루어지고 있음.\n각 상임위원회에 대한 정부 부처의 업무보고는 원활한 의정활동을\n위해 필수적이나, 명확한 근거 규정 없이 이루어지고 있는 실정임.\n이에 위원회는 정부 부처에 업무보고를 요구할 수 있고 업무보고를\n요구 받은 정부 부처는 출석하여 업무보고를 하도록 해 정부 부처의\n업무보고에 대한 근거 규정을 명확히 하고자 함(안 제129조의2 신설).",
    "법률_제_호": "국회법 일부개정법률안\n국회법 일부를 다음과 같이 개정한다.\n제10장에 제129조의2를 다음과 같이 신설한다.\n제129조의2(업무보고의 요구) ① 위원회는 그 의결로 국무위원, 정부\n위원 및 행정기관의 장 등의 출석 및 업무보고를 요구할 수 있다.\n② 제1항의 출석 및 업무보고에 관하여는 제121조제2항부터 제4항\n까지를 준용한다.",
    "신구조문대비표": "현 행 개 정 안\n<신 설> 제129조의2(업무보고의 요구) ①\n위원회는 그 의결로 국무위원,\n정부위원 및 행정기관의 장 등\n의 출석 및 업무보고를 요구할\n수 있다.\n② 제1항의 출석 및 업무보고\n에 관하여는 제121조제2항부터\n제4항까지를 준용한다."
  }
}