{
  "title": "2201965_형법_일부개정법률안",
  "bill_number": "1965",
  "proposal_date": "2024. 7. 18.",
  "submission_date": "",
  "is_alternative": false,
  "alternative_bill_numbers": [],
  "has_comparison_table": false,
  "comparison_table": "신·구조문대비표\n현 행 개 정 안\n<신 설> 제314조의2(특수업무방해) 단체\n또는 다중의 위력을 보이거나\n위험한 물건을 휴대하여 제314\n조제1항의 죄를 범한 때에는 7\n년 이하의 징역 또는 2천만원\n이하의 벌금에 처한다.",
  "full_text": "형법 일부개정법률안\n(김준혁의원 대표발의)\n발의연월일 : 2024. 7. 18.\n의 안\n1965\n번 호 발 의 자 : 김준혁ㆍ모경종ㆍ박균택\n안규백ㆍ강유정ㆍ김영진\n권칠승ㆍ이연희ㆍ김병주\n이성윤ㆍ박정현ㆍ서미화\n의원(12인)\n제안이유 및 주요내용\n현행 「형법」은 허위사실을 유포하거나 위계 또는 위력으로써 사\n람의 업무를 방해한 자는 5년 이하의 징역 또는 1천500만원 이하의\n벌금에 처한다고 정하고 있고, 「폭력행위 등 처벌에 관한 법률」(이\n하 “폭력행위처벌법”이라 함) 제4조제2항은 폭력행위처벌법에 규정된\n범죄를 목적으로 하는 단체 또는 집단을 구성하거나 그러한 단체 또\n는 집단에 가입한 사람이 단체 또는 집단의 위력을 과시하거나 단체\n또는 집단의 존속ㆍ유지를 위하여 「형법」 제314조(업무방해)의 죄를\n범하였을 때에는 형의 장기 및 단기의 2분의 1까지 가중하도록 정하\n고 있음.\n그런데 최근 이른바 ‘MZ 조폭’들이 장사 중인 음식점에 와서 단체\n로 상의를 탈의하고 문신을 보여주면서 위력을 행사하거나 주점에서\n난동을 부리는 일이 있었고, 비슷한 사건들이 자주 발생하고 있어 새\n\n\n\n로운 사회적 문제로 대두되고 있음. 단체 또는 다중의 위력을 보이거\n나 위험한 물건을 휴대하여 업무를 방해하는 경우에는 그 행위의 위\n험성으로 말미암아 이를 가중처벌할 필요성이 있음에도 불구하고 근\n거 법규정이 없어서 이를 가중처벌할 수 없음. 폭력행위처벌법위반(단\n체등의업무방해)죄는 범죄를 목적으로 하는 단체 또는 집단이 아니거\n나 범죄를 목적으로 하는 단체등의 구성원이 단체등의 구성원 아닌\n자와 함께 위력을 보이는 등의 경우에는 구성요건상 적용할 수 없음.\n단체 또는 다중이 위력을 보이는 경우에, 단체 또는 다중의 구성원이\n범죄 목적 단체 또는 집단의 구성원인지 여부에 따라 위험성의 정도\n가 크게 차이가 난다고 볼 수 없음에도 불구하고, 「형법」에 단체 또\n는 다중의 위력을 보여 업무를 방해하는 행위를 가중처벌하는 규정을\n두지 않은 것은 입법의 불비라고 할 것임.\n이에 「형법」 제314조의2에 특수업무방해죄를 신설하되 업무방해\n죄의 형의 상한만을 가중하여 폭력행위처벌법위반(단체등의업무방해)\n죄에 비하여 경하게 처벌함으로써 형벌 비례성원칙에 어긋나지 않도\n록 함(안 제314조의2).\n\n법률 제 호\n형법 일부개정법률안\n형법 일부를 다음과 같이 개정한다.\n제314조의2를 다음과 같이 신설한다.\n제314조의2(특수업무방해) 단체 또는 다중의 위력을 보이거나 위험한\n물건을 휴대하여 제314조제1항의 죄를 범한 때에는 7년 이하의 징\n역 또는 2천만원 이하의 벌금에 처한다.\n부 칙\n이 법은 공포 후 3개월이 경과한 날부터 시행한다.\n\n\n\n\n신·구조문대비표\n현 행 개 정 안\n<신 설> 제314조의2(특수업무방해) 단체\n또는 다중의 위력을 보이거나\n위험한 물건을 휴대하여 제314\n조제1항의 죄를 범한 때에는 7\n년 이하의 징역 또는 2천만원\n이하의 벌금에 처한다.\n",
  "sections": {
    "제안이유": "및",
    "주요내용": "현행 「형법」은 허위사실을 유포하거나 위계 또는 위력으로써 사\n람의 업무를 방해한 자는 5년 이하의 징역 또는 1천500만원 이하의\n벌금에 처한다고 정하고 있고, 「폭력행위 등 처벌에 관한 법률」(이\n하 “폭력행위처벌법”이라 함) 제4조제2항은 폭력행위처벌법에 규정된\n범죄를 목적으로 하는 단체 또는 집단을 구성하거나 그러한 단체 또\n는 집단에 가입한 사람이 단체 또는 집단의 위력을 과시하거나 단체\n또는 집단의 존속ㆍ유지를 위하여 「형법」 제314조(업무방해)의 죄를\n범하였을 때에는 형의 장기 및 단기의 2분의 1까지 가중하도록 정하\n고 있음.\n그런데 최근 이른바 ‘MZ 조폭’들이 장사 중인 음식점에 와서 단체\n로 상의를 탈의하고 문신을 보여주면서 위력을 행사하거나 주점에서\n난동을 부리는 일이 있었고, 비슷한 사건들이 자주 발생하고 있어 새\n\n\n\n로운 사회적 문제로 대두되고 있음. 단체 또는 다중의 위력을 보이거\n나 위험한 물건을 휴대하여 업무를 방해하는 경우에는 그 행위의 위\n험성으로 말미암아 이를 가중처벌할 필요성이 있음에도 불구하고 근\n거 법규정이 없어서 이를 가중처벌할 수 없음. 폭력행위처벌법위반(단\n체등의업무방해)죄는 범죄를 목적으로 하는 단체 또는 집단이 아니거\n나 범죄를 목적으로 하는 단체등의 구성원이 단체등의 구성원 아닌\n자와 함께 위력을 보이는 등의 경우에는 구성요건상 적용할 수 없음.\n단체 또는 다중이 위력을 보이는 경우에, 단체 또는 다중의 구성원이\n범죄 목적 단체 또는 집단의 구성원인지 여부에 따라 위험성의 정도\n가 크게 차이가 난다고 볼 수 없음에도 불구하고, 「형법」에 단체 또\n는 다중의 위력을 보여 업무를 방해하는 행위를 가중처벌하는 규정을\n두지 않은 것은 입법의 불비라고 할 것임.\n이에 「형법」 제314조의2에 특수업무방해죄를 신설하되 업무방해\n죄의 형의 상한만을 가중하여 폭력행위처벌법위반(단체등의업무방해)\n죄에 비하여 경하게 처벌함으로써 형벌 비례성원칙에 어긋나지 않도\n록 함(안 제314조의2).",
    "제안이유_및_주요내용": "현행 「형법」은 허위사실을 유포하거나 위계 또는 위력으로써 사\n람의 업무를 방해한 자는 5년 이하의 징역 또는 1천500만원 이하의\n벌금에 처한다고 정하고 있고, 「폭력행위 등 처벌에 관한 법률」(이\n하 “폭력행위처벌법”이라 함) 제4조제2항은 폭력행위처벌법에 규정된\n범죄를 목적으로 하는 단체 또는 집단을 구성하거나 그러한 단체 또\n는 집단에 가입한 사람이 단체 또는 집단의 위력을 과시하거나 단체\n또는 집단의 존속ㆍ유지를 위하여 「형법」 제314조(업무방해)의 죄를\n범하였을 때에는 형의 장기 및 단기의 2분의 1까지 가중하도록 정하\n고 있음.\n그런데 최근 이른바 ‘MZ 조폭’들이 장사 중인 음식점에 와서 단체\n로 상의를 탈의하고 문신을 보여주면서 위력을 행사하거나 주점에서\n난동을 부리는 일이 있었고, 비슷한 사건들이 자주 발생하고 있어 새\n\n\n\n로운 사회적 문제로 대두되고 있음. 단체 또는 다중의 위력을 보이거\n나 위험한 물건을 휴대하여 업무를 방해하는 경우에는 그 행위의 위\n험성으로 말미암아 이를 가중처벌할 필요성이 있음에도 불구하고 근\n거 법규정이 없어서 이를 가중처벌할 수 없음. 폭력행위처벌법위반(단\n체등의업무방해)죄는 범죄를 목적으로 하는 단체 또는 집단이 아니거\n나 범죄를 목적으로 하는 단체등의 구성원이 단체등의 구성원 아닌\n자와 함께 위력을 보이는 등의 경우에는 구성요건상 적용할 수 없음.\n단체 또는 다중이 위력을 보이는 경우에, 단체 또는 다중의 구성원이\n범죄 목적 단체 또는 집단의 구성원인지 여부에 따라 위험성의 정도\n가 크게 차이가 난다고 볼 수 없음에도 불구하고, 「형법」에 단체 또\n는 다중의 위력을 보여 업무를 방해하는 행위를 가중처벌하는 규정을\n두지 않은 것은 입법의 불비라고 할 것임.\n이에 「형법」 제314조의2에 특수업무방해죄를 신설하되 업무방해\n죄의 형의 상한만을 가중하여 폭력행위처벌법위반(단체등의업무방해)\n죄에 비하여 경하게 처벌함으로써 형벌 비례성원칙에 어긋나지 않도\n록 함(안 제314조의2).",
    "법률_제_호": "형법 일부개정법률안\n형법 일부를 다음과 같이 개정한다.\n제314조의2를 다음과 같이 신설한다.\n제314조의2(특수업무방해) 단체 또는 다중의 위력을 보이거나 위험한\n물건을 휴대하여 제314조제1항의 죄를 범한 때에는 7년 이하의 징\n역 또는 2천만원 이하의 벌금에 처한다.",
    "신구조문대비표": "현 행 개 정 안\n<신 설> 제314조의2(특수업무방해) 단체\n또는 다중의 위력을 보이거나\n위험한 물건을 휴대하여 제314\n조제1항의 죄를 범한 때에는 7\n년 이하의 징역 또는 2천만원\n이하의 벌금에 처한다."
  }
}