{
  "title": "2201522_국경일에_관한_법률_일부개정법률안",
  "bill_number": "1522",
  "proposal_date": "2024. 7. 9.",
  "submission_date": "",
  "is_alternative": false,
  "alternative_bill_numbers": [],
  "has_comparison_table": false,
  "comparison_table": "신ㆍ구조문대비표\n현 행 개 정 안\n제2조(국경일의 종류) 국경일은 제2조(국경일의 종류) --------\n다음 각 호와 같다. ------------------.\n1. ∼ 4. (생 략) 1. ∼ 4. (현행과 같음)\n5. 한글날: 10월 9일 5. 한글날: 10월 두 번째 월요\n일",
  "full_text": "국경일에 관한 법률 일부개정법률안\n(위성락의원 대표발의)\n발의연월일 : 2024. 7. 9.\n의 안\n1522\n번 호 발 의 자 : 위성락ㆍ김한규ㆍ김병주\n문정복ㆍ김윤덕ㆍ정을호\n임호선ㆍ남인순ㆍ박희승\n위성곤ㆍ신정훈 의원\n(11인)\n제안이유 및 주요내용\n현행법은 한글날을 10월 9일로 정하고 있고, 「공휴일에 관한 법\n률」은 한글날 등의 국경일을 공휴일로 정하고 있습니다.\n공휴일에 대한 예측가능성을 높이고 소비진작과 내수시장 활성화를\n위한 요일제 공휴일 도입이 19대 국회부터 제안된 바 있으나, 2021년\n「공휴일에 관한 법률」 제정 당시 해당 내용이 제외되었습니다. 그러\n나 문화관광연구원 등의 연구에 따르면 대체공휴일로 인해 생긴 3일\n연휴기간 동안 관광산업 분야 매출이 증가한 것으로 분석되었고, 관광\n이외의 다양한 산업군에도 긍정적 영향을 미칠 것으로 예상되므로 요\n일제 공휴일을 도입해야 한다는 의견이 있습니다.\n이에 한글날을 10월 두 번째 월요일로 지정하여 국민의 삶의 질 향\n상에 기여하고 내수시장 활성화를 도모하고자 합니다(안 제2조제5호).\n\n\n\n\n법률 제 호\n국경일에 관한 법률 일부개정법률안\n국경일에 관한 법률 일부를 다음과 같이 개정한다.\n제2조제5호를 다음과 같이 한다.\n5. 한글날: 10월 두 번째 월요일\n부 칙\n이 법은 공포한 날부터 시행한다.\n\n\n\n\n신ㆍ구조문대비표\n현 행 개 정 안\n제2조(국경일의 종류) 국경일은 제2조(국경일의 종류) --------\n다음 각 호와 같다. ------------------.\n1. ∼ 4. (생 략) 1. ∼ 4. (현행과 같음)\n5. 한글날: 10월 9일 5. 한글날: 10월 두 번째 월요\n일\n",
  "sections": {
    "제안이유": "및",
    "주요내용": "현행법은 한글날을 10월 9일로 정하고 있고, 「공휴일에 관한 법\n률」은 한글날 등의 국경일을 공휴일로 정하고 있습니다.\n공휴일에 대한 예측가능성을 높이고 소비진작과 내수시장 활성화를\n위한 요일제 공휴일 도입이 19대 국회부터 제안된 바 있으나, 2021년\n「공휴일에 관한 법률」 제정 당시 해당 내용이 제외되었습니다. 그러\n나 문화관광연구원 등의 연구에 따르면 대체공휴일로 인해 생긴 3일\n연휴기간 동안 관광산업 분야 매출이 증가한 것으로 분석되었고, 관광\n이외의 다양한 산업군에도 긍정적 영향을 미칠 것으로 예상되므로 요\n일제 공휴일을 도입해야 한다는 의견이 있습니다.\n이에 한글날을 10월 두 번째 월요일로 지정하여 국민의 삶의 질 향\n상에 기여하고 내수시장 활성화를 도모하고자 합니다(안 제2조제5호).",
    "제안이유_및_주요내용": "현행법은 한글날을 10월 9일로 정하고 있고, 「공휴일에 관한 법\n률」은 한글날 등의 국경일을 공휴일로 정하고 있습니다.\n공휴일에 대한 예측가능성을 높이고 소비진작과 내수시장 활성화를\n위한 요일제 공휴일 도입이 19대 국회부터 제안된 바 있으나, 2021년\n「공휴일에 관한 법률」 제정 당시 해당 내용이 제외되었습니다. 그러\n나 문화관광연구원 등의 연구에 따르면 대체공휴일로 인해 생긴 3일\n연휴기간 동안 관광산업 분야 매출이 증가한 것으로 분석되었고, 관광\n이외의 다양한 산업군에도 긍정적 영향을 미칠 것으로 예상되므로 요\n일제 공휴일을 도입해야 한다는 의견이 있습니다.\n이에 한글날을 10월 두 번째 월요일로 지정하여 국민의 삶의 질 향\n상에 기여하고 내수시장 활성화를 도모하고자 합니다(안 제2조제5호).",
    "법률_제_호": "국경일에 관한 법률 일부개정법률안\n국경일에 관한 법률 일부를 다음과 같이 개정한다.\n제2조제5호를 다음과 같이 한다.\n5. 한글날: 10월 두 번째 월요일",
    "신구조문대비표": "현 행 개 정 안\n제2조(국경일의 종류) 국경일은 제2조(국경일의 종류) --------\n다음 각 호와 같다. ------------------.\n1. ∼ 4. (생 략) 1. ∼ 4. (현행과 같음)\n5. 한글날: 10월 9일 5. 한글날: 10월 두 번째 월요\n일"
  }
}