{
  "title": "2202387_전기사업법_일부개정법률안",
  "bill_number": "2387",
  "proposal_date": "2024. 7. 30.",
  "submission_date": "",
  "is_alternative": false,
  "alternative_bill_numbers": [],
  "has_comparison_table": false,
  "comparison_table": "신ㆍ구조문대비표\n현 행 개 정 안\n<신 설> 제17조의3(전기요금의 감면) 전기\n판매사업자는 폭염ㆍ혹한 등의\n재난이 발생한 경우에는 대통\n령령으로 정하는 바에 따라 전\n기요금을 감면할 수 있다.",
  "full_text": "전기사업법 일부개정법률안\n(전재수의원 대표발의)\n발의연월일 : 2024. 7. 30.\n의 안\n2387\n번 호 발 의 자 : 전재수ㆍ이재관ㆍ박선원\n허 영ㆍ이용선ㆍ복기왕\n전진숙ㆍ이학영ㆍ강득구\n송재봉 의원(10인)\n제안이유 및 주요내용\n지구온난화에 따른 기후변화로 인하여 폭염ㆍ혹한과 같은 기상재난\n이 증가하고 냉ㆍ난방 수요 역시 급증할 수밖에 없으므로 전기요금\n부담이 높아질 서민들을 위하여 전기요금 감면 등 제도개선이 필요하\n다는 주장이 제기되고 있음.\n이에 폭염ㆍ혹한 등의 재난이 발생한 경우에는 전기요금을 감면할\n수 있도록 하여 폭염 및 혹한기의 냉ㆍ난방기 사용에 따른 국민들의\n부담을 완화하려는 것임(안 제17조의3 신설).\n\n\n\n\n법률 제 호\n전기사업법 일부개정법률안\n전기사업법 일부를 다음과 같이 개정한다.\n제17조의3을 다음과 같이 신설한다.\n제17조의3(전기요금의 감면) 전기판매사업자는 폭염ㆍ혹한 등의 재난\n이 발생한 경우에는 대통령령으로 정하는 바에 따라 전기요금을 감\n면할 수 있다.\n부 칙\n이 법은 공포 후 6개월이 경과한 날부터 시행한다.\n\n\n\n\n신ㆍ구조문대비표\n현 행 개 정 안\n<신 설> 제17조의3(전기요금의 감면) 전기\n판매사업자는 폭염ㆍ혹한 등의\n재난이 발생한 경우에는 대통\n령령으로 정하는 바에 따라 전\n기요금을 감면할 수 있다.\n",
  "sections": {
    "제안이유": "및",
    "주요내용": "지구온난화에 따른 기후변화로 인하여 폭염ㆍ혹한과 같은 기상재난\n이 증가하고 냉ㆍ난방 수요 역시 급증할 수밖에 없으므로 전기요금\n부담이 높아질 서민들을 위하여 전기요금 감면 등 제도개선이 필요하\n다는 주장이 제기되고 있음.\n이에 폭염ㆍ혹한 등의 재난이 발생한 경우에는 전기요금을 감면할\n수 있도록 하여 폭염 및 혹한기의 냉ㆍ난방기 사용에 따른 국민들의\n부담을 완화하려는 것임(안 제17조의3 신설).",
    "제안이유_및_주요내용": "지구온난화에 따른 기후변화로 인하여 폭염ㆍ혹한과 같은 기상재난\n이 증가하고 냉ㆍ난방 수요 역시 급증할 수밖에 없으므로 전기요금\n부담이 높아질 서민들을 위하여 전기요금 감면 등 제도개선이 필요하\n다는 주장이 제기되고 있음.\n이에 폭염ㆍ혹한 등의 재난이 발생한 경우에는 전기요금을 감면할\n수 있도록 하여 폭염 및 혹한기의 냉ㆍ난방기 사용에 따른 국민들의\n부담을 완화하려는 것임(안 제17조의3 신설).",
    "법률_제_호": "전기사업법 일부개정법률안\n전기사업법 일부를 다음과 같이 개정한다.\n제17조의3을 다음과 같이 신설한다.\n제17조의3(전기요금의 감면) 전기판매사업자는 폭염ㆍ혹한 등의 재난\n이 발생한 경우에는 대통령령으로 정하는 바에 따라 전기요금을 감\n면할 수 있다.",
    "신구조문대비표": "현 행 개 정 안\n<신 설> 제17조의3(전기요금의 감면) 전기\n판매사업자는 폭염ㆍ혹한 등의\n재난이 발생한 경우에는 대통\n령령으로 정하는 바에 따라 전\n기요금을 감면할 수 있다."
  }
}