{
  "title": "2202731_하도급거래_공정화에_관한_법률_일부개정법률안",
  "bill_number": "2731",
  "proposal_date": "2024. 8. 12.",
  "submission_date": "",
  "is_alternative": false,
  "alternative_bill_numbers": [],
  "has_comparison_table": false,
  "comparison_table": "신ㆍ구조문대비표\n현 행 개 정 안\n제3조의4(부당한 특약의 금지) ① 제3조의4(부당한 특약의 금지) ①\nㆍ② (생 략) ㆍ② (현행과 같음)\n<신 설> ③ 제2항에 따른 부당한 특약\n은 그 부분에 한정하여 무효로\n한다.",
  "full_text": "하도급거래 공정화에 관한 법률 일부개정법률안\n(김상훈의원 대표발의)\n발의연월일 : 2024. 8. 12.\n의 안\n2731\n번 호 발 의 자 : 김상훈ㆍ김선교ㆍ김소희\n송언석ㆍ강대식ㆍ윤한홍\n백종헌ㆍ서명옥ㆍ이달희\n김예지ㆍ김석기 의원\n(11인)\n제안이유 및 주요내용\n현행법은 원사업자가 부담하여야 할 비용을 수급사업자에게 부담시\n키는 등 수급사업자의 이익을 부당하게 침해하거나 제한하는 내용의\n특약을 설정하지 못하도록 금지하고 있으나, 부당한 특약이 존재하는\n경우에도 수급사업자는 별도의 민사소송을 제기하여 그 무효를 확인\n받기까지 계약에 따른 책임을 부담해야 하므로 수급사업자의 실질적\n인 권리 보호는 여전히 어려움이 존재하고 있음.\n이에 하도급거래 계약에서의 부당한 특약은 그에 해당하는 부분에\n한정하여 무효로 하도록 함으로써 원사업자가 문제 되는 특약을 설정\n할 유인을 제거하여 법 위반 행위를 예방하고, 수급사업자의 권리를\n두텁게 보호하려는 것임(안 제3조의4제3항 신설).\n\n\n\n\n법률 제 호\n하도급거래 공정화에 관한 법률 일부개정법률안\n하도급거래 공정화에 관한 법률 일부를 다음과 같이 개정한다.\n제3조의4에 제3항을 다음과 같이 신설한다.\n③ 제2항에 따른 부당한 특약은 그 부분에 한정하여 무효로 한다.\n부 칙\n제1조(시행일) 이 법은 공포 후 6개월이 경과한 날부터 시행한다.\n제2조(부당한 특약 금지에 관한 적용례) 제3조의4제3항의 개정규정은\n이 법 시행 이후 계약조건을 설정한 경우부터 적용한다.\n\n\n\n\n신ㆍ구조문대비표\n현 행 개 정 안\n제3조의4(부당한 특약의 금지) ① 제3조의4(부당한 특약의 금지) ①\nㆍ② (생 략) ㆍ② (현행과 같음)\n<신 설> ③ 제2항에 따른 부당한 특약\n은 그 부분에 한정하여 무효로\n한다.\n",
  "sections": {
    "제안이유": "및",
    "주요내용": "현행법은 원사업자가 부담하여야 할 비용을 수급사업자에게 부담시\n키는 등 수급사업자의 이익을 부당하게 침해하거나 제한하는 내용의\n특약을 설정하지 못하도록 금지하고 있으나, 부당한 특약이 존재하는\n경우에도 수급사업자는 별도의 민사소송을 제기하여 그 무효를 확인\n받기까지 계약에 따른 책임을 부담해야 하므로 수급사업자의 실질적\n인 권리 보호는 여전히 어려움이 존재하고 있음.\n이에 하도급거래 계약에서의 부당한 특약은 그에 해당하는 부분에\n한정하여 무효로 하도록 함으로써 원사업자가 문제 되는 특약을 설정\n할 유인을 제거하여 법 위반 행위를 예방하고, 수급사업자의 권리를\n두텁게 보호하려는 것임(안 제3조의4제3항 신설).",
    "제안이유_및_주요내용": "현행법은 원사업자가 부담하여야 할 비용을 수급사업자에게 부담시\n키는 등 수급사업자의 이익을 부당하게 침해하거나 제한하는 내용의\n특약을 설정하지 못하도록 금지하고 있으나, 부당한 특약이 존재하는\n경우에도 수급사업자는 별도의 민사소송을 제기하여 그 무효를 확인\n받기까지 계약에 따른 책임을 부담해야 하므로 수급사업자의 실질적\n인 권리 보호는 여전히 어려움이 존재하고 있음.\n이에 하도급거래 계약에서의 부당한 특약은 그에 해당하는 부분에\n한정하여 무효로 하도록 함으로써 원사업자가 문제 되는 특약을 설정\n할 유인을 제거하여 법 위반 행위를 예방하고, 수급사업자의 권리를\n두텁게 보호하려는 것임(안 제3조의4제3항 신설).",
    "법률_제_호": "하도급거래 공정화에 관한 법률 일부개정법률안\n하도급거래 공정화에 관한 법률 일부를 다음과 같이 개정한다.\n제3조의4에 제3항을 다음과 같이 신설한다.\n③ 제2항에 따른 부당한 특약은 그 부분에 한정하여 무효로 한다.",
    "신구조문대비표": "현 행 개 정 안\n제3조의4(부당한 특약의 금지) ① 제3조의4(부당한 특약의 금지) ①\nㆍ② (생 략) ㆍ② (현행과 같음)\n<신 설> ③ 제2항에 따른 부당한 특약\n은 그 부분에 한정하여 무효로\n한다."
  }
}