{
  "title": "2202096_국가재정법_일부개정법률안",
  "bill_number": "2096",
  "proposal_date": "2024. 7. 22.",
  "submission_date": "",
  "is_alternative": false,
  "alternative_bill_numbers": [],
  "has_comparison_table": false,
  "comparison_table": "신ㆍ구조문대비표\n현 행 개 정 안\n법률 제16832호 국가재정법 법률 제16832호 국가재정법\n일부개정법률 ",
  "full_text": "국가재정법 일부개정법률안\n(이철규의원 대표발의)\n발의연월일 : 2024. 7. 22.\n의 안\n2096\n번 호 발 의 자 : 이철규ㆍ조정훈ㆍ박충권\n박준태ㆍ김성원ㆍ강승규\n박성민ㆍ구자근ㆍ정희용\n김 건ㆍ유상범ㆍ이인선\n김종양ㆍ임이자ㆍ신동욱\n정점식 의원(16인)\n제안이유 및 주요내용\n「소재․부품․장비산업 경쟁력 강화 및 공급망 안정화를 위한 특\n별조치법」의 소재ㆍ부품ㆍ장비 경쟁력강화 특별회계를 소재ㆍ부품ㆍ\n장비경쟁력강화 및 공급망 안정화 특별회계로 확대ㆍ개편하는 한편\n특별회계의 유효기간을 2029년 12월 31일까지 5년 연장하는 것에 맞\n추어 「국가재정법」의 관련 특별회계의 명칭 변경 및 연장 근거조항\n을 개정하고자 함(안 법률 제16832호 국가재정법 일부개정법률 부칙\n제2조).\n참고사항\n가. 이 법률안은 이철규의원이 대표발의한 「소재ㆍ부품ㆍ장비산업 경\n\n\n\n쟁력 강화 및 공급망 안정화를 위한 특별조치법 일부개정법률안」\n(의안번호 제2094호)의 의결을 전제로 하는 것이므로 같은 법률안\n이 의결되지 아니하거나 수정의결 되는 경우에는 이에 맞추어 조정\n되어야 할 것임.\n나. 이 법률안은 「국회법」 제85조의3제4항에 따라 2025년도 세입예\n산안 부수 법률안으로 지정될 필요가 있음.\n\n법률 제 호\n국가재정법 일부개정법률안\n국가재정법 일부를 다음과 같이 개정한다.\n법률 제16832호 국가재정법 일부개정법률 부칙 제2조 중 “2024년 12\n월 31일”을 “2029년 12월 31일”로 한다.\n별표 1 제22호 중 “경쟁력강화”를 “경쟁력강화 및 공급망 안정화”로\n한다.\n부 칙\n이 법은 공포한 날부터 시행한다.\n\n\n\n\n신ㆍ구조문대비표\n현 행 개 정 안\n법률 제16832호 국가재정법 법률 제16832호 국가재정법\n일부개정법률 부칙 일부개정법률 부칙\n제2조(유효기간) 별표 1 제22호의 제2조(유효기간) ------------\n개정규정은 2024년 12월 31일까 ---------2029년 12월 31일-\n지 효력을 가진다. ----------.\n--",
  "sections": {
    "제안이유": "및",
    "주요내용": "「소재․부품․장비산업 경쟁력 강화 및 공급망 안정화를 위한 특\n별조치법」의 소재ㆍ부품ㆍ장비 경쟁력강화 특별회계를 소재ㆍ부품ㆍ\n장비경쟁력강화 및 공급망 안정화 특별회계로 확대ㆍ개편하는 한편\n특별회계의 유효기간을 2029년 12월 31일까지 5년 연장하는 것에 맞\n추어 「국가재정법」의 관련 특별회계의 명칭 변경 및 연장 근거조항\n을 개정하고자 함(안",
    "제안이유_및_주요내용": "「소재․부품․장비산업 경쟁력 강화 및 공급망 안정화를 위한 특\n별조치법」의 소재ㆍ부품ㆍ장비 경쟁력강화 특별회계를 소재ㆍ부품ㆍ\n장비경쟁력강화 및 공급망 안정화 특별회계로 확대ㆍ개편하는 한편\n특별회계의 유효기간을 2029년 12월 31일까지 5년 연장하는 것에 맞\n추어 「국가재정법」의 관련 특별회계의 명칭 변경 및 연장 근거조항\n을 개정하고자 함(안",
    "법률_제_호": "국가재정법 일부개정법률",
    "신구조문대비표": "현 행 개 정 안\n법률 제16832호 국가재정법 법률 제16832호 국가재정법\n일부개정법률"
  }
}