{
  "title": "2202503_주차장법_일부개정법률안",
  "bill_number": "2503",
  "proposal_date": "2024. 8. 1.",
  "submission_date": "",
  "is_alternative": false,
  "alternative_bill_numbers": [],
  "has_comparison_table": false,
  "comparison_table": "신ㆍ구조문대비표\n현 행 개 정 안\n제6조(주차장설비기준 등) ① ∼ 제6조(주차장설비기준 등) ① ∼\n④ (생 략) ④ (현행과 같음)\n<신 설> ⑤ 제1항에 따른 환경친화적\n자동차의 충전시설을 설치하는\n경우에는 소방용수시설, 소화수\n조 등 국토교통부령으로 정하\n는 소방시설을 설치하여야 한\n다.",
  "full_text": "주차장법 일부개정법률안\n(송언석의원 대표발의)\n발의연월일 : 2024. 8. 1.\n의 안\n2503\n번 호 발 의 자 : 송언석ㆍ구자근ㆍ김미애\n백종헌ㆍ김종양ㆍ김석기\n고동진ㆍ성일종ㆍ권성동\n장동혁 의원(10인)\n제안이유 및 주요내용\n현행법은 전기차를 포함한 환경친화적 자동차의 이용을 지원하기\n위하여 주차장의 주차대수 중 환경친화적 자동차를 위한 전용주차구\n획을 일정 비율 이상 설치하도록 하고 이 경우 충전시설도 포함하여\n설치하도록 정하고 있음.\n하지만 현행법에는 화재 대응을 위한 소방시설 설치와 주차장의 안\n전기준에 관한 규정이 부재하여 환경친화적 자동차의 화재사고 위험\n성이 높아지고 있음.\n이에 주차장에 환경친화적 자동차의 충전시설을 설치하는 경우 소\n방용수시설, 소화수조 등의 소방시설 설치를 의무화해 환경친화적 자\n동차로 인한 화재발생시 신속한 초기 대응을 도모하고 주차장 이용의\n안전성을 제고하려는 것임(안 제6조제5항 신설).\n\n\n\n\n법률 제 호\n주차장법 일부개정법률안\n주차장법 일부를 다음과 같이 개정한다.\n제6조에 제5항을 다음과 같이 신설한다.\n⑤ 제1항에 따른 환경친화적 자동차의 충전시설을 설치하는 경우에\n는 소방용수시설, 소화수조 등 국토교통부령으로 정하는 소방시설을\n설치하여야 한다.\n부 칙\n제1조(시행일) 이 법은 공포 후 12개월이 경과한 날부터 시행한다.\n제2조(소방시설 설치에 관한 경과조치) 이 법 시행 당시 종전의 규정\n에 따라 설치한 환경친화적 자동차의 충전시설이 제6조제5항의 개\n정규정에 따른 소방시설 기준에 부적합한 경우에는 이 법 시행일부\n터 1년이 되는 날까지 제6조제5항의 개정규정에 따른 소방시설 기\n준에 부합하도록 개선하여야 한다.\n\n\n\n\n신ㆍ구조문대비표\n현 행 개 정 안\n제6조(주차장설비기준 등) ① ∼ 제6조(주차장설비기준 등) ① ∼\n④ (생 략) ④ (현행과 같음)\n<신 설> ⑤ 제1항에 따른 환경친화적\n자동차의 충전시설을 설치하는\n경우에는 소방용수시설, 소화수\n조 등 국토교통부령으로 정하\n는 소방시설을 설치하여야 한\n다.\n",
  "sections": {
    "제안이유": "및",
    "주요내용": "현행법은 전기차를 포함한 환경친화적 자동차의 이용을 지원하기\n위하여 주차장의 주차대수 중 환경친화적 자동차를 위한 전용주차구\n획을 일정 비율 이상 설치하도록 하고 이 경우 충전시설도 포함하여\n설치하도록 정하고 있음.\n하지만 현행법에는 화재 대응을 위한 소방시설 설치와 주차장의 안\n전기준에 관한 규정이 부재하여 환경친화적 자동차의 화재사고 위험\n성이 높아지고 있음.\n이에 주차장에 환경친화적 자동차의 충전시설을 설치하는 경우 소\n방용수시설, 소화수조 등의 소방시설 설치를 의무화해 환경친화적 자\n동차로 인한 화재발생시 신속한 초기 대응을 도모하고 주차장 이용의\n안전성을 제고하려는 것임(안 제6조제5항 신설).",
    "제안이유_및_주요내용": "현행법은 전기차를 포함한 환경친화적 자동차의 이용을 지원하기\n위하여 주차장의 주차대수 중 환경친화적 자동차를 위한 전용주차구\n획을 일정 비율 이상 설치하도록 하고 이 경우 충전시설도 포함하여\n설치하도록 정하고 있음.\n하지만 현행법에는 화재 대응을 위한 소방시설 설치와 주차장의 안\n전기준에 관한 규정이 부재하여 환경친화적 자동차의 화재사고 위험\n성이 높아지고 있음.\n이에 주차장에 환경친화적 자동차의 충전시설을 설치하는 경우 소\n방용수시설, 소화수조 등의 소방시설 설치를 의무화해 환경친화적 자\n동차로 인한 화재발생시 신속한 초기 대응을 도모하고 주차장 이용의\n안전성을 제고하려는 것임(안 제6조제5항 신설).",
    "법률_제_호": "주차장법 일부개정법률안\n주차장법 일부를 다음과 같이 개정한다.\n제6조에 제5항을 다음과 같이 신설한다.\n⑤ 제1항에 따른 환경친화적 자동차의 충전시설을 설치하는 경우에\n는 소방용수시설, 소화수조 등 국토교통부령으로 정하는 소방시설을\n설치하여야 한다.",
    "신구조문대비표": "현 행 개 정 안\n제6조(주차장설비기준 등) ① ∼ 제6조(주차장설비기준 등) ① ∼\n④ (생 략) ④ (현행과 같음)\n<신 설> ⑤ 제1항에 따른 환경친화적\n자동차의 충전시설을 설치하는\n경우에는 소방용수시설, 소화수\n조 등 국토교통부령으로 정하\n는 소방시설을 설치하여야 한\n다."
  }
}