{
  "title": "2202887_자동차관리법_일부개정법률안",
  "bill_number": "2887",
  "proposal_date": "2024. 8. 16.",
  "submission_date": "",
  "is_alternative": false,
  "alternative_bill_numbers": [],
  "has_comparison_table": false,
  "comparison_table": "신ㆍ구조문대비표\n현 행 개 정 안\n제12조(이전등록) ① ∼ ⑥ (생 제12조(이전등록) ① ∼ ⑥ (현행\n략) 과 같음)\n<신 설> ⑦ 시ㆍ도지사는 자동차 소유\n자가 사망한 경우 대통령령으\n로 정하는 바에 따라 상속인에\n게 제1항에 따른 이전등록의\n신청에 관한 사항을 안내하여\n야 한다.\n⑦ (생 략) ⑧ (현행 제7항과 같음)",
  "full_text": "자동차관리법 일부개정법률안\n(조지연의원 대표발의)\n발의연월일 : 2024. 8. 16.\n의 안\n2887\n번 호 발 의 자 : 조지연ㆍ엄태영ㆍ박준태\n박정하ㆍ박덕흠ㆍ강대식\n구자근ㆍ고동진ㆍ주호영\n백종헌ㆍ임이자 의원\n(11인)\n제안이유 및 주요내용\n현행법은 자동차 양수인에 대한 자동차 소유권의 이전등록 신청의\n무 및 의무 위반에 대한 처벌 근거를 마련하고 있으며, 그 세부적인\n사항을 정하고 있는 대통령령인 「자동차등록령」은 상속이전에 한하\n여 신청사항을 우편 등의 방법으로 안내할 수 있도록 규정하고 있음.\n그런데 상속이전에 대한 국민 인식이 높지 않고, 현행 안내제도가\n상속인이 아닌 피상속인을 대상으로 하면서도 의무사항이 아닌 재량\n사항으로 규정되어 있어 기간 내에 이전등록을 신청하지 못하는 사례\n가 상당수 지속적으로 발생하고 있는 실정임.\n이에 현행 「자동차등록령」에서 정하고 있는 상속이전에 대한 안\n내를 법률로 상향하여 의무화하고, 그 대상을 상속인으로 명시하여 선\n량한 피해자가 발생하지 않도록 하려는 것임(안 제12조제7항 신설).\n\n\n\n\n법률 제 호\n자동차관리법 일부개정법률안\n자동차관리법 일부를 다음과 같이 개정한다.\n제12조제7항을 제8항으로 하고, 같은 조에 제7항을 다음과 같이 신설\n한다.\n⑦ 시ㆍ도지사는 자동차 소유자가 사망한 경우 대통령령으로 정하\n는 바에 따라 상속인에게 제1항에 따른 이전등록의 신청에 관한 사\n항을 안내하여야 한다.\n부 칙\n이 법은 공포 후 6개월이 경과한 날부터 시행한다.\n\n\n\n\n신ㆍ구조문대비표\n현 행 개 정 안\n제12조(이전등록) ① ∼ ⑥ (생 제12조(이전등록) ① ∼ ⑥ (현행\n략) 과 같음)\n<신 설> ⑦ 시ㆍ도지사는 자동차 소유\n자가 사망한 경우 대통령령으\n로 정하는 바에 따라 상속인에\n게 제1항에 따른 이전등록의\n신청에 관한 사항을 안내하여\n야 한다.\n⑦ (생 략) ⑧ (현행 제7항과 같음)\n",
  "sections": {
    "제안이유": "및",
    "주요내용": "현행법은 자동차 양수인에 대한 자동차 소유권의 이전등록 신청의\n무 및 의무 위반에 대한 처벌 근거를 마련하고 있으며, 그 세부적인\n사항을 정하고 있는 대통령령인 「자동차등록령」은 상속이전에 한하\n여 신청사항을 우편 등의 방법으로 안내할 수 있도록 규정하고 있음.\n그런데 상속이전에 대한 국민 인식이 높지 않고, 현행 안내제도가\n상속인이 아닌 피상속인을 대상으로 하면서도 의무사항이 아닌 재량\n사항으로 규정되어 있어 기간 내에 이전등록을 신청하지 못하는 사례\n가 상당수 지속적으로 발생하고 있는 실정임.\n이에 현행 「자동차등록령」에서 정하고 있는 상속이전에 대한 안\n내를 법률로 상향하여 의무화하고, 그 대상을 상속인으로 명시하여 선\n량한 피해자가 발생하지 않도록 하려는 것임(안 제12조제7항 신설).",
    "제안이유_및_주요내용": "현행법은 자동차 양수인에 대한 자동차 소유권의 이전등록 신청의\n무 및 의무 위반에 대한 처벌 근거를 마련하고 있으며, 그 세부적인\n사항을 정하고 있는 대통령령인 「자동차등록령」은 상속이전에 한하\n여 신청사항을 우편 등의 방법으로 안내할 수 있도록 규정하고 있음.\n그런데 상속이전에 대한 국민 인식이 높지 않고, 현행 안내제도가\n상속인이 아닌 피상속인을 대상으로 하면서도 의무사항이 아닌 재량\n사항으로 규정되어 있어 기간 내에 이전등록을 신청하지 못하는 사례\n가 상당수 지속적으로 발생하고 있는 실정임.\n이에 현행 「자동차등록령」에서 정하고 있는 상속이전에 대한 안\n내를 법률로 상향하여 의무화하고, 그 대상을 상속인으로 명시하여 선\n량한 피해자가 발생하지 않도록 하려는 것임(안 제12조제7항 신설).",
    "법률_제_호": "자동차관리법 일부개정법률안\n자동차관리법 일부를 다음과 같이 개정한다.\n제12조제7항을 제8항으로 하고, 같은 조에 제7항을 다음과 같이 신설\n한다.\n⑦ 시ㆍ도지사는 자동차 소유자가 사망한 경우 대통령령으로 정하\n는 바에 따라 상속인에게 제1항에 따른 이전등록의 신청에 관한 사\n항을 안내하여야 한다.",
    "신구조문대비표": "현 행 개 정 안\n제12조(이전등록) ① ∼ ⑥ (생 제12조(이전등록) ① ∼ ⑥ (현행\n략) 과 같음)\n<신 설> ⑦ 시ㆍ도지사는 자동차 소유\n자가 사망한 경우 대통령령으\n로 정하는 바에 따라 상속인에\n게 제1항에 따른 이전등록의\n신청에 관한 사항을 안내하여\n야 한다.\n⑦ (생 략) ⑧ (현행 제7항과 같음)"
  }
}