{
  "title": "2202643_의료법_일부개정법률안",
  "bill_number": "2643",
  "proposal_date": "2024. 8. 8.",
  "submission_date": "",
  "is_alternative": false,
  "alternative_bill_numbers": [],
  "has_comparison_table": false,
  "comparison_table": "신ㆍ구조문대비표\n현 행 개 정 안\n제15조(진료거부 금지 등) ①ㆍ② 제15조(진료거부 금지 등) ①ㆍ②\n(생 략) (현행과 같음)\n<신 설> ③ 의료인 또는 의료기관 개설\n자는 장애인 환자에게 이 법\n및 「장애인차별금지 및 권리\n구제 등에 관한 법률」 등에서\n정하는 바에 따라 최선의 처치\n를 하여야 한다.",
  "full_text": "의료법 일부개정법률안\n(서미화의원 대표발의)\n발의연월일 : 2024. 8. 8.\n의 안\n2643\n번 호 발 의 자 : 서미화ㆍ박정현ㆍ이연희\n안규백ㆍ이기헌ㆍ조계원\n조 국ㆍ허 영ㆍ조인철\n오세희ㆍ박해철ㆍ복기왕\n정일영ㆍ김원이ㆍ박수현\n이병진ㆍ정준호ㆍ황정아\n김성환ㆍ박희승ㆍ박지혜\n의원(21인)\n제안이유 및 주요내용\n현행법은 진료나 조산 요청을 받은 의료인 또는 의료기관 개설자는\n정당한 사유 없이 거부하지 못하도록 하고 있고, 「장애인차별금지 및\n권리구제 등에 관한 법률」에서는 의료기관 및 의료인은 장애인에 대\n한 의료행위에 있어서 장애인을 제한ㆍ배제ㆍ분리ㆍ거부하지 못하도\n록 하여 장애인에 대한 건강권의 차별을 금지하고 있음.\n그러나 최근 지체장애를 이유로 치과 진료를 거부하는 사례가 발생\n하였으며, 발달장애인인 한 환자가 부상 첫날에 27군데의 병원에서 진\n료를 거절하는 사례가 발생하는 등 장애인이라는 이유만으로 건강권\n을 침해받는 사례가 발생하고 있음.\n\n\n\n이에 의료인 또는 의료기관 개설자는 장애인 환자에게 이 법 및\n「장애인차별금지 및 권리구제 등에 관한 법률」 등에서 정하는 바에\n따라 최선의 처치를 하도록 규정함으로써 장애인의 의료를 받을 권리\n를 보장하려는 것임(안 제15조제3항 신설).\n\n법률 제 호\n의료법 일부개정법률안\n의료법 일부를 다음과 같이 개정한다.\n제15조에 제3항을 다음과 같이 신설한다.\n③ 의료인 또는 의료기관 개설자는 장애인 환자에게 이 법 및 「장\n애인차별금지 및 권리구제 등에 관한 법률」 등에서 정하는 바에\n따라 최선의 처치를 하여야 한다.\n부 칙\n이 법은 공포한 날부터 시행한다.\n\n\n\n\n신ㆍ구조문대비표\n현 행 개 정 안\n제15조(진료거부 금지 등) ①ㆍ② 제15조(진료거부 금지 등) ①ㆍ②\n(생 략) (현행과 같음)\n<신 설> ③ 의료인 또는 의료기관 개설\n자는 장애인 환자에게 이 법\n및 「장애인차별금지 및 권리\n구제 등에 관한 법률」 등에서\n정하는 바에 따라 최선의 처치\n를 하여야 한다.\n",
  "sections": {
    "제안이유": "및",
    "주요내용": "현행법은 진료나 조산 요청을 받은 의료인 또는 의료기관 개설자는\n정당한 사유 없이 거부하지 못하도록 하고 있고, 「장애인차별금지 및\n권리구제 등에 관한 법률」에서는 의료기관 및 의료인은 장애인에 대\n한 의료행위에 있어서 장애인을 제한ㆍ배제ㆍ분리ㆍ거부하지 못하도\n록 하여 장애인에 대한 건강권의 차별을 금지하고 있음.\n그러나 최근 지체장애를 이유로 치과 진료를 거부하는 사례가 발생\n하였으며, 발달장애인인 한 환자가 부상 첫날에 27군데의 병원에서 진\n료를 거절하는 사례가 발생하는 등 장애인이라는 이유만으로 건강권\n을 침해받는 사례가 발생하고 있음.\n\n\n\n이에 의료인 또는 의료기관 개설자는 장애인 환자에게 이 법 및\n「장애인차별금지 및 권리구제 등에 관한 법률」 등에서 정하는 바에\n따라 최선의 처치를 하도록 규정함으로써 장애인의 의료를 받을 권리\n를 보장하려는 것임(안 제15조제3항 신설).",
    "제안이유_및_주요내용": "현행법은 진료나 조산 요청을 받은 의료인 또는 의료기관 개설자는\n정당한 사유 없이 거부하지 못하도록 하고 있고, 「장애인차별금지 및\n권리구제 등에 관한 법률」에서는 의료기관 및 의료인은 장애인에 대\n한 의료행위에 있어서 장애인을 제한ㆍ배제ㆍ분리ㆍ거부하지 못하도\n록 하여 장애인에 대한 건강권의 차별을 금지하고 있음.\n그러나 최근 지체장애를 이유로 치과 진료를 거부하는 사례가 발생\n하였으며, 발달장애인인 한 환자가 부상 첫날에 27군데의 병원에서 진\n료를 거절하는 사례가 발생하는 등 장애인이라는 이유만으로 건강권\n을 침해받는 사례가 발생하고 있음.\n\n\n\n이에 의료인 또는 의료기관 개설자는 장애인 환자에게 이 법 및\n「장애인차별금지 및 권리구제 등에 관한 법률」 등에서 정하는 바에\n따라 최선의 처치를 하도록 규정함으로써 장애인의 의료를 받을 권리\n를 보장하려는 것임(안 제15조제3항 신설).",
    "법률_제_호": "의료법 일부개정법률안\n의료법 일부를 다음과 같이 개정한다.\n제15조에 제3항을 다음과 같이 신설한다.\n③ 의료인 또는 의료기관 개설자는 장애인 환자에게 이 법 및 「장\n애인차별금지 및 권리구제 등에 관한 법률」 등에서 정하는 바에\n따라 최선의 처치를 하여야 한다.",
    "신구조문대비표": "현 행 개 정 안\n제15조(진료거부 금지 등) ①ㆍ② 제15조(진료거부 금지 등) ①ㆍ②\n(생 략) (현행과 같음)\n<신 설> ③ 의료인 또는 의료기관 개설\n자는 장애인 환자에게 이 법\n및 「장애인차별금지 및 권리\n구제 등에 관한 법률」 등에서\n정하는 바에 따라 최선의 처치\n를 하여야 한다."
  }
}