{
  "title": "2202943_국경일에_관한_법률_일부개정법률안",
  "bill_number": "2943",
  "proposal_date": "2024. 8. 19.",
  "submission_date": "",
  "is_alternative": false,
  "alternative_bill_numbers": [],
  "has_comparison_table": false,
  "comparison_table": "신․구조문대비표\n현 행 개 정 안\n제2조(국경일의 종류) 국경일은 제2조(국경일의 종류) --------\n다음 각 호와 같다. --------------.\n1. (생 략) 1. (현행과 같음)\n<신 설> 2. 4ㆍ19혁명일: 4월 19일\n2. ～ 5. (생 략) 3. ～ 6. (현행 제2호부터 제5\n호까지와 같음)",
  "full_text": "국경일에 관한 법률 일부개정법률안\n(김영호의원 대표발의)\n발의연월일 : 2024. 8. 19.\n의 안\n2943\n번 호 발 의 자 : 김영호ㆍ이해식ㆍ강경숙\n최민희ㆍ송재봉ㆍ박희승\n문정복ㆍ김문수ㆍ김성환\n한민수ㆍ박지원ㆍ안태준\n강득구ㆍ박홍근 의원\n(14인)\n제안이유 및 주요내용\n4ㆍ19혁명은 우리나라 역사상 최초로 순수한 학생이 중심이 되고\n시민이 함께 궐기하여 반민주적인 독재정권을 무너뜨리고, 훼손되고\n변질된 헌정 기본질서를 바로 세우며 사회 정의를 구현한 세계적인\n민주혁명임.\n아울러 4ㆍ19혁명 이후 헌법을 개정함에 이르러 우리 헌법 전문에\n도 4ㆍ19혁명의 민주이념은 불의에 항거한 민주이념으로서 3ㆍ1운동\n과 함께 우리 국민이 계승하여야 한다고 명시되어 있음.\n이에 4ㆍ19혁명의 역사적 가치와 그 의의에 걸맞게 4ㆍ19혁명일을\n국경일로 정하여 국가의 경사로운 날로 기념할 수 있도록 하려는 것\n임(안 제2조제2호 신설).\n\n\n\n\n법률 제 호\n국경일에 관한 법률 일부개정법률안\n국경일에 관한 법률 일부를 다음과 같이 개정한다.\n제2조제2호부터 제5호까지를 각각 제3호부터 제6호까지로 하고, 같은\n조에 제2호를 다음과 같이 신설한다.\n2. 4ㆍ19혁명일: 4월 19일\n부 칙\n이 법은 공포한 날부터 시행한다.\n\n\n\n\n신․구조문대비표\n현 행 개 정 안\n제2조(국경일의 종류) 국경일은 제2조(국경일의 종류) --------\n다음 각 호와 같다. --------------.\n1. (생 략) 1. (현행과 같음)\n<신 설> 2. 4ㆍ19혁명일: 4월 19일\n2. ～ 5. (생 략) 3. ～ 6. (현행 제2호부터 제5\n호까지와 같음)\n",
  "sections": {
    "제안이유": "및",
    "주요내용": "4ㆍ19혁명은 우리나라 역사상 최초로 순수한 학생이 중심이 되고\n시민이 함께 궐기하여 반민주적인 독재정권을 무너뜨리고, 훼손되고\n변질된 헌정 기본질서를 바로 세우며 사회 정의를 구현한 세계적인\n민주혁명임.\n아울러 4ㆍ19혁명 이후 헌법을 개정함에 이르러 우리 헌법 전문에\n도 4ㆍ19혁명의 민주이념은 불의에 항거한 민주이념으로서 3ㆍ1운동\n과 함께 우리 국민이 계승하여야 한다고 명시되어 있음.\n이에 4ㆍ19혁명의 역사적 가치와 그 의의에 걸맞게 4ㆍ19혁명일을\n국경일로 정하여 국가의 경사로운 날로 기념할 수 있도록 하려는 것\n임(안 제2조제2호 신설).",
    "제안이유_및_주요내용": "4ㆍ19혁명은 우리나라 역사상 최초로 순수한 학생이 중심이 되고\n시민이 함께 궐기하여 반민주적인 독재정권을 무너뜨리고, 훼손되고\n변질된 헌정 기본질서를 바로 세우며 사회 정의를 구현한 세계적인\n민주혁명임.\n아울러 4ㆍ19혁명 이후 헌법을 개정함에 이르러 우리 헌법 전문에\n도 4ㆍ19혁명의 민주이념은 불의에 항거한 민주이념으로서 3ㆍ1운동\n과 함께 우리 국민이 계승하여야 한다고 명시되어 있음.\n이에 4ㆍ19혁명의 역사적 가치와 그 의의에 걸맞게 4ㆍ19혁명일을\n국경일로 정하여 국가의 경사로운 날로 기념할 수 있도록 하려는 것\n임(안 제2조제2호 신설).",
    "법률_제_호": "국경일에 관한 법률 일부개정법률안\n국경일에 관한 법률 일부를 다음과 같이 개정한다.\n제2조제2호부터 제5호까지를 각각 제3호부터 제6호까지로 하고, 같은\n조에 제2호를 다음과 같이 신설한다.\n2. 4ㆍ19혁명일: 4월 19일",
    "신구조문대비표": "현 행 개 정 안\n제2조(국경일의 종류) 국경일은 제2조(국경일의 종류) --------\n다음 각 호와 같다. --------------.\n1. (생 략) 1. (현행과 같음)\n<신 설> 2. 4ㆍ19혁명일: 4월 19일\n2. ～ 5. (생 략) 3. ～ 6. (현행 제2호부터 제5\n호까지와 같음)"
  }
}