{
  "title": "2202553_도로법_일부개정법률안",
  "bill_number": "2553",
  "proposal_date": "2024. 8. 5.",
  "submission_date": "",
  "is_alternative": false,
  "alternative_bill_numbers": [],
  "has_comparison_table": false,
  "comparison_table": "신ㆍ구조문대비표\n현 행 개 정 안\n제30조(도로구역 내 시설의 설치) 제30조(도로구역 내 시설의 설치)\n(생 략) ① (현행 제목 외의 부분과 같\n음)\n<신 설> ② 도로관리청은 도로의 부속\n물을 설치ㆍ운영하려는 경우에\n는 「도로교통법」 제3조제1항\n에 따라 교통안전시설을 설치\nㆍ관리하는 자와 사전에 협의\n하여야 한다.",
  "full_text": "도로법 일부개정법률안\n(이춘석의원 대표발의)\n발의연월일 : 2024. 8. 5.\n의 안\n2553\n번 호 발 의 자 : 이춘석ㆍ안호영ㆍ윤종군\n윤준병ㆍ김윤덕ㆍ이기헌\n조 국ㆍ정준호ㆍ안태준\n이원택ㆍ위성곤 의원\n(11인)\n제안이유 및 주요내용\n현행법에 따라 도로관리청은 도로 이용자의 편의 증진과 도로에서\n의 위험을 방지하기 위하여 시선유도표지, 방호울타리, 가로등 등 도\n로의 부속물을 설치ㆍ운영하고 있음. 한편, 시장 등은 「도로교통법」\n에 따라 도로에서의 위험을 방지하고 교통의 안전과 원활한 소통을\n확보하기 위하여 신호기 및 안전표지와 같은 교통안전시설을 설치ㆍ\n운영하고 있음.\n그런데 도로의 부속물과 교통안전시설이 서로 연계되어 설치ㆍ관리\n되지 못하고 개별적으로 무분별하게 설치ㆍ운영되어 해당 부속물과\n시설이 그 기능을 효과적으로 발휘하지 못하여 예산상 낭비가 초래되\n고 있다는 지적이 있음. 이는 도로의 부속물과 교통안전시설의 설치\n주체가 상이한 경우가 있기 때문임.\n이에 도로관리청이 도로의 부속물을 설치ㆍ운영하려는 경우 교통안\n\n\n\n전시설을 설치ㆍ관리하는 자와 사전에 협의하도록 함으로써 도로의\n부속물과 교통안전시설의 연계성을 높이며, 불필요한 예산낭비가 발\n생하지 않도록 하고, 도로의 부속물과 교통안전시설이 적재적소에서\n그 기능을 제대로 발휘하여 도로의 안전을 제고하려는 것임(안 제30\n조제2항 신설).\n\n법률 제 호\n도로법 일부개정법률안\n도로법 일부를 다음과 같이 개정한다.\n제30조 제목 외의 부분을 제1항으로 하고, 같은 조에 제2항을 다음과\n같이 신설한다.\n② 도로관리청은 도로의 부속물을 설치ㆍ운영하려는 경우에는 「도\n로교통법」 제3조제1항에 따라 교통안전시설을 설치ㆍ관리하는 자\n와 사전에 협의하여야 한다.\n부 칙\n이 법은 공포 후 6개월이 경과한 날부터 시행한다.\n\n\n\n\n신ㆍ구조문대비표\n현 행 개 정 안\n제30조(도로구역 내 시설의 설치) 제30조(도로구역 내 시설의 설치)\n(생 략) ① (현행 제목 외의 부분과 같\n음)\n<신 설> ② 도로관리청은 도로의 부속\n물을 설치ㆍ운영하려는 경우에\n는 「도로교통법」 제3조제1항\n에 따라 교통안전시설을 설치\nㆍ관리하는 자와 사전에 협의\n하여야 한다.\n",
  "sections": {
    "제안이유": "및",
    "주요내용": "현행법에 따라 도로관리청은 도로 이용자의 편의 증진과 도로에서\n의 위험을 방지하기 위하여 시선유도표지, 방호울타리, 가로등 등 도\n로의 부속물을 설치ㆍ운영하고 있음. 한편, 시장 등은 「도로교통법」\n에 따라 도로에서의 위험을 방지하고 교통의 안전과 원활한 소통을\n확보하기 위하여 신호기 및 안전표지와 같은 교통안전시설을 설치ㆍ\n운영하고 있음.\n그런데 도로의 부속물과 교통안전시설이 서로 연계되어 설치ㆍ관리\n되지 못하고 개별적으로 무분별하게 설치ㆍ운영되어 해당 부속물과\n시설이 그 기능을 효과적으로 발휘하지 못하여 예산상 낭비가 초래되\n고 있다는 지적이 있음. 이는 도로의 부속물과 교통안전시설의 설치\n주체가 상이한 경우가 있기 때문임.\n이에 도로관리청이 도로의 부속물을 설치ㆍ운영하려는 경우 교통안\n\n\n\n전시설을 설치ㆍ관리하는 자와 사전에 협의하도록 함으로써 도로의\n부속물과 교통안전시설의 연계성을 높이며, 불필요한 예산낭비가 발\n생하지 않도록 하고, 도로의 부속물과 교통안전시설이 적재적소에서\n그 기능을 제대로 발휘하여 도로의 안전을 제고하려는 것임(안 제30\n조제2항 신설).",
    "제안이유_및_주요내용": "현행법에 따라 도로관리청은 도로 이용자의 편의 증진과 도로에서\n의 위험을 방지하기 위하여 시선유도표지, 방호울타리, 가로등 등 도\n로의 부속물을 설치ㆍ운영하고 있음. 한편, 시장 등은 「도로교통법」\n에 따라 도로에서의 위험을 방지하고 교통의 안전과 원활한 소통을\n확보하기 위하여 신호기 및 안전표지와 같은 교통안전시설을 설치ㆍ\n운영하고 있음.\n그런데 도로의 부속물과 교통안전시설이 서로 연계되어 설치ㆍ관리\n되지 못하고 개별적으로 무분별하게 설치ㆍ운영되어 해당 부속물과\n시설이 그 기능을 효과적으로 발휘하지 못하여 예산상 낭비가 초래되\n고 있다는 지적이 있음. 이는 도로의 부속물과 교통안전시설의 설치\n주체가 상이한 경우가 있기 때문임.\n이에 도로관리청이 도로의 부속물을 설치ㆍ운영하려는 경우 교통안\n\n\n\n전시설을 설치ㆍ관리하는 자와 사전에 협의하도록 함으로써 도로의\n부속물과 교통안전시설의 연계성을 높이며, 불필요한 예산낭비가 발\n생하지 않도록 하고, 도로의 부속물과 교통안전시설이 적재적소에서\n그 기능을 제대로 발휘하여 도로의 안전을 제고하려는 것임(안 제30\n조제2항 신설).",
    "법률_제_호": "도로법 일부개정법률안\n도로법 일부를 다음과 같이 개정한다.\n제30조 제목 외의 부분을 제1항으로 하고, 같은 조에 제2항을 다음과\n같이 신설한다.\n② 도로관리청은 도로의 부속물을 설치ㆍ운영하려는 경우에는 「도\n로교통법」 제3조제1항에 따라 교통안전시설을 설치ㆍ관리하는 자\n와 사전에 협의하여야 한다.",
    "신구조문대비표": "현 행 개 정 안\n제30조(도로구역 내 시설의 설치) 제30조(도로구역 내 시설의 설치)\n(생 략) ① (현행 제목 외의 부분과 같\n음)\n<신 설> ② 도로관리청은 도로의 부속\n물을 설치ㆍ운영하려는 경우에\n는 「도로교통법」 제3조제1항\n에 따라 교통안전시설을 설치\nㆍ관리하는 자와 사전에 협의\n하여야 한다."
  }
}