{
  "title": "2202627_형법_일부개정법률안",
  "bill_number": "2627",
  "proposal_date": "2024. 8. 7.",
  "submission_date": "",
  "is_alternative": false,
  "alternative_bill_numbers": [],
  "has_comparison_table": false,
  "comparison_table": "신·구조문대비표\n현 행 개 정 안\n第98條(間諜) ①⋅② (생 략) 第98條(間諜) ①⋅② (현행과 같\n음)\n<신 설> ③ 외국 또는 이에 준하는 단\n체를 위하여 간첩한 자는 5년\n이상의 징역에 처한다.",
  "full_text": "형법 일부개정법률안\n(김선교의원 대표발의)\n발의연월일 : 2024. 8. 7.\n의 안\n2627\n번 호 발 의 자 : 김선교ㆍ구자근ㆍ서지영\n김성원ㆍ윤상현ㆍ서천호\n김예지ㆍ박준태ㆍ박정훈\n김상훈 의원(10인)\n제안이유 및 주요내용\n현행법은 적국을 위한 간첩행위를 처벌대상으로 명시하고 있어, 적\n국이 아닌 외국을 위한 간첩 행위는 다른 법률을 통해 처벌해야 하는\n상황임.\n그러나 냉전체제의 종식 및 포괄적 안보개념 대두 등 국제정세의\n변화에 따라 ‘적국’의 개념이 모호해지고, 적대관계 유무와 상관없이\n국가기밀의 해외유출 방지 필요성은 더욱 강조되고 있으며, 간첩죄의\n적용범위에 ‘외국’ 및 ‘외국에 준하는 단체’를 포함시킬 필요가 있음.\n이에 적국을 위한 간첩과는 별도로 외국 또는 이에 준하는 단체를\n위하여 간첩한 자를 5년 이상의 징역에 처하게 하려는 것임(안 제98조\n제3항 신설).\n\n\n\n\n법률 제 호\n형법 일부개정법률안\n형법 일부를 다음과 같이 개정한다.\n제98조에 제3항을 다음과 같이 신설한다.\n③ 외국 또는 이에 준하는 단체를 위하여 간첩한 자는 5년 이상의\n징역에 처한다.\n부 칙\n이 법은 공포 후 3개월이 경과한 날부터 시행한다.\n\n\n\n\n신·구조문대비표\n현 행 개 정 안\n第98條(間諜) ①⋅② (생 략) 第98條(間諜) ①⋅② (현행과 같\n음)\n<신 설> ③ 외국 또는 이에 준하는 단\n체를 위하여 간첩한 자는 5년\n이상의 징역에 처한다.\n",
  "sections": {
    "제안이유": "및",
    "주요내용": "현행법은 적국을 위한 간첩행위를 처벌대상으로 명시하고 있어, 적\n국이 아닌 외국을 위한 간첩 행위는 다른 법률을 통해 처벌해야 하는\n상황임.\n그러나 냉전체제의 종식 및 포괄적 안보개념 대두 등 국제정세의\n변화에 따라 ‘적국’의 개념이 모호해지고, 적대관계 유무와 상관없이\n국가기밀의 해외유출 방지 필요성은 더욱 강조되고 있으며, 간첩죄의\n적용범위에 ‘외국’ 및 ‘외국에 준하는 단체’를 포함시킬 필요가 있음.\n이에 적국을 위한 간첩과는 별도로 외국 또는 이에 준하는 단체를\n위하여 간첩한 자를 5년 이상의 징역에 처하게 하려는 것임(안 제98조\n제3항 신설).",
    "제안이유_및_주요내용": "현행법은 적국을 위한 간첩행위를 처벌대상으로 명시하고 있어, 적\n국이 아닌 외국을 위한 간첩 행위는 다른 법률을 통해 처벌해야 하는\n상황임.\n그러나 냉전체제의 종식 및 포괄적 안보개념 대두 등 국제정세의\n변화에 따라 ‘적국’의 개념이 모호해지고, 적대관계 유무와 상관없이\n국가기밀의 해외유출 방지 필요성은 더욱 강조되고 있으며, 간첩죄의\n적용범위에 ‘외국’ 및 ‘외국에 준하는 단체’를 포함시킬 필요가 있음.\n이에 적국을 위한 간첩과는 별도로 외국 또는 이에 준하는 단체를\n위하여 간첩한 자를 5년 이상의 징역에 처하게 하려는 것임(안 제98조\n제3항 신설).",
    "법률_제_호": "형법 일부개정법률안\n형법 일부를 다음과 같이 개정한다.\n제98조에 제3항을 다음과 같이 신설한다.\n③ 외국 또는 이에 준하는 단체를 위하여 간첩한 자는 5년 이상의\n징역에 처한다.",
    "신구조문대비표": "현 행 개 정 안\n第98條(間諜) ①⋅② (생 략) 第98條(間諜) ①⋅② (현행과 같\n음)\n<신 설> ③ 외국 또는 이에 준하는 단\n체를 위하여 간첩한 자는 5년\n이상의 징역에 처한다."
  }
}