{
  "title": "2202817_학교급식법_일부개정법률안",
  "bill_number": "2817",
  "proposal_date": "2024. 8. 14.",
  "submission_date": "",
  "is_alternative": false,
  "alternative_bill_numbers": [],
  "has_comparison_table": false,
  "comparison_table": "신ㆍ구조문대비표\n현 행 개 정 안\n제7조(영양교사의 배치 등) ① 제7조(영양교사의 배치 등) ①\n∼ ③ (생 략) ∼ ③ (현행과 같음)\n<신 설> ④ 제3항에 따라 영양교사가\n급식관리를 지원하는 유치원의\n경우 제1항 단서의 규정에 따\n라 영양교사를 둔 것으로 본다.\n④ (생 략) ⑤ (현행 제4항과 같음)",
  "full_text": "학교급식법 일부개정법률안\n(서지영의원 대표발의)\n발의연월일 : 2024. 8. 14.\n의 안\n2817\n번 호 발 의 자 : 서지영ㆍ안상훈ㆍ조승환\n최은석ㆍ이헌승ㆍ정성국\n성일종ㆍ김대식ㆍ곽규택\n김선교ㆍ서일준ㆍ김승수\n의원(12인)\n제안이유 및 주요내용\n현행법령은 국ㆍ공립유치원과 원아 50명 이상인 사립유치원을 학교\n급식 대상인 유치원으로 규정하고, 국ㆍ공립유치원과 원아 100명 이상\n사립유치원에 영양교사를 1명 이상 두도록 하며, 원아 50명 이상 100\n명 미만인 사립유치원에 대하여는 교육청 또는 교육지원청에 두는 영\n양교사가 급식관리를 지원할 수 있도록 규정함.\n그런데 「어린이 식생활안전관리 특별법」에 따라 급식을 운영하면\n서, 영양교사가 상주하지 않는 원아 50명 이상 100명 미만인 사립유치\n원은 시장ㆍ군수ㆍ구청장이 운영하는 어린이급식관리지원센터의 중복\n지도ㆍ감독 대상이 되어, 교육청과 어린이급식관리지원센터의 중복 지\n도ㆍ감독을 받고 있는 상황임.\n이에 교육청 또는 교육지원청 소속 영양교사를 통해 급식지원을 받\n는 유치원은 이 법에 따라 영양교사를 둔 것으로 보아 교육청으로 지\n\n\n\n도ㆍ감독 및 급식관리의 권한을 일원화함으로써 유치원 운영의 부담\n을 경감하려는 것임(안 제7조제4항 신설).\n\n법률 제 호\n학교급식법 일부개정법률안\n학교급식법 일부를 다음과 같이 개정한다.\n제7조제4항을 제5항으로 하고, 같은 조에 제4항을 다음과 같이 신설한\n다.\n④ 제3항에 따라 영양교사가 급식관리를 지원하는 유치원의 경우\n제1항 단서의 규정에 따라 영양교사를 둔 것으로 본다.\n부 칙\n이 법은 공포한 날부터 시행한다.\n\n\n\n\n신ㆍ구조문대비표\n현 행 개 정 안\n제7조(영양교사의 배치 등) ① 제7조(영양교사의 배치 등) ①\n∼ ③ (생 략) ∼ ③ (현행과 같음)\n<신 설> ④ 제3항에 따라 영양교사가\n급식관리를 지원하는 유치원의\n경우 제1항 단서의 규정에 따\n라 영양교사를 둔 것으로 본다.\n④ (생 략) ⑤ (현행 제4항과 같음)\n",
  "sections": {
    "제안이유": "및",
    "주요내용": "현행법령은 국ㆍ공립유치원과 원아 50명 이상인 사립유치원을 학교\n급식 대상인 유치원으로 규정하고, 국ㆍ공립유치원과 원아 100명 이상\n사립유치원에 영양교사를 1명 이상 두도록 하며, 원아 50명 이상 100\n명 미만인 사립유치원에 대하여는 교육청 또는 교육지원청에 두는 영\n양교사가 급식관리를 지원할 수 있도록 규정함.\n그런데 「어린이 식생활안전관리 특별법」에 따라 급식을 운영하면\n서, 영양교사가 상주하지 않는 원아 50명 이상 100명 미만인 사립유치\n원은 시장ㆍ군수ㆍ구청장이 운영하는 어린이급식관리지원센터의 중복\n지도ㆍ감독 대상이 되어, 교육청과 어린이급식관리지원센터의 중복 지\n도ㆍ감독을 받고 있는 상황임.\n이에 교육청 또는 교육지원청 소속 영양교사를 통해 급식지원을 받\n는 유치원은 이 법에 따라 영양교사를 둔 것으로 보아 교육청으로 지\n\n\n\n도ㆍ감독 및 급식관리의 권한을 일원화함으로써 유치원 운영의 부담\n을 경감하려는 것임(안 제7조제4항 신설).",
    "제안이유_및_주요내용": "현행법령은 국ㆍ공립유치원과 원아 50명 이상인 사립유치원을 학교\n급식 대상인 유치원으로 규정하고, 국ㆍ공립유치원과 원아 100명 이상\n사립유치원에 영양교사를 1명 이상 두도록 하며, 원아 50명 이상 100\n명 미만인 사립유치원에 대하여는 교육청 또는 교육지원청에 두는 영\n양교사가 급식관리를 지원할 수 있도록 규정함.\n그런데 「어린이 식생활안전관리 특별법」에 따라 급식을 운영하면\n서, 영양교사가 상주하지 않는 원아 50명 이상 100명 미만인 사립유치\n원은 시장ㆍ군수ㆍ구청장이 운영하는 어린이급식관리지원센터의 중복\n지도ㆍ감독 대상이 되어, 교육청과 어린이급식관리지원센터의 중복 지\n도ㆍ감독을 받고 있는 상황임.\n이에 교육청 또는 교육지원청 소속 영양교사를 통해 급식지원을 받\n는 유치원은 이 법에 따라 영양교사를 둔 것으로 보아 교육청으로 지\n\n\n\n도ㆍ감독 및 급식관리의 권한을 일원화함으로써 유치원 운영의 부담\n을 경감하려는 것임(안 제7조제4항 신설).",
    "법률_제_호": "학교급식법 일부개정법률안\n학교급식법 일부를 다음과 같이 개정한다.\n제7조제4항을 제5항으로 하고, 같은 조에 제4항을 다음과 같이 신설한\n다.\n④ 제3항에 따라 영양교사가 급식관리를 지원하는 유치원의 경우\n제1항 단서의 규정에 따라 영양교사를 둔 것으로 본다.",
    "신구조문대비표": "현 행 개 정 안\n제7조(영양교사의 배치 등) ① 제7조(영양교사의 배치 등) ①\n∼ ③ (생 략) ∼ ③ (현행과 같음)\n<신 설> ④ 제3항에 따라 영양교사가\n급식관리를 지원하는 유치원의\n경우 제1항 단서의 규정에 따\n라 영양교사를 둔 것으로 본다.\n④ (생 략) ⑤ (현행 제4항과 같음)"
  }
}