{
  "title": "2202259_노동조합_및_노동관계조정법_일부개정법률안",
  "bill_number": "2259",
  "proposal_date": "2024. 7. 25.",
  "submission_date": "",
  "is_alternative": false,
  "alternative_bill_numbers": [],
  "has_comparison_table": false,
  "comparison_table": "신ㆍ구조문대비표\n현 행 개 정 안\n第81條(不當勞動行爲) ①⋅② (생 第81條(不當勞動行爲) ①⋅② (현\n략) 행과 같음)\n<신 설> ③ 제1항과 관련한 분쟁에서\n입증책임은 사용자가 부담한다.",
  "full_text": "노동조합 및 노동관계조정법 일부개정법률안\n(이수진의원 대표발의)\n발의연월일 : 2024. 7. 25.\n의 안\n2259\n번 호 발 의 자 : 이수진ㆍ이기헌ㆍ민병덕\n송옥주ㆍ김정호ㆍ민형배\n한정애ㆍ송재봉ㆍ김 윤\n서미화 의원(10인)\n제안이유 및 주요내용\n우리 헌법은 노사 간 실질적인 대등성을 구현하고 경제민주주의를\n실현하기 위하여 노동3권을 헌법상 기본권으로 보장하고, 이에 대한\n침해행위인 부당노동행위를 노동조합 및 노동관계조정법(이하 “노동조\n합법”이라 함) 제81조부터 제86조 등을 통해 엄격히 금지하고 있음.\n그런데 현행 노동조합법은 부당노동행위에 대한 입증책임에 관한\n규정을 두지 않고 있어, 이에 대한 입증책임을 사법(私法)의 원리에\n따라 노동자 또는 노동조합이 부담하는 것으로 해석하는 경향이 나타\n나고 있음.\n그러나 노동조합법의 부당노동행위제도는 헌법상 기본권인 노동3권\n을 보장하기 위해 사회법(社會法)의 원리에 따라 도입된 것이라는 점,\n현행 근로기준법의 부당해고제도가 입증책임에 관한 규정을 두지 않\n고 있지만 그 입증책임이 사용자에게 있는 것으로 해석이 정립되어\n\n\n\n있고 노동조합법은 노동조합 가입ㆍ활동 등을 이유로 한 부당해고 등\n불이익 취급행위를 부당노동행위의 유형으로 규정하고 있는 점 등을\n고려할 때 우리나라의 현행법체계상 부당노동행위에 대한 입증책임도\n사용자가 부담하는 것이 합리적이라는 의견이 있음.\n또한, 부당노동행위와 관련한 분쟁이 발생한 경우 노동자 또는 노동\n조합이 부당노동행위의 입증을 위해 필요한 정보를 요구하는 경우 사\n용자가 영업상 비밀을 이유로 정보제공을 거부하는 경우가 많아 막대\n한 시간과 비용이 드는 상황이고, 사용자의 주관적 의사인 부당노동행\n위의사 등 인과관계를 입증하기란 사실상 곤란하여 실제 부당노동행\n위 인정률이 10% 내외로 매우 낮게 나타나고 있어, 현행 부당노동행\n위제도가 효과적으로 노동3권을 보장할 수 있도록 보완이 필요하다는\n의견이 지속적으로 제기되고 있음.\n이에 부당노동행위와 관련한 분쟁이 발생한 경우 이에 대한 입증책\n임을 사용자가 부담하도록 법적 근거를 마련함으로써 노동관계를 공\n정하게 조정하고 노동쟁의를 예방ㆍ해결하는 데 실효성을 제고하려는\n것임(안 제81조제3항 신설).\n\n법률 제 호\n노동조합 및 노동관계조정법 일부개정법률안\n노동조합 및 노동관계조정법 일부를 다음과 같이 개정한다.\n제81조에 제3항을 다음과 같이 신설한다.\n③ 제1항과 관련한 분쟁에서 입증책임은 사용자가 부담한다.\n부 칙\n제1조(시행일) 이 법은 공포 후 1개월이 경과한 날부터 시행한다.\n제2조(부당노동행위의 입증책임에 관한 적용례) 제81조제3항의 개정규\n정은 이 법 시행 이후 분쟁 조정의 요청이 있거나 손해배상청구의\n소가 제기되는 경우부터 적용한다.\n\n\n\n\n신ㆍ구조문대비표\n현 행 개 정 안\n第81條(不當勞動行爲) ①⋅② (생 第81條(不當勞動行爲) ①⋅② (현\n략) 행과 같음)\n<신 설> ③ 제1항과 관련한 분쟁에서\n입증책임은 사용자가 부담한다.\n",
  "sections": {
    "제안이유": "및",
    "주요내용": "우리 헌법은 노사 간 실질적인 대등성을 구현하고 경제민주주의를\n실현하기 위하여 노동3권을 헌법상 기본권으로 보장하고, 이에 대한\n침해행위인 부당노동행위를 노동조합 및 노동관계조정법(이하 “노동조\n합법”이라 함) 제81조부터 제86조 등을 통해 엄격히 금지하고 있음.\n그런데 현행 노동조합법은 부당노동행위에 대한 입증책임에 관한\n규정을 두지 않고 있어, 이에 대한 입증책임을 사법(私法)의 원리에\n따라 노동자 또는 노동조합이 부담하는 것으로 해석하는 경향이 나타\n나고 있음.\n그러나 노동조합법의 부당노동행위제도는 헌법상 기본권인 노동3권\n을 보장하기 위해 사회법(社會法)의 원리에 따라 도입된 것이라는 점,\n현행 근로기준법의 부당해고제도가 입증책임에 관한 규정을 두지 않\n고 있지만 그 입증책임이 사용자에게 있는 것으로 해석이 정립되어\n\n\n\n있고 노동조합법은 노동조합 가입ㆍ활동 등을 이유로 한 부당해고 등\n불이익 취급행위를 부당노동행위의 유형으로 규정하고 있는 점 등을\n고려할 때 우리나라의 현행법체계상 부당노동행위에 대한 입증책임도\n사용자가 부담하는 것이 합리적이라는 의견이 있음.\n또한, 부당노동행위와 관련한 분쟁이 발생한 경우 노동자 또는 노동\n조합이 부당노동행위의 입증을 위해 필요한 정보를 요구하는 경우 사\n용자가 영업상 비밀을 이유로 정보제공을 거부하는 경우가 많아 막대\n한 시간과 비용이 드는 상황이고, 사용자의 주관적 의사인 부당노동행\n위의사 등 인과관계를 입증하기란 사실상 곤란하여 실제 부당노동행\n위 인정률이 10% 내외로 매우 낮게 나타나고 있어, 현행 부당노동행\n위제도가 효과적으로 노동3권을 보장할 수 있도록 보완이 필요하다는\n의견이 지속적으로 제기되고 있음.\n이에 부당노동행위와 관련한 분쟁이 발생한 경우 이에 대한 입증책\n임을 사용자가 부담하도록 법적 근거를 마련함으로써 노동관계를 공\n정하게 조정하고 노동쟁의를 예방ㆍ해결하는 데 실효성을 제고하려는\n것임(안 제81조제3항 신설).",
    "제안이유_및_주요내용": "우리 헌법은 노사 간 실질적인 대등성을 구현하고 경제민주주의를\n실현하기 위하여 노동3권을 헌법상 기본권으로 보장하고, 이에 대한\n침해행위인 부당노동행위를 노동조합 및 노동관계조정법(이하 “노동조\n합법”이라 함) 제81조부터 제86조 등을 통해 엄격히 금지하고 있음.\n그런데 현행 노동조합법은 부당노동행위에 대한 입증책임에 관한\n규정을 두지 않고 있어, 이에 대한 입증책임을 사법(私法)의 원리에\n따라 노동자 또는 노동조합이 부담하는 것으로 해석하는 경향이 나타\n나고 있음.\n그러나 노동조합법의 부당노동행위제도는 헌법상 기본권인 노동3권\n을 보장하기 위해 사회법(社會法)의 원리에 따라 도입된 것이라는 점,\n현행 근로기준법의 부당해고제도가 입증책임에 관한 규정을 두지 않\n고 있지만 그 입증책임이 사용자에게 있는 것으로 해석이 정립되어\n\n\n\n있고 노동조합법은 노동조합 가입ㆍ활동 등을 이유로 한 부당해고 등\n불이익 취급행위를 부당노동행위의 유형으로 규정하고 있는 점 등을\n고려할 때 우리나라의 현행법체계상 부당노동행위에 대한 입증책임도\n사용자가 부담하는 것이 합리적이라는 의견이 있음.\n또한, 부당노동행위와 관련한 분쟁이 발생한 경우 노동자 또는 노동\n조합이 부당노동행위의 입증을 위해 필요한 정보를 요구하는 경우 사\n용자가 영업상 비밀을 이유로 정보제공을 거부하는 경우가 많아 막대\n한 시간과 비용이 드는 상황이고, 사용자의 주관적 의사인 부당노동행\n위의사 등 인과관계를 입증하기란 사실상 곤란하여 실제 부당노동행\n위 인정률이 10% 내외로 매우 낮게 나타나고 있어, 현행 부당노동행\n위제도가 효과적으로 노동3권을 보장할 수 있도록 보완이 필요하다는\n의견이 지속적으로 제기되고 있음.\n이에 부당노동행위와 관련한 분쟁이 발생한 경우 이에 대한 입증책\n임을 사용자가 부담하도록 법적 근거를 마련함으로써 노동관계를 공\n정하게 조정하고 노동쟁의를 예방ㆍ해결하는 데 실효성을 제고하려는\n것임(안 제81조제3항 신설).",
    "법률_제_호": "노동조합 및 노동관계조정법 일부개정법률안\n노동조합 및 노동관계조정법 일부를 다음과 같이 개정한다.\n제81조에 제3항을 다음과 같이 신설한다.\n③ 제1항과 관련한 분쟁에서 입증책임은 사용자가 부담한다.",
    "신구조문대비표": "현 행 개 정 안\n第81條(不當勞動行爲) ①⋅② (생 第81條(不當勞動行爲) ①⋅② (현\n략) 행과 같음)\n<신 설> ③ 제1항과 관련한 분쟁에서\n입증책임은 사용자가 부담한다."
  }
}