{
  "title": "2202621_새마을금고법_일부개정법률안",
  "bill_number": "2621",
  "proposal_date": "2024. 8. 7.",
  "submission_date": "",
  "is_alternative": false,
  "alternative_bill_numbers": [],
  "has_comparison_table": false,
  "comparison_table": "신ㆍ구조문대비표\n현 행 개 정 안\n법률 제18492호 새마을금고법 법률 제18492호 새마을금고법\n일부개정법률 ",
  "full_text": "새마을금고법 일부개정법률안\n(김상욱의원 대표발의)\n발의연월일 : 2024. 8. 7.\n의 안\n2621\n번 호 발 의 자 : 김상욱ㆍ김선교ㆍ박준태\n박덕흠ㆍ김장겸ㆍ서범수\n성일종ㆍ조지연ㆍ박수민\n조은희 의원(10인)\n제안이유 및 주요내용\n과거에는 금고 이사장 선출 시 총회 선출, 대의원회 선출, 회원 투\n표로 직접 선출하는 방법 중 정관으로 정하는 방법을 택하여 선출하\n도록 하고, 선거관리를 임의적으로 구ㆍ시ㆍ군선거관리위원회에 위탁\n할 수 있도록 하였으나, 실제로는 80퍼센트 가량의 금고에서 간선제\n방식으로 이사장을 선출하고 있고 선거 과정에서 선거부정 등이 발생\n하는 사례가 나타나 소규모 금고 등 일부 금고를 제외하고는 이사장\n을 회원의 투표로 직접 선출하도록 하고, 금고 이사장 선거를 농협ㆍ\n수협 등 유사 상호금융기관과 같이 선거관리위원회에 의무적으로 위\n탁하도록 법 개정이 이루어져 2022년 4월 20일부터 시행되었음\n당초 이 법 부칙에 동시 이사장 선거일을 구「공공단체등 위탁선거\n에 관한 법률」에 명시된 농협ㆍ수협 등 유사 상호금융기관과 동일하\n게 3월 두 번째 수요일로 명시하였으나, 2024년 1월 30일 「공공단체\n\n\n\n등 위탁선거에 관한 법률」이 선거일을 3월 첫 번째 수요일로 개정함\n으로써 양 법간 선거일의 불일치가 발생하여, 일부 금고를 제외하고\n이사장을 직접 선출하도록 하는 개정 금고법의 취지와 달리 내년 동\n시 이사장 선거일에 적용할 수 없는 문제가 발생함.\n이에 법률 제18492호 새마을금고법 일부개정법률안 부칙을 개정하\n여 제18조제5항부터 제7항까지의 개정규정이 2025년 3월 5일 동시 이\n사장 선거시 적용될 수 있도록 하여 2025년 3월 5일 이사장 동시선거\n가 원만히 진행될 수 있도록 하려는 것임(안 법률 제18492호 새마을금\n고법 일부개정법률 부칙 제3조, 제5조 및 제6조)\n\n법률 제 호\n새마을금고법 일부개정법률안\n새마을금고법 일부를 다음과 같이 개정한다.\n법률 제18492호 새마을금고법 일부개정법률 부칙 제3조제3항 중 “202\n5년 3월 12일”을 “2025년 3월 5일”로, “두 번째”를 “첫 번째”로 하고,\n같은 부칙 제5조 중 “2025년 3월 12일”을 “2025년 3월 5일”로 하며,\n같은 부칙 제6조 중 “2025년 3월 12일”을 “2025년 3월 5일”로 한다.\n부 칙\n이 법은 공포한 날부터 시행한다.\n\n\n\n\n신ㆍ구조문대비표\n현 행 개 정 안\n법률 제18492호 새마을금고법 법률 제18492호 새마을금고법\n일부개정법률 부칙 일부개정법률 부칙\n제3조(이사장의 임기 및 선출 등 제3조(이사장의 임기 및 선출 등\n에 관한 특례) ①ㆍ② (생 략) 에 관한 특례) ①ㆍ② (현행과\n같음)\n③ 제1항 본문에 따라 임기가 ③ ----------------------\n2025년 3월 20일에 만료되는 ------------------------\n이사장 선거는 2025년 3월 12 ----------- 2025년 3월 5일\n일에 동시 실시하고, 이후 임 ------------------------\n기만료에 따른 이사장 선거는 ------------------------\n임기가 만료되는 해당 연도 3 ------------------------\n월의 두 번째 수요일에 동시 ---- 첫 번째 ------------\n실시한다. --------.\n④ ∼ ⑨ (생 략) ④ ∼ ⑨ (현행과 같음)\n제5조(이사장의 선출 방법에 관 제5조(이사장의 선출 방법에 관\n한 경과조치) 이 법 시행 이후 한 경과조치) ------------\n2025년 3월 12일 전까지 실시 2025년 3월 5일 -----------\n하는 이사장의 선출에 관하여 ------------------------\n는 제18조제5항부터 제7항까지 ------------------------\n의 개정규정에도 불구하고 종 ------------------------\n전의 규정에 따른다. -----------.\n제6조(이사장 선거의 구ㆍ시ㆍ군 제6조(이사장 선거의 구ㆍ시ㆍ군\n선거관리위원회 위탁에 관한 선거관리위원회 위탁에 관한\n경과조치) 이 법 시행 이후 20 경과조치) ------------ 5 -\n\n\n25년 3월 12일 전까지 실시하 25년 3월 5일 -------------\n는 이사장 선거에 관하여는 제 ------------------------\n23조의2(제64조의2제6항에서 ------------------------\n준용하는 경우는 제외한다)의 ------------------------\n개정규정에도 불구하고 종전의 ------------------------\n규정에 따른다. ------------.",
  "sections": {
    "제안이유": "및",
    "주요내용": "과거에는 금고 이사장 선출 시 총회 선출, 대의원회 선출, 회원 투\n표로 직접 선출하는 방법 중 정관으로 정하는 방법을 택하여 선출하\n도록 하고, 선거관리를 임의적으로 구ㆍ시ㆍ군선거관리위원회에 위탁\n할 수 있도록 하였으나, 실제로는 80퍼센트 가량의 금고에서 간선제\n방식으로 이사장을 선출하고 있고 선거 과정에서 선거부정 등이 발생\n하는 사례가 나타나 소규모 금고 등 일부 금고를 제외하고는 이사장\n을 회원의 투표로 직접 선출하도록 하고, 금고 이사장 선거를 농협ㆍ\n수협 등 유사 상호금융기관과 같이 선거관리위원회에 의무적으로 위\n탁하도록 법 개정이 이루어져 2022년 4월 20일부터 시행되었음\n당초 이 법 부칙에 동시 이사장 선거일을 구「공공단체등 위탁선거\n에 관한 법률」에 명시된 농협ㆍ수협 등 유사 상호금융기관과 동일하\n게 3월 두 번째 수요일로 명시하였으나, 2024년 1월 30일 「공공단체\n\n\n\n등 위탁선거에 관한 법률」이 선거일을 3월 첫 번째 수요일로 개정함\n으로써 양 법간 선거일의 불일치가 발생하여, 일부 금고를 제외하고\n이사장을 직접 선출하도록 하는 개정 금고법의 취지와 달리 내년 동\n시 이사장 선거일에 적용할 수 없는 문제가 발생함.\n이에",
    "제안이유_및_주요내용": "과거에는 금고 이사장 선출 시 총회 선출, 대의원회 선출, 회원 투\n표로 직접 선출하는 방법 중 정관으로 정하는 방법을 택하여 선출하\n도록 하고, 선거관리를 임의적으로 구ㆍ시ㆍ군선거관리위원회에 위탁\n할 수 있도록 하였으나, 실제로는 80퍼센트 가량의 금고에서 간선제\n방식으로 이사장을 선출하고 있고 선거 과정에서 선거부정 등이 발생\n하는 사례가 나타나 소규모 금고 등 일부 금고를 제외하고는 이사장\n을 회원의 투표로 직접 선출하도록 하고, 금고 이사장 선거를 농협ㆍ\n수협 등 유사 상호금융기관과 같이 선거관리위원회에 의무적으로 위\n탁하도록 법 개정이 이루어져 2022년 4월 20일부터 시행되었음\n당초 이 법 부칙에 동시 이사장 선거일을 구「공공단체등 위탁선거\n에 관한 법률」에 명시된 농협ㆍ수협 등 유사 상호금융기관과 동일하\n게 3월 두 번째 수요일로 명시하였으나, 2024년 1월 30일 「공공단체\n\n\n\n등 위탁선거에 관한 법률」이 선거일을 3월 첫 번째 수요일로 개정함\n으로써 양 법간 선거일의 불일치가 발생하여, 일부 금고를 제외하고\n이사장을 직접 선출하도록 하는 개정 금고법의 취지와 달리 내년 동\n시 이사장 선거일에 적용할 수 없는 문제가 발생함.\n이에",
    "법률_제_호": "새마을금고법 일부개정법률안",
    "신구조문대비표": "현 행 개 정 안\n법률 제18492호 새마을금고법 법률 제18492호 새마을금고법\n일부개정법률"
  }
}