{
  "title": "2202997_전통시장_및_상점가_육성을_위한_특별법_일부개정법률안",
  "bill_number": "2997",
  "proposal_date": "2024. 8. 20.",
  "submission_date": "",
  "is_alternative": false,
  "alternative_bill_numbers": [],
  "has_comparison_table": false,
  "comparison_table": "신·구조문대비표\n현 행 개 정 안\n제22조(전주이설비용 부담에 관 제22조(전봇대이설비용 부담에\n한 특례) (생 략) 관한 특례) (현행 제목 외의 부\n분과 같음)",
  "full_text": "전통시장 및 상점가 육성을 위한 특별법 일부개정법률안\n(서일준의원 대표발의)\n발의연월일 : 2024. 8. 20.\n의 안\n2997\n번 호 발 의 자 : 서일준ㆍ고동진ㆍ권영세\n안상훈ㆍ이헌승ㆍ박성민\n이상휘ㆍ백종헌ㆍ강대식\n조경태 의원(10인)\n제안이유 및 주요내용\n현행법은 도로에 설치된 전주(電柱)가 시장의 시설현대화사업에 방\n해가 되어 이를 옮기거나 땅속에 설치하는 경우에는 시설현대화사업의\n추진 주체가 그 비용의 절반만을 부담할 수 있도록 특례를 규정하고\n있음.\n그런데 ‘전주’라는 용어는 일상생활에서 잘 사용하지 않아 일반 국\n민이 법률을 이해하기에 어려운 한자어로, 법제처는 ‘알기 쉬운 법령\n정비기준’에서 ‘전주’를 정비 대상 용어로 선정한 바 있음.\n이에 ‘전주’를 ‘전봇대’로 변경함으로써 국민이 법률을 쉽게 이해할\n수 있도록 하려는 것임(안 제22조).\n\n\n\n\n법률 제 호\n전통시장 및 상점가 육성을 위한 특별법 일부개정법률안\n전통시장 및 상점가 육성을 위한 특별법 일부를 다음과 같이 개정한\n다.\n제22조의 제목 중 “전주”를 “전봇대”로 한다.\n부 칙\n이 법은 공포한 날부터 시행한다.\n\n\n\n\n신·구조문대비표\n현 행 개 정 안\n제22조(전주이설비용 부담에 관 제22조(전봇대이설비용 부담에\n한 특례) (생 략) 관한 특례) (현행 제목 외의 부\n분과 같음)\n",
  "sections": {
    "제안이유": "및",
    "주요내용": "현행법은 도로에 설치된 전주(電柱)가 시장의 시설현대화사업에 방\n해가 되어 이를 옮기거나 땅속에 설치하는 경우에는 시설현대화사업의\n추진 주체가 그 비용의 절반만을 부담할 수 있도록 특례를 규정하고\n있음.\n그런데 ‘전주’라는 용어는 일상생활에서 잘 사용하지 않아 일반 국\n민이 법률을 이해하기에 어려운 한자어로, 법제처는 ‘알기 쉬운 법령\n정비기준’에서 ‘전주’를 정비 대상 용어로 선정한 바 있음.\n이에 ‘전주’를 ‘전봇대’로 변경함으로써 국민이 법률을 쉽게 이해할\n수 있도록 하려는 것임(안 제22조).",
    "제안이유_및_주요내용": "현행법은 도로에 설치된 전주(電柱)가 시장의 시설현대화사업에 방\n해가 되어 이를 옮기거나 땅속에 설치하는 경우에는 시설현대화사업의\n추진 주체가 그 비용의 절반만을 부담할 수 있도록 특례를 규정하고\n있음.\n그런데 ‘전주’라는 용어는 일상생활에서 잘 사용하지 않아 일반 국\n민이 법률을 이해하기에 어려운 한자어로, 법제처는 ‘알기 쉬운 법령\n정비기준’에서 ‘전주’를 정비 대상 용어로 선정한 바 있음.\n이에 ‘전주’를 ‘전봇대’로 변경함으로써 국민이 법률을 쉽게 이해할\n수 있도록 하려는 것임(안 제22조).",
    "법률_제_호": "전통시장 및 상점가 육성을 위한 특별법 일부개정법률안\n전통시장 및 상점가 육성을 위한 특별법 일부를 다음과 같이 개정한\n다.\n제22조의 제목 중 “전주”를 “전봇대”로 한다.",
    "신구조문대비표": "현 행 개 정 안\n제22조(전주이설비용 부담에 관 제22조(전봇대이설비용 부담에\n한 특례) (생 략) 관한 특례) (현행 제목 외의 부\n분과 같음)"
  }
}