{
  "title": "2202308_새만금사업_추진_및_지원에_관한_특별법_일부개정법률안",
  "bill_number": "2308",
  "proposal_date": "2024. 7. 26.",
  "submission_date": "",
  "is_alternative": false,
  "alternative_bill_numbers": [],
  "has_comparison_table": false,
  "comparison_table": "신ㆍ구조문대비표\n현 행 개 정 안\n법률 제12644호 새만금사업 추진 법률 제12644호 새만금사업 추진\n및 지원에 관한 특별법 및 지원에 관한 특별법\n일부개정법률 ",
  "full_text": "새만금사업 추진 및 지원에 관한 특별법 일부개정법률안\n(이춘석의원 대표발의)\n발의연월일 : 2024. 7. 26.\n의 안\n2308\n번 호 발 의 자 : 이춘석ㆍ안호영ㆍ이연희\n이원택ㆍ윤준병ㆍ박희승\n정준호ㆍ이기헌ㆍ김윤덕\n한병도 의원(10인)\n제안이유 및 주요내용\n새만금유역 수질개선을 위한 ‘새만금유역 제3단계(’21∼’30년) 수질\n개선대책’에 따라 김제 용지정착농원을 특별관리지역으로 지정하고\n2024년까지 현업축사 매입을 추진하고 있으나 미매입된 재래식 축사\n가 남아 있어 그간 추진한 수질개선 효과가 반감되고 있고, 기 매입된\n국공유지의 이용가치 하락 및 지속적인 가축분뇨 배출 우려로 특별관\n리지역으로 지정ㆍ고시된 축산농가의 전량 매입을 위한 사업 재추진\n이 절실히 필요한 실정임.\n특히 정부의 ‘새만금유역 제3단계 수질개선대책 연차별 추진실적 평\n가결과(’22년)’ 결과 지역 특성상 축산계 오염원 배출부하량이 새만금\n호의 주오염원으로 분석된 만큼 새만금 수질 개선을 위해 김제 용지\n정착농원을 통해 만경강으로 유입되는 축산오염원 저감을 위한 현업\n축사 매입사업 추진과 그에 따른 사업추진의 유효기간 연장이 필요함.\n\n\n\n이에, 새만금호의 수질오염 방지와 그 오염원 해소를 위해 지정된\n특별관리지역과 관련하여 환경부장관이 토지소유자와 협의하여 특별\n관리지역의 토지 등을 매수할 수 있도록 한 조항의 유효기간을 2028\n년 12월 31일까지로 연장하고자 함(법률 제12644호 새만금사업 추진\n및 지원에 관한 특별법 일부개정법률 부칙 제2조).\n\n법률 제 호\n새만금사업 추진 및 지원에 관한 특별법 일부개정법률안\n새만금사업 추진 및 지원에 관한 특별법 일부를 다음과 같이 개정한\n다.\n법률 제12644호 새만금사업 추진 및 지원에 관한 특별법 일부개정법\n률 부칙 제2조 중 “2024년 12월 31일까지”를 “2028년 12월 31일까지”\n로 한다.\n부 칙\n이 법은 공포한 날부터 시행한다.\n\n\n\n\n신ㆍ구조문대비표\n현 행 개 정 안\n법률 제12644호 새만금사업 추진 법률 제12644호 새만금사업 추진\n및 지원에 관한 특별법 및 지원에 관한 특별법\n일부개정법률 부칙 일부개정법률 부칙\n제2조(유효기간) 제32조제4항의 제2조(유효기간) ---------------\n개정 규정은 이 법 시행일로부 ----------------------------\n터 2024년 12월 31일까지 효력 --2028년 12월 31일까지------\n을 가진다. -------.\n",
  "sections": {
    "제안이유": "및",
    "주요내용": "새만금유역 수질개선을 위한 ‘새만금유역 제3단계(’21∼’30년) 수질\n개선대책’에 따라 김제 용지정착농원을 특별관리지역으로 지정하고\n2024년까지 현업축사 매입을 추진하고 있으나 미매입된 재래식 축사\n가 남아 있어 그간 추진한 수질개선 효과가 반감되고 있고, 기 매입된\n국공유지의 이용가치 하락 및 지속적인 가축분뇨 배출 우려로 특별관\n리지역으로 지정ㆍ고시된 축산농가의 전량 매입을 위한 사업 재추진\n이 절실히 필요한 실정임.\n특히 정부의 ‘새만금유역 제3단계 수질개선대책 연차별 추진실적 평\n가결과(’22년)’ 결과 지역 특성상 축산계 오염원 배출부하량이 새만금\n호의 주오염원으로 분석된 만큼 새만금 수질 개선을 위해 김제 용지\n정착농원을 통해 만경강으로 유입되는 축산오염원 저감을 위한 현업\n축사 매입사업 추진과 그에 따른 사업추진의 유효기간 연장이 필요함.\n\n\n\n이에, 새만금호의 수질오염 방지와 그 오염원 해소를 위해 지정된\n특별관리지역과 관련하여 환경부장관이 토지소유자와 협의하여 특별\n관리지역의 토지 등을 매수할 수 있도록 한 조항의 유효기간을 2028\n년 12월 31일까지로 연장하고자 함(",
    "제안이유_및_주요내용": "새만금유역 수질개선을 위한 ‘새만금유역 제3단계(’21∼’30년) 수질\n개선대책’에 따라 김제 용지정착농원을 특별관리지역으로 지정하고\n2024년까지 현업축사 매입을 추진하고 있으나 미매입된 재래식 축사\n가 남아 있어 그간 추진한 수질개선 효과가 반감되고 있고, 기 매입된\n국공유지의 이용가치 하락 및 지속적인 가축분뇨 배출 우려로 특별관\n리지역으로 지정ㆍ고시된 축산농가의 전량 매입을 위한 사업 재추진\n이 절실히 필요한 실정임.\n특히 정부의 ‘새만금유역 제3단계 수질개선대책 연차별 추진실적 평\n가결과(’22년)’ 결과 지역 특성상 축산계 오염원 배출부하량이 새만금\n호의 주오염원으로 분석된 만큼 새만금 수질 개선을 위해 김제 용지\n정착농원을 통해 만경강으로 유입되는 축산오염원 저감을 위한 현업\n축사 매입사업 추진과 그에 따른 사업추진의 유효기간 연장이 필요함.\n\n\n\n이에, 새만금호의 수질오염 방지와 그 오염원 해소를 위해 지정된\n특별관리지역과 관련하여 환경부장관이 토지소유자와 협의하여 특별\n관리지역의 토지 등을 매수할 수 있도록 한 조항의 유효기간을 2028\n년 12월 31일까지로 연장하고자 함(",
    "법률_제_호": "새만금사업 추진\n및 지원에 관한 특별법 일부개정법률",
    "신구조문대비표": "현 행 개 정 안\n법률 제12644호 새만금사업 추진 법률 제12644호 새만금사업 추진\n및 지원에 관한 특별법 및 지원에 관한 특별법\n일부개정법률"
  }
}