{
  "title": "2202708_민사집행법_일부개정법률안",
  "bill_number": "2708",
  "proposal_date": "2024. 8. 9.",
  "submission_date": "",
  "is_alternative": false,
  "alternative_bill_numbers": [],
  "has_comparison_table": false,
  "comparison_table": "신·구조문대비표\n현 행 개 정 안\n제195조(압류가 금지되는 물건) 제195조(압류가 금지되는 물건)\n다음 각호의 물건은 압류하지 -------------------------\n못한다. ---------.\n1. ∼ 16. (생 략) 1. ∼ 16. (현행과 같음)\n<신 설> 17. 「동물보호법」 제2조제7호\n의 반려동물",
  "full_text": "민사집행법 일부개정법률안\n(김도읍의원 대표발의)\n발의연월일 : 2024. 8. 9.\n의 안\n2708\n번 호 발 의 자 : 김도읍ㆍ김예지ㆍ장동혁\n구자근ㆍ권영진ㆍ서지영\n인요한ㆍ박정훈ㆍ조지연\n김석기 의원(10인)\n제안이유 및 주요내용\n현행법에 따르면 반려동물은 「민법」상 재산에 해당되고 「민사집\n행법」상 압류가 금지되는 물건으로 정해져 있지 않아 압류가 가능한\n것으로 해석될 수 있음.\n그러나 반려동물을 단순한 물건이 아닌 사실상 가족에 가깝게 받아\n들이고 있는 현실에서 반려동물을 강제집행 대상에서 제외해야 한다\n는 지적이 있음.\n이에 압류가 금지되는 물건에 「동물보호법」 제2조제7호의 반려동\n물을 추가하고자 함(안 제195조제17호 신설).\n\n\n\n\n법률 제 호\n민사집행법 일부개정법률안\n민사집행법 일부를 다음과 같이 개정한다.\n제195조에 제17호를 다음과 같이 신설한다.\n17. 「동물보호법」 제2조제7호의 반려동물\n부 칙\n이 법은 공포 후 6개월이 경과한 날부터 시행한다.\n\n\n\n\n신·구조문대비표\n현 행 개 정 안\n제195조(압류가 금지되는 물건) 제195조(압류가 금지되는 물건)\n다음 각호의 물건은 압류하지 -------------------------\n못한다. ---------.\n1. ∼ 16. (생 략) 1. ∼ 16. (현행과 같음)\n<신 설> 17. 「동물보호법」 제2조제7호\n의 반려동물\n",
  "sections": {
    "제안이유": "및",
    "주요내용": "현행법에 따르면 반려동물은 「민법」상 재산에 해당되고 「민사집\n행법」상 압류가 금지되는 물건으로 정해져 있지 않아 압류가 가능한\n것으로 해석될 수 있음.\n그러나 반려동물을 단순한 물건이 아닌 사실상 가족에 가깝게 받아\n들이고 있는 현실에서 반려동물을 강제집행 대상에서 제외해야 한다\n는 지적이 있음.\n이에 압류가 금지되는 물건에 「동물보호법」 제2조제7호의 반려동\n물을 추가하고자 함(안 제195조제17호 신설).",
    "제안이유_및_주요내용": "현행법에 따르면 반려동물은 「민법」상 재산에 해당되고 「민사집\n행법」상 압류가 금지되는 물건으로 정해져 있지 않아 압류가 가능한\n것으로 해석될 수 있음.\n그러나 반려동물을 단순한 물건이 아닌 사실상 가족에 가깝게 받아\n들이고 있는 현실에서 반려동물을 강제집행 대상에서 제외해야 한다\n는 지적이 있음.\n이에 압류가 금지되는 물건에 「동물보호법」 제2조제7호의 반려동\n물을 추가하고자 함(안 제195조제17호 신설).",
    "법률_제_호": "민사집행법 일부개정법률안\n민사집행법 일부를 다음과 같이 개정한다.\n제195조에 제17호를 다음과 같이 신설한다.\n17. 「동물보호법」 제2조제7호의 반려동물",
    "신구조문대비표": "현 행 개 정 안\n제195조(압류가 금지되는 물건) 제195조(압류가 금지되는 물건)\n다음 각호의 물건은 압류하지 -------------------------\n못한다. ---------.\n1. ∼ 16. (생 략) 1. ∼ 16. (현행과 같음)\n<신 설> 17. 「동물보호법」 제2조제7호\n의 반려동물"
  }
}