{
  "title": "2202376_국립대학병원_설치법_일부개정법률안",
  "bill_number": "2376",
  "proposal_date": "2024. 7. 30.",
  "submission_date": "",
  "is_alternative": false,
  "alternative_bill_numbers": [],
  "has_comparison_table": false,
  "comparison_table": "신ㆍ구조문대비표\n현 행 개 정 안\n제5조(설립) ①ㆍ② (생 략) 제5조(설립 등) ①ㆍ② (현행과\n같음)\n<신 설> ③ 대학병원이 설립되지 아니\n한 관련대학은 원활한 교육과\n정 운영을 위하여 의료실습교\n육 등을 대통령령으로 정하는\n기준을 충족하는 병원에 위탁\n할 수 있다.",
  "full_text": "국립대학병원 설치법 일부개정법률안\n(김형동의원 대표발의)\n발의연월일 : 2024. 7. 30.\n의 안\n2376\n번 호 발 의 자 : 김형동ㆍ안철수ㆍ박덕흠\n유용원ㆍ김위상ㆍ구자근\n임종득ㆍ조지연ㆍ이달희\n임이자ㆍ문금주ㆍ허성무\n임광현ㆍ강승규ㆍ이성권\n박성민ㆍ염태영ㆍ김승수\n임미애ㆍ전진숙ㆍ최은석\n김원이ㆍ이인선ㆍ임호선\n강선영 의원(25인)\n제안이유 및 주요내용\n현재 지역의 의료취약 문제의 해결에 대한 사회적 수요가 높은 상\n황이며 주요 해결방안 중 하나로 지역별 국립 의과대학의 신설이 논\n의되고 있음.\n그런데 국립대학의 경우에는 의학과가 설치된 대학별로 대학병원을\n설립할 것을 규정하고 있어 대학병원이 설치되지 않은 대학의 경우에\n는 의료실습 등에 대한 위탁의 근거가 명확하지 않은데, 이로 인하여\n국립 의과대학 신설 시 원활한 교육과정 운영에 어려움이 발생할 수\n있다는 우려가 있음.\n이에 대학병원이 설립되지 아니한 국립 의과대학이 원활한 교육과\n\n\n\n정 운영을 위하여 의료실습교육 등을 대통령령으로 정하는 기준을 충\n족하는 병원에 위탁할 수 있는 법적 근거를 마련함으로써 국립 의과\n대학의 원활한 신설 및 운영을 도모하려는 것임(안 제5조제3항 신설).\n\n법률 제 호\n국립대학병원 설치법 일부개정법률안\n국립대학병원 설치법 일부를 다음과 같이 개정한다.\n제5조의 제목 “(설립)”을 “(설립 등)”으로 하고, 같은 조에 제3항을 다\n음과 같이 신설한다.\n③ 대학병원이 설립되지 아니한 관련대학은 원활한 교육과정 운영\n을 위하여 의료실습교육 등을 대통령령으로 정하는 기준을 충족하\n는 병원에 위탁할 수 있다.\n부 칙\n제1조(시행일) 이 법은 공포 후 6개월이 경과한 날부터 시행한다.\n제2조(의료실습교육 등의 위탁 운영에 관한 적용례) 제5조제3항의 개\n정규정은 이 법 시행 이후 의학과를 신설하는 국립대학부터 적용한\n다.\n\n\n\n\n신ㆍ구조문대비표\n현 행 개 정 안\n제5조(설립) ①ㆍ② (생 략) 제5조(설립 등) ①ㆍ② (현행과\n같음)\n<신 설> ③ 대학병원이 설립되지 아니\n한 관련대학은 원활한 교육과\n정 운영을 위하여 의료실습교\n육 등을 대통령령으로 정하는\n기준을 충족하는 병원에 위탁\n할 수 있다.\n",
  "sections": {
    "제안이유": "및",
    "주요내용": "현재 지역의 의료취약 문제의 해결에 대한 사회적 수요가 높은 상\n황이며 주요 해결방안 중 하나로 지역별 국립 의과대학의 신설이 논\n의되고 있음.\n그런데 국립대학의 경우에는 의학과가 설치된 대학별로 대학병원을\n설립할 것을 규정하고 있어 대학병원이 설치되지 않은 대학의 경우에\n는 의료실습 등에 대한 위탁의 근거가 명확하지 않은데, 이로 인하여\n국립 의과대학 신설 시 원활한 교육과정 운영에 어려움이 발생할 수\n있다는 우려가 있음.\n이에 대학병원이 설립되지 아니한 국립 의과대학이 원활한 교육과\n\n\n\n정 운영을 위하여 의료실습교육 등을 대통령령으로 정하는 기준을 충\n족하는 병원에 위탁할 수 있는 법적 근거를 마련함으로써 국립 의과\n대학의 원활한 신설 및 운영을 도모하려는 것임(안 제5조제3항 신설).",
    "제안이유_및_주요내용": "현재 지역의 의료취약 문제의 해결에 대한 사회적 수요가 높은 상\n황이며 주요 해결방안 중 하나로 지역별 국립 의과대학의 신설이 논\n의되고 있음.\n그런데 국립대학의 경우에는 의학과가 설치된 대학별로 대학병원을\n설립할 것을 규정하고 있어 대학병원이 설치되지 않은 대학의 경우에\n는 의료실습 등에 대한 위탁의 근거가 명확하지 않은데, 이로 인하여\n국립 의과대학 신설 시 원활한 교육과정 운영에 어려움이 발생할 수\n있다는 우려가 있음.\n이에 대학병원이 설립되지 아니한 국립 의과대학이 원활한 교육과\n\n\n\n정 운영을 위하여 의료실습교육 등을 대통령령으로 정하는 기준을 충\n족하는 병원에 위탁할 수 있는 법적 근거를 마련함으로써 국립 의과\n대학의 원활한 신설 및 운영을 도모하려는 것임(안 제5조제3항 신설).",
    "법률_제_호": "국립대학병원 설치법 일부개정법률안\n국립대학병원 설치법 일부를 다음과 같이 개정한다.\n제5조의 제목 “(설립)”을 “(설립 등)”으로 하고, 같은 조에 제3항을 다\n음과 같이 신설한다.\n③ 대학병원이 설립되지 아니한 관련대학은 원활한 교육과정 운영\n을 위하여 의료실습교육 등을 대통령령으로 정하는 기준을 충족하\n는 병원에 위탁할 수 있다.",
    "신구조문대비표": "현 행 개 정 안\n제5조(설립) ①ㆍ② (생 략) 제5조(설립 등) ①ㆍ② (현행과\n같음)\n<신 설> ③ 대학병원이 설립되지 아니\n한 관련대학은 원활한 교육과\n정 운영을 위하여 의료실습교\n육 등을 대통령령으로 정하는\n기준을 충족하는 병원에 위탁\n할 수 있다."
  }
}