{
  "title": "2202244_인구감소지역_지원_특별법_일부개정법률안",
  "bill_number": "2244",
  "proposal_date": "2024. 7. 25.",
  "submission_date": "",
  "is_alternative": false,
  "alternative_bill_numbers": [],
  "has_comparison_table": false,
  "comparison_table": "신·구조문대비표\n현 행 개 정 안\n<신 설> 제28조의2(조세의 감면) 국가는\n인구감소지역에서 공장을 신축\n또는 증축하는 자에 대하여\n「조세특례제한법」에서 정하\n는 바에 따라 법인세 등의 조\n세를 감면할 수 있다.",
  "full_text": "인구감소지역 지원 특별법 일부개정법률안\n(이달희의원 대표발의)\n발의연월일 : 2024. 7. 25.\n의 안\n2244\n번 호 발 의 자 : 이달희ㆍ김상훈ㆍ김예지\n김승수ㆍ박준태ㆍ고동진\n이인선ㆍ김정재ㆍ이만희\n김종양 의원(10인)\n제안이유 및 주요내용\n현행법에는 인구감소지역에서 투자해 정착한 기업에 대한 특별한\n세제 지원 규정이 없어 기업에서 신규 투자를 결정하는 경우 우수인\n력과 주변 인프라가 갖춰진 수도권으로 다시 투자하는 문제가 발생하\n고 있다는 의견이 있음.\n이에 국가는 인구감소지역에서 공장을 신축 또는 증축하는 자에 대\n하여 「조세특례제한법」에서 정하는 바에 따라 법인세 등의 조세를\n감면할 수 있도록 하려는 것임(안 제28조의2 신설).\n참고사항\n이 법률안은 이달희의원이 대표발의한 「조세특례제한법 일부개정\n법률안」(의안번호 제2243호)의 의결을 전제로 하는 것이므로 같은 법\n률안이 의결되지 아니하거나 수정의결되는 경우에는 이에 맞추어 조\n\n\n\n정되어야 할 것임.\n\n법률 제 호\n인구감소지역 지원 특별법 일부개정법률안\n인구감소지역 지원 특별법 일부를 다음과 같이 개정한다.\n제5장에 제28조의2를 다음과 같이 신설한다.\n제28조의2(조세의 감면) 국가는 인구감소지역에서 공장을 신축 또는\n증축하는 자에 대하여 「조세특례제한법」에서 정하는 바에 따라\n법인세 등의 조세를 감면할 수 있다.\n부 칙\n이 법은 공포 후 6개월이 경과한 날부터 시행한다.\n\n\n\n\n신·구조문대비표\n현 행 개 정 안\n<신 설> 제28조의2(조세의 감면) 국가는\n인구감소지역에서 공장을 신축\n또는 증축하는 자에 대하여\n「조세특례제한법」에서 정하\n는 바에 따라 법인세 등의 조\n세를 감면할 수 있다.\n",
  "sections": {
    "제안이유": "및",
    "주요내용": "현행법에는 인구감소지역에서 투자해 정착한 기업에 대한 특별한\n세제 지원 규정이 없어 기업에서 신규 투자를 결정하는 경우 우수인\n력과 주변 인프라가 갖춰진 수도권으로 다시 투자하는 문제가 발생하\n고 있다는 의견이 있음.\n이에 국가는 인구감소지역에서 공장을 신축 또는 증축하는 자에 대\n하여 「조세특례제한법」에서 정하는 바에 따라 법인세 등의 조세를\n감면할 수 있도록 하려는 것임(안 제28조의2 신설).",
    "제안이유_및_주요내용": "현행법에는 인구감소지역에서 투자해 정착한 기업에 대한 특별한\n세제 지원 규정이 없어 기업에서 신규 투자를 결정하는 경우 우수인\n력과 주변 인프라가 갖춰진 수도권으로 다시 투자하는 문제가 발생하\n고 있다는 의견이 있음.\n이에 국가는 인구감소지역에서 공장을 신축 또는 증축하는 자에 대\n하여 「조세특례제한법」에서 정하는 바에 따라 법인세 등의 조세를\n감면할 수 있도록 하려는 것임(안 제28조의2 신설).",
    "법률_제_호": "인구감소지역 지원 특별법 일부개정법률안\n인구감소지역 지원 특별법 일부를 다음과 같이 개정한다.\n제5장에 제28조의2를 다음과 같이 신설한다.\n제28조의2(조세의 감면) 국가는 인구감소지역에서 공장을 신축 또는\n증축하는 자에 대하여 「조세특례제한법」에서 정하는 바에 따라\n법인세 등의 조세를 감면할 수 있다.",
    "신구조문대비표": "현 행 개 정 안\n<신 설> 제28조의2(조세의 감면) 국가는\n인구감소지역에서 공장을 신축\n또는 증축하는 자에 대하여\n「조세특례제한법」에서 정하\n는 바에 따라 법인세 등의 조\n세를 감면할 수 있다."
  }
}