{
  "title": "2202261_특수임무수행자_보상에_관한_법률_일부개정법률안",
  "bill_number": "2261",
  "proposal_date": "2024. 7. 25.",
  "submission_date": "",
  "is_alternative": false,
  "alternative_bill_numbers": [],
  "has_comparison_table": false,
  "comparison_table": "신ㆍ구조문대비표\n현 행 개 정 안\n제10조(보상금등의 신청) ① (생 제10조(보상금등의 신청) ① (현\n략) 행과 같음)\n② 제1항의 규정에 의한 보상 ② -----------------------\n금등의 지급신청은 이 법 시행 -------------------------\n후 6개월 이내에 하여야 한다. - 5년 ------------------.",
  "full_text": "특수임무수행자 보상에 관한 법률 일부개정법률안\n(이수진의원 대표발의)\n발의연월일 : 2024. 7. 25.\n의 안\n2261\n번 호 발 의 자 : 이수진ㆍ이기헌ㆍ민병덕\n송재봉ㆍ송옥주ㆍ신정훈\n서미화ㆍ전용기ㆍ장철민\n김현정ㆍ백승아 의원\n(11인)\n제안이유 및 주요내용\n현행법은 특수임무수행자 및 그 유족의 특별한 희생에 대하여 보상\n금ㆍ특별공로금ㆍ공로금 및 특별위로금을 지급하도록 규정하면서 그\n신청 기간을 시행일로부터 6개월로 제한하고 있음.\n특수임무수행자 등에 대하여 2004년부터 2019년까지 총 6차에 걸쳐\n보상금 등을 신청할 수 있는 기간을 연장하여 왔으나, 아직도 불가피\n한 사정으로 기한 내에 신청하지 못하여 보상금 등의 지급 심의도 받\n지 못한 경우가 있음.\n이에 보상금 등의 지급신청 기간을 법 시행 후 5년 이내로 규정해\n보상금 등의 지급을 신청하지 못한 특수임무수행자 및 그 유족에게\n필요한 보상을 함으로써 그들의 생활안정을 도모하려는 것임(안 제10\n조제2항).\n\n\n\n\n법률 제 호\n특수임무수행자 보상에 관한 법률 일부개정법률안\n특수임무수행자 보상에 관한 법률 일부를 다음과 같이 개정한다.\n제10조제2항 중 “6개월”을 “5년”으로 한다.\n부 칙\n이 법은 공포 후 3개월이 경과한 날부터 시행한다.\n\n\n\n\n신ㆍ구조문대비표\n현 행 개 정 안\n제10조(보상금등의 신청) ① (생 제10조(보상금등의 신청) ① (현\n략) 행과 같음)\n② 제1항의 규정에 의한 보상 ② -----------------------\n금등의 지급신청은 이 법 시행 -------------------------\n후 6개월 이내에 하여야 한다. - 5년 ------------------.\n",
  "sections": {
    "제안이유": "및",
    "주요내용": "현행법은 특수임무수행자 및 그 유족의 특별한 희생에 대하여 보상\n금ㆍ특별공로금ㆍ공로금 및 특별위로금을 지급하도록 규정하면서 그\n신청 기간을 시행일로부터 6개월로 제한하고 있음.\n특수임무수행자 등에 대하여 2004년부터 2019년까지 총 6차에 걸쳐\n보상금 등을 신청할 수 있는 기간을 연장하여 왔으나, 아직도 불가피\n한 사정으로 기한 내에 신청하지 못하여 보상금 등의 지급 심의도 받\n지 못한 경우가 있음.\n이에 보상금 등의 지급신청 기간을 법 시행 후 5년 이내로 규정해\n보상금 등의 지급을 신청하지 못한 특수임무수행자 및 그 유족에게\n필요한 보상을 함으로써 그들의 생활안정을 도모하려는 것임(안 제10\n조제2항).",
    "제안이유_및_주요내용": "현행법은 특수임무수행자 및 그 유족의 특별한 희생에 대하여 보상\n금ㆍ특별공로금ㆍ공로금 및 특별위로금을 지급하도록 규정하면서 그\n신청 기간을 시행일로부터 6개월로 제한하고 있음.\n특수임무수행자 등에 대하여 2004년부터 2019년까지 총 6차에 걸쳐\n보상금 등을 신청할 수 있는 기간을 연장하여 왔으나, 아직도 불가피\n한 사정으로 기한 내에 신청하지 못하여 보상금 등의 지급 심의도 받\n지 못한 경우가 있음.\n이에 보상금 등의 지급신청 기간을 법 시행 후 5년 이내로 규정해\n보상금 등의 지급을 신청하지 못한 특수임무수행자 및 그 유족에게\n필요한 보상을 함으로써 그들의 생활안정을 도모하려는 것임(안 제10\n조제2항).",
    "법률_제_호": "특수임무수행자 보상에 관한 법률 일부개정법률안\n특수임무수행자 보상에 관한 법률 일부를 다음과 같이 개정한다.\n제10조제2항 중 “6개월”을 “5년”으로 한다.",
    "신구조문대비표": "현 행 개 정 안\n제10조(보상금등의 신청) ① (생 제10조(보상금등의 신청) ① (현\n략) 행과 같음)\n② 제1항의 규정에 의한 보상 ② -----------------------\n금등의 지급신청은 이 법 시행 -------------------------\n후 6개월 이내에 하여야 한다. - 5년 ------------------."
  }
}