{
  "title": "2202789_지방공기업법_일부개정법률안",
  "bill_number": "2789",
  "proposal_date": "2024. 8. 13.",
  "submission_date": "",
  "is_alternative": false,
  "alternative_bill_numbers": [],
  "has_comparison_table": false,
  "comparison_table": "신ㆍ구조문대비표\n현 행 개 정 안\n제54조(다른 법인에 대한 출자) 제54조(다른 법인에 대한 출자)\n① ∼ ③ (생 략) ① ∼ ③ (현행과 같음)\n<신 설> ④ 제1항에 따라 출자한 법인\n에 최대주주의 변경 등 대통령\n령으로 정하는 경영상의 중대\n한 변화가 발생하는 경우 공사\n의 사장은 그 사실을 지체 없\n이 지방자치단체의 장에게 보\n고하여야 한다.",
  "full_text": "지방공기업법 일부개정법률안\n(이상식의원 대표발의)\n발의연월일 : 2024. 8. 13.\n의 안\n2789\n번 호 발 의 자 : 이상식ㆍ이병진ㆍ김문수\n서미화ㆍ양부남ㆍ임미애\n이건태ㆍ윤준병ㆍ정진욱\n김동아ㆍ이강일 의원\n(11인)\n제안이유 및 주요내용\n현행법은 지방공사가 사업을 효율적으로 수행하기 위하여 다른 법\n인에 출자하려는 경우에는 출자의 필요성 및 타당성에 대하여 전문기\n관의 사전검토를 거쳐 지방자치단체의 장에게 보고하고 지방의회의\n의결을 받도록 규정하고 있음.\n그러나 출자를 받은 법인의 경영상 변화에 대한 사후관리 규정이\n존재하지 아니하여 미흡한 사후관리로 지방공사의 재무상황에 부정적\n인 영향을 끼칠 우려가 있으며, 지방공사의 재정 악화는 이후 지방자\n치단체의 재정지원을 필요로 한다는 점을 고려할 때 출자 법인의 사\n후관리에 대한 제도가 필요함.\n이에 지방공사의 사장으로 하여금 지방공사가 출자한 법인에 최대\n주주의 변경 등 경영상 중대한 변화가 발생하는 경우 지방자치단체의\n장에게 보고하도록 하려는 것임(안 제54조제4항 신설).\n\n\n\n\n법률 제 호\n지방공기업법 일부개정법률안\n지방공기업법 일부를 다음과 같이 개정한다.\n제54조에 제4항을 다음과 같이 신설한다.\n④ 제1항에 따라 출자한 법인에 최대주주의 변경 등 대통령령으로\n정하는 경영상의 중대한 변화가 발생하는 경우 공사의 사장은 그\n사실을 지체 없이 지방자치단체의 장에게 보고하여야 한다.\n부 칙\n이 법은 공포 후 6개월이 경과한 날부터 시행한다.\n\n\n\n\n신ㆍ구조문대비표\n현 행 개 정 안\n제54조(다른 법인에 대한 출자) 제54조(다른 법인에 대한 출자)\n① ∼ ③ (생 략) ① ∼ ③ (현행과 같음)\n<신 설> ④ 제1항에 따라 출자한 법인\n에 최대주주의 변경 등 대통령\n령으로 정하는 경영상의 중대\n한 변화가 발생하는 경우 공사\n의 사장은 그 사실을 지체 없\n이 지방자치단체의 장에게 보\n고하여야 한다.\n",
  "sections": {
    "제안이유": "및",
    "주요내용": "현행법은 지방공사가 사업을 효율적으로 수행하기 위하여 다른 법\n인에 출자하려는 경우에는 출자의 필요성 및 타당성에 대하여 전문기\n관의 사전검토를 거쳐 지방자치단체의 장에게 보고하고 지방의회의\n의결을 받도록 규정하고 있음.\n그러나 출자를 받은 법인의 경영상 변화에 대한 사후관리 규정이\n존재하지 아니하여 미흡한 사후관리로 지방공사의 재무상황에 부정적\n인 영향을 끼칠 우려가 있으며, 지방공사의 재정 악화는 이후 지방자\n치단체의 재정지원을 필요로 한다는 점을 고려할 때 출자 법인의 사\n후관리에 대한 제도가 필요함.\n이에 지방공사의 사장으로 하여금 지방공사가 출자한 법인에 최대\n주주의 변경 등 경영상 중대한 변화가 발생하는 경우 지방자치단체의\n장에게 보고하도록 하려는 것임(안 제54조제4항 신설).",
    "제안이유_및_주요내용": "현행법은 지방공사가 사업을 효율적으로 수행하기 위하여 다른 법\n인에 출자하려는 경우에는 출자의 필요성 및 타당성에 대하여 전문기\n관의 사전검토를 거쳐 지방자치단체의 장에게 보고하고 지방의회의\n의결을 받도록 규정하고 있음.\n그러나 출자를 받은 법인의 경영상 변화에 대한 사후관리 규정이\n존재하지 아니하여 미흡한 사후관리로 지방공사의 재무상황에 부정적\n인 영향을 끼칠 우려가 있으며, 지방공사의 재정 악화는 이후 지방자\n치단체의 재정지원을 필요로 한다는 점을 고려할 때 출자 법인의 사\n후관리에 대한 제도가 필요함.\n이에 지방공사의 사장으로 하여금 지방공사가 출자한 법인에 최대\n주주의 변경 등 경영상 중대한 변화가 발생하는 경우 지방자치단체의\n장에게 보고하도록 하려는 것임(안 제54조제4항 신설).",
    "법률_제_호": "지방공기업법 일부개정법률안\n지방공기업법 일부를 다음과 같이 개정한다.\n제54조에 제4항을 다음과 같이 신설한다.\n④ 제1항에 따라 출자한 법인에 최대주주의 변경 등 대통령령으로\n정하는 경영상의 중대한 변화가 발생하는 경우 공사의 사장은 그\n사실을 지체 없이 지방자치단체의 장에게 보고하여야 한다.",
    "신구조문대비표": "현 행 개 정 안\n제54조(다른 법인에 대한 출자) 제54조(다른 법인에 대한 출자)\n① ∼ ③ (생 략) ① ∼ ③ (현행과 같음)\n<신 설> ④ 제1항에 따라 출자한 법인\n에 최대주주의 변경 등 대통령\n령으로 정하는 경영상의 중대\n한 변화가 발생하는 경우 공사\n의 사장은 그 사실을 지체 없\n이 지방자치단체의 장에게 보\n고하여야 한다."
  }
}