{
  "title": "2202455_한국토지주택공사법_일부개정법률안",
  "bill_number": "2455",
  "proposal_date": "2024. 7. 31.",
  "submission_date": "",
  "is_alternative": false,
  "alternative_bill_numbers": [],
  "has_comparison_table": false,
  "comparison_table": "신ㆍ구조문대비표\n현 행 개 정 안\n제4조(자본금) 공사의 자본금은 50 제4조(자본금) --------------\n조원으로 하고, 그 전액을 정부가 65조원-------------------\n출자한다. -------------------.",
  "full_text": "한국토지주택공사법 일부개정법률안\n(권영진의원 대표발의)\n발의연월일 : 2024. 7. 31.\n의 안\n2455\n번 호 발 의 자 : 권영진ㆍ권영세ㆍ서범수\n인요한ㆍ엄태영ㆍ조지연\n윤영석ㆍ박해철ㆍ박충권\n민홍철ㆍ한준호ㆍ손명수\n복기왕ㆍ이만희ㆍ김희정\n염태영ㆍ이소영ㆍ김미애\n김은혜 의원(19인)\n제안이유 및 주요내용\n한국토지주택공사는 서민 주거안정 지원을 위한 건설임대(국민, 영\n구, 행복주택, 통합공공임대) 및 매입임대 등 공공임대주택을 공급하고\n있고, 소요되는 비용의 일부를 법정자본금을 한도로 정부로부터 출자\n를 받고 있음.\n공공임대주택의 공급 확대로 향후 5년간 예상되는 연간 자본금 납\n입액 평균이 3.1조원에 달하여 2024.6월 말 48.7조원 수준인 납입자본\n금이 2025년 1분기에 현행 법정자본금 50조원을 초과하고, 2028년에는\n60조원을 넘어설 것으로 전망됨.\n이에 한국토지주택공사의 법정자본금을 65조원으로 상향 조정하여\n공공임대주택 공급을 위한 법률적 근거를 보강하고 서민 주거복지 기\n반을 확대하고자 하려는 것임(안 제4조).\n\n\n\n\n법률 제 호\n한국토지주택공사법 일부개정법률안\n한국토지주택공사법 일부를 다음과 같이 개정한다.\n제4조 중 “50조원”을 “65조원”으로 한다.\n부 칙\n이 법은 공포한 날부터 시행한다.\n\n\n\n\n신ㆍ구조문대비표\n현 행 개 정 안\n제4조(자본금) 공사의 자본금은 50 제4조(자본금) --------------\n조원으로 하고, 그 전액을 정부가 65조원-------------------\n출자한다. -------------------.\n",
  "sections": {
    "제안이유": "및",
    "주요내용": "한국토지주택공사는 서민 주거안정 지원을 위한 건설임대(국민, 영\n구, 행복주택, 통합공공임대) 및 매입임대 등 공공임대주택을 공급하고\n있고, 소요되는 비용의 일부를 법정자본금을 한도로 정부로부터 출자\n를 받고 있음.\n공공임대주택의 공급 확대로 향후 5년간 예상되는 연간 자본금 납\n입액 평균이 3.1조원에 달하여 2024.6월 말 48.7조원 수준인 납입자본\n금이 2025년 1분기에 현행 법정자본금 50조원을 초과하고, 2028년에는\n60조원을 넘어설 것으로 전망됨.\n이에 한국토지주택공사의 법정자본금을 65조원으로 상향 조정하여\n공공임대주택 공급을 위한 법률적 근거를 보강하고 서민 주거복지 기\n반을 확대하고자 하려는 것임(안 제4조).",
    "제안이유_및_주요내용": "한국토지주택공사는 서민 주거안정 지원을 위한 건설임대(국민, 영\n구, 행복주택, 통합공공임대) 및 매입임대 등 공공임대주택을 공급하고\n있고, 소요되는 비용의 일부를 법정자본금을 한도로 정부로부터 출자\n를 받고 있음.\n공공임대주택의 공급 확대로 향후 5년간 예상되는 연간 자본금 납\n입액 평균이 3.1조원에 달하여 2024.6월 말 48.7조원 수준인 납입자본\n금이 2025년 1분기에 현행 법정자본금 50조원을 초과하고, 2028년에는\n60조원을 넘어설 것으로 전망됨.\n이에 한국토지주택공사의 법정자본금을 65조원으로 상향 조정하여\n공공임대주택 공급을 위한 법률적 근거를 보강하고 서민 주거복지 기\n반을 확대하고자 하려는 것임(안 제4조).",
    "법률_제_호": "한국토지주택공사법 일부개정법률안\n한국토지주택공사법 일부를 다음과 같이 개정한다.\n제4조 중 “50조원”을 “65조원”으로 한다.",
    "신구조문대비표": "현 행 개 정 안\n제4조(자본금) 공사의 자본금은 50 제4조(자본금) --------------\n조원으로 하고, 그 전액을 정부가 65조원-------------------\n출자한다. -------------------."
  }
}