{
  "title": "2202960_모자보건법_일부개정법률안",
  "bill_number": "2960",
  "proposal_date": "2024. 8. 20.",
  "submission_date": "",
  "is_alternative": false,
  "alternative_bill_numbers": [],
  "has_comparison_table": false,
  "comparison_table": "신ㆍ구조문대비표\n현 행 개 정 안\n제11조(난임극복 지원사업) ① 국 제11조(난임극복 지원사업) ①\n가와 지방자치단체는 난임 등 --------------------------\n생식건강 문제를 극복하기 위 --------------------------\n한 지원을 할 수 있다. ------------하여야 한다.\n② (생 략) ② (현행과 같음)",
  "full_text": "모자보건법 일부개정법률안\n(백종헌의원 대표발의)\n발의연월일 : 2024. 8. 20.\n의 안\n2960\n번 호 발 의 자 : 백종헌ㆍ유용원ㆍ서천호\n조경태ㆍ김예지ㆍ진종오\n정성국ㆍ곽규택ㆍ박정하\n정희용ㆍ이헌승ㆍ김용태\n김상욱ㆍ박준태 의원\n(14인)\n제안이유 및 주요내용\n2021년도 기준 난임 진단자 수는 26만3천명에 이르고 있고, 시술인\n원은 7만9천명에 이르고 있음.\n이와 관련하여 정부는 지난 3월 저출산고령사회 정책과제 및 추진\n방향 안건에 난임극복 지원에 대한 소득 기준도 단계적으로 폐지하는\n등 난임극복 지원에 대한 확대를 포함하고 있음.\n이에 정부 정책방향에 맞춰 난임 등 생식건강 문제를 극복하기 위\n한 국가와 지방자치단체의 지원을 의무화하려는 것임(안 제11조제1\n항).\n\n\n\n\n법률 제 호\n모자보건법 일부개정법률안\n모자보건법 일부를 다음과 같이 개정한다.\n제11조제1항 중 “할 수 있다”를 “하여야 한다”로 한다.\n부 칙\n이 법은 2025년 4월 1일부터 시행한다.\n\n\n\n\n신ㆍ구조문대비표\n현 행 개 정 안\n제11조(난임극복 지원사업) ① 국 제11조(난임극복 지원사업) ①\n가와 지방자치단체는 난임 등 --------------------------\n생식건강 문제를 극복하기 위 --------------------------\n한 지원을 할 수 있다. ------------하여야 한다.\n② (생 략) ② (현행과 같음)\n",
  "sections": {
    "제안이유": "및",
    "주요내용": "2021년도 기준 난임 진단자 수는 26만3천명에 이르고 있고, 시술인\n원은 7만9천명에 이르고 있음.\n이와 관련하여 정부는 지난 3월 저출산고령사회 정책과제 및 추진\n방향 안건에 난임극복 지원에 대한 소득 기준도 단계적으로 폐지하는\n등 난임극복 지원에 대한 확대를 포함하고 있음.\n이에 정부 정책방향에 맞춰 난임 등 생식건강 문제를 극복하기 위\n한 국가와 지방자치단체의 지원을 의무화하려는 것임(안 제11조제1\n항).",
    "제안이유_및_주요내용": "2021년도 기준 난임 진단자 수는 26만3천명에 이르고 있고, 시술인\n원은 7만9천명에 이르고 있음.\n이와 관련하여 정부는 지난 3월 저출산고령사회 정책과제 및 추진\n방향 안건에 난임극복 지원에 대한 소득 기준도 단계적으로 폐지하는\n등 난임극복 지원에 대한 확대를 포함하고 있음.\n이에 정부 정책방향에 맞춰 난임 등 생식건강 문제를 극복하기 위\n한 국가와 지방자치단체의 지원을 의무화하려는 것임(안 제11조제1\n항).",
    "법률_제_호": "모자보건법 일부개정법률안\n모자보건법 일부를 다음과 같이 개정한다.\n제11조제1항 중 “할 수 있다”를 “하여야 한다”로 한다.",
    "신구조문대비표": "현 행 개 정 안\n제11조(난임극복 지원사업) ① 국 제11조(난임극복 지원사업) ①\n가와 지방자치단체는 난임 등 --------------------------\n생식건강 문제를 극복하기 위 --------------------------\n한 지원을 할 수 있다. ------------하여야 한다.\n② (생 략) ② (현행과 같음)"
  }
}