{
  "title": "2202897_성폭력범죄의_처벌_등에_관한_특례법_일부개정법률안",
  "bill_number": "2897",
  "proposal_date": "2024. 8. 16.",
  "submission_date": "",
  "is_alternative": false,
  "alternative_bill_numbers": [],
  "has_comparison_table": false,
  "comparison_table": "신ㆍ구조문대비표\n현 행 개 정 안\n제21조(공소시효에 관한 특례) ① 제21조(공소시효에 관한 특례) ①\n∼ ④ (생 략) ∼ ④ (현행과 같음)\n<신 설> ⑤ 가해자와 피해자가 친족(4촌\n이내의 혈족ㆍ인척과 동거하는\n친족을 말한다)관계일 때에는\n공소시효가 15년 연장된다.",
  "full_text": "성폭력범죄의 처벌 등에 관한 특례법 일부개정법률안\n(김승수의원 대표발의)\n발의연월일 : 2024. 8. 16.\n의 안\n2897\n번 호 발 의 자 : 김승수ㆍ강선영ㆍ박성민\n권성동ㆍ조승환ㆍ서지영\n박준태ㆍ조배숙ㆍ이인선\n구자근ㆍ강대식 의원\n(11인)\n제안이유 및 주요내용\n현행법은 13세 미만 미성년자나 신체적인 또는 정신적인 장애가 있\n는 사람을 대상으로 한 성폭력범죄에 대해 공소시효를 배제하고 있음.\n그러나 친족을 대상으로 한 성폭력범죄의 경우 피해자가 13세 이상\n의 미성년자이거나 성인인 경우에도 친족관계라는 특성으로 인해 신\n고가 어려운 점을 고려하여 공소시효를 연장할 필요가 있다는 의견이\n있음.\n이에 친족을 대상으로 한 성폭력범죄에 대하여 공소시효를 15년 더\n연장되게 함으로써 친족관계에 의한 성폭력 피해자의 인권을 보호하\n고 사법적 정의를 구현하려는 것임(안 제21조제5항 신설).\n\n\n\n\n법률 제 호\n성폭력범죄의 처벌 등에 관한 특례법 일부개정법률안\n성폭력범죄의 처벌 등에 관한 특례법 일부를 다음과 같이 개정한다.\n제21조에 제5항을 다음과 같이 신설한다.\n⑤ 가해자와 피해자가 친족(4촌 이내의 혈족ㆍ인척과 동거하는 친족\n을 말한다)관계일 때에는 공소시효가 15년 연장된다.\n부 칙\n제1조(시행일) 이 법은 공포한 날부터 시행한다.\n제2조(공소시효의 특례에 관한 적용례) 제21조제5항의 개정규정은 이\n법 시행 전에 행하여진 성폭력범죄로 아직 공소시효가 완성되지 아\n니한 경우에도 적용한다.\n\n\n\n\n신ㆍ구조문대비표\n현 행 개 정 안\n제21조(공소시효에 관한 특례) ① 제21조(공소시효에 관한 특례) ①\n∼ ④ (생 략) ∼ ④ (현행과 같음)\n<신 설> ⑤ 가해자와 피해자가 친족(4촌\n이내의 혈족ㆍ인척과 동거하는\n친족을 말한다)관계일 때에는\n공소시효가 15년 연장된다.\n",
  "sections": {
    "제안이유": "및",
    "주요내용": "현행법은 13세 미만 미성년자나 신체적인 또는 정신적인 장애가 있\n는 사람을 대상으로 한 성폭력범죄에 대해 공소시효를 배제하고 있음.\n그러나 친족을 대상으로 한 성폭력범죄의 경우 피해자가 13세 이상\n의 미성년자이거나 성인인 경우에도 친족관계라는 특성으로 인해 신\n고가 어려운 점을 고려하여 공소시효를 연장할 필요가 있다는 의견이\n있음.\n이에 친족을 대상으로 한 성폭력범죄에 대하여 공소시효를 15년 더\n연장되게 함으로써 친족관계에 의한 성폭력 피해자의 인권을 보호하\n고 사법적 정의를 구현하려는 것임(안 제21조제5항 신설).",
    "제안이유_및_주요내용": "현행법은 13세 미만 미성년자나 신체적인 또는 정신적인 장애가 있\n는 사람을 대상으로 한 성폭력범죄에 대해 공소시효를 배제하고 있음.\n그러나 친족을 대상으로 한 성폭력범죄의 경우 피해자가 13세 이상\n의 미성년자이거나 성인인 경우에도 친족관계라는 특성으로 인해 신\n고가 어려운 점을 고려하여 공소시효를 연장할 필요가 있다는 의견이\n있음.\n이에 친족을 대상으로 한 성폭력범죄에 대하여 공소시효를 15년 더\n연장되게 함으로써 친족관계에 의한 성폭력 피해자의 인권을 보호하\n고 사법적 정의를 구현하려는 것임(안 제21조제5항 신설).",
    "법률_제_호": "성폭력범죄의 처벌 등에 관한 특례법 일부개정법률안\n성폭력범죄의 처벌 등에 관한 특례법 일부를 다음과 같이 개정한다.\n제21조에 제5항을 다음과 같이 신설한다.\n⑤ 가해자와 피해자가 친족(4촌 이내의 혈족ㆍ인척과 동거하는 친족\n을 말한다)관계일 때에는 공소시효가 15년 연장된다.",
    "신구조문대비표": "현 행 개 정 안\n제21조(공소시효에 관한 특례) ① 제21조(공소시효에 관한 특례) ①\n∼ ④ (생 략) ∼ ④ (현행과 같음)\n<신 설> ⑤ 가해자와 피해자가 친족(4촌\n이내의 혈족ㆍ인척과 동거하는\n친족을 말한다)관계일 때에는\n공소시효가 15년 연장된다."
  }
}