{
  "title": "2202397_교육기본법_일부개정법률안",
  "bill_number": "2397",
  "proposal_date": "2024. 7. 30.",
  "submission_date": "",
  "is_alternative": false,
  "alternative_bill_numbers": [],
  "has_comparison_table": false,
  "comparison_table": "신ㆍ구조문대비표\n현 행 개 정 안\n제14조(교원) ① (생 략) 제14조(교원) ① (현행과 같음)\n<신 설> ② 학교에서 교원의 교육활동\n에 대한 보호와 학생 생활지도\n의 권한은 법령과 학교의 규칙\n에 따라 보장되어야 한다.\n② ∼ ⑥ (생 략) ③ ∼ ⑦ (현행 제2항부터 제6\n항까지와 같음)",
  "full_text": "교육기본법 일부개정법률안\n(강경숙의원 대표발의)\n발의연월일 : 2024. 7. 30.\n의 안\n2397\n번 호 발 의 자 : 강경숙ㆍ황운하ㆍ김한규\n조 국ㆍ김준형ㆍ이해민\n이재정ㆍ김선민ㆍ백승아\n박은정ㆍ김재원ㆍ강유정\n신장식 의원(13인)\n제안이유 및 주요내용\n현행법은 국민의 학습권과 학습자, 보호자, 교원 등 교육당사자에\n대한 역할과 책임 등 교육제도와 그 운영에 관한 기본적인 사항을 규\n정하고 있음.\n그런데 교원이 학생 생활지도와 교육활동을 하는 과정에서 학부모\n등의 민원과 과도한 간섭에 따른 피해를 겪는 경우가 발생하고 있어\n교원의 학생 교육ㆍ지도 권한에 대한 보호가 강화될 필요가 있다는\n의견이 있음.\n이에 학교에서 교원의 교육활동에 대한 보호와 학생 생활지도의 권\n한은 법령과 학교의 규칙에 따라 보장되어야 한다고 규정함으로써 교\n원들이 사명감을 가지고 교육활동에 전념할 수 있도록 하려는 것임(안\n제14조제2항 신설).\n\n\n\n\n법률 제 호\n교육기본법 일부개정법률안\n교육기본법 일부를 다음과 같이 개정한다.\n제14조제2항부터 제6항까지를 각각 제3항부터 제7항까지로 하고, 같은\n조에 제2항을 다음과 같이 신설한다.\n② 학교에서 교원의 교육활동에 대한 보호와 학생 생활지도의 권한\n은 법령과 학교의 규칙에 따라 보장되어야 한다.\n부 칙\n이 법은 공포 후 6개월이 경과한 날부터 시행한다.\n\n\n\n\n신ㆍ구조문대비표\n현 행 개 정 안\n제14조(교원) ① (생 략) 제14조(교원) ① (현행과 같음)\n<신 설> ② 학교에서 교원의 교육활동\n에 대한 보호와 학생 생활지도\n의 권한은 법령과 학교의 규칙\n에 따라 보장되어야 한다.\n② ∼ ⑥ (생 략) ③ ∼ ⑦ (현행 제2항부터 제6\n항까지와 같음)\n",
  "sections": {
    "제안이유": "및",
    "주요내용": "현행법은 국민의 학습권과 학습자, 보호자, 교원 등 교육당사자에\n대한 역할과 책임 등 교육제도와 그 운영에 관한 기본적인 사항을 규\n정하고 있음.\n그런데 교원이 학생 생활지도와 교육활동을 하는 과정에서 학부모\n등의 민원과 과도한 간섭에 따른 피해를 겪는 경우가 발생하고 있어\n교원의 학생 교육ㆍ지도 권한에 대한 보호가 강화될 필요가 있다는\n의견이 있음.\n이에 학교에서 교원의 교육활동에 대한 보호와 학생 생활지도의 권\n한은 법령과 학교의 규칙에 따라 보장되어야 한다고 규정함으로써 교\n원들이 사명감을 가지고 교육활동에 전념할 수 있도록 하려는 것임(안\n제14조제2항 신설).",
    "제안이유_및_주요내용": "현행법은 국민의 학습권과 학습자, 보호자, 교원 등 교육당사자에\n대한 역할과 책임 등 교육제도와 그 운영에 관한 기본적인 사항을 규\n정하고 있음.\n그런데 교원이 학생 생활지도와 교육활동을 하는 과정에서 학부모\n등의 민원과 과도한 간섭에 따른 피해를 겪는 경우가 발생하고 있어\n교원의 학생 교육ㆍ지도 권한에 대한 보호가 강화될 필요가 있다는\n의견이 있음.\n이에 학교에서 교원의 교육활동에 대한 보호와 학생 생활지도의 권\n한은 법령과 학교의 규칙에 따라 보장되어야 한다고 규정함으로써 교\n원들이 사명감을 가지고 교육활동에 전념할 수 있도록 하려는 것임(안\n제14조제2항 신설).",
    "법률_제_호": "교육기본법 일부개정법률안\n교육기본법 일부를 다음과 같이 개정한다.\n제14조제2항부터 제6항까지를 각각 제3항부터 제7항까지로 하고, 같은\n조에 제2항을 다음과 같이 신설한다.\n② 학교에서 교원의 교육활동에 대한 보호와 학생 생활지도의 권한\n은 법령과 학교의 규칙에 따라 보장되어야 한다.",
    "신구조문대비표": "현 행 개 정 안\n제14조(교원) ① (생 략) 제14조(교원) ① (현행과 같음)\n<신 설> ② 학교에서 교원의 교육활동\n에 대한 보호와 학생 생활지도\n의 권한은 법령과 학교의 규칙\n에 따라 보장되어야 한다.\n② ∼ ⑥ (생 략) ③ ∼ ⑦ (현행 제2항부터 제6\n항까지와 같음)"
  }
}