{
  "title": "2202825_정보통신기반_보호법_일부개정법률안",
  "bill_number": "2825",
  "proposal_date": "2024. 8. 14.",
  "submission_date": "",
  "is_alternative": false,
  "alternative_bill_numbers": [],
  "has_comparison_table": false,
  "comparison_table": "신ㆍ구조문대비표\n현 행 개 정 안\n<신 설> 제13조의2(국회에 대한 보고) 관\n계기관등의 장은 제13조제1항\n후단에 따른 조치 현황에 관한\n보고서를 대통령령으로 정하는\n바에 따라 조치한 후 처음으로\n집회하는 임시 국회의 개회 전\n까지 국회 소관 상임위원회에\n보고하여야 한다.",
  "full_text": "정보통신기반 보호법 일부개정법률안\n(윤건영의원 대표발의)\n발의연월일 : 2024. 8. 14.\n의 안\n2825\n번 호 발 의 자 : 윤건영ㆍ박지원ㆍ이기헌\n전현희ㆍ문정복ㆍ한병도\n백승아ㆍ염태영ㆍ김병기\n문진석 의원(10인)\n제안이유 및 주요내용\n현행법에 따라 주요 정보통신기반시설을 관리하는 기관의 장은 정\n보통신기반시설 침해사고가 발생하여 해당 기관의 주요 정보통신기반\n시설이 교란․마비 또는 파괴된 사실을 인지한 때에는 관계 행정기관,\n수사기관 또는 인터넷진흥원에 그 사실을 통지하도록 규정하고 있습\n니다.\n그러나 통지를 받은 관계기관등은 침해사고의 피해확산 방지와 신\n속한 대응을 위하여 필요한 조치를 취하도록 규정하고 있으나, 의무\n이행 여부에 대한 점검 장치가 없는 등 관리 및 대응에 미흡한 부분\n이 있다는 지적이 제기되고 있습니다.\n이에 주요 정보통신기반시설의 침해사고를 통지받은 관계기관의 장\n은 조치 현황에 관한 보고서를 조치한 후 처음으로 집회하는 임시국\n회의 개회 전까지 국회 소관 상임위원회에 제출하도록 하고자 합니다\n\n\n\n(안 제13조의2 신설).\n\n법률 제 호\n정보통신기반 보호법 일부개정법률안\n정보통신기반 보호법 일부를 다음과 같이 개정한다.\n제13조의2를 다음과 같이 신설한다.\n제13조의2(국회에 대한 보고) 관계기관등의 장은 제13조제1항 후단에\n따른 조치 현황에 관한 보고서를 대통령령으로 정하는 바에 따라\n조치한 후 처음으로 집회하는 임시 국회의 개회 전까지 국회 소관\n상임위원회에 보고하여야 한다.\n부 칙\n이 법은 공포 후 6개월이 경과한 날부터 시행한다.\n\n\n\n\n신ㆍ구조문대비표\n현 행 개 정 안\n<신 설> 제13조의2(국회에 대한 보고) 관\n계기관등의 장은 제13조제1항\n후단에 따른 조치 현황에 관한\n보고서를 대통령령으로 정하는\n바에 따라 조치한 후 처음으로\n집회하는 임시 국회의 개회 전\n까지 국회 소관 상임위원회에\n보고하여야 한다.\n",
  "sections": {
    "제안이유": "및",
    "주요내용": "현행법에 따라 주요 정보통신기반시설을 관리하는 기관의 장은 정\n보통신기반시설 침해사고가 발생하여 해당 기관의 주요 정보통신기반\n시설이 교란․마비 또는 파괴된 사실을 인지한 때에는 관계 행정기관,\n수사기관 또는 인터넷진흥원에 그 사실을 통지하도록 규정하고 있습\n니다.\n그러나 통지를 받은 관계기관등은 침해사고의 피해확산 방지와 신\n속한 대응을 위하여 필요한 조치를 취하도록 규정하고 있으나, 의무\n이행 여부에 대한 점검 장치가 없는 등 관리 및 대응에 미흡한 부분\n이 있다는 지적이 제기되고 있습니다.\n이에 주요 정보통신기반시설의 침해사고를 통지받은 관계기관의 장\n은 조치 현황에 관한 보고서를 조치한 후 처음으로 집회하는 임시국\n회의 개회 전까지 국회 소관 상임위원회에 제출하도록 하고자 합니다\n\n\n\n(안 제13조의2 신설).",
    "제안이유_및_주요내용": "현행법에 따라 주요 정보통신기반시설을 관리하는 기관의 장은 정\n보통신기반시설 침해사고가 발생하여 해당 기관의 주요 정보통신기반\n시설이 교란․마비 또는 파괴된 사실을 인지한 때에는 관계 행정기관,\n수사기관 또는 인터넷진흥원에 그 사실을 통지하도록 규정하고 있습\n니다.\n그러나 통지를 받은 관계기관등은 침해사고의 피해확산 방지와 신\n속한 대응을 위하여 필요한 조치를 취하도록 규정하고 있으나, 의무\n이행 여부에 대한 점검 장치가 없는 등 관리 및 대응에 미흡한 부분\n이 있다는 지적이 제기되고 있습니다.\n이에 주요 정보통신기반시설의 침해사고를 통지받은 관계기관의 장\n은 조치 현황에 관한 보고서를 조치한 후 처음으로 집회하는 임시국\n회의 개회 전까지 국회 소관 상임위원회에 제출하도록 하고자 합니다\n\n\n\n(안 제13조의2 신설).",
    "법률_제_호": "정보통신기반 보호법 일부개정법률안\n정보통신기반 보호법 일부를 다음과 같이 개정한다.\n제13조의2를 다음과 같이 신설한다.\n제13조의2(국회에 대한 보고) 관계기관등의 장은 제13조제1항 후단에\n따른 조치 현황에 관한 보고서를 대통령령으로 정하는 바에 따라\n조치한 후 처음으로 집회하는 임시 국회의 개회 전까지 국회 소관\n상임위원회에 보고하여야 한다.",
    "신구조문대비표": "현 행 개 정 안\n<신 설> 제13조의2(국회에 대한 보고) 관\n계기관등의 장은 제13조제1항\n후단에 따른 조치 현황에 관한\n보고서를 대통령령으로 정하는\n바에 따라 조치한 후 처음으로\n집회하는 임시 국회의 개회 전\n까지 국회 소관 상임위원회에\n보고하여야 한다."
  }
}