{
  "title": "2202760_교육기본법_일부개정법률안",
  "bill_number": "2760",
  "proposal_date": "2024. 8. 13.",
  "submission_date": "",
  "is_alternative": false,
  "alternative_bill_numbers": [],
  "has_comparison_table": false,
  "comparison_table": "신ㆍ구조문대비표\n현 행 개 정 안\n<신 설> 제22조의5(스마트기기 사용 교육)\n국가와 지방자치단체는 과도한\n스마트기기 사용으로 인하여\n발생하는 부작용을 예방하기\n위하여 학생이 스마트기기를\n적정시간 이상 사용하지 못하\n도록 필요한 시책을 수립ㆍ실\n시하여야 한다.",
  "full_text": "교육기본법 일부개정법률안\n(조정훈의원 대표발의)\n발의연월일 : 2024. 8. 13.\n의 안\n2760\n번 호 발 의 자 : 조정훈ㆍ성일종ㆍ서지영\n김대식ㆍ김장겸ㆍ김소희\n인요한ㆍ김예지ㆍ김민전\n김용태ㆍ김미애 의원\n(11인)\n제안이유 및 주요내용\n현행법상 양성평등의식의 증진, 안전사고 예방, 평화적 통일 지향,\n기후변화환경교육 등 필요한 교육의 진흥을 위해 수립해야 할 시책\n마련을 규정하고 있음.\n그런데 스마트기기에 대한 사용 등 디지털 교육에 대한 내용은 부\n재함. 최근 교육현장에도 AI 디지털 교과서 등 다양한 디지털 기기가\n적극적으로 도입되고 있는 반면, 올바른 스마트기기 사용에 대한 교육\n은 충분하지 못한 실정임. 과학기술정보통신부에 따르면, 2023년 기준\n만 3∼9세의 스마트폰 과의존 위험군 비율은 25%이며 만 10∼19세는\n40.1%나 되는 것으로 나타났음. 이렇다 보니 청소년의 올바른 스마트\n기기 사용 교육이 시급하단 목소리가 나오고 있음.\n이에 정부와 지방자치단체가 학생이 스마트기기를 적정시간 이상\n사용하지 못하도록 필요한 교육 시책을 수립ㆍ실시함으로써 과도한\n\n\n\n스마트기기 사용으로 인하여 발생하는 부작용을 예방하려는 것임(안\n제22조의5 신설).\n\n법률 제 호\n교육기본법 일부개정법률안\n교육기본법 일부를 다음과 같이 개정한다.\n제22조의5를 다음과 같이 신설한다.\n제22조의5(스마트기기 사용 교육) 국가와 지방자치단체는 과도한 스마\n트기기 사용으로 인하여 발생하는 부작용을 예방하기 위하여 학생\n이 스마트기기를 적정시간 이상 사용하지 못하도록 필요한 시책을\n수립ㆍ실시하여야 한다.\n부 칙\n이 법은 공포한 날부터 시행한다.\n\n\n\n\n신ㆍ구조문대비표\n현 행 개 정 안\n<신 설> 제22조의5(스마트기기 사용 교육)\n국가와 지방자치단체는 과도한\n스마트기기 사용으로 인하여\n발생하는 부작용을 예방하기\n위하여 학생이 스마트기기를\n적정시간 이상 사용하지 못하\n도록 필요한 시책을 수립ㆍ실\n시하여야 한다.\n",
  "sections": {
    "제안이유": "및",
    "주요내용": "현행법상 양성평등의식의 증진, 안전사고 예방, 평화적 통일 지향,\n기후변화환경교육 등 필요한 교육의 진흥을 위해 수립해야 할 시책\n마련을 규정하고 있음.\n그런데 스마트기기에 대한 사용 등 디지털 교육에 대한 내용은 부\n재함. 최근 교육현장에도 AI 디지털 교과서 등 다양한 디지털 기기가\n적극적으로 도입되고 있는 반면, 올바른 스마트기기 사용에 대한 교육\n은 충분하지 못한 실정임. 과학기술정보통신부에 따르면, 2023년 기준\n만 3∼9세의 스마트폰 과의존 위험군 비율은 25%이며 만 10∼19세는\n40.1%나 되는 것으로 나타났음. 이렇다 보니 청소년의 올바른 스마트\n기기 사용 교육이 시급하단 목소리가 나오고 있음.\n이에 정부와 지방자치단체가 학생이 스마트기기를 적정시간 이상\n사용하지 못하도록 필요한 교육 시책을 수립ㆍ실시함으로써 과도한\n\n\n\n스마트기기 사용으로 인하여 발생하는 부작용을 예방하려는 것임(안\n제22조의5 신설).",
    "제안이유_및_주요내용": "현행법상 양성평등의식의 증진, 안전사고 예방, 평화적 통일 지향,\n기후변화환경교육 등 필요한 교육의 진흥을 위해 수립해야 할 시책\n마련을 규정하고 있음.\n그런데 스마트기기에 대한 사용 등 디지털 교육에 대한 내용은 부\n재함. 최근 교육현장에도 AI 디지털 교과서 등 다양한 디지털 기기가\n적극적으로 도입되고 있는 반면, 올바른 스마트기기 사용에 대한 교육\n은 충분하지 못한 실정임. 과학기술정보통신부에 따르면, 2023년 기준\n만 3∼9세의 스마트폰 과의존 위험군 비율은 25%이며 만 10∼19세는\n40.1%나 되는 것으로 나타났음. 이렇다 보니 청소년의 올바른 스마트\n기기 사용 교육이 시급하단 목소리가 나오고 있음.\n이에 정부와 지방자치단체가 학생이 스마트기기를 적정시간 이상\n사용하지 못하도록 필요한 교육 시책을 수립ㆍ실시함으로써 과도한\n\n\n\n스마트기기 사용으로 인하여 발생하는 부작용을 예방하려는 것임(안\n제22조의5 신설).",
    "법률_제_호": "교육기본법 일부개정법률안\n교육기본법 일부를 다음과 같이 개정한다.\n제22조의5를 다음과 같이 신설한다.\n제22조의5(스마트기기 사용 교육) 국가와 지방자치단체는 과도한 스마\n트기기 사용으로 인하여 발생하는 부작용을 예방하기 위하여 학생\n이 스마트기기를 적정시간 이상 사용하지 못하도록 필요한 시책을\n수립ㆍ실시하여야 한다.",
    "신구조문대비표": "현 행 개 정 안\n<신 설> 제22조의5(스마트기기 사용 교육)\n국가와 지방자치단체는 과도한\n스마트기기 사용으로 인하여\n발생하는 부작용을 예방하기\n위하여 학생이 스마트기기를\n적정시간 이상 사용하지 못하\n도록 필요한 시책을 수립ㆍ실\n시하여야 한다."
  }
}