{
  "title": "2202000_해양폐기물_및_해양오염퇴적물_관리법_일부개정법률안",
  "bill_number": "2000",
  "proposal_date": "2024. 7. 19.",
  "submission_date": "",
  "is_alternative": false,
  "alternative_bill_numbers": [],
  "has_comparison_table": false,
  "comparison_table": "신ㆍ구조문대비표\n현 행 개 정 안\n제11조(폐기물의 해양유입 차단 제11조(폐기물의 해양유입 차단\n조치) ①ㆍ② (생 략) 조치) ①ㆍ② (현행과 같음)\n<신 설> ③ 해양수산부장관은 중앙행정\n기관의 장등이 제1항 또는 제2\n항에 따라 필요한 조치를 이행\n하는 데 드는 비용의 전부 또\n는 일부를 예산의 범위에서 지\n원할 수 있다.",
  "full_text": "해양폐기물 및 해양오염퇴적물 관리법 일부개정법률안\n(조경태의원 대표발의)\n발의연월일 : 2024. 7. 19.\n의 안\n2000\n번 호 발 의 자 : 조경태ㆍ김성원ㆍ김상훈\n백종헌ㆍ강선영ㆍ김대식\n정연욱ㆍ김미애ㆍ조지연\n박준태ㆍ곽규택 의원\n(11인)\n제안이유 및 주요내용\n농어촌공사는 매년 여름철 집중호우시 수위조절을 위해 영산강, 낙\n동강 등 5대 강의 수문 개방을 하고 있음. 그러나 방류 이후 5대 강\n상류지역 생활 쓰레기가 하구 수문을 통해 하류로 유입되면서 항구\n수역에 ‘쓰레기 밭’이 생성됨. 누적된 쓰레기는 항구 미관을 해칠 뿐만\n아니라 선박의 안전 운항을 위협하므로 신속한 수거가 필요함. 그러나\n장마기간 중 단기간에 쌓인 대규모 해양쓰레기로 인해 가용장비와 인\n력의 부족을 매년 겪고 있음.\n또한, 내륙지역에서 발생해 떠밀려온 해안쓰레기 처리를 해안가 지\n역 지방자치단체가 부담해 지역간 갈등의 소지가 되고 있으며, 예산상\n문제가 발생하고 있음.\n그런데 현행법은 시ㆍ도지사 등에게 유출방지시설 설치 등 필요한\n조치를 하도록 하면서 이에 필요한 비용을 지원할 수 있는 근거를 두\n\n\n\n고 있지 않아 시ㆍ도지사의 적극적인 역할을 기대하기 어렵다는 지적\n이 있음.\n이에 해양수산부장관으로 하여금 하천 폐기물의 유출방지 조치를\n이행하는 시ㆍ도지사 등에게 비용을 지원할 수 있는 근거를 마련함으\n로써, 폐기물의 해양 유입을 방지하여 해양환경 보전에 기여하려는 것\n임(안 제11조제3항 신설).\n\n법률 제 호\n해양폐기물 및 해양오염퇴적물 관리법 일부개정법률안\n해양폐기물 및 해양오염퇴적물 관리법 일부를 다음과 같이 개정한다.\n제11조에 제3항을 다음과 같이 신설한다.\n③ 해양수산부장관은 중앙행정기관의 장등이 제1항 또는 제2항에\n따라 필요한 조치를 이행하는 데 드는 비용의 전부 또는 일부를 예\n산의 범위에서 지원할 수 있다.\n부 칙\n이 법은 공포 후 6개월이 경과한 날부터 시행한다.\n\n\n\n\n신ㆍ구조문대비표\n현 행 개 정 안\n제11조(폐기물의 해양유입 차단 제11조(폐기물의 해양유입 차단\n조치) ①ㆍ② (생 략) 조치) ①ㆍ② (현행과 같음)\n<신 설> ③ 해양수산부장관은 중앙행정\n기관의 장등이 제1항 또는 제2\n항에 따라 필요한 조치를 이행\n하는 데 드는 비용의 전부 또\n는 일부를 예산의 범위에서 지\n원할 수 있다.\n",
  "sections": {
    "제안이유": "및",
    "주요내용": "농어촌공사는 매년 여름철 집중호우시 수위조절을 위해 영산강, 낙\n동강 등 5대 강의 수문 개방을 하고 있음. 그러나 방류 이후 5대 강\n상류지역 생활 쓰레기가 하구 수문을 통해 하류로 유입되면서 항구\n수역에 ‘쓰레기 밭’이 생성됨. 누적된 쓰레기는 항구 미관을 해칠 뿐만\n아니라 선박의 안전 운항을 위협하므로 신속한 수거가 필요함. 그러나\n장마기간 중 단기간에 쌓인 대규모 해양쓰레기로 인해 가용장비와 인\n력의 부족을 매년 겪고 있음.\n또한, 내륙지역에서 발생해 떠밀려온 해안쓰레기 처리를 해안가 지\n역 지방자치단체가 부담해 지역간 갈등의 소지가 되고 있으며, 예산상\n문제가 발생하고 있음.\n그런데 현행법은 시ㆍ도지사 등에게 유출방지시설 설치 등 필요한\n조치를 하도록 하면서 이에 필요한 비용을 지원할 수 있는 근거를 두\n\n\n\n고 있지 않아 시ㆍ도지사의 적극적인 역할을 기대하기 어렵다는 지적\n이 있음.\n이에 해양수산부장관으로 하여금 하천 폐기물의 유출방지 조치를\n이행하는 시ㆍ도지사 등에게 비용을 지원할 수 있는 근거를 마련함으\n로써, 폐기물의 해양 유입을 방지하여 해양환경 보전에 기여하려는 것\n임(안 제11조제3항 신설).",
    "제안이유_및_주요내용": "농어촌공사는 매년 여름철 집중호우시 수위조절을 위해 영산강, 낙\n동강 등 5대 강의 수문 개방을 하고 있음. 그러나 방류 이후 5대 강\n상류지역 생활 쓰레기가 하구 수문을 통해 하류로 유입되면서 항구\n수역에 ‘쓰레기 밭’이 생성됨. 누적된 쓰레기는 항구 미관을 해칠 뿐만\n아니라 선박의 안전 운항을 위협하므로 신속한 수거가 필요함. 그러나\n장마기간 중 단기간에 쌓인 대규모 해양쓰레기로 인해 가용장비와 인\n력의 부족을 매년 겪고 있음.\n또한, 내륙지역에서 발생해 떠밀려온 해안쓰레기 처리를 해안가 지\n역 지방자치단체가 부담해 지역간 갈등의 소지가 되고 있으며, 예산상\n문제가 발생하고 있음.\n그런데 현행법은 시ㆍ도지사 등에게 유출방지시설 설치 등 필요한\n조치를 하도록 하면서 이에 필요한 비용을 지원할 수 있는 근거를 두\n\n\n\n고 있지 않아 시ㆍ도지사의 적극적인 역할을 기대하기 어렵다는 지적\n이 있음.\n이에 해양수산부장관으로 하여금 하천 폐기물의 유출방지 조치를\n이행하는 시ㆍ도지사 등에게 비용을 지원할 수 있는 근거를 마련함으\n로써, 폐기물의 해양 유입을 방지하여 해양환경 보전에 기여하려는 것\n임(안 제11조제3항 신설).",
    "법률_제_호": "해양폐기물 및 해양오염퇴적물 관리법 일부개정법률안\n해양폐기물 및 해양오염퇴적물 관리법 일부를 다음과 같이 개정한다.\n제11조에 제3항을 다음과 같이 신설한다.\n③ 해양수산부장관은 중앙행정기관의 장등이 제1항 또는 제2항에\n따라 필요한 조치를 이행하는 데 드는 비용의 전부 또는 일부를 예\n산의 범위에서 지원할 수 있다.",
    "신구조문대비표": "현 행 개 정 안\n제11조(폐기물의 해양유입 차단 제11조(폐기물의 해양유입 차단\n조치) ①ㆍ② (생 략) 조치) ①ㆍ② (현행과 같음)\n<신 설> ③ 해양수산부장관은 중앙행정\n기관의 장등이 제1항 또는 제2\n항에 따라 필요한 조치를 이행\n하는 데 드는 비용의 전부 또\n는 일부를 예산의 범위에서 지\n원할 수 있다."
  }
}