{
  "title": "2202426_벤처기업육성에_관한_특별법_일부개정법률안",
  "bill_number": "2426",
  "proposal_date": "2024. 7. 31.",
  "submission_date": "",
  "is_alternative": false,
  "alternative_bill_numbers": [],
  "has_comparison_table": false,
  "comparison_table": "신·구조문대비표\n현 행 개 정 안\n제18조의5(촉진지구에 대한 지원) 제18조의5(촉진지구에 대한 지원)\n① ∼ ④ (생 략) ① ∼ ④ (현행과 같음)\n<신 설> ⑤ 국가는 지방자치단체가 제2\n항 및 제3항에 따라 자금을 지\n원하는 경우에는 대통령령으로\n정하는 바에 따라 이를 지원하\n여야 한다.",
  "full_text": "벤처기업육성에 관한 특별법 일부개정법률안\n(정태호의원 대표발의)\n발의연월일 : 2024. 7. 31.\n의 안\n2426\n번 호 발 의 자 : 정태호ㆍ안도걸ㆍ강준현\n이학영ㆍ이연희ㆍ이기헌\n이수진ㆍ조계원ㆍ이재정\n한병도ㆍ조 국ㆍ조인철\n위성곤ㆍ김선민ㆍ서영석\n황 희ㆍ윤건영ㆍ오세희\n의원(18인)\n제안이유 및 주요내용\n현행법에 따르면 국가와 지방자치단체는 벤처기업육성촉진지구(이하\n“촉진지구”라 함)에 있거나 촉진지구로 이전하는 벤처기업과 촉진지구\n에 설치되는 벤처기업집적시설의 설치ㆍ운영자 및 창업보육센터사업\n자에게 자금을 지원하거나 우대하여 지원할 수 있음.\n그런데 지난 5월 정부에서 발표한 ‘벤처투자 현황 진단 및 대응 방\n안’에 따르면 벤처기업에 대한 투자가 2022년 대비 큰 폭으로 감소하\n였으며, 특히 촉진지구에 대한 지원은 지방자치단체의 열악한 재정 여\n건으로 인하여 어려운 상황이므로 국가 재정 투입이 필요하다는 의견\n이 제시됨.\n이에 지방자치단체가 촉진지구의 벤처기업, 벤처기업집적시설의 설\n\n\n\n치ㆍ운영자 및 창업보육센터사업자에게 자금을 지원하는 경우에는 국\n가가 이를 지원하도록 함으로써 벤처기업 육성을 촉진하려는 것임(안\n제18조의5제5항 신설).\n\n법률 제 호\n벤처기업육성에 관한 특별법 일부개정법률안\n벤처기업육성에 관한 특별법 일부를 다음과 같이 개정한다.\n제18조의5에 제5항을 다음과 같이 신설한다.\n⑤ 국가는 지방자치단체가 제2항 및 제3항에 따라 자금을 지원하는\n경우에는 대통령령으로 정하는 바에 따라 이를 지원하여야 한다.\n부 칙\n이 법은 공포 후 6개월이 경과한 날부터 시행한다.\n\n\n\n\n신·구조문대비표\n현 행 개 정 안\n제18조의5(촉진지구에 대한 지원) 제18조의5(촉진지구에 대한 지원)\n① ∼ ④ (생 략) ① ∼ ④ (현행과 같음)\n<신 설> ⑤ 국가는 지방자치단체가 제2\n항 및 제3항에 따라 자금을 지\n원하는 경우에는 대통령령으로\n정하는 바에 따라 이를 지원하\n여야 한다.\n",
  "sections": {
    "제안이유": "및",
    "주요내용": "현행법에 따르면 국가와 지방자치단체는 벤처기업육성촉진지구(이하\n“촉진지구”라 함)에 있거나 촉진지구로 이전하는 벤처기업과 촉진지구\n에 설치되는 벤처기업집적시설의 설치ㆍ운영자 및 창업보육센터사업\n자에게 자금을 지원하거나 우대하여 지원할 수 있음.\n그런데 지난 5월 정부에서 발표한 ‘벤처투자 현황 진단 및 대응 방\n안’에 따르면 벤처기업에 대한 투자가 2022년 대비 큰 폭으로 감소하\n였으며, 특히 촉진지구에 대한 지원은 지방자치단체의 열악한 재정 여\n건으로 인하여 어려운 상황이므로 국가 재정 투입이 필요하다는 의견\n이 제시됨.\n이에 지방자치단체가 촉진지구의 벤처기업, 벤처기업집적시설의 설\n\n\n\n치ㆍ운영자 및 창업보육센터사업자에게 자금을 지원하는 경우에는 국\n가가 이를 지원하도록 함으로써 벤처기업 육성을 촉진하려는 것임(안\n제18조의5제5항 신설).",
    "제안이유_및_주요내용": "현행법에 따르면 국가와 지방자치단체는 벤처기업육성촉진지구(이하\n“촉진지구”라 함)에 있거나 촉진지구로 이전하는 벤처기업과 촉진지구\n에 설치되는 벤처기업집적시설의 설치ㆍ운영자 및 창업보육센터사업\n자에게 자금을 지원하거나 우대하여 지원할 수 있음.\n그런데 지난 5월 정부에서 발표한 ‘벤처투자 현황 진단 및 대응 방\n안’에 따르면 벤처기업에 대한 투자가 2022년 대비 큰 폭으로 감소하\n였으며, 특히 촉진지구에 대한 지원은 지방자치단체의 열악한 재정 여\n건으로 인하여 어려운 상황이므로 국가 재정 투입이 필요하다는 의견\n이 제시됨.\n이에 지방자치단체가 촉진지구의 벤처기업, 벤처기업집적시설의 설\n\n\n\n치ㆍ운영자 및 창업보육센터사업자에게 자금을 지원하는 경우에는 국\n가가 이를 지원하도록 함으로써 벤처기업 육성을 촉진하려는 것임(안\n제18조의5제5항 신설).",
    "법률_제_호": "벤처기업육성에 관한 특별법 일부개정법률안\n벤처기업육성에 관한 특별법 일부를 다음과 같이 개정한다.\n제18조의5에 제5항을 다음과 같이 신설한다.\n⑤ 국가는 지방자치단체가 제2항 및 제3항에 따라 자금을 지원하는\n경우에는 대통령령으로 정하는 바에 따라 이를 지원하여야 한다.",
    "신구조문대비표": "현 행 개 정 안\n제18조의5(촉진지구에 대한 지원) 제18조의5(촉진지구에 대한 지원)\n① ∼ ④ (생 략) ① ∼ ④ (현행과 같음)\n<신 설> ⑤ 국가는 지방자치단체가 제2\n항 및 제3항에 따라 자금을 지\n원하는 경우에는 대통령령으로\n정하는 바에 따라 이를 지원하\n여야 한다."
  }
}