{
  "title": "2202500_의료법_일부개정법률안",
  "bill_number": "2500",
  "proposal_date": "2024. 8. 1.",
  "submission_date": "",
  "is_alternative": false,
  "alternative_bill_numbers": [],
  "has_comparison_table": false,
  "comparison_table": "신ㆍ구조문대비표\n현 행 개 정 안\n제2조(의료인) ①ㆍ② (생 략) 제2조(의료인) ①ㆍ② (현행과 같\n음)\n<신 설> ③ 보건복지부장관은 「보건의\n료인력지원법」 제8조의2에 따\n른 보건의료인력 업무조정위원\n회의 심의ㆍ의결을 거쳐 제2항\n에 따른 의료인의 종별 임무의\n구체적인 업무범위를 고시할\n수 있다.",
  "full_text": "의료법 일부개정법률안\n(김윤의원 대표발의)\n발의연월일 : 2024. 8. 1.\n의 안\n2500\n번 호 발 의 자 : 김 윤ㆍ조인철ㆍ이기헌\n남인순ㆍ모경종ㆍ박정현\n황정아ㆍ장종태ㆍ김선민\n강경숙ㆍ문진석ㆍ김남희\n의원(12인)\n제안이유 및 주요내용\n보건의료분야의 빠른 발전에도 불구하고, 낡은 현행 「의료법」 등\n보건의료 관련 법률로 인해 전문성을 갖춘 개별 의료인력들이 역량을\n펼치지 못하고 있는 것이 현실임.\n의료인력 간 업무 범위가 불분명하고, 이를 조정하고 협력할 수 있\n는 제도적 기반이 부재해 직역 간 업무가 중첩되는 영역을 중심으로\n의료인력의 갈등이 야기되고 있음.\n이에 의료인의 종별 임무에 대한 구체적인 업무범위는 보건의료직\n역들, 시민대표, 전문가가 참여하는 「보건의료인력 업무조정위원회」\n의 심의ㆍ의결을 거쳐 보건복지부 장관이 고시하도록 함으로써 의료\n직역 간 불필요한 갈등을 해소하고 국민건강증진에 기여하고자 함(안\n제2조제3항 신설).\n\n\n\n참고사항\n이 법률안은 김윤의원이 대표발의한 「보건의료인력지원법 일부개\n정법률안」(의안번호 제1230호)의 의결을 전제로 하는 것이므로 같은\n법률안이 의결되지 아니하거나 수정의결되는 경우에는 이에 맞추어\n조정되어야 할 것임.\n\n법률 제 호\n의료법 일부개정법률안\n의료법 일부를 다음과 같이 개정한다.\n제2조에 제3항을 다음과 같이 신설한다.\n③ 보건복지부장관은 「보건의료인력지원법」 제8조의2에 따른 보\n건의료인력 업무조정위원회의 심의ㆍ의결을 거쳐 제2항에 따른 의\n료인의 종별 임무의 구체적인 업무범위를 고시할 수 있다.\n부 칙\n이 법은 공포 후 3개월이 경과한 날부터 시행한다.\n\n\n\n\n신ㆍ구조문대비표\n현 행 개 정 안\n제2조(의료인) ①ㆍ② (생 략) 제2조(의료인) ①ㆍ② (현행과 같\n음)\n<신 설> ③ 보건복지부장관은 「보건의\n료인력지원법」 제8조의2에 따\n른 보건의료인력 업무조정위원\n회의 심의ㆍ의결을 거쳐 제2항\n에 따른 의료인의 종별 임무의\n구체적인 업무범위를 고시할\n수 있다.\n",
  "sections": {
    "제안이유": "및",
    "주요내용": "보건의료분야의 빠른 발전에도 불구하고, 낡은 현행 「의료법」 등\n보건의료 관련 법률로 인해 전문성을 갖춘 개별 의료인력들이 역량을\n펼치지 못하고 있는 것이 현실임.\n의료인력 간 업무 범위가 불분명하고, 이를 조정하고 협력할 수 있\n는 제도적 기반이 부재해 직역 간 업무가 중첩되는 영역을 중심으로\n의료인력의 갈등이 야기되고 있음.\n이에 의료인의 종별 임무에 대한 구체적인 업무범위는 보건의료직\n역들, 시민대표, 전문가가 참여하는 「보건의료인력 업무조정위원회」\n의 심의ㆍ의결을 거쳐 보건복지부 장관이 고시하도록 함으로써 의료\n직역 간 불필요한 갈등을 해소하고 국민건강증진에 기여하고자 함(안\n제2조제3항 신설).",
    "제안이유_및_주요내용": "보건의료분야의 빠른 발전에도 불구하고, 낡은 현행 「의료법」 등\n보건의료 관련 법률로 인해 전문성을 갖춘 개별 의료인력들이 역량을\n펼치지 못하고 있는 것이 현실임.\n의료인력 간 업무 범위가 불분명하고, 이를 조정하고 협력할 수 있\n는 제도적 기반이 부재해 직역 간 업무가 중첩되는 영역을 중심으로\n의료인력의 갈등이 야기되고 있음.\n이에 의료인의 종별 임무에 대한 구체적인 업무범위는 보건의료직\n역들, 시민대표, 전문가가 참여하는 「보건의료인력 업무조정위원회」\n의 심의ㆍ의결을 거쳐 보건복지부 장관이 고시하도록 함으로써 의료\n직역 간 불필요한 갈등을 해소하고 국민건강증진에 기여하고자 함(안\n제2조제3항 신설).",
    "법률_제_호": "의료법 일부개정법률안\n의료법 일부를 다음과 같이 개정한다.\n제2조에 제3항을 다음과 같이 신설한다.\n③ 보건복지부장관은 「보건의료인력지원법」 제8조의2에 따른 보\n건의료인력 업무조정위원회의 심의ㆍ의결을 거쳐 제2항에 따른 의\n료인의 종별 임무의 구체적인 업무범위를 고시할 수 있다.",
    "신구조문대비표": "현 행 개 정 안\n제2조(의료인) ①ㆍ② (생 략) 제2조(의료인) ①ㆍ② (현행과 같\n음)\n<신 설> ③ 보건복지부장관은 「보건의\n료인력지원법」 제8조의2에 따\n른 보건의료인력 업무조정위원\n회의 심의ㆍ의결을 거쳐 제2항\n에 따른 의료인의 종별 임무의\n구체적인 업무범위를 고시할\n수 있다."
  }
}