{
  "title": "2203662_검사정원법_일부개정법률안",
  "bill_number": "3662",
  "proposal_date": "2024. 9. 4.",
  "submission_date": "",
  "is_alternative": false,
  "alternative_bill_numbers": [],
  "has_comparison_table": false,
  "comparison_table": "신ㆍ구조문대비표\n현 행 개 정 안\n제1조(검사의 정원) 「검찰청 제1조(검사의 정원) ----------\n법」 제36조제1항에 따라 검사 ------------------------\n의 정원을 2,292명으로 한다. -------- 2,512명--------.",
  "full_text": "검사정원법 일부개정법률안\n(주진우의원 대표발의)\n발의연월일 : 2024. 9. 4.\n의 안\n3662\n번 호 발 의 자 : 주진우ㆍ엄태영ㆍ박준태\n우재준ㆍ김상훈ㆍ김승수\n김종양ㆍ이성권ㆍ곽규택\n김미애 의원(10인)\n제안이유 및 주요내용\n구술심리주의와 공판중심주의의 강화 및 형사사건의 고도화ㆍ복잡\n화로 검사의 업무 부담이 가중되고 있고, 검사의 범죄피해자 지원, 범\n죄수익 환수 및 인권보호 업무에 대한 중요성이 높아지고 있으며, 변\n화하는 형사사법 환경에 효과적으로 대응하고 사건의 신속한 처리와\n충실한 공판ㆍ송무업무 수행을 통하여 국민들에게 더 나은 형사사법\n서비스를 제공하기 위하여 검사 정원을 2,292명에서 2,512명으로 증원\n하되, 2025년부터 2029년까지 5년에 걸쳐 2025년에는 40명, 2026년에\n는 40명, 2027년에는 40명, 2028년에는 50명, 2029년에는 50명을 각각\n증원하려는 것임(안 제1조).\n\n\n\n\n법률 제 호\n검사정원법 일부개정법률안\n검사정원법 일부를 다음과 같이 개정한다.\n제1조 중 “2,292명”을 “2,512명”으로 한다.\n부 칙\n이 법은 공포한 날부터 시행한다. 다만, 이 법에 따라 증원되는 검사\n의 정원 220명 중 40명의 증원은 2025년 1월 1일부터 시행하고, 40명\n의 증원은 2026년 1월 1일부터 시행하며, 40명의 증원은 2027년 1월 1\n일부터 시행하고, 50명의 증원은 2028년 1월 1일부터 시행하며, 50명\n의 증원은 2029년 1월 1일부터 시행한다.\n\n\n\n\n신ㆍ구조문대비표\n현 행 개 정 안\n제1조(검사의 정원) 「검찰청 제1조(검사의 정원) ----------\n법」 제36조제1항에 따라 검사 ------------------------\n의 정원을 2,292명으로 한다. -------- 2,512명--------.\n",
  "sections": {
    "제안이유": "및",
    "주요내용": "구술심리주의와 공판중심주의의 강화 및 형사사건의 고도화ㆍ복잡\n화로 검사의 업무 부담이 가중되고 있고, 검사의 범죄피해자 지원, 범\n죄수익 환수 및 인권보호 업무에 대한 중요성이 높아지고 있으며, 변\n화하는 형사사법 환경에 효과적으로 대응하고 사건의 신속한 처리와\n충실한 공판ㆍ송무업무 수행을 통하여 국민들에게 더 나은 형사사법\n서비스를 제공하기 위하여 검사 정원을 2,292명에서 2,512명으로 증원\n하되, 2025년부터 2029년까지 5년에 걸쳐 2025년에는 40명, 2026년에\n는 40명, 2027년에는 40명, 2028년에는 50명, 2029년에는 50명을 각각\n증원하려는 것임(안 제1조).",
    "제안이유_및_주요내용": "구술심리주의와 공판중심주의의 강화 및 형사사건의 고도화ㆍ복잡\n화로 검사의 업무 부담이 가중되고 있고, 검사의 범죄피해자 지원, 범\n죄수익 환수 및 인권보호 업무에 대한 중요성이 높아지고 있으며, 변\n화하는 형사사법 환경에 효과적으로 대응하고 사건의 신속한 처리와\n충실한 공판ㆍ송무업무 수행을 통하여 국민들에게 더 나은 형사사법\n서비스를 제공하기 위하여 검사 정원을 2,292명에서 2,512명으로 증원\n하되, 2025년부터 2029년까지 5년에 걸쳐 2025년에는 40명, 2026년에\n는 40명, 2027년에는 40명, 2028년에는 50명, 2029년에는 50명을 각각\n증원하려는 것임(안 제1조).",
    "법률_제_호": "검사정원법 일부개정법률안\n검사정원법 일부를 다음과 같이 개정한다.\n제1조 중 “2,292명”을 “2,512명”으로 한다.",
    "신구조문대비표": "현 행 개 정 안\n제1조(검사의 정원) 「검찰청 제1조(검사의 정원) ----------\n법」 제36조제1항에 따라 검사 ------------------------\n의 정원을 2,292명으로 한다. -------- 2,512명--------."
  }
}