{
  "title": "2203589_국민투표법_일부개정법률안",
  "bill_number": "3589",
  "proposal_date": "2024. 9. 3",
  "submission_date": "",
  "is_alternative": false,
  "alternative_bill_numbers": [],
  "has_comparison_table": false,
  "comparison_table": "신ㆍ구조문대비표\n현 행 개 정 안\n第7條(投票權) 19세 이상의 國民 第7條(投票權) 「공직선거법」 제\n은 投票權이 있다. 15조제1항 각 호 외의 부분 본\n문에 따라 국회의원의 선거권\n이 있는 국민---------------.",
  "full_text": "국민투표법 일부개정법률안\n(윤후덕의원 대표발의)\n발의연월일 : 2024. 9. 3\n의 안\n3589\n번 호 발 의 자 : 윤후덕ㆍ이훈기ㆍ박주민\n김정호ㆍ임오경ㆍ최기상\n차지호ㆍ정준호ㆍ김주영\n홍기원ㆍ박 정 의원\n(11인)\n제안이유 및 주요내용\n현행법은 국민투표권자를 19세 이상의 국민으로 규정하고 있는데,\n헌법 제130조제2항은 헌법개정안을 국민투표에 붙여 ‘국회의원선거권\n자’ 과반수의 투표와 투표자 과반수의 찬성을 얻도록 하고 있어 국민\n투표권자와 국회의원선거권자를 일치시키고 있음.\n한편, 2020. 1. 14. 「공직선거법」이 개정되어 국회의원 선거를 비\n롯한 모든 공직선거의 선거권 연령이 19세에서 18세로 하향됨에 따라\n현행법의 국민투표권 조항은 헌법의 관련 규정과 체계가 맞지 않음.\n이에, 국민투표권자를 국회의원의 선거권이 있는 국민으로 변경함으\n로써 헌법과 체계정합성을 확보하려는 것임(안 제7조).\n\n\n\n\n법률 제 호\n국민투표법 일부개정법률안\n국민투표법 일부를 다음과 같이 개정한다.\n제7조 중 “19세 이상의 국민”을 “「공직선거법」 제15조제1항 각 호\n외의 부분 본문에 따라 국회의원의 선거권이 있는 국민”으로 한다.\n부 칙\n이 법은 공포한 날부터 시행한다.\n\n\n\n\n신ㆍ구조문대비표\n현 행 개 정 안\n第7條(投票權) 19세 이상의 國民 第7條(投票權) 「공직선거법」 제\n은 投票權이 있다. 15조제1항 각 호 외의 부분 본\n문에 따라 국회의원의 선거권\n이 있는 국민---------------.\n",
  "sections": {
    "제안이유": "및",
    "주요내용": "현행법은 국민투표권자를 19세 이상의 국민으로 규정하고 있는데,\n헌법 제130조제2항은 헌법개정안을 국민투표에 붙여 ‘국회의원선거권\n자’ 과반수의 투표와 투표자 과반수의 찬성을 얻도록 하고 있어 국민\n투표권자와 국회의원선거권자를 일치시키고 있음.\n한편, 2020. 1. 14. 「공직선거법」이 개정되어 국회의원 선거를 비\n롯한 모든 공직선거의 선거권 연령이 19세에서 18세로 하향됨에 따라\n현행법의 국민투표권 조항은 헌법의 관련 규정과 체계가 맞지 않음.\n이에, 국민투표권자를 국회의원의 선거권이 있는 국민으로 변경함으\n로써 헌법과 체계정합성을 확보하려는 것임(안 제7조).",
    "제안이유_및_주요내용": "현행법은 국민투표권자를 19세 이상의 국민으로 규정하고 있는데,\n헌법 제130조제2항은 헌법개정안을 국민투표에 붙여 ‘국회의원선거권\n자’ 과반수의 투표와 투표자 과반수의 찬성을 얻도록 하고 있어 국민\n투표권자와 국회의원선거권자를 일치시키고 있음.\n한편, 2020. 1. 14. 「공직선거법」이 개정되어 국회의원 선거를 비\n롯한 모든 공직선거의 선거권 연령이 19세에서 18세로 하향됨에 따라\n현행법의 국민투표권 조항은 헌법의 관련 규정과 체계가 맞지 않음.\n이에, 국민투표권자를 국회의원의 선거권이 있는 국민으로 변경함으\n로써 헌법과 체계정합성을 확보하려는 것임(안 제7조).",
    "법률_제_호": "국민투표법 일부개정법률안\n국민투표법 일부를 다음과 같이 개정한다.\n제7조 중 “19세 이상의 국민”을 “「공직선거법」 제15조제1항 각 호\n외의 부분 본문에 따라 국회의원의 선거권이 있는 국민”으로 한다.",
    "신구조문대비표": "현 행 개 정 안\n第7條(投票權) 19세 이상의 國民 第7條(投票權) 「공직선거법」 제\n은 投票權이 있다. 15조제1항 각 호 외의 부분 본\n문에 따라 국회의원의 선거권\n이 있는 국민---------------."
  }
}