{
  "title": "2203247_성폭력범죄의_처벌_등에_관한_특례법_일부개정법률안",
  "bill_number": "3247",
  "proposal_date": "2024. 8. 27.",
  "submission_date": "",
  "is_alternative": false,
  "alternative_bill_numbers": [],
  "has_comparison_table": false,
  "comparison_table": "신ㆍ구조문대비표\n현 행 개 정 안\n제14조의2(허위영상물 등의 반포 제14조의2(허위영상물 등의 반포\n등) ① ∼ ③ (생 략) 등) ① ∼ ③ (현행과 같음)\n<신 설> ④ 제1항 또는 제2항의 편집물\n등 또는 복제물을 소지ㆍ구입\nㆍ저장 또는 시청한 자는 2년\n이하의 징역 또는 2천만원 이\n하의 벌금에 처한다.\n④ (생 략) ⑤ (현행 제4항과 같음)",
  "full_text": "성폭력범죄의 처벌 등에 관한 특례법 일부개정법률안\n(한정애의원 대표발의)\n발의연월일 : 2024. 8. 27.\n의 안\n3247\n번 호 발 의 자 : 한정애ㆍ장철민ㆍ박희승\n조인철ㆍ송옥주ㆍ정성호\n추미애ㆍ윤후덕ㆍ진선미\n김준형ㆍ양문석 의원\n(10인)\n제안이유 및 주요내용\n현행법은 촬영물 또는 영상물등을 대상자의 의사에 반하여 성적 욕\n망 또는 수치심을 유발할 수 있는 형태로 편집ㆍ합성 또는 가공하거\n나 반포한 자, 편집등을 할 당시에는 대상자의 의사에 반하지 아니하\n더라도 사후에 대상자의 의사에 반하여 편집물등의 허위영상물을 반\n포한 자를 처벌하도록 하고 있음.\n그런데 카메라 등을 이용한 촬영물 또는 복제물의 경우 이를 반포\nㆍ판매ㆍ임대한 자를 처벌함과 동시에 이를 구입하거나 소지한 자 또\n한 처벌토록 한 것과 달리 허위영상물의 경우 이용한 자를 처벌하는\n규정이 없음.\n이 같은 상황에서 방송통신심의위원회는 작년 성적 허위 영상물에\n대해 총 7천187건의 시정 요구를 결정했으나, 올해에는 7월 말까지 전\n년 대비 약 90%에 달하는 총 6천 434건을 시정 요구로 결정하는 등\n\n\n\n‘딥페이크’ 성범죄는 사회적 문제로 대두되고 있음.\n실제로 최근 한 대학에서 여학생의 얼굴에 음란물을 합성한 딥페이\n크 영상물이 유포된 사건이 드러난 데 이어 비슷한 종류의 텔레그램\n대화방이 잇따라 발견되면서 파장이 일고 있음.\n피해자 중에는 대학생뿐 아니라 중ㆍ고교생 등 미성년자는 물론 교\n사, 여군 등도 포함된 것으로 알려졌고, SNS 등에 '피해 학교 명단'으\n로 떠돌고 있는 곳만 100곳이 넘어 ‘딥페이크’ 공포가 확산되고 있음.\n이에 허위영상물등을 소지ㆍ구입ㆍ저장 또는 시청한 자를 처벌하려\n는 것임(안 제14조의2제4항 신설).\n\n법률 제 호\n성폭력범죄의 처벌 등에 관한 특례법 일부개정법률안\n성폭력범죄의 처벌 등에 관한 특례법 일부를 다음과 같이 개정한다.\n제14조의2제4항을 제5항으로 하고, 같은 조에 제4항을 다음과 같이 신\n설한다.\n④ 제1항 또는 제2항의 편집물등 또는 복제물을 소지ㆍ구입ㆍ저장\n또는 시청한 자는 2년 이하의 징역 또는 2천만원 이하의 벌금에 처\n한다.\n부 칙\n이 법은 공포 후 6개월이 경과한 날부터 시행한다.\n\n\n\n\n신ㆍ구조문대비표\n현 행 개 정 안\n제14조의2(허위영상물 등의 반포 제14조의2(허위영상물 등의 반포\n등) ① ∼ ③ (생 략) 등) ① ∼ ③ (현행과 같음)\n<신 설> ④ 제1항 또는 제2항의 편집물\n등 또는 복제물을 소지ㆍ구입\nㆍ저장 또는 시청한 자는 2년\n이하의 징역 또는 2천만원 이\n하의 벌금에 처한다.\n④ (생 략) ⑤ (현행 제4항과 같음)\n",
  "sections": {
    "제안이유": "및",
    "주요내용": "현행법은 촬영물 또는 영상물등을 대상자의 의사에 반하여 성적 욕\n망 또는 수치심을 유발할 수 있는 형태로 편집ㆍ합성 또는 가공하거\n나 반포한 자, 편집등을 할 당시에는 대상자의 의사에 반하지 아니하\n더라도 사후에 대상자의 의사에 반하여 편집물등의 허위영상물을 반\n포한 자를 처벌하도록 하고 있음.\n그런데 카메라 등을 이용한 촬영물 또는 복제물의 경우 이를 반포\nㆍ판매ㆍ임대한 자를 처벌함과 동시에 이를 구입하거나 소지한 자 또\n한 처벌토록 한 것과 달리 허위영상물의 경우 이용한 자를 처벌하는\n규정이 없음.\n이 같은 상황에서 방송통신심의위원회는 작년 성적 허위 영상물에\n대해 총 7천187건의 시정 요구를 결정했으나, 올해에는 7월 말까지 전\n년 대비 약 90%에 달하는 총 6천 434건을 시정 요구로 결정하는 등\n\n\n\n‘딥페이크’ 성범죄는 사회적 문제로 대두되고 있음.\n실제로 최근 한 대학에서 여학생의 얼굴에 음란물을 합성한 딥페이\n크 영상물이 유포된 사건이 드러난 데 이어 비슷한 종류의 텔레그램\n대화방이 잇따라 발견되면서 파장이 일고 있음.\n피해자 중에는 대학생뿐 아니라 중ㆍ고교생 등 미성년자는 물론 교\n사, 여군 등도 포함된 것으로 알려졌고, SNS 등에 '피해 학교 명단'으\n로 떠돌고 있는 곳만 100곳이 넘어 ‘딥페이크’ 공포가 확산되고 있음.\n이에 허위영상물등을 소지ㆍ구입ㆍ저장 또는 시청한 자를 처벌하려\n는 것임(안 제14조의2제4항 신설).",
    "제안이유_및_주요내용": "현행법은 촬영물 또는 영상물등을 대상자의 의사에 반하여 성적 욕\n망 또는 수치심을 유발할 수 있는 형태로 편집ㆍ합성 또는 가공하거\n나 반포한 자, 편집등을 할 당시에는 대상자의 의사에 반하지 아니하\n더라도 사후에 대상자의 의사에 반하여 편집물등의 허위영상물을 반\n포한 자를 처벌하도록 하고 있음.\n그런데 카메라 등을 이용한 촬영물 또는 복제물의 경우 이를 반포\nㆍ판매ㆍ임대한 자를 처벌함과 동시에 이를 구입하거나 소지한 자 또\n한 처벌토록 한 것과 달리 허위영상물의 경우 이용한 자를 처벌하는\n규정이 없음.\n이 같은 상황에서 방송통신심의위원회는 작년 성적 허위 영상물에\n대해 총 7천187건의 시정 요구를 결정했으나, 올해에는 7월 말까지 전\n년 대비 약 90%에 달하는 총 6천 434건을 시정 요구로 결정하는 등\n\n\n\n‘딥페이크’ 성범죄는 사회적 문제로 대두되고 있음.\n실제로 최근 한 대학에서 여학생의 얼굴에 음란물을 합성한 딥페이\n크 영상물이 유포된 사건이 드러난 데 이어 비슷한 종류의 텔레그램\n대화방이 잇따라 발견되면서 파장이 일고 있음.\n피해자 중에는 대학생뿐 아니라 중ㆍ고교생 등 미성년자는 물론 교\n사, 여군 등도 포함된 것으로 알려졌고, SNS 등에 '피해 학교 명단'으\n로 떠돌고 있는 곳만 100곳이 넘어 ‘딥페이크’ 공포가 확산되고 있음.\n이에 허위영상물등을 소지ㆍ구입ㆍ저장 또는 시청한 자를 처벌하려\n는 것임(안 제14조의2제4항 신설).",
    "법률_제_호": "성폭력범죄의 처벌 등에 관한 특례법 일부개정법률안\n성폭력범죄의 처벌 등에 관한 특례법 일부를 다음과 같이 개정한다.\n제14조의2제4항을 제5항으로 하고, 같은 조에 제4항을 다음과 같이 신\n설한다.\n④ 제1항 또는 제2항의 편집물등 또는 복제물을 소지ㆍ구입ㆍ저장\n또는 시청한 자는 2년 이하의 징역 또는 2천만원 이하의 벌금에 처\n한다.",
    "신구조문대비표": "현 행 개 정 안\n제14조의2(허위영상물 등의 반포 제14조의2(허위영상물 등의 반포\n등) ① ∼ ③ (생 략) 등) ① ∼ ③ (현행과 같음)\n<신 설> ④ 제1항 또는 제2항의 편집물\n등 또는 복제물을 소지ㆍ구입\nㆍ저장 또는 시청한 자는 2년\n이하의 징역 또는 2천만원 이\n하의 벌금에 처한다.\n④ (생 략) ⑤ (현행 제4항과 같음)"
  }
}