{
  "title": "2203437_상속세_및_증여세법_일부개정법률안",
  "bill_number": "3437",
  "proposal_date": "2024. 8. 30.",
  "submission_date": "",
  "is_alternative": false,
  "alternative_bill_numbers": [],
  "has_comparison_table": false,
  "comparison_table": "신·구조문대비표\n현 행 개 정 안\n제23조의2(동거주택 상속공제) ① 제23조의2(동거주택 상속공제) ①\n∼ ③ (생 략) ∼ ③ (현행과 같음)\n<신 설> ④ 제1항에도 불구하고 상속개\n시일 당시 피상속인과 동거한\n배우자가 1세대 1주택을 단독\n으로 상속받는 경우에는 상속\n주택가액의 100분의 100에 상\n당하는 금액을 상속세 과세가\n액에서 공제한다.",
  "full_text": "상속세 및 증여세법 일부개정법률안\n(박수민의원 대표발의)\n발의연월일 : 2024. 8. 30.\n의 안\n3437\n번 호 발 의 자 : 박수민ㆍ김선교ㆍ박성민\n이헌승ㆍ서지영ㆍ김소희\n임종득ㆍ이인선ㆍ김미애\n김민전 의원(10인)\n제안이유 및 주요내용\n현행법은 피상속인의 직계비속 및 직계비속의 배우자가 피상속인과\n상속개시일부터 소급하여 10년 이상 계속하여 1세대를 구성하면서 1\n세대 1주택에서 동거하는 경우 해당 상속주택의 가액을 상속세 과세\n가액에서 공제하는 동거주택 상속공제 제도를 규정하고 있으나 피상\n속인의 배우자는 상속대상에서 제외되어 있음.\n그러나 배우자 상속은 세대 간의 부의 이전에 해당하지 아니하고\n생존 배우자의 생활 안정을 도모하기 위해 상속세의 배우자공제를 확\n대하여 상속세 부담을 완화할 필요가 있음.\n이에 직계비속과 직계비속의 배우자에게만 적용되는 동거주택 상속\n공제 제도에 배우자를 포함시키고, 동거 배우자가 1세대 1주택을 단독\n으로 상속받는 경우에는 상속주택가액 전액을 상속세 과세가액에서\n공제하려는 것임(안 제23조의2제4항 신설).\n\n\n\n\n법률 제 호\n상속세 및 증여세법 일부개정법률안\n상속세 및 증여세법 일부를 다음과 같이 개정한다.\n제23조의2에 제4항을 다음과 같이 신설한다.\n④ 제1항에도 불구하고 상속개시일 당시 피상속인과 동거한 배우자\n가 1세대 1주택을 단독으로 상속받는 경우에는 상속주택가액의 100\n분의 100에 상당하는 금액을 상속세 과세가액에서 공제한다.\n부 칙\n제1조(시행일) 이 법은 2025년 1월 1일부터 시행한다.\n제2조(동거주택 상속공제 대상에 관한 적용례) 제23조의2제4항의 개정\n규정은 이 법 시행 전에 상속이 개시되어 이 법 시행 이후에 상속\n세의 과세표준과 세액을 결정 또는 경정하는 경우에도 적용한다.\n\n\n\n\n신·구조문대비표\n현 행 개 정 안\n제23조의2(동거주택 상속공제) ① 제23조의2(동거주택 상속공제) ①\n∼ ③ (생 략) ∼ ③ (현행과 같음)\n<신 설> ④ 제1항에도 불구하고 상속개\n시일 당시 피상속인과 동거한\n배우자가 1세대 1주택을 단독\n으로 상속받는 경우에는 상속\n주택가액의 100분의 100에 상\n당하는 금액을 상속세 과세가\n액에서 공제한다.\n",
  "sections": {
    "제안이유": "및",
    "주요내용": "현행법은 피상속인의 직계비속 및 직계비속의 배우자가 피상속인과\n상속개시일부터 소급하여 10년 이상 계속하여 1세대를 구성하면서 1\n세대 1주택에서 동거하는 경우 해당 상속주택의 가액을 상속세 과세\n가액에서 공제하는 동거주택 상속공제 제도를 규정하고 있으나 피상\n속인의 배우자는 상속대상에서 제외되어 있음.\n그러나 배우자 상속은 세대 간의 부의 이전에 해당하지 아니하고\n생존 배우자의 생활 안정을 도모하기 위해 상속세의 배우자공제를 확\n대하여 상속세 부담을 완화할 필요가 있음.\n이에 직계비속과 직계비속의 배우자에게만 적용되는 동거주택 상속\n공제 제도에 배우자를 포함시키고, 동거 배우자가 1세대 1주택을 단독\n으로 상속받는 경우에는 상속주택가액 전액을 상속세 과세가액에서\n공제하려는 것임(안 제23조의2제4항 신설).",
    "제안이유_및_주요내용": "현행법은 피상속인의 직계비속 및 직계비속의 배우자가 피상속인과\n상속개시일부터 소급하여 10년 이상 계속하여 1세대를 구성하면서 1\n세대 1주택에서 동거하는 경우 해당 상속주택의 가액을 상속세 과세\n가액에서 공제하는 동거주택 상속공제 제도를 규정하고 있으나 피상\n속인의 배우자는 상속대상에서 제외되어 있음.\n그러나 배우자 상속은 세대 간의 부의 이전에 해당하지 아니하고\n생존 배우자의 생활 안정을 도모하기 위해 상속세의 배우자공제를 확\n대하여 상속세 부담을 완화할 필요가 있음.\n이에 직계비속과 직계비속의 배우자에게만 적용되는 동거주택 상속\n공제 제도에 배우자를 포함시키고, 동거 배우자가 1세대 1주택을 단독\n으로 상속받는 경우에는 상속주택가액 전액을 상속세 과세가액에서\n공제하려는 것임(안 제23조의2제4항 신설).",
    "법률_제_호": "상속세 및 증여세법 일부개정법률안\n상속세 및 증여세법 일부를 다음과 같이 개정한다.\n제23조의2에 제4항을 다음과 같이 신설한다.\n④ 제1항에도 불구하고 상속개시일 당시 피상속인과 동거한 배우자\n가 1세대 1주택을 단독으로 상속받는 경우에는 상속주택가액의 100\n분의 100에 상당하는 금액을 상속세 과세가액에서 공제한다.",
    "신구조문대비표": "현 행 개 정 안\n제23조의2(동거주택 상속공제) ① 제23조의2(동거주택 상속공제) ①\n∼ ③ (생 략) ∼ ③ (현행과 같음)\n<신 설> ④ 제1항에도 불구하고 상속개\n시일 당시 피상속인과 동거한\n배우자가 1세대 1주택을 단독\n으로 상속받는 경우에는 상속\n주택가액의 100분의 100에 상\n당하는 금액을 상속세 과세가\n액에서 공제한다."
  }
}