{
  "title": "2203482_후천성면역결핍증_예방법_일부개정법률안",
  "bill_number": "3482",
  "proposal_date": "2024. 9. 2.",
  "submission_date": "",
  "is_alternative": false,
  "alternative_bill_numbers": [],
  "has_comparison_table": false,
  "comparison_table": "신ㆍ구조문대비표\n현 행 개 정 안\n제3조(국가·지방자치단체 및 국민 제3조(국가·지방자치단체 및 국민\n의 의무) ① ∼ ⑤ (생 략) 의 의무) ① ∼ ⑤ (현행과 같\n음)\n<신 설> ⑥ 「의료법」에 따른 의료인\n또는 의료기관 개설자는 정당\n한 사유 없이 감염인에 대하여\n진료를 거부하거나 차별적 대\n우를 하여서는 아니 된다.",
  "full_text": "후천성면역결핍증 예방법 일부개정법률안\n(이정문의원 대표발의)\n발의연월일 : 2024. 9. 2.\n의 안\n3482\n번 호 발 의 자 : 이정문ㆍ이기헌ㆍ황명선\n이학영ㆍ홍기원ㆍ임광현\n문금주ㆍ김영배ㆍ조승래\n윤건영 의원(10인)\n제안이유 및 주요내용\nHIV(인간면역결핍바이러스)는 전 세계적인 노력과 의료기술의 발전\n으로 현재는 관리 가능한 질환으로 전환하였음. 그러나 여전히 HIV에\n대한 부정적인 인식으로 인해 의료기관에서의 진료거부 및 차별적 진\n료가 존재하고 있으며 이에 대하여 국가인권위원회는 감염인에 대한\n치료 또는 입원 거부 등 의료차별을 개선하고 치료받을 권리를 보장\n하기 위하여 의료차별 금지 규정 법제화를 권고한 바 있음.\n이에 의료인 또는 의료기관 개설자가 정당한 사유 없이 HIV 감염\n인에 대하여 진료를 거부하거나 차별적 대우를 하지 않도록 의무를\n명시함으로써 감염인에 대한 차별금지를 규정하려는 것임(안 제3조제6\n항 신설).\n\n\n\n\n법률 제 호\n후천성면역결핍증 예방법 일부개정법률안\n후천성면역결핍증 예방법 일부를 다음과 같이 개정한다.\n제3조에 제6항을 다음과 같이 신설한다.\n⑥ 「의료법」에 따른 의료인 또는 의료기관 개설자는 정당한 사유\n없이 감염인에 대하여 진료를 거부하거나 차별적 대우를 하여서는\n아니 된다.\n부 칙\n이 법은 공포한 날부터 시행한다.\n\n\n\n\n신ㆍ구조문대비표\n현 행 개 정 안\n제3조(국가·지방자치단체 및 국민 제3조(국가·지방자치단체 및 국민\n의 의무) ① ∼ ⑤ (생 략) 의 의무) ① ∼ ⑤ (현행과 같\n음)\n<신 설> ⑥ 「의료법」에 따른 의료인\n또는 의료기관 개설자는 정당\n한 사유 없이 감염인에 대하여\n진료를 거부하거나 차별적 대\n우를 하여서는 아니 된다.\n",
  "sections": {
    "제안이유": "및",
    "주요내용": "HIV(인간면역결핍바이러스)는 전 세계적인 노력과 의료기술의 발전\n으로 현재는 관리 가능한 질환으로 전환하였음. 그러나 여전히 HIV에\n대한 부정적인 인식으로 인해 의료기관에서의 진료거부 및 차별적 진\n료가 존재하고 있으며 이에 대하여 국가인권위원회는 감염인에 대한\n치료 또는 입원 거부 등 의료차별을 개선하고 치료받을 권리를 보장\n하기 위하여 의료차별 금지 규정 법제화를 권고한 바 있음.\n이에 의료인 또는 의료기관 개설자가 정당한 사유 없이 HIV 감염\n인에 대하여 진료를 거부하거나 차별적 대우를 하지 않도록 의무를\n명시함으로써 감염인에 대한 차별금지를 규정하려는 것임(안 제3조제6\n항 신설).",
    "제안이유_및_주요내용": "HIV(인간면역결핍바이러스)는 전 세계적인 노력과 의료기술의 발전\n으로 현재는 관리 가능한 질환으로 전환하였음. 그러나 여전히 HIV에\n대한 부정적인 인식으로 인해 의료기관에서의 진료거부 및 차별적 진\n료가 존재하고 있으며 이에 대하여 국가인권위원회는 감염인에 대한\n치료 또는 입원 거부 등 의료차별을 개선하고 치료받을 권리를 보장\n하기 위하여 의료차별 금지 규정 법제화를 권고한 바 있음.\n이에 의료인 또는 의료기관 개설자가 정당한 사유 없이 HIV 감염\n인에 대하여 진료를 거부하거나 차별적 대우를 하지 않도록 의무를\n명시함으로써 감염인에 대한 차별금지를 규정하려는 것임(안 제3조제6\n항 신설).",
    "법률_제_호": "후천성면역결핍증 예방법 일부개정법률안\n후천성면역결핍증 예방법 일부를 다음과 같이 개정한다.\n제3조에 제6항을 다음과 같이 신설한다.\n⑥ 「의료법」에 따른 의료인 또는 의료기관 개설자는 정당한 사유\n없이 감염인에 대하여 진료를 거부하거나 차별적 대우를 하여서는\n아니 된다.",
    "신구조문대비표": "현 행 개 정 안\n제3조(국가·지방자치단체 및 국민 제3조(국가·지방자치단체 및 국민\n의 의무) ① ∼ ⑤ (생 략) 의 의무) ① ∼ ⑤ (현행과 같\n음)\n<신 설> ⑥ 「의료법」에 따른 의료인\n또는 의료기관 개설자는 정당\n한 사유 없이 감염인에 대하여\n진료를 거부하거나 차별적 대\n우를 하여서는 아니 된다."
  }
}