{
  "title": "2203117_한국산업은행법_일부개정법률안",
  "bill_number": "3117",
  "proposal_date": "2024. 8. 23.",
  "submission_date": "",
  "is_alternative": false,
  "alternative_bill_numbers": [],
  "has_comparison_table": false,
  "comparison_table": "신ㆍ구조문대비표\n현 행 개 정 안\n법률 제17253호 한국산업은행 법률 제17253호 한국산업은행\n법 일부개정법률 ",
  "full_text": "한국산업은행법 일부개정법률안\n(이헌승의원 대표발의)\n발의연월일 : 2024. 8. 23.\n의 안\n3117\n번 호 발 의 자 : 이헌승ㆍ김소희ㆍ송석준\n박준태ㆍ김선교ㆍ박덕흠\n조경태ㆍ박성훈ㆍ박성민\n윤상현ㆍ백종헌ㆍ김상훈\n정연욱ㆍ유용원 의원\n(14인)\n제안이유 및 주요내용\n정부는 코로나19로 일시적 경영상 어려움에 직면한 기간산업을 보\n호하기 위해 기간산업안정기금을 한국산업은행법에 규정하여 운용하\n고 있음.\n그런데 기간산업안정기금의 지원실적이 2022년 이후 전무한 상황에\n서 운용 기한이 2025년 12월 31일 도래 예정이나, 기금의 운용 종료\n후 잔여 자산 처리에 관한 규정이 없는 실정임.\n이에 따라 기금의 잔여 자산 처리를 명확히 규정하여 기금의 청산\n이 원활히 이루어지게 하고자 부칙을 개정하고자 함(안 부칙 제2조제2\n항 및 제3항 신설).\n\n\n\n\n법률 제 호\n한국산업은행법 일부개정법률안\n한국산업은행법 일부를 다음과 같이 개정한다.\n법률 제17253호 한국산업은행법 일부개정법률 부칙 제2조의 제목 중\n“운용 기간”을 “운용 기간 등”으로 하고, 같은 조 제목 외의 부분을\n제1항으로 하며, 같은 조에 제2항 및 제3항을 각각 다음과 같이 신설\n한다.\n② 제1항에 따른 기간산업안정기금 운용 기간 종료 후 기간산업안\n정기금 운용에 관한 권리ㆍ의무는 국가가 승계하며, 한국산업은행은\n운용 종료 후 3개월 이내에 기간산업안정기금의 잔여재산을 국고에\n귀속시켜야 한다.\n③ 제2항에 따른 기간산업안정기금 정리에 관한 구체적인 처리 기\n준, 시기, 절차, 방법 및 그 밖에 필요한 사항은 대통령령으로 정한\n다.\n부 칙\n이 법은 공포한 날부터 시행한다.\n\n\n\n\n신ㆍ구조문대비표\n현 행 개 정 안\n법률 제17253호 한국산업은행 법률 제17253호 한국산업은행\n법 일부개정법률 부칙 법 일부개정법률 부칙\n제2조(기간산업안정기금의 운용 제2조(기간산업안정기금의 운용\n기간) (생 략) 기간 등) ① (현행 제목 외의\n부분과 같음)\n<신 설> ② 제1항에 따른 기간산업안정\n기금 운용 기간 종료 후 기간\n산업안정기금 운용에 관한 권\n리ㆍ의무는 국가가 승계하며,\n한국산업은행은 운용 종료 후\n3개월 이내에 기간산업안정기\n금의 잔여재산을 국고에 귀속\n시켜야 한다.\n<신 설> ③ 제2항에 따른 기간산업안정\n기금 정리에 관한 구체적인 처\n리 기준, 시기, 절차, 방법 및\n그 밖에 필요한 사항은 대통령\n령으로 정한다.\n",
  "sections": {
    "제안이유": "및",
    "주요내용": "정부는 코로나19로 일시적 경영상 어려움에 직면한 기간산업을 보\n호하기 위해 기간산업안정기금을 한국산업은행법에 규정하여 운용하\n고 있음.\n그런데 기간산업안정기금의 지원실적이 2022년 이후 전무한 상황에\n서 운용 기한이 2025년 12월 31일 도래 예정이나, 기금의 운용 종료\n후 잔여 자산 처리에 관한 규정이 없는 실정임.\n이에 따라 기금의 잔여 자산 처리를 명확히 규정하여 기금의 청산\n이 원활히 이루어지게 하고자 부칙을 개정하고자 함(안 부칙 제2조제2\n항 및 제3항 신설).",
    "제안이유_및_주요내용": "정부는 코로나19로 일시적 경영상 어려움에 직면한 기간산업을 보\n호하기 위해 기간산업안정기금을 한국산업은행법에 규정하여 운용하\n고 있음.\n그런데 기간산업안정기금의 지원실적이 2022년 이후 전무한 상황에\n서 운용 기한이 2025년 12월 31일 도래 예정이나, 기금의 운용 종료\n후 잔여 자산 처리에 관한 규정이 없는 실정임.\n이에 따라 기금의 잔여 자산 처리를 명확히 규정하여 기금의 청산\n이 원활히 이루어지게 하고자 부칙을 개정하고자 함(안 부칙 제2조제2\n항 및 제3항 신설).",
    "법률_제_호": "한국산업은행법 일부개정법률안\n한국산업은행법 일부를 다음과 같이 개정한다.\n법률 제17253호 한국산업은행법 일부개정법률",
    "신구조문대비표": "현 행 개 정 안\n법률 제17253호 한국산업은행 법률 제17253호 한국산업은행\n법 일부개정법률"
  }
}