{
  "title": "2203560_국경일에_관한_법률_일부개정법률안",
  "bill_number": "3560",
  "proposal_date": "2024. 9. 3.",
  "submission_date": "",
  "is_alternative": false,
  "alternative_bill_numbers": [],
  "has_comparison_table": false,
  "comparison_table": "신·구조문대비표\n현 행 개 정 안\n제2조(국경일의 종류) 국경일은 제2조(국경일의 종류) ----------\n다음 각 호와 같다. ----------------.\n1. (생 략) 1. (현행과 같음)\n<신 설> 2. 대한민국 임시정부 수립일:\n4월 11일\n2. ∼ 5. (생 략) 3. ∼ 6. (현행 제2호부터 제5\n호까지와 같음)",
  "full_text": "국경일에 관한 법률 일부개정법률안\n(추미애의원 대표발의)\n발의연월일 : 2024. 9. 3.\n의 안\n3560\n번 호 발 의 자 : 추미애ㆍ송재봉ㆍ이수진\n이병진ㆍ송옥주ㆍ박희승\n강득구ㆍ이해식ㆍ한정애\n전용기ㆍ오세희ㆍ정춘생\n황 희ㆍ허 영ㆍ정성호\n김용민ㆍ박용갑ㆍ황정아\n김 현ㆍ김용만ㆍ정을호\n채현일ㆍ강준현ㆍ민형배\n임미애ㆍ박해철ㆍ조인철\n황명선ㆍ이광희ㆍ김영환\n이성윤ㆍ박홍근 의원\n(32인)\n제안이유 및 주요내용\n「대한민국헌법」 전문은 우리 대한국민은 3ㆍ1운동으로 건립된 대\n한민국 임시정부의 법통(法統)을 계승한다고 명시하여, 대한민국 임시\n정부의 수립이 대한민국의 근간임을 분명히 하고 있음.\n대한민국 임시정부는 국권 회복을 위하여 국호를 ‘대한민국’으로 정\n하고 1919년 4월 11일 수립한 최초의 민주공화제 정부임.\n하지만, 친일 세력은 일제 강점기 동안의 친일 행위를 정당화하거나\n\n\n\n미화하기 위해 역사적 진실을 왜곡하여 임시정부의 상징성을 지우려\n하고 있음.\n이는 대한민국의 국가 정체성을 근본적으로 훼손하는 행위임.\n왜곡된 친일 행위를 비판하고, 올바른 역사 인식을 확립하는 것은\n대한민국의 미래를 위해 중요한 과제임.\n이에 대한민국 임시정부 수립일인 4월 11일을 국경일과 공휴일로\n규정함으로써 대한민국 임시정부의 역사적 의의를 길이 보전하고자\n함(안 제2조제2호 신설).\n\n법률 제 호\n국경일에 관한 법률 일부개정법률안\n국경일에 관한 법률 일부를 다음과 같이 개정한다.\n제2조제2호부터 제5호까지를 각각 제3호부터 제6호까지로 하고, 같은\n조에 제2호를 다음과 같이 신설한다.\n2. 대한민국 임시정부 수립일: 4월 11일\n부 칙\n이 법은 공포한 날부터 시행한다.\n\n\n\n\n신·구조문대비표\n현 행 개 정 안\n제2조(국경일의 종류) 국경일은 제2조(국경일의 종류) ----------\n다음 각 호와 같다. ----------------.\n1. (생 략) 1. (현행과 같음)\n<신 설> 2. 대한민국 임시정부 수립일:\n4월 11일\n2. ∼ 5. (생 략) 3. ∼ 6. (현행 제2호부터 제5\n호까지와 같음)\n",
  "sections": {
    "제안이유": "및",
    "주요내용": "「대한민국헌법」 전문은 우리 대한국민은 3ㆍ1운동으로 건립된 대\n한민국 임시정부의 법통(法統)을 계승한다고 명시하여, 대한민국 임시\n정부의 수립이 대한민국의 근간임을 분명히 하고 있음.\n대한민국 임시정부는 국권 회복을 위하여 국호를 ‘대한민국’으로 정\n하고 1919년 4월 11일 수립한 최초의 민주공화제 정부임.\n하지만, 친일 세력은 일제 강점기 동안의 친일 행위를 정당화하거나\n\n\n\n미화하기 위해 역사적 진실을 왜곡하여 임시정부의 상징성을 지우려\n하고 있음.\n이는 대한민국의 국가 정체성을 근본적으로 훼손하는 행위임.\n왜곡된 친일 행위를 비판하고, 올바른 역사 인식을 확립하는 것은\n대한민국의 미래를 위해 중요한 과제임.\n이에 대한민국 임시정부 수립일인 4월 11일을 국경일과 공휴일로\n규정함으로써 대한민국 임시정부의 역사적 의의를 길이 보전하고자\n함(안 제2조제2호 신설).",
    "제안이유_및_주요내용": "「대한민국헌법」 전문은 우리 대한국민은 3ㆍ1운동으로 건립된 대\n한민국 임시정부의 법통(法統)을 계승한다고 명시하여, 대한민국 임시\n정부의 수립이 대한민국의 근간임을 분명히 하고 있음.\n대한민국 임시정부는 국권 회복을 위하여 국호를 ‘대한민국’으로 정\n하고 1919년 4월 11일 수립한 최초의 민주공화제 정부임.\n하지만, 친일 세력은 일제 강점기 동안의 친일 행위를 정당화하거나\n\n\n\n미화하기 위해 역사적 진실을 왜곡하여 임시정부의 상징성을 지우려\n하고 있음.\n이는 대한민국의 국가 정체성을 근본적으로 훼손하는 행위임.\n왜곡된 친일 행위를 비판하고, 올바른 역사 인식을 확립하는 것은\n대한민국의 미래를 위해 중요한 과제임.\n이에 대한민국 임시정부 수립일인 4월 11일을 국경일과 공휴일로\n규정함으로써 대한민국 임시정부의 역사적 의의를 길이 보전하고자\n함(안 제2조제2호 신설).",
    "법률_제_호": "국경일에 관한 법률 일부개정법률안\n국경일에 관한 법률 일부를 다음과 같이 개정한다.\n제2조제2호부터 제5호까지를 각각 제3호부터 제6호까지로 하고, 같은\n조에 제2호를 다음과 같이 신설한다.\n2. 대한민국 임시정부 수립일: 4월 11일",
    "신구조문대비표": "현 행 개 정 안\n제2조(국경일의 종류) 국경일은 제2조(국경일의 종류) ----------\n다음 각 호와 같다. ----------------.\n1. (생 략) 1. (현행과 같음)\n<신 설> 2. 대한민국 임시정부 수립일:\n4월 11일\n2. ∼ 5. (생 략) 3. ∼ 6. (현행 제2호부터 제5\n호까지와 같음)"
  }
}