{
  "title": "2203789_한국산업은행법_일부개정법률안",
  "bill_number": "3789",
  "proposal_date": "2024. 9. 9.",
  "submission_date": "",
  "is_alternative": false,
  "alternative_bill_numbers": [],
  "has_comparison_table": false,
  "comparison_table": "신ㆍ구조문대비표\n현 행 개 정 안\n법률 제17253호 한국산업은행 법률 제17253호 한국산업은행\n법 일부개정법률 ",
  "full_text": "한국산업은행법 일부개정법률안\n(유동수의원 대표발의)\n발의연월일 : 2024. 9. 9.\n의 안\n3789\n번 호 발 의 자 : 유동수ㆍ강선우ㆍ김태선\n박 정ㆍ강준현ㆍ이강일\n이정문ㆍ최민희ㆍ임광현\n김교흥ㆍ문대림ㆍ윤준병\n의원(12인)\n제안이유 및 주요내용\n기간산업안정기금은 코로나19 확산으로 인한 경제적 충격을 극복하\n고 주요 기간산업의 고용유지를 위하여 2020년 설치되었음. 동 기금은\n대한민국의 경제 안정과 일자리 보호에 중요한 역할을 수행하여 왔으\n나, 현행법에 따른 기금의 운용기간은 2025년 12월 31일에 종료될 예\n정임.\n이에 기금의 운용 종료에 대비하고 기금 자산의 효율적 정리와 관\n련된 절차를 명확히 하기 위한 규정을 마련하여 투명성과 법적 안정\n성을 확보하려는 것임(안 법률 제17253호 한국산업은행법 일부개정법\n률 부칙 제2항 및 제3항 신설 등).\n\n\n\n\n법률 제 호\n한국산업은행법 일부개정법률안\n한국산업은행법 일부를 다음과 같이 개정한다.\n법률 제17253호 한국산업은행법 일부개정법률 부칙 제2조의 제목 중\n“운용 기간”을 “운용 기간 등”으로 하고, 같은 조 제목 외의 부분을\n제1항으로 하며, 같은 조 제1항(종전의 제목 외의 부분) 중 “기간산업\n안정기금”을 “기간산업안정기금(이하 이 조에서 “기금”이라 한다)”으\n로, “같은 개정규정에 따른 기간산업안정기금”을 “기금”으로 하며, 같\n은 조에 제2항 및 제3항을 각각 다음과 같이 신설한다.\n② 한국산업은행은 제1항에 따른 기금의 운용기간이 종료되는 날까\n지 기간산업안정기금채권 및 차입금의 원리금 상환 등을 완료하여\n야 하며, 운용기간 종료 후 3개월 이내에 잔여재산을 국고에 귀속시\n켜야 한다. 다만, 금융위원회가 기금의 자산과 부채를 실사한 결과\n운용기간 종료일에 잔여재산이 있을 것이 확실하고 그 금액을 추정\n할 수 있는 경우에는 추정된 잔여재산의 일부를 운용기간 종료 전\n에 국고에 귀속시킬 수 있다.\n③ 제2항에 따른 기금 정리에 관한 구체적인 처리 기준ㆍ시기ㆍ절\n차 및 방법, 그 밖에 필요한 사항은 대통령령으로 정한다.\n\n\n\n부 칙\n이 법은 공포한 날부터 시행한다.\n\n신ㆍ구조문대비표\n현 행 개 정 안\n법률 제17253호 한국산업은행 법률 제17253호 한국산업은행\n법 일부개정법률 부칙 법 일부개정법률 부칙\n제2조(기간산업안정기금의 운용 제2조(기간산업안정기금의 운용\n기간) 제29조의2의 개정규정에 기간 등) ① ----------------\n따른 기간산업안정기금의 운용 ------------기간산업안정기금\n은 이 법 시행 후 같은 개정규 (이하 이 조에서 “기금”이라 한\n정에 따른 기간산업안정기금이 다)------------------------\n재원을 조성한 날부터 2025년 기금------------------------\n12월 31일까지 할 수 있다. ----------------------------\n---.\n<신 설> ② 한국산업은행은 제1항에 따\n른 기금의 운용기간이 종료되\n는 날까지 기간산업안정기금채\n권 및 차입금의 원리금 상환\n등을 완료하여야 하며, 운용기\n간 종료 후 3개월 이내에 잔여\n재산을 국고에 귀속시켜야 한\n다. 다만, 금융위원회가 기금의\n자산과 부채를 실사한 결과 운\n용기간 종료일에 잔여재산이\n있을 것이 확실하고 그 금액을\n추정할 수 있는 경우에는 추정\n된 잔여재산의 일부를 운용기\n\n\n\n간 종료 전에 국고에 귀속시킬\n수 있다.\n<신 설> ③ 제2항에 따른 기금 정리에\n관한 구체적인 처리 기준ㆍ시\n기ㆍ절차 및 방법, 그 밖에 필\n요한 사항은 대통령령으로 정\n한다.",
  "sections": {
    "제안이유": "및",
    "주요내용": "기간산업안정기금은 코로나19 확산으로 인한 경제적 충격을 극복하\n고 주요 기간산업의 고용유지를 위하여 2020년 설치되었음. 동 기금은\n대한민국의 경제 안정과 일자리 보호에 중요한 역할을 수행하여 왔으\n나, 현행법에 따른 기금의 운용기간은 2025년 12월 31일에 종료될 예\n정임.\n이에 기금의 운용 종료에 대비하고 기금 자산의 효율적 정리와 관\n련된 절차를 명확히 하기 위한 규정을 마련하여 투명성과 법적 안정\n성을 확보하려는 것임(안",
    "제안이유_및_주요내용": "기간산업안정기금은 코로나19 확산으로 인한 경제적 충격을 극복하\n고 주요 기간산업의 고용유지를 위하여 2020년 설치되었음. 동 기금은\n대한민국의 경제 안정과 일자리 보호에 중요한 역할을 수행하여 왔으\n나, 현행법에 따른 기금의 운용기간은 2025년 12월 31일에 종료될 예\n정임.\n이에 기금의 운용 종료에 대비하고 기금 자산의 효율적 정리와 관\n련된 절차를 명확히 하기 위한 규정을 마련하여 투명성과 법적 안정\n성을 확보하려는 것임(안",
    "법률_제_호": "한국산업은행법 일부개정법\n률",
    "신구조문대비표": "현 행 개 정 안\n법률 제17253호 한국산업은행 법률 제17253호 한국산업은행\n법 일부개정법률"
  }
}