{
  "title": "2203615_국회에서의_증언·감정_등에_관한_법률_일부개정법률안",
  "bill_number": "3615",
  "proposal_date": "2024. 9. 4.",
  "submission_date": "",
  "is_alternative": false,
  "alternative_bill_numbers": [],
  "has_comparison_table": false,
  "comparison_table": "신ㆍ구조문대비표\n현 행 개 정 안\n제9조(증인의 보호) ① ∼ ④ 제9조(증인의 보호) ① ∼ ④\n(생 략) (현행과 같음)\n<신 설> ⑤ 증인ㆍ감정인ㆍ참고인에 대\n한 조사는 조사 당일 오후 9시\n까지 마쳐야 한다. 다만, 증인\nㆍ감정인ㆍ참고인의 동의를 받\n은 때에는 그러하지 아니하다.",
  "full_text": "국회에서의 증언ㆍ감정 등에 관한 법률 일부개정법률안\n(이상휘의원 대표발의)\n발의연월일 : 2024. 9. 4.\n의 안\n3615\n번 호 발 의 자 : 이상휘ㆍ박덕흠ㆍ박성민\n구자근ㆍ백종헌ㆍ최은석\n박성훈ㆍ권영세ㆍ서천호\n임이자ㆍ배준영ㆍ강명구\n의원(12인)\n제안이유 및 주요내용\n현행법은 국회에서의 안건심의 또는 국정감사나 국정조사와 관련하\n여 증인ㆍ감정인ㆍ참고인의 증언ㆍ감정ㆍ진술로 인한 불이익한 처분\n을 금지하는 등 증인의 보호에 대하여 규정하고 있음.\n그러나 현행법은 증인ㆍ감정인ㆍ참고인으로부터 증언ㆍ진술을 청취\n할 수 있는 시간 등에 대해서는 규정하고 있지 않음. 그 결과 지나친\n증언ㆍ진술 요구로 증인ㆍ감정인ㆍ참고인의 인권이 침해되고 있다는\n지적이 있음.\n이에 증인ㆍ감정인ㆍ참고인에 대한 조사는 조사 당일 오후 9시까지\n마쳐야 함을 명시적으로 규정하여 내실 있는 조사가 이루어지게 함으\n로써 청문회 등의 실효성과 증인ㆍ감정인ㆍ참고인 보호 간의 균형을\n도모하고자 하는 것임(안 제9조제5항 신설).\n\n\n\n\n법률 제 호\n국회에서의 증언ㆍ감정 등에 관한 법률 일부개정법률안\n국회에서의 증언ㆍ감정 등에 관한 법률 일부를 다음과 같이 개정한다.\n제9조에 제5항을 다음과 같이 신설한다.\n⑤ 증인ㆍ감정인ㆍ참고인에 대한 조사는 조사 당일 오후 9시까지\n마쳐야 한다. 다만, 증인ㆍ감정인ㆍ참고인의 동의를 받은 때에는 그\n러하지 아니하다.\n부 칙\n이 법은 공포한 날부터 시행한다.\n\n\n\n\n신ㆍ구조문대비표\n현 행 개 정 안\n제9조(증인의 보호) ① ∼ ④ 제9조(증인의 보호) ① ∼ ④\n(생 략) (현행과 같음)\n<신 설> ⑤ 증인ㆍ감정인ㆍ참고인에 대\n한 조사는 조사 당일 오후 9시\n까지 마쳐야 한다. 다만, 증인\nㆍ감정인ㆍ참고인의 동의를 받\n은 때에는 그러하지 아니하다.\n",
  "sections": {
    "제안이유": "및",
    "주요내용": "현행법은 국회에서의 안건심의 또는 국정감사나 국정조사와 관련하\n여 증인ㆍ감정인ㆍ참고인의 증언ㆍ감정ㆍ진술로 인한 불이익한 처분\n을 금지하는 등 증인의 보호에 대하여 규정하고 있음.\n그러나 현행법은 증인ㆍ감정인ㆍ참고인으로부터 증언ㆍ진술을 청취\n할 수 있는 시간 등에 대해서는 규정하고 있지 않음. 그 결과 지나친\n증언ㆍ진술 요구로 증인ㆍ감정인ㆍ참고인의 인권이 침해되고 있다는\n지적이 있음.\n이에 증인ㆍ감정인ㆍ참고인에 대한 조사는 조사 당일 오후 9시까지\n마쳐야 함을 명시적으로 규정하여 내실 있는 조사가 이루어지게 함으\n로써 청문회 등의 실효성과 증인ㆍ감정인ㆍ참고인 보호 간의 균형을\n도모하고자 하는 것임(안 제9조제5항 신설).",
    "제안이유_및_주요내용": "현행법은 국회에서의 안건심의 또는 국정감사나 국정조사와 관련하\n여 증인ㆍ감정인ㆍ참고인의 증언ㆍ감정ㆍ진술로 인한 불이익한 처분\n을 금지하는 등 증인의 보호에 대하여 규정하고 있음.\n그러나 현행법은 증인ㆍ감정인ㆍ참고인으로부터 증언ㆍ진술을 청취\n할 수 있는 시간 등에 대해서는 규정하고 있지 않음. 그 결과 지나친\n증언ㆍ진술 요구로 증인ㆍ감정인ㆍ참고인의 인권이 침해되고 있다는\n지적이 있음.\n이에 증인ㆍ감정인ㆍ참고인에 대한 조사는 조사 당일 오후 9시까지\n마쳐야 함을 명시적으로 규정하여 내실 있는 조사가 이루어지게 함으\n로써 청문회 등의 실효성과 증인ㆍ감정인ㆍ참고인 보호 간의 균형을\n도모하고자 하는 것임(안 제9조제5항 신설).",
    "법률_제_호": "국회에서의 증언ㆍ감정 등에 관한 법률 일부개정법률안\n국회에서의 증언ㆍ감정 등에 관한 법률 일부를 다음과 같이 개정한다.\n제9조에 제5항을 다음과 같이 신설한다.\n⑤ 증인ㆍ감정인ㆍ참고인에 대한 조사는 조사 당일 오후 9시까지\n마쳐야 한다. 다만, 증인ㆍ감정인ㆍ참고인의 동의를 받은 때에는 그\n러하지 아니하다.",
    "신구조문대비표": "현 행 개 정 안\n제9조(증인의 보호) ① ∼ ④ 제9조(증인의 보호) ① ∼ ④\n(생 략) (현행과 같음)\n<신 설> ⑤ 증인ㆍ감정인ㆍ참고인에 대\n한 조사는 조사 당일 오후 9시\n까지 마쳐야 한다. 다만, 증인\nㆍ감정인ㆍ참고인의 동의를 받\n은 때에는 그러하지 아니하다."
  }
}