{
  "title": "2203262_공공주택_특별법_일부개정법률안(대안)",
  "bill_number": "",
  "proposal_date": "",
  "submission_date": "2024. 8.\n32",
  "is_alternative": true,
  "alternative_bill_numbers": [
    "2201103",
    "2201767",
    "2202951"
  ],
  "has_comparison_table": false,
  "comparison_table": "신·구조문대비표\n현 행 개 정 안\n법률 제18311호 공공주택 특별 법률 제18311호 공공주택 특별\n법 일부개정법률 ",
  "full_text": "공공주택 특별법 일부개정법률안(대안)\n의 안 제안연월일 : 2024. 8.\n3262\n번 호\n제 안 자 : 국토교통위원장\n1. 대안의 제안경위\n건 명 의안번호 발의자 회부일 회의정보\n제417회 국회(임시회)\n공공주택 상정\n강선우의원 제1차 국토교통위원회(’24.8.21.)\n특별법 2201103 ’24.7.1.\n등 10인 소위 제417회 국회(임시회)\n일부개정법률안\n심사 제2차 국토법안심사소위원회(’24.8.22.)\n제417회 국회(임시회)\n공공주택 상정\n김남근의원 제1차 국토교통위원회(’24.8.21.)\n특별법 2201767 ’24.7.16.\n등 25인 소위 제417회 국회(임시회)\n일부개정법률안\n심사 제2차 국토법안심사소위원회(’24.8.22.)\n제417회 국회(임시회)\n공공주택 상정\n문진석의원 제1차 국토교통위원회(’24.8.21.)\n특별법 2202951 ’24.8.20.\n등 10인 소위 제417회 국회(임시회)\n일부개정법률안\n심사 제2차 국토법안심사소위원회(’24.8.22.)\n제417회 국회(임시회) 제2차 국토교통위원회(2024. 8. 22.)는 위 3건\n의 법률안을 심사한 결과 본회의에 부의하지 아니하기로 하고 국회법\n제51조에 따라 위원회 대안으로 제안하기로 함.\n2. 대안의 제안이유 및 주요내용\n가. 2024년 9월 20일까지인 도심 공공주택 복합사업 유효기간을\n2026년 12월 31일까지 연장하여 안정적인 사업추진이 이루어질\n\n\n\n수 있도록 함(안 법률 제18311호 공공주택 특별법 일부개정법률\n부칙 제2조 및 법률 제19763호 공공주택 특별법 일부개정법률 부\n칙 제4조).\n나. 도심 공공주택 복합사업의 현물보상을 준용하고 있는 쪽방 밀집\n지구를 포함하는 공공주택지구 현물보상의 유효기간을 도심 공공\n주택 복합사업 유효기간에 맞추어 2026년 12월 31일까지 연장함\n(안 법률 제19763호 공공주택 특별법 일부개정법률 부칙 제2조).\n\n법률 제 호\n공공주택 특별법 일부개정법률안\n공공주택 특별법 일부를 다음과 같이 개정한다.\n법률 제18311호 공공주택 특별법 일부개정법률 부칙 제2조 중 “3년간”\n을 “2026년 12월 31일까지”로 한다.\n법률 제19763호 공공주택 특별법 일부개정법률 부칙 제2조 및 제4조\n중 “2024년 9월 20일”을 각각 “2026년 12월 31일”로 한다.\n부 칙\n이 법은 공포한 날부터 시행한다.\n\n\n신·구조문대비표\n현 행 개 정 안\n법률 제18311호 공공주택 특별 법률 제18311호 공공주택 특별\n법 일부개정법률 부칙 법 일부개정법률 부칙\n제2조(도심 공공주택 복합사업에 제2조(도심 공공주택 복합사업에\n관한 규정의 유효기간) 제2조 관한 규정의 유효기간) ------\n제2호의2, 같은 조 제3호마목, ----------------------------\n제4조제1항제6호, 제33조, 제34 ----------------------------\n조제1항, 제5장의3(제40조의7부 ----------------------------\n터 제40조의13까지) 및 제57조 ----------------------------\n의3제2호의 개정규정은 이 법 ----------------------------\n시행일부터 3년간 효력을 가진 ---2026년 12월 31일까지-----\n다. ---.\n법률 제19763호 공공주택 특별 법률 제19763호 공공주택 특별\n법 일부개정법률 부칙 법 일부개정법률 부칙\n제2조(현물보상 유효기간) 제27조 제2조(현물보상 유효기간) ------\n의4의 개정규정은 2024년 9월 -----------------2026년 12월\n20일까지 효력을 가진다. 31일-----------.\n제4조(도심 공공주택 복합사업 제4조(도심 공공주택 복합사업\n유효기간) 제40조의8 및 제40 유효기간) ------------------\n조의10부터 제40조의17까지의 ----------------------------\n개정규정은 2024년 9월 20일까 ------------2026년 12월 31일-\n지 효력을 가진다. ---------------.\n",
  "sections": {
    "제안이유": "및",
    "주요내용": "가. 2024년 9월 20일까지인 도심 공공주택 복합사업 유효기간을\n2026년 12월 31일까지 연장하여 안정적인 사업추진이 이루어질\n\n\n\n수 있도록 함(안",
    "제안이유_및_주요내용": "가. 2024년 9월 20일까지인 도심 공공주택 복합사업 유효기간을\n2026년 12월 31일까지 연장하여 안정적인 사업추진이 이루어질\n\n\n\n수 있도록 함(안",
    "법률_제_호": "공공주택 특별법 일부개정법률",
    "신구조문대비표": "현 행 개 정 안\n법률 제18311호 공공주택 특별 법률 제18311호 공공주택 특별\n법 일부개정법률"
  }
}