{
  "title": "2203093_문화산업진흥_기본법_일부개정법률안",
  "bill_number": "3093",
  "proposal_date": "2024. 8. 22.",
  "submission_date": "",
  "is_alternative": false,
  "alternative_bill_numbers": [],
  "has_comparison_table": false,
  "comparison_table": "신·구조문대비표\n현 행 개 정 안\n<신 설> 제31조의2(대출계정의 설치 등)\n① 문화상품 제작 지원 등을\n위하여 진흥원에 대출계정을\n설치한다.\n② 대출계정의 수입ㆍ운영ㆍ관\n리 등에 필요한 사항은 대통령\n령으로 정한다.",
  "full_text": "문화산업진흥 기본법 일부개정법률안\n(김승수의원 대표발의)\n발의연월일 : 2024. 8. 22.\n의 안\n3093\n번 호 발 의 자 : 김승수ㆍ강선영ㆍ서지영\n박성민ㆍ권영진ㆍ박충권\n신동욱ㆍ박정하ㆍ진종오\n조승환ㆍ한기호 의원\n(11인)\n제안이유 및 주요내용\n한국콘텐츠진흥원은 방송영상물 제작 및 인프라 구축 지원 등을 위\n해 1997년부터 ‘방송영상진흥재원 융자 지원 사업’(이하 “융자 사업”이\n라 함)을 진행해온 바 있음.\n융자 사업은 재무구조가 취약하고 영세한 방송영상물 제작사들이\n제작비를 확보하고 양질의 방송영상물을 제작하는 데 기여했다는 평\n가를 받고 있으나, 방송영상진흥재원 조성 근거 및 운용 목적과 관련\n한 법적 근거가 없다는 감사원의 지적이 있어 이에 따른 보완이 필요\n한 상황임.\n이에 한국콘텐츠진흥원에 문화상품 제작 지원 등을 위한 대출계정\n을 설치함으로써 장기간 지속되어 온 융자 사업의 법적 근거를 마련\n하고 안정적인 추진을 도모하려는 것임(안 제31조의2 신설).\n\n\n\n\n법률 제 호\n문화산업진흥 기본법 일부개정법률안\n문화산업진흥 기본법 일부를 다음과 같이 개정한다.\n제3장에 제31조의2를 다음과 같이 신설한다.\n제31조의2(대출계정의 설치 등) ① 문화상품 제작 지원 등을 위하여\n진흥원에 대출계정을 설치한다.\n② 대출계정의 수입ㆍ운영ㆍ관리 등에 필요한 사항은 대통령령으로\n정한다.\n부 칙\n이 법은 공포 후 3개월이 경과한 날부터 시행한다.\n\n\n\n\n신·구조문대비표\n현 행 개 정 안\n<신 설> 제31조의2(대출계정의 설치 등)\n① 문화상품 제작 지원 등을\n위하여 진흥원에 대출계정을\n설치한다.\n② 대출계정의 수입ㆍ운영ㆍ관\n리 등에 필요한 사항은 대통령\n령으로 정한다.\n",
  "sections": {
    "제안이유": "및",
    "주요내용": "한국콘텐츠진흥원은 방송영상물 제작 및 인프라 구축 지원 등을 위\n해 1997년부터 ‘방송영상진흥재원 융자 지원 사업’(이하 “융자 사업”이\n라 함)을 진행해온 바 있음.\n융자 사업은 재무구조가 취약하고 영세한 방송영상물 제작사들이\n제작비를 확보하고 양질의 방송영상물을 제작하는 데 기여했다는 평\n가를 받고 있으나, 방송영상진흥재원 조성 근거 및 운용 목적과 관련\n한 법적 근거가 없다는 감사원의 지적이 있어 이에 따른 보완이 필요\n한 상황임.\n이에 한국콘텐츠진흥원에 문화상품 제작 지원 등을 위한 대출계정\n을 설치함으로써 장기간 지속되어 온 융자 사업의 법적 근거를 마련\n하고 안정적인 추진을 도모하려는 것임(안 제31조의2 신설).",
    "제안이유_및_주요내용": "한국콘텐츠진흥원은 방송영상물 제작 및 인프라 구축 지원 등을 위\n해 1997년부터 ‘방송영상진흥재원 융자 지원 사업’(이하 “융자 사업”이\n라 함)을 진행해온 바 있음.\n융자 사업은 재무구조가 취약하고 영세한 방송영상물 제작사들이\n제작비를 확보하고 양질의 방송영상물을 제작하는 데 기여했다는 평\n가를 받고 있으나, 방송영상진흥재원 조성 근거 및 운용 목적과 관련\n한 법적 근거가 없다는 감사원의 지적이 있어 이에 따른 보완이 필요\n한 상황임.\n이에 한국콘텐츠진흥원에 문화상품 제작 지원 등을 위한 대출계정\n을 설치함으로써 장기간 지속되어 온 융자 사업의 법적 근거를 마련\n하고 안정적인 추진을 도모하려는 것임(안 제31조의2 신설).",
    "법률_제_호": "문화산업진흥 기본법 일부개정법률안\n문화산업진흥 기본법 일부를 다음과 같이 개정한다.\n제3장에 제31조의2를 다음과 같이 신설한다.\n제31조의2(대출계정의 설치 등) ① 문화상품 제작 지원 등을 위하여\n진흥원에 대출계정을 설치한다.\n② 대출계정의 수입ㆍ운영ㆍ관리 등에 필요한 사항은 대통령령으로\n정한다.",
    "신구조문대비표": "현 행 개 정 안\n<신 설> 제31조의2(대출계정의 설치 등)\n① 문화상품 제작 지원 등을\n위하여 진흥원에 대출계정을\n설치한다.\n② 대출계정의 수입ㆍ운영ㆍ관\n리 등에 필요한 사항은 대통령\n령으로 정한다."
  }
}