{
  "title": "2203369_형사소송법_일부개정법률안",
  "bill_number": "3369",
  "proposal_date": "2024. 8. 29.",
  "submission_date": "",
  "is_alternative": false,
  "alternative_bill_numbers": [],
  "has_comparison_table": false,
  "comparison_table": "신·구조문대비표\n현 행 개 정 안\n<신 설> 제38조의2(재판서 등의 작성) ①\n재판서 또는 조서는 피고인이\n쉽게 이해할 수 있도록 작성하\n여야 한다.\n② 피고인이 장애인인 경우에\n는 점자자료, 수어통역 등 대법\n원규칙으로 정하는 바에 따라\n재판서 또는 조서를 다른 방식\n으로 제공할 수 있다.",
  "full_text": "형사소송법 일부개정법률안\n(이건태의원 대표발의)\n발의연월일 : 2024. 8. 29.\n의 안\n3369\n번 호 발 의 자 : 이건태ㆍ이기헌ㆍ한준호\n황정아ㆍ박지원ㆍ박지혜\n곽상언ㆍ박균택ㆍ이수진\n위성곤 의원(10인)\n제안이유 및 주요내용\n현행법에 따르면 재판은 법관이 작성한 재판서에 의하여야 한다고\n명시되어 있으나, 재판서의 작성 방식에 대해서는 특별히 규정하고 있\n지 않음.\n이는 형사재판을 받는 당사자가 다양할 수 있음을 고려하지 못한\n것으로 재판을 받는 자가 장애인인 경우에는 재판서를 쉽게 이해할\n수 없는 상황이 발생할 수 있음. 또한 법치주의가 실질적으로 구현되\n기 위해서는 법조문 및 재판서가 국민 누구에게나 쉽게 느껴져야 할\n필요가 있다는 의견이 있음.\n이에 재판서를 당사자가 이해하기 쉬운 형태로 작성하도록 법률에\n명시하고, 당사자가 장애인인 경우에는 점자자료, 수어통역 등의 방식\n으로 재판서를 제공하도록 하려는 것임(안 제38조의2 신설).\n\n\n\n\n법률 제 호\n형사소송법 일부개정법률안\n형사소송법 일부를 다음과 같이 개정한다.\n제38조의2를 다음과 같이 신설한다.\n제38조의2(재판서 등의 작성) ① 재판서 또는 조서는 피고인이 쉽게\n이해할 수 있도록 작성하여야 한다.\n② 피고인이 장애인인 경우에는 점자자료, 수어통역 등 대법원규칙\n으로 정하는 바에 따라 재판서 또는 조서를 다른 방식으로 제공할\n수 있다.\n부 칙\n이 법은 공포 후 6개월이 경과한 날부터 시행한다.\n\n\n\n\n신·구조문대비표\n현 행 개 정 안\n<신 설> 제38조의2(재판서 등의 작성) ①\n재판서 또는 조서는 피고인이\n쉽게 이해할 수 있도록 작성하\n여야 한다.\n② 피고인이 장애인인 경우에\n는 점자자료, 수어통역 등 대법\n원규칙으로 정하는 바에 따라\n재판서 또는 조서를 다른 방식\n으로 제공할 수 있다.\n",
  "sections": {
    "제안이유": "및",
    "주요내용": "현행법에 따르면 재판은 법관이 작성한 재판서에 의하여야 한다고\n명시되어 있으나, 재판서의 작성 방식에 대해서는 특별히 규정하고 있\n지 않음.\n이는 형사재판을 받는 당사자가 다양할 수 있음을 고려하지 못한\n것으로 재판을 받는 자가 장애인인 경우에는 재판서를 쉽게 이해할\n수 없는 상황이 발생할 수 있음. 또한 법치주의가 실질적으로 구현되\n기 위해서는 법조문 및 재판서가 국민 누구에게나 쉽게 느껴져야 할\n필요가 있다는 의견이 있음.\n이에 재판서를 당사자가 이해하기 쉬운 형태로 작성하도록 법률에\n명시하고, 당사자가 장애인인 경우에는 점자자료, 수어통역 등의 방식\n으로 재판서를 제공하도록 하려는 것임(안 제38조의2 신설).",
    "제안이유_및_주요내용": "현행법에 따르면 재판은 법관이 작성한 재판서에 의하여야 한다고\n명시되어 있으나, 재판서의 작성 방식에 대해서는 특별히 규정하고 있\n지 않음.\n이는 형사재판을 받는 당사자가 다양할 수 있음을 고려하지 못한\n것으로 재판을 받는 자가 장애인인 경우에는 재판서를 쉽게 이해할\n수 없는 상황이 발생할 수 있음. 또한 법치주의가 실질적으로 구현되\n기 위해서는 법조문 및 재판서가 국민 누구에게나 쉽게 느껴져야 할\n필요가 있다는 의견이 있음.\n이에 재판서를 당사자가 이해하기 쉬운 형태로 작성하도록 법률에\n명시하고, 당사자가 장애인인 경우에는 점자자료, 수어통역 등의 방식\n으로 재판서를 제공하도록 하려는 것임(안 제38조의2 신설).",
    "법률_제_호": "형사소송법 일부개정법률안\n형사소송법 일부를 다음과 같이 개정한다.\n제38조의2를 다음과 같이 신설한다.\n제38조의2(재판서 등의 작성) ① 재판서 또는 조서는 피고인이 쉽게\n이해할 수 있도록 작성하여야 한다.\n② 피고인이 장애인인 경우에는 점자자료, 수어통역 등 대법원규칙\n으로 정하는 바에 따라 재판서 또는 조서를 다른 방식으로 제공할\n수 있다.",
    "신구조문대비표": "현 행 개 정 안\n<신 설> 제38조의2(재판서 등의 작성) ①\n재판서 또는 조서는 피고인이\n쉽게 이해할 수 있도록 작성하\n여야 한다.\n② 피고인이 장애인인 경우에\n는 점자자료, 수어통역 등 대법\n원규칙으로 정하는 바에 따라\n재판서 또는 조서를 다른 방식\n으로 제공할 수 있다."
  }
}