{
  "title": "2203124_정부기관_및_공공법인_등의_광고시행에_관한_법률_일부개정법률안",
  "bill_number": "3124",
  "proposal_date": "2024. 8. 23.",
  "submission_date": "",
  "is_alternative": false,
  "alternative_bill_numbers": [],
  "has_comparison_table": false,
  "comparison_table": "신·구조문대비표\n현 행 개 정 안\n<신 설> 제17조(과태료) ① 제9조를 위반\n한 자에게는 5천만원 이하의\n과태료를 부과한다.\n② 제1항에 따른 과태료는 대\n통령령으로 정하는 바에 따라\n문화체육관광부장관이 부과·징\n수한다.",
  "full_text": "정부기관 및 공공법인 등의 광고시행에 관한 법률\n일부개정법률안\n(김재원의원 대표발의)\n발의연월일 : 2024. 8. 23.\n의 안\n3124\n번 호 발 의 자 : 김재원ㆍ이해민ㆍ김준형\n조 국ㆍ신장식ㆍ한정애\n강경숙ㆍ황운하ㆍ조승래\n정준호ㆍ서영석 의원\n(11인)\n제안이유 및 주요내용\n현행법에 따르면 정부광고는 정부기관 등이 국내외의 홍보매체에\n광고, 홍보 및 공고 등을 하기 위한 모든 유료고지 행위를 말하며, 정\n부기관 등은 정부광고 형태 이외에 어떤 홍보형태도 할 수 없고 다만,\n홍보매체에 협찬받은 사실을 고지하거나 「방송법」에 따른 협찬고지\n를 한 경우는 예외로 하도록 하고 있음.\n그런데 최근 기사 형태를 취하고 있음에도 광고임을 표시하지 않는\n이른바 기사형광고가 정부기관 등이 시행하는 정부광고에도 나타나고\n있는데, 공공기관의 동정을 일방적으로 소개하는 기사와 기관장의 인\n터뷰가 광고 표시 없이 기사로 포장되어 독자에게 소개되고 있어 일\n정한 제재가 필요한 상황임.\n이에 정부광고가 아닌 유사 정부광고를 홍보매체에 의뢰하거나 게\n\n\n\n재한 정부기관 등에게는 5천만원 이하의 과태료를 부과하도록 함으로\n써 언론에 대한 국민들의 신뢰를 회복하려는 것임(안 제17조 신설).\n\n법률 제 호\n정부기관 및 공공법인 등의 광고시행에 관한 법률\n일부개정법률안\n정부기관 및 공공법인 등의 광고시행에 관한 법률 일부를 다음과 같\n이 개정한다.\n제17조를 다음과 같이 신설한다.\n제17조(과태료) ① 제9조를 위반한 자에게는 5천만원 이하의 과태료를\n부과한다.\n② 제1항에 따른 과태료는 대통령령으로 정하는 바에 따라 문화체\n육관광부장관이 부과·징수한다.\n부 칙\n이 법은 공포 후 6개월이 경과한 날부터 시행한다.\n\n\n\n\n신·구조문대비표\n현 행 개 정 안\n<신 설> 제17조(과태료) ① 제9조를 위반\n한 자에게는 5천만원 이하의\n과태료를 부과한다.\n② 제1항에 따른 과태료는 대\n통령령으로 정하는 바에 따라\n문화체육관광부장관이 부과·징\n수한다.\n",
  "sections": {
    "제안이유": "및",
    "주요내용": "현행법에 따르면 정부광고는 정부기관 등이 국내외의 홍보매체에\n광고, 홍보 및 공고 등을 하기 위한 모든 유료고지 행위를 말하며, 정\n부기관 등은 정부광고 형태 이외에 어떤 홍보형태도 할 수 없고 다만,\n홍보매체에 협찬받은 사실을 고지하거나 「방송법」에 따른 협찬고지\n를 한 경우는 예외로 하도록 하고 있음.\n그런데 최근 기사 형태를 취하고 있음에도 광고임을 표시하지 않는\n이른바 기사형광고가 정부기관 등이 시행하는 정부광고에도 나타나고\n있는데, 공공기관의 동정을 일방적으로 소개하는 기사와 기관장의 인\n터뷰가 광고 표시 없이 기사로 포장되어 독자에게 소개되고 있어 일\n정한 제재가 필요한 상황임.\n이에 정부광고가 아닌 유사 정부광고를 홍보매체에 의뢰하거나 게\n\n\n\n재한 정부기관 등에게는 5천만원 이하의 과태료를 부과하도록 함으로\n써 언론에 대한 국민들의 신뢰를 회복하려는 것임(안 제17조 신설).",
    "제안이유_및_주요내용": "현행법에 따르면 정부광고는 정부기관 등이 국내외의 홍보매체에\n광고, 홍보 및 공고 등을 하기 위한 모든 유료고지 행위를 말하며, 정\n부기관 등은 정부광고 형태 이외에 어떤 홍보형태도 할 수 없고 다만,\n홍보매체에 협찬받은 사실을 고지하거나 「방송법」에 따른 협찬고지\n를 한 경우는 예외로 하도록 하고 있음.\n그런데 최근 기사 형태를 취하고 있음에도 광고임을 표시하지 않는\n이른바 기사형광고가 정부기관 등이 시행하는 정부광고에도 나타나고\n있는데, 공공기관의 동정을 일방적으로 소개하는 기사와 기관장의 인\n터뷰가 광고 표시 없이 기사로 포장되어 독자에게 소개되고 있어 일\n정한 제재가 필요한 상황임.\n이에 정부광고가 아닌 유사 정부광고를 홍보매체에 의뢰하거나 게\n\n\n\n재한 정부기관 등에게는 5천만원 이하의 과태료를 부과하도록 함으로\n써 언론에 대한 국민들의 신뢰를 회복하려는 것임(안 제17조 신설).",
    "법률_제_호": "정부기관 및 공공법인 등의 광고시행에 관한 법률\n일부개정법률안\n정부기관 및 공공법인 등의 광고시행에 관한 법률 일부를 다음과 같\n이 개정한다.\n제17조를 다음과 같이 신설한다.\n제17조(과태료) ① 제9조를 위반한 자에게는 5천만원 이하의 과태료를\n부과한다.\n② 제1항에 따른 과태료는 대통령령으로 정하는 바에 따라 문화체\n육관광부장관이 부과·징수한다.",
    "신구조문대비표": "현 행 개 정 안\n<신 설> 제17조(과태료) ① 제9조를 위반\n한 자에게는 5천만원 이하의\n과태료를 부과한다.\n② 제1항에 따른 과태료는 대\n통령령으로 정하는 바에 따라\n문화체육관광부장관이 부과·징\n수한다."
  }
}