{
  "title": "2203594_자원봉사활동_기본법_일부개정법률안",
  "bill_number": "3594",
  "proposal_date": "2024. 9. 3.",
  "submission_date": "",
  "is_alternative": false,
  "alternative_bill_numbers": [],
  "has_comparison_table": false,
  "comparison_table": "신ㆍ구조문대비표\n현 행 개 정 안\n<신 설> 제15조의2(연수시설의 설치ㆍ운\n영) ① 국가와 지방자치단체는\n자원봉사자와 자원봉사활동을\n관리하는 자의 교육을 위하여\n연수시설을 설치ㆍ운영할 수\n있다.\n② 제1항에 따른 연수시설의\n설치ㆍ운영에 필요한 사항은\n대통령령으로 정한다.",
  "full_text": "자원봉사활동 기본법 일부개정법률안\n(성일종의원 대표발의)\n발의연월일 : 2024. 9. 3.\n의 안\n3594\n번 호 발 의 자 : 성일종ㆍ백종헌ㆍ조은희\n조 국ㆍ최수진ㆍ박덕흠\n이종배ㆍ장동혁ㆍ고동진\n유용원 의원(10인)\n제안이유 및 주요내용\n최근 자원봉사교육에 대한 수요의 증가에 따라 전문교육시설의 필\n요성이 제기되고 있으나, 현행법에는 자원봉사자의 교육을 위한 시설\n설치에 관한 규정이 없음.\n자원봉사자의 양성과 교육은 오로지 민간의 영역에만 맡겨져 있는\n실정으로 전문교육시설의 설치를 통하여 전문화된 교육과정 및 교육\n프로그램의 운영이 시급한 상황임.\n이에 국가와 지방자치단체는 자원봉사자와 자원봉사활동을 관리하\n는 자의 교육을 위하여 연수시설을 설치ㆍ운영할 수 있도록 하여 자\n원봉사활동의 진흥과 발전에 이바지하려는 것임(안 제15조의2 신설).\n\n\n\n\n법률 제 호\n자원봉사활동 기본법 일부개정법률안\n자원봉사활동 기본법 일부를 다음과 같이 개정한다.\n제15조의2를 다음과 같이 신설한다.\n제15조의2(연수시설의 설치ㆍ운영) ① 국가와 지방자치단체는 자원봉\n사자와 자원봉사활동을 관리하는 자의 교육을 위하여 연수시설을\n설치ㆍ운영할 수 있다.\n② 제1항에 따른 연수시설의 설치ㆍ운영에 필요한 사항은 대통령령\n으로 정한다.\n부 칙\n이 법은 공포 후 6개월이 경과한 날부터 시행한다.\n\n\n\n\n신ㆍ구조문대비표\n현 행 개 정 안\n<신 설> 제15조의2(연수시설의 설치ㆍ운\n영) ① 국가와 지방자치단체는\n자원봉사자와 자원봉사활동을\n관리하는 자의 교육을 위하여\n연수시설을 설치ㆍ운영할 수\n있다.\n② 제1항에 따른 연수시설의\n설치ㆍ운영에 필요한 사항은\n대통령령으로 정한다.\n",
  "sections": {
    "제안이유": "및",
    "주요내용": "최근 자원봉사교육에 대한 수요의 증가에 따라 전문교육시설의 필\n요성이 제기되고 있으나, 현행법에는 자원봉사자의 교육을 위한 시설\n설치에 관한 규정이 없음.\n자원봉사자의 양성과 교육은 오로지 민간의 영역에만 맡겨져 있는\n실정으로 전문교육시설의 설치를 통하여 전문화된 교육과정 및 교육\n프로그램의 운영이 시급한 상황임.\n이에 국가와 지방자치단체는 자원봉사자와 자원봉사활동을 관리하\n는 자의 교육을 위하여 연수시설을 설치ㆍ운영할 수 있도록 하여 자\n원봉사활동의 진흥과 발전에 이바지하려는 것임(안 제15조의2 신설).",
    "제안이유_및_주요내용": "최근 자원봉사교육에 대한 수요의 증가에 따라 전문교육시설의 필\n요성이 제기되고 있으나, 현행법에는 자원봉사자의 교육을 위한 시설\n설치에 관한 규정이 없음.\n자원봉사자의 양성과 교육은 오로지 민간의 영역에만 맡겨져 있는\n실정으로 전문교육시설의 설치를 통하여 전문화된 교육과정 및 교육\n프로그램의 운영이 시급한 상황임.\n이에 국가와 지방자치단체는 자원봉사자와 자원봉사활동을 관리하\n는 자의 교육을 위하여 연수시설을 설치ㆍ운영할 수 있도록 하여 자\n원봉사활동의 진흥과 발전에 이바지하려는 것임(안 제15조의2 신설).",
    "법률_제_호": "자원봉사활동 기본법 일부개정법률안\n자원봉사활동 기본법 일부를 다음과 같이 개정한다.\n제15조의2를 다음과 같이 신설한다.\n제15조의2(연수시설의 설치ㆍ운영) ① 국가와 지방자치단체는 자원봉\n사자와 자원봉사활동을 관리하는 자의 교육을 위하여 연수시설을\n설치ㆍ운영할 수 있다.\n② 제1항에 따른 연수시설의 설치ㆍ운영에 필요한 사항은 대통령령\n으로 정한다.",
    "신구조문대비표": "현 행 개 정 안\n<신 설> 제15조의2(연수시설의 설치ㆍ운\n영) ① 국가와 지방자치단체는\n자원봉사자와 자원봉사활동을\n관리하는 자의 교육을 위하여\n연수시설을 설치ㆍ운영할 수\n있다.\n② 제1항에 따른 연수시설의\n설치ㆍ운영에 필요한 사항은\n대통령령으로 정한다."
  }
}