{
  "title": "2203074_작은도서관_진흥법_일부개정법률안",
  "bill_number": "3074",
  "proposal_date": "2024. 8. 22.",
  "submission_date": "",
  "is_alternative": false,
  "alternative_bill_numbers": [],
  "has_comparison_table": false,
  "comparison_table": "신ㆍ구조문대비표\n현 행 개 정 안\n제5조(작은도서관의 설치 및 운 제5조(작은도서관의 설치 및 운\n영) ① (생 략) 영) ① (현행과 같음)\n<신 설> ② 국가 및 지방자치단체는 작\n은도서관의 원활한 운영을 위\n해 인력지원, 장서확충 및 독서\nㆍ문화 프로그램 등의 활성화\n를 위한 노력을 하여야 한다.\n② (생 략) ③ (현행 제2항과 같음)",
  "full_text": "작은도서관 진흥법 일부개정법률안\n(임오경의원 대표발의)\n발의연월일 : 2024. 8. 22.\n의 안\n3074\n번 호 발 의 자 : 임오경ㆍ임미애ㆍ차지호\n조계원ㆍ서영교ㆍ윤후덕\n박 정ㆍ한민수ㆍ문대림\n김재원ㆍ박수현 의원\n(11인)\n제안이유 및 주요내용\n문화체육관광부의 작은도서관 운영실태조사 결과보고서에 의하면\n2017년 6,058곳이던 작은 도서관은 2023년에는 6,875곳까지 늘어났\n는데, 전체 6,875곳 중 직원이 있는 도서관은 70.2%인 4,568개관이\n고 29.8%인 2,307개관은 직원이 없는 것으로 나타났음.\n또한 직원이 있는 4,568개관 중 사서자격증 소지 사서직원이 근무하\n는 곳은 25.5%인 1,167개관에 불과했고 한 곳당 평균자원봉사자수 역\n시 2017년 5.0명에서 2020년 3.9명, 2022년 3.4명으로 감소하는 추세임.\n독서ㆍ문화프로그램을 실시하는 곳은 67.2%인 4,623개관으로\n32.8%인 2,252개관은 독서ㆍ문화프로그램을 실시하지 않는 것으로\n나타남.\n이에 작은도서관이 국민의 지식정보 접근성을 높이고 생활 친화적\n도서관문화의 향상에 더욱 이바지하도록 작은도서관의 원활한 운영을\n\n\n\n위한 인력지원, 장서확충 및 독서ㆍ문화 프로그램 등의 활성화를 위한\n근거를 마련하고자 함(안 제5조제2항 신설).\n\n법률 제 호\n작은도서관 진흥법 일부개정법률안\n작은도서관 진흥법 일부를 다음과 같이 개정한다.\n제5조제2항을 제3항으로 하고, 같은 조에 제2항을 다음과 같이 신설한\n다.\n② 국가 및 지방자치단체는 작은도서관의 원활한 운영을 위해 인력\n지원, 장서확충 및 독서ㆍ문화 프로그램 등의 활성화를 위한 노력을\n하여야 한다.\n부 칙\n이 법은 공포 후 6개월이 경과한 날부터 시행한다.\n\n\n\n\n신ㆍ구조문대비표\n현 행 개 정 안\n제5조(작은도서관의 설치 및 운 제5조(작은도서관의 설치 및 운\n영) ① (생 략) 영) ① (현행과 같음)\n<신 설> ② 국가 및 지방자치단체는 작\n은도서관의 원활한 운영을 위\n해 인력지원, 장서확충 및 독서\nㆍ문화 프로그램 등의 활성화\n를 위한 노력을 하여야 한다.\n② (생 략) ③ (현행 제2항과 같음)\n",
  "sections": {
    "제안이유": "및",
    "주요내용": "문화체육관광부의 작은도서관 운영실태조사 결과보고서에 의하면\n2017년 6,058곳이던 작은 도서관은 2023년에는 6,875곳까지 늘어났\n는데, 전체 6,875곳 중 직원이 있는 도서관은 70.2%인 4,568개관이\n고 29.8%인 2,307개관은 직원이 없는 것으로 나타났음.\n또한 직원이 있는 4,568개관 중 사서자격증 소지 사서직원이 근무하\n는 곳은 25.5%인 1,167개관에 불과했고 한 곳당 평균자원봉사자수 역\n시 2017년 5.0명에서 2020년 3.9명, 2022년 3.4명으로 감소하는 추세임.\n독서ㆍ문화프로그램을 실시하는 곳은 67.2%인 4,623개관으로\n32.8%인 2,252개관은 독서ㆍ문화프로그램을 실시하지 않는 것으로\n나타남.\n이에 작은도서관이 국민의 지식정보 접근성을 높이고 생활 친화적\n도서관문화의 향상에 더욱 이바지하도록 작은도서관의 원활한 운영을\n\n\n\n위한 인력지원, 장서확충 및 독서ㆍ문화 프로그램 등의 활성화를 위한\n근거를 마련하고자 함(안 제5조제2항 신설).",
    "제안이유_및_주요내용": "문화체육관광부의 작은도서관 운영실태조사 결과보고서에 의하면\n2017년 6,058곳이던 작은 도서관은 2023년에는 6,875곳까지 늘어났\n는데, 전체 6,875곳 중 직원이 있는 도서관은 70.2%인 4,568개관이\n고 29.8%인 2,307개관은 직원이 없는 것으로 나타났음.\n또한 직원이 있는 4,568개관 중 사서자격증 소지 사서직원이 근무하\n는 곳은 25.5%인 1,167개관에 불과했고 한 곳당 평균자원봉사자수 역\n시 2017년 5.0명에서 2020년 3.9명, 2022년 3.4명으로 감소하는 추세임.\n독서ㆍ문화프로그램을 실시하는 곳은 67.2%인 4,623개관으로\n32.8%인 2,252개관은 독서ㆍ문화프로그램을 실시하지 않는 것으로\n나타남.\n이에 작은도서관이 국민의 지식정보 접근성을 높이고 생활 친화적\n도서관문화의 향상에 더욱 이바지하도록 작은도서관의 원활한 운영을\n\n\n\n위한 인력지원, 장서확충 및 독서ㆍ문화 프로그램 등의 활성화를 위한\n근거를 마련하고자 함(안 제5조제2항 신설).",
    "법률_제_호": "작은도서관 진흥법 일부개정법률안\n작은도서관 진흥법 일부를 다음과 같이 개정한다.\n제5조제2항을 제3항으로 하고, 같은 조에 제2항을 다음과 같이 신설한\n다.\n② 국가 및 지방자치단체는 작은도서관의 원활한 운영을 위해 인력\n지원, 장서확충 및 독서ㆍ문화 프로그램 등의 활성화를 위한 노력을\n하여야 한다.",
    "신구조문대비표": "현 행 개 정 안\n제5조(작은도서관의 설치 및 운 제5조(작은도서관의 설치 및 운\n영) ① (생 략) 영) ① (현행과 같음)\n<신 설> ② 국가 및 지방자치단체는 작\n은도서관의 원활한 운영을 위\n해 인력지원, 장서확충 및 독서\nㆍ문화 프로그램 등의 활성화\n를 위한 노력을 하여야 한다.\n② (생 략) ③ (현행 제2항과 같음)"
  }
}