{
  "title": "2203632_주민등록법_일부개정법률안",
  "bill_number": "3632",
  "proposal_date": "2024. 9. 4.",
  "submission_date": "",
  "is_alternative": false,
  "alternative_bill_numbers": [],
  "has_comparison_table": false,
  "comparison_table": "신ㆍ구조문대비표\n현 행 개 정 안\n제27조의2(중증장애인에 대한 주 제27조의2(중증장애인에 대한 주\n민등록증의 발급 및 재발급) ① 민등록증의 발급 및 재발급) ①\n시장ㆍ군수 또는 구청장은 신체 ------------------------\n적ㆍ정신적 장애정도가 심하여 ------------------------\n자립하기가 매우 곤란한 장애인 ------------------------\n(이하 이 조에서 “중증장애인” ------------------------\n이라 한다)으로서 본인이 직접 ------------------------\n주민등록증의 발급ㆍ재발급을 ------------------------\n신청하기가 어렵다고 판단하는 ------------------------\n경우에는 해당 중증장애인, 그 ------------------------\n법정대리인 또는 대통령령으로 ------------------------\n정하는 보호자의 신청에 따라 ------------------------\n관계 공무원으로 하여금 해당 ------------------------\n중증장애인을 직접 방문하게 하 ------------------------\n여 주민등록증을 발급ㆍ재발급 ------------ 발급ㆍ재발급-\n(발급의 경우는 관할구역에 주 ------------------------\n민등록이 된 중증장애인에 한정 ------------------------\n한다)할 수 있다. ------------.\n② (생 략) ② (현행과 같음)",
  "full_text": "주민등록법 일부개정법률안\n(정동만의원 대표발의)\n발의연월일 : 2024. 9. 4.\n의 안\n3632\n번 호 발 의 자 : 정동만ㆍ송언석ㆍ엄태영\n최수진ㆍ정연욱ㆍ진종오\n김형동ㆍ김선교ㆍ박형수\n김태호ㆍ김종양 의원\n(11인)\n제안이유\n종전에는 주민등록지에서만 신청할 수 있었던 주민등록증의 신규\n발급을 전국 어디서나 신청할 수 있도록 개선(’22.7.11.)하였으나, 관계\n공무원이 직접 방문하여 주민등록증 발급ㆍ재발급 신청을 받는 중증\n장애인의 경우 여전히 주민등록지에서만 신규 발급 신청이 가능한 불\n편이 존재함에 따라, 중증장애인도 전국 어디서나 신규 발급 신청이\n가능하도록 개선 필요.\n주요내용\n중증장애인이 주민등록증의 재발급 뿐만 아니라 신규 발급도 전국\n어디서나 신청할 수 있도록 개선함(안 제27조의2제1항).\n\n\n\n\n법률 제 호\n주민등록법 일부개정법률안\n주민등록법 일부를 다음과 같이 개정한다.\n제27조의2제1항 중 “발급ㆍ재발급(발급의 경우는 관할구역에 주민등록\n이 된 중증장애인에 한정한다)”을 “발급ㆍ재발급”으로 한다.\n부 칙\n제1조(시행일) 이 법은 공포한 날부터 시행한다.\n\n\n\n\n신ㆍ구조문대비표\n현 행 개 정 안\n제27조의2(중증장애인에 대한 주 제27조의2(중증장애인에 대한 주\n민등록증의 발급 및 재발급) ① 민등록증의 발급 및 재발급) ①\n시장ㆍ군수 또는 구청장은 신체 ------------------------\n적ㆍ정신적 장애정도가 심하여 ------------------------\n자립하기가 매우 곤란한 장애인 ------------------------\n(이하 이 조에서 “중증장애인” ------------------------\n이라 한다)으로서 본인이 직접 ------------------------\n주민등록증의 발급ㆍ재발급을 ------------------------\n신청하기가 어렵다고 판단하는 ------------------------\n경우에는 해당 중증장애인, 그 ------------------------\n법정대리인 또는 대통령령으로 ------------------------\n정하는 보호자의 신청에 따라 ------------------------\n관계 공무원으로 하여금 해당 ------------------------\n중증장애인을 직접 방문하게 하 ------------------------\n여 주민등록증을 발급ㆍ재발급 ------------ 발급ㆍ재발급-\n(발급의 경우는 관할구역에 주 ------------------------\n민등록이 된 중증장애인에 한정 ------------------------\n한다)할 수 있다. ------------.\n② (생 략) ② (현행과 같음)\n",
  "sections": {
    "제안이유": "종전에는 주민등록지에서만 신청할 수 있었던 주민등록증의 신규\n발급을 전국 어디서나 신청할 수 있도록 개선(’22.7.11.)하였으나, 관계\n공무원이 직접 방문하여 주민등록증 발급ㆍ재발급 신청을 받는 중증\n장애인의 경우 여전히 주민등록지에서만 신규 발급 신청이 가능한 불\n편이 존재함에 따라, 중증장애인도 전국 어디서나 신규 발급 신청이\n가능하도록 개선 필요.",
    "주요내용": "중증장애인이 주민등록증의 재발급 뿐만 아니라 신규 발급도 전국\n어디서나 신청할 수 있도록 개선함(안 제27조의2제1항).",
    "법률_제_호": "주민등록법 일부개정법률안\n주민등록법 일부를 다음과 같이 개정한다.\n제27조의2제1항 중 “발급ㆍ재발급(발급의 경우는 관할구역에 주민등록\n이 된 중증장애인에 한정한다)”을 “발급ㆍ재발급”으로 한다.",
    "신구조문대비표": "현 행 개 정 안\n제27조의2(중증장애인에 대한 주 제27조의2(중증장애인에 대한 주\n민등록증의 발급 및 재발급) ① 민등록증의 발급 및 재발급) ①\n시장ㆍ군수 또는 구청장은 신체 ------------------------\n적ㆍ정신적 장애정도가 심하여 ------------------------\n자립하기가 매우 곤란한 장애인 ------------------------\n(이하 이 조에서 “중증장애인” ------------------------\n이라 한다)으로서 본인이 직접 ------------------------\n주민등록증의 발급ㆍ재발급을 ------------------------\n신청하기가 어렵다고 판단하는 ------------------------\n경우에는 해당 중증장애인, 그 ------------------------\n법정대리인 또는 대통령령으로 ------------------------\n정하는 보호자의 신청에 따라 ------------------------\n관계 공무원으로 하여금 해당 ------------------------\n중증장애인을 직접 방문하게 하 ------------------------\n여 주민등록증을 발급ㆍ재발급 ------------ 발급ㆍ재발급-\n(발급의 경우는 관할구역에 주 ------------------------\n민등록이 된 중증장애인에 한정 ------------------------\n한다)할 수 있다. ------------.\n② (생 략) ② (현행과 같음)"
  }
}