{
  "title": "2203636_민법_일부개정법률안",
  "bill_number": "3636",
  "proposal_date": "2024. 9. 4.",
  "submission_date": "",
  "is_alternative": false,
  "alternative_bill_numbers": [],
  "has_comparison_table": false,
  "comparison_table": "신·구조문대비표\n현 행 개 정 안\n<신 설> 제98조의2(동물의 법적 지위) ①\n동물은 물건이 아닌 감각이 있\n는 생명체이다.\n② 동물에 대하여는 법률에 특\n별한 규정이 있는 경우를 제외\n하고는 물건에 관한 규정을 준\n용한다.",
  "full_text": "민법 일부개정법률안\n(박홍근의원 대표발의)\n발의연월일 : 2024. 9. 4.\n의 안\n3636\n번 호 발 의 자 : 박홍근ㆍ김영호ㆍ김기현\n이수진ㆍ박상혁ㆍ조정식\n권칠승ㆍ남인순ㆍ김남근\n이건태ㆍ한정애ㆍ김민석\n염태영ㆍ임광현 의원\n(14인)\n제안이유 및 주요내용\n농림축산식품부의 “2023년 동물복지에 대한 국민의식조사”에 따르면\n국내 반려동물 양육인구 비율이 28.2%인 것으로 나타남. 동물과 동거\n하는 인구의 증가 등 동물에 대한 인식의 변화로 동물을 생명체로 보\n호하고 비인도적 처우를 개선하여야 한다는 주장 또한 꾸준히 제기되\n고 있음.\n이후 21대 국회에서 정부안을 포함하여 동물의 비물건화를 주요내\n용으로 담은 개정안이 발의된 바 있으나, 구체적인 논의 없이 임기만\n료로 폐기된 바 있음.\n이에 현행법에 동물은 물건이 아닌 감각이 있는 생명체임을 명시하\n여 인간과 동물의 관계에 있어 생명 존중과 동물 보호를 위한 법적\n토대를 마련하고 변화된 시대상을 반영하려는 것임(안 제98조의2 신\n\n\n설).\n\n법률 제 호\n민법 일부개정법률안\n민법 일부를 다음과 같이 개정한다.\n제98조의2를 다음과 같이 신설한다.\n제98조의2(동물의 법적 지위) ① 동물은 물건이 아닌 감각이 있는 생\n명체이다.\n② 동물에 대하여는 법률에 특별한 규정이 있는 경우를 제외하고는\n물건에 관한 규정을 준용한다.\n부 칙\n이 법은 공포한 날부터 시행한다.\n\n\n\n신·구조문대비표\n현 행 개 정 안\n<신 설> 제98조의2(동물의 법적 지위) ①\n동물은 물건이 아닌 감각이 있\n는 생명체이다.\n② 동물에 대하여는 법률에 특\n별한 규정이 있는 경우를 제외\n하고는 물건에 관한 규정을 준\n용한다.\n",
  "sections": {
    "제안이유": "및",
    "주요내용": "농림축산식품부의 “2023년 동물복지에 대한 국민의식조사”에 따르면\n국내 반려동물 양육인구 비율이 28.2%인 것으로 나타남. 동물과 동거\n하는 인구의 증가 등 동물에 대한 인식의 변화로 동물을 생명체로 보\n호하고 비인도적 처우를 개선하여야 한다는 주장 또한 꾸준히 제기되\n고 있음.\n이후 21대 국회에서 정부안을 포함하여 동물의 비물건화를 주요내\n용으로 담은 개정안이 발의된 바 있으나, 구체적인 논의 없이 임기만\n료로 폐기된 바 있음.\n이에 현행법에 동물은 물건이 아닌 감각이 있는 생명체임을 명시하\n여 인간과 동물의 관계에 있어 생명 존중과 동물 보호를 위한 법적\n토대를 마련하고 변화된 시대상을 반영하려는 것임(안 제98조의2 신\n\n\n설).",
    "제안이유_및_주요내용": "농림축산식품부의 “2023년 동물복지에 대한 국민의식조사”에 따르면\n국내 반려동물 양육인구 비율이 28.2%인 것으로 나타남. 동물과 동거\n하는 인구의 증가 등 동물에 대한 인식의 변화로 동물을 생명체로 보\n호하고 비인도적 처우를 개선하여야 한다는 주장 또한 꾸준히 제기되\n고 있음.\n이후 21대 국회에서 정부안을 포함하여 동물의 비물건화를 주요내\n용으로 담은 개정안이 발의된 바 있으나, 구체적인 논의 없이 임기만\n료로 폐기된 바 있음.\n이에 현행법에 동물은 물건이 아닌 감각이 있는 생명체임을 명시하\n여 인간과 동물의 관계에 있어 생명 존중과 동물 보호를 위한 법적\n토대를 마련하고 변화된 시대상을 반영하려는 것임(안 제98조의2 신\n\n\n설).",
    "법률_제_호": "민법 일부개정법률안\n민법 일부를 다음과 같이 개정한다.\n제98조의2를 다음과 같이 신설한다.\n제98조의2(동물의 법적 지위) ① 동물은 물건이 아닌 감각이 있는 생\n명체이다.\n② 동물에 대하여는 법률에 특별한 규정이 있는 경우를 제외하고는\n물건에 관한 규정을 준용한다.",
    "신구조문대비표": "현 행 개 정 안\n<신 설> 제98조의2(동물의 법적 지위) ①\n동물은 물건이 아닌 감각이 있\n는 생명체이다.\n② 동물에 대하여는 법률에 특\n별한 규정이 있는 경우를 제외\n하고는 물건에 관한 규정을 준\n용한다."
  }
}