{
  "title": "2203821_한국주택금융공사법_일부개정법률안",
  "bill_number": "3821",
  "proposal_date": "2024. 9. 9.",
  "submission_date": "",
  "is_alternative": false,
  "alternative_bill_numbers": [],
  "has_comparison_table": false,
  "comparison_table": "신ㆍ구조문대비표\n현 행 개 정 안\n제58조(기금의 관리ㆍ운용) ①⋅ 제58조(기금의 관리ㆍ운용) ①⋅\n② (생 략) ② (현행과 같음)\n<신 설> ③ 제2항제2호에 따라 기금을\n운용하는 경우에는 장기적이고\n안정적인 수익 증대를 위하여\n투자대상과 관련한 환경ㆍ사회\nㆍ지배구조 등의 요소를 고려\n할 수 있다.",
  "full_text": "한국주택금융공사법 일부개정법률안\n(이정문의원 대표발의)\n발의연월일 : 2024. 9. 9.\n의 안\n3821\n번 호 발 의 자 : 이정문ㆍ박 정ㆍ조승래\n이학영ㆍ이연희ㆍ이훈기\n문진석ㆍ서영석ㆍ이인영\n임광현 의원(10인)\n제안이유 및 주요내용\nESG(Environment, Social, Governance)투자는 사회적 책임을 금융\n시장에 도입하여, 투자 결정 단계에서 재무적 요소와 함께 환경ㆍ사회\nㆍ지배구조 등 비재무적 요소를 고려함으로써 장기적으로 리스크를\n경감시키고 지속가능한 수익 창출을 목표로 하는 투자 원칙임.\n이러한 ‘사회적 책임투자’는 2005년에 UN에서 6가지 투자 원칙(UN\nPRI)을 천명한 이후 서명을 통해 세계 각국 및 기업에 확산되는 추세\n에 있고, 국내에서는 국민연금이 법 개정을 통해 2015년부터 도입하고\n있으며, 해외 국부펀드 중에서 노르웨이의 정부연기금(GPFG)등 주요\n연기금에서 도입하고 있음.\n이에 주택금융신용보증기금을 운용하는 경우 환경ㆍ사회ㆍ지배구조\n요소 등 사회책임 요소를 고려할 수 있도록 함으로써 기금의 장기적\n인 수익률을 제고하면서 사회적 책임을 강화하려는 것임(안 제58조제3\n\n\n\n항 신설).\n\n법률 제 호\n한국주택금융공사법 일부개정법률안\n한국주택금융공사법 일부를 다음과 같이 개정한다.\n제58조에 제3항을 다음과 같이 신설한다.\n③ 제2항제2호에 따라 기금을 운용하는 경우에는 장기적이고 안정\n적인 수익 증대를 위하여 투자대상과 관련한 환경ㆍ사회ㆍ지배구조\n등의 요소를 고려할 수 있다.\n부 칙\n이 법은 공포 후 6개월이 경과한 날부터 시행한다.\n\n\n\n\n신ㆍ구조문대비표\n현 행 개 정 안\n제58조(기금의 관리ㆍ운용) ①⋅ 제58조(기금의 관리ㆍ운용) ①⋅\n② (생 략) ② (현행과 같음)\n<신 설> ③ 제2항제2호에 따라 기금을\n운용하는 경우에는 장기적이고\n안정적인 수익 증대를 위하여\n투자대상과 관련한 환경ㆍ사회\nㆍ지배구조 등의 요소를 고려\n할 수 있다.\n",
  "sections": {
    "제안이유": "및",
    "주요내용": "ESG(Environment, Social, Governance)투자는 사회적 책임을 금융\n시장에 도입하여, 투자 결정 단계에서 재무적 요소와 함께 환경ㆍ사회\nㆍ지배구조 등 비재무적 요소를 고려함으로써 장기적으로 리스크를\n경감시키고 지속가능한 수익 창출을 목표로 하는 투자 원칙임.\n이러한 ‘사회적 책임투자’는 2005년에 UN에서 6가지 투자 원칙(UN\nPRI)을 천명한 이후 서명을 통해 세계 각국 및 기업에 확산되는 추세\n에 있고, 국내에서는 국민연금이 법 개정을 통해 2015년부터 도입하고\n있으며, 해외 국부펀드 중에서 노르웨이의 정부연기금(GPFG)등 주요\n연기금에서 도입하고 있음.\n이에 주택금융신용보증기금을 운용하는 경우 환경ㆍ사회ㆍ지배구조\n요소 등 사회책임 요소를 고려할 수 있도록 함으로써 기금의 장기적\n인 수익률을 제고하면서 사회적 책임을 강화하려는 것임(안 제58조제3\n\n\n\n항 신설).",
    "제안이유_및_주요내용": "ESG(Environment, Social, Governance)투자는 사회적 책임을 금융\n시장에 도입하여, 투자 결정 단계에서 재무적 요소와 함께 환경ㆍ사회\nㆍ지배구조 등 비재무적 요소를 고려함으로써 장기적으로 리스크를\n경감시키고 지속가능한 수익 창출을 목표로 하는 투자 원칙임.\n이러한 ‘사회적 책임투자’는 2005년에 UN에서 6가지 투자 원칙(UN\nPRI)을 천명한 이후 서명을 통해 세계 각국 및 기업에 확산되는 추세\n에 있고, 국내에서는 국민연금이 법 개정을 통해 2015년부터 도입하고\n있으며, 해외 국부펀드 중에서 노르웨이의 정부연기금(GPFG)등 주요\n연기금에서 도입하고 있음.\n이에 주택금융신용보증기금을 운용하는 경우 환경ㆍ사회ㆍ지배구조\n요소 등 사회책임 요소를 고려할 수 있도록 함으로써 기금의 장기적\n인 수익률을 제고하면서 사회적 책임을 강화하려는 것임(안 제58조제3\n\n\n\n항 신설).",
    "법률_제_호": "한국주택금융공사법 일부개정법률안\n한국주택금융공사법 일부를 다음과 같이 개정한다.\n제58조에 제3항을 다음과 같이 신설한다.\n③ 제2항제2호에 따라 기금을 운용하는 경우에는 장기적이고 안정\n적인 수익 증대를 위하여 투자대상과 관련한 환경ㆍ사회ㆍ지배구조\n등의 요소를 고려할 수 있다.",
    "신구조문대비표": "현 행 개 정 안\n제58조(기금의 관리ㆍ운용) ①⋅ 제58조(기금의 관리ㆍ운용) ①⋅\n② (생 략) ② (현행과 같음)\n<신 설> ③ 제2항제2호에 따라 기금을\n운용하는 경우에는 장기적이고\n안정적인 수익 증대를 위하여\n투자대상과 관련한 환경ㆍ사회\nㆍ지배구조 등의 요소를 고려\n할 수 있다."
  }
}