{
  "title": "2203244_성폭력범죄의_처벌_등에_관한_특례법_일부개정법률안",
  "bill_number": "3244",
  "proposal_date": "2024. 8. 27.",
  "submission_date": "",
  "is_alternative": false,
  "alternative_bill_numbers": [],
  "has_comparison_table": false,
  "comparison_table": "신ㆍ구조문대비표\n현 행 개 정 안\n제14조의2(허위영상물 등의 반포 제14조의2(허위영상물 등의 반포\n등) ① ∼ ③ (생 략) 등) ① ∼ ③ (현행과 같음)\n<신 설> ④ 제1항 또는 제2항의 편집물\n등 또는 복제물을 소지ㆍ구입\nㆍ저장 또는 시청한 자는 1년\n이하의 징역 또는 1천만원 이\n하의 벌금에 처한다.\n④ (생 략) ⑤ (현행 제4항과 같음)",
  "full_text": "성폭력범죄의 처벌 등에 관한 특례법 일부개정법률안\n(김한규의원 대표발의)\n발의연월일 : 2024. 8. 27.\n의 안\n3244\n번 호 발 의 자 : 김한규ㆍ장철민ㆍ신정훈\n이재관ㆍ정동영ㆍ박희승\n김 윤ㆍ서미화ㆍ모경종\n이연희 의원(10인)\n제안이유 및 주요내용\n현행법은 촬영물 또는 영상물등을 대상자의 의사에 반하여 성적 욕\n망 또는 수치심을 유발할 수 있는 형태로 편집, 합성, 가공하거나 이\n를 반포한 자 또는 허위영상물을 편집, 합성 또는 가공할 당시에는 대\n상자의 의사에 반하지 아니하였으나 사후에 대상자의 의사에 반하여\n이를 반포한 자를 처벌하도록 규정하고 있음.\n그런데 카메라 등을 이용한 촬영물 또는 복제물의 경우 이를 반포\nㆍ판매ㆍ임대한 자를 처벌함과 동시에 이를 구입하거나 소지, 구입,\n저장 또는 시청한 자를 처벌토록 한 것과 달리 허위영상물의 경우에\n는 소지 등을 한 자를 처벌하는 규정이 없어 형평에 맞지 않다는 의\n견이 있음.\n이에 허위영상물 등을 소지ㆍ구입ㆍ저장 또는 시청한 자를 처벌할\n수 있도록 규정하고자 함(안 제14조의2제4항 신설).\n\n\n\n\n법률 제 호\n성폭력범죄의 처벌 등에 관한 특례법 일부개정법률안\n성폭력범죄의 처벌 등에 관한 특례법 일부를 다음과 같이 개정한다.\n제14조의2제4항을 제5항으로 하고, 같은 조에 제4항을 다음과 같이 신\n설한다.\n④ 제1항 또는 제2항의 편집물등 또는 복제물을 소지ㆍ구입ㆍ저장\n또는 시청한 자는 1년 이하의 징역 또는 1천만원 이하의 벌금에 처\n한다.\n부 칙\n이 법은 공포 후 6개월이 경과한 날부터 시행한다.\n\n\n\n\n신ㆍ구조문대비표\n현 행 개 정 안\n제14조의2(허위영상물 등의 반포 제14조의2(허위영상물 등의 반포\n등) ① ∼ ③ (생 략) 등) ① ∼ ③ (현행과 같음)\n<신 설> ④ 제1항 또는 제2항의 편집물\n등 또는 복제물을 소지ㆍ구입\nㆍ저장 또는 시청한 자는 1년\n이하의 징역 또는 1천만원 이\n하의 벌금에 처한다.\n④ (생 략) ⑤ (현행 제4항과 같음)\n",
  "sections": {
    "제안이유": "및",
    "주요내용": "현행법은 촬영물 또는 영상물등을 대상자의 의사에 반하여 성적 욕\n망 또는 수치심을 유발할 수 있는 형태로 편집, 합성, 가공하거나 이\n를 반포한 자 또는 허위영상물을 편집, 합성 또는 가공할 당시에는 대\n상자의 의사에 반하지 아니하였으나 사후에 대상자의 의사에 반하여\n이를 반포한 자를 처벌하도록 규정하고 있음.\n그런데 카메라 등을 이용한 촬영물 또는 복제물의 경우 이를 반포\nㆍ판매ㆍ임대한 자를 처벌함과 동시에 이를 구입하거나 소지, 구입,\n저장 또는 시청한 자를 처벌토록 한 것과 달리 허위영상물의 경우에\n는 소지 등을 한 자를 처벌하는 규정이 없어 형평에 맞지 않다는 의\n견이 있음.\n이에 허위영상물 등을 소지ㆍ구입ㆍ저장 또는 시청한 자를 처벌할\n수 있도록 규정하고자 함(안 제14조의2제4항 신설).",
    "제안이유_및_주요내용": "현행법은 촬영물 또는 영상물등을 대상자의 의사에 반하여 성적 욕\n망 또는 수치심을 유발할 수 있는 형태로 편집, 합성, 가공하거나 이\n를 반포한 자 또는 허위영상물을 편집, 합성 또는 가공할 당시에는 대\n상자의 의사에 반하지 아니하였으나 사후에 대상자의 의사에 반하여\n이를 반포한 자를 처벌하도록 규정하고 있음.\n그런데 카메라 등을 이용한 촬영물 또는 복제물의 경우 이를 반포\nㆍ판매ㆍ임대한 자를 처벌함과 동시에 이를 구입하거나 소지, 구입,\n저장 또는 시청한 자를 처벌토록 한 것과 달리 허위영상물의 경우에\n는 소지 등을 한 자를 처벌하는 규정이 없어 형평에 맞지 않다는 의\n견이 있음.\n이에 허위영상물 등을 소지ㆍ구입ㆍ저장 또는 시청한 자를 처벌할\n수 있도록 규정하고자 함(안 제14조의2제4항 신설).",
    "법률_제_호": "성폭력범죄의 처벌 등에 관한 특례법 일부개정법률안\n성폭력범죄의 처벌 등에 관한 특례법 일부를 다음과 같이 개정한다.\n제14조의2제4항을 제5항으로 하고, 같은 조에 제4항을 다음과 같이 신\n설한다.\n④ 제1항 또는 제2항의 편집물등 또는 복제물을 소지ㆍ구입ㆍ저장\n또는 시청한 자는 1년 이하의 징역 또는 1천만원 이하의 벌금에 처\n한다.",
    "신구조문대비표": "현 행 개 정 안\n제14조의2(허위영상물 등의 반포 제14조의2(허위영상물 등의 반포\n등) ① ∼ ③ (생 략) 등) ① ∼ ③ (현행과 같음)\n<신 설> ④ 제1항 또는 제2항의 편집물\n등 또는 복제물을 소지ㆍ구입\nㆍ저장 또는 시청한 자는 1년\n이하의 징역 또는 1천만원 이\n하의 벌금에 처한다.\n④ (생 략) ⑤ (현행 제4항과 같음)"
  }
}