{
  "title": "2203737_식품위생법_일부개정법률안",
  "bill_number": "3737",
  "proposal_date": "2024. 9. 6.",
  "submission_date": "",
  "is_alternative": false,
  "alternative_bill_numbers": [],
  "has_comparison_table": false,
  "comparison_table": "신ㆍ구조문대비표\n현 행 개 정 안\n제40조(건강진단) ① ∼ ③ (생 제40조(건강진단) ① ∼ ③ (현행\n략) 과 같음)\n<신 설> ④ 제1항 본문에 따른 건강진\n단 비용은 국가가 전부를 부담\n한다.\n④ (생 략) ⑤ (현행 제4항과 같음)",
  "full_text": "식품위생법 일부개정법률안\n(이수진의원 대표발의)\n발의연월일 : 2024. 9. 6.\n의 안\n3737\n번 호 발 의 자 : 이수진ㆍ이연희ㆍ송옥주\n김정호ㆍ서미화ㆍ장철민\n민병덕ㆍ김 윤ㆍ추미애\n최기상ㆍ김태년ㆍ한창민\n의원(12인)\n제안이유 및 주요내용\n현행법령은 식품 또는 식품첨가물을 채취ㆍ제조ㆍ가공ㆍ조리ㆍ저장\nㆍ운반 또는 판매하는 일에 직접 종사하는 영업자 및 종업원에게 건\n강진단을 의무적으로 받도록 규정하고 있음.\n그런데 이 건강진단은 공중의 안전을 위해 의무화한 것이기 때문에\n국가 또는 지방자치단체가 건강진단 비용을 부담하는 것이 타당한바,\n이에 대한 개선이 필요함.\n이에 국가가 해당 영업자 및 종업원의 건강진단 비용의 전부를 부\n담하도록 하려는 것임(안 제40조제4항 신설).\n\n\n\n\n법률 제 호\n식품위생법 일부개정법률안\n식품위생법 일부를 다음과 같이 개정한다.\n제40조제4항을 제5항으로 하고, 같은 조에 제4항을 다음과 같이 신설\n한다.\n④ 제1항 본문에 따른 건강진단 비용은 국가가 전부를 부담한다.\n부 칙\n이 법은 2025년 1월 1일부터 시행한다.\n\n\n\n\n신ㆍ구조문대비표\n현 행 개 정 안\n제40조(건강진단) ① ∼ ③ (생 제40조(건강진단) ① ∼ ③ (현행\n략) 과 같음)\n<신 설> ④ 제1항 본문에 따른 건강진\n단 비용은 국가가 전부를 부담\n한다.\n④ (생 략) ⑤ (현행 제4항과 같음)\n",
  "sections": {
    "제안이유": "및",
    "주요내용": "현행법령은 식품 또는 식품첨가물을 채취ㆍ제조ㆍ가공ㆍ조리ㆍ저장\nㆍ운반 또는 판매하는 일에 직접 종사하는 영업자 및 종업원에게 건\n강진단을 의무적으로 받도록 규정하고 있음.\n그런데 이 건강진단은 공중의 안전을 위해 의무화한 것이기 때문에\n국가 또는 지방자치단체가 건강진단 비용을 부담하는 것이 타당한바,\n이에 대한 개선이 필요함.\n이에 국가가 해당 영업자 및 종업원의 건강진단 비용의 전부를 부\n담하도록 하려는 것임(안 제40조제4항 신설).",
    "제안이유_및_주요내용": "현행법령은 식품 또는 식품첨가물을 채취ㆍ제조ㆍ가공ㆍ조리ㆍ저장\nㆍ운반 또는 판매하는 일에 직접 종사하는 영업자 및 종업원에게 건\n강진단을 의무적으로 받도록 규정하고 있음.\n그런데 이 건강진단은 공중의 안전을 위해 의무화한 것이기 때문에\n국가 또는 지방자치단체가 건강진단 비용을 부담하는 것이 타당한바,\n이에 대한 개선이 필요함.\n이에 국가가 해당 영업자 및 종업원의 건강진단 비용의 전부를 부\n담하도록 하려는 것임(안 제40조제4항 신설).",
    "법률_제_호": "식품위생법 일부개정법률안\n식품위생법 일부를 다음과 같이 개정한다.\n제40조제4항을 제5항으로 하고, 같은 조에 제4항을 다음과 같이 신설\n한다.\n④ 제1항 본문에 따른 건강진단 비용은 국가가 전부를 부담한다.",
    "신구조문대비표": "현 행 개 정 안\n제40조(건강진단) ① ∼ ③ (생 제40조(건강진단) ① ∼ ③ (현행\n략) 과 같음)\n<신 설> ④ 제1항 본문에 따른 건강진\n단 비용은 국가가 전부를 부담\n한다.\n④ (생 략) ⑤ (현행 제4항과 같음)"
  }
}