{
  "title": "2203645_형법_일부개정법률안",
  "bill_number": "3645",
  "proposal_date": "2024. 9. 4.",
  "submission_date": "",
  "is_alternative": false,
  "alternative_bill_numbers": [],
  "has_comparison_table": false,
  "comparison_table": "신ㆍ구조문대비표\n현 행 개 정 안\n第9條(刑事未成年者) 14歲되지 아 第9條(刑事未成年者) 12세되지 --\n니한 者의 行爲는 罰하지 아니 ------------------------\n한다. <단서 신설> ---. 다만, 이 법 제2편 제1장부\n터 제4장까지의 죄에 대해서는\n14세 되지 아니한 자의 행위는\n벌하지 아니한다.",
  "full_text": "형법 일부개정법률안\n(김용민의원 대표발의)\n발의연월일 : 2024. 9. 4.\n의 안\n3645\n번 호 발 의 자 : 김용민ㆍ강유정ㆍ한준호\n서영석ㆍ김동아ㆍ서미화\n김 현ㆍ황운하ㆍ김용만\n문정복 의원(10인)\n제안이유 및 주요내용\n제반 사회환경의 변화로 말미암아 현재 청소년은 인터넷을 통한 자\n극적인 미디어 매체, 오락물 등에 쉽게 노출되어 과거와는 비교할 수\n없을 정도로 신체적ㆍ정신적 성장 속도가 빨라졌음.\n범죄 패턴이 강하게, 성인들의 이상동기 범죄와 상당 부분 유사하게\n나타나고 있으며, 2021년~2023년까지 최근 3년 촉법소년 현황 비율은\n2021년 11,677명, 2022년 16,435명, 2023년 19,654명으로 촉법소년의 범\n죄가 지속적으로 증가함을 알 수 있음.\n과거 단순 절도나 폭력에 그치던 것에서 방화, 강간, 추행 등 강력\n범죄로 비화하고, 특히 현대 사회에서 심각한 문제로 대두되고 있는\n마약범죄로까지 이어지고 있음.\n촉법소년이 처벌 대상이 되지 않거나 미비한 처벌로 마무리되는 사\n례가 꾸준히 드러나자 ‘촉법소년 연령 하향 조정’을 요구하는 목소리\n\n\n\n가 커지고 있음.\n이에 청소년들의 범죄를 예방하고, 법적 제도를 강화하고자 우리나\n라도 현행 교육과정 제도를 고려하여 초등교육 교과 수료 무렵인 만\n12세 정도로 형사 미성년자 연령을 낮추는 것이 바람직함.\n다만, 사회적 해악이 상대적으로 적고 정치적 의미가 강한 국가적\n법익에 관한 죄 중 제1장 내란의 죄, 제2장 외환의 죄, 제3장 국기에\n관한 죄, 제4장 국교에 관한 죄에 대해서는 종전과 같이 형사 미성년\n자 연령을 만 14세로 유지함.\n이에 형사미성년자의 기준을 만 12세로 조정하고, 다만 이 법 제1장\n내란의 죄부터 제4장 국교에 관한 죄까지는 만 14세로 함(안 제9조).\n\n법률 제 호\n형법 일부개정법률안\n형법 일부를 다음과 같이 개정한다.\n제9조 중 “14세되지”를 “12세되지”로 하고, 같은 조에 단서를 다음과\n같이 신설한다.\n다만, 이 법 제2편 제1장부터 제4장까지의 죄에 대해서는 14세 되지\n아니한 자의 행위는 벌하지 아니한다.\n부 칙\n이 법은 공포한 날부터 시행한다.\n\n\n\n\n신ㆍ구조문대비표\n현 행 개 정 안\n第9條(刑事未成年者) 14歲되지 아 第9條(刑事未成年者) 12세되지 --\n니한 者의 行爲는 罰하지 아니 ------------------------\n한다. <단서 신설> ---. 다만, 이 법 제2편 제1장부\n터 제4장까지의 죄에 대해서는\n14세 되지 아니한 자의 행위는\n벌하지 아니한다.\n",
  "sections": {
    "제안이유": "및",
    "주요내용": "제반 사회환경의 변화로 말미암아 현재 청소년은 인터넷을 통한 자\n극적인 미디어 매체, 오락물 등에 쉽게 노출되어 과거와는 비교할 수\n없을 정도로 신체적ㆍ정신적 성장 속도가 빨라졌음.\n범죄 패턴이 강하게, 성인들의 이상동기 범죄와 상당 부분 유사하게\n나타나고 있으며, 2021년~2023년까지 최근 3년 촉법소년 현황 비율은\n2021년 11,677명, 2022년 16,435명, 2023년 19,654명으로 촉법소년의 범\n죄가 지속적으로 증가함을 알 수 있음.\n과거 단순 절도나 폭력에 그치던 것에서 방화, 강간, 추행 등 강력\n범죄로 비화하고, 특히 현대 사회에서 심각한 문제로 대두되고 있는\n마약범죄로까지 이어지고 있음.\n촉법소년이 처벌 대상이 되지 않거나 미비한 처벌로 마무리되는 사\n례가 꾸준히 드러나자 ‘촉법소년 연령 하향 조정’을 요구하는 목소리\n\n\n\n가 커지고 있음.\n이에 청소년들의 범죄를 예방하고, 법적 제도를 강화하고자 우리나\n라도 현행 교육과정 제도를 고려하여 초등교육 교과 수료 무렵인 만\n12세 정도로 형사 미성년자 연령을 낮추는 것이 바람직함.\n다만, 사회적 해악이 상대적으로 적고 정치적 의미가 강한 국가적\n법익에 관한 죄 중 제1장 내란의 죄, 제2장 외환의 죄, 제3장 국기에\n관한 죄, 제4장 국교에 관한 죄에 대해서는 종전과 같이 형사 미성년\n자 연령을 만 14세로 유지함.\n이에 형사미성년자의 기준을 만 12세로 조정하고, 다만 이 법 제1장\n내란의 죄부터 제4장 국교에 관한 죄까지는 만 14세로 함(안 제9조).",
    "제안이유_및_주요내용": "제반 사회환경의 변화로 말미암아 현재 청소년은 인터넷을 통한 자\n극적인 미디어 매체, 오락물 등에 쉽게 노출되어 과거와는 비교할 수\n없을 정도로 신체적ㆍ정신적 성장 속도가 빨라졌음.\n범죄 패턴이 강하게, 성인들의 이상동기 범죄와 상당 부분 유사하게\n나타나고 있으며, 2021년~2023년까지 최근 3년 촉법소년 현황 비율은\n2021년 11,677명, 2022년 16,435명, 2023년 19,654명으로 촉법소년의 범\n죄가 지속적으로 증가함을 알 수 있음.\n과거 단순 절도나 폭력에 그치던 것에서 방화, 강간, 추행 등 강력\n범죄로 비화하고, 특히 현대 사회에서 심각한 문제로 대두되고 있는\n마약범죄로까지 이어지고 있음.\n촉법소년이 처벌 대상이 되지 않거나 미비한 처벌로 마무리되는 사\n례가 꾸준히 드러나자 ‘촉법소년 연령 하향 조정’을 요구하는 목소리\n\n\n\n가 커지고 있음.\n이에 청소년들의 범죄를 예방하고, 법적 제도를 강화하고자 우리나\n라도 현행 교육과정 제도를 고려하여 초등교육 교과 수료 무렵인 만\n12세 정도로 형사 미성년자 연령을 낮추는 것이 바람직함.\n다만, 사회적 해악이 상대적으로 적고 정치적 의미가 강한 국가적\n법익에 관한 죄 중 제1장 내란의 죄, 제2장 외환의 죄, 제3장 국기에\n관한 죄, 제4장 국교에 관한 죄에 대해서는 종전과 같이 형사 미성년\n자 연령을 만 14세로 유지함.\n이에 형사미성년자의 기준을 만 12세로 조정하고, 다만 이 법 제1장\n내란의 죄부터 제4장 국교에 관한 죄까지는 만 14세로 함(안 제9조).",
    "법률_제_호": "형법 일부개정법률안\n형법 일부를 다음과 같이 개정한다.\n제9조 중 “14세되지”를 “12세되지”로 하고, 같은 조에 단서를 다음과\n같이 신설한다.\n다만, 이 법 제2편 제1장부터 제4장까지의 죄에 대해서는 14세 되지\n아니한 자의 행위는 벌하지 아니한다.",
    "신구조문대비표": "현 행 개 정 안\n第9條(刑事未成年者) 14歲되지 아 第9條(刑事未成年者) 12세되지 --\n니한 者의 行爲는 罰하지 아니 ------------------------\n한다. <단서 신설> ---. 다만, 이 법 제2편 제1장부\n터 제4장까지의 죄에 대해서는\n14세 되지 아니한 자의 행위는\n벌하지 아니한다."
  }
}