{
  "title": "2203725_경비업법_일부개정법률안",
  "bill_number": "3725",
  "proposal_date": "",
  "submission_date": "2024. 9. 5.",
  "is_alternative": false,
  "alternative_bill_numbers": [],
  "has_comparison_table": false,
  "comparison_table": "신ㆍ구조문대비표\n현 행 개 정 안\n제15조의2(경비원 등의 의무) ① 제15조의2(경비원 등의 의무) ①\n(생 략) (현행과 같음)\n<신 설> ②경비원은 직무를 수행함에\n있어 다른 사람의 자유와 권리\n를 침해하거나 그의 정당한 활\n동에 간섭하여서는 아니 된다.\n② (생 략) ③ (현행 제2항과 같음)",
  "full_text": "경비업법 일부개정법률안\n(이개호의원 대표발의)\n제안연월일 : 2024. 9. 5.\n의 안\n3725\n번 호 제 안 자 : 이개호ㆍ이기헌ㆍ김현정\n박희승ㆍ이정문ㆍ김영배\n박수현ㆍ정진욱ㆍ이언주\n위성곤 의원(10인)\n제안이유 및 주요내용\n현행 경비업은 경비가 필요한 시설이나 장소, 현금이나 귀중품의 호\n송, 그리고 사람의 생명이나 신체에 대한 위해를 방지하고 그 신변을\n보호하기 위해 관련법에 규정을 두고 있음.\n그러나 유명 연예인이나 스포츠 스타들의 행사나 이동시에 많은 팬\n들이 몰리고 이들에 대한 신변 경호가 강화되면서 경호업에 종사하는\n종사자들이 과도한 경호업무를 수행하고 있음.\n특히 최근에는 유명 배우를 경호하는 사설 경호 업체가 공항 입구\n를 임의로 막거나, 시민들의 여권과 탑승권을 검사할 뿐만아니라 심지\n어는 시민들을 향해 플래시를 쏘는 등 경호 업무를 빙자한 과도한 행\n위로 다른 사람의 자유와 권리를 침해하거나 정당한 활동을 간섭 한\n바 있음.\n이에 경비업 종사자들이 경비업무 과정에서 다른 사람에 대한 자유\n\n\n\n와 권리, 정당한 활동을 침해하거나 방해하지 못하도록 방지하기 위한\n근거 규정을 마련하려는 것임(안 제15조의2제2항 신설).\n\n법률 제 호\n경비업법 일부개정법률안\n경비업법 일부를 다음과 같이 개정한다.\n제15조의2제2항을 제3항으로 하고, 같은 조에 제2항을 다음과 같이 신\n설한다.\n②경비원은 직무를 수행함에 있어 다른 사람의 자유와 권리를 침해\n하거나 그의 정당한 활동에 간섭하여서는 아니 된다.\n부 칙\n이 법은 공포한 날부터 시행한다.\n\n\n\n\n신ㆍ구조문대비표\n현 행 개 정 안\n제15조의2(경비원 등의 의무) ① 제15조의2(경비원 등의 의무) ①\n(생 략) (현행과 같음)\n<신 설> ②경비원은 직무를 수행함에\n있어 다른 사람의 자유와 권리\n를 침해하거나 그의 정당한 활\n동에 간섭하여서는 아니 된다.\n② (생 략) ③ (현행 제2항과 같음)\n",
  "sections": {
    "제안이유": "및",
    "주요내용": "현행 경비업은 경비가 필요한 시설이나 장소, 현금이나 귀중품의 호\n송, 그리고 사람의 생명이나 신체에 대한 위해를 방지하고 그 신변을\n보호하기 위해 관련법에 규정을 두고 있음.\n그러나 유명 연예인이나 스포츠 스타들의 행사나 이동시에 많은 팬\n들이 몰리고 이들에 대한 신변 경호가 강화되면서 경호업에 종사하는\n종사자들이 과도한 경호업무를 수행하고 있음.\n특히 최근에는 유명 배우를 경호하는 사설 경호 업체가 공항 입구\n를 임의로 막거나, 시민들의 여권과 탑승권을 검사할 뿐만아니라 심지\n어는 시민들을 향해 플래시를 쏘는 등 경호 업무를 빙자한 과도한 행\n위로 다른 사람의 자유와 권리를 침해하거나 정당한 활동을 간섭 한\n바 있음.\n이에 경비업 종사자들이 경비업무 과정에서 다른 사람에 대한 자유\n\n\n\n와 권리, 정당한 활동을 침해하거나 방해하지 못하도록 방지하기 위한\n근거 규정을 마련하려는 것임(안 제15조의2제2항 신설).",
    "제안이유_및_주요내용": "현행 경비업은 경비가 필요한 시설이나 장소, 현금이나 귀중품의 호\n송, 그리고 사람의 생명이나 신체에 대한 위해를 방지하고 그 신변을\n보호하기 위해 관련법에 규정을 두고 있음.\n그러나 유명 연예인이나 스포츠 스타들의 행사나 이동시에 많은 팬\n들이 몰리고 이들에 대한 신변 경호가 강화되면서 경호업에 종사하는\n종사자들이 과도한 경호업무를 수행하고 있음.\n특히 최근에는 유명 배우를 경호하는 사설 경호 업체가 공항 입구\n를 임의로 막거나, 시민들의 여권과 탑승권을 검사할 뿐만아니라 심지\n어는 시민들을 향해 플래시를 쏘는 등 경호 업무를 빙자한 과도한 행\n위로 다른 사람의 자유와 권리를 침해하거나 정당한 활동을 간섭 한\n바 있음.\n이에 경비업 종사자들이 경비업무 과정에서 다른 사람에 대한 자유\n\n\n\n와 권리, 정당한 활동을 침해하거나 방해하지 못하도록 방지하기 위한\n근거 규정을 마련하려는 것임(안 제15조의2제2항 신설).",
    "법률_제_호": "경비업법 일부개정법률안\n경비업법 일부를 다음과 같이 개정한다.\n제15조의2제2항을 제3항으로 하고, 같은 조에 제2항을 다음과 같이 신\n설한다.\n②경비원은 직무를 수행함에 있어 다른 사람의 자유와 권리를 침해\n하거나 그의 정당한 활동에 간섭하여서는 아니 된다.",
    "신구조문대비표": "현 행 개 정 안\n제15조의2(경비원 등의 의무) ① 제15조의2(경비원 등의 의무) ①\n(생 략) (현행과 같음)\n<신 설> ②경비원은 직무를 수행함에\n있어 다른 사람의 자유와 권리\n를 침해하거나 그의 정당한 활\n동에 간섭하여서는 아니 된다.\n② (생 략) ③ (현행 제2항과 같음)"
  }
}