{
  "title": "2203974_국민연금법_일부개정법률안",
  "bill_number": "3974",
  "proposal_date": "2024. 9. 12.",
  "submission_date": "",
  "is_alternative": false,
  "alternative_bill_numbers": [],
  "has_comparison_table": false,
  "comparison_table": "신ㆍ구조문대비표\n현 행 개 정 안\n법률 제15267호 국민연금법 일부 법률 제15267호 국민연금법 일부\n개정법률 ",
  "full_text": "국민연금법 일부개정법률안\n(박수민의원 대표발의)\n발의연월일 : 2024. 9. 12.\n의 안\n3974\n번 호 발 의 자 : 박수민ㆍ이헌승ㆍ임종득\n이인선ㆍ조지연ㆍ김선교\n김민전ㆍ고동진ㆍ정성국\n김소희 의원(10인)\n제안이유 및 주요내용\n분할연금제도는 노령연금 수급권자의 노령연금을 이혼한 배우자 사\n이에 청산ㆍ분배하는 것으로, 구법은 분할연금제도 수급 요건이 되는\n혼인 기간을 ‘법률혼’ 기간으로 하였으나 2016. 12. 19. 2015헌바182 결\n정에 따라 2018년 6월 20일부터 시행된 신법에서는 그 기간을 ‘사실\n혼’ 기준으로 변경하였음. 이는 별거나 가출 등으로 실질적인 혼인관\n계가 존재하지 아니하여 연금 형성에 기여가 없는 이혼배우자에게까\n지 법률혼 기간을 기준으로 분할연금 수급권을 인정하는 것이 불합리\n하기 때문임.\n그런데 해당 조문 개정 시 ‘법률 시행 후 최초로 분할연금 지급 사\n유가 발생한 경우’부터 적용하는 것으로 개정법률의 적용 대상을 규정\n하였는데, 최근 헌법재판소는 이러한 규정이 평등원칙을 위반한 위헌\n으로 보았음.\n\n\n\n구체적으로, ‘실질적인 혼인관계가 해소되어 분할연금의 기초가 되\n는 노령연금 수급권 형성에 아무런 기여가 없는 경우에는 노령연금\n분할을 청구할 전제를 갖추지 못한 것으로 볼 수 있다는 점에서 분할\n연금 지급 사유 발생 시점이 신법 조항 시행일 전인 경우와 후인 경\n우 사이에 아무런 차이가 없으므로, 분할연금 지급 사유 발생시점이\n신법 조항 시행일 전ㆍ후인지와 같은 우연한 사정을 기준으로 달리\n취급하는 것은 합리적인 이유를 찾기 어렵다’고 판시하였음.\n이에 종전 헌법불합치 결정일(2016년 12월 29일)부터 신법 조항 시\n행일 전일(2018년 6월 19일)까지의 기간에 분할연금 지급사유가 발생\n한 경우로서 2018년 6월 20일 이후 발생한 분할연금 수급권에 대해서\n도 신법을 적용하도록 하여 위헌적인 요소를 해소하려는 것임(법률 제\n15267호 국민연금법 일부개정법률 부칙 제2조제2항 신설).\n\n법률 제 호\n국민연금법 일부개정법률안\n국민연금법 일부를 다음과 같이 개정한다.\n법률 제15267호 국민연금법 일부개정법률 부칙 제2조 제목 외의 부분\n을 제1항으로 하고, 같은 조에 제2항을 다음과 같이 신설한다.\n② 제1항에도 불구하고 제64조제1항 및 제4항의 개정규정은 2016년\n12월 29일부터 2018년 6월 19일까지의 기간에 지급사유가 발생한\n경우로서 2018년 6월 20일 이후 발생한 분할연금 수급권(소송에 따\n라 분할연금 지급권 변경에 관한 처분이 확정된 수급권은 제외한다)\n에 대해서도 적용한다. 이 경우 지급된 급여의 환수에 대해서는 제\n57조 및 제57조의2의 규정을 적용한다.\n부 칙\n이 법은 공포한 날부터 시행한다.\n\n\n\n\n신ㆍ구조문대비표\n현 행 개 정 안\n법률 제15267호 국민연금법 일부 법률 제15267호 국민연금법 일부\n개정법률 부칙 개정법률 부칙\n제2조(분할연금 수급권자 등에 제2조(분할연금 수급권자 등에\n관한 적용례) (생 략) 관한 적용례) ① (현행 제목 외\n의 부분과 같음)\n<신 설> ② 제1항에도 불구하고 제64조\n제1항 및 제4항의 개정규정은\n2016년 12월 29일부터 2018년\n6월 19일까지의 기간에 지급사\n유가 발생한 경우로서 2018년\n6월 20일 이후 발생한 분할연\n금 수급권(소송에 따라 분할연\n금 지급권 변경에 관한 처분이\n확정된 수급권은 제외한다)에\n대해서도 적용한다. 이 경우 지\n급된 급여의 환수에 대해서는\n제57조 및 제57조의2의 규정을\n적용한다.\n",
  "sections": {
    "제안이유": "및",
    "주요내용": "분할연금제도는 노령연금 수급권자의 노령연금을 이혼한 배우자 사\n이에 청산ㆍ분배하는 것으로, 구법은 분할연금제도 수급 요건이 되는\n혼인 기간을 ‘법률혼’ 기간으로 하였으나 2016. 12. 19. 2015헌바182 결\n정에 따라 2018년 6월 20일부터 시행된 신법에서는 그 기간을 ‘사실\n혼’ 기준으로 변경하였음. 이는 별거나 가출 등으로 실질적인 혼인관\n계가 존재하지 아니하여 연금 형성에 기여가 없는 이혼배우자에게까\n지 법률혼 기간을 기준으로 분할연금 수급권을 인정하는 것이 불합리\n하기 때문임.\n그런데 해당 조문 개정 시 ‘법률 시행 후 최초로 분할연금 지급 사\n유가 발생한 경우’부터 적용하는 것으로 개정법률의 적용 대상을 규정\n하였는데, 최근 헌법재판소는 이러한 규정이 평등원칙을 위반한 위헌\n으로 보았음.\n\n\n\n구체적으로, ‘실질적인 혼인관계가 해소되어 분할연금의 기초가 되\n는 노령연금 수급권 형성에 아무런 기여가 없는 경우에는 노령연금\n분할을 청구할 전제를 갖추지 못한 것으로 볼 수 있다는 점에서 분할\n연금 지급 사유 발생 시점이 신법 조항 시행일 전인 경우와 후인 경\n우 사이에 아무런 차이가 없으므로, 분할연금 지급 사유 발생시점이\n신법 조항 시행일 전ㆍ후인지와 같은 우연한 사정을 기준으로 달리\n취급하는 것은 합리적인 이유를 찾기 어렵다’고 판시하였음.\n이에 종전 헌법불합치 결정일(2016년 12월 29일)부터 신법 조항 시\n행일 전일(2018년 6월 19일)까지의 기간에 분할연금 지급사유가 발생\n한 경우로서 2018년 6월 20일 이후 발생한 분할연금 수급권에 대해서\n도 신법을 적용하도록 하여 위헌적인 요소를 해소하려는 것임(",
    "제안이유_및_주요내용": "분할연금제도는 노령연금 수급권자의 노령연금을 이혼한 배우자 사\n이에 청산ㆍ분배하는 것으로, 구법은 분할연금제도 수급 요건이 되는\n혼인 기간을 ‘법률혼’ 기간으로 하였으나 2016. 12. 19. 2015헌바182 결\n정에 따라 2018년 6월 20일부터 시행된 신법에서는 그 기간을 ‘사실\n혼’ 기준으로 변경하였음. 이는 별거나 가출 등으로 실질적인 혼인관\n계가 존재하지 아니하여 연금 형성에 기여가 없는 이혼배우자에게까\n지 법률혼 기간을 기준으로 분할연금 수급권을 인정하는 것이 불합리\n하기 때문임.\n그런데 해당 조문 개정 시 ‘법률 시행 후 최초로 분할연금 지급 사\n유가 발생한 경우’부터 적용하는 것으로 개정법률의 적용 대상을 규정\n하였는데, 최근 헌법재판소는 이러한 규정이 평등원칙을 위반한 위헌\n으로 보았음.\n\n\n\n구체적으로, ‘실질적인 혼인관계가 해소되어 분할연금의 기초가 되\n는 노령연금 수급권 형성에 아무런 기여가 없는 경우에는 노령연금\n분할을 청구할 전제를 갖추지 못한 것으로 볼 수 있다는 점에서 분할\n연금 지급 사유 발생 시점이 신법 조항 시행일 전인 경우와 후인 경\n우 사이에 아무런 차이가 없으므로, 분할연금 지급 사유 발생시점이\n신법 조항 시행일 전ㆍ후인지와 같은 우연한 사정을 기준으로 달리\n취급하는 것은 합리적인 이유를 찾기 어렵다’고 판시하였음.\n이에 종전 헌법불합치 결정일(2016년 12월 29일)부터 신법 조항 시\n행일 전일(2018년 6월 19일)까지의 기간에 분할연금 지급사유가 발생\n한 경우로서 2018년 6월 20일 이후 발생한 분할연금 수급권에 대해서\n도 신법을 적용하도록 하여 위헌적인 요소를 해소하려는 것임(",
    "법률_제_호": "국민연금법 일부개정법률",
    "신구조문대비표": "현 행 개 정 안\n법률 제15267호 국민연금법 일부 법률 제15267호 국민연금법 일부\n개정법률"
  }
}