{
  "title": "2203332_지방교육재정교부금법_일부개정법률안",
  "bill_number": "3332",
  "proposal_date": "2024. 8. 29.",
  "submission_date": "",
  "is_alternative": false,
  "alternative_bill_numbers": [],
  "has_comparison_table": false,
  "comparison_table": "신ㆍ구조문대비표\n현 행 개 정 안\n법률 제16673호 지방교육재정교 법률 제16673호 지방교육재정교\n부금법 일부개정법률 ",
  "full_text": "지방교육재정교부금법 일부개정법률안\n(진선미의원 대표발의)\n발의연월일 : 2024. 8. 29.\n의 안\n3332\n번 호 발 의 자 : 진선미ㆍ이학영ㆍ임오경\n김문수ㆍ문정복ㆍ이기헌\n조승래ㆍ강경숙ㆍ송재봉\n이용우 의원(10인)\n제안이유 및 주요내용\n현행법은 고등학교 무상교육 등에 필요한 비용 중 1,000분의 475에\n해당하는 금액을 지방자치단체에 교부하는 교부금 외에 따로 증액교\n부하고 시ㆍ도 및 시ㆍ군ㆍ구가 고등학교 등의 무상교육에 필요한 비\n용 중 1,000분의 50에 해당하는 금액을 대통령령으로 정하는 바에 따\n라 교육비특별회계로 전출하도록 규정하고 있음.\n그런데 해당 특례 규정의 유효기간은 2024년 12월 31까지로 규정되\n어 있어 고등학교 무상교육의 안정적 추진을 위해서는 해당 규정을\n개정할 필요가 있음.\n이에 부칙에 규정된 고등학교 무상교육 경비 부담에 관한 특례 규\n정의 유효기간을 삭제하여 재원에 대한 걱정없이 고등학교 무상교육\n을 지속적으로 실시하려는 것임(법률 제16673호 지방교육재정교부금법\n일부개정법률 부칙 제2조 삭제).\n\n\n\n\n법률 제 호\n지방교육재정교부금법 일부개정법률안\n지방교육재정교부금법 일부를 다음과 같이 개정한다.\n법률 제16673호 지방교육재정교부금법 일부개정법률 부칙 제2조를 삭\n제한다.\n부 칙\n이 법은 공포한 날부터 시행한다.\n\n\n\n\n신ㆍ구조문대비표\n현 행 개 정 안\n법률 제16673호 지방교육재정교 법률 제16673호 지방교육재정교\n부금법 일부개정법률 부칙 부금법 일부개정법률 부칙\n제2조(유효기간) 제14조의 개정규 <삭 제>\n정은 2020년 1월 1일부터 2024\n년 12월 31일까지 효력을 가진\n다.\n",
  "sections": {
    "제안이유": "및",
    "주요내용": "현행법은 고등학교 무상교육 등에 필요한 비용 중 1,000분의 475에\n해당하는 금액을 지방자치단체에 교부하는 교부금 외에 따로 증액교\n부하고 시ㆍ도 및 시ㆍ군ㆍ구가 고등학교 등의 무상교육에 필요한 비\n용 중 1,000분의 50에 해당하는 금액을 대통령령으로 정하는 바에 따\n라 교육비특별회계로 전출하도록 규정하고 있음.\n그런데 해당 특례 규정의 유효기간은 2024년 12월 31까지로 규정되\n어 있어 고등학교 무상교육의 안정적 추진을 위해서는 해당 규정을\n개정할 필요가 있음.\n이에 부칙에 규정된 고등학교 무상교육 경비 부담에 관한 특례 규\n정의 유효기간을 삭제하여 재원에 대한 걱정없이 고등학교 무상교육\n을 지속적으로 실시하려는 것임(",
    "제안이유_및_주요내용": "현행법은 고등학교 무상교육 등에 필요한 비용 중 1,000분의 475에\n해당하는 금액을 지방자치단체에 교부하는 교부금 외에 따로 증액교\n부하고 시ㆍ도 및 시ㆍ군ㆍ구가 고등학교 등의 무상교육에 필요한 비\n용 중 1,000분의 50에 해당하는 금액을 대통령령으로 정하는 바에 따\n라 교육비특별회계로 전출하도록 규정하고 있음.\n그런데 해당 특례 규정의 유효기간은 2024년 12월 31까지로 규정되\n어 있어 고등학교 무상교육의 안정적 추진을 위해서는 해당 규정을\n개정할 필요가 있음.\n이에 부칙에 규정된 고등학교 무상교육 경비 부담에 관한 특례 규\n정의 유효기간을 삭제하여 재원에 대한 걱정없이 고등학교 무상교육\n을 지속적으로 실시하려는 것임(",
    "법률_제_호": "지방교육재정교부금법\n일부개정법률",
    "신구조문대비표": "현 행 개 정 안\n법률 제16673호 지방교육재정교 법률 제16673호 지방교육재정교\n부금법 일부개정법률"
  }
}