{
  "title": "2203601_직업안정법_일부개정법률안",
  "bill_number": "3601",
  "proposal_date": "2024. 9. 3.",
  "submission_date": "",
  "is_alternative": false,
  "alternative_bill_numbers": [],
  "has_comparison_table": false,
  "comparison_table": "신ㆍ구조문대비표\n현 행 개 정 안\n제37조(폐쇄조치) ① (생 략) 제37조(폐쇄조치) ① (현행과 같\n음)\n② 제1항에 따라 조치를 하는 ② 제1항에 따른 행정상 강제에\n관계 공무원은 그 권한을 표시 관하여는 「행정기본법」 제32\n하는 증표를 지니고 이를 관계 조에 따른다.\n인에게 보여주어야 한다.",
  "full_text": "직업안정법 일부개정법률안\n(김위상의원 대표발의)\n발의연월일 : 2024. 9. 3.\n의 안\n3601\n번 호 발 의 자 : 김위상ㆍ김선교ㆍ임이자\n김승수ㆍ박정하ㆍ박충권\n송언석ㆍ신동욱ㆍ김종양\n배현진ㆍ나경원 의원\n(11인)\n제안이유 및 주요내용\n행정법 분야의 집행 원칙과 기준을 정하고 주요 행정 법제도에 관\n한 통일적인 규정을 마련하여 국민 중심의 행정법 체계를 실현하기\n위한 「행정기본법」이 제정됨에 따라, 행정상 강제에 관하여 「행정\n기본법」과 중복되는 규정은 삭제하고, 「행정기본법」과 개별 법률\n간의 적용관계를 명확히 하는 규정을 신설함으로써 행정법 체계의 정\n합성 및 형평성을 확보하고 국민들이 행정법 적용관계를 이해하기 쉽\n게 하려는 것임(안 제37조제2항).\n\n\n\n\n법률 제 호\n직업안정법 일부개정법률안\n직업안정법 일부를 다음과 같이 개정한다.\n제37조제2항을 다음과 같이 한다.\n② 제1항에 따른 행정상 강제에 관하여는 「행정기본법」 제32조에\n따른다.\n부 칙\n이 법은 공포한 날부터 시행한다.\n\n\n\n\n신ㆍ구조문대비표\n현 행 개 정 안\n제37조(폐쇄조치) ① (생 략) 제37조(폐쇄조치) ① (현행과 같\n음)\n② 제1항에 따라 조치를 하는 ② 제1항에 따른 행정상 강제에\n관계 공무원은 그 권한을 표시 관하여는 「행정기본법」 제32\n하는 증표를 지니고 이를 관계 조에 따른다.\n인에게 보여주어야 한다.\n",
  "sections": {
    "제안이유": "및",
    "주요내용": "행정법 분야의 집행 원칙과 기준을 정하고 주요 행정 법제도에 관\n한 통일적인 규정을 마련하여 국민 중심의 행정법 체계를 실현하기\n위한 「행정기본법」이 제정됨에 따라, 행정상 강제에 관하여 「행정\n기본법」과 중복되는 규정은 삭제하고, 「행정기본법」과 개별 법률\n간의 적용관계를 명확히 하는 규정을 신설함으로써 행정법 체계의 정\n합성 및 형평성을 확보하고 국민들이 행정법 적용관계를 이해하기 쉽\n게 하려는 것임(안 제37조제2항).",
    "제안이유_및_주요내용": "행정법 분야의 집행 원칙과 기준을 정하고 주요 행정 법제도에 관\n한 통일적인 규정을 마련하여 국민 중심의 행정법 체계를 실현하기\n위한 「행정기본법」이 제정됨에 따라, 행정상 강제에 관하여 「행정\n기본법」과 중복되는 규정은 삭제하고, 「행정기본법」과 개별 법률\n간의 적용관계를 명확히 하는 규정을 신설함으로써 행정법 체계의 정\n합성 및 형평성을 확보하고 국민들이 행정법 적용관계를 이해하기 쉽\n게 하려는 것임(안 제37조제2항).",
    "법률_제_호": "직업안정법 일부개정법률안\n직업안정법 일부를 다음과 같이 개정한다.\n제37조제2항을 다음과 같이 한다.\n② 제1항에 따른 행정상 강제에 관하여는 「행정기본법」 제32조에\n따른다.",
    "신구조문대비표": "현 행 개 정 안\n제37조(폐쇄조치) ① (생 략) 제37조(폐쇄조치) ① (현행과 같\n음)\n② 제1항에 따라 조치를 하는 ② 제1항에 따른 행정상 강제에\n관계 공무원은 그 권한을 표시 관하여는 「행정기본법」 제32\n하는 증표를 지니고 이를 관계 조에 따른다.\n인에게 보여주어야 한다."
  }
}