{
  "title": "2203848_국회법_일부개정법률안",
  "bill_number": "3848",
  "proposal_date": "2024. 9. 10.",
  "submission_date": "",
  "is_alternative": false,
  "alternative_bill_numbers": [],
  "has_comparison_table": false,
  "comparison_table": "신ㆍ구조문대비표\n현 행 개 정 안\n제151조(회의장 출입의 제한) (생 제151조(회의장 출입의 제한) ①\n략) (현행 제목 외의 부분과 같음)\n<신 설> ② 제1항에도 불구하고 의원은\n수유가 필요한 24개월 이하의\n영아인 자녀와 함께 회의장에\n출입할 수 있다.",
  "full_text": "국회법 일부개정법률안\n(용혜인의원 대표발의)\n발의연월일 : 2024. 9. 10.\n의 안\n3848\n번 호 발 의 자 : 용혜인ㆍ김남근ㆍ김남희\n박지혜ㆍ서왕진ㆍ송재봉\n염태영ㆍ이수진ㆍ정춘생\n정혜경ㆍ조 국ㆍ한창민\n황명선 의원(13인)\n제안이유 및 주요내용\n현행법은 회의장에 출입할 수 있는 사람을 의원ㆍ국무총리ㆍ국무위\n원 또는 정부위원, 그 밖에 의안 심의에 필요한 사람으로 제한하면서,\n그 외의 사람이 회의장에 출입하려면 의장의 허가를 받도록 규정하고\n있습니다.\n한편 호주나 유럽 의회 등 선진국에서는 여성의원이 본회의장에서\n아기를 동반하여 수유하는 것을 허용하고 있고, 실제로 모유수유를 한\n사례가 있습니다. 국회도 임기 중에 출산하는 의원의 의정활동 지원을\n위한 방편으로 회의장에 수유가 필요한 영아에 한하여 보호자인 의원\n과 함께 출입이 가능하도록 할 필요가 있습니다.\n이에 의원은 수유가 필요한 24개월 이하의 영아인 자녀와 함께 회\n의장에 출입할 수 있도록 하고자 합니다(안 제151조제2항 신설).\n\n\n\n\n법률 제 호\n국회법 일부개정법률안\n국회법 일부를 다음과 같이 개정한다.\n제151조 제목 외의 부분을 제1항으로 하고, 같은 조에 제2항을 다음과\n같이 신설한다.\n② 제1항에도 불구하고 의원은 수유가 필요한 24개월 이하의 영아\n인 자녀와 함께 회의장에 출입할 수 있다.\n부 칙\n이 법은 공포한 날부터 시행한다.\n\n\n\n\n신ㆍ구조문대비표\n현 행 개 정 안\n제151조(회의장 출입의 제한) (생 제151조(회의장 출입의 제한) ①\n략) (현행 제목 외의 부분과 같음)\n<신 설> ② 제1항에도 불구하고 의원은\n수유가 필요한 24개월 이하의\n영아인 자녀와 함께 회의장에\n출입할 수 있다.\n",
  "sections": {
    "제안이유": "및",
    "주요내용": "현행법은 회의장에 출입할 수 있는 사람을 의원ㆍ국무총리ㆍ국무위\n원 또는 정부위원, 그 밖에 의안 심의에 필요한 사람으로 제한하면서,\n그 외의 사람이 회의장에 출입하려면 의장의 허가를 받도록 규정하고\n있습니다.\n한편 호주나 유럽 의회 등 선진국에서는 여성의원이 본회의장에서\n아기를 동반하여 수유하는 것을 허용하고 있고, 실제로 모유수유를 한\n사례가 있습니다. 국회도 임기 중에 출산하는 의원의 의정활동 지원을\n위한 방편으로 회의장에 수유가 필요한 영아에 한하여 보호자인 의원\n과 함께 출입이 가능하도록 할 필요가 있습니다.\n이에 의원은 수유가 필요한 24개월 이하의 영아인 자녀와 함께 회\n의장에 출입할 수 있도록 하고자 합니다(안 제151조제2항 신설).",
    "제안이유_및_주요내용": "현행법은 회의장에 출입할 수 있는 사람을 의원ㆍ국무총리ㆍ국무위\n원 또는 정부위원, 그 밖에 의안 심의에 필요한 사람으로 제한하면서,\n그 외의 사람이 회의장에 출입하려면 의장의 허가를 받도록 규정하고\n있습니다.\n한편 호주나 유럽 의회 등 선진국에서는 여성의원이 본회의장에서\n아기를 동반하여 수유하는 것을 허용하고 있고, 실제로 모유수유를 한\n사례가 있습니다. 국회도 임기 중에 출산하는 의원의 의정활동 지원을\n위한 방편으로 회의장에 수유가 필요한 영아에 한하여 보호자인 의원\n과 함께 출입이 가능하도록 할 필요가 있습니다.\n이에 의원은 수유가 필요한 24개월 이하의 영아인 자녀와 함께 회\n의장에 출입할 수 있도록 하고자 합니다(안 제151조제2항 신설).",
    "법률_제_호": "국회법 일부개정법률안\n국회법 일부를 다음과 같이 개정한다.\n제151조 제목 외의 부분을 제1항으로 하고, 같은 조에 제2항을 다음과\n같이 신설한다.\n② 제1항에도 불구하고 의원은 수유가 필요한 24개월 이하의 영아\n인 자녀와 함께 회의장에 출입할 수 있다.",
    "신구조문대비표": "현 행 개 정 안\n제151조(회의장 출입의 제한) (생 제151조(회의장 출입의 제한) ①\n략) (현행 제목 외의 부분과 같음)\n<신 설> ② 제1항에도 불구하고 의원은\n수유가 필요한 24개월 이하의\n영아인 자녀와 함께 회의장에\n출입할 수 있다."
  }
}