{
  "title": "2203339_신에너지_및_재생에너지_개발·이용·보급_촉진법_일부개정법률안",
  "bill_number": "3339",
  "proposal_date": "2024. 8. 29.",
  "submission_date": "",
  "is_alternative": false,
  "alternative_bill_numbers": [],
  "has_comparison_table": false,
  "comparison_table": "신ㆍ구조문대비표\n현 행 개 정 안\n<신 설> 제27조의3(이격거리) 지방자치단\n체의 장은 신ㆍ재생에너지 설\n비를 설치하기 위한 개발행위\n허가 시 산업통상자원부령으로\n정하는 바에 따라 이격거리를\n설정할 수 있다.",
  "full_text": "신에너지 및 재생에너지 개발ㆍ이용ㆍ보급 촉진법\n일부개정법률안\n(김소희의원 대표발의)\n발의연월일 : 2024. 8. 29.\n의 안\n3339\n번 호 발 의 자 : 김소희ㆍ권영세ㆍ신동욱\n김위상ㆍ김예지ㆍ백종헌\n우재준ㆍ이종배ㆍ김성원\n강승규ㆍ김선교ㆍ이달희\n조지연ㆍ이종욱ㆍ박수민\n서범수ㆍ강대식ㆍ이인선\n의원(18인)\n제안이유 및 주요내용\n현행법은 재생에너지 설비의 이격거리 기준에 대한 명확한 규정을\n두고 있지 않아 지방자치단체들이 조례를 통해 태양광 및 풍력 발전\n설비의 이격거리를 상이하게 규제하고 있음. 이로 인해 지방자치단체\n별로 이격거리 규제의 편차가 크고, 지자체마다 다른 규제로 인해 재\n생에너지 보급을 저해하는 갈등 유발 요인이 되고 있음. 또한, 과도한\n규제 도입으로 인해 재생에너지 발전 설비를 설치할 공간 확보에 어\n려움을 겪고 있음.\n이에 지방자치단체의 장이 신ㆍ재생에너지 설비를 설치하기 위한\n개발행위허가 시 산업통상자원부령으로 정하는 기준에 따라 이격거리\n\n\n\n를 설정할 수 있도록 하여, 지자체별로 상이하게 규제하고 있는 이격\n거리 설정이 산업통상자원부 기준에 따라 합리적으로 운영되도록 하\n고 과도한 규제가 이루어지지 않도록 하려는 것임(안 제27조의3 신\n설).\n\n법률 제 호\n신에너지 및 재생에너지 개발ㆍ이용ㆍ보급 촉진법\n일부개정법률안\n신에너지 및 재생에너지 개발ㆍ이용ㆍ보급 촉진법 일부를 다음과 같\n이 개정한다.\n제27조의3을 다음과 같이 신설한다.\n제27조의3(이격거리) 지방자치단체의 장은 신ㆍ재생에너지 설비를 설\n치하기 위한 개발행위허가 시 산업통상자원부령으로 정하는 바에\n따라 이격거리를 설정할 수 있다.\n부 칙\n이 법은 공포 후 6개월이 경과한 날부터 시행한다.\n\n\n\n\n신ㆍ구조문대비표\n현 행 개 정 안\n<신 설> 제27조의3(이격거리) 지방자치단\n체의 장은 신ㆍ재생에너지 설\n비를 설치하기 위한 개발행위\n허가 시 산업통상자원부령으로\n정하는 바에 따라 이격거리를\n설정할 수 있다.\n",
  "sections": {
    "제안이유": "및",
    "주요내용": "현행법은 재생에너지 설비의 이격거리 기준에 대한 명확한 규정을\n두고 있지 않아 지방자치단체들이 조례를 통해 태양광 및 풍력 발전\n설비의 이격거리를 상이하게 규제하고 있음. 이로 인해 지방자치단체\n별로 이격거리 규제의 편차가 크고, 지자체마다 다른 규제로 인해 재\n생에너지 보급을 저해하는 갈등 유발 요인이 되고 있음. 또한, 과도한\n규제 도입으로 인해 재생에너지 발전 설비를 설치할 공간 확보에 어\n려움을 겪고 있음.\n이에 지방자치단체의 장이 신ㆍ재생에너지 설비를 설치하기 위한\n개발행위허가 시 산업통상자원부령으로 정하는 기준에 따라 이격거리\n\n\n\n를 설정할 수 있도록 하여, 지자체별로 상이하게 규제하고 있는 이격\n거리 설정이 산업통상자원부 기준에 따라 합리적으로 운영되도록 하\n고 과도한 규제가 이루어지지 않도록 하려는 것임(안 제27조의3 신\n설).",
    "제안이유_및_주요내용": "현행법은 재생에너지 설비의 이격거리 기준에 대한 명확한 규정을\n두고 있지 않아 지방자치단체들이 조례를 통해 태양광 및 풍력 발전\n설비의 이격거리를 상이하게 규제하고 있음. 이로 인해 지방자치단체\n별로 이격거리 규제의 편차가 크고, 지자체마다 다른 규제로 인해 재\n생에너지 보급을 저해하는 갈등 유발 요인이 되고 있음. 또한, 과도한\n규제 도입으로 인해 재생에너지 발전 설비를 설치할 공간 확보에 어\n려움을 겪고 있음.\n이에 지방자치단체의 장이 신ㆍ재생에너지 설비를 설치하기 위한\n개발행위허가 시 산업통상자원부령으로 정하는 기준에 따라 이격거리\n\n\n\n를 설정할 수 있도록 하여, 지자체별로 상이하게 규제하고 있는 이격\n거리 설정이 산업통상자원부 기준에 따라 합리적으로 운영되도록 하\n고 과도한 규제가 이루어지지 않도록 하려는 것임(안 제27조의3 신\n설).",
    "법률_제_호": "신에너지 및 재생에너지 개발ㆍ이용ㆍ보급 촉진법\n일부개정법률안\n신에너지 및 재생에너지 개발ㆍ이용ㆍ보급 촉진법 일부를 다음과 같\n이 개정한다.\n제27조의3을 다음과 같이 신설한다.\n제27조의3(이격거리) 지방자치단체의 장은 신ㆍ재생에너지 설비를 설\n치하기 위한 개발행위허가 시 산업통상자원부령으로 정하는 바에\n따라 이격거리를 설정할 수 있다.",
    "신구조문대비표": "현 행 개 정 안\n<신 설> 제27조의3(이격거리) 지방자치단\n체의 장은 신ㆍ재생에너지 설\n비를 설치하기 위한 개발행위\n허가 시 산업통상자원부령으로\n정하는 바에 따라 이격거리를\n설정할 수 있다."
  }
}