{
  "title": "2203820_예금자보호법_일부개정법률안",
  "bill_number": "3820",
  "proposal_date": "2024. 9. 9.",
  "submission_date": "",
  "is_alternative": false,
  "alternative_bill_numbers": [],
  "has_comparison_table": false,
  "comparison_table": "신ㆍ구조문대비표\n현 행 개 정 안\n제25조(여유자금의 운용) (생 제25조(여유자금의 운용) ① (현\n략) 행 제목 외의 부분과 같음)\n<신 설> ② 제1항제1호에 따라 여유자\n금을 운용하는 경우에는 장기\n적이고 안정적인 수익 증대를\n위하여 투자대상과 관련한 환\n경ㆍ사회ㆍ지배구조 등의 요소\n를 고려할 수 있다.",
  "full_text": "예금자보호법 일부개정법률안\n(이정문의원 대표발의)\n발의연월일 : 2024. 9. 9.\n의 안\n3820\n번 호 발 의 자 : 이정문ㆍ박홍배ㆍ박 정\n조승래ㆍ이학영ㆍ이연희\n이훈기ㆍ문진석ㆍ서영석\n이인영ㆍ임광현 의원\n(11인)\n제안이유 및 주요내용\nESG(Environment, Social, Governance)투자는 사회적 책임을 금융\n시장에 도입하여, 투자 결정 단계에서 재무적 요소와 함께 환경ㆍ사회\nㆍ지배구조 등 비재무적 요소를 고려함으로써 장기적으로 리스크를\n경감시키고 지속가능한 수익 창출을 목표로 하는 투자 원칙임.\n이러한 ‘사회적 책임투자’는 2005년에 UN에서 6가지 투자 원칙(UN\nPRI)을 천명한 이후 서명을 통해 세계 각국 및 기업에 확산되는 추세\n에 있고, 국내에서는 국민연금이 법 개정을 통해 2015년부터 도입하고\n있으며, 해외 국부펀드 중에서 노르웨이의 정부연기금(GPFG)등 주요\n연기금에서 도입하고 있음.\n이에 예금보험기금의 여유자금을 운용하는 경우 환경ㆍ사회ㆍ지배\n구조 요소 등 사회책임 요소를 고려할 수 있도록 함으로써 기금의 장\n기적인 수익률을 제고하면서 사회적 책임을 강화하려는 것임(안 제25\n\n\n\n조제2항 신설).\n\n법률 제 호\n예금자보호법 일부개정법률안\n예금자보호법 일부를 다음과 같이 개정한다.\n제25조 제목 외의 부분을 제1항으로 하고, 같은 조에 제2항을 다음과\n같이 신설한다.\n② 제1항제1호에 따라 여유자금을 운용하는 경우에는 장기적이고\n안정적인 수익 증대를 위하여 투자대상과 관련한 환경ㆍ사회ㆍ지배\n구조 등의 요소를 고려할 수 있다.\n부 칙\n이 법은 공포 후 6개월이 경과한 날부터 시행한다.\n\n\n\n\n신ㆍ구조문대비표\n현 행 개 정 안\n제25조(여유자금의 운용) (생 제25조(여유자금의 운용) ① (현\n략) 행 제목 외의 부분과 같음)\n<신 설> ② 제1항제1호에 따라 여유자\n금을 운용하는 경우에는 장기\n적이고 안정적인 수익 증대를\n위하여 투자대상과 관련한 환\n경ㆍ사회ㆍ지배구조 등의 요소\n를 고려할 수 있다.\n",
  "sections": {
    "제안이유": "및",
    "주요내용": "ESG(Environment, Social, Governance)투자는 사회적 책임을 금융\n시장에 도입하여, 투자 결정 단계에서 재무적 요소와 함께 환경ㆍ사회\nㆍ지배구조 등 비재무적 요소를 고려함으로써 장기적으로 리스크를\n경감시키고 지속가능한 수익 창출을 목표로 하는 투자 원칙임.\n이러한 ‘사회적 책임투자’는 2005년에 UN에서 6가지 투자 원칙(UN\nPRI)을 천명한 이후 서명을 통해 세계 각국 및 기업에 확산되는 추세\n에 있고, 국내에서는 국민연금이 법 개정을 통해 2015년부터 도입하고\n있으며, 해외 국부펀드 중에서 노르웨이의 정부연기금(GPFG)등 주요\n연기금에서 도입하고 있음.\n이에 예금보험기금의 여유자금을 운용하는 경우 환경ㆍ사회ㆍ지배\n구조 요소 등 사회책임 요소를 고려할 수 있도록 함으로써 기금의 장\n기적인 수익률을 제고하면서 사회적 책임을 강화하려는 것임(안 제25\n\n\n\n조제2항 신설).",
    "제안이유_및_주요내용": "ESG(Environment, Social, Governance)투자는 사회적 책임을 금융\n시장에 도입하여, 투자 결정 단계에서 재무적 요소와 함께 환경ㆍ사회\nㆍ지배구조 등 비재무적 요소를 고려함으로써 장기적으로 리스크를\n경감시키고 지속가능한 수익 창출을 목표로 하는 투자 원칙임.\n이러한 ‘사회적 책임투자’는 2005년에 UN에서 6가지 투자 원칙(UN\nPRI)을 천명한 이후 서명을 통해 세계 각국 및 기업에 확산되는 추세\n에 있고, 국내에서는 국민연금이 법 개정을 통해 2015년부터 도입하고\n있으며, 해외 국부펀드 중에서 노르웨이의 정부연기금(GPFG)등 주요\n연기금에서 도입하고 있음.\n이에 예금보험기금의 여유자금을 운용하는 경우 환경ㆍ사회ㆍ지배\n구조 요소 등 사회책임 요소를 고려할 수 있도록 함으로써 기금의 장\n기적인 수익률을 제고하면서 사회적 책임을 강화하려는 것임(안 제25\n\n\n\n조제2항 신설).",
    "법률_제_호": "예금자보호법 일부개정법률안\n예금자보호법 일부를 다음과 같이 개정한다.\n제25조 제목 외의 부분을 제1항으로 하고, 같은 조에 제2항을 다음과\n같이 신설한다.\n② 제1항제1호에 따라 여유자금을 운용하는 경우에는 장기적이고\n안정적인 수익 증대를 위하여 투자대상과 관련한 환경ㆍ사회ㆍ지배\n구조 등의 요소를 고려할 수 있다.",
    "신구조문대비표": "현 행 개 정 안\n제25조(여유자금의 운용) (생 제25조(여유자금의 운용) ① (현\n략) 행 제목 외의 부분과 같음)\n<신 설> ② 제1항제1호에 따라 여유자\n금을 운용하는 경우에는 장기\n적이고 안정적인 수익 증대를\n위하여 투자대상과 관련한 환\n경ㆍ사회ㆍ지배구조 등의 요소\n를 고려할 수 있다."
  }
}