{
  "title": "2203621_공공주택_특별법_일부개정법률안",
  "bill_number": "3621",
  "proposal_date": "2024. 9. 2.",
  "submission_date": "",
  "is_alternative": false,
  "alternative_bill_numbers": [],
  "has_comparison_table": false,
  "comparison_table": "신ㆍ구조문대비표\n현 행 개 정 안\n<신 설> 제38조의2(「지방공기업법」에\n대한 특례) 제4조제1항제3호에\n따른 공공주택사업자가 공공주\n택사업을 시행하는 경우 「지\n방공기업법」 제65조의5제2호\n에도 불구하고 이익공유형 분\n양주택을 공급할 수 있다.",
  "full_text": "공공주택 특별법 일부개정법률안\n(이연희의원 대표발의)\n발의연월일 : 2024. 9. 2.\n의 안\n3621\n번 호 발 의 자 : 이연희ㆍ박상혁ㆍ문진석\n박홍배ㆍ김정호ㆍ이정문\n문금주ㆍ김윤덕ㆍ이춘석\n김남희ㆍ안태준ㆍ허종식\n서미화ㆍ홍기원ㆍ한민수\n복기왕ㆍ이광희 의원\n(17인)\n제안이유 및 주요내용\n이익공유형 분양주택은 부담 가능한 주택공급을 위하여 2021년 8월\n부터 도입된 공공자가주택의 한 유형으로 주택처분 시 공공주택사업\n자에게 환매하고 처분 손익을 공유하는 조건으로 일반 공공분양의\n80% 이하의 가격에 분양받는 구조로 설계되어 있음.\n현행법은 「지방공기업법」에 따른 지방공사 등 공공주택사업자가\n도심 내 역세권이나 준공업지역 등에서 공공주택과 업무시설 등을 복\n합하여 건설하는 사업(이하 “복합사업”이라 함)을 시행하는 경우 지분\n적립형 또는 이익공유형 분양주택을 전체 주택 호수의 100분의 10 이\n상 공급하도록 의무화하고 있음.\n또한, 현행법은 공공주택의 공급과 환매(還買)에 관한 규정을 두어\n\n\n\n이익공유형 분양주택에 대해서는 수분양자가 해당 주택을 처분하려는\n경우 공공주택사업자가 환매하도록 규정하고 있음.\n그런데, 현행법상 환매 조건부 계약과 달리 「지방공기업법」에서는\n지방공사의 자산 매각 시 환매 조건의 계약을 체결할 수 없는 것으로\n규정함에 따라 지방공사는 두 법률 간 상충으로 인하여 환매 조건의\n계약이 수반되는 이익공유형 분양주택 등을 공급할 수 없어 복합사업\n추진의 실효성에 한계가 있다는 지적이 있음.\n정부도 2022년 10월 발표한 「공공분양주택 50만호 공급계획」에\n따른 전체 공급물량의 절반인 25만호를 이익공유형 분양주택으로 공\n급할 계획으로 차질 없는 주택공급을 위해서 지방공사의 적극적인 참\n여가 필요한 상황임.\n따라서 「공공주택 특별법」에 예외규정을 신설하여 지방공사의 이\n익공유형 분양주택 공급 참여에 관한 법체계상 모순ㆍ저촉을 해소하\n고 참여를 유도할 필요가 있음.\n이에 지방공사가 복합사업 등 공공주택사업을 시행하는 경우 이익\n공유형 분양주택을 공급할 수 있도록 하는 특례를 마련하여 지방공사\n가 복합사업을 안정적으로 추진할 수 있도록 하려는 것임(안 제38조의\n2 신설).\n\n법률 제 호\n공공주택 특별법 일부개정법률안\n공공주택 특별법 일부를 다음과 같이 개정한다.\n제38조의2를 다음과 같이 신설한다.\n제38조의2(「지방공기업법」에 대한 특례) 제4조제1항제3호에 따른 공\n공주택사업자가 공공주택사업을 시행하는 경우 「지방공기업법」\n제65조의5제2호에도 불구하고 이익공유형 분양주택을 공급할 수 있\n다.\n부 칙\n이 법은 공포한 날부터 시행한다.\n\n\n\n\n신ㆍ구조문대비표\n현 행 개 정 안\n<신 설> 제38조의2(「지방공기업법」에\n대한 특례) 제4조제1항제3호에\n따른 공공주택사업자가 공공주\n택사업을 시행하는 경우 「지\n방공기업법」 제65조의5제2호\n에도 불구하고 이익공유형 분\n양주택을 공급할 수 있다.\n",
  "sections": {
    "제안이유": "및",
    "주요내용": "이익공유형 분양주택은 부담 가능한 주택공급을 위하여 2021년 8월\n부터 도입된 공공자가주택의 한 유형으로 주택처분 시 공공주택사업\n자에게 환매하고 처분 손익을 공유하는 조건으로 일반 공공분양의\n80% 이하의 가격에 분양받는 구조로 설계되어 있음.\n현행법은 「지방공기업법」에 따른 지방공사 등 공공주택사업자가\n도심 내 역세권이나 준공업지역 등에서 공공주택과 업무시설 등을 복\n합하여 건설하는 사업(이하 “복합사업”이라 함)을 시행하는 경우 지분\n적립형 또는 이익공유형 분양주택을 전체 주택 호수의 100분의 10 이\n상 공급하도록 의무화하고 있음.\n또한, 현행법은 공공주택의 공급과 환매(還買)에 관한 규정을 두어\n\n\n\n이익공유형 분양주택에 대해서는 수분양자가 해당 주택을 처분하려는\n경우 공공주택사업자가 환매하도록 규정하고 있음.\n그런데, 현행법상 환매 조건부 계약과 달리 「지방공기업법」에서는\n지방공사의 자산 매각 시 환매 조건의 계약을 체결할 수 없는 것으로\n규정함에 따라 지방공사는 두 법률 간 상충으로 인하여 환매 조건의\n계약이 수반되는 이익공유형 분양주택 등을 공급할 수 없어 복합사업\n추진의 실효성에 한계가 있다는 지적이 있음.\n정부도 2022년 10월 발표한 「공공분양주택 50만호 공급계획」에\n따른 전체 공급물량의 절반인 25만호를 이익공유형 분양주택으로 공\n급할 계획으로 차질 없는 주택공급을 위해서 지방공사의 적극적인 참\n여가 필요한 상황임.\n따라서 「공공주택 특별법」에 예외규정을 신설하여 지방공사의 이\n익공유형 분양주택 공급 참여에 관한 법체계상 모순ㆍ저촉을 해소하\n고 참여를 유도할 필요가 있음.\n이에 지방공사가 복합사업 등 공공주택사업을 시행하는 경우 이익\n공유형 분양주택을 공급할 수 있도록 하는 특례를 마련하여 지방공사\n가 복합사업을 안정적으로 추진할 수 있도록 하려는 것임(안 제38조의\n2 신설).",
    "제안이유_및_주요내용": "이익공유형 분양주택은 부담 가능한 주택공급을 위하여 2021년 8월\n부터 도입된 공공자가주택의 한 유형으로 주택처분 시 공공주택사업\n자에게 환매하고 처분 손익을 공유하는 조건으로 일반 공공분양의\n80% 이하의 가격에 분양받는 구조로 설계되어 있음.\n현행법은 「지방공기업법」에 따른 지방공사 등 공공주택사업자가\n도심 내 역세권이나 준공업지역 등에서 공공주택과 업무시설 등을 복\n합하여 건설하는 사업(이하 “복합사업”이라 함)을 시행하는 경우 지분\n적립형 또는 이익공유형 분양주택을 전체 주택 호수의 100분의 10 이\n상 공급하도록 의무화하고 있음.\n또한, 현행법은 공공주택의 공급과 환매(還買)에 관한 규정을 두어\n\n\n\n이익공유형 분양주택에 대해서는 수분양자가 해당 주택을 처분하려는\n경우 공공주택사업자가 환매하도록 규정하고 있음.\n그런데, 현행법상 환매 조건부 계약과 달리 「지방공기업법」에서는\n지방공사의 자산 매각 시 환매 조건의 계약을 체결할 수 없는 것으로\n규정함에 따라 지방공사는 두 법률 간 상충으로 인하여 환매 조건의\n계약이 수반되는 이익공유형 분양주택 등을 공급할 수 없어 복합사업\n추진의 실효성에 한계가 있다는 지적이 있음.\n정부도 2022년 10월 발표한 「공공분양주택 50만호 공급계획」에\n따른 전체 공급물량의 절반인 25만호를 이익공유형 분양주택으로 공\n급할 계획으로 차질 없는 주택공급을 위해서 지방공사의 적극적인 참\n여가 필요한 상황임.\n따라서 「공공주택 특별법」에 예외규정을 신설하여 지방공사의 이\n익공유형 분양주택 공급 참여에 관한 법체계상 모순ㆍ저촉을 해소하\n고 참여를 유도할 필요가 있음.\n이에 지방공사가 복합사업 등 공공주택사업을 시행하는 경우 이익\n공유형 분양주택을 공급할 수 있도록 하는 특례를 마련하여 지방공사\n가 복합사업을 안정적으로 추진할 수 있도록 하려는 것임(안 제38조의\n2 신설).",
    "법률_제_호": "공공주택 특별법 일부개정법률안\n공공주택 특별법 일부를 다음과 같이 개정한다.\n제38조의2를 다음과 같이 신설한다.\n제38조의2(「지방공기업법」에 대한 특례) 제4조제1항제3호에 따른 공\n공주택사업자가 공공주택사업을 시행하는 경우 「지방공기업법」\n제65조의5제2호에도 불구하고 이익공유형 분양주택을 공급할 수 있\n다.",
    "신구조문대비표": "현 행 개 정 안\n<신 설> 제38조의2(「지방공기업법」에\n대한 특례) 제4조제1항제3호에\n따른 공공주택사업자가 공공주\n택사업을 시행하는 경우 「지\n방공기업법」 제65조의5제2호\n에도 불구하고 이익공유형 분\n양주택을 공급할 수 있다."
  }
}