{
  "title": "2203845_근로기준법_일부개정법률안",
  "bill_number": "3845",
  "proposal_date": "2024. 9. 10.",
  "submission_date": "",
  "is_alternative": false,
  "alternative_bill_numbers": [],
  "has_comparison_table": false,
  "comparison_table": "신ㆍ구조문대비표\n현 행 개 정 안\n제18조(단시간근로자의 근로조건) 제18조(단시간근로자의 근로조건)\n①ㆍ② (생 략) ①ㆍ② (현행과 같음)\n③ 4주 동안(4주 미만으로 근 <삭 제>\n로하는 경우에는 그 기간)을\n평균하여 1주 동안의 소정근로\n시간이 15시간 미만인 근로자\n에 대하여는 제55조와 제60조\n를 적용하지 아니한다.",
  "full_text": "근로기준법 일부개정법률안\n(용혜인의원 대표발의)\n발의연월일 : 2024. 9. 10.\n의 안\n3845\n번 호 발 의 자 : 용혜인ㆍ김남근ㆍ김남희\n송재봉ㆍ염태영ㆍ윤종오\n이수진ㆍ전종덕ㆍ정춘생\n정혜경ㆍ조 국ㆍ진선미\n황명선 의원(13인)\n제안이유 및 주요내용\n현행 「근로기준법」은 4주 동안 평균하여 1주 동안의 소정근로시\n간이 15시간 미만인 초단시간 노동자에 대하여는 제55조에 따른 유급\n휴일과 제60조에 따른 연차 유급휴가의 적용을 배제하고 있음.\n그러나 단순히 노동시간이 짧다는 이유로 유급휴일과 연차 유급휴\n가를 부여하지 않는 것은 노동자의 휴식권을 합리적 이유 없이 차별\n하는 것임.\n합리적 이유 없이 차별받는 초단시간 노동자는 매년 빠르게 증가하\n고 있음(2018년 109만 명, 2019∼2020년 130만 명, 2021년 151만 명, 2\n022년 157만 명). 이에 대해 2017년 국가인권위원회는 상임위원회 결\n정문을 통해 “초단시간 근로와 일반 단시간 근로 사이에 질적인 차이\n가 존재하는지 의문이다”, “초단시간 근로자에 대해 휴식권이라는 기\n본적이고 핵심적인 근로조건의 적용을 배제하는 것은 단시간 근로에\n\n\n\n대한 부정적 인식을 확산시킬 수 있다는 점에 비추어보아도 부당하\n다”라고 개정의 필요성을 제기하였음.\n이에 「근로기준법」에서 초단시간 노동자의 유급휴일, 연차 유급휴\n가 적용제외 규정을 삭제하여 소정근로시간 수에 따른 차별을 없애고\n휴식권을 보장하고자 함(안 제18조제3항 삭제).\n\n법률 제 호\n근로기준법 일부개정법률안\n근로기준법 일부를 다음과 같이 개정한다.\n제18조제3항을 삭제한다.\n부 칙\n이 법은 공포 후 6개월이 경과한 날부터 시행한다.\n\n\n\n\n신ㆍ구조문대비표\n현 행 개 정 안\n제18조(단시간근로자의 근로조건) 제18조(단시간근로자의 근로조건)\n①ㆍ② (생 략) ①ㆍ② (현행과 같음)\n③ 4주 동안(4주 미만으로 근 <삭 제>\n로하는 경우에는 그 기간)을\n평균하여 1주 동안의 소정근로\n시간이 15시간 미만인 근로자\n에 대하여는 제55조와 제60조\n를 적용하지 아니한다.\n",
  "sections": {
    "제안이유": "및",
    "주요내용": "현행 「근로기준법」은 4주 동안 평균하여 1주 동안의 소정근로시\n간이 15시간 미만인 초단시간 노동자에 대하여는 제55조에 따른 유급\n휴일과 제60조에 따른 연차 유급휴가의 적용을 배제하고 있음.\n그러나 단순히 노동시간이 짧다는 이유로 유급휴일과 연차 유급휴\n가를 부여하지 않는 것은 노동자의 휴식권을 합리적 이유 없이 차별\n하는 것임.\n합리적 이유 없이 차별받는 초단시간 노동자는 매년 빠르게 증가하\n고 있음(2018년 109만 명, 2019∼2020년 130만 명, 2021년 151만 명, 2\n022년 157만 명). 이에 대해 2017년 국가인권위원회는 상임위원회 결\n정문을 통해 “초단시간 근로와 일반 단시간 근로 사이에 질적인 차이\n가 존재하는지 의문이다”, “초단시간 근로자에 대해 휴식권이라는 기\n본적이고 핵심적인 근로조건의 적용을 배제하는 것은 단시간 근로에\n\n\n\n대한 부정적 인식을 확산시킬 수 있다는 점에 비추어보아도 부당하\n다”라고 개정의 필요성을 제기하였음.\n이에 「근로기준법」에서 초단시간 노동자의 유급휴일, 연차 유급휴\n가 적용제외 규정을 삭제하여 소정근로시간 수에 따른 차별을 없애고\n휴식권을 보장하고자 함(안 제18조제3항 삭제).",
    "제안이유_및_주요내용": "현행 「근로기준법」은 4주 동안 평균하여 1주 동안의 소정근로시\n간이 15시간 미만인 초단시간 노동자에 대하여는 제55조에 따른 유급\n휴일과 제60조에 따른 연차 유급휴가의 적용을 배제하고 있음.\n그러나 단순히 노동시간이 짧다는 이유로 유급휴일과 연차 유급휴\n가를 부여하지 않는 것은 노동자의 휴식권을 합리적 이유 없이 차별\n하는 것임.\n합리적 이유 없이 차별받는 초단시간 노동자는 매년 빠르게 증가하\n고 있음(2018년 109만 명, 2019∼2020년 130만 명, 2021년 151만 명, 2\n022년 157만 명). 이에 대해 2017년 국가인권위원회는 상임위원회 결\n정문을 통해 “초단시간 근로와 일반 단시간 근로 사이에 질적인 차이\n가 존재하는지 의문이다”, “초단시간 근로자에 대해 휴식권이라는 기\n본적이고 핵심적인 근로조건의 적용을 배제하는 것은 단시간 근로에\n\n\n\n대한 부정적 인식을 확산시킬 수 있다는 점에 비추어보아도 부당하\n다”라고 개정의 필요성을 제기하였음.\n이에 「근로기준법」에서 초단시간 노동자의 유급휴일, 연차 유급휴\n가 적용제외 규정을 삭제하여 소정근로시간 수에 따른 차별을 없애고\n휴식권을 보장하고자 함(안 제18조제3항 삭제).",
    "법률_제_호": "근로기준법 일부개정법률안\n근로기준법 일부를 다음과 같이 개정한다.\n제18조제3항을 삭제한다.",
    "신구조문대비표": "현 행 개 정 안\n제18조(단시간근로자의 근로조건) 제18조(단시간근로자의 근로조건)\n①ㆍ② (생 략) ①ㆍ② (현행과 같음)\n③ 4주 동안(4주 미만으로 근 <삭 제>\n로하는 경우에는 그 기간)을\n평균하여 1주 동안의 소정근로\n시간이 15시간 미만인 근로자\n에 대하여는 제55조와 제60조\n를 적용하지 아니한다."
  }
}