{
  "title": "2203154_형법_일부개정법률안",
  "bill_number": "3154",
  "proposal_date": "2024. 8. 23.",
  "submission_date": "",
  "is_alternative": false,
  "alternative_bill_numbers": [],
  "has_comparison_table": false,
  "comparison_table": "신ㆍ구조문대비표\n현 행 개 정 안\n第98條(間諜) ①ㆍ② (생 략) 第98條(間諜) ①ㆍ② (현행과 같\n음)\n<신 설> ③ 외국, 외국단체 또는 외국을\n위하여 일하는 개인에 대하여\n제1항의 행위를 한 자는 사형,\n무기 또는 2년 이상의 징역에\n처한다.",
  "full_text": "형법 일부개정법률안\n(김건의원 대표발의)\n발의연월일 : 2024. 8. 23.\n의 안\n3154\n번 호 발 의 자 : 김 건ㆍ박충권ㆍ윤상현\n김기웅ㆍ윤재옥ㆍ박성민\n신동욱ㆍ최수진ㆍ이헌승\n이인선 의원(10인)\n제안이유 및 주요내용\n현행법은 간첩죄를 적국에 간첩하거나 적국에 군사상 기밀을 누설\n한 경우에 한해 처벌하고 있으므로, 적국이 아닌 외국, 외국인 또는\n외국단체에 국가기밀 등을 누설하는 경우는 현행법상 간첩죄에 해당\n되지 아니함.\n그런데 최근 국군 정보사령부 요원의 명단유출 사건에서 보듯, 전통\n적인 의미의 적국의 대상이 확대될 필요가 있다는 지적이 제기됨. 특\n히 오늘날 전통적인 군사기밀 뿐 아니라 첨단산업기술은 그 경제적,\n산업적 가치 뿐 아니라 국가안보에 미치는 영향도 매우 심대한바 적\n국이 아닌 동맹국가 사이에서도 산업기술을 탈취하기 위한 경쟁이 매\n우 심화되고 있으나, 현행법은 여전히 적국을 위하여 행한 간첩행위만\n을 처벌하고 있어 그 대상을 확대하여야 한다는 지적이 꾸준히 제기\n되어 왔음.\n\n\n\n이에 적국 뿐 아니라 ‘외국, 외국단체 또는 외국을 위해 일하는 개\n인’에 대하여도 간첩행위를 하거나 이를 방조한 자는 형법상의 간첩죄\n로 처벌할 수 있도록 하려는 취지임(안 제98조제3항 신설).\n\n법률 제 호\n형법 일부개정법률안\n형법 일부를 다음과 같이 개정한다.\n제98조에 제3항을 다음과 같이 신설한다.\n③ 외국, 외국단체 또는 외국을 위하여 일하는 개인에 대하여 제1항\n의 행위를 한 자는 사형, 무기 또는 2년 이상의 징역에 처한다.\n부 칙\n이 법은 공포한 날부터 시행한다.\n\n\n\n\n신ㆍ구조문대비표\n현 행 개 정 안\n第98條(間諜) ①ㆍ② (생 략) 第98條(間諜) ①ㆍ② (현행과 같\n음)\n<신 설> ③ 외국, 외국단체 또는 외국을\n위하여 일하는 개인에 대하여\n제1항의 행위를 한 자는 사형,\n무기 또는 2년 이상의 징역에\n처한다.\n",
  "sections": {
    "제안이유": "및",
    "주요내용": "현행법은 간첩죄를 적국에 간첩하거나 적국에 군사상 기밀을 누설\n한 경우에 한해 처벌하고 있으므로, 적국이 아닌 외국, 외국인 또는\n외국단체에 국가기밀 등을 누설하는 경우는 현행법상 간첩죄에 해당\n되지 아니함.\n그런데 최근 국군 정보사령부 요원의 명단유출 사건에서 보듯, 전통\n적인 의미의 적국의 대상이 확대될 필요가 있다는 지적이 제기됨. 특\n히 오늘날 전통적인 군사기밀 뿐 아니라 첨단산업기술은 그 경제적,\n산업적 가치 뿐 아니라 국가안보에 미치는 영향도 매우 심대한바 적\n국이 아닌 동맹국가 사이에서도 산업기술을 탈취하기 위한 경쟁이 매\n우 심화되고 있으나, 현행법은 여전히 적국을 위하여 행한 간첩행위만\n을 처벌하고 있어 그 대상을 확대하여야 한다는 지적이 꾸준히 제기\n되어 왔음.\n\n\n\n이에 적국 뿐 아니라 ‘외국, 외국단체 또는 외국을 위해 일하는 개\n인’에 대하여도 간첩행위를 하거나 이를 방조한 자는 형법상의 간첩죄\n로 처벌할 수 있도록 하려는 취지임(안 제98조제3항 신설).",
    "제안이유_및_주요내용": "현행법은 간첩죄를 적국에 간첩하거나 적국에 군사상 기밀을 누설\n한 경우에 한해 처벌하고 있으므로, 적국이 아닌 외국, 외국인 또는\n외국단체에 국가기밀 등을 누설하는 경우는 현행법상 간첩죄에 해당\n되지 아니함.\n그런데 최근 국군 정보사령부 요원의 명단유출 사건에서 보듯, 전통\n적인 의미의 적국의 대상이 확대될 필요가 있다는 지적이 제기됨. 특\n히 오늘날 전통적인 군사기밀 뿐 아니라 첨단산업기술은 그 경제적,\n산업적 가치 뿐 아니라 국가안보에 미치는 영향도 매우 심대한바 적\n국이 아닌 동맹국가 사이에서도 산업기술을 탈취하기 위한 경쟁이 매\n우 심화되고 있으나, 현행법은 여전히 적국을 위하여 행한 간첩행위만\n을 처벌하고 있어 그 대상을 확대하여야 한다는 지적이 꾸준히 제기\n되어 왔음.\n\n\n\n이에 적국 뿐 아니라 ‘외국, 외국단체 또는 외국을 위해 일하는 개\n인’에 대하여도 간첩행위를 하거나 이를 방조한 자는 형법상의 간첩죄\n로 처벌할 수 있도록 하려는 취지임(안 제98조제3항 신설).",
    "법률_제_호": "형법 일부개정법률안\n형법 일부를 다음과 같이 개정한다.\n제98조에 제3항을 다음과 같이 신설한다.\n③ 외국, 외국단체 또는 외국을 위하여 일하는 개인에 대하여 제1항\n의 행위를 한 자는 사형, 무기 또는 2년 이상의 징역에 처한다.",
    "신구조문대비표": "현 행 개 정 안\n第98條(間諜) ①ㆍ② (생 략) 第98條(間諜) ①ㆍ② (현행과 같\n음)\n<신 설> ③ 외국, 외국단체 또는 외국을\n위하여 일하는 개인에 대하여\n제1항의 행위를 한 자는 사형,\n무기 또는 2년 이상의 징역에\n처한다."
  }
}