{
  "title": "2203198_국회에서의_증언·감정_등에_관한_법률_일부개정법률안",
  "bill_number": "3198",
  "proposal_date": "2024. 8. 26.",
  "submission_date": "",
  "is_alternative": false,
  "alternative_bill_numbers": [],
  "has_comparison_table": false,
  "comparison_table": "신ㆍ구조문대비표\n현 행 개 정 안\n제15조(고발) ① ～ ④ (생 략) 제15조(고발) ① ～ ④ (현행과\n같음)\n<신 설> ⑤ 제14조제1항 본문의 죄는\n고발이 없어도 공소를 제기할\n수 있다.",
  "full_text": "국회에서의 증언ㆍ감정 등에 관한 법률 일부개정법률안\n(오기형의원 대표발의)\n발의연월일 : 2024. 8. 26.\n의 안\n3198\n번 호 발 의 자 : 오기형ㆍ복기왕ㆍ박수현\n정진욱ㆍ부승찬ㆍ김남근\n조계원ㆍ윤건영ㆍ이광희\n정성호ㆍ박희승ㆍ양부남\n이병진ㆍ송재봉ㆍ위성락\n의원(15인)\n제안이유 및 주요내용\n국회 운영의 적정성이 보장되기 위해서는 국회에서의 증언과 감정\n에 고도의 진실성이 담보되어야 함. 이에 현행법 제14조 제1항 본문은\n이 법에 따라 선서한 증인이나 감정인이 허위의 진술이나 감정을 한\n경우 1년 이상 10년 이하의 징역에 처하도록 명시하고 있음.\n그런데 대법원은 현행법에 명문의 규정이 없음에도, 이 법 제15조\n제1항의 고발을 같은 법 제14조 제1항 본문에 따른 위증죄의 소추요\n건으로 해석하고 있고, 또한 나아가 이 법 제15조 제1항의 고발은 해\n당 위원회가 존속하는 동안에 이루어져야 한다고 해석하고 있음(대법\n원 2018. 5. 17. 선고 2017도14749 전원합의체 판결).\n이러한 해석대로라면, 국정조사ㆍ인사청문회 등을 위한 특별위원회\n의 경우 위원회 활동기간 종료 이후 위증 사실이 드러날 경우 고발이\n\n\n\n불가능하게 되어 위증이 명백한 경우에도 처벌이 불가능하게 될 우려\n가 있음.\n이에 이 법 제14조제1항 본문에 따른 위증죄에 관하여 고발이 없더\n라도 공소를 제기할 수 있도록 하여 국회 증언과 감정의 진실성 등을\n확보하려는 것임(안 제15조제5항 신설).\n\n법률 제 호\n국회에서의 증언ㆍ감정 등에 관한 법률 일부개정법률안\n국회에서의 증언ㆍ감정 등에 관한 법률 일부를 다음과 같이 개정한다.\n제15조에 제5항을 다음과 같이 신설한다.\n⑤ 제14조제1항 본문의 죄는 고발이 없어도 공소를 제기할 수 있다.\n부 칙\n이 법은 공포한 날부터 시행한다.\n\n\n\n\n신ㆍ구조문대비표\n현 행 개 정 안\n제15조(고발) ① ～ ④ (생 략) 제15조(고발) ① ～ ④ (현행과\n같음)\n<신 설> ⑤ 제14조제1항 본문의 죄는\n고발이 없어도 공소를 제기할\n수 있다.\n",
  "sections": {
    "제안이유": "및",
    "주요내용": "국회 운영의 적정성이 보장되기 위해서는 국회에서의 증언과 감정\n에 고도의 진실성이 담보되어야 함. 이에 현행법 제14조 제1항 본문은\n이 법에 따라 선서한 증인이나 감정인이 허위의 진술이나 감정을 한\n경우 1년 이상 10년 이하의 징역에 처하도록 명시하고 있음.\n그런데 대법원은 현행법에 명문의 규정이 없음에도, 이 법 제15조\n제1항의 고발을 같은 법 제14조 제1항 본문에 따른 위증죄의 소추요\n건으로 해석하고 있고, 또한 나아가 이 법 제15조 제1항의 고발은 해\n당 위원회가 존속하는 동안에 이루어져야 한다고 해석하고 있음(대법\n원 2018. 5. 17. 선고 2017도14749 전원합의체 판결).\n이러한 해석대로라면, 국정조사ㆍ인사청문회 등을 위한 특별위원회\n의 경우 위원회 활동기간 종료 이후 위증 사실이 드러날 경우 고발이\n\n\n\n불가능하게 되어 위증이 명백한 경우에도 처벌이 불가능하게 될 우려\n가 있음.\n이에 이 법 제14조제1항 본문에 따른 위증죄에 관하여 고발이 없더\n라도 공소를 제기할 수 있도록 하여 국회 증언과 감정의 진실성 등을\n확보하려는 것임(안 제15조제5항 신설).",
    "제안이유_및_주요내용": "국회 운영의 적정성이 보장되기 위해서는 국회에서의 증언과 감정\n에 고도의 진실성이 담보되어야 함. 이에 현행법 제14조 제1항 본문은\n이 법에 따라 선서한 증인이나 감정인이 허위의 진술이나 감정을 한\n경우 1년 이상 10년 이하의 징역에 처하도록 명시하고 있음.\n그런데 대법원은 현행법에 명문의 규정이 없음에도, 이 법 제15조\n제1항의 고발을 같은 법 제14조 제1항 본문에 따른 위증죄의 소추요\n건으로 해석하고 있고, 또한 나아가 이 법 제15조 제1항의 고발은 해\n당 위원회가 존속하는 동안에 이루어져야 한다고 해석하고 있음(대법\n원 2018. 5. 17. 선고 2017도14749 전원합의체 판결).\n이러한 해석대로라면, 국정조사ㆍ인사청문회 등을 위한 특별위원회\n의 경우 위원회 활동기간 종료 이후 위증 사실이 드러날 경우 고발이\n\n\n\n불가능하게 되어 위증이 명백한 경우에도 처벌이 불가능하게 될 우려\n가 있음.\n이에 이 법 제14조제1항 본문에 따른 위증죄에 관하여 고발이 없더\n라도 공소를 제기할 수 있도록 하여 국회 증언과 감정의 진실성 등을\n확보하려는 것임(안 제15조제5항 신설).",
    "법률_제_호": "국회에서의 증언ㆍ감정 등에 관한 법률 일부개정법률안\n국회에서의 증언ㆍ감정 등에 관한 법률 일부를 다음과 같이 개정한다.\n제15조에 제5항을 다음과 같이 신설한다.\n⑤ 제14조제1항 본문의 죄는 고발이 없어도 공소를 제기할 수 있다.",
    "신구조문대비표": "현 행 개 정 안\n제15조(고발) ① ～ ④ (생 략) 제15조(고발) ① ～ ④ (현행과\n같음)\n<신 설> ⑤ 제14조제1항 본문의 죄는\n고발이 없어도 공소를 제기할\n수 있다."
  }
}