{
  "title": "2203961_국민연금법_일부개정법률안",
  "bill_number": "3961",
  "proposal_date": "2024. 9. 12.",
  "submission_date": "",
  "is_alternative": false,
  "alternative_bill_numbers": [],
  "has_comparison_table": false,
  "comparison_table": "신ㆍ구조문대비표\n현 행 개 정 안\n법률 제8541호 국민연금법 전부 법률 제8541호 국민연금법 전부\n개정법률 ",
  "full_text": "국민연금법 일부개정법률안\n(서천호의원 대표발의)\n발의연월일 : 2024. 9. 12.\n의 안\n3961\n번 호 발 의 자 : 서천호ㆍ임종득ㆍ강선영\n이만희ㆍ이달희ㆍ김용태\n김예지ㆍ서지영ㆍ김민전\n진종오 의원(10인)\n제안이유 및 주요내용\n국가는 농어업인의 안정적인 노후 보장을 위하여 농어업인이 부담\n하여야 할 연금보험료의 100분의 50 범위에서 연금보험료를 국고에서\n지원하고 있음. 2022년 기준으로 약 31만명에 대하여 1인당 연평균 52\n만 1천원이 지원되었음.\n그런데 영세한 농어업인의 국민연금 가입을 보다 두텁게 지원하기\n위하여 지원 규모를 늘려야 한다는 의견이 제기되고 있음.\n이에 소득수준을 고려하여 본인이 부담하여야 할 연금보험료의 100\n분의 70까지 지원할 수 있도록 하여 농어업인의 노후 생활 대비를 도\n우려는 것임(안 법률 제8541호 국민연금법 전부개정법률 부칙 제7조\n및 법률 제11143호 국민연금법 일부개정법률 부칙 제7조).\n\n\n\n\n법률 제 호\n국민연금법 일부개정법률안\n국민연금법 일부를 다음과 같이 개정한다.\n법률 제8541호 국민연금법 전부개정법률 부칙(법률 제11143호 국민연\n금법 일부개정법률, 법률 제12242호 국민연금법 일부개정법률 및 법률\n제16867호 국민연금법 일부개정법률에 따라 각각 개정된 내용을 포함\n한다) 제7조 중 “50의”를 “70의”로, “대통령령으로”를 “가입자의 소득\n을 고려하여 대통령령으로”로 한다.\n법률 제11143호 국민연금법 일부개정법률 부칙(법률 제12242호 국민연\n금법 일부개정법률 및 제16867호 국민연금법 일부개정법률에 따라 각\n각 개정된 내용을 포함한다) 제7조 중 “50의”를 “70의”로, “대통령령으\n로”를 “가입자의 소득을 고려하여 대통령령으로”로 한다.\n부 칙\n제1조(시행일) 이 법은 공포 후 3개월이 경과한 날부터 시행한다.\n제2조(농어업인에 대한 연금보험료 보조에 관한 적용례) 법률 제8541\n호 국민연금법 전부개정법률 부칙 제7조 및 법률 제11143호 국민연\n금법 일부개정법률 부칙 제7조의 개정규정은 공포한 날이 속한 달\n\n\n\n의 보험료분부터 적용한다.\n제3조(다른 법률의 개정) 농어촌주민의 보건복지 증진을 위한 특별법\n일부를 다음과 같이 개정한다.\n제31조 중 “50”을 “70”으로 한다.\n\n신ㆍ구조문대비표\n현 행 개 정 안\n법률 제8541호 국민연금법 전부 법률 제8541호 국민연금법 전부\n개정법률 부칙 개정법률 부칙\n제7조(농어업인에 대한 연금보험 제7조(농어업인에 대한 연금보험\n료 보조) 지역가입자인 농어업 료 보조) -------------------\n인과 지역가입자에서 임의계속 ----------------------------\n가입자로 된 농어업인에게는 ----------------------------\n제88조제3항의 개정규정에도 ----------------------------\n불구하고 2024년 12월 31일까 ----------------------------\n지 본인이 부담할 연금보험료 ----------------------------\n중 100분의 50의 범위 내에서 ----------70의-------------\n대통령령으로 정하는 바에 따 가입자의 소득을 고려하여 대\n라 농어촌구조개선특별회계에 통령령으로------------------\n서 지원한다. ----------------------------\n-------.\n법률 제11143호 국민연금법 일부 법률 제11143호 국민연금법 일부\n개정법률 부칙 개정법률 부칙\n제7조(농어업인에 대한 연금보험 제7조(농어업인에 대한 연금보험\n료 보조 특례) 사업장가입자 료 보조) -------------------\n또는 임의가입자에서 임의계속 ----------------------------\n가입자로 된 농어업인(당연적 ----------------------------\n용사업장의 근로자 또는 사용 ----------------------------\n자이거나 제9조 각 호의 어느 ----------------------------\n하나에 해당하는 사람은 제외 ----------------------------\n\n\n\n한다)에게는 제88조제3항에도 ----------------------------\n불구하고 2024년 12월 31일까 ----------------------------\n지 본인이 부담할 연금보험료 ----------------------------\n중 100분의 50의 범위에서 대 -------70의-------------가입\n통령령으로 정하는 바에 따라 자의 소득을 고려하여 대통령\n농어촌구조개선특별회계에서 령으로----------------------\n지원한다. ----------------------------\n---.",
  "sections": {
    "제안이유": "및",
    "주요내용": "국가는 농어업인의 안정적인 노후 보장을 위하여 농어업인이 부담\n하여야 할 연금보험료의 100분의 50 범위에서 연금보험료를 국고에서\n지원하고 있음. 2022년 기준으로 약 31만명에 대하여 1인당 연평균 52\n만 1천원이 지원되었음.\n그런데 영세한 농어업인의 국민연금 가입을 보다 두텁게 지원하기\n위하여 지원 규모를 늘려야 한다는 의견이 제기되고 있음.\n이에 소득수준을 고려하여 본인이 부담하여야 할 연금보험료의 100\n분의 70까지 지원할 수 있도록 하여 농어업인의 노후 생활 대비를 도\n우려는 것임(안",
    "제안이유_및_주요내용": "국가는 농어업인의 안정적인 노후 보장을 위하여 농어업인이 부담\n하여야 할 연금보험료의 100분의 50 범위에서 연금보험료를 국고에서\n지원하고 있음. 2022년 기준으로 약 31만명에 대하여 1인당 연평균 52\n만 1천원이 지원되었음.\n그런데 영세한 농어업인의 국민연금 가입을 보다 두텁게 지원하기\n위하여 지원 규모를 늘려야 한다는 의견이 제기되고 있음.\n이에 소득수준을 고려하여 본인이 부담하여야 할 연금보험료의 100\n분의 70까지 지원할 수 있도록 하여 농어업인의 노후 생활 대비를 도\n우려는 것임(안",
    "법률_제_호": "국민연금법 전부개정법률",
    "신구조문대비표": "현 행 개 정 안\n법률 제8541호 국민연금법 전부 법률 제8541호 국민연금법 전부\n개정법률"
  }
}