{
  "title": "2203889_주차장법_일부개정법률안",
  "bill_number": "3889",
  "proposal_date": "2024. 9. 11.",
  "submission_date": "",
  "is_alternative": false,
  "alternative_bill_numbers": [],
  "has_comparison_table": false,
  "comparison_table": "신ㆍ구조문대비표\n현 행 개 정 안\n제6조(주차장설비기준 등) ① ∼ 제6조(주차장설비기준 등) ① ∼\n④ (생 략) ④ (현행과 같음)\n<신 설> ⑤ 제1항에 따라 환경친화적\n자동차의 전용주차구획을 설치\n하는 경우 그 충전시설은 지상\n에 설치할 수 있다.",
  "full_text": "주차장법 일부개정법률안\n(김정호의원 대표발의)\n발의연월일 : 2024. 9. 11.\n의 안\n3889\n번 호 발 의 자 : 김정호ㆍ어기구ㆍ허종식\n정성호ㆍ전재수ㆍ윤후덕\n박 정ㆍ이연희ㆍ이수진\n조인철ㆍ이훈기ㆍ최기상\n의원(12인)\n제안이유 및 주요내용\n현행법은 전기자동차를 포함한 환경친화적 자동차의 이용편의를 증\n진시키기 위하여 주차장 전체 주차구획 중 일정 비율 이상을 환경친\n화적 자동차의 전용주차구획(충전시설 포함)으로 설치하도록 규정하고\n있음.\n그런데 최근 주차장에서 충전 중이거나 주차 중인 전기자동차에서\n비롯된 것으로 추정되는 화재가 잇따르면서 전기자동차의 안전성에\n대한 불안감이 확산되고 있는 가운데, 전기자동차에서 발생하는 화재\n의 경우 진압이 용이하지 아니하고 피해 범위가 광범위하여 지하주차\n장에 전기자동차 충전시설 설치를 제한해야 한다는 지적이 제기되고\n있음.\n이에 주차장에 환경친화적 자동차 충전시설을 설치하는 경우에는\n화재진압을 효율적으로 수행할 수 있도록 그 충전시설을 지상에 설치\n\n\n\n할 수 있도록 함으로써 환경친화적 자동차 화재에 대한 대응역량을\n제고하려는 것임(안 제6조제5항 신설).\n\n법률 제 호\n주차장법 일부개정법률안\n주차장법 일부를 다음과 같이 개정한다.\n제6조에 제5항을 다음과 같이 신설한다.\n⑤ 제1항에 따라 환경친화적 자동차의 전용주차구획을 설치하는 경\n우 그 충전시설은 지상에 설치할 수 있다.\n부 칙\n제1조(시행일) 이 법은 공포한 날부터 시행한다.\n제2조(환경친화적 자동차 충전시설 설치에 관한 적용례) 제6조제5항의\n개정규정은 이 법 시행 이후 환경친화적 자동차의 충전시설을 설치\n하는 경우부터 적용한다.\n\n\n\n\n신ㆍ구조문대비표\n현 행 개 정 안\n제6조(주차장설비기준 등) ① ∼ 제6조(주차장설비기준 등) ① ∼\n④ (생 략) ④ (현행과 같음)\n<신 설> ⑤ 제1항에 따라 환경친화적\n자동차의 전용주차구획을 설치\n하는 경우 그 충전시설은 지상\n에 설치할 수 있다.\n",
  "sections": {
    "제안이유": "및",
    "주요내용": "현행법은 전기자동차를 포함한 환경친화적 자동차의 이용편의를 증\n진시키기 위하여 주차장 전체 주차구획 중 일정 비율 이상을 환경친\n화적 자동차의 전용주차구획(충전시설 포함)으로 설치하도록 규정하고\n있음.\n그런데 최근 주차장에서 충전 중이거나 주차 중인 전기자동차에서\n비롯된 것으로 추정되는 화재가 잇따르면서 전기자동차의 안전성에\n대한 불안감이 확산되고 있는 가운데, 전기자동차에서 발생하는 화재\n의 경우 진압이 용이하지 아니하고 피해 범위가 광범위하여 지하주차\n장에 전기자동차 충전시설 설치를 제한해야 한다는 지적이 제기되고\n있음.\n이에 주차장에 환경친화적 자동차 충전시설을 설치하는 경우에는\n화재진압을 효율적으로 수행할 수 있도록 그 충전시설을 지상에 설치\n\n\n\n할 수 있도록 함으로써 환경친화적 자동차 화재에 대한 대응역량을\n제고하려는 것임(안 제6조제5항 신설).",
    "제안이유_및_주요내용": "현행법은 전기자동차를 포함한 환경친화적 자동차의 이용편의를 증\n진시키기 위하여 주차장 전체 주차구획 중 일정 비율 이상을 환경친\n화적 자동차의 전용주차구획(충전시설 포함)으로 설치하도록 규정하고\n있음.\n그런데 최근 주차장에서 충전 중이거나 주차 중인 전기자동차에서\n비롯된 것으로 추정되는 화재가 잇따르면서 전기자동차의 안전성에\n대한 불안감이 확산되고 있는 가운데, 전기자동차에서 발생하는 화재\n의 경우 진압이 용이하지 아니하고 피해 범위가 광범위하여 지하주차\n장에 전기자동차 충전시설 설치를 제한해야 한다는 지적이 제기되고\n있음.\n이에 주차장에 환경친화적 자동차 충전시설을 설치하는 경우에는\n화재진압을 효율적으로 수행할 수 있도록 그 충전시설을 지상에 설치\n\n\n\n할 수 있도록 함으로써 환경친화적 자동차 화재에 대한 대응역량을\n제고하려는 것임(안 제6조제5항 신설).",
    "법률_제_호": "주차장법 일부개정법률안\n주차장법 일부를 다음과 같이 개정한다.\n제6조에 제5항을 다음과 같이 신설한다.\n⑤ 제1항에 따라 환경친화적 자동차의 전용주차구획을 설치하는 경\n우 그 충전시설은 지상에 설치할 수 있다.",
    "신구조문대비표": "현 행 개 정 안\n제6조(주차장설비기준 등) ① ∼ 제6조(주차장설비기준 등) ① ∼\n④ (생 략) ④ (현행과 같음)\n<신 설> ⑤ 제1항에 따라 환경친화적\n자동차의 전용주차구획을 설치\n하는 경우 그 충전시설은 지상\n에 설치할 수 있다."
  }
}