{
  "title": "2203359_지방교부세법_일부개정법률안",
  "bill_number": "3359",
  "proposal_date": "2024. 8. 29.",
  "submission_date": "",
  "is_alternative": false,
  "alternative_bill_numbers": [],
  "has_comparison_table": false,
  "comparison_table": "신·구조문대비표\n현 행 개 정 안\n제5조(예산 계상) ①⋅② (생 제5조(예산 계상) ①⋅② (현행과\n략) 같음)\n<신 설> ③ 제2항에 따라 국세가 줄어\n교부세를 조절하는 경우 국가\n는 미리 해당 지방자치단체와\n협의를 하여야 한다.\n③ (생 략) ④ (현행 제3항과 같음)",
  "full_text": "지방교부세법 일부개정법률안\n(임광현의원 대표발의)\n발의연월일 : 2024. 8. 29.\n의 안\n3359\n번 호 발 의 자 : 임광현ㆍ황정아ㆍ박민규\n오기형ㆍ복기왕ㆍ박지혜\n오세희ㆍ허성무ㆍ강준현\n이해식ㆍ박홍배 의원\n(11인)\n제안이유 및 주요내용\n현행법은 추가경정예산에 의해 지방교부세의 재원인 국세가 늘거나\n줄면 교부세도 함께 조절하도록 하고 있음.\n그러나 국세의 감소로 지방교부세가 일방적으로 삭감되는 경우, 해\n당 지방자치단체의 사업 추진에 차질이 생기는 문제가 발생하고 있음.\n이에 국세가 줄어들어 교부세를 조정해야 하는 경우에는 미리 해당\n지방자치단체와 협의를 하도록 하려는 것임(안 제5조제3항 신설).\n\n\n\n\n법률 제 호\n지방교부세법 일부개정법률안\n지방교부세법 일부를 다음과 같이 개정한다.\n제5조제3항을 제4항으로 하고, 같은 조에 제3항을 다음과 같이 신설한\n다.\n③ 제2항에 따라 국세가 줄어 교부세를 조절하는 경우 국가는 미리\n해당 지방자치단체와 협의를 하여야 한다.\n부 칙\n제1조(시행일) 이 법은 2025년 1월 1일부터 시행한다.\n제2조(추가경정예산에 의한 교부세 조절에 관한 적용례) 제5조제3항의\n개정규정은 이 법 시행 이후 교부세를 조절하려는 경우부터 적용한\n다.\n\n\n\n\n신·구조문대비표\n현 행 개 정 안\n제5조(예산 계상) ①⋅② (생 제5조(예산 계상) ①⋅② (현행과\n략) 같음)\n<신 설> ③ 제2항에 따라 국세가 줄어\n교부세를 조절하는 경우 국가\n는 미리 해당 지방자치단체와\n협의를 하여야 한다.\n③ (생 략) ④ (현행 제3항과 같음)\n",
  "sections": {
    "제안이유": "및",
    "주요내용": "현행법은 추가경정예산에 의해 지방교부세의 재원인 국세가 늘거나\n줄면 교부세도 함께 조절하도록 하고 있음.\n그러나 국세의 감소로 지방교부세가 일방적으로 삭감되는 경우, 해\n당 지방자치단체의 사업 추진에 차질이 생기는 문제가 발생하고 있음.\n이에 국세가 줄어들어 교부세를 조정해야 하는 경우에는 미리 해당\n지방자치단체와 협의를 하도록 하려는 것임(안 제5조제3항 신설).",
    "제안이유_및_주요내용": "현행법은 추가경정예산에 의해 지방교부세의 재원인 국세가 늘거나\n줄면 교부세도 함께 조절하도록 하고 있음.\n그러나 국세의 감소로 지방교부세가 일방적으로 삭감되는 경우, 해\n당 지방자치단체의 사업 추진에 차질이 생기는 문제가 발생하고 있음.\n이에 국세가 줄어들어 교부세를 조정해야 하는 경우에는 미리 해당\n지방자치단체와 협의를 하도록 하려는 것임(안 제5조제3항 신설).",
    "법률_제_호": "지방교부세법 일부개정법률안\n지방교부세법 일부를 다음과 같이 개정한다.\n제5조제3항을 제4항으로 하고, 같은 조에 제3항을 다음과 같이 신설한\n다.\n③ 제2항에 따라 국세가 줄어 교부세를 조절하는 경우 국가는 미리\n해당 지방자치단체와 협의를 하여야 한다.",
    "신구조문대비표": "현 행 개 정 안\n제5조(예산 계상) ①⋅② (생 제5조(예산 계상) ①⋅② (현행과\n략) 같음)\n<신 설> ③ 제2항에 따라 국세가 줄어\n교부세를 조절하는 경우 국가\n는 미리 해당 지방자치단체와\n협의를 하여야 한다.\n③ (생 략) ④ (현행 제3항과 같음)"
  }
}