{
  "title": "2203612_가맹사업거래의_공정화에_관한_법률_일부개정법률안",
  "bill_number": "3612",
  "proposal_date": "2024. 9. 3.",
  "submission_date": "",
  "is_alternative": false,
  "alternative_bill_numbers": [],
  "has_comparison_table": false,
  "comparison_table": "신ㆍ구조문대비표\n현 행 개 정 안\n제13조(가맹계약의 갱신 등) ① 제13조(가맹계약의 갱신 등) ①\n(생 략) (현행과 같음)\n② 가맹점사업자의 계약갱신요 <삭 제>\n구권은 최초 가맹계약기간을 포\n함한 전체 가맹계약기간이 10년\n을 초과하지 아니하는 범위 내\n에서만 행사할 수 있다.\n③ㆍ④ (생 략) ③ㆍ④ (현행과 같음)",
  "full_text": "가맹사업거래의 공정화에 관한 법률 일부개정법률안\n(김한규의원 대표발의)\n발의연월일 : 2024. 9. 3.\n의 안\n3612\n번 호 발 의 자 : 김한규ㆍ박상혁ㆍ박정현\n이기헌ㆍ박민규ㆍ진선미\n위성락ㆍ모경종ㆍ강경숙\n정을호ㆍ조 국ㆍ민병덕\n의원(12인)\n제안이유 및 주요내용\n현행법에 따르면 가맹점사업자는 계약갱신요구권을 최초 가맹계약\n기간을 포함한 전체 가맹계약기간이 10년을 초과하지 아니하는 범위\n에서 행사할 수 있음.\n그런데 일부 가맹본부에서 10년이 초과한 가맹점사업자를 대상으로\n‘기업방침의 변화와 가맹계약에 대한 입장차이’ 등을 이유로 일방적으\n로 계약 갱신의 거절을 통보하는 경우가 발생하고 있음. 매년 계약갱\n신을 무기로 불이익을 강요하며 가맹본부에 비판적인 가맹점사업자에\n대한 보복조치, 길들이기, 단체활동 방해수단으로 악용될 여지가 크다\n는 의견이 있음.\n이에 계약갱신요구권의 기간을 없애 가맹본부가 정당한 사유 없이\n갱신거절을 할 수 없도록 하여 가맹점사업자의 권리를 보장하는 데\n\n\n\n기여하려 함(안 제13조제2항 삭제).\n\n법률 제 호\n가맹사업거래의 공정화에 관한 법률 일부개정법률안\n가맹사업거래의 공정화에 관한 법률 일부를 다음과 같이 개정한다.\n제13조제2항을 삭제한다.\n부 칙\n이 법은 공포한 날부터 시행한다.\n\n\n\n\n신ㆍ구조문대비표\n현 행 개 정 안\n제13조(가맹계약의 갱신 등) ① 제13조(가맹계약의 갱신 등) ①\n(생 략) (현행과 같음)\n② 가맹점사업자의 계약갱신요 <삭 제>\n구권은 최초 가맹계약기간을 포\n함한 전체 가맹계약기간이 10년\n을 초과하지 아니하는 범위 내\n에서만 행사할 수 있다.\n③ㆍ④ (생 략) ③ㆍ④ (현행과 같음)\n",
  "sections": {
    "제안이유": "및",
    "주요내용": "현행법에 따르면 가맹점사업자는 계약갱신요구권을 최초 가맹계약\n기간을 포함한 전체 가맹계약기간이 10년을 초과하지 아니하는 범위\n에서 행사할 수 있음.\n그런데 일부 가맹본부에서 10년이 초과한 가맹점사업자를 대상으로\n‘기업방침의 변화와 가맹계약에 대한 입장차이’ 등을 이유로 일방적으\n로 계약 갱신의 거절을 통보하는 경우가 발생하고 있음. 매년 계약갱\n신을 무기로 불이익을 강요하며 가맹본부에 비판적인 가맹점사업자에\n대한 보복조치, 길들이기, 단체활동 방해수단으로 악용될 여지가 크다\n는 의견이 있음.\n이에 계약갱신요구권의 기간을 없애 가맹본부가 정당한 사유 없이\n갱신거절을 할 수 없도록 하여 가맹점사업자의 권리를 보장하는 데\n\n\n\n기여하려 함(안 제13조제2항 삭제).",
    "제안이유_및_주요내용": "현행법에 따르면 가맹점사업자는 계약갱신요구권을 최초 가맹계약\n기간을 포함한 전체 가맹계약기간이 10년을 초과하지 아니하는 범위\n에서 행사할 수 있음.\n그런데 일부 가맹본부에서 10년이 초과한 가맹점사업자를 대상으로\n‘기업방침의 변화와 가맹계약에 대한 입장차이’ 등을 이유로 일방적으\n로 계약 갱신의 거절을 통보하는 경우가 발생하고 있음. 매년 계약갱\n신을 무기로 불이익을 강요하며 가맹본부에 비판적인 가맹점사업자에\n대한 보복조치, 길들이기, 단체활동 방해수단으로 악용될 여지가 크다\n는 의견이 있음.\n이에 계약갱신요구권의 기간을 없애 가맹본부가 정당한 사유 없이\n갱신거절을 할 수 없도록 하여 가맹점사업자의 권리를 보장하는 데\n\n\n\n기여하려 함(안 제13조제2항 삭제).",
    "법률_제_호": "가맹사업거래의 공정화에 관한 법률 일부개정법률안\n가맹사업거래의 공정화에 관한 법률 일부를 다음과 같이 개정한다.\n제13조제2항을 삭제한다.",
    "신구조문대비표": "현 행 개 정 안\n제13조(가맹계약의 갱신 등) ① 제13조(가맹계약의 갱신 등) ①\n(생 략) (현행과 같음)\n② 가맹점사업자의 계약갱신요 <삭 제>\n구권은 최초 가맹계약기간을 포\n함한 전체 가맹계약기간이 10년\n을 초과하지 아니하는 범위 내\n에서만 행사할 수 있다.\n③ㆍ④ (생 략) ③ㆍ④ (현행과 같음)"
  }
}