{
  "title": "2203142_공교육_정상화_촉진_및_선행교육_규제에_관한_특별법_일부개정법률안",
  "bill_number": "3142",
  "proposal_date": "2024. 8. 23.",
  "submission_date": "",
  "is_alternative": false,
  "alternative_bill_numbers": [],
  "has_comparison_table": false,
  "comparison_table": "신ㆍ구조문대비표\n현 행 개 정 안\n법률 제16300호 공교육 정상화 법률 제16300호 공교육 정상화\n촉진 및 선행교육 규제에 관한 촉진 및 선행교육 규제에 관한\n특별법 일부개정법률 ",
  "full_text": "공교육 정상화 촉진 및 선행교육 규제에 관한 특별법\n일부개정법률안\n(조정훈의원 대표발의)\n발의연월일 : 2024. 8. 23.\n의 안\n3142\n번 호 발 의 자 : 조정훈ㆍ김소희ㆍ김대식\n인요한ㆍ최수진ㆍ서지영\n김용태ㆍ정성국ㆍ조경태\n이인선 의원(10인)\n제안이유\n현행법상 농산어촌 지역 및 도시 저소득층 밀집 지역의 학교와 고\n등학교의 휴업일에 한하여 2025년 2월 28일까지 방과후학교를 통한\n선행학습을 허용하고 있음. 이는 사교육을 통한 선행학습 수요가 높은\n상황에서 공교육 내 선행학습 수요를 흡수하여 학부모 부담을 경감시\n키고, 상대적으로 교육여건이 열악한 지역과 학원이 많은 지역 간 교\n육격차도 완화하기 위한 취지임.\n그런데 일몰기한이 만료될 경우 소외 지역ㆍ계층에 대한 교육기회\n가 줄어들어 교육격차가 심화 될 수 있고, 여전히 선행학습 수요가 많\n은 상황에서 가계 사교육비 지출 부담이 가중될 우려가 크다는 지적\n이 있음.\n이에 농산어촌 지역 등에서 실시 중인 방과후학교 선행학습 허용기\n간을 2031년 2월 28일까지 6년 연장하여, 공교육을 통한 교육기회를\n\n\n\n보장하고 사교육비의 가계부담을 완화시키고자 함.\n주요내용\n농산어촌 지역 등에서 방과후학교를 통하여 선행학습을 허용하고\n있는 제8조제2항의 유효기간을 2031년 2월 28일까지 연장함(안 법률\n제16300호 공교육 정상화 촉진 및 선행교육 규제에 관한 특별법 일부\n개정법률 부칙 제2조).\n\n법률 제 호\n공교육 정상화 촉진 및 선행교육 규제에 관한 특별법\n일부개정법률안\n공교육 정상화 촉진 및 선행교육 규제에 관한 특별법 일부를 다음과\n같이 개정한다.\n법률 제16300호 공교육 정상화 촉진 및 선행교육 규제에 관한 특별법\n일부개정법률 부칙 제2조 중 “2025년 2월 28일까지”를 “2031년 2월 28\n일까지”로 한다.\n부 칙\n이 법은 공포한 날부터 시행한다.\n\n\n\n\n신ㆍ구조문대비표\n현 행 개 정 안\n법률 제16300호 공교육 정상화 법률 제16300호 공교육 정상화\n촉진 및 선행교육 규제에 관한 촉진 및 선행교육 규제에 관한\n특별법 일부개정법률 부칙 특별법 일부개정법률 부칙\n제2조(유효기간) 제8조제2항의 개 제2조(유효기간) ---------------\n정규정은 2025년 2월 28일까지 ---------2031년 2월 28일까지-\n효력을 가진다. -------------.\n",
  "sections": {
    "제안이유": "현행법상 농산어촌 지역 및 도시 저소득층 밀집 지역의 학교와 고\n등학교의 휴업일에 한하여 2025년 2월 28일까지 방과후학교를 통한\n선행학습을 허용하고 있음. 이는 사교육을 통한 선행학습 수요가 높은\n상황에서 공교육 내 선행학습 수요를 흡수하여 학부모 부담을 경감시\n키고, 상대적으로 교육여건이 열악한 지역과 학원이 많은 지역 간 교\n육격차도 완화하기 위한 취지임.\n그런데 일몰기한이 만료될 경우 소외 지역ㆍ계층에 대한 교육기회\n가 줄어들어 교육격차가 심화 될 수 있고, 여전히 선행학습 수요가 많\n은 상황에서 가계 사교육비 지출 부담이 가중될 우려가 크다는 지적\n이 있음.\n이에 농산어촌 지역 등에서 실시 중인 방과후학교 선행학습 허용기\n간을 2031년 2월 28일까지 6년 연장하여, 공교육을 통한 교육기회를\n\n\n\n보장하고 사교육비의 가계부담을 완화시키고자 함.",
    "주요내용": "농산어촌 지역 등에서 방과후학교를 통하여 선행학습을 허용하고\n있는 제8조제2항의 유효기간을 2031년 2월 28일까지 연장함(안",
    "법률_제_호": "공교육 정상화 촉진 및 선행교육 규제에 관한 특별법 일부\n개정법률",
    "신구조문대비표": "현 행 개 정 안\n법률 제16300호 공교육 정상화 법률 제16300호 공교육 정상화\n촉진 및 선행교육 규제에 관한 촉진 및 선행교육 규제에 관한\n특별법 일부개정법률"
  }
}