{
  "title": "2203843_방송통신위원회의_설치_및_운영에_관한_법률_일부개정법률안",
  "bill_number": "3843",
  "proposal_date": "2024. 9. 10.",
  "submission_date": "",
  "is_alternative": false,
  "alternative_bill_numbers": [],
  "has_comparison_table": false,
  "comparison_table": "신ㆍ구조문대비표\n현 행 개 정 안\n제18조(방송통신심의위원회의 설 제18조(방송통신심의위원회의 설\n치 등) ① ∼ ④ (생 략) 치 등) ① ∼ ④ (현행과 같음)\n<신 설> ⑤ 제4항에 따라 호선된 심의\n위원장은 국회의 인사청문을\n거쳐 대통령이 위촉한다.\n⑤ ∼ ⑦ (생 략) ⑥ ∼ ⑧ (현행 제5항부터 제7\n항까지와 같음)",
  "full_text": "방송통신위원회의 설치 및 운영에 관한 법률\n일부개정법률안\n(김현의원 대표발의)\n발의연월일 : 2024. 9. 10.\n의 안\n3843\n번 호 발 의 자 : 김 현ㆍ박민규ㆍ정진욱\n이정헌ㆍ송재봉ㆍ주철현\n최민희ㆍ황정아ㆍ김 윤\n문금주ㆍ김영환ㆍ이병진\n이광희ㆍ강준현ㆍ박희승\n(15인)\n제안이유 및 주요내용\n현행법은 국회의 임명동의나 선출을 요하는 공직자 등의 자질과 능\n력 등을 사전에 심사하기 위하여, 인사청문제도를 두고 있음.\n최근 방송통신심의위원회 류희림 위원장은 민원사주와 편향된 정치\n심의로 언론의 민주주의를 유린하는 가운데 임기종료 다음날 기습적\n으로 문을 걸어 잠근 채 회의를 열어 날치기 연임까지 강행함.\n방심위의 방송내용 심의ㆍ규제 권한은 자칫 언론ㆍ표현의 자유를\n침해하는 결과로 이어질 수 있을 정도로 중요해지면서, 장관급 인사로\n분류되는 방심위원장의 자질과 능력에 대한 검증제도 도입의 필요성\n이 커짐.\n이에 방송통신심의위원회 위원장이 인사청문 대상이 되어 국민들의\n\n\n\n권리와 의무에 영향을 끼치는 공직자로서 역사관, 도덕성, 직무수행\n능력이 검증될 수 있도록 「방송통신위원회의 설치 및 운영에 관한\n법률」 일부를 개정하고자 함(안 제18조제5항 신설).\n참고사항\n이 법률안은 김현의원이 대표발의한 「국회법 일부개정법률안」(의\n안번호 제3842호) 및 「인사청문회법 일부개정법률안」(의안번호 제\n3841호)의 의결을 전제로 하는 것이므로 같은 법률안이 의결되지 아니\n하거나 수정의결되는 경우에는 이에 맞추어 조정되어야 할 것임.\n\n법률 제 호\n방송통신위원회의 설치 및 운영에 관한 법률\n일부개정법률안\n방송통신위원회의 설치 및 운영에 관한 법률 일부를 다음과 같이 개\n정한다.\n제18조제5항부터 제7항까지를 각각 제6항부터 제8항까지로 하고, 같은\n조에 제5항을 다음과 같이 신설한다.\n⑤ 제4항에 따라 호선된 심의위원장은 국회의 인사청문을 거쳐 대\n통령이 위촉한다.\n부 칙\n제1조(시행일) 이 법은 공포 후 6개월이 경과한 날부터 시행한다.\n제2조(심의위원장의 국회 인사청문에 관한 적용례) 제18조제5항의 개\n정규정은 이 법 시행 이후 심의위원장을 위촉하려는 경우부터 적용\n한다.\n\n\n\n\n신ㆍ구조문대비표\n현 행 개 정 안\n제18조(방송통신심의위원회의 설 제18조(방송통신심의위원회의 설\n치 등) ① ∼ ④ (생 략) 치 등) ① ∼ ④ (현행과 같음)\n<신 설> ⑤ 제4항에 따라 호선된 심의\n위원장은 국회의 인사청문을\n거쳐 대통령이 위촉한다.\n⑤ ∼ ⑦ (생 략) ⑥ ∼ ⑧ (현행 제5항부터 제7\n항까지와 같음)\n",
  "sections": {
    "제안이유": "및",
    "주요내용": "현행법은 국회의 임명동의나 선출을 요하는 공직자 등의 자질과 능\n력 등을 사전에 심사하기 위하여, 인사청문제도를 두고 있음.\n최근 방송통신심의위원회 류희림 위원장은 민원사주와 편향된 정치\n심의로 언론의 민주주의를 유린하는 가운데 임기종료 다음날 기습적\n으로 문을 걸어 잠근 채 회의를 열어 날치기 연임까지 강행함.\n방심위의 방송내용 심의ㆍ규제 권한은 자칫 언론ㆍ표현의 자유를\n침해하는 결과로 이어질 수 있을 정도로 중요해지면서, 장관급 인사로\n분류되는 방심위원장의 자질과 능력에 대한 검증제도 도입의 필요성\n이 커짐.\n이에 방송통신심의위원회 위원장이 인사청문 대상이 되어 국민들의\n\n\n\n권리와 의무에 영향을 끼치는 공직자로서 역사관, 도덕성, 직무수행\n능력이 검증될 수 있도록 「방송통신위원회의 설치 및 운영에 관한\n법률」 일부를 개정하고자 함(안 제18조제5항 신설).",
    "제안이유_및_주요내용": "현행법은 국회의 임명동의나 선출을 요하는 공직자 등의 자질과 능\n력 등을 사전에 심사하기 위하여, 인사청문제도를 두고 있음.\n최근 방송통신심의위원회 류희림 위원장은 민원사주와 편향된 정치\n심의로 언론의 민주주의를 유린하는 가운데 임기종료 다음날 기습적\n으로 문을 걸어 잠근 채 회의를 열어 날치기 연임까지 강행함.\n방심위의 방송내용 심의ㆍ규제 권한은 자칫 언론ㆍ표현의 자유를\n침해하는 결과로 이어질 수 있을 정도로 중요해지면서, 장관급 인사로\n분류되는 방심위원장의 자질과 능력에 대한 검증제도 도입의 필요성\n이 커짐.\n이에 방송통신심의위원회 위원장이 인사청문 대상이 되어 국민들의\n\n\n\n권리와 의무에 영향을 끼치는 공직자로서 역사관, 도덕성, 직무수행\n능력이 검증될 수 있도록 「방송통신위원회의 설치 및 운영에 관한\n법률」 일부를 개정하고자 함(안 제18조제5항 신설).",
    "법률_제_호": "방송통신위원회의 설치 및 운영에 관한 법률\n일부개정법률안\n방송통신위원회의 설치 및 운영에 관한 법률 일부를 다음과 같이 개\n정한다.\n제18조제5항부터 제7항까지를 각각 제6항부터 제8항까지로 하고, 같은\n조에 제5항을 다음과 같이 신설한다.\n⑤ 제4항에 따라 호선된 심의위원장은 국회의 인사청문을 거쳐 대\n통령이 위촉한다.",
    "신구조문대비표": "현 행 개 정 안\n제18조(방송통신심의위원회의 설 제18조(방송통신심의위원회의 설\n치 등) ① ∼ ④ (생 략) 치 등) ① ∼ ④ (현행과 같음)\n<신 설> ⑤ 제4항에 따라 호선된 심의\n위원장은 국회의 인사청문을\n거쳐 대통령이 위촉한다.\n⑤ ∼ ⑦ (생 략) ⑥ ∼ ⑧ (현행 제5항부터 제7\n항까지와 같음)"
  }
}