{
  "title": "2203029_예술인_복지법_일부개정법률안",
  "bill_number": "3029",
  "proposal_date": "2024. 8. 21.",
  "submission_date": "",
  "is_alternative": false,
  "alternative_bill_numbers": [],
  "has_comparison_table": false,
  "comparison_table": "신·구조문대비표\n현 행 개 정 안\n<신 설> 제7조의2(예술인에 대한 연금보\n험료 지원) 국가는 예술인의\n노후생활을 보장하기 위하여\n대통령령으로 정하는 바에 따\n라 예술인이 내는 「국민연금\n법」 제3조제1항제10호에 따른\n연금보험료의 일부를 지원할\n수 있다.",
  "full_text": "예술인 복지법 일부개정법률안\n(소병훈의원 대표발의)\n발의연월일 : 2024. 8. 21.\n의 안\n3029\n번 호 발 의 자 : 소병훈ㆍ허 영ㆍ정성호\n문정복ㆍ오세희ㆍ이기헌\n서영석ㆍ안태준ㆍ윤건영\n박 정ㆍ강선우 의원\n(11인)\n제안이유 및 주요내용\n문화체육관광부에서 실시한 ‘2021년 예술인 실태조사’에 따르면\n2020년 기준 예술인의 국민연금 가입 비율은 54%에 불과함. 예술인의\n경우 상대적으로 소득수준이 낮고 국민연금 가입률도 저조하여 노후\n대비가 충분히 되어 있지 못한 상황인 경우가 많음.\n예술인의 경제적 불안정성을 해소하기 위하여 문화체육관광부와 한\n국예술인복지재단에서 ‘예술인 사회보험료 지원 사업’을 통해 예술인\n이 부담하는 국민연금 보험료의 일부를 지원하고 있으나, 법적인 근거\n가 없어 사업의 지속성이 담보되기 어려운 실정임.\n이에 예술인이 내는 국민연금 보험료의 일부를 국가가 지원할 수\n있도록 법적인 근거를 마련함으로써, 예술인의 노후를 국가적인 차원\n에서 보다 두텁게 보장하려는 것임(안 제7조의2 신설).\n\n\n\n\n법률 제 호\n예술인 복지법 일부개정법률안\n예술인 복지법 일부를 다음과 같이 개정한다.\n제3장에 제7조의2를 다음과 같이 신설한다.\n제7조의2(예술인에 대한 연금보험료 지원) 국가는 예술인의 노후생활\n을 보장하기 위하여 대통령령으로 정하는 바에 따라 예술인이 내는\n「국민연금법」 제3조제1항제10호에 따른 연금보험료의 일부를 지\n원할 수 있다.\n부 칙\n제1조(시행일) 이 법은 공포 후 6개월이 경과한 날부터 시행한다.\n제2조(연금보험료 지원에 관한 적용례) 제7조의2의 개정규정은 이 법\n시행일이 속하는 달의 연금보험료부터 적용한다.\n\n\n\n\n신·구조문대비표\n현 행 개 정 안\n<신 설> 제7조의2(예술인에 대한 연금보\n험료 지원) 국가는 예술인의\n노후생활을 보장하기 위하여\n대통령령으로 정하는 바에 따\n라 예술인이 내는 「국민연금\n법」 제3조제1항제10호에 따른\n연금보험료의 일부를 지원할\n수 있다.\n",
  "sections": {
    "제안이유": "및",
    "주요내용": "문화체육관광부에서 실시한 ‘2021년 예술인 실태조사’에 따르면\n2020년 기준 예술인의 국민연금 가입 비율은 54%에 불과함. 예술인의\n경우 상대적으로 소득수준이 낮고 국민연금 가입률도 저조하여 노후\n대비가 충분히 되어 있지 못한 상황인 경우가 많음.\n예술인의 경제적 불안정성을 해소하기 위하여 문화체육관광부와 한\n국예술인복지재단에서 ‘예술인 사회보험료 지원 사업’을 통해 예술인\n이 부담하는 국민연금 보험료의 일부를 지원하고 있으나, 법적인 근거\n가 없어 사업의 지속성이 담보되기 어려운 실정임.\n이에 예술인이 내는 국민연금 보험료의 일부를 국가가 지원할 수\n있도록 법적인 근거를 마련함으로써, 예술인의 노후를 국가적인 차원\n에서 보다 두텁게 보장하려는 것임(안 제7조의2 신설).",
    "제안이유_및_주요내용": "문화체육관광부에서 실시한 ‘2021년 예술인 실태조사’에 따르면\n2020년 기준 예술인의 국민연금 가입 비율은 54%에 불과함. 예술인의\n경우 상대적으로 소득수준이 낮고 국민연금 가입률도 저조하여 노후\n대비가 충분히 되어 있지 못한 상황인 경우가 많음.\n예술인의 경제적 불안정성을 해소하기 위하여 문화체육관광부와 한\n국예술인복지재단에서 ‘예술인 사회보험료 지원 사업’을 통해 예술인\n이 부담하는 국민연금 보험료의 일부를 지원하고 있으나, 법적인 근거\n가 없어 사업의 지속성이 담보되기 어려운 실정임.\n이에 예술인이 내는 국민연금 보험료의 일부를 국가가 지원할 수\n있도록 법적인 근거를 마련함으로써, 예술인의 노후를 국가적인 차원\n에서 보다 두텁게 보장하려는 것임(안 제7조의2 신설).",
    "법률_제_호": "예술인 복지법 일부개정법률안\n예술인 복지법 일부를 다음과 같이 개정한다.\n제3장에 제7조의2를 다음과 같이 신설한다.\n제7조의2(예술인에 대한 연금보험료 지원) 국가는 예술인의 노후생활\n을 보장하기 위하여 대통령령으로 정하는 바에 따라 예술인이 내는\n「국민연금법」 제3조제1항제10호에 따른 연금보험료의 일부를 지\n원할 수 있다.",
    "신구조문대비표": "현 행 개 정 안\n<신 설> 제7조의2(예술인에 대한 연금보\n험료 지원) 국가는 예술인의\n노후생활을 보장하기 위하여\n대통령령으로 정하는 바에 따\n라 예술인이 내는 「국민연금\n법」 제3조제1항제10호에 따른\n연금보험료의 일부를 지원할\n수 있다."
  }
}