{
  "title": "2203861_형법_일부개정법률안",
  "bill_number": "3861",
  "proposal_date": "2024. 9. 10.",
  "submission_date": "",
  "is_alternative": false,
  "alternative_bill_numbers": [],
  "has_comparison_table": false,
  "comparison_table": "신ㆍ구조문대비표\n현 행 개 정 안\n第9條(刑事未成年者) 14歲되지 제9조(형사미성년자) 12세가 ---\n아니한 者의 行爲는 罰하지 아 ------------------------\n니한다. -----.",
  "full_text": "형법 일부개정법률안\n(이종배의원 대표발의)\n발의연월일 : 2024. 9. 10.\n의 안\n3861\n번 호 발 의 자 : 이종배ㆍ송언석ㆍ김소희\n김위상ㆍ임이자ㆍ인요한\n김승수ㆍ김예지ㆍ신성범\n최은석 의원(10인)\n제안이유 및 주요내용\n현행법상 19세 미만의 소년이 범죄를 저지른 경우 형사처분 대신\n감호 위탁, 수강명령 등의 보호처분을 받을 수 있고, 10세 이상 14세\n미만인 소년은 형사미성년자에 해당되어 범죄를 저질러도 형사처벌이\n아닌 보호처분을 받게됨.\n그런데 최근 물질의 풍요, 인터넷의 발달 등으로 인간의 정신적ㆍ신\n체적 성장속도가 점점 빨라지고 있고 범죄의 저연령화ㆍ잔혹화 등이\n문제되고 있으므로, 현행법상 형사미성년자의 연령을 낮추어 현실을\n반영하자는 목소리가 커지고 있음. 또한 강력범죄로 검거된 소년이 가\n벼운 처분을 받는 경우가 많아 현행법이 오히려 재범의 위험성을 키\n우고 범죄예방의 효과를 약화시킨다는 지적이 있음.\n이에 형사미성년자의 연령을 12세 미만으로 조정함으로써, 소년범죄\n의 처벌 및 예방을 강화하려는 것임(안 제9조).\n\n\n\n참고사항\n이 법률안은 이종배의원이 대표발의한 「소년법 일부개정법률안」\n(의안번호 제3853호)의 의결을 전제로 하는 것이므로 같은 법률안이\n의결되지 아니하거나 수정의결되는 경우에는 이에 맞추어 조정되어야\n할 것임.\n\n법률 제 호\n형법 일부개정법률안\n형법 일부를 다음과 같이 개정한다.\n제9조의 조 번호 및 제목을 다음과 같이 하고, 같은 조 제목 외의 부\n분 중 “14歲”를 “12세가 ”로 한다.\n제9조(형사미성년자)\n부 칙\n이 법은 공포 후 3개월이 경과한 날부터 시행한다.\n\n\n\n\n신ㆍ구조문대비표\n현 행 개 정 안\n第9條(刑事未成年者) 14歲되지 제9조(형사미성년자) 12세가 ---\n아니한 者의 行爲는 罰하지 아 ------------------------\n니한다. -----.\n",
  "sections": {
    "제안이유": "및",
    "주요내용": "현행법상 19세 미만의 소년이 범죄를 저지른 경우 형사처분 대신\n감호 위탁, 수강명령 등의 보호처분을 받을 수 있고, 10세 이상 14세\n미만인 소년은 형사미성년자에 해당되어 범죄를 저질러도 형사처벌이\n아닌 보호처분을 받게됨.\n그런데 최근 물질의 풍요, 인터넷의 발달 등으로 인간의 정신적ㆍ신\n체적 성장속도가 점점 빨라지고 있고 범죄의 저연령화ㆍ잔혹화 등이\n문제되고 있으므로, 현행법상 형사미성년자의 연령을 낮추어 현실을\n반영하자는 목소리가 커지고 있음. 또한 강력범죄로 검거된 소년이 가\n벼운 처분을 받는 경우가 많아 현행법이 오히려 재범의 위험성을 키\n우고 범죄예방의 효과를 약화시킨다는 지적이 있음.\n이에 형사미성년자의 연령을 12세 미만으로 조정함으로써, 소년범죄\n의 처벌 및 예방을 강화하려는 것임(안 제9조).",
    "제안이유_및_주요내용": "현행법상 19세 미만의 소년이 범죄를 저지른 경우 형사처분 대신\n감호 위탁, 수강명령 등의 보호처분을 받을 수 있고, 10세 이상 14세\n미만인 소년은 형사미성년자에 해당되어 범죄를 저질러도 형사처벌이\n아닌 보호처분을 받게됨.\n그런데 최근 물질의 풍요, 인터넷의 발달 등으로 인간의 정신적ㆍ신\n체적 성장속도가 점점 빨라지고 있고 범죄의 저연령화ㆍ잔혹화 등이\n문제되고 있으므로, 현행법상 형사미성년자의 연령을 낮추어 현실을\n반영하자는 목소리가 커지고 있음. 또한 강력범죄로 검거된 소년이 가\n벼운 처분을 받는 경우가 많아 현행법이 오히려 재범의 위험성을 키\n우고 범죄예방의 효과를 약화시킨다는 지적이 있음.\n이에 형사미성년자의 연령을 12세 미만으로 조정함으로써, 소년범죄\n의 처벌 및 예방을 강화하려는 것임(안 제9조).",
    "법률_제_호": "형법 일부개정법률안\n형법 일부를 다음과 같이 개정한다.\n제9조의 조 번호 및 제목을 다음과 같이 하고, 같은 조 제목 외의 부\n분 중 “14歲”를 “12세가 ”로 한다.\n제9조(형사미성년자)",
    "신구조문대비표": "현 행 개 정 안\n第9條(刑事未成年者) 14歲되지 제9조(형사미성년자) 12세가 ---\n아니한 者의 行爲는 罰하지 아 ------------------------\n니한다. -----."
  }
}