{
  "title": "2203763_정당법_일부개정법률안",
  "bill_number": "3763",
  "proposal_date": "2024. 9. 6.",
  "submission_date": "",
  "is_alternative": false,
  "alternative_bill_numbers": [],
  "has_comparison_table": false,
  "comparison_table": "신·구조문대비표\n현 행 개 정 안\n<신 설> 제63조(공소시효) 이 법에 규정된\n죄의 공소시효는 6개월을 경과\n함으로써 완성한다. 다만, 범인\n이 도피한 때나 범인이 공범\n또는 범죄의 증명에 필요한 참\n고인을 도피시킨 때에는 그 기\n간은 3년으로 한다.",
  "full_text": "정당법 일부개정법률안\n(김교흥의원 대표발의)\n발의연월일 : 2024. 9. 6.\n의 안\n3763\n번 호 발 의 자 : 김교흥ㆍ소병훈ㆍ이훈기\n이언주ㆍ이해식ㆍ유동수\n신정훈ㆍ박성민ㆍ박선원\n강준현ㆍ조승래ㆍ윤건영\n강훈식ㆍ한병도ㆍ서영교\n의원(15인)\n제안이유 및 주요내용\n현행 「공직선거법」은 선거사범을 신속하게 처리하여 선거로 인한\n정국의 불안정 상태를 조속히 해결하고 당선인 등 이해관계인의 법적\n안정을 도모하기 위하여 6개월의 단기 공소시효 특례를 두고 있음. 비\n슷한 취지로 「공공단체등 위탁선거에 관한 법률」 및 「국민투표\n법」도 각각 6개월 및 3개월의 단기 공소시효 특례를 두고 있음.\n그런데 공직선거의 후보자를 선출하고 선거운동을 하는 등 공직선\n거와 밀접하게 관련이 있는 정당의 활동을 규율하는 현행법에는 별도\n의 공소시효 특례가 없어 수사와 처벌이 장기간 방치될 수 있고, 수사\n기관 등의 선택적 수사나 기소라는 불필요한 오해도 불러올 수 있음.\n이에, 현행법에도 단기 6개월의 공소시효 특례를 두어 밀접한 관련\n이 있는 「공직선거법」과 균형을 맞추려는 것임(안 제63조 신설).\n\n\n\n\n법률 제 호\n정당법 일부개정법률안\n정당법 일부를 다음과 같이 개정한다.\n제63조를 다음과 같이 신설한다.\n제63조(공소시효) 이 법에 규정된 죄의 공소시효는 6개월을 경과함으\n로써 완성한다. 다만, 범인이 도피한 때나 범인이 공범 또는 범죄의\n증명에 필요한 참고인을 도피시킨 때에는 그 기간은 3년으로 한다.\n부 칙\n제1조(시행일) 이 법은 공포한 날부터 시행한다.\n제2조(적용례) 제63조의 개정규정은 이 법 시행 이전에 발생한 범죄행\n위에도 적용한다.\n\n\n\n\n신·구조문대비표\n현 행 개 정 안\n<신 설> 제63조(공소시효) 이 법에 규정된\n죄의 공소시효는 6개월을 경과\n함으로써 완성한다. 다만, 범인\n이 도피한 때나 범인이 공범\n또는 범죄의 증명에 필요한 참\n고인을 도피시킨 때에는 그 기\n간은 3년으로 한다.\n",
  "sections": {
    "제안이유": "및",
    "주요내용": "현행 「공직선거법」은 선거사범을 신속하게 처리하여 선거로 인한\n정국의 불안정 상태를 조속히 해결하고 당선인 등 이해관계인의 법적\n안정을 도모하기 위하여 6개월의 단기 공소시효 특례를 두고 있음. 비\n슷한 취지로 「공공단체등 위탁선거에 관한 법률」 및 「국민투표\n법」도 각각 6개월 및 3개월의 단기 공소시효 특례를 두고 있음.\n그런데 공직선거의 후보자를 선출하고 선거운동을 하는 등 공직선\n거와 밀접하게 관련이 있는 정당의 활동을 규율하는 현행법에는 별도\n의 공소시효 특례가 없어 수사와 처벌이 장기간 방치될 수 있고, 수사\n기관 등의 선택적 수사나 기소라는 불필요한 오해도 불러올 수 있음.\n이에, 현행법에도 단기 6개월의 공소시효 특례를 두어 밀접한 관련\n이 있는 「공직선거법」과 균형을 맞추려는 것임(안 제63조 신설).",
    "제안이유_및_주요내용": "현행 「공직선거법」은 선거사범을 신속하게 처리하여 선거로 인한\n정국의 불안정 상태를 조속히 해결하고 당선인 등 이해관계인의 법적\n안정을 도모하기 위하여 6개월의 단기 공소시효 특례를 두고 있음. 비\n슷한 취지로 「공공단체등 위탁선거에 관한 법률」 및 「국민투표\n법」도 각각 6개월 및 3개월의 단기 공소시효 특례를 두고 있음.\n그런데 공직선거의 후보자를 선출하고 선거운동을 하는 등 공직선\n거와 밀접하게 관련이 있는 정당의 활동을 규율하는 현행법에는 별도\n의 공소시효 특례가 없어 수사와 처벌이 장기간 방치될 수 있고, 수사\n기관 등의 선택적 수사나 기소라는 불필요한 오해도 불러올 수 있음.\n이에, 현행법에도 단기 6개월의 공소시효 특례를 두어 밀접한 관련\n이 있는 「공직선거법」과 균형을 맞추려는 것임(안 제63조 신설).",
    "법률_제_호": "정당법 일부개정법률안\n정당법 일부를 다음과 같이 개정한다.\n제63조를 다음과 같이 신설한다.\n제63조(공소시효) 이 법에 규정된 죄의 공소시효는 6개월을 경과함으\n로써 완성한다. 다만, 범인이 도피한 때나 범인이 공범 또는 범죄의\n증명에 필요한 참고인을 도피시킨 때에는 그 기간은 3년으로 한다.",
    "신구조문대비표": "현 행 개 정 안\n<신 설> 제63조(공소시효) 이 법에 규정된\n죄의 공소시효는 6개월을 경과\n함으로써 완성한다. 다만, 범인\n이 도피한 때나 범인이 공범\n또는 범죄의 증명에 필요한 참\n고인을 도피시킨 때에는 그 기\n간은 3년으로 한다."
  }
}