{
  "title": "2204440_고등교육법_일부개정법률안",
  "bill_number": "4440",
  "proposal_date": "2024. 9. 30.",
  "submission_date": "",
  "is_alternative": false,
  "alternative_bill_numbers": [],
  "has_comparison_table": false,
  "comparison_table": "신ㆍ구조문대비표\n현 행 개 정 안\n제32조(학생의 정원) (생 략) 제32조(학생의 정원) ① (현행 제\n목 외의 부분과 같음)\n<신 설> ② 제1항에도 불구하고 「의료\n법」 제2조제1항에 따른 의사\n및 간호사의 양성과 관련되는\n대학의 학생 정원에 관한 사항\n은 「보건의료인력지원법」 제\n8조에 따른 보건의료인력정책\n심의위원회에서 정한다.",
  "full_text": "고등교육법 일부개정법률안\n(김윤의원 대표발의)\n발의연월일 : 2024. 9. 30.\n의 안\n4440\n번 호 발 의 자 : 김 윤ㆍ박민규ㆍ오세희\n서미화ㆍ최민희ㆍ주철현\n정혜경ㆍ전진숙ㆍ박홍배\n위성곤ㆍ채현일ㆍ김용민\n김우영ㆍ정진욱ㆍ이수진\n서왕진ㆍ이재강ㆍ황명선\n문금주ㆍ송재봉ㆍ황정아\n문대림ㆍ강준현ㆍ전종덕\n남인순ㆍ허 영ㆍ박희승\n이기헌ㆍ정준호 의원\n(29인)\n제안이유 및 주요내용\n지난 2월 정부의 일방적인 의대 증원 결정으로 인해 전공의들의 집\n단사직이 발생함. 의정갈등으로 인한 의료공백이 지속되고 있어 국민\n들의 막대한 피해가 우려되는 상황임. 과학적 근거에 기반한 사회적\n합의 절차를 거치지 않아 불필요한 사회적 갈등이 발생하고 있음.\n또한 확대된 의대정원이 지역별로 부족한 의료공급과 필요한 의료\n수요에 맞게 합리적으로 배분되지 않았다는 비판이 지속되고 있음.\n이에 의사 및 간호사의 양성과 관련된 대학의 학생 정원은 보건의\n\n\n\n료인력에 관한 주요 시책을 심의하는 보건의료인력정책심의위원회에\n서 정하도록 함으로써 의료인력 양성 대학의 정원 배정의 합리성을\n높이고자 함(안 제32조제2항 신설).\n참고사항\n이 법률안은 김윤의원이 대표발의한 「보건의료인력지원법 일부개\n정법률안」(의안번호 제4438호)의 의결을 전제로 하는 것이므로 같은\n법률안이 의결되지 아니하거나 수정의결되는 경우에는 이에 맞추어\n조정되어야 할 것임.\n\n법률 제 호\n고등교육법 일부개정법률안\n고등교육법 일부를 다음과 같이 개정한다.\n제32조 제목 외의 부분을 제1항으로 하고, 같은 조에 제2항을 다음과\n같이 신설한다.\n② 제1항에도 불구하고 「의료법」 제2조제1항에 따른 의사 및 간\n호사의 양성과 관련되는 대학의 학생 정원에 관한 사항은 「보건의\n료인력지원법」 제8조에 따른 보건의료인력정책심의위원회에서 정\n한다.\n부 칙\n제1조(시행일) 이 법은 공포한 날부터 시행한다.\n제2조(의과대학 입학정원에 관한 적용례) 제32조제2항의 개정규정은\n의과대학의 2026학년도 입학정원을 정하는 경우부터 적용한다.\n\n\n\n\n신ㆍ구조문대비표\n현 행 개 정 안\n제32조(학생의 정원) (생 략) 제32조(학생의 정원) ① (현행 제\n목 외의 부분과 같음)\n<신 설> ② 제1항에도 불구하고 「의료\n법」 제2조제1항에 따른 의사\n및 간호사의 양성과 관련되는\n대학의 학생 정원에 관한 사항\n은 「보건의료인력지원법」 제\n8조에 따른 보건의료인력정책\n심의위원회에서 정한다.\n",
  "sections": {
    "제안이유": "및",
    "주요내용": "지난 2월 정부의 일방적인 의대 증원 결정으로 인해 전공의들의 집\n단사직이 발생함. 의정갈등으로 인한 의료공백이 지속되고 있어 국민\n들의 막대한 피해가 우려되는 상황임. 과학적 근거에 기반한 사회적\n합의 절차를 거치지 않아 불필요한 사회적 갈등이 발생하고 있음.\n또한 확대된 의대정원이 지역별로 부족한 의료공급과 필요한 의료\n수요에 맞게 합리적으로 배분되지 않았다는 비판이 지속되고 있음.\n이에 의사 및 간호사의 양성과 관련된 대학의 학생 정원은 보건의\n\n\n\n료인력에 관한 주요 시책을 심의하는 보건의료인력정책심의위원회에\n서 정하도록 함으로써 의료인력 양성 대학의 정원 배정의 합리성을\n높이고자 함(안 제32조제2항 신설).",
    "제안이유_및_주요내용": "지난 2월 정부의 일방적인 의대 증원 결정으로 인해 전공의들의 집\n단사직이 발생함. 의정갈등으로 인한 의료공백이 지속되고 있어 국민\n들의 막대한 피해가 우려되는 상황임. 과학적 근거에 기반한 사회적\n합의 절차를 거치지 않아 불필요한 사회적 갈등이 발생하고 있음.\n또한 확대된 의대정원이 지역별로 부족한 의료공급과 필요한 의료\n수요에 맞게 합리적으로 배분되지 않았다는 비판이 지속되고 있음.\n이에 의사 및 간호사의 양성과 관련된 대학의 학생 정원은 보건의\n\n\n\n료인력에 관한 주요 시책을 심의하는 보건의료인력정책심의위원회에\n서 정하도록 함으로써 의료인력 양성 대학의 정원 배정의 합리성을\n높이고자 함(안 제32조제2항 신설).",
    "법률_제_호": "고등교육법 일부개정법률안\n고등교육법 일부를 다음과 같이 개정한다.\n제32조 제목 외의 부분을 제1항으로 하고, 같은 조에 제2항을 다음과\n같이 신설한다.\n② 제1항에도 불구하고 「의료법」 제2조제1항에 따른 의사 및 간\n호사의 양성과 관련되는 대학의 학생 정원에 관한 사항은 「보건의\n료인력지원법」 제8조에 따른 보건의료인력정책심의위원회에서 정\n한다.",
    "신구조문대비표": "현 행 개 정 안\n제32조(학생의 정원) (생 략) 제32조(학생의 정원) ① (현행 제\n목 외의 부분과 같음)\n<신 설> ② 제1항에도 불구하고 「의료\n법」 제2조제1항에 따른 의사\n및 간호사의 양성과 관련되는\n대학의 학생 정원에 관한 사항\n은 「보건의료인력지원법」 제\n8조에 따른 보건의료인력정책\n심의위원회에서 정한다."
  }
}