{
  "title": "2204046_지방세법_일부개정법률안",
  "bill_number": "4046",
  "proposal_date": "2024. 9. 13.",
  "submission_date": "",
  "is_alternative": false,
  "alternative_bill_numbers": [],
  "has_comparison_table": false,
  "comparison_table": "신ㆍ구조문대비표\n현 행 개 정 안\n법률 제10221호 지방세법 전부 법률 제10221호 지방세법 전부\n개정법률 ",
  "full_text": "지방세법 일부개정법률안\n(백승아의원 대표발의)\n발의연월일 : 2024. 9. 13.\n의 안\n4046\n번 호 발 의 자 : 백승아ㆍ박홍배ㆍ강경숙\n진선미ㆍ김준혁ㆍ문정복\n정을호ㆍ김동아ㆍ김문수\n서영석ㆍ양부남 의원\n(11인)\n제안이유 및 주요내용\n현행법은 담배소비세액의 1만분의 4,399에 해당하는 금액을 지방교\n육세의 세액으로 하여 부과하고 있으나, 2024년 12월 31일을 기한으로\n적용시한 만료가 예정되어 있음.\n그러나 지방교육재정의 안정적 확보 등을 위하여 해당 규정을 유지\n할 필요가 있음.\n이에 담배소비세분 지방교육세의 적용시한을 2027년 12월 31일까지\n3년 연장하려는 것임(안 법률 제10221호 지방세법 전부개정법률 부칙\n제1조의2).\n\n\n\n\n법률 제 호\n지방세법 일부개정법률안\n지방세법 일부를 다음과 같이 개정한다.\n법률 제10221호 지방세법 전부개정법률 부칙 제1조의2 중 “2024년 12\n월 31일”을 “2027년 12월 31일”로 한다.\n부 칙\n이 법은 2025년 1월 1일부터 시행한다.\n\n\n\n\n신ㆍ구조문대비표\n현 행 개 정 안\n법률 제10221호 지방세법 전부 법률 제10221호 지방세법 전부\n개정법률 부칙 개정법률 부칙\n제1조의2(적용시한) 제151조제1항 제1조의2(적용시한) ------------\n제4호의 개정규정은 2024년 12 -------------------2027년 12\n월 31일까지 효력을 가진다. 월 31일------------------.\n",
  "sections": {
    "제안이유": "및",
    "주요내용": "현행법은 담배소비세액의 1만분의 4,399에 해당하는 금액을 지방교\n육세의 세액으로 하여 부과하고 있으나, 2024년 12월 31일을 기한으로\n적용시한 만료가 예정되어 있음.\n그러나 지방교육재정의 안정적 확보 등을 위하여 해당 규정을 유지\n할 필요가 있음.\n이에 담배소비세분 지방교육세의 적용시한을 2027년 12월 31일까지\n3년 연장하려는 것임(안",
    "제안이유_및_주요내용": "현행법은 담배소비세액의 1만분의 4,399에 해당하는 금액을 지방교\n육세의 세액으로 하여 부과하고 있으나, 2024년 12월 31일을 기한으로\n적용시한 만료가 예정되어 있음.\n그러나 지방교육재정의 안정적 확보 등을 위하여 해당 규정을 유지\n할 필요가 있음.\n이에 담배소비세분 지방교육세의 적용시한을 2027년 12월 31일까지\n3년 연장하려는 것임(안",
    "법률_제_호": "지방세법 전부개정법률",
    "신구조문대비표": "현 행 개 정 안\n법률 제10221호 지방세법 전부 법률 제10221호 지방세법 전부\n개정법률"
  }
}