{
  "title": "2204754_국회법_일부개정법률안",
  "bill_number": "4754",
  "proposal_date": "2024. 10. 17.",
  "submission_date": "",
  "is_alternative": false,
  "alternative_bill_numbers": [],
  "has_comparison_table": false,
  "comparison_table": "신ㆍ구조문대비표\n현 행 개 정 안\n제54조의2(정보위원회에 대한 특 제54조의2(정보위원회에 대한 특\n례) ① 정보위원회의 회의는 례) <삭 제>\n공개하지 아니한다. 다만, 공청\n회 또는 제65조의2에 따른 인\n사청문회를 실시하는 경우에는\n위원회의 의결로 이를 공개할\n수 있다.\n② ∼ ④ (생 략) ② ∼ ④ (현행과 같음)",
  "full_text": "국회법 일부개정법률안\n(민형배의원 대표발의)\n발의연월일 : 2024. 10. 17.\n의 안\n4754\n번 호 발 의 자 : 민형배ㆍ이수진ㆍ김성환\n곽상언ㆍ소병훈ㆍ김용민\n김문수ㆍ한민수ㆍ주철현\n이강일ㆍ이개호ㆍ이기헌\n의원(12인)\n제안이유 및 주요내용\n헌법재판소 결정 취지를 반영하여, 정보위원회 회의도 다른 위원회\n와 동일하게 공개를 원칙으로 하고자 합니다.\n우리 헌법은 ‘국회의 회의는 공개한다(제50조제1항)’고 명시하고 있\n습니다. 의사공개원칙에 따라 모든 국회의 회의는 항상 공개해야합니\n다. 다만, 헌법에서 정하고 있는 일정한 요건을 갖춘 경우는 공개하지\n않을 수 있습니다.\n국회 정보위원회 회의는 국회법 정보위원회 특례 규정에 따라 모든\n회의를 일률적으로 비공개하고 있습니다. 2022년 1월 27일 헌법재판소\n는 국회법 제54조의2제1항이 국민의 알 권리를 침해한다며 위헌판결\n을 내렸습니다.\n이에 정보위원회 회의운영에 관한 특례 규정을 없애고, 국회 본회\n의, 상임위원회 회의 운영규정을 준용하도록 하고자 합니다. 공공정보\n\n\n\n공개를 통해 국정에 대한 국민 참여도를 높이고 국정운영의 투명성을\n확보하기 위한 것입니다(안 제54조의2제1항 삭제).\n\n법률 제 호\n국회법 일부개정법률안\n국회법 일부를 다음과 같이 개정한다.\n제54조의2제1항을 삭제한다.\n부 칙\n이 법은 공포한 날부터 시행한다.\n\n\n\n\n신ㆍ구조문대비표\n현 행 개 정 안\n제54조의2(정보위원회에 대한 특 제54조의2(정보위원회에 대한 특\n례) ① 정보위원회의 회의는 례) <삭 제>\n공개하지 아니한다. 다만, 공청\n회 또는 제65조의2에 따른 인\n사청문회를 실시하는 경우에는\n위원회의 의결로 이를 공개할\n수 있다.\n② ∼ ④ (생 략) ② ∼ ④ (현행과 같음)\n",
  "sections": {
    "제안이유": "및",
    "주요내용": "헌법재판소 결정 취지를 반영하여, 정보위원회 회의도 다른 위원회\n와 동일하게 공개를 원칙으로 하고자 합니다.\n우리 헌법은 ‘국회의 회의는 공개한다(제50조제1항)’고 명시하고 있\n습니다. 의사공개원칙에 따라 모든 국회의 회의는 항상 공개해야합니\n다. 다만, 헌법에서 정하고 있는 일정한 요건을 갖춘 경우는 공개하지\n않을 수 있습니다.\n국회 정보위원회 회의는 국회법 정보위원회 특례 규정에 따라 모든\n회의를 일률적으로 비공개하고 있습니다. 2022년 1월 27일 헌법재판소\n는 국회법 제54조의2제1항이 국민의 알 권리를 침해한다며 위헌판결\n을 내렸습니다.\n이에 정보위원회 회의운영에 관한 특례 규정을 없애고, 국회 본회\n의, 상임위원회 회의 운영규정을 준용하도록 하고자 합니다. 공공정보\n\n\n\n공개를 통해 국정에 대한 국민 참여도를 높이고 국정운영의 투명성을\n확보하기 위한 것입니다(안 제54조의2제1항 삭제).",
    "제안이유_및_주요내용": "헌법재판소 결정 취지를 반영하여, 정보위원회 회의도 다른 위원회\n와 동일하게 공개를 원칙으로 하고자 합니다.\n우리 헌법은 ‘국회의 회의는 공개한다(제50조제1항)’고 명시하고 있\n습니다. 의사공개원칙에 따라 모든 국회의 회의는 항상 공개해야합니\n다. 다만, 헌법에서 정하고 있는 일정한 요건을 갖춘 경우는 공개하지\n않을 수 있습니다.\n국회 정보위원회 회의는 국회법 정보위원회 특례 규정에 따라 모든\n회의를 일률적으로 비공개하고 있습니다. 2022년 1월 27일 헌법재판소\n는 국회법 제54조의2제1항이 국민의 알 권리를 침해한다며 위헌판결\n을 내렸습니다.\n이에 정보위원회 회의운영에 관한 특례 규정을 없애고, 국회 본회\n의, 상임위원회 회의 운영규정을 준용하도록 하고자 합니다. 공공정보\n\n\n\n공개를 통해 국정에 대한 국민 참여도를 높이고 국정운영의 투명성을\n확보하기 위한 것입니다(안 제54조의2제1항 삭제).",
    "법률_제_호": "국회법 일부개정법률안\n국회법 일부를 다음과 같이 개정한다.\n제54조의2제1항을 삭제한다.",
    "신구조문대비표": "현 행 개 정 안\n제54조의2(정보위원회에 대한 특 제54조의2(정보위원회에 대한 특\n례) ① 정보위원회의 회의는 례) <삭 제>\n공개하지 아니한다. 다만, 공청\n회 또는 제65조의2에 따른 인\n사청문회를 실시하는 경우에는\n위원회의 의결로 이를 공개할\n수 있다.\n② ∼ ④ (생 략) ② ∼ ④ (현행과 같음)"
  }
}