{
  "title": "2204091_지방교육재정교부금법_일부개정법률안",
  "bill_number": "4091",
  "proposal_date": "2024. 9. 19.",
  "submission_date": "",
  "is_alternative": false,
  "alternative_bill_numbers": [],
  "has_comparison_table": false,
  "comparison_table": "신ㆍ구조문대비표\n현 행 개 정 안\n법률 제16673호 지방교육재정교 법률 제16673호 지방교육재정교\n부금법 일부개정법률 ",
  "full_text": "지방교육재정교부금법 일부개정법률안\n(서영교의원 대표발의)\n발의연월일 : 2024. 9. 19.\n의 안\n4091\n번 호 발 의 자 : 서영교ㆍ위성곤ㆍ윤준병\n박희승ㆍ이해식ㆍ한정애\n박홍배ㆍ강유정ㆍ박용갑\n장경태ㆍ임오경 의원\n(11인)\n제안이유 및 주요내용\n현행법에 따르면 국가는 고등학교 등의 무상교육에 필요한 비용 중\n1,000분의 475에 해당하는 금액을 따로 증액교부하고, 시ㆍ도 및 시ㆍ\n군ㆍ구는 고등학교 등의 무상교육에 필요한 비용 중 1,000분의 50에\n해당하는 금액을 대통령령으로 정하는 바에 따라 교육비특별회계로\n전출하여야 함. 그런데 해당 특례 규정의 일몰 기한이 2024년 12월 31\n일로 도래할 예정임.\n국가의 경비 지원이 중단될 경우 각 지역의 교육재정 운영에 어려\n움이 가중될 우려가 있고 2021년에야 전면 실시되었던 고교 무상교육\n의 안정적 추진을 위해서는 해당 특례의 적용기한을 연장할 필요가\n있다는 의견이 제기되고 있음.\n이에 고등학교 등의 무상교육 경비 부담에 관한 특례의 유효기간을\n2029년까지 5년 연장하여 고등학교 등의 무상교육이 안정적으로 운영\n\n\n\n되도록 하려는 것임(안 법률 제16673호 지방교육재정교부금법 일부개\n정법률 부칙 제2조).\n\n법률 제 호\n지방교육재정교부금법 일부개정법률안\n지방교육재정교부금법 일부를 다음과 같이 개정한다.\n법률 제16673호 지방교육재정교부금법 일부개정법률 부칙 제2조 중\n“2024년”을 “2029년”으로 한다.\n부 칙\n이 법은 공포한 날부터 시행한다.\n\n\n\n\n신ㆍ구조문대비표\n현 행 개 정 안\n법률 제16673호 지방교육재정교 법률 제16673호 지방교육재정교\n부금법 일부개정법률 부칙 부금법 일부개정법률 부칙\n제2조(유효기간) 제14조의 개정규 제2조(유효기간) ---------------\n정은 2020년 1월 1일부터 2024 ------------------------2029\n년 12월 31일까지 효력을 가진 년--------------------------\n다. --.\n",
  "sections": {
    "제안이유": "및",
    "주요내용": "현행법에 따르면 국가는 고등학교 등의 무상교육에 필요한 비용 중\n1,000분의 475에 해당하는 금액을 따로 증액교부하고, 시ㆍ도 및 시ㆍ\n군ㆍ구는 고등학교 등의 무상교육에 필요한 비용 중 1,000분의 50에\n해당하는 금액을 대통령령으로 정하는 바에 따라 교육비특별회계로\n전출하여야 함. 그런데 해당 특례 규정의 일몰 기한이 2024년 12월 31\n일로 도래할 예정임.\n국가의 경비 지원이 중단될 경우 각 지역의 교육재정 운영에 어려\n움이 가중될 우려가 있고 2021년에야 전면 실시되었던 고교 무상교육\n의 안정적 추진을 위해서는 해당 특례의 적용기한을 연장할 필요가\n있다는 의견이 제기되고 있음.\n이에 고등학교 등의 무상교육 경비 부담에 관한 특례의 유효기간을\n2029년까지 5년 연장하여 고등학교 등의 무상교육이 안정적으로 운영\n\n\n\n되도록 하려는 것임(안",
    "제안이유_및_주요내용": "현행법에 따르면 국가는 고등학교 등의 무상교육에 필요한 비용 중\n1,000분의 475에 해당하는 금액을 따로 증액교부하고, 시ㆍ도 및 시ㆍ\n군ㆍ구는 고등학교 등의 무상교육에 필요한 비용 중 1,000분의 50에\n해당하는 금액을 대통령령으로 정하는 바에 따라 교육비특별회계로\n전출하여야 함. 그런데 해당 특례 규정의 일몰 기한이 2024년 12월 31\n일로 도래할 예정임.\n국가의 경비 지원이 중단될 경우 각 지역의 교육재정 운영에 어려\n움이 가중될 우려가 있고 2021년에야 전면 실시되었던 고교 무상교육\n의 안정적 추진을 위해서는 해당 특례의 적용기한을 연장할 필요가\n있다는 의견이 제기되고 있음.\n이에 고등학교 등의 무상교육 경비 부담에 관한 특례의 유효기간을\n2029년까지 5년 연장하여 고등학교 등의 무상교육이 안정적으로 운영\n\n\n\n되도록 하려는 것임(안",
    "법률_제_호": "지방교육재정교부금법 일부개\n정법률",
    "신구조문대비표": "현 행 개 정 안\n법률 제16673호 지방교육재정교 법률 제16673호 지방교육재정교\n부금법 일부개정법률"
  }
}