{
  "title": "2204751_관광진흥법_일부개정법률안",
  "bill_number": "4751",
  "proposal_date": "2024. 10. 17.",
  "submission_date": "",
  "is_alternative": false,
  "alternative_bill_numbers": [],
  "has_comparison_table": false,
  "comparison_table": "신ㆍ구조문대비표\n현 행 개 정 안\n제47조의3(장애인ㆍ고령자 관광 제47조의3(장애인ㆍ고령자ㆍ다자\n활동의 지원) ①ㆍ② (생 략) 녀 가구 관광 활동의 지원) ①\nㆍ② (현행과 같음)\n<신 설> ③ 국가 및 지방자치단체는 다\n자녀 가구의 관광 활동을 지원\n하기 위하여 숙박ㆍ관광시설\n이용의 편의를 제공하는 등 필\n요한 시책을 강구하여야 한다.",
  "full_text": "관광진흥법 일부개정법률안\n(민형배의원 대표발의)\n발의연월일 : 2024. 10. 17.\n의 안\n4751\n번 호 발 의 자 : 민형배ㆍ김영배ㆍ이수진\n김성환ㆍ곽상언ㆍ소병훈\n김용민ㆍ김문수ㆍ한민수\n주철현ㆍ이강일ㆍ이개호\n이기헌 의원(13인)\n제안이유 및 주요내용\n관광 분야에서 저출생 문제 해결의 일환으로, 다자녀 가구의 여행\n및 관광 활동을 지원할 수 있는 법적 근거를 마련하고자 합니다.\n최근 우리나라 저출생 현상이 심각한 사회문제로 제기되고 있습니\n다. 국가 및 지방자치단체는 다자녀 가구에 대해 주거ㆍ양육ㆍ교육 지\n원 및 세금 감면 등 다각도로 지원책을 마련하고 있습니다.\n현실은 자녀를 3명 이상 키우면 혜택은커녕 불편한 점이 더 많습니\n다. 대부분 숙박시설은 5인 가족 예약 시 객실 2개를 예약해야 합니\n다. 호텔 등 숙박업소 내부규정에 따라 제각각 운영하는 탓입니다. 숙\n박 및 관광시설 이용에도 다자녀 가구 특성을 고려해 편의를 제공해\n야 한다는 지적이 제기되고 있습니다.\n이에, 국가 및 지방자치단체가 다자녀 가구의 여행 및 관광 활동을\n지원할 수 있는 법적 근거를 마련하고자 합니다. 다자녀 가구에 대한\n\n\n\n일상 속 정책 지원을 통해 저출생 문제 해결에 일조하기 위한 것입니\n다(안 제47조의3).\n\n법률 제 호\n관광진흥법 일부개정법률안\n관광진흥법 일부를 다음과 같이 개정한다.\n제47조의3의 제목 중 “고령자”를 “고령자ㆍ다자녀 가구”로 하고, 같은\n조에 제3항을 다음과 같이 신설한다.\n③ 국가 및 지방자치단체는 다자녀 가구의 관광 활동을 지원하기\n위하여 숙박ㆍ관광시설 이용의 편의를 제공하는 등 필요한 시책을\n강구하여야 한다.\n부 칙\n이 법은 공포 후 6개월이 경과한 날부터 시행한다.\n\n\n\n\n신ㆍ구조문대비표\n현 행 개 정 안\n제47조의3(장애인ㆍ고령자 관광 제47조의3(장애인ㆍ고령자ㆍ다자\n활동의 지원) ①ㆍ② (생 략) 녀 가구 관광 활동의 지원) ①\nㆍ② (현행과 같음)\n<신 설> ③ 국가 및 지방자치단체는 다\n자녀 가구의 관광 활동을 지원\n하기 위하여 숙박ㆍ관광시설\n이용의 편의를 제공하는 등 필\n요한 시책을 강구하여야 한다.\n",
  "sections": {
    "제안이유": "및",
    "주요내용": "관광 분야에서 저출생 문제 해결의 일환으로, 다자녀 가구의 여행\n및 관광 활동을 지원할 수 있는 법적 근거를 마련하고자 합니다.\n최근 우리나라 저출생 현상이 심각한 사회문제로 제기되고 있습니\n다. 국가 및 지방자치단체는 다자녀 가구에 대해 주거ㆍ양육ㆍ교육 지\n원 및 세금 감면 등 다각도로 지원책을 마련하고 있습니다.\n현실은 자녀를 3명 이상 키우면 혜택은커녕 불편한 점이 더 많습니\n다. 대부분 숙박시설은 5인 가족 예약 시 객실 2개를 예약해야 합니\n다. 호텔 등 숙박업소 내부규정에 따라 제각각 운영하는 탓입니다. 숙\n박 및 관광시설 이용에도 다자녀 가구 특성을 고려해 편의를 제공해\n야 한다는 지적이 제기되고 있습니다.\n이에, 국가 및 지방자치단체가 다자녀 가구의 여행 및 관광 활동을\n지원할 수 있는 법적 근거를 마련하고자 합니다. 다자녀 가구에 대한\n\n\n\n일상 속 정책 지원을 통해 저출생 문제 해결에 일조하기 위한 것입니\n다(안 제47조의3).",
    "제안이유_및_주요내용": "관광 분야에서 저출생 문제 해결의 일환으로, 다자녀 가구의 여행\n및 관광 활동을 지원할 수 있는 법적 근거를 마련하고자 합니다.\n최근 우리나라 저출생 현상이 심각한 사회문제로 제기되고 있습니\n다. 국가 및 지방자치단체는 다자녀 가구에 대해 주거ㆍ양육ㆍ교육 지\n원 및 세금 감면 등 다각도로 지원책을 마련하고 있습니다.\n현실은 자녀를 3명 이상 키우면 혜택은커녕 불편한 점이 더 많습니\n다. 대부분 숙박시설은 5인 가족 예약 시 객실 2개를 예약해야 합니\n다. 호텔 등 숙박업소 내부규정에 따라 제각각 운영하는 탓입니다. 숙\n박 및 관광시설 이용에도 다자녀 가구 특성을 고려해 편의를 제공해\n야 한다는 지적이 제기되고 있습니다.\n이에, 국가 및 지방자치단체가 다자녀 가구의 여행 및 관광 활동을\n지원할 수 있는 법적 근거를 마련하고자 합니다. 다자녀 가구에 대한\n\n\n\n일상 속 정책 지원을 통해 저출생 문제 해결에 일조하기 위한 것입니\n다(안 제47조의3).",
    "법률_제_호": "관광진흥법 일부개정법률안\n관광진흥법 일부를 다음과 같이 개정한다.\n제47조의3의 제목 중 “고령자”를 “고령자ㆍ다자녀 가구”로 하고, 같은\n조에 제3항을 다음과 같이 신설한다.\n③ 국가 및 지방자치단체는 다자녀 가구의 관광 활동을 지원하기\n위하여 숙박ㆍ관광시설 이용의 편의를 제공하는 등 필요한 시책을\n강구하여야 한다.",
    "신구조문대비표": "현 행 개 정 안\n제47조의3(장애인ㆍ고령자 관광 제47조의3(장애인ㆍ고령자ㆍ다자\n활동의 지원) ①ㆍ② (생 략) 녀 가구 관광 활동의 지원) ①\nㆍ② (현행과 같음)\n<신 설> ③ 국가 및 지방자치단체는 다\n자녀 가구의 관광 활동을 지원\n하기 위하여 숙박ㆍ관광시설\n이용의 편의를 제공하는 등 필\n요한 시책을 강구하여야 한다."
  }
}