{
  "title": "2204145_계엄법_일부개정법률안",
  "bill_number": "4145",
  "proposal_date": "2024. 9. 20.",
  "submission_date": "",
  "is_alternative": false,
  "alternative_bill_numbers": [],
  "has_comparison_table": false,
  "comparison_table": "신ㆍ구조문대비표\n현 행 개 정 안\n제4조(계엄 선포의 통고) ① ㆍ 제4조(계엄선포의 통고) ① ㆍ ②\n② (생 략) (현행과 같음)\n<신 설> ③ 대통령이 선포한 계엄에 대\n하여 72시간 내에 국회 재적의\n원 과반수의 동의를 받아야 한\n다.",
  "full_text": "계엄법 일부개정법률안\n(김병주의원 대표발의)\n발의연월일 : 2024. 9. 20.\n의 안\n4145\n번 호 발 의 자 : 김병주ㆍ박선원ㆍ부승찬\n김민석ㆍ조 국ㆍ허 영\n안규백ㆍ황 희ㆍ박범계\n추미애 의원(10인)\n제안이유 및 주요내용\n현행법은 대통령이 계엄을 선포하였을 때에는 지체 없이 국회에 통\n고 하고, 제1항의 경우에 국회에 폐회 중일 때에는 대통령은 지체 없\n이 국회에 집회를 요구하여야 한다고 명시함.\n그러나 집회의 요구시기가 있으면 언제까지 계엄령선포를 한다는\n종료시점이 있어야 하는데 종료시점이 없음.\n그래서 집회의 요구에 대한 72시간 내 선포가 법률에 적합하는지\n판단할 필요가 있음(안 제4조제3항 신설).\n\n\n\n\n법률 제 호\n계엄법 일부개정법률안\n계엄법 일부를 다음과 같이 개정한다.\n제4조에 제3항을 다음과 같이 신설한다.\n③ 대통령이 선포한 계엄에 대하여 72시간 내에 국회 재적의원 과\n반수의 동의를 받아야 한다.\n부 칙\n이 법은 공포한 날부터 시행한다.\n\n\n\n\n신ㆍ구조문대비표\n현 행 개 정 안\n제4조(계엄 선포의 통고) ① ㆍ 제4조(계엄선포의 통고) ① ㆍ ②\n② (생 략) (현행과 같음)\n<신 설> ③ 대통령이 선포한 계엄에 대\n하여 72시간 내에 국회 재적의\n원 과반수의 동의를 받아야 한\n다.\n",
  "sections": {
    "제안이유": "및",
    "주요내용": "현행법은 대통령이 계엄을 선포하였을 때에는 지체 없이 국회에 통\n고 하고, 제1항의 경우에 국회에 폐회 중일 때에는 대통령은 지체 없\n이 국회에 집회를 요구하여야 한다고 명시함.\n그러나 집회의 요구시기가 있으면 언제까지 계엄령선포를 한다는\n종료시점이 있어야 하는데 종료시점이 없음.\n그래서 집회의 요구에 대한 72시간 내 선포가 법률에 적합하는지\n판단할 필요가 있음(안 제4조제3항 신설).",
    "제안이유_및_주요내용": "현행법은 대통령이 계엄을 선포하였을 때에는 지체 없이 국회에 통\n고 하고, 제1항의 경우에 국회에 폐회 중일 때에는 대통령은 지체 없\n이 국회에 집회를 요구하여야 한다고 명시함.\n그러나 집회의 요구시기가 있으면 언제까지 계엄령선포를 한다는\n종료시점이 있어야 하는데 종료시점이 없음.\n그래서 집회의 요구에 대한 72시간 내 선포가 법률에 적합하는지\n판단할 필요가 있음(안 제4조제3항 신설).",
    "법률_제_호": "계엄법 일부개정법률안\n계엄법 일부를 다음과 같이 개정한다.\n제4조에 제3항을 다음과 같이 신설한다.\n③ 대통령이 선포한 계엄에 대하여 72시간 내에 국회 재적의원 과\n반수의 동의를 받아야 한다.",
    "신구조문대비표": "현 행 개 정 안\n제4조(계엄 선포의 통고) ① ㆍ 제4조(계엄선포의 통고) ① ㆍ ②\n② (생 략) (현행과 같음)\n<신 설> ③ 대통령이 선포한 계엄에 대\n하여 72시간 내에 국회 재적의\n원 과반수의 동의를 받아야 한\n다."
  }
}