{
  "title": "2204277_지방자치분권_및_지역균형발전에_관한_특별법_일부개정법률안",
  "bill_number": "4277",
  "proposal_date": "2024. 9. 25.",
  "submission_date": "",
  "is_alternative": false,
  "alternative_bill_numbers": [],
  "has_comparison_table": false,
  "comparison_table": "신ㆍ구조문대비표\n현 행 개 정 안\n법률 제19430호 지방자치분권 법률 제19430호 지방자치분권\n및 지역균형발전에 관한 특별법 및 지역균형발전에 관한 특별법\n일부개정법률 ",
  "full_text": "지방자치분권 및 지역균형발전에 관한 특별법\n일부개정법률안\n(이성윤의원 대표발의)\n발의연월일 : 2024. 9. 25.\n의 안\n4277\n번 호 발 의 자 : 이성윤ㆍ강준현ㆍ이기헌\n이재강ㆍ허종식ㆍ정동영\n김태년ㆍ추미애ㆍ양부남\n장경태ㆍ박선원 의원\n(11인)\n제안이유 및 주요내용\n현행법은 통합 지방자치단체에 대한 재정지원 규정을 두고 있으며,\n보통교부세액과 별도로 보통교부세 총액의 100분의 6을 10년간 추가\n지원하도록 하고 있으나 2015년 1월 1일 이전에 통합된 지방자치단체\n에 한정하고 있음.\n이는 현재 논의되고 있는 완주-전주, 목포-신안 통합 지방자치단체\n를 배제하는 문제가 있는바, 2027년 1월 1일 이전에 통합된 지방자치\n단체로 그 대상을 확대하여 신규 통합 지방자치단체에 대한 안정적\n재정지원이 이뤄져 지역균형발전을 촉진할 수 있도록 하려는 것임(안\n법률 제19430호 지방자치분권 및 지역균형발전에 관한 특별법 일부개\n정법률 부칙 제3조제1항 단서).\n\n\n\n\n법률 제 호\n지방자치분권 및 지역균형발전에 관한 특별법\n일부개정법률안\n지방자치분권 및 지역균형발전에 관한 특별법 일부를 다음과 같이 개\n정한다.\n법률 제19430호 지방자치분권 및 지역균형발전에 관한 특별법 일부개\n정법률 부칙 제3조제1항 단서 중 “2015년”을 “2027년”으로 한다.\n부 칙\n이 법은 공포한 날부터 시행한다.\n\n\n\n\n신ㆍ구조문대비표\n현 행 개 정 안\n법률 제19430호 지방자치분권 법률 제19430호 지방자치분권\n및 지역균형발전에 관한 특별법 및 지역균형발전에 관한 특별법\n일부개정법률 부칙 일부개정법률 부칙\n제3조(통합 지방자치단체에 관한 제3조(통합 지방자치단체에 관한\n적용례 등) ① 제48조부터 제5 적용례 등) ① --------------\n7조까지의 규정은 2010년 1월 ----------------------------\n1일 이후 설치된 통합 지방자 ----------------------------\n치단체에 적용한다. 다만, 제53 ----------------. -----------\n조는 2015년 1월 1일 이전에 ----2027년------------------\n설치된 통합 지방자치단체에 ----------------------------\n한정하여 적용한다. --------------.\n② ∼ ④ (생 략) ② ∼ ④ (현행과 같음)\n",
  "sections": {
    "제안이유": "및",
    "주요내용": "현행법은 통합 지방자치단체에 대한 재정지원 규정을 두고 있으며,\n보통교부세액과 별도로 보통교부세 총액의 100분의 6을 10년간 추가\n지원하도록 하고 있으나 2015년 1월 1일 이전에 통합된 지방자치단체\n에 한정하고 있음.\n이는 현재 논의되고 있는 완주-전주, 목포-신안 통합 지방자치단체\n를 배제하는 문제가 있는바, 2027년 1월 1일 이전에 통합된 지방자치\n단체로 그 대상을 확대하여 신규 통합 지방자치단체에 대한 안정적\n재정지원이 이뤄져 지역균형발전을 촉진할 수 있도록 하려는 것임(안",
    "제안이유_및_주요내용": "현행법은 통합 지방자치단체에 대한 재정지원 규정을 두고 있으며,\n보통교부세액과 별도로 보통교부세 총액의 100분의 6을 10년간 추가\n지원하도록 하고 있으나 2015년 1월 1일 이전에 통합된 지방자치단체\n에 한정하고 있음.\n이는 현재 논의되고 있는 완주-전주, 목포-신안 통합 지방자치단체\n를 배제하는 문제가 있는바, 2027년 1월 1일 이전에 통합된 지방자치\n단체로 그 대상을 확대하여 신규 통합 지방자치단체에 대한 안정적\n재정지원이 이뤄져 지역균형발전을 촉진할 수 있도록 하려는 것임(안",
    "법률_제_호": "지방자치분권 및 지역균형발전에 관한 특별법 일부개\n정법률",
    "신구조문대비표": "현 행 개 정 안\n법률 제19430호 지방자치분권 법률 제19430호 지방자치분권\n및 지역균형발전에 관한 특별법 및 지역균형발전에 관한 특별법\n일부개정법률"
  }
}