{
  "title": "2204379_형법_일부개정법률안",
  "bill_number": "4379",
  "proposal_date": "2024. 9. 26.",
  "submission_date": "",
  "is_alternative": false,
  "alternative_bill_numbers": [],
  "has_comparison_table": false,
  "comparison_table": "신ㆍ구조문대비표\n현 행 개 정 안\n第9條(刑事未成年者) 14歲되지 아 제9조(형사미성년자) 13세가 되지\n니한 者의 行爲는 罰하지 아니 -----자의 행위는 벌하지----\n한다. ---.",
  "full_text": "형법 일부개정법률안\n(한지아의원 대표발의)\n발의연월일 : 2024. 9. 26.\n의 안\n4379\n번 호 발 의 자 : 한지아ㆍ조지연ㆍ강승규\n김승수ㆍ정성국ㆍ김형동\n진종오ㆍ김예지ㆍ고동진\n백종헌ㆍ서지영 의원\n(11인)\n제안이유 및 주요내용\n최근 촉법소년 범죄 증가 및 수법의 흉포화, 촉법소년 제도 범죄 악\n용 사례 발생 등으로 인해 촉법소년 연령 상한을 현실화해야 한다는\n국민적 여론이 형성됨.\n실제 형사미성년자의 범죄 접수 건수는 2019년 10,022건에서 2023년\n20,289건으로 2배 이상 급증했으며, 최근 5년간 범죄를 저지른 13세는\n1만 6,170명으로 10세~12세를 합친 수인 7,684명보다 110%나 많은 것\n으로 나타남.\n흉포화된 소년범죄로부터 국민을 보호할 필요성, 보호처분을 받은\n촉법소년 중 13세 소년이 차지하는 비중, 우리나라 초등ㆍ중학교의 학\n제 등을 종합적으로 고려할 때 촉법소년 연령 상한을 13세 미만으로\n낮추고 그 이상은 형사처벌을 가능하게 하여 소년 강력범죄에 엄정하\n\n\n\n게 대응할 필요가 있음.\n이에 형사미성년자의 연령을 13세 미만으로 조정하려고 함(안 제9\n조).\n참고사항\n이 법률안은 한지아의원이 대표발의한 「소년법 일부개정법률안」\n(의안번호 제4380호)의 의결을 전제로 하는 것이므로 같은 법률안이\n의결되지 아니하거나 수정의결되는 경우에는 이에 맞추어 조정되어야\n할 것임.\n\n법률 제 호\n형법 일부개정법률안\n형법 일부를 다음과 같이 개정한다.\n제9조의 조 번호 및 제목을 다음과 같이 하고, 같은 조 중 “14歲되지”\n를 “13세가 되지”로, “者의 行爲는 罰하지”를 “자의 행위는 벌하지”로\n한다.\n제9조(형사미성년자)\n부 칙\n이 법은 공포한 날부터 시행한다.\n\n\n\n\n신ㆍ구조문대비표\n현 행 개 정 안\n第9條(刑事未成年者) 14歲되지 아 제9조(형사미성년자) 13세가 되지\n니한 者의 行爲는 罰하지 아니 -----자의 행위는 벌하지----\n한다. ---.\n",
  "sections": {
    "제안이유": "및",
    "주요내용": "최근 촉법소년 범죄 증가 및 수법의 흉포화, 촉법소년 제도 범죄 악\n용 사례 발생 등으로 인해 촉법소년 연령 상한을 현실화해야 한다는\n국민적 여론이 형성됨.\n실제 형사미성년자의 범죄 접수 건수는 2019년 10,022건에서 2023년\n20,289건으로 2배 이상 급증했으며, 최근 5년간 범죄를 저지른 13세는\n1만 6,170명으로 10세~12세를 합친 수인 7,684명보다 110%나 많은 것\n으로 나타남.\n흉포화된 소년범죄로부터 국민을 보호할 필요성, 보호처분을 받은\n촉법소년 중 13세 소년이 차지하는 비중, 우리나라 초등ㆍ중학교의 학\n제 등을 종합적으로 고려할 때 촉법소년 연령 상한을 13세 미만으로\n낮추고 그 이상은 형사처벌을 가능하게 하여 소년 강력범죄에 엄정하\n\n\n\n게 대응할 필요가 있음.\n이에 형사미성년자의 연령을 13세 미만으로 조정하려고 함(안 제9\n조).",
    "제안이유_및_주요내용": "최근 촉법소년 범죄 증가 및 수법의 흉포화, 촉법소년 제도 범죄 악\n용 사례 발생 등으로 인해 촉법소년 연령 상한을 현실화해야 한다는\n국민적 여론이 형성됨.\n실제 형사미성년자의 범죄 접수 건수는 2019년 10,022건에서 2023년\n20,289건으로 2배 이상 급증했으며, 최근 5년간 범죄를 저지른 13세는\n1만 6,170명으로 10세~12세를 합친 수인 7,684명보다 110%나 많은 것\n으로 나타남.\n흉포화된 소년범죄로부터 국민을 보호할 필요성, 보호처분을 받은\n촉법소년 중 13세 소년이 차지하는 비중, 우리나라 초등ㆍ중학교의 학\n제 등을 종합적으로 고려할 때 촉법소년 연령 상한을 13세 미만으로\n낮추고 그 이상은 형사처벌을 가능하게 하여 소년 강력범죄에 엄정하\n\n\n\n게 대응할 필요가 있음.\n이에 형사미성년자의 연령을 13세 미만으로 조정하려고 함(안 제9\n조).",
    "법률_제_호": "형법 일부개정법률안\n형법 일부를 다음과 같이 개정한다.\n제9조의 조 번호 및 제목을 다음과 같이 하고, 같은 조 중 “14歲되지”\n를 “13세가 되지”로, “者의 行爲는 罰하지”를 “자의 행위는 벌하지”로\n한다.\n제9조(형사미성년자)",
    "신구조문대비표": "현 행 개 정 안\n第9條(刑事未成年者) 14歲되지 아 제9조(형사미성년자) 13세가 되지\n니한 者의 行爲는 罰하지 아니 -----자의 행위는 벌하지----\n한다. ---."
  }
}