{
  "title": "2204578_초·중등교육법_일부개정법률안",
  "bill_number": "4578",
  "proposal_date": "2024. 10. 7.",
  "submission_date": "",
  "is_alternative": false,
  "alternative_bill_numbers": [],
  "has_comparison_table": false,
  "comparison_table": "신ㆍ구조문대비표\n현 행 개 정 안\n제5조(학교의 병설) 초등학교ㆍ중 제5조(학교의 병설) 초등학교ㆍ중\n학교 및 고등학교는 지역의 실 학교ㆍ고등학교 및 특수학교--\n정에 따라 상호 병설(竝設)할 ----------------------------\n수 있다. -----------------.",
  "full_text": "초ㆍ중등교육법 일부개정법률안\n(조승래의원 대표발의)\n발의연월일 : 2024. 10. 7.\n의 안\n4578\n번 호 발 의 자 : 조승래ㆍ윤종군ㆍ윤호중\n이정문ㆍ홍기원ㆍ노종면\n박상혁ㆍ이기헌ㆍ박홍배\n박용갑ㆍ장철민 의원\n(11인)\n제안이유 및 주요내용\n현행법은 신체적ㆍ정신적ㆍ지적 장애 등으로 인하여 특수교육이 필\n요한 사람에게 초등학교ㆍ중학교 또는 고등학교에 준하는 교육을 실\n시하는 특수학교에 대한 사항을 규정하고 있음.\n그런데 특수학교의 부족으로 학생들이 원거리 통학을 하며 불편이\n발생하고, 신규 설립 등이 어려워 특수교육이 원활히 이루어지지 않고\n있는 상황임.\n이에 현행법에 따라 지역의 실정에 따라 상호 병설할 수 있는 학교\n에 특수학교를 포함하여 특수교육 대상 학생들의 교육 선택권을 확대\n하고 특수교육 여건을 개선하려는 것임(안 제5조).\n\n\n\n\n법률 제 호\n초ㆍ중등교육법 일부개정법률안\n초ㆍ중등교육법 일부를 다음과 같이 개정한다.\n제5조 중 “초등학교ㆍ중학교 및 고등학교”를 “초등학교ㆍ중학교ㆍ고등\n학교 및 특수학교”로 한다.\n부 칙\n이 법은 공포 후 6개월이 경과한 날부터 시행한다.\n\n\n\n\n신ㆍ구조문대비표\n현 행 개 정 안\n제5조(학교의 병설) 초등학교ㆍ중 제5조(학교의 병설) 초등학교ㆍ중\n학교 및 고등학교는 지역의 실 학교ㆍ고등학교 및 특수학교--\n정에 따라 상호 병설(竝設)할 ----------------------------\n수 있다. -----------------.\n",
  "sections": {
    "제안이유": "및",
    "주요내용": "현행법은 신체적ㆍ정신적ㆍ지적 장애 등으로 인하여 특수교육이 필\n요한 사람에게 초등학교ㆍ중학교 또는 고등학교에 준하는 교육을 실\n시하는 특수학교에 대한 사항을 규정하고 있음.\n그런데 특수학교의 부족으로 학생들이 원거리 통학을 하며 불편이\n발생하고, 신규 설립 등이 어려워 특수교육이 원활히 이루어지지 않고\n있는 상황임.\n이에 현행법에 따라 지역의 실정에 따라 상호 병설할 수 있는 학교\n에 특수학교를 포함하여 특수교육 대상 학생들의 교육 선택권을 확대\n하고 특수교육 여건을 개선하려는 것임(안 제5조).",
    "제안이유_및_주요내용": "현행법은 신체적ㆍ정신적ㆍ지적 장애 등으로 인하여 특수교육이 필\n요한 사람에게 초등학교ㆍ중학교 또는 고등학교에 준하는 교육을 실\n시하는 특수학교에 대한 사항을 규정하고 있음.\n그런데 특수학교의 부족으로 학생들이 원거리 통학을 하며 불편이\n발생하고, 신규 설립 등이 어려워 특수교육이 원활히 이루어지지 않고\n있는 상황임.\n이에 현행법에 따라 지역의 실정에 따라 상호 병설할 수 있는 학교\n에 특수학교를 포함하여 특수교육 대상 학생들의 교육 선택권을 확대\n하고 특수교육 여건을 개선하려는 것임(안 제5조).",
    "법률_제_호": "초ㆍ중등교육법 일부개정법률안\n초ㆍ중등교육법 일부를 다음과 같이 개정한다.\n제5조 중 “초등학교ㆍ중학교 및 고등학교”를 “초등학교ㆍ중학교ㆍ고등\n학교 및 특수학교”로 한다.",
    "신구조문대비표": "현 행 개 정 안\n제5조(학교의 병설) 초등학교ㆍ중 제5조(학교의 병설) 초등학교ㆍ중\n학교 및 고등학교는 지역의 실 학교ㆍ고등학교 및 특수학교--\n정에 따라 상호 병설(竝設)할 ----------------------------\n수 있다. -----------------."
  }
}