{
  "title": "2204010_독점규제_및_공정거래에_관한_법률_일부개정법률안",
  "bill_number": "4010",
  "proposal_date": "2024. 9. 13.",
  "submission_date": "",
  "is_alternative": false,
  "alternative_bill_numbers": [],
  "has_comparison_table": false,
  "comparison_table": "신·구조문대비표\n현 행 개 정 안\n제100조(불복의 소의 전속관할) 제100조(불복의 소의 전속관할) -\n제99조에 따른 불복의 소는 서 --------------------------대\n울고등법원을 전속관할로 한다. 전고등법원-----------------.",
  "full_text": "독점규제 및 공정거래에 관한 법률 일부개정법률안\n(박범계의원 대표발의)\n발의연월일 : 2024. 9. 13.\n의 안\n4010\n번 호 발 의 자 : 박범계ㆍ임오경ㆍ이강일\n백승아ㆍ채현일ㆍ장종태\n추미애ㆍ송재봉ㆍ황운하\n조승래 의원(10인)\n제안이유 및 주요내용\n공정거래위원회의 처분에 관한 불복의 소는 서울고등법원의 전속관\n할로 규정되어 있으나, 공정거래위원회의 세종특별자치시 이전 후에도\n서울고등법원이 전속으로 계속 관할함에 따라 비효율이 증대되고 있\n다는 지적이 있음.\n이에 공정거래위원회의 처분에 불복하는 소에 관하여는 공정거래위\n원회 소재지를 관할하는 대전고등법원이 전속으로 관할하도록 변경함\n으로써 비효율을 최소화하고 국민의 권익 구제에 기여하려는 것임(안\n제100조).\n\n\n\n\n법률 제 호\n독점규제 및 공정거래에 관한 법률 일부개정법률안\n독점규제 및 공정거래에 관한 법률 일부를 다음과 같이 개정한다.\n제100조 중 “서울고등법원”을 “대전고등법원”으로 한다.\n부 칙\n제1조(시행일) 이 법은 공포 후 6개월이 경과한 날부터 시행한다.\n제2조(불복의 소의 전속관할에 관한 적용례) 제100조의 개정규정은 이\n법 시행 이후 공정거래위원회의 처분에 대하여 불복의 소를 제기하\n는 경우부터 적용한다.\n\n\n\n\n신·구조문대비표\n현 행 개 정 안\n제100조(불복의 소의 전속관할) 제100조(불복의 소의 전속관할) -\n제99조에 따른 불복의 소는 서 --------------------------대\n울고등법원을 전속관할로 한다. 전고등법원-----------------.\n",
  "sections": {
    "제안이유": "및",
    "주요내용": "공정거래위원회의 처분에 관한 불복의 소는 서울고등법원의 전속관\n할로 규정되어 있으나, 공정거래위원회의 세종특별자치시 이전 후에도\n서울고등법원이 전속으로 계속 관할함에 따라 비효율이 증대되고 있\n다는 지적이 있음.\n이에 공정거래위원회의 처분에 불복하는 소에 관하여는 공정거래위\n원회 소재지를 관할하는 대전고등법원이 전속으로 관할하도록 변경함\n으로써 비효율을 최소화하고 국민의 권익 구제에 기여하려는 것임(안\n제100조).",
    "제안이유_및_주요내용": "공정거래위원회의 처분에 관한 불복의 소는 서울고등법원의 전속관\n할로 규정되어 있으나, 공정거래위원회의 세종특별자치시 이전 후에도\n서울고등법원이 전속으로 계속 관할함에 따라 비효율이 증대되고 있\n다는 지적이 있음.\n이에 공정거래위원회의 처분에 불복하는 소에 관하여는 공정거래위\n원회 소재지를 관할하는 대전고등법원이 전속으로 관할하도록 변경함\n으로써 비효율을 최소화하고 국민의 권익 구제에 기여하려는 것임(안\n제100조).",
    "법률_제_호": "독점규제 및 공정거래에 관한 법률 일부개정법률안\n독점규제 및 공정거래에 관한 법률 일부를 다음과 같이 개정한다.\n제100조 중 “서울고등법원”을 “대전고등법원”으로 한다.",
    "신구조문대비표": "현 행 개 정 안\n제100조(불복의 소의 전속관할) 제100조(불복의 소의 전속관할) -\n제99조에 따른 불복의 소는 서 --------------------------대\n울고등법원을 전속관할로 한다. 전고등법원-----------------."
  }
}