{
  "title": "2204669_상속세_및_증여세법_일부개정법률안",
  "bill_number": "4669",
  "proposal_date": "2024. 10. 11.",
  "submission_date": "",
  "is_alternative": false,
  "alternative_bill_numbers": [],
  "has_comparison_table": false,
  "comparison_table": "신ㆍ구조문대비표\n현 행 개 정 안\n제19조(배우자 상속공제) ① ∼ 제19조(배우자 상속공제) ① ∼\n④ (생 략) ④ (현행과 같음)\n<신 설> ⑤ 제1항에 따른 실제 상속받\n은 금액의 증명 절차 및 배우\n자 상속공제를 받기 위한 증명\n서류의 제출에 필요한 사항은\n대통령령으로 정한다.",
  "full_text": "상속세 및 증여세법 일부개정법률안\n(임광현의원 대표발의)\n발의연월일 : 2024. 10. 11.\n의 안\n4669\n번 호 발 의 자 : 임광현ㆍ정성호ㆍ임오경\n진선미ㆍ박희승ㆍ박민규\n이인영ㆍ박홍근ㆍ최기상\n황명선 의원(10인)\n제안이유 및 주요내용\n현행법은 거주자의 사망으로 상속이 개시되어 배우자가 상속받은\n금액에 대하여 상속세를 과세하는 경우 일정한 기준에 따라 최소 5억\n원에서 최대 30억원을 공제하도록 하고 있음. 그러나 배우자 상속공제\n혜택을 받은 후 과세 없이 자녀에게 재산이 이전되는 사례가 발생한\n다는 지적이 있음. 이는 실질적으로 배우자에 대한 재산의 이전에 대\n한 공제가 아닌 자녀에게 세금없는 부의 대물림을 가능하게 하는 것\n이므로 납세자의 성실신고를 위하여 배우자 상속공제를 받기 위한 증\n명서류의 제출에 관한 규정을 마련할 필요가 있음.\n이에 실제 상속받은 금액의 증명 절차 및 배우자 상속공제의 증명\n서류 제출에 관한 규정을 마련하려는 것임(안 제19조제5항).\n\n\n\n\n법률 제 호\n상속세 및 증여세법 일부개정법률안\n상속세 및 증여세법 일부를 다음과 같이 개정한다.\n제19조에 제5항을 다음과 같이 신설한다.\n⑤ 제1항에 따른 실제 상속받은 금액의 증명 절차 및 배우자 상속\n공제를 받기 위한 증명서류의 제출에 필요한 사항은 대통령령으로\n정한다.\n부 칙\n이 법은 공포 후 3개월이 경과한 날부터 시행한다.\n\n\n\n\n신ㆍ구조문대비표\n현 행 개 정 안\n제19조(배우자 상속공제) ① ∼ 제19조(배우자 상속공제) ① ∼\n④ (생 략) ④ (현행과 같음)\n<신 설> ⑤ 제1항에 따른 실제 상속받\n은 금액의 증명 절차 및 배우\n자 상속공제를 받기 위한 증명\n서류의 제출에 필요한 사항은\n대통령령으로 정한다.\n",
  "sections": {
    "제안이유": "및",
    "주요내용": "현행법은 거주자의 사망으로 상속이 개시되어 배우자가 상속받은\n금액에 대하여 상속세를 과세하는 경우 일정한 기준에 따라 최소 5억\n원에서 최대 30억원을 공제하도록 하고 있음. 그러나 배우자 상속공제\n혜택을 받은 후 과세 없이 자녀에게 재산이 이전되는 사례가 발생한\n다는 지적이 있음. 이는 실질적으로 배우자에 대한 재산의 이전에 대\n한 공제가 아닌 자녀에게 세금없는 부의 대물림을 가능하게 하는 것\n이므로 납세자의 성실신고를 위하여 배우자 상속공제를 받기 위한 증\n명서류의 제출에 관한 규정을 마련할 필요가 있음.\n이에 실제 상속받은 금액의 증명 절차 및 배우자 상속공제의 증명\n서류 제출에 관한 규정을 마련하려는 것임(안 제19조제5항).",
    "제안이유_및_주요내용": "현행법은 거주자의 사망으로 상속이 개시되어 배우자가 상속받은\n금액에 대하여 상속세를 과세하는 경우 일정한 기준에 따라 최소 5억\n원에서 최대 30억원을 공제하도록 하고 있음. 그러나 배우자 상속공제\n혜택을 받은 후 과세 없이 자녀에게 재산이 이전되는 사례가 발생한\n다는 지적이 있음. 이는 실질적으로 배우자에 대한 재산의 이전에 대\n한 공제가 아닌 자녀에게 세금없는 부의 대물림을 가능하게 하는 것\n이므로 납세자의 성실신고를 위하여 배우자 상속공제를 받기 위한 증\n명서류의 제출에 관한 규정을 마련할 필요가 있음.\n이에 실제 상속받은 금액의 증명 절차 및 배우자 상속공제의 증명\n서류 제출에 관한 규정을 마련하려는 것임(안 제19조제5항).",
    "법률_제_호": "상속세 및 증여세법 일부개정법률안\n상속세 및 증여세법 일부를 다음과 같이 개정한다.\n제19조에 제5항을 다음과 같이 신설한다.\n⑤ 제1항에 따른 실제 상속받은 금액의 증명 절차 및 배우자 상속\n공제를 받기 위한 증명서류의 제출에 필요한 사항은 대통령령으로\n정한다.",
    "신구조문대비표": "현 행 개 정 안\n제19조(배우자 상속공제) ① ∼ 제19조(배우자 상속공제) ① ∼\n④ (생 략) ④ (현행과 같음)\n<신 설> ⑤ 제1항에 따른 실제 상속받\n은 금액의 증명 절차 및 배우\n자 상속공제를 받기 위한 증명\n서류의 제출에 필요한 사항은\n대통령령으로 정한다."
  }
}