{
  "title": "2204159_소득세법_일부개정법률안",
  "bill_number": "4159",
  "proposal_date": "2024. 9. 23.",
  "submission_date": "",
  "is_alternative": false,
  "alternative_bill_numbers": [],
  "has_comparison_table": false,
  "comparison_table": "신·구조문대비표\n현 행 개 정 안\n제50조(기본공제) ① (생 략) 제50조(기본공제) ① (현행과 같\n음)\n<신 설> ② 제1항을 적용할 때 배우자\n또는 부양가족의 소득금액 합\n계액을 계산할 때에는 해당 배\n우자 또는 부양가족의 금융투\n자소득은 합산하지 아니한다.\n②·③ (생 략) ③·④ (현행 제2항 및 제3항과\n같음)",
  "full_text": "소득세법 일부개정법률안\n(임광현의원 대표발의)\n발의연월일 : 2024. 9. 23.\n의 안\n4159\n번 호 발 의 자 : 임광현ㆍ정일영ㆍ오기형\n김태년ㆍ윤호중ㆍ이연희\n정성호ㆍ정태호ㆍ안태준\n강준현ㆍ김영환ㆍ박홍배\n이기헌ㆍ강유정ㆍ황정아\n안도걸ㆍ김기표ㆍ문금주\n윤종군ㆍ이재관ㆍ민홍철\n송재봉ㆍ박민규ㆍ정준호\n안규백ㆍ차지호ㆍ정진욱\n박찬대ㆍ박희승ㆍ최기상\n임미애ㆍ조계원ㆍ김남희\n의원(33인)\n제안이유 및 주요내용\n현행법은 종합소득이 있는 거주자에 대해서 생계를 같이 하는 배우\n자 또는 부양가족 중 일정 수준 이하의 소득을 갖는 등 특정 요건을\n충족하는 사람 1명당 연 150만원의 기본공제를 적용하고 있음. 기본공\n제대상자로 인정되기 위한 소득 요건은 해당 과세기간의 소득금액 합\n계액이 100만원 이하이거나 근로소득만 있는 경우에는 총급여액이\n500만원 이하임.\n\n\n\n한편 2025년 금융투자소득세가 도입되는 상황에서 배우자 또는 부\n양가족의 주식등 양도소득, 파생상품 소득 등 금융투자소득이 100만원\n을 초과할 경우 소득 요건을 충족하지 못하여 기본공제대상자에서 제\n외되는 문제가 있음. 특히 배우자 또는 부양가족은 거주자와 생계를\n같이 하는 상황임에도 불구하고 금융투자소득이 발생한다는 이유로\n기본공제대상자로 인정되지 못할 수 있다는 문제점이 지적되고 있음.\n이에 배우자 또는 부양가족에 대해서는 기본공제대상자의 소득 요\n건 중 소득금액 합계액을 계산할 때 금융투자소득을 합산하지 아니하\n도록 하려는 것임(안 제50조).\n\n법률 제 호\n소득세법 일부개정법률안\n소득세법 일부를 다음과 같이 개정한다.\n제50조제2항 및 제3항을 각각 제3항 및 제4항으로 하고, 같은 조에 제\n2항을 다음과 같이 신설한다.\n② 제1항을 적용할 때 배우자 또는 부양가족의 소득금액 합계액을\n계산할 때에는 해당 배우자 또는 부양가족의 금융투자소득은 합산\n하지 아니한다.\n부 칙\n제1조(시행일) 이 법은 2025년 1월 1일부터 시행한다.\n제2조(기본공제에 관한 적용례) 제50조제2항의 개정규정은 이 법 시행\n이후 과세표준을 신고하거나 소득세를 결정하거나 연말정산하는 분\n부터 적용한다.\n\n\n\n\n신·구조문대비표\n현 행 개 정 안\n제50조(기본공제) ① (생 략) 제50조(기본공제) ① (현행과 같\n음)\n<신 설> ② 제1항을 적용할 때 배우자\n또는 부양가족의 소득금액 합\n계액을 계산할 때에는 해당 배\n우자 또는 부양가족의 금융투\n자소득은 합산하지 아니한다.\n②·③ (생 략) ③·④ (현행 제2항 및 제3항과\n같음)\n",
  "sections": {
    "제안이유": "및",
    "주요내용": "현행법은 종합소득이 있는 거주자에 대해서 생계를 같이 하는 배우\n자 또는 부양가족 중 일정 수준 이하의 소득을 갖는 등 특정 요건을\n충족하는 사람 1명당 연 150만원의 기본공제를 적용하고 있음. 기본공\n제대상자로 인정되기 위한 소득 요건은 해당 과세기간의 소득금액 합\n계액이 100만원 이하이거나 근로소득만 있는 경우에는 총급여액이\n500만원 이하임.\n\n\n\n한편 2025년 금융투자소득세가 도입되는 상황에서 배우자 또는 부\n양가족의 주식등 양도소득, 파생상품 소득 등 금융투자소득이 100만원\n을 초과할 경우 소득 요건을 충족하지 못하여 기본공제대상자에서 제\n외되는 문제가 있음. 특히 배우자 또는 부양가족은 거주자와 생계를\n같이 하는 상황임에도 불구하고 금융투자소득이 발생한다는 이유로\n기본공제대상자로 인정되지 못할 수 있다는 문제점이 지적되고 있음.\n이에 배우자 또는 부양가족에 대해서는 기본공제대상자의 소득 요\n건 중 소득금액 합계액을 계산할 때 금융투자소득을 합산하지 아니하\n도록 하려는 것임(안 제50조).",
    "제안이유_및_주요내용": "현행법은 종합소득이 있는 거주자에 대해서 생계를 같이 하는 배우\n자 또는 부양가족 중 일정 수준 이하의 소득을 갖는 등 특정 요건을\n충족하는 사람 1명당 연 150만원의 기본공제를 적용하고 있음. 기본공\n제대상자로 인정되기 위한 소득 요건은 해당 과세기간의 소득금액 합\n계액이 100만원 이하이거나 근로소득만 있는 경우에는 총급여액이\n500만원 이하임.\n\n\n\n한편 2025년 금융투자소득세가 도입되는 상황에서 배우자 또는 부\n양가족의 주식등 양도소득, 파생상품 소득 등 금융투자소득이 100만원\n을 초과할 경우 소득 요건을 충족하지 못하여 기본공제대상자에서 제\n외되는 문제가 있음. 특히 배우자 또는 부양가족은 거주자와 생계를\n같이 하는 상황임에도 불구하고 금융투자소득이 발생한다는 이유로\n기본공제대상자로 인정되지 못할 수 있다는 문제점이 지적되고 있음.\n이에 배우자 또는 부양가족에 대해서는 기본공제대상자의 소득 요\n건 중 소득금액 합계액을 계산할 때 금융투자소득을 합산하지 아니하\n도록 하려는 것임(안 제50조).",
    "법률_제_호": "소득세법 일부개정법률안\n소득세법 일부를 다음과 같이 개정한다.\n제50조제2항 및 제3항을 각각 제3항 및 제4항으로 하고, 같은 조에 제\n2항을 다음과 같이 신설한다.\n② 제1항을 적용할 때 배우자 또는 부양가족의 소득금액 합계액을\n계산할 때에는 해당 배우자 또는 부양가족의 금융투자소득은 합산\n하지 아니한다.",
    "신구조문대비표": "현 행 개 정 안\n제50조(기본공제) ① (생 략) 제50조(기본공제) ① (현행과 같\n음)\n<신 설> ② 제1항을 적용할 때 배우자\n또는 부양가족의 소득금액 합\n계액을 계산할 때에는 해당 배\n우자 또는 부양가족의 금융투\n자소득은 합산하지 아니한다.\n②·③ (생 략) ③·④ (현행 제2항 및 제3항과\n같음)"
  }
}