{
  "title": "2204227_국회에서의_증언·감정_등에_관한_법률_일부개정법률안",
  "bill_number": "4227",
  "proposal_date": "2024. 9. 24.",
  "submission_date": "",
  "is_alternative": false,
  "alternative_bill_numbers": [],
  "has_comparison_table": false,
  "comparison_table": "신ㆍ구조문대비표\n현 행 개 정 안\n제3조(증언 등의 거부) ① ∼ ④ 제3조(증언 등의 거부 등) ① ∼\n(생 략) ④ (현행과 같음)\n<신 설> ⑤ 증인은 「국회법」에 따른\n탄핵소추의 의결 또는 제15조\n에 따른 고발을 이유로 증언\n등을 거부할 수 없다.",
  "full_text": "국회에서의 증언ㆍ감정 등에 관한 법률 일부개정법률안\n(이훈기의원 대표발의)\n발의연월일 : 2024. 9. 24.\n의 안\n4227\n번 호 발 의 자 : 이훈기ㆍ이광희ㆍ김태선\n정을호ㆍ김교흥ㆍ문정복\n김태년ㆍ박희승ㆍ이병진\n이성윤ㆍ이재강ㆍ박홍배\n의원(12인)\n제안이유 및 주요내용\n현행법은 증인의 보호를 위하여 증인이 형사소추 또는 공소제기를\n당하거나 유죄판결을 받을 사실이 드러날 염려가 있는 경우에는 선서\nㆍ증언 또는 서류등의 제출을 거부할 수 있다고 규정하고 있음.\n그러나 청문회에서 「국회법」에 따라 탄핵소추가 의결되어 직무가\n정지된 것을 이유로 증언 등을 거부하거나 현행법상 불출석 등의 죄\n로 고발된 것을 이유로 증언 등을 거부하는 경우가 발생함에 따라, 증\n언 등의 거부가 청문회의 원활한 진행을 방해하는 수단으로 전락하여\n현행법의 증인 보호 취지가 훼손되고 있다는 지적이 있음.\n이에 「국회법」에 따라 탄핵소추가 의결되거나 현행법에 따라 고\n발된 것을 이유로 증언 등의 거부를 할 수 없도록 명시하여 증인의\n증언 등을 거부할 권리와 증언 등에 대한 의무 사이의 균형을 유지함\n으로써 청문회, 국정감사 및 국정조사의 실효성을 제고하고자 하는 것\n\n\n\n임(안 제3조제5항 신설).\n\n법률 제 호\n국회에서의 증언ㆍ감정 등에 관한 법률 일부개정법률안\n국회에서의 증언ㆍ감정 등에 관한 법률 일부를 다음과 같이 개정한다.\n제3조의 제목 “(증언 등의 거부)”를 “(증언 등의 거부 등)”으로 하고,\n같은 조에 제5항을 다음과 같이 신설한다.\n⑤ 증인은 「국회법」에 따른 탄핵소추의 의결 또는 제15조에 따른\n고발을 이유로 증언 등을 거부할 수 없다.\n부 칙\n이 법은 공포 후 3개월이 경과한 날부터 시행한다.\n\n\n\n\n신ㆍ구조문대비표\n현 행 개 정 안\n제3조(증언 등의 거부) ① ∼ ④ 제3조(증언 등의 거부 등) ① ∼\n(생 략) ④ (현행과 같음)\n<신 설> ⑤ 증인은 「국회법」에 따른\n탄핵소추의 의결 또는 제15조\n에 따른 고발을 이유로 증언\n등을 거부할 수 없다.\n",
  "sections": {
    "제안이유": "및",
    "주요내용": "현행법은 증인의 보호를 위하여 증인이 형사소추 또는 공소제기를\n당하거나 유죄판결을 받을 사실이 드러날 염려가 있는 경우에는 선서\nㆍ증언 또는 서류등의 제출을 거부할 수 있다고 규정하고 있음.\n그러나 청문회에서 「국회법」에 따라 탄핵소추가 의결되어 직무가\n정지된 것을 이유로 증언 등을 거부하거나 현행법상 불출석 등의 죄\n로 고발된 것을 이유로 증언 등을 거부하는 경우가 발생함에 따라, 증\n언 등의 거부가 청문회의 원활한 진행을 방해하는 수단으로 전락하여\n현행법의 증인 보호 취지가 훼손되고 있다는 지적이 있음.\n이에 「국회법」에 따라 탄핵소추가 의결되거나 현행법에 따라 고\n발된 것을 이유로 증언 등의 거부를 할 수 없도록 명시하여 증인의\n증언 등을 거부할 권리와 증언 등에 대한 의무 사이의 균형을 유지함\n으로써 청문회, 국정감사 및 국정조사의 실효성을 제고하고자 하는 것\n\n\n\n임(안 제3조제5항 신설).",
    "제안이유_및_주요내용": "현행법은 증인의 보호를 위하여 증인이 형사소추 또는 공소제기를\n당하거나 유죄판결을 받을 사실이 드러날 염려가 있는 경우에는 선서\nㆍ증언 또는 서류등의 제출을 거부할 수 있다고 규정하고 있음.\n그러나 청문회에서 「국회법」에 따라 탄핵소추가 의결되어 직무가\n정지된 것을 이유로 증언 등을 거부하거나 현행법상 불출석 등의 죄\n로 고발된 것을 이유로 증언 등을 거부하는 경우가 발생함에 따라, 증\n언 등의 거부가 청문회의 원활한 진행을 방해하는 수단으로 전락하여\n현행법의 증인 보호 취지가 훼손되고 있다는 지적이 있음.\n이에 「국회법」에 따라 탄핵소추가 의결되거나 현행법에 따라 고\n발된 것을 이유로 증언 등의 거부를 할 수 없도록 명시하여 증인의\n증언 등을 거부할 권리와 증언 등에 대한 의무 사이의 균형을 유지함\n으로써 청문회, 국정감사 및 국정조사의 실효성을 제고하고자 하는 것\n\n\n\n임(안 제3조제5항 신설).",
    "법률_제_호": "국회에서의 증언ㆍ감정 등에 관한 법률 일부개정법률안\n국회에서의 증언ㆍ감정 등에 관한 법률 일부를 다음과 같이 개정한다.\n제3조의 제목 “(증언 등의 거부)”를 “(증언 등의 거부 등)”으로 하고,\n같은 조에 제5항을 다음과 같이 신설한다.\n⑤ 증인은 「국회법」에 따른 탄핵소추의 의결 또는 제15조에 따른\n고발을 이유로 증언 등을 거부할 수 없다.",
    "신구조문대비표": "현 행 개 정 안\n제3조(증언 등의 거부) ① ∼ ④ 제3조(증언 등의 거부 등) ① ∼\n(생 략) ④ (현행과 같음)\n<신 설> ⑤ 증인은 「국회법」에 따른\n탄핵소추의 의결 또는 제15조\n에 따른 고발을 이유로 증언\n등을 거부할 수 없다."
  }
}