{
  "title": "2204654_한국은행법_일부개정법률안",
  "bill_number": "4654",
  "proposal_date": "2024. 10. 11.",
  "submission_date": "",
  "is_alternative": false,
  "alternative_bill_numbers": [],
  "has_comparison_table": false,
  "comparison_table": "신ㆍ구조문대비표\n현 행 개 정 안\n제24조(의결서 작성 등) ① ∼ ③ 제24조(의결서 작성 등) ① ∼ ③\n(생 략) (현행과 같음)\n<신 설> ④ 금융통화위원회는 해당 금\n융통화위원회 회의에 출석한\n위원 전원이 임기만료된 경우\n에는 의사록 전문(익명으로 처\n리되지 아니한 것을 말한다)을\n인터넷 홈페이지 등을 통하여\n공개하여야 한다.",
  "full_text": "한국은행법 일부개정법률안\n(구자근의원 대표발의)\n발의연월일 : 2024. 10. 11.\n의 안\n4654\n번 호 발 의 자 : 구자근ㆍ김선교ㆍ인요한\n최수진ㆍ김석기ㆍ박준태\n권영세ㆍ박성민ㆍ박덕흠\n김성원ㆍ김도읍 의원\n(11인)\n제안이유 및 주요내용\n현행법은 한국은행에 정책결정기구로서 금융통화위원회를 두고, 한\n국은행권 발행에 관한 기본적인 사항, 한국은행의 금융기관에 대한 여\n신업무 관련 사항, 한국은행통화안전증권 발행, 매출, 환매 등에 관한\n사항, 기준금리 결정 등 통화신용정책에 관련된 주요 사항들을 결정하\n고 있음.\n이처럼 국가경제와 국민들의 실생활과 밀접한 정책사항들을 결정하\n고 있는데, 그 과정을 공개함에 있어서는 요약된 의사록 형태로 제공\n되고, 시간이 오래 지난 뒤에도 극히 제한된 대상에게만 비공개자료로\n제공되고 있는 상황으로 정책결정과정의 투명성과 책임의식 강화 필\n요성이 제기되고 있음.\n이에 현재 공개방식을 유지하되, 금융통화위원회 회의에 출석한 위\n원들의 임기가 종료된 후에는 익명으로 처리하지 아니한 의사록 전문\n\n\n\n을 상시 공개하여 정책결정과정의 투명성을 높이고, 위원들의 책임의\n식을 강화하고자 함(안 제24조제4항 신설).\n\n법률 제 호\n한국은행법 일부개정법률안\n한국은행법 일부를 다음과 같이 개정한다.\n제24조에 제4항을 다음과 같이 신설한다.\n④ 금융통화위원회는 해당 금융통화위원회 회의에 출석한 위원 전\n원이 임기만료된 경우에는 의사록 전문(익명으로 처리되지 아니한\n것을 말한다)을 인터넷 홈페이지 등을 통하여 공개하여야 한다.\n부 칙\n제1조(시행일) 이 법은 공포한 날부터 시행한다.\n제2조(금융통화위원회 의사록 공개에 관한 적용례) 제24조제4항의 개\n정규정은 이 법 시행 이후 개의하는 금융통화위원회 회의부터 적용\n한다.\n\n\n\n\n신ㆍ구조문대비표\n현 행 개 정 안\n제24조(의결서 작성 등) ① ∼ ③ 제24조(의결서 작성 등) ① ∼ ③\n(생 략) (현행과 같음)\n<신 설> ④ 금융통화위원회는 해당 금\n융통화위원회 회의에 출석한\n위원 전원이 임기만료된 경우\n에는 의사록 전문(익명으로 처\n리되지 아니한 것을 말한다)을\n인터넷 홈페이지 등을 통하여\n공개하여야 한다.\n",
  "sections": {
    "제안이유": "및",
    "주요내용": "현행법은 한국은행에 정책결정기구로서 금융통화위원회를 두고, 한\n국은행권 발행에 관한 기본적인 사항, 한국은행의 금융기관에 대한 여\n신업무 관련 사항, 한국은행통화안전증권 발행, 매출, 환매 등에 관한\n사항, 기준금리 결정 등 통화신용정책에 관련된 주요 사항들을 결정하\n고 있음.\n이처럼 국가경제와 국민들의 실생활과 밀접한 정책사항들을 결정하\n고 있는데, 그 과정을 공개함에 있어서는 요약된 의사록 형태로 제공\n되고, 시간이 오래 지난 뒤에도 극히 제한된 대상에게만 비공개자료로\n제공되고 있는 상황으로 정책결정과정의 투명성과 책임의식 강화 필\n요성이 제기되고 있음.\n이에 현재 공개방식을 유지하되, 금융통화위원회 회의에 출석한 위\n원들의 임기가 종료된 후에는 익명으로 처리하지 아니한 의사록 전문\n\n\n\n을 상시 공개하여 정책결정과정의 투명성을 높이고, 위원들의 책임의\n식을 강화하고자 함(안 제24조제4항 신설).",
    "제안이유_및_주요내용": "현행법은 한국은행에 정책결정기구로서 금융통화위원회를 두고, 한\n국은행권 발행에 관한 기본적인 사항, 한국은행의 금융기관에 대한 여\n신업무 관련 사항, 한국은행통화안전증권 발행, 매출, 환매 등에 관한\n사항, 기준금리 결정 등 통화신용정책에 관련된 주요 사항들을 결정하\n고 있음.\n이처럼 국가경제와 국민들의 실생활과 밀접한 정책사항들을 결정하\n고 있는데, 그 과정을 공개함에 있어서는 요약된 의사록 형태로 제공\n되고, 시간이 오래 지난 뒤에도 극히 제한된 대상에게만 비공개자료로\n제공되고 있는 상황으로 정책결정과정의 투명성과 책임의식 강화 필\n요성이 제기되고 있음.\n이에 현재 공개방식을 유지하되, 금융통화위원회 회의에 출석한 위\n원들의 임기가 종료된 후에는 익명으로 처리하지 아니한 의사록 전문\n\n\n\n을 상시 공개하여 정책결정과정의 투명성을 높이고, 위원들의 책임의\n식을 강화하고자 함(안 제24조제4항 신설).",
    "법률_제_호": "한국은행법 일부개정법률안\n한국은행법 일부를 다음과 같이 개정한다.\n제24조에 제4항을 다음과 같이 신설한다.\n④ 금융통화위원회는 해당 금융통화위원회 회의에 출석한 위원 전\n원이 임기만료된 경우에는 의사록 전문(익명으로 처리되지 아니한\n것을 말한다)을 인터넷 홈페이지 등을 통하여 공개하여야 한다.",
    "신구조문대비표": "현 행 개 정 안\n제24조(의결서 작성 등) ① ∼ ③ 제24조(의결서 작성 등) ① ∼ ③\n(생 략) (현행과 같음)\n<신 설> ④ 금융통화위원회는 해당 금\n융통화위원회 회의에 출석한\n위원 전원이 임기만료된 경우\n에는 의사록 전문(익명으로 처\n리되지 아니한 것을 말한다)을\n인터넷 홈페이지 등을 통하여\n공개하여야 한다."
  }
}