{
  "title": "2204460_국가인권위원회법_일부개정법률안",
  "bill_number": "4460",
  "proposal_date": "2024. 9. 30.",
  "submission_date": "",
  "is_alternative": false,
  "alternative_bill_numbers": [],
  "has_comparison_table": false,
  "comparison_table": "신·구조문대비표\n현 행 개 정 안\n제16조(사무처) ① ∼ ③ (생 제16조(사무처) ① ∼ ③ (현행과\n략) 같음)\n<신 설> ④ 대통령은 제3항에 따른 임\n용권의 일부를 위원장에게 위\n임할 수 있다. 이 경우 위임의\n범위에 대해서는 「국가공무원\n법」 제32조제3항 및 공무원\n임용 관계 법령을 준용한다.\n④ (생 략) ⑤ (현행 제4항과 같음)",
  "full_text": "국가인권위원회법 일부개정법률안\n(신장식의원 대표발의)\n발의연월일 : 2024. 9. 30.\n의 안\n4460\n번 호 발 의 자 : 신장식ㆍ박은정ㆍ차규근\n김준형ㆍ김재원ㆍ조 국\n강경숙ㆍ김선민ㆍ황운하\n이해민ㆍ서왕진ㆍ정춘생\n의원(12인)\n제안이유 및 주요내용\n현행법은 소속 직원 중 5급 이상 공무원 또는 고위공무원단에 속하\n는 일반직 공무원은 위원장의 제청으로 대통령이 임명하며, 6급 이하\n공무원은 위원장이 임명한다고 규정함.\n그러나 3급 이하 5급 이상 공무원에 대한 대통령 임용권을 위원장\n에게 위임하는 규정이 존재하지 않아, 독립기관인 위원회가 「국가공\n무원법」 등 일반적인 공무원 임용 관계 법령의 적용을 받는 다른 부\n처에 비해 소속 장관(위원장)의 인사 자율성이 오히려 제한되고 있음.\n이에 대통령은 「국가공무원법」 제32조제3항 및 공무원 임용 관계\n법령을 준용하여 임용권의 일부를 위원장에게 위임할 수 있도록 하는\n규정을 신설하고자 함(안 제16조제4항 신설).\n\n\n\n\n법률 제 호\n국가인권위원회법 일부개정법률안\n국가인권위원회법 일부를 다음과 같이 개정한다.\n제16조제4항을 제5항으로 하고, 같은 조에 제4항을 다음과 같이 신설\n한다.\n④ 대통령은 제3항에 따른 임용권의 일부를 위원장에게 위임할 수\n있다. 이 경우 위임의 범위에 대해서는 「국가공무원법」 제32조제3\n항 및 공무원 임용 관계 법령을 준용한다.\n부 칙\n이 법은 공포한 날부터 시행한다.\n\n\n\n\n신·구조문대비표\n현 행 개 정 안\n제16조(사무처) ① ∼ ③ (생 제16조(사무처) ① ∼ ③ (현행과\n략) 같음)\n<신 설> ④ 대통령은 제3항에 따른 임\n용권의 일부를 위원장에게 위\n임할 수 있다. 이 경우 위임의\n범위에 대해서는 「국가공무원\n법」 제32조제3항 및 공무원\n임용 관계 법령을 준용한다.\n④ (생 략) ⑤ (현행 제4항과 같음)\n",
  "sections": {
    "제안이유": "및",
    "주요내용": "현행법은 소속 직원 중 5급 이상 공무원 또는 고위공무원단에 속하\n는 일반직 공무원은 위원장의 제청으로 대통령이 임명하며, 6급 이하\n공무원은 위원장이 임명한다고 규정함.\n그러나 3급 이하 5급 이상 공무원에 대한 대통령 임용권을 위원장\n에게 위임하는 규정이 존재하지 않아, 독립기관인 위원회가 「국가공\n무원법」 등 일반적인 공무원 임용 관계 법령의 적용을 받는 다른 부\n처에 비해 소속 장관(위원장)의 인사 자율성이 오히려 제한되고 있음.\n이에 대통령은 「국가공무원법」 제32조제3항 및 공무원 임용 관계\n법령을 준용하여 임용권의 일부를 위원장에게 위임할 수 있도록 하는\n규정을 신설하고자 함(안 제16조제4항 신설).",
    "제안이유_및_주요내용": "현행법은 소속 직원 중 5급 이상 공무원 또는 고위공무원단에 속하\n는 일반직 공무원은 위원장의 제청으로 대통령이 임명하며, 6급 이하\n공무원은 위원장이 임명한다고 규정함.\n그러나 3급 이하 5급 이상 공무원에 대한 대통령 임용권을 위원장\n에게 위임하는 규정이 존재하지 않아, 독립기관인 위원회가 「국가공\n무원법」 등 일반적인 공무원 임용 관계 법령의 적용을 받는 다른 부\n처에 비해 소속 장관(위원장)의 인사 자율성이 오히려 제한되고 있음.\n이에 대통령은 「국가공무원법」 제32조제3항 및 공무원 임용 관계\n법령을 준용하여 임용권의 일부를 위원장에게 위임할 수 있도록 하는\n규정을 신설하고자 함(안 제16조제4항 신설).",
    "법률_제_호": "국가인권위원회법 일부개정법률안\n국가인권위원회법 일부를 다음과 같이 개정한다.\n제16조제4항을 제5항으로 하고, 같은 조에 제4항을 다음과 같이 신설\n한다.\n④ 대통령은 제3항에 따른 임용권의 일부를 위원장에게 위임할 수\n있다. 이 경우 위임의 범위에 대해서는 「국가공무원법」 제32조제3\n항 및 공무원 임용 관계 법령을 준용한다.",
    "신구조문대비표": "현 행 개 정 안\n제16조(사무처) ① ∼ ③ (생 제16조(사무처) ① ∼ ③ (현행과\n략) 같음)\n<신 설> ④ 대통령은 제3항에 따른 임\n용권의 일부를 위원장에게 위\n임할 수 있다. 이 경우 위임의\n범위에 대해서는 「국가공무원\n법」 제32조제3항 및 공무원\n임용 관계 법령을 준용한다.\n④ (생 략) ⑤ (현행 제4항과 같음)"
  }
}