{
  "title": "2204633_체육시설의_설치·이용에_관한_법률_일부개정법률안",
  "bill_number": "4633",
  "proposal_date": "2024. 10. 10.",
  "submission_date": "",
  "is_alternative": false,
  "alternative_bill_numbers": [],
  "has_comparison_table": false,
  "comparison_table": "신ㆍ구조문대비표\n현 행 개 정 안\n제21조(체육시설의 이용 질서) ① 제21조(체육시설의 이용 질서) ①\n∼ ④ (생 략) ∼ ④ (현행과 같음)\n<신 설> ⑤ 대중형 골프장을 운영하는\n자는 이용료의 최고액을 제10\n조의2제2항에 따른 대중형 골\n프장 지정을 위한 이용료 요건\n이하로 책정하여야 한다.",
  "full_text": "체육시설의 설치ㆍ이용에 관한 법률 일부개정법률안\n(민형배의원 대표발의)\n발의연월일 : 2024. 10. 10.\n의 안\n4633\n번 호 발 의 자 : 민형배ㆍ이기헌ㆍ황운하\n주철현ㆍ윤준병ㆍ서미화\n장경태ㆍ박민규ㆍ김용민\n이정헌 의원(10인)\n제안이유 및 주요내용\n코로나 사태 이후 폭등한 대중형 골프장 코스 이용료(그린피)를 합\n리적인 수준으로 낮추고자 합니다.\n대중형 골프장은 세제혜택을 받는 대신 중과세율을 부과하는 회원\n제 골프장보다 낮은 이용료를 받아야 합니다. 현행 문화체육관광부 고\n시에 따르면, 대중형 골프장은 4ㆍ5ㆍ6월과 9ㆍ10ㆍ11월의 ‘평균 이용\n료’가 정부가 제시한 상한 이용료1)를 넘지 않아야 등록할 수 있습니\n다.\n대중형 골프장 다수가 이용 수요가 많은 시간대에 이용료를 높게\n책정하고 수요가 적은 새벽이나 야간에 이용료를 싸게 책정해 평균치\n를 맞추는 꼼수를 씁니다.\n세제혜택은 받으면서 회원제 골프장의 비회원 이용료보다 비싸게\n받는 것은 대중형 골프장 취지에 맞지 않습니다.\n1) 주중 18만 8천원, 주말 24만 7천원\n\n\n\n이에 대중형 골프장 ‘연중 최고 이용료’가 정부가 제시한 상한 이용\n료를 넘지 않도록 개정하고자 합니다. 대중형 골프장이 세금감면분만\n큼 이용료를 인하해 골프시장 질서를 바로잡고 골프 대중화 정책을\n실현시키기 위한 것입니다(안 제21조제5항 신설).\n\n법률 제 호\n체육시설의 설치ㆍ이용에 관한 법률 일부개정법률안\n체육시설의 설치ㆍ이용에 관한 법률 일부를 다음과 같이 개정한다.\n제21조에 제5항을 다음과 같이 신설한다.\n⑤ 대중형 골프장을 운영하는 자는 이용료의 최고액을 제10조의2제\n2항에 따른 대중형 골프장 지정을 위한 이용료 요건 이하로 책정하\n여야 한다.\n부 칙\n이 법은 공포 즉시 시행한다.\n\n\n\n\n신ㆍ구조문대비표\n현 행 개 정 안\n제21조(체육시설의 이용 질서) ① 제21조(체육시설의 이용 질서) ①\n∼ ④ (생 략) ∼ ④ (현행과 같음)\n<신 설> ⑤ 대중형 골프장을 운영하는\n자는 이용료의 최고액을 제10\n조의2제2항에 따른 대중형 골\n프장 지정을 위한 이용료 요건\n이하로 책정하여야 한다.\n",
  "sections": {
    "제안이유": "및",
    "주요내용": "코로나 사태 이후 폭등한 대중형 골프장 코스 이용료(그린피)를 합\n리적인 수준으로 낮추고자 합니다.\n대중형 골프장은 세제혜택을 받는 대신 중과세율을 부과하는 회원\n제 골프장보다 낮은 이용료를 받아야 합니다. 현행 문화체육관광부 고\n시에 따르면, 대중형 골프장은 4ㆍ5ㆍ6월과 9ㆍ10ㆍ11월의 ‘평균 이용\n료’가 정부가 제시한 상한 이용료1)를 넘지 않아야 등록할 수 있습니\n다.\n대중형 골프장 다수가 이용 수요가 많은 시간대에 이용료를 높게\n책정하고 수요가 적은 새벽이나 야간에 이용료를 싸게 책정해 평균치\n를 맞추는 꼼수를 씁니다.\n세제혜택은 받으면서 회원제 골프장의 비회원 이용료보다 비싸게\n받는 것은 대중형 골프장 취지에 맞지 않습니다.\n1) 주중 18만 8천원, 주말 24만 7천원\n\n\n\n이에 대중형 골프장 ‘연중 최고 이용료’가 정부가 제시한 상한 이용\n료를 넘지 않도록 개정하고자 합니다. 대중형 골프장이 세금감면분만\n큼 이용료를 인하해 골프시장 질서를 바로잡고 골프 대중화 정책을\n실현시키기 위한 것입니다(안 제21조제5항 신설).",
    "제안이유_및_주요내용": "코로나 사태 이후 폭등한 대중형 골프장 코스 이용료(그린피)를 합\n리적인 수준으로 낮추고자 합니다.\n대중형 골프장은 세제혜택을 받는 대신 중과세율을 부과하는 회원\n제 골프장보다 낮은 이용료를 받아야 합니다. 현행 문화체육관광부 고\n시에 따르면, 대중형 골프장은 4ㆍ5ㆍ6월과 9ㆍ10ㆍ11월의 ‘평균 이용\n료’가 정부가 제시한 상한 이용료1)를 넘지 않아야 등록할 수 있습니\n다.\n대중형 골프장 다수가 이용 수요가 많은 시간대에 이용료를 높게\n책정하고 수요가 적은 새벽이나 야간에 이용료를 싸게 책정해 평균치\n를 맞추는 꼼수를 씁니다.\n세제혜택은 받으면서 회원제 골프장의 비회원 이용료보다 비싸게\n받는 것은 대중형 골프장 취지에 맞지 않습니다.\n1) 주중 18만 8천원, 주말 24만 7천원\n\n\n\n이에 대중형 골프장 ‘연중 최고 이용료’가 정부가 제시한 상한 이용\n료를 넘지 않도록 개정하고자 합니다. 대중형 골프장이 세금감면분만\n큼 이용료를 인하해 골프시장 질서를 바로잡고 골프 대중화 정책을\n실현시키기 위한 것입니다(안 제21조제5항 신설).",
    "법률_제_호": "체육시설의 설치ㆍ이용에 관한 법률 일부개정법률안\n체육시설의 설치ㆍ이용에 관한 법률 일부를 다음과 같이 개정한다.\n제21조에 제5항을 다음과 같이 신설한다.\n⑤ 대중형 골프장을 운영하는 자는 이용료의 최고액을 제10조의2제\n2항에 따른 대중형 골프장 지정을 위한 이용료 요건 이하로 책정하\n여야 한다.",
    "신구조문대비표": "현 행 개 정 안\n제21조(체육시설의 이용 질서) ① 제21조(체육시설의 이용 질서) ①\n∼ ④ (생 략) ∼ ④ (현행과 같음)\n<신 설> ⑤ 대중형 골프장을 운영하는\n자는 이용료의 최고액을 제10\n조의2제2항에 따른 대중형 골\n프장 지정을 위한 이용료 요건\n이하로 책정하여야 한다."
  }
}