{
  "title": "2204680_국군조직법_일부개정법률안",
  "bill_number": "4680",
  "proposal_date": "2024. 10. 14.",
  "submission_date": "",
  "is_alternative": false,
  "alternative_bill_numbers": [],
  "has_comparison_table": false,
  "comparison_table": "신ㆍ구조문대비표\n현 행 개 정 안\n제1조(목적) 이 법은 국방의 의무 제1조(목적) 이 법은 대한민국 임\n를 수행하기 위한 국군의 조직 시정부와 독립군, 한국광복군의\n과 편성의 대강(大綱)을 규정함 역사를 계승하고, 국민의 군대\n을 목적으로 한다. 로서 국방의 ------.",
  "full_text": "국군조직법 일부개정법률안\n(부승찬의원 대표발의)\n발의연월일 : 2024. 10. 14.\n의 안\n4680\n번 호 발 의 자 : 부승찬ㆍ이기헌ㆍ박용갑\n안규백ㆍ추미애ㆍ정진욱\n한정애ㆍ정성호ㆍ신정훈\n김현정ㆍ조 국ㆍ박홍근\n김준혁ㆍ윤후덕 의원\n(14인)\n제안이유 및 주요내용\n헌법은 전문에서 “대한국민은 3ㆍ1운동으로 건립된 대한민국 임시\n정부의 법통을 계승한다.”는 점을 밝히고, 제1조제2항에서 “대한민국의\n주권은 국민에게 있고, 모든 권력은 국민으로부터 나온다.”는 점을 분\n명히 함. 이어서 제74조제2항에서 “국군의 조직과 편성은 법률로 정한\n다.”고 규정함. 이에 국군은 대한민국 임시정부의 법통을 계승하고, 주\n권자인 대한국민의 군대임.\n그런데, 헌법 제74조제2항에 근거하여 국군의 조직과 편성에 관해서\n정하고 있는 「국군조직법」은 그 정통성의 근거에 관해서 밝히지 않\n고 있음. 이로 인해 대한민국 임시정부의 법통을 계승하는 국군의 역\n사성과 역할, 국민의 군대로서의 지위 등 그 정통성을 부정하는 일들\n이 일어나고 있음.\n\n\n\n이에 헌법에 따라 조직과 편성 등 국군의 근간을 정하는 「국군조\n직법」에 국군의 정통성을 명확히 규정하고자 함(안 제1조).\n\n법률 제 호\n국군조직법 일부개정법률안\n국군조직법 일부를 다음과 같이 개정한다.\n제1조 중 “국방의”를 “대한민국 임시정부와 독립군, 한국광복군의 역\n사를 계승하고, 국민의 군대로서 국방의”로 한다.\n부 칙\n제1조(시행일) 이 법은 공포한 날부터 시행한다.\n\n\n\n\n신ㆍ구조문대비표\n현 행 개 정 안\n제1조(목적) 이 법은 국방의 의무 제1조(목적) 이 법은 대한민국 임\n를 수행하기 위한 국군의 조직 시정부와 독립군, 한국광복군의\n과 편성의 대강(大綱)을 규정함 역사를 계승하고, 국민의 군대\n을 목적으로 한다. 로서 국방의 ------.\n",
  "sections": {
    "제안이유": "및",
    "주요내용": "헌법은 전문에서 “대한국민은 3ㆍ1운동으로 건립된 대한민국 임시\n정부의 법통을 계승한다.”는 점을 밝히고, 제1조제2항에서 “대한민국의\n주권은 국민에게 있고, 모든 권력은 국민으로부터 나온다.”는 점을 분\n명히 함. 이어서 제74조제2항에서 “국군의 조직과 편성은 법률로 정한\n다.”고 규정함. 이에 국군은 대한민국 임시정부의 법통을 계승하고, 주\n권자인 대한국민의 군대임.\n그런데, 헌법 제74조제2항에 근거하여 국군의 조직과 편성에 관해서\n정하고 있는 「국군조직법」은 그 정통성의 근거에 관해서 밝히지 않\n고 있음. 이로 인해 대한민국 임시정부의 법통을 계승하는 국군의 역\n사성과 역할, 국민의 군대로서의 지위 등 그 정통성을 부정하는 일들\n이 일어나고 있음.\n\n\n\n이에 헌법에 따라 조직과 편성 등 국군의 근간을 정하는 「국군조\n직법」에 국군의 정통성을 명확히 규정하고자 함(안 제1조).",
    "제안이유_및_주요내용": "헌법은 전문에서 “대한국민은 3ㆍ1운동으로 건립된 대한민국 임시\n정부의 법통을 계승한다.”는 점을 밝히고, 제1조제2항에서 “대한민국의\n주권은 국민에게 있고, 모든 권력은 국민으로부터 나온다.”는 점을 분\n명히 함. 이어서 제74조제2항에서 “국군의 조직과 편성은 법률로 정한\n다.”고 규정함. 이에 국군은 대한민국 임시정부의 법통을 계승하고, 주\n권자인 대한국민의 군대임.\n그런데, 헌법 제74조제2항에 근거하여 국군의 조직과 편성에 관해서\n정하고 있는 「국군조직법」은 그 정통성의 근거에 관해서 밝히지 않\n고 있음. 이로 인해 대한민국 임시정부의 법통을 계승하는 국군의 역\n사성과 역할, 국민의 군대로서의 지위 등 그 정통성을 부정하는 일들\n이 일어나고 있음.\n\n\n\n이에 헌법에 따라 조직과 편성 등 국군의 근간을 정하는 「국군조\n직법」에 국군의 정통성을 명확히 규정하고자 함(안 제1조).",
    "법률_제_호": "국군조직법 일부개정법률안\n국군조직법 일부를 다음과 같이 개정한다.\n제1조 중 “국방의”를 “대한민국 임시정부와 독립군, 한국광복군의 역\n사를 계승하고, 국민의 군대로서 국방의”로 한다.",
    "신구조문대비표": "현 행 개 정 안\n제1조(목적) 이 법은 국방의 의무 제1조(목적) 이 법은 대한민국 임\n를 수행하기 위한 국군의 조직 시정부와 독립군, 한국광복군의\n과 편성의 대강(大綱)을 규정함 역사를 계승하고, 국민의 군대\n을 목적으로 한다. 로서 국방의 ------."
  }
}