{
  "title": "2204391_참전유공자_예우_및_단체설립에_관한_법률_일부개정법률안",
  "bill_number": "4391",
  "proposal_date": "2024. 9. 27.",
  "submission_date": "",
  "is_alternative": false,
  "alternative_bill_numbers": [],
  "has_comparison_table": false,
  "comparison_table": "신ㆍ구조문대비표\n현 행 개 정 안\n제7조(의료지원) ①ㆍ② (생 략) 제7조(의료지원) ①ㆍ② (현행과\n같음)\n<신 설> ③ 제2항에 따라 진료를 위탁\n하는 경우 「의료법」 제3조제\n2항제3호에 따른 병원급 의료\n기관이 모두 위탁의료기관이\n되도록 하여야 한다.\n③ (생 략) ④ (현행 제3항과 같음)",
  "full_text": "참전유공자 예우 및 단체설립에 관한 법률 일부개정법률안\n(박정하의원 대표발의)\n발의연월일 : 2024. 9. 27.\n의 안\n4391\n번 호 발 의 자 : 박정하ㆍ박성민ㆍ주진우\n진종오ㆍ한지아ㆍ김위상\n이인선ㆍ김승수ㆍ신성범\n김용태ㆍ최은석ㆍ장동혁\n의원(12인)\n제안이유 및 주요내용\n현행법은 참전유공자가 진료가 필요한 경우에 보훈병원 등 국가의\n의료시설이나 위탁병원으로 지정된 민간의료기관에서 진료받을 수 있\n도록 하고 있음.\n그런데 현재 보훈병원 및 위탁의료기관으로 지정된 민간의료기관이\n부족하여 지정된 의료기관이 부족한 곳에 거주하는 참전유공자의 경\n우에는 의료접근성이 매우 취약하고, 양질의 의료서비스를 제공받지\n못하고 있다는 지적이 있음.\n이에 국가가 민간의료기관에 진료를 위탁하는 경우에는 「의료법」\n제3조제2항제3호에 따른 병원급 의료기관이 모두 위탁의료기관이 되\n도록 함으로써 참전유공자가 위탁의료기관에 쉽게 접근하도록 하고,\n양질의 의료서비스가 제공되도록 하려는 것임(안 제7조제3항 신설).\n\n\n\n\n법률 제 호\n참전유공자 예우 및 단체설립에 관한 법률 일부개정법률안\n참전유공자 예우 및 단체설립에 관한 법률 일부를 다음과 같이 개정\n한다.\n제7조제3항을 제4항으로 하고, 같은 조에 제3항을 다음과 같이 신설한\n다.\n③ 제2항에 따라 진료를 위탁하는 경우 「의료법」 제3조제2항제3\n호에 따른 병원급 의료기관이 모두 위탁의료기관이 되도록 하여야\n한다.\n부 칙\n이 법은 공포 후 6개월이 경과한 날부터 시행한다.\n\n\n\n\n신ㆍ구조문대비표\n현 행 개 정 안\n제7조(의료지원) ①ㆍ② (생 략) 제7조(의료지원) ①ㆍ② (현행과\n같음)\n<신 설> ③ 제2항에 따라 진료를 위탁\n하는 경우 「의료법」 제3조제\n2항제3호에 따른 병원급 의료\n기관이 모두 위탁의료기관이\n되도록 하여야 한다.\n③ (생 략) ④ (현행 제3항과 같음)\n",
  "sections": {
    "제안이유": "및",
    "주요내용": "현행법은 참전유공자가 진료가 필요한 경우에 보훈병원 등 국가의\n의료시설이나 위탁병원으로 지정된 민간의료기관에서 진료받을 수 있\n도록 하고 있음.\n그런데 현재 보훈병원 및 위탁의료기관으로 지정된 민간의료기관이\n부족하여 지정된 의료기관이 부족한 곳에 거주하는 참전유공자의 경\n우에는 의료접근성이 매우 취약하고, 양질의 의료서비스를 제공받지\n못하고 있다는 지적이 있음.\n이에 국가가 민간의료기관에 진료를 위탁하는 경우에는 「의료법」\n제3조제2항제3호에 따른 병원급 의료기관이 모두 위탁의료기관이 되\n도록 함으로써 참전유공자가 위탁의료기관에 쉽게 접근하도록 하고,\n양질의 의료서비스가 제공되도록 하려는 것임(안 제7조제3항 신설).",
    "제안이유_및_주요내용": "현행법은 참전유공자가 진료가 필요한 경우에 보훈병원 등 국가의\n의료시설이나 위탁병원으로 지정된 민간의료기관에서 진료받을 수 있\n도록 하고 있음.\n그런데 현재 보훈병원 및 위탁의료기관으로 지정된 민간의료기관이\n부족하여 지정된 의료기관이 부족한 곳에 거주하는 참전유공자의 경\n우에는 의료접근성이 매우 취약하고, 양질의 의료서비스를 제공받지\n못하고 있다는 지적이 있음.\n이에 국가가 민간의료기관에 진료를 위탁하는 경우에는 「의료법」\n제3조제2항제3호에 따른 병원급 의료기관이 모두 위탁의료기관이 되\n도록 함으로써 참전유공자가 위탁의료기관에 쉽게 접근하도록 하고,\n양질의 의료서비스가 제공되도록 하려는 것임(안 제7조제3항 신설).",
    "법률_제_호": "참전유공자 예우 및 단체설립에 관한 법률 일부개정법률안\n참전유공자 예우 및 단체설립에 관한 법률 일부를 다음과 같이 개정\n한다.\n제7조제3항을 제4항으로 하고, 같은 조에 제3항을 다음과 같이 신설한\n다.\n③ 제2항에 따라 진료를 위탁하는 경우 「의료법」 제3조제2항제3\n호에 따른 병원급 의료기관이 모두 위탁의료기관이 되도록 하여야\n한다.",
    "신구조문대비표": "현 행 개 정 안\n제7조(의료지원) ①ㆍ② (생 략) 제7조(의료지원) ①ㆍ② (현행과\n같음)\n<신 설> ③ 제2항에 따라 진료를 위탁\n하는 경우 「의료법」 제3조제\n2항제3호에 따른 병원급 의료\n기관이 모두 위탁의료기관이\n되도록 하여야 한다.\n③ (생 략) ④ (현행 제3항과 같음)"
  }
}