{
  "title": "2204465_장애인복지법_일부개정법률안",
  "bill_number": "4465",
  "proposal_date": "2024. 9. 30.",
  "submission_date": "",
  "is_alternative": false,
  "alternative_bill_numbers": [],
  "has_comparison_table": false,
  "comparison_table": "신·구조문대비표\n현 행 개 정 안\n제30조(경제적 부담의 경감) ①⋅ 제30조(경제적 부담의 경감) ①⋅\n② (생 략) ② (현행과 같음)\n<신 설> ③ 국가는 제2항에 따라 장애\n인과 장애인을 보호하기 위하\n여 동행하는 자의 운임을 감면\n하는 운송사업자에 대하여 대\n통령령으로 정하는 바에 따라\n그 비용을 지원한다.",
  "full_text": "장애인복지법 일부개정법률안\n(이헌승의원 대표발의)\n발의연월일 : 2024. 9. 30.\n의 안\n4465\n번 호 발 의 자 : 이헌승ㆍ김선교ㆍ서일준\n서지영ㆍ김승수ㆍ유용원\n박덕흠ㆍ김도읍ㆍ고동진\n유영하ㆍ정성국ㆍ윤상현\n의원(12인)\n제안이유\n현행법은 장애인에게 국가나 지방자치단체의 수송시설을 무료로 이\n용할 수 있도록 하고 있음.\n장애인 무임수송은 국가 복지정책의 일환으로 국가가 비용부담에\n대한 책임이 있음에도 불구하고, 국가는 도시철도운영기관에 국비를\n지원하지 않고 있음.\n이는 도시철도운영기관의 적자요인이 되고 있고, 이로 인해 승객안\n전, 교통약자 편의시설 증진 등 도시철도 서비스 향상을 위한 투자축\n소가 현실화되고 있는 실정임.\n이에 장애인 복지증진 차원에서 장애인의 무임수송 비용을 국가가\n지원하도록 근거조항을 마련하고자 함.\n\n\n\n주요내용\n장애인 무임수송 비용을 국가가 지원하도록 함(안 제30조제3항 신\n설).\n\n법률 제 호\n장애인복지법 일부개정법률안\n장애인복지법 일부를 다음과 같이 개정한다.\n제30조에 제3항을 다음과 같이 신설한다.\n③ 국가는 제2항에 따라 장애인과 장애인을 보호하기 위하여 동행\n하는 자의 운임을 감면하는 운송사업자에 대하여 대통령령으로 정\n하는 바에 따라 그 비용을 지원한다.\n부 칙\n이 법은 공포 후 3개월이 경과한 날부터 시행한다.\n\n\n\n\n신·구조문대비표\n현 행 개 정 안\n제30조(경제적 부담의 경감) ①⋅ 제30조(경제적 부담의 경감) ①⋅\n② (생 략) ② (현행과 같음)\n<신 설> ③ 국가는 제2항에 따라 장애\n인과 장애인을 보호하기 위하\n여 동행하는 자의 운임을 감면\n하는 운송사업자에 대하여 대\n통령령으로 정하는 바에 따라\n그 비용을 지원한다.\n",
  "sections": {
    "제안이유": "현행법은 장애인에게 국가나 지방자치단체의 수송시설을 무료로 이\n용할 수 있도록 하고 있음.\n장애인 무임수송은 국가 복지정책의 일환으로 국가가 비용부담에\n대한 책임이 있음에도 불구하고, 국가는 도시철도운영기관에 국비를\n지원하지 않고 있음.\n이는 도시철도운영기관의 적자요인이 되고 있고, 이로 인해 승객안\n전, 교통약자 편의시설 증진 등 도시철도 서비스 향상을 위한 투자축\n소가 현실화되고 있는 실정임.\n이에 장애인 복지증진 차원에서 장애인의 무임수송 비용을 국가가\n지원하도록 근거조항을 마련하고자 함.",
    "주요내용": "장애인 무임수송 비용을 국가가 지원하도록 함(안 제30조제3항 신\n설).",
    "법률_제_호": "장애인복지법 일부개정법률안\n장애인복지법 일부를 다음과 같이 개정한다.\n제30조에 제3항을 다음과 같이 신설한다.\n③ 국가는 제2항에 따라 장애인과 장애인을 보호하기 위하여 동행\n하는 자의 운임을 감면하는 운송사업자에 대하여 대통령령으로 정\n하는 바에 따라 그 비용을 지원한다.",
    "신구조문대비표": "현 행 개 정 안\n제30조(경제적 부담의 경감) ①⋅ 제30조(경제적 부담의 경감) ①⋅\n② (생 략) ② (현행과 같음)\n<신 설> ③ 국가는 제2항에 따라 장애\n인과 장애인을 보호하기 위하\n여 동행하는 자의 운임을 감면\n하는 운송사업자에 대하여 대\n통령령으로 정하는 바에 따라\n그 비용을 지원한다."
  }
}