{
  "title": "2204072_우주개발_진흥법_일부개정법률안",
  "bill_number": "4072",
  "proposal_date": "2024. 9. 19.",
  "submission_date": "",
  "is_alternative": false,
  "alternative_bill_numbers": [],
  "has_comparison_table": false,
  "comparison_table": "신ㆍ구조문대비표\n현 행 개 정 안\n<신 설> 제18조의8(박람회 등의 개최 및\n지원) 국가 또는 지방자치단체\n는 우주개발의 진흥 및 홍보를\n위하여 우주개발 박람회 등을\n개최하거나 이에 필요한 예산\n을 지원할 수 있다.",
  "full_text": "우주개발 진흥법 일부개정법률안\n(서천호의원 대표발의)\n발의연월일 : 2024. 9. 19.\n의 안\n4072\n번 호 발 의 자 : 서천호ㆍ서지영ㆍ진종오\n백종헌ㆍ김용태ㆍ정성국\n임종득ㆍ김예지ㆍ우재준\n정희용ㆍ김선교ㆍ이만희\n의원(12인)\n제안이유 및 주요내용\n현행법은 우주개발의 촉진을 위하여 우주항공청장으로 하여금 민간\n부문의 우주개발과 연구개발투자를 활성화하고 우주개발 관련 기업을\n육성하기 위한 전략을 수립 및 추진하도록 하고 있음. 그 밖에도 창업\n촉진, 전문인력 양성, 우주신기술 및 우주산업클러스터의 지정 등 다\n양한 각도에서 우주개발의 진흥을 위한 입법적 조치를 마련하고 있음.\n그러나 국가 이미지 및 관련 기업들의 브랜드가치 향상, 다양한 국\n제 교류의 기회 제공, 성숙한 시민의식의 함양 등을 기대할 수 있는\n행사인 박람회를 개최할 수 있는 근거가 현행법에는 마련되어 있지\n않음. 박람회가 성공적으로 진행되어 성과를 낸다면, 우주개발뿐 아니\n라 우리나라의 경제 활성화에도 도움이 될 것으로 기대되는바, 진흥의\n목적으로서 박람회 행사는 효과적인 수단이 될 수 있음.\n이에 국가 또는 지방자치단체는 우주개발의 진흥 및 홍보를 위하여\n\n\n\n우주개발 박람회 등을 개최하거나 이에 필요한 예산을 지원할 수 있\n도록 하는 근거를 마련하려는 것임(안 제18조의8 신설).\n\n법률 제 호\n우주개발 진흥법 일부개정법률안\n우주개발 진흥법 일부를 다음과 같이 개정한다.\n제18조의8을 다음과 같이 신설한다.\n제18조의8(박람회 등의 개최 및 지원) 국가 또는 지방자치단체는 우주\n개발의 진흥 및 홍보를 위하여 우주개발 박람회 등을 개최하거나\n이에 필요한 예산을 지원할 수 있다.\n부 칙\n이 법은 공포 후 6개월이 경과한 날부터 시행한다.\n\n\n\n\n신ㆍ구조문대비표\n현 행 개 정 안\n<신 설> 제18조의8(박람회 등의 개최 및\n지원) 국가 또는 지방자치단체\n는 우주개발의 진흥 및 홍보를\n위하여 우주개발 박람회 등을\n개최하거나 이에 필요한 예산\n을 지원할 수 있다.\n",
  "sections": {
    "제안이유": "및",
    "주요내용": "현행법은 우주개발의 촉진을 위하여 우주항공청장으로 하여금 민간\n부문의 우주개발과 연구개발투자를 활성화하고 우주개발 관련 기업을\n육성하기 위한 전략을 수립 및 추진하도록 하고 있음. 그 밖에도 창업\n촉진, 전문인력 양성, 우주신기술 및 우주산업클러스터의 지정 등 다\n양한 각도에서 우주개발의 진흥을 위한 입법적 조치를 마련하고 있음.\n그러나 국가 이미지 및 관련 기업들의 브랜드가치 향상, 다양한 국\n제 교류의 기회 제공, 성숙한 시민의식의 함양 등을 기대할 수 있는\n행사인 박람회를 개최할 수 있는 근거가 현행법에는 마련되어 있지\n않음. 박람회가 성공적으로 진행되어 성과를 낸다면, 우주개발뿐 아니\n라 우리나라의 경제 활성화에도 도움이 될 것으로 기대되는바, 진흥의\n목적으로서 박람회 행사는 효과적인 수단이 될 수 있음.\n이에 국가 또는 지방자치단체는 우주개발의 진흥 및 홍보를 위하여\n\n\n\n우주개발 박람회 등을 개최하거나 이에 필요한 예산을 지원할 수 있\n도록 하는 근거를 마련하려는 것임(안 제18조의8 신설).",
    "제안이유_및_주요내용": "현행법은 우주개발의 촉진을 위하여 우주항공청장으로 하여금 민간\n부문의 우주개발과 연구개발투자를 활성화하고 우주개발 관련 기업을\n육성하기 위한 전략을 수립 및 추진하도록 하고 있음. 그 밖에도 창업\n촉진, 전문인력 양성, 우주신기술 및 우주산업클러스터의 지정 등 다\n양한 각도에서 우주개발의 진흥을 위한 입법적 조치를 마련하고 있음.\n그러나 국가 이미지 및 관련 기업들의 브랜드가치 향상, 다양한 국\n제 교류의 기회 제공, 성숙한 시민의식의 함양 등을 기대할 수 있는\n행사인 박람회를 개최할 수 있는 근거가 현행법에는 마련되어 있지\n않음. 박람회가 성공적으로 진행되어 성과를 낸다면, 우주개발뿐 아니\n라 우리나라의 경제 활성화에도 도움이 될 것으로 기대되는바, 진흥의\n목적으로서 박람회 행사는 효과적인 수단이 될 수 있음.\n이에 국가 또는 지방자치단체는 우주개발의 진흥 및 홍보를 위하여\n\n\n\n우주개발 박람회 등을 개최하거나 이에 필요한 예산을 지원할 수 있\n도록 하는 근거를 마련하려는 것임(안 제18조의8 신설).",
    "법률_제_호": "우주개발 진흥법 일부개정법률안\n우주개발 진흥법 일부를 다음과 같이 개정한다.\n제18조의8을 다음과 같이 신설한다.\n제18조의8(박람회 등의 개최 및 지원) 국가 또는 지방자치단체는 우주\n개발의 진흥 및 홍보를 위하여 우주개발 박람회 등을 개최하거나\n이에 필요한 예산을 지원할 수 있다.",
    "신구조문대비표": "현 행 개 정 안\n<신 설> 제18조의8(박람회 등의 개최 및\n지원) 국가 또는 지방자치단체\n는 우주개발의 진흥 및 홍보를\n위하여 우주개발 박람회 등을\n개최하거나 이에 필요한 예산\n을 지원할 수 있다."
  }
}