{
  "title": "2204245_초·중등교육법_일부개정법률안",
  "bill_number": "4245",
  "proposal_date": "2024. 9. 24.",
  "submission_date": "",
  "is_alternative": false,
  "alternative_bill_numbers": [],
  "has_comparison_table": false,
  "comparison_table": "신ㆍ구조문대비표\n현 행 개 정 안\n제29조(교과용 도서의 사용) ① 제29조(교과용 도서의 사용) ①\n(생 략) (현행과 같음)\n<신 설> ② 교과용 도서는 교육부장관\n이 정하는 바에 따라 「녹색제\n품 구매촉진에 관한 법률」 제\n2조의2에 따른 녹색제품에 해\n당하는 종이로 제작하여야 한\n다.\n② (생 략) ③ (현행 제2항과 같음)",
  "full_text": "초ㆍ중등교육법 일부개정법률안\n(강득구의원 대표발의)\n발의연월일 : 2024. 9. 24.\n의 안\n4245\n번 호 발 의 자 : 강득구ㆍ이상식ㆍ문정복\n김준혁ㆍ민병덕ㆍ이학영\n복기왕ㆍ윤종군ㆍ김주영\n박홍배ㆍ이강일ㆍ권칠승\n의원(12인)\n제안이유 및 주요내용\n교육부는 2010년부터 중ㆍ고등학교의 새 교과용 도서를 우수재활용\n재생용지를 사용하여 제작ㆍ공급하고 있으나, 재생용지를 생산하기 위\n한 공정에 화학약품이 사용되므로 학생들의 건강에 대한 우려를 고려\n해 초등학교와 특수학교에서 사용하는 교과용 도서에는 재생종이를\n사용하지 않고 있음.\n하지만, 교육부가 의뢰한 연구 결과에 따르면 재생종이가 인체에 위\n해한 수준이 아닌 것으로 확인되고 있으며, 기후위기를 극복하고 탄소\n중립 사회로의 이행을 위하여 자원순환에 대한 관심이 높아지고 있는\n바, 자원순환 촉진을 위한 국가의 녹색제품 수요 확대의 노력이 더욱\n요구되고 있음.\n이에, 최근 급속히 진행 중인 지구 온난화에 대응하고 탄소중립 사\n회로의 이행을 위해 모든 학교에서 사용하는 교과용 도서를 환경표지,\n\n\n\n우수재활용, 저탄소 인증제품에 해당하는 종이로 제작하도록 의무화하\n고자 함(제29조제2항 신설).\n\n법률 제 호\n초ㆍ중등교육법 일부개정법률안\n초ㆍ중등교육법 일부를 다음과 같이 개정한다.\n제29조제2항을 제3항으로 하고, 같은 조에 제2항을 다음과 같이 신설\n한다.\n② 교과용 도서는 교육부장관이 정하는 바에 따라 「녹색제품 구매\n촉진에 관한 법률」 제2조의2에 따른 녹색제품에 해당하는 종이로\n제작하여야 한다.\n부 칙\n이 법은 공포 후 1년이 경과한 날부터 시행한다.\n\n\n\n\n신ㆍ구조문대비표\n현 행 개 정 안\n제29조(교과용 도서의 사용) ① 제29조(교과용 도서의 사용) ①\n(생 략) (현행과 같음)\n<신 설> ② 교과용 도서는 교육부장관\n이 정하는 바에 따라 「녹색제\n품 구매촉진에 관한 법률」 제\n2조의2에 따른 녹색제품에 해\n당하는 종이로 제작하여야 한\n다.\n② (생 략) ③ (현행 제2항과 같음)\n",
  "sections": {
    "제안이유": "및",
    "주요내용": "교육부는 2010년부터 중ㆍ고등학교의 새 교과용 도서를 우수재활용\n재생용지를 사용하여 제작ㆍ공급하고 있으나, 재생용지를 생산하기 위\n한 공정에 화학약품이 사용되므로 학생들의 건강에 대한 우려를 고려\n해 초등학교와 특수학교에서 사용하는 교과용 도서에는 재생종이를\n사용하지 않고 있음.\n하지만, 교육부가 의뢰한 연구 결과에 따르면 재생종이가 인체에 위\n해한 수준이 아닌 것으로 확인되고 있으며, 기후위기를 극복하고 탄소\n중립 사회로의 이행을 위하여 자원순환에 대한 관심이 높아지고 있는\n바, 자원순환 촉진을 위한 국가의 녹색제품 수요 확대의 노력이 더욱\n요구되고 있음.\n이에, 최근 급속히 진행 중인 지구 온난화에 대응하고 탄소중립 사\n회로의 이행을 위해 모든 학교에서 사용하는 교과용 도서를 환경표지,\n\n\n\n우수재활용, 저탄소 인증제품에 해당하는 종이로 제작하도록 의무화하\n고자 함(제29조제2항 신설).",
    "제안이유_및_주요내용": "교육부는 2010년부터 중ㆍ고등학교의 새 교과용 도서를 우수재활용\n재생용지를 사용하여 제작ㆍ공급하고 있으나, 재생용지를 생산하기 위\n한 공정에 화학약품이 사용되므로 학생들의 건강에 대한 우려를 고려\n해 초등학교와 특수학교에서 사용하는 교과용 도서에는 재생종이를\n사용하지 않고 있음.\n하지만, 교육부가 의뢰한 연구 결과에 따르면 재생종이가 인체에 위\n해한 수준이 아닌 것으로 확인되고 있으며, 기후위기를 극복하고 탄소\n중립 사회로의 이행을 위하여 자원순환에 대한 관심이 높아지고 있는\n바, 자원순환 촉진을 위한 국가의 녹색제품 수요 확대의 노력이 더욱\n요구되고 있음.\n이에, 최근 급속히 진행 중인 지구 온난화에 대응하고 탄소중립 사\n회로의 이행을 위해 모든 학교에서 사용하는 교과용 도서를 환경표지,\n\n\n\n우수재활용, 저탄소 인증제품에 해당하는 종이로 제작하도록 의무화하\n고자 함(제29조제2항 신설).",
    "법률_제_호": "초ㆍ중등교육법 일부개정법률안\n초ㆍ중등교육법 일부를 다음과 같이 개정한다.\n제29조제2항을 제3항으로 하고, 같은 조에 제2항을 다음과 같이 신설\n한다.\n② 교과용 도서는 교육부장관이 정하는 바에 따라 「녹색제품 구매\n촉진에 관한 법률」 제2조의2에 따른 녹색제품에 해당하는 종이로\n제작하여야 한다.",
    "신구조문대비표": "현 행 개 정 안\n제29조(교과용 도서의 사용) ① 제29조(교과용 도서의 사용) ①\n(생 략) (현행과 같음)\n<신 설> ② 교과용 도서는 교육부장관\n이 정하는 바에 따라 「녹색제\n품 구매촉진에 관한 법률」 제\n2조의2에 따른 녹색제품에 해\n당하는 종이로 제작하여야 한\n다.\n② (생 략) ③ (현행 제2항과 같음)"
  }
}