{
  "title": "2204148_계엄법_일부개정법률안",
  "bill_number": "4148",
  "proposal_date": "2024. 9. 20.",
  "submission_date": "",
  "is_alternative": false,
  "alternative_bill_numbers": [],
  "has_comparison_table": false,
  "comparison_table": "신·구조문대비표\n현 행 개 정 안\n제11조(계엄의 해제) ① ∼ ③ 제11조(계엄의 해제) ① ∼ ③\n(생 략) (현행과 같음)\n<신 설> ④ 현행범인 국회의원을 체포,\n구금하고 있는 행정기관은 제1\n항에 따라 국회가 계엄 등과\n관련된 논의 등을 위하여 회의\n를 소집할 경우 즉시 회의에\n참석할 수 있도록 조치하여야\n한다.",
  "full_text": "계엄법 일부개정법률안\n(김민석의원 대표발의)\n발의연월일 : 2024. 9. 20.\n의 안\n4148\n번 호 발 의 자 : 김민석ㆍ김병주ㆍ박선원\n부승찬ㆍ조 국ㆍ허 영\n안규백ㆍ황 희ㆍ박범계\n추미애 의원(10인)\n제안이유 및 주요내용\n헌법 제77조제5항에 따르면, 국회가 재적의원 과반수의 찬성으로 계\n엄 해제를 요구할 경우, 대통령은 반드시 이를 해제하여야 함.\n그러나 2017년 반정부 활동에 참여한 국회의원들을 현행범으로 간\n주하여 체포하거나 구금하여 계엄해제를 방해하는 내용의 문건이 발\n견됨으로써 헌법에 따른 국회의 계엄 해제 권한을 무력화시킬 수 있\n다는 우려를 불러일으킴.\n이에 계엄령이 선포된 상황에서 국회의원이 현행범으로 체포되거나\n구금된 경우에도, 국회가 계엄 해제 등과 관련된 논의를 위해 회의를\n소집할 경우 해당 국회의원이 즉시 회의에 참석할 수 있도록 행정기\n관이 필요한 조치를 취하도록 함으로써 헌법에서 규정한 국회의원의\n권한을 보장하고자 함(안 제11조제4항).\n\n\n\n\n법률 제 호\n계엄법 일부개정법률안\n계엄법 일부를 다음과 같이 개정한다.\n제11조에 제4항을 다음과 같이 신설한다.\n④ 현행범인 국회의원을 체포, 구금하고 있는 행정기관은 제1항에\n따라 국회가 계엄 등과 관련된 논의 등을 위하여 회의를 소집할 경\n우 즉시 회의에 참석할 수 있도록 조치하여야 한다.\n부 칙\n이 법은 공포한 날부터 시행한다.\n\n\n\n\n신·구조문대비표\n현 행 개 정 안\n제11조(계엄의 해제) ① ∼ ③ 제11조(계엄의 해제) ① ∼ ③\n(생 략) (현행과 같음)\n<신 설> ④ 현행범인 국회의원을 체포,\n구금하고 있는 행정기관은 제1\n항에 따라 국회가 계엄 등과\n관련된 논의 등을 위하여 회의\n를 소집할 경우 즉시 회의에\n참석할 수 있도록 조치하여야\n한다.\n",
  "sections": {
    "제안이유": "및",
    "주요내용": "헌법 제77조제5항에 따르면, 국회가 재적의원 과반수의 찬성으로 계\n엄 해제를 요구할 경우, 대통령은 반드시 이를 해제하여야 함.\n그러나 2017년 반정부 활동에 참여한 국회의원들을 현행범으로 간\n주하여 체포하거나 구금하여 계엄해제를 방해하는 내용의 문건이 발\n견됨으로써 헌법에 따른 국회의 계엄 해제 권한을 무력화시킬 수 있\n다는 우려를 불러일으킴.\n이에 계엄령이 선포된 상황에서 국회의원이 현행범으로 체포되거나\n구금된 경우에도, 국회가 계엄 해제 등과 관련된 논의를 위해 회의를\n소집할 경우 해당 국회의원이 즉시 회의에 참석할 수 있도록 행정기\n관이 필요한 조치를 취하도록 함으로써 헌법에서 규정한 국회의원의\n권한을 보장하고자 함(안 제11조제4항).",
    "제안이유_및_주요내용": "헌법 제77조제5항에 따르면, 국회가 재적의원 과반수의 찬성으로 계\n엄 해제를 요구할 경우, 대통령은 반드시 이를 해제하여야 함.\n그러나 2017년 반정부 활동에 참여한 국회의원들을 현행범으로 간\n주하여 체포하거나 구금하여 계엄해제를 방해하는 내용의 문건이 발\n견됨으로써 헌법에 따른 국회의 계엄 해제 권한을 무력화시킬 수 있\n다는 우려를 불러일으킴.\n이에 계엄령이 선포된 상황에서 국회의원이 현행범으로 체포되거나\n구금된 경우에도, 국회가 계엄 해제 등과 관련된 논의를 위해 회의를\n소집할 경우 해당 국회의원이 즉시 회의에 참석할 수 있도록 행정기\n관이 필요한 조치를 취하도록 함으로써 헌법에서 규정한 국회의원의\n권한을 보장하고자 함(안 제11조제4항).",
    "법률_제_호": "계엄법 일부개정법률안\n계엄법 일부를 다음과 같이 개정한다.\n제11조에 제4항을 다음과 같이 신설한다.\n④ 현행범인 국회의원을 체포, 구금하고 있는 행정기관은 제1항에\n따라 국회가 계엄 등과 관련된 논의 등을 위하여 회의를 소집할 경\n우 즉시 회의에 참석할 수 있도록 조치하여야 한다.",
    "신구조문대비표": "현 행 개 정 안\n제11조(계엄의 해제) ① ∼ ③ 제11조(계엄의 해제) ① ∼ ③\n(생 략) (현행과 같음)\n<신 설> ④ 현행범인 국회의원을 체포,\n구금하고 있는 행정기관은 제1\n항에 따라 국회가 계엄 등과\n관련된 논의 등을 위하여 회의\n를 소집할 경우 즉시 회의에\n참석할 수 있도록 조치하여야\n한다."
  }
}