{
  "title": "2204886_법인세법_일부개정법률안",
  "bill_number": "4886",
  "proposal_date": "2024. 10. 24.",
  "submission_date": "",
  "is_alternative": false,
  "alternative_bill_numbers": [],
  "has_comparison_table": false,
  "comparison_table": "신ㆍ구조문대비표\n현 행 개 정 안\n법률 제19193호 법인세법 법률 제19193호 법인세법\n일부개정법률 ",
  "full_text": "법인세법 일부개정법률안\n(박대출의원 대표발의)\n발의연월일 : 2024. 10. 24.\n의 안\n4886\n번 호 발 의 자 : 박대출ㆍ송언석ㆍ권성동\n강승규ㆍ이종욱ㆍ신성범\n윤영석ㆍ유영하ㆍ김태호\n송석준ㆍ강명구ㆍ박수영\n의원(12인)\n제안이유 및 주요내용\n2022년 12월 31일 법인세법 개정(법률 제19193호, 2022. 12. 31., 일\n부개정)으로 배당금의 이중과세 조정을 위하여 도입된 수입배당금 익\n금불산입의 적용률이 기업형태(지주ㆍ일반회사, 상장ㆍ비상장법인)의\n구분 없이 일원화하면서 법인세법에 따라 급격히 증가하는 일부 지주\n회사의 법인세부담을 완화하고자 개정 당시 부칙 제16조에 내국법인\n의 수입배당금 익금불산입에 관한 경과조치를 두어, 2023년 12월 31일\n까지의 유예기간 1년 동안에는 개정 전 법인세법에 따른 수입배당금\n익금불산입률을 적용할 수 있도록 하였음.\n그러나 과거 정부의 정책에 따라 지주회사로 전환한 지주회사에 부\n여한 세제지원을 갑작스럽게 축소하는 것은 정부 정책에 대한 신뢰를\n크게 저해할 수 있고, 법인세법 개정 이후 지주회사가 개정 전과 동일\n한 수준의 익금불산입률을 유지하기 위해서는 주식시장에서 상장된\n\n\n\n자회사에 대한 10% 이상의 추가적인 지분 취득이 이루어져야 하는데,\n1년이라는 짧은 유예기간 동안 자회사 주식을 취득할 경우 주식시장\n에 심각한 왜곡이 발생할 우려가 있음.\n이에 지주회사가 종전의 수입배당금 익금불산입 적용률을 적용할\n수 있는 유예기간을 현행보다 3년간 연장함으로써 정부정책의 신뢰성\n을 확보하는 한편, 지주회사가 상장자회사의 주식을 추가 취득할 수\n있는 적정한 시간을 마련하여 주려는 것임(안 법률 제19193호 법인세\n법 일부개정법률 부칙 제16조).\n\n법률 제 호\n법인세법 일부개정법률안\n법인세법 일부를 다음과 같이 개정한다.\n법률 제19193호 법인세법 일부개정법률 부칙 제16조제2항 중 “2023년”\n을 “2026년”으로 한다.\n부 칙\n제1조(시행일) 이 법은 2025년 1월 1일부터 시행한다.\n제2조(내국법인 수입배당금액의 익금불산입률에 관한 적용례) 법률 제\n19193호 법인세법 일부개정법률 부칙 제16조제2항의 개정규정은 이\n법 시행일 이후 신고하는 분부터 적용한다.\n\n\n\n\n신ㆍ구조문대비표\n현 행 개 정 안\n법률 제19193호 법인세법 법률 제19193호 법인세법\n일부개정법률 부칙 일부개정법률 부칙\n제16조(내국법인 수입배당금액의 제16조(내국법인 수입배당금액의\n익금불산입률에 관한 경과조 익금불산입률에 관한 경과조\n치) ① (생 략) 치) ① (현행과 같음)\n② 내국법인이 2023년 12월 31 ② ------- 2026년---------\n일까지 받는 수입배당금액에 -------------------------\n대해서는 제18조의3의 개정규 -------------------------\n정에도 불구하고 종전의 규정 -------------------------\n에 따른 익금불산입률을 적용 -------------------------\n할 수 있다. --.\n",
  "sections": {
    "제안이유": "및",
    "주요내용": "2022년 12월 31일 법인세법 개정(",
    "제안이유_및_주요내용": "2022년 12월 31일 법인세법 개정(",
    "법률_제_호": ", 2022. 12. 31., 일\n부개정)으로 배당금의 이중과세 조정을 위하여 도입된 수입배당금 익\n금불산입의 적용률이 기업형태(지주ㆍ일반회사, 상장ㆍ비상장법인)의\n구분 없이 일원화하면서 법인세법에 따라 급격히 증가하는 일부 지주\n회사의 법인세부담을 완화하고자 개정 당시",
    "신구조문대비표": "현 행 개 정 안\n법률 제19193호 법인세법 법률 제19193호 법인세법\n일부개정법률"
  }
}