{
  "title": "2204265_보호소년_등의_처우에_관한_법률_일부개정법률안",
  "bill_number": "4265",
  "proposal_date": "2024. 9. 25.",
  "submission_date": "",
  "is_alternative": false,
  "alternative_bill_numbers": [],
  "has_comparison_table": false,
  "comparison_table": "신ㆍ구조문대비표\n현 행 개 정 안\n제29조(학교의 설치ㆍ운영) (생 제29조(학교의 설치ㆍ운영) ①\n략) (현행 제목 외의 부분과 같음)\n<신 설> ② 법무부장관은 소년원학교의\n교육과정 개발ㆍ편성 등과 관\n련하여 교육부장관에게 필요한\n지원을 요청할 수 있다.",
  "full_text": "보호소년 등의 처우에 관한 법률 일부개정법률안\n(박준태의원 대표발의)\n발의연월일 : 2024. 9. 25.\n의 안\n4265\n번 호 발 의 자 : 박준태ㆍ조지연ㆍ고동진\n구자근ㆍ김승수ㆍ조배숙\n김장겸ㆍ강승규ㆍ송석준\n안상훈ㆍ장동혁ㆍ곽규택\n김상욱ㆍ이헌승 의원\n(14인)\n제안이유 및 주요내용\n현행법은 보호소년의 재비행방지와 건전한 육성을 위해 전인적인\n성장ㆍ발달을 도모하고 사회생활에 원만하게 적응할 수 있도록 초ㆍ\n중등교육, 직업능력개발훈련, 인성교육 등을 규정하고 있음.\n그런데 소년원학교에서 이루어지고 있는 교육은 법무부에서 전반적\n으로 관리하고 있으나 교원 및 교육 기자재의 만성적인 부족 등 교육\n여건이 열악하여 교육과정이 제대로 운영되지 못하고 있으며 이는 소\n년범죄의 재범률을 높이는 이유 중 하나라는 지적이 있음.\n이에 소년원학교의 교육과정 개발ㆍ편성과 관련하여 법무부장관이\n교육부장관에게 필요한 지원을 요청할 수 있는 법적 근거를 마련하려\n는 것임(안 제29조).\n\n\n\n\n법률 제 호\n보호소년 등의 처우에 관한 법률 일부개정법률안\n보호소년 등의 처우에 관한 법률 일부를 다음과 같이 개정한다.\n제29조 제목 외의 부분을 제1항으로 하고, 같은 조에 제2항을 다음과\n같이 신설한다.\n② 법무부장관은 소년원학교의 교육과정 개발ㆍ편성 등과 관련하여\n교육부장관에게 필요한 지원을 요청할 수 있다.\n부 칙\n이 법은 공포 후 6개월이 경과한 날부터 시행한다.\n\n\n\n\n신ㆍ구조문대비표\n현 행 개 정 안\n제29조(학교의 설치ㆍ운영) (생 제29조(학교의 설치ㆍ운영) ①\n략) (현행 제목 외의 부분과 같음)\n<신 설> ② 법무부장관은 소년원학교의\n교육과정 개발ㆍ편성 등과 관\n련하여 교육부장관에게 필요한\n지원을 요청할 수 있다.\n",
  "sections": {
    "제안이유": "및",
    "주요내용": "현행법은 보호소년의 재비행방지와 건전한 육성을 위해 전인적인\n성장ㆍ발달을 도모하고 사회생활에 원만하게 적응할 수 있도록 초ㆍ\n중등교육, 직업능력개발훈련, 인성교육 등을 규정하고 있음.\n그런데 소년원학교에서 이루어지고 있는 교육은 법무부에서 전반적\n으로 관리하고 있으나 교원 및 교육 기자재의 만성적인 부족 등 교육\n여건이 열악하여 교육과정이 제대로 운영되지 못하고 있으며 이는 소\n년범죄의 재범률을 높이는 이유 중 하나라는 지적이 있음.\n이에 소년원학교의 교육과정 개발ㆍ편성과 관련하여 법무부장관이\n교육부장관에게 필요한 지원을 요청할 수 있는 법적 근거를 마련하려\n는 것임(안 제29조).",
    "제안이유_및_주요내용": "현행법은 보호소년의 재비행방지와 건전한 육성을 위해 전인적인\n성장ㆍ발달을 도모하고 사회생활에 원만하게 적응할 수 있도록 초ㆍ\n중등교육, 직업능력개발훈련, 인성교육 등을 규정하고 있음.\n그런데 소년원학교에서 이루어지고 있는 교육은 법무부에서 전반적\n으로 관리하고 있으나 교원 및 교육 기자재의 만성적인 부족 등 교육\n여건이 열악하여 교육과정이 제대로 운영되지 못하고 있으며 이는 소\n년범죄의 재범률을 높이는 이유 중 하나라는 지적이 있음.\n이에 소년원학교의 교육과정 개발ㆍ편성과 관련하여 법무부장관이\n교육부장관에게 필요한 지원을 요청할 수 있는 법적 근거를 마련하려\n는 것임(안 제29조).",
    "법률_제_호": "보호소년 등의 처우에 관한 법률 일부개정법률안\n보호소년 등의 처우에 관한 법률 일부를 다음과 같이 개정한다.\n제29조 제목 외의 부분을 제1항으로 하고, 같은 조에 제2항을 다음과\n같이 신설한다.\n② 법무부장관은 소년원학교의 교육과정 개발ㆍ편성 등과 관련하여\n교육부장관에게 필요한 지원을 요청할 수 있다.",
    "신구조문대비표": "현 행 개 정 안\n제29조(학교의 설치ㆍ운영) (생 제29조(학교의 설치ㆍ운영) ①\n략) (현행 제목 외의 부분과 같음)\n<신 설> ② 법무부장관은 소년원학교의\n교육과정 개발ㆍ편성 등과 관\n련하여 교육부장관에게 필요한\n지원을 요청할 수 있다."
  }
}