{
  "title": "2204572_형법_일부개정법률안",
  "bill_number": "4572",
  "proposal_date": "2024. 10. 4.",
  "submission_date": "",
  "is_alternative": false,
  "alternative_bill_numbers": [],
  "has_comparison_table": false,
  "comparison_table": "신·구조문대비표\n현 행 개 정 안\n第312條(告訴와 被害者의 意思) 제312조(고소) 제307조부터 제309\n① 第308條와 第311條의 罪는 조까지 및 제311조의 죄는 고\n告訴가 있어야 公訴를 제기할 소가 있어야 공소를 제기할 수\n수 있다. 있다.\n② 第307條와 第309條의 罪는\n被害者의 明示한 意思에 反하\n여 公訴를 제기할 수 없다.",
  "full_text": "형법 일부개정법률안\n(전현희의원 대표발의)\n발의연월일 : 2024. 10. 4.\n의 안\n4572\n번 호 발 의 자 : 전현희ㆍ한준호ㆍ박균택\n이정문ㆍ김승원ㆍ윤종군\n김민석ㆍ조승래ㆍ박홍배\n김영환ㆍ황정아ㆍ이기헌\n의원(12인)\n제안이유 및 주요내용\n최근 대통령실의 고발사주 의혹이 보도되며, 명예훼손죄가 제3자를\n통해 정치적 목적으로 활용된다는 지적이 있음.\n실제로 헌법이 보장하는 표현의 자유, 언론ㆍ출판의 자유를 심각하\n게 제한하고, 고소ㆍ고발 남발 등 명예훼손죄를 정치적ㆍ사회적으로\n악용하는 사례가 많이 발생하고 있음.\n이에 피해자도 아닌 자(또는 단체)가 정치적, 사회적 목적을 가지고\n명예훼손죄 고발을 남발하지 않도록, 명예훼손죄도 고소가 있어야 공\n소를 제기할 수 있도록 친고죄로 개정하고자 함(안 제312조).\n\n\n\n\n법률 제 호\n형법 일부개정법률안\n형법 일부를 다음과 같이 개정한다.\n제312조를 다음과 같이 한다.\n제312조(고소) 제307조부터 제309조까지 및 제311조의 죄는 고소가 있\n어야 공소를 제기할 수 있다.\n부 칙\n이 법은 공포한 날부터 시행한다.\n\n\n\n\n신·구조문대비표\n현 행 개 정 안\n第312條(告訴와 被害者의 意思) 제312조(고소) 제307조부터 제309\n① 第308條와 第311條의 罪는 조까지 및 제311조의 죄는 고\n告訴가 있어야 公訴를 제기할 소가 있어야 공소를 제기할 수\n수 있다. 있다.\n② 第307條와 第309條의 罪는\n被害者의 明示한 意思에 反하\n여 公訴를 제기할 수 없다.\n",
  "sections": {
    "제안이유": "및",
    "주요내용": "최근 대통령실의 고발사주 의혹이 보도되며, 명예훼손죄가 제3자를\n통해 정치적 목적으로 활용된다는 지적이 있음.\n실제로 헌법이 보장하는 표현의 자유, 언론ㆍ출판의 자유를 심각하\n게 제한하고, 고소ㆍ고발 남발 등 명예훼손죄를 정치적ㆍ사회적으로\n악용하는 사례가 많이 발생하고 있음.\n이에 피해자도 아닌 자(또는 단체)가 정치적, 사회적 목적을 가지고\n명예훼손죄 고발을 남발하지 않도록, 명예훼손죄도 고소가 있어야 공\n소를 제기할 수 있도록 친고죄로 개정하고자 함(안 제312조).",
    "제안이유_및_주요내용": "최근 대통령실의 고발사주 의혹이 보도되며, 명예훼손죄가 제3자를\n통해 정치적 목적으로 활용된다는 지적이 있음.\n실제로 헌법이 보장하는 표현의 자유, 언론ㆍ출판의 자유를 심각하\n게 제한하고, 고소ㆍ고발 남발 등 명예훼손죄를 정치적ㆍ사회적으로\n악용하는 사례가 많이 발생하고 있음.\n이에 피해자도 아닌 자(또는 단체)가 정치적, 사회적 목적을 가지고\n명예훼손죄 고발을 남발하지 않도록, 명예훼손죄도 고소가 있어야 공\n소를 제기할 수 있도록 친고죄로 개정하고자 함(안 제312조).",
    "법률_제_호": "형법 일부개정법률안\n형법 일부를 다음과 같이 개정한다.\n제312조를 다음과 같이 한다.\n제312조(고소) 제307조부터 제309조까지 및 제311조의 죄는 고소가 있\n어야 공소를 제기할 수 있다.",
    "신구조문대비표": "현 행 개 정 안\n第312條(告訴와 被害者의 意思) 제312조(고소) 제307조부터 제309\n① 第308條와 第311條의 罪는 조까지 및 제311조의 죄는 고\n告訴가 있어야 公訴를 제기할 소가 있어야 공소를 제기할 수\n수 있다. 있다.\n② 第307條와 第309條의 罪는\n被害者의 明示한 意思에 反하\n여 公訴를 제기할 수 없다."
  }
}