{
  "title": "2204705_5·18민주유공자예우_및_단체설립에_관한_법률_일부개정법률안",
  "bill_number": "4705",
  "proposal_date": "2024. 10. 16.",
  "submission_date": "",
  "is_alternative": false,
  "alternative_bill_numbers": [],
  "has_comparison_table": false,
  "comparison_table": "신ㆍ구조문대비표\n현 행 개 정 안\n제97조(위임 및 위탁) ① (생 략) 제97조(위임 및 위탁) ① (현행과\n같음)\n<신 설> ② 국가보훈부장관은 대통령령\n으로 정하는 바에 따라 제37조\n의2제1항에 따른 심리재활서비\n스 사업에 관한 업무를 공단에\n위탁할 수 있다.\n② (생 략) ③ (현행 제2항과 같음)",
  "full_text": "5ㆍ18민주유공자예우 및 단체설립에 관한 법률\n일부개정법률안\n(최은석의원 대표발의)\n발의연월일 : 2024. 10. 16.\n의 안\n4705\n번 호 발 의 자 : 최은석ㆍ우재준ㆍ고동진\n이인선ㆍ이달희ㆍ박충권\n정동만ㆍ서일준ㆍ김종양\n박덕흠 의원(10인)\n제안이유 및 주요내용\n현재 현행법 제37조의2에 따라 국가보훈부는 각 보훈관서를 통해\n심리재활서비스를 수행하고 있음. 지난 2021년 실태조사에 따르면 보\n훈대상자 3명 중 1명(약 28만명)이 정신 건강의 어려움을 호소하고 있\n음. 우울척도 검사 결과 46.5%가 우울 위험군에 해당하고, 고위험군도\n25%를 차지하는 것으로 나타남. 일반 국민에 비해 약 3배 이상 우울\n감을 호소하고 있는 것으로 보임. 특히, 전쟁이나 부상을 겪은 보훈대\n상자일수록 정신 건강에 취약한 것으로 나타남.\n그럼에도 불구하고, 현행 심리재활서비스는 보훈관서에서 제공됨에\n따라 정신 건강 증진 시설로의 진료 연계 등에서 어려움을 겪고 있고,\n중증대상자에 대해 의료(치료) 연계를 통한 종합적 정신건강 관리 수\n요가 늘어나고 있음.\n이에 국가보훈부에서 시행 중인 심리재활서비스가 치료와 연계되기\n\n\n\n어려운 한계가 있어 심리상담과 의료를 연계하는 등 체계적이고 수준\n높은 심리재활서비스를 5ㆍ18민주유공자 및 유가족에게 제공하기 위\n하여 심리재활서비스 사업을 한국보훈복지의료공단에 위탁할 수 있도\n록 하여 5ㆍ18민주유공자 및 유가족에 대한 지원을 강화하려는 것임\n(안 제97조제2항 신설).\n\n법률 제 호\n5ㆍ18민주유공자예우 및 단체설립에 관한 법률\n일부개정법률안\n5ㆍ18민주유공자예우 및 단체설립에 관한 법률 일부를 다음과 같이\n개정한다.\n제97조제2항을 제3항으로 하고, 같은 조에 제2항을 다음과 같이 신설\n한다.\n② 국가보훈부장관은 대통령령으로 정하는 바에 따라 제37조의2제1\n항에 따른 심리재활서비스 사업에 관한 업무를 공단에 위탁할 수\n있다.\n부 칙\n이 법은 공포 후 6개월이 경과한 날부터 시행한다.\n\n\n\n\n신ㆍ구조문대비표\n현 행 개 정 안\n제97조(위임 및 위탁) ① (생 략) 제97조(위임 및 위탁) ① (현행과\n같음)\n<신 설> ② 국가보훈부장관은 대통령령\n으로 정하는 바에 따라 제37조\n의2제1항에 따른 심리재활서비\n스 사업에 관한 업무를 공단에\n위탁할 수 있다.\n② (생 략) ③ (현행 제2항과 같음)\n",
  "sections": {
    "제안이유": "및",
    "주요내용": "현재 현행법 제37조의2에 따라 국가보훈부는 각 보훈관서를 통해\n심리재활서비스를 수행하고 있음. 지난 2021년 실태조사에 따르면 보\n훈대상자 3명 중 1명(약 28만명)이 정신 건강의 어려움을 호소하고 있\n음. 우울척도 검사 결과 46.5%가 우울 위험군에 해당하고, 고위험군도\n25%를 차지하는 것으로 나타남. 일반 국민에 비해 약 3배 이상 우울\n감을 호소하고 있는 것으로 보임. 특히, 전쟁이나 부상을 겪은 보훈대\n상자일수록 정신 건강에 취약한 것으로 나타남.\n그럼에도 불구하고, 현행 심리재활서비스는 보훈관서에서 제공됨에\n따라 정신 건강 증진 시설로의 진료 연계 등에서 어려움을 겪고 있고,\n중증대상자에 대해 의료(치료) 연계를 통한 종합적 정신건강 관리 수\n요가 늘어나고 있음.\n이에 국가보훈부에서 시행 중인 심리재활서비스가 치료와 연계되기\n\n\n\n어려운 한계가 있어 심리상담과 의료를 연계하는 등 체계적이고 수준\n높은 심리재활서비스를 5ㆍ18민주유공자 및 유가족에게 제공하기 위\n하여 심리재활서비스 사업을 한국보훈복지의료공단에 위탁할 수 있도\n록 하여 5ㆍ18민주유공자 및 유가족에 대한 지원을 강화하려는 것임\n(안 제97조제2항 신설).",
    "제안이유_및_주요내용": "현재 현행법 제37조의2에 따라 국가보훈부는 각 보훈관서를 통해\n심리재활서비스를 수행하고 있음. 지난 2021년 실태조사에 따르면 보\n훈대상자 3명 중 1명(약 28만명)이 정신 건강의 어려움을 호소하고 있\n음. 우울척도 검사 결과 46.5%가 우울 위험군에 해당하고, 고위험군도\n25%를 차지하는 것으로 나타남. 일반 국민에 비해 약 3배 이상 우울\n감을 호소하고 있는 것으로 보임. 특히, 전쟁이나 부상을 겪은 보훈대\n상자일수록 정신 건강에 취약한 것으로 나타남.\n그럼에도 불구하고, 현행 심리재활서비스는 보훈관서에서 제공됨에\n따라 정신 건강 증진 시설로의 진료 연계 등에서 어려움을 겪고 있고,\n중증대상자에 대해 의료(치료) 연계를 통한 종합적 정신건강 관리 수\n요가 늘어나고 있음.\n이에 국가보훈부에서 시행 중인 심리재활서비스가 치료와 연계되기\n\n\n\n어려운 한계가 있어 심리상담과 의료를 연계하는 등 체계적이고 수준\n높은 심리재활서비스를 5ㆍ18민주유공자 및 유가족에게 제공하기 위\n하여 심리재활서비스 사업을 한국보훈복지의료공단에 위탁할 수 있도\n록 하여 5ㆍ18민주유공자 및 유가족에 대한 지원을 강화하려는 것임\n(안 제97조제2항 신설).",
    "법률_제_호": "5ㆍ18민주유공자예우 및 단체설립에 관한 법률\n일부개정법률안\n5ㆍ18민주유공자예우 및 단체설립에 관한 법률 일부를 다음과 같이\n개정한다.\n제97조제2항을 제3항으로 하고, 같은 조에 제2항을 다음과 같이 신설\n한다.\n② 국가보훈부장관은 대통령령으로 정하는 바에 따라 제37조의2제1\n항에 따른 심리재활서비스 사업에 관한 업무를 공단에 위탁할 수\n있다.",
    "신구조문대비표": "현 행 개 정 안\n제97조(위임 및 위탁) ① (생 략) 제97조(위임 및 위탁) ① (현행과\n같음)\n<신 설> ② 국가보훈부장관은 대통령령\n으로 정하는 바에 따라 제37조\n의2제1항에 따른 심리재활서비\n스 사업에 관한 업무를 공단에\n위탁할 수 있다.\n② (생 략) ③ (현행 제2항과 같음)"
  }
}