{
  "title": "2204259_농업협동조합법_일부개정법률안",
  "bill_number": "4259",
  "proposal_date": "2024. 9. 24.",
  "submission_date": "",
  "is_alternative": false,
  "alternative_bill_numbers": [],
  "has_comparison_table": false,
  "comparison_table": "신ㆍ구조문대비표\n현 행 개 정 안\n법률 제10522호 농업협동조합법 법률 제10522호 농업협동조합법\n일부개정법률 ",
  "full_text": "농업협동조합법 일부개정법률안\n(이양수의원 대표발의)\n발의연월일 : 2024. 9. 24.\n의 안\n4259\n번 호 발 의 자 : 이양수ㆍ이상휘ㆍ서천호\n어기구ㆍ박준태ㆍ김선교\n조지연ㆍ이병진ㆍ정점식\n박덕흠ㆍ장동혁ㆍ김영환\n이만희ㆍ박충권ㆍ박상웅\n조경태ㆍ박정훈ㆍ김소희\n임호선ㆍ이헌승ㆍ성일종\n이개호ㆍ서영교ㆍ허성무\n서일준 의원(25인)\n제안이유 및 주요내용\n현행법은 법률 제10522호 농업협동조합법 일부개정법률 부칙 제15\n조제3항 본문에서 조합에 대하여 은행 등 다른 금융기관보험대리점에\n적용되는 방카슈랑스 규제 중 일부의 적용을 배제하되, 같은 항 단서\n에서 최근 사업연도 말 현재 자산총액이 2조원 이상인 조합이 모집할\n수 있는 1개 농협생명보험 또는 농협손해보험 상품의 모집액이 각각\n해당 조합이 신규로 모집하는 생명보험회사 상품의 모집총액 또는 손\n해보험회사 상품의 모집총액 중 일정 비율을 초과할 수 없도록 하는\n제한을 두고 있음(현재는 100분의 25가 적용되고 있음).\n이러한 자산총액 2조원 이상이라는 규제 기준은 「농업협동조합\n\n\n\n법」이 2011. 3. 31. 법률 제10522호로 일부개정될 당시 시행 중이던\n「보험업법 시행령」 제40조제6항의 금융기관보험대리점등에 관한 특\n정보험사 판매비중 제한 규제 기준(2005. 3. 31. 대통령령 제18761호로\n일부 개정된 「보험업법 시행령」에서 최초 도입)을 그대로 차용한 것\n임.\n그런데 자산총액을 기준으로 규제하는 다른 법률, 예컨대 「독점규\n제 및 공정거래에 관한 법률」은 상호출자제한기업집단 기준을 2016\n년에는 자산총액 5조원에서 10조원으로 개정하였고, 그 후 2021년\n말에는 ‘국내총생산액의 1천분의 5에 해당하는 금액’으로 상향 조정하\n여 국가경제 규모 및 규제 환경 변화 등 새로운 시대 상황을 반영하\n고 있는 반면, 현행법은 자산총액 2조원 이상 기준을 10년 이상 그대\n로 유지하고 있음.\n한편, 그동안 중소도시 및 농촌지역 조합의 지속적인 성장으로 자산\n총액 2조원 이상인 조합은 2012. 3. 기준 1개에 불과하였으나, 올해\n는 22개로 늘어났으며, 한국농촌경제연구원(KREI) 연구결과에 따르면\n2035년 말에는 위 규제를 적용받는 조합 수가 136개로 크게 늘어날\n것으로 예상되고 있어, 「보험업법 시행령」상 자산총액 2조원 이상\n기준을 조합에도 동일하게 적용하는 것은 불합리한 측면이 있음.\n이에 규제 기준인 자산총액 2조원 이상을 자산총액 5조원 이상으로\n상향 조정함으로써, 변화된 경제 여건 및 다른 금융기관보험대리점과\n사업목적ㆍ내용ㆍ규모 등이 본질적으로 다른 조합의 특수성을 충분히\n\n반영하여 규제의 합리성을 제고하려는 것임(안 법률 제10522호 농업협\n동조합법 일부개정법률 부칙 제15조제3항 각 호 외의 부분 단서).\n\n\n\n\n법률 제 호\n농업협동조합법 일부개정법률안\n농업협동조합법 일부를 다음과 같이 개정한다.\n법률 제10522호 농업협동조합법 일부개정법률 부칙(법률 제18020호 농\n업협동조합법 일부개정법률에 따라 개정된 내용을 포함한다) 제15조제\n3항 각 호 외의 부분 단서 중 “2조원”을 “5조원”으로 한다.\n부 칙\n이 법은 공포한 날부터 시행한다.\n\n\n\n\n신ㆍ구조문대비표\n현 행 개 정 안\n법률 제10522호 농업협동조합법 법률 제10522호 농업협동조합법\n일부개정법률 부칙 일부개정법률 부칙\n제15조(「보험업법」 적용에 관 제15조(「보험업법」 적용에 관\n한 특례) ①ㆍ② (생 략) 한 특례) ①ㆍ② (현행과 같음)\n③ 조합은 농협생명보험 또는 ③ -------------------------\n농협손해보험을 위하여 보험계 ----------------------------\n약 체결을 대리하는 경우에 한 ----------------------------\n정하여 농협생명보험 또는 농 ----------------------------\n협손해보험이 설립된 날부터 2 ----------------------------\n027년 3월 1일까지 「보험업 ----------------------------\n법」 제91조제2항ㆍ제3항 및 ----------------------------\n제100조제1항제4호를 적용하지 --------------------------\n아니한다. 다만, 최근 사업연도 ------. -------------------\n말 현재 자산총액이 2조원 이 ------------------5조원---\n상인 조합이 모집할 수 있는 1 --------------------------\n개 농협생명보험 또는 농협손 --------------------------\n해보험 상품의 모집액은 각각 --------------------------\n해당 조합이 신규로 모집하는 --------------------------\n생명보험회사 상품의 모집총액 --------------------------\n또는 손해보험회사 상품의 모 --------------------------\n집총액 중 다음 각 호의 비율 --------------------------\n을 초과할 수 없다. ----------------.\n1. ∼ 6. (생 략) 1. ∼ 6. (현행과 같음)\n\n\n\n④ ∼ ⑩ (생 략) ④ ∼ ⑩ (현행과 같음)",
  "sections": {
    "제안이유": "및",
    "주요내용": "현행법은",
    "제안이유_및_주요내용": "현행법은",
    "법률_제_호": "농업협동조합법 일부개정법률",
    "신구조문대비표": "현 행 개 정 안\n법률 제10522호 농업협동조합법 법률 제10522호 농업협동조합법\n일부개정법률"
  }
}