{
  "title": "2204456_독점규제_및_공정거래에_관한_법률_일부개정법률안",
  "bill_number": "4456",
  "proposal_date": "2024. 9. 30",
  "submission_date": "",
  "is_alternative": false,
  "alternative_bill_numbers": [],
  "has_comparison_table": false,
  "comparison_table": "신·구조문대비표\n현 행 개 정 안\n제100조(불복의 소의 전속관할) <삭 제>\n제99조에 따른 불복의 소는 서\n울고등법원을 전속관할로 한다.",
  "full_text": "독점규제 및 공정거래에 관한 법률 일부개정법률안\n(박형수의원 대표발의)\n발의연월일 : 2024. 9. 30\n의 안\n4456\n번 호 발 의 자 : 박형수ㆍ엄태영ㆍ구자근\n정동만ㆍ신성범ㆍ주진우\n조정훈ㆍ임종득ㆍ이종배\n김상욱 의원(10인)\n제안이유 및 주요내용\n현행법은 공정거래위원회의 시정조치, 과징금부과명령 등 처분에 대\n하여 불복하는 경우 서울고등법원에 제소할 수 있도록 하여 공정거래\n위원회의 처분을 사실상 1심 판결로 인정하고 있음.\n그러나 대법원의 경우 법률심으로 사실관계를 판단하는 절차가 한\n번에 불과하여 당사자의 재판받을 권리를 침해할 뿐만 아니라, 점점\n복잡해지는 공정거래 사건에 대한 정확한 판결을 어렵게 할 우려가\n있음.\n또한 공정거래위원회가 조사기관이자 심판기관으로 기능하면서 당\n사자의 경우 추가 불이익을 우려하여 공정위 전원회의에서 적극적으\n로 이의를 제기하지 못하는 등 방어권 행사가 어려울 뿐만 아니라, 법\n원 심리에 비해 당사자의 절차권 보장이 제한되는 실정임.\n이에 공정거래위원회의 처분에 대한 불복을 서울고등법원의 전속관\n\n\n\n할로 규정한 조항을 삭제하여 3심제 운영이 가능하도록 함으로써 국\n민의 재판받을 권리와 방어권을 보장하려는 것임(안 제100조 삭제).\n\n법률 제 호\n독점규제 및 공정거래에 관한 법률 일부개정법률안\n독점규제 및 공정거래에 관한 법률 일부를 다음과 같이 개정한다.\n제100조를 삭제한다.\n부 칙\n제1조(시행일) 이 법은 공포한 날부터 시행한다.\n제2조(재판관할에 관한 적용례) 제100조의 개정규정은 이 법 시행 이\n후 최초로 소를 제기하는 경우부터 적용한다.\n\n\n\n\n신·구조문대비표\n현 행 개 정 안\n제100조(불복의 소의 전속관할) <삭 제>\n제99조에 따른 불복의 소는 서\n울고등법원을 전속관할로 한다.\n",
  "sections": {
    "제안이유": "및",
    "주요내용": "현행법은 공정거래위원회의 시정조치, 과징금부과명령 등 처분에 대\n하여 불복하는 경우 서울고등법원에 제소할 수 있도록 하여 공정거래\n위원회의 처분을 사실상 1심 판결로 인정하고 있음.\n그러나 대법원의 경우 법률심으로 사실관계를 판단하는 절차가 한\n번에 불과하여 당사자의 재판받을 권리를 침해할 뿐만 아니라, 점점\n복잡해지는 공정거래 사건에 대한 정확한 판결을 어렵게 할 우려가\n있음.\n또한 공정거래위원회가 조사기관이자 심판기관으로 기능하면서 당\n사자의 경우 추가 불이익을 우려하여 공정위 전원회의에서 적극적으\n로 이의를 제기하지 못하는 등 방어권 행사가 어려울 뿐만 아니라, 법\n원 심리에 비해 당사자의 절차권 보장이 제한되는 실정임.\n이에 공정거래위원회의 처분에 대한 불복을 서울고등법원의 전속관\n\n\n\n할로 규정한 조항을 삭제하여 3심제 운영이 가능하도록 함으로써 국\n민의 재판받을 권리와 방어권을 보장하려는 것임(안 제100조 삭제).",
    "제안이유_및_주요내용": "현행법은 공정거래위원회의 시정조치, 과징금부과명령 등 처분에 대\n하여 불복하는 경우 서울고등법원에 제소할 수 있도록 하여 공정거래\n위원회의 처분을 사실상 1심 판결로 인정하고 있음.\n그러나 대법원의 경우 법률심으로 사실관계를 판단하는 절차가 한\n번에 불과하여 당사자의 재판받을 권리를 침해할 뿐만 아니라, 점점\n복잡해지는 공정거래 사건에 대한 정확한 판결을 어렵게 할 우려가\n있음.\n또한 공정거래위원회가 조사기관이자 심판기관으로 기능하면서 당\n사자의 경우 추가 불이익을 우려하여 공정위 전원회의에서 적극적으\n로 이의를 제기하지 못하는 등 방어권 행사가 어려울 뿐만 아니라, 법\n원 심리에 비해 당사자의 절차권 보장이 제한되는 실정임.\n이에 공정거래위원회의 처분에 대한 불복을 서울고등법원의 전속관\n\n\n\n할로 규정한 조항을 삭제하여 3심제 운영이 가능하도록 함으로써 국\n민의 재판받을 권리와 방어권을 보장하려는 것임(안 제100조 삭제).",
    "법률_제_호": "독점규제 및 공정거래에 관한 법률 일부개정법률안\n독점규제 및 공정거래에 관한 법률 일부를 다음과 같이 개정한다.\n제100조를 삭제한다.",
    "신구조문대비표": "현 행 개 정 안\n제100조(불복의 소의 전속관할) <삭 제>\n제99조에 따른 불복의 소는 서\n울고등법원을 전속관할로 한다."
  }
}