{
  "title": "2204466_노인복지법_일부개정법률안",
  "bill_number": "4466",
  "proposal_date": "2024. 9. 30.",
  "submission_date": "",
  "is_alternative": false,
  "alternative_bill_numbers": [],
  "has_comparison_table": false,
  "comparison_table": "신ㆍ구조문대비표\n현 행 개 정 안\n第26條(敬老優待) ① (생 략) 第26條(敬老優待) ① (현행과 같\n음)\n<신 설> ② 국가는 제1항에 따라 노인\n의 운임을 감면하는 운송사업\n자에 대하여 대통령령으로 정\n하는 바에 따라 그 비용을 지\n원한다.\n②ㆍ③ (생 략) ③ㆍ④ (현행 제2항 및 제3항\n과 같음)",
  "full_text": "노인복지법 일부개정법률안\n(이헌승의원 대표발의)\n발의연월일 : 2024. 9. 30.\n의 안\n4466\n번 호 발 의 자 : 이헌승ㆍ김선교ㆍ김도읍\n강선영ㆍ서일준ㆍ서지영\n김승수ㆍ박덕흠ㆍ고동진\n유영하ㆍ정성국ㆍ윤상현\n의원(12인)\n제안이유\n현행 「노인복지법」은 65세 이상 노인에게 국가나 지방자치단체의\n수송시설을 무료로 이용할 수 있도록 하고 있으며, 이에 따라 2015년\n각 지자체 소속 도시철도운영기관에서 65세 이상 노인 무임수송에 소\n요된 비용은 3,927억원에 이르고 있음.\n노인 무임수송은 국가 복지정책의 일환으로 국가가 비용부담에 대\n한 책임이 있음에도 불구하고, 도시철도운영기관에 대한 국가의 지원\n은 전혀 이루어지지 않고 있음. 반면, 한국철도공사는 관련법에 따라\n철도 무임수송 비용을 국가로부터 지원받고 있어 형평성 문제가 제기\n되고 있음.\n특히, 고령사회가 도래되면서 무임수송 비용이 급증하고 그에 따른\n도시철도의 비용부담이 가중되는 점을 감안하면 승객안전, 교통약자\n편의시설 증진 등 도시철도 서비스 향상을 위한 투자축소가 현실화\n\n\n\n되고 있는 실정임.\n이에 노인복지증진 차원에서 노인의 무임수송 비용을 국가가 지원\n하도록 근거조항을 마련하고자 함.\n주요내용\n65세 이상 노인 무임수송 비용을 국가가 지원하도록 함(안 제26조).\n\n법률 제 호\n노인복지법 일부개정법률안\n노인복지법 일부를 다음과 같이 개정한다.\n제26조제2항 및 제3항을 각각 제3항 및 제4항으로 하고, 같은 조에 제\n2항을 다음과 같이 신설한다.\n② 국가는 제1항에 따라 노인의 운임을 감면하는 운송사업자에 대\n하여 대통령령으로 정하는 바에 따라 그 비용을 지원한다.\n부 칙\n이 법은 공포 후 3개월이 경과한 날부터 시행한다.\n\n\n\n\n신ㆍ구조문대비표\n현 행 개 정 안\n第26條(敬老優待) ① (생 략) 第26條(敬老優待) ① (현행과 같\n음)\n<신 설> ② 국가는 제1항에 따라 노인\n의 운임을 감면하는 운송사업\n자에 대하여 대통령령으로 정\n하는 바에 따라 그 비용을 지\n원한다.\n②ㆍ③ (생 략) ③ㆍ④ (현행 제2항 및 제3항\n과 같음)\n",
  "sections": {
    "제안이유": "현행 「노인복지법」은 65세 이상 노인에게 국가나 지방자치단체의\n수송시설을 무료로 이용할 수 있도록 하고 있으며, 이에 따라 2015년\n각 지자체 소속 도시철도운영기관에서 65세 이상 노인 무임수송에 소\n요된 비용은 3,927억원에 이르고 있음.\n노인 무임수송은 국가 복지정책의 일환으로 국가가 비용부담에 대\n한 책임이 있음에도 불구하고, 도시철도운영기관에 대한 국가의 지원\n은 전혀 이루어지지 않고 있음. 반면, 한국철도공사는 관련법에 따라\n철도 무임수송 비용을 국가로부터 지원받고 있어 형평성 문제가 제기\n되고 있음.\n특히, 고령사회가 도래되면서 무임수송 비용이 급증하고 그에 따른\n도시철도의 비용부담이 가중되는 점을 감안하면 승객안전, 교통약자\n편의시설 증진 등 도시철도 서비스 향상을 위한 투자축소가 현실화\n\n\n\n되고 있는 실정임.\n이에 노인복지증진 차원에서 노인의 무임수송 비용을 국가가 지원\n하도록 근거조항을 마련하고자 함.",
    "주요내용": "65세 이상 노인 무임수송 비용을 국가가 지원하도록 함(안 제26조).",
    "법률_제_호": "노인복지법 일부개정법률안\n노인복지법 일부를 다음과 같이 개정한다.\n제26조제2항 및 제3항을 각각 제3항 및 제4항으로 하고, 같은 조에 제\n2항을 다음과 같이 신설한다.\n② 국가는 제1항에 따라 노인의 운임을 감면하는 운송사업자에 대\n하여 대통령령으로 정하는 바에 따라 그 비용을 지원한다.",
    "신구조문대비표": "현 행 개 정 안\n第26條(敬老優待) ① (생 략) 第26條(敬老優待) ① (현행과 같\n음)\n<신 설> ② 국가는 제1항에 따라 노인\n의 운임을 감면하는 운송사업\n자에 대하여 대통령령으로 정\n하는 바에 따라 그 비용을 지\n원한다.\n②ㆍ③ (생 략) ③ㆍ④ (현행 제2항 및 제3항\n과 같음)"
  }
}