{
  "title": "2204757_형사소송법_일부개정법률안",
  "bill_number": "4757",
  "proposal_date": "2024. 10. 17.",
  "submission_date": "",
  "is_alternative": false,
  "alternative_bill_numbers": [],
  "has_comparison_table": false,
  "comparison_table": "신ㆍ구조문대비표\n현 행 개 정 안\n第249條(公訴時效의 期間) ① ㆍ 제249조(공소시효의 기간) ① ㆍ\n② (생 략) ② (현행과 같음)\n<신 설> ③ 제1항에도 불구하고 「자본\n시장과 금융투자업에 관한 법\n률」 제443조에 따른 범죄의\n공소시효는 30년의 경과로 완\n성된다.",
  "full_text": "형사소송법 일부개정법률안\n(오기형의원 대표발의)\n발의연월일 : 2024. 10. 17.\n의 안\n4757\n번 호 발 의 자 : 오기형ㆍ복기왕ㆍ김남근\n임미애ㆍ박수현ㆍ문금주\n이광희ㆍ염태영ㆍ김영환\n박홍배ㆍ김영배ㆍ정성호\n의원(12인)\n제안이유 및 주요내용\n우리나라 상장회사의 주식가치는 유사 외국 상장회사의 경우에 비\n해 낮게 형성되는 것으로 알려져 있음. 이러한 현상을 두고 ‘코리아\n디스카운트(Korea discount)’라는 말까지 사용되고 있음.\n코리아 디스카운트 해소를 위한 여러 방안 중 하나로, 투명한 시장\n환경 조성이 필요하다는 주장이 있음. 자본시장의 가격기능이 원활히\n작동할 수 있도록 주가조작 등 불공정거래를 엄단하자는 것임.\n이에 자본시장법상 불공정거래행위의 공소시효를 현행 10년에서 다\n른 범죄와 달리 30년으로 확대하여, 수사기관이 알지 못하거나 미처\n수사하지 못하여 형사처벌에 이르지 못하는 일이 없도록 함으로써, 투\n명한 시장환경을 조성하고자 함(안 제249조제3항 신설).\n\n\n\n\n법률 제 호\n형사소송법 일부개정법률안\n형사소송법 일부를 다음과 같이 개정한다.\n제249조의 조 번호 및 제목을 다음과 같이 하고, 같은 조에 제3항을\n다음과 같이 신설한다.\n제249조(공소시효의 기간)\n③ 제1항에도 불구하고 「자본시장과 금융투자업에 관한 법률」 제\n443조에 따른 범죄의 공소시효는 30년의 경과로 완성된다.\n부 칙\n제1조(시행일) 이 법은 공포한 날부터 시행한다.\n제2조(공소시효에 관한 적용례) 제249조제3항의 개정규정은 이 법 시\n행 전에 행하여진 범죄로서 아직 공소시효가 완성되지 아니한 것에\n대하여도 적용한다.\n\n\n\n\n신ㆍ구조문대비표\n현 행 개 정 안\n第249條(公訴時效의 期間) ① ㆍ 제249조(공소시효의 기간) ① ㆍ\n② (생 략) ② (현행과 같음)\n<신 설> ③ 제1항에도 불구하고 「자본\n시장과 금융투자업에 관한 법\n률」 제443조에 따른 범죄의\n공소시효는 30년의 경과로 완\n성된다.\n",
  "sections": {
    "제안이유": "및",
    "주요내용": "우리나라 상장회사의 주식가치는 유사 외국 상장회사의 경우에 비\n해 낮게 형성되는 것으로 알려져 있음. 이러한 현상을 두고 ‘코리아\n디스카운트(Korea discount)’라는 말까지 사용되고 있음.\n코리아 디스카운트 해소를 위한 여러 방안 중 하나로, 투명한 시장\n환경 조성이 필요하다는 주장이 있음. 자본시장의 가격기능이 원활히\n작동할 수 있도록 주가조작 등 불공정거래를 엄단하자는 것임.\n이에 자본시장법상 불공정거래행위의 공소시효를 현행 10년에서 다\n른 범죄와 달리 30년으로 확대하여, 수사기관이 알지 못하거나 미처\n수사하지 못하여 형사처벌에 이르지 못하는 일이 없도록 함으로써, 투\n명한 시장환경을 조성하고자 함(안 제249조제3항 신설).",
    "제안이유_및_주요내용": "우리나라 상장회사의 주식가치는 유사 외국 상장회사의 경우에 비\n해 낮게 형성되는 것으로 알려져 있음. 이러한 현상을 두고 ‘코리아\n디스카운트(Korea discount)’라는 말까지 사용되고 있음.\n코리아 디스카운트 해소를 위한 여러 방안 중 하나로, 투명한 시장\n환경 조성이 필요하다는 주장이 있음. 자본시장의 가격기능이 원활히\n작동할 수 있도록 주가조작 등 불공정거래를 엄단하자는 것임.\n이에 자본시장법상 불공정거래행위의 공소시효를 현행 10년에서 다\n른 범죄와 달리 30년으로 확대하여, 수사기관이 알지 못하거나 미처\n수사하지 못하여 형사처벌에 이르지 못하는 일이 없도록 함으로써, 투\n명한 시장환경을 조성하고자 함(안 제249조제3항 신설).",
    "법률_제_호": "형사소송법 일부개정법률안\n형사소송법 일부를 다음과 같이 개정한다.\n제249조의 조 번호 및 제목을 다음과 같이 하고, 같은 조에 제3항을\n다음과 같이 신설한다.\n제249조(공소시효의 기간)\n③ 제1항에도 불구하고 「자본시장과 금융투자업에 관한 법률」 제\n443조에 따른 범죄의 공소시효는 30년의 경과로 완성된다.",
    "신구조문대비표": "현 행 개 정 안\n第249條(公訴時效의 期間) ① ㆍ 제249조(공소시효의 기간) ① ㆍ\n② (생 략) ② (현행과 같음)\n<신 설> ③ 제1항에도 불구하고 「자본\n시장과 금융투자업에 관한 법\n률」 제443조에 따른 범죄의\n공소시효는 30년의 경과로 완\n성된다."
  }
}