{
  "title": "2204523_하천편입토지_보상_등에_관한_특별조치법_일부개정법률안",
  "bill_number": "4523",
  "proposal_date": "2024. 10. 4.",
  "submission_date": "",
  "is_alternative": false,
  "alternative_bill_numbers": [],
  "has_comparison_table": false,
  "comparison_table": "신·구조문대비표\n현 행 개 정 안\n제3조(보상청구권의 소멸시효) 제 제3조(보상청구권의 소멸시효) --\n2조에 따른 보상청구권의 소멸 ----------------------------\n시효는 2023년 12월 31일에 만 -------2033년---------------\n료된다. ------.",
  "full_text": "하천편입토지 보상 등에 관한 특별조치법 일부개정법률안\n(김위상의원 대표발의)\n발의연월일 : 2024. 10. 4.\n의 안\n4523\n번 호 발 의 자 : 김위상ㆍ김 건ㆍ김기웅\n임종득ㆍ정성국ㆍ우재준\n유용원ㆍ조경태ㆍ이철규\n강대식 의원(10인)\n제안이유 및 주요내용\n1971. 1. 19. 전부개정된 법률 제2292호 「하천법」에 따라 사유토\n지인 유수지(遊水池) 및 제외지(堤外地, 제방으로부터 하천측의 토지)\n가 ‘하천은 국유로 한다’는 하천구역 법정주의에 포함됨에 따라 등기\n상 소유권에 관계없이 국유로 된 바 있음.\n이로 인해 하천구역으로 편입된 사유토지에 대한 소유권 보상요구\n가 발생하여 하천구역 편입토지에 대하여 수회에 걸쳐 보상이 실시된\n바, 현재 진행 중인 보상 절차는 현행법상 보상청구권의 소멸시효인 2\n023년 12월 31일까지 청구된 분에 한정하고 있음.\n그러나 여전히 미보상 토지가 존재하고 이에 대한 소유권 보상요구\n가 계속해서 발생하고 있는 실정임. 또한 그 동안 동일한 사유로 시\n효를 연장해 온 점과 이미 보상을 받은 토지 소유자와의 형평성 등을\n고려하여 하천편입토지에 대한 보상청구권의 소멸시효 기간을 2033년\n\n\n\n12월 31일까지 연장하여 위와 같은 토지를 보상할 수 있도록 함으로\n써 하천편입토지 소유자에 대한 재산상 권익을 보호하려는 것임(안 제\n3조).\n\n법률 제 호\n하천편입토지 보상 등에 관한 특별조치법 일부개정법률안\n하천편입토지 보상 등에 관한 특별조치법 일부를 다음과 같이 개정한\n다.\n제3조 중 “2023년”을 “2033년”으로 한다.\n부 칙\n제1조(시행일) 이 법은 공포 후 3개월이 경과한 날부터 시행한다.\n제2조(보상대상토지에 관한 경과조치) 이 법 시행 당시 제2조에 따른\n토지와 관련된 보상금청구소송이 법원에 계속 중이거나 이미 보상\n대상이 아니라는 확정판결을 받은 하천편입토지에 대해서도 제2조\n에 따른 보상대상토지로 본다.\n\n\n\n\n신·구조문대비표\n현 행 개 정 안\n제3조(보상청구권의 소멸시효) 제 제3조(보상청구권의 소멸시효) --\n2조에 따른 보상청구권의 소멸 ----------------------------\n시효는 2023년 12월 31일에 만 -------2033년---------------\n료된다. ------.\n",
  "sections": {
    "제안이유": "및",
    "주요내용": "1971. 1. 19. 전부개정된",
    "제안이유_및_주요내용": "1971. 1. 19. 전부개정된",
    "법률_제_호": "「하천법」에 따라 사유토\n지인 유수지(遊水池) 및 제외지(堤外地, 제방으로부터 하천측의 토지)\n가 ‘하천은 국유로 한다’는 하천구역 법정주의에 포함됨에 따라 등기\n상 소유권에 관계없이 국유로 된 바 있음.\n이로 인해 하천구역으로 편입된 사유토지에 대한 소유권 보상요구\n가 발생하여 하천구역 편입토지에 대하여 수회에 걸쳐 보상이 실시된\n바, 현재 진행 중인 보상 절차는 현행법상 보상청구권의 소멸시효인 2\n023년 12월 31일까지 청구된 분에 한정하고 있음.\n그러나 여전히 미보상 토지가 존재하고 이에 대한 소유권 보상요구\n가 계속해서 발생하고 있는 실정임. 또한 그 동안 동일한 사유로 시\n효를 연장해 온 점과 이미 보상을 받은 토지 소유자와의 형평성 등을\n고려하여 하천편입토지에 대한 보상청구권의 소멸시효 기간을 2033년\n\n\n\n12월 31일까지 연장하여 위와 같은 토지를 보상할 수 있도록 함으로\n써 하천편입토지 소유자에 대한 재산상 권익을 보호하려는 것임(안 제\n3조).\n\n법률 제 호\n하천편입토지 보상 등에 관한 특별조치법 일부개정법률안\n하천편입토지 보상 등에 관한 특별조치법 일부를 다음과 같이 개정한\n다.\n제3조 중 “2023년”을 “2033년”으로 한다.",
    "신구조문대비표": "현 행 개 정 안\n제3조(보상청구권의 소멸시효) 제 제3조(보상청구권의 소멸시효) --\n2조에 따른 보상청구권의 소멸 ----------------------------\n시효는 2023년 12월 31일에 만 -------2033년---------------\n료된다. ------."
  }
}