{
  "title": "2204560_정보통신망_이용촉진_및_정보보호_등에_관한_법률_일부개정법률안",
  "bill_number": "4560",
  "proposal_date": "2024. 10. 4.",
  "submission_date": "",
  "is_alternative": false,
  "alternative_bill_numbers": [],
  "has_comparison_table": false,
  "comparison_table": "신ㆍ구조문대비표\n현 행 개 정 안\n제70조(벌칙) ①ㆍ② (생 략) 제70조(벌칙) ①ㆍ② (현행과 같\n음)\n③ 제1항과 제2항의 죄는 피해 ③ --------------------고소\n자가 구체적으로 밝힌 의사에 가 있어야 ------------------\n반하여 공소를 제기할 수 없다. ----------------------- 있다.",
  "full_text": "정보통신망 이용촉진 및 정보보호 등에 관한 법률\n일부개정법률안\n(전현희의원 대표발의)\n발의연월일 : 2024. 10. 4.\n의 안\n4560\n번 호 발 의 자 : 전현희ㆍ한준호ㆍ박균택\n이정문ㆍ김승원ㆍ윤종군\n박홍배ㆍ김민석ㆍ조승래\n김영환ㆍ황정아ㆍ이기헌\n의원(12인)\n제안이유 및 주요내용\n최근 대통령실의 고발사주 의혹이 보도되며, 명예훼손죄가 제3자를\n통해 정치적 목적으로 활용된다는 지적이 있음.\n실제로 헌법이 보장하는 표현의 자유, 언론ㆍ출판의 자유를 심각하\n게 제한하고, 고소ㆍ고발 남발 등 명예훼손죄를 정치적ㆍ사회적으로\n악용하는 사례가 많이 발생하고 있음.\n이에 피해자도 아닌 자(또는 단체)가 정치적, 사회적 목적을 가지고\n정보통신망을 통한 명예훼손죄 고발을 남발하지 않도록, 정보통신망을\n통한 명예훼손죄도 고소가 있어야 공소를 제기할 수 있도록 친고죄로\n개정하고자 함(안 제70조제3항).\n\n\n\n\n법률 제 호\n정보통신망 이용촉진 및 정보보호 등에 관한 법률\n일부개정법률안\n정보통신망 이용촉진 및 정보보호 등에 관한 법률 일부를 다음과 같\n이 개정한다.\n제70조제3항 중 “피해자가 구체적으로 밝힌 의사에 반하여”를 “고소가\n있어야”로, “없다”를 “있다”로 한다.\n부 칙\n이 법은 공포한 날부터 시행한다.\n\n\n\n\n신ㆍ구조문대비표\n현 행 개 정 안\n제70조(벌칙) ①ㆍ② (생 략) 제70조(벌칙) ①ㆍ② (현행과 같\n음)\n③ 제1항과 제2항의 죄는 피해 ③ --------------------고소\n자가 구체적으로 밝힌 의사에 가 있어야 ------------------\n반하여 공소를 제기할 수 없다. ----------------------- 있다.\n",
  "sections": {
    "제안이유": "및",
    "주요내용": "최근 대통령실의 고발사주 의혹이 보도되며, 명예훼손죄가 제3자를\n통해 정치적 목적으로 활용된다는 지적이 있음.\n실제로 헌법이 보장하는 표현의 자유, 언론ㆍ출판의 자유를 심각하\n게 제한하고, 고소ㆍ고발 남발 등 명예훼손죄를 정치적ㆍ사회적으로\n악용하는 사례가 많이 발생하고 있음.\n이에 피해자도 아닌 자(또는 단체)가 정치적, 사회적 목적을 가지고\n정보통신망을 통한 명예훼손죄 고발을 남발하지 않도록, 정보통신망을\n통한 명예훼손죄도 고소가 있어야 공소를 제기할 수 있도록 친고죄로\n개정하고자 함(안 제70조제3항).",
    "제안이유_및_주요내용": "최근 대통령실의 고발사주 의혹이 보도되며, 명예훼손죄가 제3자를\n통해 정치적 목적으로 활용된다는 지적이 있음.\n실제로 헌법이 보장하는 표현의 자유, 언론ㆍ출판의 자유를 심각하\n게 제한하고, 고소ㆍ고발 남발 등 명예훼손죄를 정치적ㆍ사회적으로\n악용하는 사례가 많이 발생하고 있음.\n이에 피해자도 아닌 자(또는 단체)가 정치적, 사회적 목적을 가지고\n정보통신망을 통한 명예훼손죄 고발을 남발하지 않도록, 정보통신망을\n통한 명예훼손죄도 고소가 있어야 공소를 제기할 수 있도록 친고죄로\n개정하고자 함(안 제70조제3항).",
    "법률_제_호": "정보통신망 이용촉진 및 정보보호 등에 관한 법률\n일부개정법률안\n정보통신망 이용촉진 및 정보보호 등에 관한 법률 일부를 다음과 같\n이 개정한다.\n제70조제3항 중 “피해자가 구체적으로 밝힌 의사에 반하여”를 “고소가\n있어야”로, “없다”를 “있다”로 한다.",
    "신구조문대비표": "현 행 개 정 안\n제70조(벌칙) ①ㆍ② (생 략) 제70조(벌칙) ①ㆍ② (현행과 같\n음)\n③ 제1항과 제2항의 죄는 피해 ③ --------------------고소\n자가 구체적으로 밝힌 의사에 가 있어야 ------------------\n반하여 공소를 제기할 수 없다. ----------------------- 있다."
  }
}