{
  "title": "2204291_국회예산정책처법_일부개정법률안",
  "bill_number": "4291",
  "proposal_date": "2024. 9. 25.",
  "submission_date": "",
  "is_alternative": false,
  "alternative_bill_numbers": [],
  "has_comparison_table": false,
  "comparison_table": "신ㆍ구조문대비표\n현 행 개 정 안\n<신 설> 제8조의2(예산안 등 관련 자료의\n제공) 처장은 국가의 예산안ㆍ\n결산ㆍ기금운용계획안 및 기금\n결산(국회가 심의ㆍ확정한 예\n산안 등을 포함한다)과 그에\n대한 사업별 설명자료를 홈페\n이지 등에 게재하는 방법으로\n공개하여야 한다.",
  "full_text": "국회예산정책처법 일부개정법률안\n(김한규의원 대표발의)\n발의연월일 : 2024. 9. 25.\n의 안\n4291\n번 호 발 의 자 : 김한규ㆍ이원택ㆍ장철민\n김태년ㆍ강훈식ㆍ백혜련\n정진욱ㆍ박홍배ㆍ이재정\n이건태ㆍ박상혁ㆍ박정현\n모경종ㆍ강준현ㆍ박희승\n서미화ㆍ신정훈ㆍ양부남\n위성곤ㆍ손명수ㆍ김영환\n의원(21인)\n제안이유 및 주요내용\n현행법은 예산정책처의 직무로 예산안ㆍ결산ㆍ기금운용계획안 및\n기금결산(이하 “예산안 등”이라 한다)에 대한 연구 및 분석을 규정하\n고 있음. 이에 따라 예산정책처는 회계연도마다 예산안 등에 대한 분\n석 결과를 제공하고 있음.\n그러나 예산정책처의 예산안 등에 대한 분석 결과 제공에도 불구하\n고, 정부가 제출하는 예산안 등에 대한 사업별 설명자료 등 관련 자료\n는 각 부처를 소관하는 기관에만 제공되거나 부처별 홈페이지에 게재\n되는 등 파편적으로 공개되고 있어 국회의 예산안 등의 심사를 위한\n기초 자료제공에는 다소 미흡하다는 지적이 있음.\n\n\n\n이에 정부의 사업별 설명자료를 포함한 예산안 등과 국회가 의결한\n예산안 등을 취합ㆍ공개하여 예산안 등에 대한 정보를 포괄적으로 제\n공함으로써 국가 예산에 대한 국민들의 알권리를 보장하고, 예산정책\n처의 의정 활동 지원기능을 강화하고자 하는 것임(안 제8조의2 신설).\n\n법률 제 호\n국회예산정책처법 일부개정법률안\n국회예산정책처법 일부를 다음과 같이 개정한다.\n제8조의2를 다음과 같이 신설한다.\n제8조의2(예산안 등 관련 자료의 제공) 처장은 국가의 예산안ㆍ결산ㆍ\n기금운용계획안 및 기금결산(국회가 심의ㆍ확정한 예산안 등을 포함\n한다)과 그에 대한 사업별 설명자료를 홈페이지 등에 게재하는 방법\n으로 공개하여야 한다.\n부 칙\n이 법은 공포 후 3개월이 경과한 날부터 시행한다.\n\n\n\n\n신ㆍ구조문대비표\n현 행 개 정 안\n<신 설> 제8조의2(예산안 등 관련 자료의\n제공) 처장은 국가의 예산안ㆍ\n결산ㆍ기금운용계획안 및 기금\n결산(국회가 심의ㆍ확정한 예\n산안 등을 포함한다)과 그에\n대한 사업별 설명자료를 홈페\n이지 등에 게재하는 방법으로\n공개하여야 한다.\n",
  "sections": {
    "제안이유": "및",
    "주요내용": "현행법은 예산정책처의 직무로 예산안ㆍ결산ㆍ기금운용계획안 및\n기금결산(이하 “예산안 등”이라 한다)에 대한 연구 및 분석을 규정하\n고 있음. 이에 따라 예산정책처는 회계연도마다 예산안 등에 대한 분\n석 결과를 제공하고 있음.\n그러나 예산정책처의 예산안 등에 대한 분석 결과 제공에도 불구하\n고, 정부가 제출하는 예산안 등에 대한 사업별 설명자료 등 관련 자료\n는 각 부처를 소관하는 기관에만 제공되거나 부처별 홈페이지에 게재\n되는 등 파편적으로 공개되고 있어 국회의 예산안 등의 심사를 위한\n기초 자료제공에는 다소 미흡하다는 지적이 있음.\n\n\n\n이에 정부의 사업별 설명자료를 포함한 예산안 등과 국회가 의결한\n예산안 등을 취합ㆍ공개하여 예산안 등에 대한 정보를 포괄적으로 제\n공함으로써 국가 예산에 대한 국민들의 알권리를 보장하고, 예산정책\n처의 의정 활동 지원기능을 강화하고자 하는 것임(안 제8조의2 신설).",
    "제안이유_및_주요내용": "현행법은 예산정책처의 직무로 예산안ㆍ결산ㆍ기금운용계획안 및\n기금결산(이하 “예산안 등”이라 한다)에 대한 연구 및 분석을 규정하\n고 있음. 이에 따라 예산정책처는 회계연도마다 예산안 등에 대한 분\n석 결과를 제공하고 있음.\n그러나 예산정책처의 예산안 등에 대한 분석 결과 제공에도 불구하\n고, 정부가 제출하는 예산안 등에 대한 사업별 설명자료 등 관련 자료\n는 각 부처를 소관하는 기관에만 제공되거나 부처별 홈페이지에 게재\n되는 등 파편적으로 공개되고 있어 국회의 예산안 등의 심사를 위한\n기초 자료제공에는 다소 미흡하다는 지적이 있음.\n\n\n\n이에 정부의 사업별 설명자료를 포함한 예산안 등과 국회가 의결한\n예산안 등을 취합ㆍ공개하여 예산안 등에 대한 정보를 포괄적으로 제\n공함으로써 국가 예산에 대한 국민들의 알권리를 보장하고, 예산정책\n처의 의정 활동 지원기능을 강화하고자 하는 것임(안 제8조의2 신설).",
    "법률_제_호": "국회예산정책처법 일부개정법률안\n국회예산정책처법 일부를 다음과 같이 개정한다.\n제8조의2를 다음과 같이 신설한다.\n제8조의2(예산안 등 관련 자료의 제공) 처장은 국가의 예산안ㆍ결산ㆍ\n기금운용계획안 및 기금결산(국회가 심의ㆍ확정한 예산안 등을 포함\n한다)과 그에 대한 사업별 설명자료를 홈페이지 등에 게재하는 방법\n으로 공개하여야 한다.",
    "신구조문대비표": "현 행 개 정 안\n<신 설> 제8조의2(예산안 등 관련 자료의\n제공) 처장은 국가의 예산안ㆍ\n결산ㆍ기금운용계획안 및 기금\n결산(국회가 심의ㆍ확정한 예\n산안 등을 포함한다)과 그에\n대한 사업별 설명자료를 홈페\n이지 등에 게재하는 방법으로\n공개하여야 한다."
  }
}