{
  "title": "2205816_농업생명자원의_보존·관리_및_이용에_관한_법률_일부개정법률안",
  "bill_number": "5816",
  "proposal_date": "2024. 11. 22.",
  "submission_date": "",
  "is_alternative": false,
  "alternative_bill_numbers": [],
  "has_comparison_table": false,
  "comparison_table": "신ㆍ구조문대비표\n현 행 개 정 안\n제5조(기본계획의 수립 등) ① 제5조(기본계획의 수립 등) ①\n∼ ⑥ (생 략) ∼ ⑥ (현행과 같음)\n<신 설> ⑦ 농림축산식품부장관은 기본\n계획 및 시행계획을 수립할 때\n에는 제14조제1항에 따른 책임\n기관, 대학, 연구소 등 농업생\n명자원 관련 기관ㆍ단체 등의\n의견을 들어야 한다.",
  "full_text": "농업생명자원의 보존ㆍ관리 및 이용에 관한 법률\n일부개정법률안\n(안호영의원 대표발의)\n발의연월일 : 2024. 11. 22.\n의 안\n5816\n번 호 발 의 자 : 안호영ㆍ이학영ㆍ이원택\n어기구ㆍ윤준병ㆍ주철현\n정을호ㆍ박희승ㆍ소병훈\n박홍배 의원(10인)\n제안이유 및 주요내용\n현행법은 농림축산식품부장관이 농업생명자원의 보존과 지속가능한\n이용을 위하여 관계 중앙행정기관의 장과 협의하여 5년마다 농업생명\n자원의 보존ㆍ관리 및 이용에 관한 기본계획을 수립하도록 하고 있음.\n이러한 기본계획은 정책적 필요에 따라 특정 산업을 육성하거나 개\n인ㆍ기업을 지원하기 위한 정책 방향 및 수단을 제시하는 것으로서\n계획 수립 시 해당 계획의 정책 대상이나 관련 기관ㆍ단체 등 이해관\n계자의 의견을 수렴할 필요가 있음.\n이에 농림축산식품부장관이 농업생명자원의 보존ㆍ관리 및 이용에\n관한 기본계획을 수립할 때에는 관련 기관ㆍ단체 등의 의견을 듣도록\n하는 규정을 마련하려는 것임(안 제5조제7항 신설).\n\n\n\n\n법률 제 호\n농업생명자원의 보존ㆍ관리 및 이용에 관한 법률\n일부개정법률안\n농업생명자원의 보존ㆍ관리 및 이용에 관한 법률 일부를 다음과 같이\n개정한다.\n제5조에 제7항을 다음과 같이 신설한다.\n⑦ 농림축산식품부장관은 기본계획 및 시행계획을 수립할 때에는\n제14조제1항에 따른 책임기관, 대학, 연구소 등 농업생명자원 관련\n기관ㆍ단체 등의 의견을 들어야 한다.\n부 칙\n이 법은 공포 후 6개월이 경과한 날부터 시행한다.\n\n\n\n\n신ㆍ구조문대비표\n현 행 개 정 안\n제5조(기본계획의 수립 등) ① 제5조(기본계획의 수립 등) ①\n∼ ⑥ (생 략) ∼ ⑥ (현행과 같음)\n<신 설> ⑦ 농림축산식품부장관은 기본\n계획 및 시행계획을 수립할 때\n에는 제14조제1항에 따른 책임\n기관, 대학, 연구소 등 농업생\n명자원 관련 기관ㆍ단체 등의\n의견을 들어야 한다.\n",
  "sections": {
    "제안이유": "및",
    "주요내용": "현행법은 농림축산식품부장관이 농업생명자원의 보존과 지속가능한\n이용을 위하여 관계 중앙행정기관의 장과 협의하여 5년마다 농업생명\n자원의 보존ㆍ관리 및 이용에 관한 기본계획을 수립하도록 하고 있음.\n이러한 기본계획은 정책적 필요에 따라 특정 산업을 육성하거나 개\n인ㆍ기업을 지원하기 위한 정책 방향 및 수단을 제시하는 것으로서\n계획 수립 시 해당 계획의 정책 대상이나 관련 기관ㆍ단체 등 이해관\n계자의 의견을 수렴할 필요가 있음.\n이에 농림축산식품부장관이 농업생명자원의 보존ㆍ관리 및 이용에\n관한 기본계획을 수립할 때에는 관련 기관ㆍ단체 등의 의견을 듣도록\n하는 규정을 마련하려는 것임(안 제5조제7항 신설).",
    "제안이유_및_주요내용": "현행법은 농림축산식품부장관이 농업생명자원의 보존과 지속가능한\n이용을 위하여 관계 중앙행정기관의 장과 협의하여 5년마다 농업생명\n자원의 보존ㆍ관리 및 이용에 관한 기본계획을 수립하도록 하고 있음.\n이러한 기본계획은 정책적 필요에 따라 특정 산업을 육성하거나 개\n인ㆍ기업을 지원하기 위한 정책 방향 및 수단을 제시하는 것으로서\n계획 수립 시 해당 계획의 정책 대상이나 관련 기관ㆍ단체 등 이해관\n계자의 의견을 수렴할 필요가 있음.\n이에 농림축산식품부장관이 농업생명자원의 보존ㆍ관리 및 이용에\n관한 기본계획을 수립할 때에는 관련 기관ㆍ단체 등의 의견을 듣도록\n하는 규정을 마련하려는 것임(안 제5조제7항 신설).",
    "법률_제_호": "농업생명자원의 보존ㆍ관리 및 이용에 관한 법률\n일부개정법률안\n농업생명자원의 보존ㆍ관리 및 이용에 관한 법률 일부를 다음과 같이\n개정한다.\n제5조에 제7항을 다음과 같이 신설한다.\n⑦ 농림축산식품부장관은 기본계획 및 시행계획을 수립할 때에는\n제14조제1항에 따른 책임기관, 대학, 연구소 등 농업생명자원 관련\n기관ㆍ단체 등의 의견을 들어야 한다.",
    "신구조문대비표": "현 행 개 정 안\n제5조(기본계획의 수립 등) ① 제5조(기본계획의 수립 등) ①\n∼ ⑥ (생 략) ∼ ⑥ (현행과 같음)\n<신 설> ⑦ 농림축산식품부장관은 기본\n계획 및 시행계획을 수립할 때\n에는 제14조제1항에 따른 책임\n기관, 대학, 연구소 등 농업생\n명자원 관련 기관ㆍ단체 등의\n의견을 들어야 한다."
  }
}