{
  "title": "2205722_예술인의_지위와_권리의_보장에_관한_법률_일부개정법률안",
  "bill_number": "5722",
  "proposal_date": "2024. 11. 20.",
  "submission_date": "",
  "is_alternative": false,
  "alternative_bill_numbers": [],
  "has_comparison_table": false,
  "comparison_table": "신ㆍ구조문대비표\n현 행 개 정 안\n<신 설> 제10조의2(예술인의 연령차별 금\n지) 국가기관등은 예술인을 모\n집ㆍ채용할 때 합리적인 이유\n없이 연령을 이유로 차별하여\n서는 아니 된다.",
  "full_text": "예술인의 지위와 권리의 보장에 관한 법률 일부개정법률안\n(최수진의원 대표발의)\n발의연월일 : 2024. 11. 20.\n의 안\n5722\n번 호 발 의 자 : 최수진ㆍ조은희ㆍ구자근\n인요한ㆍ김선교ㆍ김장겸\n이헌승ㆍ안상훈ㆍ김소희\n김상욱 의원(10인)\n제안이유 및 주요내용\n현재 국립ㆍ시립합창단 전문지휘자를 선발하는 경우 자격요건에 공\n무원과 같이 60세 이하의 연령 제한을 두고 있는 경우가 있음.\n하지만 예술적 역량은 인문학 분야의 다양한 경험이 축적되어 완성\n되는 특성을 가지고 있어 오히려 60대에 왕성한 활동이 이루어지는\n경우도 많으므로, 예술인의 국가기관등의 채용 시 이를 고려하지 않고\n일률적으로 연령 기준을 정하는 것은 불합리한 측면이 있음.\n또한, 현행 법률이 예술 창작과 표현의 자유를 보호하고 예술인의\n노동과 복지 등 직업적 권리를 신장하여 예술 발전에 이바지하는 것\n을 목적으로 하고 있다는 점을 고려해 볼 때, 예술인의 직업적 권리\n보장과 국가적 차원의 예술 역량 확보를 위해서는 연령으로 인한 예\n술 활동의 제한이 발생하지 않도록 할 필요가 있음.\n이에 국가기관등은 예술인을 모집ㆍ채용할 때 합리적인 이유 없이\n\n\n\n연령을 이유로 차별하지 않도록 법률로 명시하려는 것임(안 제10조의2\n신설).\n\n법률 제 호\n예술인의 지위와 권리의 보장에 관한 법률 일부개정법률안\n예술인의 지위와 권리의 보장에 관한 법률 일부를 다음과 같이 개정\n한다.\n제10조의2를 다음과 같이 신설한다.\n제10조의2(예술인의 연령차별 금지) 국가기관등은 예술인을 모집ㆍ채\n용할 때 합리적인 이유 없이 연령을 이유로 차별하여서는 아니 된\n다.\n부 칙\n이 법은 공포한 날부터 시행한다.\n\n\n\n\n신ㆍ구조문대비표\n현 행 개 정 안\n<신 설> 제10조의2(예술인의 연령차별 금\n지) 국가기관등은 예술인을 모\n집ㆍ채용할 때 합리적인 이유\n없이 연령을 이유로 차별하여\n서는 아니 된다.\n",
  "sections": {
    "제안이유": "및",
    "주요내용": "현재 국립ㆍ시립합창단 전문지휘자를 선발하는 경우 자격요건에 공\n무원과 같이 60세 이하의 연령 제한을 두고 있는 경우가 있음.\n하지만 예술적 역량은 인문학 분야의 다양한 경험이 축적되어 완성\n되는 특성을 가지고 있어 오히려 60대에 왕성한 활동이 이루어지는\n경우도 많으므로, 예술인의 국가기관등의 채용 시 이를 고려하지 않고\n일률적으로 연령 기준을 정하는 것은 불합리한 측면이 있음.\n또한, 현행 법률이 예술 창작과 표현의 자유를 보호하고 예술인의\n노동과 복지 등 직업적 권리를 신장하여 예술 발전에 이바지하는 것\n을 목적으로 하고 있다는 점을 고려해 볼 때, 예술인의 직업적 권리\n보장과 국가적 차원의 예술 역량 확보를 위해서는 연령으로 인한 예\n술 활동의 제한이 발생하지 않도록 할 필요가 있음.\n이에 국가기관등은 예술인을 모집ㆍ채용할 때 합리적인 이유 없이\n\n\n\n연령을 이유로 차별하지 않도록 법률로 명시하려는 것임(안 제10조의2\n신설).",
    "제안이유_및_주요내용": "현재 국립ㆍ시립합창단 전문지휘자를 선발하는 경우 자격요건에 공\n무원과 같이 60세 이하의 연령 제한을 두고 있는 경우가 있음.\n하지만 예술적 역량은 인문학 분야의 다양한 경험이 축적되어 완성\n되는 특성을 가지고 있어 오히려 60대에 왕성한 활동이 이루어지는\n경우도 많으므로, 예술인의 국가기관등의 채용 시 이를 고려하지 않고\n일률적으로 연령 기준을 정하는 것은 불합리한 측면이 있음.\n또한, 현행 법률이 예술 창작과 표현의 자유를 보호하고 예술인의\n노동과 복지 등 직업적 권리를 신장하여 예술 발전에 이바지하는 것\n을 목적으로 하고 있다는 점을 고려해 볼 때, 예술인의 직업적 권리\n보장과 국가적 차원의 예술 역량 확보를 위해서는 연령으로 인한 예\n술 활동의 제한이 발생하지 않도록 할 필요가 있음.\n이에 국가기관등은 예술인을 모집ㆍ채용할 때 합리적인 이유 없이\n\n\n\n연령을 이유로 차별하지 않도록 법률로 명시하려는 것임(안 제10조의2\n신설).",
    "법률_제_호": "예술인의 지위와 권리의 보장에 관한 법률 일부개정법률안\n예술인의 지위와 권리의 보장에 관한 법률 일부를 다음과 같이 개정\n한다.\n제10조의2를 다음과 같이 신설한다.\n제10조의2(예술인의 연령차별 금지) 국가기관등은 예술인을 모집ㆍ채\n용할 때 합리적인 이유 없이 연령을 이유로 차별하여서는 아니 된\n다.",
    "신구조문대비표": "현 행 개 정 안\n<신 설> 제10조의2(예술인의 연령차별 금\n지) 국가기관등은 예술인을 모\n집ㆍ채용할 때 합리적인 이유\n없이 연령을 이유로 차별하여\n서는 아니 된다."
  }
}