{
  "title": "2205038_법학전문대학원_설치·운영에_관한_법률_일부개정법률안",
  "bill_number": "5038",
  "proposal_date": "2024. 10. 30.",
  "submission_date": "",
  "is_alternative": false,
  "alternative_bill_numbers": [],
  "has_comparison_table": false,
  "comparison_table": "신ㆍ구조문대비표\n현 행 개 정 안\n제7조(법학전문대학원의 입학정 제7조(법학전문대학원의 입학정\n원) ① ∼ ③ (생 략) 원) ① ∼ ③ (현행과 같음)\n<신 설> ④ 교육부장관은 지방대학의\n발전과 지역발전에 필요한 우\n수 인력을 양성하기 위하여 광\n역지방자치단체별 1개 이상의\n법학전문대학원을 설치하여야\n한다.",
  "full_text": "법학전문대학원 설치ㆍ운영에 관한 법률 일부개정법률안\n(박대출의원 대표발의)\n발의연월일 : 2024. 10. 30.\n의 안\n5038\n번 호 발 의 자 : 박대출ㆍ윤한홍ㆍ김기현\n강민국ㆍ김태호ㆍ김정재\n신성범ㆍ윤영석ㆍ송언석\n강승규 의원(10인)\n제안이유 및 주요내용\n경남과 울산은 지방법원 설치 지역임에도 법학전문대학원이 설치되\n지 않았고, 인구 300만 이상 시도 중 법학전문대학원이 설치되지 않은\n지역은 경남이 유일함.\n또 부산권역 법학전문대학원 정원 비중도 인구 대비 불균형하게 낮\n아, 학령인구인 20대 수도권 순유출이 전국에서 가장 높은 경남에 법\n학전문대학원을 설치할 수 있는 법적 근거가 필요하다는 지적이 제기\n됨.\n이에 「법학전문대학원 설치ㆍ운영에 관한 법률」에 광역지방자치\n단체별 1개 이상의 법학전문대학원을 설치하여야 한다는 조항을 신설\n하여, 지방대학의 발전과 지역발전에 필요한 우수 인력을 양성하기 위\n한 규정을 마련하려는 것임(안 제7조제4항 신설).\n\n\n\n\n법률 제 호\n법학전문대학원 설치ㆍ운영에 관한 법률 일부개정법률안\n법학전문대학원 설치ㆍ운영에 관한 법률 일부를 다음과 같이 개정한\n다.\n제7조에 제4항을 다음과 같이 신설한다.\n④ 교육부장관은 지방대학의 발전과 지역발전에 필요한 우수 인력\n을 양성하기 위하여 광역지방자치단체별 1개 이상의 법학전문대학\n원을 설치하여야 한다.\n부 칙\n이 법은 공포 후 6개월이 경과한 날부터 시행한다.\n\n\n\n\n신ㆍ구조문대비표\n현 행 개 정 안\n제7조(법학전문대학원의 입학정 제7조(법학전문대학원의 입학정\n원) ① ∼ ③ (생 략) 원) ① ∼ ③ (현행과 같음)\n<신 설> ④ 교육부장관은 지방대학의\n발전과 지역발전에 필요한 우\n수 인력을 양성하기 위하여 광\n역지방자치단체별 1개 이상의\n법학전문대학원을 설치하여야\n한다.\n",
  "sections": {
    "제안이유": "및",
    "주요내용": "경남과 울산은 지방법원 설치 지역임에도 법학전문대학원이 설치되\n지 않았고, 인구 300만 이상 시도 중 법학전문대학원이 설치되지 않은\n지역은 경남이 유일함.\n또 부산권역 법학전문대학원 정원 비중도 인구 대비 불균형하게 낮\n아, 학령인구인 20대 수도권 순유출이 전국에서 가장 높은 경남에 법\n학전문대학원을 설치할 수 있는 법적 근거가 필요하다는 지적이 제기\n됨.\n이에 「법학전문대학원 설치ㆍ운영에 관한 법률」에 광역지방자치\n단체별 1개 이상의 법학전문대학원을 설치하여야 한다는 조항을 신설\n하여, 지방대학의 발전과 지역발전에 필요한 우수 인력을 양성하기 위\n한 규정을 마련하려는 것임(안 제7조제4항 신설).",
    "제안이유_및_주요내용": "경남과 울산은 지방법원 설치 지역임에도 법학전문대학원이 설치되\n지 않았고, 인구 300만 이상 시도 중 법학전문대학원이 설치되지 않은\n지역은 경남이 유일함.\n또 부산권역 법학전문대학원 정원 비중도 인구 대비 불균형하게 낮\n아, 학령인구인 20대 수도권 순유출이 전국에서 가장 높은 경남에 법\n학전문대학원을 설치할 수 있는 법적 근거가 필요하다는 지적이 제기\n됨.\n이에 「법학전문대학원 설치ㆍ운영에 관한 법률」에 광역지방자치\n단체별 1개 이상의 법학전문대학원을 설치하여야 한다는 조항을 신설\n하여, 지방대학의 발전과 지역발전에 필요한 우수 인력을 양성하기 위\n한 규정을 마련하려는 것임(안 제7조제4항 신설).",
    "법률_제_호": "법학전문대학원 설치ㆍ운영에 관한 법률 일부개정법률안\n법학전문대학원 설치ㆍ운영에 관한 법률 일부를 다음과 같이 개정한\n다.\n제7조에 제4항을 다음과 같이 신설한다.\n④ 교육부장관은 지방대학의 발전과 지역발전에 필요한 우수 인력\n을 양성하기 위하여 광역지방자치단체별 1개 이상의 법학전문대학\n원을 설치하여야 한다.",
    "신구조문대비표": "현 행 개 정 안\n제7조(법학전문대학원의 입학정 제7조(법학전문대학원의 입학정\n원) ① ∼ ③ (생 략) 원) ① ∼ ③ (현행과 같음)\n<신 설> ④ 교육부장관은 지방대학의\n발전과 지역발전에 필요한 우\n수 인력을 양성하기 위하여 광\n역지방자치단체별 1개 이상의\n법학전문대학원을 설치하여야\n한다."
  }
}