{
  "title": "2205703_도로교통법_일부개정법률안",
  "bill_number": "5703",
  "proposal_date": "2024. 11. 19.",
  "submission_date": "",
  "is_alternative": false,
  "alternative_bill_numbers": [],
  "has_comparison_table": false,
  "comparison_table": "신ㆍ구조문대비표\n현 행 개 정 안\n제16조(노면전차 전용로의 설치 제16조(노면전차 전용로의 설치\n등) ①ㆍ② (생 략) 등) ①ㆍ② (현행과 같음)\n<신 설> ③ 제2항에도 불구하고 「도시\n철도법」 제18조의2제2항에 따\n라 노면전차와 다른 차마가 함\n께 통행하는 혼용차로가 설치\n된 경우에는 노면전차의 운전\n자는 그 혼용차로로 통행할 수\n있다.",
  "full_text": "도로교통법 일부개정법률안\n(안철수의원 대표발의)\n발의연월일 : 2024. 11. 19.\n의 안\n5703\n번 호 발 의 자 : 안철수ㆍ김석기ㆍ김은혜\n김승수ㆍ김민전ㆍ주호영\n인요한ㆍ윤상현ㆍ유용원\n조승환ㆍ고동진ㆍ김 건\n권영세ㆍ김성원ㆍ김태호\n김형동 의원(16인)\n제안이유 및 주요내용\n노면전차는 도로 등에 설치한 전용 궤도를 주행하는 경량 철도로서\n최근 기술이 발달하며 교통체증과 환경오염을 개선할 대안 교통수단\n으로 주목받고 있음.\n「도시철도법」에 따르면 도시철도건설자는 노면전차를 도로에 건\n설하는 경우 노면전차 전용도로 또는 전용차로를 설치하여야 하며, 노\n면전차 전용로 설치로 인하여 도로 교통이 현저하게 혼잡해질 우려가\n있는 특별한 경우에는 노면전차와 다른 자동차 등이 함께 통행하는\n혼용차로를 설치할 수 있도록 명시하고 있음. 하지만 현행법은 노면전\n차의 운전자로 하여금 노면전차 전용로로 통행하도록 하고 있을 뿐\n노면전차의 혼용차로 통행에 관한 규정을 두고 있지 않아 법 체계상\n미비점이 있음.\n\n\n\n이에 노면전차의 혼용차로 통행에 관한 근거를 신설하여 미비점을\n보완하고 노면전차 도입 기반을 보다 공고히 마련하려는 것임(안 제16\n조제3항 신설).\n\n법률 제 호\n도로교통법 일부개정법률안\n도로교통법 일부를 다음과 같이 개정한다.\n제16조에 제3항을 다음과 같이 신설한다.\n③ 제2항에도 불구하고 「도시철도법」 제18조의2제2항에 따라 노\n면전차와 다른 차마가 함께 통행하는 혼용차로가 설치된 경우에는\n노면전차의 운전자는 그 혼용차로로 통행할 수 있다.\n부 칙\n이 법은 공포 후 3개월이 경과한 날부터 시행한다.\n\n\n\n\n신ㆍ구조문대비표\n현 행 개 정 안\n제16조(노면전차 전용로의 설치 제16조(노면전차 전용로의 설치\n등) ①ㆍ② (생 략) 등) ①ㆍ② (현행과 같음)\n<신 설> ③ 제2항에도 불구하고 「도시\n철도법」 제18조의2제2항에 따\n라 노면전차와 다른 차마가 함\n께 통행하는 혼용차로가 설치\n된 경우에는 노면전차의 운전\n자는 그 혼용차로로 통행할 수\n있다.\n",
  "sections": {
    "제안이유": "및",
    "주요내용": "노면전차는 도로 등에 설치한 전용 궤도를 주행하는 경량 철도로서\n최근 기술이 발달하며 교통체증과 환경오염을 개선할 대안 교통수단\n으로 주목받고 있음.\n「도시철도법」에 따르면 도시철도건설자는 노면전차를 도로에 건\n설하는 경우 노면전차 전용도로 또는 전용차로를 설치하여야 하며, 노\n면전차 전용로 설치로 인하여 도로 교통이 현저하게 혼잡해질 우려가\n있는 특별한 경우에는 노면전차와 다른 자동차 등이 함께 통행하는\n혼용차로를 설치할 수 있도록 명시하고 있음. 하지만 현행법은 노면전\n차의 운전자로 하여금 노면전차 전용로로 통행하도록 하고 있을 뿐\n노면전차의 혼용차로 통행에 관한 규정을 두고 있지 않아 법 체계상\n미비점이 있음.\n\n\n\n이에 노면전차의 혼용차로 통행에 관한 근거를 신설하여 미비점을\n보완하고 노면전차 도입 기반을 보다 공고히 마련하려는 것임(안 제16\n조제3항 신설).",
    "제안이유_및_주요내용": "노면전차는 도로 등에 설치한 전용 궤도를 주행하는 경량 철도로서\n최근 기술이 발달하며 교통체증과 환경오염을 개선할 대안 교통수단\n으로 주목받고 있음.\n「도시철도법」에 따르면 도시철도건설자는 노면전차를 도로에 건\n설하는 경우 노면전차 전용도로 또는 전용차로를 설치하여야 하며, 노\n면전차 전용로 설치로 인하여 도로 교통이 현저하게 혼잡해질 우려가\n있는 특별한 경우에는 노면전차와 다른 자동차 등이 함께 통행하는\n혼용차로를 설치할 수 있도록 명시하고 있음. 하지만 현행법은 노면전\n차의 운전자로 하여금 노면전차 전용로로 통행하도록 하고 있을 뿐\n노면전차의 혼용차로 통행에 관한 규정을 두고 있지 않아 법 체계상\n미비점이 있음.\n\n\n\n이에 노면전차의 혼용차로 통행에 관한 근거를 신설하여 미비점을\n보완하고 노면전차 도입 기반을 보다 공고히 마련하려는 것임(안 제16\n조제3항 신설).",
    "법률_제_호": "도로교통법 일부개정법률안\n도로교통법 일부를 다음과 같이 개정한다.\n제16조에 제3항을 다음과 같이 신설한다.\n③ 제2항에도 불구하고 「도시철도법」 제18조의2제2항에 따라 노\n면전차와 다른 차마가 함께 통행하는 혼용차로가 설치된 경우에는\n노면전차의 운전자는 그 혼용차로로 통행할 수 있다.",
    "신구조문대비표": "현 행 개 정 안\n제16조(노면전차 전용로의 설치 제16조(노면전차 전용로의 설치\n등) ①ㆍ② (생 략) 등) ①ㆍ② (현행과 같음)\n<신 설> ③ 제2항에도 불구하고 「도시\n철도법」 제18조의2제2항에 따\n라 노면전차와 다른 차마가 함\n께 통행하는 혼용차로가 설치\n된 경우에는 노면전차의 운전\n자는 그 혼용차로로 통행할 수\n있다."
  }
}