{
  "title": "2205547_국가인권위원회법_일부개정법률안",
  "bill_number": "5547",
  "proposal_date": "2024. 11. 14.",
  "submission_date": "",
  "is_alternative": false,
  "alternative_bill_numbers": [],
  "has_comparison_table": false,
  "comparison_table": "신·구조문대비표\n현 행 개 정 안\n제5조(위원회의 구성) ① ∼ ⑦ 제5조(위원회의 구성) ① ∼ ⑦\n(생 략) (현행과 같음)\n⑧ 임기가 끝난 위원은 후임자 ⑧ 임기가 끝난 위원은 후임자\n가 임명될 때까지 그 직무를 가 임명될 때까지 그 직무를\n수행한다. 수행하되, 임기가 끝난 날부터\n60일 이내에 후임자를 임명하\n여야 한다.",
  "full_text": "국가인권위원회법 일부개정법률안\n(서미화의원 대표발의)\n발의연월일 : 2024. 11. 14.\n의 안\n5547\n번 호 발 의 자 : 서미화ㆍ윤종군ㆍ박민규\n이기헌ㆍ정진욱ㆍ김원이\n임호선ㆍ이성윤ㆍ김 윤\n문금주ㆍ정일영ㆍ장종태\n김문수ㆍ전진숙ㆍ박희승\n이광희ㆍ박홍배ㆍ조 국\n조계원ㆍ추미애 의원\n(20인)\n제안이유 및 주요내용\n현행법은 국가인권위원회의 위원 임기 종료 후 후임 위원이 선출되\n지 않을 시 별도의 제한 규정이 없어 기존 위원의 무기한 연임이 가\n능한 상황임.\n최근 현행법 제5조제2항제2호에 따라 국회 몫 인권위원이 추천되었\n으나 반인권적 언행 등의 무자격 논란으로 선출안이 부결된 바 있음.\n하지만 후임 위원이 선출되지 않을 시 기존 위원의 직무 수행을 무기\n한 허용하는 현행법의 한계로 새 위원 선출 없이 연임이 계속될 우려\n가 제기되고 있음.\n이에 국가인권위원회 위원의 임기 종료 후 60일 이내에 후임자를\n\n임명할 것을 명문화하여 무자격 위원의 연임을 방지하고자 함(안 제5\n조제8항).\n\n법률 제 호\n국가인권위원회법 일부개정법률안\n국가인권위원회법 일부를 다음과 같이 개정한다.\n제5조제8항을 다음과 같이 한다.\n⑧ 임기가 끝난 위원은 후임자가 임명될 때까지 그 직무를 수행하\n되, 임기가 끝난 날부터 60일 이내에 후임자를 임명하여야 한다.\n부 칙\n이 법은 공포한 날부터 시행한다.\n\n\n\n신·구조문대비표\n현 행 개 정 안\n제5조(위원회의 구성) ① ∼ ⑦ 제5조(위원회의 구성) ① ∼ ⑦\n(생 략) (현행과 같음)\n⑧ 임기가 끝난 위원은 후임자 ⑧ 임기가 끝난 위원은 후임자\n가 임명될 때까지 그 직무를 가 임명될 때까지 그 직무를\n수행한다. 수행하되, 임기가 끝난 날부터\n60일 이내에 후임자를 임명하\n여야 한다.",
  "sections": {
    "제안이유": "및",
    "주요내용": "현행법은 국가인권위원회의 위원 임기 종료 후 후임 위원이 선출되\n지 않을 시 별도의 제한 규정이 없어 기존 위원의 무기한 연임이 가\n능한 상황임.\n최근 현행법 제5조제2항제2호에 따라 국회 몫 인권위원이 추천되었\n으나 반인권적 언행 등의 무자격 논란으로 선출안이 부결된 바 있음.\n하지만 후임 위원이 선출되지 않을 시 기존 위원의 직무 수행을 무기\n한 허용하는 현행법의 한계로 새 위원 선출 없이 연임이 계속될 우려\n가 제기되고 있음.\n이에 국가인권위원회 위원의 임기 종료 후 60일 이내에 후임자를\n\n임명할 것을 명문화하여 무자격 위원의 연임을 방지하고자 함(안 제5\n조제8항).",
    "제안이유_및_주요내용": "현행법은 국가인권위원회의 위원 임기 종료 후 후임 위원이 선출되\n지 않을 시 별도의 제한 규정이 없어 기존 위원의 무기한 연임이 가\n능한 상황임.\n최근 현행법 제5조제2항제2호에 따라 국회 몫 인권위원이 추천되었\n으나 반인권적 언행 등의 무자격 논란으로 선출안이 부결된 바 있음.\n하지만 후임 위원이 선출되지 않을 시 기존 위원의 직무 수행을 무기\n한 허용하는 현행법의 한계로 새 위원 선출 없이 연임이 계속될 우려\n가 제기되고 있음.\n이에 국가인권위원회 위원의 임기 종료 후 60일 이내에 후임자를\n\n임명할 것을 명문화하여 무자격 위원의 연임을 방지하고자 함(안 제5\n조제8항).",
    "법률_제_호": "국가인권위원회법 일부개정법률안\n국가인권위원회법 일부를 다음과 같이 개정한다.\n제5조제8항을 다음과 같이 한다.\n⑧ 임기가 끝난 위원은 후임자가 임명될 때까지 그 직무를 수행하\n되, 임기가 끝난 날부터 60일 이내에 후임자를 임명하여야 한다.",
    "신구조문대비표": "현 행 개 정 안\n제5조(위원회의 구성) ① ∼ ⑦ 제5조(위원회의 구성) ① ∼ ⑦\n(생 략) (현행과 같음)\n⑧ 임기가 끝난 위원은 후임자 ⑧ 임기가 끝난 위원은 후임자\n가 임명될 때까지 그 직무를 가 임명될 때까지 그 직무를\n수행한다. 수행하되, 임기가 끝난 날부터\n60일 이내에 후임자를 임명하\n여야 한다."
  }
}