{
  "title": "2205798_수목원·정원의_조성_및_진흥에_관한_법률_일부개정법률안",
  "bill_number": "5798",
  "proposal_date": "2024. 11. 22.",
  "submission_date": "",
  "is_alternative": false,
  "alternative_bill_numbers": [],
  "has_comparison_table": false,
  "comparison_table": "신ㆍ구조문대비표\n현 행 개 정 안\n제6조(수목원ㆍ정원진흥기본계획 제6조(수목원ㆍ정원진흥기본계획\n등의 수립) ① ∼ ⑥ (생 략) 등의 수립) ① ∼ ⑥ (현행과 같\n음)\n<신 설> ⑦ 산림청장이 기본계획을 수립\n할 때에는 수목원ㆍ정원을 운영\n하는 자, 관련 단체 등의 의견을\n들어야 한다.\n⑦ (생 략) ⑧ (현행 제7항과 같음)",
  "full_text": "수목원ㆍ정원의 조성 및 진흥에 관한 법률 일부개정법률안\n(안호영의원 대표발의)\n발의연월일 : 2024. 11. 22.\n의 안\n5798\n번 호 발 의 자 : 안호영ㆍ이학영ㆍ이원택\n어기구ㆍ윤준병ㆍ주철현\n정을호ㆍ박희승ㆍ소병훈\n박홍배 의원(10인)\n제안이유 및 주요내용\n현행법은 산림청장이 수목원의 확충 및 수목원 사업과 정원 사업의\n육성 등을 위한 수목원ㆍ정원진흥기본계획을 5년마다 수립ㆍ시행하도\n록 하고 있음.\n이러한 기본계획은 정책적 필요에 따라 특정 산업을 육성하거나 개\n인ㆍ기업을 지원하기 위한 정책 방향 및 수단을 제시하는 것으로서\n계획 수립 시 해당 계획의 정책 대상이나 관련 기관ㆍ단체 등 이해관\n계자의 의견을 수렴할 필요가 있음.\n이에 산림청장이 수목원ㆍ정원진흥기본계획을 수립할 때에는 수목\n원ㆍ정원을 운영하는 자 또는 관련 단체 등의 의견을 듣도록 하는 규\n정을 마련하려는 것임(안 제6조제7항 신설).\n\n\n\n\n법률 제 호\n수목원ㆍ정원의 조성 및 진흥에 관한 법률 일부개정법률안\n수목원ㆍ정원의 조성 및 진흥에 관한 법률 일부를 다음과 같이 개정\n한다.\n제6조제7항을 제8항으로 하고, 같은 조에 제7항을 다음과 같이 신설한\n다.\n⑦ 산림청장이 기본계획을 수립할 때에는 수목원ㆍ정원을 운영하는\n자, 관련 단체 등의 의견을 들어야 한다.\n부 칙\n이 법은 공포 후 6개월이 경과한 날부터 시행한다.\n\n\n\n\n신ㆍ구조문대비표\n현 행 개 정 안\n제6조(수목원ㆍ정원진흥기본계획 제6조(수목원ㆍ정원진흥기본계획\n등의 수립) ① ∼ ⑥ (생 략) 등의 수립) ① ∼ ⑥ (현행과 같\n음)\n<신 설> ⑦ 산림청장이 기본계획을 수립\n할 때에는 수목원ㆍ정원을 운영\n하는 자, 관련 단체 등의 의견을\n들어야 한다.\n⑦ (생 략) ⑧ (현행 제7항과 같음)\n",
  "sections": {
    "제안이유": "및",
    "주요내용": "현행법은 산림청장이 수목원의 확충 및 수목원 사업과 정원 사업의\n육성 등을 위한 수목원ㆍ정원진흥기본계획을 5년마다 수립ㆍ시행하도\n록 하고 있음.\n이러한 기본계획은 정책적 필요에 따라 특정 산업을 육성하거나 개\n인ㆍ기업을 지원하기 위한 정책 방향 및 수단을 제시하는 것으로서\n계획 수립 시 해당 계획의 정책 대상이나 관련 기관ㆍ단체 등 이해관\n계자의 의견을 수렴할 필요가 있음.\n이에 산림청장이 수목원ㆍ정원진흥기본계획을 수립할 때에는 수목\n원ㆍ정원을 운영하는 자 또는 관련 단체 등의 의견을 듣도록 하는 규\n정을 마련하려는 것임(안 제6조제7항 신설).",
    "제안이유_및_주요내용": "현행법은 산림청장이 수목원의 확충 및 수목원 사업과 정원 사업의\n육성 등을 위한 수목원ㆍ정원진흥기본계획을 5년마다 수립ㆍ시행하도\n록 하고 있음.\n이러한 기본계획은 정책적 필요에 따라 특정 산업을 육성하거나 개\n인ㆍ기업을 지원하기 위한 정책 방향 및 수단을 제시하는 것으로서\n계획 수립 시 해당 계획의 정책 대상이나 관련 기관ㆍ단체 등 이해관\n계자의 의견을 수렴할 필요가 있음.\n이에 산림청장이 수목원ㆍ정원진흥기본계획을 수립할 때에는 수목\n원ㆍ정원을 운영하는 자 또는 관련 단체 등의 의견을 듣도록 하는 규\n정을 마련하려는 것임(안 제6조제7항 신설).",
    "법률_제_호": "수목원ㆍ정원의 조성 및 진흥에 관한 법률 일부개정법률안\n수목원ㆍ정원의 조성 및 진흥에 관한 법률 일부를 다음과 같이 개정\n한다.\n제6조제7항을 제8항으로 하고, 같은 조에 제7항을 다음과 같이 신설한\n다.\n⑦ 산림청장이 기본계획을 수립할 때에는 수목원ㆍ정원을 운영하는\n자, 관련 단체 등의 의견을 들어야 한다.",
    "신구조문대비표": "현 행 개 정 안\n제6조(수목원ㆍ정원진흥기본계획 제6조(수목원ㆍ정원진흥기본계획\n등의 수립) ① ∼ ⑥ (생 략) 등의 수립) ① ∼ ⑥ (현행과 같\n음)\n<신 설> ⑦ 산림청장이 기본계획을 수립\n할 때에는 수목원ㆍ정원을 운영\n하는 자, 관련 단체 등의 의견을\n들어야 한다.\n⑦ (생 략) ⑧ (현행 제7항과 같음)"
  }
}