{
  "title": "2205408_근로기준법_일부개정법률안",
  "bill_number": "5408",
  "proposal_date": "2024. 11. 11.",
  "submission_date": "",
  "is_alternative": false,
  "alternative_bill_numbers": [],
  "has_comparison_table": false,
  "comparison_table": "신·구조문대비표\n현 행 개 정 안\n제54조(휴게) ① (생 략) 제54조(휴게) ① (현행과 같음)\n<신 설> ② 제1항에도 불구하고 근로시\n간이 4시간인 근로일의 경우에\n는 근로자가 사용자에게 휴게\n시간을 이용하지 않을 것을 명\n시적으로 청구하면 사용자는 휴\n게시간을 부여하지 않을 수 있\n다.\n② (생 략) ③ (현행 제2항과 같음)",
  "full_text": "근로기준법 일부개정법률안\n(임이자의원 대표발의)\n발의연월일 : 2024. 11. 11.\n의 안\n5408\n번 호 발 의 자 : 임이자ㆍ송언석ㆍ김성원\n최수진ㆍ박덕흠ㆍ배준영\n우재준ㆍ김태호ㆍ김위상\n유용원 의원(10인)\n제안이유 및 주요내용\n현행 휴게시간 규정(근로기준법 제54조)에 따르면 근로자의 근로시\n간이 4시간인 경우에는 30분 이상, 8시간인 경우에는 1시간 이상의 휴\n게시간을 근로시간 ‘도중에’ 부여하도록 규정하고 있음.\n이로 인해 고용형태 다변화, 연차나 근로시간 단축 사용 활성화 등\n으로 하루 4시간만 근무하는 근로자가 확산되는 상황에서 근로자가 4\n시간 근무 후 휴게시간 없이 바로 퇴근하기를 희망하여도 퇴근하지\n못하고 해당 사업장에 30분을 더 머물러야 하는 불편 초래.\n이에 1일 근로시간이 4시간인 경우에는 근로자가 사용자에게 명시\n적으로 휴게 면제 신청 시 바로 퇴근할 수 있도록 하여 근로자의 휴\n게시간 선택권을 확대하려는 것임(안 제54조제2항 신설).\n\n\n\n\n법률 제 호\n근로기준법 일부개정법률안\n근로기준법 일부를 다음과 같이 개정한다.\n제54조제2항을 제3항으로 하고, 같은 조에 제2항을 다음과 같이 신설\n한다.\n② 제1항에도 불구하고 근로시간이 4시간인 근로일의 경우에는 근\n로자가 사용자에게 휴게 시간을 이용하지 않을 것을 명시적으로 청\n구하면 사용자는 휴게시간을 부여하지 않을 수 있다.\n부 칙\n이 법은 공포 후 6개월이 경과한 날부터 시행한다.\n\n\n\n\n신·구조문대비표\n현 행 개 정 안\n제54조(휴게) ① (생 략) 제54조(휴게) ① (현행과 같음)\n<신 설> ② 제1항에도 불구하고 근로시\n간이 4시간인 근로일의 경우에\n는 근로자가 사용자에게 휴게\n시간을 이용하지 않을 것을 명\n시적으로 청구하면 사용자는 휴\n게시간을 부여하지 않을 수 있\n다.\n② (생 략) ③ (현행 제2항과 같음)\n",
  "sections": {
    "제안이유": "및",
    "주요내용": "현행 휴게시간 규정(근로기준법 제54조)에 따르면 근로자의 근로시\n간이 4시간인 경우에는 30분 이상, 8시간인 경우에는 1시간 이상의 휴\n게시간을 근로시간 ‘도중에’ 부여하도록 규정하고 있음.\n이로 인해 고용형태 다변화, 연차나 근로시간 단축 사용 활성화 등\n으로 하루 4시간만 근무하는 근로자가 확산되는 상황에서 근로자가 4\n시간 근무 후 휴게시간 없이 바로 퇴근하기를 희망하여도 퇴근하지\n못하고 해당 사업장에 30분을 더 머물러야 하는 불편 초래.\n이에 1일 근로시간이 4시간인 경우에는 근로자가 사용자에게 명시\n적으로 휴게 면제 신청 시 바로 퇴근할 수 있도록 하여 근로자의 휴\n게시간 선택권을 확대하려는 것임(안 제54조제2항 신설).",
    "제안이유_및_주요내용": "현행 휴게시간 규정(근로기준법 제54조)에 따르면 근로자의 근로시\n간이 4시간인 경우에는 30분 이상, 8시간인 경우에는 1시간 이상의 휴\n게시간을 근로시간 ‘도중에’ 부여하도록 규정하고 있음.\n이로 인해 고용형태 다변화, 연차나 근로시간 단축 사용 활성화 등\n으로 하루 4시간만 근무하는 근로자가 확산되는 상황에서 근로자가 4\n시간 근무 후 휴게시간 없이 바로 퇴근하기를 희망하여도 퇴근하지\n못하고 해당 사업장에 30분을 더 머물러야 하는 불편 초래.\n이에 1일 근로시간이 4시간인 경우에는 근로자가 사용자에게 명시\n적으로 휴게 면제 신청 시 바로 퇴근할 수 있도록 하여 근로자의 휴\n게시간 선택권을 확대하려는 것임(안 제54조제2항 신설).",
    "법률_제_호": "근로기준법 일부개정법률안\n근로기준법 일부를 다음과 같이 개정한다.\n제54조제2항을 제3항으로 하고, 같은 조에 제2항을 다음과 같이 신설\n한다.\n② 제1항에도 불구하고 근로시간이 4시간인 근로일의 경우에는 근\n로자가 사용자에게 휴게 시간을 이용하지 않을 것을 명시적으로 청\n구하면 사용자는 휴게시간을 부여하지 않을 수 있다.",
    "신구조문대비표": "현 행 개 정 안\n제54조(휴게) ① (생 략) 제54조(휴게) ① (현행과 같음)\n<신 설> ② 제1항에도 불구하고 근로시\n간이 4시간인 근로일의 경우에\n는 근로자가 사용자에게 휴게\n시간을 이용하지 않을 것을 명\n시적으로 청구하면 사용자는 휴\n게시간을 부여하지 않을 수 있\n다.\n② (생 략) ③ (현행 제2항과 같음)"
  }
}