{
  "title": "2205502_고위공직자범죄수사처_설치_및_운영에_관한_법률_일부개정법률안",
  "bill_number": "5502",
  "proposal_date": "2024. 11. 12.",
  "submission_date": "",
  "is_alternative": false,
  "alternative_bill_numbers": [],
  "has_comparison_table": false,
  "comparison_table": "신ㆍ구조문대비표\n현 행 개 정 안\n제8조(수사처검사) ① ∼ ④ (생 제8조(수사처검사) ① ∼ ④ (현\n략) 행과 같음)\n<신 설> ⑤ 대통령은 제1항의 추천을\n받은 날부터 30일 내에 수사처\n검사를 임명하여야 한다.",
  "full_text": "고위공직자범죄수사처 설치 및 운영에 관한 법률\n일부개정법률안\n(이건태의원 대표발의)\n발의연월일 : 2024. 11. 12.\n의 안\n5502\n번 호 발 의 자 : 이건태ㆍ조계원ㆍ강준현\n박지원ㆍ고민정ㆍ서영교\n김승원ㆍ정태호ㆍ정성호\n윤종군ㆍ양문석 의원\n(11인)\n제안이유 및 주요내용\n현행법은 수사처검사는 인사위원회의 추천을 거쳐 대통령이 임명하\n고, 처장과 차장을 포함하여 25명 이내로 한다고 규정하고 있음.\n그런데 최근 수사처검사 4명의 연임에 대한 대통령 재가가 인사위\n원회의 추천으로부터 2개월 후이자 수사처검사 임기를 이틀 남겨둔\n시점에야 완료되었음. 임기연장이 불확실한 검사는 수사 연속성을 유\n지하기가 현실적으로 어려운바 대통령 재가의 지연은 가뜩이나 인원\n이 많지 않은 수사처검사의 인력 부족 문제를 심화하는 결과로 이어\n질 수 있음.\n이에 대통령은 인사위원회의 추천을 받은 날부터 30일 내에 수사처\n검사를 임명하여야 한다고 법에 명기함으로써 빠른 인력 충원을 도모\n하고 조직의 안정성을 제고하려는 것임(안 제8조제5항 신설).\n\n\n\n\n법률 제 호\n고위공직자범죄수사처 설치 및 운영에 관한 법률\n일부개정법률안\n고위공직자범죄수사처 설치 및 운영에 관한 법률 일부를 다음과 같이\n개정한다.\n제8조에 제5항을 다음과 같이 신설한다.\n⑤ 대통령은 제1항의 추천을 받은 날부터 30일 내에 수사처검사를\n임명하여야 한다.\n부 칙\n제1조(시행일) 이 법은 공포 후 6개월이 경과한 날부터 시행한다.\n제2조(수사처검사 임명에 관한 적용례) 제8조제5항의 개정규정은 이\n법 시행 이후 인사위원회가 수사처검사를 추천하는 경우부터 적용\n한다.\n\n\n\n\n신ㆍ구조문대비표\n현 행 개 정 안\n제8조(수사처검사) ① ∼ ④ (생 제8조(수사처검사) ① ∼ ④ (현\n략) 행과 같음)\n<신 설> ⑤ 대통령은 제1항의 추천을\n받은 날부터 30일 내에 수사처\n검사를 임명하여야 한다.\n",
  "sections": {
    "제안이유": "및",
    "주요내용": "현행법은 수사처검사는 인사위원회의 추천을 거쳐 대통령이 임명하\n고, 처장과 차장을 포함하여 25명 이내로 한다고 규정하고 있음.\n그런데 최근 수사처검사 4명의 연임에 대한 대통령 재가가 인사위\n원회의 추천으로부터 2개월 후이자 수사처검사 임기를 이틀 남겨둔\n시점에야 완료되었음. 임기연장이 불확실한 검사는 수사 연속성을 유\n지하기가 현실적으로 어려운바 대통령 재가의 지연은 가뜩이나 인원\n이 많지 않은 수사처검사의 인력 부족 문제를 심화하는 결과로 이어\n질 수 있음.\n이에 대통령은 인사위원회의 추천을 받은 날부터 30일 내에 수사처\n검사를 임명하여야 한다고 법에 명기함으로써 빠른 인력 충원을 도모\n하고 조직의 안정성을 제고하려는 것임(안 제8조제5항 신설).",
    "제안이유_및_주요내용": "현행법은 수사처검사는 인사위원회의 추천을 거쳐 대통령이 임명하\n고, 처장과 차장을 포함하여 25명 이내로 한다고 규정하고 있음.\n그런데 최근 수사처검사 4명의 연임에 대한 대통령 재가가 인사위\n원회의 추천으로부터 2개월 후이자 수사처검사 임기를 이틀 남겨둔\n시점에야 완료되었음. 임기연장이 불확실한 검사는 수사 연속성을 유\n지하기가 현실적으로 어려운바 대통령 재가의 지연은 가뜩이나 인원\n이 많지 않은 수사처검사의 인력 부족 문제를 심화하는 결과로 이어\n질 수 있음.\n이에 대통령은 인사위원회의 추천을 받은 날부터 30일 내에 수사처\n검사를 임명하여야 한다고 법에 명기함으로써 빠른 인력 충원을 도모\n하고 조직의 안정성을 제고하려는 것임(안 제8조제5항 신설).",
    "법률_제_호": "고위공직자범죄수사처 설치 및 운영에 관한 법률\n일부개정법률안\n고위공직자범죄수사처 설치 및 운영에 관한 법률 일부를 다음과 같이\n개정한다.\n제8조에 제5항을 다음과 같이 신설한다.\n⑤ 대통령은 제1항의 추천을 받은 날부터 30일 내에 수사처검사를\n임명하여야 한다.",
    "신구조문대비표": "현 행 개 정 안\n제8조(수사처검사) ① ∼ ④ (생 제8조(수사처검사) ① ∼ ④ (현\n략) 행과 같음)\n<신 설> ⑤ 대통령은 제1항의 추천을\n받은 날부터 30일 내에 수사처\n검사를 임명하여야 한다."
  }
}