{
  "title": "2205817_낙농진흥법_일부개정법률안",
  "bill_number": "5817",
  "proposal_date": "2024. 11. 22.",
  "submission_date": "",
  "is_alternative": false,
  "alternative_bill_numbers": [],
  "has_comparison_table": false,
  "comparison_table": "신ㆍ구조문대비표\n현 행 개 정 안\n제3조(낙농진흥계획의 수립) ① 제3조(낙농진흥계획의 수립) ①\n(생 략) (현행과 같음)\n<신 설> ② 농림축산식품부장관이 낙농\n진흥계획을 수립할 때에는 낙\n농가 및 낙농관련단체 등의 의\n견을 들어야 한다.\n②ㆍ③ (생 략) ③ㆍ④ (현행 제2항 및 제3항\n과 같음)",
  "full_text": "낙농진흥법 일부개정법률안\n(안호영의원 대표발의)\n발의연월일 : 2024. 11. 22.\n의 안\n5817\n번 호 발 의 자 : 안호영ㆍ이학영ㆍ이원택\n어기구ㆍ윤준병ㆍ주철현\n정을호ㆍ박희승ㆍ소병훈\n박홍배 의원(10인)\n제안이유 및 주요내용\n현행법은 농림축산식품부장관이 낙농업의 구조 개선에 관한 사항\n등을 포함한 낙농진흥계획을 수립하도록 하고 있음.\n이러한 진흥계획은 정책적 필요에 따라 특정 산업을 육성하거나 개\n인ㆍ기업을 지원하기 위한 정책 방향 및 수단을 제시하는 것으로서\n계획 수립 시 해당 계획의 정책 대상이나 관련 기관ㆍ단체 등 이해관\n계자의 의견을 수렴할 필요가 있음.\n이에 농림축산식품부장관이 낙농진흥계획을 수립할 때에는 낙농가,\n낙농관련단체 등으로부터 의견을 듣도록 하는 규정을 마련하려는 것\n임(안 제3조제2항 신설).\n\n\n\n\n법률 제 호\n낙농진흥법 일부개정법률안\n낙농진흥법 일부를 다음과 같이 개정한다.\n제3조제2항 및 제3항을 각각 제3항 및 제4항으로 하고, 같은 조에 제2\n항을 다음과 같이 신설한다.\n② 농림축산식품부장관이 낙농진흥계획을 수립할 때에는 낙농가 및\n낙농관련단체 등의 의견을 들어야 한다.\n부 칙\n이 법은 공포 후 6개월이 경과한 날부터 시행한다.\n\n\n\n\n신ㆍ구조문대비표\n현 행 개 정 안\n제3조(낙농진흥계획의 수립) ① 제3조(낙농진흥계획의 수립) ①\n(생 략) (현행과 같음)\n<신 설> ② 농림축산식품부장관이 낙농\n진흥계획을 수립할 때에는 낙\n농가 및 낙농관련단체 등의 의\n견을 들어야 한다.\n②ㆍ③ (생 략) ③ㆍ④ (현행 제2항 및 제3항\n과 같음)\n",
  "sections": {
    "제안이유": "및",
    "주요내용": "현행법은 농림축산식품부장관이 낙농업의 구조 개선에 관한 사항\n등을 포함한 낙농진흥계획을 수립하도록 하고 있음.\n이러한 진흥계획은 정책적 필요에 따라 특정 산업을 육성하거나 개\n인ㆍ기업을 지원하기 위한 정책 방향 및 수단을 제시하는 것으로서\n계획 수립 시 해당 계획의 정책 대상이나 관련 기관ㆍ단체 등 이해관\n계자의 의견을 수렴할 필요가 있음.\n이에 농림축산식품부장관이 낙농진흥계획을 수립할 때에는 낙농가,\n낙농관련단체 등으로부터 의견을 듣도록 하는 규정을 마련하려는 것\n임(안 제3조제2항 신설).",
    "제안이유_및_주요내용": "현행법은 농림축산식품부장관이 낙농업의 구조 개선에 관한 사항\n등을 포함한 낙농진흥계획을 수립하도록 하고 있음.\n이러한 진흥계획은 정책적 필요에 따라 특정 산업을 육성하거나 개\n인ㆍ기업을 지원하기 위한 정책 방향 및 수단을 제시하는 것으로서\n계획 수립 시 해당 계획의 정책 대상이나 관련 기관ㆍ단체 등 이해관\n계자의 의견을 수렴할 필요가 있음.\n이에 농림축산식품부장관이 낙농진흥계획을 수립할 때에는 낙농가,\n낙농관련단체 등으로부터 의견을 듣도록 하는 규정을 마련하려는 것\n임(안 제3조제2항 신설).",
    "법률_제_호": "낙농진흥법 일부개정법률안\n낙농진흥법 일부를 다음과 같이 개정한다.\n제3조제2항 및 제3항을 각각 제3항 및 제4항으로 하고, 같은 조에 제2\n항을 다음과 같이 신설한다.\n② 농림축산식품부장관이 낙농진흥계획을 수립할 때에는 낙농가 및\n낙농관련단체 등의 의견을 들어야 한다.",
    "신구조문대비표": "현 행 개 정 안\n제3조(낙농진흥계획의 수립) ① 제3조(낙농진흥계획의 수립) ①\n(생 략) (현행과 같음)\n<신 설> ② 농림축산식품부장관이 낙농\n진흥계획을 수립할 때에는 낙\n농가 및 낙농관련단체 등의 의\n견을 들어야 한다.\n②ㆍ③ (생 략) ③ㆍ④ (현행 제2항 및 제3항\n과 같음)"
  }
}