{
  "title": "2205788_고위공직자범죄수사처_설치_및_운영에_관한_법률_일부개정법률안",
  "bill_number": "5788",
  "proposal_date": "2024. 11. 22.",
  "submission_date": "",
  "is_alternative": false,
  "alternative_bill_numbers": [],
  "has_comparison_table": false,
  "comparison_table": "신ㆍ구조문대비표\n현 행 개 정 안\n제26조(수사처검사의 관계 서류 제26조(수사처검사의 관계 서류\n와 증거물 송부 등) ① ㆍ ② 와 증거물 송부 등) ① ㆍ ②\n(생 략) (현행과 같음)\n<신 설> ③ 제2항에 따라 사건을 처리\n하는 검사는 수사처검사에게\n보완수사를 요구할 수 없다.",
  "full_text": "고위공직자범죄수사처 설치 및 운영에 관한 법률\n일부개정법률안\n(김승원의원 대표발의)\n발의연월일 : 2024. 11. 22.\n의 안\n5788\n번 호 발 의 자 : 김승원ㆍ조 국ㆍ박홍배\n김현정ㆍ안태준ㆍ이원택\n최민희ㆍ조계원ㆍ이건태\n박균택ㆍ박지원ㆍ박선원\n의원(12인)\n제안이유 및 주요내용\n현행법에 따르면 수사처검사는 대법원장 및 대법관, 검찰총장, 판사\n및 검사, 경무관 이상 경찰공무원이 범한 고위공직자범죄의 사건을 제\n외한 고위공직자범죄에 관한 수사를 한 때에는 관계 서류와 증거물을\n서울중앙지방검찰청 소속 검사에게 송부하도록 하고, 송부받은 검사는\n처장에게 해당 사건의 공소제기 여부를 통보하도록 정하고 있음.\n그런데 수사처에 기소권이 없는 사건에 대하여 검찰이 보완수사를\n요구한 경우 수사처가 이 요구에 응해야 하는지에 대한 논란이 제기\n되고 있음.\n이에 서울중앙지방검찰청 소속 검사는 보완수사를 요구할 수 없도\n록 명문화함으로써 고위공직자범죄수사처의 독립성을 높이려는 것임\n(안 제26조제3항 신설).\n\n\n\n\n법률 제 호\n고위공직자범죄수사처 설치 및 운영에 관한 법률\n일부개정법률안\n고위공직자범죄수사처 설치 및 운영에 관한 법률 일부를 다음과 같이\n개정한다.\n제26조에 제3항을 다음과 같이 신설한다.\n③ 제2항에 따라 사건을 처리하는 검사는 수사처검사에게 보완수사\n를 요구할 수 없다.\n부 칙\n제1조(시행일) 이 법은 공포 후 6개월이 경과한 날부터 시행한다.\n제2조(보완수사 요구에 관한 적용례) 제26조제3항의 개정규정은 이 법\n시행 이후 수사처검사가 서울중앙지방검찰청 소속 검사에게 관계\n서류와 증거물을 송부한 사건부터 적용한다.\n\n\n\n\n신ㆍ구조문대비표\n현 행 개 정 안\n제26조(수사처검사의 관계 서류 제26조(수사처검사의 관계 서류\n와 증거물 송부 등) ① ㆍ ② 와 증거물 송부 등) ① ㆍ ②\n(생 략) (현행과 같음)\n<신 설> ③ 제2항에 따라 사건을 처리\n하는 검사는 수사처검사에게\n보완수사를 요구할 수 없다.\n",
  "sections": {
    "제안이유": "및",
    "주요내용": "현행법에 따르면 수사처검사는 대법원장 및 대법관, 검찰총장, 판사\n및 검사, 경무관 이상 경찰공무원이 범한 고위공직자범죄의 사건을 제\n외한 고위공직자범죄에 관한 수사를 한 때에는 관계 서류와 증거물을\n서울중앙지방검찰청 소속 검사에게 송부하도록 하고, 송부받은 검사는\n처장에게 해당 사건의 공소제기 여부를 통보하도록 정하고 있음.\n그런데 수사처에 기소권이 없는 사건에 대하여 검찰이 보완수사를\n요구한 경우 수사처가 이 요구에 응해야 하는지에 대한 논란이 제기\n되고 있음.\n이에 서울중앙지방검찰청 소속 검사는 보완수사를 요구할 수 없도\n록 명문화함으로써 고위공직자범죄수사처의 독립성을 높이려는 것임\n(안 제26조제3항 신설).",
    "제안이유_및_주요내용": "현행법에 따르면 수사처검사는 대법원장 및 대법관, 검찰총장, 판사\n및 검사, 경무관 이상 경찰공무원이 범한 고위공직자범죄의 사건을 제\n외한 고위공직자범죄에 관한 수사를 한 때에는 관계 서류와 증거물을\n서울중앙지방검찰청 소속 검사에게 송부하도록 하고, 송부받은 검사는\n처장에게 해당 사건의 공소제기 여부를 통보하도록 정하고 있음.\n그런데 수사처에 기소권이 없는 사건에 대하여 검찰이 보완수사를\n요구한 경우 수사처가 이 요구에 응해야 하는지에 대한 논란이 제기\n되고 있음.\n이에 서울중앙지방검찰청 소속 검사는 보완수사를 요구할 수 없도\n록 명문화함으로써 고위공직자범죄수사처의 독립성을 높이려는 것임\n(안 제26조제3항 신설).",
    "법률_제_호": "고위공직자범죄수사처 설치 및 운영에 관한 법률\n일부개정법률안\n고위공직자범죄수사처 설치 및 운영에 관한 법률 일부를 다음과 같이\n개정한다.\n제26조에 제3항을 다음과 같이 신설한다.\n③ 제2항에 따라 사건을 처리하는 검사는 수사처검사에게 보완수사\n를 요구할 수 없다.",
    "신구조문대비표": "현 행 개 정 안\n제26조(수사처검사의 관계 서류 제26조(수사처검사의 관계 서류\n와 증거물 송부 등) ① ㆍ ② 와 증거물 송부 등) ① ㆍ ②\n(생 략) (현행과 같음)\n<신 설> ③ 제2항에 따라 사건을 처리\n하는 검사는 수사처검사에게\n보완수사를 요구할 수 없다."
  }
}