{
  "title": "2205271_국민연금법_일부개정법률안",
  "bill_number": "5271",
  "proposal_date": "2024. 11. 5.",
  "submission_date": "",
  "is_alternative": false,
  "alternative_bill_numbers": [],
  "has_comparison_table": false,
  "comparison_table": "신ㆍ구조문대비표\n현 행 개 정 안\n법률 제15267호 국민연금법 일부 법률 제15267호 국민연금법 일부\n개정법률 ",
  "full_text": "국민연금법 일부개정법률안\n(서영교의원 대표발의)\n발의연월일 : 2024. 11. 5.\n의 안\n5271\n번 호 발 의 자 : 서영교ㆍ박희승ㆍ임오경\n허 영ㆍ박홍배ㆍ윤준병\n박균택ㆍ위성곤ㆍ강유정\n송재봉ㆍ이수진ㆍ진선미\n의원(12인)\n제안이유 및 주요내용\n현행법은 이혼한 자에 대하여 노령연금 수급자인 배우자의 연금형\n성에 기여한 바를 고려하여 연금의 일정 부분을 분할하여 지급하도록\n하는 분할연금 제도를 규정하고 있음. 그리고 이에 대한 기준을 별거,\n가출 등의 사유로 인하여 실질적인 혼인관계가 존재하지 아니하였던\n기간을 제외한 혼인기간이 5년 이상인 자로 규정하고 있음.\n이는 ‘법률혼’ 기간을 기준으로 분할연금 수급권을 인정했던 과거\n법률에 대한 헌법재판소의 헌법불합치 결정(2016. 12. 29. 2015헌바\n182)에 따라 수급권 인정 기준을 개정한 결과임.\n그런데 분할연금 수급권 인정 기준을 현행과 같이 개정하면서 그\n적용 대상을 법률 시행일인 ‘2018년 6월 20일 이후 최초로 분할연금\n지급 사유가 발생하는 경우’부터 적용하도록 부칙에서 규정하였는데,\n최근 헌법재판소는 이에 대하여 ‘헌법불합치 결정일인 2016년 12월 29\n\n\n\n일부터 신법 조항 시행일인 2018년 6월 20일 사이에 지급 분할연금\n지급사유가 발생한 노령연금 수급권자에 대하여 2018년 6월 20일 이\n후 분할연금 지급 사유가 발생한 노령연금 수급권자와 달리 신법의\n조항을 적용하지 않는 차별 취급이 합리적인 이유를 찾기 어렵다는\n내용의 헌법불합치 결정을 하였음(2024. 5. 30. 2019헌가29).\n이에 종전 헌법불합치 결정일(2016년 12월 29일) 이후 분할연금 지\n급사유가 발생한 경우로써 최근 헌법불합치 결정일(2024년 5월 30일)\n이후 발생하는 급여분에 대해서도 신법을 적용하도록 하여 법률의 위\n헌 요소를 제거하려는 것임(법률 제15267호 국민연금법 일부개정법률\n부칙 제2조).\n\n법률 제 호\n국민연금법 일부개정법률안\n국민연금법 일부를 다음과 같이 개정한다.\n법률 제15267호 국민연금법 일부개정법률 부칙 제2조 제목 외의 부분\n을 제1항으로 하고, 같은 조에 제2항을 다음과 같이 신설한다.\n② 제1항에도 불구하고 2016년 12월 29일부터 2018년 6월 19일까지\n의 기간에 분할연금 지급 사유가 발생한 경우에는 2024년 5월 30일\n이후 발생하는 급여분부터 제64조제1항 및 제4항의 개정규정을 적\n용한다.\n부 칙\n이 법은 공포한 날부터 시행한다.\n\n\n\n\n신ㆍ구조문대비표\n현 행 개 정 안\n법률 제15267호 국민연금법 일부 법률 제15267호 국민연금법 일부\n개정법률 부칙 개정법률 부칙\n제2조(분할연금 수급권자 등에 제2조(분할연금 수급권자 등에\n관한 적용례) (생 략) 관한 적용례) ① (현행 제목 외\n의 부분과 같음)\n<신 설> ② 제1항에도 불구하고 2016년\n12월 29일부터 2018년 6월 19\n일까지의 기간에 분할연금 지\n급 사유가 발생한 경우에는 20\n24년 5월 30일이후 발생하는\n급여분부터 제64조제1항 및 제\n4항의 개정규정을 적용한다.\n",
  "sections": {
    "제안이유": "및",
    "주요내용": "현행법은 이혼한 자에 대하여 노령연금 수급자인 배우자의 연금형\n성에 기여한 바를 고려하여 연금의 일정 부분을 분할하여 지급하도록\n하는 분할연금 제도를 규정하고 있음. 그리고 이에 대한 기준을 별거,\n가출 등의 사유로 인하여 실질적인 혼인관계가 존재하지 아니하였던\n기간을 제외한 혼인기간이 5년 이상인 자로 규정하고 있음.\n이는 ‘법률혼’ 기간을 기준으로 분할연금 수급권을 인정했던 과거\n법률에 대한 헌법재판소의 헌법불합치 결정(2016. 12. 29. 2015헌바\n182)에 따라 수급권 인정 기준을 개정한 결과임.\n그런데 분할연금 수급권 인정 기준을 현행과 같이 개정하면서 그\n적용 대상을 법률 시행일인 ‘2018년 6월 20일 이후 최초로 분할연금\n지급 사유가 발생하는 경우’부터 적용하도록 부칙에서 규정하였는데,\n최근 헌법재판소는 이에 대하여 ‘헌법불합치 결정일인 2016년 12월 29\n\n\n\n일부터 신법 조항 시행일인 2018년 6월 20일 사이에 지급 분할연금\n지급사유가 발생한 노령연금 수급권자에 대하여 2018년 6월 20일 이\n후 분할연금 지급 사유가 발생한 노령연금 수급권자와 달리 신법의\n조항을 적용하지 않는 차별 취급이 합리적인 이유를 찾기 어렵다는\n내용의 헌법불합치 결정을 하였음(2024. 5. 30. 2019헌가29).\n이에 종전 헌법불합치 결정일(2016년 12월 29일) 이후 분할연금 지\n급사유가 발생한 경우로써 최근 헌법불합치 결정일(2024년 5월 30일)\n이후 발생하는 급여분에 대해서도 신법을 적용하도록 하여 법률의 위\n헌 요소를 제거하려는 것임(",
    "제안이유_및_주요내용": "현행법은 이혼한 자에 대하여 노령연금 수급자인 배우자의 연금형\n성에 기여한 바를 고려하여 연금의 일정 부분을 분할하여 지급하도록\n하는 분할연금 제도를 규정하고 있음. 그리고 이에 대한 기준을 별거,\n가출 등의 사유로 인하여 실질적인 혼인관계가 존재하지 아니하였던\n기간을 제외한 혼인기간이 5년 이상인 자로 규정하고 있음.\n이는 ‘법률혼’ 기간을 기준으로 분할연금 수급권을 인정했던 과거\n법률에 대한 헌법재판소의 헌법불합치 결정(2016. 12. 29. 2015헌바\n182)에 따라 수급권 인정 기준을 개정한 결과임.\n그런데 분할연금 수급권 인정 기준을 현행과 같이 개정하면서 그\n적용 대상을 법률 시행일인 ‘2018년 6월 20일 이후 최초로 분할연금\n지급 사유가 발생하는 경우’부터 적용하도록 부칙에서 규정하였는데,\n최근 헌법재판소는 이에 대하여 ‘헌법불합치 결정일인 2016년 12월 29\n\n\n\n일부터 신법 조항 시행일인 2018년 6월 20일 사이에 지급 분할연금\n지급사유가 발생한 노령연금 수급권자에 대하여 2018년 6월 20일 이\n후 분할연금 지급 사유가 발생한 노령연금 수급권자와 달리 신법의\n조항을 적용하지 않는 차별 취급이 합리적인 이유를 찾기 어렵다는\n내용의 헌법불합치 결정을 하였음(2024. 5. 30. 2019헌가29).\n이에 종전 헌법불합치 결정일(2016년 12월 29일) 이후 분할연금 지\n급사유가 발생한 경우로써 최근 헌법불합치 결정일(2024년 5월 30일)\n이후 발생하는 급여분에 대해서도 신법을 적용하도록 하여 법률의 위\n헌 요소를 제거하려는 것임(",
    "법률_제_호": "국민연금법 일부개정법률",
    "신구조문대비표": "현 행 개 정 안\n법률 제15267호 국민연금법 일부 법률 제15267호 국민연금법 일부\n개정법률"
  }
}