{
  "title": "2205105_상속세_및_증여세법_일부개정법률안",
  "bill_number": "5105",
  "proposal_date": "2024. 10. 31.",
  "submission_date": "",
  "is_alternative": false,
  "alternative_bill_numbers": [],
  "has_comparison_table": false,
  "comparison_table": "신ㆍ구조문대비표\n현 행 개 정 안\n법률 제18591호 상속세 및 법률 제18591호 상속세 및\n증여세법 일부개정법률 ",
  "full_text": "상속세 및 증여세법 일부개정법률안\n(정태호의원 대표발의)\n발의연월일 : 2024. 10. 31.\n의 안\n5105\n번 호 발 의 자 : 정태호ㆍ이기헌ㆍ이연희\n한정애ㆍ박용갑ㆍ조정식\n이해식ㆍ김윤덕ㆍ박홍근\n이학영 의원(10인)\n제안이유 및 주요내용\n연부연납 제도는 국세징수절차상 일시납부의 원칙에 대한 예외로서\n납세의무자에게 분할납부 및 기한유예의 권익을 보장하는 것임. 2021.\n12. 21. 「상속세 및 증여세법」 개정에 의해 상속세 연부연납 기간이\n5년에서 10년으로, 2022. 12. 31. 개정으로는 가업상속 연부연납 기간\n이 10년에서 20년으로 납세자에게 유리하게 각각 확대되었음.\n그런데 위 개정법의 시행 전에 상속이 개시된 경우 확대된 연부연\n납 기간을 적용할 수 없도록 하였는데, 불가피하게 발생하는 피상속인\n의 사망시점을 기준으로 연부연납 기간을 적용하는 것은 연부연납 제\n도의 취지에 부합하지 않으며, 또한 상속개시 시점에 따라 연부연납\n기간이 5년 또는 10년이나 차이나는 것은 형평성에 어긋나는 문제가\n있음.\n이에 위 개정법 시행 전에 2천억원 미만의 상속세에 대한 상속이\n개시된 경우로서 연부연납 기간 중에 있거나 개정법 시행 후 연부연\n납허가를 신청하는 경우에는 확대된 연부연납 기간을 적용하려는 것\n\n\n\n임(법률 제18591호 상속세 및 증여세법 일부개정법률 부칙 및 법률 제\n19195호 상속세 및 증여세법 일부개정법률 부칙).\n\n법률 제 호\n상속세 및 증여세법 일부개정법률안\n상속세 및 증여세법 일부를 다음과 같이 개정한다.\n법률 제18591호 상속세 및 증여세법 일부개정법률 부칙에 제4조의2를\n다음과 같이 신설한다.\n제4조의2(연부연납에 관한 적용례) 제71조제2항제1호나목의 개정규정\n은 이 법 시행 전에 상속이 개시되어 연부연납 기간 중인 경우에도\n적용한다.\n법률 제19195호 상속세 및 증여세법 일부개정법률 부칙 제9조의 제목\n“(연부연납 기간에 관한 경과조치)”를 “(연부연납 기간에 관한 경과조\n치 등)”으로 하고, 같은 조에 단서를 다음과 같이 신설한다.\n다만, 이 법 시행 전에 2천억원 미만의 상속세에 대한 상속이 개시\n된 경우로서 연부연납 기간 중에 있는 분 또는 이 법 시행 이후 2\n천억원 미만의 상속세에 대한 연부연납 허가를 신청하는 분에 대해\n서는 제71조제2항제1호가목의 개정규정을 적용할 수 있다.\n부 칙\n이 법은 공포한 날부터 시행한다.\n\n\n\n신ㆍ구조문대비표\n현 행 개 정 안\n법률 제18591호 상속세 및 법률 제18591호 상속세 및\n증여세법 일부개정법률 부칙 증여세법 일부개정법률 부칙\n<신 설> 제4조의2(연부연납에 관한 적용\n례) 제71조제2항제1호나목의\n개정규정은 이 법 시행 전에\n상속이 개시되어 연부연납 기\n간 중인 경우에도 적용한다.\n법률 제19195호 상속세 및 법률 제19195호 상속세 및\n증여세법 일부개정법률 부칙 증여세법 일부개정법률 부칙\n제9조(연부연납 기간에 관한 경 제9조(연부연납 기간에 관한 경\n과조치) 이 법 시행 전에 상속 과조치 등) -----------------\n이 개시된 경우의 상속세 연부 ----------------------------\n----------------------------\n연납기간에 관하여는 제71조제\n----------------------------\n2항제1호가목의 개정규정에도\n----------------------------\n불구하고 종전의 규정에 따른\n--. 다만, 이 법 시행 전에 2천\n다. <단서 신설>\n억원 미만의 상속세에 대한 상\n속이 개시된 경우로서 연부연\n납 기간 중에 있는 분 또는 이\n법 시행 이후 2천억원 미만의\n상속세에 대한 연부연납허가를\n신청하는 분에 대해서는 제71\n조제2항1호가목의 개정규정을\n적용할 수 있다.",
  "sections": {
    "제안이유": "및",
    "주요내용": "연부연납 제도는 국세징수절차상 일시납부의 원칙에 대한 예외로서\n납세의무자에게 분할납부 및 기한유예의 권익을 보장하는 것임. 2021.\n12. 21. 「상속세 및 증여세법」 개정에 의해 상속세 연부연납 기간이\n5년에서 10년으로, 2022. 12. 31. 개정으로는 가업상속 연부연납 기간\n이 10년에서 20년으로 납세자에게 유리하게 각각 확대되었음.\n그런데 위 개정법의 시행 전에 상속이 개시된 경우 확대된 연부연\n납 기간을 적용할 수 없도록 하였는데, 불가피하게 발생하는 피상속인\n의 사망시점을 기준으로 연부연납 기간을 적용하는 것은 연부연납 제\n도의 취지에 부합하지 않으며, 또한 상속개시 시점에 따라 연부연납\n기간이 5년 또는 10년이나 차이나는 것은 형평성에 어긋나는 문제가\n있음.\n이에 위 개정법 시행 전에 2천억원 미만의 상속세에 대한 상속이\n개시된 경우로서 연부연납 기간 중에 있거나 개정법 시행 후 연부연\n납허가를 신청하는 경우에는 확대된 연부연납 기간을 적용하려는 것\n\n\n\n임(",
    "제안이유_및_주요내용": "연부연납 제도는 국세징수절차상 일시납부의 원칙에 대한 예외로서\n납세의무자에게 분할납부 및 기한유예의 권익을 보장하는 것임. 2021.\n12. 21. 「상속세 및 증여세법」 개정에 의해 상속세 연부연납 기간이\n5년에서 10년으로, 2022. 12. 31. 개정으로는 가업상속 연부연납 기간\n이 10년에서 20년으로 납세자에게 유리하게 각각 확대되었음.\n그런데 위 개정법의 시행 전에 상속이 개시된 경우 확대된 연부연\n납 기간을 적용할 수 없도록 하였는데, 불가피하게 발생하는 피상속인\n의 사망시점을 기준으로 연부연납 기간을 적용하는 것은 연부연납 제\n도의 취지에 부합하지 않으며, 또한 상속개시 시점에 따라 연부연납\n기간이 5년 또는 10년이나 차이나는 것은 형평성에 어긋나는 문제가\n있음.\n이에 위 개정법 시행 전에 2천억원 미만의 상속세에 대한 상속이\n개시된 경우로서 연부연납 기간 중에 있거나 개정법 시행 후 연부연\n납허가를 신청하는 경우에는 확대된 연부연납 기간을 적용하려는 것\n\n\n\n임(",
    "법률_제_호": "상속세 및 증여세법 일부개정법률",
    "신구조문대비표": "현 행 개 정 안\n법률 제18591호 상속세 및 법률 제18591호 상속세 및\n증여세법 일부개정법률"
  }
}