{
  "title": "2205428_자산유동화에_관한_법률_일부개정법률안",
  "bill_number": "5428",
  "proposal_date": "2024. 11. 11.",
  "submission_date": "",
  "is_alternative": false,
  "alternative_bill_numbers": [],
  "has_comparison_table": false,
  "comparison_table": "신ㆍ구조문대비표\n현 행 개 정 안\n제32조(수익증권의 발행) ① (생 제32조(수익증권의 발행) ① (현\n략) 행과 같음)\n② 제1항에 따른 수익증권의 <삭 제>\n발행에 관하여는 「자본시장과\n금융투자업에 관한 법률」 제1\n10조제1항부터 제4항까지를 적\n용하지 아니한다.",
  "full_text": "자산유동화에 관한 법률 일부개정법률안\n(김상훈의원 대표발의)\n발의연월일 : 2024. 11. 11.\n의 안\n5428\n번 호 발 의 자 : 김상훈ㆍ김선교ㆍ윤한홍\n고동진ㆍ김소희ㆍ권영진\n주호영ㆍ이달희ㆍ이헌승\n임종득ㆍ권성동ㆍ권영세\n송언석 의원(13인)\n제안이유 및 주요내용\n현행법에 따르면 신탁업자는 자산유동화계획에 따라 수익증권을 발\n행할 수 있도록 하면서 「자본시장과 금융투자업에 관한 법률」제110\n조제1항부터 제4항까지를 적용 제외되도록 규정하고 있음.\n한편 금융위원회가 「금융혁신지원 특별법」에 따라 시행되고 있는\n금융혁신서비스 중 ‘비금전재산신탁의 수익증권 발행제도’를 「자본시\n장과 금융투자업에 관한 법률」에 도입할 계획임을 밝히고 있어, 그에\n맞게 현행법 등 관련 법령을 정비할 필요성이 있음.\n이에 신탁업자가 수익증권을 발행하는 경우 「자본시장과 금융투자\n업에 관한 법률」 제110조도 적용되도록 근거 규정을 삭제하여 국민\n경제의 건전한 발전을 도모하려는 것임(안 제32조제2항 삭제).\n\n\n\n참고사항\n이 법률안은 김상훈의원이 대표발의한 「자본시장과 금융투자업에\n관한 법률 일부개정법률안」(의안번호 제5423호) 의결을 전제로 하는\n것이므로 같은 법률안이 의결되지 아니하거나 수정의결되는 경우에는\n이에 맞추어 조정되어야 할 것임.\n\n법률 제 호\n자산유동화에 관한 법률 일부개정법률안\n자산유동화에 관한 법률 일부를 다음과 같이 개정한다.\n제32조제2항을 삭제한다.\n부 칙\n이 법은 2025년 6월 18일부터 시행한다.\n\n\n\n\n신ㆍ구조문대비표\n현 행 개 정 안\n제32조(수익증권의 발행) ① (생 제32조(수익증권의 발행) ① (현\n략) 행과 같음)\n② 제1항에 따른 수익증권의 <삭 제>\n발행에 관하여는 「자본시장과\n금융투자업에 관한 법률」 제1\n10조제1항부터 제4항까지를 적\n용하지 아니한다.\n",
  "sections": {
    "제안이유": "및",
    "주요내용": "현행법에 따르면 신탁업자는 자산유동화계획에 따라 수익증권을 발\n행할 수 있도록 하면서 「자본시장과 금융투자업에 관한 법률」제110\n조제1항부터 제4항까지를 적용 제외되도록 규정하고 있음.\n한편 금융위원회가 「금융혁신지원 특별법」에 따라 시행되고 있는\n금융혁신서비스 중 ‘비금전재산신탁의 수익증권 발행제도’를 「자본시\n장과 금융투자업에 관한 법률」에 도입할 계획임을 밝히고 있어, 그에\n맞게 현행법 등 관련 법령을 정비할 필요성이 있음.\n이에 신탁업자가 수익증권을 발행하는 경우 「자본시장과 금융투자\n업에 관한 법률」 제110조도 적용되도록 근거 규정을 삭제하여 국민\n경제의 건전한 발전을 도모하려는 것임(안 제32조제2항 삭제).",
    "제안이유_및_주요내용": "현행법에 따르면 신탁업자는 자산유동화계획에 따라 수익증권을 발\n행할 수 있도록 하면서 「자본시장과 금융투자업에 관한 법률」제110\n조제1항부터 제4항까지를 적용 제외되도록 규정하고 있음.\n한편 금융위원회가 「금융혁신지원 특별법」에 따라 시행되고 있는\n금융혁신서비스 중 ‘비금전재산신탁의 수익증권 발행제도’를 「자본시\n장과 금융투자업에 관한 법률」에 도입할 계획임을 밝히고 있어, 그에\n맞게 현행법 등 관련 법령을 정비할 필요성이 있음.\n이에 신탁업자가 수익증권을 발행하는 경우 「자본시장과 금융투자\n업에 관한 법률」 제110조도 적용되도록 근거 규정을 삭제하여 국민\n경제의 건전한 발전을 도모하려는 것임(안 제32조제2항 삭제).",
    "법률_제_호": "자산유동화에 관한 법률 일부개정법률안\n자산유동화에 관한 법률 일부를 다음과 같이 개정한다.\n제32조제2항을 삭제한다.",
    "신구조문대비표": "현 행 개 정 안\n제32조(수익증권의 발행) ① (생 제32조(수익증권의 발행) ① (현\n략) 행과 같음)\n② 제1항에 따른 수익증권의 <삭 제>\n발행에 관하여는 「자본시장과\n금융투자업에 관한 법률」 제1\n10조제1항부터 제4항까지를 적\n용하지 아니한다."
  }
}