{
  "title": "2205855_야생생물_보호_및_관리에_관한_법률_일부개정법률안",
  "bill_number": "5855",
  "proposal_date": "2024. 11. 26.",
  "submission_date": "",
  "is_alternative": false,
  "alternative_bill_numbers": [],
  "has_comparison_table": false,
  "comparison_table": "신ㆍ구조문대비표\n현 행 개 정 안\n제45조(수렵면허시험 등) ① (생 제45조(수렵면허시험 등) ① (현\n략) 행과 같음)\n<신 설> ② 제1항에 따른 수렵면허시험\n은 필기시험과 실기시험으로\n구분하여 실시한다.\n②ㆍ③ (생 략) ③ㆍ④ (현행 제2항 및 제3항\n과 같음)",
  "full_text": "야생생물 보호 및 관리에 관한 법률 일부개정법률안\n(임종득의원 대표발의)\n발의연월일 : 2024. 11. 26.\n의 안\n5855\n번 호 발 의 자 : 임종득ㆍ우재준ㆍ송언석\n김예지ㆍ박대출ㆍ김석기\n김상훈ㆍ이달희ㆍ강대식\n김기웅 의원(10인)\n제안이유 및 주요내용\n현행법 시행령은 수렵면허시험의 방법은 필기시험을 원칙으로 하고,\n시ㆍ도지사가 필요한 경우 실기시험을 추가할 수 있도록 하고 있으나,\n실제로는 실기시험을 실시하고 있지 않아 사격술에 대한 검증이 이루\n어지지 않고 있음.\n사격술이 미흡한 상태에서의 수렵행위는 총기로 인한 인명사고로\n이어질 수 있으므로 수렵면허시험에 사격술에 대한 검증 과정이 추가\n될 필요가 있음.\n이에 수렵면허시험에서 실기시험을 의무화하여 사격술 미흡으로 인\n한 인명사고 발생을 예방하려는 것임(안 제45조제2항 신설).\n\n\n\n\n법률 제 호\n야생생물 보호 및 관리에 관한 법률 일부개정법률안\n야생생물 보호 및 관리에 관한 법률 일부를 다음과 같이 개정한다.\n제45조제2항 및 제3항을 각각 제3항 및 제4항으로 하고, 같은 조에 제\n2항을 다음과 같이 신설한다.\n② 제1항에 따른 수렵면허시험은 필기시험과 실기시험으로 구분하\n여 실시한다.\n부 칙\n제1조(시행일) 이 법은 공포 후 6개월이 경과한 날부터 시행한다.\n제2조(수렵면허시험에 관한 적용례) 제45조의 개정규정은 이 법 시행\n이후 수렵면허시험을 실시하는 경우부터 적용한다.\n\n\n\n\n신ㆍ구조문대비표\n현 행 개 정 안\n제45조(수렵면허시험 등) ① (생 제45조(수렵면허시험 등) ① (현\n략) 행과 같음)\n<신 설> ② 제1항에 따른 수렵면허시험\n은 필기시험과 실기시험으로\n구분하여 실시한다.\n②ㆍ③ (생 략) ③ㆍ④ (현행 제2항 및 제3항\n과 같음)\n",
  "sections": {
    "제안이유": "및",
    "주요내용": "현행법 시행령은 수렵면허시험의 방법은 필기시험을 원칙으로 하고,\n시ㆍ도지사가 필요한 경우 실기시험을 추가할 수 있도록 하고 있으나,\n실제로는 실기시험을 실시하고 있지 않아 사격술에 대한 검증이 이루\n어지지 않고 있음.\n사격술이 미흡한 상태에서의 수렵행위는 총기로 인한 인명사고로\n이어질 수 있으므로 수렵면허시험에 사격술에 대한 검증 과정이 추가\n될 필요가 있음.\n이에 수렵면허시험에서 실기시험을 의무화하여 사격술 미흡으로 인\n한 인명사고 발생을 예방하려는 것임(안 제45조제2항 신설).",
    "제안이유_및_주요내용": "현행법 시행령은 수렵면허시험의 방법은 필기시험을 원칙으로 하고,\n시ㆍ도지사가 필요한 경우 실기시험을 추가할 수 있도록 하고 있으나,\n실제로는 실기시험을 실시하고 있지 않아 사격술에 대한 검증이 이루\n어지지 않고 있음.\n사격술이 미흡한 상태에서의 수렵행위는 총기로 인한 인명사고로\n이어질 수 있으므로 수렵면허시험에 사격술에 대한 검증 과정이 추가\n될 필요가 있음.\n이에 수렵면허시험에서 실기시험을 의무화하여 사격술 미흡으로 인\n한 인명사고 발생을 예방하려는 것임(안 제45조제2항 신설).",
    "법률_제_호": "야생생물 보호 및 관리에 관한 법률 일부개정법률안\n야생생물 보호 및 관리에 관한 법률 일부를 다음과 같이 개정한다.\n제45조제2항 및 제3항을 각각 제3항 및 제4항으로 하고, 같은 조에 제\n2항을 다음과 같이 신설한다.\n② 제1항에 따른 수렵면허시험은 필기시험과 실기시험으로 구분하\n여 실시한다.",
    "신구조문대비표": "현 행 개 정 안\n제45조(수렵면허시험 등) ① (생 제45조(수렵면허시험 등) ① (현\n략) 행과 같음)\n<신 설> ② 제1항에 따른 수렵면허시험\n은 필기시험과 실기시험으로\n구분하여 실시한다.\n②ㆍ③ (생 략) ③ㆍ④ (현행 제2항 및 제3항\n과 같음)"
  }
}