{
  "title": "2205380_각급_법원_판사_정원법_일부개정법률안",
  "bill_number": "5380",
  "proposal_date": "2024. 11. 8.",
  "submission_date": "",
  "is_alternative": false,
  "alternative_bill_numbers": [],
  "has_comparison_table": false,
  "comparison_table": "신ㆍ구조문대비표\n현 행 개 정 안\n제1조(각급 법원 판사의 수) 제1조(각급 법원 판사의 수) ---\n「법원조직법」 제5조제3항 본 ------------------------\n문에 따른 각급 법원 판사의 ------------------------\n수는 3,214명으로 한다. -----3,584명--------.",
  "full_text": "각급 법원 판사 정원법 일부개정법률안\n(서영교의원 대표발의)\n발의연월일 : 2024. 11. 8.\n의 안\n5380\n번 호 발 의 자 : 서영교ㆍ김용민ㆍ김준형\n오세희ㆍ김승원ㆍ박홍배\n전현희ㆍ이건태ㆍ박균택\n이재관ㆍ채현일ㆍ이훈기\n김 윤ㆍ김남근ㆍ박지원\n김문수ㆍ정성호ㆍ김현정\n장경태 의원(19인)\n제안이유 및 주요내용\n현행 판사정원법에 따른 현재 법관 정원은 3,214명으로 2014년 후\n10년째 묶여있음. 그 사이 사건은 복잡해지고 변호사는 폭증하고, 공\n판중심주의가 강화되었음. 사법정책연구원의 「재판의 지연 실태와 신\n속화 방안」에 따르면 2019년 기준 법관 1인당 민ㆍ형사 본안 사건\n수는 독일의 약 5.17배, 일본의 약 3.05배, 프랑스의 약 2.36배에 이름.\n전문가들은 우리나라의 법관 수가 각국의 사법제도가 다르다는 점을\n고려하더라도 다른 선진국에 비해 압도적으로 부족한 상황임을 지적\n하고 있음.\n이에 변화하는 사법 환경에 효과적으로 대응하고 신속하고 공정한\n재판을 통해 국민의 재판받을 권리를 실효적으로 보장하기 위해 판사\n\n\n\n의 정원을 3,214명에서 3,584명으로 증원하되, 2025년부터 2029년까지\n5년에 걸쳐 2025년에는 90명, 2026년에는 80명, 2027년에는 70명, 2028\n년에는 70명, 2029년에는 60명을 각각 증원하려는 것임(안 제1조).\n\n법률 제 호\n각급 법원 판사 정원법 일부개정법률안\n각급 법원 판사 정원법 일부를 다음과 같이 개정한다.\n제1조 중 “3,214명”을 “3,584명”으로 한다.\n부 칙\n이 법은 공포한 날부터 시행한다. 다만, 이 법에 따라 증원되는 판사\n의 정원 370명 중 90명의 증원은 2025년 1월 1일부터 시행하고, 80명\n의 증원은 2026년 1월 1일부터 시행하며, 70명의 증원은 2027년 1월 1\n일부터 시행하고, 70명의 증원은 2028년 1월 1일부터 시행하며, 60명\n의 증원은 2029년 1월 1일부터 시행한다.\n\n\n\n\n신ㆍ구조문대비표\n현 행 개 정 안\n제1조(각급 법원 판사의 수) 제1조(각급 법원 판사의 수) ---\n「법원조직법」 제5조제3항 본 ------------------------\n문에 따른 각급 법원 판사의 ------------------------\n수는 3,214명으로 한다. -----3,584명--------.\n",
  "sections": {
    "제안이유": "및",
    "주요내용": "현행 판사정원법에 따른 현재 법관 정원은 3,214명으로 2014년 후\n10년째 묶여있음. 그 사이 사건은 복잡해지고 변호사는 폭증하고, 공\n판중심주의가 강화되었음. 사법정책연구원의 「재판의 지연 실태와 신\n속화 방안」에 따르면 2019년 기준 법관 1인당 민ㆍ형사 본안 사건\n수는 독일의 약 5.17배, 일본의 약 3.05배, 프랑스의 약 2.36배에 이름.\n전문가들은 우리나라의 법관 수가 각국의 사법제도가 다르다는 점을\n고려하더라도 다른 선진국에 비해 압도적으로 부족한 상황임을 지적\n하고 있음.\n이에 변화하는 사법 환경에 효과적으로 대응하고 신속하고 공정한\n재판을 통해 국민의 재판받을 권리를 실효적으로 보장하기 위해 판사\n\n\n\n의 정원을 3,214명에서 3,584명으로 증원하되, 2025년부터 2029년까지\n5년에 걸쳐 2025년에는 90명, 2026년에는 80명, 2027년에는 70명, 2028\n년에는 70명, 2029년에는 60명을 각각 증원하려는 것임(안 제1조).",
    "제안이유_및_주요내용": "현행 판사정원법에 따른 현재 법관 정원은 3,214명으로 2014년 후\n10년째 묶여있음. 그 사이 사건은 복잡해지고 변호사는 폭증하고, 공\n판중심주의가 강화되었음. 사법정책연구원의 「재판의 지연 실태와 신\n속화 방안」에 따르면 2019년 기준 법관 1인당 민ㆍ형사 본안 사건\n수는 독일의 약 5.17배, 일본의 약 3.05배, 프랑스의 약 2.36배에 이름.\n전문가들은 우리나라의 법관 수가 각국의 사법제도가 다르다는 점을\n고려하더라도 다른 선진국에 비해 압도적으로 부족한 상황임을 지적\n하고 있음.\n이에 변화하는 사법 환경에 효과적으로 대응하고 신속하고 공정한\n재판을 통해 국민의 재판받을 권리를 실효적으로 보장하기 위해 판사\n\n\n\n의 정원을 3,214명에서 3,584명으로 증원하되, 2025년부터 2029년까지\n5년에 걸쳐 2025년에는 90명, 2026년에는 80명, 2027년에는 70명, 2028\n년에는 70명, 2029년에는 60명을 각각 증원하려는 것임(안 제1조).",
    "법률_제_호": "각급 법원 판사 정원법 일부개정법률안\n각급 법원 판사 정원법 일부를 다음과 같이 개정한다.\n제1조 중 “3,214명”을 “3,584명”으로 한다.",
    "신구조문대비표": "현 행 개 정 안\n제1조(각급 법원 판사의 수) 제1조(각급 법원 판사의 수) ---\n「법원조직법」 제5조제3항 본 ------------------------\n문에 따른 각급 법원 판사의 ------------------------\n수는 3,214명으로 한다. -----3,584명--------."
  }
}