{
  "title": "2205597_국민연금법_일부개정법률안",
  "bill_number": "5597",
  "proposal_date": "2024. 11. 14.",
  "submission_date": "",
  "is_alternative": false,
  "alternative_bill_numbers": [],
  "has_comparison_table": false,
  "comparison_table": "신ㆍ구조문대비표\n현 행 개 정 안\n법률 제15267호 국민연금법 일부 법률 제15267호 국민연금법 일부\n개정법률 ",
  "full_text": "국민연금법 일부개정법률안\n(강선우의원 대표발의)\n발의연월일 : 2024. 11. 14.\n의 안\n5597\n번 호 발 의 자 : 강선우ㆍ김윤덕ㆍ추미애\n서미화ㆍ김교흥ㆍ김한규\n김 윤ㆍ박홍배ㆍ박해철\n홍기원ㆍ조승래ㆍ박희승\n정을호 의원(13인)\n제안이유 및 주요내용\n헌법재판소는 2016년 12월 29일 별거나 가출 등으로 실질적인 혼인\n관계가 존재하지 아니하여 연금 형성에 기여가 없는 이혼배우자에 대\n해서까지 법률혼 기간을 기준으로 분할연금 수급권을 인정하는 구\n「국민연금법」 제64조제1항에 대하여 헌법불합치 결정을 내린 바 있\n음(2015헌바82).\n이후 국회는 2017년 12월 19일 「국민연금법 일부개정법률안」을\n본회의에서 의결하여 제64조제1항 및 제4항을 개정하였고 이와 동시\n에 부칙을 통해 제64조제1항 및 제4항의 개정규정은 법 시행 후 최초\n로 분할연금 지급 사유가 발생한 경우부터 적용하는 것으로 규정하였\n으나, 헌법재판소는 구 「국민연금법」 제64조제1항에 대한 헌법불합\n치 결정 이후부터 개정법률 시행 전에 분할연금 지급 사유가 발생한\n자에 대하여 제64조제1항 및 제4항의 개정규정을 적용하지 않은 것이\n\n\n\n평등원칙에 위반된다고 하여 헌법불합치 결정을 내린 바 있음(2019헌\n가29).\n이에 2016년 12월 29일 이후 분할연금 지급사유가 발생한 경우부터\n법률 제15267호 국민연금법 일부개정법률 제64조제1항 및 제4항이 적\n용되도록 하여 위헌성을 해소하려는 것임(안 법률 제15267호 국민연금\n법 일부개정법률 부칙 제2조).\n\n법률 제 호\n국민연금법 일부개정법률안\n국민연금법 일부를 다음과 같이 개정한다.\n법률 제15267호 국민연금법 일부개정법률 부칙 제2조 중 “이 법 시행\n후”를 “2016년 12월 29일 이후”로 하고, 같은 조에 단서를 다음과 같\n이 신설한다.\n다만, 이 법 시행 전에 소송에 따라 분할연금 지급권 변경에 관한\n처분이 확정되었거나 이 법 시행 당시 소송 제기가 불가한 경우는\n제외한다.\n부 칙\n이 법은 공포한 날부터 시행한다.\n\n\n\n\n신ㆍ구조문대비표\n현 행 개 정 안\n법률 제15267호 국민연금법 일부 법률 제15267호 국민연금법 일부\n개정법률 부칙 개정법률 부칙\n제2조(분할연금 수급권자 등에 제2조(분할연금 수급권자 등에\n관한 적용례) 제64조제1항 및 관한 적용례) ---------------\n제4항의 개정규정은 이 법 시 -------------------2016년 12\n행 후 최초로 분할연금 지급 월 29일 이후----------------\n사유가 발생한 경우부터 적용 ----------------------------\n한다. <단서 신설> ---------. 다만, 이 법 시행\n전에 소송에 따라 분할연금 지\n급권 변경에 관한 처분이 확정\n되었거나 이 법 시행 당시 소\n송 제기가 불가한 경우는 제외\n한다.\n",
  "sections": {
    "제안이유": "및",
    "주요내용": "헌법재판소는 2016년 12월 29일 별거나 가출 등으로 실질적인 혼인\n관계가 존재하지 아니하여 연금 형성에 기여가 없는 이혼배우자에 대\n해서까지 법률혼 기간을 기준으로 분할연금 수급권을 인정하는 구\n「국민연금법」 제64조제1항에 대하여 헌법불합치 결정을 내린 바 있\n음(2015헌바82).\n이후 국회는 2017년 12월 19일 「국민연금법 일부개정법률안」을\n본회의에서 의결하여 제64조제1항 및 제4항을 개정하였고 이와 동시\n에 부칙을 통해 제64조제1항 및 제4항의 개정규정은 법 시행 후 최초\n로 분할연금 지급 사유가 발생한 경우부터 적용하는 것으로 규정하였\n으나, 헌법재판소는 구 「국민연금법」 제64조제1항에 대한 헌법불합\n치 결정 이후부터 개정법률 시행 전에 분할연금 지급 사유가 발생한\n자에 대하여 제64조제1항 및 제4항의 개정규정을 적용하지 않은 것이\n\n\n\n평등원칙에 위반된다고 하여 헌법불합치 결정을 내린 바 있음(2019헌\n가29).\n이에 2016년 12월 29일 이후 분할연금 지급사유가 발생한 경우부터",
    "제안이유_및_주요내용": "헌법재판소는 2016년 12월 29일 별거나 가출 등으로 실질적인 혼인\n관계가 존재하지 아니하여 연금 형성에 기여가 없는 이혼배우자에 대\n해서까지 법률혼 기간을 기준으로 분할연금 수급권을 인정하는 구\n「국민연금법」 제64조제1항에 대하여 헌법불합치 결정을 내린 바 있\n음(2015헌바82).\n이후 국회는 2017년 12월 19일 「국민연금법 일부개정법률안」을\n본회의에서 의결하여 제64조제1항 및 제4항을 개정하였고 이와 동시\n에 부칙을 통해 제64조제1항 및 제4항의 개정규정은 법 시행 후 최초\n로 분할연금 지급 사유가 발생한 경우부터 적용하는 것으로 규정하였\n으나, 헌법재판소는 구 「국민연금법」 제64조제1항에 대한 헌법불합\n치 결정 이후부터 개정법률 시행 전에 분할연금 지급 사유가 발생한\n자에 대하여 제64조제1항 및 제4항의 개정규정을 적용하지 않은 것이\n\n\n\n평등원칙에 위반된다고 하여 헌법불합치 결정을 내린 바 있음(2019헌\n가29).\n이에 2016년 12월 29일 이후 분할연금 지급사유가 발생한 경우부터",
    "법률_제_호": "국민연금법 일부개정법률 제64조제1항 및 제4항이 적\n용되도록 하여 위헌성을 해소하려는 것임(안 법률 제15267호 국민연금\n법 일부개정법률",
    "신구조문대비표": "현 행 개 정 안\n법률 제15267호 국민연금법 일부 법률 제15267호 국민연금법 일부\n개정법률"
  }
}