{
  "title": "2205484_중소기업은행법_일부개정법률안",
  "bill_number": "5484",
  "proposal_date": "2024. 11. 12.",
  "submission_date": "",
  "is_alternative": false,
  "alternative_bill_numbers": [],
  "has_comparison_table": false,
  "comparison_table": "신ㆍ구조문대비표\n현 행 개 정 안\n제4조(본점, 지점, 출장소, 대리점 제4조(본점, 지점, 출장소, 대리점\n의 설치) ① 중소기업은행은 의 설치) ① --------------\n본점을 서울특별시에 둔다. -----대구광역시에-----.\n② (생 략) ② (현행과 같음)",
  "full_text": "중소기업은행법 일부개정법률안\n(윤재옥의원 대표발의)\n발의연월일 : 2024. 11. 12.\n의 안\n5484\n번 호 발 의 자 : 윤재옥ㆍ우재준ㆍ김위상\n추경호ㆍ김기웅ㆍ김상훈\n주호영ㆍ권영진ㆍ유영하\n이인선ㆍ강대식 의원\n(11인)\n제안이유 및 주요내용\n현행 「중소기업은행법」에는 중소기업은행의 본점을 서울특별시에\n둔다고 명시하고 있지만, 극심한 수도권 집중현상 완화와 지역균형발\n전 차원에서 이전의 필요성이 제기되고 있음.\n2021년 기준, 대구에는 334,698개의 중소기업이 있고, 중소기업비율\n이 99.94%에 달함. 또 중소기업 종사자수도 767,648명으로 비율로는 9\n3.55%에 이름. 전국 8대 특ㆍ광역시 중 최고수준임.\n또한 대구광역시에는 2014년 말 대구로 이전한 신용보증기금 본점\n이 위치해 있어 중소기업은행이 이전할 경우 중소기업에 대한 적극적\n인 자금지원이 가능하고, 금융 및 전문컨설팅 제공 등에서 시너지 효\n과가 기대됨.\n이에 중소기업은행의 본점을 대구광역시에 두도록 함으로써 중소기\n업 중심인 지역경제 활성화 및 지역 금융 인프라 육성을 도모하고, 국\n\n\n\n가균형발전에 이바지하고자 함(안 제4조제1항).\n\n법률 제 호\n중소기업은행법 일부개정법률안\n중소기업은행법 일부를 다음과 같이 개정한다.\n제4조제1항 중 “서울특별시에”를 “대구광역시에”로 한다.\n부 칙\n이 법은 공포한 날부터 시행한다.\n\n\n\n\n신ㆍ구조문대비표\n현 행 개 정 안\n제4조(본점, 지점, 출장소, 대리점 제4조(본점, 지점, 출장소, 대리점\n의 설치) ① 중소기업은행은 의 설치) ① --------------\n본점을 서울특별시에 둔다. -----대구광역시에-----.\n② (생 략) ② (현행과 같음)\n",
  "sections": {
    "제안이유": "및",
    "주요내용": "현행 「중소기업은행법」에는 중소기업은행의 본점을 서울특별시에\n둔다고 명시하고 있지만, 극심한 수도권 집중현상 완화와 지역균형발\n전 차원에서 이전의 필요성이 제기되고 있음.\n2021년 기준, 대구에는 334,698개의 중소기업이 있고, 중소기업비율\n이 99.94%에 달함. 또 중소기업 종사자수도 767,648명으로 비율로는 9\n3.55%에 이름. 전국 8대 특ㆍ광역시 중 최고수준임.\n또한 대구광역시에는 2014년 말 대구로 이전한 신용보증기금 본점\n이 위치해 있어 중소기업은행이 이전할 경우 중소기업에 대한 적극적\n인 자금지원이 가능하고, 금융 및 전문컨설팅 제공 등에서 시너지 효\n과가 기대됨.\n이에 중소기업은행의 본점을 대구광역시에 두도록 함으로써 중소기\n업 중심인 지역경제 활성화 및 지역 금융 인프라 육성을 도모하고, 국\n\n\n\n가균형발전에 이바지하고자 함(안 제4조제1항).",
    "제안이유_및_주요내용": "현행 「중소기업은행법」에는 중소기업은행의 본점을 서울특별시에\n둔다고 명시하고 있지만, 극심한 수도권 집중현상 완화와 지역균형발\n전 차원에서 이전의 필요성이 제기되고 있음.\n2021년 기준, 대구에는 334,698개의 중소기업이 있고, 중소기업비율\n이 99.94%에 달함. 또 중소기업 종사자수도 767,648명으로 비율로는 9\n3.55%에 이름. 전국 8대 특ㆍ광역시 중 최고수준임.\n또한 대구광역시에는 2014년 말 대구로 이전한 신용보증기금 본점\n이 위치해 있어 중소기업은행이 이전할 경우 중소기업에 대한 적극적\n인 자금지원이 가능하고, 금융 및 전문컨설팅 제공 등에서 시너지 효\n과가 기대됨.\n이에 중소기업은행의 본점을 대구광역시에 두도록 함으로써 중소기\n업 중심인 지역경제 활성화 및 지역 금융 인프라 육성을 도모하고, 국\n\n\n\n가균형발전에 이바지하고자 함(안 제4조제1항).",
    "법률_제_호": "중소기업은행법 일부개정법률안\n중소기업은행법 일부를 다음과 같이 개정한다.\n제4조제1항 중 “서울특별시에”를 “대구광역시에”로 한다.",
    "신구조문대비표": "현 행 개 정 안\n제4조(본점, 지점, 출장소, 대리점 제4조(본점, 지점, 출장소, 대리점\n의 설치) ① 중소기업은행은 의 설치) ① --------------\n본점을 서울특별시에 둔다. -----대구광역시에-----.\n② (생 략) ② (현행과 같음)"
  }
}