{
  "title": "2205948_국가배상법_일부개정법률안",
  "bill_number": "5948",
  "proposal_date": "2024. 11. 27.",
  "submission_date": "",
  "is_alternative": false,
  "alternative_bill_numbers": [],
  "has_comparison_table": false,
  "comparison_table": "신·구조문대비표\n현 행 개 정 안\n제2조(배상책임) ①ㆍ② (생 략) 제2조(배상책임) ①ㆍ② (현행과\n같음)\n<신 설> ③ 제1항 단서에도 불구하고\n전사(戰死)ㆍ순직(殉職)한 군인\nㆍ군무원ㆍ경찰공무원 또는 예\n비군대원의 유족과 공상을 입\n은 군인 등의 본인 또는 가족\n은 정신적 고통에 대한 위자료\n를 청구할 수 있다.",
  "full_text": "국가배상법 일부개정법률안\n(김민석의원 대표발의)\n발의연월일 : 2024. 11. 27.\n의 안\n5948\n번 호 발 의 자 : 김민석ㆍ서영교ㆍ이건태\n장경태ㆍ박홍배ㆍ박선원\n김영호ㆍ안규백ㆍ황명선\n김용민ㆍ김병주ㆍ진성준\n의원(12인)\n제안이유 및 주요내용\n현행법상 공무원 등의 고의 또는 과실로 법령을 위반하여 사망하거\n나 신체의 해를 입은 피해자의 직계존속, 직계비속 및 배우자는 피해\n자의 사회적 지위, 과실(過失)의 정도, 생계 상태, 손해배상액 등을 고\n려하여 그 정신적 고통에 대한 위자료를 배상받을 수 있음.\n그러나 군인 등이 직무 중 전사ㆍ순직하거나 공상을 입은 경우 다\n른 법령에 따라 보상을 지급받을 수 있을 때에는, 「민법」 및 「국가\n배상법」에 따른 손해배상을 청구할 수 없음. 이에 따라 군인 등의 유\n족이나 가족이 정신적 고통에 대한 위자료를 청구하는 것이 제한되고\n있음.\n이에 국가를 위해 희생한 군인 등이 전사ㆍ순직하거나 공상을 입은\n경우 유족과 가족 등에 대해서도 정신적 고통에 대한 위자료를 청구\n\n\n\n할 수 있는 명확한 법률적 근거를 마련하고자 함(안 제2조제3항 신\n설).\n\n법률 제 호\n국가배상법 일부개정법률안\n국가배상법 일부를 다음과 같이 개정한다.\n제2조에 제3항을 다음과 같이 신설한다.\n③ 제1항 단서에도 불구하고 전사(戰死)ㆍ순직(殉職)한 군인ㆍ군무\n원ㆍ경찰공무원 또는 예비군대원의 유족과 공상을 입은 군인 등의\n본인 또는 가족은 정신적 고통에 대한 위자료를 청구할 수 있다.\n부 칙\n제1조(시행일) 이 법은 공포한 날부터 시행한다.\n제2조(유족의 위자료에 관한 적용례) ① 제2조제3항의 개정규정은 이\n법 시행 이후 군인ㆍ군무원ㆍ경찰공무원 또는 예비군대원이 전투ㆍ\n훈련 등 직무 집행과 관련하여 전사ㆍ순직하거나 「국가유공자 등\n예우 및 지원에 관한 법률」에 따라 상이등급 판정을 받은 경우부\n터 적용한다.\n② 제1항에도 불구하고 이 법 시행 당시 본부심의회, 특별심의회 또\n는 지구심의회에 계속 중인 사건과 법원에 계속 중인 소송사건에\n대해서는 제2조제3항의 개정규정을 적용한다.\n\n\n\n\n신·구조문대비표\n현 행 개 정 안\n제2조(배상책임) ①ㆍ② (생 략) 제2조(배상책임) ①ㆍ② (현행과\n같음)\n<신 설> ③ 제1항 단서에도 불구하고\n전사(戰死)ㆍ순직(殉職)한 군인\nㆍ군무원ㆍ경찰공무원 또는 예\n비군대원의 유족과 공상을 입\n은 군인 등의 본인 또는 가족\n은 정신적 고통에 대한 위자료\n를 청구할 수 있다.\n",
  "sections": {
    "제안이유": "및",
    "주요내용": "현행법상 공무원 등의 고의 또는 과실로 법령을 위반하여 사망하거\n나 신체의 해를 입은 피해자의 직계존속, 직계비속 및 배우자는 피해\n자의 사회적 지위, 과실(過失)의 정도, 생계 상태, 손해배상액 등을 고\n려하여 그 정신적 고통에 대한 위자료를 배상받을 수 있음.\n그러나 군인 등이 직무 중 전사ㆍ순직하거나 공상을 입은 경우 다\n른 법령에 따라 보상을 지급받을 수 있을 때에는, 「민법」 및 「국가\n배상법」에 따른 손해배상을 청구할 수 없음. 이에 따라 군인 등의 유\n족이나 가족이 정신적 고통에 대한 위자료를 청구하는 것이 제한되고\n있음.\n이에 국가를 위해 희생한 군인 등이 전사ㆍ순직하거나 공상을 입은\n경우 유족과 가족 등에 대해서도 정신적 고통에 대한 위자료를 청구\n\n\n\n할 수 있는 명확한 법률적 근거를 마련하고자 함(안 제2조제3항 신\n설).",
    "제안이유_및_주요내용": "현행법상 공무원 등의 고의 또는 과실로 법령을 위반하여 사망하거\n나 신체의 해를 입은 피해자의 직계존속, 직계비속 및 배우자는 피해\n자의 사회적 지위, 과실(過失)의 정도, 생계 상태, 손해배상액 등을 고\n려하여 그 정신적 고통에 대한 위자료를 배상받을 수 있음.\n그러나 군인 등이 직무 중 전사ㆍ순직하거나 공상을 입은 경우 다\n른 법령에 따라 보상을 지급받을 수 있을 때에는, 「민법」 및 「국가\n배상법」에 따른 손해배상을 청구할 수 없음. 이에 따라 군인 등의 유\n족이나 가족이 정신적 고통에 대한 위자료를 청구하는 것이 제한되고\n있음.\n이에 국가를 위해 희생한 군인 등이 전사ㆍ순직하거나 공상을 입은\n경우 유족과 가족 등에 대해서도 정신적 고통에 대한 위자료를 청구\n\n\n\n할 수 있는 명확한 법률적 근거를 마련하고자 함(안 제2조제3항 신\n설).",
    "법률_제_호": "국가배상법 일부개정법률안\n국가배상법 일부를 다음과 같이 개정한다.\n제2조에 제3항을 다음과 같이 신설한다.\n③ 제1항 단서에도 불구하고 전사(戰死)ㆍ순직(殉職)한 군인ㆍ군무\n원ㆍ경찰공무원 또는 예비군대원의 유족과 공상을 입은 군인 등의\n본인 또는 가족은 정신적 고통에 대한 위자료를 청구할 수 있다.",
    "신구조문대비표": "현 행 개 정 안\n제2조(배상책임) ①ㆍ② (생 략) 제2조(배상책임) ①ㆍ② (현행과\n같음)\n<신 설> ③ 제1항 단서에도 불구하고\n전사(戰死)ㆍ순직(殉職)한 군인\nㆍ군무원ㆍ경찰공무원 또는 예\n비군대원의 유족과 공상을 입\n은 군인 등의 본인 또는 가족\n은 정신적 고통에 대한 위자료\n를 청구할 수 있다."
  }
}