{
  "title": "2205820_귀농어·귀촌_활성화_및_지원에_관한_법률_일부개정법률안",
  "bill_number": "5820",
  "proposal_date": "2024. 11. 22.",
  "submission_date": "",
  "is_alternative": false,
  "alternative_bill_numbers": [],
  "has_comparison_table": false,
  "comparison_table": "신ㆍ구조문대비표\n현 행 개 정 안\n제5조(종합계획의 수립 등) ① ∼ 제5조(종합계획의 수립 등) ① ∼\n④ (생 략) ④ (현행과 같음)\n<신 설> ⑤ 농림축산식품부장관 및 해양\n수산부장관이 종합계획을 수립\n할 때에는 귀농어업인 및 귀촌\n인등의 의견을 들어야 한다.\n⑤ ∼ ⑦ (생 략) ⑥ ∼ ⑧ (현행 제5항부터 제7\n항까지와 같음)",
  "full_text": "귀농어ㆍ귀촌 활성화 및 지원에 관한 법률 일부개정법률안\n(안호영의원 대표발의)\n발의연월일 : 2024. 11. 22.\n의 안\n5820\n번 호 발 의 자 : 안호영ㆍ이학영ㆍ이원택\n어기구ㆍ윤준병ㆍ주철현\n정을호ㆍ박희승ㆍ소병훈\n박홍배 의원(10인)\n제안이유 및 주요내용\n현행법은 농림축산식품부장관과 해양수산부장관이 귀농어업인과 귀\n촌인의 안정적인 농어촌 정착 및 농어업 경영기반 조성을 지원하기\n위하여 5년마다 귀농어ㆍ귀촌 지원 종합계획을 수립하도록 하고 있음.\n이러한 종합계획은 정책적 필요에 따라 특정 산업을 육성하거나 개\n인ㆍ기업을 지원하기 위한 정책 방향 및 수단을 제시하는 것으로서\n계획 수립 시 해당 계획의 정책 대상이나 관련 기관ㆍ단체 등 이해관\n계자의 의견을 수렴할 필요가 있음.\n이에 농림축산식품부장관과 해양수산부장관이 귀농어ㆍ귀촌 지원\n종합계획을 수립할 때에는 귀농어업인 및 귀촌인 등으로부터 의견을\n듣도록 하는 규정을 마련하려는 것임(안 제5조).\n\n\n\n\n법률 제 호\n귀농어ㆍ귀촌 활성화 및 지원에 관한 법률 일부개정법률안\n귀농어ㆍ귀촌 활성화 및 지원에 관한 법률 일부를 다음과 같이 개정\n한다.\n제5조제5항부터 제7항까지를 각각 제6항부터 제8항까지로 하고, 같은\n조에 제5항을 다음과 같이 신설한다.\n⑤ 농림축산식품부장관 및 해양수산부장관이 종합계획을 수립할 때\n에는 귀농어업인 및 귀촌인등의 의견을 들어야 한다.\n부 칙\n이 법은 공포 후 6개월이 경과한 날부터 시행한다.\n\n\n\n\n신ㆍ구조문대비표\n현 행 개 정 안\n제5조(종합계획의 수립 등) ① ∼ 제5조(종합계획의 수립 등) ① ∼\n④ (생 략) ④ (현행과 같음)\n<신 설> ⑤ 농림축산식품부장관 및 해양\n수산부장관이 종합계획을 수립\n할 때에는 귀농어업인 및 귀촌\n인등의 의견을 들어야 한다.\n⑤ ∼ ⑦ (생 략) ⑥ ∼ ⑧ (현행 제5항부터 제7\n항까지와 같음)\n",
  "sections": {
    "제안이유": "및",
    "주요내용": "현행법은 농림축산식품부장관과 해양수산부장관이 귀농어업인과 귀\n촌인의 안정적인 농어촌 정착 및 농어업 경영기반 조성을 지원하기\n위하여 5년마다 귀농어ㆍ귀촌 지원 종합계획을 수립하도록 하고 있음.\n이러한 종합계획은 정책적 필요에 따라 특정 산업을 육성하거나 개\n인ㆍ기업을 지원하기 위한 정책 방향 및 수단을 제시하는 것으로서\n계획 수립 시 해당 계획의 정책 대상이나 관련 기관ㆍ단체 등 이해관\n계자의 의견을 수렴할 필요가 있음.\n이에 농림축산식품부장관과 해양수산부장관이 귀농어ㆍ귀촌 지원\n종합계획을 수립할 때에는 귀농어업인 및 귀촌인 등으로부터 의견을\n듣도록 하는 규정을 마련하려는 것임(안 제5조).",
    "제안이유_및_주요내용": "현행법은 농림축산식품부장관과 해양수산부장관이 귀농어업인과 귀\n촌인의 안정적인 농어촌 정착 및 농어업 경영기반 조성을 지원하기\n위하여 5년마다 귀농어ㆍ귀촌 지원 종합계획을 수립하도록 하고 있음.\n이러한 종합계획은 정책적 필요에 따라 특정 산업을 육성하거나 개\n인ㆍ기업을 지원하기 위한 정책 방향 및 수단을 제시하는 것으로서\n계획 수립 시 해당 계획의 정책 대상이나 관련 기관ㆍ단체 등 이해관\n계자의 의견을 수렴할 필요가 있음.\n이에 농림축산식품부장관과 해양수산부장관이 귀농어ㆍ귀촌 지원\n종합계획을 수립할 때에는 귀농어업인 및 귀촌인 등으로부터 의견을\n듣도록 하는 규정을 마련하려는 것임(안 제5조).",
    "법률_제_호": "귀농어ㆍ귀촌 활성화 및 지원에 관한 법률 일부개정법률안\n귀농어ㆍ귀촌 활성화 및 지원에 관한 법률 일부를 다음과 같이 개정\n한다.\n제5조제5항부터 제7항까지를 각각 제6항부터 제8항까지로 하고, 같은\n조에 제5항을 다음과 같이 신설한다.\n⑤ 농림축산식품부장관 및 해양수산부장관이 종합계획을 수립할 때\n에는 귀농어업인 및 귀촌인등의 의견을 들어야 한다.",
    "신구조문대비표": "현 행 개 정 안\n제5조(종합계획의 수립 등) ① ∼ 제5조(종합계획의 수립 등) ① ∼\n④ (생 략) ④ (현행과 같음)\n<신 설> ⑤ 농림축산식품부장관 및 해양\n수산부장관이 종합계획을 수립\n할 때에는 귀농어업인 및 귀촌\n인등의 의견을 들어야 한다.\n⑤ ∼ ⑦ (생 략) ⑥ ∼ ⑧ (현행 제5항부터 제7\n항까지와 같음)"
  }
}