{
  "title": "2205640_특수임무수행자_보상에_관한_법률_일부개정법률안",
  "bill_number": "5640",
  "proposal_date": "2024. 11. 18.",
  "submission_date": "",
  "is_alternative": false,
  "alternative_bill_numbers": [],
  "has_comparison_table": false,
  "comparison_table": "신·구조문대비표\n현 행 개 정 안\n제10조(보상금등의 신청) ① (생 제10조(보상금등의 신청) ① (현\n략) 행과 같음)\n②제1항의 규정에 의한 보상금 <삭 제>\n등의 지급신청은 이 법 시행\n후 6개월 이내에 하여야 한다.",
  "full_text": "특수임무수행자 보상에 관한 법률 일부개정법률안\n(이정헌의원 대표발의)\n발의연월일 : 2024. 11. 18.\n의 안\n5640\n번 호 발 의 자 : 이정헌ㆍ박홍배ㆍ박민규\n이훈기ㆍ김 현ㆍ황정아\n민형배ㆍ허성무ㆍ한민수\n최민희ㆍ김영환ㆍ이병진\n정진욱ㆍ서영교ㆍ임미애\n박희승ㆍ이원택 의원\n(17인)\n제안이유 및 주요내용\n현행법은 특수임무수행자 및 그 유족의 특별한 희생에 대하여 보상\n금ㆍ특별공로금ㆍ공로금 및 특별위로금을 지급할 수 있도록 규정하면\n서 그 신청 기간을 시행일로부터 6개월로 제한하고 있음.\n그런데 특수임무수행자 등에 대하여 2004년부터 2019년까지 총 6차\n에 걸쳐 보상금 등을 신청할 수 있는 기간을 연장하여 왔으나, 여전히\n불가피한 사정으로 기한 내에 신청하지 못하여 보상금 등의 지급 심\n의를 받지 못한 특수임무수행자 및 그 유족이 있어 이들의 보상금 지\n급 신청을 가능하게 할 필요가 있다는 의견이 제기됨.\n이에 보상금 등의 지급신청 기간을 제한하는 규정을 삭제하여 보상\n금 등의 지급을 신청하지 못한 특수임무수행자 및 그 유족에게 필요\n\n\n\n한 보상의 기회를 제공하고, 그들의 생활안정을 도모하려는 것임(안\n제10조제2항 삭제).\n\n법률 제 호\n특수임무수행자 보상에 관한 법률 일부개정법률안\n특수임무수행자 보상에 관한 법률 일부를 다음과 같이 개정한다.\n제10조제2항을 삭제한다.\n부 칙\n이 법은 공포 후 3개월이 경과한 날부터 시행한다.\n\n\n\n\n신·구조문대비표\n현 행 개 정 안\n제10조(보상금등의 신청) ① (생 제10조(보상금등의 신청) ① (현\n략) 행과 같음)\n②제1항의 규정에 의한 보상금 <삭 제>\n등의 지급신청은 이 법 시행\n후 6개월 이내에 하여야 한다.\n",
  "sections": {
    "제안이유": "및",
    "주요내용": "현행법은 특수임무수행자 및 그 유족의 특별한 희생에 대하여 보상\n금ㆍ특별공로금ㆍ공로금 및 특별위로금을 지급할 수 있도록 규정하면\n서 그 신청 기간을 시행일로부터 6개월로 제한하고 있음.\n그런데 특수임무수행자 등에 대하여 2004년부터 2019년까지 총 6차\n에 걸쳐 보상금 등을 신청할 수 있는 기간을 연장하여 왔으나, 여전히\n불가피한 사정으로 기한 내에 신청하지 못하여 보상금 등의 지급 심\n의를 받지 못한 특수임무수행자 및 그 유족이 있어 이들의 보상금 지\n급 신청을 가능하게 할 필요가 있다는 의견이 제기됨.\n이에 보상금 등의 지급신청 기간을 제한하는 규정을 삭제하여 보상\n금 등의 지급을 신청하지 못한 특수임무수행자 및 그 유족에게 필요\n\n\n\n한 보상의 기회를 제공하고, 그들의 생활안정을 도모하려는 것임(안\n제10조제2항 삭제).",
    "제안이유_및_주요내용": "현행법은 특수임무수행자 및 그 유족의 특별한 희생에 대하여 보상\n금ㆍ특별공로금ㆍ공로금 및 특별위로금을 지급할 수 있도록 규정하면\n서 그 신청 기간을 시행일로부터 6개월로 제한하고 있음.\n그런데 특수임무수행자 등에 대하여 2004년부터 2019년까지 총 6차\n에 걸쳐 보상금 등을 신청할 수 있는 기간을 연장하여 왔으나, 여전히\n불가피한 사정으로 기한 내에 신청하지 못하여 보상금 등의 지급 심\n의를 받지 못한 특수임무수행자 및 그 유족이 있어 이들의 보상금 지\n급 신청을 가능하게 할 필요가 있다는 의견이 제기됨.\n이에 보상금 등의 지급신청 기간을 제한하는 규정을 삭제하여 보상\n금 등의 지급을 신청하지 못한 특수임무수행자 및 그 유족에게 필요\n\n\n\n한 보상의 기회를 제공하고, 그들의 생활안정을 도모하려는 것임(안\n제10조제2항 삭제).",
    "법률_제_호": "특수임무수행자 보상에 관한 법률 일부개정법률안\n특수임무수행자 보상에 관한 법률 일부를 다음과 같이 개정한다.\n제10조제2항을 삭제한다.",
    "신구조문대비표": "현 행 개 정 안\n제10조(보상금등의 신청) ① (생 제10조(보상금등의 신청) ① (현\n략) 행과 같음)\n②제1항의 규정에 의한 보상금 <삭 제>\n등의 지급신청은 이 법 시행\n후 6개월 이내에 하여야 한다."
  }
}