{
  "title": "2205156_국유재산법_일부개정법률안",
  "bill_number": "5156",
  "proposal_date": "2024. 11. 1.",
  "submission_date": "",
  "is_alternative": false,
  "alternative_bill_numbers": [],
  "has_comparison_table": false,
  "comparison_table": "신·구조문대비표\n현 행 개 정 안\n제61조(현물출자 절차) ① ∼ ③ 제61조(현물출자 절차) ① ∼ ③\n(생 략) (현행과 같음)\n<신 설> ④ 제1항부터 제3항까지에 따\n른 현물출자로서 출자가액이\n대통령령으로 정하는 금액 이\n상인 경우에는 미리 국회의 동\n의를 받아야 한다.",
  "full_text": "국유재산법 일부개정법률안\n(박홍근의원 대표발의)\n발의연월일 : 2024. 11. 1.\n의 안\n5156\n번 호 발 의 자 : 박홍근ㆍ이건태ㆍ한민수\n이수진ㆍ박상혁ㆍ한정애\n박홍배ㆍ박주민ㆍ조정식\n정을호 의원(10인)\n제안이유 및 주요내용\n현행법은 현물출자의 절차에 대해 규정하면서 현물출자를 하려는\n경우 현물출자계획서를 작성하여 국무회의의 심의를 거쳐 대통령의\n승인을 받도록 하고 있음.\n한편 현물출자는 「국가재정법」에 따라 세입세출예산 외로 처리할\n수 있어 예산 심의 대상에서 제외되고, 국유재산종합계획에도 반영되\n어 있지 않아 국회 차원에서 정부의 재량권을 실질적으로 견제할 방\n법이 없는 실정임.\n이에 일정 금액 이상의 재산을 현물출자하려는 경우에는 미리 국회\n의 동의를 받도록 하여 현물출자에 대한 국회의 심의를 강화하려는\n것임(안 제61조제4항 신설).\n\n\n\n\n법률 제 호\n국유재산법 일부개정법률안\n국유재산법 일부를 다음과 같이 개정한다.\n제61조에 제4항을 다음과 같이 신설한다.\n④ 제1항부터 제3항까지에 따른 현물출자로서 출자가액이 대통령령\n으로 정하는 금액 이상인 경우에는 미리 국회의 동의를 받아야 한\n다.\n부 칙\n제1조(시행일) 이 법은 공포 후 6개월이 경과한 날부터 시행한다.\n제2조(현물출자 절차에 관한 적용례) 제61조제4항의 개정규정은 이 법\n시행 이후 출자하는 경우부터 적용한다.\n\n\n\n\n신·구조문대비표\n현 행 개 정 안\n제61조(현물출자 절차) ① ∼ ③ 제61조(현물출자 절차) ① ∼ ③\n(생 략) (현행과 같음)\n<신 설> ④ 제1항부터 제3항까지에 따\n른 현물출자로서 출자가액이\n대통령령으로 정하는 금액 이\n상인 경우에는 미리 국회의 동\n의를 받아야 한다.\n",
  "sections": {
    "제안이유": "및",
    "주요내용": "현행법은 현물출자의 절차에 대해 규정하면서 현물출자를 하려는\n경우 현물출자계획서를 작성하여 국무회의의 심의를 거쳐 대통령의\n승인을 받도록 하고 있음.\n한편 현물출자는 「국가재정법」에 따라 세입세출예산 외로 처리할\n수 있어 예산 심의 대상에서 제외되고, 국유재산종합계획에도 반영되\n어 있지 않아 국회 차원에서 정부의 재량권을 실질적으로 견제할 방\n법이 없는 실정임.\n이에 일정 금액 이상의 재산을 현물출자하려는 경우에는 미리 국회\n의 동의를 받도록 하여 현물출자에 대한 국회의 심의를 강화하려는\n것임(안 제61조제4항 신설).",
    "제안이유_및_주요내용": "현행법은 현물출자의 절차에 대해 규정하면서 현물출자를 하려는\n경우 현물출자계획서를 작성하여 국무회의의 심의를 거쳐 대통령의\n승인을 받도록 하고 있음.\n한편 현물출자는 「국가재정법」에 따라 세입세출예산 외로 처리할\n수 있어 예산 심의 대상에서 제외되고, 국유재산종합계획에도 반영되\n어 있지 않아 국회 차원에서 정부의 재량권을 실질적으로 견제할 방\n법이 없는 실정임.\n이에 일정 금액 이상의 재산을 현물출자하려는 경우에는 미리 국회\n의 동의를 받도록 하여 현물출자에 대한 국회의 심의를 강화하려는\n것임(안 제61조제4항 신설).",
    "법률_제_호": "국유재산법 일부개정법률안\n국유재산법 일부를 다음과 같이 개정한다.\n제61조에 제4항을 다음과 같이 신설한다.\n④ 제1항부터 제3항까지에 따른 현물출자로서 출자가액이 대통령령\n으로 정하는 금액 이상인 경우에는 미리 국회의 동의를 받아야 한\n다.",
    "신구조문대비표": "현 행 개 정 안\n제61조(현물출자 절차) ① ∼ ③ 제61조(현물출자 절차) ① ∼ ③\n(생 략) (현행과 같음)\n<신 설> ④ 제1항부터 제3항까지에 따\n른 현물출자로서 출자가액이\n대통령령으로 정하는 금액 이\n상인 경우에는 미리 국회의 동\n의를 받아야 한다."
  }
}