{
  "title": "2205028_고등교육법_일부개정법률안",
  "bill_number": "5028",
  "proposal_date": "2024. 10. 30.",
  "submission_date": "",
  "is_alternative": false,
  "alternative_bill_numbers": [],
  "has_comparison_table": false,
  "comparison_table": "신ㆍ구조문대비표\n현 행 개 정 안\n제5조(지도ㆍ감독) ①ㆍ② (생 제5조(지도ㆍ감독 등) ①ㆍ②\n략) (현행과 같음)\n<신 설> ③ 교육부장관은 학교의 장에\n게 국가의 교육정책 수립과 국\n회에 대한 보고 등에 필요한\n자료의 제출을 요구할 수 있다.\n이 경우 요구를 받은 학교의\n장은 정당한 사유가 없으면 이\n에 따라야 한다.",
  "full_text": "고등교육법 일부개정법률안\n(정을호의원 대표발의)\n발의연월일 : 2024. 10. 30.\n의 안\n5028\n번 호 발 의 자 : 정을호ㆍ이기헌ㆍ김병기\n김남근ㆍ추미애ㆍ김영환\n문금주ㆍ김준혁ㆍ강유정\n한준호ㆍ모경종 의원\n(11인)\n제안이유 및 주요내용\n현행법에 따르면 학교는 교육부장관의 지도ㆍ감독을 받고, 지도ㆍ감\n독을 위하여 교육부장관은 필요한 경우 학교의 장에게 관련 자료 제\n출을 요구할 수 있도록 규정하고 있음.\n그러나 국회가 감사와 제도개선 등의 기초자료로 사용하기 위해 교\n육부장관에게 자료 요구를 하는 경우 학교의 장이 이를 거부하거나\n불성실하게 제출하는 사례가 발생하고 있어 법ㆍ제도적 개선책 마련\n이 필요하다는 지적이 있음.\n이에 교육부장관은 학교의 장에게 국가의 교육정책 수립과 국회에\n대한 보고 등에 필요한 자료의 제출을 요구할 수 있도록 하고, 학교의\n장은 정당한 사유가 없으면 이에 따르도록 규정함으로써 국가의 교육\n정책 수립과 국회의 의정활동이 원활하게 이루어질 수 있도록 하려는\n것임(안 제5조제3항 신설).\n\n\n\n\n법률 제 호\n고등교육법 일부개정법률안\n고등교육법 일부를 다음과 같이 개정한다.\n제5조의 제목 중 “감독”을 “감독 등”으로 하고, 같은 조에 제3항을 다\n음과 같이 신설한다.\n③ 교육부장관은 학교의 장에게 국가의 교육정책 수립과 국회에 대\n한 보고 등에 필요한 자료의 제출을 요구할 수 있다. 이 경우 요구\n를 받은 학교의 장은 정당한 사유가 없으면 이에 따라야 한다.\n부 칙\n이 법은 공포 후 3개월이 경과한 날부터 시행한다.\n\n\n\n\n신ㆍ구조문대비표\n현 행 개 정 안\n제5조(지도ㆍ감독) ①ㆍ② (생 제5조(지도ㆍ감독 등) ①ㆍ②\n략) (현행과 같음)\n<신 설> ③ 교육부장관은 학교의 장에\n게 국가의 교육정책 수립과 국\n회에 대한 보고 등에 필요한\n자료의 제출을 요구할 수 있다.\n이 경우 요구를 받은 학교의\n장은 정당한 사유가 없으면 이\n에 따라야 한다.\n",
  "sections": {
    "제안이유": "및",
    "주요내용": "현행법에 따르면 학교는 교육부장관의 지도ㆍ감독을 받고, 지도ㆍ감\n독을 위하여 교육부장관은 필요한 경우 학교의 장에게 관련 자료 제\n출을 요구할 수 있도록 규정하고 있음.\n그러나 국회가 감사와 제도개선 등의 기초자료로 사용하기 위해 교\n육부장관에게 자료 요구를 하는 경우 학교의 장이 이를 거부하거나\n불성실하게 제출하는 사례가 발생하고 있어 법ㆍ제도적 개선책 마련\n이 필요하다는 지적이 있음.\n이에 교육부장관은 학교의 장에게 국가의 교육정책 수립과 국회에\n대한 보고 등에 필요한 자료의 제출을 요구할 수 있도록 하고, 학교의\n장은 정당한 사유가 없으면 이에 따르도록 규정함으로써 국가의 교육\n정책 수립과 국회의 의정활동이 원활하게 이루어질 수 있도록 하려는\n것임(안 제5조제3항 신설).",
    "제안이유_및_주요내용": "현행법에 따르면 학교는 교육부장관의 지도ㆍ감독을 받고, 지도ㆍ감\n독을 위하여 교육부장관은 필요한 경우 학교의 장에게 관련 자료 제\n출을 요구할 수 있도록 규정하고 있음.\n그러나 국회가 감사와 제도개선 등의 기초자료로 사용하기 위해 교\n육부장관에게 자료 요구를 하는 경우 학교의 장이 이를 거부하거나\n불성실하게 제출하는 사례가 발생하고 있어 법ㆍ제도적 개선책 마련\n이 필요하다는 지적이 있음.\n이에 교육부장관은 학교의 장에게 국가의 교육정책 수립과 국회에\n대한 보고 등에 필요한 자료의 제출을 요구할 수 있도록 하고, 학교의\n장은 정당한 사유가 없으면 이에 따르도록 규정함으로써 국가의 교육\n정책 수립과 국회의 의정활동이 원활하게 이루어질 수 있도록 하려는\n것임(안 제5조제3항 신설).",
    "법률_제_호": "고등교육법 일부개정법률안\n고등교육법 일부를 다음과 같이 개정한다.\n제5조의 제목 중 “감독”을 “감독 등”으로 하고, 같은 조에 제3항을 다\n음과 같이 신설한다.\n③ 교육부장관은 학교의 장에게 국가의 교육정책 수립과 국회에 대\n한 보고 등에 필요한 자료의 제출을 요구할 수 있다. 이 경우 요구\n를 받은 학교의 장은 정당한 사유가 없으면 이에 따라야 한다.",
    "신구조문대비표": "현 행 개 정 안\n제5조(지도ㆍ감독) ①ㆍ② (생 제5조(지도ㆍ감독 등) ①ㆍ②\n략) (현행과 같음)\n<신 설> ③ 교육부장관은 학교의 장에\n게 국가의 교육정책 수립과 국\n회에 대한 보고 등에 필요한\n자료의 제출을 요구할 수 있다.\n이 경우 요구를 받은 학교의\n장은 정당한 사유가 없으면 이\n에 따라야 한다."
  }
}