{
  "title": "2205762_행정소송법_일부개정법률안",
  "bill_number": "5762",
  "proposal_date": "2024. 11. 21.",
  "submission_date": "",
  "is_alternative": false,
  "alternative_bill_numbers": [],
  "has_comparison_table": false,
  "comparison_table": "신ㆍ구조문대비표\n현 행 개 정 안\n第43條(假執行宣告의 제한) 國家 <삭 제>\n를 상대로 하는 當事者訴訟의\n경우에는 假執行宣告를 할 수\n없다.",
  "full_text": "行政訴訟法 일부개정법률안\n(송석준의원 대표발의)\n발의연월일 : 2024. 11. 21.\n의 안\n5762\n번 호 발 의 자 : 송석준ㆍ김선교ㆍ이종배\n성일종ㆍ조배숙ㆍ조경태\n김형동ㆍ이헌승ㆍ박형수\n김성원ㆍ박정하ㆍ유상범\n곽규택 의원(13인)\n제안이유 및 주요내용\n헌법재판소는 국가를 상대로 하는 당사자소송의 경우에는 가집행선\n고를 할 수 없도록 규정한 「행정소송법」 제43조에 대하여 국가가\n당사자소송의 피고인 경우 가집행의 선고를 제한하는 것은 국가가 아\n닌 공공단체, 그 밖의 권리주체가 피고인 경우에 비해 합리적인 이유\n없는 차별에 해당하여 평등원칙에 반하므로 헌법에 위반된다는 취지\n로 위헌 결정을 선고하였음(헌법재판소 2022. 2. 24. 2020헌가12 결정).\n이에 헌법재판소의 위헌 결정으로 효력을 상실한 규정을 삭제하여\n국가를 상대로 하는 당사자소송에서도 가집행선고가 가능함을 명확히\n하고, 헌법재판소의 위헌 결정에 따라 발생한 국회의 입법의무를 충실\n히 이행하려는 것임(안 제43조 삭제).\n\n\n\n\n법률 제 호\n行政訴訟法 일부개정법률안\n행정소송법 일부를 다음과 같이 개정한다.\n제43조를 삭제한다.\n부 칙\n이 법은 공포한 날부터 시행한다.\n\n\n\n\n신ㆍ구조문대비표\n현 행 개 정 안\n第43條(假執行宣告의 제한) 國家 <삭 제>\n를 상대로 하는 當事者訴訟의\n경우에는 假執行宣告를 할 수\n없다.\n",
  "sections": {
    "제안이유": "및",
    "주요내용": "헌법재판소는 국가를 상대로 하는 당사자소송의 경우에는 가집행선\n고를 할 수 없도록 규정한 「행정소송법」 제43조에 대하여 국가가\n당사자소송의 피고인 경우 가집행의 선고를 제한하는 것은 국가가 아\n닌 공공단체, 그 밖의 권리주체가 피고인 경우에 비해 합리적인 이유\n없는 차별에 해당하여 평등원칙에 반하므로 헌법에 위반된다는 취지\n로 위헌 결정을 선고하였음(헌법재판소 2022. 2. 24. 2020헌가12 결정).\n이에 헌법재판소의 위헌 결정으로 효력을 상실한 규정을 삭제하여\n국가를 상대로 하는 당사자소송에서도 가집행선고가 가능함을 명확히\n하고, 헌법재판소의 위헌 결정에 따라 발생한 국회의 입법의무를 충실\n히 이행하려는 것임(안 제43조 삭제).",
    "제안이유_및_주요내용": "헌법재판소는 국가를 상대로 하는 당사자소송의 경우에는 가집행선\n고를 할 수 없도록 규정한 「행정소송법」 제43조에 대하여 국가가\n당사자소송의 피고인 경우 가집행의 선고를 제한하는 것은 국가가 아\n닌 공공단체, 그 밖의 권리주체가 피고인 경우에 비해 합리적인 이유\n없는 차별에 해당하여 평등원칙에 반하므로 헌법에 위반된다는 취지\n로 위헌 결정을 선고하였음(헌법재판소 2022. 2. 24. 2020헌가12 결정).\n이에 헌법재판소의 위헌 결정으로 효력을 상실한 규정을 삭제하여\n국가를 상대로 하는 당사자소송에서도 가집행선고가 가능함을 명확히\n하고, 헌법재판소의 위헌 결정에 따라 발생한 국회의 입법의무를 충실\n히 이행하려는 것임(안 제43조 삭제).",
    "법률_제_호": "行政訴訟法 일부개정법률안\n행정소송법 일부를 다음과 같이 개정한다.\n제43조를 삭제한다.",
    "신구조문대비표": "현 행 개 정 안\n第43條(假執行宣告의 제한) 國家 <삭 제>\n를 상대로 하는 當事者訴訟의\n경우에는 假執行宣告를 할 수\n없다."
  }
}