{
  "title": "2205085_낚시_관리_및_육성법_일부개정법률안",
  "bill_number": "5085",
  "proposal_date": "2024. 10. 31.",
  "submission_date": "",
  "is_alternative": false,
  "alternative_bill_numbers": [],
  "has_comparison_table": false,
  "comparison_table": "신·구조문대비표\n현 행 개 정 안\n제27조(영업구역) ① (생 략) 제27조(영업구역) ① (현행과 같\n음)\n<신 설> ② 제1항에 따른 영업구역은\n낚시어선의 선적항이 속한 시\nㆍ도지사의 관할 수역 또는 공\n동영업구역과 연접한 다른 시\nㆍ도지사의 관할 수역은 포함\n하지 아니한다.\n② · ③ (생 략) ③ · ④ (현행 제2항 및 제3항\n과 같음)",
  "full_text": "낚시 관리 및 육성법 일부개정법률안\n(김정호의원 대표발의)\n발의연월일 : 2024. 10. 31.\n의 안\n5085\n번 호 발 의 자 : 김정호ㆍ허종식ㆍ최기상\n박 정ㆍ윤후덕ㆍ임미애\n이연희ㆍ이수진ㆍ정성호\n신영대ㆍ전재수 의원\n(11인)\n제안이유 및 주요내용\n현행법은 낚시어선업의 영업구역을 그 낚시어선의 선적항이 속한\n시ㆍ도지사의 관할 수역으로 하되, 연접한 시ㆍ도 간 수역에 대하여\n대통령령으로 정하는 바에 따라 공동영업구역을 지정하는 경우에는\n그 공동영업구역과 해당 시ㆍ도지사의 관할 수역을 영업구역으로 함\n을 규정하고 있음.\n한편 하위법령에서는 낚시어선업자가 낚시인을 낚시어선에 승선시\n켜 낚시터로 안내하되, 그 어선에서 낚시를 하지 아니하는 경우에는\n법률에서 정한 영업구역을 벗어나 연접한 다른 시ㆍ도 관할 수역까지\n를 영업구역으로 볼 수 있다고 규정하고 있음.\n그런데 영업구역은 낚시어선업자의 영업에 대한 권리와 직접적으로\n관련된 사항으로서 법률 근거 없이 하위법령에서 그 예외를 정한 것\n은 법률유보원칙에 위배되는 측면이 있을 뿐 아니라, 해당 하위법령에\n\n\n\n근거하여 제주특별자치도와 연접한 시ㆍ도의 낚시어선업자가 제주시\n추자도에 무분별하게 낚시인을 하선시켜 쓰레기 투기, 안전사고 등 문\n제가 발생하고 있으므로 법률에서 영업구역에 관한 사항을 명확히 할\n필요가 있다는 지적이 있음.\n이에 낚시어선업의 영업범위에 낚시어선의 선적항이 속한 시ㆍ도지\n사의 관할 수역 또는 공동영업구역과 연접한 다른 시ㆍ도지사의 관할\n수역은 포함되지 아니함을 규정함으로써 낚시어선업의 영업구역을 명\n확히 함과 동시에 영업구역에 대한 예측가능성을 제고하려는 것임(안\n제27조제2항 신설).\n\n법률 제 호\n낚시 관리 및 육성법 일부개정법률안\n낚시 관리 및 육성법 일부를 다음과 같이 개정한다.\n제27조제2항 및 제3항을 각각 제3항 및 제4항으로 하고, 같은 조에 제\n2항을 다음과 같이 신설한다.\n② 제1항에 따른 영업구역은 낚시어선의 선적항이 속한 시ㆍ도지사\n의 관할 수역 또는 공동영업구역과 연접한 다른 시ㆍ도지사의 관할\n수역은 포함하지 아니한다.\n부 칙\n이 법은 공포 후 6개월이 경과한 날부터 시행한다.\n\n\n\n\n신·구조문대비표\n현 행 개 정 안\n제27조(영업구역) ① (생 략) 제27조(영업구역) ① (현행과 같\n음)\n<신 설> ② 제1항에 따른 영업구역은\n낚시어선의 선적항이 속한 시\nㆍ도지사의 관할 수역 또는 공\n동영업구역과 연접한 다른 시\nㆍ도지사의 관할 수역은 포함\n하지 아니한다.\n② · ③ (생 략) ③ · ④ (현행 제2항 및 제3항\n과 같음)\n",
  "sections": {
    "제안이유": "및",
    "주요내용": "현행법은 낚시어선업의 영업구역을 그 낚시어선의 선적항이 속한\n시ㆍ도지사의 관할 수역으로 하되, 연접한 시ㆍ도 간 수역에 대하여\n대통령령으로 정하는 바에 따라 공동영업구역을 지정하는 경우에는\n그 공동영업구역과 해당 시ㆍ도지사의 관할 수역을 영업구역으로 함\n을 규정하고 있음.\n한편 하위법령에서는 낚시어선업자가 낚시인을 낚시어선에 승선시\n켜 낚시터로 안내하되, 그 어선에서 낚시를 하지 아니하는 경우에는\n법률에서 정한 영업구역을 벗어나 연접한 다른 시ㆍ도 관할 수역까지\n를 영업구역으로 볼 수 있다고 규정하고 있음.\n그런데 영업구역은 낚시어선업자의 영업에 대한 권리와 직접적으로\n관련된 사항으로서 법률 근거 없이 하위법령에서 그 예외를 정한 것\n은 법률유보원칙에 위배되는 측면이 있을 뿐 아니라, 해당 하위법령에\n\n\n\n근거하여 제주특별자치도와 연접한 시ㆍ도의 낚시어선업자가 제주시\n추자도에 무분별하게 낚시인을 하선시켜 쓰레기 투기, 안전사고 등 문\n제가 발생하고 있으므로 법률에서 영업구역에 관한 사항을 명확히 할\n필요가 있다는 지적이 있음.\n이에 낚시어선업의 영업범위에 낚시어선의 선적항이 속한 시ㆍ도지\n사의 관할 수역 또는 공동영업구역과 연접한 다른 시ㆍ도지사의 관할\n수역은 포함되지 아니함을 규정함으로써 낚시어선업의 영업구역을 명\n확히 함과 동시에 영업구역에 대한 예측가능성을 제고하려는 것임(안\n제27조제2항 신설).",
    "제안이유_및_주요내용": "현행법은 낚시어선업의 영업구역을 그 낚시어선의 선적항이 속한\n시ㆍ도지사의 관할 수역으로 하되, 연접한 시ㆍ도 간 수역에 대하여\n대통령령으로 정하는 바에 따라 공동영업구역을 지정하는 경우에는\n그 공동영업구역과 해당 시ㆍ도지사의 관할 수역을 영업구역으로 함\n을 규정하고 있음.\n한편 하위법령에서는 낚시어선업자가 낚시인을 낚시어선에 승선시\n켜 낚시터로 안내하되, 그 어선에서 낚시를 하지 아니하는 경우에는\n법률에서 정한 영업구역을 벗어나 연접한 다른 시ㆍ도 관할 수역까지\n를 영업구역으로 볼 수 있다고 규정하고 있음.\n그런데 영업구역은 낚시어선업자의 영업에 대한 권리와 직접적으로\n관련된 사항으로서 법률 근거 없이 하위법령에서 그 예외를 정한 것\n은 법률유보원칙에 위배되는 측면이 있을 뿐 아니라, 해당 하위법령에\n\n\n\n근거하여 제주특별자치도와 연접한 시ㆍ도의 낚시어선업자가 제주시\n추자도에 무분별하게 낚시인을 하선시켜 쓰레기 투기, 안전사고 등 문\n제가 발생하고 있으므로 법률에서 영업구역에 관한 사항을 명확히 할\n필요가 있다는 지적이 있음.\n이에 낚시어선업의 영업범위에 낚시어선의 선적항이 속한 시ㆍ도지\n사의 관할 수역 또는 공동영업구역과 연접한 다른 시ㆍ도지사의 관할\n수역은 포함되지 아니함을 규정함으로써 낚시어선업의 영업구역을 명\n확히 함과 동시에 영업구역에 대한 예측가능성을 제고하려는 것임(안\n제27조제2항 신설).",
    "법률_제_호": "낚시 관리 및 육성법 일부개정법률안\n낚시 관리 및 육성법 일부를 다음과 같이 개정한다.\n제27조제2항 및 제3항을 각각 제3항 및 제4항으로 하고, 같은 조에 제\n2항을 다음과 같이 신설한다.\n② 제1항에 따른 영업구역은 낚시어선의 선적항이 속한 시ㆍ도지사\n의 관할 수역 또는 공동영업구역과 연접한 다른 시ㆍ도지사의 관할\n수역은 포함하지 아니한다.",
    "신구조문대비표": "현 행 개 정 안\n제27조(영업구역) ① (생 략) 제27조(영업구역) ① (현행과 같\n음)\n<신 설> ② 제1항에 따른 영업구역은\n낚시어선의 선적항이 속한 시\nㆍ도지사의 관할 수역 또는 공\n동영업구역과 연접한 다른 시\nㆍ도지사의 관할 수역은 포함\n하지 아니한다.\n② · ③ (생 략) ③ · ④ (현행 제2항 및 제3항\n과 같음)"
  }
}