{
  "title": "2205350_헌법재판소법_일부개정법률안",
  "bill_number": "5350",
  "proposal_date": "2024. 11. 7.",
  "submission_date": "",
  "is_alternative": false,
  "alternative_bill_numbers": [],
  "has_comparison_table": false,
  "comparison_table": "신ㆍ구조문대비표\n현 행 개 정 안\n<신 설> 제11조의2(소재지) 헌법재판소는\n전북특별자치도 전주시에 둔\n다.",
  "full_text": "헌법재판소법 일부개정법률안\n(이성윤의원 대표발의)\n발의연월일 : 2024. 11. 7.\n의 안\n5350\n번 호 발 의 자 : 이성윤ㆍ정동영ㆍ윤준병\n전현희ㆍ김문수ㆍ신영대\n강준현ㆍ이원택ㆍ김윤덕\n김병주 의원(10인)\n제안이유 및 주요내용\n헌법은 전문에 ‘국민 생활의 균등한 향상’을 기한다고 명시하고 있\n으며, 헌법 제122조는 ‘국민 모두의 생산 및 생활의 기반이 되는 국토\n의 효율적이고 균형있는 이용ㆍ개발과 보전’을 국가의 의무로 명령하\n고 있음\n서울 등 수도권 과밀화 해소와 국가 균형 발전 차원에서 많은 공공\n기관이 지역으로 이전하였고, 헌법재판소 역시 헌법의 가치를 수호해\n야 할 책무가 있는 기관으로서 헌법이 명령한 국토 균형 발전에 기여\n하기 위해 지역으로 이전하는 것은 헌법적 요구로 판단됨.\n1894년 시작된 동학농민혁명은 일제강점기 독립운동의 밑거름이 되\n었고, 3ㆍ1운동의 주요한 동인이 되었음. 실제로 3ㆍ1운동 당시 우리\n민족의 대표로서 독립선언서에 서명한 “민족대표 33인” 중 9명이 동학\n농민혁명에도 참여하였고, 3ㆍ1운동의 주요 정신적 토대가 되었음.\n\n\n\n3ㆍ1운동의 정신을 계승한다는 헌법 전문에 비추어 볼 때, 그 인적\nㆍ물적ㆍ사상적 토대가 된 동학농민혁명의 발상지인 전북특별자치도\n전주시에 헌법재판소가 소재하는 것이 적합하다는 요구가 있음.\n이에 헌법재판소의 소재지를 전북특별자치도 전주시에 두어 지역균\n형발전을 도모하고 헌법정신을 진정으로 계승하고자 함(안 제11조의2\n신설).\n\n법률 제 호\n헌법재판소법 일부개정법률안\n헌법재판소법 일부를 다음과 같이 개정한다.\n제2장에 제11조의2를 다음과 같이 신설한다.\n제11조의2(소재지) 헌법재판소는 전북특별자치도 전주시에 둔다.\n부 칙\n이 법은 공포 후 1년이 경과한 날부터 시행한다.\n\n\n\n\n신ㆍ구조문대비표\n현 행 개 정 안\n<신 설> 제11조의2(소재지) 헌법재판소는\n전북특별자치도 전주시에 둔\n다.\n",
  "sections": {
    "제안이유": "및",
    "주요내용": "헌법은 전문에 ‘국민 생활의 균등한 향상’을 기한다고 명시하고 있\n으며, 헌법 제122조는 ‘국민 모두의 생산 및 생활의 기반이 되는 국토\n의 효율적이고 균형있는 이용ㆍ개발과 보전’을 국가의 의무로 명령하\n고 있음\n서울 등 수도권 과밀화 해소와 국가 균형 발전 차원에서 많은 공공\n기관이 지역으로 이전하였고, 헌법재판소 역시 헌법의 가치를 수호해\n야 할 책무가 있는 기관으로서 헌법이 명령한 국토 균형 발전에 기여\n하기 위해 지역으로 이전하는 것은 헌법적 요구로 판단됨.\n1894년 시작된 동학농민혁명은 일제강점기 독립운동의 밑거름이 되\n었고, 3ㆍ1운동의 주요한 동인이 되었음. 실제로 3ㆍ1운동 당시 우리\n민족의 대표로서 독립선언서에 서명한 “민족대표 33인” 중 9명이 동학\n농민혁명에도 참여하였고, 3ㆍ1운동의 주요 정신적 토대가 되었음.\n\n\n\n3ㆍ1운동의 정신을 계승한다는 헌법 전문에 비추어 볼 때, 그 인적\nㆍ물적ㆍ사상적 토대가 된 동학농민혁명의 발상지인 전북특별자치도\n전주시에 헌법재판소가 소재하는 것이 적합하다는 요구가 있음.\n이에 헌법재판소의 소재지를 전북특별자치도 전주시에 두어 지역균\n형발전을 도모하고 헌법정신을 진정으로 계승하고자 함(안 제11조의2\n신설).",
    "제안이유_및_주요내용": "헌법은 전문에 ‘국민 생활의 균등한 향상’을 기한다고 명시하고 있\n으며, 헌법 제122조는 ‘국민 모두의 생산 및 생활의 기반이 되는 국토\n의 효율적이고 균형있는 이용ㆍ개발과 보전’을 국가의 의무로 명령하\n고 있음\n서울 등 수도권 과밀화 해소와 국가 균형 발전 차원에서 많은 공공\n기관이 지역으로 이전하였고, 헌법재판소 역시 헌법의 가치를 수호해\n야 할 책무가 있는 기관으로서 헌법이 명령한 국토 균형 발전에 기여\n하기 위해 지역으로 이전하는 것은 헌법적 요구로 판단됨.\n1894년 시작된 동학농민혁명은 일제강점기 독립운동의 밑거름이 되\n었고, 3ㆍ1운동의 주요한 동인이 되었음. 실제로 3ㆍ1운동 당시 우리\n민족의 대표로서 독립선언서에 서명한 “민족대표 33인” 중 9명이 동학\n농민혁명에도 참여하였고, 3ㆍ1운동의 주요 정신적 토대가 되었음.\n\n\n\n3ㆍ1운동의 정신을 계승한다는 헌법 전문에 비추어 볼 때, 그 인적\nㆍ물적ㆍ사상적 토대가 된 동학농민혁명의 발상지인 전북특별자치도\n전주시에 헌법재판소가 소재하는 것이 적합하다는 요구가 있음.\n이에 헌법재판소의 소재지를 전북특별자치도 전주시에 두어 지역균\n형발전을 도모하고 헌법정신을 진정으로 계승하고자 함(안 제11조의2\n신설).",
    "법률_제_호": "헌법재판소법 일부개정법률안\n헌법재판소법 일부를 다음과 같이 개정한다.\n제2장에 제11조의2를 다음과 같이 신설한다.\n제11조의2(소재지) 헌법재판소는 전북특별자치도 전주시에 둔다.",
    "신구조문대비표": "현 행 개 정 안\n<신 설> 제11조의2(소재지) 헌법재판소는\n전북특별자치도 전주시에 둔\n다."
  }
}