{
  "title": "2205387_상법_일부개정법률안",
  "bill_number": "5387",
  "proposal_date": "2024. 11. 8.",
  "submission_date": "",
  "is_alternative": false,
  "alternative_bill_numbers": [],
  "has_comparison_table": false,
  "comparison_table": "신·구조문대비표\n현 행 개 정 안\n第382條의3(理事의 忠實義務) 理 제382조의3(이사의 충실의무) 이\n事는 法令과 定款의 規定에 따 사는 법령과 정관의 규정에 따\n라 會社를 위하여 그 職務를 라 주주와 회사를 위하여 그\n忠實하게 수행하여야 한다. 직무를 충실하게 수행하여야\n한다.",
  "full_text": "상법 일부개정법률안\n(이언주의원 대표발의)\n발의연월일 : 2024. 11. 8.\n의 안\n5387\n번 호 발 의 자 : 이언주ㆍ민병덕ㆍ박홍배\n김병주ㆍ이재관ㆍ이광희\n오세희ㆍ정진욱ㆍ박지혜\n김동아 의원(10인)\n제안이유 및 주요내용\n「상법」 제382조의3(이사의 충실의무) 조항은 “이사는 법령과 정관\n의 규정에 따라 회사를 위하여 그 직무를 충실하게 수행하여야 한다”\n고 규정하고 있어 주주에 대한 충실의무는 없음.\n회사의 이사들이 그들을 선임한 지배주주의 입장만 대변하여 소\n수 주주의 이익을 침해한다면 이는 주주 각자는 출자한 몫에 따라\n회사의 의사결정에 참여하고 이익을 분배받아야 한다는 주주 평등\n원칙에 반하는 결과를 초래하고 있음. 주주 평등원칙은 사유재산보\n호라는 자본주의 기초 정신에 입각한 것으로 우리나라 전체를 관통\n하는 대원칙임.\n이에 따라 동법 제382조의3(이사의 충실의무) 조항을 “이사는 법\n령과 정관의 규정에 따라 주주와 회사를 위하여 그 직무를 충실하\n게 수행하여야 한다”로 개정함으로써 소액주주의 권리 보호와 주주\n\n\n\n평등원칙을 실현하고자 함(안 제382조의3).\n\n법률 제 호\n상법 일부개정법률안\n상법 일부를 다음과 같이 개정한다.\n제382조의3을 다음과 같이 한다.\n제382조의3(이사의 충실의무) 이사는 법령과 정관의 규정에 따라 주주\n와 회사를 위하여 그 직무를 충실하게 수행하여야 한다.\n부 칙\n이 법은 공포 후 3개월이 경과한 날부터 시행한다.\n\n\n\n\n신·구조문대비표\n현 행 개 정 안\n第382條의3(理事의 忠實義務) 理 제382조의3(이사의 충실의무) 이\n事는 法令과 定款의 規定에 따 사는 법령과 정관의 규정에 따\n라 會社를 위하여 그 職務를 라 주주와 회사를 위하여 그\n忠實하게 수행하여야 한다. 직무를 충실하게 수행하여야\n한다.\n",
  "sections": {
    "제안이유": "및",
    "주요내용": "「상법」 제382조의3(이사의 충실의무) 조항은 “이사는 법령과 정관\n의 규정에 따라 회사를 위하여 그 직무를 충실하게 수행하여야 한다”\n고 규정하고 있어 주주에 대한 충실의무는 없음.\n회사의 이사들이 그들을 선임한 지배주주의 입장만 대변하여 소\n수 주주의 이익을 침해한다면 이는 주주 각자는 출자한 몫에 따라\n회사의 의사결정에 참여하고 이익을 분배받아야 한다는 주주 평등\n원칙에 반하는 결과를 초래하고 있음. 주주 평등원칙은 사유재산보\n호라는 자본주의 기초 정신에 입각한 것으로 우리나라 전체를 관통\n하는 대원칙임.\n이에 따라 동법 제382조의3(이사의 충실의무) 조항을 “이사는 법\n령과 정관의 규정에 따라 주주와 회사를 위하여 그 직무를 충실하\n게 수행하여야 한다”로 개정함으로써 소액주주의 권리 보호와 주주\n\n\n\n평등원칙을 실현하고자 함(안 제382조의3).",
    "제안이유_및_주요내용": "「상법」 제382조의3(이사의 충실의무) 조항은 “이사는 법령과 정관\n의 규정에 따라 회사를 위하여 그 직무를 충실하게 수행하여야 한다”\n고 규정하고 있어 주주에 대한 충실의무는 없음.\n회사의 이사들이 그들을 선임한 지배주주의 입장만 대변하여 소\n수 주주의 이익을 침해한다면 이는 주주 각자는 출자한 몫에 따라\n회사의 의사결정에 참여하고 이익을 분배받아야 한다는 주주 평등\n원칙에 반하는 결과를 초래하고 있음. 주주 평등원칙은 사유재산보\n호라는 자본주의 기초 정신에 입각한 것으로 우리나라 전체를 관통\n하는 대원칙임.\n이에 따라 동법 제382조의3(이사의 충실의무) 조항을 “이사는 법\n령과 정관의 규정에 따라 주주와 회사를 위하여 그 직무를 충실하\n게 수행하여야 한다”로 개정함으로써 소액주주의 권리 보호와 주주\n\n\n\n평등원칙을 실현하고자 함(안 제382조의3).",
    "법률_제_호": "상법 일부개정법률안\n상법 일부를 다음과 같이 개정한다.\n제382조의3을 다음과 같이 한다.\n제382조의3(이사의 충실의무) 이사는 법령과 정관의 규정에 따라 주주\n와 회사를 위하여 그 직무를 충실하게 수행하여야 한다.",
    "신구조문대비표": "현 행 개 정 안\n第382條의3(理事의 忠實義務) 理 제382조의3(이사의 충실의무) 이\n事는 法令과 定款의 規定에 따 사는 법령과 정관의 규정에 따\n라 會社를 위하여 그 職務를 라 주주와 회사를 위하여 그\n忠實하게 수행하여야 한다. 직무를 충실하게 수행하여야\n한다."
  }
}