{
  "title": "2206674_국가공무원법_일부개정법률안",
  "bill_number": "6674",
  "proposal_date": "2024. 12. 18.",
  "submission_date": "",
  "is_alternative": false,
  "alternative_bill_numbers": [],
  "has_comparison_table": false,
  "comparison_table": "신ㆍ구조문대비표\n현 행 개 정 안\n<신 설> 제47조의2(권한행사가 정지된 공\n무원의 보수) 탄핵소추의 의결\n을 받아 권한 행사가 정지된\n자는 그 기간동안 보수 전액을\n감한다. 단, 헌법재판소의 결정\n으로 탄핵이 취소된 경우에는\n미지급분을 일괄 지급할 수 있\n다.",
  "full_text": "국가공무원법 일부개정법률안\n(김재원의원 대표발의)\n발의연월일 : 2024. 12. 18.\n의 안\n6674\n번 호 발 의 자 : 김재원ㆍ황운하ㆍ정춘생\n박지원ㆍ김준형ㆍ박은정\n김선민ㆍ차규근ㆍ강경숙\n박홍배ㆍ신장식ㆍ서왕진\n백선희 의원(13인)\n제안이유 및 주요내용\n현행법은 공무원 보수 결정의 원칙에 관해 규정하고 있음. 이에 따\n라 공무원의 보수는 직무의 곤란성과 책임의 정도에 맞도록 지급하고\n있음. 그러나 탄핵소추 의결로 권한 행사가 정지된 공무원의 경우, 직\n무 수행이 중단되었음에도 불구하고 관련 규정의 부재로 인해 보수가\n그대로 지급되는 문제가 발생하고 있음. 이에 탄핵소추 의결 등 권한\n행사가 정지된 경우, 해당 기간 동안 보수를 전액 감액하도록 규정하\n여 공무원의 보수가 직무 수행 실태와 부합하도록 하고자 함(안 제47\n조의2 신설).\n\n\n\n\n법률 제 호\n국가공무원법 일부개정법률안\n국가공무원법 일부를 다음과 같이 개정한다.\n제47조의2를 다음과 같이 신설한다.\n제47조의2 (권한행사가 정지된 공무원의 보수) 탄핵소추의 의결을 받\n아 권한 행사가 정지된 자는 그 기간동안 보수 전액을 감한다. 단,\n헌법재판소의 결정으로 탄핵이 취소된 경우에는 미지급분을 일괄\n지급할 수 있다.\n부 칙\n제1조(시행일) 이 법은 공포한 날부터 시행한다.\n제2조(보수의 전액 감액에 관한 적용례) 제47조의2의 개정규정은 이\n법 시행 당시 탄핵 절차가 진행 중인 경우에 대하여도 적용한다.\n\n\n\n\n신ㆍ구조문대비표\n현 행 개 정 안\n<신 설> 제47조의2(권한행사가 정지된 공\n무원의 보수) 탄핵소추의 의결\n을 받아 권한 행사가 정지된\n자는 그 기간동안 보수 전액을\n감한다. 단, 헌법재판소의 결정\n으로 탄핵이 취소된 경우에는\n미지급분을 일괄 지급할 수 있\n다.\n",
  "sections": {
    "제안이유": "및",
    "주요내용": "현행법은 공무원 보수 결정의 원칙에 관해 규정하고 있음. 이에 따\n라 공무원의 보수는 직무의 곤란성과 책임의 정도에 맞도록 지급하고\n있음. 그러나 탄핵소추 의결로 권한 행사가 정지된 공무원의 경우, 직\n무 수행이 중단되었음에도 불구하고 관련 규정의 부재로 인해 보수가\n그대로 지급되는 문제가 발생하고 있음. 이에 탄핵소추 의결 등 권한\n행사가 정지된 경우, 해당 기간 동안 보수를 전액 감액하도록 규정하\n여 공무원의 보수가 직무 수행 실태와 부합하도록 하고자 함(안 제47\n조의2 신설).",
    "제안이유_및_주요내용": "현행법은 공무원 보수 결정의 원칙에 관해 규정하고 있음. 이에 따\n라 공무원의 보수는 직무의 곤란성과 책임의 정도에 맞도록 지급하고\n있음. 그러나 탄핵소추 의결로 권한 행사가 정지된 공무원의 경우, 직\n무 수행이 중단되었음에도 불구하고 관련 규정의 부재로 인해 보수가\n그대로 지급되는 문제가 발생하고 있음. 이에 탄핵소추 의결 등 권한\n행사가 정지된 경우, 해당 기간 동안 보수를 전액 감액하도록 규정하\n여 공무원의 보수가 직무 수행 실태와 부합하도록 하고자 함(안 제47\n조의2 신설).",
    "법률_제_호": "국가공무원법 일부개정법률안\n국가공무원법 일부를 다음과 같이 개정한다.\n제47조의2를 다음과 같이 신설한다.\n제47조의2 (권한행사가 정지된 공무원의 보수) 탄핵소추의 의결을 받\n아 권한 행사가 정지된 자는 그 기간동안 보수 전액을 감한다. 단,\n헌법재판소의 결정으로 탄핵이 취소된 경우에는 미지급분을 일괄\n지급할 수 있다.",
    "신구조문대비표": "현 행 개 정 안\n<신 설> 제47조의2(권한행사가 정지된 공\n무원의 보수) 탄핵소추의 의결\n을 받아 권한 행사가 정지된\n자는 그 기간동안 보수 전액을\n감한다. 단, 헌법재판소의 결정\n으로 탄핵이 취소된 경우에는\n미지급분을 일괄 지급할 수 있\n다."
  }
}