{
  "title": "2206350_진실·화해를_위한_과거사정리_기본법_일부개정법률안",
  "bill_number": "6350",
  "proposal_date": "2024. 12. 10.",
  "submission_date": "",
  "is_alternative": false,
  "alternative_bill_numbers": [],
  "has_comparison_table": false,
  "comparison_table": "신ㆍ구조문대비표\n현 행 개 정 안\n제4조(위원회의 구성) ① ∼ ③ 제4조(위원회의 구성) ① ∼ ③\n(생 략) (현행과 같음)\n④위원장은 상임위원 중에서 ④----------------------\n대통령이 임명한다. 국회의 인사청문을 거쳐 대통\n령이---------.\n⑤ (생 략) ⑤ (현행과 같음)",
  "full_text": "진실ㆍ화해를 위한 과거사정리 기본법 일부개정법률안\n(한병도의원 대표발의)\n발의연월일 : 2024. 12. 10.\n의 안\n6350\n번 호 발 의 자 : 한병도ㆍ위성곤ㆍ이광희\n신정훈ㆍ박정현ㆍ이해식\n모경종ㆍ이상식ㆍ양부남\n김성환ㆍ강선우ㆍ채현일\n윤건영ㆍ김성회ㆍ김영환\n의원(15인)\n제안이유 및 주요내용\n진실ㆍ화해를위한과거사정리위원회는 역사적으로 왜곡되거나 은폐\n된 진실을 밝혀냄으로써 민족의 정통성을 확립하고 과거와의 화해를\n통해 국민통합에 기여하고자 설립된 독립위원회임.\n그런데 현행법상 진실ㆍ화해를위한과거사정리위원회 위원장은 대통\n령이 임명하고, 정무직 공무원으로 보하도록 규정하였을 뿐 국회의 인\n사청문 대상으로 정하고 있지 않음. 청문 없이 임명된 위원장이 최근\n“5ㆍ18광주민주화운동에 북한이 개입했을 가능성이 있다”고 발언하는\n등 국가폭력 진상을 규명하는 조직의 수장으로서 부적절한 언행을 반\n복하고 있는바, 위원회가 수행하는 업무의 중요도와 위원회의 전문성\nㆍ정치적 중립성 등을 고려할 때 위원장 임명 시 국회의 인사청문회\n를 거치도록 할 필요가 있음.\n\n\n\n이에 진실ㆍ화해위원회 위원장 또한 대통령이 임명하기 전 국회 인\n사청문을 거치도록 규정함으로써 극단적 언행을 일삼은 인사의 임명\n을 저지하고, 진실화해위원회가 국가폭력 진상규명 및 국민통합 기여\n라는 목적을 실현할 수 있도록 하고자 함(안 제4조제4항).\n참고사항\n이 법률안은 한병도의원이 대표발의한 「국회법 일부개정법률안」\n(의안번호 제6360호) 및 「인사청문회법 일부개정법률안」(의안번호\n제6359호)의 의결을 전제로 하는 것이므로 같은 법률안이 의결되지 아\n니하거나 수정의결되는 경우에는 이에 맞추어 조정되어야 할 것임.\n\n법률 제 호\n진실ㆍ화해를 위한 과거사정리 기본법 일부개정법률안\n진실ㆍ화해를 위한 과거사정리 기본법 일부를 다음과 같이 개정한다.\n제4조제4항 중 “대통령이”를 “국회의 인사청문을 거쳐 대통령이”로 한\n다.\n부 칙\n제1조(시행일) 이 법은 공포한 날부터 시행한다.\n제2조(위원장의 국회 인사청문에 관한 적용례) 제4조제4항의 개정규정\n은 이 법 시행 이후 임명되는 위원장부터 적용한다.\n\n\n\n\n신ㆍ구조문대비표\n현 행 개 정 안\n제4조(위원회의 구성) ① ∼ ③ 제4조(위원회의 구성) ① ∼ ③\n(생 략) (현행과 같음)\n④위원장은 상임위원 중에서 ④----------------------\n대통령이 임명한다. 국회의 인사청문을 거쳐 대통\n령이---------.\n⑤ (생 략) ⑤ (현행과 같음)\n",
  "sections": {
    "제안이유": "및",
    "주요내용": "진실ㆍ화해를위한과거사정리위원회는 역사적으로 왜곡되거나 은폐\n된 진실을 밝혀냄으로써 민족의 정통성을 확립하고 과거와의 화해를\n통해 국민통합에 기여하고자 설립된 독립위원회임.\n그런데 현행법상 진실ㆍ화해를위한과거사정리위원회 위원장은 대통\n령이 임명하고, 정무직 공무원으로 보하도록 규정하였을 뿐 국회의 인\n사청문 대상으로 정하고 있지 않음. 청문 없이 임명된 위원장이 최근\n“5ㆍ18광주민주화운동에 북한이 개입했을 가능성이 있다”고 발언하는\n등 국가폭력 진상을 규명하는 조직의 수장으로서 부적절한 언행을 반\n복하고 있는바, 위원회가 수행하는 업무의 중요도와 위원회의 전문성\nㆍ정치적 중립성 등을 고려할 때 위원장 임명 시 국회의 인사청문회\n를 거치도록 할 필요가 있음.\n\n\n\n이에 진실ㆍ화해위원회 위원장 또한 대통령이 임명하기 전 국회 인\n사청문을 거치도록 규정함으로써 극단적 언행을 일삼은 인사의 임명\n을 저지하고, 진실화해위원회가 국가폭력 진상규명 및 국민통합 기여\n라는 목적을 실현할 수 있도록 하고자 함(안 제4조제4항).",
    "제안이유_및_주요내용": "진실ㆍ화해를위한과거사정리위원회는 역사적으로 왜곡되거나 은폐\n된 진실을 밝혀냄으로써 민족의 정통성을 확립하고 과거와의 화해를\n통해 국민통합에 기여하고자 설립된 독립위원회임.\n그런데 현행법상 진실ㆍ화해를위한과거사정리위원회 위원장은 대통\n령이 임명하고, 정무직 공무원으로 보하도록 규정하였을 뿐 국회의 인\n사청문 대상으로 정하고 있지 않음. 청문 없이 임명된 위원장이 최근\n“5ㆍ18광주민주화운동에 북한이 개입했을 가능성이 있다”고 발언하는\n등 국가폭력 진상을 규명하는 조직의 수장으로서 부적절한 언행을 반\n복하고 있는바, 위원회가 수행하는 업무의 중요도와 위원회의 전문성\nㆍ정치적 중립성 등을 고려할 때 위원장 임명 시 국회의 인사청문회\n를 거치도록 할 필요가 있음.\n\n\n\n이에 진실ㆍ화해위원회 위원장 또한 대통령이 임명하기 전 국회 인\n사청문을 거치도록 규정함으로써 극단적 언행을 일삼은 인사의 임명\n을 저지하고, 진실화해위원회가 국가폭력 진상규명 및 국민통합 기여\n라는 목적을 실현할 수 있도록 하고자 함(안 제4조제4항).",
    "법률_제_호": "진실ㆍ화해를 위한 과거사정리 기본법 일부개정법률안\n진실ㆍ화해를 위한 과거사정리 기본법 일부를 다음과 같이 개정한다.\n제4조제4항 중 “대통령이”를 “국회의 인사청문을 거쳐 대통령이”로 한\n다.",
    "신구조문대비표": "현 행 개 정 안\n제4조(위원회의 구성) ① ∼ ③ 제4조(위원회의 구성) ① ∼ ③\n(생 략) (현행과 같음)\n④위원장은 상임위원 중에서 ④----------------------\n대통령이 임명한다. 국회의 인사청문을 거쳐 대통\n령이---------.\n⑤ (생 략) ⑤ (현행과 같음)"
  }
}