{
  "title": "2206060_형사소송법_일부개정법률안",
  "bill_number": "6060",
  "proposal_date": "2024. 11. 29.",
  "submission_date": "",
  "is_alternative": false,
  "alternative_bill_numbers": [],
  "has_comparison_table": false,
  "comparison_table": "신ㆍ구조문대비표\n현 행 개 정 안\n제34조(피고인ㆍ피의자와의 접견, 제34조(피고인ㆍ피의자와의 접견,\n교통, 진료) (생 략) 교통, 진료) ① (현행 제목 외\n의 부분과 같음)\n<신 설> ② 교정시설의 장은 토요일, 일\n요일 및 「공휴일에 관한 법\n률」에 따른 공휴일 및 대체공\n휴일에도 제1항의 접견, 교통,\n진료를 보장하고 지원하여야\n한다.",
  "full_text": "형사소송법 일부개정법률안\n(이건태의원 대표발의)\n발의연월일 : 2024. 11. 29.\n의 안\n6060\n번 호 발 의 자 : 이건태ㆍ박지원ㆍ이수진\n황 희ㆍ장종태ㆍ조인철\n송재봉ㆍ이개호ㆍ양문석\n김한규 의원(10인)\n제안이유 및 주요내용\n현행법은 변호인이나 변호인이 되려는 자는 신체가 구속된 피고인\n또는 피의자를 접견하고 의사로 하여금 피고인이나 피의자를 진료하\n게 할 수 있음. 변호인의 조력을 받을 권리 등 변호인과의 접견교통권\n은 헌법상 권리로서, 교정행정상의 편의보다 신체가 구속된 피고인이\n나 피의자의 권리가 보다 우선시되어야 할 것임.\n그런데 실무상 토ㆍ일요일이나 공휴일에는 변호인과의 접견 및 의\n사의 진료가 불허되고 있고, 이로 인하여 피고인과 피의자의 건강권,\n변호인의 조력을 받을 권리가 중대하게 제한되고 있음.\n이에 토요일, 일요일 및 공휴일에도 신체가 구속된 피고인 등에 대\n해 변호인의 접견 및 그에 따른 의사의 진료가 가능하도록 현행법을\n개정하여 피고인 등의 권리를 보다 충실하게 보호하고자 하는 취지임\n(안 제34조제2항 신설).\n\n\n\n\n법률 제 호\n형사소송법 일부개정법률안\n형사소송법 일부를 다음과 같이 개정한다.\n제34조 제목 외의 부분을 제1항으로 하고, 같은 조에 제2항을 다음과\n같이 신설한다.\n② 교정시설의 장은 토요일, 일요일 및 「공휴일에 관한 법률」에\n따른 공휴일 및 대체공휴일에도 제1항의 접견, 교통, 진료를 보장하\n고 지원하여야 한다.\n부 칙\n이 법은 공포 후 3개월이 경과한 날부터 시행한다.\n\n\n\n\n신ㆍ구조문대비표\n현 행 개 정 안\n제34조(피고인ㆍ피의자와의 접견, 제34조(피고인ㆍ피의자와의 접견,\n교통, 진료) (생 략) 교통, 진료) ① (현행 제목 외\n의 부분과 같음)\n<신 설> ② 교정시설의 장은 토요일, 일\n요일 및 「공휴일에 관한 법\n률」에 따른 공휴일 및 대체공\n휴일에도 제1항의 접견, 교통,\n진료를 보장하고 지원하여야\n한다.\n",
  "sections": {
    "제안이유": "및",
    "주요내용": "현행법은 변호인이나 변호인이 되려는 자는 신체가 구속된 피고인\n또는 피의자를 접견하고 의사로 하여금 피고인이나 피의자를 진료하\n게 할 수 있음. 변호인의 조력을 받을 권리 등 변호인과의 접견교통권\n은 헌법상 권리로서, 교정행정상의 편의보다 신체가 구속된 피고인이\n나 피의자의 권리가 보다 우선시되어야 할 것임.\n그런데 실무상 토ㆍ일요일이나 공휴일에는 변호인과의 접견 및 의\n사의 진료가 불허되고 있고, 이로 인하여 피고인과 피의자의 건강권,\n변호인의 조력을 받을 권리가 중대하게 제한되고 있음.\n이에 토요일, 일요일 및 공휴일에도 신체가 구속된 피고인 등에 대\n해 변호인의 접견 및 그에 따른 의사의 진료가 가능하도록 현행법을\n개정하여 피고인 등의 권리를 보다 충실하게 보호하고자 하는 취지임\n(안 제34조제2항 신설).",
    "제안이유_및_주요내용": "현행법은 변호인이나 변호인이 되려는 자는 신체가 구속된 피고인\n또는 피의자를 접견하고 의사로 하여금 피고인이나 피의자를 진료하\n게 할 수 있음. 변호인의 조력을 받을 권리 등 변호인과의 접견교통권\n은 헌법상 권리로서, 교정행정상의 편의보다 신체가 구속된 피고인이\n나 피의자의 권리가 보다 우선시되어야 할 것임.\n그런데 실무상 토ㆍ일요일이나 공휴일에는 변호인과의 접견 및 의\n사의 진료가 불허되고 있고, 이로 인하여 피고인과 피의자의 건강권,\n변호인의 조력을 받을 권리가 중대하게 제한되고 있음.\n이에 토요일, 일요일 및 공휴일에도 신체가 구속된 피고인 등에 대\n해 변호인의 접견 및 그에 따른 의사의 진료가 가능하도록 현행법을\n개정하여 피고인 등의 권리를 보다 충실하게 보호하고자 하는 취지임\n(안 제34조제2항 신설).",
    "법률_제_호": "형사소송법 일부개정법률안\n형사소송법 일부를 다음과 같이 개정한다.\n제34조 제목 외의 부분을 제1항으로 하고, 같은 조에 제2항을 다음과\n같이 신설한다.\n② 교정시설의 장은 토요일, 일요일 및 「공휴일에 관한 법률」에\n따른 공휴일 및 대체공휴일에도 제1항의 접견, 교통, 진료를 보장하\n고 지원하여야 한다.",
    "신구조문대비표": "현 행 개 정 안\n제34조(피고인ㆍ피의자와의 접견, 제34조(피고인ㆍ피의자와의 접견,\n교통, 진료) (생 략) 교통, 진료) ① (현행 제목 외\n의 부분과 같음)\n<신 설> ② 교정시설의 장은 토요일, 일\n요일 및 「공휴일에 관한 법\n률」에 따른 공휴일 및 대체공\n휴일에도 제1항의 접견, 교통,\n진료를 보장하고 지원하여야\n한다."
  }
}