{
  "title": "2206861_헌법재판소법_일부개정법률안",
  "bill_number": "6861",
  "proposal_date": "2024. 12. 23.",
  "submission_date": "",
  "is_alternative": false,
  "alternative_bill_numbers": [],
  "has_comparison_table": false,
  "comparison_table": "신ㆍ구조문대비표\n현 행 개 정 안\n제7조(재판관의 임기) ①ㆍ② (생 제7조(재판관의 임기) ①ㆍ② (현\n략) 행과 같음)\n<신 설> ③ 제1항 및 제2항에도 불구하\n고 후임자가 임명되지 아니한\n재판관의 경우에는 그 후임자\n가 임명될 때까지 계속하여 직\n무를 수행한다.",
  "full_text": "헌법재판소법 일부개정법률안\n(김현정의원 대표발의)\n발의연월일 : 2024. 12. 23.\n의 안\n6861\n번 호 발 의 자 : 김현정ㆍ민병덕ㆍ이학영\n임오경ㆍ박 정ㆍ전재수\n양문석ㆍ이개호ㆍ이수진\n박균택 의원(10인)\n제안이유 및 주요내용\n현행법은 헌법재판소 재판관의 임기를 6년으로 규정하고 그 정년을\n70세로 함.\n이와 관련하여 재판관의 임기가 만료되고 난 뒤에도 상당 기간 후\n임자가 임명되지 못하는 경우가 발생하여, 재판관 공백으로 인해 심리\n진행에 문제가 생기는 경우가 빈발하고 있다는 지적이 있음.\n이에 재판관이 임기가 만료되거나 정년이 된 뒤에도 후임자가 임명\n되기 전까지는 직무를 수행하도록 하여, 헌법재판소의 지속성과 안정\n성을 확보하고자 함(안 제7조제3항 신설).\n\n\n\n\n법률 제 호\n헌법재판소법 일부개정법률안\n헌법재판소법 일부를 다음과 같이 개정한다.\n제7조에 제3항을 다음과 같이 신설한다.\n③ 제1항 및 제2항에도 불구하고 후임자가 임명되지 아니한 재판관\n의 경우에는 그 후임자가 임명될 때까지 계속하여 직무를 수행한다.\n부 칙\n이 법은 공포한 날부터 시행한다.\n\n\n\n\n신ㆍ구조문대비표\n현 행 개 정 안\n제7조(재판관의 임기) ①ㆍ② (생 제7조(재판관의 임기) ①ㆍ② (현\n략) 행과 같음)\n<신 설> ③ 제1항 및 제2항에도 불구하\n고 후임자가 임명되지 아니한\n재판관의 경우에는 그 후임자\n가 임명될 때까지 계속하여 직\n무를 수행한다.\n",
  "sections": {
    "제안이유": "및",
    "주요내용": "현행법은 헌법재판소 재판관의 임기를 6년으로 규정하고 그 정년을\n70세로 함.\n이와 관련하여 재판관의 임기가 만료되고 난 뒤에도 상당 기간 후\n임자가 임명되지 못하는 경우가 발생하여, 재판관 공백으로 인해 심리\n진행에 문제가 생기는 경우가 빈발하고 있다는 지적이 있음.\n이에 재판관이 임기가 만료되거나 정년이 된 뒤에도 후임자가 임명\n되기 전까지는 직무를 수행하도록 하여, 헌법재판소의 지속성과 안정\n성을 확보하고자 함(안 제7조제3항 신설).",
    "제안이유_및_주요내용": "현행법은 헌법재판소 재판관의 임기를 6년으로 규정하고 그 정년을\n70세로 함.\n이와 관련하여 재판관의 임기가 만료되고 난 뒤에도 상당 기간 후\n임자가 임명되지 못하는 경우가 발생하여, 재판관 공백으로 인해 심리\n진행에 문제가 생기는 경우가 빈발하고 있다는 지적이 있음.\n이에 재판관이 임기가 만료되거나 정년이 된 뒤에도 후임자가 임명\n되기 전까지는 직무를 수행하도록 하여, 헌법재판소의 지속성과 안정\n성을 확보하고자 함(안 제7조제3항 신설).",
    "법률_제_호": "헌법재판소법 일부개정법률안\n헌법재판소법 일부를 다음과 같이 개정한다.\n제7조에 제3항을 다음과 같이 신설한다.\n③ 제1항 및 제2항에도 불구하고 후임자가 임명되지 아니한 재판관\n의 경우에는 그 후임자가 임명될 때까지 계속하여 직무를 수행한다.",
    "신구조문대비표": "현 행 개 정 안\n제7조(재판관의 임기) ①ㆍ② (생 제7조(재판관의 임기) ①ㆍ② (현\n략) 행과 같음)\n<신 설> ③ 제1항 및 제2항에도 불구하\n고 후임자가 임명되지 아니한\n재판관의 경우에는 그 후임자\n가 임명될 때까지 계속하여 직\n무를 수행한다."
  }
}