{
  "title": "2206862_민법_일부개정법률안",
  "bill_number": "6862",
  "proposal_date": "2024. 12. 23.",
  "submission_date": "",
  "is_alternative": false,
  "alternative_bill_numbers": [],
  "has_comparison_table": false,
  "comparison_table": "신ㆍ구조문대비표\n현 행 개 정 안\n第837條의2(面接交涉權) ① ∼ ③ 第837條의2(面接交涉權) ① ∼ ③\n(생 략) (현행과 같음)\n<신 설> ④ 가정법원은 제2항 또는 제3\n항에 따라 면접교섭을 허가 또\n는 제한ㆍ배제ㆍ변경하는 경우\n부ㆍ모ㆍ자(子) 간의 가정폭력\n이력을 확인하고 이를 참작하\n여 결정하여야 한다.",
  "full_text": "민법 일부개정법률안\n(민홍철의원 대표발의)\n발의연월일 : 2024. 12. 23.\n의 안\n6862\n번 호 발 의 자 : 민홍철ㆍ백혜련ㆍ문진석\n한정애ㆍ정준호ㆍ허성무\n한준호ㆍ신정훈ㆍ황 희\n김교흥ㆍ위성곤ㆍ차지호\n장철민ㆍ박홍근ㆍ전재수\n의원(15인)\n제안이유 및 주요내용\n현행법상 자(子)를 직접 양육하지 아니하는 부모의 일방과 자(子)는\n상호 면접교섭할 수 있는 권리를 가지며, 가정법원은 자의 복리를 위\n하여 필요한 때에는 당사자의 청구 또는 직권에 의하여 면접교섭을\n제한ㆍ배제ㆍ변경할 수 있도록 규정하고 있음.\n그러나 ‘자의 복리’가 추상적인 용어로 규정되어 있을 뿐, 가정폭력\n이력 등의 확인의무가 직접적으로 명시되어 있지 않아 실무에서 그\n사실을 고려할 근거가 미약하다는 지적이 있음. 실제로 가정폭력 가해\n자가 자녀 면접교섭에 동행한 배우자를 폭행하거나, 자녀를 납치하여\n배우자에 대한 위협 수단으로 이용하는 사례가 발생하기도 함.\n이에 법원이 자녀 면접교섭을 허가 또는 제한ㆍ배제ㆍ변경할 때에\n는 부ㆍ모ㆍ자(子) 간의 가정폭력 이력을 확인하고 이를 참작하여 결\n\n\n\n정하도록 명문으로 규정하려는 것임(안 제837조의2제4항 신설).\n\n법률 제 호\n민법 일부개정법률안\n민법 일부를 다음과 같이 개정한다.\n제837조의2에 제4항을 다음과 같이 신설한다.\n④ 가정법원은 제2항 또는 제3항에 따라 면접교섭을 허가 또는 제\n한ㆍ배제ㆍ변경하는 경우 부ㆍ모ㆍ자(子) 간의 가정폭력 이력을 확\n인하고 이를 참작하여 결정하여야 한다.\n부 칙\n이 법은 공포한 날부터 시행한다.\n\n\n\n\n신ㆍ구조문대비표\n현 행 개 정 안\n第837條의2(面接交涉權) ① ∼ ③ 第837條의2(面接交涉權) ① ∼ ③\n(생 략) (현행과 같음)\n<신 설> ④ 가정법원은 제2항 또는 제3\n항에 따라 면접교섭을 허가 또\n는 제한ㆍ배제ㆍ변경하는 경우\n부ㆍ모ㆍ자(子) 간의 가정폭력\n이력을 확인하고 이를 참작하\n여 결정하여야 한다.\n",
  "sections": {
    "제안이유": "및",
    "주요내용": "현행법상 자(子)를 직접 양육하지 아니하는 부모의 일방과 자(子)는\n상호 면접교섭할 수 있는 권리를 가지며, 가정법원은 자의 복리를 위\n하여 필요한 때에는 당사자의 청구 또는 직권에 의하여 면접교섭을\n제한ㆍ배제ㆍ변경할 수 있도록 규정하고 있음.\n그러나 ‘자의 복리’가 추상적인 용어로 규정되어 있을 뿐, 가정폭력\n이력 등의 확인의무가 직접적으로 명시되어 있지 않아 실무에서 그\n사실을 고려할 근거가 미약하다는 지적이 있음. 실제로 가정폭력 가해\n자가 자녀 면접교섭에 동행한 배우자를 폭행하거나, 자녀를 납치하여\n배우자에 대한 위협 수단으로 이용하는 사례가 발생하기도 함.\n이에 법원이 자녀 면접교섭을 허가 또는 제한ㆍ배제ㆍ변경할 때에\n는 부ㆍ모ㆍ자(子) 간의 가정폭력 이력을 확인하고 이를 참작하여 결\n\n\n\n정하도록 명문으로 규정하려는 것임(안 제837조의2제4항 신설).",
    "제안이유_및_주요내용": "현행법상 자(子)를 직접 양육하지 아니하는 부모의 일방과 자(子)는\n상호 면접교섭할 수 있는 권리를 가지며, 가정법원은 자의 복리를 위\n하여 필요한 때에는 당사자의 청구 또는 직권에 의하여 면접교섭을\n제한ㆍ배제ㆍ변경할 수 있도록 규정하고 있음.\n그러나 ‘자의 복리’가 추상적인 용어로 규정되어 있을 뿐, 가정폭력\n이력 등의 확인의무가 직접적으로 명시되어 있지 않아 실무에서 그\n사실을 고려할 근거가 미약하다는 지적이 있음. 실제로 가정폭력 가해\n자가 자녀 면접교섭에 동행한 배우자를 폭행하거나, 자녀를 납치하여\n배우자에 대한 위협 수단으로 이용하는 사례가 발생하기도 함.\n이에 법원이 자녀 면접교섭을 허가 또는 제한ㆍ배제ㆍ변경할 때에\n는 부ㆍ모ㆍ자(子) 간의 가정폭력 이력을 확인하고 이를 참작하여 결\n\n\n\n정하도록 명문으로 규정하려는 것임(안 제837조의2제4항 신설).",
    "법률_제_호": "민법 일부개정법률안\n민법 일부를 다음과 같이 개정한다.\n제837조의2에 제4항을 다음과 같이 신설한다.\n④ 가정법원은 제2항 또는 제3항에 따라 면접교섭을 허가 또는 제\n한ㆍ배제ㆍ변경하는 경우 부ㆍ모ㆍ자(子) 간의 가정폭력 이력을 확\n인하고 이를 참작하여 결정하여야 한다.",
    "신구조문대비표": "현 행 개 정 안\n第837條의2(面接交涉權) ① ∼ ③ 第837條의2(面接交涉權) ① ∼ ③\n(생 략) (현행과 같음)\n<신 설> ④ 가정법원은 제2항 또는 제3\n항에 따라 면접교섭을 허가 또\n는 제한ㆍ배제ㆍ변경하는 경우\n부ㆍ모ㆍ자(子) 간의 가정폭력\n이력을 확인하고 이를 참작하\n여 결정하여야 한다."
  }
}