{
  "title": "2206745_형사소송법_일부개정법률안",
  "bill_number": "6745",
  "proposal_date": "2024. 12. 19.",
  "submission_date": "",
  "is_alternative": false,
  "alternative_bill_numbers": [],
  "has_comparison_table": false,
  "comparison_table": "신ㆍ구조문대비표\n현 행 개 정 안\n第254條(公訴提起의 方式과 公訴 第254條(公訴提起의 方式과 公訴\n狀) ① ∼ ⑤ (생 략) 狀) ① ∼ ⑤ (현행과 같음)\n<신 설> ⑥ 공소장에는 사건에 관하여\n법원에 예단이 생기게 할 수\n있는 서류, 그 밖에 물건을 첨\n부하거나 그 내용을 인용하여\n서는 아니 된다.",
  "full_text": "형사소송법 일부개정법률안\n(김승원의원 대표발의)\n발의연월일 : 2024. 12. 19.\n의 안\n6745\n번 호 발 의 자 : 김승원ㆍ박홍배ㆍ김현정\n이원택ㆍ조계원ㆍ이건태\n박균택ㆍ박지원ㆍ서영교\n박해철 의원(10인)\n제안이유 및 주요내용\n현행법은 공소를 제기함에는 피고인의 성명, 죄명, 공소사실과 적용\n법조를 기재한 공소장을 관할법원에 제출하여야 한다고 규정하고,\n「형사소송규칙」에서 공소장에는 사건에 관하여 법원에 예단이 생기\n게 할 수 있는 서류 기타 물건을 첨부하거나 그 내용을 인용하여서는\n아니 된다고 규정하여 ‘공소장일본주의’를 채택하고 있음.\n그런데 현실적으로 공소장일본주의를 위반한 공소제기의 경우 공소\n제기의 절차가 법률의 규정을 위반하여 무효인 때에 해당하여 이 법\n제327조제2호에 따라 공소기각의 판결이 선고되는 점을 고려할 때 공\n소장일본주의도 대법원 규칙이 아닌 법에 규정하는 것이 타당하다는\n의견이 있음.\n이에 공소장일본주의 원칙을 규칙에서 상향 입법함으로써 실체적\n진실발견과 적법절차보장이라는 형사소송 기본이념을 명확히 하려는\n\n\n\n것임(안 제254조제6항 신설).\n\n법률 제 호\n형사소송법 일부개정법률안\n형사소송법 일부를 다음과 같이 개정한다.\n제254조에 제6항을 다음과 같이 신설한다.\n⑥ 공소장에는 사건에 관하여 법원에 예단이 생기게 할 수 있는 서\n류, 그 밖에 물건을 첨부하거나 그 내용을 인용하여서는 아니 된다.\n부 칙\n이 법은 공포한 날부터 시행한다.\n\n\n\n\n신ㆍ구조문대비표\n현 행 개 정 안\n第254條(公訴提起의 方式과 公訴 第254條(公訴提起의 方式과 公訴\n狀) ① ∼ ⑤ (생 략) 狀) ① ∼ ⑤ (현행과 같음)\n<신 설> ⑥ 공소장에는 사건에 관하여\n법원에 예단이 생기게 할 수\n있는 서류, 그 밖에 물건을 첨\n부하거나 그 내용을 인용하여\n서는 아니 된다.\n",
  "sections": {
    "제안이유": "및",
    "주요내용": "현행법은 공소를 제기함에는 피고인의 성명, 죄명, 공소사실과 적용\n법조를 기재한 공소장을 관할법원에 제출하여야 한다고 규정하고,\n「형사소송규칙」에서 공소장에는 사건에 관하여 법원에 예단이 생기\n게 할 수 있는 서류 기타 물건을 첨부하거나 그 내용을 인용하여서는\n아니 된다고 규정하여 ‘공소장일본주의’를 채택하고 있음.\n그런데 현실적으로 공소장일본주의를 위반한 공소제기의 경우 공소\n제기의 절차가 법률의 규정을 위반하여 무효인 때에 해당하여 이 법\n제327조제2호에 따라 공소기각의 판결이 선고되는 점을 고려할 때 공\n소장일본주의도 대법원 규칙이 아닌 법에 규정하는 것이 타당하다는\n의견이 있음.\n이에 공소장일본주의 원칙을 규칙에서 상향 입법함으로써 실체적\n진실발견과 적법절차보장이라는 형사소송 기본이념을 명확히 하려는\n\n\n\n것임(안 제254조제6항 신설).",
    "제안이유_및_주요내용": "현행법은 공소를 제기함에는 피고인의 성명, 죄명, 공소사실과 적용\n법조를 기재한 공소장을 관할법원에 제출하여야 한다고 규정하고,\n「형사소송규칙」에서 공소장에는 사건에 관하여 법원에 예단이 생기\n게 할 수 있는 서류 기타 물건을 첨부하거나 그 내용을 인용하여서는\n아니 된다고 규정하여 ‘공소장일본주의’를 채택하고 있음.\n그런데 현실적으로 공소장일본주의를 위반한 공소제기의 경우 공소\n제기의 절차가 법률의 규정을 위반하여 무효인 때에 해당하여 이 법\n제327조제2호에 따라 공소기각의 판결이 선고되는 점을 고려할 때 공\n소장일본주의도 대법원 규칙이 아닌 법에 규정하는 것이 타당하다는\n의견이 있음.\n이에 공소장일본주의 원칙을 규칙에서 상향 입법함으로써 실체적\n진실발견과 적법절차보장이라는 형사소송 기본이념을 명확히 하려는\n\n\n\n것임(안 제254조제6항 신설).",
    "법률_제_호": "형사소송법 일부개정법률안\n형사소송법 일부를 다음과 같이 개정한다.\n제254조에 제6항을 다음과 같이 신설한다.\n⑥ 공소장에는 사건에 관하여 법원에 예단이 생기게 할 수 있는 서\n류, 그 밖에 물건을 첨부하거나 그 내용을 인용하여서는 아니 된다.",
    "신구조문대비표": "현 행 개 정 안\n第254條(公訴提起의 方式과 公訴 第254條(公訴提起의 方式과 公訴\n狀) ① ∼ ⑤ (생 략) 狀) ① ∼ ⑤ (현행과 같음)\n<신 설> ⑥ 공소장에는 사건에 관하여\n법원에 예단이 생기게 할 수\n있는 서류, 그 밖에 물건을 첨\n부하거나 그 내용을 인용하여\n서는 아니 된다."
  }
}