{
  "title": "2206025_민법_일부개정법률안",
  "bill_number": "6025",
  "proposal_date": "2024. 11. 28.",
  "submission_date": "",
  "is_alternative": false,
  "alternative_bill_numbers": [],
  "has_comparison_table": false,
  "comparison_table": "신ㆍ구조문대비표\n현 행 개 정 안\n<신 설> 제98조의2(동물의 법적 지위) ①\n동물은 물건이 아니다.\n② 동물에 대하여는 법률에 특\n별한 규정이 있는 경우를 제외\n하고는 물건에 관한 규정을 준\n용한다.",
  "full_text": "민법 일부개정법률안\n(김태년의원 대표발의)\n발의연월일 : 2024. 11. 28.\n의 안\n6025\n번 호 발 의 자 : 김태년ㆍ홍기원ㆍ정준호\n박지원ㆍ김준형ㆍ김병기\n전현희ㆍ이훈기ㆍ김영배\n손명수 의원(10인)\n제안이유 및 주요내용\n현행법은 권리의 주체와 객체의 관점에서 인(人)과 물건으로 이분화\n하면서, 인은 자연인과 법인으로 권리의 주체가 되고, 유체물 및 전기\n기타 관리할 수 있는 자연력을 물건으로 정의하여 인이 아닌 것은 물\n건으로 권리의 객체로 구분함. 이러한 이분법적 구분에 따라 동물은\n물건으로 취급되어 왔음.\n그런데 최근 반려동물 양육인구의 증가 및 동물의 생명에 대한 존\n중 의식이 커져감에 따라 우리 사회에서 동물학대나 유기의 방지, 비\n인도적 처우의 개선 등 이른바 동물권 보호 강화의 요청이 확대되고\n있어 현행법의 동물의 법적 지위가 국민의 인식에 부합하지 아니한다\n는 지적이 제기되어 왔음.\n이에 동물의 법적지위에 관한 규정을 신설하고 동물은 물건이 아님\n을 선언함으로써, 시대적 인식의 변화와 동물권 강화의 토대를 현행법\n\n\n\n에 규정하려는 취지임(안 제98조의2 신설).\n\n법률 제 호\n민법 일부개정법률안\n민법 일부를 다음과 같이 개정한다.\n제98조의2를 다음과 같이 신설한다.\n제98조의2(동물의 법적 지위) ① 동물은 물건이 아니다.\n② 동물에 대하여는 법률에 특별한 규정이 있는 경우를 제외하고는\n물건에 관한 규정을 준용한다.\n부 칙\n이 법은 공포 후 6개월이 경과한 날부터 시행한다.\n\n\n\n\n신ㆍ구조문대비표\n현 행 개 정 안\n<신 설> 제98조의2(동물의 법적 지위) ①\n동물은 물건이 아니다.\n② 동물에 대하여는 법률에 특\n별한 규정이 있는 경우를 제외\n하고는 물건에 관한 규정을 준\n용한다.\n",
  "sections": {
    "제안이유": "및",
    "주요내용": "현행법은 권리의 주체와 객체의 관점에서 인(人)과 물건으로 이분화\n하면서, 인은 자연인과 법인으로 권리의 주체가 되고, 유체물 및 전기\n기타 관리할 수 있는 자연력을 물건으로 정의하여 인이 아닌 것은 물\n건으로 권리의 객체로 구분함. 이러한 이분법적 구분에 따라 동물은\n물건으로 취급되어 왔음.\n그런데 최근 반려동물 양육인구의 증가 및 동물의 생명에 대한 존\n중 의식이 커져감에 따라 우리 사회에서 동물학대나 유기의 방지, 비\n인도적 처우의 개선 등 이른바 동물권 보호 강화의 요청이 확대되고\n있어 현행법의 동물의 법적 지위가 국민의 인식에 부합하지 아니한다\n는 지적이 제기되어 왔음.\n이에 동물의 법적지위에 관한 규정을 신설하고 동물은 물건이 아님\n을 선언함으로써, 시대적 인식의 변화와 동물권 강화의 토대를 현행법\n\n\n\n에 규정하려는 취지임(안 제98조의2 신설).",
    "제안이유_및_주요내용": "현행법은 권리의 주체와 객체의 관점에서 인(人)과 물건으로 이분화\n하면서, 인은 자연인과 법인으로 권리의 주체가 되고, 유체물 및 전기\n기타 관리할 수 있는 자연력을 물건으로 정의하여 인이 아닌 것은 물\n건으로 권리의 객체로 구분함. 이러한 이분법적 구분에 따라 동물은\n물건으로 취급되어 왔음.\n그런데 최근 반려동물 양육인구의 증가 및 동물의 생명에 대한 존\n중 의식이 커져감에 따라 우리 사회에서 동물학대나 유기의 방지, 비\n인도적 처우의 개선 등 이른바 동물권 보호 강화의 요청이 확대되고\n있어 현행법의 동물의 법적 지위가 국민의 인식에 부합하지 아니한다\n는 지적이 제기되어 왔음.\n이에 동물의 법적지위에 관한 규정을 신설하고 동물은 물건이 아님\n을 선언함으로써, 시대적 인식의 변화와 동물권 강화의 토대를 현행법\n\n\n\n에 규정하려는 취지임(안 제98조의2 신설).",
    "법률_제_호": "민법 일부개정법률안\n민법 일부를 다음과 같이 개정한다.\n제98조의2를 다음과 같이 신설한다.\n제98조의2(동물의 법적 지위) ① 동물은 물건이 아니다.\n② 동물에 대하여는 법률에 특별한 규정이 있는 경우를 제외하고는\n물건에 관한 규정을 준용한다.",
    "신구조문대비표": "현 행 개 정 안\n<신 설> 제98조의2(동물의 법적 지위) ①\n동물은 물건이 아니다.\n② 동물에 대하여는 법률에 특\n별한 규정이 있는 경우를 제외\n하고는 물건에 관한 규정을 준\n용한다."
  }
}