{
  "title": "2206017_방어해면법_일부개정법률안",
  "bill_number": "6017",
  "proposal_date": "2024. 11. 28.",
  "submission_date": "",
  "is_alternative": false,
  "alternative_bill_numbers": [],
  "has_comparison_table": false,
  "comparison_table": "신·구조문대비표\n현 행 개 정 안\n제7조(퇴거의 강제 등) (생 략) 제7조(퇴거의 강제 등) ① (현행\n제목 외의 부분과 같음)\n<신 설> ② 제1항에 따른 조치 중 행정\n상 강제에 관하여는 「행정기\n본법」 제32조 또는 제33조에\n따른다.",
  "full_text": "방어해면법 일부개정법률안\n(강대식의원 대표발의)\n발의연월일 : 2024. 11. 28.\n의 안\n6017\n번 호 발 의 자 : 강대식ㆍ조지연ㆍ김선교\n최은석ㆍ유용원ㆍ서명옥\n고동진ㆍ강선영ㆍ배준영\n김장겸 의원(10인)\n제안이유 및 주요내용\n행정법 분야의 집행 원칙과 기준을 정하고 주요 행정 법제도에 관\n한 통일적인 규정을 마련하여 국민 중심의 행정법 체계를 실현하기\n위한 「행정기본법」이 제정됨에 따라, 행정상 강제에 관하여 「행정\n기본법」과 개별 법률 간의 적용관계를 명확히 하는 규정을 신설함으\n로써 행정법 체계의 정합성 및 형평성을 확보하고 국민들이 행정법\n적용관계를 이해하기 쉽게 하려는 것임(안 제7조제2항 신설).\n\n\n\n\n법률 제 호\n방어해면법 일부개정법률안\n방어해면법 일부를 다음과 같이 개정한다.\n제7조 제목 외의 부분을 제1항으로 하고, 같은 조에 제2항을 다음과\n같이 신설한다.\n② 제1항에 따른 조치 중 행정상 강제에 관하여는 「행정기본법」\n제32조 또는 제33조에 따른다.\n부 칙\n이 법은 공포한 날부터 시행한다.\n\n\n\n\n신·구조문대비표\n현 행 개 정 안\n제7조(퇴거의 강제 등) (생 략) 제7조(퇴거의 강제 등) ① (현행\n제목 외의 부분과 같음)\n<신 설> ② 제1항에 따른 조치 중 행정\n상 강제에 관하여는 「행정기\n본법」 제32조 또는 제33조에\n따른다.\n",
  "sections": {
    "제안이유": "및",
    "주요내용": "행정법 분야의 집행 원칙과 기준을 정하고 주요 행정 법제도에 관\n한 통일적인 규정을 마련하여 국민 중심의 행정법 체계를 실현하기\n위한 「행정기본법」이 제정됨에 따라, 행정상 강제에 관하여 「행정\n기본법」과 개별 법률 간의 적용관계를 명확히 하는 규정을 신설함으\n로써 행정법 체계의 정합성 및 형평성을 확보하고 국민들이 행정법\n적용관계를 이해하기 쉽게 하려는 것임(안 제7조제2항 신설).",
    "제안이유_및_주요내용": "행정법 분야의 집행 원칙과 기준을 정하고 주요 행정 법제도에 관\n한 통일적인 규정을 마련하여 국민 중심의 행정법 체계를 실현하기\n위한 「행정기본법」이 제정됨에 따라, 행정상 강제에 관하여 「행정\n기본법」과 개별 법률 간의 적용관계를 명확히 하는 규정을 신설함으\n로써 행정법 체계의 정합성 및 형평성을 확보하고 국민들이 행정법\n적용관계를 이해하기 쉽게 하려는 것임(안 제7조제2항 신설).",
    "법률_제_호": "방어해면법 일부개정법률안\n방어해면법 일부를 다음과 같이 개정한다.\n제7조 제목 외의 부분을 제1항으로 하고, 같은 조에 제2항을 다음과\n같이 신설한다.\n② 제1항에 따른 조치 중 행정상 강제에 관하여는 「행정기본법」\n제32조 또는 제33조에 따른다.",
    "신구조문대비표": "현 행 개 정 안\n제7조(퇴거의 강제 등) (생 략) 제7조(퇴거의 강제 등) ① (현행\n제목 외의 부분과 같음)\n<신 설> ② 제1항에 따른 조치 중 행정\n상 강제에 관하여는 「행정기\n본법」 제32조 또는 제33조에\n따른다."
  }
}