{
  "title": "2206084_공직선거법_일부개정법률안",
  "bill_number": "6084",
  "proposal_date": "2024. 11. 29.",
  "submission_date": "",
  "is_alternative": false,
  "alternative_bill_numbers": [],
  "has_comparison_table": false,
  "comparison_table": "신ㆍ구조문대비표\n현 행 개 정 안\n第5條(選擧事務協助) 官公署 기 제5조(선거사무지시 등) 국가기\n타 公共機關은 選擧事務에 관 관, 지방자치단체 그 밖의----\n하여 選擧管理委員會의 협조요 -------------지시 및 협조\n구를 받은 때에는 우선적으로 요구---------------------\n이에 따라야 한다. --------.",
  "full_text": "공직선거법 일부개정법률안\n(한병도의원 대표발의)\n발의연월일 : 2024. 11. 29.\n의 안\n6084\n번 호 발 의 자 : 한병도ㆍ황운하ㆍ진선미\n양부남ㆍ김영배ㆍ이춘석\n이해식ㆍ박용갑ㆍ이원택\n정태호ㆍ위성곤 의원\n(11인)\n제안이유 및 주요내용\n현행 제5조는 관공서 기타 공공기관이 선거사무에 관하여 선거관리\n위원회의 협조요구를 받은 때에는 우선적으로 이에 따르도록 규정하\n고 있음.\n그러나 ‘관공서’의 명칭 및 범위가 모호하여 해당 법조의 수명 주체\n가 불명확하고, 「대한민국헌법」 제115조제1항에서 규정한 각급 선거\n관리위원회의 행정기관에 대한 지시권이 「공직선거법」에 누락되어\n있다는 지적이 있음.\n이에 ‘관공서’를 ‘국가기관 및 지방자치단체’로 하여 수명 주체를 명\n확히 하고, 헌법 규정의 실현과 통일성 확보 등을 위하여 선거관리위\n원회의 선거사무 지시권을 법률에 추가하려는 것임(안 제5조).\n\n\n\n\n법률 제 호\n공직선거법 일부개정법률안\n공직선거법 일부를 다음과 같이 개정한다.\n제5조의 조 번호 및 제목을 다음과 같이 하고, 같은 조 중 “官公署 기\n타”를 “국가기관, 지방자치단체 그 밖의”로, “협조요구”를 “지시 및 협\n조요구”로 한다.\n제5조(선거사무지시 등)\n부 칙\n이 법은 공포한 날부터 시행한다.\n\n\n\n\n신ㆍ구조문대비표\n현 행 개 정 안\n第5條(選擧事務協助) 官公署 기 제5조(선거사무지시 등) 국가기\n타 公共機關은 選擧事務에 관 관, 지방자치단체 그 밖의----\n하여 選擧管理委員會의 협조요 -------------지시 및 협조\n구를 받은 때에는 우선적으로 요구---------------------\n이에 따라야 한다. --------.\n",
  "sections": {
    "제안이유": "및",
    "주요내용": "현행 제5조는 관공서 기타 공공기관이 선거사무에 관하여 선거관리\n위원회의 협조요구를 받은 때에는 우선적으로 이에 따르도록 규정하\n고 있음.\n그러나 ‘관공서’의 명칭 및 범위가 모호하여 해당 법조의 수명 주체\n가 불명확하고, 「대한민국헌법」 제115조제1항에서 규정한 각급 선거\n관리위원회의 행정기관에 대한 지시권이 「공직선거법」에 누락되어\n있다는 지적이 있음.\n이에 ‘관공서’를 ‘국가기관 및 지방자치단체’로 하여 수명 주체를 명\n확히 하고, 헌법 규정의 실현과 통일성 확보 등을 위하여 선거관리위\n원회의 선거사무 지시권을 법률에 추가하려는 것임(안 제5조).",
    "제안이유_및_주요내용": "현행 제5조는 관공서 기타 공공기관이 선거사무에 관하여 선거관리\n위원회의 협조요구를 받은 때에는 우선적으로 이에 따르도록 규정하\n고 있음.\n그러나 ‘관공서’의 명칭 및 범위가 모호하여 해당 법조의 수명 주체\n가 불명확하고, 「대한민국헌법」 제115조제1항에서 규정한 각급 선거\n관리위원회의 행정기관에 대한 지시권이 「공직선거법」에 누락되어\n있다는 지적이 있음.\n이에 ‘관공서’를 ‘국가기관 및 지방자치단체’로 하여 수명 주체를 명\n확히 하고, 헌법 규정의 실현과 통일성 확보 등을 위하여 선거관리위\n원회의 선거사무 지시권을 법률에 추가하려는 것임(안 제5조).",
    "법률_제_호": "공직선거법 일부개정법률안\n공직선거법 일부를 다음과 같이 개정한다.\n제5조의 조 번호 및 제목을 다음과 같이 하고, 같은 조 중 “官公署 기\n타”를 “국가기관, 지방자치단체 그 밖의”로, “협조요구”를 “지시 및 협\n조요구”로 한다.\n제5조(선거사무지시 등)",
    "신구조문대비표": "현 행 개 정 안\n第5條(選擧事務協助) 官公署 기 제5조(선거사무지시 등) 국가기\n타 公共機關은 選擧事務에 관 관, 지방자치단체 그 밖의----\n하여 選擧管理委員會의 협조요 -------------지시 및 협조\n구를 받은 때에는 우선적으로 요구---------------------\n이에 따라야 한다. --------."
  }
}