{
  "title": "2206237_독점규제_및_공정거래에_관한_법률_일부개정법률안",
  "bill_number": "6237",
  "proposal_date": "2024. 12. 5.",
  "submission_date": "",
  "is_alternative": false,
  "alternative_bill_numbers": [],
  "has_comparison_table": false,
  "comparison_table": "신·구조문대비표\n현 행 개 정 안\n<신 설> 제63조의2(겸직 등의 금지) 위원\n은 재직 중 다음 각 호의 직\n(職)을 겸하거나 직무와 관련하\n여 영리를 목적으로 하는 사업\n을 할 수 없다.\n1. 국회의원 또는 지방의회의원\n2. 국가공무원 또는 지방공무원\n3. 자산총액 또는 매출액의 규\n모가 대통령령으로 정하는 기\n준에 해당하는 회사의 임원",
  "full_text": "독점규제 및 공정거래에 관한 법률 일부개정법률안\n(이인영의원 대표발의)\n발의연월일 : 2024. 12. 5.\n의 안\n6237\n번 호 발 의 자 : 이인영ㆍ박상혁ㆍ김용만\n한정애ㆍ이정문ㆍ전진숙\n김영진ㆍ백승아ㆍ이연희\n장철민ㆍ김성회 의원\n(11인)\n제안이유 및 주요내용\n현행법은 공정거래위원회 위원에 대하여 정치운동의 금지만을 규정\n하고 겸직 금지에 대한 규정은 두고 있지 아니하여 위원의 이해 충돌\n이 발생할 수 있다는 지적이 제기되고 있음.\n이에 기업체의 임원 등에 대한 겸직 금지 규정을 신설하여 이해 충\n돌을 방지하고 공정거래위원회의 공정성과 신뢰성을 확보하고자 함(안\n제63조의2 신설).\n\n\n\n\n법률 제 호\n독점규제 및 공정거래에 관한 법률 일부개정법률안\n독점규제 및 공정거래에 관한 법률 일부를 다음과 같이 개정한다.\n제63조의2를 다음과 같이 신설한다.\n제63조의2(겸직 등의 금지) 위원은 재직 중 다음 각 호의 직(職)을 겸\n하거나 직무와 관련하여 영리를 목적으로 하는 사업을 할 수 없다.\n1. 국회의원 또는 지방의회의원\n2. 국가공무원 또는 지방공무원\n3. 자산총액 또는 매출액의 규모가 대통령령으로 정하는 기준에 해\n당하는 회사의 임원\n부 칙\n제1조(시행일) 이 법은 공포 후 6개월이 경과한 날부터 시행한다.\n제2조(겸직 등의 금지에 관한 경과조치) 이 법 시행 당시 종전의 규정\n에 따라 임명된 위원에 대하여는 그 임기만료일까지 제63조의2의\n개정규정에도 불구하고 종전의 규정에 따른다.\n\n\n\n\n신·구조문대비표\n현 행 개 정 안\n<신 설> 제63조의2(겸직 등의 금지) 위원\n은 재직 중 다음 각 호의 직\n(職)을 겸하거나 직무와 관련하\n여 영리를 목적으로 하는 사업\n을 할 수 없다.\n1. 국회의원 또는 지방의회의원\n2. 국가공무원 또는 지방공무원\n3. 자산총액 또는 매출액의 규\n모가 대통령령으로 정하는 기\n준에 해당하는 회사의 임원\n",
  "sections": {
    "제안이유": "및",
    "주요내용": "현행법은 공정거래위원회 위원에 대하여 정치운동의 금지만을 규정\n하고 겸직 금지에 대한 규정은 두고 있지 아니하여 위원의 이해 충돌\n이 발생할 수 있다는 지적이 제기되고 있음.\n이에 기업체의 임원 등에 대한 겸직 금지 규정을 신설하여 이해 충\n돌을 방지하고 공정거래위원회의 공정성과 신뢰성을 확보하고자 함(안\n제63조의2 신설).",
    "제안이유_및_주요내용": "현행법은 공정거래위원회 위원에 대하여 정치운동의 금지만을 규정\n하고 겸직 금지에 대한 규정은 두고 있지 아니하여 위원의 이해 충돌\n이 발생할 수 있다는 지적이 제기되고 있음.\n이에 기업체의 임원 등에 대한 겸직 금지 규정을 신설하여 이해 충\n돌을 방지하고 공정거래위원회의 공정성과 신뢰성을 확보하고자 함(안\n제63조의2 신설).",
    "법률_제_호": "독점규제 및 공정거래에 관한 법률 일부개정법률안\n독점규제 및 공정거래에 관한 법률 일부를 다음과 같이 개정한다.\n제63조의2를 다음과 같이 신설한다.\n제63조의2(겸직 등의 금지) 위원은 재직 중 다음 각 호의 직(職)을 겸\n하거나 직무와 관련하여 영리를 목적으로 하는 사업을 할 수 없다.\n1. 국회의원 또는 지방의회의원\n2. 국가공무원 또는 지방공무원\n3. 자산총액 또는 매출액의 규모가 대통령령으로 정하는 기준에 해\n당하는 회사의 임원",
    "신구조문대비표": "현 행 개 정 안\n<신 설> 제63조의2(겸직 등의 금지) 위원\n은 재직 중 다음 각 호의 직\n(職)을 겸하거나 직무와 관련하\n여 영리를 목적으로 하는 사업\n을 할 수 없다.\n1. 국회의원 또는 지방의회의원\n2. 국가공무원 또는 지방공무원\n3. 자산총액 또는 매출액의 규\n모가 대통령령으로 정하는 기\n준에 해당하는 회사의 임원"
  }
}