{
  "title": "2206279_계엄법_일부개정법률안",
  "bill_number": "6279",
  "proposal_date": "2024. 12. 6.",
  "submission_date": "",
  "is_alternative": false,
  "alternative_bill_numbers": [],
  "has_comparison_table": false,
  "comparison_table": "신ㆍ구조문대비표\n현 행 개 정 안\n제11조(계엄의 해제) ① ∼ ③ 제11조(계엄의 해제) ① ∼ ③\n(생 략) (현행과 같음)\n<신 설> ④ 대통령은 제1항에 따라 계\n엄을 해제한 경우 동일한 사유\n(포괄적인 취지가 동일한 경우\n를 포함한다)로 다시 계엄을\n선포할 수 없다.",
  "full_text": "계엄법 일부개정법률안\n(서삼석의원 대표발의)\n발의연월일 : 2024. 12. 6.\n의 안\n6279\n번 호 발 의 자 : 서삼석ㆍ조인철ㆍ소병훈\n전재수ㆍ문대림ㆍ이병진\n이원택ㆍ김동아ㆍ안도걸\n문금주ㆍ이개호ㆍ허 영\n강훈식ㆍ조계원ㆍ황명선\n서미화ㆍ임미애ㆍ박희승\n오세희ㆍ장종태ㆍ김영배\n신정훈ㆍ임호선ㆍ김교흥\n주철현ㆍ전종덕ㆍ서영교\n의원(27인)\n제안이유 및 주요내용\n현행법은 대통령이 전시ㆍ사변 또는 이에 준하는 국가비상사태 시\n군사상 필요나 공공의 안녕질서를 유지하기 위하여 계엄을 선포할 수\n있도록 하고 있음.\n그런데 계엄이 선포되면 국민의 기본권에 중대한 제한이 가해지는\n등 국민의 일상생활에 불편과 불안이 초래될 우려가 큼에도 불구하고\n현행법에는 계엄의 반복적 선포를 제한하는 규정이 없어 이를 보완할\n필요가 있다는 지적이 있음.\n\n\n\n이에 대통령이 계엄을 해제한 경우 다시 계엄을 선포할 수 없도록\n함으로써 계엄권의 남용을 방지하고 계엄 선포로 인한 국민 생활의\n불편을 줄이려는 것임(안 제11조제4항 신설).\n\n법률 제 호\n계엄법 일부개정법률안\n계엄법 일부를 다음과 같이 개정한다.\n제11조에 제4항을 다음과 같이 신설한다.\n④ 대통령은 제1항에 따라 계엄을 해제한 경우 동일한 사유(포괄적\n인 취지가 동일한 경우를 포함한다)로 다시 계엄을 선포할 수 없다.\n부 칙\n이 법은 공포 후 6개월이 경과한 날부터 시행한다.\n\n\n\n\n신ㆍ구조문대비표\n현 행 개 정 안\n제11조(계엄의 해제) ① ∼ ③ 제11조(계엄의 해제) ① ∼ ③\n(생 략) (현행과 같음)\n<신 설> ④ 대통령은 제1항에 따라 계\n엄을 해제한 경우 동일한 사유\n(포괄적인 취지가 동일한 경우\n를 포함한다)로 다시 계엄을\n선포할 수 없다.\n",
  "sections": {
    "제안이유": "및",
    "주요내용": "현행법은 대통령이 전시ㆍ사변 또는 이에 준하는 국가비상사태 시\n군사상 필요나 공공의 안녕질서를 유지하기 위하여 계엄을 선포할 수\n있도록 하고 있음.\n그런데 계엄이 선포되면 국민의 기본권에 중대한 제한이 가해지는\n등 국민의 일상생활에 불편과 불안이 초래될 우려가 큼에도 불구하고\n현행법에는 계엄의 반복적 선포를 제한하는 규정이 없어 이를 보완할\n필요가 있다는 지적이 있음.\n\n\n\n이에 대통령이 계엄을 해제한 경우 다시 계엄을 선포할 수 없도록\n함으로써 계엄권의 남용을 방지하고 계엄 선포로 인한 국민 생활의\n불편을 줄이려는 것임(안 제11조제4항 신설).",
    "제안이유_및_주요내용": "현행법은 대통령이 전시ㆍ사변 또는 이에 준하는 국가비상사태 시\n군사상 필요나 공공의 안녕질서를 유지하기 위하여 계엄을 선포할 수\n있도록 하고 있음.\n그런데 계엄이 선포되면 국민의 기본권에 중대한 제한이 가해지는\n등 국민의 일상생활에 불편과 불안이 초래될 우려가 큼에도 불구하고\n현행법에는 계엄의 반복적 선포를 제한하는 규정이 없어 이를 보완할\n필요가 있다는 지적이 있음.\n\n\n\n이에 대통령이 계엄을 해제한 경우 다시 계엄을 선포할 수 없도록\n함으로써 계엄권의 남용을 방지하고 계엄 선포로 인한 국민 생활의\n불편을 줄이려는 것임(안 제11조제4항 신설).",
    "법률_제_호": "계엄법 일부개정법률안\n계엄법 일부를 다음과 같이 개정한다.\n제11조에 제4항을 다음과 같이 신설한다.\n④ 대통령은 제1항에 따라 계엄을 해제한 경우 동일한 사유(포괄적\n인 취지가 동일한 경우를 포함한다)로 다시 계엄을 선포할 수 없다.",
    "신구조문대비표": "현 행 개 정 안\n제11조(계엄의 해제) ① ∼ ③ 제11조(계엄의 해제) ① ∼ ③\n(생 략) (현행과 같음)\n<신 설> ④ 대통령은 제1항에 따라 계\n엄을 해제한 경우 동일한 사유\n(포괄적인 취지가 동일한 경우\n를 포함한다)로 다시 계엄을\n선포할 수 없다."
  }
}