{
  "title": "2206021_경비업법_일부개정법률안",
  "bill_number": "6021",
  "proposal_date": "2024. 11. 28.",
  "submission_date": "",
  "is_alternative": false,
  "alternative_bill_numbers": [],
  "has_comparison_table": false,
  "comparison_table": "신ㆍ구조문대비표\n현 행 개 정 안\n제26조(손해배상 등) ①ㆍ② (생 제26조(손해배상 등) ①ㆍ② (현\n략) 행과 같음)\n<신 설> ③ 경비업자는 제1항 및 제2항\n에 따른 손해배상책임을 보장\n하기 위하여 보험이나 공제에\n가입하여야 한다.\n<신 설> ④ 제3항에 따른 공제의 기간\nㆍ종류ㆍ대상 및 방법 등에 필\n요한 사항은 대통령령으로 정\n한다.",
  "full_text": "경비업법 일부개정법률안\n(이개호의원 대표발의)\n발의연월일 : 2024. 11. 28.\n의 안\n6021\n번 호 발 의 자 : 이개호ㆍ백승아ㆍ위성곤\n정진욱ㆍ박수현ㆍ어기구\n김영배ㆍ이정문ㆍ문금주\n소병훈 의원(10인)\n제안이유 및 주요내용\n경비업무는 타인의 생명과 재산을 지키는 업무임에도 업무상 고의\n또는 과실 등으로 국민들이 신체적 피해를 당하거나 재산상의 피해를\n입는 상황이 발생하고 있음.\n뿐만 아니라 2025년 1월 31일부터 시행되는 혼잡교통유도경비 업무\n는 도로에 접한 각종 공사현장, 대형 행사장, 집회 현장 등 교통사고\n위험성이 높은 현장에 대해서는 전문경비원으로 하여금 업무를 수행\n하게 함으로써 교통사고를 예방하는 등 직무상 위험 직군에 속하는\n직종이 되었음.\n또한 전국에는 전국 경찰서에 배치되어 경비업법 적용을 받는 19만\n명과 경비업법 적용을 받지 못하는 45만 명의 경비원들이 연예인 신\n변 보호, 행사장 질서유지, 교통 유도 등 민간 경비 활동이 일반되고\n있어 이용자인 국민들이 보호받을 수 있도록 함으로써 ‘중대재해’를\n\n\n\n예방하고 배상의 사각지대를 최소화하기 위한 조치가 절실한 상황임.\n그러나 ‘외국인환자유치업’을 영위하고자 하는 경우에도 외국인을\n위하여 1억 원의 ‘인허가보증보험증권’을 제출하도록 하고 있고, 엔지\n니어링 산업배상책임공제(보험) 및 승강기 사고배상책임공제(보험), 전\n기공사업 등 안전분야에 해당하는 모든 업종이 손해배상 책임공제가\n입 및 보험가입을 의무화하고 있음에도 「경비업법」 제26조(손해배상\n등)에는 경비원이 제3자에게 손해를 끼쳤을 때만 손해를 배상하도록\n하고 있어 사업자가 배상을 게을리하거나 영세한 경우 충분한 보상이\n이루어지지 못하는 결과가 초래되고 있음.\n이에 국민의 생명과 안전, 그리고 재산상의 피해를 최소화하고 보호\n하기 위해 경비업자가 의무적으로 손해배상공제(보험)에 가입하도록\n근거 규정을 마련함으로써 이용자인 국민들이 신속한 피해구제를 받\n을 수 있도록 하려는 것임(안 제26조제3항 및 제4항 신설).\n\n법률 제 호\n경비업법 일부개정법률안\n경비업법 일부를 다음과 같이 개정한다.\n제26조에 제3항 및 제4항을 각각 다음과 같이 신설한다.\n③ 경비업자는 제1항 및 제2항에 따른 손해배상책임을 보장하기 위\n하여 보험이나 공제에 가입하여야 한다.\n④ 제3항에 따른 공제의 기간ㆍ종류ㆍ대상 및 방법 등에 필요한 사\n항은 대통령령으로 정한다.\n부 칙\n이 법은 공포 후 6개월이 경과한 날부터 시행한다.\n\n\n\n\n신ㆍ구조문대비표\n현 행 개 정 안\n제26조(손해배상 등) ①ㆍ② (생 제26조(손해배상 등) ①ㆍ② (현\n략) 행과 같음)\n<신 설> ③ 경비업자는 제1항 및 제2항\n에 따른 손해배상책임을 보장\n하기 위하여 보험이나 공제에\n가입하여야 한다.\n<신 설> ④ 제3항에 따른 공제의 기간\nㆍ종류ㆍ대상 및 방법 등에 필\n요한 사항은 대통령령으로 정\n한다.\n",
  "sections": {
    "제안이유": "및",
    "주요내용": "경비업무는 타인의 생명과 재산을 지키는 업무임에도 업무상 고의\n또는 과실 등으로 국민들이 신체적 피해를 당하거나 재산상의 피해를\n입는 상황이 발생하고 있음.\n뿐만 아니라 2025년 1월 31일부터 시행되는 혼잡교통유도경비 업무\n는 도로에 접한 각종 공사현장, 대형 행사장, 집회 현장 등 교통사고\n위험성이 높은 현장에 대해서는 전문경비원으로 하여금 업무를 수행\n하게 함으로써 교통사고를 예방하는 등 직무상 위험 직군에 속하는\n직종이 되었음.\n또한 전국에는 전국 경찰서에 배치되어 경비업법 적용을 받는 19만\n명과 경비업법 적용을 받지 못하는 45만 명의 경비원들이 연예인 신\n변 보호, 행사장 질서유지, 교통 유도 등 민간 경비 활동이 일반되고\n있어 이용자인 국민들이 보호받을 수 있도록 함으로써 ‘중대재해’를\n\n\n\n예방하고 배상의 사각지대를 최소화하기 위한 조치가 절실한 상황임.\n그러나 ‘외국인환자유치업’을 영위하고자 하는 경우에도 외국인을\n위하여 1억 원의 ‘인허가보증보험증권’을 제출하도록 하고 있고, 엔지\n니어링 산업배상책임공제(보험) 및 승강기 사고배상책임공제(보험), 전\n기공사업 등 안전분야에 해당하는 모든 업종이 손해배상 책임공제가\n입 및 보험가입을 의무화하고 있음에도 「경비업법」 제26조(손해배상\n등)에는 경비원이 제3자에게 손해를 끼쳤을 때만 손해를 배상하도록\n하고 있어 사업자가 배상을 게을리하거나 영세한 경우 충분한 보상이\n이루어지지 못하는 결과가 초래되고 있음.\n이에 국민의 생명과 안전, 그리고 재산상의 피해를 최소화하고 보호\n하기 위해 경비업자가 의무적으로 손해배상공제(보험)에 가입하도록\n근거 규정을 마련함으로써 이용자인 국민들이 신속한 피해구제를 받\n을 수 있도록 하려는 것임(안 제26조제3항 및 제4항 신설).",
    "제안이유_및_주요내용": "경비업무는 타인의 생명과 재산을 지키는 업무임에도 업무상 고의\n또는 과실 등으로 국민들이 신체적 피해를 당하거나 재산상의 피해를\n입는 상황이 발생하고 있음.\n뿐만 아니라 2025년 1월 31일부터 시행되는 혼잡교통유도경비 업무\n는 도로에 접한 각종 공사현장, 대형 행사장, 집회 현장 등 교통사고\n위험성이 높은 현장에 대해서는 전문경비원으로 하여금 업무를 수행\n하게 함으로써 교통사고를 예방하는 등 직무상 위험 직군에 속하는\n직종이 되었음.\n또한 전국에는 전국 경찰서에 배치되어 경비업법 적용을 받는 19만\n명과 경비업법 적용을 받지 못하는 45만 명의 경비원들이 연예인 신\n변 보호, 행사장 질서유지, 교통 유도 등 민간 경비 활동이 일반되고\n있어 이용자인 국민들이 보호받을 수 있도록 함으로써 ‘중대재해’를\n\n\n\n예방하고 배상의 사각지대를 최소화하기 위한 조치가 절실한 상황임.\n그러나 ‘외국인환자유치업’을 영위하고자 하는 경우에도 외국인을\n위하여 1억 원의 ‘인허가보증보험증권’을 제출하도록 하고 있고, 엔지\n니어링 산업배상책임공제(보험) 및 승강기 사고배상책임공제(보험), 전\n기공사업 등 안전분야에 해당하는 모든 업종이 손해배상 책임공제가\n입 및 보험가입을 의무화하고 있음에도 「경비업법」 제26조(손해배상\n등)에는 경비원이 제3자에게 손해를 끼쳤을 때만 손해를 배상하도록\n하고 있어 사업자가 배상을 게을리하거나 영세한 경우 충분한 보상이\n이루어지지 못하는 결과가 초래되고 있음.\n이에 국민의 생명과 안전, 그리고 재산상의 피해를 최소화하고 보호\n하기 위해 경비업자가 의무적으로 손해배상공제(보험)에 가입하도록\n근거 규정을 마련함으로써 이용자인 국민들이 신속한 피해구제를 받\n을 수 있도록 하려는 것임(안 제26조제3항 및 제4항 신설).",
    "법률_제_호": "경비업법 일부개정법률안\n경비업법 일부를 다음과 같이 개정한다.\n제26조에 제3항 및 제4항을 각각 다음과 같이 신설한다.\n③ 경비업자는 제1항 및 제2항에 따른 손해배상책임을 보장하기 위\n하여 보험이나 공제에 가입하여야 한다.\n④ 제3항에 따른 공제의 기간ㆍ종류ㆍ대상 및 방법 등에 필요한 사\n항은 대통령령으로 정한다.",
    "신구조문대비표": "현 행 개 정 안\n제26조(손해배상 등) ①ㆍ② (생 제26조(손해배상 등) ①ㆍ② (현\n략) 행과 같음)\n<신 설> ③ 경비업자는 제1항 및 제2항\n에 따른 손해배상책임을 보장\n하기 위하여 보험이나 공제에\n가입하여야 한다.\n<신 설> ④ 제3항에 따른 공제의 기간\nㆍ종류ㆍ대상 및 방법 등에 필\n요한 사항은 대통령령으로 정\n한다."
  }
}