{
  "title": "2206648_국회법_일부개정법률안",
  "bill_number": "6648",
  "proposal_date": "2024. 12. 18.",
  "submission_date": "",
  "is_alternative": false,
  "alternative_bill_numbers": [],
  "has_comparison_table": false,
  "comparison_table": "신·구조문대비표\n현 행 개 정 안\n제144조(경위와 경찰관) ① ∼ ③ 제144조(경위와 경찰관) ① ∼ ③\n(생 략) (현행과 같음)\n<신 설> ④ 경위는 항상 국회의장의 지\n휘를 받고, 경찰공무원은 전쟁,\n폭동, 계엄 등 위기상황 발생시\n국회의장의 지휘를 받는다.",
  "full_text": "국회법 일부개정법률안\n(서영교의원 대표발의)\n발의연월일 : 2024. 12. 18.\n의 안\n6648\n번 호 발 의 자 : 서영교ㆍ복기왕ㆍ김남근\n차지호ㆍ정태호ㆍ한민수\n용혜인ㆍ박해철ㆍ김교흥\n이해식ㆍ한정애 의원\n(11인)\n제안이유 및 주요내용\n최근 불법적인 계엄령 시행 후 국회의원 및 보좌진의 국회 경내 출\n입이 경찰에 의해 제지되어 문제가 되었음. 국회의원을 보호하고 국회\n의 기능을 지켜야 할 경찰이 오히려 그 기능을 마비시키고 국회의원\n을 체포하고 억압하려고 하는 것은 민주 국가에서 도저히 납득하기\n어려운 상황임.\n이에 국회의장이 국회 내 경호 인력 및 국회 밖 경찰 인력의 지휘\n권을 갖고 독립적으로 행사하게 하여 국회가 위기상황에서도 제대로\n기능할 수 있도록 하고자 함(안 제144조제4항).\n\n\n\n\n법률 제 호\n국회법 일부개정법률안\n국회법 일부를 다음과 같이 개정한다.\n제144조에 제4항을 다음과 같이 신설한다.\n④ 경위는 항상 국회의장의 지휘를 받고, 경찰공무원은 전쟁, 폭동,\n계엄 등 위기상황 발생 시 국회의장의 지휘를 받는다.\n부 칙\n이 법은 공포 후 6개월이 경과한 날부터 시행한다.\n\n\n\n\n신·구조문대비표\n현 행 개 정 안\n제144조(경위와 경찰관) ① ∼ ③ 제144조(경위와 경찰관) ① ∼ ③\n(생 략) (현행과 같음)\n<신 설> ④ 경위는 항상 국회의장의 지\n휘를 받고, 경찰공무원은 전쟁,\n폭동, 계엄 등 위기상황 발생시\n국회의장의 지휘를 받는다.\n",
  "sections": {
    "제안이유": "및",
    "주요내용": "최근 불법적인 계엄령 시행 후 국회의원 및 보좌진의 국회 경내 출\n입이 경찰에 의해 제지되어 문제가 되었음. 국회의원을 보호하고 국회\n의 기능을 지켜야 할 경찰이 오히려 그 기능을 마비시키고 국회의원\n을 체포하고 억압하려고 하는 것은 민주 국가에서 도저히 납득하기\n어려운 상황임.\n이에 국회의장이 국회 내 경호 인력 및 국회 밖 경찰 인력의 지휘\n권을 갖고 독립적으로 행사하게 하여 국회가 위기상황에서도 제대로\n기능할 수 있도록 하고자 함(안 제144조제4항).",
    "제안이유_및_주요내용": "최근 불법적인 계엄령 시행 후 국회의원 및 보좌진의 국회 경내 출\n입이 경찰에 의해 제지되어 문제가 되었음. 국회의원을 보호하고 국회\n의 기능을 지켜야 할 경찰이 오히려 그 기능을 마비시키고 국회의원\n을 체포하고 억압하려고 하는 것은 민주 국가에서 도저히 납득하기\n어려운 상황임.\n이에 국회의장이 국회 내 경호 인력 및 국회 밖 경찰 인력의 지휘\n권을 갖고 독립적으로 행사하게 하여 국회가 위기상황에서도 제대로\n기능할 수 있도록 하고자 함(안 제144조제4항).",
    "법률_제_호": "국회법 일부개정법률안\n국회법 일부를 다음과 같이 개정한다.\n제144조에 제4항을 다음과 같이 신설한다.\n④ 경위는 항상 국회의장의 지휘를 받고, 경찰공무원은 전쟁, 폭동,\n계엄 등 위기상황 발생 시 국회의장의 지휘를 받는다.",
    "신구조문대비표": "현 행 개 정 안\n제144조(경위와 경찰관) ① ∼ ③ 제144조(경위와 경찰관) ① ∼ ③\n(생 략) (현행과 같음)\n<신 설> ④ 경위는 항상 국회의장의 지\n휘를 받고, 경찰공무원은 전쟁,\n폭동, 계엄 등 위기상황 발생시\n국회의장의 지휘를 받는다."
  }
}