{
  "title": "2206796_방송통신위원회의_설치_및_운영에_관한_법률_일부개정법률안",
  "bill_number": "6796",
  "proposal_date": "2024. 12. 20.",
  "submission_date": "",
  "is_alternative": false,
  "alternative_bill_numbers": [],
  "has_comparison_table": false,
  "comparison_table": "신ㆍ구조문대비표\n현 행 개 정 안\n제13조(회의) ① (생 략) 제13조(회의) ① (현행과 같음)\n② 위원회의 회의는 재적위원 ② ----------------4인 이상\n과반수의 찬성으로 의결한다. 의 위원의 출석으로 개의하고,\n출석위원--------------------.\n③ ∼ ⑦ (생 략) ③ ∼ ⑦ (현행과 같음)",
  "full_text": "방송통신위원회의 설치 및 운영에 관한 법률\n일부개정법률안\n(황정아의원 대표발의)\n발의연월일 : 2024. 12. 20.\n의 안\n6796\n번 호 발 의 자 : 황정아ㆍ조인철ㆍ정동영\n박민규ㆍ이훈기ㆍ김우영\n최민희ㆍ노종면ㆍ이정헌\n한민수 의원(10인)\n제안이유 및 주요내용\n현행법에 따르면 방송통신위원회의 회의는 2인 이상의 위원의 요구\n가 있는 때 위원장이 소집하거나, 위원장이 단독으로 소집할 수 있도\n록 하고 있으며, 재적위원 과반수의 찬성으로 의결하도록 규정하고 있\n음.\n그러나 회의 개의에 필요한 최소한의 출석인원 수를 정하고 있지\n않고 대통령이 지명한 2인의 출석만으로도 의결이 가능하다보니, 방송\n통신위원회가 재적위원을 현 재적으로 해석하여 방송문화진흥회 이사\n해임 등의 중대 안건들을 위법적으로 의결하고 있다는 지적이 제기됨.\n이에 방송통신위원회의 의사정족수를 4인 이상의 위원의 출석으로\n하고, 출석위원 과반수의 찬성으로 의결하도록 하여 방송통신위원회의\n중립성과 의결의 정당성을 강화하고자 함(안 제13조제2항).\n\n\n\n\n법률 제 호\n방송통신위원회의 설치 및 운영에 관한 법률\n일부개정법률안\n방송통신위원회의 설치 및 운영에 관한 법률 일부를 다음과 같이 개\n정한다.\n제13조제2항 중 “재적위원”을 “4인 이상의 위원의 출석으로 개의하고,\n출석위원”으로 한다.\n부 칙\n이 법은 공포한 날부터 시행한다.\n\n\n\n\n신ㆍ구조문대비표\n현 행 개 정 안\n제13조(회의) ① (생 략) 제13조(회의) ① (현행과 같음)\n② 위원회의 회의는 재적위원 ② ----------------4인 이상\n과반수의 찬성으로 의결한다. 의 위원의 출석으로 개의하고,\n출석위원--------------------.\n③ ∼ ⑦ (생 략) ③ ∼ ⑦ (현행과 같음)\n",
  "sections": {
    "제안이유": "및",
    "주요내용": "현행법에 따르면 방송통신위원회의 회의는 2인 이상의 위원의 요구\n가 있는 때 위원장이 소집하거나, 위원장이 단독으로 소집할 수 있도\n록 하고 있으며, 재적위원 과반수의 찬성으로 의결하도록 규정하고 있\n음.\n그러나 회의 개의에 필요한 최소한의 출석인원 수를 정하고 있지\n않고 대통령이 지명한 2인의 출석만으로도 의결이 가능하다보니, 방송\n통신위원회가 재적위원을 현 재적으로 해석하여 방송문화진흥회 이사\n해임 등의 중대 안건들을 위법적으로 의결하고 있다는 지적이 제기됨.\n이에 방송통신위원회의 의사정족수를 4인 이상의 위원의 출석으로\n하고, 출석위원 과반수의 찬성으로 의결하도록 하여 방송통신위원회의\n중립성과 의결의 정당성을 강화하고자 함(안 제13조제2항).",
    "제안이유_및_주요내용": "현행법에 따르면 방송통신위원회의 회의는 2인 이상의 위원의 요구\n가 있는 때 위원장이 소집하거나, 위원장이 단독으로 소집할 수 있도\n록 하고 있으며, 재적위원 과반수의 찬성으로 의결하도록 규정하고 있\n음.\n그러나 회의 개의에 필요한 최소한의 출석인원 수를 정하고 있지\n않고 대통령이 지명한 2인의 출석만으로도 의결이 가능하다보니, 방송\n통신위원회가 재적위원을 현 재적으로 해석하여 방송문화진흥회 이사\n해임 등의 중대 안건들을 위법적으로 의결하고 있다는 지적이 제기됨.\n이에 방송통신위원회의 의사정족수를 4인 이상의 위원의 출석으로\n하고, 출석위원 과반수의 찬성으로 의결하도록 하여 방송통신위원회의\n중립성과 의결의 정당성을 강화하고자 함(안 제13조제2항).",
    "법률_제_호": "방송통신위원회의 설치 및 운영에 관한 법률\n일부개정법률안\n방송통신위원회의 설치 및 운영에 관한 법률 일부를 다음과 같이 개\n정한다.\n제13조제2항 중 “재적위원”을 “4인 이상의 위원의 출석으로 개의하고,\n출석위원”으로 한다.",
    "신구조문대비표": "현 행 개 정 안\n제13조(회의) ① (생 략) 제13조(회의) ① (현행과 같음)\n② 위원회의 회의는 재적위원 ② ----------------4인 이상\n과반수의 찬성으로 의결한다. 의 위원의 출석으로 개의하고,\n출석위원--------------------.\n③ ∼ ⑦ (생 략) ③ ∼ ⑦ (현행과 같음)"
  }
}