{
  "title": "2206297_선거관리위원회법_일부개정법률안",
  "bill_number": "6297",
  "proposal_date": "2024. 12. 9.",
  "submission_date": "",
  "is_alternative": false,
  "alternative_bill_numbers": [],
  "has_comparison_table": false,
  "comparison_table": "신·구조문대비표\n현 행 개 정 안\n<신 설> 제15조의4(선거관리위원회경비대)\n선거관리위원회청사 방호와 경\n비업무를 위하여 중앙선거관리\n위원회와 각급 선거관리위원회\n에 선거관리위원회경비대를 두\n며, 그 설치와 조직 및 분장사\n무에 관한 사항은 중앙선거관\n리위원회규칙으로 정한다.",
  "full_text": "선거관리위원회법 일부개정법률안\n(한병도의원 대표발의)\n발의연월일 : 2024. 12. 9.\n의 안\n6297\n번 호 발 의 자 : 한병도ㆍ박해철ㆍ이해식\n장철민ㆍ신영대ㆍ정일영\n윤준병ㆍ김영배ㆍ정태호\n양부남 의원(10인)\n제안이유 및 주요내용\n중앙선거관리위원회는 선거와 국민투표의 공정한 관리 및 정당에\n관한 사무를 처리하기 위하여 설치된 헌법기관이며, 선거관리위원회의\n공정하고 중립적인 업무 수행은 민주주의 핵심 요소임.\n그런데, 2024년 12월 3일 비상계엄 선포 직후 약 300명의 계엄군이\n중앙선거관리위원회 과천청사를 점거하여 직원의 출입을 통제하는 등\n위헌ㆍ불법 행위를 자행함.\n중앙 및 각급 선거관리위원회에는 헌법기관으로써 기초적인 청사\n방호 및 경비를 위한 제도적 근거가 없어 외부 침입 시 위원ㆍ직원\n보호와 자료 보안에 취약하다는 사실이 확인됨.\n이에, 중앙선거관리위원회와 각급 선거관리위원회에 선거관리위원회\n경비대를 설치함으로써 헌법상 규정된 공정한 선거 관리를 공고히 하\n려는 것임(안 제15조의4 신설).\n\n\n\n\n법률 제 호\n선거관리위원회법 일부개정법률안\n선거관리위원회법 일부를 다음과 같이 개정한다.\n제15조의4를 다음과 같이 신설한다.\n제15조의4(선거관리위원회경비대) 선거관리위원회청사 방호와 경비업\n무를 위하여 중앙선거관리위원회와 각급 선거관리위원회에 선거관\n리위원회경비대를 두며, 그 설치와 조직 및 분장사무에 관한 사항은\n중앙선거관리위원회규칙으로 정한다.\n부 칙\n이 법은 공포 후 6개월이 경과한 날부터 시행한다.\n\n\n\n\n신·구조문대비표\n현 행 개 정 안\n<신 설> 제15조의4(선거관리위원회경비대)\n선거관리위원회청사 방호와 경\n비업무를 위하여 중앙선거관리\n위원회와 각급 선거관리위원회\n에 선거관리위원회경비대를 두\n며, 그 설치와 조직 및 분장사\n무에 관한 사항은 중앙선거관\n리위원회규칙으로 정한다.\n",
  "sections": {
    "제안이유": "및",
    "주요내용": "중앙선거관리위원회는 선거와 국민투표의 공정한 관리 및 정당에\n관한 사무를 처리하기 위하여 설치된 헌법기관이며, 선거관리위원회의\n공정하고 중립적인 업무 수행은 민주주의 핵심 요소임.\n그런데, 2024년 12월 3일 비상계엄 선포 직후 약 300명의 계엄군이\n중앙선거관리위원회 과천청사를 점거하여 직원의 출입을 통제하는 등\n위헌ㆍ불법 행위를 자행함.\n중앙 및 각급 선거관리위원회에는 헌법기관으로써 기초적인 청사\n방호 및 경비를 위한 제도적 근거가 없어 외부 침입 시 위원ㆍ직원\n보호와 자료 보안에 취약하다는 사실이 확인됨.\n이에, 중앙선거관리위원회와 각급 선거관리위원회에 선거관리위원회\n경비대를 설치함으로써 헌법상 규정된 공정한 선거 관리를 공고히 하\n려는 것임(안 제15조의4 신설).",
    "제안이유_및_주요내용": "중앙선거관리위원회는 선거와 국민투표의 공정한 관리 및 정당에\n관한 사무를 처리하기 위하여 설치된 헌법기관이며, 선거관리위원회의\n공정하고 중립적인 업무 수행은 민주주의 핵심 요소임.\n그런데, 2024년 12월 3일 비상계엄 선포 직후 약 300명의 계엄군이\n중앙선거관리위원회 과천청사를 점거하여 직원의 출입을 통제하는 등\n위헌ㆍ불법 행위를 자행함.\n중앙 및 각급 선거관리위원회에는 헌법기관으로써 기초적인 청사\n방호 및 경비를 위한 제도적 근거가 없어 외부 침입 시 위원ㆍ직원\n보호와 자료 보안에 취약하다는 사실이 확인됨.\n이에, 중앙선거관리위원회와 각급 선거관리위원회에 선거관리위원회\n경비대를 설치함으로써 헌법상 규정된 공정한 선거 관리를 공고히 하\n려는 것임(안 제15조의4 신설).",
    "법률_제_호": "선거관리위원회법 일부개정법률안\n선거관리위원회법 일부를 다음과 같이 개정한다.\n제15조의4를 다음과 같이 신설한다.\n제15조의4(선거관리위원회경비대) 선거관리위원회청사 방호와 경비업\n무를 위하여 중앙선거관리위원회와 각급 선거관리위원회에 선거관\n리위원회경비대를 두며, 그 설치와 조직 및 분장사무에 관한 사항은\n중앙선거관리위원회규칙으로 정한다.",
    "신구조문대비표": "현 행 개 정 안\n<신 설> 제15조의4(선거관리위원회경비대)\n선거관리위원회청사 방호와 경\n비업무를 위하여 중앙선거관리\n위원회와 각급 선거관리위원회\n에 선거관리위원회경비대를 두\n며, 그 설치와 조직 및 분장사\n무에 관한 사항은 중앙선거관\n리위원회규칙으로 정한다."
  }
}