{
  "title": "2206375_계엄법_일부개정법률안",
  "bill_number": "6375",
  "proposal_date": "2024. 12. 10.",
  "submission_date": "",
  "is_alternative": false,
  "alternative_bill_numbers": [],
  "has_comparison_table": false,
  "comparison_table": "신ㆍ구조문대비표\n현 행 개 정 안\n<신 설> 제2조의2(국회의 권한 및 기능의\n제한 금지) 계엄 시에도 국회\n의 기능과 국회의원의 활동을\n방해할 수 없으며, 계엄사령관\n은 국회 기능을 수호하고 국회\n의원의 활동을 보호하여야 한\n다.",
  "full_text": "계엄법 일부개정법률안\n(백혜련의원 대표발의)\n발의연월일 : 2024. 12. 10.\n의 안\n6375\n번 호 발 의 자 : 백혜련ㆍ이병진ㆍ이수진\n문진석ㆍ이건태ㆍ서영석\n이재정ㆍ이용우ㆍ김준혁\n김기표 의원(10인)\n제안이유 및 주요내용\n「대한민국 헌법」제77조제3항에서 대통령이 비상계엄을 선포하였\n을 때에는 정부나 법원의 권한에만 관하여 특별한 조치를 할 수 있고,\n국회 권한에 관하여서는 조치 할 수 없음. 그러나 현행 「계엄법」에\n는 계엄 시 국회의 기능과 국회의원 활동을 방해 할 수 없다는 내용\n이 부재하고, 계엄사령관이 국회 기능 및 국회의원 활동을 방해하여\n계엄 해제 방해 등의 우려가 있음. 실제로 2024년 12월 3일 비상계엄\n선포 이후 계엄사령관 등은 계엄 해제 권한을 갖고 있는 국회를 봉쇄\n하고 국회의원 출입을 막는 등 계엄 해제를 방해하였음.\n이에 계엄 시에도 국회 활동은 방해할 수 없음을 규정하고, 계엄사\n령관은 국회 활동과 국회의원을 보호한다고 규정하여 헌법에서 보장\n하고 있는 국회의원의 정치활동을 보장하고자 함(안 제2조의2 신설).\n\n\n\n\n법률 제 호\n계엄법 일부개정법률안\n계엄법 일부를 다음과 같이 개정한다.\n제2조의2를 다음과 같이 신설한다.\n제2조의2(국회의 권한 및 기능의 제한 금지) 계엄 시에도 국회의 기능\n과 국회의원의 활동을 방해할 수 없으며, 계엄사령관은 국회 기능을\n수호하고 국회의원의 활동을 보호하여야 한다.\n부 칙\n이 법은 공포한 날부터 시행한다.\n\n\n\n\n신ㆍ구조문대비표\n현 행 개 정 안\n<신 설> 제2조의2(국회의 권한 및 기능의\n제한 금지) 계엄 시에도 국회\n의 기능과 국회의원의 활동을\n방해할 수 없으며, 계엄사령관\n은 국회 기능을 수호하고 국회\n의원의 활동을 보호하여야 한\n다.\n",
  "sections": {
    "제안이유": "및",
    "주요내용": "「대한민국 헌법」제77조제3항에서 대통령이 비상계엄을 선포하였\n을 때에는 정부나 법원의 권한에만 관하여 특별한 조치를 할 수 있고,\n국회 권한에 관하여서는 조치 할 수 없음. 그러나 현행 「계엄법」에\n는 계엄 시 국회의 기능과 국회의원 활동을 방해 할 수 없다는 내용\n이 부재하고, 계엄사령관이 국회 기능 및 국회의원 활동을 방해하여\n계엄 해제 방해 등의 우려가 있음. 실제로 2024년 12월 3일 비상계엄\n선포 이후 계엄사령관 등은 계엄 해제 권한을 갖고 있는 국회를 봉쇄\n하고 국회의원 출입을 막는 등 계엄 해제를 방해하였음.\n이에 계엄 시에도 국회 활동은 방해할 수 없음을 규정하고, 계엄사\n령관은 국회 활동과 국회의원을 보호한다고 규정하여 헌법에서 보장\n하고 있는 국회의원의 정치활동을 보장하고자 함(안 제2조의2 신설).",
    "제안이유_및_주요내용": "「대한민국 헌법」제77조제3항에서 대통령이 비상계엄을 선포하였\n을 때에는 정부나 법원의 권한에만 관하여 특별한 조치를 할 수 있고,\n국회 권한에 관하여서는 조치 할 수 없음. 그러나 현행 「계엄법」에\n는 계엄 시 국회의 기능과 국회의원 활동을 방해 할 수 없다는 내용\n이 부재하고, 계엄사령관이 국회 기능 및 국회의원 활동을 방해하여\n계엄 해제 방해 등의 우려가 있음. 실제로 2024년 12월 3일 비상계엄\n선포 이후 계엄사령관 등은 계엄 해제 권한을 갖고 있는 국회를 봉쇄\n하고 국회의원 출입을 막는 등 계엄 해제를 방해하였음.\n이에 계엄 시에도 국회 활동은 방해할 수 없음을 규정하고, 계엄사\n령관은 국회 활동과 국회의원을 보호한다고 규정하여 헌법에서 보장\n하고 있는 국회의원의 정치활동을 보장하고자 함(안 제2조의2 신설).",
    "법률_제_호": "계엄법 일부개정법률안\n계엄법 일부를 다음과 같이 개정한다.\n제2조의2를 다음과 같이 신설한다.\n제2조의2(국회의 권한 및 기능의 제한 금지) 계엄 시에도 국회의 기능\n과 국회의원의 활동을 방해할 수 없으며, 계엄사령관은 국회 기능을\n수호하고 국회의원의 활동을 보호하여야 한다.",
    "신구조문대비표": "현 행 개 정 안\n<신 설> 제2조의2(국회의 권한 및 기능의\n제한 금지) 계엄 시에도 국회\n의 기능과 국회의원의 활동을\n방해할 수 없으며, 계엄사령관\n은 국회 기능을 수호하고 국회\n의원의 활동을 보호하여야 한\n다."
  }
}