{
  "title": "2206677_이자제한법_일부개정법률안",
  "bill_number": "6677",
  "proposal_date": "2024. 12. 18.",
  "submission_date": "",
  "is_alternative": false,
  "alternative_bill_numbers": [],
  "has_comparison_table": false,
  "comparison_table": "신ㆍ구조문대비표\n현 행 개 정 안\n제2조(이자의 최고한도) ① ∼ ④ 제2조(이자의 최고한도) ① ∼ ④\n(생 략) (현행과 같음)\n⑤ 대차원금이 10만원 미만인 <삭 제>\n대차의 이자에 관하여는 제1항\n을 적용하지 아니한다.",
  "full_text": "이자제한법 일부개정법률안\n(김정재의원 대표발의)\n발의연월일 : 2024. 12. 18.\n의 안\n6677\n번 호 발 의 자 : 김정재ㆍ김성원ㆍ박덕흠\n윤한홍ㆍ고동진ㆍ김승수\n정점식ㆍ김소희ㆍ이인선\n이만희 의원(10인)\n제안이유 및 주요내용\n현행법은 금전대차계약에 있어서 최고이율을 연 25%을 초과하지\n아니하는 범위에서 대통령령으로 정하도록 규정하고 있음. 이는 금전\n대차계약에서 약자의 지위를 지니는 채무자를 보호하고 사회상규상\n지나치게 높은 이율을 규제하려는 목적을 가진 조항임.\n그런데 대차원금이 10만원 미만인 대차계약에 대하여는 최고이율의\n적용을 배제하고 있는바, SNS를 이용하여 청소년 사이에서 10만원 이\n하의 소액을 대출하여 주고 수천 %의 고금리를 요구하는 등 각종 피\n해사례가 발생하고 있음.\n이에 해당 조항을 삭제하여 모든 금전대차계약에 최고이율의 제한\n규정이 적용되도록 함으로써 현행법의 제정 목적과 같이 국민경제생\n활의 안정과 경제정의를 구현하려는 취지임(안 제2조제5항 삭제).\n\n\n\n\n법률 제 호\n이자제한법 일부개정법률안\n이자제한법 일부를 다음과 같이 개정한다.\n제2조제5항을 삭제한다.\n부 칙\n제1조(시행일) 이 법은 공포 후 6개월이 경과한 날부터 시행한다.\n제2조(이자의 최고한도에 관한 적용례) 제2조의 개정규정은 이 법 시\n행 이후 체결된 금전대차계약부터 적용한다.\n\n\n\n\n신ㆍ구조문대비표\n현 행 개 정 안\n제2조(이자의 최고한도) ① ∼ ④ 제2조(이자의 최고한도) ① ∼ ④\n(생 략) (현행과 같음)\n⑤ 대차원금이 10만원 미만인 <삭 제>\n대차의 이자에 관하여는 제1항\n을 적용하지 아니한다.\n",
  "sections": {
    "제안이유": "및",
    "주요내용": "현행법은 금전대차계약에 있어서 최고이율을 연 25%을 초과하지\n아니하는 범위에서 대통령령으로 정하도록 규정하고 있음. 이는 금전\n대차계약에서 약자의 지위를 지니는 채무자를 보호하고 사회상규상\n지나치게 높은 이율을 규제하려는 목적을 가진 조항임.\n그런데 대차원금이 10만원 미만인 대차계약에 대하여는 최고이율의\n적용을 배제하고 있는바, SNS를 이용하여 청소년 사이에서 10만원 이\n하의 소액을 대출하여 주고 수천 %의 고금리를 요구하는 등 각종 피\n해사례가 발생하고 있음.\n이에 해당 조항을 삭제하여 모든 금전대차계약에 최고이율의 제한\n규정이 적용되도록 함으로써 현행법의 제정 목적과 같이 국민경제생\n활의 안정과 경제정의를 구현하려는 취지임(안 제2조제5항 삭제).",
    "제안이유_및_주요내용": "현행법은 금전대차계약에 있어서 최고이율을 연 25%을 초과하지\n아니하는 범위에서 대통령령으로 정하도록 규정하고 있음. 이는 금전\n대차계약에서 약자의 지위를 지니는 채무자를 보호하고 사회상규상\n지나치게 높은 이율을 규제하려는 목적을 가진 조항임.\n그런데 대차원금이 10만원 미만인 대차계약에 대하여는 최고이율의\n적용을 배제하고 있는바, SNS를 이용하여 청소년 사이에서 10만원 이\n하의 소액을 대출하여 주고 수천 %의 고금리를 요구하는 등 각종 피\n해사례가 발생하고 있음.\n이에 해당 조항을 삭제하여 모든 금전대차계약에 최고이율의 제한\n규정이 적용되도록 함으로써 현행법의 제정 목적과 같이 국민경제생\n활의 안정과 경제정의를 구현하려는 취지임(안 제2조제5항 삭제).",
    "법률_제_호": "이자제한법 일부개정법률안\n이자제한법 일부를 다음과 같이 개정한다.\n제2조제5항을 삭제한다.",
    "신구조문대비표": "현 행 개 정 안\n제2조(이자의 최고한도) ① ∼ ④ 제2조(이자의 최고한도) ① ∼ ④\n(생 략) (현행과 같음)\n⑤ 대차원금이 10만원 미만인 <삭 제>\n대차의 이자에 관하여는 제1항\n을 적용하지 아니한다."
  }
}