{
  "title": "2206898_기초학력_보장법_일부개정법률안",
  "bill_number": "6898",
  "proposal_date": "2024. 12. 24.",
  "submission_date": "",
  "is_alternative": false,
  "alternative_bill_numbers": [],
  "has_comparison_table": false,
  "comparison_table": "신ㆍ구조문대비표\n현 행 개 정 안\n제7조(기초학력진단검사) ① (생 제7조(기초학력진단검사) ① (현\n략) 행과 같음)\n<신 설> ② 교육부장관ㆍ교육감 및 학\n교의 장은 기초학력진단검사의\n결과를 외부에 공개(제1항에\n따른 학생의 보호자에 대한 통\n지는 제외한다)하여서는 아니\n된다.\n② (생 략) ③ (현행 제2항과 같음)",
  "full_text": "기초학력 보장법 일부개정법률안\n(고민정의원 대표발의)\n발의연월일 : 2024. 12. 24.\n의 안\n6898\n번 호 발 의 자 : 고민정ㆍ박정현ㆍ이훈기\n추미애ㆍ조인철ㆍ김동아\n문정복ㆍ김준혁ㆍ장철민\n김태년 의원(10인)\n제안이유 및 주요내용\n현행법은 학교의 장이 학습지원대상학생을 조기에 발견하고 효과적\n으로 지원하기 위하여 기초학력진단검사를 실시할 수 있도록 하고, 그\n결과를 학생의 보호자에게 통지할 수 있도록 하고 있음.\n그런데 2023년 서울시의회에서 기초학력진단검사 결과를 외부에 공\n개할 수 있도록 하는 내용의 ‘서울특별시교육청 기초학력 보장 지원에\n관한 조례’를 공포하였는데, 기초학력진단검사 결과의 외부 공개로 인\n한 학교 서열화 등의 부작용이 우려되고 있는 상황임.\n이에 교육부장관ㆍ교육감 및 학교의 장이 기초학력진단검사 결과를\n외부에 공개할 수 없도록 법률에 명시하여 학교별 과도한 경쟁 및 서\n열화 등 기초학력진단검사 결과 공개에 따른 부작용을 방지하려는 것\n임(안 제7조제2항 신설).\n\n\n\n\n법률 제 호\n기초학력 보장법 일부개정법률안\n기초학력 보장법 일부를 다음과 같이 개정한다.\n제7조제2항을 제3항으로 하고, 같은 조에 제2항을 다음과 같이 신설한\n다.\n② 교육부장관ㆍ교육감 및 학교의 장은 기초학력진단검사의 결과를\n외부에 공개(제1항에 따른 학생의 보호자에 대한 통지는 제외한다)\n하여서는 아니 된다.\n부 칙\n이 법은 공포 후 6개월이 경과한 날부터 시행한다.\n\n\n\n\n신ㆍ구조문대비표\n현 행 개 정 안\n제7조(기초학력진단검사) ① (생 제7조(기초학력진단검사) ① (현\n략) 행과 같음)\n<신 설> ② 교육부장관ㆍ교육감 및 학\n교의 장은 기초학력진단검사의\n결과를 외부에 공개(제1항에\n따른 학생의 보호자에 대한 통\n지는 제외한다)하여서는 아니\n된다.\n② (생 략) ③ (현행 제2항과 같음)\n",
  "sections": {
    "제안이유": "및",
    "주요내용": "현행법은 학교의 장이 학습지원대상학생을 조기에 발견하고 효과적\n으로 지원하기 위하여 기초학력진단검사를 실시할 수 있도록 하고, 그\n결과를 학생의 보호자에게 통지할 수 있도록 하고 있음.\n그런데 2023년 서울시의회에서 기초학력진단검사 결과를 외부에 공\n개할 수 있도록 하는 내용의 ‘서울특별시교육청 기초학력 보장 지원에\n관한 조례’를 공포하였는데, 기초학력진단검사 결과의 외부 공개로 인\n한 학교 서열화 등의 부작용이 우려되고 있는 상황임.\n이에 교육부장관ㆍ교육감 및 학교의 장이 기초학력진단검사 결과를\n외부에 공개할 수 없도록 법률에 명시하여 학교별 과도한 경쟁 및 서\n열화 등 기초학력진단검사 결과 공개에 따른 부작용을 방지하려는 것\n임(안 제7조제2항 신설).",
    "제안이유_및_주요내용": "현행법은 학교의 장이 학습지원대상학생을 조기에 발견하고 효과적\n으로 지원하기 위하여 기초학력진단검사를 실시할 수 있도록 하고, 그\n결과를 학생의 보호자에게 통지할 수 있도록 하고 있음.\n그런데 2023년 서울시의회에서 기초학력진단검사 결과를 외부에 공\n개할 수 있도록 하는 내용의 ‘서울특별시교육청 기초학력 보장 지원에\n관한 조례’를 공포하였는데, 기초학력진단검사 결과의 외부 공개로 인\n한 학교 서열화 등의 부작용이 우려되고 있는 상황임.\n이에 교육부장관ㆍ교육감 및 학교의 장이 기초학력진단검사 결과를\n외부에 공개할 수 없도록 법률에 명시하여 학교별 과도한 경쟁 및 서\n열화 등 기초학력진단검사 결과 공개에 따른 부작용을 방지하려는 것\n임(안 제7조제2항 신설).",
    "법률_제_호": "기초학력 보장법 일부개정법률안\n기초학력 보장법 일부를 다음과 같이 개정한다.\n제7조제2항을 제3항으로 하고, 같은 조에 제2항을 다음과 같이 신설한\n다.\n② 교육부장관ㆍ교육감 및 학교의 장은 기초학력진단검사의 결과를\n외부에 공개(제1항에 따른 학생의 보호자에 대한 통지는 제외한다)\n하여서는 아니 된다.",
    "신구조문대비표": "현 행 개 정 안\n제7조(기초학력진단검사) ① (생 제7조(기초학력진단검사) ① (현\n략) 행과 같음)\n<신 설> ② 교육부장관ㆍ교육감 및 학\n교의 장은 기초학력진단검사의\n결과를 외부에 공개(제1항에\n따른 학생의 보호자에 대한 통\n지는 제외한다)하여서는 아니\n된다.\n② (생 략) ③ (현행 제2항과 같음)"
  }
}