{
  "title": "2206572_사면법_일부개정법률안",
  "bill_number": "6572",
  "proposal_date": "2024. 12. 17.",
  "submission_date": "",
  "is_alternative": false,
  "alternative_bill_numbers": [],
  "has_comparison_table": false,
  "comparison_table": "신ㆍ구조문대비표\n현 행 개 정 안\n제6조(복권의 제한) <신 설> 제6조(복권의 제한) ① 특별사면,\n감형, 복권은 「형법」 제87조\n제1호ㆍ제2호 및 제88조의 죄의\n경우에는 하지 아니한다.\n(생 략) ② (현행 제목 외의 부분과 같\n음)",
  "full_text": "사면법 일부개정법률안\n(이연희의원 대표발의)\n발의연월일 : 2024. 12. 17.\n의 안\n6572\n번 호 발 의 자 : 이연희ㆍ이광희ㆍ허종식\n박상혁ㆍ복기왕ㆍ홍기원\n서미화ㆍ한민수ㆍ정준호\n정성호ㆍ문진석ㆍ한준호\n박홍배ㆍ이정문ㆍ김남희\n김정호ㆍ김윤덕ㆍ박 정\n문금주 의원(19인)\n제안이유 및 주요내용\n현행법은 대통령에게 사면, 감형, 복권의 권한을 주고 있음.\n이와 같은 대통령의 사면권 등은 법의 경직성에서 발생할 수 있는\n선의의 피해자를 최종적으로 구제하자는 취지로 삼권분립의 원칙에\n다소 예외를 두는 것이므로 그 행사에 고도의 엄격함과 신중함이 요\n구되나 실제로는 정치적이고 정략적인 고려가 반영된 사면이 빈번하\n여 사면권의 남용을 방지할 필요가 있다는 지적이 있으며, 특히 헌정\n질서 자체에 위기를 가져오게 하는 내란죄 및 내란목적살인죄 등의\n경우에는 헌정질서 유린의 반복을 막기 위하여 더더욱 그러하다는 지\n적이 있음.\n이에 내란죄(부화수행의 경우는 제외)와 내란목적살인죄 등에 대해\n\n\n\n서는 특별사면, 감형, 복권을 할 수 없도록 하여 헌정질서를 수호하고\n내란은 결코 성공할 수 없다는 교훈을 역사에 남기고자 하는 것임(안\n제6조).\n\n법률 제 호\n사면법 일부개정법률안\n사면법 일부를 다음과 같이 개정한다.\n제6조 제목 외의 부분을 제2항으로 하고, 같은 조에 제1항을 다음과\n같이 신설한다.\n① 특별사면, 감형, 복권은 「형법」 제87조제1호ㆍ제2호 및 제88조\n의 죄의 경우에는 하지 아니한다.\n부 칙\n이 법은 공포한 날부터 시행한다.\n\n\n\n\n신ㆍ구조문대비표\n현 행 개 정 안\n제6조(복권의 제한) <신 설> 제6조(복권의 제한) ① 특별사면,\n감형, 복권은 「형법」 제87조\n제1호ㆍ제2호 및 제88조의 죄의\n경우에는 하지 아니한다.\n(생 략) ② (현행 제목 외의 부분과 같\n음)\n",
  "sections": {
    "제안이유": "및",
    "주요내용": "현행법은 대통령에게 사면, 감형, 복권의 권한을 주고 있음.\n이와 같은 대통령의 사면권 등은 법의 경직성에서 발생할 수 있는\n선의의 피해자를 최종적으로 구제하자는 취지로 삼권분립의 원칙에\n다소 예외를 두는 것이므로 그 행사에 고도의 엄격함과 신중함이 요\n구되나 실제로는 정치적이고 정략적인 고려가 반영된 사면이 빈번하\n여 사면권의 남용을 방지할 필요가 있다는 지적이 있으며, 특히 헌정\n질서 자체에 위기를 가져오게 하는 내란죄 및 내란목적살인죄 등의\n경우에는 헌정질서 유린의 반복을 막기 위하여 더더욱 그러하다는 지\n적이 있음.\n이에 내란죄(부화수행의 경우는 제외)와 내란목적살인죄 등에 대해\n\n\n\n서는 특별사면, 감형, 복권을 할 수 없도록 하여 헌정질서를 수호하고\n내란은 결코 성공할 수 없다는 교훈을 역사에 남기고자 하는 것임(안\n제6조).",
    "제안이유_및_주요내용": "현행법은 대통령에게 사면, 감형, 복권의 권한을 주고 있음.\n이와 같은 대통령의 사면권 등은 법의 경직성에서 발생할 수 있는\n선의의 피해자를 최종적으로 구제하자는 취지로 삼권분립의 원칙에\n다소 예외를 두는 것이므로 그 행사에 고도의 엄격함과 신중함이 요\n구되나 실제로는 정치적이고 정략적인 고려가 반영된 사면이 빈번하\n여 사면권의 남용을 방지할 필요가 있다는 지적이 있으며, 특히 헌정\n질서 자체에 위기를 가져오게 하는 내란죄 및 내란목적살인죄 등의\n경우에는 헌정질서 유린의 반복을 막기 위하여 더더욱 그러하다는 지\n적이 있음.\n이에 내란죄(부화수행의 경우는 제외)와 내란목적살인죄 등에 대해\n\n\n\n서는 특별사면, 감형, 복권을 할 수 없도록 하여 헌정질서를 수호하고\n내란은 결코 성공할 수 없다는 교훈을 역사에 남기고자 하는 것임(안\n제6조).",
    "법률_제_호": "사면법 일부개정법률안\n사면법 일부를 다음과 같이 개정한다.\n제6조 제목 외의 부분을 제2항으로 하고, 같은 조에 제1항을 다음과\n같이 신설한다.\n① 특별사면, 감형, 복권은 「형법」 제87조제1호ㆍ제2호 및 제88조\n의 죄의 경우에는 하지 아니한다.",
    "신구조문대비표": "현 행 개 정 안\n제6조(복권의 제한) <신 설> 제6조(복권의 제한) ① 특별사면,\n감형, 복권은 「형법」 제87조\n제1호ㆍ제2호 및 제88조의 죄의\n경우에는 하지 아니한다.\n(생 략) ② (현행 제목 외의 부분과 같\n음)"
  }
}