{
  "title": "2206550_사회복지공동모금회법_일부개정법률안",
  "bill_number": "6550",
  "proposal_date": "2024. 12. 17.",
  "submission_date": "",
  "is_alternative": false,
  "alternative_bill_numbers": [],
  "has_comparison_table": false,
  "comparison_table": "신ㆍ구조문대비표\n현 행 개 정 안\n<신 설> 제24조의2(압류금지) 배분대상자\n에게 지급된 금품과 이를 받을\n권리는 압류할 수 없다.",
  "full_text": "사회복지공동모금회법 일부개정법률안\n(백혜련의원 대표발의)\n발의연월일 : 2024. 12. 17.\n의 안\n6550\n번 호 발 의 자 : 백혜련ㆍ천하람ㆍ정동영\n김기표ㆍ서미화ㆍ이수진\n김영환ㆍ오세희ㆍ민형배\n문진석ㆍ이원택 의원\n(11인)\n제안이유 및 주요내용\n현행법은 사회복지공동모금회가 배분한 금품에 대한 압류금지 규정\n을 두고 있지 않음.\n이로 인하여 신용불량자와 같이 개인 사유로 인하여 계좌가 압류되\n어 있는 자의 경우 배분 금품의 압류를 우려하여 주민센터 계좌를 동\n원하여 지원을 신청하는 등 어려움이 발생하고 있음.\n이에 사회복지공동모금회로부터 지급받은 금품 및 이를 받을 권리\n는 압류할 수 없음을 법률에 규정하여 복지 수급권을 보장하려는 것\n임(안 제24조의2 신설).\n\n\n\n\n법률 제 호\n사회복지공동모금회법 일부개정법률안\n사회복지공동모금회법 일부를 다음과 같이 개정한다.\n제24조의2를 다음과 같이 신설한다.\n제24조의2(압류금지) 배분대상자에게 지급된 금품과 이를 받을 권리는\n압류할 수 없다.\n부 칙\n이 법은 공포한 날부터 시행한다.\n\n\n\n\n신ㆍ구조문대비표\n현 행 개 정 안\n<신 설> 제24조의2(압류금지) 배분대상자\n에게 지급된 금품과 이를 받을\n권리는 압류할 수 없다.\n",
  "sections": {
    "제안이유": "및",
    "주요내용": "현행법은 사회복지공동모금회가 배분한 금품에 대한 압류금지 규정\n을 두고 있지 않음.\n이로 인하여 신용불량자와 같이 개인 사유로 인하여 계좌가 압류되\n어 있는 자의 경우 배분 금품의 압류를 우려하여 주민센터 계좌를 동\n원하여 지원을 신청하는 등 어려움이 발생하고 있음.\n이에 사회복지공동모금회로부터 지급받은 금품 및 이를 받을 권리\n는 압류할 수 없음을 법률에 규정하여 복지 수급권을 보장하려는 것\n임(안 제24조의2 신설).",
    "제안이유_및_주요내용": "현행법은 사회복지공동모금회가 배분한 금품에 대한 압류금지 규정\n을 두고 있지 않음.\n이로 인하여 신용불량자와 같이 개인 사유로 인하여 계좌가 압류되\n어 있는 자의 경우 배분 금품의 압류를 우려하여 주민센터 계좌를 동\n원하여 지원을 신청하는 등 어려움이 발생하고 있음.\n이에 사회복지공동모금회로부터 지급받은 금품 및 이를 받을 권리\n는 압류할 수 없음을 법률에 규정하여 복지 수급권을 보장하려는 것\n임(안 제24조의2 신설).",
    "법률_제_호": "사회복지공동모금회법 일부개정법률안\n사회복지공동모금회법 일부를 다음과 같이 개정한다.\n제24조의2를 다음과 같이 신설한다.\n제24조의2(압류금지) 배분대상자에게 지급된 금품과 이를 받을 권리는\n압류할 수 없다.",
    "신구조문대비표": "현 행 개 정 안\n<신 설> 제24조의2(압류금지) 배분대상자\n에게 지급된 금품과 이를 받을\n권리는 압류할 수 없다."
  }
}