{
  "title": "2206158_출입국관리법_일부개정법률안",
  "bill_number": "6158",
  "proposal_date": "2024. 12. 3.",
  "submission_date": "",
  "is_alternative": false,
  "alternative_bill_numbers": [],
  "has_comparison_table": false,
  "comparison_table": "신ㆍ구조문대비표\n현 행 개 정 안\n제86조(신병의 인도) ① (생 략) 제86조(신병의 인도) ① (현행과\n같음)\n<신 설> ② 사법경찰관은 강제퇴거명령\n서가 발급된 구속피의자에게\n불송치결정을 한 경우에는 석\n방과 동시에 출입국관리공무원\n에게 그를 인도하여야 한다.\n② (생 략) ③ (현행 제2항과 같음)",
  "full_text": "출입국관리법 일부개정법률안\n(권영세의원 대표발의)\n발의연월일 : 2024. 12. 3.\n의 안\n6158\n번 호 발 의 자 : 권영세ㆍ이성권ㆍ김소희\n김재섭ㆍ서일준ㆍ고동진\n안철수ㆍ구자근ㆍ강대식\n인요한 의원(10인)\n제안이유 및 주요내용\n현행법은 강제퇴거명령서의 집행은 출입국관리공무원이 하도록 규\n정하고, 강제퇴거명령서가 발급된 구속피의자에 대하여 검사가 불기소\n처분을 하는 경우 석방과 동시에 출입국관리공무원에 인도하도록 규\n정하고 있음.\n그런데 「형사소송법」 개정으로 사법경찰관이 수사종결권을 가지\n게 되었는바, 현행법에는 사법경찰관이 강제퇴거명령서가 발급된 구속\n피의자에 대하여 수사를 종결하는 경우에 출입국관리공무원에게 그를\n인도하는 규정이 없어 강제퇴거대상자의 신병 확보에 공백이 발생한\n다는 비판이 제기됨.\n이에 사법경찰관이 강제퇴거명령서가 발급된 구속피의자에 대하여\n불송치결정을 하는 때에는 해당 피의자를 출입국관리공무원에게 석방\n과 동시에 인도하도록 하여 신병확보에 공백이 없도록 하려는 취지임\n\n\n\n(안 제86조제2항 신설).\n\n법률 제 호\n출입국관리법 일부개정법률안\n출입국관리법 일부를 다음과 같이 개정한다.\n제86조제2항을 제3항으로 하고, 같은 조에 제2항을 다음과 같이 신설\n한다.\n② 사법경찰관은 강제퇴거명령서가 발급된 구속피의자에게 불송치\n결정을 한 경우에는 석방과 동시에 출입국관리공무원에게 그를 인\n도하여야 한다.\n부 칙\n제1조(시행일) 이 법은 공포 후 6개월이 경과한 날부터 시행한다.\n제2조(신병인도에 관한 적용례) 제86조제2항의 개정규정은 이 법 시행\n이후 불송치결정을 한 경우부터 적용한다.\n\n\n\n\n신ㆍ구조문대비표\n현 행 개 정 안\n제86조(신병의 인도) ① (생 략) 제86조(신병의 인도) ① (현행과\n같음)\n<신 설> ② 사법경찰관은 강제퇴거명령\n서가 발급된 구속피의자에게\n불송치결정을 한 경우에는 석\n방과 동시에 출입국관리공무원\n에게 그를 인도하여야 한다.\n② (생 략) ③ (현행 제2항과 같음)\n",
  "sections": {
    "제안이유": "및",
    "주요내용": "현행법은 강제퇴거명령서의 집행은 출입국관리공무원이 하도록 규\n정하고, 강제퇴거명령서가 발급된 구속피의자에 대하여 검사가 불기소\n처분을 하는 경우 석방과 동시에 출입국관리공무원에 인도하도록 규\n정하고 있음.\n그런데 「형사소송법」 개정으로 사법경찰관이 수사종결권을 가지\n게 되었는바, 현행법에는 사법경찰관이 강제퇴거명령서가 발급된 구속\n피의자에 대하여 수사를 종결하는 경우에 출입국관리공무원에게 그를\n인도하는 규정이 없어 강제퇴거대상자의 신병 확보에 공백이 발생한\n다는 비판이 제기됨.\n이에 사법경찰관이 강제퇴거명령서가 발급된 구속피의자에 대하여\n불송치결정을 하는 때에는 해당 피의자를 출입국관리공무원에게 석방\n과 동시에 인도하도록 하여 신병확보에 공백이 없도록 하려는 취지임\n\n\n\n(안 제86조제2항 신설).",
    "제안이유_및_주요내용": "현행법은 강제퇴거명령서의 집행은 출입국관리공무원이 하도록 규\n정하고, 강제퇴거명령서가 발급된 구속피의자에 대하여 검사가 불기소\n처분을 하는 경우 석방과 동시에 출입국관리공무원에 인도하도록 규\n정하고 있음.\n그런데 「형사소송법」 개정으로 사법경찰관이 수사종결권을 가지\n게 되었는바, 현행법에는 사법경찰관이 강제퇴거명령서가 발급된 구속\n피의자에 대하여 수사를 종결하는 경우에 출입국관리공무원에게 그를\n인도하는 규정이 없어 강제퇴거대상자의 신병 확보에 공백이 발생한\n다는 비판이 제기됨.\n이에 사법경찰관이 강제퇴거명령서가 발급된 구속피의자에 대하여\n불송치결정을 하는 때에는 해당 피의자를 출입국관리공무원에게 석방\n과 동시에 인도하도록 하여 신병확보에 공백이 없도록 하려는 취지임\n\n\n\n(안 제86조제2항 신설).",
    "법률_제_호": "출입국관리법 일부개정법률안\n출입국관리법 일부를 다음과 같이 개정한다.\n제86조제2항을 제3항으로 하고, 같은 조에 제2항을 다음과 같이 신설\n한다.\n② 사법경찰관은 강제퇴거명령서가 발급된 구속피의자에게 불송치\n결정을 한 경우에는 석방과 동시에 출입국관리공무원에게 그를 인\n도하여야 한다.",
    "신구조문대비표": "현 행 개 정 안\n제86조(신병의 인도) ① (생 략) 제86조(신병의 인도) ① (현행과\n같음)\n<신 설> ② 사법경찰관은 강제퇴거명령\n서가 발급된 구속피의자에게\n불송치결정을 한 경우에는 석\n방과 동시에 출입국관리공무원\n에게 그를 인도하여야 한다.\n② (생 략) ③ (현행 제2항과 같음)"
  }
}