{
  "title": "2206014_형법_일부개정법률안",
  "bill_number": "6014",
  "proposal_date": "2024. 11. 28.",
  "submission_date": "",
  "is_alternative": false,
  "alternative_bill_numbers": [],
  "has_comparison_table": false,
  "comparison_table": "신ㆍ구조문대비표\n현 행 개 정 안\n<신 설> 제130조의2(위법성의 조각) 제130\n조의 행위가 공공의 이익을 위\n한 경우로서 제3자가 국가, 지\n방자치단체, 공공기관 또는\n「공익법인의 설립ㆍ운영에 관\n한 법률」에 따라 설립된 공익\n법인 등에 해당하는 경우에는\n처벌하지 아니한다.",
  "full_text": "형법 일부개정법률안\n(주철현의원 대표발의)\n발의연월일 : 2024. 11. 28.\n의 안\n6014\n번 호 발 의 자 : 주철현ㆍ모경종ㆍ위성곤\n조인철ㆍ황명선ㆍ박정현\n김문수ㆍ천하람ㆍ박균택\n이병진ㆍ이재강ㆍ양부남\n이기헌ㆍ정준호ㆍ오세희\n민형배ㆍ염태영ㆍ복기왕\n서삼석ㆍ김성환ㆍ장종태\n허성무ㆍ조계원 의원\n(23인)\n제안이유 및 주요내용\n현행법에서는 공무원 또는 중재인이 그 직무에 관하여 부정한 청탁\n을 받고 제3자에게 뇌물을 공여하게 하거나 공여를 요구 또는 약속한\n때에는 5년 이하의 징역 또는 10년 이하의 자격정지에 처하고 있음.\n그런데 이러한 ‘부정한 청탁’과 관련하여, 대법원 판례에 의하면 직\n무집행 자체가 위법ㆍ부당한 경우뿐 아니라 의뢰한 직무집행 자체는\n위법하거나 부당하지 않더라도 당해 직무집행을 어떤 대가관계와 연\n결시켜 이에 관한 대가의 교부를 내용으로 하는 청탁 또한 ‘부정한 청\n탁’에 해당됨. 심지어 지방자치단체도 뇌물을 제공받는 ‘제3자’가 될\n\n\n\n수 있다고 판시하였음.\n이러한 대법원 판례의 입장에 의한다면 지방자치단체가 개발이익환\n수를 위하여 인ㆍ허가의 반대급부로 기반시설이나 문화시설을 이전받\n는 등으로 사회공헌 사업을 시행한 경우, 해당 사업은 「개발이익 환\n수에 관한 법률」상의 개발부담금 또는 「도시 및 주거환경정비법」\n이나 기타 개발 관련 법률에서 정하고 있는 기부채납에 해당하지 아\n니하는 한 현행법상 제3자뇌물제공죄의 적용을 받을 가능성이 있음.\n이는 주민복리 및 공공의 이익을 위한 지방자치단체의 적극행정을\n제약하는 요소로 작용할 수 있어 제도적인 보완이 필요하다는 의견이\n제기되고 있음.\n이에 공공의 이익을 위한 경우로서 제3자가 국가, 지방자치단체, 공\n공기관 또는 「공익법인의 설립ㆍ운영에 관한 법률」에 따라 설립된\n공익법인 등에 해당하는 경우에는 처벌받지 아니할 수 있도록 하는\n근거규정을 마련함으로써 지방자치단체의 적극행정과 기업의 사회공\n헌을 장려하고 주민복리 증진을 기하려는 것임(안 제130조의2 신설).\n\n법률 제 호\n형법 일부개정법률안\n형법 일부를 다음과 같이 개정한다.\n제130조의2를 다음과 같이 신설한다.\n제130조의2(위법성의 조각) 제130조의 행위가 공공의 이익을 위한 경\n우로서 제3자가 국가, 지방자치단체, 공공기관 또는 「공익법인의\n설립ㆍ운영에 관한 법률」에 따라 설립된 공익법인 등에 해당하는\n경우에는 처벌하지 아니한다.\n부 칙\n이 법은 공포 후 3개월이 경과한 날부터 시행한다.\n\n\n\n\n신ㆍ구조문대비표\n현 행 개 정 안\n<신 설> 제130조의2(위법성의 조각) 제130\n조의 행위가 공공의 이익을 위\n한 경우로서 제3자가 국가, 지\n방자치단체, 공공기관 또는\n「공익법인의 설립ㆍ운영에 관\n한 법률」에 따라 설립된 공익\n법인 등에 해당하는 경우에는\n처벌하지 아니한다.\n",
  "sections": {
    "제안이유": "및",
    "주요내용": "현행법에서는 공무원 또는 중재인이 그 직무에 관하여 부정한 청탁\n을 받고 제3자에게 뇌물을 공여하게 하거나 공여를 요구 또는 약속한\n때에는 5년 이하의 징역 또는 10년 이하의 자격정지에 처하고 있음.\n그런데 이러한 ‘부정한 청탁’과 관련하여, 대법원 판례에 의하면 직\n무집행 자체가 위법ㆍ부당한 경우뿐 아니라 의뢰한 직무집행 자체는\n위법하거나 부당하지 않더라도 당해 직무집행을 어떤 대가관계와 연\n결시켜 이에 관한 대가의 교부를 내용으로 하는 청탁 또한 ‘부정한 청\n탁’에 해당됨. 심지어 지방자치단체도 뇌물을 제공받는 ‘제3자’가 될\n\n\n\n수 있다고 판시하였음.\n이러한 대법원 판례의 입장에 의한다면 지방자치단체가 개발이익환\n수를 위하여 인ㆍ허가의 반대급부로 기반시설이나 문화시설을 이전받\n는 등으로 사회공헌 사업을 시행한 경우, 해당 사업은 「개발이익 환\n수에 관한 법률」상의 개발부담금 또는 「도시 및 주거환경정비법」\n이나 기타 개발 관련 법률에서 정하고 있는 기부채납에 해당하지 아\n니하는 한 현행법상 제3자뇌물제공죄의 적용을 받을 가능성이 있음.\n이는 주민복리 및 공공의 이익을 위한 지방자치단체의 적극행정을\n제약하는 요소로 작용할 수 있어 제도적인 보완이 필요하다는 의견이\n제기되고 있음.\n이에 공공의 이익을 위한 경우로서 제3자가 국가, 지방자치단체, 공\n공기관 또는 「공익법인의 설립ㆍ운영에 관한 법률」에 따라 설립된\n공익법인 등에 해당하는 경우에는 처벌받지 아니할 수 있도록 하는\n근거규정을 마련함으로써 지방자치단체의 적극행정과 기업의 사회공\n헌을 장려하고 주민복리 증진을 기하려는 것임(안 제130조의2 신설).",
    "제안이유_및_주요내용": "현행법에서는 공무원 또는 중재인이 그 직무에 관하여 부정한 청탁\n을 받고 제3자에게 뇌물을 공여하게 하거나 공여를 요구 또는 약속한\n때에는 5년 이하의 징역 또는 10년 이하의 자격정지에 처하고 있음.\n그런데 이러한 ‘부정한 청탁’과 관련하여, 대법원 판례에 의하면 직\n무집행 자체가 위법ㆍ부당한 경우뿐 아니라 의뢰한 직무집행 자체는\n위법하거나 부당하지 않더라도 당해 직무집행을 어떤 대가관계와 연\n결시켜 이에 관한 대가의 교부를 내용으로 하는 청탁 또한 ‘부정한 청\n탁’에 해당됨. 심지어 지방자치단체도 뇌물을 제공받는 ‘제3자’가 될\n\n\n\n수 있다고 판시하였음.\n이러한 대법원 판례의 입장에 의한다면 지방자치단체가 개발이익환\n수를 위하여 인ㆍ허가의 반대급부로 기반시설이나 문화시설을 이전받\n는 등으로 사회공헌 사업을 시행한 경우, 해당 사업은 「개발이익 환\n수에 관한 법률」상의 개발부담금 또는 「도시 및 주거환경정비법」\n이나 기타 개발 관련 법률에서 정하고 있는 기부채납에 해당하지 아\n니하는 한 현행법상 제3자뇌물제공죄의 적용을 받을 가능성이 있음.\n이는 주민복리 및 공공의 이익을 위한 지방자치단체의 적극행정을\n제약하는 요소로 작용할 수 있어 제도적인 보완이 필요하다는 의견이\n제기되고 있음.\n이에 공공의 이익을 위한 경우로서 제3자가 국가, 지방자치단체, 공\n공기관 또는 「공익법인의 설립ㆍ운영에 관한 법률」에 따라 설립된\n공익법인 등에 해당하는 경우에는 처벌받지 아니할 수 있도록 하는\n근거규정을 마련함으로써 지방자치단체의 적극행정과 기업의 사회공\n헌을 장려하고 주민복리 증진을 기하려는 것임(안 제130조의2 신설).",
    "법률_제_호": "형법 일부개정법률안\n형법 일부를 다음과 같이 개정한다.\n제130조의2를 다음과 같이 신설한다.\n제130조의2(위법성의 조각) 제130조의 행위가 공공의 이익을 위한 경\n우로서 제3자가 국가, 지방자치단체, 공공기관 또는 「공익법인의\n설립ㆍ운영에 관한 법률」에 따라 설립된 공익법인 등에 해당하는\n경우에는 처벌하지 아니한다.",
    "신구조문대비표": "현 행 개 정 안\n<신 설> 제130조의2(위법성의 조각) 제130\n조의 행위가 공공의 이익을 위\n한 경우로서 제3자가 국가, 지\n방자치단체, 공공기관 또는\n「공익법인의 설립ㆍ운영에 관\n한 법률」에 따라 설립된 공익\n법인 등에 해당하는 경우에는\n처벌하지 아니한다."
  }
}