{
  "title": "2206797_정부조직법_일부개정법률안",
  "bill_number": "6797",
  "proposal_date": "2024. 12. 20.",
  "submission_date": "",
  "is_alternative": false,
  "alternative_bill_numbers": [],
  "has_comparison_table": false,
  "comparison_table": "신ㆍ구조문대비표\n현 행 개 정 안\n제33조(국방부) ① (생 략) 제33조(국방부) ① (현행과 같음)\n<신 설> ② 「군인사법」 제3조제1항제\n1호의 장교인 군인은 현역을\n면한 날로부터 7년이 지나지\n아니하면 국방부장관으로 임명\n될 수 없다.\n② ∼ ⑥ (생 략) ③ ∼ ⑦ (현행 제2항부터 제6\n항까지와 같음)",
  "full_text": "정부조직법 일부개정법률안\n(추미애의원 대표발의)\n발의연월일 : 2024. 12. 20.\n의 안\n6797\n번 호 발 의 자 : 추미애ㆍ송옥주ㆍ이수진\n한정애ㆍ강선우ㆍ정을호\n박균택ㆍ박홍배ㆍ서미화\n박해철ㆍ이성윤ㆍ이병진\n의원(12인)\n제안이유 및 주요내용\n「대한민국헌법」은 군인은 현역을 면한 후가 아니면 국무위원으로\n임명될 수 없다고 규정하고 있으며, 이에 따라 국방부장관 역시 현역\n을 면한 이후여야만 임명될 수 있음.\n1961년 이래 우리나라의 국방부장관은 예비역 장성만이 임명되었음.\n대체로 군인이 현역을 면한 직후 국방부장관으로 임명됨으로써 국방\n부장관이 주도하는 군내 사조직과 특정 파벌이 형성될 수 있고, 이를\n통해 친위쿠데타가 발생할 수 있는 점, 군내 지휘감독 체계에 어긋나\n는 명령과 작전이 이루어질 수 있는 점 등의 문제가 야기됨. 이에, 군\n에 대한 문민통제 실현, 군정권과 군령권의 확실한 분리를 위해 예비\n역 군인에 대한 국방부장관 임명을 제한하고자 함.\n한편, 미국은 법(미국법전 제10편 제113조)을 통해 대령 이하의 장\n\n\n\n교인 군인은 현역을 면한 날로부터 7년, 준장 이상의 군인은 현역을\n면한 날로부터 10년이 지나지 아니하면 국방부장관으로 임명될 수 없\n도록 하고 있음.\n이에 군인으로서 현역을 면한 날로부터 7년이 지나지 않은 예비역\n장성급 장교는 국방부장관으로 임명될 수 없도록 관련 조항을 신설하\n려는 것임(안 제33조제2항 신설).\n\n법률 제 호\n정부조직법 일부개정법률안\n정부조직법 일부를 다음과 같이 개정한다.\n제33조제2항부터 제6항까지를 각각 제3항부터 제7항까지로 하고, 같은\n조에 제2항을 다음과 같이 신설한다.\n② 「군인사법」 제3조제1항제1호의 장교인 군인은 현역을 면한 날\n로부터 7년이 지나지 아니하면 국방부장관으로 임명될 수 없다.\n부 칙\n이 법은 공포한 날부터 시행한다.\n\n\n\n\n신ㆍ구조문대비표\n현 행 개 정 안\n제33조(국방부) ① (생 략) 제33조(국방부) ① (현행과 같음)\n<신 설> ② 「군인사법」 제3조제1항제\n1호의 장교인 군인은 현역을\n면한 날로부터 7년이 지나지\n아니하면 국방부장관으로 임명\n될 수 없다.\n② ∼ ⑥ (생 략) ③ ∼ ⑦ (현행 제2항부터 제6\n항까지와 같음)\n",
  "sections": {
    "제안이유": "및",
    "주요내용": "「대한민국헌법」은 군인은 현역을 면한 후가 아니면 국무위원으로\n임명될 수 없다고 규정하고 있으며, 이에 따라 국방부장관 역시 현역\n을 면한 이후여야만 임명될 수 있음.\n1961년 이래 우리나라의 국방부장관은 예비역 장성만이 임명되었음.\n대체로 군인이 현역을 면한 직후 국방부장관으로 임명됨으로써 국방\n부장관이 주도하는 군내 사조직과 특정 파벌이 형성될 수 있고, 이를\n통해 친위쿠데타가 발생할 수 있는 점, 군내 지휘감독 체계에 어긋나\n는 명령과 작전이 이루어질 수 있는 점 등의 문제가 야기됨. 이에, 군\n에 대한 문민통제 실현, 군정권과 군령권의 확실한 분리를 위해 예비\n역 군인에 대한 국방부장관 임명을 제한하고자 함.\n한편, 미국은 법(미국법전 제10편 제113조)을 통해 대령 이하의 장\n\n\n\n교인 군인은 현역을 면한 날로부터 7년, 준장 이상의 군인은 현역을\n면한 날로부터 10년이 지나지 아니하면 국방부장관으로 임명될 수 없\n도록 하고 있음.\n이에 군인으로서 현역을 면한 날로부터 7년이 지나지 않은 예비역\n장성급 장교는 국방부장관으로 임명될 수 없도록 관련 조항을 신설하\n려는 것임(안 제33조제2항 신설).",
    "제안이유_및_주요내용": "「대한민국헌법」은 군인은 현역을 면한 후가 아니면 국무위원으로\n임명될 수 없다고 규정하고 있으며, 이에 따라 국방부장관 역시 현역\n을 면한 이후여야만 임명될 수 있음.\n1961년 이래 우리나라의 국방부장관은 예비역 장성만이 임명되었음.\n대체로 군인이 현역을 면한 직후 국방부장관으로 임명됨으로써 국방\n부장관이 주도하는 군내 사조직과 특정 파벌이 형성될 수 있고, 이를\n통해 친위쿠데타가 발생할 수 있는 점, 군내 지휘감독 체계에 어긋나\n는 명령과 작전이 이루어질 수 있는 점 등의 문제가 야기됨. 이에, 군\n에 대한 문민통제 실현, 군정권과 군령권의 확실한 분리를 위해 예비\n역 군인에 대한 국방부장관 임명을 제한하고자 함.\n한편, 미국은 법(미국법전 제10편 제113조)을 통해 대령 이하의 장\n\n\n\n교인 군인은 현역을 면한 날로부터 7년, 준장 이상의 군인은 현역을\n면한 날로부터 10년이 지나지 아니하면 국방부장관으로 임명될 수 없\n도록 하고 있음.\n이에 군인으로서 현역을 면한 날로부터 7년이 지나지 않은 예비역\n장성급 장교는 국방부장관으로 임명될 수 없도록 관련 조항을 신설하\n려는 것임(안 제33조제2항 신설).",
    "법률_제_호": "정부조직법 일부개정법률안\n정부조직법 일부를 다음과 같이 개정한다.\n제33조제2항부터 제6항까지를 각각 제3항부터 제7항까지로 하고, 같은\n조에 제2항을 다음과 같이 신설한다.\n② 「군인사법」 제3조제1항제1호의 장교인 군인은 현역을 면한 날\n로부터 7년이 지나지 아니하면 국방부장관으로 임명될 수 없다.",
    "신구조문대비표": "현 행 개 정 안\n제33조(국방부) ① (생 략) 제33조(국방부) ① (현행과 같음)\n<신 설> ② 「군인사법」 제3조제1항제\n1호의 장교인 군인은 현역을\n면한 날로부터 7년이 지나지\n아니하면 국방부장관으로 임명\n될 수 없다.\n② ∼ ⑥ (생 략) ③ ∼ ⑦ (현행 제2항부터 제6\n항까지와 같음)"
  }
}