{
  "title": "2206967_초·중등교육법_일부개정법률안",
  "bill_number": "6967",
  "proposal_date": "2024. 12. 26.",
  "submission_date": "",
  "is_alternative": false,
  "alternative_bill_numbers": [],
  "has_comparison_table": false,
  "comparison_table": "신ㆍ구조문대비표\n현 행 개 정 안\n제48조(학과 및 학점제 등) ① ∼ 제48조(학과 및 학점제 등) ① ∼\n③ (생 략) ③ (현행과 같음)\n<신 설> ④ 고교학점제를 운영하는 학\n교의 장은 학생의 과목 선택권\n을 확대하기 위하여 학교 간\n공동교육과정을 운영할 수 있\n다.\n④ㆍ⑤ (생 략) ⑤ㆍ⑥ (현행 제4항 및 제5항\n과 같음)",
  "full_text": "초ㆍ중등교육법 일부개정법률안\n(고민정의원 대표발의)\n발의연월일 : 2024. 12. 26.\n의 안\n6967\n번 호 발 의 자 : 고민정ㆍ박정현ㆍ이훈기\n추미애ㆍ조인철ㆍ김동아\n문정복ㆍ김준혁ㆍ장철민\n임호선 의원(10인)\n제안이유 및 주요내용\n고교학점제 도입으로 2025년부터 고등학교에 입학하는 학생은 진로\nㆍ적성에 따라 과목을 선택하고 이수 기준에 도달한 과목에 대해 학\n점을 취득ㆍ누적하여 졸업함.\n고교학점제 취지를 살리기 위해서는 학생이 희망하는 과목을 최대\n한 개설할 수 있어야 하나 수강을 희망하는 학생이 적거나 교사가 부\n족한 과목의 경우 개별 학교에서 수업을 개설하기가 어려움.\n이에 학교의 장이 개설이 어려운 소인수ㆍ심화 과목 등을 학교 간\n연계 및 협력을 통해 운영하는 교육과정인 공동교육과정을 운영할 수\n있는 명확한 근거를 마련하여 학생의 과목 선택권을 보장하고자 함(안\n제48조제4항 신설).\n\n\n\n\n법률 제 호\n초ㆍ중등교육법 일부개정법률안\n초ㆍ중등교육법 일부를 다음과 같이 개정한다.\n제48조제4항 및 제5항을 각각 제5항 및 제6항으로 하고, 같은 조에 제\n4항을 다음과 같이 신설한다.\n④ 고교학점제를 운영하는 학교의 장은 학생의 과목 선택권을 확대\n하기 위하여 학교 간 공동교육과정을 운영할 수 있다.\n부 칙\n이 법은 공포한 날부터 시행한다.\n\n\n\n\n신ㆍ구조문대비표\n현 행 개 정 안\n제48조(학과 및 학점제 등) ① ∼ 제48조(학과 및 학점제 등) ① ∼\n③ (생 략) ③ (현행과 같음)\n<신 설> ④ 고교학점제를 운영하는 학\n교의 장은 학생의 과목 선택권\n을 확대하기 위하여 학교 간\n공동교육과정을 운영할 수 있\n다.\n④ㆍ⑤ (생 략) ⑤ㆍ⑥ (현행 제4항 및 제5항\n과 같음)\n",
  "sections": {
    "제안이유": "및",
    "주요내용": "고교학점제 도입으로 2025년부터 고등학교에 입학하는 학생은 진로\nㆍ적성에 따라 과목을 선택하고 이수 기준에 도달한 과목에 대해 학\n점을 취득ㆍ누적하여 졸업함.\n고교학점제 취지를 살리기 위해서는 학생이 희망하는 과목을 최대\n한 개설할 수 있어야 하나 수강을 희망하는 학생이 적거나 교사가 부\n족한 과목의 경우 개별 학교에서 수업을 개설하기가 어려움.\n이에 학교의 장이 개설이 어려운 소인수ㆍ심화 과목 등을 학교 간\n연계 및 협력을 통해 운영하는 교육과정인 공동교육과정을 운영할 수\n있는 명확한 근거를 마련하여 학생의 과목 선택권을 보장하고자 함(안\n제48조제4항 신설).",
    "제안이유_및_주요내용": "고교학점제 도입으로 2025년부터 고등학교에 입학하는 학생은 진로\nㆍ적성에 따라 과목을 선택하고 이수 기준에 도달한 과목에 대해 학\n점을 취득ㆍ누적하여 졸업함.\n고교학점제 취지를 살리기 위해서는 학생이 희망하는 과목을 최대\n한 개설할 수 있어야 하나 수강을 희망하는 학생이 적거나 교사가 부\n족한 과목의 경우 개별 학교에서 수업을 개설하기가 어려움.\n이에 학교의 장이 개설이 어려운 소인수ㆍ심화 과목 등을 학교 간\n연계 및 협력을 통해 운영하는 교육과정인 공동교육과정을 운영할 수\n있는 명확한 근거를 마련하여 학생의 과목 선택권을 보장하고자 함(안\n제48조제4항 신설).",
    "법률_제_호": "초ㆍ중등교육법 일부개정법률안\n초ㆍ중등교육법 일부를 다음과 같이 개정한다.\n제48조제4항 및 제5항을 각각 제5항 및 제6항으로 하고, 같은 조에 제\n4항을 다음과 같이 신설한다.\n④ 고교학점제를 운영하는 학교의 장은 학생의 과목 선택권을 확대\n하기 위하여 학교 간 공동교육과정을 운영할 수 있다.",
    "신구조문대비표": "현 행 개 정 안\n제48조(학과 및 학점제 등) ① ∼ 제48조(학과 및 학점제 등) ① ∼\n③ (생 략) ③ (현행과 같음)\n<신 설> ④ 고교학점제를 운영하는 학\n교의 장은 학생의 과목 선택권\n을 확대하기 위하여 학교 간\n공동교육과정을 운영할 수 있\n다.\n④ㆍ⑤ (생 략) ⑤ㆍ⑥ (현행 제4항 및 제5항\n과 같음)"
  }
}