{
  "title": "2206222_국회법_일부개정법률안",
  "bill_number": "6222",
  "proposal_date": "2024. 12. 5.",
  "submission_date": "",
  "is_alternative": false,
  "alternative_bill_numbers": [],
  "has_comparison_table": false,
  "comparison_table": "신ㆍ구조문대비표\n현 행 개 정 안\n제144조(경위와 경찰관) ① ∼ ③ 제144조(경위와 경찰관) ① ∼ ③\n(생 략) (현행과 같음)\n<신 설> ④「계엄법」에도 불구하고 계\n엄 선포시 제3항에 따른 경찰\n공무원은 의장의 지휘를 따른\n다.",
  "full_text": "국회법 일부개정법률안\n(김태선의원 대표발의)\n발의연월일 : 2024. 12. 5.\n의 안\n6222\n번 호 발 의 자 : 김태선ㆍ조인철ㆍ장철민\n안호영ㆍ김태년ㆍ박홍배\n한민수ㆍ박 정ㆍ정준호\n이용우ㆍ김주영 의원\n(11인)\n제안이유 및 주요내용\n현행 국회 경비 체계에서 국회의 회의장 건물 밖의 경호는 서울경\n찰청 소속 경찰공무원이 담당하고 있습니다. 이는 국회의 경비와 보호\n를 목적으로 설치된 국회경비대가 행정부의 지휘를 받는 구조로 운영\n됨에 따라 입법부의 자율성과 독립성이 훼손될 가능성을 내포하고 있\n습니다. 특히 계엄 선포 시에는 국회경비대가 입법부 보호보다 계엄사\n령관의 지휘를 우선시할 수밖에 없는 구조적 한계가 드러날 수 있습\n니다. 이러한 상황은 삼권분립이라는 헌법적 원칙과 입법부의 독립성\n을 심각하게 위협할 우려가 있습니다.\n국회는 민주적 통치의 중심으로서 입법부의 자율성과 독립성을 유\n지해야 하며, 이에 따라 국회의 경비 및 경호 체계 또한 입법부의 필\n요와 특수성을 반영하여 독립적으로 운영될 필요가 있습니다. 이에 본\n개정안은 계엄 선포 시 경찰공무원이 국회의 자율성과 독립성을 보장\n\n\n\n하기 위해 국회의장의 지휘를 우선적으로 따르도록 명확히 규정하고\n자 합니다. 이를 통해 국회 경비 체계의 독립성을 강화하고, 입법부의\n헌법적 권위와 국민의 신뢰를 보다 공고히 하고자 합니다(안 제144조\n제4항 신설).\n\n법률 제 호\n국회법 일부개정법률안\n국회법 일부를 다음과 같이 개정한다.\n제144조에 제4항을 다음과 같이 신설한다.\n④ 「계엄법」에도 불구하고 계엄 선포시 제3항에 따른 경찰공무원\n은 의장의 지휘를 따른다.\n부 칙\n이 법은 공포한 날부터 시행한다.\n\n\n\n\n신ㆍ구조문대비표\n현 행 개 정 안\n제144조(경위와 경찰관) ① ∼ ③ 제144조(경위와 경찰관) ① ∼ ③\n(생 략) (현행과 같음)\n<신 설> ④「계엄법」에도 불구하고 계\n엄 선포시 제3항에 따른 경찰\n공무원은 의장의 지휘를 따른\n다.\n",
  "sections": {
    "제안이유": "및",
    "주요내용": "현행 국회 경비 체계에서 국회의 회의장 건물 밖의 경호는 서울경\n찰청 소속 경찰공무원이 담당하고 있습니다. 이는 국회의 경비와 보호\n를 목적으로 설치된 국회경비대가 행정부의 지휘를 받는 구조로 운영\n됨에 따라 입법부의 자율성과 독립성이 훼손될 가능성을 내포하고 있\n습니다. 특히 계엄 선포 시에는 국회경비대가 입법부 보호보다 계엄사\n령관의 지휘를 우선시할 수밖에 없는 구조적 한계가 드러날 수 있습\n니다. 이러한 상황은 삼권분립이라는 헌법적 원칙과 입법부의 독립성\n을 심각하게 위협할 우려가 있습니다.\n국회는 민주적 통치의 중심으로서 입법부의 자율성과 독립성을 유\n지해야 하며, 이에 따라 국회의 경비 및 경호 체계 또한 입법부의 필\n요와 특수성을 반영하여 독립적으로 운영될 필요가 있습니다. 이에 본\n개정안은 계엄 선포 시 경찰공무원이 국회의 자율성과 독립성을 보장\n\n\n\n하기 위해 국회의장의 지휘를 우선적으로 따르도록 명확히 규정하고\n자 합니다. 이를 통해 국회 경비 체계의 독립성을 강화하고, 입법부의\n헌법적 권위와 국민의 신뢰를 보다 공고히 하고자 합니다(안 제144조\n제4항 신설).",
    "제안이유_및_주요내용": "현행 국회 경비 체계에서 국회의 회의장 건물 밖의 경호는 서울경\n찰청 소속 경찰공무원이 담당하고 있습니다. 이는 국회의 경비와 보호\n를 목적으로 설치된 국회경비대가 행정부의 지휘를 받는 구조로 운영\n됨에 따라 입법부의 자율성과 독립성이 훼손될 가능성을 내포하고 있\n습니다. 특히 계엄 선포 시에는 국회경비대가 입법부 보호보다 계엄사\n령관의 지휘를 우선시할 수밖에 없는 구조적 한계가 드러날 수 있습\n니다. 이러한 상황은 삼권분립이라는 헌법적 원칙과 입법부의 독립성\n을 심각하게 위협할 우려가 있습니다.\n국회는 민주적 통치의 중심으로서 입법부의 자율성과 독립성을 유\n지해야 하며, 이에 따라 국회의 경비 및 경호 체계 또한 입법부의 필\n요와 특수성을 반영하여 독립적으로 운영될 필요가 있습니다. 이에 본\n개정안은 계엄 선포 시 경찰공무원이 국회의 자율성과 독립성을 보장\n\n\n\n하기 위해 국회의장의 지휘를 우선적으로 따르도록 명확히 규정하고\n자 합니다. 이를 통해 국회 경비 체계의 독립성을 강화하고, 입법부의\n헌법적 권위와 국민의 신뢰를 보다 공고히 하고자 합니다(안 제144조\n제4항 신설).",
    "법률_제_호": "국회법 일부개정법률안\n국회법 일부를 다음과 같이 개정한다.\n제144조에 제4항을 다음과 같이 신설한다.\n④ 「계엄법」에도 불구하고 계엄 선포시 제3항에 따른 경찰공무원\n은 의장의 지휘를 따른다.",
    "신구조문대비표": "현 행 개 정 안\n제144조(경위와 경찰관) ① ∼ ③ 제144조(경위와 경찰관) ① ∼ ③\n(생 략) (현행과 같음)\n<신 설> ④「계엄법」에도 불구하고 계\n엄 선포시 제3항에 따른 경찰\n공무원은 의장의 지휘를 따른\n다."
  }
}