{
  "title": "2206714_사면법_일부개정법률안",
  "bill_number": "6714",
  "proposal_date": "2024. 12. 19.",
  "submission_date": "",
  "is_alternative": false,
  "alternative_bill_numbers": [],
  "has_comparison_table": false,
  "comparison_table": "신ㆍ구조문대비표\n현 행 개 정 안\n<신 설> 제5조의2(특별사면의 제한) 특별\n사면은 「형법」 제87조제1호\nㆍ제2호 또는 「군형법」 제5\n조제1호ㆍ제2호의 죄로 형을\n선고받은 자에 대하여는 하지\n아니한다.",
  "full_text": "사면법 일부개정법률안\n(권향엽의원 대표발의)\n발의연월일 : 2024. 12. 19.\n의 안\n6714\n번 호 발 의 자 : 권향엽ㆍ박민규ㆍ채현일\nㅂ\n김문수ㆍ오세희ㆍ박지원\n전진숙ㆍ박용갑ㆍ문진석\n임미애ㆍ정동영 의원\n(11인)\n제안이유 및 주요내용\n현행법은 특별사면, 특정한 자에 대한 감형 및 복권은 대통령이 한\n다고 규정하고 있으며, 그 대상 범죄 등에 대해서는 특별한 제한을 두\n고 있지 않음.\n이처럼 대통령의 특별사면을 제한하는 규정이 없어 헌정질서를 위\n협하는 내란죄 및 반란죄 등을 획책하고 실행한 경우에도 특별사면이\n가능하다는 지적이 있음.\n이에 「형법」상 내란의 우두머리 및 내란 중요 임무 종사자와\n「군형법」상 반란수괴 및 반란 중요 임무 종사자에 대해서는 특별사\n면을 할 수 없도록 하여, 헌정을 붕괴시키고 주권자의 생명을 위협하\n려는 국헌문란 행위는 반드시 단죄된다는 법원칙을 확고히 하려는 것\n임(안 제5조의2 신설).\n\n\n\n\n법률 제 호\n사면법 일부개정법률안\n사면법 일부를 다음과 같이 개정한다.\n제5조의2를 다음과 같이 신설한다.\n제5조의2(특별사면의 제한) 특별사면은 「형법」 제87조제1호ㆍ제2호\n또는 「군형법」 제5조제1호ㆍ제2호의 죄로 형을 선고받은 자에 대\n하여는 하지 아니한다.\n부 칙\n이 법은 공포 후 3개월이 경과한 날부터 시행한다.\n\n\n\n\n신ㆍ구조문대비표\n현 행 개 정 안\n<신 설> 제5조의2(특별사면의 제한) 특별\n사면은 「형법」 제87조제1호\nㆍ제2호 또는 「군형법」 제5\n조제1호ㆍ제2호의 죄로 형을\n선고받은 자에 대하여는 하지\n아니한다.\n",
  "sections": {
    "제안이유": "및",
    "주요내용": "현행법은 특별사면, 특정한 자에 대한 감형 및 복권은 대통령이 한\n다고 규정하고 있으며, 그 대상 범죄 등에 대해서는 특별한 제한을 두\n고 있지 않음.\n이처럼 대통령의 특별사면을 제한하는 규정이 없어 헌정질서를 위\n협하는 내란죄 및 반란죄 등을 획책하고 실행한 경우에도 특별사면이\n가능하다는 지적이 있음.\n이에 「형법」상 내란의 우두머리 및 내란 중요 임무 종사자와\n「군형법」상 반란수괴 및 반란 중요 임무 종사자에 대해서는 특별사\n면을 할 수 없도록 하여, 헌정을 붕괴시키고 주권자의 생명을 위협하\n려는 국헌문란 행위는 반드시 단죄된다는 법원칙을 확고히 하려는 것\n임(안 제5조의2 신설).",
    "제안이유_및_주요내용": "현행법은 특별사면, 특정한 자에 대한 감형 및 복권은 대통령이 한\n다고 규정하고 있으며, 그 대상 범죄 등에 대해서는 특별한 제한을 두\n고 있지 않음.\n이처럼 대통령의 특별사면을 제한하는 규정이 없어 헌정질서를 위\n협하는 내란죄 및 반란죄 등을 획책하고 실행한 경우에도 특별사면이\n가능하다는 지적이 있음.\n이에 「형법」상 내란의 우두머리 및 내란 중요 임무 종사자와\n「군형법」상 반란수괴 및 반란 중요 임무 종사자에 대해서는 특별사\n면을 할 수 없도록 하여, 헌정을 붕괴시키고 주권자의 생명을 위협하\n려는 국헌문란 행위는 반드시 단죄된다는 법원칙을 확고히 하려는 것\n임(안 제5조의2 신설).",
    "법률_제_호": "사면법 일부개정법률안\n사면법 일부를 다음과 같이 개정한다.\n제5조의2를 다음과 같이 신설한다.\n제5조의2(특별사면의 제한) 특별사면은 「형법」 제87조제1호ㆍ제2호\n또는 「군형법」 제5조제1호ㆍ제2호의 죄로 형을 선고받은 자에 대\n하여는 하지 아니한다.",
    "신구조문대비표": "현 행 개 정 안\n<신 설> 제5조의2(특별사면의 제한) 특별\n사면은 「형법」 제87조제1호\nㆍ제2호 또는 「군형법」 제5\n조제1호ㆍ제2호의 죄로 형을\n선고받은 자에 대하여는 하지\n아니한다."
  }
}