{
  "title": "2206479_국가공무원법_일부개정법률안",
  "bill_number": "6479",
  "proposal_date": "2024. 12. 13.",
  "submission_date": "",
  "is_alternative": false,
  "alternative_bill_numbers": [],
  "has_comparison_table": false,
  "comparison_table": "신ㆍ구조문대비표\n현 행 개 정 안\n<신 설> 제47조의2(권한행사가 정지된 공\n무원의 보수) 탄핵소추의 의결\n을 받는 등 본인의 귀책사유로\n인하여 권한 행사가 정지된 자\n는 그 기간동안 보수 전액을\n감한다.",
  "full_text": "국가공무원법 일부개정법률안\n(김태년의원 대표발의)\n발의연월일 : 2024. 12. 13.\n의 안\n6479\n번 호 발 의 자 : 김태년ㆍ황명선ㆍ김남근\n이훈기ㆍ채현일ㆍ김태선\n김한규ㆍ김현정ㆍ김영배\n염태영 의원(10인)\n제안이유 및 주요내용\n현행법은 공무원의 보수 결정 원칙에 관한 사항을 규정함으로써 공\n무원이 직무의 곤란성과 책임에 맞는 보수를 지급받을 수 있도록 하\n고 있음.\n그런데 탄핵소추의 의결을 받아 그 권한 행사가 정지된 자의 경우,\n관련 직무에서 배제되어 직무 수행을 하고 있지 않음에도 불구하고\n근거 규정의 미비로 보수를 지급받고 있다는 지적이 있음.\n이에 탄핵소추의 의결을 받는 등 본인의 귀책사유로 인해 직무가\n정지된 자는 그 기간동안 보수 전액을 감하도록 하여 직무 수행 정도\n에 맞는 보수 지급을 하려는 것임(안 제47조의2 신설).\n\n\n\n\n법률 제 호\n국가공무원법 일부개정법률안\n국가공무원법 일부를 다음과 같이 개정한다.\n제47조의2를 다음과 같이 신설한다.\n제47조의2(권한행사가 정지된 공무원의 보수) 탄핵소추의 의결을 받는\n등 본인의 귀책사유로 인하여 권한 행사가 정지된 자는 그 기간동\n안 보수 전액을 감한다.\n부 칙\n제1조(시행일) 이 법은 공포한 날부터 시행한다.\n제2조(보수 감액에 관한 적용례) 제47조의2의 개정규정은 이 법 시행\n당시 탄핵 절차가 진행 중인 경우에 대하여도 적용한다.\n\n\n\n\n신ㆍ구조문대비표\n현 행 개 정 안\n<신 설> 제47조의2(권한행사가 정지된 공\n무원의 보수) 탄핵소추의 의결\n을 받는 등 본인의 귀책사유로\n인하여 권한 행사가 정지된 자\n는 그 기간동안 보수 전액을\n감한다.\n",
  "sections": {
    "제안이유": "및",
    "주요내용": "현행법은 공무원의 보수 결정 원칙에 관한 사항을 규정함으로써 공\n무원이 직무의 곤란성과 책임에 맞는 보수를 지급받을 수 있도록 하\n고 있음.\n그런데 탄핵소추의 의결을 받아 그 권한 행사가 정지된 자의 경우,\n관련 직무에서 배제되어 직무 수행을 하고 있지 않음에도 불구하고\n근거 규정의 미비로 보수를 지급받고 있다는 지적이 있음.\n이에 탄핵소추의 의결을 받는 등 본인의 귀책사유로 인해 직무가\n정지된 자는 그 기간동안 보수 전액을 감하도록 하여 직무 수행 정도\n에 맞는 보수 지급을 하려는 것임(안 제47조의2 신설).",
    "제안이유_및_주요내용": "현행법은 공무원의 보수 결정 원칙에 관한 사항을 규정함으로써 공\n무원이 직무의 곤란성과 책임에 맞는 보수를 지급받을 수 있도록 하\n고 있음.\n그런데 탄핵소추의 의결을 받아 그 권한 행사가 정지된 자의 경우,\n관련 직무에서 배제되어 직무 수행을 하고 있지 않음에도 불구하고\n근거 규정의 미비로 보수를 지급받고 있다는 지적이 있음.\n이에 탄핵소추의 의결을 받는 등 본인의 귀책사유로 인해 직무가\n정지된 자는 그 기간동안 보수 전액을 감하도록 하여 직무 수행 정도\n에 맞는 보수 지급을 하려는 것임(안 제47조의2 신설).",
    "법률_제_호": "국가공무원법 일부개정법률안\n국가공무원법 일부를 다음과 같이 개정한다.\n제47조의2를 다음과 같이 신설한다.\n제47조의2(권한행사가 정지된 공무원의 보수) 탄핵소추의 의결을 받는\n등 본인의 귀책사유로 인하여 권한 행사가 정지된 자는 그 기간동\n안 보수 전액을 감한다.",
    "신구조문대비표": "현 행 개 정 안\n<신 설> 제47조의2(권한행사가 정지된 공\n무원의 보수) 탄핵소추의 의결\n을 받는 등 본인의 귀책사유로\n인하여 권한 행사가 정지된 자\n는 그 기간동안 보수 전액을\n감한다."
  }
}