{
  "title": "2206962_기후·기후변화_감시_및_예측_등에_관한_법률_일부개정법률안",
  "bill_number": "6962",
  "proposal_date": "2024. 12. 26.",
  "submission_date": "",
  "is_alternative": false,
  "alternative_bill_numbers": [],
  "has_comparison_table": false,
  "comparison_table": "신ㆍ구조문대비표\n현 행 개 정 안\n제9조(국가 기후변화 표준 시나 제9조(국가 기후변화 표준 시나\n리오의 생산 등) ① ∼ ④ (생 리오의 생산 등) ① ∼ ④ (현\n략) 행과 같음)\n<신 설> ⑤ 기상청장은 대통령령으로\n정하는 바에 따라 매년 표준시\n나리오의 활용에 관한 실태조\n사를 실시하고 국회에 보고하\n여야 한다.",
  "full_text": "기후ㆍ기후변화 감시 및 예측 등에 관한 법률\n일부개정법률안\n(박해철의원 대표발의)\n발의연월일 : 2024. 12. 26.\n의 안\n6962\n번 호 발 의 자 : 박해철ㆍ조계원ㆍ정태호\n서영석ㆍ이성윤ㆍ추미애\n한민수ㆍ송옥주ㆍ강선우\n복기왕 의원(10인)\n제안이유 및 주요내용\n국가 기후변화 표준 시나리오(이하 “표준 시나리오”라고 한다.)란 기\n후변화의 미래 진행 양상을 파악ㆍ분석한 기후변화 예측 정보로서, 현\n행법은 기상청장으로 하여금 이와 같은 표준 시나리오를 생산하고 널\n리 보급하며 사회 각 분야에서 활용을 촉진하도록 하고 있음.\n그러나 이와 같은 표준 시나리오가 어떻게 활용되고 사용이 촉진되\n었는지 그 활용 실태를 알 수 없기 때문에, 이에 대한 현황 파악과 감\n독이 필요하다는 지적이 있음.\n이에 기상청장으로 하여금 시행령에 따른 표준시나리오의 활용에\n관한 실태조사를 수행할 수 있도록 하고, 이를 매년 국회에 보고할 수\n있도록 해서 표준시나리오의 활용도를 높이고자 하는 것임(안 제9조제\n5항 신설).\n\n\n\n\n법률 제 호\n기후ㆍ기후변화 감시 및 예측 등에 관한 법률\n일부개정법률안\n기후ㆍ기후변화 감시 및 예측 등에 관한 법률 일부를 다음과 같이 개\n정한다.\n제9조에 제5항을 다음과 같이 신설한다.\n⑤ 기상청장은 대통령령으로 정하는 바에 따라 매년 표준시나리오\n의 활용에 관한 실태조사를 실시하고 국회에 보고하여야 한다.\n부 칙\n이 법은 공포 후 6개월이 경과한 날부터 시행한다.\n\n\n\n\n신ㆍ구조문대비표\n현 행 개 정 안\n제9조(국가 기후변화 표준 시나 제9조(국가 기후변화 표준 시나\n리오의 생산 등) ① ∼ ④ (생 리오의 생산 등) ① ∼ ④ (현\n략) 행과 같음)\n<신 설> ⑤ 기상청장은 대통령령으로\n정하는 바에 따라 매년 표준시\n나리오의 활용에 관한 실태조\n사를 실시하고 국회에 보고하\n여야 한다.\n",
  "sections": {
    "제안이유": "및",
    "주요내용": "국가 기후변화 표준 시나리오(이하 “표준 시나리오”라고 한다.)란 기\n후변화의 미래 진행 양상을 파악ㆍ분석한 기후변화 예측 정보로서, 현\n행법은 기상청장으로 하여금 이와 같은 표준 시나리오를 생산하고 널\n리 보급하며 사회 각 분야에서 활용을 촉진하도록 하고 있음.\n그러나 이와 같은 표준 시나리오가 어떻게 활용되고 사용이 촉진되\n었는지 그 활용 실태를 알 수 없기 때문에, 이에 대한 현황 파악과 감\n독이 필요하다는 지적이 있음.\n이에 기상청장으로 하여금 시행령에 따른 표준시나리오의 활용에\n관한 실태조사를 수행할 수 있도록 하고, 이를 매년 국회에 보고할 수\n있도록 해서 표준시나리오의 활용도를 높이고자 하는 것임(안 제9조제\n5항 신설).",
    "제안이유_및_주요내용": "국가 기후변화 표준 시나리오(이하 “표준 시나리오”라고 한다.)란 기\n후변화의 미래 진행 양상을 파악ㆍ분석한 기후변화 예측 정보로서, 현\n행법은 기상청장으로 하여금 이와 같은 표준 시나리오를 생산하고 널\n리 보급하며 사회 각 분야에서 활용을 촉진하도록 하고 있음.\n그러나 이와 같은 표준 시나리오가 어떻게 활용되고 사용이 촉진되\n었는지 그 활용 실태를 알 수 없기 때문에, 이에 대한 현황 파악과 감\n독이 필요하다는 지적이 있음.\n이에 기상청장으로 하여금 시행령에 따른 표준시나리오의 활용에\n관한 실태조사를 수행할 수 있도록 하고, 이를 매년 국회에 보고할 수\n있도록 해서 표준시나리오의 활용도를 높이고자 하는 것임(안 제9조제\n5항 신설).",
    "법률_제_호": "기후ㆍ기후변화 감시 및 예측 등에 관한 법률\n일부개정법률안\n기후ㆍ기후변화 감시 및 예측 등에 관한 법률 일부를 다음과 같이 개\n정한다.\n제9조에 제5항을 다음과 같이 신설한다.\n⑤ 기상청장은 대통령령으로 정하는 바에 따라 매년 표준시나리오\n의 활용에 관한 실태조사를 실시하고 국회에 보고하여야 한다.",
    "신구조문대비표": "현 행 개 정 안\n제9조(국가 기후변화 표준 시나 제9조(국가 기후변화 표준 시나\n리오의 생산 등) ① ∼ ④ (생 리오의 생산 등) ① ∼ ④ (현\n략) 행과 같음)\n<신 설> ⑤ 기상청장은 대통령령으로\n정하는 바에 따라 매년 표준시\n나리오의 활용에 관한 실태조\n사를 실시하고 국회에 보고하\n여야 한다."
  }
}