{
  "title": "2206374_계엄법_일부개정법률안",
  "bill_number": "6374",
  "proposal_date": "2024. 12. 10.",
  "submission_date": "",
  "is_alternative": false,
  "alternative_bill_numbers": [],
  "has_comparison_table": false,
  "comparison_table": "신ㆍ구조문대비표\n현 행 개 정 안\n<신 설> 제4조의2(계엄 선포의 효력 상실)\n대통령은 계엄이 선포된 때로\n부터 48시간 이내에 국회 재적\n의원 과반수의 찬성으로 국회\n의 동의를 받아야 하며, 국회의\n동의를 받지 못한 경우 계엄\n선포는 효력을 상실한다.",
  "full_text": "계엄법 일부개정법률안\n(이해식의원 대표발의)\n발의연월일 : 2024. 12. 10.\n의 안\n6374\n번 호 발 의 자 : 이해식ㆍ서영교ㆍ한민수\n채현일ㆍ박해철ㆍ박용갑\n박상혁ㆍ박정현ㆍ염태영\n서영석 의원(10인)\n제안이유 및 주요내용\n현행법은 대통령이 전시ㆍ사변 또는 이에 준하는 국가비상사태 시\n계엄을 선포할 수 있도록 하고, 계엄 상황이 평상상태로 회복되거나\n국회가 계엄의 해제를 요구한 경우에는 대통령이 계엄을 해제하도록\n하고 있음.\n그러나 국회가 본회의를 개의할 수 없는 등 국회의 계엄 해제 요구\n가 불가능한 상황이 발생할 우려가 있으므로 계엄 선포에 대한 국회\n의 동의가 없는 경우에는 계엄 선포의 효력이 자동적으로 상실되도록\n하는 규정을 보완할 필요가 있다는 지적이 있음.\n이에 대통령은 계엄 선포 후 48시간 이내에 국회 재적의원 과반수\n의 찬성으로 국회의 동의를 받도록 하고, 국회의 동의를 받지 못한 경\n우 계엄 선포의 효력이 상실되도록 함으로써 계엄 선포에 대한 국회\n의 사후적 통제를 강화하려는 것임(안 제4조의2 신설).\n\n\n\n\n법률 제 호\n계엄법 일부개정법률안\n계엄법 일부를 다음과 같이 개정한다.\n제4조의2를 다음과 같이 신설한다.\n제4조의2(계엄 선포의 효력 상실) 대통령은 계엄이 선포된 때로부터\n48시간 이내에 국회 재적의원 과반수의 찬성으로 국회의 동의를 받\n아야 하며, 국회의 동의를 받지 못한 경우 계엄 선포는 효력을 상실\n한다.\n부 칙\n이 법은 공포한 날부터 시행한다.\n\n\n\n\n신ㆍ구조문대비표\n현 행 개 정 안\n<신 설> 제4조의2(계엄 선포의 효력 상실)\n대통령은 계엄이 선포된 때로\n부터 48시간 이내에 국회 재적\n의원 과반수의 찬성으로 국회\n의 동의를 받아야 하며, 국회의\n동의를 받지 못한 경우 계엄\n선포는 효력을 상실한다.\n",
  "sections": {
    "제안이유": "및",
    "주요내용": "현행법은 대통령이 전시ㆍ사변 또는 이에 준하는 국가비상사태 시\n계엄을 선포할 수 있도록 하고, 계엄 상황이 평상상태로 회복되거나\n국회가 계엄의 해제를 요구한 경우에는 대통령이 계엄을 해제하도록\n하고 있음.\n그러나 국회가 본회의를 개의할 수 없는 등 국회의 계엄 해제 요구\n가 불가능한 상황이 발생할 우려가 있으므로 계엄 선포에 대한 국회\n의 동의가 없는 경우에는 계엄 선포의 효력이 자동적으로 상실되도록\n하는 규정을 보완할 필요가 있다는 지적이 있음.\n이에 대통령은 계엄 선포 후 48시간 이내에 국회 재적의원 과반수\n의 찬성으로 국회의 동의를 받도록 하고, 국회의 동의를 받지 못한 경\n우 계엄 선포의 효력이 상실되도록 함으로써 계엄 선포에 대한 국회\n의 사후적 통제를 강화하려는 것임(안 제4조의2 신설).",
    "제안이유_및_주요내용": "현행법은 대통령이 전시ㆍ사변 또는 이에 준하는 국가비상사태 시\n계엄을 선포할 수 있도록 하고, 계엄 상황이 평상상태로 회복되거나\n국회가 계엄의 해제를 요구한 경우에는 대통령이 계엄을 해제하도록\n하고 있음.\n그러나 국회가 본회의를 개의할 수 없는 등 국회의 계엄 해제 요구\n가 불가능한 상황이 발생할 우려가 있으므로 계엄 선포에 대한 국회\n의 동의가 없는 경우에는 계엄 선포의 효력이 자동적으로 상실되도록\n하는 규정을 보완할 필요가 있다는 지적이 있음.\n이에 대통령은 계엄 선포 후 48시간 이내에 국회 재적의원 과반수\n의 찬성으로 국회의 동의를 받도록 하고, 국회의 동의를 받지 못한 경\n우 계엄 선포의 효력이 상실되도록 함으로써 계엄 선포에 대한 국회\n의 사후적 통제를 강화하려는 것임(안 제4조의2 신설).",
    "법률_제_호": "계엄법 일부개정법률안\n계엄법 일부를 다음과 같이 개정한다.\n제4조의2를 다음과 같이 신설한다.\n제4조의2(계엄 선포의 효력 상실) 대통령은 계엄이 선포된 때로부터\n48시간 이내에 국회 재적의원 과반수의 찬성으로 국회의 동의를 받\n아야 하며, 국회의 동의를 받지 못한 경우 계엄 선포는 효력을 상실\n한다.",
    "신구조문대비표": "현 행 개 정 안\n<신 설> 제4조의2(계엄 선포의 효력 상실)\n대통령은 계엄이 선포된 때로\n부터 48시간 이내에 국회 재적\n의원 과반수의 찬성으로 국회\n의 동의를 받아야 하며, 국회의\n동의를 받지 못한 경우 계엄\n선포는 효력을 상실한다."
  }
}