{
  "title": "2206711_주택임대차보호법_일부개정법률안",
  "bill_number": "6711",
  "proposal_date": "2024. 12. 19.",
  "submission_date": "",
  "is_alternative": false,
  "alternative_bill_numbers": [],
  "has_comparison_table": false,
  "comparison_table": "신ㆍ구조문대비표\n현 행 개 정 안\n제8조의2(주택임대차위원회) ① 제8조의2(주택임대차위원회) ①\n∼ ④ (생 략) ∼ ④ (현행과 같음)\n<신 설> ⑤ 위원회는 매년 2회 이상 개\n최하여야 한다.\n⑤ (생 략) ⑥ (현행 제5항과 같음)",
  "full_text": "주택임대차보호법 일부개정법률안\n(문진석의원 대표발의)\n발의연월일 : 2024. 12. 19.\n의 안\n6711\n번 호 발 의 자 : 문진석ㆍ이재관ㆍ한정애\n장종태ㆍ이정문ㆍ김동아\n이연희ㆍ김종민ㆍ박용갑\n김문수ㆍ윤호중 의원\n(11인)\n제안이유 및 주요내용\n현행법은 보증금 중 일정액을 다른 담보물권자보다 우선하여 변제\n받을 임차인 및 보증금 중 일정액의 범위와 기준을 심의하기 위하여\n법무부에 주택임대차위원회를 두도록 하고, 대통령령에서 위원회의 회\n의는 매년 1회 개최되는 정기회의와 필요할 때 개최되는 임시회의로\n구분하여 운영하도록 규정하고 있음.\n그런데 주택임대차시장은 경제상황이나 사회적 사건 등의 영향을\n빠르게 반영하며 시세 등이 변동하므로, 주택임대차위원회를 매년 2회\n이상 개최해 시장상황을 최우선변제권의 범위와 내용에 반영해야 한\n다는 의견이 있음.\n이에 주택임대차위원회의 개최 횟수에 관한 내용을 시행령에서 법\n률로 상향하여 입법하며 매년 2회 이상 개최하도록 의무화함으로써\n\n\n\n최우선변제금에 관한 위원회의 결정 내용을 현실화하려는 것임(안 제8\n조의2).\n\n법률 제 호\n주택임대차보호법 일부개정법률안\n주택임대차보호법 일부를 다음과 같이 개정한다.\n제8조의2제5항을 제6항으로 하고, 같은 조에 제5항을 다음과 같이 신\n설한다.\n⑤ 위원회는 매년 2회 이상 개최하여야 한다.\n부 칙\n이 법은 1년이 경과한 날부터 시행한다.\n\n\n\n\n신ㆍ구조문대비표\n현 행 개 정 안\n제8조의2(주택임대차위원회) ① 제8조의2(주택임대차위원회) ①\n∼ ④ (생 략) ∼ ④ (현행과 같음)\n<신 설> ⑤ 위원회는 매년 2회 이상 개\n최하여야 한다.\n⑤ (생 략) ⑥ (현행 제5항과 같음)\n",
  "sections": {
    "제안이유": "및",
    "주요내용": "현행법은 보증금 중 일정액을 다른 담보물권자보다 우선하여 변제\n받을 임차인 및 보증금 중 일정액의 범위와 기준을 심의하기 위하여\n법무부에 주택임대차위원회를 두도록 하고, 대통령령에서 위원회의 회\n의는 매년 1회 개최되는 정기회의와 필요할 때 개최되는 임시회의로\n구분하여 운영하도록 규정하고 있음.\n그런데 주택임대차시장은 경제상황이나 사회적 사건 등의 영향을\n빠르게 반영하며 시세 등이 변동하므로, 주택임대차위원회를 매년 2회\n이상 개최해 시장상황을 최우선변제권의 범위와 내용에 반영해야 한\n다는 의견이 있음.\n이에 주택임대차위원회의 개최 횟수에 관한 내용을 시행령에서 법\n률로 상향하여 입법하며 매년 2회 이상 개최하도록 의무화함으로써\n\n\n\n최우선변제금에 관한 위원회의 결정 내용을 현실화하려는 것임(안 제8\n조의2).",
    "제안이유_및_주요내용": "현행법은 보증금 중 일정액을 다른 담보물권자보다 우선하여 변제\n받을 임차인 및 보증금 중 일정액의 범위와 기준을 심의하기 위하여\n법무부에 주택임대차위원회를 두도록 하고, 대통령령에서 위원회의 회\n의는 매년 1회 개최되는 정기회의와 필요할 때 개최되는 임시회의로\n구분하여 운영하도록 규정하고 있음.\n그런데 주택임대차시장은 경제상황이나 사회적 사건 등의 영향을\n빠르게 반영하며 시세 등이 변동하므로, 주택임대차위원회를 매년 2회\n이상 개최해 시장상황을 최우선변제권의 범위와 내용에 반영해야 한\n다는 의견이 있음.\n이에 주택임대차위원회의 개최 횟수에 관한 내용을 시행령에서 법\n률로 상향하여 입법하며 매년 2회 이상 개최하도록 의무화함으로써\n\n\n\n최우선변제금에 관한 위원회의 결정 내용을 현실화하려는 것임(안 제8\n조의2).",
    "법률_제_호": "주택임대차보호법 일부개정법률안\n주택임대차보호법 일부를 다음과 같이 개정한다.\n제8조의2제5항을 제6항으로 하고, 같은 조에 제5항을 다음과 같이 신\n설한다.\n⑤ 위원회는 매년 2회 이상 개최하여야 한다.",
    "신구조문대비표": "현 행 개 정 안\n제8조의2(주택임대차위원회) ① 제8조의2(주택임대차위원회) ①\n∼ ④ (생 략) ∼ ④ (현행과 같음)\n<신 설> ⑤ 위원회는 매년 2회 이상 개\n최하여야 한다.\n⑤ (생 략) ⑥ (현행 제5항과 같음)"
  }
}