{
  "title": "2206260_접경지역_지원_특별법_일부개정법률안",
  "bill_number": "6260",
  "proposal_date": "2024. 12. 5.",
  "submission_date": "",
  "is_alternative": false,
  "alternative_bill_numbers": [],
  "has_comparison_table": false,
  "comparison_table": "신ㆍ구조문대비표\n현 행 개 정 안\n<신 설> 제27조의2(대남방송으로 인한 피\n해주민 지원) 국가는 북한의\n대남방송으로 인한 소음 등으\n로 피해를 입은 접경지역의 주\n민에 대하여 필요한 지원을 할\n수 있다.",
  "full_text": "접경지역 지원 특별법 일부개정법률안\n(박정의원 대표발의)\n발의연월일 : 2024. 12. 5.\n의 안\n6260\n번 호 발 의 자 : 박 정ㆍ이기헌ㆍ정진욱\n김성원ㆍ허 영ㆍ김영환\n박상혁ㆍ정동영ㆍ박지혜\n정성호ㆍ김주영ㆍ윤후덕\n김성회ㆍ김용태 의원\n(14인)\n제안이유 및 주요내용\n현행법은 남북 분단으로 낙후된 접경지역의 지속가능한 발전에 필\n요한 사항을 규정하여 주민의 복지향상을 지원하도록 하고 있음.\n그런데 최근 남북관계 악화에 따라 북한의 대남방송이 일상화되고,\n이에 따라 접경지역의 주민들이 일상생활이 불가능하다는 고통을 호\n소하는 등의 상황이 발생하고 있음.\n이에 국가는 북한의 대남방송으로 인한 소음 등으로 피해를 입은\n접경지역의 주민에 대하여 필요한 지원을 할 수 있도록 하려는 것임\n(안 제27조의2 신설).\n\n\n\n\n법률 제 호\n접경지역 지원 특별법 일부개정법률안\n접경지역 지원 특별법 일부를 다음과 같이 개정한다.\n제5장에 제27조의2를 다음과 같이 신설한다.\n제27조의2(대남방송으로 인한 피해주민 지원) 국가는 북한의 대남방송\n으로 인한 소음 등으로 피해를 입은 접경지역의 주민에 대하여 필\n요한 지원을 할 수 있다.\n부 칙\n이 법은 공포 후 3개월이 경과한 날부터 시행한다.\n\n\n\n\n신ㆍ구조문대비표\n현 행 개 정 안\n<신 설> 제27조의2(대남방송으로 인한 피\n해주민 지원) 국가는 북한의\n대남방송으로 인한 소음 등으\n로 피해를 입은 접경지역의 주\n민에 대하여 필요한 지원을 할\n수 있다.\n",
  "sections": {
    "제안이유": "및",
    "주요내용": "현행법은 남북 분단으로 낙후된 접경지역의 지속가능한 발전에 필\n요한 사항을 규정하여 주민의 복지향상을 지원하도록 하고 있음.\n그런데 최근 남북관계 악화에 따라 북한의 대남방송이 일상화되고,\n이에 따라 접경지역의 주민들이 일상생활이 불가능하다는 고통을 호\n소하는 등의 상황이 발생하고 있음.\n이에 국가는 북한의 대남방송으로 인한 소음 등으로 피해를 입은\n접경지역의 주민에 대하여 필요한 지원을 할 수 있도록 하려는 것임\n(안 제27조의2 신설).",
    "제안이유_및_주요내용": "현행법은 남북 분단으로 낙후된 접경지역의 지속가능한 발전에 필\n요한 사항을 규정하여 주민의 복지향상을 지원하도록 하고 있음.\n그런데 최근 남북관계 악화에 따라 북한의 대남방송이 일상화되고,\n이에 따라 접경지역의 주민들이 일상생활이 불가능하다는 고통을 호\n소하는 등의 상황이 발생하고 있음.\n이에 국가는 북한의 대남방송으로 인한 소음 등으로 피해를 입은\n접경지역의 주민에 대하여 필요한 지원을 할 수 있도록 하려는 것임\n(안 제27조의2 신설).",
    "법률_제_호": "접경지역 지원 특별법 일부개정법률안\n접경지역 지원 특별법 일부를 다음과 같이 개정한다.\n제5장에 제27조의2를 다음과 같이 신설한다.\n제27조의2(대남방송으로 인한 피해주민 지원) 국가는 북한의 대남방송\n으로 인한 소음 등으로 피해를 입은 접경지역의 주민에 대하여 필\n요한 지원을 할 수 있다.",
    "신구조문대비표": "현 행 개 정 안\n<신 설> 제27조의2(대남방송으로 인한 피\n해주민 지원) 국가는 북한의\n대남방송으로 인한 소음 등으\n로 피해를 입은 접경지역의 주\n민에 대하여 필요한 지원을 할\n수 있다."
  }
}