{
  "title": "2206481_정부조직법_일부개정법률안",
  "bill_number": "6481",
  "proposal_date": "2024. 12. 13.",
  "submission_date": "",
  "is_alternative": false,
  "alternative_bill_numbers": [],
  "has_comparison_table": false,
  "comparison_table": "신ㆍ구조문대비표\n현 행 개 정 안\n제33조(국방부) ① (생 략) 제33조(국방부) ① (현행과 같음)\n<신 설> ② 군인으로서 현역을 면한 날\n로부터 5년이 지나지 아니한\n사람은 국방부장관으로 임명될\n수 없다.\n② ∼ ⑥ (생 략) ③ ∼ ⑦ (현행 제2항부터 제6\n항까지와 같음)",
  "full_text": "정부조직법 일부개정법률안\n(김태년의원 대표발의)\n발의연월일 : 2024. 12. 13.\n의 안\n6481\n번 호 발 의 자 : 김태년ㆍ황명선ㆍ김남근\n이훈기ㆍ채현일ㆍ김태선\n김한규ㆍ김현정ㆍ김영배\n염태영 의원(10인)\n제안이유 및 주요내용\n「대한민국헌법」은 군인은 현역을 면한 후가 아니면 국무위원으로\n임명될 수 없다고 규정하고 있으며, 이에 따라 국방부장관에도 역시\n현역 군인이 임명될 수 없도록 하고 있음.\n그러나 현역을 면한 직후 국무위원으로 임명되는 경우를 배제할 수\n없고, 특히 국방부장관으로 임명될 경우 이에 대한 효과적인 견제가\n어려워 관련 법률을 정비하여야 한다는 지적이 있음.\n이에 군인으로서 현역을 면한 날로부터 5년이 지나지 아니한 사람\n은 국방부장관으로 임명될 수 없도록 하여 중앙행정기관의 공무집행\n의 공정성을 확보하려는 것임(안 제33조).\n\n\n\n\n법률 제 호\n정부조직법 일부개정법률안\n정부조직법 일부를 다음과 같이 개정한다.\n제33조제2항부터 제6항까지를 각각 제3항부터 제7항까지로 하고, 같은\n조에 제2항을 다음과 같이 신설한다.\n② 군인으로서 현역을 면한 날로부터 5년이 지나지 아니한 사람은\n국방부장관으로 임명될 수 없다.\n부 칙\n이 법은 공포한 날부터 시행한다.\n\n\n\n\n신ㆍ구조문대비표\n현 행 개 정 안\n제33조(국방부) ① (생 략) 제33조(국방부) ① (현행과 같음)\n<신 설> ② 군인으로서 현역을 면한 날\n로부터 5년이 지나지 아니한\n사람은 국방부장관으로 임명될\n수 없다.\n② ∼ ⑥ (생 략) ③ ∼ ⑦ (현행 제2항부터 제6\n항까지와 같음)\n",
  "sections": {
    "제안이유": "및",
    "주요내용": "「대한민국헌법」은 군인은 현역을 면한 후가 아니면 국무위원으로\n임명될 수 없다고 규정하고 있으며, 이에 따라 국방부장관에도 역시\n현역 군인이 임명될 수 없도록 하고 있음.\n그러나 현역을 면한 직후 국무위원으로 임명되는 경우를 배제할 수\n없고, 특히 국방부장관으로 임명될 경우 이에 대한 효과적인 견제가\n어려워 관련 법률을 정비하여야 한다는 지적이 있음.\n이에 군인으로서 현역을 면한 날로부터 5년이 지나지 아니한 사람\n은 국방부장관으로 임명될 수 없도록 하여 중앙행정기관의 공무집행\n의 공정성을 확보하려는 것임(안 제33조).",
    "제안이유_및_주요내용": "「대한민국헌법」은 군인은 현역을 면한 후가 아니면 국무위원으로\n임명될 수 없다고 규정하고 있으며, 이에 따라 국방부장관에도 역시\n현역 군인이 임명될 수 없도록 하고 있음.\n그러나 현역을 면한 직후 국무위원으로 임명되는 경우를 배제할 수\n없고, 특히 국방부장관으로 임명될 경우 이에 대한 효과적인 견제가\n어려워 관련 법률을 정비하여야 한다는 지적이 있음.\n이에 군인으로서 현역을 면한 날로부터 5년이 지나지 아니한 사람\n은 국방부장관으로 임명될 수 없도록 하여 중앙행정기관의 공무집행\n의 공정성을 확보하려는 것임(안 제33조).",
    "법률_제_호": "정부조직법 일부개정법률안\n정부조직법 일부를 다음과 같이 개정한다.\n제33조제2항부터 제6항까지를 각각 제3항부터 제7항까지로 하고, 같은\n조에 제2항을 다음과 같이 신설한다.\n② 군인으로서 현역을 면한 날로부터 5년이 지나지 아니한 사람은\n국방부장관으로 임명될 수 없다.",
    "신구조문대비표": "현 행 개 정 안\n제33조(국방부) ① (생 략) 제33조(국방부) ① (현행과 같음)\n<신 설> ② 군인으로서 현역을 면한 날\n로부터 5년이 지나지 아니한\n사람은 국방부장관으로 임명될\n수 없다.\n② ∼ ⑥ (생 략) ③ ∼ ⑦ (현행 제2항부터 제6\n항까지와 같음)"
  }
}