{
  "title": "2206757_유아교육법_일부개정법률안",
  "bill_number": "6757",
  "proposal_date": "2024. 12. 19.",
  "submission_date": "",
  "is_alternative": false,
  "alternative_bill_numbers": [],
  "has_comparison_table": false,
  "comparison_table": "신ㆍ구조문대비표\n현 행 개 정 안\n제15조(특수학교 등) ①ㆍ② (생 제15조(특수학교 등) ①ㆍ② (현\n략) 행과 같음)\n<신 설> ③ 제2항에 따른 통합교육 실\n시를 위하여 유치원에 특수학\n급을 둘 수 있다.\n<신 설> ④ 국가 및 지방자치단체는 제\n3항에 따라 유치원에 특수학급\n을 두는 경우 그 운영에 필요\n한 행정적ㆍ재정적 지원을 할\n수 있다.",
  "full_text": "유아교육법 일부개정법률안\n(강경숙의원 대표발의)\n발의연월일 : 2024. 12. 19.\n의 안\n6757\n번 호 발 의 자 : 강경숙ㆍ차규근ㆍ황운하\n김준형ㆍ정춘생ㆍ김재원\n신장식ㆍ서왕진ㆍ강유정\n백선희ㆍ김선민ㆍ김문수\n진선미ㆍ고민정ㆍ문정복\n의원(15인)\n제안이유 및 주요내용\n「초ㆍ중등교육법」 제55조와 제56조는 특수교육이 필요한 학생을\n위한 특수학교와 특수학급의 설치 근거를 규정하고 있음.\n그러나 통합교육을 위하여 특수교육이 필요한 유아 대다수가 일반\n유치원에 배치되고 있음에도 불구하고, 유치원에 특수학급을 설치하고\n운영할 법적 근거는 미비한 실정임.\n이에 유치원에 특수학급을 둘 수 있다고 명시하고 특수학급을 두는\n경우에는 국가와 지방자치단체는 운영에 필요한 행정적ㆍ재정적 지원\n을 할 수 있도록 함으로써 특수교육이 필요한 유아가 통합교육을 통\n해 사회성을 함양하고 개개인에게 적합한 교육을 받게 하려는 것임(안\n제15조제3항 및 제4항 신설).\n\n\n\n\n법률 제 호\n유아교육법 일부개정법률안\n유아교육법 일부를 다음과 같이 개정한다.\n제15조에 제3항 및 제4항을 각각 다음과 같이 신설한다.\n③ 제2항에 따른 통합교육 실시를 위하여 유치원에 특수학급을 둘\n수 있다.\n④ 국가 및 지방자치단체는 제3항에 따라 유치원에 특수학급을 두\n는 경우 그 운영에 필요한 행정적ㆍ재정적 지원을 할 수 있다.\n부 칙\n이 법은 공포 후 6개월이 경과한 날부터 시행한다.\n\n\n\n\n신ㆍ구조문대비표\n현 행 개 정 안\n제15조(특수학교 등) ①ㆍ② (생 제15조(특수학교 등) ①ㆍ② (현\n략) 행과 같음)\n<신 설> ③ 제2항에 따른 통합교육 실\n시를 위하여 유치원에 특수학\n급을 둘 수 있다.\n<신 설> ④ 국가 및 지방자치단체는 제\n3항에 따라 유치원에 특수학급\n을 두는 경우 그 운영에 필요\n한 행정적ㆍ재정적 지원을 할\n수 있다.\n",
  "sections": {
    "제안이유": "및",
    "주요내용": "「초ㆍ중등교육법」 제55조와 제56조는 특수교육이 필요한 학생을\n위한 특수학교와 특수학급의 설치 근거를 규정하고 있음.\n그러나 통합교육을 위하여 특수교육이 필요한 유아 대다수가 일반\n유치원에 배치되고 있음에도 불구하고, 유치원에 특수학급을 설치하고\n운영할 법적 근거는 미비한 실정임.\n이에 유치원에 특수학급을 둘 수 있다고 명시하고 특수학급을 두는\n경우에는 국가와 지방자치단체는 운영에 필요한 행정적ㆍ재정적 지원\n을 할 수 있도록 함으로써 특수교육이 필요한 유아가 통합교육을 통\n해 사회성을 함양하고 개개인에게 적합한 교육을 받게 하려는 것임(안\n제15조제3항 및 제4항 신설).",
    "제안이유_및_주요내용": "「초ㆍ중등교육법」 제55조와 제56조는 특수교육이 필요한 학생을\n위한 특수학교와 특수학급의 설치 근거를 규정하고 있음.\n그러나 통합교육을 위하여 특수교육이 필요한 유아 대다수가 일반\n유치원에 배치되고 있음에도 불구하고, 유치원에 특수학급을 설치하고\n운영할 법적 근거는 미비한 실정임.\n이에 유치원에 특수학급을 둘 수 있다고 명시하고 특수학급을 두는\n경우에는 국가와 지방자치단체는 운영에 필요한 행정적ㆍ재정적 지원\n을 할 수 있도록 함으로써 특수교육이 필요한 유아가 통합교육을 통\n해 사회성을 함양하고 개개인에게 적합한 교육을 받게 하려는 것임(안\n제15조제3항 및 제4항 신설).",
    "법률_제_호": "유아교육법 일부개정법률안\n유아교육법 일부를 다음과 같이 개정한다.\n제15조에 제3항 및 제4항을 각각 다음과 같이 신설한다.\n③ 제2항에 따른 통합교육 실시를 위하여 유치원에 특수학급을 둘\n수 있다.\n④ 국가 및 지방자치단체는 제3항에 따라 유치원에 특수학급을 두\n는 경우 그 운영에 필요한 행정적ㆍ재정적 지원을 할 수 있다.",
    "신구조문대비표": "현 행 개 정 안\n제15조(특수학교 등) ①ㆍ② (생 제15조(특수학교 등) ①ㆍ② (현\n략) 행과 같음)\n<신 설> ③ 제2항에 따른 통합교육 실\n시를 위하여 유치원에 특수학\n급을 둘 수 있다.\n<신 설> ④ 국가 및 지방자치단체는 제\n3항에 따라 유치원에 특수학급\n을 두는 경우 그 운영에 필요\n한 행정적ㆍ재정적 지원을 할\n수 있다."
  }
}