{
  "title": "2206367_계엄법_일부개정법률안",
  "bill_number": "6367",
  "proposal_date": "2024. 12. 10.",
  "submission_date": "",
  "is_alternative": false,
  "alternative_bill_numbers": [],
  "has_comparison_table": false,
  "comparison_table": "신ㆍ구조문대비표\n현 행 개 정 안\n제13조(국회의원의 불체포특권) 제13조(국회의원의 불체포특권\n(생 략) 등) ① (현행 제목 외의 부분\n과 같음)\n<신 설> ② 계엄 시행 중에도 국회의원\n의 국회 출입을 저지 또는 방\n해하는 행위를 하여서는 아니\n된다.",
  "full_text": "계엄법 일부개정법률안\n(이용우의원 대표발의)\n발의연월일 : 2024. 12. 10.\n의 안\n6367\n번 호 발 의 자 : 이용우ㆍ모경종ㆍ이원택\n진선미ㆍ민병덕ㆍ김한규\n김교흥ㆍ박정현ㆍ박주민\n백승아ㆍ백혜련 의원\n(11인)\n제안이유 및 주요내용\n최근 있었던 비상계엄 상황에서 계엄 해제를 위한 국회 개의가 있\n었음에도 불구하고 국회의원이 국회 출입을 저지당하는 사건이 발생\n했음.\n이때문에 다수의 국회의원은 물론 심지어 국회의장도 국회를 월담\n하여 국회에 입장하는 사태가 발생했음.\n이와 같은 사태를 방지하기 위하여 계엄 시행 중에도 국회의원의\n국회 출입을 저지 또는 방해하는 행위를 하여서는 아니된다는 규정을\n신설하고자 함(안 제13조제2항 등).\n\n\n\n\n법률 제 호\n계엄법 일부개정법률안\n계엄법 일부를 다음과 같이 개정한다.\n제13조의 제목 “(국회의원의 불체포특권)”을 “(국회의원의 불체포특권\n등)”으로 하고, 같은 조 제목 외의 부분을 제1항으로 하며, 같은 조에\n제2항을 다음과 같이 신설한다.\n② 계엄 시행 중에도 국회의원의 국회 출입을 저지 또는 방해하는\n행위를 하여서는 아니된다.\n부 칙\n이 법은 공포한 날부터 시행한다.\n\n\n\n\n신ㆍ구조문대비표\n현 행 개 정 안\n제13조(국회의원의 불체포특권) 제13조(국회의원의 불체포특권\n(생 략) 등) ① (현행 제목 외의 부분\n과 같음)\n<신 설> ② 계엄 시행 중에도 국회의원\n의 국회 출입을 저지 또는 방\n해하는 행위를 하여서는 아니\n된다.\n",
  "sections": {
    "제안이유": "및",
    "주요내용": "최근 있었던 비상계엄 상황에서 계엄 해제를 위한 국회 개의가 있\n었음에도 불구하고 국회의원이 국회 출입을 저지당하는 사건이 발생\n했음.\n이때문에 다수의 국회의원은 물론 심지어 국회의장도 국회를 월담\n하여 국회에 입장하는 사태가 발생했음.\n이와 같은 사태를 방지하기 위하여 계엄 시행 중에도 국회의원의\n국회 출입을 저지 또는 방해하는 행위를 하여서는 아니된다는 규정을\n신설하고자 함(안 제13조제2항 등).",
    "제안이유_및_주요내용": "최근 있었던 비상계엄 상황에서 계엄 해제를 위한 국회 개의가 있\n었음에도 불구하고 국회의원이 국회 출입을 저지당하는 사건이 발생\n했음.\n이때문에 다수의 국회의원은 물론 심지어 국회의장도 국회를 월담\n하여 국회에 입장하는 사태가 발생했음.\n이와 같은 사태를 방지하기 위하여 계엄 시행 중에도 국회의원의\n국회 출입을 저지 또는 방해하는 행위를 하여서는 아니된다는 규정을\n신설하고자 함(안 제13조제2항 등).",
    "법률_제_호": "계엄법 일부개정법률안\n계엄법 일부를 다음과 같이 개정한다.\n제13조의 제목 “(국회의원의 불체포특권)”을 “(국회의원의 불체포특권\n등)”으로 하고, 같은 조 제목 외의 부분을 제1항으로 하며, 같은 조에\n제2항을 다음과 같이 신설한다.\n② 계엄 시행 중에도 국회의원의 국회 출입을 저지 또는 방해하는\n행위를 하여서는 아니된다.",
    "신구조문대비표": "현 행 개 정 안\n제13조(국회의원의 불체포특권) 제13조(국회의원의 불체포특권\n(생 략) 등) ① (현행 제목 외의 부분\n과 같음)\n<신 설> ② 계엄 시행 중에도 국회의원\n의 국회 출입을 저지 또는 방\n해하는 행위를 하여서는 아니\n된다."
  }
}