{
  "title": "2206420_계엄법_일부개정법률안",
  "bill_number": "6420",
  "proposal_date": "2024. 12. 12.",
  "submission_date": "",
  "is_alternative": false,
  "alternative_bill_numbers": [],
  "has_comparison_table": false,
  "comparison_table": "신ㆍ구조문대비표\n현 행 개 정 안\n제2조(계엄의 종류와 선포 등) ① 제2조(계엄의 종류와 선포 등) ①\n∼ ⑤ (생 략) ∼ ⑤ (현행과 같음)\n⑥ 국방부장관 또는 행정안전 <삭 제>\n부장관은 제2항 또는 제3항에\n해당하는 사유가 발생한 경우\n에는 국무총리를 거쳐 대통령\n에게 계엄의 선포를 건의할 수\n있다.",
  "full_text": "계엄법 일부개정법률안\n(모경종의원 대표발의)\n발의연월일 : 2024. 12. 12.\n의 안\n6420\n번 호 발 의 자 : 모경종ㆍ김 윤ㆍ이광희\n김우영ㆍ김한규ㆍ김교흥\n남인순ㆍ이재강ㆍ김원이\n진선미 의원(10인)\n제안이유 및 주요내용\n현행 「계엄법」은 국방부장관과 행정안전부장관의 계엄선포건의권\n을 규정하고 있음. 최근 윤석열 대통령의 비상계엄이 선포되었고, 해\n당 계엄은 김용현 국방부장관의 건의로 선포된 것으로 알려져 있음.\n그러나 대통령이 실질적 국정통제권을 행사하지 못하는 상황에서는\n국방부장관이 대통령에게 강압으로 계엄선포를 건의하고, 대통령이 그\n에 의해 계엄을 선포하는 사례가 발생할 수 있음. 또한 이 경우 헌법\n상 대통령 고유권한인 계엄선포권이 침해될 우려가 있음.\n이에 「계엄법」에 명시되어 있는 국방부장관과 행정안전부장관의\n계엄선포건의권을 삭제하여 계엄선포의 최종 결정권이 대통령에게 있\n음을 명확히 하고, 부당한 영향력 행사 가능성을 차단하려는 것임(안\n제2조제6항 삭제).\n\n\n\n\n법률 제 호\n계엄법 일부개정법률안\n계엄법 일부를 다음과 같이 개정한다.\n제2조제6항을 삭제한다.\n부 칙\n이 법은 공포한 날부터 시행한다.\n\n\n\n\n신ㆍ구조문대비표\n현 행 개 정 안\n제2조(계엄의 종류와 선포 등) ① 제2조(계엄의 종류와 선포 등) ①\n∼ ⑤ (생 략) ∼ ⑤ (현행과 같음)\n⑥ 국방부장관 또는 행정안전 <삭 제>\n부장관은 제2항 또는 제3항에\n해당하는 사유가 발생한 경우\n에는 국무총리를 거쳐 대통령\n에게 계엄의 선포를 건의할 수\n있다.\n",
  "sections": {
    "제안이유": "및",
    "주요내용": "현행 「계엄법」은 국방부장관과 행정안전부장관의 계엄선포건의권\n을 규정하고 있음. 최근 윤석열 대통령의 비상계엄이 선포되었고, 해\n당 계엄은 김용현 국방부장관의 건의로 선포된 것으로 알려져 있음.\n그러나 대통령이 실질적 국정통제권을 행사하지 못하는 상황에서는\n국방부장관이 대통령에게 강압으로 계엄선포를 건의하고, 대통령이 그\n에 의해 계엄을 선포하는 사례가 발생할 수 있음. 또한 이 경우 헌법\n상 대통령 고유권한인 계엄선포권이 침해될 우려가 있음.\n이에 「계엄법」에 명시되어 있는 국방부장관과 행정안전부장관의\n계엄선포건의권을 삭제하여 계엄선포의 최종 결정권이 대통령에게 있\n음을 명확히 하고, 부당한 영향력 행사 가능성을 차단하려는 것임(안\n제2조제6항 삭제).",
    "제안이유_및_주요내용": "현행 「계엄법」은 국방부장관과 행정안전부장관의 계엄선포건의권\n을 규정하고 있음. 최근 윤석열 대통령의 비상계엄이 선포되었고, 해\n당 계엄은 김용현 국방부장관의 건의로 선포된 것으로 알려져 있음.\n그러나 대통령이 실질적 국정통제권을 행사하지 못하는 상황에서는\n국방부장관이 대통령에게 강압으로 계엄선포를 건의하고, 대통령이 그\n에 의해 계엄을 선포하는 사례가 발생할 수 있음. 또한 이 경우 헌법\n상 대통령 고유권한인 계엄선포권이 침해될 우려가 있음.\n이에 「계엄법」에 명시되어 있는 국방부장관과 행정안전부장관의\n계엄선포건의권을 삭제하여 계엄선포의 최종 결정권이 대통령에게 있\n음을 명확히 하고, 부당한 영향력 행사 가능성을 차단하려는 것임(안\n제2조제6항 삭제).",
    "법률_제_호": "계엄법 일부개정법률안\n계엄법 일부를 다음과 같이 개정한다.\n제2조제6항을 삭제한다.",
    "신구조문대비표": "현 행 개 정 안\n제2조(계엄의 종류와 선포 등) ① 제2조(계엄의 종류와 선포 등) ①\n∼ ⑤ (생 략) ∼ ⑤ (현행과 같음)\n⑥ 국방부장관 또는 행정안전 <삭 제>\n부장관은 제2항 또는 제3항에\n해당하는 사유가 발생한 경우\n에는 국무총리를 거쳐 대통령\n에게 계엄의 선포를 건의할 수\n있다."
  }
}