{
  "title": "2206683_공휴일에_관한_법률_일부개정법률안",
  "bill_number": "6683",
  "proposal_date": "2024. 12. 18.",
  "submission_date": "",
  "is_alternative": false,
  "alternative_bill_numbers": [],
  "has_comparison_table": false,
  "comparison_table": "신ㆍ구조문대비표\n현 행 개 정 안\n제2조(공휴일) 공휴일은 다음 각 제2조(공휴일) --------------\n호와 같다. -----.\n1. ～ 4. (생 략) 1. ～ 4. (현행과 같음)\n<신 설> 5. 노동절 (5월 1일)\n5. ～ 10. (생 략) 6. ～ 11. (현행 제5호부터 제1\n0호까지와 같음)",
  "full_text": "공휴일에 관한 법률 일부개정법률안\n(박홍배의원 대표발의)\n발의연월일 : 2024. 12. 18.\n의 안\n6683\n번 호 발 의 자 : 박홍배ㆍ윤준병ㆍ정태호\n김재원ㆍ김태년ㆍ김현정\n김우영ㆍ박정현ㆍ서미화\n김민석ㆍ민병덕ㆍ이광희\n이용우ㆍ박지원ㆍ이연희\n박해철ㆍ강훈식ㆍ문진석\n복기왕ㆍ김한규ㆍ한준호\n조승래ㆍ염태영ㆍ정진욱\n의원(24인)\n제안이유 및 주요내용\n현행법은 세계 노동자의 권익 보호와 노동운동의 역사를 기리기 위\n한 메이데이(MAY DAY) 정신에 입각하여 「노동절 제정에 관한 법\n률」에 따라 매년 5월 1일을 노동절(근로자의 날)로 규정하고 「근로\n기준법」에 따른 유급휴일로 지정하고 있음.\n하지만 노동절을 「공휴일에 관한 법률」상 공휴일로 인정하고 있\n지 않게 때문에, 일부 민간기업에서만 자율적으로 휴일을 적용하고,\n공무원을 포함한 관공서는 이를 적용하지 않아 근로자의 날 본연의\n취지와 부합하지 않는 결과를 발생함.\n이에 5월 1일 노동절을 「공휴일에 관한 법률」상의 공휴일로 지정\n\n\n\n하여, 민간과 관공서를 포함한 모든 노동자가 세계 노동운동의 가치와\n정신을 되새길 수 있도록 법적 근거를 마련하고자 함(안 제2조제5호\n신설).\n참고사항\n이 법률안은 박홍배 의원이 대표발의한 「근로자의 날 제정에 관한\n법률」전부개정법률안(의안번호 제6660호)의 의결을 전제로 하는 것이\n므로 같은 법률안이 의결되지 아니하거나 수정의결되는 경우에는 이\n에 맞추어 조정되어야 할 것임.\n\n법률 제 호\n공휴일에 관한 법률 일부개정법률안\n공휴일에 관한 법률 일부를 다음과 같이 개정한다.\n제2조5호부터 제10호까지를 제6호부터 제11호까지로 하고, 같은 조에\n제5호를 다음과 같이 신설한다.\n5. 노동절 (5월 1일)\n부 칙\n이 법은 공포한 날부터 시행한다.\n\n\n\n\n신ㆍ구조문대비표\n현 행 개 정 안\n제2조(공휴일) 공휴일은 다음 각 제2조(공휴일) --------------\n호와 같다. -----.\n1. ～ 4. (생 략) 1. ～ 4. (현행과 같음)\n<신 설> 5. 노동절 (5월 1일)\n5. ～ 10. (생 략) 6. ～ 11. (현행 제5호부터 제1\n0호까지와 같음)\n",
  "sections": {
    "제안이유": "및",
    "주요내용": "현행법은 세계 노동자의 권익 보호와 노동운동의 역사를 기리기 위\n한 메이데이(MAY DAY) 정신에 입각하여 「노동절 제정에 관한 법\n률」에 따라 매년 5월 1일을 노동절(근로자의 날)로 규정하고 「근로\n기준법」에 따른 유급휴일로 지정하고 있음.\n하지만 노동절을 「공휴일에 관한 법률」상 공휴일로 인정하고 있\n지 않게 때문에, 일부 민간기업에서만 자율적으로 휴일을 적용하고,\n공무원을 포함한 관공서는 이를 적용하지 않아 근로자의 날 본연의\n취지와 부합하지 않는 결과를 발생함.\n이에 5월 1일 노동절을 「공휴일에 관한 법률」상의 공휴일로 지정\n\n\n\n하여, 민간과 관공서를 포함한 모든 노동자가 세계 노동운동의 가치와\n정신을 되새길 수 있도록 법적 근거를 마련하고자 함(안 제2조제5호\n신설).",
    "제안이유_및_주요내용": "현행법은 세계 노동자의 권익 보호와 노동운동의 역사를 기리기 위\n한 메이데이(MAY DAY) 정신에 입각하여 「노동절 제정에 관한 법\n률」에 따라 매년 5월 1일을 노동절(근로자의 날)로 규정하고 「근로\n기준법」에 따른 유급휴일로 지정하고 있음.\n하지만 노동절을 「공휴일에 관한 법률」상 공휴일로 인정하고 있\n지 않게 때문에, 일부 민간기업에서만 자율적으로 휴일을 적용하고,\n공무원을 포함한 관공서는 이를 적용하지 않아 근로자의 날 본연의\n취지와 부합하지 않는 결과를 발생함.\n이에 5월 1일 노동절을 「공휴일에 관한 법률」상의 공휴일로 지정\n\n\n\n하여, 민간과 관공서를 포함한 모든 노동자가 세계 노동운동의 가치와\n정신을 되새길 수 있도록 법적 근거를 마련하고자 함(안 제2조제5호\n신설).",
    "법률_제_호": "공휴일에 관한 법률 일부개정법률안\n공휴일에 관한 법률 일부를 다음과 같이 개정한다.\n제2조5호부터 제10호까지를 제6호부터 제11호까지로 하고, 같은 조에\n제5호를 다음과 같이 신설한다.\n5. 노동절 (5월 1일)",
    "신구조문대비표": "현 행 개 정 안\n제2조(공휴일) 공휴일은 다음 각 제2조(공휴일) --------------\n호와 같다. -----.\n1. ～ 4. (생 략) 1. ～ 4. (현행과 같음)\n<신 설> 5. 노동절 (5월 1일)\n5. ～ 10. (생 략) 6. ～ 11. (현행 제5호부터 제1\n0호까지와 같음)"
  }
}