{
  "title": "2206106_대기관리권역의_대기환경개선에_관한_특별법_일부개정법률안",
  "bill_number": "6106",
  "proposal_date": "2024. 12. 2.",
  "submission_date": "",
  "is_alternative": false,
  "alternative_bill_numbers": [],
  "has_comparison_table": false,
  "comparison_table": "신ㆍ구조문대비표\n현 행 개 정 안\n법률 제17983호 대기관리권역의 법률 제17983호 대기관리권역의\n대기환경개선에 관한 특별법 일 대기환경개선에 관한 특별법 일\n부개정법률 ",
  "full_text": "대기관리권역의 대기환경개선에 관한 특별법\n일부개정법률안\n(박용갑의원 대표발의)\n발의연월일 : 2024. 12. 2.\n의 안\n6106\n번 호 발 의 자 : 박용갑ㆍ이용우ㆍ조승래\n한병도ㆍ황명선ㆍ정준호\n박정현ㆍ강유정ㆍ문금주\n황정아 의원(10인)\n제안이유 및 주요내용\n현행법이 시행되면서 서울을 비롯해 광역시ㆍ경기ㆍ충청ㆍ전남ㆍ경\n남 등 전국 대부분에서 경유차는 어린이 통학차량으로 등록할 수 없\n음. 기존에 운행되던 경유차도 내구연한(신차 구매 후 어린이 통학에\n사용할 수 있는 기간)인 13년이 지나면 운행이 금지됨.\n문제는 어린이집ㆍ유치원 등 해당 기관들은 ‘신차를 구매할 수 없는\n상황’이라며 제도 유예를 요구하고 있음.\n이에 어린이통학버스 용도로 이전에 사용되어 온 경유자동차에 대\n해서는 적용례를 “소유자”에서 “차량”으로 그 기준을 변경하여 어린이\n통학버스로 계속 운용 가능토록 하려는 것임(안 법률 제17983호 대기\n관리권역의 대기환경개선에 관한 특별법 일부개정법률 부칙 제3조).\n\n\n\n\n법률 제 호\n대기관리권역의 대기환경개선에 관한 특별법\n일부개정법률안\n대기관리권역의 대기환경개선에 관한 특별법 일부를 다음과 같이 개\n정한다.\n법률 제17983호 대기관리권역의 대기환경개선에 관한 특별법 일부개\n정법률 부칙 제3조제1항제1호 단서 중 “어린이통학버스를 소유한 자\n가 해당 어린이 통학버스를”을 “어린이통학버스를”로 한다.\n부 칙\n이 법은 공포한 날부터 시행한다.\n\n\n\n\n신ㆍ구조문대비표\n현 행 개 정 안\n법률 제17983호 대기관리권역의 법률 제17983호 대기관리권역의\n대기환경개선에 관한 특별법 일 대기환경개선에 관한 특별법 일\n부개정법률 부칙 부개정법률 부칙\n제3조(특정 용도 자동차로 경유자 제3조(특정 용도 자동차로 경유자\n동차 사용 제한에 관한 적용례) 동차 사용 제한에 관한 적용례)\n① 법률 제16305호 대기관리권 ① ----------------------\n역의 대기환경개선에 관한 특별 ------------------------\n법 제28조제1호 및 제2호의 개 ------------------------\n정규정은 같은 개정규정 시행 ------------------------\n이후 다음 각 호의 어느 하나에 ------------------------\n해당하는 경우부터 적용한다. ----------------------.\n1. 「도로교통법」 제52조에 따 1. ----------------------\n라 어린이통학버스 운영 신고 -----------------------\n를 하려는 경우. 다만, 이 법 -----------. -----------\n시행 전 「도로교통법」 제52 -----------------------\n조제1항에 따라 신고된 어린 -----------------어린이\n이통학버스를 소유한 자가 해 통학버스를--------------\n당 어린이통학버스를 계속 사 -----------------------\n용하는 경우는 제외한다. -----------------.\n2. ∼ 4. (생 략) 2. ∼ 4. (현행과 같음)\n② (생 략) ② (현행과 같음)\n",
  "sections": {
    "제안이유": "및",
    "주요내용": "현행법이 시행되면서 서울을 비롯해 광역시ㆍ경기ㆍ충청ㆍ전남ㆍ경\n남 등 전국 대부분에서 경유차는 어린이 통학차량으로 등록할 수 없\n음. 기존에 운행되던 경유차도 내구연한(신차 구매 후 어린이 통학에\n사용할 수 있는 기간)인 13년이 지나면 운행이 금지됨.\n문제는 어린이집ㆍ유치원 등 해당 기관들은 ‘신차를 구매할 수 없는\n상황’이라며 제도 유예를 요구하고 있음.\n이에 어린이통학버스 용도로 이전에 사용되어 온 경유자동차에 대\n해서는 적용례를 “소유자”에서 “차량”으로 그 기준을 변경하여 어린이\n통학버스로 계속 운용 가능토록 하려는 것임(안",
    "제안이유_및_주요내용": "현행법이 시행되면서 서울을 비롯해 광역시ㆍ경기ㆍ충청ㆍ전남ㆍ경\n남 등 전국 대부분에서 경유차는 어린이 통학차량으로 등록할 수 없\n음. 기존에 운행되던 경유차도 내구연한(신차 구매 후 어린이 통학에\n사용할 수 있는 기간)인 13년이 지나면 운행이 금지됨.\n문제는 어린이집ㆍ유치원 등 해당 기관들은 ‘신차를 구매할 수 없는\n상황’이라며 제도 유예를 요구하고 있음.\n이에 어린이통학버스 용도로 이전에 사용되어 온 경유자동차에 대\n해서는 적용례를 “소유자”에서 “차량”으로 그 기준을 변경하여 어린이\n통학버스로 계속 운용 가능토록 하려는 것임(안",
    "법률_제_호": "대기\n관리권역의 대기환경개선에 관한 특별법 일부개정법률",
    "신구조문대비표": "현 행 개 정 안\n법률 제17983호 대기관리권역의 법률 제17983호 대기관리권역의\n대기환경개선에 관한 특별법 일 대기환경개선에 관한 특별법 일\n부개정법률"
  }
}