{
  "title": "2206949_국가를_당사자로_하는_계약에_관한_법률_일부개정법률안",
  "bill_number": "6949",
  "proposal_date": "2024. 12. 26.",
  "submission_date": "",
  "is_alternative": false,
  "alternative_bill_numbers": [],
  "has_comparison_table": false,
  "comparison_table": "신ㆍ구조문대비표\n현 행 개 정 안\n제5조(계약의 원칙) ① ∼ ④ (생 제5조(계약의 원칙) ① ∼ ④ (현\n략) 행과 같음)\n<신 설> ⑤ 계약금액을 고정하는 특약\n이나 조건은 제3항의 부당한\n특약등에 해당하는 것으로 본\n다. 다만, 대통령령으로 정하는\n특별한 사유가 있는 경우에는\n그러하지 아니하다.",
  "full_text": "국가를 당사자로 하는 계약에 관한 법률 일부개정법률안\n(이종욱의원 대표발의)\n발의연월일 : 2024. 12. 26.\n의 안\n6949\n번 호 발 의 자 : 이종욱ㆍ신성범ㆍ이양수\n김예지ㆍ송언석ㆍ김종양\n박수영ㆍ김소희ㆍ이성권\n이종배 의원(10인)\n제안이유 및 주요내용\n현행법은 국가가 계약을 체결할 때 계약상대자의 계약상 이익을 부\n당하게 제한하는 특약 또는 조건(이하 “부당한 특약등”이라 함)을 정\n해서는 아니되도록 규정하고 있으나, 부당한 특약등의 구체적인 내용\n은 정하고 있지 아니함.\n한편, 「대ㆍ중소기업 상생협력 촉진에 관한 법률」 개정에 따라\n2023년 10월부터 주요 원재료의 가격이 일정한 비율 이상 변동하는\n경우 그 변동분에 연동하여 납품대금을 조정할 의무를 위탁기업에게\n부과하도록 하는 납품대금 연동제가 시행되고 있음.\n그러나 일부 공공기관이 관행적으로 계약상대자와 계약 기간 중 계\n약금액 조정이 어려운 “고정불변금액 계약”을 체결하고 있어, 공사 등\n을 재위탁한 계약상대자가 납품대금 연동제로 인하여 지출한 비용을\n제대로 보상받지 못하는 사례가 발생할 수 있어 개선이 필요함.\n\n\n\n이에 납품대금 연동제의 시행과 관련하여 위탁기업이 받는 불합리\n한 처우를 개선하기 위해 국가가 계약을 체결할 때 대통령령으로 정\n하는 특별한 사유 이외에 계약금액을 고정하는 특약이나 조건은 부당\n한 특약등으로 간주하도록 규정하려는 것임(안 제5조제5항 신설).\n\n법률 제 호\n국가를 당사자로 하는 계약에 관한 법률 일부개정법률안\n국가를 당사자로 하는 계약에 관한 법률 일부를 다음과 같이 개정한\n다.\n제5조에 제5항을 다음과 같이 신설한다.\n⑤ 계약금액을 고정하는 특약이나 조건은 제3항의 부당한 특약등에\n해당하는 것으로 본다. 다만, 대통령령으로 정하는 특별한 사유가\n있는 경우에는 그러하지 아니하다.\n부 칙\n제1조(시행일) 이 법은 공포 후 3개월이 경과한 날부터 시행한다.\n제2조(부당한 특약등에 관한 적용례) 제5조제5항의 개정규정은 이 법\n시행 이후 체결하는 계약부터 적용한다.\n\n\n\n\n신ㆍ구조문대비표\n현 행 개 정 안\n제5조(계약의 원칙) ① ∼ ④ (생 제5조(계약의 원칙) ① ∼ ④ (현\n략) 행과 같음)\n<신 설> ⑤ 계약금액을 고정하는 특약\n이나 조건은 제3항의 부당한\n특약등에 해당하는 것으로 본\n다. 다만, 대통령령으로 정하는\n특별한 사유가 있는 경우에는\n그러하지 아니하다.\n",
  "sections": {
    "제안이유": "및",
    "주요내용": "현행법은 국가가 계약을 체결할 때 계약상대자의 계약상 이익을 부\n당하게 제한하는 특약 또는 조건(이하 “부당한 특약등”이라 함)을 정\n해서는 아니되도록 규정하고 있으나, 부당한 특약등의 구체적인 내용\n은 정하고 있지 아니함.\n한편, 「대ㆍ중소기업 상생협력 촉진에 관한 법률」 개정에 따라\n2023년 10월부터 주요 원재료의 가격이 일정한 비율 이상 변동하는\n경우 그 변동분에 연동하여 납품대금을 조정할 의무를 위탁기업에게\n부과하도록 하는 납품대금 연동제가 시행되고 있음.\n그러나 일부 공공기관이 관행적으로 계약상대자와 계약 기간 중 계\n약금액 조정이 어려운 “고정불변금액 계약”을 체결하고 있어, 공사 등\n을 재위탁한 계약상대자가 납품대금 연동제로 인하여 지출한 비용을\n제대로 보상받지 못하는 사례가 발생할 수 있어 개선이 필요함.\n\n\n\n이에 납품대금 연동제의 시행과 관련하여 위탁기업이 받는 불합리\n한 처우를 개선하기 위해 국가가 계약을 체결할 때 대통령령으로 정\n하는 특별한 사유 이외에 계약금액을 고정하는 특약이나 조건은 부당\n한 특약등으로 간주하도록 규정하려는 것임(안 제5조제5항 신설).",
    "제안이유_및_주요내용": "현행법은 국가가 계약을 체결할 때 계약상대자의 계약상 이익을 부\n당하게 제한하는 특약 또는 조건(이하 “부당한 특약등”이라 함)을 정\n해서는 아니되도록 규정하고 있으나, 부당한 특약등의 구체적인 내용\n은 정하고 있지 아니함.\n한편, 「대ㆍ중소기업 상생협력 촉진에 관한 법률」 개정에 따라\n2023년 10월부터 주요 원재료의 가격이 일정한 비율 이상 변동하는\n경우 그 변동분에 연동하여 납품대금을 조정할 의무를 위탁기업에게\n부과하도록 하는 납품대금 연동제가 시행되고 있음.\n그러나 일부 공공기관이 관행적으로 계약상대자와 계약 기간 중 계\n약금액 조정이 어려운 “고정불변금액 계약”을 체결하고 있어, 공사 등\n을 재위탁한 계약상대자가 납품대금 연동제로 인하여 지출한 비용을\n제대로 보상받지 못하는 사례가 발생할 수 있어 개선이 필요함.\n\n\n\n이에 납품대금 연동제의 시행과 관련하여 위탁기업이 받는 불합리\n한 처우를 개선하기 위해 국가가 계약을 체결할 때 대통령령으로 정\n하는 특별한 사유 이외에 계약금액을 고정하는 특약이나 조건은 부당\n한 특약등으로 간주하도록 규정하려는 것임(안 제5조제5항 신설).",
    "법률_제_호": "국가를 당사자로 하는 계약에 관한 법률 일부개정법률안\n국가를 당사자로 하는 계약에 관한 법률 일부를 다음과 같이 개정한\n다.\n제5조에 제5항을 다음과 같이 신설한다.\n⑤ 계약금액을 고정하는 특약이나 조건은 제3항의 부당한 특약등에\n해당하는 것으로 본다. 다만, 대통령령으로 정하는 특별한 사유가\n있는 경우에는 그러하지 아니하다.",
    "신구조문대비표": "현 행 개 정 안\n제5조(계약의 원칙) ① ∼ ④ (생 제5조(계약의 원칙) ① ∼ ④ (현\n략) 행과 같음)\n<신 설> ⑤ 계약금액을 고정하는 특약\n이나 조건은 제3항의 부당한\n특약등에 해당하는 것으로 본\n다. 다만, 대통령령으로 정하는\n특별한 사유가 있는 경우에는\n그러하지 아니하다."
  }
}