{
  "title": "2206917_한국산업은행법_일부개정법률안(대안)",
  "bill_number": "",
  "proposal_date": "",
  "submission_date": "2024. 12.\n69",
  "is_alternative": true,
  "alternative_bill_numbers": [
    "2203117",
    "2203789"
  ],
  "has_comparison_table": false,
  "comparison_table": "신·구조문대비표\n현 행 개 정 안\n법률 제17253호 한국산업은행 법률 제17253호 한국산업은행\n법 일부개정법률 ",
  "full_text": "한국산업은행법 일부개정법률안 (대안)\n의 안 제안연월일 : 2024. 12.\n6917\n번 호\n제 안 자 : 정무위원장\n1. 대안의 제안경위\n의안번호 의안명 대표발의 발의일 심사경과\n제418회(정기회) 제7차\n정무위원회(2024.11.12.)\n2203117 이헌승의원 2024.08.23. 상정 후 제안설명, 검토\n보고 및 대체토론을 거쳐\n한국산업은행법 법안심사제1소위원회 회부\n일부개정법률안 제418회(정기회) 제7차\n정무위원회(2024.11.12.)\n2203789 유동수의원 2024. 9. 9. 상정 후 제안설명, 검토\n보고 및 대체토론을 거쳐\n법안심사제1소위원회 회부\n제418회 국회(정기회) 제1차 법안심사제1소위원회(2024. 11. 25.)에서\n이상 2건의 법률안을 각각 본회의에 부의하지 아니하기로 하고, 각 법\n률안의 내용을 통합·조정하여 위원회의 대안으로 제안하기로 함.\n제418회 국회(정기회) 제9차 정무위원회(2024. 12. 3.)에서 법안심사\n제1소위원회에서 심사보고한 대로 2건의 법률안을 각각 본회의에 부\n의하지 아니하고, 법안심사제1소위원회에서 마련한 대안을 위원회안으\n로 제안하기로 의결함.\n\n\n\n2. 대안의 제안이유\n코로나19 확산으로 인한 경제적 충격을 극복하고 주요 기간산업의\n고용유지를 위하여 2020년 설치된 기간산업안정기금은 부칙에 따라\n2025년 12월 31일에 운용이 종료될 예정이나, 법률에서 기간산업안정\n기금의 청산과 관련된 사항을 규율하고 있지 않은 상황임.\n이에 기금의 운용 종료에 대비하고 기금 자산의 효율적 정리와 관\n련된 절차를 명확히 하기 위한 규정을 마련하여 투명성과 법적 안정\n성을 확보하려는 것임\n3. 대안의 주요내용\n기간산업안정기금 운용 기간 종료 후 권리ㆍ의무의 국가 승계, 잔여\n재산의 국고 귀속 등을 명확하게 규정함(안 법률 제17253호 한국산업\n은행법 일부개정법률 부칙 제2항부터 제4항까지 신설).\n\n법률 제 호\n한국산업은행법 일부개정법률안\n한국산업은행법 일부를 다음과 같이 개정한다.\n법률 제17253호 한국산업은행법 일부개정법률 부칙 제2조의 제목 중\n“운용 기간”을 “운용 기간 등”으로 하고, 같은 조 제목 외의 부분을\n제1항으로 하며, 같은 조에 제2항부터 제4항까지를 각각 다음과 같이\n신설한다.\n② 한국산업은행은 제1항에 따른 기간산업안정기금의 운용 기간이 종\n료되는 날까지 기간산업안정기금채권 및 차입금의 원리금 상환 등을\n완료하여야 한다.\n③ 제1항에 따른 기간산업안정기금 운용 기간 종료 후 기간산업안정\n기금 운용에 관한 권리ㆍ의무는 국가가 승계하며, 한국산업은행은 운\n용 기간 종료 후 3개월 이내에 기간산업안정기금의 잔여재산을 국고\n에 귀속시켜야 한다. 다만, 금융위원회가 기간산업안정기금의 자산과\n부채를 실사한 결과 운용 기간 종료일에 잔여재산이 있을 것이 확실하\n고 그 금액을 추정할 수 있는 경우에는 추정된 잔여재산의 일부를 운\n용기간 종료 전에 국고에 귀속시킬 수 있다.\n④ 제2항 및 제3항에 따른 기간산업안정기금 정리에 관한 구체적인 처\n리 기준, 시기, 절차, 방법 및 그 밖에 필요한 사항은 대통령령으로 정\n\n\n\n한다.\n부 칙\n이 법은 공포한 날부터 시행한다.\n\n신·구조문대비표\n현 행 개 정 안\n법률 제17253호 한국산업은행 법률 제17253호 한국산업은행\n법 일부개정법률 부칙 법 일부개정법률 부칙\n제2조(기간산업안정기금의 운용 제2조(기간산업안정기금의 운용\n기간) (생 략) 기간 등) ① (현행 제목 외의\n부분과 같음)\n<신 설> ② 한국산업은행은 제1항에 따\n른 기간산업안정기금의 운용\n기간이 종료되는 날까지 기간\n산업안정기금채권 및 차입금의\n원리금 상환 등을 완료하여야\n한다.\n<신 설> ③ 제1항에 따른 기간산업안정\n기금 운용 기간 종료 후 기간\n산업안정기금 운용에 관한 권\n리ㆍ의무는 국가가 승계하며,\n한국산업은행은 운용 기간 종\n료 후 3개월 이내에 기간산업\n안정기금의 잔여재산을 국고에\n귀속시켜야 한다. 다만, 금융위\n원회가 기간산업안정기금의 자\n산과 부채를 실사한 결과 운용\n기간 종료일에 잔여재산이 있\n을 것이 확실하고 그 금액을\n추정할 수 있는 경우에는 추정\n\n\n\n된 잔여재산의 일부를 운용기\n간 종료 전에 국고에 귀속시킬\n수 있다.\n<신 설> ④ 제2항 및 제3항에 따른 기\n간산업안정기금 정리에 관한\n구체적인 처리 기준, 시기, 절\n차, 방법 및 그 밖에 필요한\n사항은 대통령령으로 정한다.",
  "sections": {
    "제안이유": "코로나19 확산으로 인한 경제적 충격을 극복하고 주요 기간산업의\n고용유지를 위하여 2020년 설치된 기간산업안정기금은 부칙에 따라\n2025년 12월 31일에 운용이 종료될 예정이나, 법률에서 기간산업안정\n기금의 청산과 관련된 사항을 규율하고 있지 않은 상황임.\n이에 기금의 운용 종료에 대비하고 기금 자산의 효율적 정리와 관\n련된 절차를 명확히 하기 위한 규정을 마련하여 투명성과 법적 안정\n성을 확보하려는 것임\n3. 대안의",
    "주요내용": "기간산업안정기금 운용 기간 종료 후 권리ㆍ의무의 국가 승계, 잔여\n재산의 국고 귀속 등을 명확하게 규정함(안",
    "법률_제_호": "한국산업\n은행법 일부개정법률",
    "신구조문대비표": "현 행 개 정 안\n법률 제17253호 한국산업은행 법률 제17253호 한국산업은행\n법 일부개정법률"
  }
}