{
  "title": "2206872_형법_일부개정법률안",
  "bill_number": "6872",
  "proposal_date": "2024. 12. 24.",
  "submission_date": "",
  "is_alternative": false,
  "alternative_bill_numbers": [],
  "has_comparison_table": false,
  "comparison_table": "신ㆍ구조문대비표\n현 행 개 정 안\n<신 설> 제76조의2(가석방의 제한) 제87조\n제1호ㆍ제2호 및 제88조의 죄\n에 관하여는 이 절을 적용하지\n아니한다.",
  "full_text": "형법 일부개정법률안\n(이연희의원 대표발의)\n발의연월일 : 2024. 12. 24.\n의 안\n6872\n번 호 발 의 자 : 이연희ㆍ이광희ㆍ박상혁\n허종식ㆍ이인영ㆍ김윤덕\n김남희ㆍ임미애ㆍ송재봉\n서미화ㆍ한민수ㆍ정준호\n이정문ㆍ이강일ㆍ복기왕\n손명수ㆍ한준호 의원\n(17인)\n제안이유 및 주요내용\n현행법은 가석방의 요건과 효과를 정하고 있음.\n그런데 문언상 가석방은 모든 죄에 적용될 수 있으므로 일부 죄의\n경우는 공익을 해하는 정도가 매우 큼에도 불구하고 가석방의 대상이\n될 수 있음. 특히, 내란죄의 경우 범죄 자체의 중대성은 물론 정치적,\n경제적, 외교적으로 미치는 부정적인 영향이 심각함에도 현행법령에\n따르면 가석방이 가능함.\n이에 향후 내란의 재발가능성을 줄이고 내란범에 대해 엄정한 처벌\n을 하기 위해서는 일체의 선처가 없어야 할 것임. 이를 위해 내란수괴\n및 중요임무조사자에 대해서는 가석방을 제한하도록 하는 규정을 신\n설함(안 제76조의2 신설).\n\n\n\n\n법률 제 호\n형법 일부개정법률안\n형법 일부를 다음과 같이 개정한다.\n제1편제3장제6절에 제76조의2를 다음과 같이 신설한다.\n제76조의2(가석방의 제한) 제87조제1호ㆍ제2호 및 제88조의 죄에 관하\n여는 이 절을 적용하지 아니한다.\n부 칙\n이 법은 공포 후 6개월이 경과한 날부터 시행한다.\n\n\n\n\n신ㆍ구조문대비표\n현 행 개 정 안\n<신 설> 제76조의2(가석방의 제한) 제87조\n제1호ㆍ제2호 및 제88조의 죄\n에 관하여는 이 절을 적용하지\n아니한다.\n",
  "sections": {
    "제안이유": "및",
    "주요내용": "현행법은 가석방의 요건과 효과를 정하고 있음.\n그런데 문언상 가석방은 모든 죄에 적용될 수 있으므로 일부 죄의\n경우는 공익을 해하는 정도가 매우 큼에도 불구하고 가석방의 대상이\n될 수 있음. 특히, 내란죄의 경우 범죄 자체의 중대성은 물론 정치적,\n경제적, 외교적으로 미치는 부정적인 영향이 심각함에도 현행법령에\n따르면 가석방이 가능함.\n이에 향후 내란의 재발가능성을 줄이고 내란범에 대해 엄정한 처벌\n을 하기 위해서는 일체의 선처가 없어야 할 것임. 이를 위해 내란수괴\n및 중요임무조사자에 대해서는 가석방을 제한하도록 하는 규정을 신\n설함(안 제76조의2 신설).",
    "제안이유_및_주요내용": "현행법은 가석방의 요건과 효과를 정하고 있음.\n그런데 문언상 가석방은 모든 죄에 적용될 수 있으므로 일부 죄의\n경우는 공익을 해하는 정도가 매우 큼에도 불구하고 가석방의 대상이\n될 수 있음. 특히, 내란죄의 경우 범죄 자체의 중대성은 물론 정치적,\n경제적, 외교적으로 미치는 부정적인 영향이 심각함에도 현행법령에\n따르면 가석방이 가능함.\n이에 향후 내란의 재발가능성을 줄이고 내란범에 대해 엄정한 처벌\n을 하기 위해서는 일체의 선처가 없어야 할 것임. 이를 위해 내란수괴\n및 중요임무조사자에 대해서는 가석방을 제한하도록 하는 규정을 신\n설함(안 제76조의2 신설).",
    "법률_제_호": "형법 일부개정법률안\n형법 일부를 다음과 같이 개정한다.\n제1편제3장제6절에 제76조의2를 다음과 같이 신설한다.\n제76조의2(가석방의 제한) 제87조제1호ㆍ제2호 및 제88조의 죄에 관하\n여는 이 절을 적용하지 아니한다.",
    "신구조문대비표": "현 행 개 정 안\n<신 설> 제76조의2(가석방의 제한) 제87조\n제1호ㆍ제2호 및 제88조의 죄\n에 관하여는 이 절을 적용하지\n아니한다."
  }
}