{
  "title": "2206251_계엄법_일부개정법률안",
  "bill_number": "6251",
  "proposal_date": "2024. 12. 5.",
  "submission_date": "",
  "is_alternative": false,
  "alternative_bill_numbers": [],
  "has_comparison_table": false,
  "comparison_table": "신ㆍ구조문대비표\n현 행 개 정 안\n<신 설> 제4조의2(계엄 선포의 무효) 제4\n조에 따른 절차를 거치지 아니\n한 계엄 선포는 그 효력이 없\n다.",
  "full_text": "계엄법 일부개정법률안\n(진선미의원 대표발의)\n발의연월일 : 2024. 12. 5.\n의 안\n6251\n번 호 발 의 자 : 진선미ㆍ김한규ㆍ강유정\n강훈식ㆍ박정현ㆍ모경종\n김영환ㆍ박민규ㆍ백승아\n이재관 의원(10인)\n제안이유 및 주요내용\n현행 「계엄법」은 대통령의 계엄 선포 시 지체 없이 국회에 통고\n하도록 하고, 국회가 폐회 중일 때에는 지체 없이 국회에 집회를 요구\n하여야 한다고 규정하고 있음.\n하지만 2024년 12월 3일 윤석열 대통령은 비상계엄 선포 이후 국회\n에 통고하지 아니하고 집회를 요구하지도 않았음. 오히려 군경을 동원\n해 국회 본회의 개의를 가로막았음.\n이에, 「계엄법」 제4조에서 규정하고 있는 국회에 통고하는 절차와\n집회를 요구하는 절차를 이행하지 않을 시 계엄 선포의 효력을 무효\n로 하도록 함(안 제4조의2).\n\n\n\n\n법률 제 호\n계엄법 일부개정법률안\n계엄법 일부를 다음과 같이 개정한다.\n제4조의2를 다음과 같이 신설한다.\n제4조의2(계엄 선포의 무효) 제4조에 따른 절차를 거치지 아니한 계엄\n선포는 그 효력이 없다.\n부 칙\n이 법은 공포한 날부터 시행한다.\n\n\n\n\n신ㆍ구조문대비표\n현 행 개 정 안\n<신 설> 제4조의2(계엄 선포의 무효) 제4\n조에 따른 절차를 거치지 아니\n한 계엄 선포는 그 효력이 없\n다.\n",
  "sections": {
    "제안이유": "및",
    "주요내용": "현행 「계엄법」은 대통령의 계엄 선포 시 지체 없이 국회에 통고\n하도록 하고, 국회가 폐회 중일 때에는 지체 없이 국회에 집회를 요구\n하여야 한다고 규정하고 있음.\n하지만 2024년 12월 3일 윤석열 대통령은 비상계엄 선포 이후 국회\n에 통고하지 아니하고 집회를 요구하지도 않았음. 오히려 군경을 동원\n해 국회 본회의 개의를 가로막았음.\n이에, 「계엄법」 제4조에서 규정하고 있는 국회에 통고하는 절차와\n집회를 요구하는 절차를 이행하지 않을 시 계엄 선포의 효력을 무효\n로 하도록 함(안 제4조의2).",
    "제안이유_및_주요내용": "현행 「계엄법」은 대통령의 계엄 선포 시 지체 없이 국회에 통고\n하도록 하고, 국회가 폐회 중일 때에는 지체 없이 국회에 집회를 요구\n하여야 한다고 규정하고 있음.\n하지만 2024년 12월 3일 윤석열 대통령은 비상계엄 선포 이후 국회\n에 통고하지 아니하고 집회를 요구하지도 않았음. 오히려 군경을 동원\n해 국회 본회의 개의를 가로막았음.\n이에, 「계엄법」 제4조에서 규정하고 있는 국회에 통고하는 절차와\n집회를 요구하는 절차를 이행하지 않을 시 계엄 선포의 효력을 무효\n로 하도록 함(안 제4조의2).",
    "법률_제_호": "계엄법 일부개정법률안\n계엄법 일부를 다음과 같이 개정한다.\n제4조의2를 다음과 같이 신설한다.\n제4조의2(계엄 선포의 무효) 제4조에 따른 절차를 거치지 아니한 계엄\n선포는 그 효력이 없다.",
    "신구조문대비표": "현 행 개 정 안\n<신 설> 제4조의2(계엄 선포의 무효) 제4\n조에 따른 절차를 거치지 아니\n한 계엄 선포는 그 효력이 없\n다."
  }
}