{
  "title": "2206278_계엄법_일부개정법률안",
  "bill_number": "6278",
  "proposal_date": "2024. 12. 6.",
  "submission_date": "",
  "is_alternative": false,
  "alternative_bill_numbers": [],
  "has_comparison_table": false,
  "comparison_table": "신ㆍ구조문대비표\n현 행 개 정 안\n<신 설> 제13조의2(국회 기능의 유지) 대\n통령 및 계엄사령관은 국회의\n기능을 방해하거나 정지시킬\n수 없다.",
  "full_text": "계엄법 일부개정법률안\n(장철민의원 대표발의)\n발의연월일 : 2024. 12. 6.\n의 안\n6278\n번 호 발 의 자 : 장철민ㆍ한창민ㆍ민병덕\n복기왕ㆍ위성락ㆍ이용우\n황명선ㆍ한병도ㆍ채현일\n황정아ㆍ박희승ㆍ이재관\n김교흥ㆍ김한규ㆍ강선우\n의원(15인)\n제안이유 및 주요내용\n현행법은 대통령이 전시ㆍ사변 또는 이에 준하는 국가비상사태 시\n계엄을 선포할 수 있도록 하고, 계엄 상황이 평상상태로 회복되거나\n국회가 계엄의 해제를 요구한 경우에는 대통령이 계엄을 해제하도록\n하고 있음.\n그러나 국회가 본회의를 개의할 수 없는 경우 등 국회의 기능이 정\n상적으로 작동하지 않는 경우에는 국회가 계엄 해제의 요구를 하지\n못하는 상황이 발생할 우려가 있어, 계엄이 선포된 상황에서도 국회의\n기능이 유지될 수 있도록 관련 규정을 보완할 필요가 있다는 지적이\n있음.\n이에 대통령 및 계엄사령관은 국회의 기능을 방해하거나 정지시킬\n수 없도록 명시적으로 규정함으로써 계엄 해제의 요구를 위한 국회의\n\n\n\n기능을 안정적으로 보장하려는 것임(안 제13조의2 신설).\n\n법률 제 호\n계엄법 일부개정법률안\n계엄법 일부를 다음과 같이 개정한다.\n제13조의2를 다음과 같이 신설한다.\n제13조의2(국회 기능의 유지) 대통령 및 계엄사령관은 국회의 기능을\n방해하거나 정지시킬 수 없다.\n부 칙\n이 법은 공포한 날부터 시행한다.\n\n\n\n\n신ㆍ구조문대비표\n현 행 개 정 안\n<신 설> 제13조의2(국회 기능의 유지) 대\n통령 및 계엄사령관은 국회의\n기능을 방해하거나 정지시킬\n수 없다.\n",
  "sections": {
    "제안이유": "및",
    "주요내용": "현행법은 대통령이 전시ㆍ사변 또는 이에 준하는 국가비상사태 시\n계엄을 선포할 수 있도록 하고, 계엄 상황이 평상상태로 회복되거나\n국회가 계엄의 해제를 요구한 경우에는 대통령이 계엄을 해제하도록\n하고 있음.\n그러나 국회가 본회의를 개의할 수 없는 경우 등 국회의 기능이 정\n상적으로 작동하지 않는 경우에는 국회가 계엄 해제의 요구를 하지\n못하는 상황이 발생할 우려가 있어, 계엄이 선포된 상황에서도 국회의\n기능이 유지될 수 있도록 관련 규정을 보완할 필요가 있다는 지적이\n있음.\n이에 대통령 및 계엄사령관은 국회의 기능을 방해하거나 정지시킬\n수 없도록 명시적으로 규정함으로써 계엄 해제의 요구를 위한 국회의\n\n\n\n기능을 안정적으로 보장하려는 것임(안 제13조의2 신설).",
    "제안이유_및_주요내용": "현행법은 대통령이 전시ㆍ사변 또는 이에 준하는 국가비상사태 시\n계엄을 선포할 수 있도록 하고, 계엄 상황이 평상상태로 회복되거나\n국회가 계엄의 해제를 요구한 경우에는 대통령이 계엄을 해제하도록\n하고 있음.\n그러나 국회가 본회의를 개의할 수 없는 경우 등 국회의 기능이 정\n상적으로 작동하지 않는 경우에는 국회가 계엄 해제의 요구를 하지\n못하는 상황이 발생할 우려가 있어, 계엄이 선포된 상황에서도 국회의\n기능이 유지될 수 있도록 관련 규정을 보완할 필요가 있다는 지적이\n있음.\n이에 대통령 및 계엄사령관은 국회의 기능을 방해하거나 정지시킬\n수 없도록 명시적으로 규정함으로써 계엄 해제의 요구를 위한 국회의\n\n\n\n기능을 안정적으로 보장하려는 것임(안 제13조의2 신설).",
    "법률_제_호": "계엄법 일부개정법률안\n계엄법 일부를 다음과 같이 개정한다.\n제13조의2를 다음과 같이 신설한다.\n제13조의2(국회 기능의 유지) 대통령 및 계엄사령관은 국회의 기능을\n방해하거나 정지시킬 수 없다.",
    "신구조문대비표": "현 행 개 정 안\n<신 설> 제13조의2(국회 기능의 유지) 대\n통령 및 계엄사령관은 국회의\n기능을 방해하거나 정지시킬\n수 없다."
  }
}