{
  "title": "2206556_군무원인사법_일부개정법률안",
  "bill_number": "6556",
  "proposal_date": "2024. 12. 17.",
  "submission_date": "",
  "is_alternative": false,
  "alternative_bill_numbers": [],
  "has_comparison_table": false,
  "comparison_table": "신ㆍ구조문대비표\n현 행 개 정 안\n제14조(휴직자ㆍ장기파견자 등의 제14조(휴직자ㆍ장기파견자 등의\n결원 보충) ① ∼ ③ (생 략) 결원 보충) ① ∼ ③ (현행과\n같음)\n<신 설> ④ 임용권자는 제1항제1호에\n따른 휴직으로 인하여 결원이\n발생한 경우 대체인력 확보를\n위하여 노력하여야 한다.",
  "full_text": "군무원인사법 일부개정법률안\n(홍기원의원 대표발의)\n발의연월일 : 2024. 12. 17.\n의 안\n6556\n번 호 발 의 자 : 홍기원ㆍ김태년ㆍ한민수\n윤종군ㆍ허 영ㆍ윤준병\n박지원ㆍ강훈식ㆍ이정문\n송옥주ㆍ이연희ㆍ민형배\n한정애 의원(13인)\n제안이유 및 주요내용\n최근 군인의 복무환경 개선을 위하여 임용권자가 군인 휴직자에 대\n한 대체인력 확보를 위하여 노력하여야 한다는 규정을 명시하도록\n「군인사법」이 개정되었음.\n그런데 군인과 함께 일선 부대에서 근무하고 있는 군무원의 경우\n그 규모 및 역할의 확대에도 불구하고 현행법에 휴직자 발생 시 대체\n인력 확보에 관한 규정이 명시되어 있지 아니하여 군인과의 형평성\n등을 고려하여 이를 보완할 필요가 있다는 지적이 제기되고 있음.\n이에 임용권자에게 휴직으로 인하여 군무원에 결원이 발생한 경우\n대체인력 확보를 위하여 노력할 의무를 부여함으로써 군무원이 안정\n적으로 일ㆍ가정 생활을 병행하며 복무에 임할 수 있는 환경을 조성\n하려는 것임(안 제14조제4항 신설).\n\n\n\n\n법률 제 호\n군무원인사법 일부개정법률안\n군무원인사법 일부를 다음과 같이 개정한다.\n제14조에 제4항을 다음과 같이 신설한다.\n④ 임용권자는 제1항제1호에 따른 휴직으로 인하여 결원이 발생한\n경우 대체인력 확보를 위하여 노력하여야 한다.\n부 칙\n이 법은 공포한 날부터 시행한다.\n\n\n\n\n신ㆍ구조문대비표\n현 행 개 정 안\n제14조(휴직자ㆍ장기파견자 등의 제14조(휴직자ㆍ장기파견자 등의\n결원 보충) ① ∼ ③ (생 략) 결원 보충) ① ∼ ③ (현행과\n같음)\n<신 설> ④ 임용권자는 제1항제1호에\n따른 휴직으로 인하여 결원이\n발생한 경우 대체인력 확보를\n위하여 노력하여야 한다.\n",
  "sections": {
    "제안이유": "및",
    "주요내용": "최근 군인의 복무환경 개선을 위하여 임용권자가 군인 휴직자에 대\n한 대체인력 확보를 위하여 노력하여야 한다는 규정을 명시하도록\n「군인사법」이 개정되었음.\n그런데 군인과 함께 일선 부대에서 근무하고 있는 군무원의 경우\n그 규모 및 역할의 확대에도 불구하고 현행법에 휴직자 발생 시 대체\n인력 확보에 관한 규정이 명시되어 있지 아니하여 군인과의 형평성\n등을 고려하여 이를 보완할 필요가 있다는 지적이 제기되고 있음.\n이에 임용권자에게 휴직으로 인하여 군무원에 결원이 발생한 경우\n대체인력 확보를 위하여 노력할 의무를 부여함으로써 군무원이 안정\n적으로 일ㆍ가정 생활을 병행하며 복무에 임할 수 있는 환경을 조성\n하려는 것임(안 제14조제4항 신설).",
    "제안이유_및_주요내용": "최근 군인의 복무환경 개선을 위하여 임용권자가 군인 휴직자에 대\n한 대체인력 확보를 위하여 노력하여야 한다는 규정을 명시하도록\n「군인사법」이 개정되었음.\n그런데 군인과 함께 일선 부대에서 근무하고 있는 군무원의 경우\n그 규모 및 역할의 확대에도 불구하고 현행법에 휴직자 발생 시 대체\n인력 확보에 관한 규정이 명시되어 있지 아니하여 군인과의 형평성\n등을 고려하여 이를 보완할 필요가 있다는 지적이 제기되고 있음.\n이에 임용권자에게 휴직으로 인하여 군무원에 결원이 발생한 경우\n대체인력 확보를 위하여 노력할 의무를 부여함으로써 군무원이 안정\n적으로 일ㆍ가정 생활을 병행하며 복무에 임할 수 있는 환경을 조성\n하려는 것임(안 제14조제4항 신설).",
    "법률_제_호": "군무원인사법 일부개정법률안\n군무원인사법 일부를 다음과 같이 개정한다.\n제14조에 제4항을 다음과 같이 신설한다.\n④ 임용권자는 제1항제1호에 따른 휴직으로 인하여 결원이 발생한\n경우 대체인력 확보를 위하여 노력하여야 한다.",
    "신구조문대비표": "현 행 개 정 안\n제14조(휴직자ㆍ장기파견자 등의 제14조(휴직자ㆍ장기파견자 등의\n결원 보충) ① ∼ ③ (생 략) 결원 보충) ① ∼ ③ (현행과\n같음)\n<신 설> ④ 임용권자는 제1항제1호에\n따른 휴직으로 인하여 결원이\n발생한 경우 대체인력 확보를\n위하여 노력하여야 한다."
  }
}