{
  "title": "2206387_계엄법_일부개정법률안",
  "bill_number": "6387",
  "proposal_date": "2024. 12. 11.",
  "submission_date": "",
  "is_alternative": false,
  "alternative_bill_numbers": [],
  "has_comparison_table": false,
  "comparison_table": "신ㆍ구조문대비표\n현 행 개 정 안\n제4조(계엄 선포의 통고) ①ㆍ② 제4조(계엄 선포의 통고) ①ㆍ②\n(생 략) (현행과 같음)\n<신 설> ③ 제1항 및 제2항에 의하여\n통고받거나 집회를 요구받은\n경우에 국회의장은 지체 없이\n국회를 개의 또는 집회하여야\n한다. 제1항 및 제2항에도 불\n구하고 대통령이 통고 또는 집\n회를 요구하지 아니한 경우에\n도 같다.",
  "full_text": "계엄법 일부개정법률안\n(이용우의원 대표발의)\n발의연월일 : 2024. 12. 11.\n의 안\n6387\n번 호 발 의 자 : 이용우ㆍ모경종ㆍ진선미\n민병덕ㆍ김한규ㆍ김교흥\n박정현ㆍ박주민ㆍ백승아\n이원택ㆍ백혜련 의원\n(11인)\n제안이유 및 주요내용\n현행 법률에 의하면 대통령이 계엄을 선포하였을 때에는 지체 없이\n국회에 통고하여야 하고, 국회가 폐회 중일 때에는 대통령은 지체없이\n국회에 집회를 요구하여야 함.\n최근 선포되었던 비상계엄에서 윤석열 대통령은 국회에 계엄 선포\n통고를 하지 않았음.\n설사 국회가 통고 또는 집회 요구를 받았다고 하더라도 계엄 해제\n논의를 위한 국회 개의 또는 집회 의무가 국회의장에게 부여되어 있\n지 않아서 국회의 계엄 해제 요구가 지연될 우려가 있음.\n이에 대통령이 국회에 계엄 선포 통고를 하거나 집회를 요구할 경\n우에 신속하게 계엄 해제 요구를 논의할 수 있도록 국회의장에게 국\n회 개의 또는 집회 의무를 부여하고, 최근 선포되었던 비상계엄의 사\n\n\n\n례와 같이 대통령이 통고 또는 집회 요구를 하지 않았다 할지라도 국\n회의장에게 같은 의무를 부여하고자 함(안 제4조제3항).\n\n법률 제 호\n계엄법 일부개정법률안\n계엄법 일부를 다음과 같이 개정한다.\n제4조에 제3항을 다음과 같이 신설한다.\n③ 제1항 및 제2항에 의하여 통고받거나 집회를 요구받은 경우에\n국회의장은 지체 없이 국회를 개의 또는 집회하여야 한다. 제1항 및\n제2항에도 불구하고 대통령이 통고 또는 집회를 요구하지 아니한\n경우에도 같다.\n부 칙\n이 법은 공포한 날부터 시행한다.\n\n\n\n\n신ㆍ구조문대비표\n현 행 개 정 안\n제4조(계엄 선포의 통고) ①ㆍ② 제4조(계엄 선포의 통고) ①ㆍ②\n(생 략) (현행과 같음)\n<신 설> ③ 제1항 및 제2항에 의하여\n통고받거나 집회를 요구받은\n경우에 국회의장은 지체 없이\n국회를 개의 또는 집회하여야\n한다. 제1항 및 제2항에도 불\n구하고 대통령이 통고 또는 집\n회를 요구하지 아니한 경우에\n도 같다.\n",
  "sections": {
    "제안이유": "및",
    "주요내용": "현행 법률에 의하면 대통령이 계엄을 선포하였을 때에는 지체 없이\n국회에 통고하여야 하고, 국회가 폐회 중일 때에는 대통령은 지체없이\n국회에 집회를 요구하여야 함.\n최근 선포되었던 비상계엄에서 윤석열 대통령은 국회에 계엄 선포\n통고를 하지 않았음.\n설사 국회가 통고 또는 집회 요구를 받았다고 하더라도 계엄 해제\n논의를 위한 국회 개의 또는 집회 의무가 국회의장에게 부여되어 있\n지 않아서 국회의 계엄 해제 요구가 지연될 우려가 있음.\n이에 대통령이 국회에 계엄 선포 통고를 하거나 집회를 요구할 경\n우에 신속하게 계엄 해제 요구를 논의할 수 있도록 국회의장에게 국\n회 개의 또는 집회 의무를 부여하고, 최근 선포되었던 비상계엄의 사\n\n\n\n례와 같이 대통령이 통고 또는 집회 요구를 하지 않았다 할지라도 국\n회의장에게 같은 의무를 부여하고자 함(안 제4조제3항).",
    "제안이유_및_주요내용": "현행 법률에 의하면 대통령이 계엄을 선포하였을 때에는 지체 없이\n국회에 통고하여야 하고, 국회가 폐회 중일 때에는 대통령은 지체없이\n국회에 집회를 요구하여야 함.\n최근 선포되었던 비상계엄에서 윤석열 대통령은 국회에 계엄 선포\n통고를 하지 않았음.\n설사 국회가 통고 또는 집회 요구를 받았다고 하더라도 계엄 해제\n논의를 위한 국회 개의 또는 집회 의무가 국회의장에게 부여되어 있\n지 않아서 국회의 계엄 해제 요구가 지연될 우려가 있음.\n이에 대통령이 국회에 계엄 선포 통고를 하거나 집회를 요구할 경\n우에 신속하게 계엄 해제 요구를 논의할 수 있도록 국회의장에게 국\n회 개의 또는 집회 의무를 부여하고, 최근 선포되었던 비상계엄의 사\n\n\n\n례와 같이 대통령이 통고 또는 집회 요구를 하지 않았다 할지라도 국\n회의장에게 같은 의무를 부여하고자 함(안 제4조제3항).",
    "법률_제_호": "계엄법 일부개정법률안\n계엄법 일부를 다음과 같이 개정한다.\n제4조에 제3항을 다음과 같이 신설한다.\n③ 제1항 및 제2항에 의하여 통고받거나 집회를 요구받은 경우에\n국회의장은 지체 없이 국회를 개의 또는 집회하여야 한다. 제1항 및\n제2항에도 불구하고 대통령이 통고 또는 집회를 요구하지 아니한\n경우에도 같다.",
    "신구조문대비표": "현 행 개 정 안\n제4조(계엄 선포의 통고) ①ㆍ② 제4조(계엄 선포의 통고) ①ㆍ②\n(생 략) (현행과 같음)\n<신 설> ③ 제1항 및 제2항에 의하여\n통고받거나 집회를 요구받은\n경우에 국회의장은 지체 없이\n국회를 개의 또는 집회하여야\n한다. 제1항 및 제2항에도 불\n구하고 대통령이 통고 또는 집\n회를 요구하지 아니한 경우에\n도 같다."
  }
}