{
  "title": "2206146_의용소방대_설치_및_운영에_관한_법률_일부개정법률안",
  "bill_number": "6146",
  "proposal_date": "2024. 12. 3.",
  "submission_date": "",
  "is_alternative": false,
  "alternative_bill_numbers": [],
  "has_comparison_table": false,
  "comparison_table": "신ㆍ구조문대비표\n현 행 개 정 안\n제5조(정년) 의용소방대원의 정년 제5조(정년) -------------------\n은 65세로 한다. <단서 신설> --------------. 다만, 인구 수\n및 65세 이상 고령인구의 비율\n등을 고려하여 대통령령으로\n정하는 지역의 경우에는 70세로\n한다.",
  "full_text": "의용소방대 설치 및 운영에 관한 법률 일부개정법률안\n(정점식의원 대표발의)\n발의연월일 : 2024. 12. 3.\n의 안\n6146\n번 호 발 의 자 : 정점식ㆍ김도읍ㆍ성일종\n박충권ㆍ고동진ㆍ서명옥\n신성범ㆍ정희용ㆍ김태호\n박덕흠ㆍ김장겸 의원\n(11인)\n제안이유 및 주요내용\n현행법은 시ㆍ도지사 또는 소방서장이 신체가 건강하고 협동정신이\n강한 사람, 소방기술 관련 자격ㆍ학력 또는 경력이 있는 사람, 의사ㆍ\n간호사 또는 응급구조사 자격을 가진 사람 등 중에서 의용소방대원을\n임명하도록 하며, 의용소방대원의 정년은 65세로 정하고 있음.\n그러나 최근 고령화로 인해 고령인구 비율이 급격히 상승함에 따라\n농어촌지역은 의용소방대원의 모집과 유지에 어려움을 겪고 있음. 통\n계청에 따르면 농어촌지역의 65세 이상 고령인구 비율은 46.8%에 달\n함(2021년 기준).\n이에 인구 수 및 고령인구 비율 등을 고려하여 대통령령으로 정하\n는 지역의 경우에는 의용소방대원의 정년을 70세로 연장하려는 것임\n(안 제5조 단서 신설).\n\n\n\n\n법률 제 호\n의용소방대 설치 및 운영에 관한 법률 일부개정법률안\n의용소방대 설치 및 운영에 관한 법률 일부를 다음과 같이 개정한다.\n제5조에 단서를 다음과 같이 신설한다.\n다만, 인구 수 및 65세 이상 고령인구의 비율 등을 고려하여 대통령\n령으로 정하는 지역의 경우에는 70세로 한다.\n부 칙\n이 법은 공포 후 6개월이 경과한 날부터 시행한다.\n\n\n\n\n신ㆍ구조문대비표\n현 행 개 정 안\n제5조(정년) 의용소방대원의 정년 제5조(정년) -------------------\n은 65세로 한다. <단서 신설> --------------. 다만, 인구 수\n및 65세 이상 고령인구의 비율\n등을 고려하여 대통령령으로\n정하는 지역의 경우에는 70세로\n한다.\n",
  "sections": {
    "제안이유": "및",
    "주요내용": "현행법은 시ㆍ도지사 또는 소방서장이 신체가 건강하고 협동정신이\n강한 사람, 소방기술 관련 자격ㆍ학력 또는 경력이 있는 사람, 의사ㆍ\n간호사 또는 응급구조사 자격을 가진 사람 등 중에서 의용소방대원을\n임명하도록 하며, 의용소방대원의 정년은 65세로 정하고 있음.\n그러나 최근 고령화로 인해 고령인구 비율이 급격히 상승함에 따라\n농어촌지역은 의용소방대원의 모집과 유지에 어려움을 겪고 있음. 통\n계청에 따르면 농어촌지역의 65세 이상 고령인구 비율은 46.8%에 달\n함(2021년 기준).\n이에 인구 수 및 고령인구 비율 등을 고려하여 대통령령으로 정하\n는 지역의 경우에는 의용소방대원의 정년을 70세로 연장하려는 것임\n(안 제5조 단서 신설).",
    "제안이유_및_주요내용": "현행법은 시ㆍ도지사 또는 소방서장이 신체가 건강하고 협동정신이\n강한 사람, 소방기술 관련 자격ㆍ학력 또는 경력이 있는 사람, 의사ㆍ\n간호사 또는 응급구조사 자격을 가진 사람 등 중에서 의용소방대원을\n임명하도록 하며, 의용소방대원의 정년은 65세로 정하고 있음.\n그러나 최근 고령화로 인해 고령인구 비율이 급격히 상승함에 따라\n농어촌지역은 의용소방대원의 모집과 유지에 어려움을 겪고 있음. 통\n계청에 따르면 농어촌지역의 65세 이상 고령인구 비율은 46.8%에 달\n함(2021년 기준).\n이에 인구 수 및 고령인구 비율 등을 고려하여 대통령령으로 정하\n는 지역의 경우에는 의용소방대원의 정년을 70세로 연장하려는 것임\n(안 제5조 단서 신설).",
    "법률_제_호": "의용소방대 설치 및 운영에 관한 법률 일부개정법률안\n의용소방대 설치 및 운영에 관한 법률 일부를 다음과 같이 개정한다.\n제5조에 단서를 다음과 같이 신설한다.\n다만, 인구 수 및 65세 이상 고령인구의 비율 등을 고려하여 대통령\n령으로 정하는 지역의 경우에는 70세로 한다.",
    "신구조문대비표": "현 행 개 정 안\n제5조(정년) 의용소방대원의 정년 제5조(정년) -------------------\n은 65세로 한다. <단서 신설> --------------. 다만, 인구 수\n및 65세 이상 고령인구의 비율\n등을 고려하여 대통령령으로\n정하는 지역의 경우에는 70세로\n한다."
  }
}