{
  "title": "2207489_대통령_등의_경호에_관한_법률_일부개정법률안",
  "bill_number": "7489",
  "proposal_date": "2025. 1. 14.",
  "submission_date": "",
  "is_alternative": false,
  "alternative_bill_numbers": [],
  "has_comparison_table": false,
  "comparison_table": "신ㆍ구조문대비표\n현 행 개 정 안\n제18조(직권 남용 금지 등) ① ～ 제18조(직권 남용 금지 등) ① ～\n② (생 략) ② (현행과 같음)\n<신 설> ③ 제4조제1항 각 호의 경호대\n상에 대하여 법관이 영장을 발\n부한 경우에 소속공무원은 경\n호를 이유로 그 영장의 집행을\n방해하여서는 아니 된다.",
  "full_text": "대통령 등의 경호에 관한 법률 일부개정법률안\n(황희의원 대표발의)\n발의연월일 : 2025. 1. 14.\n의 안\n7489\n번 호 발 의 자 : 황 희ㆍ김태년ㆍ허 영\n이용선ㆍ김문수ㆍ박용갑\n차지호ㆍ신영대ㆍ정성호\n한민수ㆍ김준형ㆍ안규백\n의원(12인)\n제안이유 및 주요내용\n현행법에 따르면 대통령경호처의 주요 임무인 경호란 대통령 등 경\n호 대상자의 생명과 재산을 보호하기 위하여 신체에 가하여지는 위해\n를 방지하거나 제거하고, 특정 지역을 경계ㆍ순찰 및 방비하는 등의\n모든 안전 활동을 말함.\n그런데 지난 2024년 12월 3일 비상계엄 선포행위에 대한 내란죄 관\n련 수사를 위하여 법원이 대통령에게 발부한 체포영장에 대하여 대통\n령경호처는 경호대상인 대통령의 경호가 필요하다는 이유로 영장의\n집행을 방해하였음.\n이에 대통령을 비롯한 경호대상에 대하여 법관이 영장을 발부한 경\n우에는 소속공무원이 경호를 이유로 그 영장의 집행을 방해하여서는\n아니 된다는 규정을 신설함으로써 영장 집행의 실효성을 제고하고 법\n치주의의 확립에 기여하려는 것임(안 제18조제3항 신설).\n\n\n\n\n법률 제 호\n대통령 등의 경호에 관한 법률 일부개정법률안\n대통령 등의 경호에 관한 법률 일부를 다음과 같이 개정한다.\n제18조에 제3항을 다음과 같이 신설한다.\n③ 제4조제1항 각 호의 경호대상에 대하여 법관이 영장을 발부한\n경우에 소속공무원은 경호를 이유로 그 영장의 집행을 방해하여서\n는 아니 된다.\n부 칙\n이 법은 공포한 날부터 시행한다.\n\n\n\n\n신ㆍ구조문대비표\n현 행 개 정 안\n제18조(직권 남용 금지 등) ① ～ 제18조(직권 남용 금지 등) ① ～\n② (생 략) ② (현행과 같음)\n<신 설> ③ 제4조제1항 각 호의 경호대\n상에 대하여 법관이 영장을 발\n부한 경우에 소속공무원은 경\n호를 이유로 그 영장의 집행을\n방해하여서는 아니 된다.\n",
  "sections": {
    "제안이유": "및",
    "주요내용": "현행법에 따르면 대통령경호처의 주요 임무인 경호란 대통령 등 경\n호 대상자의 생명과 재산을 보호하기 위하여 신체에 가하여지는 위해\n를 방지하거나 제거하고, 특정 지역을 경계ㆍ순찰 및 방비하는 등의\n모든 안전 활동을 말함.\n그런데 지난 2024년 12월 3일 비상계엄 선포행위에 대한 내란죄 관\n련 수사를 위하여 법원이 대통령에게 발부한 체포영장에 대하여 대통\n령경호처는 경호대상인 대통령의 경호가 필요하다는 이유로 영장의\n집행을 방해하였음.\n이에 대통령을 비롯한 경호대상에 대하여 법관이 영장을 발부한 경\n우에는 소속공무원이 경호를 이유로 그 영장의 집행을 방해하여서는\n아니 된다는 규정을 신설함으로써 영장 집행의 실효성을 제고하고 법\n치주의의 확립에 기여하려는 것임(안 제18조제3항 신설).",
    "제안이유_및_주요내용": "현행법에 따르면 대통령경호처의 주요 임무인 경호란 대통령 등 경\n호 대상자의 생명과 재산을 보호하기 위하여 신체에 가하여지는 위해\n를 방지하거나 제거하고, 특정 지역을 경계ㆍ순찰 및 방비하는 등의\n모든 안전 활동을 말함.\n그런데 지난 2024년 12월 3일 비상계엄 선포행위에 대한 내란죄 관\n련 수사를 위하여 법원이 대통령에게 발부한 체포영장에 대하여 대통\n령경호처는 경호대상인 대통령의 경호가 필요하다는 이유로 영장의\n집행을 방해하였음.\n이에 대통령을 비롯한 경호대상에 대하여 법관이 영장을 발부한 경\n우에는 소속공무원이 경호를 이유로 그 영장의 집행을 방해하여서는\n아니 된다는 규정을 신설함으로써 영장 집행의 실효성을 제고하고 법\n치주의의 확립에 기여하려는 것임(안 제18조제3항 신설).",
    "법률_제_호": "대통령 등의 경호에 관한 법률 일부개정법률안\n대통령 등의 경호에 관한 법률 일부를 다음과 같이 개정한다.\n제18조에 제3항을 다음과 같이 신설한다.\n③ 제4조제1항 각 호의 경호대상에 대하여 법관이 영장을 발부한\n경우에 소속공무원은 경호를 이유로 그 영장의 집행을 방해하여서\n는 아니 된다.",
    "신구조문대비표": "현 행 개 정 안\n제18조(직권 남용 금지 등) ① ～ 제18조(직권 남용 금지 등) ① ～\n② (생 략) ② (현행과 같음)\n<신 설> ③ 제4조제1항 각 호의 경호대\n상에 대하여 법관이 영장을 발\n부한 경우에 소속공무원은 경\n호를 이유로 그 영장의 집행을\n방해하여서는 아니 된다."
  }
}