{
  "title": "2207572_국민체육진흥법_일부개정법률안",
  "bill_number": "7572",
  "proposal_date": "2025. 1. 16.",
  "submission_date": "",
  "is_alternative": false,
  "alternative_bill_numbers": [],
  "has_comparison_table": false,
  "comparison_table": "신ㆍ구조문대비표\n현 행 개 정 안\n제10조의2(노인 체육의 진흥) ① 제10조의2(노인 체육의 진흥) ①\n(생 략) (현행과 같음)\n<신 설> ② 국가와 지방자치단체는 노\n인 건강을 증진시키고 삶의 활\n력을 제고하기 위하여 노인에\n특화된 체육시설을 설치하거나\n그 설치에 필요한 비용을 지원\n할 수 있다.\n② (생 략) ③ (현행 제2항과 같음)",
  "full_text": "국민체육진흥법 일부개정법률안\n(송기헌의원 대표발의)\n발의연월일 : 2025. 1. 16.\n의 안\n7572\n번 호 발 의 자 : 송기헌ㆍ강훈식ㆍ김태년\n박 정ㆍ백혜련ㆍ어기구\n이성윤ㆍ조승래ㆍ주철현\n허 영 의원(10인)\n제안이유 및 주요내용\n현행법은 국가와 지방자치단체가 노인 건강의 유지 및 증진을 위한\n맞춤 체육활동 프로그램을 운영하거나 그 운영에 필요한 비용 및 시\n설을 지원할 수 있도록 하고 있음.\n우리나라는 노인인구의 비율이 지속적으로 상승하여 초고령 사회\n진입을 앞두고 있음. 이에 따라 노인의 체육활동에 대한 관심도 높아\n지고 있는데, 노인 맞춤 체육활동 프로그램과 함께 노인 친화적인 체\n육시설도 적극적으로 확충할 필요가 있다는 의견이 있음.\n이에 국가와 지방자치단체가 노인에 특화된 체육시설을 설치하거나\n그 설치에 필요한 비용을 지원할 수 있도록 하여 노인 친화적인 체육\n활동 여건을 조성하려는 것임(안 제10조의2제2항 신설).\n\n\n\n\n법률 제 호\n국민체육진흥법 일부개정법률안\n국민체육진흥법 일부를 다음과 같이 개정한다.\n제10조의2제2항을 제3항으로 하고, 같은 조에 제2항을 다음과 같이 신\n설한다.\n② 국가와 지방자치단체는 노인 건강을 증진시키고 삶의 활력을 제\n고하기 위하여 노인에 특화된 체육시설을 설치하거나 그 설치에 필\n요한 비용을 지원할 수 있다.\n부 칙\n이 법은 공포 후 6개월이 경과한 날부터 시행한다.\n\n\n\n\n신ㆍ구조문대비표\n현 행 개 정 안\n제10조의2(노인 체육의 진흥) ① 제10조의2(노인 체육의 진흥) ①\n(생 략) (현행과 같음)\n<신 설> ② 국가와 지방자치단체는 노\n인 건강을 증진시키고 삶의 활\n력을 제고하기 위하여 노인에\n특화된 체육시설을 설치하거나\n그 설치에 필요한 비용을 지원\n할 수 있다.\n② (생 략) ③ (현행 제2항과 같음)\n",
  "sections": {
    "제안이유": "및",
    "주요내용": "현행법은 국가와 지방자치단체가 노인 건강의 유지 및 증진을 위한\n맞춤 체육활동 프로그램을 운영하거나 그 운영에 필요한 비용 및 시\n설을 지원할 수 있도록 하고 있음.\n우리나라는 노인인구의 비율이 지속적으로 상승하여 초고령 사회\n진입을 앞두고 있음. 이에 따라 노인의 체육활동에 대한 관심도 높아\n지고 있는데, 노인 맞춤 체육활동 프로그램과 함께 노인 친화적인 체\n육시설도 적극적으로 확충할 필요가 있다는 의견이 있음.\n이에 국가와 지방자치단체가 노인에 특화된 체육시설을 설치하거나\n그 설치에 필요한 비용을 지원할 수 있도록 하여 노인 친화적인 체육\n활동 여건을 조성하려는 것임(안 제10조의2제2항 신설).",
    "제안이유_및_주요내용": "현행법은 국가와 지방자치단체가 노인 건강의 유지 및 증진을 위한\n맞춤 체육활동 프로그램을 운영하거나 그 운영에 필요한 비용 및 시\n설을 지원할 수 있도록 하고 있음.\n우리나라는 노인인구의 비율이 지속적으로 상승하여 초고령 사회\n진입을 앞두고 있음. 이에 따라 노인의 체육활동에 대한 관심도 높아\n지고 있는데, 노인 맞춤 체육활동 프로그램과 함께 노인 친화적인 체\n육시설도 적극적으로 확충할 필요가 있다는 의견이 있음.\n이에 국가와 지방자치단체가 노인에 특화된 체육시설을 설치하거나\n그 설치에 필요한 비용을 지원할 수 있도록 하여 노인 친화적인 체육\n활동 여건을 조성하려는 것임(안 제10조의2제2항 신설).",
    "법률_제_호": "국민체육진흥법 일부개정법률안\n국민체육진흥법 일부를 다음과 같이 개정한다.\n제10조의2제2항을 제3항으로 하고, 같은 조에 제2항을 다음과 같이 신\n설한다.\n② 국가와 지방자치단체는 노인 건강을 증진시키고 삶의 활력을 제\n고하기 위하여 노인에 특화된 체육시설을 설치하거나 그 설치에 필\n요한 비용을 지원할 수 있다.",
    "신구조문대비표": "현 행 개 정 안\n제10조의2(노인 체육의 진흥) ① 제10조의2(노인 체육의 진흥) ①\n(생 략) (현행과 같음)\n<신 설> ② 국가와 지방자치단체는 노\n인 건강을 증진시키고 삶의 활\n력을 제고하기 위하여 노인에\n특화된 체육시설을 설치하거나\n그 설치에 필요한 비용을 지원\n할 수 있다.\n② (생 략) ③ (현행 제2항과 같음)"
  }
}