{
  "title": "2207544_형사소송법_일부개정법률안",
  "bill_number": "7544",
  "proposal_date": "2025. 1. 15.",
  "submission_date": "",
  "is_alternative": false,
  "alternative_bill_numbers": [],
  "has_comparison_table": false,
  "comparison_table": "신ㆍ구조문대비표\n현 행 개 정 안\n<신 설> 제245조의11(수사방해죄) 내란,\n외환, 또는 반란죄 혐의를 받는\n피의자가 정당한 이유 없이 제\n200조에 따른 검사 또는 사법\n경찰관의 출석 요구를 거부 또\n는 기피한 때에는 1년 이하의\n징역 또는 1천만원 이하의 벌\n금에 처한다.",
  "full_text": "형사소송법 일부개정법률안\n(서영교의원 대표발의)\n발의연월일 : 2025. 1. 15.\n의 안\n7544\n번 호 발 의 자 : 서영교ㆍ김문수ㆍ이해식\n송재봉ㆍ윤준병ㆍ이광희\n김준형ㆍ한민수ㆍ박홍배\n임오경 의원(10인)\n제안이유 및 주요내용\n최근 내란죄 등의 혐의로 대통령에 대한 수사가 진행되고 있음. 그\n러나 출석요구서 수령 자체를 거부하고 소환조사에 불응하여 수사 진\n행에 차질을 빚고 있음. 대통령의 이와 같은 태도는 수사 지연 등을\n위한 고의적인 회피라고 볼 수 있음.\n이는 많은 국민들이 관심을 갖고 지켜보고 있는 사항인 바, 내란,\n외환, 또는 반란의 죄 혐의를 받는 피의자가 출석 요구를 거부ㆍ기피\n하는 방법으로 수사를 방해하는 행위를 제재할 수 있는 근거를 마련\n하고자 함(안 제245조의11 신설).\n\n\n\n\n법률 제 호\n형사소송법 일부개정법률안\n형사소송법 일부를 다음과 같이 개정한다.\n제2편 제1장에 제245조의11을 다음과 같이 신설한다.\n제245조의11(수사방해죄) 내란, 외환, 또는 반란죄 혐의를 받는 피의자\n가 정당한 이유 없이 제200조에 따른 검사 또는 사법경찰관의 출석\n요구를 거부 또는 기피한 때에는 1년 이하의 징역 또는 1천만원 이\n하의 벌금에 처한다.\n부 칙\n이 법은 공포한 날부터 시행한다.\n\n\n\n\n신ㆍ구조문대비표\n현 행 개 정 안\n<신 설> 제245조의11(수사방해죄) 내란,\n외환, 또는 반란죄 혐의를 받는\n피의자가 정당한 이유 없이 제\n200조에 따른 검사 또는 사법\n경찰관의 출석 요구를 거부 또\n는 기피한 때에는 1년 이하의\n징역 또는 1천만원 이하의 벌\n금에 처한다.\n",
  "sections": {
    "제안이유": "및",
    "주요내용": "최근 내란죄 등의 혐의로 대통령에 대한 수사가 진행되고 있음. 그\n러나 출석요구서 수령 자체를 거부하고 소환조사에 불응하여 수사 진\n행에 차질을 빚고 있음. 대통령의 이와 같은 태도는 수사 지연 등을\n위한 고의적인 회피라고 볼 수 있음.\n이는 많은 국민들이 관심을 갖고 지켜보고 있는 사항인 바, 내란,\n외환, 또는 반란의 죄 혐의를 받는 피의자가 출석 요구를 거부ㆍ기피\n하는 방법으로 수사를 방해하는 행위를 제재할 수 있는 근거를 마련\n하고자 함(안 제245조의11 신설).",
    "제안이유_및_주요내용": "최근 내란죄 등의 혐의로 대통령에 대한 수사가 진행되고 있음. 그\n러나 출석요구서 수령 자체를 거부하고 소환조사에 불응하여 수사 진\n행에 차질을 빚고 있음. 대통령의 이와 같은 태도는 수사 지연 등을\n위한 고의적인 회피라고 볼 수 있음.\n이는 많은 국민들이 관심을 갖고 지켜보고 있는 사항인 바, 내란,\n외환, 또는 반란의 죄 혐의를 받는 피의자가 출석 요구를 거부ㆍ기피\n하는 방법으로 수사를 방해하는 행위를 제재할 수 있는 근거를 마련\n하고자 함(안 제245조의11 신설).",
    "법률_제_호": "형사소송법 일부개정법률안\n형사소송법 일부를 다음과 같이 개정한다.\n제2편 제1장에 제245조의11을 다음과 같이 신설한다.\n제245조의11(수사방해죄) 내란, 외환, 또는 반란죄 혐의를 받는 피의자\n가 정당한 이유 없이 제200조에 따른 검사 또는 사법경찰관의 출석\n요구를 거부 또는 기피한 때에는 1년 이하의 징역 또는 1천만원 이\n하의 벌금에 처한다.",
    "신구조문대비표": "현 행 개 정 안\n<신 설> 제245조의11(수사방해죄) 내란,\n외환, 또는 반란죄 혐의를 받는\n피의자가 정당한 이유 없이 제\n200조에 따른 검사 또는 사법\n경찰관의 출석 요구를 거부 또\n는 기피한 때에는 1년 이하의\n징역 또는 1천만원 이하의 벌\n금에 처한다."
  }
}