{
  "title": "2207399_참전유공자_예우_및_단체설립에_관한_법률_일부개정법률안",
  "bill_number": "7399",
  "proposal_date": "2025. 1. 9.",
  "submission_date": "",
  "is_alternative": false,
  "alternative_bill_numbers": [],
  "has_comparison_table": false,
  "comparison_table": "신ㆍ구조문대비표\n현 행 개 정 안\n제7조(의료지원) ①ㆍ② (생 략) 제7조(의료지원) ①ㆍ② (현행과\n같음)\n<신 설> ③ 제2항에 따라 진료를 위탁\n하는 경우 각 지역별로 의료기\n관 수, 전문의 수, 진료과목 등\n대통령령으로 정하는 기준을\n충족하도록 하여야 한다.\n③ (생 략) ④ (현행 제3항과 같음)",
  "full_text": "참전유공자 예우 및 단체설립에 관한 법률 일부개정법률안\n(송기헌의원 대표발의)\n발의연월일 : 2025. 1. 9.\n의 안\n7399\n번 호 발 의 자 : 송기헌ㆍ이기헌ㆍ김 윤\n문진석ㆍ염태영ㆍ백혜련\n김영배ㆍ주철현ㆍ강훈식\n김태년ㆍ위성곤ㆍ허 영\n박 정 의원(13인)\n제안이유 및 주요내용\n현행법은 참전유공자가 진료가 필요한 경우에 보훈병원 등 국가의\n의료시설이나 위탁병원으로 지정된 민간의료기관에서 진료받을 수 있\n도록 하고 있음.\n그런데 현재 보훈병원은 전국에 6개로서 그 설치된 지역이 서울, 부\n산, 광주를 비롯한 대도시이기에 지방에 거주하시는 독립유공자 및 그\n유가족의 경우에는 의료접근성이 매우 취약하고, 위탁병원으로 지정된\n민간의료기관이 부족하여 양질의 의료서비스가 제공되지 못하고 있다\n는 지적이 있음.\n이에 국가가 민간의료기관에 진료를 위탁하는 경우에는 각 지역별\n로 의료기관 수, 전문의 수, 진료과목 등에 있어 일정한 기준을 충족\n하도록 위탁함으로써 참전유공자에게 양질의 의료서비스를 제공하려\n는 것임(안 제7조제3항 신설).\n\n\n\n\n법률 제 호\n참전유공자 예우 및 단체설립에 관한 법률 일부개정법률안\n참전유공자 예우 및 단체설립에 관한 법률 일부를 다음과 같이 개정\n한다.\n제7조제3항을 제4항으로 하고, 같은 조에 제3항을 다음과 같이 신설한\n다.\n③ 제2항에 따라 진료를 위탁하는 경우 각 지역별로 의료기관 수,\n전문의 수, 진료과목 등 대통령령으로 정하는 기준을 충족하도록 하\n여야 한다.\n부 칙\n이 법은 공포 후 6개월이 경과한 날부터 시행한다.\n\n\n\n\n신ㆍ구조문대비표\n현 행 개 정 안\n제7조(의료지원) ①ㆍ② (생 략) 제7조(의료지원) ①ㆍ② (현행과\n같음)\n<신 설> ③ 제2항에 따라 진료를 위탁\n하는 경우 각 지역별로 의료기\n관 수, 전문의 수, 진료과목 등\n대통령령으로 정하는 기준을\n충족하도록 하여야 한다.\n③ (생 략) ④ (현행 제3항과 같음)\n",
  "sections": {
    "제안이유": "및",
    "주요내용": "현행법은 참전유공자가 진료가 필요한 경우에 보훈병원 등 국가의\n의료시설이나 위탁병원으로 지정된 민간의료기관에서 진료받을 수 있\n도록 하고 있음.\n그런데 현재 보훈병원은 전국에 6개로서 그 설치된 지역이 서울, 부\n산, 광주를 비롯한 대도시이기에 지방에 거주하시는 독립유공자 및 그\n유가족의 경우에는 의료접근성이 매우 취약하고, 위탁병원으로 지정된\n민간의료기관이 부족하여 양질의 의료서비스가 제공되지 못하고 있다\n는 지적이 있음.\n이에 국가가 민간의료기관에 진료를 위탁하는 경우에는 각 지역별\n로 의료기관 수, 전문의 수, 진료과목 등에 있어 일정한 기준을 충족\n하도록 위탁함으로써 참전유공자에게 양질의 의료서비스를 제공하려\n는 것임(안 제7조제3항 신설).",
    "제안이유_및_주요내용": "현행법은 참전유공자가 진료가 필요한 경우에 보훈병원 등 국가의\n의료시설이나 위탁병원으로 지정된 민간의료기관에서 진료받을 수 있\n도록 하고 있음.\n그런데 현재 보훈병원은 전국에 6개로서 그 설치된 지역이 서울, 부\n산, 광주를 비롯한 대도시이기에 지방에 거주하시는 독립유공자 및 그\n유가족의 경우에는 의료접근성이 매우 취약하고, 위탁병원으로 지정된\n민간의료기관이 부족하여 양질의 의료서비스가 제공되지 못하고 있다\n는 지적이 있음.\n이에 국가가 민간의료기관에 진료를 위탁하는 경우에는 각 지역별\n로 의료기관 수, 전문의 수, 진료과목 등에 있어 일정한 기준을 충족\n하도록 위탁함으로써 참전유공자에게 양질의 의료서비스를 제공하려\n는 것임(안 제7조제3항 신설).",
    "법률_제_호": "참전유공자 예우 및 단체설립에 관한 법률 일부개정법률안\n참전유공자 예우 및 단체설립에 관한 법률 일부를 다음과 같이 개정\n한다.\n제7조제3항을 제4항으로 하고, 같은 조에 제3항을 다음과 같이 신설한\n다.\n③ 제2항에 따라 진료를 위탁하는 경우 각 지역별로 의료기관 수,\n전문의 수, 진료과목 등 대통령령으로 정하는 기준을 충족하도록 하\n여야 한다.",
    "신구조문대비표": "현 행 개 정 안\n제7조(의료지원) ①ㆍ② (생 략) 제7조(의료지원) ①ㆍ② (현행과\n같음)\n<신 설> ③ 제2항에 따라 진료를 위탁\n하는 경우 각 지역별로 의료기\n관 수, 전문의 수, 진료과목 등\n대통령령으로 정하는 기준을\n충족하도록 하여야 한다.\n③ (생 략) ④ (현행 제3항과 같음)"
  }
}