{
  "title": "2207908_공탁법_일부개정법률안",
  "bill_number": "7908",
  "proposal_date": "2025. 2. 5.",
  "submission_date": "",
  "is_alternative": false,
  "alternative_bill_numbers": [],
  "has_comparison_table": false,
  "comparison_table": "신ㆍ구조문대비표\n현 행 개 정 안\n제5조의2(형사공탁의 특례) ① ∼ 제5조의2(형사공탁의 특례) ① ∼\n④ (생 략) ④ (현행과 같음)\n<신 설> ⑤ 공탁관은 공탁물 출급청구\n가 있는 때에는 해당 형사사건\n이 계속 중인 법원과 관할 검\n찰청에 형사공탁에 관한 내용\n을 통지하여야 한다.\n⑤ (생 략) ⑥ (현행 제5항과 같음)",
  "full_text": "공탁법 일부개정법률안\n(이인선의원 대표발의)\n발의연월일 : 2025. 2. 5.\n의 안\n7908\n번 호 발 의 자 : 이인선ㆍ강선영ㆍ고동진\n최은석ㆍ임이자ㆍ박수영\n박충권ㆍ송언석ㆍ성일종\n박상웅 의원(10인)\n제안이유 및 주요내용\n형사재판에서 피고인의 공탁금을 받지 아니하겠다는 의사를 밝혔던\n피해자가 판결 선고 전날 공탁금을 수령하는 이른바 ‘기습출급’ 사례\n가 발생하고 있음.\n현행법에 따르면 피고인의 공탁 사실은 재판부에 통지되는 반면 피\n해자의 공탁금 수령 여부는 재판부에 통지되지 아니함. 피해자가 선고\n직전 ‘기습출급’하는 경우 재판부가 피해자의 공탁금 수령 여부를 양\n형 사유로 고려하지 못하고 판결 선고를 하게 되는 상황이 초래될 수\n있음.\n이에 공탁관으로 하여금 공탁금 출급 사실을 재판부에 통지하도록\n하여 공탁제도 악용 사례의 재발을 방지하고자 함(안 제5조의2).\n\n\n\n\n법률 제 호\n공탁법 일부개정법률안\n공탁법 일부를 다음과 같이 개정한다.\n제5조의2제5항을 제6항으로 하고, 같은 조에 제5항을 다음과 같이 신\n설한다.\n⑤ 공탁관은 공탁물 출급청구가 있는 때에는 해당 형사사건이 계속\n중인 법원과 관할 검찰청에 형사공탁에 관한 내용을 통지하여야 한\n다.\n부 칙\n제1조(시행일) 이 법은 공포 후 6개월이 경과한 날부터 시행한다.\n제2조(적용례) 제5조의2의 개정규정은 이 법 시행 이후 공탁물 출급청\n구가 있는 때부터 적용한다.\n\n\n\n\n신ㆍ구조문대비표\n현 행 개 정 안\n제5조의2(형사공탁의 특례) ① ∼ 제5조의2(형사공탁의 특례) ① ∼\n④ (생 략) ④ (현행과 같음)\n<신 설> ⑤ 공탁관은 공탁물 출급청구\n가 있는 때에는 해당 형사사건\n이 계속 중인 법원과 관할 검\n찰청에 형사공탁에 관한 내용\n을 통지하여야 한다.\n⑤ (생 략) ⑥ (현행 제5항과 같음)\n",
  "sections": {
    "제안이유": "및",
    "주요내용": "형사재판에서 피고인의 공탁금을 받지 아니하겠다는 의사를 밝혔던\n피해자가 판결 선고 전날 공탁금을 수령하는 이른바 ‘기습출급’ 사례\n가 발생하고 있음.\n현행법에 따르면 피고인의 공탁 사실은 재판부에 통지되는 반면 피\n해자의 공탁금 수령 여부는 재판부에 통지되지 아니함. 피해자가 선고\n직전 ‘기습출급’하는 경우 재판부가 피해자의 공탁금 수령 여부를 양\n형 사유로 고려하지 못하고 판결 선고를 하게 되는 상황이 초래될 수\n있음.\n이에 공탁관으로 하여금 공탁금 출급 사실을 재판부에 통지하도록\n하여 공탁제도 악용 사례의 재발을 방지하고자 함(안 제5조의2).",
    "제안이유_및_주요내용": "형사재판에서 피고인의 공탁금을 받지 아니하겠다는 의사를 밝혔던\n피해자가 판결 선고 전날 공탁금을 수령하는 이른바 ‘기습출급’ 사례\n가 발생하고 있음.\n현행법에 따르면 피고인의 공탁 사실은 재판부에 통지되는 반면 피\n해자의 공탁금 수령 여부는 재판부에 통지되지 아니함. 피해자가 선고\n직전 ‘기습출급’하는 경우 재판부가 피해자의 공탁금 수령 여부를 양\n형 사유로 고려하지 못하고 판결 선고를 하게 되는 상황이 초래될 수\n있음.\n이에 공탁관으로 하여금 공탁금 출급 사실을 재판부에 통지하도록\n하여 공탁제도 악용 사례의 재발을 방지하고자 함(안 제5조의2).",
    "법률_제_호": "공탁법 일부개정법률안\n공탁법 일부를 다음과 같이 개정한다.\n제5조의2제5항을 제6항으로 하고, 같은 조에 제5항을 다음과 같이 신\n설한다.\n⑤ 공탁관은 공탁물 출급청구가 있는 때에는 해당 형사사건이 계속\n중인 법원과 관할 검찰청에 형사공탁에 관한 내용을 통지하여야 한\n다.",
    "신구조문대비표": "현 행 개 정 안\n제5조의2(형사공탁의 특례) ① ∼ 제5조의2(형사공탁의 특례) ① ∼\n④ (생 략) ④ (현행과 같음)\n<신 설> ⑤ 공탁관은 공탁물 출급청구\n가 있는 때에는 해당 형사사건\n이 계속 중인 법원과 관할 검\n찰청에 형사공탁에 관한 내용\n을 통지하여야 한다.\n⑤ (생 략) ⑥ (현행 제5항과 같음)"
  }
}