{
  "title": "2207830_공휴일에_관한_법률_일부개정법률안",
  "bill_number": "7830",
  "proposal_date": "2025. 1. 24.",
  "submission_date": "",
  "is_alternative": false,
  "alternative_bill_numbers": [],
  "has_comparison_table": false,
  "comparison_table": "신ㆍ구조문대비표\n현 행 개 정 안\n제2조(공휴일) 공휴일은 다음 각 제2조(공휴일) --------------\n호와 같다. ------.\n1. ∼ 4. (생 략) 1. ∼ 4. (현행과 같음)\n<신 설> 5. 근로자의 날(5월 1일)\n5. ∼ 10. (생 략) 6. ∼ 11. (현행 제5호부터 제1\n0호까지와 같음)",
  "full_text": "공휴일에 관한 법률 일부개정법률안\n(전종덕의원 대표발의)\n발의연월일 : 2025. 1. 24.\n의 안\n7830\n번 호 발 의 자 : 전종덕ㆍ이수진ㆍ신장식\n백선희ㆍ이해민ㆍ송옥주\n추미애ㆍ한창민ㆍ윤종오\n정혜경ㆍ송재봉ㆍ임미애\n민형배 의원(13인)\n제안이유 및 주요내용\n근로자의 날(5월 1일)은 「근로자의 날 제정에 관한 법률」과 「근\n로기준법」에 따른 유급휴일로 규정하고 있으나 현행법에 따른 공휴\n일로 지정되어 있지 아니함.\n이에 따라 민간 부문의 노동자와 공공 부문에서 「근로기준법」의\n적용을 받는 공무직 노동자 등의 경우에는 근로자의 날이 휴무일이나\n공무원에 있어서 근로자의 날은 휴무일에 해당하지 아니하여 헌법상\n보장된 행복추구권의 하나인 휴식권이 모든 국민에게 보장되지 않는\n형평성의 문제가 발생함.\n이에 근로자의 날(5월 1일)을 법정공휴일로 지정하여 사회 전반적으\n로 휴무일 운영의 통일성을 기해 모든 국민이 평등하게 휴식권을 확\n보할 수 있도록 그 근거를 마련하려는 것임(안 제2조제5호 신설).\n\n\n\n\n법률 제 호\n공휴일에 관한 법률 일부개정법률안\n공휴일에 관한 법률 일부를 다음과 같이 개정한다.\n제2조제5호부터 제10호까지를 각각 제6호부터 제11호까지로 하고, 같\n은 조에 제5호를 다음과 같이 신설한다.\n5. 근로자의 날(5월 1일)\n부 칙\n이 법은 공포한 날부터 시행한다.\n\n\n\n\n신ㆍ구조문대비표\n현 행 개 정 안\n제2조(공휴일) 공휴일은 다음 각 제2조(공휴일) --------------\n호와 같다. ------.\n1. ∼ 4. (생 략) 1. ∼ 4. (현행과 같음)\n<신 설> 5. 근로자의 날(5월 1일)\n5. ∼ 10. (생 략) 6. ∼ 11. (현행 제5호부터 제1\n0호까지와 같음)\n",
  "sections": {
    "제안이유": "및",
    "주요내용": "근로자의 날(5월 1일)은 「근로자의 날 제정에 관한 법률」과 「근\n로기준법」에 따른 유급휴일로 규정하고 있으나 현행법에 따른 공휴\n일로 지정되어 있지 아니함.\n이에 따라 민간 부문의 노동자와 공공 부문에서 「근로기준법」의\n적용을 받는 공무직 노동자 등의 경우에는 근로자의 날이 휴무일이나\n공무원에 있어서 근로자의 날은 휴무일에 해당하지 아니하여 헌법상\n보장된 행복추구권의 하나인 휴식권이 모든 국민에게 보장되지 않는\n형평성의 문제가 발생함.\n이에 근로자의 날(5월 1일)을 법정공휴일로 지정하여 사회 전반적으\n로 휴무일 운영의 통일성을 기해 모든 국민이 평등하게 휴식권을 확\n보할 수 있도록 그 근거를 마련하려는 것임(안 제2조제5호 신설).",
    "제안이유_및_주요내용": "근로자의 날(5월 1일)은 「근로자의 날 제정에 관한 법률」과 「근\n로기준법」에 따른 유급휴일로 규정하고 있으나 현행법에 따른 공휴\n일로 지정되어 있지 아니함.\n이에 따라 민간 부문의 노동자와 공공 부문에서 「근로기준법」의\n적용을 받는 공무직 노동자 등의 경우에는 근로자의 날이 휴무일이나\n공무원에 있어서 근로자의 날은 휴무일에 해당하지 아니하여 헌법상\n보장된 행복추구권의 하나인 휴식권이 모든 국민에게 보장되지 않는\n형평성의 문제가 발생함.\n이에 근로자의 날(5월 1일)을 법정공휴일로 지정하여 사회 전반적으\n로 휴무일 운영의 통일성을 기해 모든 국민이 평등하게 휴식권을 확\n보할 수 있도록 그 근거를 마련하려는 것임(안 제2조제5호 신설).",
    "법률_제_호": "공휴일에 관한 법률 일부개정법률안\n공휴일에 관한 법률 일부를 다음과 같이 개정한다.\n제2조제5호부터 제10호까지를 각각 제6호부터 제11호까지로 하고, 같\n은 조에 제5호를 다음과 같이 신설한다.\n5. 근로자의 날(5월 1일)",
    "신구조문대비표": "현 행 개 정 안\n제2조(공휴일) 공휴일은 다음 각 제2조(공휴일) --------------\n호와 같다. ------.\n1. ∼ 4. (생 략) 1. ∼ 4. (현행과 같음)\n<신 설> 5. 근로자의 날(5월 1일)\n5. ∼ 10. (생 략) 6. ∼ 11. (현행 제5호부터 제1\n0호까지와 같음)"
  }
}