{
  "title": "2207389_제주특별자치도_설치_및_국제자유도시_조성을_위한_특별법_일부개정법률안",
  "bill_number": "7389",
  "proposal_date": "2025. 1. 9.",
  "submission_date": "",
  "is_alternative": false,
  "alternative_bill_numbers": [],
  "has_comparison_table": false,
  "comparison_table": "신ㆍ구조문대비표\n현 행 개 정 안\n법률 제16774호 제주특별자치도 법률 제16774호 제주특별자치도\n설치 및 국제자유도시 조성을 설치 및 국제자유도시 조성을\n위한 특별법 일부개정법률 위한 특별법 일부개정법률\n",
  "full_text": "제주특별자치도 설치 및 국제자유도시 조성을 위한 특별법\n일부개정법률안\n(위성곤의원 대표발의)\n발의연월일 : 2025. 1. 9.\n의 안\n7389\n번 호 발 의 자 : 위성곤ㆍ모경종ㆍ허 영\n주철현ㆍ박희승ㆍ한병도\n서영교ㆍ김한규ㆍ이개호\n박정현 의원(10인)\n제안이유 및 주요내용\n동법은 제주특별자치도의 행정적ㆍ재정적 지원 방안 마련, 중앙권한\n의 단계적 이양 등을 심의하기 위하여 국무총리 소속으로 지원위원회\n를 두고, 그 사무를 처리하기 위하여 사무기구를 설치하도록 하였음.\n이에 해당 사무기구가 지방분권 실현을 위한 제도개선 과제의 발굴\n및 부처협의, 갈등 조정 등 컨트롤타워 역할하고 있으며, 제주특별자\n치도의 분권모델 완성을 위해 지속적인 업무 수행이 필요함.\n그러나 동법에서 최초 부칙으로 사무기구의 유효기간을 설정한 탓\n에 2006년 7월 이후 유효기간 연장을 위한 부칙 개정을 4차례나 반복\n하고, 현재는 법적 근거 없이 국무총리 훈령으로 그 설치 근거를 두고\n있는 실정이며, 이는 유사업무를 수행하는 제주특별자치도 이후 출범\n한 다른 특별자치시도의 지원위원회 사무기구가 상설조직인 것을 고\n\n\n\n려할 때 형평성에도 맞지 않는 문제가 있음.\n이에 제주특별자치도 지원위원회 사무기구의 유효기간을 삭제하여\n상설화함으로써 제도개선 과제 이행 등을 지속적으로 지원하는 한편\n제주특별자치도의 지방분권 실현에 기여하려는 것임(안 법률 제16774\n호 제주특별자치도 설치 및 국제자유도시 조성을 위한 특별법 일부개\n정법률 부칙 제2조 삭제).\n\n법률 제 호\n제주특별자치도 설치 및 국제자유도시 조성을 위한 특별법\n일부개정법률안\n제주특별자치도 설치 및 국제자유도시 조성을 위한 특별법 일부를 다\n음과 같이 개정한다.\n법률 제16774호 제주특별자치도 설치 및 국제자유도시 조성을 위한\n특별법 일부개정법률 부칙 제2조를 삭제한다.\n부 칙\n이 법은 공포한 날부터 시행한다.\n\n\n\n\n신ㆍ구조문대비표\n현 행 개 정 안\n법률 제16774호 제주특별자치도 법률 제16774호 제주특별자치도\n설치 및 국제자유도시 조성을 설치 및 국제자유도시 조성을\n위한 특별법 일부개정법률 위한 특별법 일부개정법률\n부칙 부칙\n제2조 (유효기간) 제18조의2의 <삭 제>\n개정규정은 2021년 6월 30일까\n지 효력을 가진다.\n",
  "sections": {
    "제안이유": "및",
    "주요내용": "동법은 제주특별자치도의 행정적ㆍ재정적 지원 방안 마련, 중앙권한\n의 단계적 이양 등을 심의하기 위하여 국무총리 소속으로 지원위원회\n를 두고, 그 사무를 처리하기 위하여 사무기구를 설치하도록 하였음.\n이에 해당 사무기구가 지방분권 실현을 위한 제도개선 과제의 발굴\n및 부처협의, 갈등 조정 등 컨트롤타워 역할하고 있으며, 제주특별자\n치도의 분권모델 완성을 위해 지속적인 업무 수행이 필요함.\n그러나 동법에서 최초 부칙으로 사무기구의 유효기간을 설정한 탓\n에 2006년 7월 이후 유효기간 연장을 위한 부칙 개정을 4차례나 반복\n하고, 현재는 법적 근거 없이 국무총리 훈령으로 그 설치 근거를 두고\n있는 실정이며, 이는 유사업무를 수행하는 제주특별자치도 이후 출범\n한 다른 특별자치시도의 지원위원회 사무기구가 상설조직인 것을 고\n\n\n\n려할 때 형평성에도 맞지 않는 문제가 있음.\n이에 제주특별자치도 지원위원회 사무기구의 유효기간을 삭제하여\n상설화함으로써 제도개선 과제 이행 등을 지속적으로 지원하는 한편\n제주특별자치도의 지방분권 실현에 기여하려는 것임(안",
    "제안이유_및_주요내용": "동법은 제주특별자치도의 행정적ㆍ재정적 지원 방안 마련, 중앙권한\n의 단계적 이양 등을 심의하기 위하여 국무총리 소속으로 지원위원회\n를 두고, 그 사무를 처리하기 위하여 사무기구를 설치하도록 하였음.\n이에 해당 사무기구가 지방분권 실현을 위한 제도개선 과제의 발굴\n및 부처협의, 갈등 조정 등 컨트롤타워 역할하고 있으며, 제주특별자\n치도의 분권모델 완성을 위해 지속적인 업무 수행이 필요함.\n그러나 동법에서 최초 부칙으로 사무기구의 유효기간을 설정한 탓\n에 2006년 7월 이후 유효기간 연장을 위한 부칙 개정을 4차례나 반복\n하고, 현재는 법적 근거 없이 국무총리 훈령으로 그 설치 근거를 두고\n있는 실정이며, 이는 유사업무를 수행하는 제주특별자치도 이후 출범\n한 다른 특별자치시도의 지원위원회 사무기구가 상설조직인 것을 고\n\n\n\n려할 때 형평성에도 맞지 않는 문제가 있음.\n이에 제주특별자치도 지원위원회 사무기구의 유효기간을 삭제하여\n상설화함으로써 제도개선 과제 이행 등을 지속적으로 지원하는 한편\n제주특별자치도의 지방분권 실현에 기여하려는 것임(안",
    "법률_제_호": "제주특별자치도 설치 및 국제자유도시 조성을 위한 특별법 일부개\n정법률",
    "신구조문대비표": "현 행 개 정 안\n법률 제16774호 제주특별자치도 법률 제16774호 제주특별자치도\n설치 및 국제자유도시 조성을 설치 및 국제자유도시 조성을\n위한 특별법 일부개정법률 위한 특별법 일부개정법률"
  }
}