{
  "title": "2207554_대통령_등의_경호에_관한_법률_일부개정법률안",
  "bill_number": "7554",
  "proposal_date": "2025. 1. 15.",
  "submission_date": "",
  "is_alternative": false,
  "alternative_bill_numbers": [],
  "has_comparison_table": false,
  "comparison_table": "신ㆍ구조문대비표\n현 행 개 정 안\n제3조(대통령경호처장 등) ① ∼ 제3조(대통령경호처장 등) ① ∼\n③ (생 략) ③ (현행과 같음)\n<신 설> ④ 처장이 직무를 집행함에 있\n어 헌법이나 법률을 위배하였\n을 때에는 국회는 탄핵 소추를\n의결할 수 있다.",
  "full_text": "대통령 등의 경호에 관한 법률 일부개정법률안\n(윤준병의원 대표발의)\n발의연월일 : 2025. 1. 15.\n의 안\n7554\n번 호 발 의 자 : 윤준병ㆍ박민규ㆍ조계원\n정동영ㆍ황명선ㆍ강준현\n안호영ㆍ김문수ㆍ민병덕\n신영대ㆍ김태선ㆍ문정복\n의원(12인)\n제안이유 및 주요내용\n「대한민국헌법」 제65조에 따라 대통령ㆍ국무총리ㆍ국무위원ㆍ행\n정각부의 장ㆍ헌법재판소 재판관ㆍ법관ㆍ중앙선거관리위원회 위원ㆍ\n감사원장ㆍ감사위원 및 기타 법률이 정한 공무원이 그 직무집행에 있\n어서 헌법이나 법률을 위배한 때에는 국회는 탄핵의 소추를 의결할\n수 있도록 규정하고 있음. 이에 따라 경찰청장 및 국가수사본부장, 원\n자력안전위원장, 방송통신위원장 등은 각 개별 법률에서 정하는 바에\n따라 국회가 탄핵 소추를 의결할 수 있도록 명시하고 있음.\n이와 관련, 대통령경호처장은 대통령 등의 생명과 재산을 보호하기\n위한 경호업무를 총괄하며 그 업무수행의 객관성·중립성이 중요함에도\n불구하고, 헌법과 법률의 범위를 벗어난 자의적인 판단으로 직권을 남\n용하거나 헌법과 법률을 중대하게 위반하더라도 이에 대한 책임을 묻\n거나 통제할 수 있는 법적 수단이 없는 실정임.\n\n\n\n이에 대통령경호처에 대한 국회의 통제수단을 마련하기 위하여 대\n통령경호처장이 그 직무집행에 있어서 헌법이나 법률을 위배한 때에\n는 탄핵소추를 의결할 수 있도록 하려는 것임(안 제3조제4항 신설).\n\n법률 제 호\n대통령 등의 경호에 관한 법률 일부개정법률안\n대통령 등의 경호에 관한 법률 일부를 다음과 같이 개정한다.\n제3조에 제4항을 다음과 같이 신설한다.\n④ 처장이 직무를 집행함에 있어 헌법이나 법률을 위배하였을 때에\n는 국회는 탄핵 소추를 의결할 수 있다.\n부 칙\n이 법은 공포한 날부터 시행한다.\n\n\n\n\n신ㆍ구조문대비표\n현 행 개 정 안\n제3조(대통령경호처장 등) ① ∼ 제3조(대통령경호처장 등) ① ∼\n③ (생 략) ③ (현행과 같음)\n<신 설> ④ 처장이 직무를 집행함에 있\n어 헌법이나 법률을 위배하였\n을 때에는 국회는 탄핵 소추를\n의결할 수 있다.\n",
  "sections": {
    "제안이유": "및",
    "주요내용": "「대한민국헌법」 제65조에 따라 대통령ㆍ국무총리ㆍ국무위원ㆍ행\n정각부의 장ㆍ헌법재판소 재판관ㆍ법관ㆍ중앙선거관리위원회 위원ㆍ\n감사원장ㆍ감사위원 및 기타 법률이 정한 공무원이 그 직무집행에 있\n어서 헌법이나 법률을 위배한 때에는 국회는 탄핵의 소추를 의결할\n수 있도록 규정하고 있음. 이에 따라 경찰청장 및 국가수사본부장, 원\n자력안전위원장, 방송통신위원장 등은 각 개별 법률에서 정하는 바에\n따라 국회가 탄핵 소추를 의결할 수 있도록 명시하고 있음.\n이와 관련, 대통령경호처장은 대통령 등의 생명과 재산을 보호하기\n위한 경호업무를 총괄하며 그 업무수행의 객관성·중립성이 중요함에도\n불구하고, 헌법과 법률의 범위를 벗어난 자의적인 판단으로 직권을 남\n용하거나 헌법과 법률을 중대하게 위반하더라도 이에 대한 책임을 묻\n거나 통제할 수 있는 법적 수단이 없는 실정임.\n\n\n\n이에 대통령경호처에 대한 국회의 통제수단을 마련하기 위하여 대\n통령경호처장이 그 직무집행에 있어서 헌법이나 법률을 위배한 때에\n는 탄핵소추를 의결할 수 있도록 하려는 것임(안 제3조제4항 신설).",
    "제안이유_및_주요내용": "「대한민국헌법」 제65조에 따라 대통령ㆍ국무총리ㆍ국무위원ㆍ행\n정각부의 장ㆍ헌법재판소 재판관ㆍ법관ㆍ중앙선거관리위원회 위원ㆍ\n감사원장ㆍ감사위원 및 기타 법률이 정한 공무원이 그 직무집행에 있\n어서 헌법이나 법률을 위배한 때에는 국회는 탄핵의 소추를 의결할\n수 있도록 규정하고 있음. 이에 따라 경찰청장 및 국가수사본부장, 원\n자력안전위원장, 방송통신위원장 등은 각 개별 법률에서 정하는 바에\n따라 국회가 탄핵 소추를 의결할 수 있도록 명시하고 있음.\n이와 관련, 대통령경호처장은 대통령 등의 생명과 재산을 보호하기\n위한 경호업무를 총괄하며 그 업무수행의 객관성·중립성이 중요함에도\n불구하고, 헌법과 법률의 범위를 벗어난 자의적인 판단으로 직권을 남\n용하거나 헌법과 법률을 중대하게 위반하더라도 이에 대한 책임을 묻\n거나 통제할 수 있는 법적 수단이 없는 실정임.\n\n\n\n이에 대통령경호처에 대한 국회의 통제수단을 마련하기 위하여 대\n통령경호처장이 그 직무집행에 있어서 헌법이나 법률을 위배한 때에\n는 탄핵소추를 의결할 수 있도록 하려는 것임(안 제3조제4항 신설).",
    "법률_제_호": "대통령 등의 경호에 관한 법률 일부개정법률안\n대통령 등의 경호에 관한 법률 일부를 다음과 같이 개정한다.\n제3조에 제4항을 다음과 같이 신설한다.\n④ 처장이 직무를 집행함에 있어 헌법이나 법률을 위배하였을 때에\n는 국회는 탄핵 소추를 의결할 수 있다.",
    "신구조문대비표": "현 행 개 정 안\n제3조(대통령경호처장 등) ① ∼ 제3조(대통령경호처장 등) ① ∼\n③ (생 략) ③ (현행과 같음)\n<신 설> ④ 처장이 직무를 집행함에 있\n어 헌법이나 법률을 위배하였\n을 때에는 국회는 탄핵 소추를\n의결할 수 있다."
  }
}