{
  "title": "2207185_환경보건법_일부개정법률안",
  "bill_number": "7185",
  "proposal_date": "2024. 12. 31.",
  "submission_date": "",
  "is_alternative": false,
  "alternative_bill_numbers": [],
  "has_comparison_table": false,
  "comparison_table": "신ㆍ구조문대비표\n현 행 개 정 안\n<신 설> 제30조의2(벌칙 적용에서 공무원\n의제) 위원회(위원회에 전문위\n원회를 설치한 경우 전문위원\n회를 포함한다) 및 지역위원회\n의 위원 중 공무원이 아닌 사\n람은 「형법」 제129조부터 제\n132조까지를 적용할 때에는 공\n무원으로 본다.",
  "full_text": "환경보건법 일부개정법률안\n(진성준의원 대표발의)\n발의연월일 : 2024. 12. 31.\n의 안\n7185\n번 호 발 의 자 : 진성준ㆍ허 영ㆍ박해철\n김주영ㆍ강선우ㆍ양문석\n위성곤ㆍ정을호ㆍ정태호\n임광현ㆍ문진석ㆍ김태년\n의원(12인)\n제안이유 및 주요내용\n「행정기관 소속 위원회의 설치ㆍ운영에 관한 법률」은 행정기관의\n장은 국민의 권리ㆍ의무와 관련되는 인ㆍ허가, 분쟁 조정 등 공정하고\n객관적인 심의ㆍ의결이 필요한 위원회를 설치할 때에는 공무원이 아\n닌 위원에 대한 벌칙 적용에서 공무원 의제에 관한 사항이 관련 법률\n에 명시되도록 필요한 조치를 하도록 규정하고 있음.\n이와 관련하여 현행법의 ‘환경보건위원회(이하 “위원회”라 한다)’는\n환경보건종합계획의 수립과 변경ㆍ환경성질환의 지정ㆍ환경보건의 증\n진에 관한 시책 등을 심의하고, ‘지역환경보건위원회(이하 “지역위원\n회”라 한다)’는 지역환경보건계획의 수립과 변경ㆍ관할구역의 환경보\n건 증진을 위한 시책 등을 심의하는 등 국민의 권리ㆍ의무와 관련되\n는 사안을 결정하고 있으므로 위원회의 공정성과 책임성을 기하기 위\n하여 공무원이 아닌 위원에 대한 벌칙 적용에서 공무원 의제 규정이\n\n\n\n필요하다는 의견이 있음.\n이에 위원회(위원회에 전문위원회를 설치한 경우 전문위원회를 포함\n한다) 및 지역위원회의 위원 중 공무원이 아닌 사람은 「형법」에 따\n른 뇌물 관련 범죄의 경우에는 공무원으로 보도록 하여 그 책임성을\n제고하려는 것임(안 제30조의2 신설).\n\n법률 제 호\n환경보건법 일부개정법률안\n환경보건법 일부를 다음과 같이 개정한다.\n제5장에 제30조의2를 다음과 같이 신설한다.\n제30조의2(벌칙 적용에서 공무원 의제) 위원회(위원회에 전문위원회를\n설치한 경우 전문위원회를 포함한다) 및 지역위원회의 위원 중 공무\n원이 아닌 사람은 「형법」 제129조부터 제132조까지를 적용할 때\n에는 공무원으로 본다.\n부 칙\n이 법은 공포 후 6개월이 경과한 날부터 시행한다.\n\n\n\n\n신ㆍ구조문대비표\n현 행 개 정 안\n<신 설> 제30조의2(벌칙 적용에서 공무원\n의제) 위원회(위원회에 전문위\n원회를 설치한 경우 전문위원\n회를 포함한다) 및 지역위원회\n의 위원 중 공무원이 아닌 사\n람은 「형법」 제129조부터 제\n132조까지를 적용할 때에는 공\n무원으로 본다.\n",
  "sections": {
    "제안이유": "및",
    "주요내용": "「행정기관 소속 위원회의 설치ㆍ운영에 관한 법률」은 행정기관의\n장은 국민의 권리ㆍ의무와 관련되는 인ㆍ허가, 분쟁 조정 등 공정하고\n객관적인 심의ㆍ의결이 필요한 위원회를 설치할 때에는 공무원이 아\n닌 위원에 대한 벌칙 적용에서 공무원 의제에 관한 사항이 관련 법률\n에 명시되도록 필요한 조치를 하도록 규정하고 있음.\n이와 관련하여 현행법의 ‘환경보건위원회(이하 “위원회”라 한다)’는\n환경보건종합계획의 수립과 변경ㆍ환경성질환의 지정ㆍ환경보건의 증\n진에 관한 시책 등을 심의하고, ‘지역환경보건위원회(이하 “지역위원\n회”라 한다)’는 지역환경보건계획의 수립과 변경ㆍ관할구역의 환경보\n건 증진을 위한 시책 등을 심의하는 등 국민의 권리ㆍ의무와 관련되\n는 사안을 결정하고 있으므로 위원회의 공정성과 책임성을 기하기 위\n하여 공무원이 아닌 위원에 대한 벌칙 적용에서 공무원 의제 규정이\n\n\n\n필요하다는 의견이 있음.\n이에 위원회(위원회에 전문위원회를 설치한 경우 전문위원회를 포함\n한다) 및 지역위원회의 위원 중 공무원이 아닌 사람은 「형법」에 따\n른 뇌물 관련 범죄의 경우에는 공무원으로 보도록 하여 그 책임성을\n제고하려는 것임(안 제30조의2 신설).",
    "제안이유_및_주요내용": "「행정기관 소속 위원회의 설치ㆍ운영에 관한 법률」은 행정기관의\n장은 국민의 권리ㆍ의무와 관련되는 인ㆍ허가, 분쟁 조정 등 공정하고\n객관적인 심의ㆍ의결이 필요한 위원회를 설치할 때에는 공무원이 아\n닌 위원에 대한 벌칙 적용에서 공무원 의제에 관한 사항이 관련 법률\n에 명시되도록 필요한 조치를 하도록 규정하고 있음.\n이와 관련하여 현행법의 ‘환경보건위원회(이하 “위원회”라 한다)’는\n환경보건종합계획의 수립과 변경ㆍ환경성질환의 지정ㆍ환경보건의 증\n진에 관한 시책 등을 심의하고, ‘지역환경보건위원회(이하 “지역위원\n회”라 한다)’는 지역환경보건계획의 수립과 변경ㆍ관할구역의 환경보\n건 증진을 위한 시책 등을 심의하는 등 국민의 권리ㆍ의무와 관련되\n는 사안을 결정하고 있으므로 위원회의 공정성과 책임성을 기하기 위\n하여 공무원이 아닌 위원에 대한 벌칙 적용에서 공무원 의제 규정이\n\n\n\n필요하다는 의견이 있음.\n이에 위원회(위원회에 전문위원회를 설치한 경우 전문위원회를 포함\n한다) 및 지역위원회의 위원 중 공무원이 아닌 사람은 「형법」에 따\n른 뇌물 관련 범죄의 경우에는 공무원으로 보도록 하여 그 책임성을\n제고하려는 것임(안 제30조의2 신설).",
    "법률_제_호": "환경보건법 일부개정법률안\n환경보건법 일부를 다음과 같이 개정한다.\n제5장에 제30조의2를 다음과 같이 신설한다.\n제30조의2(벌칙 적용에서 공무원 의제) 위원회(위원회에 전문위원회를\n설치한 경우 전문위원회를 포함한다) 및 지역위원회의 위원 중 공무\n원이 아닌 사람은 「형법」 제129조부터 제132조까지를 적용할 때\n에는 공무원으로 본다.",
    "신구조문대비표": "현 행 개 정 안\n<신 설> 제30조의2(벌칙 적용에서 공무원\n의제) 위원회(위원회에 전문위\n원회를 설치한 경우 전문위원\n회를 포함한다) 및 지역위원회\n의 위원 중 공무원이 아닌 사\n람은 「형법」 제129조부터 제\n132조까지를 적용할 때에는 공\n무원으로 본다."
  }
}