{
  "title": "2207251_공무원연금법_일부개정법률안",
  "bill_number": "7251",
  "proposal_date": "2025. 1. 6.",
  "submission_date": "",
  "is_alternative": false,
  "alternative_bill_numbers": [],
  "has_comparison_table": false,
  "comparison_table": "신ㆍ구조문대비표\n현 행 개 정 안\n제62조(퇴직수당) ① (생 략) 제62조(퇴직수당) ① (현행과 같\n음)\n② 제1항의 퇴직수당은 다음의 ② 제1항의 퇴직수당은 다음의\n계산식에 따라 산출한다. 계산식에 따라 산출한다.\n재직기간 × 기준소득월액 × 재직기간 × 기준소득월액 ×\n대통령령으로 정하는 비율 100분의 39\n③ (생 략) ③ (현행과 같음)",
  "full_text": "공무원연금법 일부개정법률안\n(박정현의원 대표발의)\n발의연월일 : 2025. 1. 6.\n의 안\n7251\n번 호 발 의 자 : 박정현ㆍ김남근ㆍ김한규\n박홍배ㆍ박희승ㆍ서미화\n위성곤ㆍ이용우ㆍ민병덕\n이광희ㆍ김현정ㆍ박지혜\n의원(12인)\n제안이유 및 주요내용\n1991년 시행된 공무원 퇴직수당의 본래 취지는 국민연금제도 도입\n으로 퇴직금과 국민연금을 모두 수령받는 민간에 비해 공무원은 연금\n에만 의존하는 불균형한 상황을 해소하기 위함이었음. 공무원 퇴직수\n당 도입 당시 장기적으로 민간 부분의 퇴직금과 균형을 맞춰나갈 계\n획임을 명시했으나 30년이 지난 현재까지도 재직기간에 따른 지급액\n누진제 적용으로 매우 불균형한 상황임.\n현행법령은 공무원이 1년 이상 재직하고 퇴직하거나 사망한 경우에\n는 퇴직수당을 지급한다고 하면서, 재직기간×기준소득월액×대통령령\n으로 정하는 비율의 계산식에 따라 퇴직수당을 산출하고, 시행령에서\n재직기간에 따라 비율에 차등을 두고 있음.\n그러나 재직기간 5년 미만 퇴직자의 경우 그 비율이 6.5%에 지나지\n\n\n\n않고 20년 이상 근속하더라도 39%로 상한이 정해져 있어 지나치게\n불평등하다는 비판이 이어지고 있음. 또한 각종 개방형 직위가 증가하\n고 있는 상황에서 현행 퇴직수당 제도는 이들에 대한 역차별이 될 가\n능성이 있다는 지적마저 제기되는 상황임.\n이에 퇴직수당 계산식을 재직기간×기준소득월액×100분의 39로 법에\n서 규정함으로써 재직자들 간의 형평성을 향상하고, 변화하는 공직사\n회와 인사구조에 대응하려는 것임(안 제62조제2항).\n\n법률 제 호\n공무원연금법 일부개정법률안\n공무원연금법 일부를 다음과 같이 개정한다.\n제62조제2항을 다음과 같이 한다.\n② 제1항의 퇴직수당은 다음의 계산식에 따라 산출한다.\n재직기간 × 기준소득월액 × 100분의 39\n부 칙\n제1조(시행일) 이 법은 공포 후 3개월이 경과한 날부터 시행한다.\n제2조(퇴직수당의 계산에 관한 적용례) 제62조제2항의 개정규정은 이\n법 시행 후 퇴직수당의 사유가 발생하는 사람부터 적용한다.\n\n\n\n\n신ㆍ구조문대비표\n현 행 개 정 안\n제62조(퇴직수당) ① (생 략) 제62조(퇴직수당) ① (현행과 같\n음)\n② 제1항의 퇴직수당은 다음의 ② 제1항의 퇴직수당은 다음의\n계산식에 따라 산출한다. 계산식에 따라 산출한다.\n재직기간 × 기준소득월액 × 재직기간 × 기준소득월액 ×\n대통령령으로 정하는 비율 100분의 39\n③ (생 략) ③ (현행과 같음)\n",
  "sections": {
    "제안이유": "및",
    "주요내용": "1991년 시행된 공무원 퇴직수당의 본래 취지는 국민연금제도 도입\n으로 퇴직금과 국민연금을 모두 수령받는 민간에 비해 공무원은 연금\n에만 의존하는 불균형한 상황을 해소하기 위함이었음. 공무원 퇴직수\n당 도입 당시 장기적으로 민간 부분의 퇴직금과 균형을 맞춰나갈 계\n획임을 명시했으나 30년이 지난 현재까지도 재직기간에 따른 지급액\n누진제 적용으로 매우 불균형한 상황임.\n현행법령은 공무원이 1년 이상 재직하고 퇴직하거나 사망한 경우에\n는 퇴직수당을 지급한다고 하면서, 재직기간×기준소득월액×대통령령\n으로 정하는 비율의 계산식에 따라 퇴직수당을 산출하고, 시행령에서\n재직기간에 따라 비율에 차등을 두고 있음.\n그러나 재직기간 5년 미만 퇴직자의 경우 그 비율이 6.5%에 지나지\n\n\n\n않고 20년 이상 근속하더라도 39%로 상한이 정해져 있어 지나치게\n불평등하다는 비판이 이어지고 있음. 또한 각종 개방형 직위가 증가하\n고 있는 상황에서 현행 퇴직수당 제도는 이들에 대한 역차별이 될 가\n능성이 있다는 지적마저 제기되는 상황임.\n이에 퇴직수당 계산식을 재직기간×기준소득월액×100분의 39로 법에\n서 규정함으로써 재직자들 간의 형평성을 향상하고, 변화하는 공직사\n회와 인사구조에 대응하려는 것임(안 제62조제2항).",
    "제안이유_및_주요내용": "1991년 시행된 공무원 퇴직수당의 본래 취지는 국민연금제도 도입\n으로 퇴직금과 국민연금을 모두 수령받는 민간에 비해 공무원은 연금\n에만 의존하는 불균형한 상황을 해소하기 위함이었음. 공무원 퇴직수\n당 도입 당시 장기적으로 민간 부분의 퇴직금과 균형을 맞춰나갈 계\n획임을 명시했으나 30년이 지난 현재까지도 재직기간에 따른 지급액\n누진제 적용으로 매우 불균형한 상황임.\n현행법령은 공무원이 1년 이상 재직하고 퇴직하거나 사망한 경우에\n는 퇴직수당을 지급한다고 하면서, 재직기간×기준소득월액×대통령령\n으로 정하는 비율의 계산식에 따라 퇴직수당을 산출하고, 시행령에서\n재직기간에 따라 비율에 차등을 두고 있음.\n그러나 재직기간 5년 미만 퇴직자의 경우 그 비율이 6.5%에 지나지\n\n\n\n않고 20년 이상 근속하더라도 39%로 상한이 정해져 있어 지나치게\n불평등하다는 비판이 이어지고 있음. 또한 각종 개방형 직위가 증가하\n고 있는 상황에서 현행 퇴직수당 제도는 이들에 대한 역차별이 될 가\n능성이 있다는 지적마저 제기되는 상황임.\n이에 퇴직수당 계산식을 재직기간×기준소득월액×100분의 39로 법에\n서 규정함으로써 재직자들 간의 형평성을 향상하고, 변화하는 공직사\n회와 인사구조에 대응하려는 것임(안 제62조제2항).",
    "법률_제_호": "공무원연금법 일부개정법률안\n공무원연금법 일부를 다음과 같이 개정한다.\n제62조제2항을 다음과 같이 한다.\n② 제1항의 퇴직수당은 다음의 계산식에 따라 산출한다.\n재직기간 × 기준소득월액 × 100분의 39",
    "신구조문대비표": "현 행 개 정 안\n제62조(퇴직수당) ① (생 략) 제62조(퇴직수당) ① (현행과 같\n음)\n② 제1항의 퇴직수당은 다음의 ② 제1항의 퇴직수당은 다음의\n계산식에 따라 산출한다. 계산식에 따라 산출한다.\n재직기간 × 기준소득월액 × 재직기간 × 기준소득월액 ×\n대통령령으로 정하는 비율 100분의 39\n③ (생 략) ③ (현행과 같음)"
  }
}