{
  "title": "2207970_어린이제품_안전_특별법_일부개정법률안",
  "bill_number": "7970",
  "proposal_date": "2025. 2. 7.",
  "submission_date": "",
  "is_alternative": false,
  "alternative_bill_numbers": [],
  "has_comparison_table": false,
  "comparison_table": "신ㆍ구조문대비표\n현 행 개 정 안\n제22조(안전확인 신고 등) ① ∼ 제22조(안전확인 신고 등) ① ∼\n④ (생 략) ④ (현행과 같음)\n⑤ 제1항에 따른 안전확인의 <삭 제>\n유효기간은 5년으로 하되, 안전\n확인의 신고가 수리된 날부터\n기산(起算)한다.\n⑥ ∼ ⑫ (생 략) ⑥ ∼ ⑫ (현행과 같음)",
  "full_text": "어린이제품 안전 특별법 일부개정법률안\n(서일준의원 대표발의)\n발의연월일 : 2025. 2. 7.\n의 안\n7970\n번 호 발 의 자 : 서일준ㆍ최보윤ㆍ김 건\n이헌승ㆍ박성민ㆍ김은혜\n고동진ㆍ서범수ㆍ김위상\n정동만ㆍ이철규ㆍ윤영석\n박정하 의원(13인)\n제안이유 및 주요내용\n현행법에 따라 완구, 유아용 섬유제품, 학용품 등 ‘안전확인대상 어\n린이제품’의 제조업자 또는 수입업자는 산업부가 지정한 시험ㆍ검사기\n관으로부터 안전성에 대한 시험‧검사를 받아 해당 어린이제품이 안전\n기준에 적합함을 확인한 후, 이를 안전인증기관에 신고하여야 하며 이\n러한 안전확인신고의 유효기간은 신고가 수리된 날로부터 5년으로 규\n정되어 있음.\n2022년 8월 4일 시행된 동법 개정법률안에 따라 산업부는 ‘안전확인\n대상 어린이제품’이 안전기준에 적합하지 아니한 경우 등에 대해 해당\n어린이제품의 안전확인신고 효력상실 처분을 할 수 있게 되어 안전관\n리가 강화된 바 있음.\n다만, 안전기준에 부적합한 ‘안전확인대상 어린이제품’에 대해 안전\n확인신고 효력상실처분이 가능함에도, 현행법에는 안전확인신고 유효\n\n\n\n기간이 5년으로 규정되어 제조업자 또는 수입업자는 안전확인신고 후\n5년이 지난 어린이제품에 대해 제품검사 수수료 등을 부담하며 추가\n로 안전확인신고를 해야 하므로 전기생활용품안전법에 따른 안전확인\n대상 생활용품의 경우와 비교하여 이중 규제로 볼 수 있음.\n안전확인대상 생활용품의 경우 2017년 1월 28일 전기생활용품안전\n법 개정법률안의 시행으로 안전확인신고 효력상실처분 규정이 도입됨\n과 동시에 안전확인신고 유효기간(5년)은 폐지되었음.\n이에, 안전확인대상 어린이제품의 안전확인 유효기간을 폐지하고자\n함(안 제22조제5항 삭제).\n\n법률 제 호\n어린이제품 안전 특별법 일부개정법률안\n어린이제품 안전 특별법 일부를 다음과 같이 개정한다.\n제22조제5항을 삭제한다.\n부 칙\n이 법은 공포 후 6개월이 경과한 날부터 시행한다.\n\n\n\n\n신ㆍ구조문대비표\n현 행 개 정 안\n제22조(안전확인 신고 등) ① ∼ 제22조(안전확인 신고 등) ① ∼\n④ (생 략) ④ (현행과 같음)\n⑤ 제1항에 따른 안전확인의 <삭 제>\n유효기간은 5년으로 하되, 안전\n확인의 신고가 수리된 날부터\n기산(起算)한다.\n⑥ ∼ ⑫ (생 략) ⑥ ∼ ⑫ (현행과 같음)\n",
  "sections": {
    "제안이유": "및",
    "주요내용": "현행법에 따라 완구, 유아용 섬유제품, 학용품 등 ‘안전확인대상 어\n린이제품’의 제조업자 또는 수입업자는 산업부가 지정한 시험ㆍ검사기\n관으로부터 안전성에 대한 시험‧검사를 받아 해당 어린이제품이 안전\n기준에 적합함을 확인한 후, 이를 안전인증기관에 신고하여야 하며 이\n러한 안전확인신고의 유효기간은 신고가 수리된 날로부터 5년으로 규\n정되어 있음.\n2022년 8월 4일 시행된 동법 개정법률안에 따라 산업부는 ‘안전확인\n대상 어린이제품’이 안전기준에 적합하지 아니한 경우 등에 대해 해당\n어린이제품의 안전확인신고 효력상실 처분을 할 수 있게 되어 안전관\n리가 강화된 바 있음.\n다만, 안전기준에 부적합한 ‘안전확인대상 어린이제품’에 대해 안전\n확인신고 효력상실처분이 가능함에도, 현행법에는 안전확인신고 유효\n\n\n\n기간이 5년으로 규정되어 제조업자 또는 수입업자는 안전확인신고 후\n5년이 지난 어린이제품에 대해 제품검사 수수료 등을 부담하며 추가\n로 안전확인신고를 해야 하므로 전기생활용품안전법에 따른 안전확인\n대상 생활용품의 경우와 비교하여 이중 규제로 볼 수 있음.\n안전확인대상 생활용품의 경우 2017년 1월 28일 전기생활용품안전\n법 개정법률안의 시행으로 안전확인신고 효력상실처분 규정이 도입됨\n과 동시에 안전확인신고 유효기간(5년)은 폐지되었음.\n이에, 안전확인대상 어린이제품의 안전확인 유효기간을 폐지하고자\n함(안 제22조제5항 삭제).",
    "제안이유_및_주요내용": "현행법에 따라 완구, 유아용 섬유제품, 학용품 등 ‘안전확인대상 어\n린이제품’의 제조업자 또는 수입업자는 산업부가 지정한 시험ㆍ검사기\n관으로부터 안전성에 대한 시험‧검사를 받아 해당 어린이제품이 안전\n기준에 적합함을 확인한 후, 이를 안전인증기관에 신고하여야 하며 이\n러한 안전확인신고의 유효기간은 신고가 수리된 날로부터 5년으로 규\n정되어 있음.\n2022년 8월 4일 시행된 동법 개정법률안에 따라 산업부는 ‘안전확인\n대상 어린이제품’이 안전기준에 적합하지 아니한 경우 등에 대해 해당\n어린이제품의 안전확인신고 효력상실 처분을 할 수 있게 되어 안전관\n리가 강화된 바 있음.\n다만, 안전기준에 부적합한 ‘안전확인대상 어린이제품’에 대해 안전\n확인신고 효력상실처분이 가능함에도, 현행법에는 안전확인신고 유효\n\n\n\n기간이 5년으로 규정되어 제조업자 또는 수입업자는 안전확인신고 후\n5년이 지난 어린이제품에 대해 제품검사 수수료 등을 부담하며 추가\n로 안전확인신고를 해야 하므로 전기생활용품안전법에 따른 안전확인\n대상 생활용품의 경우와 비교하여 이중 규제로 볼 수 있음.\n안전확인대상 생활용품의 경우 2017년 1월 28일 전기생활용품안전\n법 개정법률안의 시행으로 안전확인신고 효력상실처분 규정이 도입됨\n과 동시에 안전확인신고 유효기간(5년)은 폐지되었음.\n이에, 안전확인대상 어린이제품의 안전확인 유효기간을 폐지하고자\n함(안 제22조제5항 삭제).",
    "법률_제_호": "어린이제품 안전 특별법 일부개정법률안\n어린이제품 안전 특별법 일부를 다음과 같이 개정한다.\n제22조제5항을 삭제한다.",
    "신구조문대비표": "현 행 개 정 안\n제22조(안전확인 신고 등) ① ∼ 제22조(안전확인 신고 등) ① ∼\n④ (생 략) ④ (현행과 같음)\n⑤ 제1항에 따른 안전확인의 <삭 제>\n유효기간은 5년으로 하되, 안전\n확인의 신고가 수리된 날부터\n기산(起算)한다.\n⑥ ∼ ⑫ (생 략) ⑥ ∼ ⑫ (현행과 같음)"
  }
}