{
  "title": "2207230_국민연금법_일부개정법률안",
  "bill_number": "7230",
  "proposal_date": "2025. 01. 03.",
  "submission_date": "",
  "is_alternative": false,
  "alternative_bill_numbers": [],
  "has_comparison_table": false,
  "comparison_table": "신ㆍ구조문대비표\n현 행 개 정 안\n<신 설> 제3조의3(노무제공자에 대한 특\n례) 「산업재해보상보험법」\n제91조의16에 따라 산업재해보\n상보험의 적용을 받는 노무제\n공자(같은 법 제91조의15에 따\n른 노무제공자를 말한다)는 제\n3조제1호에도 불구하고 이 법\n을 적용할 때에는 근로자로 본\n다.",
  "full_text": "국민연금법 일부개정법률안\n(김선민의원 대표발의)\n발의연월일 : 2025. 01. 03.\n의 안\n7230\n번 호 발 의 자 : 김선민ㆍ신장식ㆍ서왕진\n강경숙ㆍ박은정ㆍ김준형\n김재원ㆍ이해민ㆍ황운하\n차규근ㆍ백선희ㆍ정춘생\n의원(12인)\n제안이유 및 주요내용\n보험설계사, 학습지 방문교사, 택배원 등 특수형태근로종사자는 근\n로자와 유사하면서도 사용자에 대한 전속성이 약하다는 이유 등으로\n근로자로 인정받지 못하여, 현행법상 사업장가입자로 편입되지 못하고\n있음.\n이로 인하여 특수형태근로종사자는 지역가입자로서 연금보험료 전\n액을 본인이 부담하게 됨에 따라, 국민연금 가입율이 낮아져 노후소득\n보장을 저하시키는 원인이 된다는 지적이 있음.\n이에 특수형태근로종사자는 이 법을 적용할 때에는 근로자로 보도\n록 함으로써, 특수형태근로종사자를 사업장가입자로 편입하여 연금보\n험료 부담을 완화하고 국민연금의 사각지대를 해소하려는 것임(안 제3\n조의3 신설).\n\n\n\n\n법률 제 호\n국민연금법 일부개정법률안\n국민연금법 일부를 다음과 같이 개정한다.\n제3조의3을 다음과 같이 신설한다.\n제3조의3(노무제공자에 대한 특례) 「산업재해보상보험법」 제91조의1\n6에 따라 산업재해보상보험의 적용을 받는 노무제공자(같은 법 제91\n조의15에 따른 노무제공자를 말한다)는 제3조제1호에도 불구하고 이\n법을 적용할 때에는 근로자로 본다.\n부 칙\n이 법은 공포한 날부터 시행한다.\n\n\n\n\n신ㆍ구조문대비표\n현 행 개 정 안\n<신 설> 제3조의3(노무제공자에 대한 특\n례) 「산업재해보상보험법」\n제91조의16에 따라 산업재해보\n상보험의 적용을 받는 노무제\n공자(같은 법 제91조의15에 따\n른 노무제공자를 말한다)는 제\n3조제1호에도 불구하고 이 법\n을 적용할 때에는 근로자로 본\n다.\n",
  "sections": {
    "제안이유": "및",
    "주요내용": "보험설계사, 학습지 방문교사, 택배원 등 특수형태근로종사자는 근\n로자와 유사하면서도 사용자에 대한 전속성이 약하다는 이유 등으로\n근로자로 인정받지 못하여, 현행법상 사업장가입자로 편입되지 못하고\n있음.\n이로 인하여 특수형태근로종사자는 지역가입자로서 연금보험료 전\n액을 본인이 부담하게 됨에 따라, 국민연금 가입율이 낮아져 노후소득\n보장을 저하시키는 원인이 된다는 지적이 있음.\n이에 특수형태근로종사자는 이 법을 적용할 때에는 근로자로 보도\n록 함으로써, 특수형태근로종사자를 사업장가입자로 편입하여 연금보\n험료 부담을 완화하고 국민연금의 사각지대를 해소하려는 것임(안 제3\n조의3 신설).",
    "제안이유_및_주요내용": "보험설계사, 학습지 방문교사, 택배원 등 특수형태근로종사자는 근\n로자와 유사하면서도 사용자에 대한 전속성이 약하다는 이유 등으로\n근로자로 인정받지 못하여, 현행법상 사업장가입자로 편입되지 못하고\n있음.\n이로 인하여 특수형태근로종사자는 지역가입자로서 연금보험료 전\n액을 본인이 부담하게 됨에 따라, 국민연금 가입율이 낮아져 노후소득\n보장을 저하시키는 원인이 된다는 지적이 있음.\n이에 특수형태근로종사자는 이 법을 적용할 때에는 근로자로 보도\n록 함으로써, 특수형태근로종사자를 사업장가입자로 편입하여 연금보\n험료 부담을 완화하고 국민연금의 사각지대를 해소하려는 것임(안 제3\n조의3 신설).",
    "법률_제_호": "국민연금법 일부개정법률안\n국민연금법 일부를 다음과 같이 개정한다.\n제3조의3을 다음과 같이 신설한다.\n제3조의3(노무제공자에 대한 특례) 「산업재해보상보험법」 제91조의1\n6에 따라 산업재해보상보험의 적용을 받는 노무제공자(같은 법 제91\n조의15에 따른 노무제공자를 말한다)는 제3조제1호에도 불구하고 이\n법을 적용할 때에는 근로자로 본다.",
    "신구조문대비표": "현 행 개 정 안\n<신 설> 제3조의3(노무제공자에 대한 특\n례) 「산업재해보상보험법」\n제91조의16에 따라 산업재해보\n상보험의 적용을 받는 노무제\n공자(같은 법 제91조의15에 따\n른 노무제공자를 말한다)는 제\n3조제1호에도 불구하고 이 법\n을 적용할 때에는 근로자로 본\n다."
  }
}