{
  "title": "2207783_채용절차의_공정화에_관한_법률_일부개정법률안",
  "bill_number": "7783",
  "proposal_date": "2025. 1. 23.",
  "submission_date": "",
  "is_alternative": false,
  "alternative_bill_numbers": [],
  "has_comparison_table": false,
  "comparison_table": "신ㆍ구조문대비표\n현 행 개 정 안\n제16조(벌칙) 제4조제1항을 위반 제16조(벌칙) ------------------\n하여 거짓의 채용광고를 낸 구 ----------------------------\n인자는 5년 이하의 징역 또는 ---------------------------\n2천만원 이하의 벌금에 처한다. 5천만원 이하의 벌금---------.",
  "full_text": "채용절차의 공정화에 관한 법률 일부개정법률안\n(김도읍의원 대표발의)\n발의연월일 : 2025. 1. 23.\n의 안\n7783\n번 호 발 의 자 : 김도읍ㆍ김정재ㆍ장동혁\n구자근ㆍ권영진ㆍ유상범\n조배숙ㆍ박성훈ㆍ김희정\n백종헌 의원(10인)\n제안이유 및 주요내용\n취업준비를 하는 청년들의 간절함을 이용하는 거짓 채용광고가 기\n승을 부리고 있음. 특히, 구인자가 채용을 가정하여 아이디어를 수집\n하거나 사업장을 홍보하기 위한 목적의 수단으로 악용되고 있고, 구직\n자들의 정보를 불법적으로 취득할 목적으로 허위 채용광고를 하는 등\n불법 및 범죄행위에까지 악용되고 있는 실정임. 이에 보다 강력한 처\n벌이 이뤄질 필요가 있으므로 거짓 채용광고를 낸 구인자의 벌금을\n현행 2천만원 이하의 벌금을 5천만원으로 상향하여 엄격한 처벌이 이\n뤄질 수 있도록 하고자 함(안 제16조).\n\n\n\n\n법률 제 호\n채용절차의 공정화에 관한 법률 일부개정법률안\n채용절차의 공정화에 관한 법률 일부를 다음과 같이 개정한다.\n제16조 중 “2천만원 이하의 벌금”을 “5천만원 이하의 벌금”으로 한다.\n부 칙\n이 법은 공포한 날부터 시행한다.\n\n\n\n\n신ㆍ구조문대비표\n현 행 개 정 안\n제16조(벌칙) 제4조제1항을 위반 제16조(벌칙) ------------------\n하여 거짓의 채용광고를 낸 구 ----------------------------\n인자는 5년 이하의 징역 또는 ---------------------------\n2천만원 이하의 벌금에 처한다. 5천만원 이하의 벌금---------.\n",
  "sections": {
    "제안이유": "및",
    "주요내용": "취업준비를 하는 청년들의 간절함을 이용하는 거짓 채용광고가 기\n승을 부리고 있음. 특히, 구인자가 채용을 가정하여 아이디어를 수집\n하거나 사업장을 홍보하기 위한 목적의 수단으로 악용되고 있고, 구직\n자들의 정보를 불법적으로 취득할 목적으로 허위 채용광고를 하는 등\n불법 및 범죄행위에까지 악용되고 있는 실정임. 이에 보다 강력한 처\n벌이 이뤄질 필요가 있으므로 거짓 채용광고를 낸 구인자의 벌금을\n현행 2천만원 이하의 벌금을 5천만원으로 상향하여 엄격한 처벌이 이\n뤄질 수 있도록 하고자 함(안 제16조).",
    "제안이유_및_주요내용": "취업준비를 하는 청년들의 간절함을 이용하는 거짓 채용광고가 기\n승을 부리고 있음. 특히, 구인자가 채용을 가정하여 아이디어를 수집\n하거나 사업장을 홍보하기 위한 목적의 수단으로 악용되고 있고, 구직\n자들의 정보를 불법적으로 취득할 목적으로 허위 채용광고를 하는 등\n불법 및 범죄행위에까지 악용되고 있는 실정임. 이에 보다 강력한 처\n벌이 이뤄질 필요가 있으므로 거짓 채용광고를 낸 구인자의 벌금을\n현행 2천만원 이하의 벌금을 5천만원으로 상향하여 엄격한 처벌이 이\n뤄질 수 있도록 하고자 함(안 제16조).",
    "법률_제_호": "채용절차의 공정화에 관한 법률 일부개정법률안\n채용절차의 공정화에 관한 법률 일부를 다음과 같이 개정한다.\n제16조 중 “2천만원 이하의 벌금”을 “5천만원 이하의 벌금”으로 한다.",
    "신구조문대비표": "현 행 개 정 안\n제16조(벌칙) 제4조제1항을 위반 제16조(벌칙) ------------------\n하여 거짓의 채용광고를 낸 구 ----------------------------\n인자는 5년 이하의 징역 또는 ---------------------------\n2천만원 이하의 벌금에 처한다. 5천만원 이하의 벌금---------."
  }
}