{
  "title": "2207265_정신건강증진_및_정신질환자_복지서비스_지원에_관한_법률_일부개정법률안",
  "bill_number": "7265",
  "proposal_date": "2025. 1. 6.",
  "submission_date": "",
  "is_alternative": false,
  "alternative_bill_numbers": [],
  "has_comparison_table": false,
  "comparison_table": "신ㆍ구조문대비표\n현 행 개 정 안\n법률 제17794호 정신건강증진 및 법률 제17794호 정신건강증진 및\n정신질환자 복지서비스 지원에 정신질환자 복지서비스 지원에\n관한 법률 일부개정법률 ",
  "full_text": "정신건강증진 및 정신질환자 복지서비스 지원에 관한 법률\n일부개정법률안\n(한정애의원 대표발의)\n발의연월일 : 2025. 1. 6.\n의 안\n7265\n번 호 발 의 자 : 한정애ㆍ박홍배ㆍ이강일\n문진석ㆍ송옥주ㆍ이수진\n김영배ㆍ권향엽ㆍ박수현\n민홍철ㆍ조정식ㆍ서영교\n허성무ㆍ이학영 의원\n(14명)\n제안이유 및 주요내용\n정신요양ㆍ재활시설에서 거주하다 사망한 무연고자의 유류품 처리는\n원칙적으로 평균 3년 3개월이 걸리는 복잡한 민법상 절차를 준수하여\n야 하나, 2020년 현행법 및 사회복지사업법의 개정으로 500만원 이하\n소액 잔여재산은 지방자치단체에 신고 후 6개월 내 권리 주장자가 없\n으면 지방자치단체에 귀속시킬 수 있는 간소화 특례가 마련됨.\n그런데 법 개정 당시 부칙으로 인해 2021년 6월 30일 이전 사망자\n의 잔여재산은 금액에 상관없이 모두 민법상 절차를 준수하도록 하고\n있어, 현장에서 법률 지식 부족 등의 문제로 무연고 사망자의 재산을\n임의적으로 처리하거나 처리를 회피하는 등의 문제가 여전히 많이 발\n생하고 있다는 지적이 있음.\n\n\n\n이에 현재 시설에서 보관 중인 무연고 사망자의 유류재산에 대해서\n는 사망일에 관계없이 한도액 이하면 간소화 특례에 따라 재산을 처리\n할 수 있도록 부칙을 개정하고자 하는 것임(안 법률 제17794호 정신건\n강증진 및 정신질환자 복지서비스 지원에 관한 법률 일부개정법률 부\n칙 제2조).\n참고사항\n이 법률안은 한정애의원이 대표발의한 「노인복지법 일부개정법률\n안」(의안번호 제7266호), 「장애인복지법 일부개정법률안」(의안번호\n제7274호), 「사회복지사업법 일부개정법률안」(의안번호 제7275호) 및\n「노숙인 등의 복지 및 자립지원에 관한 법률 일부개정법률안」(의안\n번호 제7273호)의 의결을 전제로 하는 것이므로 같은 법률안이 의결되\n지 아니하거나 수정의결되는 경우에는 이에 맞추어 조정되어야 할 것\n임.\n\n법률 제 호\n정신건강증진 및 정신질환자 복지서비스 지원에 관한 법률\n일부개정법률안\n정신건강증진 및 정신질환자 복지서비스 지원에 관한 법률 일부를 다\n음과 같이 개정한다.\n법률 제17794호 정신건강증진 및 정신질환자 복지서비스 지원에 관한\n법률 일부개정법률 부칙 제2조 중 “이후”를 “전”으로, “경우부터”를\n“경우에도”로 하고, 같은 조에 단서를 다음과 같이 신설한다.\n단, 사망한 사람의 재산에 대하여 제81조의2제1항 본문의 규정에 따\n라 「민법」 제1053조에 따른 상속재산관리인이 선임된 경우는 제\n외한다.\n부 칙\n이 법은 공포 후 3개월이 경과한 날부터 시행한다.\n\n\n\n\n신ㆍ구조문대비표\n현 행 개 정 안\n법률 제17794호 정신건강증진 및 법률 제17794호 정신건강증진 및\n정신질환자 복지서비스 지원에 정신질환자 복지서비스 지원에\n관한 법률 일부개정법률 부칙 관한 법률 일부개정법률 부칙\n제2조(상속인 없는 재산의 처리 제2조(상속인 없는 재산의 처리\n에 관한 적용례) 제81조의2의 에 관한 적용례) ------------\n개정규정은 부칙 제1조 단서에 ----------------------------\n따른 시행일 이후 정신요양시 -------------전-------------\n설 또는 정신재활시설에 입소 ----------------------------\n중인 사람이 사망한 경우부터 -----------------경우에도---\n적용한다. <단서 신설> ------. 단, 사망한 사람의 재\n산에 대하여 제81조의2제1항\n본문의 규정에 따라 「민법」\n제1053조에 따른 상속재산관리\n인이 선임된 경우는 제외한다.\n",
  "sections": {
    "제안이유": "및",
    "주요내용": "정신요양ㆍ재활시설에서 거주하다 사망한 무연고자의 유류품 처리는\n원칙적으로 평균 3년 3개월이 걸리는 복잡한 민법상 절차를 준수하여\n야 하나, 2020년 현행법 및 사회복지사업법의 개정으로 500만원 이하\n소액 잔여재산은 지방자치단체에 신고 후 6개월 내 권리 주장자가 없\n으면 지방자치단체에 귀속시킬 수 있는 간소화 특례가 마련됨.\n그런데 법 개정 당시 부칙으로 인해 2021년 6월 30일 이전 사망자\n의 잔여재산은 금액에 상관없이 모두 민법상 절차를 준수하도록 하고\n있어, 현장에서 법률 지식 부족 등의 문제로 무연고 사망자의 재산을\n임의적으로 처리하거나 처리를 회피하는 등의 문제가 여전히 많이 발\n생하고 있다는 지적이 있음.\n\n\n\n이에 현재 시설에서 보관 중인 무연고 사망자의 유류재산에 대해서\n는 사망일에 관계없이 한도액 이하면 간소화 특례에 따라 재산을 처리\n할 수 있도록 부칙을 개정하고자 하는 것임(안",
    "제안이유_및_주요내용": "정신요양ㆍ재활시설에서 거주하다 사망한 무연고자의 유류품 처리는\n원칙적으로 평균 3년 3개월이 걸리는 복잡한 민법상 절차를 준수하여\n야 하나, 2020년 현행법 및 사회복지사업법의 개정으로 500만원 이하\n소액 잔여재산은 지방자치단체에 신고 후 6개월 내 권리 주장자가 없\n으면 지방자치단체에 귀속시킬 수 있는 간소화 특례가 마련됨.\n그런데 법 개정 당시 부칙으로 인해 2021년 6월 30일 이전 사망자\n의 잔여재산은 금액에 상관없이 모두 민법상 절차를 준수하도록 하고\n있어, 현장에서 법률 지식 부족 등의 문제로 무연고 사망자의 재산을\n임의적으로 처리하거나 처리를 회피하는 등의 문제가 여전히 많이 발\n생하고 있다는 지적이 있음.\n\n\n\n이에 현재 시설에서 보관 중인 무연고 사망자의 유류재산에 대해서\n는 사망일에 관계없이 한도액 이하면 간소화 특례에 따라 재산을 처리\n할 수 있도록 부칙을 개정하고자 하는 것임(안",
    "법률_제_호": "정신건\n강증진 및 정신질환자 복지서비스 지원에 관한 법률 일부개정법률",
    "신구조문대비표": "현 행 개 정 안\n법률 제17794호 정신건강증진 및 법률 제17794호 정신건강증진 및\n정신질환자 복지서비스 지원에 정신질환자 복지서비스 지원에\n관한 법률 일부개정법률"
  }
}