{
  "title": "2207133_정부조직법_일부개정법률안",
  "bill_number": "7133",
  "proposal_date": "2024. 12. 31.",
  "submission_date": "",
  "is_alternative": false,
  "alternative_bill_numbers": [],
  "has_comparison_table": false,
  "comparison_table": "신ㆍ구조문대비표\n현 행 개 정 안\n제12조(국무회의) ① ∼ ③ (생 제12조(국무회의) ① ∼ ③ (현행\n략) 과 같음)\n<신 설> ④ 「공공기록물 관리에 관한\n법률」 제17조제2항에 따라 국\n무회의의 회의록, 속기록 또는\n녹음기록이 작성되지 아니하였\n을 경우 국무회의가 소집되지\n아니한 것으로 간주한다.\n④ (생 략) ⑤ (현행 제4항과 같음)",
  "full_text": "정부조직법 일부개정법률안\n(권향엽의원 대표발의)\n발의연월일 : 2024. 12. 31.\n의 안\n7133\n번 호 발 의 자 : 권향엽ㆍ주철현ㆍ박희승\n이기헌ㆍ임미애ㆍ정진욱\n박지원ㆍ이광희ㆍ민형배\n문금주ㆍ민병덕ㆍ윤준병\n박용갑ㆍ김기표ㆍ정동영\n소병훈 의원(16인)\n제안이유 및 주요내용\n현행법은 의장, 권한 대행, 국무위원 및 국무회의의 출석권 등을 명\n시하여 국가의 중대사 전반이 논의되는 최고정책심의기관으로서의 국\n무회의에 대해 명확히 규정하고 있음.\n그러나 현재 회의록, 속기록 또는 녹음기록 중 어느 것도 작성되지\n않은 국무회의의 경우에도 그 효력이 동일하게 발생하고 있어, 이는\n국무회의라는 최고기관의 지위 및 논의되는 사안의 중대성과는 부합\n하지 않는 실정이라는 지적이 있음.\n이에 국무회의의 회의록, 속기록 또는 녹음기록이 작성되지 않은 경\n우 국무회의가 소집되지 않은 것으로 간주하려는 것임(안 제12조제4항\n신설).\n\n\n\n참고사항\n이 법률안은 권향엽의원이 대표발의한 「공공기록물 관리에 관한\n법률 일부개정법률안」(의안번호 제7136호)의 의결을 전제로 하는 것\n이므로 같은 법률안이 의결되지 아니하거나 수정의결되는 경우에는\n이에 맞추어 조정되어야 할 것임.\n\n법률 제 호\n정부조직법 일부개정법률안\n정부조직법 일부를 다음과 같이 개정한다.\n제12조제4항을 제5항으로 하고, 같은 조에 제4항을 다음과 같이 신설\n한다.\n④ 「공공기록물 관리에 관한 법률」 제17조제2항에 따라 국무회의\n의 회의록, 속기록 또는 녹음기록이 작성되지 아니하였을 경우 국무\n회의가 소집되지 아니한 것으로 간주한다.\n부 칙\n이 법은 공포한 날부터 시행한다.\n\n\n\n\n신ㆍ구조문대비표\n현 행 개 정 안\n제12조(국무회의) ① ∼ ③ (생 제12조(국무회의) ① ∼ ③ (현행\n략) 과 같음)\n<신 설> ④ 「공공기록물 관리에 관한\n법률」 제17조제2항에 따라 국\n무회의의 회의록, 속기록 또는\n녹음기록이 작성되지 아니하였\n을 경우 국무회의가 소집되지\n아니한 것으로 간주한다.\n④ (생 략) ⑤ (현행 제4항과 같음)\n",
  "sections": {
    "제안이유": "및",
    "주요내용": "현행법은 의장, 권한 대행, 국무위원 및 국무회의의 출석권 등을 명\n시하여 국가의 중대사 전반이 논의되는 최고정책심의기관으로서의 국\n무회의에 대해 명확히 규정하고 있음.\n그러나 현재 회의록, 속기록 또는 녹음기록 중 어느 것도 작성되지\n않은 국무회의의 경우에도 그 효력이 동일하게 발생하고 있어, 이는\n국무회의라는 최고기관의 지위 및 논의되는 사안의 중대성과는 부합\n하지 않는 실정이라는 지적이 있음.\n이에 국무회의의 회의록, 속기록 또는 녹음기록이 작성되지 않은 경\n우 국무회의가 소집되지 않은 것으로 간주하려는 것임(안 제12조제4항\n신설).",
    "제안이유_및_주요내용": "현행법은 의장, 권한 대행, 국무위원 및 국무회의의 출석권 등을 명\n시하여 국가의 중대사 전반이 논의되는 최고정책심의기관으로서의 국\n무회의에 대해 명확히 규정하고 있음.\n그러나 현재 회의록, 속기록 또는 녹음기록 중 어느 것도 작성되지\n않은 국무회의의 경우에도 그 효력이 동일하게 발생하고 있어, 이는\n국무회의라는 최고기관의 지위 및 논의되는 사안의 중대성과는 부합\n하지 않는 실정이라는 지적이 있음.\n이에 국무회의의 회의록, 속기록 또는 녹음기록이 작성되지 않은 경\n우 국무회의가 소집되지 않은 것으로 간주하려는 것임(안 제12조제4항\n신설).",
    "법률_제_호": "정부조직법 일부개정법률안\n정부조직법 일부를 다음과 같이 개정한다.\n제12조제4항을 제5항으로 하고, 같은 조에 제4항을 다음과 같이 신설\n한다.\n④ 「공공기록물 관리에 관한 법률」 제17조제2항에 따라 국무회의\n의 회의록, 속기록 또는 녹음기록이 작성되지 아니하였을 경우 국무\n회의가 소집되지 아니한 것으로 간주한다.",
    "신구조문대비표": "현 행 개 정 안\n제12조(국무회의) ① ∼ ③ (생 제12조(국무회의) ① ∼ ③ (현행\n략) 과 같음)\n<신 설> ④ 「공공기록물 관리에 관한\n법률」 제17조제2항에 따라 국\n무회의의 회의록, 속기록 또는\n녹음기록이 작성되지 아니하였\n을 경우 국무회의가 소집되지\n아니한 것으로 간주한다.\n④ (생 략) ⑤ (현행 제4항과 같음)"
  }
}