{
  "title": "2207607_각급_법원의_설치와_관할구역에_관한_법률_일부개정법률안",
  "bill_number": "7607",
  "proposal_date": "2025. 1. 17.",
  "submission_date": "",
  "is_alternative": false,
  "alternative_bill_numbers": [],
  "has_comparison_table": false,
  "comparison_table": "신ㆍ구조문대비표\n현 행 개 정 안\n법률 제17124호 각급 법원의 법률 제17124호 각급 법원의\n설치와 관할구역에 관한 법률 설치와 관할구역에 관한 법률\n일부개정법률 ",
  "full_text": "각급 법원의 설치와 관할구역에 관한 법률 일부개정법률안\n(허성무의원 대표발의)\n발의연월일 : 2025. 1. 17.\n의 안\n7607\n번 호 발 의 자 : 허성무ㆍ김문수ㆍ최민희\n민병덕ㆍ손명수ㆍ이광희\n김남희ㆍ박균택ㆍ김용민\n박희승 의원(10인)\n제안이유 및 주요내용\n지역주민들의 법원 접근성을 향상시키고 사법서비스의 질을 제고하\n기 위하여 2020년 3월 법률개정을 통해 창원가정법원의 설치 근거를\n마련하고, 해당 가정법원 설치에 관한 시행일(2025년 3월 1일)과 사건\n관할에 관한 경과조치를 두었음. 그러나 이전 예정 부지 조성 및 관련\n절차 지연 등으로 신축사업이 지체됨에 따라 2025년 3월 1일에 개원\n하는 것은 현실적으로 어렵게 되었음.\n이에 따라 부칙에 규정한 창원가정법원의 설치 시행일과 사건관할\n일을 기존 2025년 3월 1일에서 2029년 3월 1일로 개정하려는 것임(법\n률 제17124호 각급 법원의 설치와 관할구역에 관한 법률 일부개정법\n률 부칙 제1조 및 같은 법 부칙 제2조제2항ㆍ제3항).\n\n\n\n\n법률 제 호\n각급 법원의 설치와 관할구역에 관한 법률 일부개정법률안\n각급 법원의 설치와 관할구역에 관한 법률 일부를 다음과 같이 개정\n한다.\n법률 제17124호 각급 법원의 설치와 관할구역에 관한 법률 일부개정\n법률 부칙 제1조에 단서를 다음과 같이 신설한다.\n다만, 창원가정법원 설치에 관한 사항은 2029년 3월 1일부터 시행한\n다.\n법률 제17124호 각급 법원의 설치와 관할구역에 관한 법률 일부개정\n법률 부칙 제2조제2항 중 “2025년”을 각각 “2029년”으로 한다.\n법률 제17124호 각급 법원의 설치와 관할구역에 관한 법률 일부개정\n법률 부칙 제2조제3항 중 “2025년”을 각각 “2029년”으로 한다.\n부 칙\n이 법은 공포한 날부터 시행한다.\n\n\n\n\n신ㆍ구조문대비표\n현 행 개 정 안\n법률 제17124호 각급 법원의 법률 제17124호 각급 법원의\n설치와 관할구역에 관한 법률 설치와 관할구역에 관한 법률\n일부개정법률 부칙 일부개정법률 부칙\n제1조(시행일) 이 법은 2025년 3 제1조(시행일) --------------\n월 1일부터 시행한다. <단서 -------------------. 다만,\n신설> 창원가정법원 설치에 관한 사\n항은 2029년 3월 1일부터 시행\n한다.\n제2조(사건관할에 관한 경과조치) 제2조(사건관할에 관한 경과조치)\n① (생 략) ① (현행과 같음)\n② 이 법 시행으로 2025년 3월 ② ---------------2029년----\n1일부터 창원가정법원 관할에 ----------------------------\n속할 사건으로 2025년 2월 28 -------------- 2029년-------\n일 현재 창원지방법원 본원에 ----------------------------\n계속 중인 사건은 창원가정법 ----------------------------\n원의 관할로 한다. --------------.\n③ 이 법 시행으로 2025년 2월 ③ ---------------2029년----\n28일 현재 창원지방법원 마산 ----------------------------\n지원, 진주지원, 통영지원, 밀양 ----------------------------\n지원 및 거창지원에 계속 중인 ----------------------------\n사건 중 가사사건, 가정보호사 ----------------------------\n건 및 가족관계등록사건은 202 -------------------------202\n5년 3월 1일부터 창원가정법원 9년-------------------------\n\n\n\n마산지원, 진주지원, 통영지원, ----------------------------\n밀양지원 및 거창지원에 각각 ----------------------------\n계속 중인 것으로 본다. ---------------------.",
  "sections": {
    "제안이유": "및",
    "주요내용": "지역주민들의 법원 접근성을 향상시키고 사법서비스의 질을 제고하\n기 위하여 2020년 3월 법률개정을 통해 창원가정법원의 설치 근거를\n마련하고, 해당 가정법원 설치에 관한 시행일(2025년 3월 1일)과 사건\n관할에 관한 경과조치를 두었음. 그러나 이전 예정 부지 조성 및 관련\n절차 지연 등으로 신축사업이 지체됨에 따라 2025년 3월 1일에 개원\n하는 것은 현실적으로 어렵게 되었음.\n이에 따라 부칙에 규정한 창원가정법원의 설치 시행일과 사건관할\n일을 기존 2025년 3월 1일에서 2029년 3월 1일로 개정하려는 것임(법\n률 제17124호 각급 법원의 설치와 관할구역에 관한 법률 일부개정법\n률 부칙 제1조 및 같은 법 부칙 제2조제2항ㆍ제3항).",
    "제안이유_및_주요내용": "지역주민들의 법원 접근성을 향상시키고 사법서비스의 질을 제고하\n기 위하여 2020년 3월 법률개정을 통해 창원가정법원의 설치 근거를\n마련하고, 해당 가정법원 설치에 관한 시행일(2025년 3월 1일)과 사건\n관할에 관한 경과조치를 두었음. 그러나 이전 예정 부지 조성 및 관련\n절차 지연 등으로 신축사업이 지체됨에 따라 2025년 3월 1일에 개원\n하는 것은 현실적으로 어렵게 되었음.\n이에 따라 부칙에 규정한 창원가정법원의 설치 시행일과 사건관할\n일을 기존 2025년 3월 1일에서 2029년 3월 1일로 개정하려는 것임(법\n률 제17124호 각급 법원의 설치와 관할구역에 관한 법률 일부개정법\n률 부칙 제1조 및 같은 법 부칙 제2조제2항ㆍ제3항).",
    "법률_제_호": "각급 법원의 설치와 관할구역에 관한 법률 일부개정법률안\n각급 법원의 설치와 관할구역에 관한 법률 일부를 다음과 같이 개정\n한다.\n법률 제17124호 각급 법원의 설치와 관할구역에 관한 법률 일부개정\n법률",
    "신구조문대비표": "현 행 개 정 안\n법률 제17124호 각급 법원의 법률 제17124호 각급 법원의\n설치와 관할구역에 관한 법률 설치와 관할구역에 관한 법률\n일부개정법률"
  }
}