{
  "title": "2207146_국회법_일부개정법률안",
  "bill_number": "7146",
  "proposal_date": "2024. 12. 31.",
  "submission_date": "",
  "is_alternative": false,
  "alternative_bill_numbers": [],
  "has_comparison_table": false,
  "comparison_table": "신ㆍ구조문대비표\n현 행 개 정 안\n제92조(일사부재의) 부결된 안건 제92조(일사부재의) ------------\n은 같은 회기 중에 다시 발의 --부결된 날부터 1년이 지나지\n하거나 제출할 수 없다. 아니하면--------------------\n-----------.",
  "full_text": "국회법 일부개정법률안\n(김민전의원 대표발의)\n발의연월일 : 2024. 12. 31.\n의 안\n7146\n번 호 발 의 자 : 김민전ㆍ안철수ㆍ서천호\n강대식ㆍ이성권ㆍ진종오\n이종배ㆍ강선영ㆍ나경원\n조정훈 의원(10인)\n제안이유 및 주요내용\n현행법은 부결된 안건의 반복적인 발의로 인한 의결 과정의 비효율\n성을 방지하고자 일사부재의(一事不再議) 원칙을 규정하여 같은 회기\n중에는 부결된 안건의 재발의 및 제출을 금지하고 있음.\n그러나 현행법은 임시회를 2월ㆍ3월ㆍ4월ㆍ5월ㆍ6월 및 8월에 집회\n하도록 규정하고 있지만, 2015년부터 2023년까지 임시회 연평균 개회\n횟수가 8회에 이르는 등 회기 간 시간적 간격이 줄어듦에 따라 부결\n된 안건의 재발의 및 제출 기간이 단축되어 일사부재의 원칙이 유명\n무실화 되고 있다는 지적이 있음.\n이에 부결된 안건의 재발의 및 제출 금지 기간을 1년으로 규정함으\n로써 일사부재의 원칙의 실효성을 제고하고자 하는 것임(안 제92조).\n\n\n\n\n법률 제 호\n국회법 일부개정법률안\n국회법 일부를 다음과 같이 개정한다.\n제92조 중 “같은 회기 중에”를 “부결된 날부터 1년이 지나지 아니하\n면”으로 한다.\n부 칙\n제1조(시행일) 이 법은 공포한 날부터 시행한다.\n제2조(일사부재의에 관한 적용례) 이 법의 개정규정은 이 법 시행 이\n후 발의 또는 제출되는 안건부터 적용한다.\n\n\n\n\n신ㆍ구조문대비표\n현 행 개 정 안\n제92조(일사부재의) 부결된 안건 제92조(일사부재의) ------------\n은 같은 회기 중에 다시 발의 --부결된 날부터 1년이 지나지\n하거나 제출할 수 없다. 아니하면--------------------\n-----------.\n",
  "sections": {
    "제안이유": "및",
    "주요내용": "현행법은 부결된 안건의 반복적인 발의로 인한 의결 과정의 비효율\n성을 방지하고자 일사부재의(一事不再議) 원칙을 규정하여 같은 회기\n중에는 부결된 안건의 재발의 및 제출을 금지하고 있음.\n그러나 현행법은 임시회를 2월ㆍ3월ㆍ4월ㆍ5월ㆍ6월 및 8월에 집회\n하도록 규정하고 있지만, 2015년부터 2023년까지 임시회 연평균 개회\n횟수가 8회에 이르는 등 회기 간 시간적 간격이 줄어듦에 따라 부결\n된 안건의 재발의 및 제출 기간이 단축되어 일사부재의 원칙이 유명\n무실화 되고 있다는 지적이 있음.\n이에 부결된 안건의 재발의 및 제출 금지 기간을 1년으로 규정함으\n로써 일사부재의 원칙의 실효성을 제고하고자 하는 것임(안 제92조).",
    "제안이유_및_주요내용": "현행법은 부결된 안건의 반복적인 발의로 인한 의결 과정의 비효율\n성을 방지하고자 일사부재의(一事不再議) 원칙을 규정하여 같은 회기\n중에는 부결된 안건의 재발의 및 제출을 금지하고 있음.\n그러나 현행법은 임시회를 2월ㆍ3월ㆍ4월ㆍ5월ㆍ6월 및 8월에 집회\n하도록 규정하고 있지만, 2015년부터 2023년까지 임시회 연평균 개회\n횟수가 8회에 이르는 등 회기 간 시간적 간격이 줄어듦에 따라 부결\n된 안건의 재발의 및 제출 기간이 단축되어 일사부재의 원칙이 유명\n무실화 되고 있다는 지적이 있음.\n이에 부결된 안건의 재발의 및 제출 금지 기간을 1년으로 규정함으\n로써 일사부재의 원칙의 실효성을 제고하고자 하는 것임(안 제92조).",
    "법률_제_호": "국회법 일부개정법률안\n국회법 일부를 다음과 같이 개정한다.\n제92조 중 “같은 회기 중에”를 “부결된 날부터 1년이 지나지 아니하\n면”으로 한다.",
    "신구조문대비표": "현 행 개 정 안\n제92조(일사부재의) 부결된 안건 제92조(일사부재의) ------------\n은 같은 회기 중에 다시 발의 --부결된 날부터 1년이 지나지\n하거나 제출할 수 없다. 아니하면--------------------\n-----------."
  }
}