{
  "title": "2207462_재외동포기본법_일부개정법률안",
  "bill_number": "7462",
  "proposal_date": "2025. 1. 13.",
  "submission_date": "",
  "is_alternative": false,
  "alternative_bill_numbers": [],
  "has_comparison_table": false,
  "comparison_table": "신ㆍ구조문대비표\n현 행 개 정 안\n<신 설> 제15조의2(국고 지원) 국가는 재\n외동포정책 관련 사업을 실시\n하는 지방자치단체 또는 민간\n단체에 대하여 예산의 범위에\n서 사업 수행에 필요한 비용의\n전부 또는 일부를 지원할 수\n있다.",
  "full_text": "재외동포기본법 일부개정법률안\n(이용선의원 대표발의)\n발의연월일 : 2025. 1. 13.\n의 안\n7462\n번 호 발 의 자 : 이용선ㆍ김문수ㆍ허 영\n박지원ㆍ박용갑ㆍ김 윤\n허성무ㆍ박희승ㆍ이재강\n채현일ㆍ오세희ㆍ정준호\n강준현ㆍ이재명 의원\n(14인)\n제안이유 및 주요내용\n현행법은 국가가 재외동포의 권익보호와 대한민국과의 유대감 강화\n를 위한 각종 시책을 수립ㆍ시행하도록 하고, 재외동포정책의 원활한\n추진을 위하여 인력과 조직의 확보 및 예산의 지원 등 여건을 조성하\n도록 국가의 책무를 규정하고 있음.\n그러나 재외동포정책과 관련한 사업을 실시하는 지방자치단체 또는\n민간단체에 재정 지원을 할 수 있다는 명확한 근거규정이 마련되어\n있지 않음.\n이에 국가가 재외동포정책 관련 사업을 실시하는 지방자치단체 또\n는 민간단체에 예산의 범위에서 사업 수행에 필요한 비용의 전부 또\n는 일부를 지원할 수 있도록 하여 재외동포정책 관련 사업이 활발하\n게 이루어질 수 있도록 하고자 함(안 제15조의2 신설).\n\n\n\n\n법률 제 호\n재외동포기본법 일부개정법률안\n재외동포기본법 일부를 다음과 같이 개정한다.\n제15조의2를 다음과 같이 신설한다.\n제15조의2(국고 지원) 국가는 재외동포정책 관련 사업을 실시하는 지\n방자치단체 또는 민간단체에 대하여 예산의 범위에서 사업 수행에\n필요한 비용의 전부 또는 일부를 지원할 수 있다.\n부 칙\n이 법은 공포한 날부터 시행한다.\n\n\n\n\n신ㆍ구조문대비표\n현 행 개 정 안\n<신 설> 제15조의2(국고 지원) 국가는 재\n외동포정책 관련 사업을 실시\n하는 지방자치단체 또는 민간\n단체에 대하여 예산의 범위에\n서 사업 수행에 필요한 비용의\n전부 또는 일부를 지원할 수\n있다.\n",
  "sections": {
    "제안이유": "및",
    "주요내용": "현행법은 국가가 재외동포의 권익보호와 대한민국과의 유대감 강화\n를 위한 각종 시책을 수립ㆍ시행하도록 하고, 재외동포정책의 원활한\n추진을 위하여 인력과 조직의 확보 및 예산의 지원 등 여건을 조성하\n도록 국가의 책무를 규정하고 있음.\n그러나 재외동포정책과 관련한 사업을 실시하는 지방자치단체 또는\n민간단체에 재정 지원을 할 수 있다는 명확한 근거규정이 마련되어\n있지 않음.\n이에 국가가 재외동포정책 관련 사업을 실시하는 지방자치단체 또\n는 민간단체에 예산의 범위에서 사업 수행에 필요한 비용의 전부 또\n는 일부를 지원할 수 있도록 하여 재외동포정책 관련 사업이 활발하\n게 이루어질 수 있도록 하고자 함(안 제15조의2 신설).",
    "제안이유_및_주요내용": "현행법은 국가가 재외동포의 권익보호와 대한민국과의 유대감 강화\n를 위한 각종 시책을 수립ㆍ시행하도록 하고, 재외동포정책의 원활한\n추진을 위하여 인력과 조직의 확보 및 예산의 지원 등 여건을 조성하\n도록 국가의 책무를 규정하고 있음.\n그러나 재외동포정책과 관련한 사업을 실시하는 지방자치단체 또는\n민간단체에 재정 지원을 할 수 있다는 명확한 근거규정이 마련되어\n있지 않음.\n이에 국가가 재외동포정책 관련 사업을 실시하는 지방자치단체 또\n는 민간단체에 예산의 범위에서 사업 수행에 필요한 비용의 전부 또\n는 일부를 지원할 수 있도록 하여 재외동포정책 관련 사업이 활발하\n게 이루어질 수 있도록 하고자 함(안 제15조의2 신설).",
    "법률_제_호": "재외동포기본법 일부개정법률안\n재외동포기본법 일부를 다음과 같이 개정한다.\n제15조의2를 다음과 같이 신설한다.\n제15조의2(국고 지원) 국가는 재외동포정책 관련 사업을 실시하는 지\n방자치단체 또는 민간단체에 대하여 예산의 범위에서 사업 수행에\n필요한 비용의 전부 또는 일부를 지원할 수 있다.",
    "신구조문대비표": "현 행 개 정 안\n<신 설> 제15조의2(국고 지원) 국가는 재\n외동포정책 관련 사업을 실시\n하는 지방자치단체 또는 민간\n단체에 대하여 예산의 범위에\n서 사업 수행에 필요한 비용의\n전부 또는 일부를 지원할 수\n있다."
  }
}