{
  "title": "2207190_사면법_일부개정법률안",
  "bill_number": "7190",
  "proposal_date": "2025. 1. 2.",
  "submission_date": "",
  "is_alternative": false,
  "alternative_bill_numbers": [],
  "has_comparison_table": false,
  "comparison_table": "신·구조문대비표\n현 행 개 정 안\n<신 설> 제9조의2(사면 등의 제한) 제8조\n및 제9조에도 불구하고 다음\n각 호에 해당하는 자에 대해서\n는 사면ㆍ감형 및 복권을 할\n수 없다.\n1. 「형법」 제2편제1장의 죄를\n범한 자\n2. 「형법」 제2편제2장의 죄를\n범한 자\n3. 「군형법」 제2편제1장의 죄\n를 범한 자",
  "full_text": "사면법 일부개정법률안\n(한병도의원 대표발의)\n발의연월일 : 2025. 1. 2.\n의 안\n7190\n번 호 발 의 자 : 한병도ㆍ이개호ㆍ안규백\n이해식ㆍ서미화ㆍ임오경\n윤준병ㆍ한정애ㆍ박수현\n부승찬ㆍ위성곤ㆍ윤호중\n의원(12인)\n제안이유 및 주요내용\n현행 법률은 「대한민국헌법」에 명시된 대통령의 사면ㆍ감형 또는\n복권에 관한 내용 및 절차 등을 구체적으로 정하고 있음.\n그런데, 내란과 외환, 반란의 죄는 헌법의 존립을 해치거나 헌정질\n서의 파괴를 목적으로 하는 범죄로써, 해당 범죄를 저지른 자를 사면\n의 대상으로 정하면 안 된다는 사회적 공감대가 형성되고 있음.\n이에, 내란과 외환, 반란의 죄를 범한 자는 사면ㆍ감형 또는 복권을\n할 수 없도록 규정하려는 것임(안 제9조의2 신설).\n\n\n\n\n법률 제 호\n사면법 일부개정법률안\n사면법 일부를 다음과 같이 개정한다.\n제9조의2를 다음과 같이 신설한다.\n제9조의2(사면 등의 제한) 제8조 및 제9조에도 불구하고 다음 각 호에\n해당하는 자에 대해서는 사면ㆍ감형 및 복권을 할 수 없다.\n1. 「형법」 제2편제1장의 죄를 범한 자\n2. 「형법」 제2편제2장의 죄를 범한 자\n3. 「군형법」 제2편제1장의 죄를 범한 자\n부 칙\n이 법은 공포한 날부터 시행한다.\n\n\n\n\n신·구조문대비표\n현 행 개 정 안\n<신 설> 제9조의2(사면 등의 제한) 제8조\n및 제9조에도 불구하고 다음\n각 호에 해당하는 자에 대해서\n는 사면ㆍ감형 및 복권을 할\n수 없다.\n1. 「형법」 제2편제1장의 죄를\n범한 자\n2. 「형법」 제2편제2장의 죄를\n범한 자\n3. 「군형법」 제2편제1장의 죄\n를 범한 자\n",
  "sections": {
    "제안이유": "및",
    "주요내용": "현행 법률은 「대한민국헌법」에 명시된 대통령의 사면ㆍ감형 또는\n복권에 관한 내용 및 절차 등을 구체적으로 정하고 있음.\n그런데, 내란과 외환, 반란의 죄는 헌법의 존립을 해치거나 헌정질\n서의 파괴를 목적으로 하는 범죄로써, 해당 범죄를 저지른 자를 사면\n의 대상으로 정하면 안 된다는 사회적 공감대가 형성되고 있음.\n이에, 내란과 외환, 반란의 죄를 범한 자는 사면ㆍ감형 또는 복권을\n할 수 없도록 규정하려는 것임(안 제9조의2 신설).",
    "제안이유_및_주요내용": "현행 법률은 「대한민국헌법」에 명시된 대통령의 사면ㆍ감형 또는\n복권에 관한 내용 및 절차 등을 구체적으로 정하고 있음.\n그런데, 내란과 외환, 반란의 죄는 헌법의 존립을 해치거나 헌정질\n서의 파괴를 목적으로 하는 범죄로써, 해당 범죄를 저지른 자를 사면\n의 대상으로 정하면 안 된다는 사회적 공감대가 형성되고 있음.\n이에, 내란과 외환, 반란의 죄를 범한 자는 사면ㆍ감형 또는 복권을\n할 수 없도록 규정하려는 것임(안 제9조의2 신설).",
    "법률_제_호": "사면법 일부개정법률안\n사면법 일부를 다음과 같이 개정한다.\n제9조의2를 다음과 같이 신설한다.\n제9조의2(사면 등의 제한) 제8조 및 제9조에도 불구하고 다음 각 호에\n해당하는 자에 대해서는 사면ㆍ감형 및 복권을 할 수 없다.\n1. 「형법」 제2편제1장의 죄를 범한 자\n2. 「형법」 제2편제2장의 죄를 범한 자\n3. 「군형법」 제2편제1장의 죄를 범한 자",
    "신구조문대비표": "현 행 개 정 안\n<신 설> 제9조의2(사면 등의 제한) 제8조\n및 제9조에도 불구하고 다음\n각 호에 해당하는 자에 대해서\n는 사면ㆍ감형 및 복권을 할\n수 없다.\n1. 「형법」 제2편제1장의 죄를\n범한 자\n2. 「형법」 제2편제2장의 죄를\n범한 자\n3. 「군형법」 제2편제1장의 죄\n를 범한 자"
  }
}