{
  "title": "2207392_기후위기_대응을_위한_탄소중립ㆍ녹색성장_기본법_일부개정법률안",
  "bill_number": "7392",
  "proposal_date": "2025. 1. 9.",
  "submission_date": "",
  "is_alternative": false,
  "alternative_bill_numbers": [],
  "has_comparison_table": false,
  "comparison_table": "신ㆍ구조문대비표\n현 행 개 정 안\n<신 설> 제72조의2(기금의 평가) 기획재정\n부장관은 기금을 사용하는 사\n업의 성과를 평가하고 그 평가\n결과를 국회에 보고하여야 한\n다.",
  "full_text": "기후위기 대응을 위한 탄소중립ㆍ녹색성장 기본법\n일부개정법률안\n(김소희의원 대표발의)\n발의연월일 : 2025. 1. 9.\n의 안\n7392\n번 호 발 의 자 : 김소희ㆍ김위상ㆍ조경태\n김상훈ㆍ김예지ㆍ안상훈\n김성원ㆍ박덕흠ㆍ유용원\n성일종ㆍ서범수ㆍ김장겸\n의원(12인)\n제안이유 및 주요내용\n기후대응기금 사업의 성과관리를 각 부처에서 개별적으로 실시함에\n따라, 기후대응기금 사업의 전체 임무와 비전이 부재하고 전략목표와\n성과지표 등이 분절적으로 관리되는 등 체계적인 성과관리가 이루어\n지지 않고 있음. 또한, 기후대응기금 사업의 성과달성 현황이 각 부처\n별로 분산되어 있어 종합적인 성과 측정이 곤란한 실정임.\n이에 기후대응기금 관리주체인 기획재정부가 기후대응기금을 사용\n하는 사업의 성과를 평가하고 그 평가 결과를 국회에 보고하도록 하\n여, 기금의 효과적인 운용 및 종합적인 성과관리가 이루어지도록 하려\n는 것임(안 제72조의2 신설).\n\n\n\n\n법률 제 호\n기후위기 대응을 위한 탄소중립ㆍ녹색성장 기본법\n일부개정법률안\n기후위기 대응을 위한 탄소중립ㆍ녹색성장 기본법 일부를 다음과 같\n이 개정한다.\n제72조의2를 다음과 같이 신설한다.\n제72조의2(기금의 평가) 기획재정부장관은 기금을 사용하는 사업의 성\n과를 평가하고 그 평가 결과를 국회에 보고하여야 한다.\n부 칙\n이 법은 공포한 날부터 시행한다.\n\n\n\n\n신ㆍ구조문대비표\n현 행 개 정 안\n<신 설> 제72조의2(기금의 평가) 기획재정\n부장관은 기금을 사용하는 사\n업의 성과를 평가하고 그 평가\n결과를 국회에 보고하여야 한\n다.\n",
  "sections": {
    "제안이유": "및",
    "주요내용": "기후대응기금 사업의 성과관리를 각 부처에서 개별적으로 실시함에\n따라, 기후대응기금 사업의 전체 임무와 비전이 부재하고 전략목표와\n성과지표 등이 분절적으로 관리되는 등 체계적인 성과관리가 이루어\n지지 않고 있음. 또한, 기후대응기금 사업의 성과달성 현황이 각 부처\n별로 분산되어 있어 종합적인 성과 측정이 곤란한 실정임.\n이에 기후대응기금 관리주체인 기획재정부가 기후대응기금을 사용\n하는 사업의 성과를 평가하고 그 평가 결과를 국회에 보고하도록 하\n여, 기금의 효과적인 운용 및 종합적인 성과관리가 이루어지도록 하려\n는 것임(안 제72조의2 신설).",
    "제안이유_및_주요내용": "기후대응기금 사업의 성과관리를 각 부처에서 개별적으로 실시함에\n따라, 기후대응기금 사업의 전체 임무와 비전이 부재하고 전략목표와\n성과지표 등이 분절적으로 관리되는 등 체계적인 성과관리가 이루어\n지지 않고 있음. 또한, 기후대응기금 사업의 성과달성 현황이 각 부처\n별로 분산되어 있어 종합적인 성과 측정이 곤란한 실정임.\n이에 기후대응기금 관리주체인 기획재정부가 기후대응기금을 사용\n하는 사업의 성과를 평가하고 그 평가 결과를 국회에 보고하도록 하\n여, 기금의 효과적인 운용 및 종합적인 성과관리가 이루어지도록 하려\n는 것임(안 제72조의2 신설).",
    "법률_제_호": "기후위기 대응을 위한 탄소중립ㆍ녹색성장 기본법\n일부개정법률안\n기후위기 대응을 위한 탄소중립ㆍ녹색성장 기본법 일부를 다음과 같\n이 개정한다.\n제72조의2를 다음과 같이 신설한다.\n제72조의2(기금의 평가) 기획재정부장관은 기금을 사용하는 사업의 성\n과를 평가하고 그 평가 결과를 국회에 보고하여야 한다.",
    "신구조문대비표": "현 행 개 정 안\n<신 설> 제72조의2(기금의 평가) 기획재정\n부장관은 기금을 사용하는 사\n업의 성과를 평가하고 그 평가\n결과를 국회에 보고하여야 한\n다."
  }
}