{
  "title": "2207459_재외동포의_출입국과_법적_지위에_관한_법률_일부개정법률안",
  "bill_number": "7459",
  "proposal_date": "2025. 1. 13.",
  "submission_date": "",
  "is_alternative": false,
  "alternative_bill_numbers": [],
  "has_comparison_table": false,
  "comparison_table": "신ㆍ구조문대비표\n현 행 개 정 안\n제5조(재외동포체류자격의 부여) 제5조(재외동포체류자격의 부여)\n① ∼ ③ (생 략) ① ∼ ③ (현행과 같음)\n<신 설> ④ 법무부장관은 제1항과 제2\n항에 따라 재외동포체류자격을\n부여할 때에는 재외동포체류자\n격을 신청한 외국국적동포의\n국적을 이유로 차별하여서는\n아니 된다.\n④ (생 략) ⑤ (현행 제4항과 같음)",
  "full_text": "재외동포의 출입국과 법적 지위에 관한 법률\n일부개정법률안\n(이용선의원 대표발의)\n발의연월일 : 2025. 1. 13.\n의 안\n7459\n번 호 발 의 자 : 이용선ㆍ김문수ㆍ허 영\n박용갑ㆍ김 윤ㆍ허성무\n박희승ㆍ이재강ㆍ채현일\n오세희ㆍ강준현 의원\n(11인)\n제안이유 및 주요내용\n현행법 제5조에 따르면 법무부장관은 대한민국 안에서 활동하려는\n외국국적동포에게 재외동포체류자격을 부여할 수 있음.\n그런데 체류자격을 부여할 때 출신 국적에 따라 서로 다른 요건을\n적용하고 있고, 그 결과 국적에 따라 외국국적동포가 취득하고 있는\n체류자격이 다른 현상이 나타나고 있음. 이는 국적의 다름을 기준으로\n재외동포를 차별하는 조치이며, 「재외동포기본법」 제4조제3항에 따\n른 ‘국가는 거주국을 기준으로 재외동포를 차별하여서는 아니 된다’는\n내용과도 부합하지 아니함.\n이에 법무부장관이 재외동포체류자격을 부여할 때 신청자의 국적에\n따라 차별하여서는 아니 된다는 내용을 규정하고자 함(안 제5조).\n\n\n\n\n법률 제 호\n재외동포의 출입국과 법적 지위에 관한 법률\n일부개정법률안\n재외동포의 출입국과 법적 지위에 관한 법률 일부를 다음과 같이 개\n정한다.\n제5조제4항을 제5항으로 하고, 같은 조에 제4항을 다음과 같이 신설한\n다.\n④ 법무부장관은 제1항과 제2항에 따라 재외동포체류자격을 부여할\n때에는 재외동포체류자격을 신청한 외국국적동포의 국적을 이유로\n차별하여서는 아니 된다.\n부 칙\n이 법은 공포 후 6개월이 경과한 날부터 시행한다.\n\n\n\n\n신ㆍ구조문대비표\n현 행 개 정 안\n제5조(재외동포체류자격의 부여) 제5조(재외동포체류자격의 부여)\n① ∼ ③ (생 략) ① ∼ ③ (현행과 같음)\n<신 설> ④ 법무부장관은 제1항과 제2\n항에 따라 재외동포체류자격을\n부여할 때에는 재외동포체류자\n격을 신청한 외국국적동포의\n국적을 이유로 차별하여서는\n아니 된다.\n④ (생 략) ⑤ (현행 제4항과 같음)\n",
  "sections": {
    "제안이유": "및",
    "주요내용": "현행법 제5조에 따르면 법무부장관은 대한민국 안에서 활동하려는\n외국국적동포에게 재외동포체류자격을 부여할 수 있음.\n그런데 체류자격을 부여할 때 출신 국적에 따라 서로 다른 요건을\n적용하고 있고, 그 결과 국적에 따라 외국국적동포가 취득하고 있는\n체류자격이 다른 현상이 나타나고 있음. 이는 국적의 다름을 기준으로\n재외동포를 차별하는 조치이며, 「재외동포기본법」 제4조제3항에 따\n른 ‘국가는 거주국을 기준으로 재외동포를 차별하여서는 아니 된다’는\n내용과도 부합하지 아니함.\n이에 법무부장관이 재외동포체류자격을 부여할 때 신청자의 국적에\n따라 차별하여서는 아니 된다는 내용을 규정하고자 함(안 제5조).",
    "제안이유_및_주요내용": "현행법 제5조에 따르면 법무부장관은 대한민국 안에서 활동하려는\n외국국적동포에게 재외동포체류자격을 부여할 수 있음.\n그런데 체류자격을 부여할 때 출신 국적에 따라 서로 다른 요건을\n적용하고 있고, 그 결과 국적에 따라 외국국적동포가 취득하고 있는\n체류자격이 다른 현상이 나타나고 있음. 이는 국적의 다름을 기준으로\n재외동포를 차별하는 조치이며, 「재외동포기본법」 제4조제3항에 따\n른 ‘국가는 거주국을 기준으로 재외동포를 차별하여서는 아니 된다’는\n내용과도 부합하지 아니함.\n이에 법무부장관이 재외동포체류자격을 부여할 때 신청자의 국적에\n따라 차별하여서는 아니 된다는 내용을 규정하고자 함(안 제5조).",
    "법률_제_호": "재외동포의 출입국과 법적 지위에 관한 법률\n일부개정법률안\n재외동포의 출입국과 법적 지위에 관한 법률 일부를 다음과 같이 개\n정한다.\n제5조제4항을 제5항으로 하고, 같은 조에 제4항을 다음과 같이 신설한\n다.\n④ 법무부장관은 제1항과 제2항에 따라 재외동포체류자격을 부여할\n때에는 재외동포체류자격을 신청한 외국국적동포의 국적을 이유로\n차별하여서는 아니 된다.",
    "신구조문대비표": "현 행 개 정 안\n제5조(재외동포체류자격의 부여) 제5조(재외동포체류자격의 부여)\n① ∼ ③ (생 략) ① ∼ ③ (현행과 같음)\n<신 설> ④ 법무부장관은 제1항과 제2\n항에 따라 재외동포체류자격을\n부여할 때에는 재외동포체류자\n격을 신청한 외국국적동포의\n국적을 이유로 차별하여서는\n아니 된다.\n④ (생 략) ⑤ (현행 제4항과 같음)"
  }
}