{
  "title": "2207274_장애인복지법_일부개정법률안",
  "bill_number": "7274",
  "proposal_date": "2025. 1. 6.",
  "submission_date": "",
  "is_alternative": false,
  "alternative_bill_numbers": [],
  "has_comparison_table": false,
  "comparison_table": "신ㆍ구조문대비표\n현 행 개 정 안\n법률 제17791호 장애인복지법 일 법률 제17791호 장애인복지법 일\n부개정법률 ",
  "full_text": "장애인복지법 일부개정법률안\n(한정애의원 대표발의)\n발의연월일 : 2025. 1. 6.\n의 안\n7274\n번 호 발 의 자 : 한정애ㆍ박홍배ㆍ이수진\n문진석ㆍ송옥주ㆍ김영배\n박수현ㆍ조정식ㆍ추미애\n서영교ㆍ허성무ㆍ이학영\n의원(12인)\n제안이유 및 주요내용\n장애인 거주시설에서 거주 중 사망한 무연고자의 유류품 처리는 원\n칙적으로 평균 3년 3개월이 걸리는 복잡한 「민법」상 절차를 준수하\n여야 하나, 2020년 현행법 및 「사회복지사업법」의 개정으로 500만원\n이하 소액 잔여재산은 지방자치단체에 신고 후 6개월 내 권리 주장자\n가 없으면 지방자치단체에 귀속시킬 수 있는 간소화 특례가 마련됨.\n그런데 법 개정 당시 부칙으로 인해 2021년 6월 30일 이전 사망자\n의 잔여재산은 금액에 상관없이 모두 「민법」상 절차를 준수하도록\n하고 있어, 현장에서 법률 지식 부족 등의 문제로 무연고 사망자의 재\n산을 임의적으로 처리하거나 처리를 회피하는 등의 문제가 여전히 많\n이 발생하고 있다는 지적이 있음.\n이에 현재 시설에서 보관 중인 무연고 사망자의 유류재산에 대해서\n는 사망일에 관계없이 한도액 이하면 간소화 특례에 따라 재산을 처\n\n\n\n리할 수 있도록 부칙을 개정하고자 하는 것임(안 법률 제17791호 장애\n인복지법 일부개정법률 부칙 제3조).\n참고사항\n이 법률안은 한정애의원이 대표발의한 「노인복지법 일부개정법률\n안」(의안번호 제7266호), 「노숙인 등의 복지 및 자립지원에 관한 법\n률 일부개정법률안」(의안번호 제7273호), 「사회복지사업법 일부개정\n법률안」(의안번호 제7275호) 및 「정신건강증진 및 정신질환자 복지\n서비스 지원에 관한 법률 일부개정법률안」(의안번호 제7265호)의 의\n결을 전제로 하는 것이므로 같은 법률안이 의결되지 아니하거나 수정\n의결되는 경우에는 이에 맞추어 조정되어야 할 것임.\n\n법률 제 호\n장애인복지법 일부개정법률안\n장애인복지법 일부를 다음과 같이 개정한다.\n법률 제17791호 장애인복지법 일부개정법률 부칙 제3조 중 “이후”를\n“전”으로, “경우부터”를 “경우에도”로 하고, 같은 부칙 같은 조에 단서\n를 다음과 같이 신설한다.\n다만, 사망한 사람의 재산에 대하여 제60조의5제1항 본문에 따라\n「민법」 제1053조에 따른 상속재산관리인이 선임된 경우는 제외한\n다.\n부 칙\n이 법은 공포 후 3개월이 경과한 날부터 시행한다.\n\n\n\n\n신ㆍ구조문대비표\n현 행 개 정 안\n법률 제17791호 장애인복지법 일 법률 제17791호 장애인복지법 일\n부개정법률 부칙 부개정법률 부칙\n제3조(상속인 없는 재산의 처리 제3조(상속인 없는 재산의 처리\n에 관한 적용례) 제60조의5의 에 관한 적용례) ------------\n개정규정은 이 법 시행 이후 --------------------------전\n장애인 거주시설에 입소 중인 ----------------------------\n사람이 사망한 경우부터 적용 ---------------경우에도-----\n한다. <단서 신설> ----. 다만, 사망한 사람의 재\n산에 대하여 제60조의5제1항\n본문에 따라 「민법」 제1053\n조에 따른 상속재산관리인이\n선임된 경우는 제외한다.\n",
  "sections": {
    "제안이유": "및",
    "주요내용": "장애인 거주시설에서 거주 중 사망한 무연고자의 유류품 처리는 원\n칙적으로 평균 3년 3개월이 걸리는 복잡한 「민법」상 절차를 준수하\n여야 하나, 2020년 현행법 및 「사회복지사업법」의 개정으로 500만원\n이하 소액 잔여재산은 지방자치단체에 신고 후 6개월 내 권리 주장자\n가 없으면 지방자치단체에 귀속시킬 수 있는 간소화 특례가 마련됨.\n그런데 법 개정 당시 부칙으로 인해 2021년 6월 30일 이전 사망자\n의 잔여재산은 금액에 상관없이 모두 「민법」상 절차를 준수하도록\n하고 있어, 현장에서 법률 지식 부족 등의 문제로 무연고 사망자의 재\n산을 임의적으로 처리하거나 처리를 회피하는 등의 문제가 여전히 많\n이 발생하고 있다는 지적이 있음.\n이에 현재 시설에서 보관 중인 무연고 사망자의 유류재산에 대해서\n는 사망일에 관계없이 한도액 이하면 간소화 특례에 따라 재산을 처\n\n\n\n리할 수 있도록 부칙을 개정하고자 하는 것임(안",
    "제안이유_및_주요내용": "장애인 거주시설에서 거주 중 사망한 무연고자의 유류품 처리는 원\n칙적으로 평균 3년 3개월이 걸리는 복잡한 「민법」상 절차를 준수하\n여야 하나, 2020년 현행법 및 「사회복지사업법」의 개정으로 500만원\n이하 소액 잔여재산은 지방자치단체에 신고 후 6개월 내 권리 주장자\n가 없으면 지방자치단체에 귀속시킬 수 있는 간소화 특례가 마련됨.\n그런데 법 개정 당시 부칙으로 인해 2021년 6월 30일 이전 사망자\n의 잔여재산은 금액에 상관없이 모두 「민법」상 절차를 준수하도록\n하고 있어, 현장에서 법률 지식 부족 등의 문제로 무연고 사망자의 재\n산을 임의적으로 처리하거나 처리를 회피하는 등의 문제가 여전히 많\n이 발생하고 있다는 지적이 있음.\n이에 현재 시설에서 보관 중인 무연고 사망자의 유류재산에 대해서\n는 사망일에 관계없이 한도액 이하면 간소화 특례에 따라 재산을 처\n\n\n\n리할 수 있도록 부칙을 개정하고자 하는 것임(안",
    "법률_제_호": "장애\n인복지법 일부개정법률",
    "신구조문대비표": "현 행 개 정 안\n법률 제17791호 장애인복지법 일 법률 제17791호 장애인복지법 일\n부개정법률"
  }
}