{
  "title": "2207015_국가공무원법_일부개정법률안",
  "bill_number": "7015",
  "proposal_date": "2024. 12. 27.",
  "submission_date": "",
  "is_alternative": false,
  "alternative_bill_numbers": [],
  "has_comparison_table": false,
  "comparison_table": "신ㆍ구조문대비표\n현 행 개 정 안\n<신 설> 제47조의2(탄핵소추된 공무원의\n보수) 내란, 외환 또는 반란의\n죄로 탄핵소추의 의결을 받아\n권한 행사가 정지된 공무원은\n해당 기간동안 보수 전액을 감\n한다.",
  "full_text": "국가공무원법 일부개정법률안\n(서영교의원 대표발의)\n발의연월일 : 2024. 12. 27.\n의 안\n7015\n번 호 발 의 자 : 서영교ㆍ한정애ㆍ박희승\n송재봉ㆍ임오경ㆍ유동수\n박균택ㆍ서삼석ㆍ위성곤\n이강일 의원(10인)\n제안이유 및 주요내용\n현행법은 탄핵소추의 의결을 받아 권한 행사가 정지된 공무원에게\n도 보수 지급에 대한 제한 규정이 없음. 이로 인해 본인의 잘못으로\n탄핵소추 의결에 이르러 일을 하지 않게 되어도 탄핵 절차가 종료될\n때까지 다달이 보수를 지급 받는 문제가 발생하고 있음.\n특히 최근 대통령의 내란의 죄 등으로 탄핵소추안이 국회를 통과하\n여 직무가 정지되었음에도 불구하고 월급 약 2천만원이 지급되고 있\n어 “탄핵된 대통령에게 혈세로 월급을 지급할 수 없다”는 국민적 요구\n가 증대되고 있음.\n이에 내란, 외환 또는 반란의 죄로 탄핵소추의 의결을 받아 권한 행\n사가 정지된 공무원은 해당 기간동안 보수 전액을 감하고(안 제47조의\n2 신설), 법 시행 시 탄핵 절차가 진행 중인 경우에도 법의 적용을 받\n을 수 있도록 함(안 부칙 제2조).\n\n\n\n\n법률 제 호\n국가공무원법 일부개정법률안\n국가공무원법 일부를 다음과 같이 개정한다.\n제47조의2를 다음과 같이 신설한다.\n제47조의2(탄핵소추된 공무원의 보수) 내란, 외환 또는 반란의 죄로\n탄핵소추의 의결을 받아 권한 행사가 정지된 공무원은 해당 기간동\n안 보수 전액을 감한다.\n부 칙\n제1조(시행일) 이 법은 공포한 날부터 시행한다.\n제2조(보수 감액에 관한 적용례) 제47조의2의 개정규정은 이 법 시행\n시 탄핵 절차가 진행 중인 경우에 대하여도 적용한다.\n\n\n\n\n신ㆍ구조문대비표\n현 행 개 정 안\n<신 설> 제47조의2(탄핵소추된 공무원의\n보수) 내란, 외환 또는 반란의\n죄로 탄핵소추의 의결을 받아\n권한 행사가 정지된 공무원은\n해당 기간동안 보수 전액을 감\n한다.\n",
  "sections": {
    "제안이유": "및",
    "주요내용": "현행법은 탄핵소추의 의결을 받아 권한 행사가 정지된 공무원에게\n도 보수 지급에 대한 제한 규정이 없음. 이로 인해 본인의 잘못으로\n탄핵소추 의결에 이르러 일을 하지 않게 되어도 탄핵 절차가 종료될\n때까지 다달이 보수를 지급 받는 문제가 발생하고 있음.\n특히 최근 대통령의 내란의 죄 등으로 탄핵소추안이 국회를 통과하\n여 직무가 정지되었음에도 불구하고 월급 약 2천만원이 지급되고 있\n어 “탄핵된 대통령에게 혈세로 월급을 지급할 수 없다”는 국민적 요구\n가 증대되고 있음.\n이에 내란, 외환 또는 반란의 죄로 탄핵소추의 의결을 받아 권한 행\n사가 정지된 공무원은 해당 기간동안 보수 전액을 감하고(안 제47조의\n2 신설), 법 시행 시 탄핵 절차가 진행 중인 경우에도 법의 적용을 받\n을 수 있도록 함(안 부칙 제2조).",
    "제안이유_및_주요내용": "현행법은 탄핵소추의 의결을 받아 권한 행사가 정지된 공무원에게\n도 보수 지급에 대한 제한 규정이 없음. 이로 인해 본인의 잘못으로\n탄핵소추 의결에 이르러 일을 하지 않게 되어도 탄핵 절차가 종료될\n때까지 다달이 보수를 지급 받는 문제가 발생하고 있음.\n특히 최근 대통령의 내란의 죄 등으로 탄핵소추안이 국회를 통과하\n여 직무가 정지되었음에도 불구하고 월급 약 2천만원이 지급되고 있\n어 “탄핵된 대통령에게 혈세로 월급을 지급할 수 없다”는 국민적 요구\n가 증대되고 있음.\n이에 내란, 외환 또는 반란의 죄로 탄핵소추의 의결을 받아 권한 행\n사가 정지된 공무원은 해당 기간동안 보수 전액을 감하고(안 제47조의\n2 신설), 법 시행 시 탄핵 절차가 진행 중인 경우에도 법의 적용을 받\n을 수 있도록 함(안 부칙 제2조).",
    "법률_제_호": "국가공무원법 일부개정법률안\n국가공무원법 일부를 다음과 같이 개정한다.\n제47조의2를 다음과 같이 신설한다.\n제47조의2(탄핵소추된 공무원의 보수) 내란, 외환 또는 반란의 죄로\n탄핵소추의 의결을 받아 권한 행사가 정지된 공무원은 해당 기간동\n안 보수 전액을 감한다.",
    "신구조문대비표": "현 행 개 정 안\n<신 설> 제47조의2(탄핵소추된 공무원의\n보수) 내란, 외환 또는 반란의\n죄로 탄핵소추의 의결을 받아\n권한 행사가 정지된 공무원은\n해당 기간동안 보수 전액을 감\n한다."
  }
}