{
  "title": "2207183_자연공원법_일부개정법률안",
  "bill_number": "7183",
  "proposal_date": "2024. 12. 31.",
  "submission_date": "",
  "is_alternative": false,
  "alternative_bill_numbers": [],
  "has_comparison_table": false,
  "comparison_table": "신ㆍ구조문대비표\n현 행 개 정 안\n<신 설> 제81조의2(벌칙 적용에서 공무원\n의제) 제9조제2항에 따른 각\n공원위원회의 위원 중 공무원\n이 아닌 사람은 「형법」 제12\n9조부터 제132조까지를 적용할\n때에는 공무원으로 본다.",
  "full_text": "자연공원법 일부개정법률안\n(진성준의원 대표발의)\n발의연월일 : 2024. 12. 31.\n의 안\n7183\n번 호 발 의 자 : 진성준ㆍ허 영ㆍ박해철\n김주영ㆍ강선우ㆍ양문석\n위성곤ㆍ정을호ㆍ정태호\n임광현ㆍ문진석ㆍ김태년\n의원(12인)\n제안이유 및 주요내용\n「행정기관 소속 위원회의 설치ㆍ운영에 관한 법률」에 따르면 행\n정기관의 장은 국민의 권리ㆍ의무와 관련되는 인ㆍ허가, 분쟁 조정 등\n공정하고 객관적인 심의ㆍ의결이 필요한 위원회를 설치할 때에는 공\n무원이 아닌 위원에 대한 벌칙 적용에서 공무원 의제에 관한 사항을\n관련 법률에 명시하는 조치를 하도록 규정하고 있음.\n그런데 현행법에 따른 공원위원회가 자연공원의 지정ㆍ해제 및 구\n역변경 등 국민의 권리ㆍ의무와 관련되는 중요사항을 심의하고 있음\n에도, 공원위원회의 위원 중 공무원이 아닌 사람에 대한 공무원 의제\n조항이 마련되어 있지 않음.\n이에 공원위원회 위원 중 공무원이 아닌 사람에 대한 벌칙 적용에\n서 공무원 의제 조항을 마련함으로써 공원위원회에서 공정하고 객관\n적인 심의가 이루어지도록 하려는 것임(안 제81조의2 신설).\n\n\n\n\n법률 제 호\n자연공원법 일부개정법률안\n자연공원법 일부를 다음과 같이 개정한다.\n제7장에 제81조의2를 다음과 같이 신설한다.\n제81조의2(벌칙 적용에서 공무원 의제) 제9조제2항에 따른 각 공원위\n원회의 위원 중 공무원이 아닌 사람은 「형법」 제129조부터 제132\n조까지를 적용할 때에는 공무원으로 본다.\n부 칙\n이 법은 공포 후 6개월이 경과한 날부터 시행한다.\n\n\n\n\n신ㆍ구조문대비표\n현 행 개 정 안\n<신 설> 제81조의2(벌칙 적용에서 공무원\n의제) 제9조제2항에 따른 각\n공원위원회의 위원 중 공무원\n이 아닌 사람은 「형법」 제12\n9조부터 제132조까지를 적용할\n때에는 공무원으로 본다.\n",
  "sections": {
    "제안이유": "및",
    "주요내용": "「행정기관 소속 위원회의 설치ㆍ운영에 관한 법률」에 따르면 행\n정기관의 장은 국민의 권리ㆍ의무와 관련되는 인ㆍ허가, 분쟁 조정 등\n공정하고 객관적인 심의ㆍ의결이 필요한 위원회를 설치할 때에는 공\n무원이 아닌 위원에 대한 벌칙 적용에서 공무원 의제에 관한 사항을\n관련 법률에 명시하는 조치를 하도록 규정하고 있음.\n그런데 현행법에 따른 공원위원회가 자연공원의 지정ㆍ해제 및 구\n역변경 등 국민의 권리ㆍ의무와 관련되는 중요사항을 심의하고 있음\n에도, 공원위원회의 위원 중 공무원이 아닌 사람에 대한 공무원 의제\n조항이 마련되어 있지 않음.\n이에 공원위원회 위원 중 공무원이 아닌 사람에 대한 벌칙 적용에\n서 공무원 의제 조항을 마련함으로써 공원위원회에서 공정하고 객관\n적인 심의가 이루어지도록 하려는 것임(안 제81조의2 신설).",
    "제안이유_및_주요내용": "「행정기관 소속 위원회의 설치ㆍ운영에 관한 법률」에 따르면 행\n정기관의 장은 국민의 권리ㆍ의무와 관련되는 인ㆍ허가, 분쟁 조정 등\n공정하고 객관적인 심의ㆍ의결이 필요한 위원회를 설치할 때에는 공\n무원이 아닌 위원에 대한 벌칙 적용에서 공무원 의제에 관한 사항을\n관련 법률에 명시하는 조치를 하도록 규정하고 있음.\n그런데 현행법에 따른 공원위원회가 자연공원의 지정ㆍ해제 및 구\n역변경 등 국민의 권리ㆍ의무와 관련되는 중요사항을 심의하고 있음\n에도, 공원위원회의 위원 중 공무원이 아닌 사람에 대한 공무원 의제\n조항이 마련되어 있지 않음.\n이에 공원위원회 위원 중 공무원이 아닌 사람에 대한 벌칙 적용에\n서 공무원 의제 조항을 마련함으로써 공원위원회에서 공정하고 객관\n적인 심의가 이루어지도록 하려는 것임(안 제81조의2 신설).",
    "법률_제_호": "자연공원법 일부개정법률안\n자연공원법 일부를 다음과 같이 개정한다.\n제7장에 제81조의2를 다음과 같이 신설한다.\n제81조의2(벌칙 적용에서 공무원 의제) 제9조제2항에 따른 각 공원위\n원회의 위원 중 공무원이 아닌 사람은 「형법」 제129조부터 제132\n조까지를 적용할 때에는 공무원으로 본다.",
    "신구조문대비표": "현 행 개 정 안\n<신 설> 제81조의2(벌칙 적용에서 공무원\n의제) 제9조제2항에 따른 각\n공원위원회의 위원 중 공무원\n이 아닌 사람은 「형법」 제12\n9조부터 제132조까지를 적용할\n때에는 공무원으로 본다."
  }
}