{
  "title": "2207258_각급_법원의_설치와_관할구역에_관한_법률_일부개정법률안",
  "bill_number": "7258",
  "proposal_date": "2025. 1. 6.",
  "submission_date": "",
  "is_alternative": false,
  "alternative_bill_numbers": [],
  "has_comparison_table": false,
  "comparison_table": "신ㆍ구조문대비표\n현 행 개 정 안\n법률 제17124호 각급 법원의 설 법률 제17124호 각급 법원의 설\n치와 관할구역에 관한 법률 일부 치와 관할구역에 관한 법률 일부\n개정법률 ",
  "full_text": "각급 법원의 설치와 관할구역에 관한 법률 일부개정법률안\n(모경종의원 대표발의)\n발의연월일 : 2025. 1. 6.\n의 안\n7258\n번 호 발 의 자 : 모경종ㆍ채현일ㆍ이준석\n김준혁ㆍ주철현ㆍ박정현\n김한규ㆍ이광희ㆍ윤건영\n김 윤ㆍ곽상언 의원\n(11인)\n제안이유 및 주요내용\n지역주민들의 법원 접근성을 향상시키고 사법서비스의 질을 제고하\n기 위하여 2020년 3월 법률개정을 통해 인천지방법원 북부지원의 설\n치 근거를 마련하고, 해당 지원 설치에 관한 시행일(2025년 3월 1일)\n과 사건관할에 관한 경과조치를 두었음. 그러나 이전 예정 부지 조성\n및 관련 절차 지연 등으로 신축사업이 지체됨에 따라 2025년 3월 1일\n에 개원하는 것은 현실적으로 어렵게 되었음.\n이에 따라 부칙에 규정한 인천지방법원 북부지원의 설치 시행일과\n사건관할일을 기존 2025년 3월 1일에서 2028년 3월 1일로 개정하려는\n것임(법률 제17124호 각급 법원의 설치와 관할구역에 관한 법률 일부\n개정법률 부칙 제1조 및 같은 부칙 제2조제1항).\n\n\n\n\n법률 제 호\n각급 법원의 설치와 관할구역에 관한 법률 일부개정법률안\n각급 법원의 설치와 관할구역에 관한 법률 일부를 다음과 같이 개정\n한다.\n법률 제17124호 각급 법원의 설치와 관할구역에 관한 법률 일부개정\n법률 부칙 제1조에 단서를 다음과 같이 신설한다.\n다만, 인천지방법원 북부지원 설치에 관한 사항은 2028년 3월 1일부\n터 시행한다.\n법률 제17124호 각급 법원의 설치와 관할구역에 관한 법률 일부개정\n법률 부칙 제2조제1항 중 “2025년”을 각각 “2028년”으로 한다.\n부 칙\n이 법은 공포한 날부터 시행한다.\n\n\n\n\n신ㆍ구조문대비표\n현 행 개 정 안\n법률 제17124호 각급 법원의 설 법률 제17124호 각급 법원의 설\n치와 관할구역에 관한 법률 일부 치와 관할구역에 관한 법률 일부\n개정법률 부칙 개정법률 부칙\n제1조(시행일) 이 법은 2025년 3 제1조(시행일) -----------------\n월 1일부터 시행한다. <단서 -----------------. 다만, 인천\n신설> 지방법원 북부지원 설치에 관\n한 사항은 2028년 3월 1일부터\n시행한다.\n제2조(사건관할에 관한 경과조치) 제2조(사건관할에 관한 경과조치)\n① 이 법 시행으로 2025년 3월 ① ---------------2028년----\n1일부터 인천지방법원 북부지 ----------------------------\n원의 관할에 속할 사건으로서 ----------------------------\n2025년 2월 28일 현재 인천지 2028년----------------------\n방법원 본원에 계속 중인 사건 ----------------------------\n은 그 계속 중인 법원의 관할 ----------------------------\n로 한다. -------.\n② ∼ ③ (생 략) ② ∼ ③ (현행과 같음)\n",
  "sections": {
    "제안이유": "및",
    "주요내용": "지역주민들의 법원 접근성을 향상시키고 사법서비스의 질을 제고하\n기 위하여 2020년 3월 법률개정을 통해 인천지방법원 북부지원의 설\n치 근거를 마련하고, 해당 지원 설치에 관한 시행일(2025년 3월 1일)\n과 사건관할에 관한 경과조치를 두었음. 그러나 이전 예정 부지 조성\n및 관련 절차 지연 등으로 신축사업이 지체됨에 따라 2025년 3월 1일\n에 개원하는 것은 현실적으로 어렵게 되었음.\n이에 따라 부칙에 규정한 인천지방법원 북부지원의 설치 시행일과\n사건관할일을 기존 2025년 3월 1일에서 2028년 3월 1일로 개정하려는\n것임(",
    "제안이유_및_주요내용": "지역주민들의 법원 접근성을 향상시키고 사법서비스의 질을 제고하\n기 위하여 2020년 3월 법률개정을 통해 인천지방법원 북부지원의 설\n치 근거를 마련하고, 해당 지원 설치에 관한 시행일(2025년 3월 1일)\n과 사건관할에 관한 경과조치를 두었음. 그러나 이전 예정 부지 조성\n및 관련 절차 지연 등으로 신축사업이 지체됨에 따라 2025년 3월 1일\n에 개원하는 것은 현실적으로 어렵게 되었음.\n이에 따라 부칙에 규정한 인천지방법원 북부지원의 설치 시행일과\n사건관할일을 기존 2025년 3월 1일에서 2028년 3월 1일로 개정하려는\n것임(",
    "법률_제_호": "각급 법원의 설치와 관할구역에 관한 법률 일부\n개정법률",
    "신구조문대비표": "현 행 개 정 안\n법률 제17124호 각급 법원의 설 법률 제17124호 각급 법원의 설\n치와 관할구역에 관한 법률 일부 치와 관할구역에 관한 법률 일부\n개정법률"
  }
}