{
  "title": "2207488_한국장학재단_설립_등에_관한_법률_일부개정법률안",
  "bill_number": "7488",
  "proposal_date": "2025. 1. 14.",
  "submission_date": "",
  "is_alternative": false,
  "alternative_bill_numbers": [],
  "has_comparison_table": false,
  "comparison_table": "신ㆍ구조문대비표\n현 행 개 정 안\n제5조(국가의 책무) (생 략) 제5조(국가의 책무) ① (현행 제\n목 외의 부분과 같음)\n<신 설> ② 국가는 학자금대출을 받은\n사람이 학자금대출로 인하여\n금융 활동에서 불이익을 받지\n아니하도록 노력하여야 한다.",
  "full_text": "한국장학재단 설립 등에 관한 법률 일부개정법률안\n(박정의원 대표발의)\n발의연월일 : 2025. 1. 14.\n의 안\n7488\n번 호 발 의 자 : 박 정ㆍ김정호ㆍ임오경\n권칠승ㆍ안호영ㆍ부승찬\n송옥주ㆍ박홍배ㆍ강유정\n김태선ㆍ어기구ㆍ윤후덕\n허 영ㆍ강득구ㆍ신정훈\n김문수ㆍ조계원ㆍ김영환\n이연희 의원(19인)\n제안이유 및 주요내용\n현행법은 학자금 지원 제도를 효율적으로 운영함으로써 경제적 여\n건에 관계없이 누구나 의지와 능력에 따라 고등교육 기회를 가질 수\n있도록 함을 목적으로 하고 있음.\n그런데, 학자금대출이 여타의 금융권 대출에 비하여 신용을 낮게 평\n가받고 있어 향후의 금융활동에 부정적인 영향을 미치고 있는데, 학자\n금대출은 모든 국민의 고등교육 기회를 보장하기 위하여 국가가 운영\n하는 정책대출이라는 점을 고려할 때 학자금대출로 인한 대학생의 금\n융 활동에 불이익이 발생하지 않도록 국가가 노력할 필요가 있음.\n이에 학자금대출을 받은 사람이 학자금대출로 인하여 금융 활동에\n서 불이익을 받지 아니하도록 노력할 의무를 국가에 부여함으로써 학\n\n\n\n자금지원으로 인한 부정적인 영향이 발생하지 않도록 하려는 것임(안\n제5조제2항 신설).\n\n법률 제 호\n한국장학재단 설립 등에 관한 법률 일부개정법률안\n한국장학재단 설립 등에 관한 법률 일부를 다음과 같이 개정한다.\n제5조 제목 외의 부분을 제1항으로 하고, 같은 조에 제2항을 다음과\n같이 신설한다.\n② 국가는 학자금대출을 받은 사람이 학자금대출로 인하여 금융 활\n동에서 불이익을 받지 아니하도록 노력하여야 한다.\n부 칙\n이 법은 공포 후 6개월이 경과한 날부터 시행한다.\n\n\n\n\n신ㆍ구조문대비표\n현 행 개 정 안\n제5조(국가의 책무) (생 략) 제5조(국가의 책무) ① (현행 제\n목 외의 부분과 같음)\n<신 설> ② 국가는 학자금대출을 받은\n사람이 학자금대출로 인하여\n금융 활동에서 불이익을 받지\n아니하도록 노력하여야 한다.\n",
  "sections": {
    "제안이유": "및",
    "주요내용": "현행법은 학자금 지원 제도를 효율적으로 운영함으로써 경제적 여\n건에 관계없이 누구나 의지와 능력에 따라 고등교육 기회를 가질 수\n있도록 함을 목적으로 하고 있음.\n그런데, 학자금대출이 여타의 금융권 대출에 비하여 신용을 낮게 평\n가받고 있어 향후의 금융활동에 부정적인 영향을 미치고 있는데, 학자\n금대출은 모든 국민의 고등교육 기회를 보장하기 위하여 국가가 운영\n하는 정책대출이라는 점을 고려할 때 학자금대출로 인한 대학생의 금\n융 활동에 불이익이 발생하지 않도록 국가가 노력할 필요가 있음.\n이에 학자금대출을 받은 사람이 학자금대출로 인하여 금융 활동에\n서 불이익을 받지 아니하도록 노력할 의무를 국가에 부여함으로써 학\n\n\n\n자금지원으로 인한 부정적인 영향이 발생하지 않도록 하려는 것임(안\n제5조제2항 신설).",
    "제안이유_및_주요내용": "현행법은 학자금 지원 제도를 효율적으로 운영함으로써 경제적 여\n건에 관계없이 누구나 의지와 능력에 따라 고등교육 기회를 가질 수\n있도록 함을 목적으로 하고 있음.\n그런데, 학자금대출이 여타의 금융권 대출에 비하여 신용을 낮게 평\n가받고 있어 향후의 금융활동에 부정적인 영향을 미치고 있는데, 학자\n금대출은 모든 국민의 고등교육 기회를 보장하기 위하여 국가가 운영\n하는 정책대출이라는 점을 고려할 때 학자금대출로 인한 대학생의 금\n융 활동에 불이익이 발생하지 않도록 국가가 노력할 필요가 있음.\n이에 학자금대출을 받은 사람이 학자금대출로 인하여 금융 활동에\n서 불이익을 받지 아니하도록 노력할 의무를 국가에 부여함으로써 학\n\n\n\n자금지원으로 인한 부정적인 영향이 발생하지 않도록 하려는 것임(안\n제5조제2항 신설).",
    "법률_제_호": "한국장학재단 설립 등에 관한 법률 일부개정법률안\n한국장학재단 설립 등에 관한 법률 일부를 다음과 같이 개정한다.\n제5조 제목 외의 부분을 제1항으로 하고, 같은 조에 제2항을 다음과\n같이 신설한다.\n② 국가는 학자금대출을 받은 사람이 학자금대출로 인하여 금융 활\n동에서 불이익을 받지 아니하도록 노력하여야 한다.",
    "신구조문대비표": "현 행 개 정 안\n제5조(국가의 책무) (생 략) 제5조(국가의 책무) ① (현행 제\n목 외의 부분과 같음)\n<신 설> ② 국가는 학자금대출을 받은\n사람이 학자금대출로 인하여\n금융 활동에서 불이익을 받지\n아니하도록 노력하여야 한다."
  }
}