{
  "title": "2207917_형법_일부개정법률안",
  "bill_number": "7917",
  "proposal_date": "2025. 2. 5.",
  "submission_date": "",
  "is_alternative": false,
  "alternative_bill_numbers": [],
  "has_comparison_table": false,
  "comparison_table": "신ㆍ구조문대비표\n현 행 개 정 안\n<신 설> 제116조의2(공중협박) ① 불특정\n또는 다수의 사람의 생명, 신\n체에 위해를 가할 것을 공연히\n유포하여 공중을 협박한 사람\n은 5년 이하의 징역 또는 2천\n만원 이하의 벌금에 처한다.\n② 제1항의 미수범은 처벌한\n다.",
  "full_text": "형법 일부개정법률안\n(서영교의원 대표발의)\n발의연월일 : 2025. 2. 5.\n의 안\n7917\n번 호 발 의 자 : 서영교ㆍ송재봉ㆍ임오경\n유동수ㆍ윤준병ㆍ박상혁\n이개호ㆍ장경태ㆍ전현희\n박홍배 의원(10인)\n제안이유 및 주요내용\n최근 온라인 살인예고 글 게시 등 공중을 대상으로 한 협박 범죄가\n수차례 발생하고 있어 국민들의 불안감이 증폭되고 있음.\n그러나 현행법상 이러한 공중협박 행위에 대한 명시적인 처벌 규정\n이 없어 범죄 대응과 처벌이 어려움. 특히 온라인 살인예고 글 게시\n등 불특정 다수에 대한 협박의 경우, 기존 협박죄 적용에 있어 피해자\n의 범위, 범죄성립 여부 등에 대한 해석이 엇갈리고 있음.\n이에 불특정 또는 다수의 사람의 생명, 신체에 위해를 가할 것을 공\n연히 유포하여 공중을 협박한 사람을 처벌하는 공중협박죄를 「형\n법」에 신설함으로써 공중의 생명ㆍ신체에 대한 안전을 위협하는 행\n위로부터 국민을 보호하려는 것임(안 제116조의2 신설).\n\n\n\n\n법률 제 호\n형법 일부개정법률안\n형법 일부를 다음과 같이 개정한다.\n제116조의2를 다음과 같이 신설한다.\n제116조의2(공중협박) ① 불특정 또는 다수의 사람의 생명, 신체에 위\n해를 가할 것을 공연히 유포하여 공중을 협박한 사람은 5년 이하의\n징역 또는 2천만원 이하의 벌금에 처한다.\n② 제1항의 미수범은 처벌한다.\n부 칙\n이 법은 공포한 날부터 시행한다.\n\n\n\n\n신ㆍ구조문대비표\n현 행 개 정 안\n<신 설> 제116조의2(공중협박) ① 불특정\n또는 다수의 사람의 생명, 신\n체에 위해를 가할 것을 공연히\n유포하여 공중을 협박한 사람\n은 5년 이하의 징역 또는 2천\n만원 이하의 벌금에 처한다.\n② 제1항의 미수범은 처벌한\n다.\n",
  "sections": {
    "제안이유": "및",
    "주요내용": "최근 온라인 살인예고 글 게시 등 공중을 대상으로 한 협박 범죄가\n수차례 발생하고 있어 국민들의 불안감이 증폭되고 있음.\n그러나 현행법상 이러한 공중협박 행위에 대한 명시적인 처벌 규정\n이 없어 범죄 대응과 처벌이 어려움. 특히 온라인 살인예고 글 게시\n등 불특정 다수에 대한 협박의 경우, 기존 협박죄 적용에 있어 피해자\n의 범위, 범죄성립 여부 등에 대한 해석이 엇갈리고 있음.\n이에 불특정 또는 다수의 사람의 생명, 신체에 위해를 가할 것을 공\n연히 유포하여 공중을 협박한 사람을 처벌하는 공중협박죄를 「형\n법」에 신설함으로써 공중의 생명ㆍ신체에 대한 안전을 위협하는 행\n위로부터 국민을 보호하려는 것임(안 제116조의2 신설).",
    "제안이유_및_주요내용": "최근 온라인 살인예고 글 게시 등 공중을 대상으로 한 협박 범죄가\n수차례 발생하고 있어 국민들의 불안감이 증폭되고 있음.\n그러나 현행법상 이러한 공중협박 행위에 대한 명시적인 처벌 규정\n이 없어 범죄 대응과 처벌이 어려움. 특히 온라인 살인예고 글 게시\n등 불특정 다수에 대한 협박의 경우, 기존 협박죄 적용에 있어 피해자\n의 범위, 범죄성립 여부 등에 대한 해석이 엇갈리고 있음.\n이에 불특정 또는 다수의 사람의 생명, 신체에 위해를 가할 것을 공\n연히 유포하여 공중을 협박한 사람을 처벌하는 공중협박죄를 「형\n법」에 신설함으로써 공중의 생명ㆍ신체에 대한 안전을 위협하는 행\n위로부터 국민을 보호하려는 것임(안 제116조의2 신설).",
    "법률_제_호": "형법 일부개정법률안\n형법 일부를 다음과 같이 개정한다.\n제116조의2를 다음과 같이 신설한다.\n제116조의2(공중협박) ① 불특정 또는 다수의 사람의 생명, 신체에 위\n해를 가할 것을 공연히 유포하여 공중을 협박한 사람은 5년 이하의\n징역 또는 2천만원 이하의 벌금에 처한다.\n② 제1항의 미수범은 처벌한다.",
    "신구조문대비표": "현 행 개 정 안\n<신 설> 제116조의2(공중협박) ① 불특정\n또는 다수의 사람의 생명, 신\n체에 위해를 가할 것을 공연히\n유포하여 공중을 협박한 사람\n은 5년 이하의 징역 또는 2천\n만원 이하의 벌금에 처한다.\n② 제1항의 미수범은 처벌한\n다."
  }
}