{
  "title": "2207448_사면법_일부개정법률안",
  "bill_number": "7448",
  "proposal_date": "2025. 1. 10.",
  "submission_date": "",
  "is_alternative": false,
  "alternative_bill_numbers": [],
  "has_comparison_table": false,
  "comparison_table": "신·구조문대비표\n현 행 개 정 안\n<신 설> 제9조의2(사면 등의 제한) 제8조\n및 제9조에도 불구하고 다음\n각 호에 해당하는 자에 대해서\n는 사면ㆍ감형 및 복권을 할\n수 없다.\n1. 「형법」 제2편제1장의 죄를\n범한 자\n2. 「형법」 제2편제2장의 죄를\n범한 자",
  "full_text": "사면법 일부개정법률안\n(한정애의원 대표발의)\n발의연월일 : 2025. 1. 10.\n의 안\n7448\n번 호 발 의 자 : 한정애ㆍ주철현ㆍ조인철\n문진석ㆍ박홍근ㆍ양문석\n강준현ㆍ민홍철ㆍ한창민\n김영배ㆍ허종식ㆍ임광현\n송옥주 의원(13인)\n제안이유 및 주요내용\n헌법 제79조는 “대통령은 법률이 정하는 바에 의하여 사면ㆍ감형\n또는 복권을 명할 수 있다”고 규정하고 이 중 일반 사면은 국회 동의\n를 거쳐야 하지만, 「사면법」에 명시된 특별사면은 대통령 권한임.\n이로 인해 「형법」상 내란죄ㆍ외환죄와 같이 국가의 존립과 헌정\n질서를 위협하는 매우 중대한 범죄를 저지르더라도 대통령의 독단적\n인 판단에 의한 사면이 가능한 상황임.\n그러나 최근 반헌법적 비상계엄 선포를 선포해 헌정질서를 위협하\n는 내란죄 등의 중대 범죄를 저지른 내란수괴 피의자 윤석열과 같은\n경우에는 사면 등으로 면죄부를 주지 못하도록 제도 정비가 필요하다\n는 지적이 제기되고 있음.\n한편, 헌법 제84조에 따르면 현직 대통령의 직무수행이 형사 절차로\n\n\n\n방해받지 않도록 내란 또는 외환의 죄를 범한 경우를 제외하고 재직\n중 형사상의 소추를 받지 아니하도록 하는 불소추특권을 부여하고 있\n는데 이는 내란죄와 외환죄를 범한 경우에는 대통령이라 할지라도 헌\n법 질서를 수호해야 하는 책임에서 자유로울 수 없다는 법치주의의\n원칙을 반영한 것임.\n이에 내란과 외환의 죄를 범한 자는 사면ㆍ감형 또는 복권을 할 수\n없도록 규정하려는 것임(안 제9조의2 신설).\n\n법률 제 호\n사면법 일부개정법률안\n사면법 일부를 다음과 같이 개정한다.\n제9조의2를 다음과 같이 신설한다.\n제9조의2(사면 등의 제한) 제8조 및 제9조에도 불구하고 다음 각 호에\n해당하는 자에 대해서는 사면ㆍ감형 및 복권을 할 수 없다.\n1. 「형법」 제2편제1장의 죄를 범한 자\n2. 「형법」 제2편제2장의 죄를 범한 자\n부 칙\n이 법은 공포한 날부터 시행한다.\n\n\n\n\n신·구조문대비표\n현 행 개 정 안\n<신 설> 제9조의2(사면 등의 제한) 제8조\n및 제9조에도 불구하고 다음\n각 호에 해당하는 자에 대해서\n는 사면ㆍ감형 및 복권을 할\n수 없다.\n1. 「형법」 제2편제1장의 죄를\n범한 자\n2. 「형법」 제2편제2장의 죄를\n범한 자\n",
  "sections": {
    "제안이유": "및",
    "주요내용": "헌법 제79조는 “대통령은 법률이 정하는 바에 의하여 사면ㆍ감형\n또는 복권을 명할 수 있다”고 규정하고 이 중 일반 사면은 국회 동의\n를 거쳐야 하지만, 「사면법」에 명시된 특별사면은 대통령 권한임.\n이로 인해 「형법」상 내란죄ㆍ외환죄와 같이 국가의 존립과 헌정\n질서를 위협하는 매우 중대한 범죄를 저지르더라도 대통령의 독단적\n인 판단에 의한 사면이 가능한 상황임.\n그러나 최근 반헌법적 비상계엄 선포를 선포해 헌정질서를 위협하\n는 내란죄 등의 중대 범죄를 저지른 내란수괴 피의자 윤석열과 같은\n경우에는 사면 등으로 면죄부를 주지 못하도록 제도 정비가 필요하다\n는 지적이 제기되고 있음.\n한편, 헌법 제84조에 따르면 현직 대통령의 직무수행이 형사 절차로\n\n\n\n방해받지 않도록 내란 또는 외환의 죄를 범한 경우를 제외하고 재직\n중 형사상의 소추를 받지 아니하도록 하는 불소추특권을 부여하고 있\n는데 이는 내란죄와 외환죄를 범한 경우에는 대통령이라 할지라도 헌\n법 질서를 수호해야 하는 책임에서 자유로울 수 없다는 법치주의의\n원칙을 반영한 것임.\n이에 내란과 외환의 죄를 범한 자는 사면ㆍ감형 또는 복권을 할 수\n없도록 규정하려는 것임(안 제9조의2 신설).",
    "제안이유_및_주요내용": "헌법 제79조는 “대통령은 법률이 정하는 바에 의하여 사면ㆍ감형\n또는 복권을 명할 수 있다”고 규정하고 이 중 일반 사면은 국회 동의\n를 거쳐야 하지만, 「사면법」에 명시된 특별사면은 대통령 권한임.\n이로 인해 「형법」상 내란죄ㆍ외환죄와 같이 국가의 존립과 헌정\n질서를 위협하는 매우 중대한 범죄를 저지르더라도 대통령의 독단적\n인 판단에 의한 사면이 가능한 상황임.\n그러나 최근 반헌법적 비상계엄 선포를 선포해 헌정질서를 위협하\n는 내란죄 등의 중대 범죄를 저지른 내란수괴 피의자 윤석열과 같은\n경우에는 사면 등으로 면죄부를 주지 못하도록 제도 정비가 필요하다\n는 지적이 제기되고 있음.\n한편, 헌법 제84조에 따르면 현직 대통령의 직무수행이 형사 절차로\n\n\n\n방해받지 않도록 내란 또는 외환의 죄를 범한 경우를 제외하고 재직\n중 형사상의 소추를 받지 아니하도록 하는 불소추특권을 부여하고 있\n는데 이는 내란죄와 외환죄를 범한 경우에는 대통령이라 할지라도 헌\n법 질서를 수호해야 하는 책임에서 자유로울 수 없다는 법치주의의\n원칙을 반영한 것임.\n이에 내란과 외환의 죄를 범한 자는 사면ㆍ감형 또는 복권을 할 수\n없도록 규정하려는 것임(안 제9조의2 신설).",
    "법률_제_호": "사면법 일부개정법률안\n사면법 일부를 다음과 같이 개정한다.\n제9조의2를 다음과 같이 신설한다.\n제9조의2(사면 등의 제한) 제8조 및 제9조에도 불구하고 다음 각 호에\n해당하는 자에 대해서는 사면ㆍ감형 및 복권을 할 수 없다.\n1. 「형법」 제2편제1장의 죄를 범한 자\n2. 「형법」 제2편제2장의 죄를 범한 자",
    "신구조문대비표": "현 행 개 정 안\n<신 설> 제9조의2(사면 등의 제한) 제8조\n및 제9조에도 불구하고 다음\n각 호에 해당하는 자에 대해서\n는 사면ㆍ감형 및 복권을 할\n수 없다.\n1. 「형법」 제2편제1장의 죄를\n범한 자\n2. 「형법」 제2편제2장의 죄를\n범한 자"
  }
}