{
  "title": "2207266_노인복지법_일부개정법률안",
  "bill_number": "7266",
  "proposal_date": "2025. 1. 6.",
  "submission_date": "",
  "is_alternative": false,
  "alternative_bill_numbers": [],
  "has_comparison_table": false,
  "comparison_table": "신ㆍ구조문대비표\n현 행 개 정 안\n법률 제17776호 노인복지법 법률 제17776호 노인복지법\n일부개정법률 ",
  "full_text": "노인복지법 일부개정법률안\n(한정애의원 대표발의)\n발의연월일 : 2025. 1. 6.\n의 안\n7266\n번 호 발 의 자 : 한정애ㆍ박홍배ㆍ이수진\n이강일ㆍ문진석ㆍ송옥주\n권향엽ㆍ김영배ㆍ박수현\n민홍철ㆍ조정식ㆍ서영교\n허성무ㆍ이학영 의원\n(14명)\n제안이유 및 주요내용\n노인주거ㆍ의료복지시설에서 거주하다 사망한 무연고자의 유류품 처\n리는 원칙적으로 평균 3년 3개월이 걸리는 복잡한 민법상 절차를 준수\n하여야 하나, 2020년 현행법 및 사회복지사업법의 개정으로 500만원 이\n하 소액 잔여재산은 지방자치단체에 신고 후 6개월 내 권리 주장자가\n없으면 지방자치단체에 귀속시킬 수 있는 간소화 특례가 마련됨.\n그런데 법 개정 당시 부칙으로 인해 2021년 6월 30일 이전 사망자\n의 잔여재산은 금액에 상관없이 모두 민법상 절차를 준수하도록 하고\n있어, 현장에서 법률 지식 부족 등의 문제로 무연고 사망자의 재산을\n임의적으로 처리하거나 처리를 회피하는 등의 문제가 여전히 많이 발\n생하고 있다는 지적이 있음.\n이에 현재 시설에서 보관 중인 무연고 사망자의 유류재산에 대해서\n\n\n\n는 사망일에 관계없이 한도액 이하면 간소화 특례에 따라 재산을 처리\n할 수 있도록 부칙을 개정하고자 하는 것임(안 법률 제17776호 노인복\n지법 일부개정법률 부칙 제2조).\n참고사항\n이 법률안은 한정애의원이 대표발의한 「노숙인 등의 복지 및 자립\n지원에 관한 법률 일부개정법률안」(의안번호 제7273호), 「장애인복\n지법 일부개정법률안」(의안번호 제7274호), 「사회복지사업법 일부개\n정법률안」(의안번호 제7275호) 및 「정신건강증진 및 정신질환자 복\n지서비스 지원에 관한 법률 일부개정법률안」(의안번호 제7265호)의\n의결을 전제로 하는 것이므로 같은 법률안이 의결되지 아니하거나 수\n정의결되는 경우에는 이에 맞추어 조정되어야 할 것임.\n\n법률 제 호\n노인복지법 일부개정법률안\n노인복지법 일부를 다음과 같이 개정한다.\n법률 제17776호 노인복지법 일부개정법률 부칙 제2조 중 “이후”를\n“전”으로, “경우부터”를 “경우에도”로 하고, 같은 조에 단서를 다음과\n같이 신설한다.\n단, 사망한 사람의 재산에 대하여 제48조제1항 본문의 규정에 따라\n「민법」 제1053조에 따른 상속재산관리인이 선임된 경우는 제외한\n다.\n부 칙\n이 법은 공포 후 3개월이 경과한 날부터 시행한다.\n\n\n\n\n신ㆍ구조문대비표\n현 행 개 정 안\n법률 제17776호 노인복지법 법률 제17776호 노인복지법\n일부개정법률 부칙 일부개정법률 부칙\n제2조(상속인 없는 재산의 처리 제2조(상속인 없는 재산의 처리\n에 관한 적용례) 제48조의 개 에 관한 적용례) ------------\n정규정은 이 법 시행 이후 노 -------------------전-------\n인주거복지시설 또는 노인의료 ----------------------------\n복지시설에 입소 중인 사람이 ----------------------------\n사망한 경우부터 적용한다. ---경우에도---------. 단, 사\n<단서 신설> 망한 사람의 재산에 대하여 제\n48조제1항 본문의 규정에 따라\n「민법」 제1053조에 따른 상\n속재산관리인이 선임된 경우는\n제외한다.\n",
  "sections": {
    "제안이유": "및",
    "주요내용": "노인주거ㆍ의료복지시설에서 거주하다 사망한 무연고자의 유류품 처\n리는 원칙적으로 평균 3년 3개월이 걸리는 복잡한 민법상 절차를 준수\n하여야 하나, 2020년 현행법 및 사회복지사업법의 개정으로 500만원 이\n하 소액 잔여재산은 지방자치단체에 신고 후 6개월 내 권리 주장자가\n없으면 지방자치단체에 귀속시킬 수 있는 간소화 특례가 마련됨.\n그런데 법 개정 당시 부칙으로 인해 2021년 6월 30일 이전 사망자\n의 잔여재산은 금액에 상관없이 모두 민법상 절차를 준수하도록 하고\n있어, 현장에서 법률 지식 부족 등의 문제로 무연고 사망자의 재산을\n임의적으로 처리하거나 처리를 회피하는 등의 문제가 여전히 많이 발\n생하고 있다는 지적이 있음.\n이에 현재 시설에서 보관 중인 무연고 사망자의 유류재산에 대해서\n\n\n\n는 사망일에 관계없이 한도액 이하면 간소화 특례에 따라 재산을 처리\n할 수 있도록 부칙을 개정하고자 하는 것임(안",
    "제안이유_및_주요내용": "노인주거ㆍ의료복지시설에서 거주하다 사망한 무연고자의 유류품 처\n리는 원칙적으로 평균 3년 3개월이 걸리는 복잡한 민법상 절차를 준수\n하여야 하나, 2020년 현행법 및 사회복지사업법의 개정으로 500만원 이\n하 소액 잔여재산은 지방자치단체에 신고 후 6개월 내 권리 주장자가\n없으면 지방자치단체에 귀속시킬 수 있는 간소화 특례가 마련됨.\n그런데 법 개정 당시 부칙으로 인해 2021년 6월 30일 이전 사망자\n의 잔여재산은 금액에 상관없이 모두 민법상 절차를 준수하도록 하고\n있어, 현장에서 법률 지식 부족 등의 문제로 무연고 사망자의 재산을\n임의적으로 처리하거나 처리를 회피하는 등의 문제가 여전히 많이 발\n생하고 있다는 지적이 있음.\n이에 현재 시설에서 보관 중인 무연고 사망자의 유류재산에 대해서\n\n\n\n는 사망일에 관계없이 한도액 이하면 간소화 특례에 따라 재산을 처리\n할 수 있도록 부칙을 개정하고자 하는 것임(안",
    "법률_제_호": "노인복\n지법 일부개정법률",
    "신구조문대비표": "현 행 개 정 안\n법률 제17776호 노인복지법 법률 제17776호 노인복지법\n일부개정법률"
  }
}