{
  "title": "2207419_국경일에_관한_법률_일부개정법률안",
  "bill_number": "7419",
  "proposal_date": "2025. 1. 10.",
  "submission_date": "",
  "is_alternative": false,
  "alternative_bill_numbers": [],
  "has_comparison_table": false,
  "comparison_table": "신ㆍ구조문대비표\n현 행 개 정 안\n제2조(국경일의 종류) 국경일은 제2조(국경일의 종류) ----------\n다음 각 호와 같다. ----------------.\n1. (생 략) 1. (현행과 같음)\n<신 설> 2. 6ㆍ10민주항쟁: 6월 10일\n2. ∼ 5. (생 략) 3. ∼ 6. (현행 제2호부터 제5\n호까지와 같음)",
  "full_text": "국경일에 관한 법률 일부개정법률안\n(김상욱의원 대표발의)\n발의연월일 : 2025. 1. 10.\n의 안\n7419\n번 호 발 의 자 : 김상욱ㆍ이준석ㆍ김예지\n서천호ㆍ김한규ㆍ정준호\n천하람ㆍ김 윤ㆍ이소영\n박주민ㆍ박지혜ㆍ성일종\n김용민ㆍ조경태ㆍ이해민\n의원(15인)\n제안이유 및 주요내용\n현행법은 3ㆍ1절, 제헌절, 광복절, 개천절 및 한글날을 국경일로 정\n하고 있음.\n하지만, 「대한민국 헌법」 제1조제2항에서 민주주의 원칙을 명시하\n고 있음에도 민주주의와 관련한 국경일은 없는 실정임.\n1987년 6월 10일 민주항쟁은 군사 독재 정권을 시민혁명으로 종식\n시키고 대한민국 민주주의의 역사적 전환점이 되었으며 모든 분야에\n서 민주주의의 토대를 다진 기념비적 항쟁임.\n이에 국민의 손으로 민주주의를 쟁취한 6ㆍ10민주항쟁일인 6월 10\n일을 국경일과 공휴일로 규정함으로써 대한민국 민주주의 가치를 공\n식적으로 기념하고 민주주의의 지속적인 발전과 국민 통합을 위한 상\n징적 역할을 할 수 있도록 하고자 함(안 제2조제2호 신설).\n\n\n\n\n법률 제 호\n국경일에 관한 법률 일부개정법률안\n국경일에 관한 법률 일부를 다음과 같이 개정한다.\n제2조제2호부터 제5호까지를 각각 제3호부터 제6호까지로 하고, 같은\n조에 제2호를 다음과 같이 신설한다.\n2. 6ㆍ10민주항쟁: 6월 10일\n부 칙\n이 법은 공포한 날부터 시행한다.\n\n\n\n\n신ㆍ구조문대비표\n현 행 개 정 안\n제2조(국경일의 종류) 국경일은 제2조(국경일의 종류) ----------\n다음 각 호와 같다. ----------------.\n1. (생 략) 1. (현행과 같음)\n<신 설> 2. 6ㆍ10민주항쟁: 6월 10일\n2. ∼ 5. (생 략) 3. ∼ 6. (현행 제2호부터 제5\n호까지와 같음)\n",
  "sections": {
    "제안이유": "및",
    "주요내용": "현행법은 3ㆍ1절, 제헌절, 광복절, 개천절 및 한글날을 국경일로 정\n하고 있음.\n하지만, 「대한민국 헌법」 제1조제2항에서 민주주의 원칙을 명시하\n고 있음에도 민주주의와 관련한 국경일은 없는 실정임.\n1987년 6월 10일 민주항쟁은 군사 독재 정권을 시민혁명으로 종식\n시키고 대한민국 민주주의의 역사적 전환점이 되었으며 모든 분야에\n서 민주주의의 토대를 다진 기념비적 항쟁임.\n이에 국민의 손으로 민주주의를 쟁취한 6ㆍ10민주항쟁일인 6월 10\n일을 국경일과 공휴일로 규정함으로써 대한민국 민주주의 가치를 공\n식적으로 기념하고 민주주의의 지속적인 발전과 국민 통합을 위한 상\n징적 역할을 할 수 있도록 하고자 함(안 제2조제2호 신설).",
    "제안이유_및_주요내용": "현행법은 3ㆍ1절, 제헌절, 광복절, 개천절 및 한글날을 국경일로 정\n하고 있음.\n하지만, 「대한민국 헌법」 제1조제2항에서 민주주의 원칙을 명시하\n고 있음에도 민주주의와 관련한 국경일은 없는 실정임.\n1987년 6월 10일 민주항쟁은 군사 독재 정권을 시민혁명으로 종식\n시키고 대한민국 민주주의의 역사적 전환점이 되었으며 모든 분야에\n서 민주주의의 토대를 다진 기념비적 항쟁임.\n이에 국민의 손으로 민주주의를 쟁취한 6ㆍ10민주항쟁일인 6월 10\n일을 국경일과 공휴일로 규정함으로써 대한민국 민주주의 가치를 공\n식적으로 기념하고 민주주의의 지속적인 발전과 국민 통합을 위한 상\n징적 역할을 할 수 있도록 하고자 함(안 제2조제2호 신설).",
    "법률_제_호": "국경일에 관한 법률 일부개정법률안\n국경일에 관한 법률 일부를 다음과 같이 개정한다.\n제2조제2호부터 제5호까지를 각각 제3호부터 제6호까지로 하고, 같은\n조에 제2호를 다음과 같이 신설한다.\n2. 6ㆍ10민주항쟁: 6월 10일",
    "신구조문대비표": "현 행 개 정 안\n제2조(국경일의 종류) 국경일은 제2조(국경일의 종류) ----------\n다음 각 호와 같다. ----------------.\n1. (생 략) 1. (현행과 같음)\n<신 설> 2. 6ㆍ10민주항쟁: 6월 10일\n2. ∼ 5. (생 략) 3. ∼ 6. (현행 제2호부터 제5\n호까지와 같음)"
  }
}