{
  "title": "2207597_공휴일에_관한_법률_일부개정법률안",
  "bill_number": "7597",
  "proposal_date": "2025. 1. 17.",
  "submission_date": "",
  "is_alternative": false,
  "alternative_bill_numbers": [],
  "has_comparison_table": false,
  "comparison_table": "신ㆍ구조문대비표\n현 행 개 정 안\n제3조(대체공휴일) ①ㆍ② (생 제3조(대체공휴일) ①ㆍ② (현행\n략) 과 같음)\n<신 설> ③ 제1항에 따라 대체공휴일을\n지정할 때에는 해당 공휴일 최\n소 1개월 전까지 공표하여야\n한다.",
  "full_text": "공휴일에 관한 법률 일부개정법률안\n(김문수의원 대표발의)\n발의연월일 : 2025. 1. 17.\n의 안\n7597\n번 호 발 의 자 : 김문수ㆍ박지원ㆍ이광희\n이수진ㆍ조계원ㆍ허성무\n정일영ㆍ박희승ㆍ이병진\n김우영ㆍ신정훈ㆍ정성호\n강준현 의원(13인)\n제안이유 및 주요내용\n현행법은 대체공휴일 지정의 법적 근거를 마련하고 있으나, 대체공\n휴일 지정 시기의 구체적 기준이 없어 국민과 기업이 미리 계획을 수\n립할 수 없다는 지적이 지속되고 있음.\n이에 대체공휴일을 해당 공휴일 최소 한 달 전에 공표하도록 하여\n공휴일 운영의 예측 가능성을 확보하려고 함(안 제3조제3항).\n\n\n\n\n법률 제 호\n공휴일에 관한 법률 일부개정법률안\n공휴일에 관한 법률 일부를 다음과 같이 개정한다.\n제3조에 제3항을 다음과 같이 신설한다.\n③ 제1항에 따라 대체공휴일을 지정할 때에는 해당 공휴일 최소 1\n개월 전까지 공표하여야 한다.\n부 칙\n이 법은 공포 후 3개월이 경과한 날부터 시행한다.\n\n\n\n\n신ㆍ구조문대비표\n현 행 개 정 안\n제3조(대체공휴일) ①ㆍ② (생 제3조(대체공휴일) ①ㆍ② (현행\n략) 과 같음)\n<신 설> ③ 제1항에 따라 대체공휴일을\n지정할 때에는 해당 공휴일 최\n소 1개월 전까지 공표하여야\n한다.\n",
  "sections": {
    "제안이유": "및",
    "주요내용": "현행법은 대체공휴일 지정의 법적 근거를 마련하고 있으나, 대체공\n휴일 지정 시기의 구체적 기준이 없어 국민과 기업이 미리 계획을 수\n립할 수 없다는 지적이 지속되고 있음.\n이에 대체공휴일을 해당 공휴일 최소 한 달 전에 공표하도록 하여\n공휴일 운영의 예측 가능성을 확보하려고 함(안 제3조제3항).",
    "제안이유_및_주요내용": "현행법은 대체공휴일 지정의 법적 근거를 마련하고 있으나, 대체공\n휴일 지정 시기의 구체적 기준이 없어 국민과 기업이 미리 계획을 수\n립할 수 없다는 지적이 지속되고 있음.\n이에 대체공휴일을 해당 공휴일 최소 한 달 전에 공표하도록 하여\n공휴일 운영의 예측 가능성을 확보하려고 함(안 제3조제3항).",
    "법률_제_호": "공휴일에 관한 법률 일부개정법률안\n공휴일에 관한 법률 일부를 다음과 같이 개정한다.\n제3조에 제3항을 다음과 같이 신설한다.\n③ 제1항에 따라 대체공휴일을 지정할 때에는 해당 공휴일 최소 1\n개월 전까지 공표하여야 한다.",
    "신구조문대비표": "현 행 개 정 안\n제3조(대체공휴일) ①ㆍ② (생 제3조(대체공휴일) ①ㆍ② (현행\n략) 과 같음)\n<신 설> ③ 제1항에 따라 대체공휴일을\n지정할 때에는 해당 공휴일 최\n소 1개월 전까지 공표하여야\n한다."
  }
}