{
  "title": "2207593_항공안전법_일부개정법률안",
  "bill_number": "7593",
  "proposal_date": "2025. 1. 16.",
  "submission_date": "",
  "is_alternative": false,
  "alternative_bill_numbers": [],
  "has_comparison_table": false,
  "comparison_table": "신ㆍ구조문대비표\n현 행 개 정 안\n<신 설> 제52조의2(보조동력장치의 의무\n설치 등) 항공기를 운항하려는\n자 또는 소유자등은 보조동력\n장치를 의무적으로 설치하여야\n한다. 설치가 불가한 경우 해당\n항공기의 탑승객에게 그 사실\n을 알려야 한다.",
  "full_text": "항공안전법 일부개정법률안\n(전용기의원 대표발의)\n발의연월일 : 2025. 1. 16.\n의 안\n7593\n번 호 발 의 자 : 전용기ㆍ박지혜ㆍ서영석\n박지원ㆍ고민정ㆍ정일영\n이수진ㆍ조계원ㆍ박용갑\n이재강ㆍ박희승 의원\n(11인)\n제안이유 및 주요내용\n2024년 12월에 발생한 제주항공참사 여객기에는 충돌 전 4분간 비\n행자료기록이 저장되어 있지 않음. 항공기의 엔진이 모두 꺼지더라도\n보조동력장치를 켜면 비행자료기록장치(FDR)가 작동되는데, 해당 항\n공기에는 보조동력장치가 설치되어 있지 않았음.\n관련 규정에 따르면, 2018년 이후 최초 개별감항증명을 받은 항공기\n는 모두 보조동력장치를 처음부터 설치하고 있지만, 그 이전의 항공기\n에는 의무적으로 설치가 되어 있지 않음.\n이에 따라 모든 항공기에는 보조동력장치를 의무적으로 설치하도록\n하되, 만약 설치가 불가한 경우에는 그 사실을 해당 여객기의 탑승객\n에게 알리도록 규정하고자 함(안 제52조의2 신설).\n\n\n\n\n법률 제 호\n항공안전법 일부개정법률안\n항공안전법 일부를 다음과 같이 개정한다.\n제52조의2를 다음과 같이 신설한다.\n제52조의2(보조동력장치의 의무 설치 등) 항공기를 운항하려는 자 또\n는 소유자등은 보조동력장치를 의무적으로 설치하여야 한다. 설치가\n불가한 경우 해당 항공기의 탑승객에게 그 사실을 알려야 한다.\n부 칙\n이 법은 공포 후 3개월이 지난 날부터 시행한다.\n\n\n\n\n신ㆍ구조문대비표\n현 행 개 정 안\n<신 설> 제52조의2(보조동력장치의 의무\n설치 등) 항공기를 운항하려는\n자 또는 소유자등은 보조동력\n장치를 의무적으로 설치하여야\n한다. 설치가 불가한 경우 해당\n항공기의 탑승객에게 그 사실\n을 알려야 한다.\n",
  "sections": {
    "제안이유": "및",
    "주요내용": "2024년 12월에 발생한 제주항공참사 여객기에는 충돌 전 4분간 비\n행자료기록이 저장되어 있지 않음. 항공기의 엔진이 모두 꺼지더라도\n보조동력장치를 켜면 비행자료기록장치(FDR)가 작동되는데, 해당 항\n공기에는 보조동력장치가 설치되어 있지 않았음.\n관련 규정에 따르면, 2018년 이후 최초 개별감항증명을 받은 항공기\n는 모두 보조동력장치를 처음부터 설치하고 있지만, 그 이전의 항공기\n에는 의무적으로 설치가 되어 있지 않음.\n이에 따라 모든 항공기에는 보조동력장치를 의무적으로 설치하도록\n하되, 만약 설치가 불가한 경우에는 그 사실을 해당 여객기의 탑승객\n에게 알리도록 규정하고자 함(안 제52조의2 신설).",
    "제안이유_및_주요내용": "2024년 12월에 발생한 제주항공참사 여객기에는 충돌 전 4분간 비\n행자료기록이 저장되어 있지 않음. 항공기의 엔진이 모두 꺼지더라도\n보조동력장치를 켜면 비행자료기록장치(FDR)가 작동되는데, 해당 항\n공기에는 보조동력장치가 설치되어 있지 않았음.\n관련 규정에 따르면, 2018년 이후 최초 개별감항증명을 받은 항공기\n는 모두 보조동력장치를 처음부터 설치하고 있지만, 그 이전의 항공기\n에는 의무적으로 설치가 되어 있지 않음.\n이에 따라 모든 항공기에는 보조동력장치를 의무적으로 설치하도록\n하되, 만약 설치가 불가한 경우에는 그 사실을 해당 여객기의 탑승객\n에게 알리도록 규정하고자 함(안 제52조의2 신설).",
    "법률_제_호": "항공안전법 일부개정법률안\n항공안전법 일부를 다음과 같이 개정한다.\n제52조의2를 다음과 같이 신설한다.\n제52조의2(보조동력장치의 의무 설치 등) 항공기를 운항하려는 자 또\n는 소유자등은 보조동력장치를 의무적으로 설치하여야 한다. 설치가\n불가한 경우 해당 항공기의 탑승객에게 그 사실을 알려야 한다.",
    "신구조문대비표": "현 행 개 정 안\n<신 설> 제52조의2(보조동력장치의 의무\n설치 등) 항공기를 운항하려는\n자 또는 소유자등은 보조동력\n장치를 의무적으로 설치하여야\n한다. 설치가 불가한 경우 해당\n항공기의 탑승객에게 그 사실\n을 알려야 한다."
  }
}