{
  "title": "2207638_군형법_일부개정법률안",
  "bill_number": "7638",
  "proposal_date": "2025. 1. 20.",
  "submission_date": "",
  "is_alternative": false,
  "alternative_bill_numbers": [],
  "has_comparison_table": false,
  "comparison_table": "신ㆍ구조문대비표\n현 행 개 정 안\n<신 설> 제10조의2(가석방의 제한) 이 장\n의 죄를 범한 사람에 대하여는\n「형법」 제72조에 따른 가석\n방을 하지 아니한다.",
  "full_text": "군형법 일부개정법률안\n(김승원의원 대표발의)\n발의연월일 : 2025. 1. 20.\n의 안\n7638\n번 호 발 의 자 : 김승원ㆍ박선원ㆍ박정현\n김문수ㆍ이광희ㆍ박해철\n임호선ㆍ한준호ㆍ서미화\n이재강ㆍ서영교 의원\n(11인)\n제안이유 및 주요내용\n최근 국가의 존립과 국민의 안전을 위협하는 중대범죄를 저지른 사\n람의 경우에는 가석방을 허용하지 말아야 한다는 사회적 목소리가 높\n음.\n이에 「형법」에서 내란 및 외환의 죄를 범한 사람에 대하여는 가\n석방을 할 수 없도록 제한함과 동시에 현행법에서 반란의 죄를 범한\n사람에 대해 가석방을 할 수 없도록 제한함으로써 국가의 안전을 보\n장하고 사법정의를 바로세우려는 것임(안 제10조의2 신설).\n참고사항\n이 법률안은 김승원의원이 대표발의한 「형법 일부개정법률안」(의\n안번호 제7636호)의 의결을 전제로 하므로, 해당 법률안이 의결되지\n\n\n\n아니하거나 수정의결되는 경우에는 이에 맞추어 조정되어야 할 것임.\n\n법률 제 호\n군형법 일부개정법률안\n군형법 일부를 다음과 같이 개정한다.\n제2편제1장에 제10조의2를 다음과 같이 신설한다.\n제10조의2(가석방의 제한) 이 장의 죄를 범한 사람에 대하여는 「형\n법」 제72조에 따른 가석방을 하지 아니한다.\n부 칙\n제1조(시행일) 이 법은 공포 후 6개월이 경과한 날부터 시행한다.\n제2조(가석방의 제한에 관한 적용례) 제10조의2의 개정규정은 이 법\n시행 당시 수용 중인 사람에 대하여도 적용한다.\n\n\n\n\n신ㆍ구조문대비표\n현 행 개 정 안\n<신 설> 제10조의2(가석방의 제한) 이 장\n의 죄를 범한 사람에 대하여는\n「형법」 제72조에 따른 가석\n방을 하지 아니한다.\n",
  "sections": {
    "제안이유": "및",
    "주요내용": "최근 국가의 존립과 국민의 안전을 위협하는 중대범죄를 저지른 사\n람의 경우에는 가석방을 허용하지 말아야 한다는 사회적 목소리가 높\n음.\n이에 「형법」에서 내란 및 외환의 죄를 범한 사람에 대하여는 가\n석방을 할 수 없도록 제한함과 동시에 현행법에서 반란의 죄를 범한\n사람에 대해 가석방을 할 수 없도록 제한함으로써 국가의 안전을 보\n장하고 사법정의를 바로세우려는 것임(안 제10조의2 신설).",
    "제안이유_및_주요내용": "최근 국가의 존립과 국민의 안전을 위협하는 중대범죄를 저지른 사\n람의 경우에는 가석방을 허용하지 말아야 한다는 사회적 목소리가 높\n음.\n이에 「형법」에서 내란 및 외환의 죄를 범한 사람에 대하여는 가\n석방을 할 수 없도록 제한함과 동시에 현행법에서 반란의 죄를 범한\n사람에 대해 가석방을 할 수 없도록 제한함으로써 국가의 안전을 보\n장하고 사법정의를 바로세우려는 것임(안 제10조의2 신설).",
    "법률_제_호": "군형법 일부개정법률안\n군형법 일부를 다음과 같이 개정한다.\n제2편제1장에 제10조의2를 다음과 같이 신설한다.\n제10조의2(가석방의 제한) 이 장의 죄를 범한 사람에 대하여는 「형\n법」 제72조에 따른 가석방을 하지 아니한다.",
    "신구조문대비표": "현 행 개 정 안\n<신 설> 제10조의2(가석방의 제한) 이 장\n의 죄를 범한 사람에 대하여는\n「형법」 제72조에 따른 가석\n방을 하지 아니한다."
  }
}