{
  "title": "2207876_근로기준법_일부개정법률안",
  "bill_number": "7876",
  "proposal_date": "2025. 2. 3.",
  "submission_date": "",
  "is_alternative": false,
  "alternative_bill_numbers": [],
  "has_comparison_table": false,
  "comparison_table": "신ㆍ구조문대비표\n현 행 개 정 안\n제2조(정의) ①ㆍ② (생 략) 제2조(정의) ①ㆍ② (현행과 같\n음)\n<신 설> ③ 근로자의 통상임금이 「최\n저임금법」 제5조에 따른 최저\n임금액보다 적으면 최저임금액\n을 그 근로자의 통상임금으로\n한다. 다만, 「최저임금법」 제\n7조에 따라 최저임금의 적용이\n제외되는 근로자의 경우에는\n그러하지 아니하다.",
  "full_text": "근로기준법 일부개정법률안\n(이용우의원 대표발의)\n발의연월일 : 2025. 2. 3.\n의 안\n7876\n번 호 발 의 자 : 이용우ㆍ박해철ㆍ정혜경\n김문수ㆍ박지원ㆍ이수진\n김태선ㆍ김 윤ㆍ장종태\n이광희ㆍ이강일ㆍ이학영\n한창민ㆍ백승아ㆍ정진욱\n의원(15인)\n제안이유 및 주요내용\n2018년 최저임금법을 개정하여 상여금과 복리후생비를 최저임금에\n산입하도록 하였으나, 이후 사용자들이 통상임금에 산입되지 않는 방\n식으로 상여금이나 실비성 복리후생비를 증가시켜 통상임금이 최저임\n금에 하회하는 경우가 발생하고 있음. 통상임금은 연장 및 야간임금\n지급의 기준이 되는 임금으로, 통상임금이 최저임금을 하회할 경우 사\n용자에게는 상대적으로 비용이 적게 드는 연장 및 야간근로를 장시간\n활용하려는 유인이 있게 됨. 근로기준법은 연장 및 야간근로에 대한\n할증을 통하여 그 사용을 촉진하려는 것이 아니라 자제하려는 데에\n취지가 있는 만큼, 최저임금을 하회하는 통상임금은 근로조건을 보호\n하려는 법의 기본적 취지에 위배됨. 이에 통상임금이 최저임금을 하회\n할 경우, 최저임금을 통상임금으로 하려는 것임(안 제2조제3항 신설).\n\n\n\n\n법률 제 호\n근로기준법 일부개정법률안\n근로기준법 일부를 다음과 같이 개정한다.\n제2조에 제3항을 다음과 같이 신설한다.\n③ 근로자의 통상임금이 「최저임금법」 제5조에 따른 최저임금액\n보다 적으면 최저임금액을 그 근로자의 통상임금으로 한다. 다만,\n「최저임금법」 제7조에 따라 최저임금의 적용이 제외되는 근로자\n의 경우에는 그러하지 아니하다.\n부 칙\n이 법은 공포한 날부터 시행한다.\n\n\n\n\n신ㆍ구조문대비표\n현 행 개 정 안\n제2조(정의) ①ㆍ② (생 략) 제2조(정의) ①ㆍ② (현행과 같\n음)\n<신 설> ③ 근로자의 통상임금이 「최\n저임금법」 제5조에 따른 최저\n임금액보다 적으면 최저임금액\n을 그 근로자의 통상임금으로\n한다. 다만, 「최저임금법」 제\n7조에 따라 최저임금의 적용이\n제외되는 근로자의 경우에는\n그러하지 아니하다.\n",
  "sections": {
    "제안이유": "및",
    "주요내용": "2018년 최저임금법을 개정하여 상여금과 복리후생비를 최저임금에\n산입하도록 하였으나, 이후 사용자들이 통상임금에 산입되지 않는 방\n식으로 상여금이나 실비성 복리후생비를 증가시켜 통상임금이 최저임\n금에 하회하는 경우가 발생하고 있음. 통상임금은 연장 및 야간임금\n지급의 기준이 되는 임금으로, 통상임금이 최저임금을 하회할 경우 사\n용자에게는 상대적으로 비용이 적게 드는 연장 및 야간근로를 장시간\n활용하려는 유인이 있게 됨. 근로기준법은 연장 및 야간근로에 대한\n할증을 통하여 그 사용을 촉진하려는 것이 아니라 자제하려는 데에\n취지가 있는 만큼, 최저임금을 하회하는 통상임금은 근로조건을 보호\n하려는 법의 기본적 취지에 위배됨. 이에 통상임금이 최저임금을 하회\n할 경우, 최저임금을 통상임금으로 하려는 것임(안 제2조제3항 신설).",
    "제안이유_및_주요내용": "2018년 최저임금법을 개정하여 상여금과 복리후생비를 최저임금에\n산입하도록 하였으나, 이후 사용자들이 통상임금에 산입되지 않는 방\n식으로 상여금이나 실비성 복리후생비를 증가시켜 통상임금이 최저임\n금에 하회하는 경우가 발생하고 있음. 통상임금은 연장 및 야간임금\n지급의 기준이 되는 임금으로, 통상임금이 최저임금을 하회할 경우 사\n용자에게는 상대적으로 비용이 적게 드는 연장 및 야간근로를 장시간\n활용하려는 유인이 있게 됨. 근로기준법은 연장 및 야간근로에 대한\n할증을 통하여 그 사용을 촉진하려는 것이 아니라 자제하려는 데에\n취지가 있는 만큼, 최저임금을 하회하는 통상임금은 근로조건을 보호\n하려는 법의 기본적 취지에 위배됨. 이에 통상임금이 최저임금을 하회\n할 경우, 최저임금을 통상임금으로 하려는 것임(안 제2조제3항 신설).",
    "법률_제_호": "근로기준법 일부개정법률안\n근로기준법 일부를 다음과 같이 개정한다.\n제2조에 제3항을 다음과 같이 신설한다.\n③ 근로자의 통상임금이 「최저임금법」 제5조에 따른 최저임금액\n보다 적으면 최저임금액을 그 근로자의 통상임금으로 한다. 다만,\n「최저임금법」 제7조에 따라 최저임금의 적용이 제외되는 근로자\n의 경우에는 그러하지 아니하다.",
    "신구조문대비표": "현 행 개 정 안\n제2조(정의) ①ㆍ② (생 략) 제2조(정의) ①ㆍ② (현행과 같\n음)\n<신 설> ③ 근로자의 통상임금이 「최\n저임금법」 제5조에 따른 최저\n임금액보다 적으면 최저임금액\n을 그 근로자의 통상임금으로\n한다. 다만, 「최저임금법」 제\n7조에 따라 최저임금의 적용이\n제외되는 근로자의 경우에는\n그러하지 아니하다."
  }
}