{
  "title": "2207047_군인의_지위_및_복무에_관한_기본법_일부개정법률안",
  "bill_number": "7047",
  "proposal_date": "2024. 12. 27.",
  "submission_date": "",
  "is_alternative": false,
  "alternative_bill_numbers": [],
  "has_comparison_table": false,
  "comparison_table": "신ㆍ구조문대비표\n현 행 개 정 안\n제25조(명령 복종의 의무) 군인은 제25조(명령 복종의 의무) ------\n직무를 수행할 때 상관의 직무 ------------------------정당\n상 명령에 복종하여야 한다. 하고, 직무상 명령의 범위에 속\n하는----한하여 복종하여야--.",
  "full_text": "군인의 지위 및 복무에 관한 기본법 일부개정법률안\n(이학영의원 대표발의)\n발의연월일 : 2024. 12. 27.\n의 안\n7047\n번 호 발 의 자 : 이학영ㆍ강득구ㆍ정태호\n이춘석ㆍ안호영ㆍ정준호\n임호선ㆍ김재원ㆍ김교흥\n이정문ㆍ한정애ㆍ이병진\n의원(12인)\n제안이유 및 주요내용\n2024년 12월 3일, 절차와 요건에 부합하지 않은 불법적인 계엄 선포\n와 이를 핑계로 한 계엄군의 위헌적 지시로 인해 수많은 군인이 국회\n와 중앙선거관리위원회에 난입해 장악을 시도하고, 선량한 시민을 위\n협하는 사태가 발생했음. 이는 누구도 납득할 수 없는 명백히 부당한\n지시였음에도 「군형법」 및 「군인의 지위 및 복무에 관한 기본법」\n은 상관의 명령에 복종할 것만을 명시하고 있어 국가를 방위하고 국\n민을 보호해야 하는 국군 강령에 큰 혼란을 야기했음.\n그 결과로 직접적인 ‘항명’에 이를 수 없었던 수많은 군인이 ‘내란\n죄’에 의한 수사와 무거운 처벌에 직면해 있음. 이에 군인이 직무를\n수행할 때 상관의 명령이라 하더라도 법규에 반하는 사항이거나 일반\n적인 시민의 안전을 위협하는 등 인간의 존엄을 침해하는 행위 등 군\n\n\n\n의 본래 목적에 위배되는 명령일 경우, 또한 직무상 범위에 해당하지\n않는 사적인 업무지시 등의 경우 이를 거부할 수 있도록 법적 근거를\n마련하고자 함(안 제25조).\n\n법률 제 호\n군인의 지위 및 복무에 관한 기본법 일부개정법률안\n군인의 지위 및 복무에 관한 기본법 일부를 다음과 같이 개정한다.\n제25조 중 “직무상”을 “정당하고, 직무상 명령의 범위에 속하는”으로,\n“복종하여야”를 “한하여 복종하여야”로 한다.\n부 칙\n이 법은 공포한 날부터 시행한다.\n\n\n\n\n신ㆍ구조문대비표\n현 행 개 정 안\n제25조(명령 복종의 의무) 군인은 제25조(명령 복종의 의무) ------\n직무를 수행할 때 상관의 직무 ------------------------정당\n상 명령에 복종하여야 한다. 하고, 직무상 명령의 범위에 속\n하는----한하여 복종하여야--.\n",
  "sections": {
    "제안이유": "및",
    "주요내용": "2024년 12월 3일, 절차와 요건에 부합하지 않은 불법적인 계엄 선포\n와 이를 핑계로 한 계엄군의 위헌적 지시로 인해 수많은 군인이 국회\n와 중앙선거관리위원회에 난입해 장악을 시도하고, 선량한 시민을 위\n협하는 사태가 발생했음. 이는 누구도 납득할 수 없는 명백히 부당한\n지시였음에도 「군형법」 및 「군인의 지위 및 복무에 관한 기본법」\n은 상관의 명령에 복종할 것만을 명시하고 있어 국가를 방위하고 국\n민을 보호해야 하는 국군 강령에 큰 혼란을 야기했음.\n그 결과로 직접적인 ‘항명’에 이를 수 없었던 수많은 군인이 ‘내란\n죄’에 의한 수사와 무거운 처벌에 직면해 있음. 이에 군인이 직무를\n수행할 때 상관의 명령이라 하더라도 법규에 반하는 사항이거나 일반\n적인 시민의 안전을 위협하는 등 인간의 존엄을 침해하는 행위 등 군\n\n\n\n의 본래 목적에 위배되는 명령일 경우, 또한 직무상 범위에 해당하지\n않는 사적인 업무지시 등의 경우 이를 거부할 수 있도록 법적 근거를\n마련하고자 함(안 제25조).",
    "제안이유_및_주요내용": "2024년 12월 3일, 절차와 요건에 부합하지 않은 불법적인 계엄 선포\n와 이를 핑계로 한 계엄군의 위헌적 지시로 인해 수많은 군인이 국회\n와 중앙선거관리위원회에 난입해 장악을 시도하고, 선량한 시민을 위\n협하는 사태가 발생했음. 이는 누구도 납득할 수 없는 명백히 부당한\n지시였음에도 「군형법」 및 「군인의 지위 및 복무에 관한 기본법」\n은 상관의 명령에 복종할 것만을 명시하고 있어 국가를 방위하고 국\n민을 보호해야 하는 국군 강령에 큰 혼란을 야기했음.\n그 결과로 직접적인 ‘항명’에 이를 수 없었던 수많은 군인이 ‘내란\n죄’에 의한 수사와 무거운 처벌에 직면해 있음. 이에 군인이 직무를\n수행할 때 상관의 명령이라 하더라도 법규에 반하는 사항이거나 일반\n적인 시민의 안전을 위협하는 등 인간의 존엄을 침해하는 행위 등 군\n\n\n\n의 본래 목적에 위배되는 명령일 경우, 또한 직무상 범위에 해당하지\n않는 사적인 업무지시 등의 경우 이를 거부할 수 있도록 법적 근거를\n마련하고자 함(안 제25조).",
    "법률_제_호": "군인의 지위 및 복무에 관한 기본법 일부개정법률안\n군인의 지위 및 복무에 관한 기본법 일부를 다음과 같이 개정한다.\n제25조 중 “직무상”을 “정당하고, 직무상 명령의 범위에 속하는”으로,\n“복종하여야”를 “한하여 복종하여야”로 한다.",
    "신구조문대비표": "현 행 개 정 안\n제25조(명령 복종의 의무) 군인은 제25조(명령 복종의 의무) ------\n직무를 수행할 때 상관의 직무 ------------------------정당\n상 명령에 복종하여야 한다. 하고, 직무상 명령의 범위에 속\n하는----한하여 복종하여야--."
  }
}