{
  "title": "2207196_헌정질서_파괴범죄의_공소시효_등에_관한_특례법_일부개정법률안",
  "bill_number": "7196",
  "proposal_date": "2025. 1. 2.",
  "submission_date": "",
  "is_alternative": false,
  "alternative_bill_numbers": [],
  "has_comparison_table": false,
  "comparison_table": "신ㆍ구조문대비표\n현 행 개 정 안\n<신 설> 제5조(압수 등에 관한 특례) 제2\n조의 헌정질서 파괴범죄에 대\n하여는 「형사소송법」 제110\n조제1항 또는 제111조제1항에\n도 불구하고 승낙 없이도 압수\n또는 수색을 할 수 있다.",
  "full_text": "헌정질서 파괴범죄의 공소시효 등에 관한 특례법\n일부개정법률안\n(한병도의원 대표발의)\n발의연월일 : 2025. 1. 2.\n의 안\n7196\n번 호 발 의 자 : 한병도ㆍ이개호ㆍ안규백\n이해식ㆍ서미화ㆍ임오경\n윤준병ㆍ한정애ㆍ박수현\n부승찬 의원(10인)\n제안이유 및 주요내용\n헌정질서 파괴범죄는 헌법의 존립을 해치고 헌법의 자유민주적 기\n본질서를 무너뜨리는 중대한 범죄임.\n그런데 헌정질서 파괴범죄와 관련한 수사기관의 압수 및 수색을\n「형사소송법」 제110조제1항과 제111조제1항을 근거로 거부하는 사\n례가 발생하고 있는 것인바, 위 조항들이 적법한 영장 집행을 거부하\n여 정당한 수사를 방해하는 근거로 악용되고 있다는 지적이 있음.\n이에 헌정질서 파괴범죄에 대해서는 「형사소송법」 제110조제1항\n및 제111조제1항에도 불구하고 책임자 등의 승낙 없이도 압수 또는\n수색을 할 수 있도록 하려는 것임(안 제5조 신설).\n\n\n\n\n법률 제 호\n헌정질서 파괴범죄의 공소시효 등에 관한 특례법\n일부개정법률안\n헌정질서 파괴범죄의 공소시효 등에 관한 특례법 일부를 다음과 같이\n개정한다.\n제5조를 다음과 같이 신설한다.\n제5조(압수 등에 관한 특례) 제2조의 헌정질서 파괴범죄에 대하여는\n「형사소송법」 제110조제1항 또는 제111조제1항에도 불구하고 승\n낙 없이도 압수 또는 수색을 할 수 있다.\n부 칙\n이 법은 공포한 날부터 시행한다.\n\n\n\n\n신ㆍ구조문대비표\n현 행 개 정 안\n<신 설> 제5조(압수 등에 관한 특례) 제2\n조의 헌정질서 파괴범죄에 대\n하여는 「형사소송법」 제110\n조제1항 또는 제111조제1항에\n도 불구하고 승낙 없이도 압수\n또는 수색을 할 수 있다.\n",
  "sections": {
    "제안이유": "및",
    "주요내용": "헌정질서 파괴범죄는 헌법의 존립을 해치고 헌법의 자유민주적 기\n본질서를 무너뜨리는 중대한 범죄임.\n그런데 헌정질서 파괴범죄와 관련한 수사기관의 압수 및 수색을\n「형사소송법」 제110조제1항과 제111조제1항을 근거로 거부하는 사\n례가 발생하고 있는 것인바, 위 조항들이 적법한 영장 집행을 거부하\n여 정당한 수사를 방해하는 근거로 악용되고 있다는 지적이 있음.\n이에 헌정질서 파괴범죄에 대해서는 「형사소송법」 제110조제1항\n및 제111조제1항에도 불구하고 책임자 등의 승낙 없이도 압수 또는\n수색을 할 수 있도록 하려는 것임(안 제5조 신설).",
    "제안이유_및_주요내용": "헌정질서 파괴범죄는 헌법의 존립을 해치고 헌법의 자유민주적 기\n본질서를 무너뜨리는 중대한 범죄임.\n그런데 헌정질서 파괴범죄와 관련한 수사기관의 압수 및 수색을\n「형사소송법」 제110조제1항과 제111조제1항을 근거로 거부하는 사\n례가 발생하고 있는 것인바, 위 조항들이 적법한 영장 집행을 거부하\n여 정당한 수사를 방해하는 근거로 악용되고 있다는 지적이 있음.\n이에 헌정질서 파괴범죄에 대해서는 「형사소송법」 제110조제1항\n및 제111조제1항에도 불구하고 책임자 등의 승낙 없이도 압수 또는\n수색을 할 수 있도록 하려는 것임(안 제5조 신설).",
    "법률_제_호": "헌정질서 파괴범죄의 공소시효 등에 관한 특례법\n일부개정법률안\n헌정질서 파괴범죄의 공소시효 등에 관한 특례법 일부를 다음과 같이\n개정한다.\n제5조를 다음과 같이 신설한다.\n제5조(압수 등에 관한 특례) 제2조의 헌정질서 파괴범죄에 대하여는\n「형사소송법」 제110조제1항 또는 제111조제1항에도 불구하고 승\n낙 없이도 압수 또는 수색을 할 수 있다.",
    "신구조문대비표": "현 행 개 정 안\n<신 설> 제5조(압수 등에 관한 특례) 제2\n조의 헌정질서 파괴범죄에 대\n하여는 「형사소송법」 제110\n조제1항 또는 제111조제1항에\n도 불구하고 승낙 없이도 압수\n또는 수색을 할 수 있다."
  }
}