{
  "title": "2207029_헌법재판소법_일부개정법률안",
  "bill_number": "7029",
  "proposal_date": "2024. 12. 27.",
  "submission_date": "",
  "is_alternative": false,
  "alternative_bill_numbers": [],
  "has_comparison_table": false,
  "comparison_table": "신ㆍ구조문대비표\n현 행 개 정 안\n제6조(재판관의 임명) ① (생 제6조(재판관의 임명) ① (현행과\n략) 같음)\n<신 설> ② 제1항 후단의 임명은 국회\n의 선출과 대법원장의 지명이\n결정된 즉시 이루어져야 하며,\n대통령은 그 임명을 거부할 수\n없다.\n② ∼ ⑤ (생 략) ③ ∼ ⑥ (현행 제2항부터 제5\n항까지와 같음)",
  "full_text": "헌법재판소법 일부개정법률안\n(박균택의원 대표발의)\n발의연월일 : 2024. 12. 27.\n의 안\n7029\n번 호 발 의 자 : 박균택ㆍ박 정ㆍ서영교\n김현정ㆍ허 영ㆍ박정현\n김태선ㆍ장경태ㆍ이재정\n맹성규 의원(10인)\n제안이유 및 주요내용\n현행법은 대통령이 헌법재판소 재판관을 임명하되, 9인의 재판관 중\n3인은 국회가 선출하는 사람을, 다른 3인은 대법원장이 지명하는 사람\n을 임명하도록 하고 있음.\n그러나 국회의 선출과 대법원장의 지명이 결정된 이후에도 대통령\n의 임명권 행사가 지체되거나 거부되는 경우, 입법부와 사법부 고유의\n결정권을 침해하는 것은 물론 헌법상의 삼권분립 원칙을 훼손하는 등\n헌정질서에 혼란을 가져올 수 있다는 지적이 있음.\n이에 헌법재판소 재판관에 대한 대통령의 임명권 행사를 국회의 선\n출과 대법원장의 지명이 결정되는 즉시 이뤄지도록 하고, 그에 대한\n거부는 제한함으로써 헌정질서를 더욱 굳건히 하고자 하는 것임(안 제\n6조제2항 신설).\n\n\n\n\n법률 제 호\n헌법재판소법 일부개정법률안\n헌법재판소법 일부를 다음과 같이 개정한다.\n제6조제2항부터 제5항까지를 각각 제3항부터 제6항까지로 하고, 같은\n조에 제2항을 다음과 같이 신설한다.\n② 제1항 후단의 임명은 국회의 선출과 대법원장의 지명이 결정된\n즉시 이루어져야 하며, 대통령은 그 임명을 거부할 수 없다.\n부 칙\n이 법은 공포한 날부터 시행한다.\n\n\n\n\n신ㆍ구조문대비표\n현 행 개 정 안\n제6조(재판관의 임명) ① (생 제6조(재판관의 임명) ① (현행과\n략) 같음)\n<신 설> ② 제1항 후단의 임명은 국회\n의 선출과 대법원장의 지명이\n결정된 즉시 이루어져야 하며,\n대통령은 그 임명을 거부할 수\n없다.\n② ∼ ⑤ (생 략) ③ ∼ ⑥ (현행 제2항부터 제5\n항까지와 같음)\n",
  "sections": {
    "제안이유": "및",
    "주요내용": "현행법은 대통령이 헌법재판소 재판관을 임명하되, 9인의 재판관 중\n3인은 국회가 선출하는 사람을, 다른 3인은 대법원장이 지명하는 사람\n을 임명하도록 하고 있음.\n그러나 국회의 선출과 대법원장의 지명이 결정된 이후에도 대통령\n의 임명권 행사가 지체되거나 거부되는 경우, 입법부와 사법부 고유의\n결정권을 침해하는 것은 물론 헌법상의 삼권분립 원칙을 훼손하는 등\n헌정질서에 혼란을 가져올 수 있다는 지적이 있음.\n이에 헌법재판소 재판관에 대한 대통령의 임명권 행사를 국회의 선\n출과 대법원장의 지명이 결정되는 즉시 이뤄지도록 하고, 그에 대한\n거부는 제한함으로써 헌정질서를 더욱 굳건히 하고자 하는 것임(안 제\n6조제2항 신설).",
    "제안이유_및_주요내용": "현행법은 대통령이 헌법재판소 재판관을 임명하되, 9인의 재판관 중\n3인은 국회가 선출하는 사람을, 다른 3인은 대법원장이 지명하는 사람\n을 임명하도록 하고 있음.\n그러나 국회의 선출과 대법원장의 지명이 결정된 이후에도 대통령\n의 임명권 행사가 지체되거나 거부되는 경우, 입법부와 사법부 고유의\n결정권을 침해하는 것은 물론 헌법상의 삼권분립 원칙을 훼손하는 등\n헌정질서에 혼란을 가져올 수 있다는 지적이 있음.\n이에 헌법재판소 재판관에 대한 대통령의 임명권 행사를 국회의 선\n출과 대법원장의 지명이 결정되는 즉시 이뤄지도록 하고, 그에 대한\n거부는 제한함으로써 헌정질서를 더욱 굳건히 하고자 하는 것임(안 제\n6조제2항 신설).",
    "법률_제_호": "헌법재판소법 일부개정법률안\n헌법재판소법 일부를 다음과 같이 개정한다.\n제6조제2항부터 제5항까지를 각각 제3항부터 제6항까지로 하고, 같은\n조에 제2항을 다음과 같이 신설한다.\n② 제1항 후단의 임명은 국회의 선출과 대법원장의 지명이 결정된\n즉시 이루어져야 하며, 대통령은 그 임명을 거부할 수 없다.",
    "신구조문대비표": "현 행 개 정 안\n제6조(재판관의 임명) ① (생 제6조(재판관의 임명) ① (현행과\n략) 같음)\n<신 설> ② 제1항 후단의 임명은 국회\n의 선출과 대법원장의 지명이\n결정된 즉시 이루어져야 하며,\n대통령은 그 임명을 거부할 수\n없다.\n② ∼ ⑤ (생 략) ③ ∼ ⑥ (현행 제2항부터 제5\n항까지와 같음)"
  }
}