{
  "title": "2208577_노인장기요양보험법_일부개정법률안",
  "bill_number": "8577",
  "proposal_date": "2025. 2. 28.",
  "submission_date": "",
  "is_alternative": false,
  "alternative_bill_numbers": [],
  "has_comparison_table": false,
  "comparison_table": "신ㆍ구조문대비표\n현 행 개 정 안\n제37조의2(과징금의 부과 등) ① 제37조의2(과징금의 부과 등) ①\n∼ ⑤ (생 략) ∼ ⑤ (현행과 같음)\n<신 설> ⑥ 특별자치시장ㆍ특별자치도\n지사ㆍ시장ㆍ군수ㆍ구청장은\n제1항 및 제2항에 따라 과징금\n을 부과하는 경우 대통령령으\n로 정하는 바에 따라 12개월의\n범위에서 분할납부를 하게 할\n수 있다.",
  "full_text": "노인장기요양보험법 일부개정법률안\n(이헌승의원 대표발의)\n발의연월일 : 2025. 2. 28.\n의 안\n8577\n번 호 발 의 자 : 이헌승ㆍ서일준ㆍ조경태\n김정재ㆍ서범수ㆍ윤상현\n이상휘ㆍ김기현ㆍ송석준\n정성국ㆍ박덕흠ㆍ강선영\n성일종 의원(13인)\n제안이유 및 주요내용\n현행법은 장기요양기관의 법률 위반행위 발생 시 지방자치단체의\n장이 업무정지명령을 하도록 하고, 그 업무정지가 수급자에게 심한 불\n편을 줄 우려가 있는 등 특별한 사유가 있다고 인정되는 경우에 한하\n여 업무정지명령을 갈음하여 과징금을 부과할 수 있도록 규정함.\n그러나 현행법에 과징금의 분할납부에 대해서는 규정되어 있지 않\n아, 「행정기본법」 제29조에 따라 분할납부가 가능한지에 대하여 지\n방자치단체에 따라 다르게 적용되는 문제가 있음.\n이에 과징금의 분할납부 근거를 현행법에 명확히 규정함으로써, 현\n장의 혼란을 해소하고 대상 기관의 예측성을 확보하고자 함(안 제37조\n의2제6항 신설).\n\n\n\n\n법률 제 호\n노인장기요양보험법 일부개정법률안\n노인장기요양보험법 일부를 다음과 같이 개정한다.\n제37조의2에 제6항을 다음과 같이 신설한다.\n⑥ 특별자치시장ㆍ특별자치도지사ㆍ시장ㆍ군수ㆍ구청장은 제1항 및\n제2항에 따라 과징금을 부과하는 경우 대통령령으로 정하는 바에\n따라 12개월의 범위에서 분할납부를 하게 할 수 있다.\n부 칙\n이 법은 공포 후 6개월이 경과한 날부터 시행한다.\n\n\n\n\n신ㆍ구조문대비표\n현 행 개 정 안\n제37조의2(과징금의 부과 등) ① 제37조의2(과징금의 부과 등) ①\n∼ ⑤ (생 략) ∼ ⑤ (현행과 같음)\n<신 설> ⑥ 특별자치시장ㆍ특별자치도\n지사ㆍ시장ㆍ군수ㆍ구청장은\n제1항 및 제2항에 따라 과징금\n을 부과하는 경우 대통령령으\n로 정하는 바에 따라 12개월의\n범위에서 분할납부를 하게 할\n수 있다.\n",
  "sections": {
    "제안이유": "및",
    "주요내용": "현행법은 장기요양기관의 법률 위반행위 발생 시 지방자치단체의\n장이 업무정지명령을 하도록 하고, 그 업무정지가 수급자에게 심한 불\n편을 줄 우려가 있는 등 특별한 사유가 있다고 인정되는 경우에 한하\n여 업무정지명령을 갈음하여 과징금을 부과할 수 있도록 규정함.\n그러나 현행법에 과징금의 분할납부에 대해서는 규정되어 있지 않\n아, 「행정기본법」 제29조에 따라 분할납부가 가능한지에 대하여 지\n방자치단체에 따라 다르게 적용되는 문제가 있음.\n이에 과징금의 분할납부 근거를 현행법에 명확히 규정함으로써, 현\n장의 혼란을 해소하고 대상 기관의 예측성을 확보하고자 함(안 제37조\n의2제6항 신설).",
    "제안이유_및_주요내용": "현행법은 장기요양기관의 법률 위반행위 발생 시 지방자치단체의\n장이 업무정지명령을 하도록 하고, 그 업무정지가 수급자에게 심한 불\n편을 줄 우려가 있는 등 특별한 사유가 있다고 인정되는 경우에 한하\n여 업무정지명령을 갈음하여 과징금을 부과할 수 있도록 규정함.\n그러나 현행법에 과징금의 분할납부에 대해서는 규정되어 있지 않\n아, 「행정기본법」 제29조에 따라 분할납부가 가능한지에 대하여 지\n방자치단체에 따라 다르게 적용되는 문제가 있음.\n이에 과징금의 분할납부 근거를 현행법에 명확히 규정함으로써, 현\n장의 혼란을 해소하고 대상 기관의 예측성을 확보하고자 함(안 제37조\n의2제6항 신설).",
    "법률_제_호": "노인장기요양보험법 일부개정법률안\n노인장기요양보험법 일부를 다음과 같이 개정한다.\n제37조의2에 제6항을 다음과 같이 신설한다.\n⑥ 특별자치시장ㆍ특별자치도지사ㆍ시장ㆍ군수ㆍ구청장은 제1항 및\n제2항에 따라 과징금을 부과하는 경우 대통령령으로 정하는 바에\n따라 12개월의 범위에서 분할납부를 하게 할 수 있다.",
    "신구조문대비표": "현 행 개 정 안\n제37조의2(과징금의 부과 등) ① 제37조의2(과징금의 부과 등) ①\n∼ ⑤ (생 략) ∼ ⑤ (현행과 같음)\n<신 설> ⑥ 특별자치시장ㆍ특별자치도\n지사ㆍ시장ㆍ군수ㆍ구청장은\n제1항 및 제2항에 따라 과징금\n을 부과하는 경우 대통령령으\n로 정하는 바에 따라 12개월의\n범위에서 분할납부를 하게 할\n수 있다."
  }
}