{
  "title": "2208175_소방시설_설치_및_관리에_관한_법률_일부개정법률안",
  "bill_number": "8175",
  "proposal_date": "2025. 2. 14.",
  "submission_date": "",
  "is_alternative": false,
  "alternative_bill_numbers": [],
  "has_comparison_table": false,
  "comparison_table": "신ㆍ구조문대비표\n현 행 개 정 안\n제13조(소방시설기준 적용의 특 제13조(소방시설기준 적용의 특\n례) ① ∼ ⑤ (생 략) 례) ① ∼ ⑤ (현행과 같음)\n<신 설> ⑥ 국가와 지방자치단체는 제1\n항 단서에 따라 강화된 기준을\n적용하는 데 필요한 비용의 전\n부 또는 일부를 대통령령으로\n정하는 바에 따라 지원할 수\n있다.",
  "full_text": "소방시설 설치 및 관리에 관한 법률 일부개정법률안\n(김교흥의원 대표발의)\n발의연월일 : 2025. 2. 14.\n의 안\n8175\n번 호 발 의 자 : 김교흥ㆍ유동수ㆍ이훈기\n이학영ㆍ신영대ㆍ강득구\n허종식ㆍ윤준병ㆍ이용우\n허성무 의원(10인)\n제안이유 및 주요내용\n현행법에 따라 특정소방대상물의 관계인은 대통령령으로 정하는 소방\n시설을 화재안전기준에 따라 설치ㆍ관리하여야 하고, 대통령령이나 화\n재안전기준이 변경되어 그 기준이 강화된 경우 소방본부장 등은 기존의\n특정소방대상물의 소방시설에 대하여 변경 전의 기준을 적용하도록 하\n되, 예외적으로 의료시설 등에 설치하는 소방시설 등에는 강화된 기준을\n적용할 수 있도록 하고 있음.\n그러나 대형 안전사고를 예방하기 위해 강화된 소방안전기준이 불경\n기로 어려움을 겪고 있는 의료시설 및 노유자시설에 부담이 되어 강화된\n소방안전기준을 적용하지 못하고 있는 실정임.\n이에 화재안전기준 등이 강화된 기준을 적용하는 경우 의료시설 및 노\n유자시설 등에 해당 비용의 일부를 지원하여 국민의 안전을 확보하고자\n함(안 제13조제6항 신설).\n\n\n\n\n법률 제 호\n소방시설 설치 및 관리에 관한 법률 일부개정법률안\n소방시설 설치 및 관리에 관한 법률 일부를 다음과 같이 개정한다.\n제13조에 제6항을 다음과 같이 신설한다.\n⑥ 국가와 지방자치단체는 제1항 단서에 따라 강화된 기준을 적용하\n는 데 필요한 비용의 전부 또는 일부를 대통령령으로 정하는 바에 따\n라 지원할 수 있다.\n부 칙\n이 법은 공포한 날부터 시행한다.\n\n\n\n\n신ㆍ구조문대비표\n현 행 개 정 안\n제13조(소방시설기준 적용의 특 제13조(소방시설기준 적용의 특\n례) ① ∼ ⑤ (생 략) 례) ① ∼ ⑤ (현행과 같음)\n<신 설> ⑥ 국가와 지방자치단체는 제1\n항 단서에 따라 강화된 기준을\n적용하는 데 필요한 비용의 전\n부 또는 일부를 대통령령으로\n정하는 바에 따라 지원할 수\n있다.\n",
  "sections": {
    "제안이유": "및",
    "주요내용": "현행법에 따라 특정소방대상물의 관계인은 대통령령으로 정하는 소방\n시설을 화재안전기준에 따라 설치ㆍ관리하여야 하고, 대통령령이나 화\n재안전기준이 변경되어 그 기준이 강화된 경우 소방본부장 등은 기존의\n특정소방대상물의 소방시설에 대하여 변경 전의 기준을 적용하도록 하\n되, 예외적으로 의료시설 등에 설치하는 소방시설 등에는 강화된 기준을\n적용할 수 있도록 하고 있음.\n그러나 대형 안전사고를 예방하기 위해 강화된 소방안전기준이 불경\n기로 어려움을 겪고 있는 의료시설 및 노유자시설에 부담이 되어 강화된\n소방안전기준을 적용하지 못하고 있는 실정임.\n이에 화재안전기준 등이 강화된 기준을 적용하는 경우 의료시설 및 노\n유자시설 등에 해당 비용의 일부를 지원하여 국민의 안전을 확보하고자\n함(안 제13조제6항 신설).",
    "제안이유_및_주요내용": "현행법에 따라 특정소방대상물의 관계인은 대통령령으로 정하는 소방\n시설을 화재안전기준에 따라 설치ㆍ관리하여야 하고, 대통령령이나 화\n재안전기준이 변경되어 그 기준이 강화된 경우 소방본부장 등은 기존의\n특정소방대상물의 소방시설에 대하여 변경 전의 기준을 적용하도록 하\n되, 예외적으로 의료시설 등에 설치하는 소방시설 등에는 강화된 기준을\n적용할 수 있도록 하고 있음.\n그러나 대형 안전사고를 예방하기 위해 강화된 소방안전기준이 불경\n기로 어려움을 겪고 있는 의료시설 및 노유자시설에 부담이 되어 강화된\n소방안전기준을 적용하지 못하고 있는 실정임.\n이에 화재안전기준 등이 강화된 기준을 적용하는 경우 의료시설 및 노\n유자시설 등에 해당 비용의 일부를 지원하여 국민의 안전을 확보하고자\n함(안 제13조제6항 신설).",
    "법률_제_호": "소방시설 설치 및 관리에 관한 법률 일부개정법률안\n소방시설 설치 및 관리에 관한 법률 일부를 다음과 같이 개정한다.\n제13조에 제6항을 다음과 같이 신설한다.\n⑥ 국가와 지방자치단체는 제1항 단서에 따라 강화된 기준을 적용하\n는 데 필요한 비용의 전부 또는 일부를 대통령령으로 정하는 바에 따\n라 지원할 수 있다.",
    "신구조문대비표": "현 행 개 정 안\n제13조(소방시설기준 적용의 특 제13조(소방시설기준 적용의 특\n례) ① ∼ ⑤ (생 략) 례) ① ∼ ⑤ (현행과 같음)\n<신 설> ⑥ 국가와 지방자치단체는 제1\n항 단서에 따라 강화된 기준을\n적용하는 데 필요한 비용의 전\n부 또는 일부를 대통령령으로\n정하는 바에 따라 지원할 수\n있다."
  }
}