{
  "title": "2208668_공직선거법_일부개정법률안",
  "bill_number": "8668",
  "proposal_date": "2025. 3. 5.",
  "submission_date": "",
  "is_alternative": false,
  "alternative_bill_numbers": [],
  "has_comparison_table": false,
  "comparison_table": "신ㆍ구조문대비표\n현 행 개 정 안\n<신 설> 제260조의2(각급선거관리위원회\n위원ㆍ직원의 위법한 직무수행\n죄) 각급선거관리위원회의 위\n원ㆍ직원이 이 법에 따른 직무\n를 수행하면서 법률을 위반하\n거나 직권을 남용하여 다른 사\n람에게 해를 끼친 때에는 1년\n이하의 징역 또는 1천만원 이\n하의 벌금에 처한다.",
  "full_text": "공직선거법 일부개정법률안\n(조승환의원 대표발의)\n발의연월일 : 2025. 3. 5.\n의 안\n8668\n번 호 발 의 자 : 조승환ㆍ김승수ㆍ안철수\n이성권ㆍ인요한ㆍ김성원\n김태호ㆍ임이자ㆍ최은석\n나경원 의원(10인)\n제안이유 및 주요내용\n현행법은 각급선거관리위원회의 위원 및 직원은 선거범죄의 혐의가\n있는 경우 관계자에 대하여 증표를 제시하고 소속과 성명을 밝히고\n그 목적과 이유를 설명하는 등 일련의 절차를 거쳐 질문·조사를 하거\n나 자료제출 요구 등을 할 수 있도록 하고 있음.\n그런데 최근 선거관리위원회 직원이 선거범죄 조사 시 준수하여야\n하는 관련 절차를 위반하고 불법적으로 취득한 증거로 수사기관에 관\n계자를 고발하는 사건이 발생하여 논란이 발생하였고, 선거관리위원회\n의 위원·직원의 위법한 선거범죄 조사 및 수사기관 고발 등을 규제할\n필요가 있다는 의견이 제기되고 있음.\n이에, 각급선거관리위원회의 위원 및 직원이 이 법에 따른 직무를\n수행하면서 법률을 위반하거나 직권을 남용하여 다른 사람에게 해를\n끼친 때에는 1년 이하의 징역 또는 1천만원 이하의 벌금에 처하도록\n\n\n\n하려는 것임(안 제260조의2 신설).\n\n법률 제 호\n공직선거법 일부개정법률안\n공직선거법 일부를 다음과 같이 개정한다.\n제260조의2를 다음과 같이 신설한다.\n제260조의2(각급선거관리위원회 위원ㆍ직원의 위법한 직무수행죄) 각\n급선거관리위원회의 위원ㆍ직원이 이 법에 따른 직무를 수행하면서\n법률을 위반하거나 직권을 남용하여 다른 사람에게 해를 끼친 때에\n는 1년 이하의 징역 또는 1천만원 이하의 벌금에 처한다.\n부 칙\n이 법은 공포 후 3개월이 경과한 날부터 시행한다.\n\n\n\n\n신ㆍ구조문대비표\n현 행 개 정 안\n<신 설> 제260조의2(각급선거관리위원회\n위원ㆍ직원의 위법한 직무수행\n죄) 각급선거관리위원회의 위\n원ㆍ직원이 이 법에 따른 직무\n를 수행하면서 법률을 위반하\n거나 직권을 남용하여 다른 사\n람에게 해를 끼친 때에는 1년\n이하의 징역 또는 1천만원 이\n하의 벌금에 처한다.\n",
  "sections": {
    "제안이유": "및",
    "주요내용": "현행법은 각급선거관리위원회의 위원 및 직원은 선거범죄의 혐의가\n있는 경우 관계자에 대하여 증표를 제시하고 소속과 성명을 밝히고\n그 목적과 이유를 설명하는 등 일련의 절차를 거쳐 질문·조사를 하거\n나 자료제출 요구 등을 할 수 있도록 하고 있음.\n그런데 최근 선거관리위원회 직원이 선거범죄 조사 시 준수하여야\n하는 관련 절차를 위반하고 불법적으로 취득한 증거로 수사기관에 관\n계자를 고발하는 사건이 발생하여 논란이 발생하였고, 선거관리위원회\n의 위원·직원의 위법한 선거범죄 조사 및 수사기관 고발 등을 규제할\n필요가 있다는 의견이 제기되고 있음.\n이에, 각급선거관리위원회의 위원 및 직원이 이 법에 따른 직무를\n수행하면서 법률을 위반하거나 직권을 남용하여 다른 사람에게 해를\n끼친 때에는 1년 이하의 징역 또는 1천만원 이하의 벌금에 처하도록\n\n\n\n하려는 것임(안 제260조의2 신설).",
    "제안이유_및_주요내용": "현행법은 각급선거관리위원회의 위원 및 직원은 선거범죄의 혐의가\n있는 경우 관계자에 대하여 증표를 제시하고 소속과 성명을 밝히고\n그 목적과 이유를 설명하는 등 일련의 절차를 거쳐 질문·조사를 하거\n나 자료제출 요구 등을 할 수 있도록 하고 있음.\n그런데 최근 선거관리위원회 직원이 선거범죄 조사 시 준수하여야\n하는 관련 절차를 위반하고 불법적으로 취득한 증거로 수사기관에 관\n계자를 고발하는 사건이 발생하여 논란이 발생하였고, 선거관리위원회\n의 위원·직원의 위법한 선거범죄 조사 및 수사기관 고발 등을 규제할\n필요가 있다는 의견이 제기되고 있음.\n이에, 각급선거관리위원회의 위원 및 직원이 이 법에 따른 직무를\n수행하면서 법률을 위반하거나 직권을 남용하여 다른 사람에게 해를\n끼친 때에는 1년 이하의 징역 또는 1천만원 이하의 벌금에 처하도록\n\n\n\n하려는 것임(안 제260조의2 신설).",
    "법률_제_호": "공직선거법 일부개정법률안\n공직선거법 일부를 다음과 같이 개정한다.\n제260조의2를 다음과 같이 신설한다.\n제260조의2(각급선거관리위원회 위원ㆍ직원의 위법한 직무수행죄) 각\n급선거관리위원회의 위원ㆍ직원이 이 법에 따른 직무를 수행하면서\n법률을 위반하거나 직권을 남용하여 다른 사람에게 해를 끼친 때에\n는 1년 이하의 징역 또는 1천만원 이하의 벌금에 처한다.",
    "신구조문대비표": "현 행 개 정 안\n<신 설> 제260조의2(각급선거관리위원회\n위원ㆍ직원의 위법한 직무수행\n죄) 각급선거관리위원회의 위\n원ㆍ직원이 이 법에 따른 직무\n를 수행하면서 법률을 위반하\n거나 직권을 남용하여 다른 사\n람에게 해를 끼친 때에는 1년\n이하의 징역 또는 1천만원 이\n하의 벌금에 처한다."
  }
}