{
  "title": "2208623_도시형캠퍼스_설립·운영에_관한_특별법_일부개정법률안",
  "bill_number": "8623",
  "proposal_date": "2025. 3. 4.",
  "submission_date": "",
  "is_alternative": false,
  "alternative_bill_numbers": [],
  "has_comparison_table": false,
  "comparison_table": "신ㆍ구조문대비표\n현 행 개 정 안\n법률 제20665호 도시형캠퍼스 설 법률 제20665호 도시형캠퍼스 설\n립ㆍ운영에 관한 특별법 립ㆍ운영에 관한 특별법\n<신 설> 제4장 보칙\n<신 설> 제13조(국가의 재정적인 지원) 국\n가와 지방자치단체는 도시형캠\n퍼스의 원활한 설립ㆍ운영을\n위하여 필요한 경우 재정적 지\n원을 할 수 있다.",
  "full_text": "도시형캠퍼스 설립ㆍ운영에 관한 특별법 일부개정법률안\n(이해식의원 대표발의)\n발의연월일 : 2025. 3. 4.\n의 안\n8623\n번 호 발 의 자 : 이해식ㆍ박용갑ㆍ박상혁\n박정현ㆍ신정훈ㆍ김영호\n황명선ㆍ윤준병ㆍ서영석\n민병덕ㆍ서영교ㆍ염태영\n의원(12인)\n제안이유 및 주요내용\n최근 저출산으로 인해 전체적인 학령인구는 감소하고 있으나, 특정\n지역은 오히려 학생 수가 증가해 학교 과밀화, 원거리 통학 등으로 학\n생들의 교육여건이 악화되는 문제가 발생하고 있음.\n도시형캠퍼스는 이러한 변화에 맞춰 학교 및 학교 시설 운영의 유\n연화와 다양화를 도모하기 위해 새롭게 도입된 학교 유형이나, 설립\n및 운영에 대한 국가의 재정 지원 근거가 없어 교육청 예산으로 충당\n해야 하는 실정임.\n이에 국가와 지방자치단체는 도시형캠퍼스의 원활한 설립ㆍ운영을\n위하여 필요한 경우 재정적 지원을 할 수 있도록 하는 근거를 마련함\n으로써 학생의 교육환경 개선에 이바지하려는 것임(안 제13조 신설).\n\n\n\n\n법률 제 호\n도시형캠퍼스 설립ㆍ운영에 관한 특별법 일부개정법률안\n법률 제20665호 도시형캠퍼스 설립ㆍ운영에 관한 특별법 일부를 다음\n과 같이 개정한다.\n제4장(제13조)을 다음과 같이 신설한다.\n제4장 보칙\n제13조(국가의 재정적인 지원) 국가와 지방자치단체는 도시형캠퍼스의\n원활한 설립ㆍ운영을 위하여 필요한 경우 재정적 지원을 할 수 있\n다.\n부 칙\n이 법은 2026년 1월 22일부터 시행한다.\n\n\n\n\n신ㆍ구조문대비표\n현 행 개 정 안\n법률 제20665호 도시형캠퍼스 설 법률 제20665호 도시형캠퍼스 설\n립ㆍ운영에 관한 특별법 립ㆍ운영에 관한 특별법\n<신 설> 제4장 보칙\n<신 설> 제13조(국가의 재정적인 지원) 국\n가와 지방자치단체는 도시형캠\n퍼스의 원활한 설립ㆍ운영을\n위하여 필요한 경우 재정적 지\n원을 할 수 있다.\n",
  "sections": {
    "제안이유": "및",
    "주요내용": "최근 저출산으로 인해 전체적인 학령인구는 감소하고 있으나, 특정\n지역은 오히려 학생 수가 증가해 학교 과밀화, 원거리 통학 등으로 학\n생들의 교육여건이 악화되는 문제가 발생하고 있음.\n도시형캠퍼스는 이러한 변화에 맞춰 학교 및 학교 시설 운영의 유\n연화와 다양화를 도모하기 위해 새롭게 도입된 학교 유형이나, 설립\n및 운영에 대한 국가의 재정 지원 근거가 없어 교육청 예산으로 충당\n해야 하는 실정임.\n이에 국가와 지방자치단체는 도시형캠퍼스의 원활한 설립ㆍ운영을\n위하여 필요한 경우 재정적 지원을 할 수 있도록 하는 근거를 마련함\n으로써 학생의 교육환경 개선에 이바지하려는 것임(안 제13조 신설).",
    "제안이유_및_주요내용": "최근 저출산으로 인해 전체적인 학령인구는 감소하고 있으나, 특정\n지역은 오히려 학생 수가 증가해 학교 과밀화, 원거리 통학 등으로 학\n생들의 교육여건이 악화되는 문제가 발생하고 있음.\n도시형캠퍼스는 이러한 변화에 맞춰 학교 및 학교 시설 운영의 유\n연화와 다양화를 도모하기 위해 새롭게 도입된 학교 유형이나, 설립\n및 운영에 대한 국가의 재정 지원 근거가 없어 교육청 예산으로 충당\n해야 하는 실정임.\n이에 국가와 지방자치단체는 도시형캠퍼스의 원활한 설립ㆍ운영을\n위하여 필요한 경우 재정적 지원을 할 수 있도록 하는 근거를 마련함\n으로써 학생의 교육환경 개선에 이바지하려는 것임(안 제13조 신설).",
    "법률_제_호": "도시형캠퍼스 설립ㆍ운영에 관한 특별법 일부개정법률안\n법률 제20665호 도시형캠퍼스 설립ㆍ운영에 관한 특별법 일부를 다음\n과 같이 개정한다.\n제4장(제13조)을 다음과 같이 신설한다.\n제4장 보칙\n제13조(국가의 재정적인 지원) 국가와 지방자치단체는 도시형캠퍼스의\n원활한 설립ㆍ운영을 위하여 필요한 경우 재정적 지원을 할 수 있\n다.",
    "신구조문대비표": "현 행 개 정 안\n법률 제20665호 도시형캠퍼스 설 법률 제20665호 도시형캠퍼스 설\n립ㆍ운영에 관한 특별법 립ㆍ운영에 관한 특별법\n<신 설> 제4장 보칙\n<신 설> 제13조(국가의 재정적인 지원) 국\n가와 지방자치단체는 도시형캠\n퍼스의 원활한 설립ㆍ운영을\n위하여 필요한 경우 재정적 지\n원을 할 수 있다."
  }
}