{
  "title": "2208006_새마을운동조직_육성법_일부개정법률안",
  "bill_number": "8006",
  "proposal_date": "2025. 2. 7.",
  "submission_date": "",
  "is_alternative": false,
  "alternative_bill_numbers": [],
  "has_comparison_table": false,
  "comparison_table": "신ㆍ구조문대비표\n현 행 개 정 안\n<신 설> 제3조의2(수당 등의 지급) 국가나\n지방자치단체는 새마을운동조\n직의 장의 업무 수행을 지원하\n기 위하여 대통령령으로 정하\n는 바에 따라 새마을운동조직\n의 장에게 예산의 범위에서 수\n당, 여비 등 필요한 경비를 지\n급할 수 있다.",
  "full_text": "새마을운동조직 육성법 일부개정법률안\n(이종배의원 대표발의)\n발의연월일 : 2025. 2. 7.\n의 안\n8006\n번 호 발 의 자 : 이종배ㆍ이종욱ㆍ김성원\n서천호ㆍ성일종ㆍ엄태영\n진종오ㆍ송석준ㆍ유용원\n정희용 의원(10인)\n제안이유 및 주요내용\n현행법은 국가나 지방자치단체가 새마을운동조직의 운영에 필요한\n비용에 충당하기 위하여 출연금 및 보조금을 지급할 수 있도록 하고\n있음.\n그런데 새마을운동조직은 생활환경 개선, 취약계층 돌봄, 재난 구호\n활동 등 지역발전을 위해 헌신ㆍ봉사하는 조직으로, 그 장에 대한 수\n당, 여비 등 필요한 경비 지원이 미흡하다는 지적이 있음.\n이에 국가나 지방자치단체는 새마을운동조직의 장의 업무 수행을\n지원하기 위하여 대통령령으로 정하는 바에 따라 새마을운동조직의\n장에게 예산의 범위에서 수당, 여비 등 필요한 경비를 지급할 수 있도\n록 하려는 것임(안 제3조의2 신설).\n\n\n\n\n법률 제 호\n새마을운동조직 육성법 일부개정법률안\n새마을운동조직 육성법 일부를 다음과 같이 개정한다.\n제3조의2를 다음과 같이 신설한다.\n제3조의2(수당 등의 지급) 국가나 지방자치단체는 새마을운동조직의\n장의 업무 수행을 지원하기 위하여 대통령령으로 정하는 바에 따라\n새마을운동조직의 장에게 예산의 범위에서 수당, 여비 등 필요한 경\n비를 지급할 수 있다.\n부 칙\n이 법은 공포 후 3개월이 경과한 날부터 시행한다.\n\n\n\n\n신ㆍ구조문대비표\n현 행 개 정 안\n<신 설> 제3조의2(수당 등의 지급) 국가나\n지방자치단체는 새마을운동조\n직의 장의 업무 수행을 지원하\n기 위하여 대통령령으로 정하\n는 바에 따라 새마을운동조직\n의 장에게 예산의 범위에서 수\n당, 여비 등 필요한 경비를 지\n급할 수 있다.\n",
  "sections": {
    "제안이유": "및",
    "주요내용": "현행법은 국가나 지방자치단체가 새마을운동조직의 운영에 필요한\n비용에 충당하기 위하여 출연금 및 보조금을 지급할 수 있도록 하고\n있음.\n그런데 새마을운동조직은 생활환경 개선, 취약계층 돌봄, 재난 구호\n활동 등 지역발전을 위해 헌신ㆍ봉사하는 조직으로, 그 장에 대한 수\n당, 여비 등 필요한 경비 지원이 미흡하다는 지적이 있음.\n이에 국가나 지방자치단체는 새마을운동조직의 장의 업무 수행을\n지원하기 위하여 대통령령으로 정하는 바에 따라 새마을운동조직의\n장에게 예산의 범위에서 수당, 여비 등 필요한 경비를 지급할 수 있도\n록 하려는 것임(안 제3조의2 신설).",
    "제안이유_및_주요내용": "현행법은 국가나 지방자치단체가 새마을운동조직의 운영에 필요한\n비용에 충당하기 위하여 출연금 및 보조금을 지급할 수 있도록 하고\n있음.\n그런데 새마을운동조직은 생활환경 개선, 취약계층 돌봄, 재난 구호\n활동 등 지역발전을 위해 헌신ㆍ봉사하는 조직으로, 그 장에 대한 수\n당, 여비 등 필요한 경비 지원이 미흡하다는 지적이 있음.\n이에 국가나 지방자치단체는 새마을운동조직의 장의 업무 수행을\n지원하기 위하여 대통령령으로 정하는 바에 따라 새마을운동조직의\n장에게 예산의 범위에서 수당, 여비 등 필요한 경비를 지급할 수 있도\n록 하려는 것임(안 제3조의2 신설).",
    "법률_제_호": "새마을운동조직 육성법 일부개정법률안\n새마을운동조직 육성법 일부를 다음과 같이 개정한다.\n제3조의2를 다음과 같이 신설한다.\n제3조의2(수당 등의 지급) 국가나 지방자치단체는 새마을운동조직의\n장의 업무 수행을 지원하기 위하여 대통령령으로 정하는 바에 따라\n새마을운동조직의 장에게 예산의 범위에서 수당, 여비 등 필요한 경\n비를 지급할 수 있다.",
    "신구조문대비표": "현 행 개 정 안\n<신 설> 제3조의2(수당 등의 지급) 국가나\n지방자치단체는 새마을운동조\n직의 장의 업무 수행을 지원하\n기 위하여 대통령령으로 정하\n는 바에 따라 새마을운동조직\n의 장에게 예산의 범위에서 수\n당, 여비 등 필요한 경비를 지\n급할 수 있다."
  }
}