{
  "title": "2208444_교원의_지위_향상_및_교육활동_보호를_위한_특별법_일부개정법률안",
  "bill_number": "8444",
  "proposal_date": "2025. 2. 26.",
  "submission_date": "",
  "is_alternative": false,
  "alternative_bill_numbers": [],
  "has_comparison_table": false,
  "comparison_table": "신ㆍ구조문대비표\n현 행 개 정 안\n<신 설> 제29조의2(교원의 건강증진 지원\n등) 국가 및 지방자치단체는\n원활한 교육활동을 위하여 교\n원의 신체 및 정신건강 증진을\n지원하기 위한 시책을 마련하\n여야 한다.",
  "full_text": "교원의 지위 향상 및 교육활동 보호를 위한 특별법\n일부개정법률안\n(김예지의원 대표발의)\n발의연월일 : 2025. 2. 26.\n의 안\n8444\n번 호 발 의 자 : 김예지ㆍ김선교ㆍ박덕흠\n최수진ㆍ정성국ㆍ김소희\n조은희ㆍ서천호ㆍ강대식\n윤재옥 의원(10인)\n제안이유 및 주요내용\n현행법은 교원의 교육활동에 대한 보호를 강화하고 이를 통해 교육\n발전을 도모하는 것을 목적으로 하고 있음.\n교원은 업무 특성상 스트레스 등으로 인해 건강이 악화될 가능성이\n높은데, 교원의 신체 및 정신건강은 교육의 질적 제고 및 안정적인 교\n육활동 환경 조성에 큰 영향을 끼칠 수 있어 교원의 전반적인 건강증\n진을 위한 대책 마련이 필요한 시점임.\n이에 국가 및 지방자치단체가 교원의 신체 및 정신건강 증진을 지\n원하기 위해 필요한 시책을 마련하여 원활한 교육활동이 이루어질 수\n있도록 하려는 것임(안 제29조의2 신설).\n\n\n\n\n법률 제 호\n교원의 지위 향상 및 교육활동 보호를 위한 특별법\n일부개정법률안\n교원의 지위 향상 및 교육활동 보호를 위한 특별법 일부를 다음과 같\n이 개정한다.\n제29조의2를 다음과 같이 신설한다.\n제29조의2(교원의 건강증진 지원 등) 국가 및 지방자치단체는 원활한\n교육활동을 위하여 교원의 신체 및 정신건강 증진을 지원하기 위한\n시책을 마련하여야 한다.\n부 칙\n이 법은 공포 후 6개월이 경과한 날부터 시행한다.\n\n\n\n\n신ㆍ구조문대비표\n현 행 개 정 안\n<신 설> 제29조의2(교원의 건강증진 지원\n등) 국가 및 지방자치단체는\n원활한 교육활동을 위하여 교\n원의 신체 및 정신건강 증진을\n지원하기 위한 시책을 마련하\n여야 한다.\n",
  "sections": {
    "제안이유": "및",
    "주요내용": "현행법은 교원의 교육활동에 대한 보호를 강화하고 이를 통해 교육\n발전을 도모하는 것을 목적으로 하고 있음.\n교원은 업무 특성상 스트레스 등으로 인해 건강이 악화될 가능성이\n높은데, 교원의 신체 및 정신건강은 교육의 질적 제고 및 안정적인 교\n육활동 환경 조성에 큰 영향을 끼칠 수 있어 교원의 전반적인 건강증\n진을 위한 대책 마련이 필요한 시점임.\n이에 국가 및 지방자치단체가 교원의 신체 및 정신건강 증진을 지\n원하기 위해 필요한 시책을 마련하여 원활한 교육활동이 이루어질 수\n있도록 하려는 것임(안 제29조의2 신설).",
    "제안이유_및_주요내용": "현행법은 교원의 교육활동에 대한 보호를 강화하고 이를 통해 교육\n발전을 도모하는 것을 목적으로 하고 있음.\n교원은 업무 특성상 스트레스 등으로 인해 건강이 악화될 가능성이\n높은데, 교원의 신체 및 정신건강은 교육의 질적 제고 및 안정적인 교\n육활동 환경 조성에 큰 영향을 끼칠 수 있어 교원의 전반적인 건강증\n진을 위한 대책 마련이 필요한 시점임.\n이에 국가 및 지방자치단체가 교원의 신체 및 정신건강 증진을 지\n원하기 위해 필요한 시책을 마련하여 원활한 교육활동이 이루어질 수\n있도록 하려는 것임(안 제29조의2 신설).",
    "법률_제_호": "교원의 지위 향상 및 교육활동 보호를 위한 특별법\n일부개정법률안\n교원의 지위 향상 및 교육활동 보호를 위한 특별법 일부를 다음과 같\n이 개정한다.\n제29조의2를 다음과 같이 신설한다.\n제29조의2(교원의 건강증진 지원 등) 국가 및 지방자치단체는 원활한\n교육활동을 위하여 교원의 신체 및 정신건강 증진을 지원하기 위한\n시책을 마련하여야 한다.",
    "신구조문대비표": "현 행 개 정 안\n<신 설> 제29조의2(교원의 건강증진 지원\n등) 국가 및 지방자치단체는\n원활한 교육활동을 위하여 교\n원의 신체 및 정신건강 증진을\n지원하기 위한 시책을 마련하\n여야 한다."
  }
}