{
  "title": "2208826_감사원법_일부개정법률안",
  "bill_number": "8826",
  "proposal_date": "2025. 3. 12.",
  "submission_date": "",
  "is_alternative": false,
  "alternative_bill_numbers": [],
  "has_comparison_table": false,
  "comparison_table": "신ㆍ구조문대비표\n현 행 개 정 안\n<신 설> 제7조의2(결격사유) 감사원 소속\n의 공무원으로서 퇴직 후 3년\n이 지나지 아니한 사람은 감사\n위원으로 임명할 수 없다.",
  "full_text": "감사원법 일부개정법률안\n(윤건영의원 대표발의)\n발의연월일 : 2025. 3. 12.\n의 안\n8826\n번 호 발 의 자 : 윤건영ㆍ전현희ㆍ김 윤\n박해철ㆍ정태호ㆍ한준호\n정을호ㆍ이성윤ㆍ한병도\n민병덕 의원(10인)\n제안이유 및 주요내용\n감사위원은 감사원의 최고의사결정기관인 감사위원회의의 위원으로\n서 감사정책 및 주요감사계획, 국가의 세입ㆍ세출 결산의 확인, 회계\n관계직원 등에 대한 변상책임 판정, 공무원의 파면 등 징계 요구에 대\n한 사항 등의 심의ㆍ결정에 참여하고 있음.\n그런데 감사원 사무총장을 포함한 감사원 소속 직원이 아무런 제한\n없이 감사위원으로 임명되는 경우에는 감사원의 독립성 및 정치적 중\n립성을 훼손시킬 우려가 있다는 의견이 있음.\n이에 감사원 소속 공무원의 경우 퇴직 후 3년간 감사위원 임명을\n제한함으로써 감사원의 독립성 및 정치적 중립성을 제고하기 위함(안\n제7조의2 신설).\n\n\n\n\n법률 제 호\n감사원법 일부개정법률안\n감사원법 일부를 다음과 같이 개정한다.\n제7조의2를 다음과 같이 신설한다.\n제7조의2(결격사유) 감사원 소속의 공무원으로서 퇴직 후 3년이 지나\n지 아니한 사람은 감사위원으로 임명할 수 없다.\n부 칙\n제1조(시행일) 이 법은 공포 후 6개월이 경과한 날부터 시행한다.\n제2조(적용례) 제7조의2의 개정규정은 이 법 시행 이후 감사위원을 임\n명하는 경우부터 적용한다.\n\n\n\n\n신ㆍ구조문대비표\n현 행 개 정 안\n<신 설> 제7조의2(결격사유) 감사원 소속\n의 공무원으로서 퇴직 후 3년\n이 지나지 아니한 사람은 감사\n위원으로 임명할 수 없다.\n",
  "sections": {
    "제안이유": "및",
    "주요내용": "감사위원은 감사원의 최고의사결정기관인 감사위원회의의 위원으로\n서 감사정책 및 주요감사계획, 국가의 세입ㆍ세출 결산의 확인, 회계\n관계직원 등에 대한 변상책임 판정, 공무원의 파면 등 징계 요구에 대\n한 사항 등의 심의ㆍ결정에 참여하고 있음.\n그런데 감사원 사무총장을 포함한 감사원 소속 직원이 아무런 제한\n없이 감사위원으로 임명되는 경우에는 감사원의 독립성 및 정치적 중\n립성을 훼손시킬 우려가 있다는 의견이 있음.\n이에 감사원 소속 공무원의 경우 퇴직 후 3년간 감사위원 임명을\n제한함으로써 감사원의 독립성 및 정치적 중립성을 제고하기 위함(안\n제7조의2 신설).",
    "제안이유_및_주요내용": "감사위원은 감사원의 최고의사결정기관인 감사위원회의의 위원으로\n서 감사정책 및 주요감사계획, 국가의 세입ㆍ세출 결산의 확인, 회계\n관계직원 등에 대한 변상책임 판정, 공무원의 파면 등 징계 요구에 대\n한 사항 등의 심의ㆍ결정에 참여하고 있음.\n그런데 감사원 사무총장을 포함한 감사원 소속 직원이 아무런 제한\n없이 감사위원으로 임명되는 경우에는 감사원의 독립성 및 정치적 중\n립성을 훼손시킬 우려가 있다는 의견이 있음.\n이에 감사원 소속 공무원의 경우 퇴직 후 3년간 감사위원 임명을\n제한함으로써 감사원의 독립성 및 정치적 중립성을 제고하기 위함(안\n제7조의2 신설).",
    "법률_제_호": "감사원법 일부개정법률안\n감사원법 일부를 다음과 같이 개정한다.\n제7조의2를 다음과 같이 신설한다.\n제7조의2(결격사유) 감사원 소속의 공무원으로서 퇴직 후 3년이 지나\n지 아니한 사람은 감사위원으로 임명할 수 없다.",
    "신구조문대비표": "현 행 개 정 안\n<신 설> 제7조의2(결격사유) 감사원 소속\n의 공무원으로서 퇴직 후 3년\n이 지나지 아니한 사람은 감사\n위원으로 임명할 수 없다."
  }
}