{
  "title": "2208163_헌법재판소법_일부개정법률안",
  "bill_number": "8163",
  "proposal_date": "2025. 2. 14.",
  "submission_date": "",
  "is_alternative": false,
  "alternative_bill_numbers": [],
  "has_comparison_table": false,
  "comparison_table": "신ㆍ구조문대비표\n현 행 개 정 안\n제7조(재판관의 임기) ①ㆍ② (생 제7조(재판관의 임기) ①ㆍ② (현\n략) 행과 같음)\n<신 설> ③ 제1항 및 제2항에도 불구하\n고 후임자가 임명되지 아니한\n재판관의 경우에는 그 후임자\n가 임명될 때까지 6개월에 한\n하여 직무를 연속적으로 수행\n한다.",
  "full_text": "헌법재판소법 일부개정법률안\n(복기왕의원 대표발의)\n발의연월일 : 2025. 2. 14.\n의 안\n8163\n번 호 발 의 자 : 복기왕ㆍ문진석ㆍ채현일\n김종민ㆍ정준호ㆍ김태선\n염태영ㆍ노종면ㆍ장철민\n임미애 의원(10인)\n제안이유 및 주요내용\n현행법은 헌법재판소 재판관의 임기를 6년으로 하고 있고, 정년은\n70세로 정하고 있고, 대한민국 헌법은 헌법재판소 재판관의 임기는 6\n년으로 하며 법률이 정하는 바에 의하여 연임할 수 있도록 규정하고\n있음.\n하지만 재판관의 임기가 만료될 예정이거나 만료됐음에도 임명이\n연기되거나 보류되는 등 후임자가 임명되지 못하는 경우가 발생함에\n따라, 헌법재판소의 재판관 공백이 발생하고 이에 따라 국민의 권리가\n침해되는 사례가 발생하고 있음.\n이에 재판관이 임기가 만료되거나 정년이 도과된 뒤에도 후임자가\n임명되지 않는 경우 기존 재판관이 임기 6개월에 한하여 직무를 수행\n하도록 함으로써, 헌법재판소의 재판 공백을 방지하려는 것임(안 제7\n조제3항 신설).\n\n\n\n\n법률 제 호\n헌법재판소법 일부개정법률안\n헌법재판소법 일부를 다음과 같이 개정한다.\n제7조에 제3항을 다음과 같이 신설한다.\n③ 제1항 및 제2항에도 불구하고 후임자가 임명되지 아니한 재판관\n의 경우에는 그 후임자가 임명될 때까지 6개월에 한하여 직무를 연\n속적으로 수행한다.\n부 칙\n이 법은 공포한 날부터 시행한다.\n\n\n\n\n신ㆍ구조문대비표\n현 행 개 정 안\n제7조(재판관의 임기) ①ㆍ② (생 제7조(재판관의 임기) ①ㆍ② (현\n략) 행과 같음)\n<신 설> ③ 제1항 및 제2항에도 불구하\n고 후임자가 임명되지 아니한\n재판관의 경우에는 그 후임자\n가 임명될 때까지 6개월에 한\n하여 직무를 연속적으로 수행\n한다.\n",
  "sections": {
    "제안이유": "및",
    "주요내용": "현행법은 헌법재판소 재판관의 임기를 6년으로 하고 있고, 정년은\n70세로 정하고 있고, 대한민국 헌법은 헌법재판소 재판관의 임기는 6\n년으로 하며 법률이 정하는 바에 의하여 연임할 수 있도록 규정하고\n있음.\n하지만 재판관의 임기가 만료될 예정이거나 만료됐음에도 임명이\n연기되거나 보류되는 등 후임자가 임명되지 못하는 경우가 발생함에\n따라, 헌법재판소의 재판관 공백이 발생하고 이에 따라 국민의 권리가\n침해되는 사례가 발생하고 있음.\n이에 재판관이 임기가 만료되거나 정년이 도과된 뒤에도 후임자가\n임명되지 않는 경우 기존 재판관이 임기 6개월에 한하여 직무를 수행\n하도록 함으로써, 헌법재판소의 재판 공백을 방지하려는 것임(안 제7\n조제3항 신설).",
    "제안이유_및_주요내용": "현행법은 헌법재판소 재판관의 임기를 6년으로 하고 있고, 정년은\n70세로 정하고 있고, 대한민국 헌법은 헌법재판소 재판관의 임기는 6\n년으로 하며 법률이 정하는 바에 의하여 연임할 수 있도록 규정하고\n있음.\n하지만 재판관의 임기가 만료될 예정이거나 만료됐음에도 임명이\n연기되거나 보류되는 등 후임자가 임명되지 못하는 경우가 발생함에\n따라, 헌법재판소의 재판관 공백이 발생하고 이에 따라 국민의 권리가\n침해되는 사례가 발생하고 있음.\n이에 재판관이 임기가 만료되거나 정년이 도과된 뒤에도 후임자가\n임명되지 않는 경우 기존 재판관이 임기 6개월에 한하여 직무를 수행\n하도록 함으로써, 헌법재판소의 재판 공백을 방지하려는 것임(안 제7\n조제3항 신설).",
    "법률_제_호": "헌법재판소법 일부개정법률안\n헌법재판소법 일부를 다음과 같이 개정한다.\n제7조에 제3항을 다음과 같이 신설한다.\n③ 제1항 및 제2항에도 불구하고 후임자가 임명되지 아니한 재판관\n의 경우에는 그 후임자가 임명될 때까지 6개월에 한하여 직무를 연\n속적으로 수행한다.",
    "신구조문대비표": "현 행 개 정 안\n제7조(재판관의 임기) ①ㆍ② (생 제7조(재판관의 임기) ①ㆍ② (현\n략) 행과 같음)\n<신 설> ③ 제1항 및 제2항에도 불구하\n고 후임자가 임명되지 아니한\n재판관의 경우에는 그 후임자\n가 임명될 때까지 6개월에 한\n하여 직무를 연속적으로 수행\n한다."
  }
}