{
  "title": "2208358_헌법재판소법_일부개정법률안",
  "bill_number": "8358",
  "proposal_date": "2025. 2. 21.",
  "submission_date": "",
  "is_alternative": false,
  "alternative_bill_numbers": [],
  "has_comparison_table": false,
  "comparison_table": "신ㆍ구조문대비표\n현 행 개 정 안\n제7조(재판관의 임기) ①ㆍ② (생 제7조(재판관의 임기) ①ㆍ② (현\n략) 행과 같음)\n<신 설> ③ 제1항 및 제2항에 따라 임\n기가 만료되거나 정년이 도래\n한 재판관은 그 후임자가 임명\n되지 아니한 경우에도 직무를\n수행하지 아니한다.",
  "full_text": "헌법재판소법 일부개정법률안\n(김승수의원 대표발의)\n발의연월일 : 2025. 2. 21.\n의 안\n8358\n번 호 발 의 자 : 김승수ㆍ김상훈ㆍ엄태영\n김기현ㆍ박성민ㆍ최보윤\n강명구ㆍ이인선ㆍ최수진\n조승환 의원(10인)\n제안이유 및 주요내용\n「대한민국헌법」 제112조제1항은 헌법재판소 “재판관의 임기는 6\n년으로 하며, 법률이 정하는 바에 의하여 연임할 수 있다”고 규정하\n며, 현행법 제7조는 재판관의 임기는 6년으로 하며 연임할 수 있고 정\n년은 70세로 하도록 정하고 있음.\n최근 헌법재판소 재판관에 공석이 발생하는 경우에 대처하기 위하\n여 후임자가 임명되지 아니한 재판관은 임기가 만료되거나 정년이 도\n래한 후에도 직무를 연속적으로 수행하도록 해야 한다는 일부의 의견\n이 논의되고 있음. 그런데 국립국어원의 「표준국어대사전」에 따르면\n“임기(任期)”는 “임무를 맡아보는 일정한 기간”으로, “정년(停年)”은\n“관청이나 학교, 회사 따위에 근무하는 공무원이나 직원이 직장에서\n물러나도록 정하여져 있는 나이”로 정의되고 있으므로, 임기가 만료되\n거나 정년이 도래한 후에는 직무를 수행할 수 없다는 뜻으로 해석함\n\n\n\n이 타당하다는 반대 의견이 있음.\n이에 임기가 만료되거나 정년이 도래한 재판관은 그 후임자가 임명\n되지 아니한 경우에도 직무를 수행하지 아니함을 명기함으로써 현행\n법에 대한 해석을 명확히 하려는 것임(안 제7조제3항 신설).\n\n법률 제 호\n헌법재판소법 일부개정법률안\n헌법재판소법 일부를 다음과 같이 개정한다.\n제7조에 제3항을 다음과 같이 신설한다.\n③ 제1항 및 제2항에 따라 임기가 만료되거나 정년이 도래한 재판\n관은 그 후임자가 임명되지 아니한 경우에도 직무를 수행하지 아니\n한다.\n부 칙\n이 법은 공포한 날부터 시행한다.\n\n\n\n\n신ㆍ구조문대비표\n현 행 개 정 안\n제7조(재판관의 임기) ①ㆍ② (생 제7조(재판관의 임기) ①ㆍ② (현\n략) 행과 같음)\n<신 설> ③ 제1항 및 제2항에 따라 임\n기가 만료되거나 정년이 도래\n한 재판관은 그 후임자가 임명\n되지 아니한 경우에도 직무를\n수행하지 아니한다.\n",
  "sections": {
    "제안이유": "및",
    "주요내용": "「대한민국헌법」 제112조제1항은 헌법재판소 “재판관의 임기는 6\n년으로 하며, 법률이 정하는 바에 의하여 연임할 수 있다”고 규정하\n며, 현행법 제7조는 재판관의 임기는 6년으로 하며 연임할 수 있고 정\n년은 70세로 하도록 정하고 있음.\n최근 헌법재판소 재판관에 공석이 발생하는 경우에 대처하기 위하\n여 후임자가 임명되지 아니한 재판관은 임기가 만료되거나 정년이 도\n래한 후에도 직무를 연속적으로 수행하도록 해야 한다는 일부의 의견\n이 논의되고 있음. 그런데 국립국어원의 「표준국어대사전」에 따르면\n“임기(任期)”는 “임무를 맡아보는 일정한 기간”으로, “정년(停年)”은\n“관청이나 학교, 회사 따위에 근무하는 공무원이나 직원이 직장에서\n물러나도록 정하여져 있는 나이”로 정의되고 있으므로, 임기가 만료되\n거나 정년이 도래한 후에는 직무를 수행할 수 없다는 뜻으로 해석함\n\n\n\n이 타당하다는 반대 의견이 있음.\n이에 임기가 만료되거나 정년이 도래한 재판관은 그 후임자가 임명\n되지 아니한 경우에도 직무를 수행하지 아니함을 명기함으로써 현행\n법에 대한 해석을 명확히 하려는 것임(안 제7조제3항 신설).",
    "제안이유_및_주요내용": "「대한민국헌법」 제112조제1항은 헌법재판소 “재판관의 임기는 6\n년으로 하며, 법률이 정하는 바에 의하여 연임할 수 있다”고 규정하\n며, 현행법 제7조는 재판관의 임기는 6년으로 하며 연임할 수 있고 정\n년은 70세로 하도록 정하고 있음.\n최근 헌법재판소 재판관에 공석이 발생하는 경우에 대처하기 위하\n여 후임자가 임명되지 아니한 재판관은 임기가 만료되거나 정년이 도\n래한 후에도 직무를 연속적으로 수행하도록 해야 한다는 일부의 의견\n이 논의되고 있음. 그런데 국립국어원의 「표준국어대사전」에 따르면\n“임기(任期)”는 “임무를 맡아보는 일정한 기간”으로, “정년(停年)”은\n“관청이나 학교, 회사 따위에 근무하는 공무원이나 직원이 직장에서\n물러나도록 정하여져 있는 나이”로 정의되고 있으므로, 임기가 만료되\n거나 정년이 도래한 후에는 직무를 수행할 수 없다는 뜻으로 해석함\n\n\n\n이 타당하다는 반대 의견이 있음.\n이에 임기가 만료되거나 정년이 도래한 재판관은 그 후임자가 임명\n되지 아니한 경우에도 직무를 수행하지 아니함을 명기함으로써 현행\n법에 대한 해석을 명확히 하려는 것임(안 제7조제3항 신설).",
    "법률_제_호": "헌법재판소법 일부개정법률안\n헌법재판소법 일부를 다음과 같이 개정한다.\n제7조에 제3항을 다음과 같이 신설한다.\n③ 제1항 및 제2항에 따라 임기가 만료되거나 정년이 도래한 재판\n관은 그 후임자가 임명되지 아니한 경우에도 직무를 수행하지 아니\n한다.",
    "신구조문대비표": "현 행 개 정 안\n제7조(재판관의 임기) ①ㆍ② (생 제7조(재판관의 임기) ①ㆍ② (현\n략) 행과 같음)\n<신 설> ③ 제1항 및 제2항에 따라 임\n기가 만료되거나 정년이 도래\n한 재판관은 그 후임자가 임명\n되지 아니한 경우에도 직무를\n수행하지 아니한다."
  }
}