{
  "title": "2208128_예술인의_지위와_권리의_보장에_관한_법률_일부개정법률안",
  "bill_number": "8128",
  "proposal_date": "2025. 2. 13.",
  "submission_date": "",
  "is_alternative": false,
  "alternative_bill_numbers": [],
  "has_comparison_table": false,
  "comparison_table": "신ㆍ구조문대비표\n현 행 개 정 안\n제5조(국가기관등의 책무) ① ∼ 제5조(국가기관등의 책무) ① ∼\n⑥ (생 략) ⑥ (현행과 같음)\n<신 설> ⑦ 국가기관등은 예술인의 자\n유로운 예술 활동에 대하여 정\n당한 사유 없이 간섭ㆍ방해 또\n는 지시하지 아니하여야 한다.",
  "full_text": "예술인의 지위와 권리의 보장에 관한 법률 일부개정법률안\n(조계원의원 대표발의)\n발의연월일 : 2025. 2. 13.\n의 안\n8128\n번 호 발 의 자 : 조계원ㆍ주철현ㆍ문금주\n서삼석ㆍ양부남ㆍ김우영\n박수현ㆍ이기헌ㆍ양문석\n김문수ㆍ김승원ㆍ박지원\n권향엽ㆍ임미애ㆍ임호선\n서미화ㆍ정일영ㆍ박해철\n의원(18인)\n제안이유 및 주요내용\n현행법은 예술 창작과 표현의 자유를 보호하고 예술인의 노동과 복\n지 등 직업적 권리를 신장하며, 예술인의 문화적ㆍ사회적ㆍ경제적ㆍ정\n치적 지위를 보장하고 성평등한 예술환경을 조성하여 예술 발전에 이\n바지하는 것을 규정하고 있음.\n하지만, 최근 청년작가전 폐쇄, 가수 콘서트 대관 취소 등 예술인의\n자유로운 창작 활동이 침해받는 사건이 빈번하게 발생하고 있어 대책\n마련이 필요한 실정임.\n최근 문화기본법에서 ‘국가와 지방자치단체는 문화예술의 진흥을 위\n하여 지원하되, 정당한 사유 없이 그 내용에 대하여 간섭하지 아니하\n여야 한다’고 규정함으로써 현행 법률에서도 예술인이 자유롭게 예술\n\n\n\n활동을 할 수 있는 환경을 조성하려는 것임(안 제5조제7항 신설).\n\n법률 제 호\n예술인의 지위와 권리의 보장에 관한 법률 일부개정법률안\n예술인의 지위와 권리의 보장에 관한 법률 일부를 다음과 같이 개정\n한다.\n제5조에 제7항을 다음과 같이 신설한다.\n⑦ 국가기관등은 예술인의 자유로운 예술 활동에 대하여 정당한 사\n유 없이 간섭ㆍ방해 또는 지시하지 아니하여야 한다.\n부 칙\n이 법은 공포한 날부터 시행한다.\n\n\n\n\n신ㆍ구조문대비표\n현 행 개 정 안\n제5조(국가기관등의 책무) ① ∼ 제5조(국가기관등의 책무) ① ∼\n⑥ (생 략) ⑥ (현행과 같음)\n<신 설> ⑦ 국가기관등은 예술인의 자\n유로운 예술 활동에 대하여 정\n당한 사유 없이 간섭ㆍ방해 또\n는 지시하지 아니하여야 한다.\n",
  "sections": {
    "제안이유": "및",
    "주요내용": "현행법은 예술 창작과 표현의 자유를 보호하고 예술인의 노동과 복\n지 등 직업적 권리를 신장하며, 예술인의 문화적ㆍ사회적ㆍ경제적ㆍ정\n치적 지위를 보장하고 성평등한 예술환경을 조성하여 예술 발전에 이\n바지하는 것을 규정하고 있음.\n하지만, 최근 청년작가전 폐쇄, 가수 콘서트 대관 취소 등 예술인의\n자유로운 창작 활동이 침해받는 사건이 빈번하게 발생하고 있어 대책\n마련이 필요한 실정임.\n최근 문화기본법에서 ‘국가와 지방자치단체는 문화예술의 진흥을 위\n하여 지원하되, 정당한 사유 없이 그 내용에 대하여 간섭하지 아니하\n여야 한다’고 규정함으로써 현행 법률에서도 예술인이 자유롭게 예술\n\n\n\n활동을 할 수 있는 환경을 조성하려는 것임(안 제5조제7항 신설).",
    "제안이유_및_주요내용": "현행법은 예술 창작과 표현의 자유를 보호하고 예술인의 노동과 복\n지 등 직업적 권리를 신장하며, 예술인의 문화적ㆍ사회적ㆍ경제적ㆍ정\n치적 지위를 보장하고 성평등한 예술환경을 조성하여 예술 발전에 이\n바지하는 것을 규정하고 있음.\n하지만, 최근 청년작가전 폐쇄, 가수 콘서트 대관 취소 등 예술인의\n자유로운 창작 활동이 침해받는 사건이 빈번하게 발생하고 있어 대책\n마련이 필요한 실정임.\n최근 문화기본법에서 ‘국가와 지방자치단체는 문화예술의 진흥을 위\n하여 지원하되, 정당한 사유 없이 그 내용에 대하여 간섭하지 아니하\n여야 한다’고 규정함으로써 현행 법률에서도 예술인이 자유롭게 예술\n\n\n\n활동을 할 수 있는 환경을 조성하려는 것임(안 제5조제7항 신설).",
    "법률_제_호": "예술인의 지위와 권리의 보장에 관한 법률 일부개정법률안\n예술인의 지위와 권리의 보장에 관한 법률 일부를 다음과 같이 개정\n한다.\n제5조에 제7항을 다음과 같이 신설한다.\n⑦ 국가기관등은 예술인의 자유로운 예술 활동에 대하여 정당한 사\n유 없이 간섭ㆍ방해 또는 지시하지 아니하여야 한다.",
    "신구조문대비표": "현 행 개 정 안\n제5조(국가기관등의 책무) ① ∼ 제5조(국가기관등의 책무) ① ∼\n⑥ (생 략) ⑥ (현행과 같음)\n<신 설> ⑦ 국가기관등은 예술인의 자\n유로운 예술 활동에 대하여 정\n당한 사유 없이 간섭ㆍ방해 또\n는 지시하지 아니하여야 한다."
  }
}