{
  "title": "2208263_정부조직법_일부개정법률안",
  "bill_number": "8263",
  "proposal_date": "2025. 2. 18.",
  "submission_date": "",
  "is_alternative": false,
  "alternative_bill_numbers": [],
  "has_comparison_table": false,
  "comparison_table": "신ㆍ구조문대비표\n현 행 개 정 안\n제41조(고용노동부) (생 략) 제41조(고용노동부) ① (현행 제\n목 외의 부분과 같음)\n<신 설> ② 고용노동부에 산업안전보건\n정책과 산업재해보상보험 사무\n를 담당하는 본부장 1명을 두\n되, 본부장은 정무직으로 한다.",
  "full_text": "정부조직법 일부개정법률안\n(박홍배의원 대표발의)\n발의연월일 : 2025. 2. 18.\n의 안\n8263\n번 호 발 의 자 : 박홍배ㆍ이용우ㆍ김남근\n이광희ㆍ박지원ㆍ윤준병\n박희승ㆍ민병덕ㆍ고민정\n김태선ㆍ백승아ㆍ송재봉\n박정현ㆍ복기왕ㆍ이재정\n서영교ㆍ박수현 의원\n(17인)\n제안이유 및 주요내용\n2021년 중대재해처벌법이 제정되었지만 대한민국에는 여전히 산업\n재해가 끊이지 않고 현장 노동자들이 죽거나 다치는 상황이 벌어지고\n있음.\n산업안전보건은 근로자의 생명과 건강 보호뿐만 아니라 기업의 생\n산성을 높이고 나아가 대한민국 산업 전반의 경쟁력을 강화하는 중요\n한 정책임. 기존 21대 국회에서도 산업안전보건에 대한 중요성을 인식\n하고, 단순한 관리감독기능이 아닌 산업안전보건에 대한 전문성을 높\n여야 한다는 필요성이 논의되었음.\n산업안전보건과 같이 공공성, 전문성, 독립성, 효율성이 높이 요구되\n는 분야는 부처 내 해당 업무를 전담하는 본부를 신설하고 실질적인\n\n\n\n정책을 수행할 수 있는 인력과 전문성을 확보해야 함. 비슷한 예로 과\n학기술정보통신부는 부처 내 과학기술혁신본부를 신설하고 전문기구\n역할을 하고 있음.\n이에 정부조직법 개정을 통해 고용노동부 내 산업안전보건정책과\n산업재해보상보험에 관한 사무를 전담하는 차관급의 산업안전보건본\n부를 신설하고 이를 담당하는 본부장을 배치하여, 산업재해 예방 및\n관련 업무를 전문화ㆍ고도화하고 산업안전보건정책과 산업재해보상\n업무에 대한 효율성과 체계성을 갖추는 등 대한민국 산업안전보건관\n리 체계를 재조정하고자 함(안 제41조).\n\n법률 제 호\n정부조직법 일부개정법률안\n정부조직법 일부를 다음과 같이 개정한다.\n제41조 제목 외의 부분을 제1항으로 하고, 같은 조에 제2항을 다음과\n같이 신설한다.\n② 고용노동부에 산업안전보건정책과 산업재해보상보험 사무를 담\n당하는 본부장 1명을 두되, 본부장은 정무직으로 한다.\n부 칙\n이 법은 공포한 후 3개월이 경과한 날부터 시행한다.\n\n\n\n\n신ㆍ구조문대비표\n현 행 개 정 안\n제41조(고용노동부) (생 략) 제41조(고용노동부) ① (현행 제\n목 외의 부분과 같음)\n<신 설> ② 고용노동부에 산업안전보건\n정책과 산업재해보상보험 사무\n를 담당하는 본부장 1명을 두\n되, 본부장은 정무직으로 한다.\n",
  "sections": {
    "제안이유": "및",
    "주요내용": "2021년 중대재해처벌법이 제정되었지만 대한민국에는 여전히 산업\n재해가 끊이지 않고 현장 노동자들이 죽거나 다치는 상황이 벌어지고\n있음.\n산업안전보건은 근로자의 생명과 건강 보호뿐만 아니라 기업의 생\n산성을 높이고 나아가 대한민국 산업 전반의 경쟁력을 강화하는 중요\n한 정책임. 기존 21대 국회에서도 산업안전보건에 대한 중요성을 인식\n하고, 단순한 관리감독기능이 아닌 산업안전보건에 대한 전문성을 높\n여야 한다는 필요성이 논의되었음.\n산업안전보건과 같이 공공성, 전문성, 독립성, 효율성이 높이 요구되\n는 분야는 부처 내 해당 업무를 전담하는 본부를 신설하고 실질적인\n\n\n\n정책을 수행할 수 있는 인력과 전문성을 확보해야 함. 비슷한 예로 과\n학기술정보통신부는 부처 내 과학기술혁신본부를 신설하고 전문기구\n역할을 하고 있음.\n이에 정부조직법 개정을 통해 고용노동부 내 산업안전보건정책과\n산업재해보상보험에 관한 사무를 전담하는 차관급의 산업안전보건본\n부를 신설하고 이를 담당하는 본부장을 배치하여, 산업재해 예방 및\n관련 업무를 전문화ㆍ고도화하고 산업안전보건정책과 산업재해보상\n업무에 대한 효율성과 체계성을 갖추는 등 대한민국 산업안전보건관\n리 체계를 재조정하고자 함(안 제41조).",
    "제안이유_및_주요내용": "2021년 중대재해처벌법이 제정되었지만 대한민국에는 여전히 산업\n재해가 끊이지 않고 현장 노동자들이 죽거나 다치는 상황이 벌어지고\n있음.\n산업안전보건은 근로자의 생명과 건강 보호뿐만 아니라 기업의 생\n산성을 높이고 나아가 대한민국 산업 전반의 경쟁력을 강화하는 중요\n한 정책임. 기존 21대 국회에서도 산업안전보건에 대한 중요성을 인식\n하고, 단순한 관리감독기능이 아닌 산업안전보건에 대한 전문성을 높\n여야 한다는 필요성이 논의되었음.\n산업안전보건과 같이 공공성, 전문성, 독립성, 효율성이 높이 요구되\n는 분야는 부처 내 해당 업무를 전담하는 본부를 신설하고 실질적인\n\n\n\n정책을 수행할 수 있는 인력과 전문성을 확보해야 함. 비슷한 예로 과\n학기술정보통신부는 부처 내 과학기술혁신본부를 신설하고 전문기구\n역할을 하고 있음.\n이에 정부조직법 개정을 통해 고용노동부 내 산업안전보건정책과\n산업재해보상보험에 관한 사무를 전담하는 차관급의 산업안전보건본\n부를 신설하고 이를 담당하는 본부장을 배치하여, 산업재해 예방 및\n관련 업무를 전문화ㆍ고도화하고 산업안전보건정책과 산업재해보상\n업무에 대한 효율성과 체계성을 갖추는 등 대한민국 산업안전보건관\n리 체계를 재조정하고자 함(안 제41조).",
    "법률_제_호": "정부조직법 일부개정법률안\n정부조직법 일부를 다음과 같이 개정한다.\n제41조 제목 외의 부분을 제1항으로 하고, 같은 조에 제2항을 다음과\n같이 신설한다.\n② 고용노동부에 산업안전보건정책과 산업재해보상보험 사무를 담\n당하는 본부장 1명을 두되, 본부장은 정무직으로 한다.",
    "신구조문대비표": "현 행 개 정 안\n제41조(고용노동부) (생 략) 제41조(고용노동부) ① (현행 제\n목 외의 부분과 같음)\n<신 설> ② 고용노동부에 산업안전보건\n정책과 산업재해보상보험 사무\n를 담당하는 본부장 1명을 두\n되, 본부장은 정무직으로 한다."
  }
}