{
  "title": "2208896_유아교육지원특별회계법_일부개정법률안",
  "bill_number": "8896",
  "proposal_date": "2025. 3. 13.",
  "submission_date": "",
  "is_alternative": false,
  "alternative_bill_numbers": [],
  "has_comparison_table": false,
  "comparison_table": "신ㆍ구조문대비표\n현 행 개 정 안\n법률 제14395호 유아교육지원특 법률 제14395호 유아교육지원특\n별회계법 ",
  "full_text": "유아교육지원특별회계법 일부개정법률안\n(김선교의원 대표발의)\n발의연월일 : 2025. 3. 13.\n의 안\n8896\n번 호 발 의 자 : 김선교ㆍ김상훈ㆍ서천호\n김예지ㆍ박충권ㆍ박수민\n김위상ㆍ최수진ㆍ구자근\n김승수ㆍ안상훈ㆍ김성원\n의원(12인)\n제안이유 및 주요내용\n유아교육지원특별회계는 유아교육 및 보육을 통합한 공통의 교육ㆍ\n보육과정 정책의 안정적인 추진을 위하여 2017년에 설치된 회계로, 두\n차례의 유효기간 연장을 거쳐 2025년 12월 31일까지 효력을 가지게\n되었음.\n현재 유아교육지원특별회계를 통해 취학 직전 3년의 유아에 대한\n공통 교육ㆍ보육과정(이하 “누리과정”이라 함) 운영에 소요되는 비용\n을 지원하고 있는데, 유효기간이 만료될 경우 누리과정 운영 등 유아\n교육과 보육을 통합하기 위한 정책 수행에 차질이 생길 우려가 있어\n대책을 마련할 필요가 있음.\n이에 유아교육지원특별회계의 유효기한을 2028년 12월 31일까지로\n3년 연장하여 안정적인 누리과정 운영 및 정책 추진을 도모하려는 것\n임(안 법률 제14395호 유아교육지원특별회계법 일부개정법률 부칙 제2\n\n\n\n조).\n\n법률 제 호\n유아교육지원특별회계법 일부개정법률안\n유아교육지원특별회계법 일부를 다음과 같이 개정한다.\n법률 제14395호 유아교육지원특별회계법 부칙(법률 제16675호 유아교\n육지원특별회계법 일부개정법률 및 법률 제19203호 유아교육지원특별\n회계법 일부개정법률에 따라 각각 개정된 내용을 포함한다) 제2조 중\n“2025년”을 “2028년”으로 한다.\n부 칙\n이 법은 공포한 날부터 시행한다.\n\n\n\n\n신ㆍ구조문대비표\n현 행 개 정 안\n법률 제14395호 유아교육지원특 법률 제14395호 유아교육지원특\n별회계법 부칙 별회계법 부칙\n제2조(유효기간) 이 법은 2025년 제2조(유효기간) --------2028년-\n12월 31일까지 효력을 가진다. ---------------------------.\n",
  "sections": {
    "제안이유": "및",
    "주요내용": "유아교육지원특별회계는 유아교육 및 보육을 통합한 공통의 교육ㆍ\n보육과정 정책의 안정적인 추진을 위하여 2017년에 설치된 회계로, 두\n차례의 유효기간 연장을 거쳐 2025년 12월 31일까지 효력을 가지게\n되었음.\n현재 유아교육지원특별회계를 통해 취학 직전 3년의 유아에 대한\n공통 교육ㆍ보육과정(이하 “누리과정”이라 함) 운영에 소요되는 비용\n을 지원하고 있는데, 유효기간이 만료될 경우 누리과정 운영 등 유아\n교육과 보육을 통합하기 위한 정책 수행에 차질이 생길 우려가 있어\n대책을 마련할 필요가 있음.\n이에 유아교육지원특별회계의 유효기한을 2028년 12월 31일까지로\n3년 연장하여 안정적인 누리과정 운영 및 정책 추진을 도모하려는 것\n임(안",
    "제안이유_및_주요내용": "유아교육지원특별회계는 유아교육 및 보육을 통합한 공통의 교육ㆍ\n보육과정 정책의 안정적인 추진을 위하여 2017년에 설치된 회계로, 두\n차례의 유효기간 연장을 거쳐 2025년 12월 31일까지 효력을 가지게\n되었음.\n현재 유아교육지원특별회계를 통해 취학 직전 3년의 유아에 대한\n공통 교육ㆍ보육과정(이하 “누리과정”이라 함) 운영에 소요되는 비용\n을 지원하고 있는데, 유효기간이 만료될 경우 누리과정 운영 등 유아\n교육과 보육을 통합하기 위한 정책 수행에 차질이 생길 우려가 있어\n대책을 마련할 필요가 있음.\n이에 유아교육지원특별회계의 유효기한을 2028년 12월 31일까지로\n3년 연장하여 안정적인 누리과정 운영 및 정책 추진을 도모하려는 것\n임(안",
    "법률_제_호": "유아교육지원특별회계법 일부개정법률",
    "신구조문대비표": "현 행 개 정 안\n법률 제14395호 유아교육지원특 법률 제14395호 유아교육지원특\n별회계법"
  }
}