{
  "title": "2208464_도로법_일부개정법률안",
  "bill_number": "8464",
  "proposal_date": "2025. 2. 26.",
  "submission_date": "",
  "is_alternative": false,
  "alternative_bill_numbers": [],
  "has_comparison_table": false,
  "comparison_table": "신ㆍ구조문대비표\n현 행 개 정 안\n제77조(차량의 운행 제한 및 운 제77조(차량의 운행 제한 및 운\n행 허가) ① ∼ ⑦ (생 략) 행 허가) ① ∼ ⑦ (현행과 같\n음)\n<신 설> ⑧ 운행제한단속원의 보수는\n재직기간과 유사한 업무에 종\n사하는 공무원의 보수를 고려\n하여 대통령령으로 정한다.\n⑧ (생 략) ⑨ (현행 제8항과 같음)",
  "full_text": "도로법 일부개정법률안\n(문진석의원 대표발의)\n발의연월일 : 2025. 2. 26.\n의 안\n8464\n번 호 발 의 자 : 문진석ㆍ박정현ㆍ윤종군\n복기왕ㆍ이정문ㆍ이재관\n윤호중ㆍ장종태ㆍ박성준\n김문수 의원(10인)\n제안이유 및 주요내용\n현행법에 따라 도로관리청은 도로에서의 차량 운행으로 인한 위험\n을 방지하기 위하여 차량의 운행을 제한할 수 있고, 차량 운행제한에\n대한 준수여부를 확인하기 위하여 관계 공무원 또는 운행제한단속원\n으로 하여금 차량에 승차하는 방법 등으로 차량의 적재량을 측정할\n수 있도록 하고 있음.\n그런데 국토교통부 소속의 지방국토관리청, 지방자치단체 등 여러\n도로관리청에 소속된 운행제한단속원의 경우 “운행제한 단속”이라는\n동일한 업무를 수행하고 있으나, 이들이 소속된 기관별로 보수수준이\n큰 편차를 보이고 있으며, 유사한 업무를 수행하는 공무원 보수 수준\n과도 큰 차이를 보이고 있어 이들에 대한 차별적 처우 상황을 개선할\n필요가 있다는 지적이 있음.\n이에 운행제한단속원의 보수를 재직기간과 유사한 업무를 수행하는\n\n\n\n공무원의 보수를 고려하여 대통령령으로 정하도록 함으로써 동일한\n업무를 수행하는 공공부문 근로자의 차별적 대우를 개선하고 이들의\n사기를 진작하려는 것임(안 제77조제8항 신설).\n\n법률 제 호\n도로법 일부개정법률안\n도로법 일부를 다음과 같이 개정한다.\n제77조제8항을 제9항으로 하고, 같은 조에 제8항을 다음과 같이 신설\n한다.\n⑧ 운행제한단속원의 보수는 재직기간과 유사한 업무에 종사하는\n공무원의 보수를 고려하여 대통령령으로 정한다.\n부 칙\n이 법은 공포 후 6개월이 경과한 날부터 시행한다.\n\n\n\n\n신ㆍ구조문대비표\n현 행 개 정 안\n제77조(차량의 운행 제한 및 운 제77조(차량의 운행 제한 및 운\n행 허가) ① ∼ ⑦ (생 략) 행 허가) ① ∼ ⑦ (현행과 같\n음)\n<신 설> ⑧ 운행제한단속원의 보수는\n재직기간과 유사한 업무에 종\n사하는 공무원의 보수를 고려\n하여 대통령령으로 정한다.\n⑧ (생 략) ⑨ (현행 제8항과 같음)\n",
  "sections": {
    "제안이유": "및",
    "주요내용": "현행법에 따라 도로관리청은 도로에서의 차량 운행으로 인한 위험\n을 방지하기 위하여 차량의 운행을 제한할 수 있고, 차량 운행제한에\n대한 준수여부를 확인하기 위하여 관계 공무원 또는 운행제한단속원\n으로 하여금 차량에 승차하는 방법 등으로 차량의 적재량을 측정할\n수 있도록 하고 있음.\n그런데 국토교통부 소속의 지방국토관리청, 지방자치단체 등 여러\n도로관리청에 소속된 운행제한단속원의 경우 “운행제한 단속”이라는\n동일한 업무를 수행하고 있으나, 이들이 소속된 기관별로 보수수준이\n큰 편차를 보이고 있으며, 유사한 업무를 수행하는 공무원 보수 수준\n과도 큰 차이를 보이고 있어 이들에 대한 차별적 처우 상황을 개선할\n필요가 있다는 지적이 있음.\n이에 운행제한단속원의 보수를 재직기간과 유사한 업무를 수행하는\n\n\n\n공무원의 보수를 고려하여 대통령령으로 정하도록 함으로써 동일한\n업무를 수행하는 공공부문 근로자의 차별적 대우를 개선하고 이들의\n사기를 진작하려는 것임(안 제77조제8항 신설).",
    "제안이유_및_주요내용": "현행법에 따라 도로관리청은 도로에서의 차량 운행으로 인한 위험\n을 방지하기 위하여 차량의 운행을 제한할 수 있고, 차량 운행제한에\n대한 준수여부를 확인하기 위하여 관계 공무원 또는 운행제한단속원\n으로 하여금 차량에 승차하는 방법 등으로 차량의 적재량을 측정할\n수 있도록 하고 있음.\n그런데 국토교통부 소속의 지방국토관리청, 지방자치단체 등 여러\n도로관리청에 소속된 운행제한단속원의 경우 “운행제한 단속”이라는\n동일한 업무를 수행하고 있으나, 이들이 소속된 기관별로 보수수준이\n큰 편차를 보이고 있으며, 유사한 업무를 수행하는 공무원 보수 수준\n과도 큰 차이를 보이고 있어 이들에 대한 차별적 처우 상황을 개선할\n필요가 있다는 지적이 있음.\n이에 운행제한단속원의 보수를 재직기간과 유사한 업무를 수행하는\n\n\n\n공무원의 보수를 고려하여 대통령령으로 정하도록 함으로써 동일한\n업무를 수행하는 공공부문 근로자의 차별적 대우를 개선하고 이들의\n사기를 진작하려는 것임(안 제77조제8항 신설).",
    "법률_제_호": "도로법 일부개정법률안\n도로법 일부를 다음과 같이 개정한다.\n제77조제8항을 제9항으로 하고, 같은 조에 제8항을 다음과 같이 신설\n한다.\n⑧ 운행제한단속원의 보수는 재직기간과 유사한 업무에 종사하는\n공무원의 보수를 고려하여 대통령령으로 정한다.",
    "신구조문대비표": "현 행 개 정 안\n제77조(차량의 운행 제한 및 운 제77조(차량의 운행 제한 및 운\n행 허가) ① ∼ ⑦ (생 략) 행 허가) ① ∼ ⑦ (현행과 같\n음)\n<신 설> ⑧ 운행제한단속원의 보수는\n재직기간과 유사한 업무에 종\n사하는 공무원의 보수를 고려\n하여 대통령령으로 정한다.\n⑧ (생 략) ⑨ (현행 제8항과 같음)"
  }
}