{
  "title": "2208768_고등·평생교육지원특별회계법_일부개정법률안",
  "bill_number": "8768",
  "proposal_date": "2025. 3. 10.",
  "submission_date": "",
  "is_alternative": false,
  "alternative_bill_numbers": [],
  "has_comparison_table": false,
  "comparison_table": "신ㆍ구조문대비표\n현 행 개 정 안\n법률 제19202호 고등ㆍ평생교육 법률 제19202호 고등ㆍ평생교육\n지원특별회계법 ",
  "full_text": "고등ㆍ평생교육지원특별회계법 일부개정법률안\n(윤준병의원 대표발의)\n발의연월일 : 2025. 3. 10.\n의 안\n8768\n번 호 발 의 자 : 윤준병ㆍ주철현ㆍ송옥주\n이원택ㆍ조계원ㆍ박민규\n허 영ㆍ정동영ㆍ신영대\n민병덕ㆍ김태선ㆍ김윤덕\n의원(12인)\n제안이유 및 주요내용\n고등ㆍ평생교육지원특별회계는 대학의 미래 인재양성 역량을 강화\n하고, 교육ㆍ연구ㆍ운영 여건 개선 등을 지원하기 위하여 설치된 특별\n회계임.\n2023년 1월 최초로 도입된 이 특별회계는, 교육 분야 간의 투자 불\n균형과 초ㆍ중등교육에 치우친 재정 등을 완화하기 위해 기존 교육\n예산을 전입받는 한편 추가 세입을 도입하여 총규모가 10조원에 달하\n며, 현재까지 대학 등에 지원해 왔으나, 2023년 1월 1일 최초 시행된\n이후 2025년 12월 31일부로 그 효력이 종료될 예정임.\n이에 고등ㆍ평생교육지원특별회계의 유효기한을 연장함으로써 고등\nㆍ평생교육의 역량 강화를 계속하여 지원하려는 것임(안 법률 제19202\n호 고등ㆍ평생교육지원특별회계법 부칙 제2조).\n\n\n\n\n법률 제 호\n고등ㆍ평생교육지원특별회계법 일부개정법률안\n고등ㆍ평생교육지원특별회계법 일부를 다음과 같이 개정한다.\n법률 제19202호 고등ㆍ평생교육지원특별회계법 부칙 제2조 중 “2025\n년”을 “2030년”으로 한다.\n부 칙\n이 법은 공포한 날부터 시행한다.\n\n\n\n\n신ㆍ구조문대비표\n현 행 개 정 안\n법률 제19202호 고등ㆍ평생교육 법률 제19202호 고등ㆍ평생교육\n지원특별회계법 부칙 지원특별회계법 부칙\n제2조(유효기간) 이 법은 2025년 제2조(유효기간) --------2030년-\n12월 31일까지 효력을 가진다. ---------------------------.\n",
  "sections": {
    "제안이유": "및",
    "주요내용": "고등ㆍ평생교육지원특별회계는 대학의 미래 인재양성 역량을 강화\n하고, 교육ㆍ연구ㆍ운영 여건 개선 등을 지원하기 위하여 설치된 특별\n회계임.\n2023년 1월 최초로 도입된 이 특별회계는, 교육 분야 간의 투자 불\n균형과 초ㆍ중등교육에 치우친 재정 등을 완화하기 위해 기존 교육\n예산을 전입받는 한편 추가 세입을 도입하여 총규모가 10조원에 달하\n며, 현재까지 대학 등에 지원해 왔으나, 2023년 1월 1일 최초 시행된\n이후 2025년 12월 31일부로 그 효력이 종료될 예정임.\n이에 고등ㆍ평생교육지원특별회계의 유효기한을 연장함으로써 고등\nㆍ평생교육의 역량 강화를 계속하여 지원하려는 것임(안",
    "제안이유_및_주요내용": "고등ㆍ평생교육지원특별회계는 대학의 미래 인재양성 역량을 강화\n하고, 교육ㆍ연구ㆍ운영 여건 개선 등을 지원하기 위하여 설치된 특별\n회계임.\n2023년 1월 최초로 도입된 이 특별회계는, 교육 분야 간의 투자 불\n균형과 초ㆍ중등교육에 치우친 재정 등을 완화하기 위해 기존 교육\n예산을 전입받는 한편 추가 세입을 도입하여 총규모가 10조원에 달하\n며, 현재까지 대학 등에 지원해 왔으나, 2023년 1월 1일 최초 시행된\n이후 2025년 12월 31일부로 그 효력이 종료될 예정임.\n이에 고등ㆍ평생교육지원특별회계의 유효기한을 연장함으로써 고등\nㆍ평생교육의 역량 강화를 계속하여 지원하려는 것임(안",
    "법률_제_호": "고등ㆍ평생교육지원특별회계법",
    "신구조문대비표": "현 행 개 정 안\n법률 제19202호 고등ㆍ평생교육 법률 제19202호 고등ㆍ평생교육\n지원특별회계법"
  }
}