{
  "title": "2208756_국가경찰과_자치경찰의_조직_및_운영에_관한_법률_일부개정법률안",
  "bill_number": "8756",
  "proposal_date": "2025. 3. 10.",
  "submission_date": "",
  "is_alternative": false,
  "alternative_bill_numbers": [],
  "has_comparison_table": false,
  "comparison_table": "신ㆍ구조문대비표\n현 행 개 정 안\n제27조(사무기구) ① ㆍ ② (생 제27조(사무기구) ① ㆍ ② (현행\n략) 과 같음)\n<신 설> ③ 사무기구에는 「지방공무원\n법」 제2조제2항제2호에 따른\n교육전문직원을 두어야 한다.\n③ㆍ④ (생 략) ④ㆍ⑤ (현행 제3항 및 제4항\n과 같음)",
  "full_text": "국가경찰과 자치경찰의 조직 및 운영에 관한 법률\n일부개정법률안\n(이해식의원 대표발의)\n발의연월일 : 2025. 3. 10.\n의 안\n8756\n번 호 발 의 자 : 이해식ㆍ박상혁ㆍ박정현\n신정훈ㆍ황명선ㆍ윤준병\n서영석ㆍ민병덕ㆍ서영교\n염태영 의원(10인)\n제안이유 및 주요내용\n최근 한 초등학생이 가장 안전한 공간이어야 할 학교에서, 가장 믿\n고 따라야 할 교사에게 소중한 생명을 빼앗긴 이른바 ‘하늘이 사건’이\n발생했음. 이 비극적인 사건은 학생 보호체계에 중대한 허점이 있다는\n것을 보여주는 단적인 사례임.\n현행법은 시ㆍ도지사 소속으로 자치경찰위원회를 두어 자치경찰 업\n무를 수행하고 있고, 자치경찰은 청소년 보호와 학교 내외에서 학생을\n대상으로 발생하는 상해, 폭행, 따돌림 등의 학교폭력 예방 사무를 하\n고 있음.\n이에 시ㆍ도지사는 시ㆍ도교육감으로부터 자치경찰위원회 위원 1명\n을 추천받아 임명하고 있으나, 정작 실질적 사무를 처리하는 사무기구\n에는 교육공무원을 배치할 법적 근거가 없어 교육현장의 특수성과 전\n\n\n\n문성을 고려한 업무 수행이 어렵다는 지적이 있음.\n이에 자치경찰위원회 사무기구에 지방교육공무원을 두도록 하여 보\n다 안전한 교육환경을 조성하고자 함(안 제27조제3항).\n\n법률 제 호\n국가경찰과 자치경찰의 조직 및 운영에 관한 법률\n일부개정법률안\n국가경찰과 자치경찰의 조직 및 운영에 관한 법률 일부를 다음과 같\n이 개정한다.\n제27조제3항 및 제4항을 각각 제4항 및 제5항으로 하고, 같은 조에 제\n3항을 다음과 같이 신설한다.\n③ 사무기구에는 「지방공무원법」 제2조제2항제2호에 따른 교육전\n문직원을 두어야 한다.\n부 칙\n이 법은 공포한 날부터 시행한다.\n\n\n\n\n신ㆍ구조문대비표\n현 행 개 정 안\n제27조(사무기구) ① ㆍ ② (생 제27조(사무기구) ① ㆍ ② (현행\n략) 과 같음)\n<신 설> ③ 사무기구에는 「지방공무원\n법」 제2조제2항제2호에 따른\n교육전문직원을 두어야 한다.\n③ㆍ④ (생 략) ④ㆍ⑤ (현행 제3항 및 제4항\n과 같음)\n",
  "sections": {
    "제안이유": "및",
    "주요내용": "최근 한 초등학생이 가장 안전한 공간이어야 할 학교에서, 가장 믿\n고 따라야 할 교사에게 소중한 생명을 빼앗긴 이른바 ‘하늘이 사건’이\n발생했음. 이 비극적인 사건은 학생 보호체계에 중대한 허점이 있다는\n것을 보여주는 단적인 사례임.\n현행법은 시ㆍ도지사 소속으로 자치경찰위원회를 두어 자치경찰 업\n무를 수행하고 있고, 자치경찰은 청소년 보호와 학교 내외에서 학생을\n대상으로 발생하는 상해, 폭행, 따돌림 등의 학교폭력 예방 사무를 하\n고 있음.\n이에 시ㆍ도지사는 시ㆍ도교육감으로부터 자치경찰위원회 위원 1명\n을 추천받아 임명하고 있으나, 정작 실질적 사무를 처리하는 사무기구\n에는 교육공무원을 배치할 법적 근거가 없어 교육현장의 특수성과 전\n\n\n\n문성을 고려한 업무 수행이 어렵다는 지적이 있음.\n이에 자치경찰위원회 사무기구에 지방교육공무원을 두도록 하여 보\n다 안전한 교육환경을 조성하고자 함(안 제27조제3항).",
    "제안이유_및_주요내용": "최근 한 초등학생이 가장 안전한 공간이어야 할 학교에서, 가장 믿\n고 따라야 할 교사에게 소중한 생명을 빼앗긴 이른바 ‘하늘이 사건’이\n발생했음. 이 비극적인 사건은 학생 보호체계에 중대한 허점이 있다는\n것을 보여주는 단적인 사례임.\n현행법은 시ㆍ도지사 소속으로 자치경찰위원회를 두어 자치경찰 업\n무를 수행하고 있고, 자치경찰은 청소년 보호와 학교 내외에서 학생을\n대상으로 발생하는 상해, 폭행, 따돌림 등의 학교폭력 예방 사무를 하\n고 있음.\n이에 시ㆍ도지사는 시ㆍ도교육감으로부터 자치경찰위원회 위원 1명\n을 추천받아 임명하고 있으나, 정작 실질적 사무를 처리하는 사무기구\n에는 교육공무원을 배치할 법적 근거가 없어 교육현장의 특수성과 전\n\n\n\n문성을 고려한 업무 수행이 어렵다는 지적이 있음.\n이에 자치경찰위원회 사무기구에 지방교육공무원을 두도록 하여 보\n다 안전한 교육환경을 조성하고자 함(안 제27조제3항).",
    "법률_제_호": "국가경찰과 자치경찰의 조직 및 운영에 관한 법률\n일부개정법률안\n국가경찰과 자치경찰의 조직 및 운영에 관한 법률 일부를 다음과 같\n이 개정한다.\n제27조제3항 및 제4항을 각각 제4항 및 제5항으로 하고, 같은 조에 제\n3항을 다음과 같이 신설한다.\n③ 사무기구에는 「지방공무원법」 제2조제2항제2호에 따른 교육전\n문직원을 두어야 한다.",
    "신구조문대비표": "현 행 개 정 안\n제27조(사무기구) ① ㆍ ② (생 제27조(사무기구) ① ㆍ ② (현행\n략) 과 같음)\n<신 설> ③ 사무기구에는 「지방공무원\n법」 제2조제2항제2호에 따른\n교육전문직원을 두어야 한다.\n③ㆍ④ (생 략) ④ㆍ⑤ (현행 제3항 및 제4항\n과 같음)"
  }
}