{
  "title": "2208614_감사원법_일부개정법률안",
  "bill_number": "8614",
  "proposal_date": "2025. 2. 28.",
  "submission_date": "",
  "is_alternative": false,
  "alternative_bill_numbers": [],
  "has_comparison_table": false,
  "comparison_table": "신ㆍ구조문대비표\n현 행 개 정 안\n제24조(감찰 사항) ①ㆍ② (생 제24조(감찰 사항) ①ㆍ② (현행\n략) 과 같음)\n③ 제1항의 공무원에는 국회· ③ -------------------------\n법원 및 헌법재판소에 소속한 --------헌법재판소ㆍ선거관리\n공무원은 제외한다. 위원회에---------.\n④ (생 략) ④ (현행과 같음)",
  "full_text": "감사원법 일부개정법률안\n(전용기의원 대표발의)\n발의연월일 : 2025. 2. 28.\n의 안\n8614\n번 호 발 의 자 : 전용기ㆍ박홍배ㆍ민병덕\n신정훈ㆍ전진숙ㆍ장철민\n박용갑ㆍ임호선ㆍ윤종군\n박지원ㆍ송옥주ㆍ김현정\n의원(12인)\n제안이유 및 주요내용\n선거관리위원회의 법적 지위나 업무의 성격 등에 관하여 다양한 의\n견들이 존재하지만, 현행 헌법상 선거관리위원회는 엄연히 독립적으로\n규정되어 있는 헌법기관이고, 그에 따른 지위를 보장받아야 함. 따라\n서 헌법의 취지에 맞게 감사원법에서 직무감찰의 예외로 둔 국회나\n법원 및 헌법재판소와 동일하게 규정될 필요가 있음. 또한 이렇게 규\n정해야 감사원과 선거관리위원회 사이에서 발생하는 직무감찰과 관련\n한 갈등을 원천적으로 차단 가능함. 이에 감사원의 직무감찰 범위에서\n선거관리위원회를 제외하려는 것임(제24조제3항 개정).\n\n\n\n\n법률 제 호\n감사원법 일부개정법률안\n감사원법 일부를 다음과 같이 개정한다.\n제24조제3항 중 “헌법재판소에”를 “헌법재판소ㆍ선거관리위원회에”로\n한다.\n부 칙\n이 법은 공포한 날부터 시행한다.\n\n\n\n\n신ㆍ구조문대비표\n현 행 개 정 안\n제24조(감찰 사항) ①ㆍ② (생 제24조(감찰 사항) ①ㆍ② (현행\n략) 과 같음)\n③ 제1항의 공무원에는 국회· ③ -------------------------\n법원 및 헌법재판소에 소속한 --------헌법재판소ㆍ선거관리\n공무원은 제외한다. 위원회에---------.\n④ (생 략) ④ (현행과 같음)\n",
  "sections": {
    "제안이유": "및",
    "주요내용": "선거관리위원회의 법적 지위나 업무의 성격 등에 관하여 다양한 의\n견들이 존재하지만, 현행 헌법상 선거관리위원회는 엄연히 독립적으로\n규정되어 있는 헌법기관이고, 그에 따른 지위를 보장받아야 함. 따라\n서 헌법의 취지에 맞게 감사원법에서 직무감찰의 예외로 둔 국회나\n법원 및 헌법재판소와 동일하게 규정될 필요가 있음. 또한 이렇게 규\n정해야 감사원과 선거관리위원회 사이에서 발생하는 직무감찰과 관련\n한 갈등을 원천적으로 차단 가능함. 이에 감사원의 직무감찰 범위에서\n선거관리위원회를 제외하려는 것임(제24조제3항 개정).",
    "제안이유_및_주요내용": "선거관리위원회의 법적 지위나 업무의 성격 등에 관하여 다양한 의\n견들이 존재하지만, 현행 헌법상 선거관리위원회는 엄연히 독립적으로\n규정되어 있는 헌법기관이고, 그에 따른 지위를 보장받아야 함. 따라\n서 헌법의 취지에 맞게 감사원법에서 직무감찰의 예외로 둔 국회나\n법원 및 헌법재판소와 동일하게 규정될 필요가 있음. 또한 이렇게 규\n정해야 감사원과 선거관리위원회 사이에서 발생하는 직무감찰과 관련\n한 갈등을 원천적으로 차단 가능함. 이에 감사원의 직무감찰 범위에서\n선거관리위원회를 제외하려는 것임(제24조제3항 개정).",
    "법률_제_호": "감사원법 일부개정법률안\n감사원법 일부를 다음과 같이 개정한다.\n제24조제3항 중 “헌법재판소에”를 “헌법재판소ㆍ선거관리위원회에”로\n한다.",
    "신구조문대비표": "현 행 개 정 안\n제24조(감찰 사항) ①ㆍ② (생 제24조(감찰 사항) ①ㆍ② (현행\n략) 과 같음)\n③ 제1항의 공무원에는 국회· ③ -------------------------\n법원 및 헌법재판소에 소속한 --------헌법재판소ㆍ선거관리\n공무원은 제외한다. 위원회에---------.\n④ (생 략) ④ (현행과 같음)"
  }
}