{
  "title": "2208846_가축분뇨의_관리_및_이용에_관한_법률_일부개정법률안",
  "bill_number": "8846",
  "proposal_date": "2025. 3. 12.",
  "submission_date": "",
  "is_alternative": false,
  "alternative_bill_numbers": [],
  "has_comparison_table": false,
  "comparison_table": "신ㆍ구조문대비표\n현 행 개 정 안\n제8조(가축사육의 제한 등) ① 제8조(가축사육의 제한 등) ① ∼\n∼ ⑤ (생 략) ⑤ (현행과 같음)\n<신 설> ⑥ 시장ㆍ군수ㆍ구청장은 지역\n주민의 생활환경보전을 위하여\n가축사육제한구역 내의 축사의\n이전이 필요하다고 인정하는 경\n우 지역주민의 과반수 동의를\n얻어 동일 면적 이내로 이전을\n허용할 수 있다.",
  "full_text": "가축분뇨의 관리 및 이용에 관한 법률 일부개정법률안\n(서천호의원 대표발의)\n발의연월일 : 2025. 3. 12.\n의 안\n8846\n번 호 발 의 자 : 서천호ㆍ이종배ㆍ엄태영\n조인철ㆍ이종욱ㆍ김기현\n박덕흠ㆍ이양수ㆍ김종양\n권영진 의원(10인)\n제안이유 및 주요내용\n현행법은 시장ㆍ군수ㆍ구청장이 지역 주민의 생활환경보전 또는 상\n수원의 수질보전을 위하여 가축사육제한구역을 지정ㆍ고시하여 가축\n의 사육을 제한하고 있으나, 가축사육제한구역 내에서 축사의 이전이\n제한되어 주민의 생활환경이 개선되지 않고 축산농가의 재산권이 제\n약받고 있다는 지적이 있음.\n이에 가축사육제한구역 내에서도 지역주민의 생활환경보전을 위\n해 축사의 이전이 필요하다고 인정하는 경우 동일 면적 이내에서 이전\n을 허용하여 현실에 적합한 규제가 시행되도록 하려는 것임(안 제8\n조제6항 신설).\n\n\n\n\n법률 제 호\n가축분뇨의 관리 및 이용에 관한 법률 일부개정법률안\n가축분뇨의 관리 및 이용에 관한 법률 일부를 다음과 같이 개정한다.\n제8조에 제6항을 다음과 같이 신설한다.\n⑥ 시장ㆍ군수ㆍ구청장은 지역주민의 생활환경보전을 위하여 가축\n사육제한구역 내의 축사의 이전이 필요하다고 인정하는 경우 지역\n주민의 과반수 동의를 얻어 동일 면적 이내로 이전을 허용할 수 있\n다.\n부 칙\n이 법은 공포 후 6개월이 경과한 날부터 시행한다.\n\n\n\n\n신ㆍ구조문대비표\n현 행 개 정 안\n제8조(가축사육의 제한 등) ① 제8조(가축사육의 제한 등) ① ∼\n∼ ⑤ (생 략) ⑤ (현행과 같음)\n<신 설> ⑥ 시장ㆍ군수ㆍ구청장은 지역\n주민의 생활환경보전을 위하여\n가축사육제한구역 내의 축사의\n이전이 필요하다고 인정하는 경\n우 지역주민의 과반수 동의를\n얻어 동일 면적 이내로 이전을\n허용할 수 있다.\n",
  "sections": {
    "제안이유": "및",
    "주요내용": "현행법은 시장ㆍ군수ㆍ구청장이 지역 주민의 생활환경보전 또는 상\n수원의 수질보전을 위하여 가축사육제한구역을 지정ㆍ고시하여 가축\n의 사육을 제한하고 있으나, 가축사육제한구역 내에서 축사의 이전이\n제한되어 주민의 생활환경이 개선되지 않고 축산농가의 재산권이 제\n약받고 있다는 지적이 있음.\n이에 가축사육제한구역 내에서도 지역주민의 생활환경보전을 위\n해 축사의 이전이 필요하다고 인정하는 경우 동일 면적 이내에서 이전\n을 허용하여 현실에 적합한 규제가 시행되도록 하려는 것임(안 제8\n조제6항 신설).",
    "제안이유_및_주요내용": "현행법은 시장ㆍ군수ㆍ구청장이 지역 주민의 생활환경보전 또는 상\n수원의 수질보전을 위하여 가축사육제한구역을 지정ㆍ고시하여 가축\n의 사육을 제한하고 있으나, 가축사육제한구역 내에서 축사의 이전이\n제한되어 주민의 생활환경이 개선되지 않고 축산농가의 재산권이 제\n약받고 있다는 지적이 있음.\n이에 가축사육제한구역 내에서도 지역주민의 생활환경보전을 위\n해 축사의 이전이 필요하다고 인정하는 경우 동일 면적 이내에서 이전\n을 허용하여 현실에 적합한 규제가 시행되도록 하려는 것임(안 제8\n조제6항 신설).",
    "법률_제_호": "가축분뇨의 관리 및 이용에 관한 법률 일부개정법률안\n가축분뇨의 관리 및 이용에 관한 법률 일부를 다음과 같이 개정한다.\n제8조에 제6항을 다음과 같이 신설한다.\n⑥ 시장ㆍ군수ㆍ구청장은 지역주민의 생활환경보전을 위하여 가축\n사육제한구역 내의 축사의 이전이 필요하다고 인정하는 경우 지역\n주민의 과반수 동의를 얻어 동일 면적 이내로 이전을 허용할 수 있\n다.",
    "신구조문대비표": "현 행 개 정 안\n제8조(가축사육의 제한 등) ① 제8조(가축사육의 제한 등) ① ∼\n∼ ⑤ (생 략) ⑤ (현행과 같음)\n<신 설> ⑥ 시장ㆍ군수ㆍ구청장은 지역\n주민의 생활환경보전을 위하여\n가축사육제한구역 내의 축사의\n이전이 필요하다고 인정하는 경\n우 지역주민의 과반수 동의를\n얻어 동일 면적 이내로 이전을\n허용할 수 있다."
  }
}