{
  "title": "2208105_공휴일에_관한_법률_일부개정법률안",
  "bill_number": "8105",
  "proposal_date": "2025. 2. 12.",
  "submission_date": "",
  "is_alternative": false,
  "alternative_bill_numbers": [],
  "has_comparison_table": false,
  "comparison_table": "신ㆍ구조문대비표\n현 행 개 정 안\n<신 설> 제3조의2(임시공휴일) 정부는 제2\n조제10호에 따라 임시공휴일을\n지정하는 경우 임시공휴일 30\n일 전까지 지정하여야 한다. 다\n만, 예측 불가능한 사유로 임시\n공휴일을 지정하는 경우에는\n적용하지 아니한다.",
  "full_text": "공휴일에 관한 법률 일부개정법률안\n(진종오의원 대표발의)\n발의연월일 : 2025. 2. 12.\n의 안\n8105\n번 호 발 의 자 : 진종오ㆍ서천호ㆍ박정하\n백종헌ㆍ정성국ㆍ김미애\n서명옥ㆍ곽규택ㆍ이종배\n박상웅 의원(10인)\n제안이유 및 주요내용\n현행법에 따라 정부가 수시로 공휴일을 지정할 수 있도록 하고 있\n지만 그 지정기한을 규정하지 않고 있음.\n화요일이나 목요일이 공휴일인 경우나 명절 연휴로 인해 징검다리\n연휴가 있는 경우 정부가 내수 진작, 경제 활성화, 국민의 휴식권 보\n장을 위해 임시공휴일을 지정하고 있으며, 통상 그 시기가 임박해 임\n시공휴일로 지정하고 있는 실정임.\n임시공휴일에 임박하여 지정하는 경우 국내외 여행을 위한 교통ㆍ\n관광ㆍ숙박 예약의 어려움, 이미 임시공휴일 지정 전에 예약한 경우\n공휴일 추가요금 납부 문제로 인한 갈등, 기업 경영의 예측 불가능성\n등의 문제가 있다는 지적이 있음.\n이에, 정부가 임시공휴일을 지정하는 경우 예측불가능한 경우가 아\n니면 30일 전까지 지정하도록 하려는 것임(안 제3조의2 신설).\n\n\n\n\n법률 제 호\n공휴일에 관한 법률 일부개정법률안\n공휴일에 관한 법률 일부를 다음과 같이 개정한다.\n제3조의2를 다음과 같이 신설한다.\n제3조의2(임시공휴일) 정부는 제2조제10호에 따라 임시공휴일을 지정\n하는 경우 임시공휴일 30일 전까지 지정하여야 한다. 다만, 예측 불\n가능한 사유로 임시공휴일을 지정하는 경우에는 적용하지 아니한다.\n부 칙\n이 법은 공포한 날부터 시행한다.\n\n\n\n\n신ㆍ구조문대비표\n현 행 개 정 안\n<신 설> 제3조의2(임시공휴일) 정부는 제2\n조제10호에 따라 임시공휴일을\n지정하는 경우 임시공휴일 30\n일 전까지 지정하여야 한다. 다\n만, 예측 불가능한 사유로 임시\n공휴일을 지정하는 경우에는\n적용하지 아니한다.\n",
  "sections": {
    "제안이유": "및",
    "주요내용": "현행법에 따라 정부가 수시로 공휴일을 지정할 수 있도록 하고 있\n지만 그 지정기한을 규정하지 않고 있음.\n화요일이나 목요일이 공휴일인 경우나 명절 연휴로 인해 징검다리\n연휴가 있는 경우 정부가 내수 진작, 경제 활성화, 국민의 휴식권 보\n장을 위해 임시공휴일을 지정하고 있으며, 통상 그 시기가 임박해 임\n시공휴일로 지정하고 있는 실정임.\n임시공휴일에 임박하여 지정하는 경우 국내외 여행을 위한 교통ㆍ\n관광ㆍ숙박 예약의 어려움, 이미 임시공휴일 지정 전에 예약한 경우\n공휴일 추가요금 납부 문제로 인한 갈등, 기업 경영의 예측 불가능성\n등의 문제가 있다는 지적이 있음.\n이에, 정부가 임시공휴일을 지정하는 경우 예측불가능한 경우가 아\n니면 30일 전까지 지정하도록 하려는 것임(안 제3조의2 신설).",
    "제안이유_및_주요내용": "현행법에 따라 정부가 수시로 공휴일을 지정할 수 있도록 하고 있\n지만 그 지정기한을 규정하지 않고 있음.\n화요일이나 목요일이 공휴일인 경우나 명절 연휴로 인해 징검다리\n연휴가 있는 경우 정부가 내수 진작, 경제 활성화, 국민의 휴식권 보\n장을 위해 임시공휴일을 지정하고 있으며, 통상 그 시기가 임박해 임\n시공휴일로 지정하고 있는 실정임.\n임시공휴일에 임박하여 지정하는 경우 국내외 여행을 위한 교통ㆍ\n관광ㆍ숙박 예약의 어려움, 이미 임시공휴일 지정 전에 예약한 경우\n공휴일 추가요금 납부 문제로 인한 갈등, 기업 경영의 예측 불가능성\n등의 문제가 있다는 지적이 있음.\n이에, 정부가 임시공휴일을 지정하는 경우 예측불가능한 경우가 아\n니면 30일 전까지 지정하도록 하려는 것임(안 제3조의2 신설).",
    "법률_제_호": "공휴일에 관한 법률 일부개정법률안\n공휴일에 관한 법률 일부를 다음과 같이 개정한다.\n제3조의2를 다음과 같이 신설한다.\n제3조의2(임시공휴일) 정부는 제2조제10호에 따라 임시공휴일을 지정\n하는 경우 임시공휴일 30일 전까지 지정하여야 한다. 다만, 예측 불\n가능한 사유로 임시공휴일을 지정하는 경우에는 적용하지 아니한다.",
    "신구조문대비표": "현 행 개 정 안\n<신 설> 제3조의2(임시공휴일) 정부는 제2\n조제10호에 따라 임시공휴일을\n지정하는 경우 임시공휴일 30\n일 전까지 지정하여야 한다. 다\n만, 예측 불가능한 사유로 임시\n공휴일을 지정하는 경우에는\n적용하지 아니한다."
  }
}