{
  "title": "2208763_한국해양진흥공사법_일부개정법률안",
  "bill_number": "8763",
  "proposal_date": "2025. 3. 10.",
  "submission_date": "",
  "is_alternative": false,
  "alternative_bill_numbers": [],
  "has_comparison_table": false,
  "comparison_table": "신ㆍ구조문대비표\n현 행 개 정 안\n제5조(자본금) 공사의 자본금은 5 제5조(자본금) ---------------10\n조원으로 하되, 정부 등이 출자 조원------------------------\n한다. ----.",
  "full_text": "한국해양진흥공사법 일부개정법률안\n(윤준병의원 대표발의)\n발의연월일 : 2025. 3. 10.\n의 안\n8763\n번 호 발 의 자 : 윤준병ㆍ김한규ㆍ민병덕\n박희승ㆍ김현정ㆍ허성무\n장철민ㆍ조계원ㆍ문진석\n이춘석ㆍ허 영ㆍ문대림\n신영대ㆍ백선희 의원\n(14인)\n제안이유 및 주요내용\n한국해양진흥공사는 해운업계 지원을 위하여 설립되었으나, 현재 시\n급히 추진하여야 할 사업이 있음에도 불구하고 법정 자본금 규모가\n크지 아니하여 사업 추진에 한계가 있는 실정임.\n일반적으로 5년 내에 친환경 선박 이용을 강제하는 국제해사기구\n(IMO)의 지침을 준수하기 위해서는 현재 노후선 등 6,005척의 선박에\n대하여 친환경 선박으로의 대체가 필요한데, 해당 선박을 모두 신조\n(新造) 선박으로 전환하는 데에는 49〜55조원의 자금이 필요한 상황으\n로 현재의 법정 자본금 규모로는 감당하기 힘든 상태임.\n이에 한국해양진흥공사의 법정 자본금을 5조원에서 10조원으로 상\n향함으로써 국제 규제에 대한 대응력을 강화하고 해운업계의 경쟁력\n을 강화하려는 것임(안 제5조).\n\n\n\n\n법률 제 호\n한국해양진흥공사법 일부개정법률안\n한국해양진흥공사법 일부를 다음과 같이 개정한다.\n제5조 중 “5조원”을 “10조원”으로 한다.\n부 칙\n이 법은 공포한 날부터 시행한다.\n\n\n\n\n신ㆍ구조문대비표\n현 행 개 정 안\n제5조(자본금) 공사의 자본금은 5 제5조(자본금) ---------------10\n조원으로 하되, 정부 등이 출자 조원------------------------\n한다. ----.\n",
  "sections": {
    "제안이유": "및",
    "주요내용": "한국해양진흥공사는 해운업계 지원을 위하여 설립되었으나, 현재 시\n급히 추진하여야 할 사업이 있음에도 불구하고 법정 자본금 규모가\n크지 아니하여 사업 추진에 한계가 있는 실정임.\n일반적으로 5년 내에 친환경 선박 이용을 강제하는 국제해사기구\n(IMO)의 지침을 준수하기 위해서는 현재 노후선 등 6,005척의 선박에\n대하여 친환경 선박으로의 대체가 필요한데, 해당 선박을 모두 신조\n(新造) 선박으로 전환하는 데에는 49〜55조원의 자금이 필요한 상황으\n로 현재의 법정 자본금 규모로는 감당하기 힘든 상태임.\n이에 한국해양진흥공사의 법정 자본금을 5조원에서 10조원으로 상\n향함으로써 국제 규제에 대한 대응력을 강화하고 해운업계의 경쟁력\n을 강화하려는 것임(안 제5조).",
    "제안이유_및_주요내용": "한국해양진흥공사는 해운업계 지원을 위하여 설립되었으나, 현재 시\n급히 추진하여야 할 사업이 있음에도 불구하고 법정 자본금 규모가\n크지 아니하여 사업 추진에 한계가 있는 실정임.\n일반적으로 5년 내에 친환경 선박 이용을 강제하는 국제해사기구\n(IMO)의 지침을 준수하기 위해서는 현재 노후선 등 6,005척의 선박에\n대하여 친환경 선박으로의 대체가 필요한데, 해당 선박을 모두 신조\n(新造) 선박으로 전환하는 데에는 49〜55조원의 자금이 필요한 상황으\n로 현재의 법정 자본금 규모로는 감당하기 힘든 상태임.\n이에 한국해양진흥공사의 법정 자본금을 5조원에서 10조원으로 상\n향함으로써 국제 규제에 대한 대응력을 강화하고 해운업계의 경쟁력\n을 강화하려는 것임(안 제5조).",
    "법률_제_호": "한국해양진흥공사법 일부개정법률안\n한국해양진흥공사법 일부를 다음과 같이 개정한다.\n제5조 중 “5조원”을 “10조원”으로 한다.",
    "신구조문대비표": "현 행 개 정 안\n제5조(자본금) 공사의 자본금은 5 제5조(자본금) ---------------10\n조원으로 하되, 정부 등이 출자 조원------------------------\n한다. ----."
  }
}