{
  "title": "2208786_주택도시기금법_일부개정법률안",
  "bill_number": "8786",
  "proposal_date": "2025. 3. 11.",
  "submission_date": "",
  "is_alternative": false,
  "alternative_bill_numbers": [],
  "has_comparison_table": false,
  "comparison_table": "신·구조문대비표\n현 행 개 정 안\n법률 제19316호 주택도시기금법 법률 제19316호 주택도시기금법\n일부개정법률 ",
  "full_text": "주택도시기금법 일부개정법률안\n(김희정의원 대표발의)\n발의연월일 : 2025. 3. 11.\n의 안\n8786\n번 호 발 의 자 : 김희정ㆍ박준태ㆍ김종양\n김은혜ㆍ박성민ㆍ김상욱\n우재준ㆍ서일준ㆍ권영진\n서범수ㆍ김도읍ㆍ김승수\n의원(12인)\n제안이유 및 주요내용\n현행법은 임차보증금을 임차인에게 상습적으로 반환하지 않은 상습\n채무불이행자에 대해서는 성명, 채무금액 등을 공개할 수 있도록 규정\n하고 있고, 그 공개 대상은 해당 규정이 도입된 2023. 9. 29. 이후 공\n사의 구상채권이 발생한 경우로 한정하여 규정하고 있음.\n그런데 현재 상습 채무불이행자의 대다수는 제도 이전에 채무를 불\n이행하여 공사의 구상채권을 발생하게 한 임대인임에도 불구하고 현\n행 명단 공개 대상에서 법시행 이후 신규사고가 나지 않은 임대인은\n제외됨에 따라 실제 명단 공개대상은 소수에 그치는 등 임차인의 알\n권리를 보장하고 보증금 미반환사고를 예방하는데 한계가 있다는 지\n적이 제기되고 있음.\n이에 제도 이전에 공사의 구상채권이 발생한 경우에도 성명, 채무금\n액 등을 공개할 수 있도록 규정함으로써 제도 실효성을 제고하고 임\n\n\n\n차인 보호를 강화하려는 것임(안 법률 제19316호 주택도시기금법 일부\n개정법률 부칙 제2조 등).\n\n법률 제 호\n주택도시기금법 일부개정법률안\n주택도시기금법 일부를 다음과 같이 개정한다.\n법률 제19316호 주택도시기금법 일부개정법률 부칙 제2조 중 “시행\n이후”를 “시행 전에”로, “경우부터”를 “경우에도”로 한다.\n같은 부칙 제3조를 삭제한다.\n부 칙\n이 법은 공포한 날부터 시행한다.\n\n\n\n\n신·구조문대비표\n현 행 개 정 안\n법률 제19316호 주택도시기금법 법률 제19316호 주택도시기금법\n일부개정법률 부칙 일부개정법률 부칙\n제2조(상습 채무불이행자의 성명 제2조(상습 채무불이행자의 성명\n등의 공개에 관한 적용례) 제3 등의 공개에 관한 적용례) ---\n4조의5의 개정규정은 이 법 시 --------------------------시\n행 이후 공사의 구상채권이 발 행 전에---------------------\n생한 경우부터 적용한다. -----경우에도---------.\n제3조(상습 채무불이행자의 성명 <삭 제>\n등 공개요건에 관한 특례) 이\n법 시행 전에 발생한 임대인의\n임차보증금반환채무의 불이행\n은 제34조의5제1항제2호의 개\n정규정에 따른 성명 등 공개요\n건을 판단할 때에 포함한다.\n",
  "sections": {
    "제안이유": "및",
    "주요내용": "현행법은 임차보증금을 임차인에게 상습적으로 반환하지 않은 상습\n채무불이행자에 대해서는 성명, 채무금액 등을 공개할 수 있도록 규정\n하고 있고, 그 공개 대상은 해당 규정이 도입된 2023. 9. 29. 이후 공\n사의 구상채권이 발생한 경우로 한정하여 규정하고 있음.\n그런데 현재 상습 채무불이행자의 대다수는 제도 이전에 채무를 불\n이행하여 공사의 구상채권을 발생하게 한 임대인임에도 불구하고 현\n행 명단 공개 대상에서 법시행 이후 신규사고가 나지 않은 임대인은\n제외됨에 따라 실제 명단 공개대상은 소수에 그치는 등 임차인의 알\n권리를 보장하고 보증금 미반환사고를 예방하는데 한계가 있다는 지\n적이 제기되고 있음.\n이에 제도 이전에 공사의 구상채권이 발생한 경우에도 성명, 채무금\n액 등을 공개할 수 있도록 규정함으로써 제도 실효성을 제고하고 임\n\n\n\n차인 보호를 강화하려는 것임(안",
    "제안이유_및_주요내용": "현행법은 임차보증금을 임차인에게 상습적으로 반환하지 않은 상습\n채무불이행자에 대해서는 성명, 채무금액 등을 공개할 수 있도록 규정\n하고 있고, 그 공개 대상은 해당 규정이 도입된 2023. 9. 29. 이후 공\n사의 구상채권이 발생한 경우로 한정하여 규정하고 있음.\n그런데 현재 상습 채무불이행자의 대다수는 제도 이전에 채무를 불\n이행하여 공사의 구상채권을 발생하게 한 임대인임에도 불구하고 현\n행 명단 공개 대상에서 법시행 이후 신규사고가 나지 않은 임대인은\n제외됨에 따라 실제 명단 공개대상은 소수에 그치는 등 임차인의 알\n권리를 보장하고 보증금 미반환사고를 예방하는데 한계가 있다는 지\n적이 제기되고 있음.\n이에 제도 이전에 공사의 구상채권이 발생한 경우에도 성명, 채무금\n액 등을 공개할 수 있도록 규정함으로써 제도 실효성을 제고하고 임\n\n\n\n차인 보호를 강화하려는 것임(안",
    "법률_제_호": "주택도시기금법 일부\n개정법률",
    "신구조문대비표": "현 행 개 정 안\n법률 제19316호 주택도시기금법 법률 제19316호 주택도시기금법\n일부개정법률"
  }
}