{
  "title": "2208856_형사소송법_일부개정법률안",
  "bill_number": "8856",
  "proposal_date": "2025. 3. 12.",
  "submission_date": "",
  "is_alternative": false,
  "alternative_bill_numbers": [],
  "has_comparison_table": false,
  "comparison_table": "신ㆍ구조문대비표\n현 행 개 정 안\n제221조(제3자의 출석요구 등) ① 제221조(제3자의 출석요구 등) ①\n∼ ③ (생 략) ∼ ③ (현행과 같음)\n<신 설> ④ 제1항에 따라 출석한 자는\n법률의 정하는 바에 의하여 여\n비, 일당과 숙박료를 청구할 수\n있다. 단, 허위의 진술을 하였\n다고 인정할 상당한 이유가 있\n거나 진술을 거부한 자는 예외\n로 한다.",
  "full_text": "형사소송법 일부개정법률안\n(김영호의원 대표발의)\n발의연월일 : 2025. 3. 12.\n의 안\n8856\n번 호 발 의 자 : 김영호ㆍ박선원ㆍ임호선\n이재정ㆍ김동아ㆍ김준혁\n김영환ㆍ이훈기ㆍ이병진\n문정복 의원(10인)\n제안이유 및 주요내용\n현행법은 검사 또는 사법경찰관이 수사에 필요한 때에는 피의자가\n아닌 자의 출석을 요구하여 진술을 들을 수 있도록 하고 있으며, 법무\n부 훈령 「참고인등비용지급규칙」 및 경찰청 훈령 「참고인등에 대\n한 비용 지급 규칙」에 따라 이렇게 출석한 참고인에게 여비, 일당,\n숙박료와 식비를 지급할 수 있음.\n그런데 증인과 감정인의 경우 여비, 일당, 숙박료를 청구할 수 있다\n고 법에 명시하여 모든 사람이 쉽게 알 수 있는 반면, 참고인의 경우\n에는 ‘참고인 출석요구서’ 등을 통해 “소정의 여비를 지급한다”고만 안\n내받고 있으므로 본인이 교통비나 식비 등을 부담해야 한다고 오해하\n는 경우가 많다는 지적이 있음.\n이에 참고인으로 출석한 사람도 여비, 일당과 숙박료를 청구할 수\n있으며, 다만 허위의 진술을 하였다고 인정할 상당한 이유가 있거나\n\n\n\n진술을 거부한 자는 예외로 한다고 법에 명기함으로써 비용 지급에\n관한 내용을 모든 사람이 쉽게 알 수 있게 하고, 참고인의 출석에 대\n한 경제적 부담감을 완화함으로써 형사사법절차 협력을 독려하려는\n것임(안 제221조제4항 신설).\n참고사항\n이 법률안은 김영호의원이 대표발의한 「형사소송비용 등에 관한\n법률 전부개정법률안」(의안번호 제8853호)의 의결을 전제로 하는 것\n이므로 같은 법률안이 의결되지 아니하거나 수정의결되는 경우에는\n이에 맞추어 조정되어야 할 것임.\n\n법률 제 호\n형사소송법 일부개정법률안\n형사소송법 일부를 다음과 같이 개정한다.\n제221조에 제4항을 다음과 같이 신설한다.\n④ 제1항에 따라 출석한 자는 법률의 정하는 바에 의하여 여비, 일\n당과 숙박료를 청구할 수 있다. 단, 허위의 진술을 하였다고 인정할\n상당한 이유가 있거나 진술을 거부한 자는 예외로 한다.\n부 칙\n제1조(시행일) 이 법은 공포 후 3개월이 경과한 날부터 시행한다.\n제2조(참고인의 여비 등에 관한 적용례) 제221조제4항의 개정규정은\n이 법 시행 이후 출석을 요구받은 참고인부터 적용한다.\n\n\n\n\n신ㆍ구조문대비표\n현 행 개 정 안\n제221조(제3자의 출석요구 등) ① 제221조(제3자의 출석요구 등) ①\n∼ ③ (생 략) ∼ ③ (현행과 같음)\n<신 설> ④ 제1항에 따라 출석한 자는\n법률의 정하는 바에 의하여 여\n비, 일당과 숙박료를 청구할 수\n있다. 단, 허위의 진술을 하였\n다고 인정할 상당한 이유가 있\n거나 진술을 거부한 자는 예외\n로 한다.\n",
  "sections": {
    "제안이유": "및",
    "주요내용": "현행법은 검사 또는 사법경찰관이 수사에 필요한 때에는 피의자가\n아닌 자의 출석을 요구하여 진술을 들을 수 있도록 하고 있으며, 법무\n부 훈령 「참고인등비용지급규칙」 및 경찰청 훈령 「참고인등에 대\n한 비용 지급 규칙」에 따라 이렇게 출석한 참고인에게 여비, 일당,\n숙박료와 식비를 지급할 수 있음.\n그런데 증인과 감정인의 경우 여비, 일당, 숙박료를 청구할 수 있다\n고 법에 명시하여 모든 사람이 쉽게 알 수 있는 반면, 참고인의 경우\n에는 ‘참고인 출석요구서’ 등을 통해 “소정의 여비를 지급한다”고만 안\n내받고 있으므로 본인이 교통비나 식비 등을 부담해야 한다고 오해하\n는 경우가 많다는 지적이 있음.\n이에 참고인으로 출석한 사람도 여비, 일당과 숙박료를 청구할 수\n있으며, 다만 허위의 진술을 하였다고 인정할 상당한 이유가 있거나\n\n\n\n진술을 거부한 자는 예외로 한다고 법에 명기함으로써 비용 지급에\n관한 내용을 모든 사람이 쉽게 알 수 있게 하고, 참고인의 출석에 대\n한 경제적 부담감을 완화함으로써 형사사법절차 협력을 독려하려는\n것임(안 제221조제4항 신설).",
    "제안이유_및_주요내용": "현행법은 검사 또는 사법경찰관이 수사에 필요한 때에는 피의자가\n아닌 자의 출석을 요구하여 진술을 들을 수 있도록 하고 있으며, 법무\n부 훈령 「참고인등비용지급규칙」 및 경찰청 훈령 「참고인등에 대\n한 비용 지급 규칙」에 따라 이렇게 출석한 참고인에게 여비, 일당,\n숙박료와 식비를 지급할 수 있음.\n그런데 증인과 감정인의 경우 여비, 일당, 숙박료를 청구할 수 있다\n고 법에 명시하여 모든 사람이 쉽게 알 수 있는 반면, 참고인의 경우\n에는 ‘참고인 출석요구서’ 등을 통해 “소정의 여비를 지급한다”고만 안\n내받고 있으므로 본인이 교통비나 식비 등을 부담해야 한다고 오해하\n는 경우가 많다는 지적이 있음.\n이에 참고인으로 출석한 사람도 여비, 일당과 숙박료를 청구할 수\n있으며, 다만 허위의 진술을 하였다고 인정할 상당한 이유가 있거나\n\n\n\n진술을 거부한 자는 예외로 한다고 법에 명기함으로써 비용 지급에\n관한 내용을 모든 사람이 쉽게 알 수 있게 하고, 참고인의 출석에 대\n한 경제적 부담감을 완화함으로써 형사사법절차 협력을 독려하려는\n것임(안 제221조제4항 신설).",
    "법률_제_호": "형사소송법 일부개정법률안\n형사소송법 일부를 다음과 같이 개정한다.\n제221조에 제4항을 다음과 같이 신설한다.\n④ 제1항에 따라 출석한 자는 법률의 정하는 바에 의하여 여비, 일\n당과 숙박료를 청구할 수 있다. 단, 허위의 진술을 하였다고 인정할\n상당한 이유가 있거나 진술을 거부한 자는 예외로 한다.",
    "신구조문대비표": "현 행 개 정 안\n제221조(제3자의 출석요구 등) ① 제221조(제3자의 출석요구 등) ①\n∼ ③ (생 략) ∼ ③ (현행과 같음)\n<신 설> ④ 제1항에 따라 출석한 자는\n법률의 정하는 바에 의하여 여\n비, 일당과 숙박료를 청구할 수\n있다. 단, 허위의 진술을 하였\n다고 인정할 상당한 이유가 있\n거나 진술을 거부한 자는 예외\n로 한다."
  }
}