{
  "title": "2208453_국민연금법_일부개정법률안",
  "bill_number": "8453",
  "proposal_date": "2025. 2. 26.",
  "submission_date": "",
  "is_alternative": false,
  "alternative_bill_numbers": [],
  "has_comparison_table": false,
  "comparison_table": "신ㆍ구조문대비표\n현 행 개 정 안\n<신 설> 제43조의2(기금재정에 대한 정부\n지원) 정부는 매년 「소득세\n법」에 따른 연금소득세 총액을\n공단에 지원하여야 한다.",
  "full_text": "국민연금법 일부개정법률안\n(이소영의원 대표발의)\n발의연월일 : 2025. 2. 26.\n의 안\n8453\n번 호 발 의 자 : 이소영ㆍ김태년ㆍ김남근\n장철민ㆍ강훈식ㆍ박지원\n채현일ㆍ정준호ㆍ김기표\n조승래 의원(10인)\n제안이유\n2023년 3월 정부가 발표한 ‘제5차 국민연금 재정추계결과’에 따르면\n국민연금기금은 2041년에 적자 전환 후 2055년에 고갈될 것으로 전망\n되고 있음. 이에 국회는 국민연금의 개혁을 위하여 다양한 방안들을\n논의하고 있으나, 정부는 더내고 덜받는 방안만을 주장하고 있음.\n그러나 단순히 더내고 덜받는 방안은 재정안정에는 도움이 될지는\n모르겠으나, 국민의 노후빈곤 문제를 더 악화시키고, 세대간의 갈등을\n부추기는 등 국민연금제도의 신뢰도를 심각하게 훼손할 우려가 있음.\n따라서 보다 책임있는 국민연금재정 안정방안을 마련하기 위해서는\n정부의 재정지원 노력도 병행되어야 할 것임.\n이에 현재 노후세대가 납부하는 연금소득세 총액을 국민연금에 지\n원토록 의무화하여, 일부라도 국민연금 재정안정에 기여하고자 함.\n\n\n\n주요내용\n기금재정에 대한 정부지원 조항을 신설하여 정부는 「소득세법」에\n따른 연금소득세 총액을 공단에 지원하도록 하고자 함(안 제43조의2\n신설).\n\n법률 제 호\n국민연금법 일부개정법률안\n국민연금법 일부를 다음과 같이 개정한다.\n제43조의2를 다음과 같이 신설한다.\n제43조의2(기금재정에 대한 정부지원) 정부는 매년 「소득세법」에 따\n른 연금소득세 총액을 공단에 지원하여야 한다.\n부 칙\n이 법은 2026년 1월 1일부터 시행한다.\n\n\n\n\n신ㆍ구조문대비표\n현 행 개 정 안\n<신 설> 제43조의2(기금재정에 대한 정부\n지원) 정부는 매년 「소득세\n법」에 따른 연금소득세 총액을\n공단에 지원하여야 한다.\n",
  "sections": {
    "제안이유": "2023년 3월 정부가 발표한 ‘제5차 국민연금 재정추계결과’에 따르면\n국민연금기금은 2041년에 적자 전환 후 2055년에 고갈될 것으로 전망\n되고 있음. 이에 국회는 국민연금의 개혁을 위하여 다양한 방안들을\n논의하고 있으나, 정부는 더내고 덜받는 방안만을 주장하고 있음.\n그러나 단순히 더내고 덜받는 방안은 재정안정에는 도움이 될지는\n모르겠으나, 국민의 노후빈곤 문제를 더 악화시키고, 세대간의 갈등을\n부추기는 등 국민연금제도의 신뢰도를 심각하게 훼손할 우려가 있음.\n따라서 보다 책임있는 국민연금재정 안정방안을 마련하기 위해서는\n정부의 재정지원 노력도 병행되어야 할 것임.\n이에 현재 노후세대가 납부하는 연금소득세 총액을 국민연금에 지\n원토록 의무화하여, 일부라도 국민연금 재정안정에 기여하고자 함.",
    "주요내용": "기금재정에 대한 정부지원 조항을 신설하여 정부는 「소득세법」에\n따른 연금소득세 총액을 공단에 지원하도록 하고자 함(안 제43조의2\n신설).",
    "법률_제_호": "국민연금법 일부개정법률안\n국민연금법 일부를 다음과 같이 개정한다.\n제43조의2를 다음과 같이 신설한다.\n제43조의2(기금재정에 대한 정부지원) 정부는 매년 「소득세법」에 따\n른 연금소득세 총액을 공단에 지원하여야 한다.",
    "신구조문대비표": "현 행 개 정 안\n<신 설> 제43조의2(기금재정에 대한 정부\n지원) 정부는 매년 「소득세\n법」에 따른 연금소득세 총액을\n공단에 지원하여야 한다."
  }
}