{
  "title": "2208796_수산업법_일부개정법률안",
  "bill_number": "8796",
  "proposal_date": "2025. 3. 11.",
  "submission_date": "",
  "is_alternative": false,
  "alternative_bill_numbers": [],
  "has_comparison_table": false,
  "comparison_table": "신ㆍ구조문대비표\n현 행 개 정 안\n제79조(폐어구 집하장등의 설치 제79조(폐어구 집하장등의 설치\n등) ① ㆍ ② (생 략) 등) ① ㆍ ② (현행과 같음)\n<신 설> ③ 국가는 시ㆍ도지사 또는 시\n장ㆍ군수ㆍ구청장이 집하장등\n을 설치ㆍ운영하는 경우 이에\n필요한 비용의 전부 또는 일부\n를 지원할 수 있다.\n③ (생 략) ④ (현행 제3항과 같음)",
  "full_text": "수산업법 일부개정법률안\n(이병진의원 대표발의)\n발의연월일 : 2025. 3. 11.\n의 안\n8796\n번 호 발 의 자 : 이병진ㆍ장종태ㆍ임광현\n박 정ㆍ한정애ㆍ윤후덕\n최기상ㆍ이훈기ㆍ이정문\n박용갑 의원(10인)\n제안이유 및 주요내용\n현행법에 따르면 해양수산부장관, 시ㆍ도지사, 시장ㆍ군수ㆍ구청장\n은 폐어구 및 유실어구를 수거ㆍ처리하기 위한 집하장 등을 설치ㆍ운\n영할 수 있음.\n폐어구는 바다에 유기되어 해양 생물의 부상 및 폐사를 유발할 뿐\n만 아니라 폐어구의 상당 부분이 플라스틱으로 되어 있어 해양환경오\n염을 가중시키는 주요 원인이 되므로 집하장 설치 확대를 통한 폐어\n구 수거율을 제고할 필요가 있다는 의견이 있음.\n이에 국가로 하여금 시ㆍ도지사 또는 시장ㆍ군수ㆍ구청장이 집하장\n등을 설치ㆍ운영하는 데 필요한 비용의 전부 또는 일부를 지원할 수\n있도록 함으로써 폐어구 집하장 설치를 촉진하여 해양생태계 및 해양\n환경 보전에 기여하려는 것임(안 제79조제3항 신설).\n\n\n\n\n법률 제 호\n수산업법 일부개정법률안\n수산업법 일부를 다음과 같이 개정한다.\n제79조제3항을 제4항으로 하고, 같은 조에 제3항을 다음과 같이 신설\n한다.\n③ 국가는 시ㆍ도지사 또는 시장ㆍ군수ㆍ구청장이 집하장등을 설치\nㆍ운영하는 경우 이에 필요한 비용의 전부 또는 일부를 지원할 수\n있다.\n부 칙\n이 법은 공포 후 6개월이 경과한 날부터 시행한다.\n\n\n\n\n신ㆍ구조문대비표\n현 행 개 정 안\n제79조(폐어구 집하장등의 설치 제79조(폐어구 집하장등의 설치\n등) ① ㆍ ② (생 략) 등) ① ㆍ ② (현행과 같음)\n<신 설> ③ 국가는 시ㆍ도지사 또는 시\n장ㆍ군수ㆍ구청장이 집하장등\n을 설치ㆍ운영하는 경우 이에\n필요한 비용의 전부 또는 일부\n를 지원할 수 있다.\n③ (생 략) ④ (현행 제3항과 같음)\n",
  "sections": {
    "제안이유": "및",
    "주요내용": "현행법에 따르면 해양수산부장관, 시ㆍ도지사, 시장ㆍ군수ㆍ구청장\n은 폐어구 및 유실어구를 수거ㆍ처리하기 위한 집하장 등을 설치ㆍ운\n영할 수 있음.\n폐어구는 바다에 유기되어 해양 생물의 부상 및 폐사를 유발할 뿐\n만 아니라 폐어구의 상당 부분이 플라스틱으로 되어 있어 해양환경오\n염을 가중시키는 주요 원인이 되므로 집하장 설치 확대를 통한 폐어\n구 수거율을 제고할 필요가 있다는 의견이 있음.\n이에 국가로 하여금 시ㆍ도지사 또는 시장ㆍ군수ㆍ구청장이 집하장\n등을 설치ㆍ운영하는 데 필요한 비용의 전부 또는 일부를 지원할 수\n있도록 함으로써 폐어구 집하장 설치를 촉진하여 해양생태계 및 해양\n환경 보전에 기여하려는 것임(안 제79조제3항 신설).",
    "제안이유_및_주요내용": "현행법에 따르면 해양수산부장관, 시ㆍ도지사, 시장ㆍ군수ㆍ구청장\n은 폐어구 및 유실어구를 수거ㆍ처리하기 위한 집하장 등을 설치ㆍ운\n영할 수 있음.\n폐어구는 바다에 유기되어 해양 생물의 부상 및 폐사를 유발할 뿐\n만 아니라 폐어구의 상당 부분이 플라스틱으로 되어 있어 해양환경오\n염을 가중시키는 주요 원인이 되므로 집하장 설치 확대를 통한 폐어\n구 수거율을 제고할 필요가 있다는 의견이 있음.\n이에 국가로 하여금 시ㆍ도지사 또는 시장ㆍ군수ㆍ구청장이 집하장\n등을 설치ㆍ운영하는 데 필요한 비용의 전부 또는 일부를 지원할 수\n있도록 함으로써 폐어구 집하장 설치를 촉진하여 해양생태계 및 해양\n환경 보전에 기여하려는 것임(안 제79조제3항 신설).",
    "법률_제_호": "수산업법 일부개정법률안\n수산업법 일부를 다음과 같이 개정한다.\n제79조제3항을 제4항으로 하고, 같은 조에 제3항을 다음과 같이 신설\n한다.\n③ 국가는 시ㆍ도지사 또는 시장ㆍ군수ㆍ구청장이 집하장등을 설치\nㆍ운영하는 경우 이에 필요한 비용의 전부 또는 일부를 지원할 수\n있다.",
    "신구조문대비표": "현 행 개 정 안\n제79조(폐어구 집하장등의 설치 제79조(폐어구 집하장등의 설치\n등) ① ㆍ ② (생 략) 등) ① ㆍ ② (현행과 같음)\n<신 설> ③ 국가는 시ㆍ도지사 또는 시\n장ㆍ군수ㆍ구청장이 집하장등\n을 설치ㆍ운영하는 경우 이에\n필요한 비용의 전부 또는 일부\n를 지원할 수 있다.\n③ (생 략) ④ (현행 제3항과 같음)"
  }
}