{
  "title": "2208888_국가전략기술_육성에_관한_특별법_일부개정법률안",
  "bill_number": "8888",
  "proposal_date": "2025. 3. 13.",
  "submission_date": "",
  "is_alternative": false,
  "alternative_bill_numbers": [],
  "has_comparison_table": false,
  "comparison_table": "신ㆍ구조문대비표\n현 행 개 정 안\n<신 설> 제26조의2(병역특례 우선 배정)\n정부는 「병역법」 제37조제1\n항 및 제38조제1항에 따른 전문\n연구요원 및 산업기능요원의 편\n입 시 기술육성주체에 우선 배\n정해야 한다.",
  "full_text": "국가전략기술 육성에 관한 특별법 일부개정법률안\n(이해민의원 대표발의)\n발의연월일 : 2025. 3. 13.\n의 안\n8888\n번 호 발 의 자 : 이해민ㆍ조인철ㆍ한민수\n김우영ㆍ김선민ㆍ조승래\n신장식ㆍ오세희ㆍ정동영\n신영대 의원(10인)\n제안이유 및 주요내용\n국가전략기술은 미래 신산업 발전과 과학기술 주권 확립, 그리고 국\n민경제 발전에 핵심적인 역할을 수행하며, 국가의 안전보장과도 밀접\n한 연관이 있음.\n최근 Deepseek 충격을 비롯해 국가전략기술 분야에서 선도국과의\n기술 격차에 대한 우려가 점차 확대되고 있으며, 인재 양성 측면에서\n도 우수 인재의 해외 유출 문제가 사회적으로 대두되고 있음.\n이에 정부는 「병역법」 제37조제1항 및 제38조제1항 규정에 따른\n전문연구요원 및 산업기능요원의 편입 시 「국가전략기술육성법」상\n의 기술육성주체에 우선 배정하도록 개정함으로써 국가전략기술 인재\n육성과 산업 발전에 기여하고, 종국적으로 국가안보에 보탬이 되고자\n함(안 제26조의2 신설).\n\n\n\n\n법률 제 호\n국가전략기술 육성에 관한 특별법 일부개정법률안\n국가전략기술 육성에 관한 특별법 일부를 다음과 같이 개정한다.\n제5장에 제26조의2를 다음과 같이 신설한다.\n제26조의2(병역특례 우선 배정) 정부는 「병역법」 제37조제1항 및 제\n38조제1항에 따른 전문연구요원 및 산업기능요원의 편입 시 기술육\n성주체에 우선 배정해야 한다.\n부 칙\n이 법은 공포한 날부터 시행한다.\n\n\n\n\n신ㆍ구조문대비표\n현 행 개 정 안\n<신 설> 제26조의2(병역특례 우선 배정)\n정부는 「병역법」 제37조제1\n항 및 제38조제1항에 따른 전문\n연구요원 및 산업기능요원의 편\n입 시 기술육성주체에 우선 배\n정해야 한다.\n",
  "sections": {
    "제안이유": "및",
    "주요내용": "국가전략기술은 미래 신산업 발전과 과학기술 주권 확립, 그리고 국\n민경제 발전에 핵심적인 역할을 수행하며, 국가의 안전보장과도 밀접\n한 연관이 있음.\n최근 Deepseek 충격을 비롯해 국가전략기술 분야에서 선도국과의\n기술 격차에 대한 우려가 점차 확대되고 있으며, 인재 양성 측면에서\n도 우수 인재의 해외 유출 문제가 사회적으로 대두되고 있음.\n이에 정부는 「병역법」 제37조제1항 및 제38조제1항 규정에 따른\n전문연구요원 및 산업기능요원의 편입 시 「국가전략기술육성법」상\n의 기술육성주체에 우선 배정하도록 개정함으로써 국가전략기술 인재\n육성과 산업 발전에 기여하고, 종국적으로 국가안보에 보탬이 되고자\n함(안 제26조의2 신설).",
    "제안이유_및_주요내용": "국가전략기술은 미래 신산업 발전과 과학기술 주권 확립, 그리고 국\n민경제 발전에 핵심적인 역할을 수행하며, 국가의 안전보장과도 밀접\n한 연관이 있음.\n최근 Deepseek 충격을 비롯해 국가전략기술 분야에서 선도국과의\n기술 격차에 대한 우려가 점차 확대되고 있으며, 인재 양성 측면에서\n도 우수 인재의 해외 유출 문제가 사회적으로 대두되고 있음.\n이에 정부는 「병역법」 제37조제1항 및 제38조제1항 규정에 따른\n전문연구요원 및 산업기능요원의 편입 시 「국가전략기술육성법」상\n의 기술육성주체에 우선 배정하도록 개정함으로써 국가전략기술 인재\n육성과 산업 발전에 기여하고, 종국적으로 국가안보에 보탬이 되고자\n함(안 제26조의2 신설).",
    "법률_제_호": "국가전략기술 육성에 관한 특별법 일부개정법률안\n국가전략기술 육성에 관한 특별법 일부를 다음과 같이 개정한다.\n제5장에 제26조의2를 다음과 같이 신설한다.\n제26조의2(병역특례 우선 배정) 정부는 「병역법」 제37조제1항 및 제\n38조제1항에 따른 전문연구요원 및 산업기능요원의 편입 시 기술육\n성주체에 우선 배정해야 한다.",
    "신구조문대비표": "현 행 개 정 안\n<신 설> 제26조의2(병역특례 우선 배정)\n정부는 「병역법」 제37조제1\n항 및 제38조제1항에 따른 전문\n연구요원 및 산업기능요원의 편\n입 시 기술육성주체에 우선 배\n정해야 한다."
  }
}