{
  "title": "2208597_국회법_일부개정법률안",
  "bill_number": "8597",
  "proposal_date": "2025. 2. 28.",
  "submission_date": "",
  "is_alternative": false,
  "alternative_bill_numbers": [],
  "has_comparison_table": false,
  "comparison_table": "신ㆍ구조문대비표\n현 행 개 정 안\n제60조(위원의 발언) ①ㆍ② (생 제60조(위원의 발언) ①ㆍ② (현\n략) 행과 같음)\n<신 설> ③ 위원장이 제49조에 따른 위\n원장의 직무가 아닌 위원으로\n서 질의 등의 발언을 할 때에\n는 위원석으로 이동하여야 한\n다. 이 경우 위원장이 지정하는\n간사가 그 직무를 대리한다.",
  "full_text": "국회법 일부개정법률안\n(서지영의원 대표발의)\n발의연월일 : 2025. 2. 28.\n의 안\n8597\n번 호 발 의 자 : 서지영ㆍ박충권ㆍ조경태\n인요한ㆍ김용태ㆍ서일준\n김대식ㆍ정성국ㆍ김선교\n정동만ㆍ박성훈ㆍ윤영석\n김소희ㆍ최은석 의원\n(14인)\n제안이유 및 주요내용\n현행법에서는 위원장의 직무를 의사 정리 및 질서 유지, 사무 감독\n등으로 제한하는 한편, 위원회에서의 위원의 발언 시간에 대하여는 발\n언을 원하는 위원이 2명 이상인 경우 위원장이 간사와 협의하여 15분\n의 범위에서 각 위원의 첫 번째 발언시간을 균등하게 정하도록 하는\n등의 제한을 둘 수 있도록 규정하고 있음.\n그러나 위원장이 그 직무로 정해진 범위를 벗어나 위원으로서 질의\n등의 발언을 할 때에도 위원장의 직무 수행에 따른 발언과 위원으로\n서의 발언이 구분되지 아니하여 위원장이 위원의 발언시간 제한 등과\n무관하게 발언할 수 있다는 지적이 있음.\n이에 위원장이 위원장의 직무가 아닌 위원으로서 발언하기 위해서\n는 위원석으로 이동하여 위원의 발언 규정에 맞게 발언하도록 함으로\n\n\n\n써 위원회가 공정하고 형평성있게 운영되도록 하고자 함(안 제60조).\n\n법률 제 호\n국회법 일부개정법률안\n국회법 일부를 다음과 같이 개정한다.\n제60조에 제3항을 다음과 같이 신설한다.\n③ 위원장이 제49조에 따른 위원장의 직무가 아닌 위원으로서 질의\n등의 발언을 할 때에는 위원석으로 이동하여야 한다. 이 경우 위원\n장이 지정하는 간사가 그 직무를 대리한다.\n부 칙\n이 법은 공포한 날부터 시행한다.\n\n\n\n\n신ㆍ구조문대비표\n현 행 개 정 안\n제60조(위원의 발언) ①ㆍ② (생 제60조(위원의 발언) ①ㆍ② (현\n략) 행과 같음)\n<신 설> ③ 위원장이 제49조에 따른 위\n원장의 직무가 아닌 위원으로\n서 질의 등의 발언을 할 때에\n는 위원석으로 이동하여야 한\n다. 이 경우 위원장이 지정하는\n간사가 그 직무를 대리한다.\n",
  "sections": {
    "제안이유": "및",
    "주요내용": "현행법에서는 위원장의 직무를 의사 정리 및 질서 유지, 사무 감독\n등으로 제한하는 한편, 위원회에서의 위원의 발언 시간에 대하여는 발\n언을 원하는 위원이 2명 이상인 경우 위원장이 간사와 협의하여 15분\n의 범위에서 각 위원의 첫 번째 발언시간을 균등하게 정하도록 하는\n등의 제한을 둘 수 있도록 규정하고 있음.\n그러나 위원장이 그 직무로 정해진 범위를 벗어나 위원으로서 질의\n등의 발언을 할 때에도 위원장의 직무 수행에 따른 발언과 위원으로\n서의 발언이 구분되지 아니하여 위원장이 위원의 발언시간 제한 등과\n무관하게 발언할 수 있다는 지적이 있음.\n이에 위원장이 위원장의 직무가 아닌 위원으로서 발언하기 위해서\n는 위원석으로 이동하여 위원의 발언 규정에 맞게 발언하도록 함으로\n\n\n\n써 위원회가 공정하고 형평성있게 운영되도록 하고자 함(안 제60조).",
    "제안이유_및_주요내용": "현행법에서는 위원장의 직무를 의사 정리 및 질서 유지, 사무 감독\n등으로 제한하는 한편, 위원회에서의 위원의 발언 시간에 대하여는 발\n언을 원하는 위원이 2명 이상인 경우 위원장이 간사와 협의하여 15분\n의 범위에서 각 위원의 첫 번째 발언시간을 균등하게 정하도록 하는\n등의 제한을 둘 수 있도록 규정하고 있음.\n그러나 위원장이 그 직무로 정해진 범위를 벗어나 위원으로서 질의\n등의 발언을 할 때에도 위원장의 직무 수행에 따른 발언과 위원으로\n서의 발언이 구분되지 아니하여 위원장이 위원의 발언시간 제한 등과\n무관하게 발언할 수 있다는 지적이 있음.\n이에 위원장이 위원장의 직무가 아닌 위원으로서 발언하기 위해서\n는 위원석으로 이동하여 위원의 발언 규정에 맞게 발언하도록 함으로\n\n\n\n써 위원회가 공정하고 형평성있게 운영되도록 하고자 함(안 제60조).",
    "법률_제_호": "국회법 일부개정법률안\n국회법 일부를 다음과 같이 개정한다.\n제60조에 제3항을 다음과 같이 신설한다.\n③ 위원장이 제49조에 따른 위원장의 직무가 아닌 위원으로서 질의\n등의 발언을 할 때에는 위원석으로 이동하여야 한다. 이 경우 위원\n장이 지정하는 간사가 그 직무를 대리한다.",
    "신구조문대비표": "현 행 개 정 안\n제60조(위원의 발언) ①ㆍ② (생 제60조(위원의 발언) ①ㆍ② (현\n략) 행과 같음)\n<신 설> ③ 위원장이 제49조에 따른 위\n원장의 직무가 아닌 위원으로\n서 질의 등의 발언을 할 때에\n는 위원석으로 이동하여야 한\n다. 이 경우 위원장이 지정하는\n간사가 그 직무를 대리한다."
  }
}