{
  "title": "2208706_환경정책기본법_일부개정법률안",
  "bill_number": "8706",
  "proposal_date": "2025. 3. 7.",
  "submission_date": "",
  "is_alternative": false,
  "alternative_bill_numbers": [],
  "has_comparison_table": false,
  "comparison_table": "신ㆍ구조문대비표\n현 행 개 정 안\n제12조(환경기준의 설정) ① (생 제12조(환경기준의 설정) ① (현\n략) 행과 같음)\n② 환경기준은 대통령령으로 ② -----------세계보건기구(W\n정한다. HO)의 권고기준을 고려하여 대\n통령령으로-------.\n③ㆍ④ (생 략) ③ㆍ④ (현행과 같음)",
  "full_text": "환경정책기본법 일부개정법률안\n(이용우의원 대표발의)\n발의연월일 : 2025. 3. 7.\n의 안\n8706\n번 호 발 의 자 : 이용우ㆍ이원택ㆍ박홍배\n전진숙ㆍ정혜경ㆍ김태선\n김 윤ㆍ박용갑ㆍ김우영\n이학영ㆍ임미애ㆍ천하람\n의원(12인)\n제안이유 및 주요내용\n환경기준은 국민의 건강을 보호하고 쾌적한 환경을 조성하기 위하\n여 국가가 달성하고 유지하는 것이 바람직한 환경상의 조건 또는 질\n적인 수준을 의미함.\n그런데 우리나라 미세먼지 등에 대한 환경기준은 세계보건기구 권\n고기준보다 낮은 상황임. 특히 심폐질환과 폐암의 원인이 되는 미세먼\n지 등에 대한 경각심을 위해서라도 세계보건기구 권고기준을 고려하\n여 그에 근접한 환경기준을 설정하는 것이 필요하다는 의견이 있음.\n이에 대기ㆍ소음ㆍ수질 및 수생태계 환경기준 설정 시 WHO의 권\n고기준을 고려하도록 하여, 환경기준 설정에 신중을 기하고 대기질 환\n경기준에 관한 국제적 추세를 반영할 수 있도록 하려는 것임(안 제12\n조제2항).\n\n\n\n\n법률 제 호\n환경정책기본법 일부개정법률안\n환경정책기본법 일부를 다음과 같이 개정한다.\n제12조제2항 중 “대통령령으로”를 “세계보건기구(WHO)의 권고기준을\n고려하여 대통령령으로”로 한다.\n부 칙\n이 법은 공포 후 6개월이 경과한 날부터 시행한다.\n\n\n\n\n신ㆍ구조문대비표\n현 행 개 정 안\n제12조(환경기준의 설정) ① (생 제12조(환경기준의 설정) ① (현\n략) 행과 같음)\n② 환경기준은 대통령령으로 ② -----------세계보건기구(W\n정한다. HO)의 권고기준을 고려하여 대\n통령령으로-------.\n③ㆍ④ (생 략) ③ㆍ④ (현행과 같음)\n",
  "sections": {
    "제안이유": "및",
    "주요내용": "환경기준은 국민의 건강을 보호하고 쾌적한 환경을 조성하기 위하\n여 국가가 달성하고 유지하는 것이 바람직한 환경상의 조건 또는 질\n적인 수준을 의미함.\n그런데 우리나라 미세먼지 등에 대한 환경기준은 세계보건기구 권\n고기준보다 낮은 상황임. 특히 심폐질환과 폐암의 원인이 되는 미세먼\n지 등에 대한 경각심을 위해서라도 세계보건기구 권고기준을 고려하\n여 그에 근접한 환경기준을 설정하는 것이 필요하다는 의견이 있음.\n이에 대기ㆍ소음ㆍ수질 및 수생태계 환경기준 설정 시 WHO의 권\n고기준을 고려하도록 하여, 환경기준 설정에 신중을 기하고 대기질 환\n경기준에 관한 국제적 추세를 반영할 수 있도록 하려는 것임(안 제12\n조제2항).",
    "제안이유_및_주요내용": "환경기준은 국민의 건강을 보호하고 쾌적한 환경을 조성하기 위하\n여 국가가 달성하고 유지하는 것이 바람직한 환경상의 조건 또는 질\n적인 수준을 의미함.\n그런데 우리나라 미세먼지 등에 대한 환경기준은 세계보건기구 권\n고기준보다 낮은 상황임. 특히 심폐질환과 폐암의 원인이 되는 미세먼\n지 등에 대한 경각심을 위해서라도 세계보건기구 권고기준을 고려하\n여 그에 근접한 환경기준을 설정하는 것이 필요하다는 의견이 있음.\n이에 대기ㆍ소음ㆍ수질 및 수생태계 환경기준 설정 시 WHO의 권\n고기준을 고려하도록 하여, 환경기준 설정에 신중을 기하고 대기질 환\n경기준에 관한 국제적 추세를 반영할 수 있도록 하려는 것임(안 제12\n조제2항).",
    "법률_제_호": "환경정책기본법 일부개정법률안\n환경정책기본법 일부를 다음과 같이 개정한다.\n제12조제2항 중 “대통령령으로”를 “세계보건기구(WHO)의 권고기준을\n고려하여 대통령령으로”로 한다.",
    "신구조문대비표": "현 행 개 정 안\n제12조(환경기준의 설정) ① (생 제12조(환경기준의 설정) ① (현\n략) 행과 같음)\n② 환경기준은 대통령령으로 ② -----------세계보건기구(W\n정한다. HO)의 권고기준을 고려하여 대\n통령령으로-------.\n③ㆍ④ (생 략) ③ㆍ④ (현행과 같음)"
  }
}