{
  "title": "2209433_한국석유공사법_일부개정법률안",
  "bill_number": "9433",
  "proposal_date": "2025. 3. 28.",
  "submission_date": "",
  "is_alternative": false,
  "alternative_bill_numbers": [],
  "has_comparison_table": false,
  "comparison_table": "신ㆍ구조문대비표\n현 행 개 정 안\n제20조(과태료) ① 제6조를 위반 제20조(과태료) ① -------------\n한 자에게는 200만원 이하의 -----------500만원----------\n과태료를 부과한다. ---------------.\n② (생 략) ② (현행과 같음)",
  "full_text": "한국석유공사법 일부개정법률안\n(김상욱의원 대표발의)\n발의연월일 : 2025. 3. 28.\n의 안\n9433\n번 호 발 의 자 : 김상욱ㆍ김선교ㆍ조지연\n박준태ㆍ박덕흠ㆍ김기현\n최형두ㆍ김예지ㆍ이종배\n서천호ㆍ성일종 의원\n(11인)\n제안이유 및 주요내용\n현행법은 한국석유공사가 아닌 자가 한국석유공사 또는 이와 유사\n한 명칭을 사용한 경우에는 200만원 이하의 과태료를 부과하도록 규\n정하고 있음.\n그런데 현행 과태료 규정은 한국조폐공사, 한국도로공사 등 다른 공\n공기관과 비교해 볼 때 지나치게 낮은 수준으로 이를 합리적으로 조\n정할 필요가 있다는 의견이 있음.\n이에 한국석유공사가 아닌 자가 한국석유공사 또는 이와 유사한 명\n칭을 사용한 자에게 부과하는 과태료를 현행 200만에서 500만원으로\n상향함으로써 유사한 위반행위에 대한 과태료 금액의 형평성을 제고\n하고, 위반행위에 대한 적절한 금전적 제재를 통해 실효성을 높이려는\n것임(안 제20조제1항).\n\n\n\n\n법률 제 호\n한국석유공사법 일부개정법률안\n한국석유공사법 일부를 다음과 같이 개정한다.\n제20조제1항 중 “200만원”을 “500만원”으로 한다.\n부 칙\n이 법은 공포 후 3개월이 경과한 날부터 시행한다.\n\n\n\n\n신ㆍ구조문대비표\n현 행 개 정 안\n제20조(과태료) ① 제6조를 위반 제20조(과태료) ① -------------\n한 자에게는 200만원 이하의 -----------500만원----------\n과태료를 부과한다. ---------------.\n② (생 략) ② (현행과 같음)\n",
  "sections": {
    "제안이유": "및",
    "주요내용": "현행법은 한국석유공사가 아닌 자가 한국석유공사 또는 이와 유사\n한 명칭을 사용한 경우에는 200만원 이하의 과태료를 부과하도록 규\n정하고 있음.\n그런데 현행 과태료 규정은 한국조폐공사, 한국도로공사 등 다른 공\n공기관과 비교해 볼 때 지나치게 낮은 수준으로 이를 합리적으로 조\n정할 필요가 있다는 의견이 있음.\n이에 한국석유공사가 아닌 자가 한국석유공사 또는 이와 유사한 명\n칭을 사용한 자에게 부과하는 과태료를 현행 200만에서 500만원으로\n상향함으로써 유사한 위반행위에 대한 과태료 금액의 형평성을 제고\n하고, 위반행위에 대한 적절한 금전적 제재를 통해 실효성을 높이려는\n것임(안 제20조제1항).",
    "제안이유_및_주요내용": "현행법은 한국석유공사가 아닌 자가 한국석유공사 또는 이와 유사\n한 명칭을 사용한 경우에는 200만원 이하의 과태료를 부과하도록 규\n정하고 있음.\n그런데 현행 과태료 규정은 한국조폐공사, 한국도로공사 등 다른 공\n공기관과 비교해 볼 때 지나치게 낮은 수준으로 이를 합리적으로 조\n정할 필요가 있다는 의견이 있음.\n이에 한국석유공사가 아닌 자가 한국석유공사 또는 이와 유사한 명\n칭을 사용한 자에게 부과하는 과태료를 현행 200만에서 500만원으로\n상향함으로써 유사한 위반행위에 대한 과태료 금액의 형평성을 제고\n하고, 위반행위에 대한 적절한 금전적 제재를 통해 실효성을 높이려는\n것임(안 제20조제1항).",
    "법률_제_호": "한국석유공사법 일부개정법률안\n한국석유공사법 일부를 다음과 같이 개정한다.\n제20조제1항 중 “200만원”을 “500만원”으로 한다.",
    "신구조문대비표": "현 행 개 정 안\n제20조(과태료) ① 제6조를 위반 제20조(과태료) ① -------------\n한 자에게는 200만원 이하의 -----------500만원----------\n과태료를 부과한다. ---------------.\n② (생 략) ② (현행과 같음)"
  }
}