{
  "title": "2209225_노동조합_및_노동관계조정법_일부개정법률안",
  "bill_number": "9225",
  "proposal_date": "2025. 3. 21.",
  "submission_date": "",
  "is_alternative": false,
  "alternative_bill_numbers": [],
  "has_comparison_table": false,
  "comparison_table": "신ㆍ구조문대비표\n현 행 개 정 안\n<신 설> 제3조의2(손해배상 청구의 취하)\n이 법을 위반한 노동조합의 쟁\n의행위에 대하여 손해배상 청\n구소송을 제기한 사용자는 경\n영상의 판단에 따라 상당하고\n합리적인 이유가 있을 때에는\n그 손해배상청구의 소를 취하\n할 수 있다.",
  "full_text": "노동조합 및 노동관계조정법 일부개정법률안\n(박정의원 대표발의)\n발의연월일 : 2025. 3. 21.\n의 안\n9225\n번 호 발 의 자 : 박 정ㆍ김정호ㆍ허 영\n소병훈ㆍ안호영ㆍ박용갑\n윤후덕ㆍ송옥주ㆍ김태선\n김주영ㆍ허성무ㆍ이학영\n어기구ㆍ강유정 의원\n(14인)\n제안이유 및 주요내용\n현재 사용자의 노동조합과 노동자에 대한 감당할 수 없는 수준의\n손해배상청구와 이에 따른 가압류 등은 노동자 개인과 그 가족의 일\n상적 생활을 불가능하게 할 뿐만 아니라, 당사자의 재취업마저 봉쇄되\n는 등 인간으로서 살아갈 기본적 삶조차 유지할 수 없게 해 이를 견\n디다 못해 목숨을 잃는 일이 이어지고 있음.\n이러한 현실에서도 사용자측 일부에선 현재 손해배상청구소송이 진\n행 중이지만, 기업 경영상 다양한 이유로 이를 취하해 노사상생을 통\n한 기업경영 정상화를 원하는 경우가 있음.\n그러나 현행법상으론 경영진이 손해배상청구소송을 취하할 경우 배\n임 문제 등이 발생할 우려가 있어 이를 실행에 옮기기 어렵다는 지적\n이 있음.\n\n\n\n이에 사용자가 경영판단상 상당하고 합리적 이유가 있을 때 손해배\n상청구를 취하할 수 있도록 해 노동자의 삶을 보장하고 기업경영의\n정상화를 촉진하고자 함(안 제3조의2 신설).\n\n법률 제 호\n노동조합 및 노동관계조정법 일부개정법률안\n노동조합 및 노동관계조정법 일부를 다음과 같이 개정한다.\n제3조의2를 다음과 같이 신설한다.\n제3조의2(손해배상 청구의 취하) 이 법을 위반한 노동조합의 쟁의행위\n에 대하여 손해배상 청구소송을 제기한 사용자는 경영상의 판단에\n따라 상당하고 합리적인 이유가 있을 때에는 그 손해배상청구의 소\n를 취하할 수 있다.\n부 칙\n이 법은 공포 후 6개월이 경과한 날부터 시행한다.\n\n\n\n\n신ㆍ구조문대비표\n현 행 개 정 안\n<신 설> 제3조의2(손해배상 청구의 취하)\n이 법을 위반한 노동조합의 쟁\n의행위에 대하여 손해배상 청\n구소송을 제기한 사용자는 경\n영상의 판단에 따라 상당하고\n합리적인 이유가 있을 때에는\n그 손해배상청구의 소를 취하\n할 수 있다.\n",
  "sections": {
    "제안이유": "및",
    "주요내용": "현재 사용자의 노동조합과 노동자에 대한 감당할 수 없는 수준의\n손해배상청구와 이에 따른 가압류 등은 노동자 개인과 그 가족의 일\n상적 생활을 불가능하게 할 뿐만 아니라, 당사자의 재취업마저 봉쇄되\n는 등 인간으로서 살아갈 기본적 삶조차 유지할 수 없게 해 이를 견\n디다 못해 목숨을 잃는 일이 이어지고 있음.\n이러한 현실에서도 사용자측 일부에선 현재 손해배상청구소송이 진\n행 중이지만, 기업 경영상 다양한 이유로 이를 취하해 노사상생을 통\n한 기업경영 정상화를 원하는 경우가 있음.\n그러나 현행법상으론 경영진이 손해배상청구소송을 취하할 경우 배\n임 문제 등이 발생할 우려가 있어 이를 실행에 옮기기 어렵다는 지적\n이 있음.\n\n\n\n이에 사용자가 경영판단상 상당하고 합리적 이유가 있을 때 손해배\n상청구를 취하할 수 있도록 해 노동자의 삶을 보장하고 기업경영의\n정상화를 촉진하고자 함(안 제3조의2 신설).",
    "제안이유_및_주요내용": "현재 사용자의 노동조합과 노동자에 대한 감당할 수 없는 수준의\n손해배상청구와 이에 따른 가압류 등은 노동자 개인과 그 가족의 일\n상적 생활을 불가능하게 할 뿐만 아니라, 당사자의 재취업마저 봉쇄되\n는 등 인간으로서 살아갈 기본적 삶조차 유지할 수 없게 해 이를 견\n디다 못해 목숨을 잃는 일이 이어지고 있음.\n이러한 현실에서도 사용자측 일부에선 현재 손해배상청구소송이 진\n행 중이지만, 기업 경영상 다양한 이유로 이를 취하해 노사상생을 통\n한 기업경영 정상화를 원하는 경우가 있음.\n그러나 현행법상으론 경영진이 손해배상청구소송을 취하할 경우 배\n임 문제 등이 발생할 우려가 있어 이를 실행에 옮기기 어렵다는 지적\n이 있음.\n\n\n\n이에 사용자가 경영판단상 상당하고 합리적 이유가 있을 때 손해배\n상청구를 취하할 수 있도록 해 노동자의 삶을 보장하고 기업경영의\n정상화를 촉진하고자 함(안 제3조의2 신설).",
    "법률_제_호": "노동조합 및 노동관계조정법 일부개정법률안\n노동조합 및 노동관계조정법 일부를 다음과 같이 개정한다.\n제3조의2를 다음과 같이 신설한다.\n제3조의2(손해배상 청구의 취하) 이 법을 위반한 노동조합의 쟁의행위\n에 대하여 손해배상 청구소송을 제기한 사용자는 경영상의 판단에\n따라 상당하고 합리적인 이유가 있을 때에는 그 손해배상청구의 소\n를 취하할 수 있다.",
    "신구조문대비표": "현 행 개 정 안\n<신 설> 제3조의2(손해배상 청구의 취하)\n이 법을 위반한 노동조합의 쟁\n의행위에 대하여 손해배상 청\n구소송을 제기한 사용자는 경\n영상의 판단에 따라 상당하고\n합리적인 이유가 있을 때에는\n그 손해배상청구의 소를 취하\n할 수 있다."
  }
}