{
  "title": "2209966_도시_및_주거환경정비법_일부개정법률안",
  "bill_number": "9966",
  "proposal_date": "2025. 4. 21.",
  "submission_date": "",
  "is_alternative": false,
  "alternative_bill_numbers": [],
  "has_comparison_table": false,
  "comparison_table": "신ㆍ구조문대비표\n현 행 개 정 안\n제124조(관련 자료의 공개 등) ① 제124조(관련 자료의 공개 등) ①\n∼ ⑥ (생 략) ∼ ⑥ (현행과 같음)\n<신 설> ⑦ 국토교통부장관 또는 시ㆍ\n도지사는 조합이 시행하는 정\n비사업의 투명한 관리를 위하\n여 제1항 각 호의 서류 및 관\n련 자료의 체계적인 관리와 공\n개에 필요한 정보시스템을 구\n축ㆍ운영할 수 있다.",
  "full_text": "도시 및 주거환경정비법 일부개정법률안\n(김영호의원 대표발의)\n발의연월일 : 2025. 4. 21.\n의 안\n9966\n번 호 발 의 자 : 김영호ㆍ박용갑ㆍ한민수\n이해식ㆍ박희승ㆍ김문수\n문대림ㆍ이병진ㆍ강선우\n김동아ㆍ김영배ㆍ김준혁\n의원(12인)\n제안이유 및 주요내용\n현행법은 정비사업의 추진위원장 또는 조합 등 사업시행자는 정비\n사업의 시행에 관한 자료를 인터넷 등에 공개하도록 하고 있고, 조합\n원 등이 그 자료에 대하여 열람ㆍ복사 요청을 한 경우에는 그 요청에\n따르도록 규정하고 있음.\n그런데 조합의 정보공개 규정에도 불구하고 조합 운영비 집행 등\n조합 운영 전반과 관련한 분쟁과 갈등이 끊이지 않고 있으며, 일부 조\n합의 경우에는 불리한 정보를 공개하지 않거나 조합원이 자료를 열람\nㆍ복사 요청하더라도 거부하는 경우가 많아 법적 분쟁이 발생하는 사\n례가 빈번하게 발생하고 있음.\n이에 국토교통부장관 또는 시ㆍ도지사가 조합이 공개하여야 하는\n서류 및 관련 자료가 체계적으로 관리되고 공개될 수 있도록 하는 정\n보시스템을 구축ㆍ운영할 수 있는 근거를 마련하여 재개발ㆍ재건축\n\n\n\n등 정비사업의 투명성을 제고하고, 조합원 및 입주예정자들의 정보접\n근성을 높이려는 것임(안 제124조제7항 신설).\n\n법률 제 호\n도시 및 주거환경정비법 일부개정법률안\n도시 및 주거환경정비법 일부를 다음과 같이 개정한다.\n제124조에 제7항을 다음과 같이 신설한다.\n⑦ 국토교통부장관 또는 시ㆍ도지사는 조합이 시행하는 정비사업의\n투명한 관리를 위하여 제1항 각 호의 서류 및 관련 자료의 체계적\n인 관리와 공개에 필요한 정보시스템을 구축ㆍ운영할 수 있다.\n부 칙\n이 법은 공포 후 6개월이 경과한 날부터 시행한다.\n\n\n\n\n신ㆍ구조문대비표\n현 행 개 정 안\n제124조(관련 자료의 공개 등) ① 제124조(관련 자료의 공개 등) ①\n∼ ⑥ (생 략) ∼ ⑥ (현행과 같음)\n<신 설> ⑦ 국토교통부장관 또는 시ㆍ\n도지사는 조합이 시행하는 정\n비사업의 투명한 관리를 위하\n여 제1항 각 호의 서류 및 관\n련 자료의 체계적인 관리와 공\n개에 필요한 정보시스템을 구\n축ㆍ운영할 수 있다.\n",
  "sections": {
    "제안이유": "및",
    "주요내용": "현행법은 정비사업의 추진위원장 또는 조합 등 사업시행자는 정비\n사업의 시행에 관한 자료를 인터넷 등에 공개하도록 하고 있고, 조합\n원 등이 그 자료에 대하여 열람ㆍ복사 요청을 한 경우에는 그 요청에\n따르도록 규정하고 있음.\n그런데 조합의 정보공개 규정에도 불구하고 조합 운영비 집행 등\n조합 운영 전반과 관련한 분쟁과 갈등이 끊이지 않고 있으며, 일부 조\n합의 경우에는 불리한 정보를 공개하지 않거나 조합원이 자료를 열람\nㆍ복사 요청하더라도 거부하는 경우가 많아 법적 분쟁이 발생하는 사\n례가 빈번하게 발생하고 있음.\n이에 국토교통부장관 또는 시ㆍ도지사가 조합이 공개하여야 하는\n서류 및 관련 자료가 체계적으로 관리되고 공개될 수 있도록 하는 정\n보시스템을 구축ㆍ운영할 수 있는 근거를 마련하여 재개발ㆍ재건축\n\n\n\n등 정비사업의 투명성을 제고하고, 조합원 및 입주예정자들의 정보접\n근성을 높이려는 것임(안 제124조제7항 신설).",
    "제안이유_및_주요내용": "현행법은 정비사업의 추진위원장 또는 조합 등 사업시행자는 정비\n사업의 시행에 관한 자료를 인터넷 등에 공개하도록 하고 있고, 조합\n원 등이 그 자료에 대하여 열람ㆍ복사 요청을 한 경우에는 그 요청에\n따르도록 규정하고 있음.\n그런데 조합의 정보공개 규정에도 불구하고 조합 운영비 집행 등\n조합 운영 전반과 관련한 분쟁과 갈등이 끊이지 않고 있으며, 일부 조\n합의 경우에는 불리한 정보를 공개하지 않거나 조합원이 자료를 열람\nㆍ복사 요청하더라도 거부하는 경우가 많아 법적 분쟁이 발생하는 사\n례가 빈번하게 발생하고 있음.\n이에 국토교통부장관 또는 시ㆍ도지사가 조합이 공개하여야 하는\n서류 및 관련 자료가 체계적으로 관리되고 공개될 수 있도록 하는 정\n보시스템을 구축ㆍ운영할 수 있는 근거를 마련하여 재개발ㆍ재건축\n\n\n\n등 정비사업의 투명성을 제고하고, 조합원 및 입주예정자들의 정보접\n근성을 높이려는 것임(안 제124조제7항 신설).",
    "법률_제_호": "도시 및 주거환경정비법 일부개정법률안\n도시 및 주거환경정비법 일부를 다음과 같이 개정한다.\n제124조에 제7항을 다음과 같이 신설한다.\n⑦ 국토교통부장관 또는 시ㆍ도지사는 조합이 시행하는 정비사업의\n투명한 관리를 위하여 제1항 각 호의 서류 및 관련 자료의 체계적\n인 관리와 공개에 필요한 정보시스템을 구축ㆍ운영할 수 있다.",
    "신구조문대비표": "현 행 개 정 안\n제124조(관련 자료의 공개 등) ① 제124조(관련 자료의 공개 등) ①\n∼ ⑥ (생 략) ∼ ⑥ (현행과 같음)\n<신 설> ⑦ 국토교통부장관 또는 시ㆍ\n도지사는 조합이 시행하는 정\n비사업의 투명한 관리를 위하\n여 제1항 각 호의 서류 및 관\n련 자료의 체계적인 관리와 공\n개에 필요한 정보시스템을 구\n축ㆍ운영할 수 있다."
  }
}