{
  "title": "2209667_고등·평생교육지원특별회계법_일부개정법률안",
  "bill_number": "9667",
  "proposal_date": "2025. 4. 9.",
  "submission_date": "",
  "is_alternative": false,
  "alternative_bill_numbers": [],
  "has_comparison_table": false,
  "comparison_table": "신ㆍ구조문대비표\n현 행 개 정 안\n법률 제19202호 고등ㆍ평생교육 법률 제19202호 고등ㆍ평생교육\n지원특별회계법 ",
  "full_text": "고등ㆍ평생교육지원특별회계법 일부개정법률안\n(정을호의원 대표발의)\n발의연월일 : 2025. 4. 9.\n의 안\n9667\n번 호 발 의 자 : 정을호ㆍ김준혁ㆍ김동아\n김문수ㆍ차지호ㆍ박정현\n전용기ㆍ홍기원ㆍ박용갑\n강준현ㆍ이훈기 의원\n(11인)\n제안이유 및 주요내용\n현행법에 따른 고등ㆍ평생교육지원특별회계는 대학의 미래 인재양\n성 역량 강화와 교육ㆍ연구, 운영 여건 개선 등의 비용을 지원하는 특\n별회계이며, 2023년에 3년 한시 회계로 설치되어 이후 2025년 12월 31\n일 일몰을 앞두고 있는 상태임.\n그런데 최근 대학들이 재정난을 이유로 등록금 인상을 추진하고 있\n으며, 대학 등록금 동결 유도와 양질의 고등교육 제공을 위해 국가 재\n정 투입의 필요성이 제기되고 있음.\n또한, OECD 교육지표 2024 결과에 따르면, 한국의 청년층(만 25∼\n34세)의 고등교육 이수율은 69.7%로 OECD 1위지만, 2021년 기준\nGDP 대비 정부 재원 고등교육 공교육비 비율은 0.7%로 OECD 평균\n(1.0%)보다 낮음. 이는 한국의 높은 고등교육 이수율과 비교할 때 정\n부 재정 투입이 상대적으로 부족한 실정임.\n\n\n\n이에 고등ㆍ평생교육지원특별회계의 일몰기한을 현행 2025년 12월\n31일에서 2028년 12월 31일로 연장함으로써 대학의 안정적 재정 운영\n을 도모하고 미래 인재양성 역량 강화에 기여하도록 하려는 것임(안\n법률 제19202호 고등ㆍ평생교육지원특별회계법 부칙 제2조).\n\n법률 제 호\n고등ㆍ평생교육지원특별회계법 일부개정법률안\n고등ㆍ평생교육지원특별회계법 일부를 다음과 같이 개정한다.\n법률 제19202호 고등ㆍ평생교육지원특별회계법 부칙 제2조 중 “2025\n년”을 “2028년”으로 한다.\n부 칙\n이 법은 공포한 날부터 시행한다.\n\n\n\n\n신ㆍ구조문대비표\n현 행 개 정 안\n법률 제19202호 고등ㆍ평생교육 법률 제19202호 고등ㆍ평생교육\n지원특별회계법 부칙 지원특별회계법 부칙\n제2조(유효기간) 이 법은 2025년 제2조(유효기간) ---------2028년\n12월 31일까지 효력을 가진다. --------------------------.\n",
  "sections": {
    "제안이유": "및",
    "주요내용": "현행법에 따른 고등ㆍ평생교육지원특별회계는 대학의 미래 인재양\n성 역량 강화와 교육ㆍ연구, 운영 여건 개선 등의 비용을 지원하는 특\n별회계이며, 2023년에 3년 한시 회계로 설치되어 이후 2025년 12월 31\n일 일몰을 앞두고 있는 상태임.\n그런데 최근 대학들이 재정난을 이유로 등록금 인상을 추진하고 있\n으며, 대학 등록금 동결 유도와 양질의 고등교육 제공을 위해 국가 재\n정 투입의 필요성이 제기되고 있음.\n또한, OECD 교육지표 2024 결과에 따르면, 한국의 청년층(만 25∼\n34세)의 고등교육 이수율은 69.7%로 OECD 1위지만, 2021년 기준\nGDP 대비 정부 재원 고등교육 공교육비 비율은 0.7%로 OECD 평균\n(1.0%)보다 낮음. 이는 한국의 높은 고등교육 이수율과 비교할 때 정\n부 재정 투입이 상대적으로 부족한 실정임.\n\n\n\n이에 고등ㆍ평생교육지원특별회계의 일몰기한을 현행 2025년 12월\n31일에서 2028년 12월 31일로 연장함으로써 대학의 안정적 재정 운영\n을 도모하고 미래 인재양성 역량 강화에 기여하도록 하려는 것임(안",
    "제안이유_및_주요내용": "현행법에 따른 고등ㆍ평생교육지원특별회계는 대학의 미래 인재양\n성 역량 강화와 교육ㆍ연구, 운영 여건 개선 등의 비용을 지원하는 특\n별회계이며, 2023년에 3년 한시 회계로 설치되어 이후 2025년 12월 31\n일 일몰을 앞두고 있는 상태임.\n그런데 최근 대학들이 재정난을 이유로 등록금 인상을 추진하고 있\n으며, 대학 등록금 동결 유도와 양질의 고등교육 제공을 위해 국가 재\n정 투입의 필요성이 제기되고 있음.\n또한, OECD 교육지표 2024 결과에 따르면, 한국의 청년층(만 25∼\n34세)의 고등교육 이수율은 69.7%로 OECD 1위지만, 2021년 기준\nGDP 대비 정부 재원 고등교육 공교육비 비율은 0.7%로 OECD 평균\n(1.0%)보다 낮음. 이는 한국의 높은 고등교육 이수율과 비교할 때 정\n부 재정 투입이 상대적으로 부족한 실정임.\n\n\n\n이에 고등ㆍ평생교육지원특별회계의 일몰기한을 현행 2025년 12월\n31일에서 2028년 12월 31일로 연장함으로써 대학의 안정적 재정 운영\n을 도모하고 미래 인재양성 역량 강화에 기여하도록 하려는 것임(안",
    "법률_제_호": "고등ㆍ평생교육지원특별회계법",
    "신구조문대비표": "현 행 개 정 안\n법률 제19202호 고등ㆍ평생교육 법률 제19202호 고등ㆍ평생교육\n지원특별회계법"
  }
}