{
  "title": "2209291_대기환경보전법_일부개정법률안",
  "bill_number": "9291",
  "proposal_date": "2025. 3. 24.",
  "submission_date": "",
  "is_alternative": false,
  "alternative_bill_numbers": [],
  "has_comparison_table": false,
  "comparison_table": "신ㆍ구조문대비표\n현 행 개 정 안\n법률 제18028호 대기환경보전법 법률 제18028호 대기환경보전법\n일부개정법률 ",
  "full_text": "대기환경보전법 일부개정법률안\n(윤준병의원 대표발의)\n발의연월일 : 2025. 3. 24.\n의 안\n9291\n번 호 발 의 자 : 윤준병ㆍ신영대ㆍ박민규\n정동영ㆍ박홍배ㆍ조계원\n김한규ㆍ민병덕ㆍ박지원\n김태년ㆍ김태선ㆍ허종식\n송옥주ㆍ서영교 의원\n(14인)\n제안이유 및 주요내용\n미세먼지 등 대기오염물질과 온실가스를 감축하기 위해 수소자동차,\n전기자동차 등 대체에너지를 이용한 교통수단이 널리 보급되고 있으\n며, 전기자동차의 충전시설이 광범위하게 보급된 것에 비해 수소자동\n차의 충전시설 등 인프라는 미흡한 실정임.\n때문에 환경부장관의 수소연료공급시설 설치계획의 승인 규정 및\n승인 시 각종 인ㆍ허가를 받은 것으로 의제하는 규정을 마련한 바 있\n으나, 해당 조항의 유효기간은 2025년 12월 31일부로 만료될 예정임.\n이에 관련 규정의 유효기간을 5년 연장함으로써 수소자동차의 충전\n시설 구축을 가속화하고 대체에너지를 이용한 교통수단의 보급을 계\n속 지원하려는 것임(안 법률 제18028호 대기환경보전법 일부개정법률\n부칙 제2조).\n\n\n\n\n법률 제 호\n대기환경보전법 일부개정법률안\n대기환경보전법 일부를 다음과 같이 개정한다.\n법률 제18028호 대기환경보전법 일부개정법률 부칙 제2조 중 “2025년”\n을 “2030년”으로 한다.\n부 칙\n이 법은 공포한 날부터 시행한다.\n\n\n\n\n신ㆍ구조문대비표\n현 행 개 정 안\n법률 제18028호 대기환경보전법 법률 제18028호 대기환경보전법\n일부개정법률 부칙 일부개정법률 부칙\n제2조(유효기간) 제58조의11 및 제2조(유효기간) ---------------\n제58조의12의 개정규정은 2025 -----------------------2030\n년 12월 31일까지 효력을 가진 년--------------------------\n다. --.\n",
  "sections": {
    "제안이유": "및",
    "주요내용": "미세먼지 등 대기오염물질과 온실가스를 감축하기 위해 수소자동차,\n전기자동차 등 대체에너지를 이용한 교통수단이 널리 보급되고 있으\n며, 전기자동차의 충전시설이 광범위하게 보급된 것에 비해 수소자동\n차의 충전시설 등 인프라는 미흡한 실정임.\n때문에 환경부장관의 수소연료공급시설 설치계획의 승인 규정 및\n승인 시 각종 인ㆍ허가를 받은 것으로 의제하는 규정을 마련한 바 있\n으나, 해당 조항의 유효기간은 2025년 12월 31일부로 만료될 예정임.\n이에 관련 규정의 유효기간을 5년 연장함으로써 수소자동차의 충전\n시설 구축을 가속화하고 대체에너지를 이용한 교통수단의 보급을 계\n속 지원하려는 것임(안",
    "제안이유_및_주요내용": "미세먼지 등 대기오염물질과 온실가스를 감축하기 위해 수소자동차,\n전기자동차 등 대체에너지를 이용한 교통수단이 널리 보급되고 있으\n며, 전기자동차의 충전시설이 광범위하게 보급된 것에 비해 수소자동\n차의 충전시설 등 인프라는 미흡한 실정임.\n때문에 환경부장관의 수소연료공급시설 설치계획의 승인 규정 및\n승인 시 각종 인ㆍ허가를 받은 것으로 의제하는 규정을 마련한 바 있\n으나, 해당 조항의 유효기간은 2025년 12월 31일부로 만료될 예정임.\n이에 관련 규정의 유효기간을 5년 연장함으로써 수소자동차의 충전\n시설 구축을 가속화하고 대체에너지를 이용한 교통수단의 보급을 계\n속 지원하려는 것임(안",
    "법률_제_호": "대기환경보전법 일부개정법률",
    "신구조문대비표": "현 행 개 정 안\n법률 제18028호 대기환경보전법 법률 제18028호 대기환경보전법\n일부개정법률"
  }
}