{
  "title": "2209008_유아교육법_일부개정법률안",
  "bill_number": "9008",
  "proposal_date": "2025. 3. 17.",
  "submission_date": "",
  "is_alternative": false,
  "alternative_bill_numbers": [],
  "has_comparison_table": false,
  "comparison_table": "신ㆍ구조문대비표\n현 행 개 정 안\n제11조(입학) ① ∼ ③ (생 략) 제11조(입학) ① ∼ ③ (현행과\n같음)\n<신 설> ④ 교육감은 육아를 지원하고\n임신과 출산을 장려하기 위하여\n필요한 경우 조례로 정하는 바에\n따라 다자녀(2인 이상), 쌍생\n아, 재학 유아의 형제․자매를\n우선적으로 선발할 수 있도록\n유아모집․선발계획을 수립하여\n공고할 수 있다.",
  "full_text": "유아교육법 일부개정법률안\n(곽규택의원 대표발의)\n발의연월일 : 2025. 3. 17.\n의 안\n9008\n번 호 발 의 자 : 곽규택ㆍ조배숙ㆍ조승환\n김대식ㆍ송석준ㆍ서지영\n강선영ㆍ진종오ㆍ이헌승\n이만희 의원(10인)\n제안이유 및 주요내용\n현행법 제11조에서는 지방자치단체가 유아의 모집․선발 시기, 절차\n및 방법 등을 조례로 정할 수 있도록 하고, 유치원 원장은 조례에서\n모집․선발 시기 등을 달리 정한 경우에는 이를 따르도록 규정하고\n있음.\n이에 따라, 각 지방자치단체는 조례로 교육감이 매년 유아모집․선\n발계획을 수립․공고하도록 하고 있고, 그에 맞춰 교육감은 우선모집\n대상 및 순위와 일반모집 대상을 정하여 유아모집․선발계획을 수\n립․공고하고 있음.\n그러나, 대부분의 지방자치단체 교육감이 모집대상과 순위를 정하면\n서 다자녀 가정(2인 이상), 쌍생아, 재학 유아의 형제․자매를 기타 4\n순위 이하 우선모집 대상으로 정하고 있어, 다자녀 가정 등의 형제․\n자매들이 같은 유치원에 입학하지 못하는 경우가 발생하여 각각 등하\n\n\n\n교와 유치원 상담 등 육아에 어려움이 있다는 지적이 있고, 임신과 출\n산을 장려하는 정부 시책에도 부응하지 못하고 있다는 지적이 있음.\n이에 교육감은 육아를 지원하고 임신과 출산을 장려하기 위하여 필\n요한 경우 조례로 정하는 바에 따라 다자녀(2인 이상), 쌍생아, 재학\n유아의 형제․자매를 우선적으로 선발할 수 있도록 유아모집․선발계\n획을 수립하여 공고할 수 있게 함으로써 이들 유아들의 육아를 지원\n하고 임신과 출산을 장려하려는 것임(안 제11조제4항 신설).\n\n법률 제 호\n유아교육법 일부개정법률안\n유아교육법 일부를 다음과 같이 개정한다.\n제11조에 제4항을 다음과 같이 신설한다.\n④ 교육감은 육아를 지원하고 임신과 출산을 장려하기 위하여 필요\n한 경우 조례로 정하는 바에 따라 다자녀(2인 이상), 쌍생아, 재학\n유아의 형제․자매를 우선적으로 선발할 수 있도록 유아모집․선발\n계획을 수립하여 공고할 수 있다.\n부 칙\n이 법은 공포한 날부터 시행한다.\n\n\n\n\n신ㆍ구조문대비표\n현 행 개 정 안\n제11조(입학) ① ∼ ③ (생 략) 제11조(입학) ① ∼ ③ (현행과\n같음)\n<신 설> ④ 교육감은 육아를 지원하고\n임신과 출산을 장려하기 위하여\n필요한 경우 조례로 정하는 바에\n따라 다자녀(2인 이상), 쌍생\n아, 재학 유아의 형제․자매를\n우선적으로 선발할 수 있도록\n유아모집․선발계획을 수립하여\n공고할 수 있다.\n",
  "sections": {
    "제안이유": "및",
    "주요내용": "현행법 제11조에서는 지방자치단체가 유아의 모집․선발 시기, 절차\n및 방법 등을 조례로 정할 수 있도록 하고, 유치원 원장은 조례에서\n모집․선발 시기 등을 달리 정한 경우에는 이를 따르도록 규정하고\n있음.\n이에 따라, 각 지방자치단체는 조례로 교육감이 매년 유아모집․선\n발계획을 수립․공고하도록 하고 있고, 그에 맞춰 교육감은 우선모집\n대상 및 순위와 일반모집 대상을 정하여 유아모집․선발계획을 수\n립․공고하고 있음.\n그러나, 대부분의 지방자치단체 교육감이 모집대상과 순위를 정하면\n서 다자녀 가정(2인 이상), 쌍생아, 재학 유아의 형제․자매를 기타 4\n순위 이하 우선모집 대상으로 정하고 있어, 다자녀 가정 등의 형제․\n자매들이 같은 유치원에 입학하지 못하는 경우가 발생하여 각각 등하\n\n\n\n교와 유치원 상담 등 육아에 어려움이 있다는 지적이 있고, 임신과 출\n산을 장려하는 정부 시책에도 부응하지 못하고 있다는 지적이 있음.\n이에 교육감은 육아를 지원하고 임신과 출산을 장려하기 위하여 필\n요한 경우 조례로 정하는 바에 따라 다자녀(2인 이상), 쌍생아, 재학\n유아의 형제․자매를 우선적으로 선발할 수 있도록 유아모집․선발계\n획을 수립하여 공고할 수 있게 함으로써 이들 유아들의 육아를 지원\n하고 임신과 출산을 장려하려는 것임(안 제11조제4항 신설).",
    "제안이유_및_주요내용": "현행법 제11조에서는 지방자치단체가 유아의 모집․선발 시기, 절차\n및 방법 등을 조례로 정할 수 있도록 하고, 유치원 원장은 조례에서\n모집․선발 시기 등을 달리 정한 경우에는 이를 따르도록 규정하고\n있음.\n이에 따라, 각 지방자치단체는 조례로 교육감이 매년 유아모집․선\n발계획을 수립․공고하도록 하고 있고, 그에 맞춰 교육감은 우선모집\n대상 및 순위와 일반모집 대상을 정하여 유아모집․선발계획을 수\n립․공고하고 있음.\n그러나, 대부분의 지방자치단체 교육감이 모집대상과 순위를 정하면\n서 다자녀 가정(2인 이상), 쌍생아, 재학 유아의 형제․자매를 기타 4\n순위 이하 우선모집 대상으로 정하고 있어, 다자녀 가정 등의 형제․\n자매들이 같은 유치원에 입학하지 못하는 경우가 발생하여 각각 등하\n\n\n\n교와 유치원 상담 등 육아에 어려움이 있다는 지적이 있고, 임신과 출\n산을 장려하는 정부 시책에도 부응하지 못하고 있다는 지적이 있음.\n이에 교육감은 육아를 지원하고 임신과 출산을 장려하기 위하여 필\n요한 경우 조례로 정하는 바에 따라 다자녀(2인 이상), 쌍생아, 재학\n유아의 형제․자매를 우선적으로 선발할 수 있도록 유아모집․선발계\n획을 수립하여 공고할 수 있게 함으로써 이들 유아들의 육아를 지원\n하고 임신과 출산을 장려하려는 것임(안 제11조제4항 신설).",
    "법률_제_호": "유아교육법 일부개정법률안\n유아교육법 일부를 다음과 같이 개정한다.\n제11조에 제4항을 다음과 같이 신설한다.\n④ 교육감은 육아를 지원하고 임신과 출산을 장려하기 위하여 필요\n한 경우 조례로 정하는 바에 따라 다자녀(2인 이상), 쌍생아, 재학\n유아의 형제․자매를 우선적으로 선발할 수 있도록 유아모집․선발\n계획을 수립하여 공고할 수 있다.",
    "신구조문대비표": "현 행 개 정 안\n제11조(입학) ① ∼ ③ (생 략) 제11조(입학) ① ∼ ③ (현행과\n같음)\n<신 설> ④ 교육감은 육아를 지원하고\n임신과 출산을 장려하기 위하여\n필요한 경우 조례로 정하는 바에\n따라 다자녀(2인 이상), 쌍생\n아, 재학 유아의 형제․자매를\n우선적으로 선발할 수 있도록\n유아모집․선발계획을 수립하여\n공고할 수 있다."
  }
}