{
  "title": "2209027_국경일에_관한_법률_일부개정법률안",
  "bill_number": "9027",
  "proposal_date": "2025. 3. 18.",
  "submission_date": "",
  "is_alternative": false,
  "alternative_bill_numbers": [],
  "has_comparison_table": false,
  "comparison_table": "신ㆍ구조문대비표\n현 행 개 정 안\n제2조(국경일의 종류) 국경일은 제2조(국경일의 종류) ----------\n다음 각 호와 같다. ----------------.\n1. 3ㆍ1절: 3월 1일 1. 3ㆍ1 독립선언일---------\n2. ∼ 5. (생 략) 2. ∼ 5. (현행과 같음)",
  "full_text": "국경일에 관한 법률 일부개정법률안\n(강경숙의원 대표발의)\n발의연월일 : 2025. 3. 18.\n의 안\n9027\n번 호 발 의 자 : 강경숙ㆍ신장식ㆍ정춘생\n문정복ㆍ김재원ㆍ김준혁\n김준형ㆍ서왕진ㆍ진선미\n백승아 의원(10인)\n제안이유 및 주요내용\n1919년 3월 1일 제국주의 일본의 식민통치를 거부하고 세계 만방에\n독립 의지를 공식적으로 천명함. 3ㆍ1운동은 단순한 대일항쟁이 아니\n라 독립국가로서 대한민국의 존재를 대외적으로 선언하고, 이후 대한\n민국 임시정부의 수립과 광복에 기틀을 마련한 역사적 사건임.\n그러나 대한민국 임시정부가 공식적으로 ‘독립선언일’로 명명한 기\n념일이 단순히 ‘3ㆍ1절’로 되어 있어 독립선언의 의미는 희석되고, 그\n본래의 역사적 의미를 온전히 담아내지 못하고 있다는 지적이 있음.\n대한민국의 정통성은 3ㆍ1 독립선언으로부터 시작되었음에도 불구하\n고, 해방 이후 친일 세력의 잔재가 청산되지 못하면서 3ㆍ1운동의 역\n사적 의미가 점차 축소되었음.\n이에 3ㆍ1절의 명칭을 3ㆍ1 독립선언일로 변경하여 해당 국경일의\n의미와 대한민국의 정통성과 법통이 1919년 3월 1일에 시작되었음을\n\n\n\n명확히 하려는 것임(안 제2조제1호).\n\n법률 제 호\n국경일에 관한 법률 일부개정법률안\n국경일에 관한 법률 일부를 다음과 같이 개정한다.\n제2조제1호 중 “3ㆍ1절”을 “3ㆍ1 독립선언일”로 한다.\n부 칙\n제1조(시행일) 이 법은 공포한 날부터 시행한다.\n제2조(다른 법률의 개정) 공휴일에 관한 법률 일부를 다음과 같이 개\n정한다.\n제2조제1호 중 “3ㆍ1절”을 “3ㆍ1 독립선언일”로 한다.\n\n\n\n\n신ㆍ구조문대비표\n현 행 개 정 안\n제2조(국경일의 종류) 국경일은 제2조(국경일의 종류) ----------\n다음 각 호와 같다. ----------------.\n1. 3ㆍ1절: 3월 1일 1. 3ㆍ1 독립선언일---------\n2. ∼ 5. (생 략) 2. ∼ 5. (현행과 같음)\n",
  "sections": {
    "제안이유": "및",
    "주요내용": "1919년 3월 1일 제국주의 일본의 식민통치를 거부하고 세계 만방에\n독립 의지를 공식적으로 천명함. 3ㆍ1운동은 단순한 대일항쟁이 아니\n라 독립국가로서 대한민국의 존재를 대외적으로 선언하고, 이후 대한\n민국 임시정부의 수립과 광복에 기틀을 마련한 역사적 사건임.\n그러나 대한민국 임시정부가 공식적으로 ‘독립선언일’로 명명한 기\n념일이 단순히 ‘3ㆍ1절’로 되어 있어 독립선언의 의미는 희석되고, 그\n본래의 역사적 의미를 온전히 담아내지 못하고 있다는 지적이 있음.\n대한민국의 정통성은 3ㆍ1 독립선언으로부터 시작되었음에도 불구하\n고, 해방 이후 친일 세력의 잔재가 청산되지 못하면서 3ㆍ1운동의 역\n사적 의미가 점차 축소되었음.\n이에 3ㆍ1절의 명칭을 3ㆍ1 독립선언일로 변경하여 해당 국경일의\n의미와 대한민국의 정통성과 법통이 1919년 3월 1일에 시작되었음을\n\n\n\n명확히 하려는 것임(안 제2조제1호).",
    "제안이유_및_주요내용": "1919년 3월 1일 제국주의 일본의 식민통치를 거부하고 세계 만방에\n독립 의지를 공식적으로 천명함. 3ㆍ1운동은 단순한 대일항쟁이 아니\n라 독립국가로서 대한민국의 존재를 대외적으로 선언하고, 이후 대한\n민국 임시정부의 수립과 광복에 기틀을 마련한 역사적 사건임.\n그러나 대한민국 임시정부가 공식적으로 ‘독립선언일’로 명명한 기\n념일이 단순히 ‘3ㆍ1절’로 되어 있어 독립선언의 의미는 희석되고, 그\n본래의 역사적 의미를 온전히 담아내지 못하고 있다는 지적이 있음.\n대한민국의 정통성은 3ㆍ1 독립선언으로부터 시작되었음에도 불구하\n고, 해방 이후 친일 세력의 잔재가 청산되지 못하면서 3ㆍ1운동의 역\n사적 의미가 점차 축소되었음.\n이에 3ㆍ1절의 명칭을 3ㆍ1 독립선언일로 변경하여 해당 국경일의\n의미와 대한민국의 정통성과 법통이 1919년 3월 1일에 시작되었음을\n\n\n\n명확히 하려는 것임(안 제2조제1호).",
    "법률_제_호": "국경일에 관한 법률 일부개정법률안\n국경일에 관한 법률 일부를 다음과 같이 개정한다.\n제2조제1호 중 “3ㆍ1절”을 “3ㆍ1 독립선언일”로 한다.",
    "신구조문대비표": "현 행 개 정 안\n제2조(국경일의 종류) 국경일은 제2조(국경일의 종류) ----------\n다음 각 호와 같다. ----------------.\n1. 3ㆍ1절: 3월 1일 1. 3ㆍ1 독립선언일---------\n2. ∼ 5. (생 략) 2. ∼ 5. (현행과 같음)"
  }
}