{
  "title": "2209023_평생교육법_일부개정법률안",
  "bill_number": "9023",
  "proposal_date": "2025. 3. 18.",
  "submission_date": "",
  "is_alternative": false,
  "alternative_bill_numbers": [],
  "has_comparison_table": false,
  "comparison_table": "신ㆍ구조문대비표\n현 행 개 정 안\n제39조(문해교육의 실시 등) ① 제39조(문해교육의 실시 등) ①\n∼ ③ (생 략) ∼ ③ (현행과 같음)\n<신 설> ④ 한글 문해교육에 필요한 수\n업료, 교재비ㆍ교구비 등의 비\n용은 무상으로 한다. 이 경우\n해당 비용은 국가 및 지방자치\n단체가 부담한다.",
  "full_text": "평생교육법 일부개정법률안\n(이건태의원 대표발의)\n발의연월일 : 2025. 3. 18.\n의 안\n9023\n번 호 발 의 자 : 이건태ㆍ김 윤ㆍ박지원\n이재관ㆍ김승원ㆍ정진욱\n권향엽ㆍ이기헌ㆍ강준현\n문진석ㆍ황정아ㆍ최민희\n이병진ㆍ이정헌ㆍ김문수\n이원택ㆍ윤준병ㆍ이용우\n문금주 의원(19인)\n제안이유 및 주요내용\n현행법은 성인이 일상생활을 영위하는 데 필요한 한글 문해교육의\n실시 근거를 두고 국가 및 지방자치단체로 하여금 경비를 지원할 수\n있도록 규정하고 있음.\n그러나 한글 문해교육 프로그램 운영비, 교재비ㆍ교구비, 교원의 인\n건비 및 연수비 등 현행법령에 따른 재정적 지원에도 프로그램 실시\n기관에서 문해교육에 참여하는 수강생으로부터 별도의 수업료 등을\n받는 경우가 있고, 이로 인해 일상생활에 불편을 겪고 있는 비문해자\n가 경제적인 부담으로 프로그램 참여를 주저하거나 포기하는 사례가\n발생하고 있음.\n한글 문해교육은 국민의 기본권을 보장하고 사회생활을 영위하는\n\n\n\n데 필요한 필수 지원에 해당하는 바, 개정안은 한글 문해교육 참여자\n가 부담하는 수업료, 교재비ㆍ교구비 등의 비용을 무상으로 하고 해당\n비용은 국가 및 지방자치단체가 부담하도록 함으로써 비문해자에게\n실질적인 배움의 기회를 보장하고자 하는 것임(안 제39조제4항 신설).\n\n법률 제 호\n평생교육법 일부개정법률안\n평생교육법 일부를 다음과 같이 개정한다.\n제39조에 제4항을 다음과 같이 신설한다.\n④ 한글 문해교육에 필요한 수업료, 교재비ㆍ교구비 등의 비용은 무\n상으로 한다. 이 경우 해당 비용은 국가 및 지방자치단체가 부담한\n다.\n부 칙\n이 법은 2026년 1월 1일부터 시행한다.\n\n\n\n\n신ㆍ구조문대비표\n현 행 개 정 안\n제39조(문해교육의 실시 등) ① 제39조(문해교육의 실시 등) ①\n∼ ③ (생 략) ∼ ③ (현행과 같음)\n<신 설> ④ 한글 문해교육에 필요한 수\n업료, 교재비ㆍ교구비 등의 비\n용은 무상으로 한다. 이 경우\n해당 비용은 국가 및 지방자치\n단체가 부담한다.\n",
  "sections": {
    "제안이유": "및",
    "주요내용": "현행법은 성인이 일상생활을 영위하는 데 필요한 한글 문해교육의\n실시 근거를 두고 국가 및 지방자치단체로 하여금 경비를 지원할 수\n있도록 규정하고 있음.\n그러나 한글 문해교육 프로그램 운영비, 교재비ㆍ교구비, 교원의 인\n건비 및 연수비 등 현행법령에 따른 재정적 지원에도 프로그램 실시\n기관에서 문해교육에 참여하는 수강생으로부터 별도의 수업료 등을\n받는 경우가 있고, 이로 인해 일상생활에 불편을 겪고 있는 비문해자\n가 경제적인 부담으로 프로그램 참여를 주저하거나 포기하는 사례가\n발생하고 있음.\n한글 문해교육은 국민의 기본권을 보장하고 사회생활을 영위하는\n\n\n\n데 필요한 필수 지원에 해당하는 바, 개정안은 한글 문해교육 참여자\n가 부담하는 수업료, 교재비ㆍ교구비 등의 비용을 무상으로 하고 해당\n비용은 국가 및 지방자치단체가 부담하도록 함으로써 비문해자에게\n실질적인 배움의 기회를 보장하고자 하는 것임(안 제39조제4항 신설).",
    "제안이유_및_주요내용": "현행법은 성인이 일상생활을 영위하는 데 필요한 한글 문해교육의\n실시 근거를 두고 국가 및 지방자치단체로 하여금 경비를 지원할 수\n있도록 규정하고 있음.\n그러나 한글 문해교육 프로그램 운영비, 교재비ㆍ교구비, 교원의 인\n건비 및 연수비 등 현행법령에 따른 재정적 지원에도 프로그램 실시\n기관에서 문해교육에 참여하는 수강생으로부터 별도의 수업료 등을\n받는 경우가 있고, 이로 인해 일상생활에 불편을 겪고 있는 비문해자\n가 경제적인 부담으로 프로그램 참여를 주저하거나 포기하는 사례가\n발생하고 있음.\n한글 문해교육은 국민의 기본권을 보장하고 사회생활을 영위하는\n\n\n\n데 필요한 필수 지원에 해당하는 바, 개정안은 한글 문해교육 참여자\n가 부담하는 수업료, 교재비ㆍ교구비 등의 비용을 무상으로 하고 해당\n비용은 국가 및 지방자치단체가 부담하도록 함으로써 비문해자에게\n실질적인 배움의 기회를 보장하고자 하는 것임(안 제39조제4항 신설).",
    "법률_제_호": "평생교육법 일부개정법률안\n평생교육법 일부를 다음과 같이 개정한다.\n제39조에 제4항을 다음과 같이 신설한다.\n④ 한글 문해교육에 필요한 수업료, 교재비ㆍ교구비 등의 비용은 무\n상으로 한다. 이 경우 해당 비용은 국가 및 지방자치단체가 부담한\n다.",
    "신구조문대비표": "현 행 개 정 안\n제39조(문해교육의 실시 등) ① 제39조(문해교육의 실시 등) ①\n∼ ③ (생 략) ∼ ③ (현행과 같음)\n<신 설> ④ 한글 문해교육에 필요한 수\n업료, 교재비ㆍ교구비 등의 비\n용은 무상으로 한다. 이 경우\n해당 비용은 국가 및 지방자치\n단체가 부담한다."
  }
}