{
  "title": "2209636_사면법_일부개정법률안",
  "bill_number": "9636",
  "proposal_date": "",
  "submission_date": "2025. 4. 7.",
  "is_alternative": false,
  "alternative_bill_numbers": [],
  "has_comparison_table": false,
  "comparison_table": "신ㆍ구조문대비표\n현 행 개 정 안\n<신 설> 제6조의2(사면의 제한) 사면은\n다음 각 호에 해당한 자에 대\n하여는 하지 아니한다.\n1. 「헌정질서 파괴범죄의 공\n소시효 등에 관한 특례법」\n제2조의 헌정질서파괴 범죄\n자\n2. 「헌법재판소법」 제4장제2\n절의 탄핵심판을 받은 자\n3. 「민법」 제779조에 따른\n대통령 가족",
  "full_text": "사면법 일부개정법률안\n(이개호의원 대표발의)\n제안연월일 : 2025. 4. 7.\n의 안\n9636\n번 호 발 의 자 : 이개호ㆍ서영교ㆍ문금주\n이정문ㆍ민형배ㆍ박희승\n황명선ㆍ정진욱ㆍ박수현\n조계원 의원(10인)\n제안이유 및 주요내용\n우리나라 사면권 행사에 대한 지금까지의 관행을 살펴보면 새로운\n대통령의 취임과 경축일 등을 기하여 너무 자주 사용되는 등 연례행\n사처럼 반복되어 법을 위반해도 다음 경축일에 사면될 것이라는 기대\n감을 가지게 되는 등 대통령의 사면권 행사가 사법권의 침해가 될 수\n있고, 결국 형벌권 행사를 제한함으로써 정당한 형벌 목적이 실현되는\n것이 방해될 수 있음.\n따라서 사면은 사법적 책임에 대하여 전면적ㆍ부분적인 변경을 야\n기하므로 제한된 범위에서만 실시되어야 한다는 의견이 많았음.\n이에 헌정질서를 파괴하거나 국헌을 문란하게 하는 범죄자와 탄핵\n심판을 받은 자, 그리고 사면권을 행사하는 대통령의 가족에 대해서는\n사면을 하지 못하도록 제한함으로써 형벌 목적을 달성시키고자 하는\n것임(안 제6조의2).\n\n\n\n\n법률 제 호\n사면법 일부개정법률안\n사면법 일부를 다음과 같이 개정한다.\n제6조의2를 신설한다.\n제6조의2(사면의 제한) 사면은 다음 각 호에 해당한 자에 대하여는 하\n지 아니한다.\n1. 「헌정질서 파괴범죄의 공소시효 등에 관한 특례법」 제2조의 헌\n정질서파괴 범죄자\n2. 「헌법재판소법」 제4장제2절의 탄핵심판을 받은 자\n3. 「민법」 제779조에 따른 대통령 가족\n부 칙\n이 법은 공포 후 6개월이 경과한 날부터 시행한다.\n\n\n\n\n신ㆍ구조문대비표\n현 행 개 정 안\n<신 설> 제6조의2(사면의 제한) 사면은\n다음 각 호에 해당한 자에 대\n하여는 하지 아니한다.\n1. 「헌정질서 파괴범죄의 공\n소시효 등에 관한 특례법」\n제2조의 헌정질서파괴 범죄\n자\n2. 「헌법재판소법」 제4장제2\n절의 탄핵심판을 받은 자\n3. 「민법」 제779조에 따른\n대통령 가족\n",
  "sections": {
    "제안이유": "및",
    "주요내용": "우리나라 사면권 행사에 대한 지금까지의 관행을 살펴보면 새로운\n대통령의 취임과 경축일 등을 기하여 너무 자주 사용되는 등 연례행\n사처럼 반복되어 법을 위반해도 다음 경축일에 사면될 것이라는 기대\n감을 가지게 되는 등 대통령의 사면권 행사가 사법권의 침해가 될 수\n있고, 결국 형벌권 행사를 제한함으로써 정당한 형벌 목적이 실현되는\n것이 방해될 수 있음.\n따라서 사면은 사법적 책임에 대하여 전면적ㆍ부분적인 변경을 야\n기하므로 제한된 범위에서만 실시되어야 한다는 의견이 많았음.\n이에 헌정질서를 파괴하거나 국헌을 문란하게 하는 범죄자와 탄핵\n심판을 받은 자, 그리고 사면권을 행사하는 대통령의 가족에 대해서는\n사면을 하지 못하도록 제한함으로써 형벌 목적을 달성시키고자 하는\n것임(안 제6조의2).",
    "제안이유_및_주요내용": "우리나라 사면권 행사에 대한 지금까지의 관행을 살펴보면 새로운\n대통령의 취임과 경축일 등을 기하여 너무 자주 사용되는 등 연례행\n사처럼 반복되어 법을 위반해도 다음 경축일에 사면될 것이라는 기대\n감을 가지게 되는 등 대통령의 사면권 행사가 사법권의 침해가 될 수\n있고, 결국 형벌권 행사를 제한함으로써 정당한 형벌 목적이 실현되는\n것이 방해될 수 있음.\n따라서 사면은 사법적 책임에 대하여 전면적ㆍ부분적인 변경을 야\n기하므로 제한된 범위에서만 실시되어야 한다는 의견이 많았음.\n이에 헌정질서를 파괴하거나 국헌을 문란하게 하는 범죄자와 탄핵\n심판을 받은 자, 그리고 사면권을 행사하는 대통령의 가족에 대해서는\n사면을 하지 못하도록 제한함으로써 형벌 목적을 달성시키고자 하는\n것임(안 제6조의2).",
    "법률_제_호": "사면법 일부개정법률안\n사면법 일부를 다음과 같이 개정한다.\n제6조의2를 신설한다.\n제6조의2(사면의 제한) 사면은 다음 각 호에 해당한 자에 대하여는 하\n지 아니한다.\n1. 「헌정질서 파괴범죄의 공소시효 등에 관한 특례법」 제2조의 헌\n정질서파괴 범죄자\n2. 「헌법재판소법」 제4장제2절의 탄핵심판을 받은 자\n3. 「민법」 제779조에 따른 대통령 가족",
    "신구조문대비표": "현 행 개 정 안\n<신 설> 제6조의2(사면의 제한) 사면은\n다음 각 호에 해당한 자에 대\n하여는 하지 아니한다.\n1. 「헌정질서 파괴범죄의 공\n소시효 등에 관한 특례법」\n제2조의 헌정질서파괴 범죄\n자\n2. 「헌법재판소법」 제4장제2\n절의 탄핵심판을 받은 자\n3. 「민법」 제779조에 따른\n대통령 가족"
  }
}