{
  "title": "2209006_소년법_일부개정법률안",
  "bill_number": "9006",
  "proposal_date": "2025. 3. 17.",
  "submission_date": "",
  "is_alternative": false,
  "alternative_bill_numbers": [],
  "has_comparison_table": false,
  "comparison_table": "신ㆍ구조문대비표\n현 행 개 정 안\n<신 설> 제18조의2(상담ㆍ교육 등) ① 소\n년부 판사는 조사 또는 심리\n중인 사건 본인에 대하여 비행\n방지 및 피해자 등의 보호를\n위하여 필요하다고 인정하는\n경우에는 소년의 상담ㆍ선도ㆍ\n교화와 관련된 단체나 시설에\n서의 상담ㆍ교육을 받을 것을\n명할 수 있다.\n② 제1항에 따른 상담ㆍ교육은\n40시간을 초과하지 못한다.",
  "full_text": "소년법 일부개정법률안\n(곽규택의원 대표발의)\n발의연월일 : 2025. 3. 17.\n의 안\n9006\n번 호 발 의 자 : 곽규택ㆍ조배숙ㆍ조승환\n김대식ㆍ송석준ㆍ서지영\n진종오ㆍ이헌승ㆍ정성국\n강선영ㆍ이만희 의원\n(11인)\n제안이유\n현행법은 소년부 판사가 사건을 조사 또는 심리하는 데 필요하다고\n인정하는 경우 소년 감호에 관한 결정으로써 보호자, 소년을 보호할\n수 있는 적당한 자 또는 시설에 위탁, 병원이나 그 밖의 요양소에 위\n탁, 소년분류심사원에 위탁하는 임시조치를 할 수 있도록 하고 있음.\n이러한 위탁 방식으로 인해 2023년 기준 임시조치 부과율은 15.2%\n(보호자 등 위탁 9.3%, 분류심사원 위탁 5.9%)에 그치고 있어 그 부과\n를 받지 않은 대부분의 비행 소년들이 법원의 보호처분이 이뤄지기\n전까지 실효적인 임시조치를 받지 못해 재비행을 반복하는 사례가 다\n수 발생하고 있고, 분류심사원 등 시설에 일률적으로 위탁하는 것도\n과도한 수용 처우로 볼 수 있다는 의견이 있어 일부 소년부 판사들은\n「소년법」 제18조제1항제1호에 근거하여 임시조치 성격인 ‘청소년비\n행예방센터 대안교육’을 처분적 대안교육의 일환으로 명령하고 있으나\n\n\n\n명확한 법규정 미비로 의뢰 건수가 미미한 실정임.\n이에 임시조치 방법으로 현재 법원에서 의뢰하는 처분 전 대안교육\n의 의뢰시간 등을 고려한 ‘상담ㆍ교육’ 항목을 신설하여 초기 비행소\n년의 재비행을 예방하고 처분적 대안교육을 활성화하기 위한 근거 규\n정을 마련하고자 하는 것임.\n주요내용\n소년부 판사는 조사 또는 심리 중인 사건 본인에 대하여 비행방지\n및 피해자 등의 보호를 위하여 필요하다고 인정하는 경우에는 소년\n의 상담ㆍ선도ㆍ교화와 관련된 단체나 시설에서의 상담ㆍ교육을 받\n을 것을 명할 수 있도록 하고, 상담교육은 40시간을 초과하지 않도록\n함(안 제18조의2 신설).\n\n법률 제 호\n소년법 일부개정법률안\n소년법 일부를 다음과 같이 개정한다.\n제18조의2를 다음과 같이 신설한다.\n제18조의2(상담ㆍ교육 등) ① 소년부 판사는 조사 또는 심리 중인 사\n건 본인에 대하여 비행방지 및 피해자 등의 보호를 위하여 필요하\n다고 인정하는 경우에는 소년의 상담ㆍ선도ㆍ교화와 관련된 단체나\n시설에서의 상담ㆍ교육을 받을 것을 명할 수 있다.\n② 제1항에 따른 상담ㆍ교육은 40시간을 초과하지 못한다.\n부 칙\n제1조(시행일) 이 법은 공포 후 3개월이 경과한 날부터 시행한다.\n제2조(상담ㆍ교육 등에 관한 적용례) 제18조의2의 개정규정은 이 법\n시행 당시 조사 또는 심리 중에 있는 보호사건에 대하여도 적용한\n다.\n\n\n\n\n신ㆍ구조문대비표\n현 행 개 정 안\n<신 설> 제18조의2(상담ㆍ교육 등) ① 소\n년부 판사는 조사 또는 심리\n중인 사건 본인에 대하여 비행\n방지 및 피해자 등의 보호를\n위하여 필요하다고 인정하는\n경우에는 소년의 상담ㆍ선도ㆍ\n교화와 관련된 단체나 시설에\n서의 상담ㆍ교육을 받을 것을\n명할 수 있다.\n② 제1항에 따른 상담ㆍ교육은\n40시간을 초과하지 못한다.\n",
  "sections": {
    "제안이유": "현행법은 소년부 판사가 사건을 조사 또는 심리하는 데 필요하다고\n인정하는 경우 소년 감호에 관한 결정으로써 보호자, 소년을 보호할\n수 있는 적당한 자 또는 시설에 위탁, 병원이나 그 밖의 요양소에 위\n탁, 소년분류심사원에 위탁하는 임시조치를 할 수 있도록 하고 있음.\n이러한 위탁 방식으로 인해 2023년 기준 임시조치 부과율은 15.2%\n(보호자 등 위탁 9.3%, 분류심사원 위탁 5.9%)에 그치고 있어 그 부과\n를 받지 않은 대부분의 비행 소년들이 법원의 보호처분이 이뤄지기\n전까지 실효적인 임시조치를 받지 못해 재비행을 반복하는 사례가 다\n수 발생하고 있고, 분류심사원 등 시설에 일률적으로 위탁하는 것도\n과도한 수용 처우로 볼 수 있다는 의견이 있어 일부 소년부 판사들은\n「소년법」 제18조제1항제1호에 근거하여 임시조치 성격인 ‘청소년비\n행예방센터 대안교육’을 처분적 대안교육의 일환으로 명령하고 있으나\n\n\n\n명확한 법규정 미비로 의뢰 건수가 미미한 실정임.\n이에 임시조치 방법으로 현재 법원에서 의뢰하는 처분 전 대안교육\n의 의뢰시간 등을 고려한 ‘상담ㆍ교육’ 항목을 신설하여 초기 비행소\n년의 재비행을 예방하고 처분적 대안교육을 활성화하기 위한 근거 규\n정을 마련하고자 하는 것임.",
    "주요내용": "소년부 판사는 조사 또는 심리 중인 사건 본인에 대하여 비행방지\n및 피해자 등의 보호를 위하여 필요하다고 인정하는 경우에는 소년\n의 상담ㆍ선도ㆍ교화와 관련된 단체나 시설에서의 상담ㆍ교육을 받\n을 것을 명할 수 있도록 하고, 상담교육은 40시간을 초과하지 않도록\n함(안 제18조의2 신설).",
    "법률_제_호": "소년법 일부개정법률안\n소년법 일부를 다음과 같이 개정한다.\n제18조의2를 다음과 같이 신설한다.\n제18조의2(상담ㆍ교육 등) ① 소년부 판사는 조사 또는 심리 중인 사\n건 본인에 대하여 비행방지 및 피해자 등의 보호를 위하여 필요하\n다고 인정하는 경우에는 소년의 상담ㆍ선도ㆍ교화와 관련된 단체나\n시설에서의 상담ㆍ교육을 받을 것을 명할 수 있다.\n② 제1항에 따른 상담ㆍ교육은 40시간을 초과하지 못한다.",
    "신구조문대비표": "현 행 개 정 안\n<신 설> 제18조의2(상담ㆍ교육 등) ① 소\n년부 판사는 조사 또는 심리\n중인 사건 본인에 대하여 비행\n방지 및 피해자 등의 보호를\n위하여 필요하다고 인정하는\n경우에는 소년의 상담ㆍ선도ㆍ\n교화와 관련된 단체나 시설에\n서의 상담ㆍ교육을 받을 것을\n명할 수 있다.\n② 제1항에 따른 상담ㆍ교육은\n40시간을 초과하지 못한다."
  }
}