{
  "title": "2209562_국민건강보험법_일부개정법률안",
  "bill_number": "9562",
  "proposal_date": "2025. 4. 3.",
  "submission_date": "",
  "is_alternative": false,
  "alternative_bill_numbers": [],
  "has_comparison_table": false,
  "comparison_table": "신ㆍ구조문대비표\n현 행 개 정 안\n<신 설> 제44조의2(투석의 본인일부부담\n금에 대한 특례) 제44조제1항\n에도 불구하고 가입자 또는 피\n부양자가 요양급여로 투석(透\n析)을 받는 경우에는 가입자\n또는 피부양자 본인이 해당 요\n양급여비용 총액의 100분의 5\n를 부담한다.",
  "full_text": "국민건강보험법 일부개정법률안\n(이병진의원 대표발의)\n발의연월일 : 2025. 4. 3.\n의 안\n9562\n번 호 발 의 자 : 이병진ㆍ박 정ㆍ윤후덕\n최기상ㆍ이훈기ㆍ남인순\n권향엽ㆍ문대림ㆍ허성무\n박용갑ㆍ강준현ㆍ임미애\n김영호ㆍ이원택 의원\n(14인)\n제안이유 및 주요내용\n현행 산정특례제도는 질환에 따라 특례의 기간과 진료비의 본인부\n담률을 상이하게 규정하고 있음. 그 중 희귀질환은 특례기간 5년, 본\n인부담률 10%이며, 특례기간이 지난 후에도 산정특례를 추가로 받고\n자 하는 경우에는 특례기간 말소 전에 재등록을 하여야 함.\n다만 만성 신장병 환자들은 투석을 받는 자체로 일상 및 직장 생활\n에도 큰 지장을 받는바, 본인부담률을 5%로 줄여 환자들의 경제적 부\n담을 덜어줘야 한다는 의견이 제기되고 있음.\n또한 만성 신장병 환자의 경우에는 진단을 받은 이후부터는 신장\n이식을 받지 않는 이상 평생 투석을 받아야 하기에, 특례기간을 별도\n로 규정하는 것은 환자의 불편을 야기할 뿐만 아니라 행정상으로도\n효율적이지 못한 것으로 보임.\n\n\n\n이에 건강보험급여나 의료급여로 투석(透析)을 받는 경우에는 본인\n부담률을 5%로 낮추고, 별도의 특례기간 없이 산정특례를 적용하려는\n것임(안 제44조의2 신설).\n참고사항\n이 법률안은 이병진의원이 대표발의한 「의료급여법 일부개정법률\n안」(의안번호 제9561호)의 의결을 전제로 하는 것이므로 같은 법률안\n이 의결되지 아니하거나 수정의결되는 경우에는 이에 맞추어 조정되\n어야 할 것임.\n\n법률 제 호\n국민건강보험법 일부개정법률안\n국민건강보험법 일부를 다음과 같이 개정한다.\n제44조의2를 다음과 같이 신설한다.\n제44조의2(투석의 본인일부부담금에 대한 특례) 제44조제1항에도 불구\n하고 가입자 또는 피부양자가 요양급여로 투석(透析)을 받는 경우에\n는 가입자 또는 피부양자 본인이 해당 요양급여비용 총액의 100분\n의 5를 부담한다.\n부 칙\n이 법은 공포한 날부터 시행한다.\n\n\n\n\n신ㆍ구조문대비표\n현 행 개 정 안\n<신 설> 제44조의2(투석의 본인일부부담\n금에 대한 특례) 제44조제1항\n에도 불구하고 가입자 또는 피\n부양자가 요양급여로 투석(透\n析)을 받는 경우에는 가입자\n또는 피부양자 본인이 해당 요\n양급여비용 총액의 100분의 5\n를 부담한다.\n",
  "sections": {
    "제안이유": "및",
    "주요내용": "현행 산정특례제도는 질환에 따라 특례의 기간과 진료비의 본인부\n담률을 상이하게 규정하고 있음. 그 중 희귀질환은 특례기간 5년, 본\n인부담률 10%이며, 특례기간이 지난 후에도 산정특례를 추가로 받고\n자 하는 경우에는 특례기간 말소 전에 재등록을 하여야 함.\n다만 만성 신장병 환자들은 투석을 받는 자체로 일상 및 직장 생활\n에도 큰 지장을 받는바, 본인부담률을 5%로 줄여 환자들의 경제적 부\n담을 덜어줘야 한다는 의견이 제기되고 있음.\n또한 만성 신장병 환자의 경우에는 진단을 받은 이후부터는 신장\n이식을 받지 않는 이상 평생 투석을 받아야 하기에, 특례기간을 별도\n로 규정하는 것은 환자의 불편을 야기할 뿐만 아니라 행정상으로도\n효율적이지 못한 것으로 보임.\n\n\n\n이에 건강보험급여나 의료급여로 투석(透析)을 받는 경우에는 본인\n부담률을 5%로 낮추고, 별도의 특례기간 없이 산정특례를 적용하려는\n것임(안 제44조의2 신설).",
    "제안이유_및_주요내용": "현행 산정특례제도는 질환에 따라 특례의 기간과 진료비의 본인부\n담률을 상이하게 규정하고 있음. 그 중 희귀질환은 특례기간 5년, 본\n인부담률 10%이며, 특례기간이 지난 후에도 산정특례를 추가로 받고\n자 하는 경우에는 특례기간 말소 전에 재등록을 하여야 함.\n다만 만성 신장병 환자들은 투석을 받는 자체로 일상 및 직장 생활\n에도 큰 지장을 받는바, 본인부담률을 5%로 줄여 환자들의 경제적 부\n담을 덜어줘야 한다는 의견이 제기되고 있음.\n또한 만성 신장병 환자의 경우에는 진단을 받은 이후부터는 신장\n이식을 받지 않는 이상 평생 투석을 받아야 하기에, 특례기간을 별도\n로 규정하는 것은 환자의 불편을 야기할 뿐만 아니라 행정상으로도\n효율적이지 못한 것으로 보임.\n\n\n\n이에 건강보험급여나 의료급여로 투석(透析)을 받는 경우에는 본인\n부담률을 5%로 낮추고, 별도의 특례기간 없이 산정특례를 적용하려는\n것임(안 제44조의2 신설).",
    "법률_제_호": "국민건강보험법 일부개정법률안\n국민건강보험법 일부를 다음과 같이 개정한다.\n제44조의2를 다음과 같이 신설한다.\n제44조의2(투석의 본인일부부담금에 대한 특례) 제44조제1항에도 불구\n하고 가입자 또는 피부양자가 요양급여로 투석(透析)을 받는 경우에\n는 가입자 또는 피부양자 본인이 해당 요양급여비용 총액의 100분\n의 5를 부담한다.",
    "신구조문대비표": "현 행 개 정 안\n<신 설> 제44조의2(투석의 본인일부부담\n금에 대한 특례) 제44조제1항\n에도 불구하고 가입자 또는 피\n부양자가 요양급여로 투석(透\n析)을 받는 경우에는 가입자\n또는 피부양자 본인이 해당 요\n양급여비용 총액의 100분의 5\n를 부담한다."
  }
}