{
  "title": "2209227_태권도_진흥_및_태권도공원_조성_등에_관한_법률_일부개정법률안",
  "bill_number": "9227",
  "proposal_date": "2025. 3. 21.",
  "submission_date": "",
  "is_alternative": false,
  "alternative_bill_numbers": [],
  "has_comparison_table": false,
  "comparison_table": "신ㆍ구조문대비표\n현 행 개 정 안\n제9조(태권도공원의 조성) ①ㆍ② 제9조(태권도공원의 조성) ①ㆍ②\n(생 략) (현행과 같음)\n<신 설> ③ 공원에는 이용자의 안전을\n확보하고 응급환자 발생에 효\n과적으로 대처하기 위하여 필\n요한 의료 인력을 둘 수 있다.",
  "full_text": "태권도 진흥 및 태권도공원 조성 등에 관한 법률\n일부개정법률안\n(민형배의원 대표발의)\n발의연월일 : 2025. 3. 21.\n의 안\n9227\n번 호 발 의 자 : 민형배ㆍ정동영ㆍ김동아\n양부남ㆍ이개호ㆍ김문수\n안도걸ㆍ조계원ㆍ장경태\n강유정ㆍ소병훈 의원\n(11인)\n제안이유 및 주요내용\n태권도공원에 의료 인력을 배치하고자 합니다.\n태권도공원은 체육시설, 숙박시설, 상업시설, 전시시설 등이 공존하\n는 복합시설로, 태권도 보급ㆍ연구ㆍ전시ㆍ수련, 지도자 양성 등 역할\n을 합니다. 연간 방문객이 22년 24만 명, 23년 31만 명, 24년 29만 명\n이지만, 응급상황에 대처할 인력이 없습니다. 근거리에 의료시설도 없\n습니다.\n이에 태권도공원 내에 의료 인력 배치 근거를 마련하여, 태권도공원\n이용자의 안전을 도모하고자 합니다(안 제9조제3항 신설).\n\n\n\n\n법률 제 호\n태권도 진흥 및 태권도공원 조성 등에 관한 법률\n일부개정법률안\n태권도 진흥 및 태권도공원 조성 등에 관한 법률 일부를 다음과 같이\n개정한다.\n제9조에 제3항을 다음과 같이 신설한다.\n③ 공원에는 이용자의 안전을 확보하고 응급환자 발생에 효과적으\n로 대처하기 위하여 필요한 의료 인력을 둘 수 있다.\n부 칙\n이 법은 공포 후 6개월이 경과한 날부터 시행한다.\n\n\n\n\n신ㆍ구조문대비표\n현 행 개 정 안\n제9조(태권도공원의 조성) ①ㆍ② 제9조(태권도공원의 조성) ①ㆍ②\n(생 략) (현행과 같음)\n<신 설> ③ 공원에는 이용자의 안전을\n확보하고 응급환자 발생에 효\n과적으로 대처하기 위하여 필\n요한 의료 인력을 둘 수 있다.\n",
  "sections": {
    "제안이유": "및",
    "주요내용": "태권도공원에 의료 인력을 배치하고자 합니다.\n태권도공원은 체육시설, 숙박시설, 상업시설, 전시시설 등이 공존하\n는 복합시설로, 태권도 보급ㆍ연구ㆍ전시ㆍ수련, 지도자 양성 등 역할\n을 합니다. 연간 방문객이 22년 24만 명, 23년 31만 명, 24년 29만 명\n이지만, 응급상황에 대처할 인력이 없습니다. 근거리에 의료시설도 없\n습니다.\n이에 태권도공원 내에 의료 인력 배치 근거를 마련하여, 태권도공원\n이용자의 안전을 도모하고자 합니다(안 제9조제3항 신설).",
    "제안이유_및_주요내용": "태권도공원에 의료 인력을 배치하고자 합니다.\n태권도공원은 체육시설, 숙박시설, 상업시설, 전시시설 등이 공존하\n는 복합시설로, 태권도 보급ㆍ연구ㆍ전시ㆍ수련, 지도자 양성 등 역할\n을 합니다. 연간 방문객이 22년 24만 명, 23년 31만 명, 24년 29만 명\n이지만, 응급상황에 대처할 인력이 없습니다. 근거리에 의료시설도 없\n습니다.\n이에 태권도공원 내에 의료 인력 배치 근거를 마련하여, 태권도공원\n이용자의 안전을 도모하고자 합니다(안 제9조제3항 신설).",
    "법률_제_호": "태권도 진흥 및 태권도공원 조성 등에 관한 법률\n일부개정법률안\n태권도 진흥 및 태권도공원 조성 등에 관한 법률 일부를 다음과 같이\n개정한다.\n제9조에 제3항을 다음과 같이 신설한다.\n③ 공원에는 이용자의 안전을 확보하고 응급환자 발생에 효과적으\n로 대처하기 위하여 필요한 의료 인력을 둘 수 있다.",
    "신구조문대비표": "현 행 개 정 안\n제9조(태권도공원의 조성) ①ㆍ② 제9조(태권도공원의 조성) ①ㆍ②\n(생 략) (현행과 같음)\n<신 설> ③ 공원에는 이용자의 안전을\n확보하고 응급환자 발생에 효\n과적으로 대처하기 위하여 필\n요한 의료 인력을 둘 수 있다."
  }
}