{
  "title": "2209770_주한미군_공여구역주변지역_등_지원_특별법_일부개정법률안",
  "bill_number": "9770",
  "proposal_date": "2025. 4. 11.",
  "submission_date": "",
  "is_alternative": false,
  "alternative_bill_numbers": [],
  "has_comparison_table": false,
  "comparison_table": "신ㆍ구조문대비표\n현 행 개 정 안\n제12조(공여구역 등의 반환 및 제12조(공여구역 등의 반환 및\n처분) ① ∼ ⑧ (생 략) 처분) ① ∼ ⑧ (현행과 같음)\n<신 설> ⑨ 제5항에 따른 반환공여구역\n의 매각가격은 반환일을 기준\n으로 「감정평가 및 감정평가\n사에 관한 법률」에 따른 감정\n평가법인등이 평가한 감정평가\n액으로 산정한다.",
  "full_text": "주한미군 공여구역주변지역 등 지원 특별법\n일부개정법률안\n(김성원의원 대표발의)\n발의연월일 : 2025. 4. 11.\n의 안\n9770\n번 호 발 의 자 : 김성원ㆍ박덕흠ㆍ김선교\n박성훈ㆍ고동진ㆍ김태호\n구자근ㆍ박충권ㆍ김정재\n임이자ㆍ이종배ㆍ이인선\n의원(12인)\n제안이유 및 주요내용\n현행법은 미합중국이 대한민국에 반환한 공여구역인 “반환공여구역”\n을 지방자치단체 또는 민간이 국방부로부터 양여받거나 매입하는 등\n의 방식으로 활용할 수 있도록 규정하고 있음.\n그러나 반환공여구역의 매각가액 산정 시점이 명확히 규정되지 않\n아 주한미군의 공여구역 반환이 지연되거나 매각ㆍ양여 등 처분의 요\n건인 토양 오염 정화작업에 장기간이 소요될 경우 사업계획 수립 당\n시의 평가액과 최종 처분 시점의 평가액 간 격차가 심하여 지연된 기\n간 동안의 지가상승분만큼 사업비가 폭증해 사업의 불확실성이 증대\n되고, 급증한 매각가액으로 인하여 사업계획이 무산되거나 국방부와\n사업당사자 간 분쟁이 심화되고 있는 실정임.\n이에 반환공여구역 매각가액 산정의 기준일을 반환일로 명시하여\n\n\n\n소요비용에 대한 불확실성과 막대한 사업비를 낮추고 안정적인 사업\n추진이 가능하게 함으로써 반환공여구역 개발을 활성화하고 지역 간\n균형발전에 기여하려는 것임(안 제12조제9항).\n\n법률 제 호\n주한미군 공여구역주변지역 등 지원 특별법\n일부개정법률안\n주한미군 공여구역주변지역 등 지원 특별법 일부를 다음과 같이 개정\n한다.\n제12조에 제9항을 다음과 같이 신설한다.\n⑨ 제5항에 따른 반환공여구역의 매각가격은 반환일을 기준으로\n「감정평가 및 감정평가사에 관한 법률」에 따른 감정평가법인등이\n평가한 감정평가액으로 산정한다.\n부 칙\n제1조(시행일) 이 법은 공포 후 6개월이 경과한 날부터 시행한다.\n제2조(반환공여구역 매각가격 산정에 관한 적용례) 제12조제9항의 개\n정규정은 이 법 시행 이후 체결하는 매매계약부터 적용한다.\n\n\n\n\n신ㆍ구조문대비표\n현 행 개 정 안\n제12조(공여구역 등의 반환 및 제12조(공여구역 등의 반환 및\n처분) ① ∼ ⑧ (생 략) 처분) ① ∼ ⑧ (현행과 같음)\n<신 설> ⑨ 제5항에 따른 반환공여구역\n의 매각가격은 반환일을 기준\n으로 「감정평가 및 감정평가\n사에 관한 법률」에 따른 감정\n평가법인등이 평가한 감정평가\n액으로 산정한다.\n",
  "sections": {
    "제안이유": "및",
    "주요내용": "현행법은 미합중국이 대한민국에 반환한 공여구역인 “반환공여구역”\n을 지방자치단체 또는 민간이 국방부로부터 양여받거나 매입하는 등\n의 방식으로 활용할 수 있도록 규정하고 있음.\n그러나 반환공여구역의 매각가액 산정 시점이 명확히 규정되지 않\n아 주한미군의 공여구역 반환이 지연되거나 매각ㆍ양여 등 처분의 요\n건인 토양 오염 정화작업에 장기간이 소요될 경우 사업계획 수립 당\n시의 평가액과 최종 처분 시점의 평가액 간 격차가 심하여 지연된 기\n간 동안의 지가상승분만큼 사업비가 폭증해 사업의 불확실성이 증대\n되고, 급증한 매각가액으로 인하여 사업계획이 무산되거나 국방부와\n사업당사자 간 분쟁이 심화되고 있는 실정임.\n이에 반환공여구역 매각가액 산정의 기준일을 반환일로 명시하여\n\n\n\n소요비용에 대한 불확실성과 막대한 사업비를 낮추고 안정적인 사업\n추진이 가능하게 함으로써 반환공여구역 개발을 활성화하고 지역 간\n균형발전에 기여하려는 것임(안 제12조제9항).",
    "제안이유_및_주요내용": "현행법은 미합중국이 대한민국에 반환한 공여구역인 “반환공여구역”\n을 지방자치단체 또는 민간이 국방부로부터 양여받거나 매입하는 등\n의 방식으로 활용할 수 있도록 규정하고 있음.\n그러나 반환공여구역의 매각가액 산정 시점이 명확히 규정되지 않\n아 주한미군의 공여구역 반환이 지연되거나 매각ㆍ양여 등 처분의 요\n건인 토양 오염 정화작업에 장기간이 소요될 경우 사업계획 수립 당\n시의 평가액과 최종 처분 시점의 평가액 간 격차가 심하여 지연된 기\n간 동안의 지가상승분만큼 사업비가 폭증해 사업의 불확실성이 증대\n되고, 급증한 매각가액으로 인하여 사업계획이 무산되거나 국방부와\n사업당사자 간 분쟁이 심화되고 있는 실정임.\n이에 반환공여구역 매각가액 산정의 기준일을 반환일로 명시하여\n\n\n\n소요비용에 대한 불확실성과 막대한 사업비를 낮추고 안정적인 사업\n추진이 가능하게 함으로써 반환공여구역 개발을 활성화하고 지역 간\n균형발전에 기여하려는 것임(안 제12조제9항).",
    "법률_제_호": "주한미군 공여구역주변지역 등 지원 특별법\n일부개정법률안\n주한미군 공여구역주변지역 등 지원 특별법 일부를 다음과 같이 개정\n한다.\n제12조에 제9항을 다음과 같이 신설한다.\n⑨ 제5항에 따른 반환공여구역의 매각가격은 반환일을 기준으로\n「감정평가 및 감정평가사에 관한 법률」에 따른 감정평가법인등이\n평가한 감정평가액으로 산정한다.",
    "신구조문대비표": "현 행 개 정 안\n제12조(공여구역 등의 반환 및 제12조(공여구역 등의 반환 및\n처분) ① ∼ ⑧ (생 략) 처분) ① ∼ ⑧ (현행과 같음)\n<신 설> ⑨ 제5항에 따른 반환공여구역\n의 매각가격은 반환일을 기준\n으로 「감정평가 및 감정평가\n사에 관한 법률」에 따른 감정\n평가법인등이 평가한 감정평가\n액으로 산정한다."
  }
}