{
  "title": "2209642_전사·순직한_진급예정자의_진급에_관한_특별법_일부개정법률안",
  "bill_number": "9642",
  "proposal_date": "2025. 4. 8.",
  "submission_date": "",
  "is_alternative": false,
  "alternative_bill_numbers": [],
  "has_comparison_table": false,
  "comparison_table": "신ㆍ구조문대비표\n현 행 개 정 안\n제7조(진급신청의 기간) 진급신청 제7조(진급신청의 기간) -------\n은 이 법 시행일부터 1년 이내 ----2026년 12월 31일까지---\n에 하여야 한다. ---------.",
  "full_text": "전사ㆍ순직한 진급예정자의 진급에 관한 특별법\n일부개정법률안\n(성일종의원 대표발의)\n발의연월일 : 2025. 4. 8.\n의 안\n9642\n번 호 발 의 자 : 성일종ㆍ강대식ㆍ최수진\n김소희ㆍ김태호ㆍ강명구\n박덕흠ㆍ이종배ㆍ고동진\n김상욱 의원(10인)\n제안이유 및 주요내용\n현행법은 2001년 9월 1일 이후 2011년 3월 28일 이전에 전사ㆍ순직\n한 진급예정자에 대하여 그 유족으로부터 진급신청을 받아 이들을 진\n급시킬 수 있도록 「군인사법」에 대한 특례를 규정하고 있음.\n그런데 진급신청 기간이 법 시행일인 2019년 7월 24일부터 1년 이\n내로 한시적으로 규정되어 있어 진급신청 기간은 이미 만료되었으나,\n진급신청 대상자 확인에서 누락이 발생하여 일부 유가족은 대상자에\n해당함에도 안내를 받지 못하여 기간 내에 진급신청을 하지 못한 상\n황임.\n이에 진급신청 기간을 2026년 12월 31일까지로 연장하여 전사ㆍ순\n직한 진급예정자의 유가족이 이 법에 따라 진급신청을 할 수 있도록\n하려는 것임(안 제7조).\n\n\n\n\n법률 제 호\n전사ㆍ순직한 진급예정자의 진급에 관한 특별법\n일부개정법률안\n전사ㆍ순직한 진급예정자의 진급에 관한 특별법 일부를 다음과 같이\n개정한다.\n제7조 중 “이 법 시행일부터 1년 이내에”를 “2026년 12월 31일까지”로\n한다.\n부 칙\n이 법은 공포한 날부터 시행한다.\n\n\n\n\n신ㆍ구조문대비표\n현 행 개 정 안\n제7조(진급신청의 기간) 진급신청 제7조(진급신청의 기간) -------\n은 이 법 시행일부터 1년 이내 ----2026년 12월 31일까지---\n에 하여야 한다. ---------.\n",
  "sections": {
    "제안이유": "및",
    "주요내용": "현행법은 2001년 9월 1일 이후 2011년 3월 28일 이전에 전사ㆍ순직\n한 진급예정자에 대하여 그 유족으로부터 진급신청을 받아 이들을 진\n급시킬 수 있도록 「군인사법」에 대한 특례를 규정하고 있음.\n그런데 진급신청 기간이 법 시행일인 2019년 7월 24일부터 1년 이\n내로 한시적으로 규정되어 있어 진급신청 기간은 이미 만료되었으나,\n진급신청 대상자 확인에서 누락이 발생하여 일부 유가족은 대상자에\n해당함에도 안내를 받지 못하여 기간 내에 진급신청을 하지 못한 상\n황임.\n이에 진급신청 기간을 2026년 12월 31일까지로 연장하여 전사ㆍ순\n직한 진급예정자의 유가족이 이 법에 따라 진급신청을 할 수 있도록\n하려는 것임(안 제7조).",
    "제안이유_및_주요내용": "현행법은 2001년 9월 1일 이후 2011년 3월 28일 이전에 전사ㆍ순직\n한 진급예정자에 대하여 그 유족으로부터 진급신청을 받아 이들을 진\n급시킬 수 있도록 「군인사법」에 대한 특례를 규정하고 있음.\n그런데 진급신청 기간이 법 시행일인 2019년 7월 24일부터 1년 이\n내로 한시적으로 규정되어 있어 진급신청 기간은 이미 만료되었으나,\n진급신청 대상자 확인에서 누락이 발생하여 일부 유가족은 대상자에\n해당함에도 안내를 받지 못하여 기간 내에 진급신청을 하지 못한 상\n황임.\n이에 진급신청 기간을 2026년 12월 31일까지로 연장하여 전사ㆍ순\n직한 진급예정자의 유가족이 이 법에 따라 진급신청을 할 수 있도록\n하려는 것임(안 제7조).",
    "법률_제_호": "전사ㆍ순직한 진급예정자의 진급에 관한 특별법\n일부개정법률안\n전사ㆍ순직한 진급예정자의 진급에 관한 특별법 일부를 다음과 같이\n개정한다.\n제7조 중 “이 법 시행일부터 1년 이내에”를 “2026년 12월 31일까지”로\n한다.",
    "신구조문대비표": "현 행 개 정 안\n제7조(진급신청의 기간) 진급신청 제7조(진급신청의 기간) -------\n은 이 법 시행일부터 1년 이내 ----2026년 12월 31일까지---\n에 하여야 한다. ---------."
  }
}