{
  "title": "2209623_국경일에_관한_법률_일부개정법률안",
  "bill_number": "9623",
  "proposal_date": "2025. 4. 7.",
  "submission_date": "",
  "is_alternative": false,
  "alternative_bill_numbers": [],
  "has_comparison_table": false,
  "comparison_table": "신ㆍ구조문대비표\n현 행 개 정 안\n제2조(국경일의 종류) 국경일은 제2조(국경일의 종류) --------\n다음 각 호와 같다. ---------------.\n1. ∼ 5. (생 략) 1. ∼ 5. (현행과 같음)\n<신 설> 6. 민주시민의 날: 12월 3일",
  "full_text": "국경일에 관한 법률 일부개정법률안\n(이해민의원 대표발의)\n발의연월일 : 2025. 4. 7.\n의 안\n9623\n번 호 발 의 자 : 이해민ㆍ조인철ㆍ이학영\n김재원ㆍ김우영ㆍ신장식\n정춘생ㆍ김선민ㆍ이정헌\n정혜경 의원(10인)\n제안이유 및 주요내용\n윤석열 일당은 비상계엄의 요건에 부합하지 않음에도 위헌ㆍ위법적\n비상계엄을 선포했고, 국회와 선거관리위원회 등 헌법기관에 군을 동\n원해 침탈했으며, 시민의 정치적 활동과 언론ㆍ출판의 자유를 억압하\n는 포고령을 발표하는 등 12.3 내란을 일으켜 헌정질서를 문란케 함.\n그러나 대한민국 민주시민은 윤석열 일당의 폭력적 준동에 항거하\n기 위해 국회 앞으로 모여 군의 진입을 막아세웠고, 국회 구성원들은\n계엄군의 국회 본회의장 진입을 차단했으며, 국회는 비상계엄 해제 요\n구안을 의결해 계엄군의 철수를 이루어냈음.\n대한민국 헌법은 전문에서 불의에 항거한 4ㆍ19 민주이념을 계승하\n고, 제1조제2항에서 민주주의 원칙을 명확히 하고 있으나, 현행 법령\n과 제도는 민주주의를 기념ㆍ추모하는 국경일과 공휴일은 부재한 상\n황임.\n\n\n\n이에 사상 초유의 대통령 친위쿠데타에 맞서 시민이 직접 민주주의\n를 수호한 역사적 사건의 발생일인 12월 3일을 ‘민주시민의 날’로 지\n정하고, 이를 국경일과 공휴일로 삼아 민주시민의 승리를 기념하고,\n민주주의의 가치와 의미를 계승ㆍ발전시키고자 함(안 제2조).\n\n법률 제 호\n국경일에 관한 법률 일부개정법률안\n국경일에 관한 법률 일부를 다음과 같이 개정한다.\n제2조에 제6호를 다음과 같이 신설한다.\n6. 민주시민의 날: 12월 3일\n부 칙\n이 법은 공포한 날부터 시행한다.\n\n\n\n\n신ㆍ구조문대비표\n현 행 개 정 안\n제2조(국경일의 종류) 국경일은 제2조(국경일의 종류) --------\n다음 각 호와 같다. ---------------.\n1. ∼ 5. (생 략) 1. ∼ 5. (현행과 같음)\n<신 설> 6. 민주시민의 날: 12월 3일\n",
  "sections": {
    "제안이유": "및",
    "주요내용": "윤석열 일당은 비상계엄의 요건에 부합하지 않음에도 위헌ㆍ위법적\n비상계엄을 선포했고, 국회와 선거관리위원회 등 헌법기관에 군을 동\n원해 침탈했으며, 시민의 정치적 활동과 언론ㆍ출판의 자유를 억압하\n는 포고령을 발표하는 등 12.3 내란을 일으켜 헌정질서를 문란케 함.\n그러나 대한민국 민주시민은 윤석열 일당의 폭력적 준동에 항거하\n기 위해 국회 앞으로 모여 군의 진입을 막아세웠고, 국회 구성원들은\n계엄군의 국회 본회의장 진입을 차단했으며, 국회는 비상계엄 해제 요\n구안을 의결해 계엄군의 철수를 이루어냈음.\n대한민국 헌법은 전문에서 불의에 항거한 4ㆍ19 민주이념을 계승하\n고, 제1조제2항에서 민주주의 원칙을 명확히 하고 있으나, 현행 법령\n과 제도는 민주주의를 기념ㆍ추모하는 국경일과 공휴일은 부재한 상\n황임.\n\n\n\n이에 사상 초유의 대통령 친위쿠데타에 맞서 시민이 직접 민주주의\n를 수호한 역사적 사건의 발생일인 12월 3일을 ‘민주시민의 날’로 지\n정하고, 이를 국경일과 공휴일로 삼아 민주시민의 승리를 기념하고,\n민주주의의 가치와 의미를 계승ㆍ발전시키고자 함(안 제2조).",
    "제안이유_및_주요내용": "윤석열 일당은 비상계엄의 요건에 부합하지 않음에도 위헌ㆍ위법적\n비상계엄을 선포했고, 국회와 선거관리위원회 등 헌법기관에 군을 동\n원해 침탈했으며, 시민의 정치적 활동과 언론ㆍ출판의 자유를 억압하\n는 포고령을 발표하는 등 12.3 내란을 일으켜 헌정질서를 문란케 함.\n그러나 대한민국 민주시민은 윤석열 일당의 폭력적 준동에 항거하\n기 위해 국회 앞으로 모여 군의 진입을 막아세웠고, 국회 구성원들은\n계엄군의 국회 본회의장 진입을 차단했으며, 국회는 비상계엄 해제 요\n구안을 의결해 계엄군의 철수를 이루어냈음.\n대한민국 헌법은 전문에서 불의에 항거한 4ㆍ19 민주이념을 계승하\n고, 제1조제2항에서 민주주의 원칙을 명확히 하고 있으나, 현행 법령\n과 제도는 민주주의를 기념ㆍ추모하는 국경일과 공휴일은 부재한 상\n황임.\n\n\n\n이에 사상 초유의 대통령 친위쿠데타에 맞서 시민이 직접 민주주의\n를 수호한 역사적 사건의 발생일인 12월 3일을 ‘민주시민의 날’로 지\n정하고, 이를 국경일과 공휴일로 삼아 민주시민의 승리를 기념하고,\n민주주의의 가치와 의미를 계승ㆍ발전시키고자 함(안 제2조).",
    "법률_제_호": "국경일에 관한 법률 일부개정법률안\n국경일에 관한 법률 일부를 다음과 같이 개정한다.\n제2조에 제6호를 다음과 같이 신설한다.\n6. 민주시민의 날: 12월 3일",
    "신구조문대비표": "현 행 개 정 안\n제2조(국경일의 종류) 국경일은 제2조(국경일의 종류) --------\n다음 각 호와 같다. ---------------.\n1. ∼ 5. (생 략) 1. ∼ 5. (현행과 같음)\n<신 설> 6. 민주시민의 날: 12월 3일"
  }
}