{
  "title": "2209896_인공지능_발전과_신뢰_기반_조성_등에_관한_기본법_일부개정법률안",
  "bill_number": "9896",
  "proposal_date": "2025. 4. 17.",
  "submission_date": "",
  "is_alternative": false,
  "alternative_bill_numbers": [],
  "has_comparison_table": false,
  "comparison_table": "신ㆍ구조문대비표\n현 행 개 정 안\n법률 제20676호 인공지능 발전과 법률 제20676호 인공지능 발전과\n신뢰 기반 조성 등에 관한 기본 신뢰 기반 조성 등에 관한 기본\n법 ",
  "full_text": "인공지능 발전과 신뢰 기반 조성 등에 관한 기본법\n일부개정법률안\n(황정아의원 대표발의)\n발의연월일 : 2025. 4. 17.\n의 안\n9896\n번 호 발 의 자 : 황정아ㆍ박용갑ㆍ김문수\n맹성규ㆍ이성윤ㆍ이언주\n양부남ㆍ허종식ㆍ정성호\n박민규ㆍ김준혁ㆍ김우영\n송기헌ㆍ권칠승 의원\n(14인)\n제안이유 및 주요내용\n현행법은 인공지능의 안전성과 신뢰성을 보장하기 위하여 인공지능\n사업자로 하여금 고영향 인공지능이나 생성형 인공지능 사용 사실에\n대한 사전고지 의무, 인공지능 관련 안전사고 모니터링 및 위험관리체\n계 구축, 고영향 인공지능 영향평가 실시 등 책임과 의무를 부과하고\n있음.\n그러나 미국은 AI 관련 행정명령 폐기 및 혁신 중심 정책을 추진\n하는 등 EU, 일본을 포함한 전세계적 AI 관련 트렌드가 규제에서 진\n흥으로 전환되고 있음. 또한, 트럼프 정부 2기에 들어 AI 규제를 비관\n세 장벽으로 판단해 통상 갈등의 여지가 높아지고 있는 실정임.\n특히 인공지능사업자에 대한 과도한 규제는 기술 발전을 저해하고\n\n\n\n기업 혁신을 위축시킬 수 있어 현행법에서 진흥 관련 규정은 우선적\n으로 진행하되, 규제 관련 규정은 그 적용을 일정 기간 유예할 필요가\n있다는 현장의 목소리가 제기되고 있음.\n이에 인공지능사업자에 대한 의무나 책임을 부과하는 일부 규제 조\n항에 대하여 그 시행일을 3년 유예함으로써 AI 시대에 발맞추어 인공\n지능 발전을 촉진하고, 저성장과 민생경제 위기를 극복하는 데 이바지\n하고자 함(안 법률 제20676호 인공지능 발전과 신뢰 기반 조성 등에\n관한 기본법 부칙 제1조).\n\n법률 제 호\n인공지능 발전과 신뢰 기반 조성 등에 관한 기본법\n일부개정법률안\n법률 제20676호 인공지능 발전과 신뢰 기반 조성 등에 관한 기본법\n일부를 다음과 같이 개정한다.\n부칙 제1조 단서 중 “시행한다”를 “시행하고, 제31조부터 제35조까지\n는 이 법 시행 후 3년이 경과한 날부터 시행한다”로 한다.\n부 칙\n이 법은 2026년 1월 22일부터 시행한다.\n\n\n\n\n신ㆍ구조문대비표\n현 행 개 정 안\n법률 제20676호 인공지능 발전과 법률 제20676호 인공지능 발전과\n신뢰 기반 조성 등에 관한 기본 신뢰 기반 조성 등에 관한 기본\n법 부칙 법 부칙\n제1조(시행일) 이 법은 공포 후 1 제1조(시행일) -----------------\n년이 경과한 날부터 시행한다. ---------------------------.\n다만, 제2조제4호라목 중 디지 ----------------------------\n털의료기기에 관한 부분은 202 ----------------------------\n6년 1월 24일부터 시행한다. -----------------시행하고, 제\n31조부터 제35조까지는 이 법\n시행 후 3년이 경과한 날부터\n시행한다.\n",
  "sections": {
    "제안이유": "및",
    "주요내용": "현행법은 인공지능의 안전성과 신뢰성을 보장하기 위하여 인공지능\n사업자로 하여금 고영향 인공지능이나 생성형 인공지능 사용 사실에\n대한 사전고지 의무, 인공지능 관련 안전사고 모니터링 및 위험관리체\n계 구축, 고영향 인공지능 영향평가 실시 등 책임과 의무를 부과하고\n있음.\n그러나 미국은 AI 관련 행정명령 폐기 및 혁신 중심 정책을 추진\n하는 등 EU, 일본을 포함한 전세계적 AI 관련 트렌드가 규제에서 진\n흥으로 전환되고 있음. 또한, 트럼프 정부 2기에 들어 AI 규제를 비관\n세 장벽으로 판단해 통상 갈등의 여지가 높아지고 있는 실정임.\n특히 인공지능사업자에 대한 과도한 규제는 기술 발전을 저해하고\n\n\n\n기업 혁신을 위축시킬 수 있어 현행법에서 진흥 관련 규정은 우선적\n으로 진행하되, 규제 관련 규정은 그 적용을 일정 기간 유예할 필요가\n있다는 현장의 목소리가 제기되고 있음.\n이에 인공지능사업자에 대한 의무나 책임을 부과하는 일부 규제 조\n항에 대하여 그 시행일을 3년 유예함으로써 AI 시대에 발맞추어 인공\n지능 발전을 촉진하고, 저성장과 민생경제 위기를 극복하는 데 이바지\n하고자 함(안",
    "제안이유_및_주요내용": "현행법은 인공지능의 안전성과 신뢰성을 보장하기 위하여 인공지능\n사업자로 하여금 고영향 인공지능이나 생성형 인공지능 사용 사실에\n대한 사전고지 의무, 인공지능 관련 안전사고 모니터링 및 위험관리체\n계 구축, 고영향 인공지능 영향평가 실시 등 책임과 의무를 부과하고\n있음.\n그러나 미국은 AI 관련 행정명령 폐기 및 혁신 중심 정책을 추진\n하는 등 EU, 일본을 포함한 전세계적 AI 관련 트렌드가 규제에서 진\n흥으로 전환되고 있음. 또한, 트럼프 정부 2기에 들어 AI 규제를 비관\n세 장벽으로 판단해 통상 갈등의 여지가 높아지고 있는 실정임.\n특히 인공지능사업자에 대한 과도한 규제는 기술 발전을 저해하고\n\n\n\n기업 혁신을 위축시킬 수 있어 현행법에서 진흥 관련 규정은 우선적\n으로 진행하되, 규제 관련 규정은 그 적용을 일정 기간 유예할 필요가\n있다는 현장의 목소리가 제기되고 있음.\n이에 인공지능사업자에 대한 의무나 책임을 부과하는 일부 규제 조\n항에 대하여 그 시행일을 3년 유예함으로써 AI 시대에 발맞추어 인공\n지능 발전을 촉진하고, 저성장과 민생경제 위기를 극복하는 데 이바지\n하고자 함(안",
    "법률_제_호": "인공지능 발전과 신뢰 기반 조성 등에\n관한 기본법",
    "신구조문대비표": "현 행 개 정 안\n법률 제20676호 인공지능 발전과 법률 제20676호 인공지능 발전과\n신뢰 기반 조성 등에 관한 기본 신뢰 기반 조성 등에 관한 기본\n법"
  }
}