{
  "title": "2209934_국가경찰과_자치경찰의_조직_및_운영에_관한_법률_일부개정법률안",
  "bill_number": "9934",
  "proposal_date": "2025. 4. 17.",
  "submission_date": "",
  "is_alternative": false,
  "alternative_bill_numbers": [],
  "has_comparison_table": false,
  "comparison_table": "신ㆍ구조문대비표\n현 행 개 정 안\n제14조(경찰청장) ① ∼ ⑩ (생 제14조(경찰청장) ① ∼ ⑩ (현행\n략) 과 같음)\n<신 설> ⑪ 경찰청장은 대통령령으로\n정하는 바에 따라 장관급 공무\n원의 봉급과 그 밖의 보수를\n받는다.\n<신 설> ⑫ 경찰청장은 필요한 경우 국\n무회의에 출석하여 발언할 수\n있다.",
  "full_text": "국가경찰과 자치경찰의 조직 및 운영에 관한 법률\n일부개정법률안\n(정청래의원 대표발의)\n발의연월일 : 2025. 4. 17.\n의 안\n9934\n번 호 발 의 자 : 정청래ㆍ김현정ㆍ이원택\n박지원ㆍ천준호ㆍ김성환\n김성회ㆍ강선우ㆍ김영환\n최민희ㆍ서삼석ㆍ김정호\n서미화ㆍ안호영ㆍ김남근\n송옥주ㆍ김 현 의원\n(17인)\n제안이유 및 주요내용\n현행법 상 치안총감인 경찰청장은 차관급으로 되어 있음.\n그러나 검경 수사권 조정 등으로 경찰의 책임이 커진 만큼 경찰이\n정치적 중립성을 확보하여 행정 조직에 휘둘리지 않고, 검찰과 균형을\n이루고 상호 견제하며 독자적으로 경찰사무를 수행하며 국민안전ㆍ치\n안 문제가 국가 주요정책에 신속ㆍ효율적으로 반영될 수 있도록 할\n필요가 있다는 지적이 계속되어 오고 있음.\n이에 경찰청장인 치안총감을 장관급으로 치안정감을 차관급으로 승\n격하는 등 경찰 보수체계 개편 등을 통해 국가경찰의 위상을 높이고,\n치안을 강화하고자 함(안 제14조제11항 및 제12항 신설).\n\n\n\n\n법률 제 호\n국가경찰과 자치경찰의 조직 및 운영에 관한 법률\n일부개정법률안\n국가경찰과 자치경찰의 조직 및 운영에 관한 법률 일부를 다음과 같\n이 개정한다.\n제14조에 제11항 및 제12항을 다음과 같이 신설한다.\n⑪ 경찰청장은 대통령령으로 정하는 바에 따라 장관급 공무원의 봉\n급과 그 밖의 보수를 받는다.\n⑫ 경찰청장은 필요한 경우 국무회의에 출석하여 발언할 수 있다.\n부 칙\n이 법은 공포한 날부터 시행한다.\n\n\n\n\n신ㆍ구조문대비표\n현 행 개 정 안\n제14조(경찰청장) ① ∼ ⑩ (생 제14조(경찰청장) ① ∼ ⑩ (현행\n략) 과 같음)\n<신 설> ⑪ 경찰청장은 대통령령으로\n정하는 바에 따라 장관급 공무\n원의 봉급과 그 밖의 보수를\n받는다.\n<신 설> ⑫ 경찰청장은 필요한 경우 국\n무회의에 출석하여 발언할 수\n있다.\n",
  "sections": {
    "제안이유": "및",
    "주요내용": "현행법 상 치안총감인 경찰청장은 차관급으로 되어 있음.\n그러나 검경 수사권 조정 등으로 경찰의 책임이 커진 만큼 경찰이\n정치적 중립성을 확보하여 행정 조직에 휘둘리지 않고, 검찰과 균형을\n이루고 상호 견제하며 독자적으로 경찰사무를 수행하며 국민안전ㆍ치\n안 문제가 국가 주요정책에 신속ㆍ효율적으로 반영될 수 있도록 할\n필요가 있다는 지적이 계속되어 오고 있음.\n이에 경찰청장인 치안총감을 장관급으로 치안정감을 차관급으로 승\n격하는 등 경찰 보수체계 개편 등을 통해 국가경찰의 위상을 높이고,\n치안을 강화하고자 함(안 제14조제11항 및 제12항 신설).",
    "제안이유_및_주요내용": "현행법 상 치안총감인 경찰청장은 차관급으로 되어 있음.\n그러나 검경 수사권 조정 등으로 경찰의 책임이 커진 만큼 경찰이\n정치적 중립성을 확보하여 행정 조직에 휘둘리지 않고, 검찰과 균형을\n이루고 상호 견제하며 독자적으로 경찰사무를 수행하며 국민안전ㆍ치\n안 문제가 국가 주요정책에 신속ㆍ효율적으로 반영될 수 있도록 할\n필요가 있다는 지적이 계속되어 오고 있음.\n이에 경찰청장인 치안총감을 장관급으로 치안정감을 차관급으로 승\n격하는 등 경찰 보수체계 개편 등을 통해 국가경찰의 위상을 높이고,\n치안을 강화하고자 함(안 제14조제11항 및 제12항 신설).",
    "법률_제_호": "국가경찰과 자치경찰의 조직 및 운영에 관한 법률\n일부개정법률안\n국가경찰과 자치경찰의 조직 및 운영에 관한 법률 일부를 다음과 같\n이 개정한다.\n제14조에 제11항 및 제12항을 다음과 같이 신설한다.\n⑪ 경찰청장은 대통령령으로 정하는 바에 따라 장관급 공무원의 봉\n급과 그 밖의 보수를 받는다.\n⑫ 경찰청장은 필요한 경우 국무회의에 출석하여 발언할 수 있다.",
    "신구조문대비표": "현 행 개 정 안\n제14조(경찰청장) ① ∼ ⑩ (생 제14조(경찰청장) ① ∼ ⑩ (현행\n략) 과 같음)\n<신 설> ⑪ 경찰청장은 대통령령으로\n정하는 바에 따라 장관급 공무\n원의 봉급과 그 밖의 보수를\n받는다.\n<신 설> ⑫ 경찰청장은 필요한 경우 국\n무회의에 출석하여 발언할 수\n있다."
  }
}