{
  "title": "2209677_지방자치법_일부개정법률안",
  "bill_number": "9677",
  "proposal_date": "2025. 4. 9.",
  "submission_date": "",
  "is_alternative": false,
  "alternative_bill_numbers": [],
  "has_comparison_table": false,
  "comparison_table": "신ㆍ구조문대비표\n현 행 개 정 안\n제47조의2(인사청문회) ① ㆍ ② 제47조의2(인사청문회) ① ㆍ ②\n(생 략) (현행과 같음)\n<신 설> ③ 제1항에 따라 인사청문이\n요청된 후보자에게 지방자치단\n체 등 관계 행정기관은 필요한\n최소한의 행정적 지원을 할 수\n있다.\n③ (생 략) ④ (현행 제3항과 같음)",
  "full_text": "지방자치법 일부개정법률안\n(정동만의원 대표발의)\n발의연월일 : 2025. 4. 9.\n의 안\n9677\n번 호 발 의 자 : 정동만ㆍ정희용ㆍ박상웅\n임이자ㆍ이달희ㆍ김선교\n강민국ㆍ엄태영ㆍ이인선\n박성민 의원(10인)\n제안이유 및 주요내용\n현행법에 따르면 지방자치단체의 장은 부시장ㆍ부지사, 지방공사의\n사장 등의 직위 중 조례로 정하는 직위의 후보자에 대하여 지방의회\n에 인사청문을 요청할 수 있도록 하고 있음.\n그런데 인사청문 대상 후보자가 인사청문회의 모든 과정을 혼자 준\n비하기는 어려워 「인사청문회법」과 유사하게 행정적 지원에 관한\n규정을 마련해야 한다는 의견이 있음.\n이에 인사청문이 요청된 후보자에게 지방자치단체 등 관계 행정기\n관은 필요한 최소한의 행정적 지원을 할 수 있도록 하려는 것임(안 제\n47조의2제3항 신설).\n\n\n\n\n법률 제 호\n지방자치법 일부개정법률안\n지방자치법 일부를 다음과 같이 개정한다.\n제47조의2제3항을 제4항으로 하고, 같은 조에 제3항을 다음과 같이 신\n설한다.\n③ 제1항에 따라 인사청문이 요청된 후보자에게 지방자치단체 등\n관계 행정기관은 필요한 최소한의 행정적 지원을 할 수 있다.\n부 칙\n이 법은 공포 후 3개월이 경과한 날부터 시행한다.\n\n\n\n\n신ㆍ구조문대비표\n현 행 개 정 안\n제47조의2(인사청문회) ① ㆍ ② 제47조의2(인사청문회) ① ㆍ ②\n(생 략) (현행과 같음)\n<신 설> ③ 제1항에 따라 인사청문이\n요청된 후보자에게 지방자치단\n체 등 관계 행정기관은 필요한\n최소한의 행정적 지원을 할 수\n있다.\n③ (생 략) ④ (현행 제3항과 같음)\n",
  "sections": {
    "제안이유": "및",
    "주요내용": "현행법에 따르면 지방자치단체의 장은 부시장ㆍ부지사, 지방공사의\n사장 등의 직위 중 조례로 정하는 직위의 후보자에 대하여 지방의회\n에 인사청문을 요청할 수 있도록 하고 있음.\n그런데 인사청문 대상 후보자가 인사청문회의 모든 과정을 혼자 준\n비하기는 어려워 「인사청문회법」과 유사하게 행정적 지원에 관한\n규정을 마련해야 한다는 의견이 있음.\n이에 인사청문이 요청된 후보자에게 지방자치단체 등 관계 행정기\n관은 필요한 최소한의 행정적 지원을 할 수 있도록 하려는 것임(안 제\n47조의2제3항 신설).",
    "제안이유_및_주요내용": "현행법에 따르면 지방자치단체의 장은 부시장ㆍ부지사, 지방공사의\n사장 등의 직위 중 조례로 정하는 직위의 후보자에 대하여 지방의회\n에 인사청문을 요청할 수 있도록 하고 있음.\n그런데 인사청문 대상 후보자가 인사청문회의 모든 과정을 혼자 준\n비하기는 어려워 「인사청문회법」과 유사하게 행정적 지원에 관한\n규정을 마련해야 한다는 의견이 있음.\n이에 인사청문이 요청된 후보자에게 지방자치단체 등 관계 행정기\n관은 필요한 최소한의 행정적 지원을 할 수 있도록 하려는 것임(안 제\n47조의2제3항 신설).",
    "법률_제_호": "지방자치법 일부개정법률안\n지방자치법 일부를 다음과 같이 개정한다.\n제47조의2제3항을 제4항으로 하고, 같은 조에 제3항을 다음과 같이 신\n설한다.\n③ 제1항에 따라 인사청문이 요청된 후보자에게 지방자치단체 등\n관계 행정기관은 필요한 최소한의 행정적 지원을 할 수 있다.",
    "신구조문대비표": "현 행 개 정 안\n제47조의2(인사청문회) ① ㆍ ② 제47조의2(인사청문회) ① ㆍ ②\n(생 략) (현행과 같음)\n<신 설> ③ 제1항에 따라 인사청문이\n요청된 후보자에게 지방자치단\n체 등 관계 행정기관은 필요한\n최소한의 행정적 지원을 할 수\n있다.\n③ (생 략) ④ (현행 제3항과 같음)"
  }
}