{
  "title": "2209731_국립공원공단법_일부개정법률안",
  "bill_number": "9731",
  "proposal_date": "2025. 4. 11.",
  "submission_date": "",
  "is_alternative": false,
  "alternative_bill_numbers": [],
  "has_comparison_table": false,
  "comparison_table": "신ㆍ구조문대비표\n현 행 개 정 안\n제9조(사업) 공단은 다음 각 호의 제9조(사업) -------------------\n사업을 한다. ------------.\n1. ∼ 3. (생 략) 1. ∼ 3. (현행과 같음)\n<신 설> 3의2. 국립공원의 산불 등 재난\n관리 및 지원\n4. ∼ 14. (생 략) 4. ∼ 14. (현행과 같음)",
  "full_text": "국립공원공단법 일부개정법률안\n(임이자의원 대표발의)\n발의연월일 : 2025. 4. 11.\n의 안\n9731\n번 호 발 의 자 : 임이자ㆍ안상훈ㆍ유용원\n조정훈ㆍ김위상ㆍ조지연\n김장겸ㆍ김용태ㆍ우재준\n박성훈 의원(10인)\n제안이유 및 주요내용\n최근 경북 의성, 경남 산청 등에서 대규모 산불 피해가 발생한 바\n있고, 기후변화가 가속화되는 가운데 산불이 연중화, 대형화되는 추세\n에 있음.\n그런데 전국 21개 국립공원을 관리하는 국립공원공단의 법정 사업\n에 산불 예방 및 재난 지원과 관련된 사업이 명시되지 않아 관련 예\n산 편성 및 사업 추진을 하기 어렵다는 지적이 있음.\n이에 현행법의 국립공원공단 사업에 국립공원의 산불 등 재난관리\n및 지원사업을 명시하려는 것임(안 제9조제3호의2 신설).\n\n\n\n\n법률 제 호\n국립공원공단법 일부개정법률안\n국립공원공단법 일부를 다음과 같이 개정한다.\n제9조에 제3호의2를 다음과 같이 신설한다.\n3의2. 국립공원의 산불 등 재난관리 및 지원\n부 칙\n이 법은 공포 후 6개월이 경과한 날부터 시행한다.\n\n\n\n\n신ㆍ구조문대비표\n현 행 개 정 안\n제9조(사업) 공단은 다음 각 호의 제9조(사업) -------------------\n사업을 한다. ------------.\n1. ∼ 3. (생 략) 1. ∼ 3. (현행과 같음)\n<신 설> 3의2. 국립공원의 산불 등 재난\n관리 및 지원\n4. ∼ 14. (생 략) 4. ∼ 14. (현행과 같음)\n",
  "sections": {
    "제안이유": "및",
    "주요내용": "최근 경북 의성, 경남 산청 등에서 대규모 산불 피해가 발생한 바\n있고, 기후변화가 가속화되는 가운데 산불이 연중화, 대형화되는 추세\n에 있음.\n그런데 전국 21개 국립공원을 관리하는 국립공원공단의 법정 사업\n에 산불 예방 및 재난 지원과 관련된 사업이 명시되지 않아 관련 예\n산 편성 및 사업 추진을 하기 어렵다는 지적이 있음.\n이에 현행법의 국립공원공단 사업에 국립공원의 산불 등 재난관리\n및 지원사업을 명시하려는 것임(안 제9조제3호의2 신설).",
    "제안이유_및_주요내용": "최근 경북 의성, 경남 산청 등에서 대규모 산불 피해가 발생한 바\n있고, 기후변화가 가속화되는 가운데 산불이 연중화, 대형화되는 추세\n에 있음.\n그런데 전국 21개 국립공원을 관리하는 국립공원공단의 법정 사업\n에 산불 예방 및 재난 지원과 관련된 사업이 명시되지 않아 관련 예\n산 편성 및 사업 추진을 하기 어렵다는 지적이 있음.\n이에 현행법의 국립공원공단 사업에 국립공원의 산불 등 재난관리\n및 지원사업을 명시하려는 것임(안 제9조제3호의2 신설).",
    "법률_제_호": "국립공원공단법 일부개정법률안\n국립공원공단법 일부를 다음과 같이 개정한다.\n제9조에 제3호의2를 다음과 같이 신설한다.\n3의2. 국립공원의 산불 등 재난관리 및 지원",
    "신구조문대비표": "현 행 개 정 안\n제9조(사업) 공단은 다음 각 호의 제9조(사업) -------------------\n사업을 한다. ------------.\n1. ∼ 3. (생 략) 1. ∼ 3. (현행과 같음)\n<신 설> 3의2. 국립공원의 산불 등 재난\n관리 및 지원\n4. ∼ 14. (생 략) 4. ∼ 14. (현행과 같음)"
  }
}