{
  "title": "2209145_형법_일부개정법률안",
  "bill_number": "9145",
  "proposal_date": "2025. 3. 20.",
  "submission_date": "",
  "is_alternative": false,
  "alternative_bill_numbers": [],
  "has_comparison_table": false,
  "comparison_table": "신ㆍ구조문대비표\n현 행 개 정 안\n<신 설> 제348조의2(특수사기) 2명 이상이\n합동하여 제347조, 제347조의2\n및 제348조의 죄를 범한 자는\n2년 이상 20년 이하의 징역에\n처한다.\n第348條의2(便宜施設不正利用) 第348條의3(便宜施設不正利用)\n(생 략) (현행 제348조의2와 같음)",
  "full_text": "형법 일부개정법률안\n(이종배의원 대표발의)\n발의연월일 : 2025. 3. 20.\n의 안\n9145\n번 호 발 의 자 : 이종배ㆍ서천호ㆍ박덕흠\n이만희ㆍ김위상ㆍ이종욱\n김성원ㆍ성일종ㆍ신동욱\n김용태ㆍ권영진 의원\n(11인)\n제안이유 및 주요내용\n현행법은 사기범죄를 제347조, 제347조의2, 제348조에 따라 10년 이\n하의 징역 또는 2천만원 이하의 벌금으로 처벌하고 있음.\n이와 관련하여 최근 보이스피싱, 투자리딩방 사기 및 전세사기 등\n조직적 사기범죄가 급증하고 있음에도, 조직적 사기범죄에 대해 가중\n처벌이 이뤄지고 있지 않다는 지적이 있음.\n이에 2인 이상이 합동하여 제347조, 제347조의2, 제348조의 죄를 범\n한 경우를 가중하여 처벌하도록 하여 조직적인 사기범죄를 억제하고\n피해자를 보호하려는 것임(안 제348조의2).\n참고사항\n이 법률안은 이종배의원이 대표발의한 「부동산투자회사법 일부개\n\n\n\n정법률안」(의안번호 제9148호)의 의결을 전제로 하는 것이므로 같은\n법률안이 의결되지 아니하거나 수정의결되는 경우에는 이에 맞추어\n조정되어야 할 것임.\n\n법률 제 호\n형법 일부개정법률안\n형법 일부를 다음과 같이 개정한다.\n제348조의2를 제348조의3으로 하고, 제348조의2를 다음과 같이 신설한\n다.\n제348조의2(특수사기) 2명 이상이 합동하여 제347조, 제347조의2 및\n제348조의 죄를 범한 자는 2년 이상 20년 이하의 징역에 처한다.\n부 칙\n이 법은 공포 후 3개월이 경과한 날부터 시행한다.\n\n\n\n\n신ㆍ구조문대비표\n현 행 개 정 안\n<신 설> 제348조의2(특수사기) 2명 이상이\n합동하여 제347조, 제347조의2\n및 제348조의 죄를 범한 자는\n2년 이상 20년 이하의 징역에\n처한다.\n第348條의2(便宜施設不正利用) 第348條의3(便宜施設不正利用)\n(생 략) (현행 제348조의2와 같음)\n",
  "sections": {
    "제안이유": "및",
    "주요내용": "현행법은 사기범죄를 제347조, 제347조의2, 제348조에 따라 10년 이\n하의 징역 또는 2천만원 이하의 벌금으로 처벌하고 있음.\n이와 관련하여 최근 보이스피싱, 투자리딩방 사기 및 전세사기 등\n조직적 사기범죄가 급증하고 있음에도, 조직적 사기범죄에 대해 가중\n처벌이 이뤄지고 있지 않다는 지적이 있음.\n이에 2인 이상이 합동하여 제347조, 제347조의2, 제348조의 죄를 범\n한 경우를 가중하여 처벌하도록 하여 조직적인 사기범죄를 억제하고\n피해자를 보호하려는 것임(안 제348조의2).",
    "제안이유_및_주요내용": "현행법은 사기범죄를 제347조, 제347조의2, 제348조에 따라 10년 이\n하의 징역 또는 2천만원 이하의 벌금으로 처벌하고 있음.\n이와 관련하여 최근 보이스피싱, 투자리딩방 사기 및 전세사기 등\n조직적 사기범죄가 급증하고 있음에도, 조직적 사기범죄에 대해 가중\n처벌이 이뤄지고 있지 않다는 지적이 있음.\n이에 2인 이상이 합동하여 제347조, 제347조의2, 제348조의 죄를 범\n한 경우를 가중하여 처벌하도록 하여 조직적인 사기범죄를 억제하고\n피해자를 보호하려는 것임(안 제348조의2).",
    "법률_제_호": "형법 일부개정법률안\n형법 일부를 다음과 같이 개정한다.\n제348조의2를 제348조의3으로 하고, 제348조의2를 다음과 같이 신설한\n다.\n제348조의2(특수사기) 2명 이상이 합동하여 제347조, 제347조의2 및\n제348조의 죄를 범한 자는 2년 이상 20년 이하의 징역에 처한다.",
    "신구조문대비표": "현 행 개 정 안\n<신 설> 제348조의2(특수사기) 2명 이상이\n합동하여 제347조, 제347조의2\n및 제348조의 죄를 범한 자는\n2년 이상 20년 이하의 징역에\n처한다.\n第348條의2(便宜施設不正利用) 第348條의3(便宜施設不正利用)\n(생 략) (현행 제348조의2와 같음)"
  }
}