{
  "title": "2209725_식품안전기본법_일부개정법률안",
  "bill_number": "9725",
  "proposal_date": "2025. 4. 10.",
  "submission_date": "",
  "is_alternative": false,
  "alternative_bill_numbers": [],
  "has_comparison_table": false,
  "comparison_table": "신ㆍ구조문대비표\n현 행 개 정 안\n<신 설> 제21조의2(기후변화에 따른 안전\n관리) 관계중앙행정기관의 장은\n기후변화에 따른 식품안전기준\n에 관한 연구 등 기후변화가\n국민건강에 위해가 되지 않도\n록 안전관리대책을 수립ㆍ시행\n하여야 한다.",
  "full_text": "식품안전기본법 일부개정법률안\n(전진숙의원 대표발의)\n발의연월일 : 2025. 4. 10.\n의 안\n9725\n번 호 발 의 자 : 전진숙ㆍ박희승ㆍ서미화\n김선민ㆍ이수진ㆍ백혜련\n임호선ㆍ김 윤ㆍ남인순\n임광현 의원(10인)\n제안이유 및 주요내용\n기후변화는 재배작물의 변화, 새로운 질병 및 해충의 증가, 생태계\n변화 등을 야기하고 이는 농산물ㆍ축산물ㆍ해산물 등의 식재료 안전\n문제로 이어지고 있음에 따라 이에 대한 대책을 필요로 하고 있음.\n이에 기후변화에 따른 식품안전기준에 관한 연구 등 안전관리대책\n을 수립ㆍ시행하게 함으로써 국민이 건강하고 안전한 식생활을 영위\n할 수 있도록 하려는 것임(안 제21조의2 신설).\n\n\n\n\n법률 제 호\n식품안전기본법 일부개정법률안\n식품안전기본법 일부를 다음과 같이 개정한다.\n제21조의2를 다음과 같이 신설한다.\n제21조의2(기후변화에 따른 안전관리) 관계중앙행정기관의 장은 기후\n변화에 따른 식품안전기준에 관한 연구 등 기후변화가 국민건강에\n위해가 되지 않도록 안전관리대책을 수립ㆍ시행하여야 한다.\n부 칙\n이 법은 공포한 날부터 시행한다.\n\n\n\n\n신ㆍ구조문대비표\n현 행 개 정 안\n<신 설> 제21조의2(기후변화에 따른 안전\n관리) 관계중앙행정기관의 장은\n기후변화에 따른 식품안전기준\n에 관한 연구 등 기후변화가\n국민건강에 위해가 되지 않도\n록 안전관리대책을 수립ㆍ시행\n하여야 한다.\n",
  "sections": {
    "제안이유": "및",
    "주요내용": "기후변화는 재배작물의 변화, 새로운 질병 및 해충의 증가, 생태계\n변화 등을 야기하고 이는 농산물ㆍ축산물ㆍ해산물 등의 식재료 안전\n문제로 이어지고 있음에 따라 이에 대한 대책을 필요로 하고 있음.\n이에 기후변화에 따른 식품안전기준에 관한 연구 등 안전관리대책\n을 수립ㆍ시행하게 함으로써 국민이 건강하고 안전한 식생활을 영위\n할 수 있도록 하려는 것임(안 제21조의2 신설).",
    "제안이유_및_주요내용": "기후변화는 재배작물의 변화, 새로운 질병 및 해충의 증가, 생태계\n변화 등을 야기하고 이는 농산물ㆍ축산물ㆍ해산물 등의 식재료 안전\n문제로 이어지고 있음에 따라 이에 대한 대책을 필요로 하고 있음.\n이에 기후변화에 따른 식품안전기준에 관한 연구 등 안전관리대책\n을 수립ㆍ시행하게 함으로써 국민이 건강하고 안전한 식생활을 영위\n할 수 있도록 하려는 것임(안 제21조의2 신설).",
    "법률_제_호": "식품안전기본법 일부개정법률안\n식품안전기본법 일부를 다음과 같이 개정한다.\n제21조의2를 다음과 같이 신설한다.\n제21조의2(기후변화에 따른 안전관리) 관계중앙행정기관의 장은 기후\n변화에 따른 식품안전기준에 관한 연구 등 기후변화가 국민건강에\n위해가 되지 않도록 안전관리대책을 수립ㆍ시행하여야 한다.",
    "신구조문대비표": "현 행 개 정 안\n<신 설> 제21조의2(기후변화에 따른 안전\n관리) 관계중앙행정기관의 장은\n기후변화에 따른 식품안전기준\n에 관한 연구 등 기후변화가\n국민건강에 위해가 되지 않도\n록 안전관리대책을 수립ㆍ시행\n하여야 한다."
  }
}