{
  "title": "2209856_의용소방대_설치_및_운영에_관한_법률_일부개정법률안",
  "bill_number": "9856",
  "proposal_date": "2025. 4. 16.",
  "submission_date": "",
  "is_alternative": false,
  "alternative_bill_numbers": [],
  "has_comparison_table": false,
  "comparison_table": "신ㆍ구조문대비표\n현 행 개 정 안\n제5조(정년) 의용소방대원의 정년 제5조(정년) -------------------\n은 65세로 한다. ---70세로-----.",
  "full_text": "의용소방대 설치 및 운영에 관한 법률 일부개정법률안\n(정춘생의원 대표발의)\n발의연월일 : 2025. 4. 16.\n의 안\n9856\n번 호 발 의 자 : 정춘생ㆍ황운하ㆍ신장식\n이해민ㆍ차규근ㆍ김선민\n서왕진ㆍ박은정ㆍ강경숙\n김재원 의원(10인)\n제안이유 및 주요내용\n현행법은 재난현장에서 화재진압, 구조ㆍ구급 등의 활동 등을 보조\n하기 위하여 지역 거주민 중 건강하고 협동정신이 강한 사람 등을 의\n용소방대원으로 임명할 수 있도록 하고, 그 정년을 65세로 규정하고\n있음.\n그런데, 의료기술의 발달로 국민 전반의 건강이 개선되어 노동 가능\n연령도 높아지고 있는 가운데, 농ㆍ산ㆍ어촌 등 인구 감소가 급격한\n지역의 경우 65세 이상 고령인구 비율이 상대적으로 높아 의용소방대\n원 모집에 어려움을 겪고 있어 의용소방대의 정년을 높여야 한다는\n의견이 지역사회를 중심으로 제기되었음.\n이에 의용소방대원의 정년을 65세에서 70세로 연장하려는 것임(안\n제5조).\n\n\n\n\n법률 제 호\n의용소방대 설치 및 운영에 관한 법률 일부개정법률안\n의용소방대 설치 및 운영에 관한 법률 일부를 다음과 같이 개정한다.\n제5조 중 “65세로”를 “70세로”로 한다.\n부 칙\n이 법은 공포한 날부터 시행한다.\n\n\n\n\n신ㆍ구조문대비표\n현 행 개 정 안\n제5조(정년) 의용소방대원의 정년 제5조(정년) -------------------\n은 65세로 한다. ---70세로-----.\n",
  "sections": {
    "제안이유": "및",
    "주요내용": "현행법은 재난현장에서 화재진압, 구조ㆍ구급 등의 활동 등을 보조\n하기 위하여 지역 거주민 중 건강하고 협동정신이 강한 사람 등을 의\n용소방대원으로 임명할 수 있도록 하고, 그 정년을 65세로 규정하고\n있음.\n그런데, 의료기술의 발달로 국민 전반의 건강이 개선되어 노동 가능\n연령도 높아지고 있는 가운데, 농ㆍ산ㆍ어촌 등 인구 감소가 급격한\n지역의 경우 65세 이상 고령인구 비율이 상대적으로 높아 의용소방대\n원 모집에 어려움을 겪고 있어 의용소방대의 정년을 높여야 한다는\n의견이 지역사회를 중심으로 제기되었음.\n이에 의용소방대원의 정년을 65세에서 70세로 연장하려는 것임(안\n제5조).",
    "제안이유_및_주요내용": "현행법은 재난현장에서 화재진압, 구조ㆍ구급 등의 활동 등을 보조\n하기 위하여 지역 거주민 중 건강하고 협동정신이 강한 사람 등을 의\n용소방대원으로 임명할 수 있도록 하고, 그 정년을 65세로 규정하고\n있음.\n그런데, 의료기술의 발달로 국민 전반의 건강이 개선되어 노동 가능\n연령도 높아지고 있는 가운데, 농ㆍ산ㆍ어촌 등 인구 감소가 급격한\n지역의 경우 65세 이상 고령인구 비율이 상대적으로 높아 의용소방대\n원 모집에 어려움을 겪고 있어 의용소방대의 정년을 높여야 한다는\n의견이 지역사회를 중심으로 제기되었음.\n이에 의용소방대원의 정년을 65세에서 70세로 연장하려는 것임(안\n제5조).",
    "법률_제_호": "의용소방대 설치 및 운영에 관한 법률 일부개정법률안\n의용소방대 설치 및 운영에 관한 법률 일부를 다음과 같이 개정한다.\n제5조 중 “65세로”를 “70세로”로 한다.",
    "신구조문대비표": "현 행 개 정 안\n제5조(정년) 의용소방대원의 정년 제5조(정년) -------------------\n은 65세로 한다. ---70세로-----."
  }
}