{
  "title": "2209954_주한미군기지_이전에_따른_평택시_등의_지원_등에_관한_특별법_일부개정법률안",
  "bill_number": "9954",
  "proposal_date": "2025. 4. 18.",
  "submission_date": "",
  "is_alternative": false,
  "alternative_bill_numbers": [],
  "has_comparison_table": false,
  "comparison_table": "신ㆍ구조문대비표\n현 행 개 정 안\n법률 제7271호 주한미군기지 이 법률 제7271호 주한미군기지 이\n전에 따른 평택시 등의 지원 등 전에 따른 평택시 등의 지원 등\n에 관한 특별법 ",
  "full_text": "주한미군기지 이전에 따른 평택시 등의 지원 등에 관한\n특별법 일부개정법률안\n(홍기원의원 대표발의)\n발의연월일 : 2025. 4. 18.\n의 안\n9954\n번 호 발 의 자 : 홍기원ㆍ김동아ㆍ서미화\n노종면ㆍ허 영ㆍ김영배\n윤종군ㆍ박지원ㆍ박 정\n김성회ㆍ송옥주ㆍ장종태\n서삼석ㆍ김기표ㆍ주철현\n어기구ㆍ이연희ㆍ김교흥\n전현희ㆍ복기왕ㆍ정태호\n소병훈ㆍ김병기ㆍ김태년\n서영석ㆍ오세희ㆍ김 윤\n이용선ㆍ이용우ㆍ최민희\n권칠승ㆍ박희승ㆍ박선원\n서왕진ㆍ이정문ㆍ부승찬\n이기헌ㆍ김준형ㆍ김주영\n박해철ㆍ허성무ㆍ김종민\n백선희ㆍ정일영ㆍ이병진\n이언주ㆍ임미애ㆍ김성환\n박용갑ㆍ신영대ㆍ안호영\n김현정 의원(52인)\n제안이유 및 주요내용\n\n\n\n현행법은 주한미군의 기지이전을 위한 시설사업을 원활하게 시행하\n고, 주한미군기지가 이전되는 지역에 대한 개발사업과 지원대책 등을\n정하기 위한 것으로 2004년 12월 31일 제정되었음.\n그런데 공여해제반환재산의 매각 부진 등으로 평택시의 지역개발을\n위해 추진하고 있는 총 86개의 사업 중 15개의 사업이 완료되지 않고\n있으며 용산 잔류 미군시설의 이전 사업도 아직 한미 협의 단계에 머\n물러 있어 현 특별법의 존치가 꼭 필요한 상황임.\n이에 현행법의 유효기간을 2026년에서 2030년까지로 4년 연장하여\n주한미군기지 이전과 관련한 제반 문제를 해결할 수 있는 여유 기간\n을 확보함으로써 주한미군의 평택 지역으로의 이전을 원활히 추진할\n수 있도록 하려는 것임(안 부칙 제2항).\n\n법률 제 호\n주한미군기지 이전에 따른 평택시 등의 지원 등에 관한\n특별법 일부개정법률안\n주한미군기지 이전에 따른 평택시 등의 지원 등에 관한 특별법 일부\n를 다음과 같이 개정한다.\n법률 제7271호 주한미군기지 이전에 따른 평택시 등의 지원 등에 관\n한 특별법 부칙 제2항 중 “2026년”을 “2030년”으로 한다.\n부 칙\n제1조(시행일) 이 법은 공포한 날부터 시행한다.\n제2조(유효기간 이후의 경과조치) ① 이 법의 유효기간 중에 주한미군\n시설사업시행자가 「국방ㆍ군사시설 사업에 관한 법률」 제6조제1\n항 또는 제2항에 따라 주한미군사업의 실시계획에 대한 국방부장관\n의 승인을 얻은 때에는 해당 유효기간이 지난 후에도 제5조부터 제\n8조의2까지, 제30조 및 제31조의 개정규정을 적용한다.\n② 이 법의 유효기간 중에 평택시개발사업을 시행하는 자가 제17조\n에 따라 평택시개발사업의 시행승인을 얻은 후 사업에 착수하였거\n나, 제16조제1호부터 제3호까지에서 규정된 자가 평택시개발사업에\n착수하였을 경우에는 해당 유효기간이 지난 후에도 제18조부터 제2\n\n\n\n0조까지, 제24조의2, 제25조, 제26조, 제28조부터 제31조까지의 개정\n규정을 적용한다.\n③ 이 법의 유효기간 중에 국제화계획지구개발사업시행자가 제23조\n에 따라 국토교통부장관의 승인을 얻은 때에는 해당 유효기간이 지\n난 후에도 제24조부터 제24조의3까지, 제27조, 제30조 및 제31조의\n개정규정을 적용한다.\n\n신ㆍ구조문대비표\n현 행 개 정 안\n법률 제7271호 주한미군기지 이 법률 제7271호 주한미군기지 이\n전에 따른 평택시 등의 지원 등 전에 따른 평택시 등의 지원 등\n에 관한 특별법 부칙 에 관한 특별법 부칙\n② (유효기간) 이 법은 2026년 12 ② (유효기간) --------2030년---\n월 31일까지 그 효력을 가진다. ----------------------------.\n",
  "sections": {
    "제안이유": "및",
    "주요내용": "현행법은 주한미군의 기지이전을 위한 시설사업을 원활하게 시행하\n고, 주한미군기지가 이전되는 지역에 대한 개발사업과 지원대책 등을\n정하기 위한 것으로 2004년 12월 31일 제정되었음.\n그런데 공여해제반환재산의 매각 부진 등으로 평택시의 지역개발을\n위해 추진하고 있는 총 86개의 사업 중 15개의 사업이 완료되지 않고\n있으며 용산 잔류 미군시설의 이전 사업도 아직 한미 협의 단계에 머\n물러 있어 현 특별법의 존치가 꼭 필요한 상황임.\n이에 현행법의 유효기간을 2026년에서 2030년까지로 4년 연장하여\n주한미군기지 이전과 관련한 제반 문제를 해결할 수 있는 여유 기간\n을 확보함으로써 주한미군의 평택 지역으로의 이전을 원활히 추진할\n수 있도록 하려는 것임(안 부칙 제2항).",
    "제안이유_및_주요내용": "현행법은 주한미군의 기지이전을 위한 시설사업을 원활하게 시행하\n고, 주한미군기지가 이전되는 지역에 대한 개발사업과 지원대책 등을\n정하기 위한 것으로 2004년 12월 31일 제정되었음.\n그런데 공여해제반환재산의 매각 부진 등으로 평택시의 지역개발을\n위해 추진하고 있는 총 86개의 사업 중 15개의 사업이 완료되지 않고\n있으며 용산 잔류 미군시설의 이전 사업도 아직 한미 협의 단계에 머\n물러 있어 현 특별법의 존치가 꼭 필요한 상황임.\n이에 현행법의 유효기간을 2026년에서 2030년까지로 4년 연장하여\n주한미군기지 이전과 관련한 제반 문제를 해결할 수 있는 여유 기간\n을 확보함으로써 주한미군의 평택 지역으로의 이전을 원활히 추진할\n수 있도록 하려는 것임(안 부칙 제2항).",
    "법률_제_호": "주한미군기지 이전에 따른 평택시 등의 지원 등에 관한\n특별법 일부개정법률안\n주한미군기지 이전에 따른 평택시 등의 지원 등에 관한 특별법 일부\n를 다음과 같이 개정한다.\n법률 제7271호 주한미군기지 이전에 따른 평택시 등의 지원 등에 관\n한 특별법",
    "신구조문대비표": "현 행 개 정 안\n법률 제7271호 주한미군기지 이 법률 제7271호 주한미군기지 이\n전에 따른 평택시 등의 지원 등 전에 따른 평택시 등의 지원 등\n에 관한 특별법"
  }
}