{
  "title": "2209297_과학기술기본법_일부개정법률안",
  "bill_number": "9297",
  "proposal_date": "2025. 3. 24.",
  "submission_date": "",
  "is_alternative": false,
  "alternative_bill_numbers": [],
  "has_comparison_table": false,
  "comparison_table": "신ㆍ구조문대비표\n현 행 개 정 안\n<신 설> 제16조의9(중소기업 협동연구개\n발의 촉진) 정부는 중소기업들\n의 협동연구개발을 통하여 중\n소기업들에게 공통으로 필요하\n거나 활용 가능한 기술의 개발\n을 촉진하고 성과를 공유하기\n위한 시책을 세우고 추진하여\n야 한다.",
  "full_text": "과학기술기본법 일부개정법률안\n(조인철의원 대표발의)\n발의연월일 : 2025. 3. 24.\n의 안\n9297\n번 호 발 의 자 : 조인철ㆍ장종태ㆍ오세희\n박지원ㆍ이개호ㆍ문진석\n주철현ㆍ정진욱ㆍ이해민\n안도걸ㆍ박용갑ㆍ위성곤\n의원(12인)\n제안이유 및 주요내용\n우리나라의 총 연구개발비 및 GDP 대비 투자 규모는 세계 최고 수\n준임. 그러나 중소기업이 수행하는 연구개발과제의 경우 연구개발 성\n공률은 90%를 상회하여 높게 나타나지만, 실제 제품으로 사업화되어\n매출이 발생하는 사업화 성공률의 경우는 약 50%에 불과하여 미흡한\n실정임.\n사업화 성공률은 연구개발의 실질적 성과를 나타내는 중요한 지표\n라는 측면에서 중소기업들이 산업현장에서 요구되는 공통기술에 대하\n여 국가연구개발을 통해 주도적으로 기술개발 및 사업화를 추진하여\n연구개발의 성과를 공유하고 확산시킬 필요가 있다는 지적이 있음.\n이에 정부로 하여금 중소기업들의 협동연구개발을 통하여 중소기업\n들에게 공통으로 필요하거나 활용 가능한 기술의 개발을 촉진하고 성\n과를 공유하기 위한 시책을 세우고 추진하도록 하려는 것임(안 제16조\n\n\n\n의9 신설).\n\n법률 제 호\n과학기술기본법 일부개정법률안\n과학기술기본법 일부를 다음과 같이 개정한다.\n제16조의9를 다음과 같이 신설한다.\n제16조의9(중소기업 협동연구개발의 촉진) 정부는 중소기업들의 협동\n연구개발을 통하여 중소기업들에게 공통으로 필요하거나 활용 가능\n한 기술의 개발을 촉진하고 성과를 공유하기 위한 시책을 세우고\n추진하여야 한다.\n부 칙\n이 법은 공포 후 6개월이 경과한 날부터 시행한다.\n\n\n\n\n신ㆍ구조문대비표\n현 행 개 정 안\n<신 설> 제16조의9(중소기업 협동연구개\n발의 촉진) 정부는 중소기업들\n의 협동연구개발을 통하여 중\n소기업들에게 공통으로 필요하\n거나 활용 가능한 기술의 개발\n을 촉진하고 성과를 공유하기\n위한 시책을 세우고 추진하여\n야 한다.\n",
  "sections": {
    "제안이유": "및",
    "주요내용": "우리나라의 총 연구개발비 및 GDP 대비 투자 규모는 세계 최고 수\n준임. 그러나 중소기업이 수행하는 연구개발과제의 경우 연구개발 성\n공률은 90%를 상회하여 높게 나타나지만, 실제 제품으로 사업화되어\n매출이 발생하는 사업화 성공률의 경우는 약 50%에 불과하여 미흡한\n실정임.\n사업화 성공률은 연구개발의 실질적 성과를 나타내는 중요한 지표\n라는 측면에서 중소기업들이 산업현장에서 요구되는 공통기술에 대하\n여 국가연구개발을 통해 주도적으로 기술개발 및 사업화를 추진하여\n연구개발의 성과를 공유하고 확산시킬 필요가 있다는 지적이 있음.\n이에 정부로 하여금 중소기업들의 협동연구개발을 통하여 중소기업\n들에게 공통으로 필요하거나 활용 가능한 기술의 개발을 촉진하고 성\n과를 공유하기 위한 시책을 세우고 추진하도록 하려는 것임(안 제16조\n\n\n\n의9 신설).",
    "제안이유_및_주요내용": "우리나라의 총 연구개발비 및 GDP 대비 투자 규모는 세계 최고 수\n준임. 그러나 중소기업이 수행하는 연구개발과제의 경우 연구개발 성\n공률은 90%를 상회하여 높게 나타나지만, 실제 제품으로 사업화되어\n매출이 발생하는 사업화 성공률의 경우는 약 50%에 불과하여 미흡한\n실정임.\n사업화 성공률은 연구개발의 실질적 성과를 나타내는 중요한 지표\n라는 측면에서 중소기업들이 산업현장에서 요구되는 공통기술에 대하\n여 국가연구개발을 통해 주도적으로 기술개발 및 사업화를 추진하여\n연구개발의 성과를 공유하고 확산시킬 필요가 있다는 지적이 있음.\n이에 정부로 하여금 중소기업들의 협동연구개발을 통하여 중소기업\n들에게 공통으로 필요하거나 활용 가능한 기술의 개발을 촉진하고 성\n과를 공유하기 위한 시책을 세우고 추진하도록 하려는 것임(안 제16조\n\n\n\n의9 신설).",
    "법률_제_호": "과학기술기본법 일부개정법률안\n과학기술기본법 일부를 다음과 같이 개정한다.\n제16조의9를 다음과 같이 신설한다.\n제16조의9(중소기업 협동연구개발의 촉진) 정부는 중소기업들의 협동\n연구개발을 통하여 중소기업들에게 공통으로 필요하거나 활용 가능\n한 기술의 개발을 촉진하고 성과를 공유하기 위한 시책을 세우고\n추진하여야 한다.",
    "신구조문대비표": "현 행 개 정 안\n<신 설> 제16조의9(중소기업 협동연구개\n발의 촉진) 정부는 중소기업들\n의 협동연구개발을 통하여 중\n소기업들에게 공통으로 필요하\n거나 활용 가능한 기술의 개발\n을 촉진하고 성과를 공유하기\n위한 시책을 세우고 추진하여\n야 한다."
  }
}