{
  "title": "2209699_상법_일부개정법률안",
  "bill_number": "9699",
  "proposal_date": "2025. 4. 10.",
  "submission_date": "",
  "is_alternative": false,
  "alternative_bill_numbers": [],
  "has_comparison_table": false,
  "comparison_table": "신ㆍ구조문대비표\n현 행 개 정 안\n第54條(商事法定利率) 商行爲로 第54條(商事法定利率) ----------\n因한 債務의 法定利率은 年 6 ----------------------한국은\n分으로 한다. 행에서 공시하는 기준금리, 시\n장금리, 물가상승률, 그 밖에\n경제 사정의 변동을 고려하여\n매년 대통령령으로 정한다.",
  "full_text": "상법 일부개정법률안\n(이정문의원 대표발의)\n발의연월일 : 2025. 4. 10.\n의 안\n9699\n번 호 발 의 자 : 이정문ㆍ이개호ㆍ박 정\n이인영ㆍ이학영ㆍ김남근\n한민수ㆍ이연희ㆍ김동아\n문진석ㆍ조승래ㆍ강훈식\n박수현ㆍ이훈기 의원\n(14인)\n제안이유 및 주요내용\n현행법은 상행위로 인한 채무 법정이율을 연 6%로 규정하고 있으\n나, 이는 1962년 「상법」이 제정된 이후 단 한 차례도 바뀌지 않아\n현재의 경제 현실을 반영하지 못하고 있음. 특히, 국내 대표 시장금리\n인 국고채 3년물 금리만 보더라도 최근 10년간 최저 0.8%에서 최고\n4.5%까지 변동하는 등 시장금리는 지속적으로 변화해 왔으나, 법정이\n율이 고정적으로 운영되면서 그 적정성에 대한 논란이 꾸준히 제기되\n고 있음. 또한, 일부 채권자가 변제 청구를 의도적으로 지연하여 법정\n이율이 적용되는 기간을 늘리는 방식으로 부당한 이익을 취하는 문제\n도 발생하고 있어, 법정이율이 현실적인 금리를 반영하도록 개정할 필\n요성이 있음.\n주요 해외 사례를 보면, 독일은 법정이율을 4%로 설정한 후 기준금\n\n\n\n리에 따라 6개월마다 변동하도록 하고 있으며, 미국의 경우 50개 주\n중 26개 주가 변동이율제를 채택하고 있음. 일본 또한 2017년 법 개정\n을 통해 법정이율을 3%로 인하하고, 3년마다 1%씩 조정하는 변동이\n율제를 도입하는 등 주요 국가들은 경제 상황에 맞춰 법정이율을 탄\n력적으로 운영하고 있음.\n이에 우리나라의 상사법정이율 또한 한국은행 기준금리, 시장금리,\n물가상승률, 그 밖에 경제 사정의 변동을 고려하여 매년 대통령령으로\n정하도록 함으로써 시장 상황에 부합하는 합리적인 이율을 적용하고,\n법정이율을 악용한 불공정 사례를 방지하려는 것임(안 제54조).\n\n법률 제 호\n상법 일부개정법률안\n상법 일부를 다음과 같이 개정한다.\n제54조 중 “年 6分으로 한다”를 “한국은행에서 공시하는 기준금리, 시\n장금리, 물가상승률, 그 밖에 경제 사정의 변동을 고려하여 매년 대통\n령령으로 정한다”로 한다.\n부 칙\n제1조(시행일) 이 법은 공포 후 6개월이 경과한 날부터 시행한다.\n제2조(상사법정이율에 관한 적용례) 제54조의 개정규정은 이 법 시행\n이후 발생한 이자부터 적용한다.\n제3조(상사법정이율에 관한 경과조치) 이 법 시행 전에 채무자가 지체\n책임을 진 경우 그 지연손해금에 관하여는 제54조의 개정규정에도\n불구하고 종전의 규정에 따른다.\n\n\n\n\n신ㆍ구조문대비표\n현 행 개 정 안\n第54條(商事法定利率) 商行爲로 第54條(商事法定利率) ----------\n因한 債務의 法定利率은 年 6 ----------------------한국은\n分으로 한다. 행에서 공시하는 기준금리, 시\n장금리, 물가상승률, 그 밖에\n경제 사정의 변동을 고려하여\n매년 대통령령으로 정한다.\n",
  "sections": {
    "제안이유": "및",
    "주요내용": "현행법은 상행위로 인한 채무 법정이율을 연 6%로 규정하고 있으\n나, 이는 1962년 「상법」이 제정된 이후 단 한 차례도 바뀌지 않아\n현재의 경제 현실을 반영하지 못하고 있음. 특히, 국내 대표 시장금리\n인 국고채 3년물 금리만 보더라도 최근 10년간 최저 0.8%에서 최고\n4.5%까지 변동하는 등 시장금리는 지속적으로 변화해 왔으나, 법정이\n율이 고정적으로 운영되면서 그 적정성에 대한 논란이 꾸준히 제기되\n고 있음. 또한, 일부 채권자가 변제 청구를 의도적으로 지연하여 법정\n이율이 적용되는 기간을 늘리는 방식으로 부당한 이익을 취하는 문제\n도 발생하고 있어, 법정이율이 현실적인 금리를 반영하도록 개정할 필\n요성이 있음.\n주요 해외 사례를 보면, 독일은 법정이율을 4%로 설정한 후 기준금\n\n\n\n리에 따라 6개월마다 변동하도록 하고 있으며, 미국의 경우 50개 주\n중 26개 주가 변동이율제를 채택하고 있음. 일본 또한 2017년 법 개정\n을 통해 법정이율을 3%로 인하하고, 3년마다 1%씩 조정하는 변동이\n율제를 도입하는 등 주요 국가들은 경제 상황에 맞춰 법정이율을 탄\n력적으로 운영하고 있음.\n이에 우리나라의 상사법정이율 또한 한국은행 기준금리, 시장금리,\n물가상승률, 그 밖에 경제 사정의 변동을 고려하여 매년 대통령령으로\n정하도록 함으로써 시장 상황에 부합하는 합리적인 이율을 적용하고,\n법정이율을 악용한 불공정 사례를 방지하려는 것임(안 제54조).",
    "제안이유_및_주요내용": "현행법은 상행위로 인한 채무 법정이율을 연 6%로 규정하고 있으\n나, 이는 1962년 「상법」이 제정된 이후 단 한 차례도 바뀌지 않아\n현재의 경제 현실을 반영하지 못하고 있음. 특히, 국내 대표 시장금리\n인 국고채 3년물 금리만 보더라도 최근 10년간 최저 0.8%에서 최고\n4.5%까지 변동하는 등 시장금리는 지속적으로 변화해 왔으나, 법정이\n율이 고정적으로 운영되면서 그 적정성에 대한 논란이 꾸준히 제기되\n고 있음. 또한, 일부 채권자가 변제 청구를 의도적으로 지연하여 법정\n이율이 적용되는 기간을 늘리는 방식으로 부당한 이익을 취하는 문제\n도 발생하고 있어, 법정이율이 현실적인 금리를 반영하도록 개정할 필\n요성이 있음.\n주요 해외 사례를 보면, 독일은 법정이율을 4%로 설정한 후 기준금\n\n\n\n리에 따라 6개월마다 변동하도록 하고 있으며, 미국의 경우 50개 주\n중 26개 주가 변동이율제를 채택하고 있음. 일본 또한 2017년 법 개정\n을 통해 법정이율을 3%로 인하하고, 3년마다 1%씩 조정하는 변동이\n율제를 도입하는 등 주요 국가들은 경제 상황에 맞춰 법정이율을 탄\n력적으로 운영하고 있음.\n이에 우리나라의 상사법정이율 또한 한국은행 기준금리, 시장금리,\n물가상승률, 그 밖에 경제 사정의 변동을 고려하여 매년 대통령령으로\n정하도록 함으로써 시장 상황에 부합하는 합리적인 이율을 적용하고,\n법정이율을 악용한 불공정 사례를 방지하려는 것임(안 제54조).",
    "법률_제_호": "상법 일부개정법률안\n상법 일부를 다음과 같이 개정한다.\n제54조 중 “年 6分으로 한다”를 “한국은행에서 공시하는 기준금리, 시\n장금리, 물가상승률, 그 밖에 경제 사정의 변동을 고려하여 매년 대통\n령령으로 정한다”로 한다.",
    "신구조문대비표": "현 행 개 정 안\n第54條(商事法定利率) 商行爲로 第54條(商事法定利率) ----------\n因한 債務의 法定利率은 年 6 ----------------------한국은\n分으로 한다. 행에서 공시하는 기준금리, 시\n장금리, 물가상승률, 그 밖에\n경제 사정의 변동을 고려하여\n매년 대통령령으로 정한다."
  }
}