{
  "title": "2209362_상표법_일부개정법률안",
  "bill_number": "9362",
  "proposal_date": "2025. 3. 26.",
  "submission_date": "",
  "is_alternative": false,
  "alternative_bill_numbers": [],
  "has_comparison_table": false,
  "comparison_table": "신ㆍ구조문대비표\n현 행 개 정 안\n제52조(상표전문기관의 등록취소 제52조(상표전문기관의 등록취소\n등) ① (생 략) 등) ① (현행과 같음)\n<신 설> ② 제1항제1호에 따라 등록이\n취소된 전문기관은 등록이 취\n소된 날부터 2년 이내에는 다\n시 등록을 할 수 없다.\n②ㆍ③ (생 략) ③ㆍ④ (현행 제2항 및 제3항\n과 같음)",
  "full_text": "상표법 일부개정법률안\n(김동아의원 대표발의)\n발의연월일 : 2025. 3. 26.\n의 안\n9362\n번 호 발 의 자 : 김동아ㆍ허성무ㆍ임호선\n박균택ㆍ추미애ㆍ김남근\n김영호ㆍ박정현ㆍ이정문\n김문수ㆍ허종식ㆍ한준호\n김준혁ㆍ정준호 의원\n(14인)\n제안이유 및 주요내용\n현행법은 특허청이 상표등록출원 심사 업무를 효과적으로 수행할\n수 있도록 외부기관에 상표검색, 상표분류 등 상표심사업무의 일부를\n의뢰할 수 있도록 규정하고 있음. 또 특허청으로부터 관련 업무를 의\n뢰받아 수행하려는 자는 상표전문기관으로 등록하여야 함.\n그런데 현행법상 상표전문기관 관리에 필요한 일부 규정이 미비하\n여 개선이 필요하다는 지적이 있음.\n이에 거짓이나 그 밖의 부정한 방법으로 상표전문기관으로 등록한\n경우, 그 등록을 취소하면서 등록이 취소된 날로부터 2년 이내에는 재\n등록할 수 없도록 제도를 보완하려는 것임(안 제52조).\n\n\n\n\n법률 제 호\n상표법 일부개정법률안\n상표법 일부를 다음과 같이 개정한다.\n제52조제2항 및 제3항을 각각 제3항 및 제4항으로 하고, 같은 조에 제\n2항을 다음과 같이 신설한다.\n② 제1항제1호에 따라 등록이 취소된 전문기관은 등록이 취소된 날\n부터 2년 이내에는 다시 등록을 할 수 없다.\n부 칙\n제1조(시행일) 이 법은 공포 후 6개월이 경과한 날부터 시행한다.\n제2조(전문기관의 등록 제한에 관한 적용례) 제52조제2항의 개정규정\n은 이 법 시행 이후 등록이 취소된 전문기관부터 적용한다.\n\n\n\n\n신ㆍ구조문대비표\n현 행 개 정 안\n제52조(상표전문기관의 등록취소 제52조(상표전문기관의 등록취소\n등) ① (생 략) 등) ① (현행과 같음)\n<신 설> ② 제1항제1호에 따라 등록이\n취소된 전문기관은 등록이 취\n소된 날부터 2년 이내에는 다\n시 등록을 할 수 없다.\n②ㆍ③ (생 략) ③ㆍ④ (현행 제2항 및 제3항\n과 같음)\n",
  "sections": {
    "제안이유": "및",
    "주요내용": "현행법은 특허청이 상표등록출원 심사 업무를 효과적으로 수행할\n수 있도록 외부기관에 상표검색, 상표분류 등 상표심사업무의 일부를\n의뢰할 수 있도록 규정하고 있음. 또 특허청으로부터 관련 업무를 의\n뢰받아 수행하려는 자는 상표전문기관으로 등록하여야 함.\n그런데 현행법상 상표전문기관 관리에 필요한 일부 규정이 미비하\n여 개선이 필요하다는 지적이 있음.\n이에 거짓이나 그 밖의 부정한 방법으로 상표전문기관으로 등록한\n경우, 그 등록을 취소하면서 등록이 취소된 날로부터 2년 이내에는 재\n등록할 수 없도록 제도를 보완하려는 것임(안 제52조).",
    "제안이유_및_주요내용": "현행법은 특허청이 상표등록출원 심사 업무를 효과적으로 수행할\n수 있도록 외부기관에 상표검색, 상표분류 등 상표심사업무의 일부를\n의뢰할 수 있도록 규정하고 있음. 또 특허청으로부터 관련 업무를 의\n뢰받아 수행하려는 자는 상표전문기관으로 등록하여야 함.\n그런데 현행법상 상표전문기관 관리에 필요한 일부 규정이 미비하\n여 개선이 필요하다는 지적이 있음.\n이에 거짓이나 그 밖의 부정한 방법으로 상표전문기관으로 등록한\n경우, 그 등록을 취소하면서 등록이 취소된 날로부터 2년 이내에는 재\n등록할 수 없도록 제도를 보완하려는 것임(안 제52조).",
    "법률_제_호": "상표법 일부개정법률안\n상표법 일부를 다음과 같이 개정한다.\n제52조제2항 및 제3항을 각각 제3항 및 제4항으로 하고, 같은 조에 제\n2항을 다음과 같이 신설한다.\n② 제1항제1호에 따라 등록이 취소된 전문기관은 등록이 취소된 날\n부터 2년 이내에는 다시 등록을 할 수 없다.",
    "신구조문대비표": "현 행 개 정 안\n제52조(상표전문기관의 등록취소 제52조(상표전문기관의 등록취소\n등) ① (생 략) 등) ① (현행과 같음)\n<신 설> ② 제1항제1호에 따라 등록이\n취소된 전문기관은 등록이 취\n소된 날부터 2년 이내에는 다\n시 등록을 할 수 없다.\n②ㆍ③ (생 략) ③ㆍ④ (현행 제2항 및 제3항\n과 같음)"
  }
}