{
  "title": "2209724_고등·평생교육지원특별회계법_일부개정법률안",
  "bill_number": "9724",
  "proposal_date": "2025. 4. 10.",
  "submission_date": "",
  "is_alternative": false,
  "alternative_bill_numbers": [],
  "has_comparison_table": false,
  "comparison_table": "신ㆍ구조문대비표\n현 행 개 정 안\n법률 제19202호 고등ㆍ평생교육 법률 제19202호 고등ㆍ평생교육\n지원특별회계법 ",
  "full_text": "고등ㆍ평생교육지원특별회계법 일부개정법률안\n(김준혁의원 대표발의)\n발의연월일 : 2025. 4. 10.\n의 안\n9724\n번 호 발 의 자 : 김준혁ㆍ박희승ㆍ이수진\n권칠승ㆍ김영환ㆍ안규백\n김재원ㆍ손명수ㆍ부승찬\n정을호ㆍ김문수ㆍ박정현\n강유정 의원(13인)\n제안이유 및 주요내용\n최근 대학의 재정난이 심각해지면서 서울과 수도권 일부를 제외한\n지방의 상당수 대학들이 존폐위기를 겪고 있음. 뿐만 아니라 많은 대\n학들이 재정난을 이유로 등록금 인상을 추진하고 있어 고등교육에 대\n한 국가재정 투입의 필요성이 강조되고 있음.\n그러나 우리나라는 고등교육 이수율이 69.7%로 OECD 1위임에도\n불구하고 GDP 대비 정부 지출 고등교육 공교육비 비율은 0.7%로, 정\n부 재정 투입이 OECD 평균보다 낮은 수준임 .\n이러한 상황에서 대학의 미래 인재양성 역량을 강화하고 교육ㆍ연\n구, 운영 여건 개선 등을 지원하기 위해 2023년 고등ㆍ평생교육지원특\n별회계가 3년 한시로 설치되었으나, 2025년 12월 31일 일몰을 앞두고\n있는 상태임.\n이에 고등ㆍ평생교육지원특별회계의 일몰기한에 관한 부칙 규정을\n\n\n\n삭제하여 대학의 안정적 재정 운영을 도모하고 대학 역량 강화에 기\n여하도록 하려는 것임(안 법률 제19202호 고등ㆍ평생교육지원특별회계\n법 부칙 제2조 삭제).\n\n법률 제 호\n고등ㆍ평생교육지원특별회계법 일부개정법률안\n고등ㆍ평생교육지원특별회계법 일부를 다음과 같이 개정한다.\n법률 제19202호 고등ㆍ평생교육지원특별회계법 부칙 제2조를 삭제한\n다.\n부 칙\n이 법은 공포한 날부터 시행한다.\n\n\n\n\n신ㆍ구조문대비표\n현 행 개 정 안\n법률 제19202호 고등ㆍ평생교육 법률 제19202호 고등ㆍ평생교육\n지원특별회계법 부칙 지원특별회계법 부칙\n제2조(유효기간) 이 법은 2025년 <삭 제>\n12월 31일까지 효력을 가진다.\n",
  "sections": {
    "제안이유": "및",
    "주요내용": "최근 대학의 재정난이 심각해지면서 서울과 수도권 일부를 제외한\n지방의 상당수 대학들이 존폐위기를 겪고 있음. 뿐만 아니라 많은 대\n학들이 재정난을 이유로 등록금 인상을 추진하고 있어 고등교육에 대\n한 국가재정 투입의 필요성이 강조되고 있음.\n그러나 우리나라는 고등교육 이수율이 69.7%로 OECD 1위임에도\n불구하고 GDP 대비 정부 지출 고등교육 공교육비 비율은 0.7%로, 정\n부 재정 투입이 OECD 평균보다 낮은 수준임 .\n이러한 상황에서 대학의 미래 인재양성 역량을 강화하고 교육ㆍ연\n구, 운영 여건 개선 등을 지원하기 위해 2023년 고등ㆍ평생교육지원특\n별회계가 3년 한시로 설치되었으나, 2025년 12월 31일 일몰을 앞두고\n있는 상태임.\n이에 고등ㆍ평생교육지원특별회계의 일몰기한에 관한 부칙 규정을\n\n\n\n삭제하여 대학의 안정적 재정 운영을 도모하고 대학 역량 강화에 기\n여하도록 하려는 것임(안",
    "제안이유_및_주요내용": "최근 대학의 재정난이 심각해지면서 서울과 수도권 일부를 제외한\n지방의 상당수 대학들이 존폐위기를 겪고 있음. 뿐만 아니라 많은 대\n학들이 재정난을 이유로 등록금 인상을 추진하고 있어 고등교육에 대\n한 국가재정 투입의 필요성이 강조되고 있음.\n그러나 우리나라는 고등교육 이수율이 69.7%로 OECD 1위임에도\n불구하고 GDP 대비 정부 지출 고등교육 공교육비 비율은 0.7%로, 정\n부 재정 투입이 OECD 평균보다 낮은 수준임 .\n이러한 상황에서 대학의 미래 인재양성 역량을 강화하고 교육ㆍ연\n구, 운영 여건 개선 등을 지원하기 위해 2023년 고등ㆍ평생교육지원특\n별회계가 3년 한시로 설치되었으나, 2025년 12월 31일 일몰을 앞두고\n있는 상태임.\n이에 고등ㆍ평생교육지원특별회계의 일몰기한에 관한 부칙 규정을\n\n\n\n삭제하여 대학의 안정적 재정 운영을 도모하고 대학 역량 강화에 기\n여하도록 하려는 것임(안",
    "법률_제_호": "고등ㆍ평생교육지원특별회계\n법",
    "신구조문대비표": "현 행 개 정 안\n법률 제19202호 고등ㆍ평생교육 법률 제19202호 고등ㆍ평생교육\n지원특별회계법"
  }
}