{
  "title": "2209368_도서관법_일부개정법률안",
  "bill_number": "9368",
  "proposal_date": "2025. 3. 26.",
  "submission_date": "",
  "is_alternative": false,
  "alternative_bill_numbers": [],
  "has_comparison_table": false,
  "comparison_table": "신ㆍ구조문대비표\n현 행 개 정 안\n제41조(전문도서관ㆍ특수도서관 제41조(전문도서관ㆍ특수도서관\n의 설치 등) ① ∼ ③ (생 략) 의 설치 등) ① ∼ ③ (현행과\n같음)\n<신 설> ④ 제1항에 따른 전문도서관\n및 특수도서관의 설립ㆍ운영에\n관하여 필요한 사항은 대통령\n령으로 정한다.",
  "full_text": "도서관법 일부개정법률안\n(김병기의원 대표발의)\n발의연월일 : 2025. 3. 26.\n의 안\n9368\n번 호 발 의 자 : 김병기ㆍ장종태ㆍ강훈식\n박지원ㆍ강준현ㆍ한준호\n김남근ㆍ허 영ㆍ김주영\n조계원 의원(10인)\n제안이유 및 주요내용\n현행법은 전문도서관과 특수도서관의 목적 및 역할을 규정하고, 해\n당 도서관을 국가, 지방자치단체, 법인, 단체 또는 개인이 설립할 수\n있도록 하고 있음.\n전문도서관은 학술 및 연구 활동에 필요한 도서관자료를 수집ㆍ정\n리ㆍ보존하는 등의 역할을 수행하도록 하고, 특수도서관은 병원, 병영,\n교정시설 등 특수한 환경에 처한 사람의 학습과 독서, 여가 등에 필요\n한 서비스를 제공하도록 하고 있는데, 설립ㆍ운영 등에 관한 별도의\n근거 규정이 없어 그 역할을 수행하는 데에 어려움이 있는 상황임.\n이에 전문도서관 및 특수도서관의 설립ㆍ운영에 관하여 필요한 사\n항을 대통령령으로 정하도록 하여 해당 도서관의 역할을 원활히 수행\n할 수 있도록 함으로써 국민의 지식정보 접근성 강화에 기여하려는\n것임(안 제41조제4항 신설).\n\n\n\n\n법률 제 호\n도서관법 일부개정법률안\n도서관법 일부를 다음과 같이 개정한다.\n제41조에 제4항을 다음과 같이 신설한다.\n④ 제1항에 따른 전문도서관 및 특수도서관의 설립ㆍ운영에 관하여\n필요한 사항은 대통령령으로 정한다.\n부 칙\n이 법은 공포 후 6개월이 경과한 날부터 시행한다.\n\n\n\n\n신ㆍ구조문대비표\n현 행 개 정 안\n제41조(전문도서관ㆍ특수도서관 제41조(전문도서관ㆍ특수도서관\n의 설치 등) ① ∼ ③ (생 략) 의 설치 등) ① ∼ ③ (현행과\n같음)\n<신 설> ④ 제1항에 따른 전문도서관\n및 특수도서관의 설립ㆍ운영에\n관하여 필요한 사항은 대통령\n령으로 정한다.\n",
  "sections": {
    "제안이유": "및",
    "주요내용": "현행법은 전문도서관과 특수도서관의 목적 및 역할을 규정하고, 해\n당 도서관을 국가, 지방자치단체, 법인, 단체 또는 개인이 설립할 수\n있도록 하고 있음.\n전문도서관은 학술 및 연구 활동에 필요한 도서관자료를 수집ㆍ정\n리ㆍ보존하는 등의 역할을 수행하도록 하고, 특수도서관은 병원, 병영,\n교정시설 등 특수한 환경에 처한 사람의 학습과 독서, 여가 등에 필요\n한 서비스를 제공하도록 하고 있는데, 설립ㆍ운영 등에 관한 별도의\n근거 규정이 없어 그 역할을 수행하는 데에 어려움이 있는 상황임.\n이에 전문도서관 및 특수도서관의 설립ㆍ운영에 관하여 필요한 사\n항을 대통령령으로 정하도록 하여 해당 도서관의 역할을 원활히 수행\n할 수 있도록 함으로써 국민의 지식정보 접근성 강화에 기여하려는\n것임(안 제41조제4항 신설).",
    "제안이유_및_주요내용": "현행법은 전문도서관과 특수도서관의 목적 및 역할을 규정하고, 해\n당 도서관을 국가, 지방자치단체, 법인, 단체 또는 개인이 설립할 수\n있도록 하고 있음.\n전문도서관은 학술 및 연구 활동에 필요한 도서관자료를 수집ㆍ정\n리ㆍ보존하는 등의 역할을 수행하도록 하고, 특수도서관은 병원, 병영,\n교정시설 등 특수한 환경에 처한 사람의 학습과 독서, 여가 등에 필요\n한 서비스를 제공하도록 하고 있는데, 설립ㆍ운영 등에 관한 별도의\n근거 규정이 없어 그 역할을 수행하는 데에 어려움이 있는 상황임.\n이에 전문도서관 및 특수도서관의 설립ㆍ운영에 관하여 필요한 사\n항을 대통령령으로 정하도록 하여 해당 도서관의 역할을 원활히 수행\n할 수 있도록 함으로써 국민의 지식정보 접근성 강화에 기여하려는\n것임(안 제41조제4항 신설).",
    "법률_제_호": "도서관법 일부개정법률안\n도서관법 일부를 다음과 같이 개정한다.\n제41조에 제4항을 다음과 같이 신설한다.\n④ 제1항에 따른 전문도서관 및 특수도서관의 설립ㆍ운영에 관하여\n필요한 사항은 대통령령으로 정한다.",
    "신구조문대비표": "현 행 개 정 안\n제41조(전문도서관ㆍ특수도서관 제41조(전문도서관ㆍ특수도서관\n의 설치 등) ① ∼ ③ (생 략) 의 설치 등) ① ∼ ③ (현행과\n같음)\n<신 설> ④ 제1항에 따른 전문도서관\n및 특수도서관의 설립ㆍ운영에\n관하여 필요한 사항은 대통령\n령으로 정한다."
  }
}