{
  "title": "2209431_한국환경공단법_일부개정법률안",
  "bill_number": "9431",
  "proposal_date": "2025. 3. 28.",
  "submission_date": "",
  "is_alternative": false,
  "alternative_bill_numbers": [],
  "has_comparison_table": false,
  "comparison_table": "신ㆍ구조문대비표\n현 행 개 정 안\n제34조(과태료) ① 제6조를 위반 제34조(과태료) ① -------------\n하여 유사명칭을 사용한 자에 ----------------------------\n게는 100만원 이하의 과태료를 ---500만원------------------\n부과한다. -------.\n② (생 략) ② (현행과 같음)",
  "full_text": "한국환경공단법 일부개정법률안\n(김상욱의원 대표발의)\n발의연월일 : 2025. 3. 28.\n의 안\n9431\n번 호 발 의 자 : 김상욱ㆍ김선교ㆍ조지연\n박준태ㆍ박덕흠ㆍ김기현\n최형두ㆍ김예지ㆍ이종배\n서천호ㆍ성일종 의원\n(11인)\n제안이유 및 주요내용\n현행법은 한국환경공단이 아닌 자는 한국환경공단 또는 이와 유사\n한 명칭을 사용하지 못하도록 하고, 이를 위반하는 경우에는 100만원\n이하의 과태료를 부과하도록 하고 있음.\n그런데 최근 공공기관ㆍ특수법인 등의 명칭과 동일 또는 유사한 명\n칭을 사용한 사기 등 각종 범죄의 증가로 사회적 피해가 증가하고 있\n어 이에 대한 제재수준을 강화할 필요가 있음.\n또한 한국산업인력공단, 한국환경산업기술원 등 다른 유사한 공공기\n관의 경우와 비교하여 과태료 수준이 낮아 이를 합리적으로 조정할\n필요가 있음.\n이에 한국환경공단 또는 이와 비슷한 명칭을 사용한 자에 대한 과\n태료를 현행 100만원 이하에서 500만원 이하로 상향하여 처벌을 강화\n하려는 것임(안 제34조제1항).\n\n\n\n\n법률 제 호\n한국환경공단법 일부개정법률안\n한국환경공단법 일부를 다음과 같이 개정한다.\n제34조제1항 중 “100만원”을 “500만원”으로 한다.\n부 칙\n이 법은 공포 후 6개월이 경과한 날부터 시행한다.\n\n\n\n\n신ㆍ구조문대비표\n현 행 개 정 안\n제34조(과태료) ① 제6조를 위반 제34조(과태료) ① -------------\n하여 유사명칭을 사용한 자에 ----------------------------\n게는 100만원 이하의 과태료를 ---500만원------------------\n부과한다. -------.\n② (생 략) ② (현행과 같음)\n",
  "sections": {
    "제안이유": "및",
    "주요내용": "현행법은 한국환경공단이 아닌 자는 한국환경공단 또는 이와 유사\n한 명칭을 사용하지 못하도록 하고, 이를 위반하는 경우에는 100만원\n이하의 과태료를 부과하도록 하고 있음.\n그런데 최근 공공기관ㆍ특수법인 등의 명칭과 동일 또는 유사한 명\n칭을 사용한 사기 등 각종 범죄의 증가로 사회적 피해가 증가하고 있\n어 이에 대한 제재수준을 강화할 필요가 있음.\n또한 한국산업인력공단, 한국환경산업기술원 등 다른 유사한 공공기\n관의 경우와 비교하여 과태료 수준이 낮아 이를 합리적으로 조정할\n필요가 있음.\n이에 한국환경공단 또는 이와 비슷한 명칭을 사용한 자에 대한 과\n태료를 현행 100만원 이하에서 500만원 이하로 상향하여 처벌을 강화\n하려는 것임(안 제34조제1항).",
    "제안이유_및_주요내용": "현행법은 한국환경공단이 아닌 자는 한국환경공단 또는 이와 유사\n한 명칭을 사용하지 못하도록 하고, 이를 위반하는 경우에는 100만원\n이하의 과태료를 부과하도록 하고 있음.\n그런데 최근 공공기관ㆍ특수법인 등의 명칭과 동일 또는 유사한 명\n칭을 사용한 사기 등 각종 범죄의 증가로 사회적 피해가 증가하고 있\n어 이에 대한 제재수준을 강화할 필요가 있음.\n또한 한국산업인력공단, 한국환경산업기술원 등 다른 유사한 공공기\n관의 경우와 비교하여 과태료 수준이 낮아 이를 합리적으로 조정할\n필요가 있음.\n이에 한국환경공단 또는 이와 비슷한 명칭을 사용한 자에 대한 과\n태료를 현행 100만원 이하에서 500만원 이하로 상향하여 처벌을 강화\n하려는 것임(안 제34조제1항).",
    "법률_제_호": "한국환경공단법 일부개정법률안\n한국환경공단법 일부를 다음과 같이 개정한다.\n제34조제1항 중 “100만원”을 “500만원”으로 한다.",
    "신구조문대비표": "현 행 개 정 안\n제34조(과태료) ① 제6조를 위반 제34조(과태료) ① -------------\n하여 유사명칭을 사용한 자에 ----------------------------\n게는 100만원 이하의 과태료를 ---500만원------------------\n부과한다. -------.\n② (생 략) ② (현행과 같음)"
  }
}