{
  "title": "2209172_유아교육지원특별회계법_일부개정법률안",
  "bill_number": "9172",
  "proposal_date": "2025. 3. 20.",
  "submission_date": "",
  "is_alternative": false,
  "alternative_bill_numbers": [],
  "has_comparison_table": false,
  "comparison_table": "신ㆍ구조문대비표\n현 행 개 정 안\n법률 제14395호 유아교육지원특 법률 제14395호 유아교육지원특\n별회계법 ",
  "full_text": "유아교육지원특별회계법 일부개정법률안\n(윤준병의원 대표발의)\n발의연월일 : 2025. 3. 20.\n의 안\n9172\n번 호 발 의 자 : 윤준병ㆍ박민규ㆍ주철현\n조계원ㆍ정동영ㆍ박홍배\n이원택ㆍ박희승ㆍ이춘석\n허 영ㆍ김우영ㆍ김태선\n의원(12인)\n제안이유 및 주요내용\n유아교육지원특별회계는 유아교육 및 보육을 통합한 공통의 교육ㆍ\n보육과정 정책의 안정적인 추진을 위하여 설치되어 교육부장관이 운\n용ㆍ관리하는 특별회계임.\n한편, 유아교육지원특별회계와 관련한 내용을 규정하는 「유아교육\n지원특별회계법」은 2017년 1월 1일 첫 시행된 이후 2025년 12월 31\n일 그 유효기간이 만료될 예정인데, 유아교육 및 보육을 통합하려는\n유보통합 정책은 이제 첫발을 떼었을 뿐 제도의 실질을 갖추고 정착\n하기 위해서는 아직 더 많은 추진력이 필요한 상황임.\n이에 법의 유효기간을 5년 연장하여 유보통합 정책의 안정적인 추\n진을 지원하려는 것임(안 법률 제14395호 유아교육지원특별회계법 부\n칙 제2조).\n\n\n\n\n법률 제 호\n유아교육지원특별회계법 일부개정법률안\n유아교육지원특별회계법 일부를 다음과 같이 개정한다.\n법률 제14395호 유아교육지원특별회계법 부칙(법률 제16675호 유아교\n육지원특별회계법 일부개정법률 및 법률 제19203호 유아교육지원특별\n회계법 일부개정법률에 따라 각각 개정된 내용을 포함한다) 제2조 중\n“2025년”을 “2030년”으로 한다.\n부 칙\n이 법은 공포한 날부터 시행한다.\n\n\n\n\n신ㆍ구조문대비표\n현 행 개 정 안\n법률 제14395호 유아교육지원특 법률 제14395호 유아교육지원특\n별회계법 부칙 별회계법 부칙\n제2조(유효기간) 이 법은 2025년 제2조(유효기간) --------2030년-\n12월 31일까지 효력을 가진다. ---------------------------.\n",
  "sections": {
    "제안이유": "및",
    "주요내용": "유아교육지원특별회계는 유아교육 및 보육을 통합한 공통의 교육ㆍ\n보육과정 정책의 안정적인 추진을 위하여 설치되어 교육부장관이 운\n용ㆍ관리하는 특별회계임.\n한편, 유아교육지원특별회계와 관련한 내용을 규정하는 「유아교육\n지원특별회계법」은 2017년 1월 1일 첫 시행된 이후 2025년 12월 31\n일 그 유효기간이 만료될 예정인데, 유아교육 및 보육을 통합하려는\n유보통합 정책은 이제 첫발을 떼었을 뿐 제도의 실질을 갖추고 정착\n하기 위해서는 아직 더 많은 추진력이 필요한 상황임.\n이에 법의 유효기간을 5년 연장하여 유보통합 정책의 안정적인 추\n진을 지원하려는 것임(안",
    "제안이유_및_주요내용": "유아교육지원특별회계는 유아교육 및 보육을 통합한 공통의 교육ㆍ\n보육과정 정책의 안정적인 추진을 위하여 설치되어 교육부장관이 운\n용ㆍ관리하는 특별회계임.\n한편, 유아교육지원특별회계와 관련한 내용을 규정하는 「유아교육\n지원특별회계법」은 2017년 1월 1일 첫 시행된 이후 2025년 12월 31\n일 그 유효기간이 만료될 예정인데, 유아교육 및 보육을 통합하려는\n유보통합 정책은 이제 첫발을 떼었을 뿐 제도의 실질을 갖추고 정착\n하기 위해서는 아직 더 많은 추진력이 필요한 상황임.\n이에 법의 유효기간을 5년 연장하여 유보통합 정책의 안정적인 추\n진을 지원하려는 것임(안",
    "법률_제_호": "유아교육지원특별회계법",
    "신구조문대비표": "현 행 개 정 안\n법률 제14395호 유아교육지원특 법률 제14395호 유아교육지원특\n별회계법"
  }
}