{
  "title": "2209972_고향사랑_기부금에_관한_법률_일부개정법률안",
  "bill_number": "9972",
  "proposal_date": "2025. 4. 21.",
  "submission_date": "",
  "is_alternative": false,
  "alternative_bill_numbers": [],
  "has_comparison_table": false,
  "comparison_table": "신ㆍ구조문대비표\n현 행 개 정 안\n제8조(고향사랑 기부금의 접수 제8조(고향사랑 기부금의 접수\n및 상한액) ①ㆍ② (생 략) 및 상한액) ①ㆍ② (현행과 같\n음)\n③ 개인별 고향사랑 기부금의 ③ ----------------------\n연간 상한액은 2천만원으로 한 ------------------------\n다. <단서 신설> --. 다만, 「재난 및 안전관리\n기본법」 제60조에 따라 특별\n재난지역으로 선포된 지역의\n지방자치단체에 특별재난지역\n선포일로부터 대통령령으로 정\n하는 기간 이내에 기부한 경우\n에는 상한액을 정하지 아니한\n다.\n④ (생 략) ④ (현행과 같음)",
  "full_text": "고향사랑 기부금에 관한 법률 일부개정법률안\n(이만희의원 대표발의)\n발의연월일 : 2025. 4. 21.\n의 안\n9972\n번 호 발 의 자 : 이만희ㆍ서천호ㆍ정희용\n김태호ㆍ최은석ㆍ박성민\n서명옥ㆍ조은희ㆍ엄태영\n이달희ㆍ이성권ㆍ김선교\n송언석ㆍ박형수ㆍ임종득\n김형동ㆍ이상휘ㆍ구자근\n강명구ㆍ김정재ㆍ조지연\n김석기ㆍ임이자 의원\n(23인)\n제안이유\n최근 대규모 산불로 인한 피해극복을 위해 고향사랑기부를 통해 많\n은 국민들이 위로의 마음을 전하고 있으나, 현행법은 개인의 고향사랑\n기부금 상한액을 2천만원으로 정하고 있어 기부 활성화를 저해한다는\n지적이 있음.\n주요내용\n이에 특별재난지역으로 선포된 지역의 지방자치단체에 기부하는 경\n우에는 기부금 한도를 없애 고향사랑 기부금 제도를 보다 활성화하고,\n\n\n\n특별재난지역으로 선포된 지역의 지방자치단체가 신속하게 산불 등으\n로 인한 피해를 극복할 수 있게 하려는 것임(안 제8조제3항).\n참고사항\n이 법률안은 이만희의원이 대표발의한 「조세특례제한법 일부개정\n법률안」(의안번호 제9971호)의 의결을 전제로 하는 것이므로 같은 법\n률안이 의결되지 아니하거나 수정의결되는 경우에는 이에 맞추어 조\n정되어야 할 것임.\n\n법률 제 호\n고향사랑 기부금에 관한 법률 일부개정법률안\n고향사랑 기부금에 관한 법률 일부를 다음과 같이 개정한다.\n제8조제3항에 단서를 다음과 같이 신설한다.\n다만, 「재난 및 안전관리 기본법」 제60조에 따라 특별재난지역으\n로 선포된 지역의 지방자치단체에 특별재난지역 선포일로부터 대통\n령령으로 정하는 기간 이내에 기부한 경우에는 상한액을 정하지 아\n니한다.\n부 칙\n이 법은 공포 후 3개월이 경과한 날부터 시행한다.\n\n\n\n\n신ㆍ구조문대비표\n현 행 개 정 안\n제8조(고향사랑 기부금의 접수 제8조(고향사랑 기부금의 접수\n및 상한액) ①ㆍ② (생 략) 및 상한액) ①ㆍ② (현행과 같\n음)\n③ 개인별 고향사랑 기부금의 ③ ----------------------\n연간 상한액은 2천만원으로 한 ------------------------\n다. <단서 신설> --. 다만, 「재난 및 안전관리\n기본법」 제60조에 따라 특별\n재난지역으로 선포된 지역의\n지방자치단체에 특별재난지역\n선포일로부터 대통령령으로 정\n하는 기간 이내에 기부한 경우\n에는 상한액을 정하지 아니한\n다.\n④ (생 략) ④ (현행과 같음)\n",
  "sections": {
    "제안이유": "최근 대규모 산불로 인한 피해극복을 위해 고향사랑기부를 통해 많\n은 국민들이 위로의 마음을 전하고 있으나, 현행법은 개인의 고향사랑\n기부금 상한액을 2천만원으로 정하고 있어 기부 활성화를 저해한다는\n지적이 있음.",
    "주요내용": "이에 특별재난지역으로 선포된 지역의 지방자치단체에 기부하는 경\n우에는 기부금 한도를 없애 고향사랑 기부금 제도를 보다 활성화하고,\n\n\n\n특별재난지역으로 선포된 지역의 지방자치단체가 신속하게 산불 등으\n로 인한 피해를 극복할 수 있게 하려는 것임(안 제8조제3항).",
    "법률_제_호": "고향사랑 기부금에 관한 법률 일부개정법률안\n고향사랑 기부금에 관한 법률 일부를 다음과 같이 개정한다.\n제8조제3항에 단서를 다음과 같이 신설한다.\n다만, 「재난 및 안전관리 기본법」 제60조에 따라 특별재난지역으\n로 선포된 지역의 지방자치단체에 특별재난지역 선포일로부터 대통\n령령으로 정하는 기간 이내에 기부한 경우에는 상한액을 정하지 아\n니한다.",
    "신구조문대비표": "현 행 개 정 안\n제8조(고향사랑 기부금의 접수 제8조(고향사랑 기부금의 접수\n및 상한액) ①ㆍ② (생 략) 및 상한액) ①ㆍ② (현행과 같\n음)\n③ 개인별 고향사랑 기부금의 ③ ----------------------\n연간 상한액은 2천만원으로 한 ------------------------\n다. <단서 신설> --. 다만, 「재난 및 안전관리\n기본법」 제60조에 따라 특별\n재난지역으로 선포된 지역의\n지방자치단체에 특별재난지역\n선포일로부터 대통령령으로 정\n하는 기간 이내에 기부한 경우\n에는 상한액을 정하지 아니한\n다.\n④ (생 략) ④ (현행과 같음)"
  }
}