{
  "title": "2209488_공휴일에_관한_법률_일부개정법률안",
  "bill_number": "9488",
  "proposal_date": "2025. 3. 31.",
  "submission_date": "",
  "is_alternative": false,
  "alternative_bill_numbers": [],
  "has_comparison_table": false,
  "comparison_table": "신ㆍ구조문대비표\n현 행 개 정 안\n제2조(공휴일) 공휴일은 다음 각 제2조(공휴일) --------------\n호와 같다. -----------.\n1. ∼ 3. (생 략) 1. ∼ 3. (현행과 같음)\n<신 설> 4. 식목일(4월 5일)\n4. ∼ 10. (생 략) 5. ∼ 11. (현행 제4호부터 제1\n0호까지와 같음)",
  "full_text": "공휴일에 관한 법률 일부개정법률안\n(이인선의원 대표발의)\n발의연월일 : 2025. 3. 31.\n의 안\n9488\n번 호 발 의 자 : 이인선ㆍ강선영ㆍ고동진\n김성원ㆍ박충권ㆍ정동만\n백종헌ㆍ김희정ㆍ정점식\n천하람 의원(10인)\n제안이유 및 주요내용\n식목일(4월 5일)은 이전 「관공서의 공휴일에 관한 규정」에 따른\n공휴일이었으나, 2005년 6월 규정이 개정되며 공휴일에서 제외된 바\n있음.\n그러나 최근 산림청에 따르면 2017년부터 2023년까지 32건의 대형\n산불로 3만5357ha 규모의 산림 피해가 발생하였고, 최근 영남지역 대\n형산불로 피해가 빠르게 확산중에 있어 어느 때보다 산림 조성에 큰\n관심을 갖고 노력하여야 할 시기라는 의견이 있음.\n이에 산불로 인한 국민 경각심을 고취하고, 소실된 산림자원을 복귀\n하는 한편, 미세먼지 등의 환경문제에 대응하기 위해 4월 5일 식목일\n을 공휴일로 지정하려는 것임(안 제2조제4호 신설).\n\n\n\n\n법률 제 호\n공휴일에 관한 법률 일부개정법률안\n공휴일에 관한 법률 일부를 다음과 같이 개정한다.\n제2조제4호부터 제10호까지를 각각 제5호부터 제11호까지로 하고, 같\n은 조에 제4호를 다음과 같이 신설한다.\n4. 식목일(4월 5일)\n부 칙\n이 법은 공포한 날부터 시행한다.\n\n\n\n\n신ㆍ구조문대비표\n현 행 개 정 안\n제2조(공휴일) 공휴일은 다음 각 제2조(공휴일) --------------\n호와 같다. -----------.\n1. ∼ 3. (생 략) 1. ∼ 3. (현행과 같음)\n<신 설> 4. 식목일(4월 5일)\n4. ∼ 10. (생 략) 5. ∼ 11. (현행 제4호부터 제1\n0호까지와 같음)\n",
  "sections": {
    "제안이유": "및",
    "주요내용": "식목일(4월 5일)은 이전 「관공서의 공휴일에 관한 규정」에 따른\n공휴일이었으나, 2005년 6월 규정이 개정되며 공휴일에서 제외된 바\n있음.\n그러나 최근 산림청에 따르면 2017년부터 2023년까지 32건의 대형\n산불로 3만5357ha 규모의 산림 피해가 발생하였고, 최근 영남지역 대\n형산불로 피해가 빠르게 확산중에 있어 어느 때보다 산림 조성에 큰\n관심을 갖고 노력하여야 할 시기라는 의견이 있음.\n이에 산불로 인한 국민 경각심을 고취하고, 소실된 산림자원을 복귀\n하는 한편, 미세먼지 등의 환경문제에 대응하기 위해 4월 5일 식목일\n을 공휴일로 지정하려는 것임(안 제2조제4호 신설).",
    "제안이유_및_주요내용": "식목일(4월 5일)은 이전 「관공서의 공휴일에 관한 규정」에 따른\n공휴일이었으나, 2005년 6월 규정이 개정되며 공휴일에서 제외된 바\n있음.\n그러나 최근 산림청에 따르면 2017년부터 2023년까지 32건의 대형\n산불로 3만5357ha 규모의 산림 피해가 발생하였고, 최근 영남지역 대\n형산불로 피해가 빠르게 확산중에 있어 어느 때보다 산림 조성에 큰\n관심을 갖고 노력하여야 할 시기라는 의견이 있음.\n이에 산불로 인한 국민 경각심을 고취하고, 소실된 산림자원을 복귀\n하는 한편, 미세먼지 등의 환경문제에 대응하기 위해 4월 5일 식목일\n을 공휴일로 지정하려는 것임(안 제2조제4호 신설).",
    "법률_제_호": "공휴일에 관한 법률 일부개정법률안\n공휴일에 관한 법률 일부를 다음과 같이 개정한다.\n제2조제4호부터 제10호까지를 각각 제5호부터 제11호까지로 하고, 같\n은 조에 제4호를 다음과 같이 신설한다.\n4. 식목일(4월 5일)",
    "신구조문대비표": "현 행 개 정 안\n제2조(공휴일) 공휴일은 다음 각 제2조(공휴일) --------------\n호와 같다. -----------.\n1. ∼ 3. (생 략) 1. ∼ 3. (현행과 같음)\n<신 설> 4. 식목일(4월 5일)\n4. ∼ 10. (생 략) 5. ∼ 11. (현행 제4호부터 제1\n0호까지와 같음)"
  }
}