{
  "title": "2209437_한국도로교통공단법_일부개정법률안",
  "bill_number": "9437",
  "proposal_date": "2025. 3. 28.",
  "submission_date": "",
  "is_alternative": false,
  "alternative_bill_numbers": [],
  "has_comparison_table": false,
  "comparison_table": "신·구조문대비표\n현 행 개 정 안\n제20조(벌칙) 제11조를 위반하여 제20조(벌칙) ---------------\n비밀을 누설하거나 도용한 사 -------------------------\n람은 2년 이하의 징역이나 500 ---------------------2천\n만원 이하의 벌금에 처한다. 만원-------------------.",
  "full_text": "한국도로교통공단법 일부개정법률안\n(김상욱의원 대표발의)\n발의연월일 : 2025. 3. 28.\n의 안\n9437\n번 호 발 의 자 : 김상욱ㆍ김선교ㆍ조지연\n박준태ㆍ박덕흠ㆍ김기현\n최형두ㆍ김예지ㆍ이종배\n서천호ㆍ성일종 의원\n(11인)\n제안이유 및 주요내용\n현행법은 한국도로교통공단의 임직원이거나 임직원이었던 사람이\n그 직무상 알게 된 비밀을 누설하거나 도용하지 못하도록 하고 이를\n위반할 경우 2년 이하의 징역이나 500만원 이하의 벌금에 처하도록\n하고 있음.\n그런데 이러한 벌칙에서 벌금형의 수준이 「국가철도공단법」에 따\n른 국가철도공단, 「한국해양교통안전공단법」에 따른 한국해양교통안\n전공단 등 다른 공공기관에 적용되는 유사조항의 벌금형 수준에 비해\n지나치게 낮은 수준이고, 국회사무처의 「법률안의 표준화 기준」에서\n제시하는 벌금형의 일반적 기준인 징역형 1년당 1천만원에 맞지 않는\n등 벌금액의 적정 수준을 재검토할 필요가 있다는 지적이 있음.\n이에 임직원 등의 직무상 비밀 누설 및 도용 금지에 따른 벌칙에서\n벌금형의 수준을 징역형 1년당 1천만원에 맞추어 2천만원으로 조정하\n\n\n\n려는 것임(안 제20조).\n\n법률 제 호\n한국도로교통공단법 일부개정법률안\n한국도로교통공단법 일부를 다음과 같이 개정한다.\n제20조 중 “500만원”을 “2천만원”으로 한다.\n부 칙\n이 법은 공포 후 6개월이 경과한 날부터 시행한다.\n\n\n\n\n신·구조문대비표\n현 행 개 정 안\n제20조(벌칙) 제11조를 위반하여 제20조(벌칙) ---------------\n비밀을 누설하거나 도용한 사 -------------------------\n람은 2년 이하의 징역이나 500 ---------------------2천\n만원 이하의 벌금에 처한다. 만원-------------------.\n",
  "sections": {
    "제안이유": "및",
    "주요내용": "현행법은 한국도로교통공단의 임직원이거나 임직원이었던 사람이\n그 직무상 알게 된 비밀을 누설하거나 도용하지 못하도록 하고 이를\n위반할 경우 2년 이하의 징역이나 500만원 이하의 벌금에 처하도록\n하고 있음.\n그런데 이러한 벌칙에서 벌금형의 수준이 「국가철도공단법」에 따\n른 국가철도공단, 「한국해양교통안전공단법」에 따른 한국해양교통안\n전공단 등 다른 공공기관에 적용되는 유사조항의 벌금형 수준에 비해\n지나치게 낮은 수준이고, 국회사무처의 「법률안의 표준화 기준」에서\n제시하는 벌금형의 일반적 기준인 징역형 1년당 1천만원에 맞지 않는\n등 벌금액의 적정 수준을 재검토할 필요가 있다는 지적이 있음.\n이에 임직원 등의 직무상 비밀 누설 및 도용 금지에 따른 벌칙에서\n벌금형의 수준을 징역형 1년당 1천만원에 맞추어 2천만원으로 조정하\n\n\n\n려는 것임(안 제20조).",
    "제안이유_및_주요내용": "현행법은 한국도로교통공단의 임직원이거나 임직원이었던 사람이\n그 직무상 알게 된 비밀을 누설하거나 도용하지 못하도록 하고 이를\n위반할 경우 2년 이하의 징역이나 500만원 이하의 벌금에 처하도록\n하고 있음.\n그런데 이러한 벌칙에서 벌금형의 수준이 「국가철도공단법」에 따\n른 국가철도공단, 「한국해양교통안전공단법」에 따른 한국해양교통안\n전공단 등 다른 공공기관에 적용되는 유사조항의 벌금형 수준에 비해\n지나치게 낮은 수준이고, 국회사무처의 「법률안의 표준화 기준」에서\n제시하는 벌금형의 일반적 기준인 징역형 1년당 1천만원에 맞지 않는\n등 벌금액의 적정 수준을 재검토할 필요가 있다는 지적이 있음.\n이에 임직원 등의 직무상 비밀 누설 및 도용 금지에 따른 벌칙에서\n벌금형의 수준을 징역형 1년당 1천만원에 맞추어 2천만원으로 조정하\n\n\n\n려는 것임(안 제20조).",
    "법률_제_호": "한국도로교통공단법 일부개정법률안\n한국도로교통공단법 일부를 다음과 같이 개정한다.\n제20조 중 “500만원”을 “2천만원”으로 한다.",
    "신구조문대비표": "현 행 개 정 안\n제20조(벌칙) 제11조를 위반하여 제20조(벌칙) ---------------\n비밀을 누설하거나 도용한 사 -------------------------\n람은 2년 이하의 징역이나 500 ---------------------2천\n만원 이하의 벌금에 처한다. 만원-------------------."
  }
}