{
  "title": "2209705_제주특별자치도_설치_및_국제자유도시_조성을_위한_특별법_일부개정법률안",
  "bill_number": "9705",
  "proposal_date": "2025. 4. 10.",
  "submission_date": "",
  "is_alternative": false,
  "alternative_bill_numbers": [],
  "has_comparison_table": false,
  "comparison_table": "신ㆍ구조문대비표\n현 행 개 정 안\n<신 설> 제123조의2(과세대상의 구분에\n관한 특례) 「지방세법」 제10\n6조제1항제3호아목에서 대통령\n령으로 정하도록 한 사항은 도\n조례로 정할 수 있다.",
  "full_text": "제주특별자치도 설치 및 국제자유도시 조성을 위한 특별법\n일부개정법률안\n(위성곤의원 대표발의)\n발의연월일 : 2025. 4. 10.\n의 안\n9705\n번 호 발 의 자 : 위성곤ㆍ민병덕ㆍ허 영\n김성환ㆍ이건태ㆍ전재수\n박희승ㆍ이재관ㆍ조인철\n박정현 의원(10인)\n제안이유 및 주요내용\n현행법은 제주자치도세의 세율, 세액감면 및 징수ㆍ부과 절차 등에\n관해 「지방세법」에도 불구하고 일정 범위 내에서 도조례로 정하는\n바에 따라 세율ㆍ세액감면을 가감조정하거나 대통령령 위임사항을 달\n리 정할 수 있도록 특례를 두고 있음.\n한편 「지방세법」에서는 재산세 과세대상 토지를 종합합산과세대\n상, 별도합산과세대상 및 분리과세대상으로 구분하면서 분리과세대상\n은 그 성격에 따라 다른 토지보다 저율(전ㆍ답ㆍ과수원ㆍ목장용지 등)\n또는 고율(골프장용 토지 등)을 적용하고 있는데, 대통령령에 위임된\n분리과세대상 토지의 기준에 관해서는 이를 도조례로 정할 수 있도록\n하는 특례규정이 없음.\n그런데 2022. 1. 1. 「지방세법 시행령」 개정으로 비영리법인 소유\n\n\n\n토지 중 교육사업에 사용되지 않는 부분이 저율 분리과세대상에서 제\n외되면서, 제주자치도 내 일부 비영리법인이 장기간 보유하며 공익사\n업에 활용해오던 토지가 막대한 세금부과의 대상이 되었음. 이와 관련\n하여 제주자치도의 역사적ㆍ지역적 특수성 및 지방분권 필요성을 고\n려할 때 분리과세 여부를 제주자치도 내에서 논의하여 정하도록 할\n필요가 있다는 지적이 있음.\n이에 「지방세법」 제106조제1항제3호아목에서 ‘지역경제의 발전,\n공익성의 정도 등을 고려하여 분리과세하여야 할 타당한 이유가 있는\n토지로서 대통령령으로 정하는 토지’와 같이 대통령령으로 정하도록\n한 재산세 분리과세대상을 도조례로 정할 수 있도록 하려는 것임(안\n제123조의2 신설).\n\n법률 제 호\n제주특별자치도 설치 및 국제자유도시 조성을 위한 특별법\n일부개정법률안\n제주특별자치도 설치 및 국제자유도시 조성을 위한 특별법 일부를 다\n음과 같이 개정한다.\n제123조의2를 다음과 같이 신설한다.\n제123조의2(과세대상의 구분에 관한 특례) 「지방세법」 제106조제1항\n제3호아목에서 대통령령으로 정하도록 한 사항은 도조례로 정할 수\n있다.\n부 칙\n이 법은 공포 후 6개월이 경과한 날부터 시행한다.\n\n\n\n\n신ㆍ구조문대비표\n현 행 개 정 안\n<신 설> 제123조의2(과세대상의 구분에\n관한 특례) 「지방세법」 제10\n6조제1항제3호아목에서 대통령\n령으로 정하도록 한 사항은 도\n조례로 정할 수 있다.\n",
  "sections": {
    "제안이유": "및",
    "주요내용": "현행법은 제주자치도세의 세율, 세액감면 및 징수ㆍ부과 절차 등에\n관해 「지방세법」에도 불구하고 일정 범위 내에서 도조례로 정하는\n바에 따라 세율ㆍ세액감면을 가감조정하거나 대통령령 위임사항을 달\n리 정할 수 있도록 특례를 두고 있음.\n한편 「지방세법」에서는 재산세 과세대상 토지를 종합합산과세대\n상, 별도합산과세대상 및 분리과세대상으로 구분하면서 분리과세대상\n은 그 성격에 따라 다른 토지보다 저율(전ㆍ답ㆍ과수원ㆍ목장용지 등)\n또는 고율(골프장용 토지 등)을 적용하고 있는데, 대통령령에 위임된\n분리과세대상 토지의 기준에 관해서는 이를 도조례로 정할 수 있도록\n하는 특례규정이 없음.\n그런데 2022. 1. 1. 「지방세법 시행령」 개정으로 비영리법인 소유\n\n\n\n토지 중 교육사업에 사용되지 않는 부분이 저율 분리과세대상에서 제\n외되면서, 제주자치도 내 일부 비영리법인이 장기간 보유하며 공익사\n업에 활용해오던 토지가 막대한 세금부과의 대상이 되었음. 이와 관련\n하여 제주자치도의 역사적ㆍ지역적 특수성 및 지방분권 필요성을 고\n려할 때 분리과세 여부를 제주자치도 내에서 논의하여 정하도록 할\n필요가 있다는 지적이 있음.\n이에 「지방세법」 제106조제1항제3호아목에서 ‘지역경제의 발전,\n공익성의 정도 등을 고려하여 분리과세하여야 할 타당한 이유가 있는\n토지로서 대통령령으로 정하는 토지’와 같이 대통령령으로 정하도록\n한 재산세 분리과세대상을 도조례로 정할 수 있도록 하려는 것임(안\n제123조의2 신설).",
    "제안이유_및_주요내용": "현행법은 제주자치도세의 세율, 세액감면 및 징수ㆍ부과 절차 등에\n관해 「지방세법」에도 불구하고 일정 범위 내에서 도조례로 정하는\n바에 따라 세율ㆍ세액감면을 가감조정하거나 대통령령 위임사항을 달\n리 정할 수 있도록 특례를 두고 있음.\n한편 「지방세법」에서는 재산세 과세대상 토지를 종합합산과세대\n상, 별도합산과세대상 및 분리과세대상으로 구분하면서 분리과세대상\n은 그 성격에 따라 다른 토지보다 저율(전ㆍ답ㆍ과수원ㆍ목장용지 등)\n또는 고율(골프장용 토지 등)을 적용하고 있는데, 대통령령에 위임된\n분리과세대상 토지의 기준에 관해서는 이를 도조례로 정할 수 있도록\n하는 특례규정이 없음.\n그런데 2022. 1. 1. 「지방세법 시행령」 개정으로 비영리법인 소유\n\n\n\n토지 중 교육사업에 사용되지 않는 부분이 저율 분리과세대상에서 제\n외되면서, 제주자치도 내 일부 비영리법인이 장기간 보유하며 공익사\n업에 활용해오던 토지가 막대한 세금부과의 대상이 되었음. 이와 관련\n하여 제주자치도의 역사적ㆍ지역적 특수성 및 지방분권 필요성을 고\n려할 때 분리과세 여부를 제주자치도 내에서 논의하여 정하도록 할\n필요가 있다는 지적이 있음.\n이에 「지방세법」 제106조제1항제3호아목에서 ‘지역경제의 발전,\n공익성의 정도 등을 고려하여 분리과세하여야 할 타당한 이유가 있는\n토지로서 대통령령으로 정하는 토지’와 같이 대통령령으로 정하도록\n한 재산세 분리과세대상을 도조례로 정할 수 있도록 하려는 것임(안\n제123조의2 신설).",
    "법률_제_호": "제주특별자치도 설치 및 국제자유도시 조성을 위한 특별법\n일부개정법률안\n제주특별자치도 설치 및 국제자유도시 조성을 위한 특별법 일부를 다\n음과 같이 개정한다.\n제123조의2를 다음과 같이 신설한다.\n제123조의2(과세대상의 구분에 관한 특례) 「지방세법」 제106조제1항\n제3호아목에서 대통령령으로 정하도록 한 사항은 도조례로 정할 수\n있다.",
    "신구조문대비표": "현 행 개 정 안\n<신 설> 제123조의2(과세대상의 구분에\n관한 특례) 「지방세법」 제10\n6조제1항제3호아목에서 대통령\n령으로 정하도록 한 사항은 도\n조례로 정할 수 있다."
  }
}