{
  "title": "2209059_북한이탈주민의_보호_및_정착지원에_관한_법률_일부개정법률안",
  "bill_number": "9059",
  "proposal_date": "2025. 3. 18.",
  "submission_date": "",
  "is_alternative": false,
  "alternative_bill_numbers": [],
  "has_comparison_table": false,
  "comparison_table": "신ㆍ구조문대비표\n현 행 개 정 안\n제4조의3(기본계획 및 시행계획) 제4조의3(기본계획 및 시행계획)\n① ∼ ⑥ (생 략) ① ∼ ⑥ (현행과 같음)\n<신 설> ⑦ 통일부장관은 기본계획 및\n시행계획을 수립하거나 제5항\n에 따른 추진성과 분석을 완료\n한 때에는 이를 지체 없이 국\n회 소관 상임위원회에 보고하\n여야 한다.",
  "full_text": "북한이탈주민의 보호 및 정착지원에 관한 법률\n일부개정법률안\n(김태호의원 대표발의)\n발의연월일 : 2025. 3. 18.\n의 안\n9059\n번 호 발 의 자 : 김태호ㆍ조승환ㆍ김종양\n신성범ㆍ김성원ㆍ엄태영\n박충권ㆍ정동만ㆍ서범수\n박대출 의원(10인)\n제안이유 및 주요내용\n현행법은 통일부장관이 보호대상자인 북한이탈주민의 보호 및 정착\n지원에 관한 기본계획을 3년마다, 기본계획에 따른 연도별 시행계획을\n매년 수립ㆍ시행하도록 하고 있으며, 시행계획의 추진성과를 매년 정\n기적으로 분석하여 그 결과를 기본계획 및 시행계획에 반영하도록 하\n고 있음.\n그런데 기본계획ㆍ시행계획 및 추진성과를 국회에 보고하는 절차가\n규정되어 있지 않아 국회가 북한이탈주민 보호 및 정착 지원 현황을\n정확히 파악하는 데 어려움이 있음.\n이에 통일부장관이 기본계획 및 시행계획을 수립하거나 추진성과\n분석을 완료한 때에 지체 없이 이를 국회 소관 상임위원회에 보고하\n도록 함으로써 북한이탈주민에 대한 면밀한 현황 파악을 토대로 한\n\n\n\n지원을 제공하고자 함(안 제4조의3제7항 신설).\n\n법률 제 호\n북한이탈주민의 보호 및 정착지원에 관한 법률\n일부개정법률안\n북한이탈주민의 보호 및 정착지원에 관한 법률 일부를 다음과 같이\n개정한다.\n제4조의3에 제7항을 다음과 같이 신설한다.\n⑦ 통일부장관은 기본계획 및 시행계획을 수립하거나 제5항에 따른\n추진성과 분석을 완료한 때에는 이를 지체 없이 국회 소관 상임위\n원회에 보고하여야 한다.\n부 칙\n제1조(시행일) 이 법은 공포 후 3개월이 경과한 날부터 시행한다.\n제2조(국회 보고에 관한 적용례) 제4조의3제7항의 개정규정은 이 법\n시행 이후 수립한 기본계획 및 시행계획과 이 법 시행 이후 완료된\n추진성과 분석부터 적용한다.\n\n\n\n\n신ㆍ구조문대비표\n현 행 개 정 안\n제4조의3(기본계획 및 시행계획) 제4조의3(기본계획 및 시행계획)\n① ∼ ⑥ (생 략) ① ∼ ⑥ (현행과 같음)\n<신 설> ⑦ 통일부장관은 기본계획 및\n시행계획을 수립하거나 제5항\n에 따른 추진성과 분석을 완료\n한 때에는 이를 지체 없이 국\n회 소관 상임위원회에 보고하\n여야 한다.\n",
  "sections": {
    "제안이유": "및",
    "주요내용": "현행법은 통일부장관이 보호대상자인 북한이탈주민의 보호 및 정착\n지원에 관한 기본계획을 3년마다, 기본계획에 따른 연도별 시행계획을\n매년 수립ㆍ시행하도록 하고 있으며, 시행계획의 추진성과를 매년 정\n기적으로 분석하여 그 결과를 기본계획 및 시행계획에 반영하도록 하\n고 있음.\n그런데 기본계획ㆍ시행계획 및 추진성과를 국회에 보고하는 절차가\n규정되어 있지 않아 국회가 북한이탈주민 보호 및 정착 지원 현황을\n정확히 파악하는 데 어려움이 있음.\n이에 통일부장관이 기본계획 및 시행계획을 수립하거나 추진성과\n분석을 완료한 때에 지체 없이 이를 국회 소관 상임위원회에 보고하\n도록 함으로써 북한이탈주민에 대한 면밀한 현황 파악을 토대로 한\n\n\n\n지원을 제공하고자 함(안 제4조의3제7항 신설).",
    "제안이유_및_주요내용": "현행법은 통일부장관이 보호대상자인 북한이탈주민의 보호 및 정착\n지원에 관한 기본계획을 3년마다, 기본계획에 따른 연도별 시행계획을\n매년 수립ㆍ시행하도록 하고 있으며, 시행계획의 추진성과를 매년 정\n기적으로 분석하여 그 결과를 기본계획 및 시행계획에 반영하도록 하\n고 있음.\n그런데 기본계획ㆍ시행계획 및 추진성과를 국회에 보고하는 절차가\n규정되어 있지 않아 국회가 북한이탈주민 보호 및 정착 지원 현황을\n정확히 파악하는 데 어려움이 있음.\n이에 통일부장관이 기본계획 및 시행계획을 수립하거나 추진성과\n분석을 완료한 때에 지체 없이 이를 국회 소관 상임위원회에 보고하\n도록 함으로써 북한이탈주민에 대한 면밀한 현황 파악을 토대로 한\n\n\n\n지원을 제공하고자 함(안 제4조의3제7항 신설).",
    "법률_제_호": "북한이탈주민의 보호 및 정착지원에 관한 법률\n일부개정법률안\n북한이탈주민의 보호 및 정착지원에 관한 법률 일부를 다음과 같이\n개정한다.\n제4조의3에 제7항을 다음과 같이 신설한다.\n⑦ 통일부장관은 기본계획 및 시행계획을 수립하거나 제5항에 따른\n추진성과 분석을 완료한 때에는 이를 지체 없이 국회 소관 상임위\n원회에 보고하여야 한다.",
    "신구조문대비표": "현 행 개 정 안\n제4조의3(기본계획 및 시행계획) 제4조의3(기본계획 및 시행계획)\n① ∼ ⑥ (생 략) ① ∼ ⑥ (현행과 같음)\n<신 설> ⑦ 통일부장관은 기본계획 및\n시행계획을 수립하거나 제5항\n에 따른 추진성과 분석을 완료\n한 때에는 이를 지체 없이 국\n회 소관 상임위원회에 보고하\n여야 한다."
  }
}