{
  "title": "2209640_하수도법_일부개정법률안",
  "bill_number": "9640",
  "proposal_date": "2025. 4. 8.",
  "submission_date": "",
  "is_alternative": false,
  "alternative_bill_numbers": [],
  "has_comparison_table": false,
  "comparison_table": "신ㆍ구조문대비표\n현 행 개 정 안\n제63조(국고보조) (생 략) 제63조(국고보조) ① (현행 제목\n외의 부분과 같음)\n<신 설> ② 국가는 공공하수처리시설의\n이전에 관한 공사비용의 전부\n또는 일부를 예산의 범위에서\n지방자치단체에 보조할 수 있\n다.",
  "full_text": "하수도법 일부개정법률안\n(조지연의원 대표발의)\n발의연월일 : 2025. 4. 8.\n의 안\n9640\n번 호 발 의 자 : 조지연ㆍ구자근ㆍ장동혁\n서명옥ㆍ엄태영ㆍ최수진\n박준태ㆍ강선영ㆍ강대식\n이인선ㆍ최은석ㆍ김소희\n임이자ㆍ박덕흠ㆍ김정재\n김도읍ㆍ김장겸ㆍ고동진\n우재준 의원(19인)\n제안이유 및 주요내용\n현행법은 국가가 공공하수도의 설치ㆍ개축 또는 재해복구에 관한\n공사비용의 전부 또는 일부를 예산의 범위에서 지방자치단체에 보조\n할 수 있도록 규정하고 있음.\n최근 악취, 소음 등으로 인한 주민 민원을 이유로 지방자치단체가\n공공하수처리시설의 위치를 이전하는 사례가 발생하고 있지만, 공공하\n수처리시설 이전에 대한 국가 지원의 법적 근거가 명확하지 않아 지\n방자치단체에 재정적 부담이 되고 있다는 의견이 있음.\n이에 공공하수처리시설을 이전할 경우에도 국가가 공사비용의 전부\n또는 일부를 예산 범위 내에서 보조할 수 있도록 규정하여 지방자치\n단체의 재정적 부담을 줄이려는 것임(안 제63조).\n\n\n\n\n법률 제 호\n하수도법 일부개정법률안\n하수도법 일부를 다음과 같이 개정한다.\n제63조 제목 외의 부분을 제1항으로 하고, 같은 조에 제2항을 다음과\n같이 신설한다.\n② 국가는 공공하수처리시설의 이전에 관한 공사비용의 전부 또는\n일부를 예산의 범위에서 지방자치단체에 보조할 수 있다.\n부 칙\n이 법은 공포한 날부터 시행한다.\n\n\n\n\n신ㆍ구조문대비표\n현 행 개 정 안\n제63조(국고보조) (생 략) 제63조(국고보조) ① (현행 제목\n외의 부분과 같음)\n<신 설> ② 국가는 공공하수처리시설의\n이전에 관한 공사비용의 전부\n또는 일부를 예산의 범위에서\n지방자치단체에 보조할 수 있\n다.\n",
  "sections": {
    "제안이유": "및",
    "주요내용": "현행법은 국가가 공공하수도의 설치ㆍ개축 또는 재해복구에 관한\n공사비용의 전부 또는 일부를 예산의 범위에서 지방자치단체에 보조\n할 수 있도록 규정하고 있음.\n최근 악취, 소음 등으로 인한 주민 민원을 이유로 지방자치단체가\n공공하수처리시설의 위치를 이전하는 사례가 발생하고 있지만, 공공하\n수처리시설 이전에 대한 국가 지원의 법적 근거가 명확하지 않아 지\n방자치단체에 재정적 부담이 되고 있다는 의견이 있음.\n이에 공공하수처리시설을 이전할 경우에도 국가가 공사비용의 전부\n또는 일부를 예산 범위 내에서 보조할 수 있도록 규정하여 지방자치\n단체의 재정적 부담을 줄이려는 것임(안 제63조).",
    "제안이유_및_주요내용": "현행법은 국가가 공공하수도의 설치ㆍ개축 또는 재해복구에 관한\n공사비용의 전부 또는 일부를 예산의 범위에서 지방자치단체에 보조\n할 수 있도록 규정하고 있음.\n최근 악취, 소음 등으로 인한 주민 민원을 이유로 지방자치단체가\n공공하수처리시설의 위치를 이전하는 사례가 발생하고 있지만, 공공하\n수처리시설 이전에 대한 국가 지원의 법적 근거가 명확하지 않아 지\n방자치단체에 재정적 부담이 되고 있다는 의견이 있음.\n이에 공공하수처리시설을 이전할 경우에도 국가가 공사비용의 전부\n또는 일부를 예산 범위 내에서 보조할 수 있도록 규정하여 지방자치\n단체의 재정적 부담을 줄이려는 것임(안 제63조).",
    "법률_제_호": "하수도법 일부개정법률안\n하수도법 일부를 다음과 같이 개정한다.\n제63조 제목 외의 부분을 제1항으로 하고, 같은 조에 제2항을 다음과\n같이 신설한다.\n② 국가는 공공하수처리시설의 이전에 관한 공사비용의 전부 또는\n일부를 예산의 범위에서 지방자치단체에 보조할 수 있다.",
    "신구조문대비표": "현 행 개 정 안\n제63조(국고보조) (생 략) 제63조(국고보조) ① (현행 제목\n외의 부분과 같음)\n<신 설> ② 국가는 공공하수처리시설의\n이전에 관한 공사비용의 전부\n또는 일부를 예산의 범위에서\n지방자치단체에 보조할 수 있\n다."
  }
}