{
  "title": "2209137_관광기본법_일부개정법률안(대안)",
  "bill_number": "9137",
  "proposal_date": "",
  "submission_date": "",
  "is_alternative": true,
  "alternative_bill_numbers": [
    "2203950",
    "2205912"
  ],
  "has_comparison_table": false,
  "comparison_table": "신ㆍ구조문대비표\n현 행 개 정 안\n제3조(관광진흥계획의 수립) ① 제3조(관광진흥계획의 수립) ①\n(생 략) (현행과 같음)\n② 기본계획에는 다음 각 호의 ② -------------------------\n사항이 포함되어야 한다. -----------------------.\n1. ∼ 3. (생 략) 1. ∼ 3. (현행과 같음)\n<신 설> 3의2. 관광취약계층 등을 위한\n「관광진흥법」 제2조제13호\n에 따른 무장애 관광 환경 조\n성 및 지원에 관한 사항\n4. ∼ 9. (생 략) 4. ∼ 9. (현행과 같음)\n③ㆍ④ (생 략) ③ㆍ④ (현행과 같음)",
  "full_text": "관광기본법 일부개정법률안(대안)\n제안연월일 : 2025. 3. .\n의 안\n9137\n번 호\n제 안 자 : 문화체육관광위원장\n1. 대안의 제안경위\n의안 대표\n건 명 발의일자 회의정보\n번호 발의자\n제418회 국회(정기회) 제12차\n상정\n문화체육관광위원회(’24.11.19.)\n문대림의원 제420회 국회(임시회) 제1차\n2203950 ’24.9.12.\n등 10인 소위 체육관광법안심사소위원회(’25.1.15.)\n심사 제422회 국회(임시회) 제1차\n관광기본법 체육관광법안심사소위원회(’25.2.27.)\n일부개정법률안 제420회 국회(임시회) 제2차\n상정\n문화체육관광위원회(’25.1.10.)\n최보윤의원 제420회 국회(임시회) 제1차\n2205912 ’24.11.27.\n등 10인 소위 체육관광법안심사소위원회(’25.1.15.)\n심사 제422회 국회(임시회) 제1차\n체육관광법안심사소위원회(’25.2.27.)\n제423회국회(임시회) 제1차 문화체육관광위원회(2025. 3. 5.)는 위 2\n건의 법률안을 심사한 결과 이를 본회의에 부의하지 아니하기로 하고\n국회법 제51조에 따라 위원회 대안으로 제안하기로 함.\n2. 대안의 제안이유 및 주요내용\n장애인 등 관광약자를 위한 관광정책을 적극적·체계적으로 추진하기\n\n\n\n위하여 관광진흥계획에 ‘관광취약계층 등을 위한 무장애 관광 환경 조\n성 및 지원에 관한 사항’을 포함하도록 함(안 제3조제2항제3호의2 신\n설).\n\n법률 제 호\n관광기본법 일부개정법률안\n관광기본법 일부를 다음과 같이 개정한다.\n제3조제2항에 제3호의2를 다음과 같이 신설한다.\n3의2. 관광취약계층 등을 위한 「관광진흥법」 제2조제13호에 따른\n무장애 관광 환경 조성 및 지원에 관한 사항\n부 칙\n제1조(시행일) 이 법은 공포 후 6개월이 경과한 날부터 시행한다.\n제2조(관광진흥계획 수립에 관한 적용례) 이 법은 이 법 시행 이후 관\n광진흥계획을 수립하는 경우부터 적용한다.\n\n\n신ㆍ구조문대비표\n현 행 개 정 안\n제3조(관광진흥계획의 수립) ① 제3조(관광진흥계획의 수립) ①\n(생 략) (현행과 같음)\n② 기본계획에는 다음 각 호의 ② -------------------------\n사항이 포함되어야 한다. -----------------------.\n1. ∼ 3. (생 략) 1. ∼ 3. (현행과 같음)\n<신 설> 3의2. 관광취약계층 등을 위한\n「관광진흥법」 제2조제13호\n에 따른 무장애 관광 환경 조\n성 및 지원에 관한 사항\n4. ∼ 9. (생 략) 4. ∼ 9. (현행과 같음)\n③ㆍ④ (생 략) ③ㆍ④ (현행과 같음)\n",
  "sections": {
    "제안이유": "및",
    "주요내용": "장애인 등 관광약자를 위한 관광정책을 적극적·체계적으로 추진하기\n\n\n\n위하여 관광진흥계획에 ‘관광취약계층 등을 위한 무장애 관광 환경 조\n성 및 지원에 관한 사항’을 포함하도록 함(안 제3조제2항제3호의2 신\n설).",
    "제안이유_및_주요내용": "장애인 등 관광약자를 위한 관광정책을 적극적·체계적으로 추진하기\n\n\n\n위하여 관광진흥계획에 ‘관광취약계층 등을 위한 무장애 관광 환경 조\n성 및 지원에 관한 사항’을 포함하도록 함(안 제3조제2항제3호의2 신\n설).",
    "법률_제_호": "관광기본법 일부개정법률안\n관광기본법 일부를 다음과 같이 개정한다.\n제3조제2항에 제3호의2를 다음과 같이 신설한다.\n3의2. 관광취약계층 등을 위한 「관광진흥법」 제2조제13호에 따른\n무장애 관광 환경 조성 및 지원에 관한 사항",
    "신구조문대비표": "현 행 개 정 안\n제3조(관광진흥계획의 수립) ① 제3조(관광진흥계획의 수립) ①\n(생 략) (현행과 같음)\n② 기본계획에는 다음 각 호의 ② -------------------------\n사항이 포함되어야 한다. -----------------------.\n1. ∼ 3. (생 략) 1. ∼ 3. (현행과 같음)\n<신 설> 3의2. 관광취약계층 등을 위한\n「관광진흥법」 제2조제13호\n에 따른 무장애 관광 환경 조\n성 및 지원에 관한 사항\n4. ∼ 9. (생 략) 4. ∼ 9. (현행과 같음)\n③ㆍ④ (생 략) ③ㆍ④ (현행과 같음)"
  }
}