{
  "title": "2210360_형사소송법_일부개정법률안",
  "bill_number": "10360",
  "proposal_date": "2025. 5. 2.",
  "submission_date": "",
  "is_alternative": false,
  "alternative_bill_numbers": [],
  "has_comparison_table": false,
  "comparison_table": "신ㆍ구조문대비표\n현 행 개 정 안\n<신 설> 제306조의2(대통령이 피고인인\n사건의 공판절차 정지) 피고인\n이 대통령인 경우 그 임기 중\n에는 헌법 제84조에 따라 내란\n또는 외환의 죄를 제외하고는\n공판절차가 당연히 정지된다.",
  "full_text": "형사소송법 일부개정법률안\n(이용우의원 대표발의)\n발의연월일 : 2025. 5. 2.\n의 안\n10360\n번 호 발 의 자 : 이용우ㆍ한준호ㆍ문정복\n이기헌ㆍ임미애ㆍ박상혁\n장종태ㆍ김주영ㆍ임호선\n이강일 의원(10인)\n제안이유\n헌법 제84조는 “대통령은 내란 또는 외환의 죄를 범한 경우를 제외\n하고는 재직 중 형사상의 소추를 받지 아니한다”고 하여 대통령에 대\n하여 형사상 불소추 특권을 규정하고 있음. 한편 헌법재판소는 1995.\n1. 20. 선고 94헌마246에서 이러한 불소추 특권에 대해 “국가의 원수\n로서 외국에 대하여 국가를 대표하는 지위에 있는 대통령이라는 특수\n한 직책의 원활한 수행을 보장하고, 그 권위를 확보하여 국가의 체면\n과 권위를 유지하여야 할 실제상의 필요”가 있다고 하였으므로, 대통\n령 직무의 원활한 수행이라는 헌법상 목적에 따라 재직 중인 대통령\n이 피고인인 경우의 공판절차 정지를 이 법에서 명확히 규정할 필요\n가 있음.\n\n\n\n주요내용\n가. 피고인이 대통령인 경우 그 임기 중에는 헌법 제84조에 따라 내란\n또는 외환의 죄를 제외하고는 공판절차가 당연히 정지되도록 함(안\n제306조의2 신설).\n나. 제306조의2의 개정규정은 대통령이 이 법 시행 이전 피고인으로\n진행 중인 공판절차에도 적용하도록 함(부칙 제2조 등).\n\n법률 제 호\n형사소송법 일부개정법률안\n형사소송법 일부를 다음과 같이 개정한다.\n제306조의2를 다음과 같이 신설한다.\n제306조의2(대통령이 피고인인 사건의 공판절차 정지) 피고인이 대통\n령인 경우 그 임기 중에는 헌법 제84조에 따라 내란 또는 외환의\n죄를 제외하고는 공판절차가 당연히 정지된다.\n부 칙\n제1조(시행일) 이 법은 공포한 날부터 시행한다.\n제2조(경과조치) 제306조의2의 개정규정은 대통령이 이 법 시행 이전\n피고인으로 진행 중인 공판절차에도 적용한다.\n\n\n\n\n신ㆍ구조문대비표\n현 행 개 정 안\n<신 설> 제306조의2(대통령이 피고인인\n사건의 공판절차 정지) 피고인\n이 대통령인 경우 그 임기 중\n에는 헌법 제84조에 따라 내란\n또는 외환의 죄를 제외하고는\n공판절차가 당연히 정지된다.\n",
  "sections": {
    "제안이유": "헌법 제84조는 “대통령은 내란 또는 외환의 죄를 범한 경우를 제외\n하고는 재직 중 형사상의 소추를 받지 아니한다”고 하여 대통령에 대\n하여 형사상 불소추 특권을 규정하고 있음. 한편 헌법재판소는 1995.\n1. 20. 선고 94헌마246에서 이러한 불소추 특권에 대해 “국가의 원수\n로서 외국에 대하여 국가를 대표하는 지위에 있는 대통령이라는 특수\n한 직책의 원활한 수행을 보장하고, 그 권위를 확보하여 국가의 체면\n과 권위를 유지하여야 할 실제상의 필요”가 있다고 하였으므로, 대통\n령 직무의 원활한 수행이라는 헌법상 목적에 따라 재직 중인 대통령\n이 피고인인 경우의 공판절차 정지를 이 법에서 명확히 규정할 필요\n가 있음.",
    "주요내용": "가. 피고인이 대통령인 경우 그 임기 중에는 헌법 제84조에 따라 내란\n또는 외환의 죄를 제외하고는 공판절차가 당연히 정지되도록 함(안\n제306조의2 신설).\n나. 제306조의2의 개정규정은 대통령이 이 법 시행 이전 피고인으로\n진행 중인 공판절차에도 적용하도록 함(부칙 제2조 등).",
    "법률_제_호": "형사소송법 일부개정법률안\n형사소송법 일부를 다음과 같이 개정한다.\n제306조의2를 다음과 같이 신설한다.\n제306조의2(대통령이 피고인인 사건의 공판절차 정지) 피고인이 대통\n령인 경우 그 임기 중에는 헌법 제84조에 따라 내란 또는 외환의\n죄를 제외하고는 공판절차가 당연히 정지된다.",
    "신구조문대비표": "현 행 개 정 안\n<신 설> 제306조의2(대통령이 피고인인\n사건의 공판절차 정지) 피고인\n이 대통령인 경우 그 임기 중\n에는 헌법 제84조에 따라 내란\n또는 외환의 죄를 제외하고는\n공판절차가 당연히 정지된다."
  }
}