{
  "title": "2210512_국회법_일부개정법률안",
  "bill_number": "10512",
  "proposal_date": "2025. 5. 14.",
  "submission_date": "",
  "is_alternative": false,
  "alternative_bill_numbers": [],
  "has_comparison_table": false,
  "comparison_table": "신ㆍ구조문대비표\n현 행 개 정 안\n제92조(일사부재의) (생 략) 제92조(일사부재의) ① (현행 제\n목 외의 부분과 같음)\n<신 설> ② 제1항에도 불구하고 부결된\n탄핵소추안은 같은 국회 중에\n다시 발의할 수 없다. 다만, 새\n로운 탄핵소추의 사유를 기재\n한 경우에는 그러하지 아니하\n다.",
  "full_text": "국회법 일부개정법률안\n(강명구의원 대표발의)\n발의연월일 : 2025. 5. 14.\n의 안\n10512\n번 호 발 의 자 : 강명구ㆍ박충권ㆍ김민전\n유상범ㆍ김소희ㆍ고동진\n엄태영ㆍ이성권ㆍ강대식\n박덕흠ㆍ윤한홍ㆍ배준영\n이종욱ㆍ김 건ㆍ곽규택\n이인선 의원(16인)\n제안이유 및 주요내용\n현행법은 부결된 안건의 경우 같은 회기 중에 다시 발의하거나 제\n출할 수 없도록 함으로써 일사부재의를 규정하고 있음. 일사부재의는\n탄핵소추안을 포함한 모든 국회의 안건에 적용되는 것으로 단일한 의\n사 결정과 효율적인 회의 운영 측면에서 의의가 있음.\n그러나 국회의 회기를 달리하여 부결된 탄핵소추안을 다시 발의하\n는 경우에는 일사부재의에 위반되지 않는데, 같은 소추 사유를 기재한\n탄핵소추안이 회기만을 달리한 채 반복 발의됨에 따라 국정 운영의\n연속성을 저해할 수 있다는 지적이 있음.\n이에 부결된 탄핵소추안의 경우 같은 국회 내에서 일사부재의를 적\n용하되, 새로운 탄핵소추 사유를 기재한 경우에는 그 예외를 규정함으\n로써 국정 운영의 안정성 제고와 국회 탄핵소추권 보장의 균형을 도\n\n\n\n모하고자 하는 것임(안 제92조).\n\n법률 제 호\n국회법 일부개정법률안\n국회법 일부를 다음과 같이 개정한다.\n제92조 제목 외의 부분을 제1항으로 하고, 같은 조에 제2항을 다음과\n같이 신설한다.\n② 제1항에도 불구하고 부결된 탄핵소추안은 같은 국회 중에 다시\n발의할 수 없다. 다만, 새로운 탄핵소추의 사유를 기재한 경우에는\n그러하지 아니하다.\n부 칙\n제1조(시행일) 이 법은 공포한 날부터 시행한다.\n제2조(탄핵소추안의 일사부재의에 관한 적용례) 이 법의 개정규정은\n이 법 시행 이후 발의된 탄핵소추안부터 적용한다.\n\n\n\n\n신ㆍ구조문대비표\n현 행 개 정 안\n제92조(일사부재의) (생 략) 제92조(일사부재의) ① (현행 제\n목 외의 부분과 같음)\n<신 설> ② 제1항에도 불구하고 부결된\n탄핵소추안은 같은 국회 중에\n다시 발의할 수 없다. 다만, 새\n로운 탄핵소추의 사유를 기재\n한 경우에는 그러하지 아니하\n다.\n",
  "sections": {
    "제안이유": "및",
    "주요내용": "현행법은 부결된 안건의 경우 같은 회기 중에 다시 발의하거나 제\n출할 수 없도록 함으로써 일사부재의를 규정하고 있음. 일사부재의는\n탄핵소추안을 포함한 모든 국회의 안건에 적용되는 것으로 단일한 의\n사 결정과 효율적인 회의 운영 측면에서 의의가 있음.\n그러나 국회의 회기를 달리하여 부결된 탄핵소추안을 다시 발의하\n는 경우에는 일사부재의에 위반되지 않는데, 같은 소추 사유를 기재한\n탄핵소추안이 회기만을 달리한 채 반복 발의됨에 따라 국정 운영의\n연속성을 저해할 수 있다는 지적이 있음.\n이에 부결된 탄핵소추안의 경우 같은 국회 내에서 일사부재의를 적\n용하되, 새로운 탄핵소추 사유를 기재한 경우에는 그 예외를 규정함으\n로써 국정 운영의 안정성 제고와 국회 탄핵소추권 보장의 균형을 도\n\n\n\n모하고자 하는 것임(안 제92조).",
    "제안이유_및_주요내용": "현행법은 부결된 안건의 경우 같은 회기 중에 다시 발의하거나 제\n출할 수 없도록 함으로써 일사부재의를 규정하고 있음. 일사부재의는\n탄핵소추안을 포함한 모든 국회의 안건에 적용되는 것으로 단일한 의\n사 결정과 효율적인 회의 운영 측면에서 의의가 있음.\n그러나 국회의 회기를 달리하여 부결된 탄핵소추안을 다시 발의하\n는 경우에는 일사부재의에 위반되지 않는데, 같은 소추 사유를 기재한\n탄핵소추안이 회기만을 달리한 채 반복 발의됨에 따라 국정 운영의\n연속성을 저해할 수 있다는 지적이 있음.\n이에 부결된 탄핵소추안의 경우 같은 국회 내에서 일사부재의를 적\n용하되, 새로운 탄핵소추 사유를 기재한 경우에는 그 예외를 규정함으\n로써 국정 운영의 안정성 제고와 국회 탄핵소추권 보장의 균형을 도\n\n\n\n모하고자 하는 것임(안 제92조).",
    "법률_제_호": "국회법 일부개정법률안\n국회법 일부를 다음과 같이 개정한다.\n제92조 제목 외의 부분을 제1항으로 하고, 같은 조에 제2항을 다음과\n같이 신설한다.\n② 제1항에도 불구하고 부결된 탄핵소추안은 같은 국회 중에 다시\n발의할 수 없다. 다만, 새로운 탄핵소추의 사유를 기재한 경우에는\n그러하지 아니하다.",
    "신구조문대비표": "현 행 개 정 안\n제92조(일사부재의) (생 략) 제92조(일사부재의) ① (현행 제\n목 외의 부분과 같음)\n<신 설> ② 제1항에도 불구하고 부결된\n탄핵소추안은 같은 국회 중에\n다시 발의할 수 없다. 다만, 새\n로운 탄핵소추의 사유를 기재\n한 경우에는 그러하지 아니하\n다."
  }
}