{
  "title": "2210105_국경일에_관한_법률_일부개정법률안",
  "bill_number": "10105",
  "proposal_date": "2025. 4. 24.",
  "submission_date": "",
  "is_alternative": false,
  "alternative_bill_numbers": [],
  "has_comparison_table": false,
  "comparison_table": "신ㆍ구조문대비표\n현 행 개 정 안\n제2조(국경일의 종류) 국경일은 제2조(국경일의 종류) --------\n다음 각 호와 같다. ------------------.\n1. 3ㆍ1절: 3월 1일 1. 3ㆍ1절(독립만세기념일)---\n------\n2. ～ 5. (생 략) 2. ～ 5. (현행과 같음)",
  "full_text": "국경일에 관한 법률 일부개정법률안\n(문진석의원 대표발의)\n발의연월일 : 2025. 4. 24.\n의 안\n10105\n번 호 발 의 자 : 문진석ㆍ이건태ㆍ강준현\n권향엽ㆍ이정문ㆍ이연희\n복기왕ㆍ전용기ㆍ장종태\n이춘석 의원(10인)\n제안이유 및 주요내용\n「대한민국헌법」은 전문에 “유구한 역사와 전통에 빛나는 우리 대\n한국민은 3ㆍ1운동으로 건립된 대한민국임시정부의 법통”을 계승한다\n고 명시하고 있음.\n현행법의 영문본에는 3ㆍ1절이 Independence Movement Day로 번\n역되어 있는데, 이는 3ㆍ1운동이 대한민국 헌정사에서 차지하는 위상\n과 기념을 고려할 때 독립운동한 날 정도로 축소되는 것임.\n3ㆍ1 운동을 시작으로 일제의 지배에 항거하며 비폭력 만세운동이\n시작되고 독립으로 이어진 만큼 만세운동의 의미가 드러날 수 있어야\n함.\n이에 3ㆍ1절에 “독립만세기념일”이라고 부가명칭을 부여해 해당 국\n경일의 의미를 잘 나타낼 수 있게 하려는 것임(안 제2조).\n\n\n\n\n법률 제 호\n국경일에 관한 법률 일부개정법률안\n국경일에 관한 법률 일부를 다음과 같이 개정한다.\n제2조제1호 중 “3ㆍ1절”을 “3ㆍ1절(독립만세기념일)”로 한다.\n부 칙\n이 법은 공포한 날부터 시행한다.\n\n\n\n\n신ㆍ구조문대비표\n현 행 개 정 안\n제2조(국경일의 종류) 국경일은 제2조(국경일의 종류) --------\n다음 각 호와 같다. ------------------.\n1. 3ㆍ1절: 3월 1일 1. 3ㆍ1절(독립만세기념일)---\n------\n2. ～ 5. (생 략) 2. ～ 5. (현행과 같음)\n",
  "sections": {
    "제안이유": "및",
    "주요내용": "「대한민국헌법」은 전문에 “유구한 역사와 전통에 빛나는 우리 대\n한국민은 3ㆍ1운동으로 건립된 대한민국임시정부의 법통”을 계승한다\n고 명시하고 있음.\n현행법의 영문본에는 3ㆍ1절이 Independence Movement Day로 번\n역되어 있는데, 이는 3ㆍ1운동이 대한민국 헌정사에서 차지하는 위상\n과 기념을 고려할 때 독립운동한 날 정도로 축소되는 것임.\n3ㆍ1 운동을 시작으로 일제의 지배에 항거하며 비폭력 만세운동이\n시작되고 독립으로 이어진 만큼 만세운동의 의미가 드러날 수 있어야\n함.\n이에 3ㆍ1절에 “독립만세기념일”이라고 부가명칭을 부여해 해당 국\n경일의 의미를 잘 나타낼 수 있게 하려는 것임(안 제2조).",
    "제안이유_및_주요내용": "「대한민국헌법」은 전문에 “유구한 역사와 전통에 빛나는 우리 대\n한국민은 3ㆍ1운동으로 건립된 대한민국임시정부의 법통”을 계승한다\n고 명시하고 있음.\n현행법의 영문본에는 3ㆍ1절이 Independence Movement Day로 번\n역되어 있는데, 이는 3ㆍ1운동이 대한민국 헌정사에서 차지하는 위상\n과 기념을 고려할 때 독립운동한 날 정도로 축소되는 것임.\n3ㆍ1 운동을 시작으로 일제의 지배에 항거하며 비폭력 만세운동이\n시작되고 독립으로 이어진 만큼 만세운동의 의미가 드러날 수 있어야\n함.\n이에 3ㆍ1절에 “독립만세기념일”이라고 부가명칭을 부여해 해당 국\n경일의 의미를 잘 나타낼 수 있게 하려는 것임(안 제2조).",
    "법률_제_호": "국경일에 관한 법률 일부개정법률안\n국경일에 관한 법률 일부를 다음과 같이 개정한다.\n제2조제1호 중 “3ㆍ1절”을 “3ㆍ1절(독립만세기념일)”로 한다.",
    "신구조문대비표": "현 행 개 정 안\n제2조(국경일의 종류) 국경일은 제2조(국경일의 종류) --------\n다음 각 호와 같다. ------------------.\n1. 3ㆍ1절: 3월 1일 1. 3ㆍ1절(독립만세기념일)---\n------\n2. ～ 5. (생 략) 2. ～ 5. (현행과 같음)"
  }
}