{
  "title": "2210751_대기환경보전법_일부개정법률안",
  "bill_number": "10751",
  "proposal_date": "2025. 6. 12.",
  "submission_date": "",
  "is_alternative": false,
  "alternative_bill_numbers": [],
  "has_comparison_table": false,
  "comparison_table": "신ㆍ구조문대비표\n현 행 개 정 안\n법률 제18028호 대기환경보전법 법률 제18028호 대기환경보전법\n일부개정법률 ",
  "full_text": "대기환경보전법 일부개정법률안\n(전재수의원 대표발의)\n발의연월일 : 2025. 6. 12.\n의 안\n10751\n번 호 발 의 자 : 전재수ㆍ채현일ㆍ박해철\n이학영ㆍ김영호ㆍ송기헌\n허 영ㆍ김정호ㆍ신영대\n위성곤ㆍ김기표 의원\n(11인)\n제안이유 및 주요내용\n현행법은 수소전기자동차 보급 및 충전인프라 확충을 위하여 수소\n충전소 설치 절차를 간소화하는 수소연료공급시설 설치계획 승인제도\n를 2025년까지 가능하도록 정하고 있음.\n그러나 설치계획 승인제도의 유효기간이 1년여밖에 남지 아니하여\n수소연료공급시설의 체계적인 보급을 위해서는 해당 제도를 연장할\n필요가 있다는 의견이 제기되고 있음.\n이에 수소연료공급시설 설치계획 승인제도의 유효기간을 2028년까\n지 3년 연장하여 수소연료공급시설이 안정적으로 확충되도록 하려는\n것임(안 법률 제18028호 대기환경보전법 일부개정법률 부칙 제2조).\n\n\n\n\n법률 제 호\n대기환경보전법 일부개정법률안\n대기환경보전법 일부를 다음과 같이 개정한다.\n법률 제18028호 대기환경보전법 일부개정법률 부칙 제2조 중 “2025년”\n을 “2028년”으로 한다.\n부 칙\n이 법은 공포한 날부터 시행한다.\n\n\n\n\n신ㆍ구조문대비표\n현 행 개 정 안\n법률 제18028호 대기환경보전법 법률 제18028호 대기환경보전법\n일부개정법률 부칙 일부개정법률 부칙\n제2조(유효기간) 제58조의11 및 제2조(유효기간) ---------------\n제58조의12의 개정규정은 2025 -----------------------2028\n년 12월 31일까지 효력을 가진 년--------------------------\n다. --.\n",
  "sections": {
    "제안이유": "및",
    "주요내용": "현행법은 수소전기자동차 보급 및 충전인프라 확충을 위하여 수소\n충전소 설치 절차를 간소화하는 수소연료공급시설 설치계획 승인제도\n를 2025년까지 가능하도록 정하고 있음.\n그러나 설치계획 승인제도의 유효기간이 1년여밖에 남지 아니하여\n수소연료공급시설의 체계적인 보급을 위해서는 해당 제도를 연장할\n필요가 있다는 의견이 제기되고 있음.\n이에 수소연료공급시설 설치계획 승인제도의 유효기간을 2028년까\n지 3년 연장하여 수소연료공급시설이 안정적으로 확충되도록 하려는\n것임(안",
    "제안이유_및_주요내용": "현행법은 수소전기자동차 보급 및 충전인프라 확충을 위하여 수소\n충전소 설치 절차를 간소화하는 수소연료공급시설 설치계획 승인제도\n를 2025년까지 가능하도록 정하고 있음.\n그러나 설치계획 승인제도의 유효기간이 1년여밖에 남지 아니하여\n수소연료공급시설의 체계적인 보급을 위해서는 해당 제도를 연장할\n필요가 있다는 의견이 제기되고 있음.\n이에 수소연료공급시설 설치계획 승인제도의 유효기간을 2028년까\n지 3년 연장하여 수소연료공급시설이 안정적으로 확충되도록 하려는\n것임(안",
    "법률_제_호": "대기환경보전법 일부개정법률",
    "신구조문대비표": "현 행 개 정 안\n법률 제18028호 대기환경보전법 법률 제18028호 대기환경보전법\n일부개정법률"
  }
}