{
  "title": "2210158_문화유산의_보존_및_활용에_관한_법률_일부개정법률안",
  "bill_number": "10158",
  "proposal_date": "2025. 4. 28.",
  "submission_date": "",
  "is_alternative": false,
  "alternative_bill_numbers": [],
  "has_comparison_table": false,
  "comparison_table": "신ㆍ구조문대비표\n현 행 개 정 안\n제35조(허가사항) ① ∼ ⑤ (생 제35조(허가사항) ① ∼ ⑤ (현행\n략) 과 같음)\n<신 설> ⑥ 국가유산청장은 제1항에도\n불구하고 대통령령으로 정하는\n산불 등 긴급을 요하는 재해ㆍ\n재난이 발생하였을 경우 제1항\n제1호 또는 제2호의 행위에 대\n하여 사후에 허가를 할 수 있\n다.",
  "full_text": "문화유산의 보존 및 활용에 관한 법률 일부개정법률안\n(정희용의원 대표발의)\n발의연월일 : 2025. 4. 28.\n의 안\n10158\n번 호 발 의 자 : 정희용ㆍ고동진ㆍ최수진\n김상훈ㆍ박충권ㆍ정동만\n김태호ㆍ박준태ㆍ김선교\n주호영ㆍ서천호 의원\n(11인)\n제안이유 및 주요내용\n최근 기후변화로 인한 대형 산불 등 각종 자연재해가 빈번하게 발\n생하고 대형화됨에 따라 산에 인접한 문화유산이 실질적인 위협에 노\n출되고 있음. 현행 「문화유산법」은 국가지정문화유산 보호구역(현상\n변경 허가 대상 구역) 내에서의 현상변경을 원칙적으로 사전허가 대상\n으로 규정하고 있어, 긴급 상황에서 문화유산을 보호하기 위한 신속한\n대응에 제약이 따름.\n이에 따라, 산불 등 긴급재난상황 발생 시 문화유산을 보존하기 위\n한 긴급조치를 ‘선조치 후승인’ 방식으로 허용할 수 있도록 법적 근거\n를 마련하여 문화유산의 훼손을 예방하고 실질적인 보호체계를 구축\n하고자 함.\n따라서 현행 「문화유산법」 제35조(허가사항) 조항에 제6항의 단서\n를 신설하여 긴급한 재난상황에서는 문화유산보호를 위한 조치를 우\n\n\n\n선적으로 시행한 후, 사후적으로 허가를 받을 수 있도록 함(안 제35조\n제6항 신설).\n\n법률 제 호\n문화유산의 보존 및 활용에 관한 법률 일부개정법률안\n문화유산의 보존 및 활용에 관한 법률 일부를 다음과 같이 개정한다.\n제35조에 제6항을 다음과 같이 신설한다.\n⑥ 국가유산청장은 제1항에도 불구하고 대통령령으로 정하는 산불\n등 긴급을 요하는 재해ㆍ재난이 발생하였을 경우 제1항제1호 또는\n제2호의 행위에 대하여 사후에 허가를 할 수 있다.\n부 칙\n이 법은 공포 후 6개월이 경과한 날부터 시행한다.\n\n\n\n\n신ㆍ구조문대비표\n현 행 개 정 안\n제35조(허가사항) ① ∼ ⑤ (생 제35조(허가사항) ① ∼ ⑤ (현행\n략) 과 같음)\n<신 설> ⑥ 국가유산청장은 제1항에도\n불구하고 대통령령으로 정하는\n산불 등 긴급을 요하는 재해ㆍ\n재난이 발생하였을 경우 제1항\n제1호 또는 제2호의 행위에 대\n하여 사후에 허가를 할 수 있\n다.\n",
  "sections": {
    "제안이유": "및",
    "주요내용": "최근 기후변화로 인한 대형 산불 등 각종 자연재해가 빈번하게 발\n생하고 대형화됨에 따라 산에 인접한 문화유산이 실질적인 위협에 노\n출되고 있음. 현행 「문화유산법」은 국가지정문화유산 보호구역(현상\n변경 허가 대상 구역) 내에서의 현상변경을 원칙적으로 사전허가 대상\n으로 규정하고 있어, 긴급 상황에서 문화유산을 보호하기 위한 신속한\n대응에 제약이 따름.\n이에 따라, 산불 등 긴급재난상황 발생 시 문화유산을 보존하기 위\n한 긴급조치를 ‘선조치 후승인’ 방식으로 허용할 수 있도록 법적 근거\n를 마련하여 문화유산의 훼손을 예방하고 실질적인 보호체계를 구축\n하고자 함.\n따라서 현행 「문화유산법」 제35조(허가사항) 조항에 제6항의 단서\n를 신설하여 긴급한 재난상황에서는 문화유산보호를 위한 조치를 우\n\n\n\n선적으로 시행한 후, 사후적으로 허가를 받을 수 있도록 함(안 제35조\n제6항 신설).",
    "제안이유_및_주요내용": "최근 기후변화로 인한 대형 산불 등 각종 자연재해가 빈번하게 발\n생하고 대형화됨에 따라 산에 인접한 문화유산이 실질적인 위협에 노\n출되고 있음. 현행 「문화유산법」은 국가지정문화유산 보호구역(현상\n변경 허가 대상 구역) 내에서의 현상변경을 원칙적으로 사전허가 대상\n으로 규정하고 있어, 긴급 상황에서 문화유산을 보호하기 위한 신속한\n대응에 제약이 따름.\n이에 따라, 산불 등 긴급재난상황 발생 시 문화유산을 보존하기 위\n한 긴급조치를 ‘선조치 후승인’ 방식으로 허용할 수 있도록 법적 근거\n를 마련하여 문화유산의 훼손을 예방하고 실질적인 보호체계를 구축\n하고자 함.\n따라서 현행 「문화유산법」 제35조(허가사항) 조항에 제6항의 단서\n를 신설하여 긴급한 재난상황에서는 문화유산보호를 위한 조치를 우\n\n\n\n선적으로 시행한 후, 사후적으로 허가를 받을 수 있도록 함(안 제35조\n제6항 신설).",
    "법률_제_호": "문화유산의 보존 및 활용에 관한 법률 일부개정법률안\n문화유산의 보존 및 활용에 관한 법률 일부를 다음과 같이 개정한다.\n제35조에 제6항을 다음과 같이 신설한다.\n⑥ 국가유산청장은 제1항에도 불구하고 대통령령으로 정하는 산불\n등 긴급을 요하는 재해ㆍ재난이 발생하였을 경우 제1항제1호 또는\n제2호의 행위에 대하여 사후에 허가를 할 수 있다.",
    "신구조문대비표": "현 행 개 정 안\n제35조(허가사항) ① ∼ ⑤ (생 제35조(허가사항) ① ∼ ⑤ (현행\n략) 과 같음)\n<신 설> ⑥ 국가유산청장은 제1항에도\n불구하고 대통령령으로 정하는\n산불 등 긴급을 요하는 재해ㆍ\n재난이 발생하였을 경우 제1항\n제1호 또는 제2호의 행위에 대\n하여 사후에 허가를 할 수 있\n다."
  }
}