{
  "title": "2210368_공공기관의_운영에_관한_법률_일부개정법률안",
  "bill_number": "10368",
  "proposal_date": "2025. 5. 2.",
  "submission_date": "",
  "is_alternative": false,
  "alternative_bill_numbers": [],
  "has_comparison_table": false,
  "comparison_table": "신ㆍ구조문대비표\n현 행 개 정 안\n제52조의5(채용비위 관련자 합격 제52조의5(채용비위 관련자 합격\n취소 등) ① (생 략) 취소 등) ① (현행과 같음)\n<신 설> ② 제1항에 따른 합격ㆍ승진ㆍ\n임용의 취소 처분은 합격ㆍ승\n진ㆍ임용 당시로 소급하여 효\n력이 발생한다.\n② (생 략) ③ (현행 제2항과 같음)",
  "full_text": "공공기관의 운영에 관한 법률 일부개정법률안\n(이성권의원 대표발의)\n발의연월일 : 2025. 5. 2.\n의 안\n10368\n번 호 발 의 자 : 이성권ㆍ이헌승ㆍ박수영\n조승환ㆍ김도읍ㆍ최은석\n곽규택ㆍ정성국ㆍ정연욱\n권영진ㆍ김용태ㆍ주진우\n서지영ㆍ배준영ㆍ신성범\n강명구 의원(16인)\n제안이유 및 주요내용\n현행법에 따르면 기획재정부장관 또는 주무기관의 장은 채용비위와\n관련하여 유죄판결이 확정된 공공기관 임원의 해당 비위행위로 채용\n시험에 합격하거나 승진 또는 임용된 사람에 대해서는 해당 공공기관\n의 장에게 합격ㆍ승진ㆍ임용의 취소 또는 인사상의 불이익 조치를 취\n할 것을 요청할 수 있음.\n최근 중앙선거관리위원회의 채용비리 사건과 관련하여 특혜나 비리\n등으로 채용되거나 임용된 이들에 대한 처분을 취소해야 한다는 의견\n이 비등해지면서 채용은 공정해야 한다는 여론이 커지고 있음.\n다만, 현행법은 특혜나 비리채용에 대한 취소 처분 조항이 있지만,\n취소 처분의 적용 시점이 명확하지 않아 이를 법률에 명확히 규정할\n필요가 있음.\n\n\n\n이에 비위행위로 채용시험에 합격하거나 승진 또는 임용된 사람에\n대한 합격ㆍ승진ㆍ임용의 취소 처분시 그 효력이 합격ㆍ승진ㆍ임용\n당시로 소급하여 효력이 발생한다는 것을 명확히 규정하려는 것임(안\n제52조의5제2항 신설).\n\n법률 제 호\n공공기관의 운영에 관한 법률 일부개정법률안\n공공기관의 운영에 관한 법률 일부를 다음과 같이 개정한다.\n제52조의5제2항을 제3항으로 하고, 같은 조에 제2항을 다음과 같이 신\n설한다.\n② 제1항에 따른 합격ㆍ승진ㆍ임용의 취소 처분은 합격ㆍ승진ㆍ임\n용 당시로 소급하여 효력이 발생한다.\n부 칙\n이 법은 공포한 날부터 시행한다.\n\n\n\n\n신ㆍ구조문대비표\n현 행 개 정 안\n제52조의5(채용비위 관련자 합격 제52조의5(채용비위 관련자 합격\n취소 등) ① (생 략) 취소 등) ① (현행과 같음)\n<신 설> ② 제1항에 따른 합격ㆍ승진ㆍ\n임용의 취소 처분은 합격ㆍ승\n진ㆍ임용 당시로 소급하여 효\n력이 발생한다.\n② (생 략) ③ (현행 제2항과 같음)\n",
  "sections": {
    "제안이유": "및",
    "주요내용": "현행법에 따르면 기획재정부장관 또는 주무기관의 장은 채용비위와\n관련하여 유죄판결이 확정된 공공기관 임원의 해당 비위행위로 채용\n시험에 합격하거나 승진 또는 임용된 사람에 대해서는 해당 공공기관\n의 장에게 합격ㆍ승진ㆍ임용의 취소 또는 인사상의 불이익 조치를 취\n할 것을 요청할 수 있음.\n최근 중앙선거관리위원회의 채용비리 사건과 관련하여 특혜나 비리\n등으로 채용되거나 임용된 이들에 대한 처분을 취소해야 한다는 의견\n이 비등해지면서 채용은 공정해야 한다는 여론이 커지고 있음.\n다만, 현행법은 특혜나 비리채용에 대한 취소 처분 조항이 있지만,\n취소 처분의 적용 시점이 명확하지 않아 이를 법률에 명확히 규정할\n필요가 있음.\n\n\n\n이에 비위행위로 채용시험에 합격하거나 승진 또는 임용된 사람에\n대한 합격ㆍ승진ㆍ임용의 취소 처분시 그 효력이 합격ㆍ승진ㆍ임용\n당시로 소급하여 효력이 발생한다는 것을 명확히 규정하려는 것임(안\n제52조의5제2항 신설).",
    "제안이유_및_주요내용": "현행법에 따르면 기획재정부장관 또는 주무기관의 장은 채용비위와\n관련하여 유죄판결이 확정된 공공기관 임원의 해당 비위행위로 채용\n시험에 합격하거나 승진 또는 임용된 사람에 대해서는 해당 공공기관\n의 장에게 합격ㆍ승진ㆍ임용의 취소 또는 인사상의 불이익 조치를 취\n할 것을 요청할 수 있음.\n최근 중앙선거관리위원회의 채용비리 사건과 관련하여 특혜나 비리\n등으로 채용되거나 임용된 이들에 대한 처분을 취소해야 한다는 의견\n이 비등해지면서 채용은 공정해야 한다는 여론이 커지고 있음.\n다만, 현행법은 특혜나 비리채용에 대한 취소 처분 조항이 있지만,\n취소 처분의 적용 시점이 명확하지 않아 이를 법률에 명확히 규정할\n필요가 있음.\n\n\n\n이에 비위행위로 채용시험에 합격하거나 승진 또는 임용된 사람에\n대한 합격ㆍ승진ㆍ임용의 취소 처분시 그 효력이 합격ㆍ승진ㆍ임용\n당시로 소급하여 효력이 발생한다는 것을 명확히 규정하려는 것임(안\n제52조의5제2항 신설).",
    "법률_제_호": "공공기관의 운영에 관한 법률 일부개정법률안\n공공기관의 운영에 관한 법률 일부를 다음과 같이 개정한다.\n제52조의5제2항을 제3항으로 하고, 같은 조에 제2항을 다음과 같이 신\n설한다.\n② 제1항에 따른 합격ㆍ승진ㆍ임용의 취소 처분은 합격ㆍ승진ㆍ임\n용 당시로 소급하여 효력이 발생한다.",
    "신구조문대비표": "현 행 개 정 안\n제52조의5(채용비위 관련자 합격 제52조의5(채용비위 관련자 합격\n취소 등) ① (생 략) 취소 등) ① (현행과 같음)\n<신 설> ② 제1항에 따른 합격ㆍ승진ㆍ\n임용의 취소 처분은 합격ㆍ승\n진ㆍ임용 당시로 소급하여 효\n력이 발생한다.\n② (생 략) ③ (현행 제2항과 같음)"
  }
}