{
  "title": "2210121_군인의_지위_및_복무에_관한_기본법_일부개정법률안",
  "bill_number": "10121",
  "proposal_date": "2025. 4. 25.",
  "submission_date": "",
  "is_alternative": false,
  "alternative_bill_numbers": [],
  "has_comparison_table": false,
  "comparison_table": "신ㆍ구조문대비표\n현 행 개 정 안\n법률 제20539호 군인의 지위 및 법률 제20539호 군인의 지위 및\n복무에 관한 기본법 복무에 관한 기본법\n일부개정법률 일부개정법률\n<신 설> 제17조의4(안전권의 보장) 국가는\n병영생활에서 군인의 생명 및\n신체의 안전을 보장하기 위하\n여 필요한 조치를 취하여야 한\n다.",
  "full_text": "군인의 지위 및 복무에 관한 기본법 일부개정법률안\n(추미애의원 대표발의)\n발의연월일 : 2025. 4. 25.\n의 안\n10121\n번 호 발 의 자 : 추미애ㆍ전재수ㆍ신영대\n이성윤ㆍ부승찬ㆍ김동아\n한병도ㆍ김기표ㆍ박선원\n박용갑ㆍ정성호ㆍ송옥주\n한정애ㆍ전종덕 의원\n(14인)\n제안이유 및 주요내용\n현재 병영생활에서의 군인의 안전을 보장하기 위한 국가의 의무 사\n항이 규정되어 있지 않음.\n그런데 최근 군용트럭 교통사고로 병사들이 사망하는 등 인명사고\n가 발생한 가운데, 그 주요 원인으로 노후된 군용차량과 좌석안전띠\n미설치 등의 문제점이 지적됨에 따라 군용차량의 안전 확보를 위한\n조치 마련이 필요하다는 의견이 제기됨.\n특히, 국민청원을 통해서도 노후된 군용차량에 대한 불용 처분과 모\n든 군용차량에 좌석안전띠 설치 및 철저한 관리가 요구되는 등 법안\n개정이 시급하다는 의견이 나타나고 있음.\n이에 군인의 안전을 보장하기 위한 국가의 책무를 명시하여 군인들\n이 안전한 병영생활을 할 수 있도록 하려는 것임(안 제17조의4 신설).\n\n\n\n\n법률 제 호\n군인의 지위 및 복무에 관한 기본법 일부개정법률안\n법률 제20539호 군인의 지위 및 복무에 관한 기본법 일부를 다음과\n같이 개정한다.\n제17조의4를 다음과 같이 신설한다.\n제17조의4(안전권의 보장) 국가는 병영생활에서 군인의 생명 및 신체\n의 안전을 보장하기 위하여 필요한 조치를 취하여야 한다.\n부 칙\n이 법은 공포한 날부터 시행한다.\n\n\n\n\n신ㆍ구조문대비표\n현 행 개 정 안\n법률 제20539호 군인의 지위 및 법률 제20539호 군인의 지위 및\n복무에 관한 기본법 복무에 관한 기본법\n일부개정법률 일부개정법률\n<신 설> 제17조의4(안전권의 보장) 국가는\n병영생활에서 군인의 생명 및\n신체의 안전을 보장하기 위하\n여 필요한 조치를 취하여야 한\n다.\n",
  "sections": {
    "제안이유": "및",
    "주요내용": "현재 병영생활에서의 군인의 안전을 보장하기 위한 국가의 의무 사\n항이 규정되어 있지 않음.\n그런데 최근 군용트럭 교통사고로 병사들이 사망하는 등 인명사고\n가 발생한 가운데, 그 주요 원인으로 노후된 군용차량과 좌석안전띠\n미설치 등의 문제점이 지적됨에 따라 군용차량의 안전 확보를 위한\n조치 마련이 필요하다는 의견이 제기됨.\n특히, 국민청원을 통해서도 노후된 군용차량에 대한 불용 처분과 모\n든 군용차량에 좌석안전띠 설치 및 철저한 관리가 요구되는 등 법안\n개정이 시급하다는 의견이 나타나고 있음.\n이에 군인의 안전을 보장하기 위한 국가의 책무를 명시하여 군인들\n이 안전한 병영생활을 할 수 있도록 하려는 것임(안 제17조의4 신설).",
    "제안이유_및_주요내용": "현재 병영생활에서의 군인의 안전을 보장하기 위한 국가의 의무 사\n항이 규정되어 있지 않음.\n그런데 최근 군용트럭 교통사고로 병사들이 사망하는 등 인명사고\n가 발생한 가운데, 그 주요 원인으로 노후된 군용차량과 좌석안전띠\n미설치 등의 문제점이 지적됨에 따라 군용차량의 안전 확보를 위한\n조치 마련이 필요하다는 의견이 제기됨.\n특히, 국민청원을 통해서도 노후된 군용차량에 대한 불용 처분과 모\n든 군용차량에 좌석안전띠 설치 및 철저한 관리가 요구되는 등 법안\n개정이 시급하다는 의견이 나타나고 있음.\n이에 군인의 안전을 보장하기 위한 국가의 책무를 명시하여 군인들\n이 안전한 병영생활을 할 수 있도록 하려는 것임(안 제17조의4 신설).",
    "법률_제_호": "군인의 지위 및 복무에 관한 기본법 일부개정법률안\n법률 제20539호 군인의 지위 및 복무에 관한 기본법 일부를 다음과\n같이 개정한다.\n제17조의4를 다음과 같이 신설한다.\n제17조의4(안전권의 보장) 국가는 병영생활에서 군인의 생명 및 신체\n의 안전을 보장하기 위하여 필요한 조치를 취하여야 한다.",
    "신구조문대비표": "현 행 개 정 안\n법률 제20539호 군인의 지위 및 법률 제20539호 군인의 지위 및\n복무에 관한 기본법 복무에 관한 기본법\n일부개정법률 일부개정법률\n<신 설> 제17조의4(안전권의 보장) 국가는\n병영생활에서 군인의 생명 및\n신체의 안전을 보장하기 위하\n여 필요한 조치를 취하여야 한\n다."
  }
}