{
  "title": "2210772_한식진흥법_일부개정법률안",
  "bill_number": "10772",
  "proposal_date": "2025. 6. 12.",
  "submission_date": "",
  "is_alternative": false,
  "alternative_bill_numbers": [],
  "has_comparison_table": false,
  "comparison_table": "신ㆍ구조문대비표\n현 행 개 정 안\n<신 설> 제16조의2(한식의 날) ① 한식산\n업을 진흥하고 한식의 가치와\n우수성을 널리 알리기 위하여\n매년 10월 10일을 한식의 날로\n한다.\n② 국가와 지방자치단체는 제1\n항에 따른 한식의 날의 취지에\n맞는 행사와 교육 및 홍보를\n실시할 수 있다.",
  "full_text": "한식진흥법 일부개정법률안\n(어기구의원 대표발의)\n발의연월일 : 2025. 6. 12.\n의 안\n10772\n번 호 발 의 자 : 어기구ㆍ이병진ㆍ박용갑\n박수현ㆍ박희승ㆍ박균택\n이개호ㆍ한정애ㆍ오세희\n김종민ㆍ정춘생ㆍ이성윤\n의원(12인)\n제안이유 및 주요내용\n한식은 오랜 역사와 전통을 지닌 우리나라 고유의 음식으로 국내외\n에서 그 우수성을 인정받고 있으며, 최근에는 한류 열풍에 힘입어 한\n식에 대한 세계인의 관심이 높아짐에 따라 한식은 더 이상 단순한 음\n식 문화에 그치는 것이 아니라 국가 브랜드 가치 제고 및 식품ㆍ외식\n산업 활성화 등에 큰 기여를 하는 것으로 평가받고 있음.\n이에 따라 한식의 문화적ㆍ경제적 가치 창출 역할을 고려하여 국가\n적 차원에서 한식의 가치와 우수성을 널리 알릴 수 있는 법정 기념일\n의 지정이 필요하다는 의견이 있음.\n이에 매년 10월 10일을 한식의 날로 정하여 한식산업을 진흥하고\n한식의 가치와 우수성을 널리 알림으로써 한식에 대한 국민의 자긍심\n을 높이고 한식의 국내외 확산에 기여하려는 것임(안 제16조의2 신\n설).\n\n\n\n\n법률 제 호\n한식진흥법 일부개정법률안\n한식진흥법 일부를 다음과 같이 개정한다.\n제4장에 제16조의2를 다음과 같이 신설한다.\n제16조의2(한식의 날) ① 한식산업을 진흥하고 한식의 가치와 우수성\n을 널리 알리기 위하여 매년 10월 10일을 한식의 날로 한다.\n② 국가와 지방자치단체는 제1항에 따른 한식의 날의 취지에 맞는\n행사와 교육 및 홍보를 실시할 수 있다.\n부 칙\n이 법은 공포한 날부터 시행한다.\n\n\n\n\n신ㆍ구조문대비표\n현 행 개 정 안\n<신 설> 제16조의2(한식의 날) ① 한식산\n업을 진흥하고 한식의 가치와\n우수성을 널리 알리기 위하여\n매년 10월 10일을 한식의 날로\n한다.\n② 국가와 지방자치단체는 제1\n항에 따른 한식의 날의 취지에\n맞는 행사와 교육 및 홍보를\n실시할 수 있다.\n",
  "sections": {
    "제안이유": "및",
    "주요내용": "한식은 오랜 역사와 전통을 지닌 우리나라 고유의 음식으로 국내외\n에서 그 우수성을 인정받고 있으며, 최근에는 한류 열풍에 힘입어 한\n식에 대한 세계인의 관심이 높아짐에 따라 한식은 더 이상 단순한 음\n식 문화에 그치는 것이 아니라 국가 브랜드 가치 제고 및 식품ㆍ외식\n산업 활성화 등에 큰 기여를 하는 것으로 평가받고 있음.\n이에 따라 한식의 문화적ㆍ경제적 가치 창출 역할을 고려하여 국가\n적 차원에서 한식의 가치와 우수성을 널리 알릴 수 있는 법정 기념일\n의 지정이 필요하다는 의견이 있음.\n이에 매년 10월 10일을 한식의 날로 정하여 한식산업을 진흥하고\n한식의 가치와 우수성을 널리 알림으로써 한식에 대한 국민의 자긍심\n을 높이고 한식의 국내외 확산에 기여하려는 것임(안 제16조의2 신\n설).",
    "제안이유_및_주요내용": "한식은 오랜 역사와 전통을 지닌 우리나라 고유의 음식으로 국내외\n에서 그 우수성을 인정받고 있으며, 최근에는 한류 열풍에 힘입어 한\n식에 대한 세계인의 관심이 높아짐에 따라 한식은 더 이상 단순한 음\n식 문화에 그치는 것이 아니라 국가 브랜드 가치 제고 및 식품ㆍ외식\n산업 활성화 등에 큰 기여를 하는 것으로 평가받고 있음.\n이에 따라 한식의 문화적ㆍ경제적 가치 창출 역할을 고려하여 국가\n적 차원에서 한식의 가치와 우수성을 널리 알릴 수 있는 법정 기념일\n의 지정이 필요하다는 의견이 있음.\n이에 매년 10월 10일을 한식의 날로 정하여 한식산업을 진흥하고\n한식의 가치와 우수성을 널리 알림으로써 한식에 대한 국민의 자긍심\n을 높이고 한식의 국내외 확산에 기여하려는 것임(안 제16조의2 신\n설).",
    "법률_제_호": "한식진흥법 일부개정법률안\n한식진흥법 일부를 다음과 같이 개정한다.\n제4장에 제16조의2를 다음과 같이 신설한다.\n제16조의2(한식의 날) ① 한식산업을 진흥하고 한식의 가치와 우수성\n을 널리 알리기 위하여 매년 10월 10일을 한식의 날로 한다.\n② 국가와 지방자치단체는 제1항에 따른 한식의 날의 취지에 맞는\n행사와 교육 및 홍보를 실시할 수 있다.",
    "신구조문대비표": "현 행 개 정 안\n<신 설> 제16조의2(한식의 날) ① 한식산\n업을 진흥하고 한식의 가치와\n우수성을 널리 알리기 위하여\n매년 10월 10일을 한식의 날로\n한다.\n② 국가와 지방자치단체는 제1\n항에 따른 한식의 날의 취지에\n맞는 행사와 교육 및 홍보를\n실시할 수 있다."
  }
}