{
  "title": "2210375_법원조직법_일부개정법률안",
  "bill_number": "10375",
  "proposal_date": "2025. 5. 2.",
  "submission_date": "",
  "is_alternative": false,
  "alternative_bill_numbers": [],
  "has_comparison_table": false,
  "comparison_table": "신ㆍ구조문대비표\n현 행 개 정 안\n제4조(대법관) ①(생 략) 제4조(대법관) ① (현행과 같음)\n② 대법관의 수는 대법원장을 ② ----------------------\n포함하여 14명으로 한다. ---------30명-------.",
  "full_text": "법원조직법 일부개정법률안\n(김용민의원 대표발의)\n발의연월일 : 2025. 5. 2.\n의 안\n10375\n번 호 발 의 자 : 김용민ㆍ한준호ㆍ민형배\n정진욱ㆍ노종면ㆍ장경태\n임미애ㆍ김남희ㆍ박민규\n박성준ㆍ문진석ㆍ신정훈\n부승찬ㆍ박지원 의원\n(14인)\n제안이유 및 주요내용\n대법원은 국민의 기본권 보장과 일상생활의 중요한 법적 분쟁에 대\n해 최종적인 판단을 내리는 최고법원으로서, 우리 사회의 법질서 확립\n과 방향성을 제시하는 중추적 기관임. 그러나 현재 대법관은 대법원장\n을 포함하여 총 14명에 불과함.\n2022년 기준 대법원 본안사건 접수 건수는 연간 56,000건을 초과하\n였으며, 대법관 1인당 연간 약 5,000건에 달하는 사건을 처리해야 할\n정도로 업무가 과중함. 이로 인해 심층적 심리와 숙의가 어려워지고\n있으며, 상당수 사건이 '심리불속행 기각'으로 종결되는 구조 속에서\n상고심에 대한 국민적 불신이 심화되고 있음. 이러한 구조는 대법원이\n법령 해석의 통일이라는 제도적 기능은 물론, 국민의 권리구제라는 헌\n법적 책무를 수행하는 데 근본적인 제약으로 작용하고 있음.\n\n\n\n또한, 대법관 후보군이 사실상 고위 법관 중심으로 제한되고 있는\n현실은, 성별ㆍ세대ㆍ직업적 배경 등 다양한 관점이 반영된 대법원 구\n성을 어렵게 만들고 있음. 실제로 최근 10년간 임명된 대법관과 후보\n자 중 상당수가 50대 남성, 고위 법관 출신, 특정 대학 출신에 집중되\n어 있어 구성의 획일화에 대한 사회적 비판이 제기되고 있음.\n이에 본 법률안은 대법관의 수를 기존 14명에서 30명으로 증원함으\n로써 대법관들이 개별 사건에 보다 충분한 시간과 역량을 투입할 수\n있게 하고, 사회적 다양성이 반영된 대법원 구성을 가능케 하여 대법\n원의 심리 충실성과 사회적 신뢰를 제고하며, 국민의 재판청구권 보장\n과 법치주의 실현에 이바지하고자 함(안 제4조제2항).\n\n법률 제 호\n법원조직법 일부개정법률안\n법원조직법 일부를 다음과 같이 개정한다.\n제4조제2항 중 “14명”을 “30명”으로 한다.\n부 칙\n이 법은 공포한 날부터 시행한다. 다만, 이 법에 따라 증원되는 대법\n관의 정원 16명 중 8명의 증원은 공포 후 1년이 경과한 날부터 시행\n하고, 8명의 증원은 공포 후 2년이 경과한 날부터 시행한다.\n\n\n\n\n신ㆍ구조문대비표\n현 행 개 정 안\n제4조(대법관) ①(생 략) 제4조(대법관) ① (현행과 같음)\n② 대법관의 수는 대법원장을 ② ----------------------\n포함하여 14명으로 한다. ---------30명-------.\n",
  "sections": {
    "제안이유": "및",
    "주요내용": "대법원은 국민의 기본권 보장과 일상생활의 중요한 법적 분쟁에 대\n해 최종적인 판단을 내리는 최고법원으로서, 우리 사회의 법질서 확립\n과 방향성을 제시하는 중추적 기관임. 그러나 현재 대법관은 대법원장\n을 포함하여 총 14명에 불과함.\n2022년 기준 대법원 본안사건 접수 건수는 연간 56,000건을 초과하\n였으며, 대법관 1인당 연간 약 5,000건에 달하는 사건을 처리해야 할\n정도로 업무가 과중함. 이로 인해 심층적 심리와 숙의가 어려워지고\n있으며, 상당수 사건이 '심리불속행 기각'으로 종결되는 구조 속에서\n상고심에 대한 국민적 불신이 심화되고 있음. 이러한 구조는 대법원이\n법령 해석의 통일이라는 제도적 기능은 물론, 국민의 권리구제라는 헌\n법적 책무를 수행하는 데 근본적인 제약으로 작용하고 있음.\n\n\n\n또한, 대법관 후보군이 사실상 고위 법관 중심으로 제한되고 있는\n현실은, 성별ㆍ세대ㆍ직업적 배경 등 다양한 관점이 반영된 대법원 구\n성을 어렵게 만들고 있음. 실제로 최근 10년간 임명된 대법관과 후보\n자 중 상당수가 50대 남성, 고위 법관 출신, 특정 대학 출신에 집중되\n어 있어 구성의 획일화에 대한 사회적 비판이 제기되고 있음.\n이에 본 법률안은 대법관의 수를 기존 14명에서 30명으로 증원함으\n로써 대법관들이 개별 사건에 보다 충분한 시간과 역량을 투입할 수\n있게 하고, 사회적 다양성이 반영된 대법원 구성을 가능케 하여 대법\n원의 심리 충실성과 사회적 신뢰를 제고하며, 국민의 재판청구권 보장\n과 법치주의 실현에 이바지하고자 함(안 제4조제2항).",
    "제안이유_및_주요내용": "대법원은 국민의 기본권 보장과 일상생활의 중요한 법적 분쟁에 대\n해 최종적인 판단을 내리는 최고법원으로서, 우리 사회의 법질서 확립\n과 방향성을 제시하는 중추적 기관임. 그러나 현재 대법관은 대법원장\n을 포함하여 총 14명에 불과함.\n2022년 기준 대법원 본안사건 접수 건수는 연간 56,000건을 초과하\n였으며, 대법관 1인당 연간 약 5,000건에 달하는 사건을 처리해야 할\n정도로 업무가 과중함. 이로 인해 심층적 심리와 숙의가 어려워지고\n있으며, 상당수 사건이 '심리불속행 기각'으로 종결되는 구조 속에서\n상고심에 대한 국민적 불신이 심화되고 있음. 이러한 구조는 대법원이\n법령 해석의 통일이라는 제도적 기능은 물론, 국민의 권리구제라는 헌\n법적 책무를 수행하는 데 근본적인 제약으로 작용하고 있음.\n\n\n\n또한, 대법관 후보군이 사실상 고위 법관 중심으로 제한되고 있는\n현실은, 성별ㆍ세대ㆍ직업적 배경 등 다양한 관점이 반영된 대법원 구\n성을 어렵게 만들고 있음. 실제로 최근 10년간 임명된 대법관과 후보\n자 중 상당수가 50대 남성, 고위 법관 출신, 특정 대학 출신에 집중되\n어 있어 구성의 획일화에 대한 사회적 비판이 제기되고 있음.\n이에 본 법률안은 대법관의 수를 기존 14명에서 30명으로 증원함으\n로써 대법관들이 개별 사건에 보다 충분한 시간과 역량을 투입할 수\n있게 하고, 사회적 다양성이 반영된 대법원 구성을 가능케 하여 대법\n원의 심리 충실성과 사회적 신뢰를 제고하며, 국민의 재판청구권 보장\n과 법치주의 실현에 이바지하고자 함(안 제4조제2항).",
    "법률_제_호": "법원조직법 일부개정법률안\n법원조직법 일부를 다음과 같이 개정한다.\n제4조제2항 중 “14명”을 “30명”으로 한다.",
    "신구조문대비표": "현 행 개 정 안\n제4조(대법관) ①(생 략) 제4조(대법관) ① (현행과 같음)\n② 대법관의 수는 대법원장을 ② ----------------------\n포함하여 14명으로 한다. ---------30명-------."
  }
}