{
  "title": "2210216_기상법_일부개정법률안",
  "bill_number": "10216",
  "proposal_date": "2025. 4. 29.",
  "submission_date": "",
  "is_alternative": false,
  "alternative_bill_numbers": [],
  "has_comparison_table": false,
  "comparison_table": "신ㆍ구조문대비표\n현 행 개 정 안\n<신 설> 제18조의2(기상 조절 기술개발\n및 활용) 기상청장은 대기질\n개선, 산불 예방 등을 위하여\n인공강우 등 기상 조절 기술개\n발 및 활용을 위하여 노력하여\n야 한다.",
  "full_text": "기상법 일부개정법률안\n(김선교의원 대표발의)\n발의연월일 : 2025. 4. 29.\n의 안\n10216\n번 호 발 의 자 : 김선교ㆍ서천호ㆍ김성원\n송석준ㆍ김상훈ㆍ최보윤\n김예지ㆍ김위상ㆍ박덕흠\n김소희 의원(10인)\n제안이유 및 주요내용\n현행법은 기상재해의 예방과 기상학 연구를 위한 경우로서 기상청\n장의 승인을 받은 경우에는 기상청장 외의 자가 기상 상태에 인위적\n인 영향을 주어 비ㆍ눈ㆍ우박 및 안개 등의 기상현상을 변화시키거나\n조절하는 것을 목적으로 하는 행위를 할 수 있도록 규정하고 있음.\n그런데 외국에서는 대기질 개선, 산불 예방 등을 위하여 인공강우\n기술 개발 및 활용을 적극적으로 추진하고 있어, 우리나라에서도 그와\n관련된 지속적인 예산 지원 및 연구인력 확보가 필요한 실정임.\n이에 기상청장으로 하여금 대기질 개선, 산불 예방 등을 위하여 인\n공강우 등 기상 조절 기술개발 및 활용을 위한 노력 의무를 규정함으\n로써 대기질 개선, 산불 예방을 위한 인공강우 기술 향상을 촉진하려\n는 것임(안 제18조의2 신설).\n\n\n\n\n법률 제 호\n기상법 일부개정법률안\n기상법 일부를 다음과 같이 개정한다.\n제18조의2를 다음과 같이 신설한다.\n제18조의2(기상 조절 기술개발 및 활용) 기상청장은 대기질 개선, 산\n불 예방 등을 위하여 인공강우 등 기상 조절 기술개발 및 활용을\n위하여 노력하여야 한다.\n부 칙\n이 법은 공포 후 6개월이 경과한 날부터 시행한다.\n\n\n\n\n신ㆍ구조문대비표\n현 행 개 정 안\n<신 설> 제18조의2(기상 조절 기술개발\n및 활용) 기상청장은 대기질\n개선, 산불 예방 등을 위하여\n인공강우 등 기상 조절 기술개\n발 및 활용을 위하여 노력하여\n야 한다.\n",
  "sections": {
    "제안이유": "및",
    "주요내용": "현행법은 기상재해의 예방과 기상학 연구를 위한 경우로서 기상청\n장의 승인을 받은 경우에는 기상청장 외의 자가 기상 상태에 인위적\n인 영향을 주어 비ㆍ눈ㆍ우박 및 안개 등의 기상현상을 변화시키거나\n조절하는 것을 목적으로 하는 행위를 할 수 있도록 규정하고 있음.\n그런데 외국에서는 대기질 개선, 산불 예방 등을 위하여 인공강우\n기술 개발 및 활용을 적극적으로 추진하고 있어, 우리나라에서도 그와\n관련된 지속적인 예산 지원 및 연구인력 확보가 필요한 실정임.\n이에 기상청장으로 하여금 대기질 개선, 산불 예방 등을 위하여 인\n공강우 등 기상 조절 기술개발 및 활용을 위한 노력 의무를 규정함으\n로써 대기질 개선, 산불 예방을 위한 인공강우 기술 향상을 촉진하려\n는 것임(안 제18조의2 신설).",
    "제안이유_및_주요내용": "현행법은 기상재해의 예방과 기상학 연구를 위한 경우로서 기상청\n장의 승인을 받은 경우에는 기상청장 외의 자가 기상 상태에 인위적\n인 영향을 주어 비ㆍ눈ㆍ우박 및 안개 등의 기상현상을 변화시키거나\n조절하는 것을 목적으로 하는 행위를 할 수 있도록 규정하고 있음.\n그런데 외국에서는 대기질 개선, 산불 예방 등을 위하여 인공강우\n기술 개발 및 활용을 적극적으로 추진하고 있어, 우리나라에서도 그와\n관련된 지속적인 예산 지원 및 연구인력 확보가 필요한 실정임.\n이에 기상청장으로 하여금 대기질 개선, 산불 예방 등을 위하여 인\n공강우 등 기상 조절 기술개발 및 활용을 위한 노력 의무를 규정함으\n로써 대기질 개선, 산불 예방을 위한 인공강우 기술 향상을 촉진하려\n는 것임(안 제18조의2 신설).",
    "법률_제_호": "기상법 일부개정법률안\n기상법 일부를 다음과 같이 개정한다.\n제18조의2를 다음과 같이 신설한다.\n제18조의2(기상 조절 기술개발 및 활용) 기상청장은 대기질 개선, 산\n불 예방 등을 위하여 인공강우 등 기상 조절 기술개발 및 활용을\n위하여 노력하여야 한다.",
    "신구조문대비표": "현 행 개 정 안\n<신 설> 제18조의2(기상 조절 기술개발\n및 활용) 기상청장은 대기질\n개선, 산불 예방 등을 위하여\n인공강우 등 기상 조절 기술개\n발 및 활용을 위하여 노력하여\n야 한다."
  }
}