{
  "title": "2210438_철도산업발전기본법_일부개정법률안",
  "bill_number": "10438",
  "proposal_date": "2025. 5. 9.",
  "submission_date": "",
  "is_alternative": false,
  "alternative_bill_numbers": [],
  "has_comparison_table": false,
  "comparison_table": "신ㆍ구조문대비표\n현 행 개 정 안\n제8조(철도산업의 지원) (생 략) 제8조(철도산업의 지원) ① (현행\n제목 외의 부분과 같음)\n<신 설> ② 국가는 철도이용자의 안전\n을 위하여 철도운영자가 국토\n교통부령으로 정하는 노후화된\n철도차량을 교체하는 경우 필\n요한 소요자금의 일부를 보조\n할 수 있다.",
  "full_text": "철도산업발전기본법 일부개정법률안\n(손명수의원ㆍ윤영석의원 대표발의)\n발의연월일 : 2025. 5. 9.\n의 안\n10438\n번 호 발 의 자 : 손명수ㆍ윤영석ㆍ김태년\n김한규ㆍ맹성규ㆍ김원이\n김남근ㆍ박용갑ㆍ서삼석\n박홍배ㆍ윤종군ㆍ남인순\n이학영ㆍ권칠승ㆍ김영배\n전용기ㆍ장경태ㆍ송기헌\n민형배ㆍ이연희ㆍ염태영\n정태호ㆍ이정문ㆍ박덕흠\n백종헌ㆍ김태호ㆍ구자근\n문금주ㆍ박대출ㆍ이헌승\n이인선ㆍ김도읍ㆍ정동만\n조경태ㆍ서일준ㆍ황운하\n곽규택ㆍ서지영ㆍ안태준\n엄태영ㆍ박성민ㆍ서천호\n최형두ㆍ박성훈ㆍ최은석\n이상휘ㆍ서범수ㆍ김종양\n이종욱ㆍ김기표ㆍ신성범\n권영진ㆍ김상훈ㆍ문진석\n이건태ㆍ윤종오 의원\n(56인)\n제안이유 및 주요내용\n\n\n\n현행법은 철도산업의 육성ㆍ발전과 철도안전 확보를 위하여 국가로\n하여금 재정ㆍ금융ㆍ세제ㆍ행정상의 지원을 할 수 있도록 하고 있음.\n우리나라에서 운영중인 고속철도 차량의 절반 이상은 20년 이상 된\n노후 철도차량으로, 이에 따라 유지보수 비용이 증가하고, 철도이용자\n의 안전확보에도 어려움이 발생할 우려가 있음.\n그런데 우리나라 철도산업의 여건상 철도운영자가 충분한 이익잉여\n금을 적립하기 어려워 막대한 비용이 수반되는 철도차량의 교체를 적\n기에 시행하기 어려운 측면이 있으므로, 노후 철도차량 교체에 대한\n정부의 정책적ㆍ재정적 지원이 불가피한 실정임.\n이에 국토교통부령으로 정하는 노후 철도차량을 교체하는 경우 국\n가가 교체에 필요한 소요자금의 일부를 지원할 수 있도록 하려는 것\n임(안 제8조제2항 신설).\n\n법률 제 호\n철도산업발전기본법 일부개정법률안\n철도산업발전기본법 일부를 다음과 같이 개정한다.\n제8조 제목 외의 부분을 제1항으로 하고, 같은 조에 제2항을 다음과\n같이 신설한다.\n② 국가는 철도이용자의 안전을 위하여 철도운영자가 국토교통부령\n으로 정하는 노후화된 철도차량을 교체하는 경우 필요한 소요자금\n의 일부를 보조할 수 있다.\n부 칙\n이 법은 공포 후 6개월이 경과한 날부터 시행한다.\n\n\n\n\n신ㆍ구조문대비표\n현 행 개 정 안\n제8조(철도산업의 지원) (생 략) 제8조(철도산업의 지원) ① (현행\n제목 외의 부분과 같음)\n<신 설> ② 국가는 철도이용자의 안전\n을 위하여 철도운영자가 국토\n교통부령으로 정하는 노후화된\n철도차량을 교체하는 경우 필\n요한 소요자금의 일부를 보조\n할 수 있다.\n",
  "sections": {
    "제안이유": "및",
    "주요내용": "현행법은 철도산업의 육성ㆍ발전과 철도안전 확보를 위하여 국가로\n하여금 재정ㆍ금융ㆍ세제ㆍ행정상의 지원을 할 수 있도록 하고 있음.\n우리나라에서 운영중인 고속철도 차량의 절반 이상은 20년 이상 된\n노후 철도차량으로, 이에 따라 유지보수 비용이 증가하고, 철도이용자\n의 안전확보에도 어려움이 발생할 우려가 있음.\n그런데 우리나라 철도산업의 여건상 철도운영자가 충분한 이익잉여\n금을 적립하기 어려워 막대한 비용이 수반되는 철도차량의 교체를 적\n기에 시행하기 어려운 측면이 있으므로, 노후 철도차량 교체에 대한\n정부의 정책적ㆍ재정적 지원이 불가피한 실정임.\n이에 국토교통부령으로 정하는 노후 철도차량을 교체하는 경우 국\n가가 교체에 필요한 소요자금의 일부를 지원할 수 있도록 하려는 것\n임(안 제8조제2항 신설).",
    "제안이유_및_주요내용": "현행법은 철도산업의 육성ㆍ발전과 철도안전 확보를 위하여 국가로\n하여금 재정ㆍ금융ㆍ세제ㆍ행정상의 지원을 할 수 있도록 하고 있음.\n우리나라에서 운영중인 고속철도 차량의 절반 이상은 20년 이상 된\n노후 철도차량으로, 이에 따라 유지보수 비용이 증가하고, 철도이용자\n의 안전확보에도 어려움이 발생할 우려가 있음.\n그런데 우리나라 철도산업의 여건상 철도운영자가 충분한 이익잉여\n금을 적립하기 어려워 막대한 비용이 수반되는 철도차량의 교체를 적\n기에 시행하기 어려운 측면이 있으므로, 노후 철도차량 교체에 대한\n정부의 정책적ㆍ재정적 지원이 불가피한 실정임.\n이에 국토교통부령으로 정하는 노후 철도차량을 교체하는 경우 국\n가가 교체에 필요한 소요자금의 일부를 지원할 수 있도록 하려는 것\n임(안 제8조제2항 신설).",
    "법률_제_호": "철도산업발전기본법 일부개정법률안\n철도산업발전기본법 일부를 다음과 같이 개정한다.\n제8조 제목 외의 부분을 제1항으로 하고, 같은 조에 제2항을 다음과\n같이 신설한다.\n② 국가는 철도이용자의 안전을 위하여 철도운영자가 국토교통부령\n으로 정하는 노후화된 철도차량을 교체하는 경우 필요한 소요자금\n의 일부를 보조할 수 있다.",
    "신구조문대비표": "현 행 개 정 안\n제8조(철도산업의 지원) (생 략) 제8조(철도산업의 지원) ① (현행\n제목 외의 부분과 같음)\n<신 설> ② 국가는 철도이용자의 안전\n을 위하여 철도운영자가 국토\n교통부령으로 정하는 노후화된\n철도차량을 교체하는 경우 필\n요한 소요자금의 일부를 보조\n할 수 있다."
  }
}