{
  "title": "2210412_공휴일에_관한_법률_일부개정법률안",
  "bill_number": "10412",
  "proposal_date": "2025. 5. 8.",
  "submission_date": "",
  "is_alternative": false,
  "alternative_bill_numbers": [],
  "has_comparison_table": false,
  "comparison_table": "신ㆍ구조문대비표\n현 행 개 정 안\n제2조(공휴일) 공휴일은 다음 각 제2조(공휴일) --------------\n호와 같다. -------.\n1. ∼ 9. (생 략) 1. ∼ 9. (현행과 같음)\n<신 설> 10. 노동자의 날(5월 1일)\n<신 설> 11. 어버이날(5월 8일)\n10. (생 략) 12. (현행 제10호와 같음)",
  "full_text": "공휴일에 관한 법률 일부개정법률안\n(정춘생의원 대표발의)\n발의연월일 : 2025. 5. 8.\n의 안\n10412\n번 호 발 의 자 : 정춘생ㆍ서왕진ㆍ차규근\n황운하ㆍ서미화ㆍ이해민\n박용갑ㆍ신장식ㆍ김선민\n강경숙 의원(10인)\n제안이유 및 주요내용\n노동자의 날(5월 1일)은 노동의 가치를 기념하고 존중하는 날임에도\n불구하고, 법정공휴일로 인정되지 않아 많은 노동자들이 실질적인 휴\n식을 보장받지 못하고 있음.\n한편, 어버이날(5월 8일) 또한 부모의 은혜를 기리고 가족과 함께\n시간을 보내야 할 뜻깊은 날임에도, 현행 제도상 공휴일로 지정되어\n있지 않아 가족 간 유대와 돌봄의 의미를 실천하기 어려운 현실임.\n이에 두 날을 법정공휴일로 지정함으로써, 전 국민이 노동의 의미와\n가족의 가치를 함께 되새기고, 우리 사회가 노동과 돌봄을 공적 책임\n으로 받아들이는 하나의 이정표를 세우고자 함(안 제2조).\n\n\n\n\n법률 제 호\n공휴일에 관한 법률 일부개정법률안\n공휴일에 관한 법률 일부를 다음과 같이 개정한다.\n제2조제10호를 제12호로 하고, 같은 조에 제10호 및 제11호를 각각 다\n음과 같이 신설한다.\n10. 노동자의 날(5월 1일)\n11. 어버이날(5월 8일)\n부 칙\n이 법은 공포한 날부터 시행한다.\n\n\n\n\n신ㆍ구조문대비표\n현 행 개 정 안\n제2조(공휴일) 공휴일은 다음 각 제2조(공휴일) --------------\n호와 같다. -------.\n1. ∼ 9. (생 략) 1. ∼ 9. (현행과 같음)\n<신 설> 10. 노동자의 날(5월 1일)\n<신 설> 11. 어버이날(5월 8일)\n10. (생 략) 12. (현행 제10호와 같음)\n",
  "sections": {
    "제안이유": "및",
    "주요내용": "노동자의 날(5월 1일)은 노동의 가치를 기념하고 존중하는 날임에도\n불구하고, 법정공휴일로 인정되지 않아 많은 노동자들이 실질적인 휴\n식을 보장받지 못하고 있음.\n한편, 어버이날(5월 8일) 또한 부모의 은혜를 기리고 가족과 함께\n시간을 보내야 할 뜻깊은 날임에도, 현행 제도상 공휴일로 지정되어\n있지 않아 가족 간 유대와 돌봄의 의미를 실천하기 어려운 현실임.\n이에 두 날을 법정공휴일로 지정함으로써, 전 국민이 노동의 의미와\n가족의 가치를 함께 되새기고, 우리 사회가 노동과 돌봄을 공적 책임\n으로 받아들이는 하나의 이정표를 세우고자 함(안 제2조).",
    "제안이유_및_주요내용": "노동자의 날(5월 1일)은 노동의 가치를 기념하고 존중하는 날임에도\n불구하고, 법정공휴일로 인정되지 않아 많은 노동자들이 실질적인 휴\n식을 보장받지 못하고 있음.\n한편, 어버이날(5월 8일) 또한 부모의 은혜를 기리고 가족과 함께\n시간을 보내야 할 뜻깊은 날임에도, 현행 제도상 공휴일로 지정되어\n있지 않아 가족 간 유대와 돌봄의 의미를 실천하기 어려운 현실임.\n이에 두 날을 법정공휴일로 지정함으로써, 전 국민이 노동의 의미와\n가족의 가치를 함께 되새기고, 우리 사회가 노동과 돌봄을 공적 책임\n으로 받아들이는 하나의 이정표를 세우고자 함(안 제2조).",
    "법률_제_호": "공휴일에 관한 법률 일부개정법률안\n공휴일에 관한 법률 일부를 다음과 같이 개정한다.\n제2조제10호를 제12호로 하고, 같은 조에 제10호 및 제11호를 각각 다\n음과 같이 신설한다.\n10. 노동자의 날(5월 1일)\n11. 어버이날(5월 8일)",
    "신구조문대비표": "현 행 개 정 안\n제2조(공휴일) 공휴일은 다음 각 제2조(공휴일) --------------\n호와 같다. -------.\n1. ∼ 9. (생 략) 1. ∼ 9. (현행과 같음)\n<신 설> 10. 노동자의 날(5월 1일)\n<신 설> 11. 어버이날(5월 8일)\n10. (생 략) 12. (현행 제10호와 같음)"
  }
}