{
  "title": "2210430_법원조직법_일부개정법률안",
  "bill_number": "10430",
  "proposal_date": "2025. 5. 8.",
  "submission_date": "",
  "is_alternative": false,
  "alternative_bill_numbers": [],
  "has_comparison_table": false,
  "comparison_table": "신ㆍ구조문대비표\n현 행 개 정 안\n제4조(대법관) ① (생 략) 제4조(대법관) ① (현행과 같음)\n② 대법관의 수는 대법원장을 ② -------------------------\n포함하여 14명으로 한다. ---------100명으로-----.",
  "full_text": "법원조직법 일부개정법률안\n(장경태의원 대표발의)\n발의연월일 : 2025. 5. 8.\n의 안\n10430\n번 호 발 의 자 : 장경태ㆍ민형배ㆍ부승찬\n문정복ㆍ김우영ㆍ정진욱\n박성준ㆍ김동아ㆍ윤종군\n김용민 의원(10인)\n제안이유 및 주요내용\n대법원은 헌법상 최고법원으로서, 국민의 권리를 최종적으로 확정하\n고 법질서의 통일과 안정성을 확보하는 사법의 중심축임. 그러나 현행\n법상 대법관의 수는 대법원장을 포함하여 14명에 불과해 그 본래 기\n능을 온전히 수행하기 어려운 구조적 한계에 직면하고 있음.\n연간 수만 건에 달하는 사건이 대법원에 접수되고 있으나, 대법관 1\n인당 연간 수천 건에 이르는 사건을 감당하고 있는 실정임. 이로 인해\n개별 사건에 대한 충분한 심리와 판단이 사실상 불가능해지고 있어\n상고심 제도에 대한 국민의 신뢰가 심각하게 저하되고 있음.\n이에 따라 대법관의 정원을 현행 14명에서 100명으로 증원하여, 대\n법원이 사건을 보다 심도 있게 심리할 수 있는 여건을 마련하고, 다양\n한 배경을 가진 인재들이 대법관으로 진입할 수 있는 구조를 마련하\n고자 함(안 제4조제2항).\n\n\n\n\n법률 제 호\n법원조직법 일부개정법률안\n법원조직법 일부를 다음과 같이 개정한다.\n제4조제2항 중 “14명으로”를 “100명으로”로 한다.\n부 칙\n이 법은 공포한 날부터 시행한다. 다만, 이 법에 따라 증원되는 대법\n관의 정원 86명 중 28명의 증원은 공포 후 1년이 경과한 날부터 시행\n하고, 29명의 증원은 공포 후 2년이 경과한 날부터 시행하며, 29명의\n증원은 공포 후 3년이 경과한 날부터 시행한다.\n\n\n\n\n신ㆍ구조문대비표\n현 행 개 정 안\n제4조(대법관) ① (생 략) 제4조(대법관) ① (현행과 같음)\n② 대법관의 수는 대법원장을 ② -------------------------\n포함하여 14명으로 한다. ---------100명으로-----.\n",
  "sections": {
    "제안이유": "및",
    "주요내용": "대법원은 헌법상 최고법원으로서, 국민의 권리를 최종적으로 확정하\n고 법질서의 통일과 안정성을 확보하는 사법의 중심축임. 그러나 현행\n법상 대법관의 수는 대법원장을 포함하여 14명에 불과해 그 본래 기\n능을 온전히 수행하기 어려운 구조적 한계에 직면하고 있음.\n연간 수만 건에 달하는 사건이 대법원에 접수되고 있으나, 대법관 1\n인당 연간 수천 건에 이르는 사건을 감당하고 있는 실정임. 이로 인해\n개별 사건에 대한 충분한 심리와 판단이 사실상 불가능해지고 있어\n상고심 제도에 대한 국민의 신뢰가 심각하게 저하되고 있음.\n이에 따라 대법관의 정원을 현행 14명에서 100명으로 증원하여, 대\n법원이 사건을 보다 심도 있게 심리할 수 있는 여건을 마련하고, 다양\n한 배경을 가진 인재들이 대법관으로 진입할 수 있는 구조를 마련하\n고자 함(안 제4조제2항).",
    "제안이유_및_주요내용": "대법원은 헌법상 최고법원으로서, 국민의 권리를 최종적으로 확정하\n고 법질서의 통일과 안정성을 확보하는 사법의 중심축임. 그러나 현행\n법상 대법관의 수는 대법원장을 포함하여 14명에 불과해 그 본래 기\n능을 온전히 수행하기 어려운 구조적 한계에 직면하고 있음.\n연간 수만 건에 달하는 사건이 대법원에 접수되고 있으나, 대법관 1\n인당 연간 수천 건에 이르는 사건을 감당하고 있는 실정임. 이로 인해\n개별 사건에 대한 충분한 심리와 판단이 사실상 불가능해지고 있어\n상고심 제도에 대한 국민의 신뢰가 심각하게 저하되고 있음.\n이에 따라 대법관의 정원을 현행 14명에서 100명으로 증원하여, 대\n법원이 사건을 보다 심도 있게 심리할 수 있는 여건을 마련하고, 다양\n한 배경을 가진 인재들이 대법관으로 진입할 수 있는 구조를 마련하\n고자 함(안 제4조제2항).",
    "법률_제_호": "법원조직법 일부개정법률안\n법원조직법 일부를 다음과 같이 개정한다.\n제4조제2항 중 “14명으로”를 “100명으로”로 한다.",
    "신구조문대비표": "현 행 개 정 안\n제4조(대법관) ① (생 략) 제4조(대법관) ① (현행과 같음)\n② 대법관의 수는 대법원장을 ② -------------------------\n포함하여 14명으로 한다. ---------100명으로-----."
  }
}