{
  "title": "2210133_부동산등기법_일부개정법률안",
  "bill_number": "10133",
  "proposal_date": "2025. 4. 25.",
  "submission_date": "",
  "is_alternative": false,
  "alternative_bill_numbers": [],
  "has_comparison_table": false,
  "comparison_table": "신ㆍ구조문대비표\n현 행 개 정 안\n<신 설> 제32조의2(이해관계 있는 자의\n경정등기 신청) 제23조제5항\n및 제6항에도 불구하고 해당\n권리의 등기명의인이 경정의\n등기를 신청하지 아니하는 경\n우에는 등기상 이해관계 있는\n제3자가 이를 신청할 수 있다.",
  "full_text": "부동산등기법 일부개정법률안\n(문진석의원 대표발의)\n발의연월일 : 2025. 4. 25.\n의 안\n10133\n번 호 발 의 자 : 문진석ㆍ이건태ㆍ강준현\n윤종군ㆍ이재관ㆍ권향엽\n손명수ㆍ이정문ㆍ이연희\n복기왕ㆍ전용기ㆍ이춘석\n의원(12인)\n제안이유 및 주요내용\n최근 발생한 전세사기의 경우 현행법이 등기의 공신력을 인정하지\n않는다는 점을 이용하여, 허위서류를 제출해 근저당권을 소멸시키는\n방법으로 임차인에게 손해를 입힌 바 있음.\n해당 사건에서 1심 법원은 임대인이 임차인에게 손해를 배상해야\n한다고 판결하였으나, 2심 법원은 근저당권의 우선적 효력을 인정하였\n음.\n이에 부동산 등기가 실제 사실과 다르게 표기되어 있어 피해를 입\n는 이해관계인이 해당 등기에 대한 경정신청권을 가질 수 있도록 개\n정하고자 함(안 제32조의2).\n\n\n\n\n법률 제 호\n부동산등기법 일부개정법률안\n부동산등기법 일부를 다음과 같이 개정한다.\n제32조의2를 다음과 같이 신설한다.\n제32조의2(이해관계 있는 자의 경정등기 신청) 제23조제5항 및 제6항\n에도 불구하고 해당 권리의 등기명의인이 경정의 등기를 신청하지\n아니하는 경우에는 등기상 이해관계 있는 제3자가 이를 신청할 수\n있다.\n부 칙\n이 법은 공포 후 6개월이 경과한 날부터 시행한다.\n\n\n\n\n신ㆍ구조문대비표\n현 행 개 정 안\n<신 설> 제32조의2(이해관계 있는 자의\n경정등기 신청) 제23조제5항\n및 제6항에도 불구하고 해당\n권리의 등기명의인이 경정의\n등기를 신청하지 아니하는 경\n우에는 등기상 이해관계 있는\n제3자가 이를 신청할 수 있다.\n",
  "sections": {
    "제안이유": "및",
    "주요내용": "최근 발생한 전세사기의 경우 현행법이 등기의 공신력을 인정하지\n않는다는 점을 이용하여, 허위서류를 제출해 근저당권을 소멸시키는\n방법으로 임차인에게 손해를 입힌 바 있음.\n해당 사건에서 1심 법원은 임대인이 임차인에게 손해를 배상해야\n한다고 판결하였으나, 2심 법원은 근저당권의 우선적 효력을 인정하였\n음.\n이에 부동산 등기가 실제 사실과 다르게 표기되어 있어 피해를 입\n는 이해관계인이 해당 등기에 대한 경정신청권을 가질 수 있도록 개\n정하고자 함(안 제32조의2).",
    "제안이유_및_주요내용": "최근 발생한 전세사기의 경우 현행법이 등기의 공신력을 인정하지\n않는다는 점을 이용하여, 허위서류를 제출해 근저당권을 소멸시키는\n방법으로 임차인에게 손해를 입힌 바 있음.\n해당 사건에서 1심 법원은 임대인이 임차인에게 손해를 배상해야\n한다고 판결하였으나, 2심 법원은 근저당권의 우선적 효력을 인정하였\n음.\n이에 부동산 등기가 실제 사실과 다르게 표기되어 있어 피해를 입\n는 이해관계인이 해당 등기에 대한 경정신청권을 가질 수 있도록 개\n정하고자 함(안 제32조의2).",
    "법률_제_호": "부동산등기법 일부개정법률안\n부동산등기법 일부를 다음과 같이 개정한다.\n제32조의2를 다음과 같이 신설한다.\n제32조의2(이해관계 있는 자의 경정등기 신청) 제23조제5항 및 제6항\n에도 불구하고 해당 권리의 등기명의인이 경정의 등기를 신청하지\n아니하는 경우에는 등기상 이해관계 있는 제3자가 이를 신청할 수\n있다.",
    "신구조문대비표": "현 행 개 정 안\n<신 설> 제32조의2(이해관계 있는 자의\n경정등기 신청) 제23조제5항\n및 제6항에도 불구하고 해당\n권리의 등기명의인이 경정의\n등기를 신청하지 아니하는 경\n우에는 등기상 이해관계 있는\n제3자가 이를 신청할 수 있다."
  }
}