{
  "title": "2210471_공휴일에_관한_법률_일부개정법률안",
  "bill_number": "10471",
  "proposal_date": "2025. 5. 12.",
  "submission_date": "",
  "is_alternative": false,
  "alternative_bill_numbers": [],
  "has_comparison_table": false,
  "comparison_table": "신ㆍ구조문대비표\n현 행 개 정 안\n제2조(공휴일) 공휴일은 다음 각 제2조(공휴일) --------------\n호와 같다. ------------.\n1. ∼ 5. (생 략) 1. ∼ 5. (현행과 같음)\n<신 설> 6. 가족문화의 날(5월 두 번째\n금요일)\n6. ∼ 10. (생 략) 7. ∼ 11. (현행 제6호부터 제1\n0호까지와 같음)",
  "full_text": "공휴일에 관한 법률 일부개정법률안\n(김재섭의원 대표발의)\n발의연월일 : 2025. 5. 12.\n의 안\n10471\n번 호 발 의 자 : 김재섭ㆍ백종헌ㆍ엄태영\n서천호ㆍ윤한홍ㆍ권영진\n강승규ㆍ최수진ㆍ신성범\n박덕흠 의원(10인)\n제안이유 및 주요내용\n「제4차 저출산ㆍ고령사회 기본계획」은 저출산의 원인과 관련하여\n일가정 양립을 저해하는 요인으로 장시간 근로와 과소한 휴가일수를\n적시하고 있으나 유급 공휴일 도입에 대하여는 관련 논의가 없음.\n5월 두 번째 금요일을 가족문화의 날로 지정하여 가족친화적 휴일\n제도를 마련함으로써 일가정 양립을 위한 휴가 필요성에 대한 인식을\n제고하려는 것임(안 제2조제6호 신설).\n\n\n\n\n법률 제 호\n공휴일에 관한 법률 일부개정법률안\n공휴일에 관한 법률 일부를 다음과 같이 개정한다.\n제2조제6호부터 제10호까지를 각각 제7호부터 제11호까지로 하고, 같\n은 조에 제6호를 다음과 같이 신설한다.\n6. 가족문화의 날(5월 두 번째 금요일)\n부 칙\n이 법은 공포한 날부터 시행한다.\n\n\n\n\n신ㆍ구조문대비표\n현 행 개 정 안\n제2조(공휴일) 공휴일은 다음 각 제2조(공휴일) --------------\n호와 같다. ------------.\n1. ∼ 5. (생 략) 1. ∼ 5. (현행과 같음)\n<신 설> 6. 가족문화의 날(5월 두 번째\n금요일)\n6. ∼ 10. (생 략) 7. ∼ 11. (현행 제6호부터 제1\n0호까지와 같음)\n",
  "sections": {
    "제안이유": "및",
    "주요내용": "「제4차 저출산ㆍ고령사회 기본계획」은 저출산의 원인과 관련하여\n일가정 양립을 저해하는 요인으로 장시간 근로와 과소한 휴가일수를\n적시하고 있으나 유급 공휴일 도입에 대하여는 관련 논의가 없음.\n5월 두 번째 금요일을 가족문화의 날로 지정하여 가족친화적 휴일\n제도를 마련함으로써 일가정 양립을 위한 휴가 필요성에 대한 인식을\n제고하려는 것임(안 제2조제6호 신설).",
    "제안이유_및_주요내용": "「제4차 저출산ㆍ고령사회 기본계획」은 저출산의 원인과 관련하여\n일가정 양립을 저해하는 요인으로 장시간 근로와 과소한 휴가일수를\n적시하고 있으나 유급 공휴일 도입에 대하여는 관련 논의가 없음.\n5월 두 번째 금요일을 가족문화의 날로 지정하여 가족친화적 휴일\n제도를 마련함으로써 일가정 양립을 위한 휴가 필요성에 대한 인식을\n제고하려는 것임(안 제2조제6호 신설).",
    "법률_제_호": "공휴일에 관한 법률 일부개정법률안\n공휴일에 관한 법률 일부를 다음과 같이 개정한다.\n제2조제6호부터 제10호까지를 각각 제7호부터 제11호까지로 하고, 같\n은 조에 제6호를 다음과 같이 신설한다.\n6. 가족문화의 날(5월 두 번째 금요일)",
    "신구조문대비표": "현 행 개 정 안\n제2조(공휴일) 공휴일은 다음 각 제2조(공휴일) --------------\n호와 같다. ------------.\n1. ∼ 5. (생 략) 1. ∼ 5. (현행과 같음)\n<신 설> 6. 가족문화의 날(5월 두 번째\n금요일)\n6. ∼ 10. (생 략) 7. ∼ 11. (현행 제6호부터 제1\n0호까지와 같음)"
  }
}