{
  "title": "2210082_법인세법_일부개정법률안",
  "bill_number": "10082",
  "proposal_date": "2025. 4. 24.",
  "submission_date": "",
  "is_alternative": false,
  "alternative_bill_numbers": [],
  "has_comparison_table": false,
  "comparison_table": "신ㆍ구조문대비표\n현 행 개 정 안\n제4조(과세소득의 범위) ① ∼ ⑤ 제4조(과세소득의 범위) ① ∼ ⑤\n(생 략) (현행과 같음)\n<신 설> ⑥ 제1항과 제4항의 규정에도\n불구하고, 법인이 「근로복지기\n본법」 제2조제4호에 따른 우리\n사주조합에 자기주식을 양도하\n거나 우리사주로 전환될 수 있\n는 증권 등을 양도하여 생기는\n수입은 법인세가 과세되는 소득\n에서 제외한다.",
  "full_text": "법인세법 일부개정법률안\n(한정애의원 대표발의)\n발의연월일 : 2025. 4. 24.\n의 안\n10082\n번 호 발 의 자 : 한정애ㆍ박희승ㆍ이수진\n송옥주ㆍ주철현ㆍ윤후덕\n이병진ㆍ조인철ㆍ조정식\n박수현ㆍ김주영 의원\n(11인)\n제안이유\n종업원소유제도는 종업원들이 자사 주식을 장기 보유하도록 지원하\n는 제도로서, 이윤공유와 참여경영을 통해 경제민주화를 실현하는 핵\n심적 정책 수단을 말함. 이는 자본 소유의 편중 해소와 노동 소외 문\n제를 직접적으로 시정하고, 특히 저소득층의 자산 증대와 고용 안정성\n향상을 통해 지속가능한 경제ㆍ사회 발전에 기여할 수 있음.\n한국형 종업원소유제도로서 우리사주제도는 현재 우리사주 지분율\n이 미미한 수준이고 보유기간도 단기에 그치는 등 제도가 충분히 활\n성화되지 못하고 있음. 특히 미국, 영국과 달리 주주들의 보유지분 매\n각에 대한 특별한 이익 동기가 없다는 것이 주요 원인으로 지적되며,\n이는 제도의 실효성을 저해하는 핵심적 요인이 되고 있음.\n한편 현재 우리나라 기업들의 CEO 고령화로 인한 기업승계 문제가\n사회적 현안으로 대두되고 있음. 일반적으로 사모펀드나 경쟁사 매각,\n\n\n\n가족 승계 등이 주요 승계방안으로 거론되나, 기업의 지속가능성과 사\n회적 책임성 측면에서 보다 바람직한 대안이 필요한 상황임.\n이에 주주의 보유지분 종업원 매각에 대한 법인세 감면제도 도입을\n통해 우리사주제도 활성화와 바람직한 기업승계를 동시에 도모하고자\n함. 이는 고용유지, 참여를 통한 혁신, 불평등 완화, 기업의 사회적 역\n할 강화 등 다양한 경제적ㆍ사회적 효과를 가져올 것으로 기대되며,\n기업의 장기적 성장과 경제민주화 실현에 기여할 수 있음.\n주요내용\n「근로복지기본법」 제2조제4호에 따른 우리사주조합에 우리사주로\n주식을 양도하거나 우리사주로 전환될 수 있는 증권 등의 양도로 인\n하여 생기는 수입은 법인세가 과세되는 소득에서 제외함(안 제4조제6\n항 신설).\n\n법률 제 호\n법인세법 일부개정법률안\n법인세법 일부를 다음과 같이 개정한다.\n제4조에 제6항을 다음과 같이 신설한다.\n⑥ 제1항과 제4항의 규정에도 불구하고, 법인이 「근로복지기본법」\n제2조제4호에 따른 우리사주조합에 자기주식을 양도하거나 우리사\n주로 전환될 수 있는 증권 등을 양도하여 생기는 수입은 법인세가\n과세되는 소득에서 제외한다.\n부 칙\n이 법은 2026년 1월 1일부터 시행한다.\n\n\n\n\n신ㆍ구조문대비표\n현 행 개 정 안\n제4조(과세소득의 범위) ① ∼ ⑤ 제4조(과세소득의 범위) ① ∼ ⑤\n(생 략) (현행과 같음)\n<신 설> ⑥ 제1항과 제4항의 규정에도\n불구하고, 법인이 「근로복지기\n본법」 제2조제4호에 따른 우리\n사주조합에 자기주식을 양도하\n거나 우리사주로 전환될 수 있\n는 증권 등을 양도하여 생기는\n수입은 법인세가 과세되는 소득\n에서 제외한다.\n",
  "sections": {
    "제안이유": "종업원소유제도는 종업원들이 자사 주식을 장기 보유하도록 지원하\n는 제도로서, 이윤공유와 참여경영을 통해 경제민주화를 실현하는 핵\n심적 정책 수단을 말함. 이는 자본 소유의 편중 해소와 노동 소외 문\n제를 직접적으로 시정하고, 특히 저소득층의 자산 증대와 고용 안정성\n향상을 통해 지속가능한 경제ㆍ사회 발전에 기여할 수 있음.\n한국형 종업원소유제도로서 우리사주제도는 현재 우리사주 지분율\n이 미미한 수준이고 보유기간도 단기에 그치는 등 제도가 충분히 활\n성화되지 못하고 있음. 특히 미국, 영국과 달리 주주들의 보유지분 매\n각에 대한 특별한 이익 동기가 없다는 것이 주요 원인으로 지적되며,\n이는 제도의 실효성을 저해하는 핵심적 요인이 되고 있음.\n한편 현재 우리나라 기업들의 CEO 고령화로 인한 기업승계 문제가\n사회적 현안으로 대두되고 있음. 일반적으로 사모펀드나 경쟁사 매각,\n\n\n\n가족 승계 등이 주요 승계방안으로 거론되나, 기업의 지속가능성과 사\n회적 책임성 측면에서 보다 바람직한 대안이 필요한 상황임.\n이에 주주의 보유지분 종업원 매각에 대한 법인세 감면제도 도입을\n통해 우리사주제도 활성화와 바람직한 기업승계를 동시에 도모하고자\n함. 이는 고용유지, 참여를 통한 혁신, 불평등 완화, 기업의 사회적 역\n할 강화 등 다양한 경제적ㆍ사회적 효과를 가져올 것으로 기대되며,\n기업의 장기적 성장과 경제민주화 실현에 기여할 수 있음.",
    "주요내용": "「근로복지기본법」 제2조제4호에 따른 우리사주조합에 우리사주로\n주식을 양도하거나 우리사주로 전환될 수 있는 증권 등의 양도로 인\n하여 생기는 수입은 법인세가 과세되는 소득에서 제외함(안 제4조제6\n항 신설).",
    "법률_제_호": "법인세법 일부개정법률안\n법인세법 일부를 다음과 같이 개정한다.\n제4조에 제6항을 다음과 같이 신설한다.\n⑥ 제1항과 제4항의 규정에도 불구하고, 법인이 「근로복지기본법」\n제2조제4호에 따른 우리사주조합에 자기주식을 양도하거나 우리사\n주로 전환될 수 있는 증권 등을 양도하여 생기는 수입은 법인세가\n과세되는 소득에서 제외한다.",
    "신구조문대비표": "현 행 개 정 안\n제4조(과세소득의 범위) ① ∼ ⑤ 제4조(과세소득의 범위) ① ∼ ⑤\n(생 략) (현행과 같음)\n<신 설> ⑥ 제1항과 제4항의 규정에도\n불구하고, 법인이 「근로복지기\n본법」 제2조제4호에 따른 우리\n사주조합에 자기주식을 양도하\n거나 우리사주로 전환될 수 있\n는 증권 등을 양도하여 생기는\n수입은 법인세가 과세되는 소득\n에서 제외한다."
  }
}