{
  "title": "2210415_공직선거법_일부개정법률안",
  "bill_number": "10415",
  "proposal_date": "2025. 5. 8.",
  "submission_date": "",
  "is_alternative": false,
  "alternative_bill_numbers": [],
  "has_comparison_table": false,
  "comparison_table": "신ㆍ구조문대비표\n현 행 개 정 안\n<신 설> 제11조의2(후보자에 대한 공판절\n차의 중지) 선거기간 중에는\n후보자에 대한 공판절차는 중\n지된다.",
  "full_text": "공직선거법 일부개정법률안\n(민형배의원 대표발의)\n발의연월일 : 2025. 5. 8.\n의 안\n10415\n번 호 발 의 자 : 민형배ㆍ이개호ㆍ정동영\n박지원ㆍ장경태ㆍ김동아\n김성환ㆍ김현정ㆍ안도걸\n양부남ㆍ양문석 의원\n(11인)\n제안이유 및 주요내용\n주권자 시민의 권리이자 의무인 투표권을 온전히 행사하기 위해 선\n거기간 중 후보자에 대한 공판절차를 중지하고자 합니다.\n현행법은 대통령 선거에 출마한 후보자는 사형ㆍ무기 또는 장기 7\n년 이상의 징역이나 금고에 해당하는 죄를 범한 경우를 제외하고는\n현행범이 아니면 선거기간 중 체포 또는 구속되지 않도록 신분을 보\n장하고 있습니다. 이는 피선거권자의 자유로운 선거운동을 보장함과\n동시에, 유권자의 정치적 참여권을 보호하기 위한 것입니다.\n최근 대법원이 대통령 선거를 앞두고 유죄 취지의 판결을 신속히\n하급심에 환송한 것은 사실상 ‘사법부의 선거 개입’으로 비칠 수 있는\n중대한 사안입니다. 선거기간 중 공판절차가 지속되는 것은 법관의 정\n치적 중립 의무에 위배될 뿐 아니라, 시민의 자유로운 투표권 행사에\n\n\n\n도 영향을 미칠 수 있습니다.\n이에, 선거기간 중 후보자에 대한 공판절차를 중지하도록 법적 근거\n를 마련하고자 합니다. 선거기간 동안 국가 공권력은 정치에 개입하지\n않아야 하며, 후보자의 피선거권 또한 철저히 보장되어야 하기 때문입\n니다(안 제11조의2).\n\n법률 제 호\n공직선거법 일부개정법률안\n공직선거법 일부를 다음과 같이 개정한다.\n제11조의2를 다음과 같이 신설한다.\n제11조의2(후보자에 대한 공판절차의 중지) 선거기간 중에는 후보자에\n대한 공판절차는 중지된다.\n부 칙\n이 법은 공포한 날부터 시행한다.\n\n\n\n\n신ㆍ구조문대비표\n현 행 개 정 안\n<신 설> 제11조의2(후보자에 대한 공판절\n차의 중지) 선거기간 중에는\n후보자에 대한 공판절차는 중\n지된다.\n",
  "sections": {
    "제안이유": "및",
    "주요내용": "주권자 시민의 권리이자 의무인 투표권을 온전히 행사하기 위해 선\n거기간 중 후보자에 대한 공판절차를 중지하고자 합니다.\n현행법은 대통령 선거에 출마한 후보자는 사형ㆍ무기 또는 장기 7\n년 이상의 징역이나 금고에 해당하는 죄를 범한 경우를 제외하고는\n현행범이 아니면 선거기간 중 체포 또는 구속되지 않도록 신분을 보\n장하고 있습니다. 이는 피선거권자의 자유로운 선거운동을 보장함과\n동시에, 유권자의 정치적 참여권을 보호하기 위한 것입니다.\n최근 대법원이 대통령 선거를 앞두고 유죄 취지의 판결을 신속히\n하급심에 환송한 것은 사실상 ‘사법부의 선거 개입’으로 비칠 수 있는\n중대한 사안입니다. 선거기간 중 공판절차가 지속되는 것은 법관의 정\n치적 중립 의무에 위배될 뿐 아니라, 시민의 자유로운 투표권 행사에\n\n\n\n도 영향을 미칠 수 있습니다.\n이에, 선거기간 중 후보자에 대한 공판절차를 중지하도록 법적 근거\n를 마련하고자 합니다. 선거기간 동안 국가 공권력은 정치에 개입하지\n않아야 하며, 후보자의 피선거권 또한 철저히 보장되어야 하기 때문입\n니다(안 제11조의2).",
    "제안이유_및_주요내용": "주권자 시민의 권리이자 의무인 투표권을 온전히 행사하기 위해 선\n거기간 중 후보자에 대한 공판절차를 중지하고자 합니다.\n현행법은 대통령 선거에 출마한 후보자는 사형ㆍ무기 또는 장기 7\n년 이상의 징역이나 금고에 해당하는 죄를 범한 경우를 제외하고는\n현행범이 아니면 선거기간 중 체포 또는 구속되지 않도록 신분을 보\n장하고 있습니다. 이는 피선거권자의 자유로운 선거운동을 보장함과\n동시에, 유권자의 정치적 참여권을 보호하기 위한 것입니다.\n최근 대법원이 대통령 선거를 앞두고 유죄 취지의 판결을 신속히\n하급심에 환송한 것은 사실상 ‘사법부의 선거 개입’으로 비칠 수 있는\n중대한 사안입니다. 선거기간 중 공판절차가 지속되는 것은 법관의 정\n치적 중립 의무에 위배될 뿐 아니라, 시민의 자유로운 투표권 행사에\n\n\n\n도 영향을 미칠 수 있습니다.\n이에, 선거기간 중 후보자에 대한 공판절차를 중지하도록 법적 근거\n를 마련하고자 합니다. 선거기간 동안 국가 공권력은 정치에 개입하지\n않아야 하며, 후보자의 피선거권 또한 철저히 보장되어야 하기 때문입\n니다(안 제11조의2).",
    "법률_제_호": "공직선거법 일부개정법률안\n공직선거법 일부를 다음과 같이 개정한다.\n제11조의2를 다음과 같이 신설한다.\n제11조의2(후보자에 대한 공판절차의 중지) 선거기간 중에는 후보자에\n대한 공판절차는 중지된다.",
    "신구조문대비표": "현 행 개 정 안\n<신 설> 제11조의2(후보자에 대한 공판절\n차의 중지) 선거기간 중에는\n후보자에 대한 공판절차는 중\n지된다."
  }
}