{
  "title": "2210372_지방공기업법_일부개정법률안",
  "bill_number": "10372",
  "proposal_date": "2025. 5. 2.",
  "submission_date": "",
  "is_alternative": false,
  "alternative_bill_numbers": [],
  "has_comparison_table": false,
  "comparison_table": "신ㆍ구조문대비표\n현 행 개 정 안\n제63조의7(비위행위자에 대한 조 제63조의7(비위행위자에 대한 조\n치) ① ∼ ⑤ (생 략) 치) ① ∼ ⑤ (현행과 같음)\n<신 설> ⑥ 제5항에 따른 합격ㆍ승진ㆍ\n임용의 취소 처분은 합격ㆍ승\n진ㆍ임용 당시로 소급하여 효\n력이 발생한다.\n⑥ (생 략) ⑦ (현행 제6항과 같음)",
  "full_text": "지방공기업법 일부개정법률안\n(이성권의원 대표발의)\n발의연월일 : 2025. 5. 2.\n의 안\n10372\n번 호 발 의 자 : 이성권ㆍ이헌승ㆍ박수영\n조승환ㆍ김도읍ㆍ최은석\n곽규택ㆍ정성국ㆍ정연욱\n권영진ㆍ김용태ㆍ주진우\n서지영ㆍ배준영ㆍ신성범\n강명구 의원(16인)\n제안이유 및 주요내용\n현행법에 따르면 지방자치단체의 장은 채용비위와 관련하여 유죄판\n결이 확정된 공사 임직원의 해당 비위행위로 채용시험에 합격하거나\n승진 또는 임용된 사람에 대해서는 해당 공사의 사장에게 합격ㆍ승진\nㆍ임용의 취소 또는 인사상의 불이익 조치를 취할 것을 요구할 수 있\n음.\n최근 중앙선거관리위원회의 채용비리 사건과 관련하여 특혜나 비리\n등으로 채용되거나 임용된 이들에 대한 처분을 취소해야 한다는 의견\n이 비등해지면서 채용은 공정해야 한다는 여론이 커지고 있음.\n다만, 현행법은 특혜나 비리채용에 대한 취소 처분 조항이 있지만,\n취소 처분의 적용 시점이 명확하지 않아 이를 법률에 명확히 규정할\n필요가 있음.\n\n\n\n이에 비위행위로 채용시험에 합격하거나 승진 또는 임용된 사람에\n대한 합격ㆍ승진ㆍ임용의 취소 처분 시 그 효력이 합격ㆍ승진ㆍ임용\n당시로 소급하여 효력이 발생한다는 것을 명확히 규정하려는 것임(안\n제63조의7제6항 신설).\n\n법률 제 호\n지방공기업법 일부개정법률안\n지방공기업법 일부를 다음과 같이 개정한다.\n제63조의7제6항을 제7항으로 하고, 같은 조에 제6항을 다음과 같이 신\n설한다.\n⑥ 제5항에 따른 합격ㆍ승진ㆍ임용의 취소 처분은 합격ㆍ승진ㆍ임\n용 당시로 소급하여 효력이 발생한다.\n부 칙\n이 법은 공포한 날부터 시행한다.\n\n\n\n\n신ㆍ구조문대비표\n현 행 개 정 안\n제63조의7(비위행위자에 대한 조 제63조의7(비위행위자에 대한 조\n치) ① ∼ ⑤ (생 략) 치) ① ∼ ⑤ (현행과 같음)\n<신 설> ⑥ 제5항에 따른 합격ㆍ승진ㆍ\n임용의 취소 처분은 합격ㆍ승\n진ㆍ임용 당시로 소급하여 효\n력이 발생한다.\n⑥ (생 략) ⑦ (현행 제6항과 같음)\n",
  "sections": {
    "제안이유": "및",
    "주요내용": "현행법에 따르면 지방자치단체의 장은 채용비위와 관련하여 유죄판\n결이 확정된 공사 임직원의 해당 비위행위로 채용시험에 합격하거나\n승진 또는 임용된 사람에 대해서는 해당 공사의 사장에게 합격ㆍ승진\nㆍ임용의 취소 또는 인사상의 불이익 조치를 취할 것을 요구할 수 있\n음.\n최근 중앙선거관리위원회의 채용비리 사건과 관련하여 특혜나 비리\n등으로 채용되거나 임용된 이들에 대한 처분을 취소해야 한다는 의견\n이 비등해지면서 채용은 공정해야 한다는 여론이 커지고 있음.\n다만, 현행법은 특혜나 비리채용에 대한 취소 처분 조항이 있지만,\n취소 처분의 적용 시점이 명확하지 않아 이를 법률에 명확히 규정할\n필요가 있음.\n\n\n\n이에 비위행위로 채용시험에 합격하거나 승진 또는 임용된 사람에\n대한 합격ㆍ승진ㆍ임용의 취소 처분 시 그 효력이 합격ㆍ승진ㆍ임용\n당시로 소급하여 효력이 발생한다는 것을 명확히 규정하려는 것임(안\n제63조의7제6항 신설).",
    "제안이유_및_주요내용": "현행법에 따르면 지방자치단체의 장은 채용비위와 관련하여 유죄판\n결이 확정된 공사 임직원의 해당 비위행위로 채용시험에 합격하거나\n승진 또는 임용된 사람에 대해서는 해당 공사의 사장에게 합격ㆍ승진\nㆍ임용의 취소 또는 인사상의 불이익 조치를 취할 것을 요구할 수 있\n음.\n최근 중앙선거관리위원회의 채용비리 사건과 관련하여 특혜나 비리\n등으로 채용되거나 임용된 이들에 대한 처분을 취소해야 한다는 의견\n이 비등해지면서 채용은 공정해야 한다는 여론이 커지고 있음.\n다만, 현행법은 특혜나 비리채용에 대한 취소 처분 조항이 있지만,\n취소 처분의 적용 시점이 명확하지 않아 이를 법률에 명확히 규정할\n필요가 있음.\n\n\n\n이에 비위행위로 채용시험에 합격하거나 승진 또는 임용된 사람에\n대한 합격ㆍ승진ㆍ임용의 취소 처분 시 그 효력이 합격ㆍ승진ㆍ임용\n당시로 소급하여 효력이 발생한다는 것을 명확히 규정하려는 것임(안\n제63조의7제6항 신설).",
    "법률_제_호": "지방공기업법 일부개정법률안\n지방공기업법 일부를 다음과 같이 개정한다.\n제63조의7제6항을 제7항으로 하고, 같은 조에 제6항을 다음과 같이 신\n설한다.\n⑥ 제5항에 따른 합격ㆍ승진ㆍ임용의 취소 처분은 합격ㆍ승진ㆍ임\n용 당시로 소급하여 효력이 발생한다.",
    "신구조문대비표": "현 행 개 정 안\n제63조의7(비위행위자에 대한 조 제63조의7(비위행위자에 대한 조\n치) ① ∼ ⑤ (생 략) 치) ① ∼ ⑤ (현행과 같음)\n<신 설> ⑥ 제5항에 따른 합격ㆍ승진ㆍ\n임용의 취소 처분은 합격ㆍ승\n진ㆍ임용 당시로 소급하여 효\n력이 발생한다.\n⑥ (생 략) ⑦ (현행 제6항과 같음)"
  }
}