{
  "title": "2210335_군인복지기본법_일부개정법률안",
  "bill_number": "10335",
  "proposal_date": "2025. 5. 2.",
  "submission_date": "",
  "is_alternative": false,
  "alternative_bill_numbers": [],
  "has_comparison_table": false,
  "comparison_table": "신ㆍ구조문대비표\n현 행 개 정 안\n<신 설> 제11조의3(문화시설 등의 이용\n지원) 국가나 지방자치단체는\n군인에게 대통령령으로 정하는\n바에 따라 고궁, 공원, 박물관\n및 미술관 등의 시설을 무료로\n이용하게 하거나 그 요금을 할\n인하여 이용하게 할 수 있다.",
  "full_text": "군인복지기본법 일부개정법률안\n(황희의원 대표발의)\n발의연월일 : 2025. 5. 2.\n의 안\n10335\n번 호 발 의 자 : 황 희ㆍ김종민ㆍ김병주\n이건태ㆍ추미애ㆍ허 영\n박지원ㆍ김준형ㆍ주철현\n조승래ㆍ서삼석 의원\n(11인)\n제안이유 및 주요내용\n현행 「제대군인지원에 관한 법률」은 장기복무 제대군인에게 국가\n나 지방자치단체가 관리하는 고궁 및 공원 등의 시설을 무료로 이용\n하거나 요금을 할인하여 이용할 수 있도록 규정하고 있음.\n그러나 장기복무 제대군인과 달리 현역에 복무 중인 군인에 대하여\n는 이러한 지원 규정이 미비하여, 군인에 대한 복지 확대를 위하여 현\n역 군인에 대하여 문화시설 등의 이용에 대한 지원 규정을 마련할 필\n요가 있다는 지적이 있음.\n이에 국가나 지방자치단체는 군인으로 하여금 고궁, 공원, 박물관\n및 미술관 등의 시설을 무료로 이용하거나 그 요금을 할인하여 이용\n할 수 있게 함으로써 군인의 복지 증진 및 사기 진작을 도모하려는\n것임(안 제11조의3 신설).\n\n\n\n\n법률 제 호\n군인복지기본법 일부개정법률안\n군인복지기본법 일부를 다음과 같이 개정한다.\n제11조의3을 다음과 같이 신설한다.\n제11조의3(문화시설 등의 이용 지원) 국가나 지방자치단체는 군인에게\n대통령령으로 정하는 바에 따라 고궁, 공원, 박물관 및 미술관 등의\n시설을 무료로 이용하게 하거나 그 요금을 할인하여 이용하게 할\n수 있다.\n부 칙\n이 법은 공포 후 6개월이 경과한 날부터 시행한다.\n\n\n\n\n신ㆍ구조문대비표\n현 행 개 정 안\n<신 설> 제11조의3(문화시설 등의 이용\n지원) 국가나 지방자치단체는\n군인에게 대통령령으로 정하는\n바에 따라 고궁, 공원, 박물관\n및 미술관 등의 시설을 무료로\n이용하게 하거나 그 요금을 할\n인하여 이용하게 할 수 있다.\n",
  "sections": {
    "제안이유": "및",
    "주요내용": "현행 「제대군인지원에 관한 법률」은 장기복무 제대군인에게 국가\n나 지방자치단체가 관리하는 고궁 및 공원 등의 시설을 무료로 이용\n하거나 요금을 할인하여 이용할 수 있도록 규정하고 있음.\n그러나 장기복무 제대군인과 달리 현역에 복무 중인 군인에 대하여\n는 이러한 지원 규정이 미비하여, 군인에 대한 복지 확대를 위하여 현\n역 군인에 대하여 문화시설 등의 이용에 대한 지원 규정을 마련할 필\n요가 있다는 지적이 있음.\n이에 국가나 지방자치단체는 군인으로 하여금 고궁, 공원, 박물관\n및 미술관 등의 시설을 무료로 이용하거나 그 요금을 할인하여 이용\n할 수 있게 함으로써 군인의 복지 증진 및 사기 진작을 도모하려는\n것임(안 제11조의3 신설).",
    "제안이유_및_주요내용": "현행 「제대군인지원에 관한 법률」은 장기복무 제대군인에게 국가\n나 지방자치단체가 관리하는 고궁 및 공원 등의 시설을 무료로 이용\n하거나 요금을 할인하여 이용할 수 있도록 규정하고 있음.\n그러나 장기복무 제대군인과 달리 현역에 복무 중인 군인에 대하여\n는 이러한 지원 규정이 미비하여, 군인에 대한 복지 확대를 위하여 현\n역 군인에 대하여 문화시설 등의 이용에 대한 지원 규정을 마련할 필\n요가 있다는 지적이 있음.\n이에 국가나 지방자치단체는 군인으로 하여금 고궁, 공원, 박물관\n및 미술관 등의 시설을 무료로 이용하거나 그 요금을 할인하여 이용\n할 수 있게 함으로써 군인의 복지 증진 및 사기 진작을 도모하려는\n것임(안 제11조의3 신설).",
    "법률_제_호": "군인복지기본법 일부개정법률안\n군인복지기본법 일부를 다음과 같이 개정한다.\n제11조의3을 다음과 같이 신설한다.\n제11조의3(문화시설 등의 이용 지원) 국가나 지방자치단체는 군인에게\n대통령령으로 정하는 바에 따라 고궁, 공원, 박물관 및 미술관 등의\n시설을 무료로 이용하게 하거나 그 요금을 할인하여 이용하게 할\n수 있다.",
    "신구조문대비표": "현 행 개 정 안\n<신 설> 제11조의3(문화시설 등의 이용\n지원) 국가나 지방자치단체는\n군인에게 대통령령으로 정하는\n바에 따라 고궁, 공원, 박물관\n및 미술관 등의 시설을 무료로\n이용하게 하거나 그 요금을 할\n인하여 이용하게 할 수 있다."
  }
}