{
  "title": "2210706_지방교육재정교부금법_일부개정법률안",
  "bill_number": "10706",
  "proposal_date": "2025. 6. 11.",
  "submission_date": "",
  "is_alternative": false,
  "alternative_bill_numbers": [],
  "has_comparison_table": false,
  "comparison_table": "신ㆍ구조문대비표\n현 행 개 정 안\n제9조(예산 계상) ①ㆍ② (생 제9조(예산 계상) ①ㆍ② (현행과\n략) 같음)\n<신 설> ③ 국가는 추가경정예산에 의\n하지 아니하고서는 제1항에 따\n라 계상된 교부금을 해당 연도\n에는 감액 조절할 수 없다.\n③ (생 략) ④ (현행 제3항과 같음)",
  "full_text": "지방교육재정교부금법 일부개정법률안\n(박정의원 대표발의)\n발의연월일 : 2025. 6. 11.\n의 안\n10706\n번 호 발 의 자 : 박 정ㆍ서영석ㆍ장철민\n김태선ㆍ허 영ㆍ이재강\n차규근ㆍ김정호ㆍ윤준병\n위성곤ㆍ김영환ㆍ한민수\n박홍배ㆍ김영진ㆍ송옥주\n황정아ㆍ권향엽ㆍ안도걸\n소병훈ㆍ이용선ㆍ허성무\n임호선 의원(22인)\n제안이유 및 주요내용\n정부는 2023년에 대규모 세수부족이 발생하게 되자, 세수재추계를\n바탕으로 한 예상 세입을 기준으로 지방교육재정교부금 규모를 재산\n정하였음.\n2023년 지방교육재정교부금 10.4조원이 미교부되었고, 더하여 특별\n교부금 총액을 국가시책, 지역현안, 재난안전관리에 각각 60%, 30%,\n10%씩 교부하도록 명시한 「지방교육재정교부금법」 제5조의2제1항\n을 준수하지 못하였음.\n이러한 지방교육재정교부금의 갑작스러운 해당 연도 미교부 및 법\n정비율 미준수는 교육기관에 대한 필요 재원 교부를 통해 교육의 균\n\n\n\n형 있는 발전을 도모하도록 한 지방교육재정교부금의 주요 목적에 반\n하는 것임.\n이에 계상된 지방교육재정교부금을 해당 연도에 감액 조절할 수 없\n도록 함(안 제9조제3항 신설).\n\n법률 제 호\n지방교육재정교부금법 일부개정법률안\n지방교육재정교부금법 일부를 다음과 같이 개정한다.\n제9조제3항을 제4항으로 하고, 같은 조에 제3항을 다음과 같이 신설한\n다.\n③ 국가는 추가경정예산에 의하지 아니하고서는 제1항에 따라 계상\n된 교부금을 해당 연도에는 감액 조절할 수 없다.\n부 칙\n제1조(시행일) 이 법은 2026년 1월 1일부터 시행한다.\n제2조(교부금 조절에 관한 적용례) 제9조의 개정규정은 2026년도에 교\n부하는 교부금부터 적용한다.\n\n\n\n\n신ㆍ구조문대비표\n현 행 개 정 안\n제9조(예산 계상) ①ㆍ② (생 제9조(예산 계상) ①ㆍ② (현행과\n략) 같음)\n<신 설> ③ 국가는 추가경정예산에 의\n하지 아니하고서는 제1항에 따\n라 계상된 교부금을 해당 연도\n에는 감액 조절할 수 없다.\n③ (생 략) ④ (현행 제3항과 같음)\n",
  "sections": {
    "제안이유": "및",
    "주요내용": "정부는 2023년에 대규모 세수부족이 발생하게 되자, 세수재추계를\n바탕으로 한 예상 세입을 기준으로 지방교육재정교부금 규모를 재산\n정하였음.\n2023년 지방교육재정교부금 10.4조원이 미교부되었고, 더하여 특별\n교부금 총액을 국가시책, 지역현안, 재난안전관리에 각각 60%, 30%,\n10%씩 교부하도록 명시한 「지방교육재정교부금법」 제5조의2제1항\n을 준수하지 못하였음.\n이러한 지방교육재정교부금의 갑작스러운 해당 연도 미교부 및 법\n정비율 미준수는 교육기관에 대한 필요 재원 교부를 통해 교육의 균\n\n\n\n형 있는 발전을 도모하도록 한 지방교육재정교부금의 주요 목적에 반\n하는 것임.\n이에 계상된 지방교육재정교부금을 해당 연도에 감액 조절할 수 없\n도록 함(안 제9조제3항 신설).",
    "제안이유_및_주요내용": "정부는 2023년에 대규모 세수부족이 발생하게 되자, 세수재추계를\n바탕으로 한 예상 세입을 기준으로 지방교육재정교부금 규모를 재산\n정하였음.\n2023년 지방교육재정교부금 10.4조원이 미교부되었고, 더하여 특별\n교부금 총액을 국가시책, 지역현안, 재난안전관리에 각각 60%, 30%,\n10%씩 교부하도록 명시한 「지방교육재정교부금법」 제5조의2제1항\n을 준수하지 못하였음.\n이러한 지방교육재정교부금의 갑작스러운 해당 연도 미교부 및 법\n정비율 미준수는 교육기관에 대한 필요 재원 교부를 통해 교육의 균\n\n\n\n형 있는 발전을 도모하도록 한 지방교육재정교부금의 주요 목적에 반\n하는 것임.\n이에 계상된 지방교육재정교부금을 해당 연도에 감액 조절할 수 없\n도록 함(안 제9조제3항 신설).",
    "법률_제_호": "지방교육재정교부금법 일부개정법률안\n지방교육재정교부금법 일부를 다음과 같이 개정한다.\n제9조제3항을 제4항으로 하고, 같은 조에 제3항을 다음과 같이 신설한\n다.\n③ 국가는 추가경정예산에 의하지 아니하고서는 제1항에 따라 계상\n된 교부금을 해당 연도에는 감액 조절할 수 없다.",
    "신구조문대비표": "현 행 개 정 안\n제9조(예산 계상) ①ㆍ② (생 제9조(예산 계상) ①ㆍ② (현행과\n략) 같음)\n<신 설> ③ 국가는 추가경정예산에 의\n하지 아니하고서는 제1항에 따\n라 계상된 교부금을 해당 연도\n에는 감액 조절할 수 없다.\n③ (생 략) ④ (현행 제3항과 같음)"
  }
}