{
  "title": "2210552_대통령_등의_경호에_관한_법률_일부개정법률안",
  "bill_number": "10552",
  "proposal_date": "2025. 5. 20.",
  "submission_date": "",
  "is_alternative": false,
  "alternative_bill_numbers": [],
  "has_comparison_table": false,
  "comparison_table": "신ㆍ구조문대비표\n현 행 개 정 안\n제4조(경호대상) ① ∼ ③ (생 제4조(경호대상) ① ∼ ③ (현행\n략) 과 같음)\n<신 설> ④ 제1항에도 불구하고 다음\n각 호의 어느 하나에 해당하는\n사람은 대통령 등의 경호대상\n에서 제외한다.\n1. 탄핵 소추로 파면된 자\n2. 형법상 내란 또는 외환죄로\n유죄 확정 판결을 받은 자",
  "full_text": "대통령 등의 경호에 관한 법률 일부개정법률안\n(정춘생의원 대표발의)\n발의연월일 : 2025. 5. 20.\n의 안\n10552\n번 호 발 의 자 : 정춘생ㆍ강경숙ㆍ황운하\n김선민ㆍ이해민ㆍ서왕진\n용혜인ㆍ김준형ㆍ차규근\n한정애 의원(10인)\n제안이유 및 주요내용\n현행법은 전직 대통령을 포함한 대통령 등의 신변 보호를 위해 일\n정한 경호를 제공하도록 규정하고 있으나, 헌정질서를 중대하게 위반\n하거나 국민적 신뢰를 상실한 자에 대해서도 동일한 수준의 경호를\n제공하는 것은 정당성과 형평성에 문제가 있다는 지적이 지속되어 왔\n음.\n특히, 헌법재판소의 탄핵 결정에 따라 파면된 전직 대통령이나, 내\n란·외환 등 국가의 존립과 헌정질서를 위협하는 중대한 범죄로 유죄가\n확정된 자에 대해까지 경호를 제공하는 것은 국민 정서와 법치주의의\n원칙에도 부합하지 않다는 의견이 있음.\n이에 탄핵 소추로 파면된 자 및 형법상 내란 또는 외환죄로 유죄가\n확정된 자에 대해서는 대통령 등의 경호대상에서 명백히 제외하도록\n하여, 경호의 공공성과 정당성을 강화하고, 법에 의한 통치를 실현하\n\n\n\n려는 것이 본 개정안의 취지입니다(안 제4조제4항 신설).\n\n법률 제 호\n대통령 등의 경호에 관한 법률 일부개정법률안\n대통령 등의 경호에 관한 법률 일부를 다음과 같이 개정한다.\n제4조에 제4항을 다음과 같이 신설한다.\n④ 제1항에도 불구하고 다음 각 호의 어느 하나에 해당하는 사람은\n대통령 등의 경호대상에서 제외한다.\n1. 탄핵 소추로 파면된 자\n2. 형법상 내란 또는 외환죄로 유죄 확정 판결을 받은 자\n부 칙\n이 법은 공포한 날부터 시행한다.\n\n\n\n\n신ㆍ구조문대비표\n현 행 개 정 안\n제4조(경호대상) ① ∼ ③ (생 제4조(경호대상) ① ∼ ③ (현행\n략) 과 같음)\n<신 설> ④ 제1항에도 불구하고 다음\n각 호의 어느 하나에 해당하는\n사람은 대통령 등의 경호대상\n에서 제외한다.\n1. 탄핵 소추로 파면된 자\n2. 형법상 내란 또는 외환죄로\n유죄 확정 판결을 받은 자\n",
  "sections": {
    "제안이유": "및",
    "주요내용": "현행법은 전직 대통령을 포함한 대통령 등의 신변 보호를 위해 일\n정한 경호를 제공하도록 규정하고 있으나, 헌정질서를 중대하게 위반\n하거나 국민적 신뢰를 상실한 자에 대해서도 동일한 수준의 경호를\n제공하는 것은 정당성과 형평성에 문제가 있다는 지적이 지속되어 왔\n음.\n특히, 헌법재판소의 탄핵 결정에 따라 파면된 전직 대통령이나, 내\n란·외환 등 국가의 존립과 헌정질서를 위협하는 중대한 범죄로 유죄가\n확정된 자에 대해까지 경호를 제공하는 것은 국민 정서와 법치주의의\n원칙에도 부합하지 않다는 의견이 있음.\n이에 탄핵 소추로 파면된 자 및 형법상 내란 또는 외환죄로 유죄가\n확정된 자에 대해서는 대통령 등의 경호대상에서 명백히 제외하도록\n하여, 경호의 공공성과 정당성을 강화하고, 법에 의한 통치를 실현하\n\n\n\n려는 것이 본 개정안의 취지입니다(안 제4조제4항 신설).",
    "제안이유_및_주요내용": "현행법은 전직 대통령을 포함한 대통령 등의 신변 보호를 위해 일\n정한 경호를 제공하도록 규정하고 있으나, 헌정질서를 중대하게 위반\n하거나 국민적 신뢰를 상실한 자에 대해서도 동일한 수준의 경호를\n제공하는 것은 정당성과 형평성에 문제가 있다는 지적이 지속되어 왔\n음.\n특히, 헌법재판소의 탄핵 결정에 따라 파면된 전직 대통령이나, 내\n란·외환 등 국가의 존립과 헌정질서를 위협하는 중대한 범죄로 유죄가\n확정된 자에 대해까지 경호를 제공하는 것은 국민 정서와 법치주의의\n원칙에도 부합하지 않다는 의견이 있음.\n이에 탄핵 소추로 파면된 자 및 형법상 내란 또는 외환죄로 유죄가\n확정된 자에 대해서는 대통령 등의 경호대상에서 명백히 제외하도록\n하여, 경호의 공공성과 정당성을 강화하고, 법에 의한 통치를 실현하\n\n\n\n려는 것이 본 개정안의 취지입니다(안 제4조제4항 신설).",
    "법률_제_호": "대통령 등의 경호에 관한 법률 일부개정법률안\n대통령 등의 경호에 관한 법률 일부를 다음과 같이 개정한다.\n제4조에 제4항을 다음과 같이 신설한다.\n④ 제1항에도 불구하고 다음 각 호의 어느 하나에 해당하는 사람은\n대통령 등의 경호대상에서 제외한다.\n1. 탄핵 소추로 파면된 자\n2. 형법상 내란 또는 외환죄로 유죄 확정 판결을 받은 자",
    "신구조문대비표": "현 행 개 정 안\n제4조(경호대상) ① ∼ ③ (생 제4조(경호대상) ① ∼ ③ (현행\n략) 과 같음)\n<신 설> ④ 제1항에도 불구하고 다음\n각 호의 어느 하나에 해당하는\n사람은 대통령 등의 경호대상\n에서 제외한다.\n1. 탄핵 소추로 파면된 자\n2. 형법상 내란 또는 외환죄로\n유죄 확정 판결을 받은 자"
  }
}