{
  "title": "2210370_지방공무원법_일부개정법률안",
  "bill_number": "10370",
  "proposal_date": "2025. 5. 2.",
  "submission_date": "",
  "is_alternative": false,
  "alternative_bill_numbers": [],
  "has_comparison_table": false,
  "comparison_table": "신ㆍ구조문대비표\n현 행 개 정 안\n법률 제18208호 지방공무원법 법률 제18208호 지방공무원법\n일부개정법률 ",
  "full_text": "지방공무원법 일부개정법률안\n(이성권의원 대표발의)\n발의연월일 : 2025. 5. 2.\n의 안\n10370\n번 호 발 의 자 : 이성권ㆍ이헌승ㆍ박수영\n조승환ㆍ김도읍ㆍ최은석\n곽규택ㆍ정성국ㆍ정연욱\n권영진ㆍ김용태ㆍ주진우\n서지영ㆍ배준영ㆍ신성범\n강명구 의원(16인)\n제안이유 및 주요내용\n현행법은 누구든지 공무원 채용과 관련하여 비위를 저질러 유죄판\n결이 확정된 경우에는 그 비위 행위로 인하여 채용시험에 합격하거나\n임용된 사람에 대하여 합격 또는 임용을 취소할 수 있도록 하고 있음.\n그런데 2021년 6월 해당 조항을 신설하면서 부칙으로 개정법률 시\n행 이후 공무원 채용과 관련하여 비위를 저지른 경우부터 적용하도록\n하였음.\n이에 해당 부칙을 삭제하여 시행 이전에 발생한 채용 비위의 관련\n자도 임용을 취소할 수 있도록 분명히 하려는 것임(안 법률 제18208호\n지방공무원법 일부개정법률 부칙 제3조 삭제).\n\n\n\n\n법률 제 호\n지방공무원법 일부개정법률안\n지방공무원법 일부를 다음과 같이 개정한다.\n법률 제18208호 지방공무원법 일부개정법률 부칙 제3조를 삭제한다.\n부 칙\n이 법은 공포한 날부터 시행한다.\n\n\n\n\n신ㆍ구조문대비표\n현 행 개 정 안\n법률 제18208호 지방공무원법 법률 제18208호 지방공무원법\n일부개정법률 부칙 일부개정법률 부칙\n제3조(채용비위 관련자 합격취소 <삭 제>\n에 관한 적용례) 제43조의3\n의 개정규정은 이 법 시행\n이후 공무원 채용과 관련하\n여 비위를 저지른 경우부터\n적용한다.\n",
  "sections": {
    "제안이유": "및",
    "주요내용": "현행법은 누구든지 공무원 채용과 관련하여 비위를 저질러 유죄판\n결이 확정된 경우에는 그 비위 행위로 인하여 채용시험에 합격하거나\n임용된 사람에 대하여 합격 또는 임용을 취소할 수 있도록 하고 있음.\n그런데 2021년 6월 해당 조항을 신설하면서 부칙으로 개정법률 시\n행 이후 공무원 채용과 관련하여 비위를 저지른 경우부터 적용하도록\n하였음.\n이에 해당 부칙을 삭제하여 시행 이전에 발생한 채용 비위의 관련\n자도 임용을 취소할 수 있도록 분명히 하려는 것임(안",
    "제안이유_및_주요내용": "현행법은 누구든지 공무원 채용과 관련하여 비위를 저질러 유죄판\n결이 확정된 경우에는 그 비위 행위로 인하여 채용시험에 합격하거나\n임용된 사람에 대하여 합격 또는 임용을 취소할 수 있도록 하고 있음.\n그런데 2021년 6월 해당 조항을 신설하면서 부칙으로 개정법률 시\n행 이후 공무원 채용과 관련하여 비위를 저지른 경우부터 적용하도록\n하였음.\n이에 해당 부칙을 삭제하여 시행 이전에 발생한 채용 비위의 관련\n자도 임용을 취소할 수 있도록 분명히 하려는 것임(안",
    "법률_제_호": "지방공무원법 일부개정법률",
    "신구조문대비표": "현 행 개 정 안\n법률 제18208호 지방공무원법 법률 제18208호 지방공무원법\n일부개정법률"
  }
}