{
  "title": "2210820_국경일에_관한_법률_일부개정법률안",
  "bill_number": "10820",
  "proposal_date": "2025. 6. 13.",
  "submission_date": "",
  "is_alternative": false,
  "alternative_bill_numbers": [],
  "has_comparison_table": false,
  "comparison_table": "신ㆍ구조문대비표\n현 행 개 정 안\n제2조(국경일의 종류) 국경일은 제2조(국경일의 종류) --------\n다음 각 호와 같다. ------------------.\n1. (생 략) 1. (현행과 같음)\n2. 제헌절: 7월 17일 2. 헌법의 날----------\n3. ∼ 5. (생 략) 3. ∼ 5. (현행과 같음)",
  "full_text": "국경일에 관한 법률 일부개정법률안\n(곽상언의원 대표발의)\n발의연월일 : 2025. 6. 13.\n의 안\n10820\n번 호 발 의 자 : 곽상언ㆍ박지원ㆍ이기헌\n강경숙ㆍ서미화ㆍ한창민\n김재원ㆍ김종민ㆍ최기상\n김준형 의원(10인)\n제안이유 및 주요내용\n현행법은 1948년 7월 17일 헌법 공포를 기념하여 7월 17일을 제헌\n절로 지정하고 이를 국경일로 하고 있음.\n그러나 「대한민국헌법」이 대한민국의 자유민주적 기본질서를 이\n루는 근간이자 기본원칙임을 고려하여, 그 명칭을 보다 알기 쉽게 변\n경하여야 한다는 의견이 있음.\n이에 제헌절의 명칭을 헌법의 날로 변경하여 대한민국의 국민이 헌\n법 공포의 날을 더욱 쉽게 되새기고 기념할 수 있도록 하려는 것임(안\n제2조제2호).\n\n\n\n\n법률 제 호\n국경일에 관한 법률 일부개정법률안\n국경일에 관한 법률 일부를 다음과 같이 개정한다.\n제2조제2호 중 “제헌절”을 “헌법의 날”로 한다.\n부 칙\n이 법은 공포한 날부터 시행한다.\n\n\n\n\n신ㆍ구조문대비표\n현 행 개 정 안\n제2조(국경일의 종류) 국경일은 제2조(국경일의 종류) --------\n다음 각 호와 같다. ------------------.\n1. (생 략) 1. (현행과 같음)\n2. 제헌절: 7월 17일 2. 헌법의 날----------\n3. ∼ 5. (생 략) 3. ∼ 5. (현행과 같음)\n",
  "sections": {
    "제안이유": "및",
    "주요내용": "현행법은 1948년 7월 17일 헌법 공포를 기념하여 7월 17일을 제헌\n절로 지정하고 이를 국경일로 하고 있음.\n그러나 「대한민국헌법」이 대한민국의 자유민주적 기본질서를 이\n루는 근간이자 기본원칙임을 고려하여, 그 명칭을 보다 알기 쉽게 변\n경하여야 한다는 의견이 있음.\n이에 제헌절의 명칭을 헌법의 날로 변경하여 대한민국의 국민이 헌\n법 공포의 날을 더욱 쉽게 되새기고 기념할 수 있도록 하려는 것임(안\n제2조제2호).",
    "제안이유_및_주요내용": "현행법은 1948년 7월 17일 헌법 공포를 기념하여 7월 17일을 제헌\n절로 지정하고 이를 국경일로 하고 있음.\n그러나 「대한민국헌법」이 대한민국의 자유민주적 기본질서를 이\n루는 근간이자 기본원칙임을 고려하여, 그 명칭을 보다 알기 쉽게 변\n경하여야 한다는 의견이 있음.\n이에 제헌절의 명칭을 헌법의 날로 변경하여 대한민국의 국민이 헌\n법 공포의 날을 더욱 쉽게 되새기고 기념할 수 있도록 하려는 것임(안\n제2조제2호).",
    "법률_제_호": "국경일에 관한 법률 일부개정법률안\n국경일에 관한 법률 일부를 다음과 같이 개정한다.\n제2조제2호 중 “제헌절”을 “헌법의 날”로 한다.",
    "신구조문대비표": "현 행 개 정 안\n제2조(국경일의 종류) 국경일은 제2조(국경일의 종류) --------\n다음 각 호와 같다. ------------------.\n1. (생 략) 1. (현행과 같음)\n2. 제헌절: 7월 17일 2. 헌법의 날----------\n3. ∼ 5. (생 략) 3. ∼ 5. (현행과 같음)"
  }
}