{
  "title": "2210333_형사소송법_일부개정법률안",
  "bill_number": "10333",
  "proposal_date": "2025. 5. 2.",
  "submission_date": "",
  "is_alternative": false,
  "alternative_bill_numbers": [],
  "has_comparison_table": false,
  "comparison_table": "신ㆍ구조문대비표\n현 행 개 정 안\n第306條(公判節次의 停止) ① ∼ 第306條(公判節次의 停止) ① ∼\n⑤ (생 략) ⑤ (현행과 같음)\n<신 설> ⑥ 피고인이 대통령선거에 당\n선된 때에는 법원은 당선된 날\n부터 임기종료시까지 결정으로\n공판절차를 정지하여야 한다.",
  "full_text": "형사소송법 일부개정법률안\n(김용민의원 대표발의)\n발의연월일 : 2025. 5. 2.\n의 안\n10333\n번 호 발 의 자 : 김용민ㆍ박지원ㆍ박민규\n민형배ㆍ노종면ㆍ주철현\n송재봉ㆍ부승찬ㆍ임미애\n김남희ㆍ임오경ㆍ박희승\n한준호ㆍ백승아ㆍ민병덕\n서미화ㆍ김승원ㆍ장경태\n이원택ㆍ정진욱ㆍ안태준\n위성락ㆍ박성준ㆍ문진석\n김현정 의원(25인)\n제안이유 및 주요내용\n헌법 제84조는 대통령이 내란 또는 외환의 죄를 범한 경우를 제외\n하고는 재직 중 형사소추를 받지 않도록 규정하고 있음. 이는 대통령\n의 헌정 수행 기능 보장을 위한 취지임.\n그러나 현행 법령 체계에서는 대통령에 당선되어 재직 중이 된 피\n고인에 대해 이미 개시된 형사재판이 계속 진행되는 경우, 재판부가\n이를 중지할 법적 근거가 명확히 규정되어 있지 않음. 이로 인해 헌법\n상 불소추특권과 실제 재판운영 사이에 충돌이 발생할 수 있으며, 헌\n법 취지를 실질적으로 구현하지 못하는 문제가 제기됨. 또한, 재판이\n계속됨으로써 대통령으로서의 직무수행에 장애가 발생할 수 있고, 정\n\n\n\n치적 중립성을 유지해야 할 형사사법기관이 대통령을 상대로 한 재판\n을 계속 수행하게 됨에 따라 헌정질서와 정치적 중립성에 대한 논란\n도 발생할 수 있음.\n이에 대통령에 당선된 피고인에 대하여는 헌법 제84조가 적용되는\n재직 기간 동안 형사재판 절차를 정지하도록 하여, 헌법상 불소추특권\n이 절차적으로도 실현되도록 하려는 것임(안 제306조제6항 신설).\n\n법률 제 호\n형사소송법 일부개정법률안\n형사소송법 일부를 다음과 같이 개정한다.\n제306조에 제6항을 다음과 같이 신설한다.\n⑥ 피고인이 대통령선거에 당선된 때에는 법원은 당선된 날부터 임\n기종료시까지 결정으로 공판절차를 정지하여야 한다.\n부 칙\n제1조(시행일) 이 법은 공포한 날부터 시행한다.\n제2조(경과조치) 이 법 시행 당시 대통령에게도 적용한다.\n\n\n\n\n신ㆍ구조문대비표\n현 행 개 정 안\n第306條(公判節次의 停止) ① ∼ 第306條(公判節次의 停止) ① ∼\n⑤ (생 략) ⑤ (현행과 같음)\n<신 설> ⑥ 피고인이 대통령선거에 당\n선된 때에는 법원은 당선된 날\n부터 임기종료시까지 결정으로\n공판절차를 정지하여야 한다.\n",
  "sections": {
    "제안이유": "및",
    "주요내용": "헌법 제84조는 대통령이 내란 또는 외환의 죄를 범한 경우를 제외\n하고는 재직 중 형사소추를 받지 않도록 규정하고 있음. 이는 대통령\n의 헌정 수행 기능 보장을 위한 취지임.\n그러나 현행 법령 체계에서는 대통령에 당선되어 재직 중이 된 피\n고인에 대해 이미 개시된 형사재판이 계속 진행되는 경우, 재판부가\n이를 중지할 법적 근거가 명확히 규정되어 있지 않음. 이로 인해 헌법\n상 불소추특권과 실제 재판운영 사이에 충돌이 발생할 수 있으며, 헌\n법 취지를 실질적으로 구현하지 못하는 문제가 제기됨. 또한, 재판이\n계속됨으로써 대통령으로서의 직무수행에 장애가 발생할 수 있고, 정\n\n\n\n치적 중립성을 유지해야 할 형사사법기관이 대통령을 상대로 한 재판\n을 계속 수행하게 됨에 따라 헌정질서와 정치적 중립성에 대한 논란\n도 발생할 수 있음.\n이에 대통령에 당선된 피고인에 대하여는 헌법 제84조가 적용되는\n재직 기간 동안 형사재판 절차를 정지하도록 하여, 헌법상 불소추특권\n이 절차적으로도 실현되도록 하려는 것임(안 제306조제6항 신설).",
    "제안이유_및_주요내용": "헌법 제84조는 대통령이 내란 또는 외환의 죄를 범한 경우를 제외\n하고는 재직 중 형사소추를 받지 않도록 규정하고 있음. 이는 대통령\n의 헌정 수행 기능 보장을 위한 취지임.\n그러나 현행 법령 체계에서는 대통령에 당선되어 재직 중이 된 피\n고인에 대해 이미 개시된 형사재판이 계속 진행되는 경우, 재판부가\n이를 중지할 법적 근거가 명확히 규정되어 있지 않음. 이로 인해 헌법\n상 불소추특권과 실제 재판운영 사이에 충돌이 발생할 수 있으며, 헌\n법 취지를 실질적으로 구현하지 못하는 문제가 제기됨. 또한, 재판이\n계속됨으로써 대통령으로서의 직무수행에 장애가 발생할 수 있고, 정\n\n\n\n치적 중립성을 유지해야 할 형사사법기관이 대통령을 상대로 한 재판\n을 계속 수행하게 됨에 따라 헌정질서와 정치적 중립성에 대한 논란\n도 발생할 수 있음.\n이에 대통령에 당선된 피고인에 대하여는 헌법 제84조가 적용되는\n재직 기간 동안 형사재판 절차를 정지하도록 하여, 헌법상 불소추특권\n이 절차적으로도 실현되도록 하려는 것임(안 제306조제6항 신설).",
    "법률_제_호": "형사소송법 일부개정법률안\n형사소송법 일부를 다음과 같이 개정한다.\n제306조에 제6항을 다음과 같이 신설한다.\n⑥ 피고인이 대통령선거에 당선된 때에는 법원은 당선된 날부터 임\n기종료시까지 결정으로 공판절차를 정지하여야 한다.",
    "신구조문대비표": "현 행 개 정 안\n第306條(公判節次의 停止) ① ∼ 第306條(公判節次의 停止) ① ∼\n⑤ (생 략) ⑤ (현행과 같음)\n<신 설> ⑥ 피고인이 대통령선거에 당\n선된 때에는 법원은 당선된 날\n부터 임기종료시까지 결정으로\n공판절차를 정지하여야 한다."
  }
}